{
  "paper_id": "CG737FAS",
  "title": "The Impact of Information Technology on Patient Engagement and Health Behavior Change: A Systematic Review of the Literature",
  "abstract": "Background: Advancements in information technology (IT) and its increasingly ubiquitous nature expand the ability to engage patients in the health care process and motivate health behavior change. Objective: Our aim was to systematically review the (1) impact of IT platforms used to promote patients' engagement and to effect change in health behaviors and health outcomes, (2) behavior theories or models applied as bases for developing these interventions and their impact on health outcomes, (3) different ways of measuring health outcomes, (4) usability, feasibility, and acceptability of these technologies among patients, and (5) challenges and research directions for implementing IT platforms to meaningfully impact patient engagement and health outcomes. Methods: PubMed, Web of Science, PsycINFO, and Google Scholar were searched for studies published from 2000 to December 2014. Two reviewers assessed the quality of the included papers, and potentially relevant studies were retrieved and assessed for eligibility based on predetermined inclusion criteria. Results: A total of 170 articles met the inclusion criteria and were reviewed in detail. Overall, 88.8% (151/170) of studies showed positive impact on patient behavior and 82.9% (141/170) reported high levels of improvement in patient engagement. Only 47.1% (80/170) referenced specific behavior theories and only 33.5% (57/170) assessed the usability of IT platforms. The majority of studies used indirect ways to measure health outcomes (65.9%, 112/170). \n Conclusions: In general, the review has shown that IT platforms can enhance patient engagement and improve health outcomes. Few studies addressed usability of these interventions, and the reason for not using specific behavior theories remains unclear. Further research is needed to clarify these important questions. In addition, an assessment of these types of interventions should be conducted based on a common framework using a large variety of measurements; these measurements should include those related to motivation for health behavior change, long-standing adherence, expenditure, satisfaction, and health outcomes.",
  "year": 2014,
  "date": "2014",
  "authors": [
    {
      "name": "Suhila Sawesi",
      "email": "ssawesi@umail.iu.edu",
      "affiliation": {
        "organization": "School of Informatics and Computing -Indianapolis",
        "department": "School of Informatics and Computing -Indianapolis",
        "institution": "IUPUI",
        "address": "Indianapolis, IN, United States"
      }
    },
    {
      "name": "B Pharm",
      "affiliation": {
        "organization": "School of Informatics and Computing -Indianapolis Department of BioHealth Informatics",
        "department": "School of Informatics and Computing -Indianapolis Department of BioHealth Informatics",
        "institution": "IUPUI Walker Plaza (",
        "address": "WK) 120 719 Indiana Avenue Indianapolis, 46202, IN, United States"
      }
    },
    {
      "name": "Mohamed Rashrash",
      "affiliation": {
        "organization": "School of Pharmacy",
        "department": "School of Pharmacy",
        "institution": "Chapman University",
        "address": "Irvine, CA, United States"
      }
    },
    {
      "name": "Kanitha Phalakornkule",
      "affiliation": {
        "organization": "School of Informatics and Computing -Indianapolis",
        "department": "School of Informatics and Computing -Indianapolis",
        "institution": "IUPUI",
        "address": "Indianapolis, IN, United States"
      }
    },
    {
      "name": "Janet Carpenter",
      "affiliation": {
        "organization": "School of Nursing",
        "department": "School of Nursing",
        "institution": "Indiana University",
        "address": "Indianapolis, IN, United States"
      }
    },
    {
      "name": "Josette Jones",
      "affiliation": {
        "organization": "School of Informatics and Computing -Indianapolis",
        "department": "School of Informatics and Computing -Indianapolis",
        "institution": "IUPUI",
        "address": "Indianapolis, IN, United States"
      }
    }
  ],
  "doi": "10.2196/medinform.4514",
  "md5": "6DD42DB77B375B0D1E984F619F0330D9",
  "publication": {
    "journal": "J Med Internet Res",
    "journal_inferred": true
  },
  "keywords": [
    "patient engagement",
    "patient behavior",
    "technology",
    "Internet",
    "web-based",
    "cell phone",
    "social media"
  ],
  "sections": [
    {
      "title": "Introduction",
      "text": "Patient engagement is currently considered the cornerstone of the health care system revolution for its positive impact on health outcomes and health care costs  [1, 2] . A growing body of evidence demonstrates that lack of patient engagement is a major contributor to preventable deaths. In fact, it is estimated that 40% of deaths in the United States are caused by modifiable behavioral issues, including smoking, obesity, poor blood sugar control, poor blood pressure control, inadequate exercise, medication non-adherence, and neglect in attending follow-up medical appointments  [3] . As a result, patients must be encouraged to become more involved with managing their own care. Frequent, real-time communication and feedback are essential in supporting health behavior change and empowering patient engagement in the health care process  [4] . However, the traditional model of care delivery, a face-to-face interaction with an expert or trusted health care provider, can be implemented only with a small number of patients and thus has limited impact and limited reach  [5] . In an effort to reach and engage larger numbers of patients, researchers and clinicians have begun exploring the role of information technology (IT) platforms in patient engagement and health behavior change interventions  [5, 6] . It is assumed that face-to face interaction in the traditional model can be mimicked by peer-to-peer or peer group support in social media.\n\nIT platforms are being embraced as a way to enhance patient engagement in the health care process, improve quality of care, support health care safety, and provide cost-effective health services for patients  [6] [7] [8] [9] . Numerous IT platforms are used to motivate patient engagement in health behavior change including short message service (SMS)-capable mobile devices, Internet-based interventions, social media, and other online communication tools  [10] [11] [12] . Previous systematic reviews have evaluated the potential benefit of IT platforms in managing different health conditions and how these platforms have been used to actively engage patients and change unhealthy patient behavior. A systematic review conducted to assess the effectiveness of IT platforms on physical activity and dietary behavior change found that 51% of studies showed positive results, although a significant proportion of the studies showed no significant effect  [13] . The reviewed interventions tended to focus on specific technology (eg, desktop applications), while mobile devices, such as mobile phones and text messaging devices were not included. Similarly, Webb et al reviewed 85 studies on the impact of Internet-based interventions on health behavior change and found small but significant effects on health-related behavior, especially with regards to interventions grounded in behavioral theory. Although the review mentioned that the effectiveness of Internet-based interventions was enhanced by using additional IT methods, such as text messaging (SMS), it did not focus on the distinction between these different interventions  [8] .\n\nIn addition, a meta-analysis performed to investigate the effectiveness of Web-based interventions on health behavior changes found that Web-based interventions improve patient outcomes. This particular meta-analysis, however, referred only to Web-based interventions in specific problem areas and focused on a relatively narrow range of technologies  [14] . A recent systematic review that investigated the effectiveness of the IT platform on self-management among diabetic patients showed positive effects in 74% of studies  [15] . Another research study showed that successful health behavior interventions may contribute to understanding of health behavior theories and their appropriate use  [16] . Mobile-based interventions and Web-based interventions developed based on health behavior theories are more likely to effectively change patient health behavior and maintain behavior change than non-theory-based interventions  [8, [17] [18] [19] . Basing IT interventions on behavior theories can help test and detect why interventions succeed or fail  [20] . Health behavioral theories can identify key determinants of the target behaviors and identify behavior change strategies essential to obtain desired health outcomes; this knowledge can then be transformed into specific behavioral strategies that patients can adapt in their daily life  [20] .\n\nConclusions drawn from these reviews are important; they provide insights but no clear answers about the effectiveness of IT platforms on patient engagement and behavior change. They do not address which interventions are used most or are most effective with which theory or model when it comes to improving patients' health behaviors and patient engagement. IT platforms generally can have high potential benefits and some proven effects; however, specific components in several health conditions associated with success remain unclear. To better understand how to build a successful intervention that can engage patients to change their behavior meaningfully, we performed a systematic review.\n\nReview aims were to systematically determine (1) the impact of IT platforms used to promote patient engagement and to effect change in health behaviors and health outcomes,  (2)  behavioral theories or models applied as bases for developing these interventions and their impact on health outcomes, (3) different ways of measuring health outcomes, (4) usability, feasibility, and acceptability of these technologies among patients, and (  5 ) challenges and research directions for implementing IT platforms to meaningfully impact patient engagement and health outcomes."
    },
    {
      "title": "Methods"
    },
    {
      "title": "Search Strategy and Data Sources",
      "text": "Electronic literature searches were performed using four databases: PubMed, Web of Science, PsycINFO, and Google Scholar. Google Scholar was searched because it had sufficiently wide coverage to be used instead of several databases  [21] [22] [23] . The reference lists of retrieved articles from searches were screened for additional articles. Searches used the following medical subject headings (MeSH) terms in various combinations: patient engagement, health, promotion, behavior, digital, technology, email, Internet, Web-based, cell phone, social media, computer, and intervention."
    },
    {
      "title": "Inclusion and Excluding Criteria",
      "text": "The following criteria were used to select the articles:  (1)  all types of study designs published in scientific journals between 2000 and December 2014 were included, excluding conference"
    },
    {
      "title": "Data Extraction",
      "text": "Two investigators independently reviewed the titles and then abstracts. The same investigators read and screened for full text eligibility. Data extraction was carried out by 1 reviewer and was rechecked for accuracy by another reviewer. The reasons for exclusion were recorded. Discrepancies were resolved by joint probability of agreement (0.98)  [15] .\n\nA meta-analysis was not feasible due to the varying data collection methods and outcome measures. Therefore, eligible studies were broken down and evaluated in a narrative format using some statistical analysis when feasible and summarized systematically according to the following key information abstracted from them: study details (including author name, year, country, and study design); study characteristics (including sample size and condition/disease); intervention details (including technology used and duration); and outcome details (including direct and indirect assessment methods); and impact of intervention, usability assessment, patient engagement, and theory used in interventions classified according to Leventhal (biomedical model, behavioral learning, communicative, cognitive theory, and self-regulative)  [27] [28] [29] .\n\nThe outcomes variable was classified into  (1)  positive impact in which health information technology platform was associated with improvement in one or more aspects of care and (2) no impact or no noticeable improvement or change in health outcomes. This was assessed based on the overall conclusion made by the authors of each study. Most studies used statistical methods to test hypotheses or describe quantitative findings.\n\nPatient engagement was measured based on the overall conclusion. This was usually measured by timed patient log-ins, communication with the health care provider via secure message, or data download."
    },
    {
      "title": "Results"
    },
    {
      "title": "Search and Selection Results",
      "text": "Figure  1  shows the flow chart that describes the process of identifying the relevant literature. A separate comprehensive search using 4 databases yielded 2235 articles. Following removal of duplicates, our search identified 786 potentially relevant articles. These were scanned keeping 219 papers for full reading at full text level, of which 59 were screened and rejected, leaving 160 studies to be included in the review. Ten additional papers were included from the reference lists of retrieved articles. A total of 170 articles matched the initial search criteria."
    },
    {
      "title": "Article Characteristics",
      "text": "Table 1 provides a summary of the studies, and Multimedia Appendix 2 summarizes the 170 articles included in the research study and their characteristics. Multimedia Appendix 1 summarizes the quality assessment of the 170 included articles. Multimedia Appendix 3 contains definitions of terms used in the paper. Different categories of IT platforms were identified including Internet-based interventions (50.6%, 86/170), mobile-based interventions (25.9%, 44/170), social media (9.4%, 16/170), video game technology (3.5%, 6/170), and telemonitoring (10.6%, 18/170). Publication years ranged from 2000 to 2014, with an overall increase in articles published more recently  (21.8%, 37/170 in 2014) . The majority of studies were implemented in the United States  (54.7%, 93/170) . With respect to the different targeted disorders, hormonal disorders were most frequently targeted  (22.4%, 38/170 studies, eg, diabetes) . The literature was dominated by randomized controlled trials  (65.9%, 112/170 ). The duration of these studies ranged from 1 week to 48 months, and sample sizes ranged from 1-22,337 subjects. Articles included in this review were categorized in five topics based on study aims: impact of IT platform on health outcomes, patient engagement in health behavior change, theory of health behavior, ways to assess health outcomes, and usability assessment (see Table  1 ).   1 (6)  1 (6)  2 (33)  1 (2)  7 (8)  Brain ,  spinal cord , and  nerve disorders   2 (11)  2 (13)  1 (17)  2 (5)  5 (8)  Cancer   1 (6)  2 (13)  1 (17)  4 (9)  13 (   15 ) Disorders of nutrition and metabolism 1 (2) Ears, nose, and throat disorders 1 (  6 ) Eye disorders 6 (  14 ) 5 (  6 ) Health hazard 6 (  33 ) 3 (  7 ) 5  (6)  Heart and blood vessel disorders 3 (  17 ) 4 (  25 ) 11 (  25 ) 20 (  23 ) Hormonal disorders 1 (  6 ) 1 (  6 ) 5 (  11 ) 4 (  5 ) Immune disorders 1 (  6 ) 1 (  6 ) 1 (  17 ) 1 (  2 ) 2 (  2 ) Lung and airway disorders 2 (  11 ) 2 (  13 ) 1 (  17 ) 4 (  9 ) 12 (  14 ) Mental health disorders\n\nWomen's health issues 2 (13) 4 (  9 ) 7 (  8 ) Not specified Country, n (%) 5 (  42 ) 7 (  8 ) Australia  1 (6)  Austria   1 (2)  Bangladesh   2 (11)  4 (5)  Canada   1 (1)  Chile   1 (2)  China   1 (2)  France   3 (3)  Germany   1 (6)  Israel   1 (2)  1 (1)  Italy   1 (6)  1 (1)  Japan   1 (2)  Kenya   1 (6)  1 (2)  1 (1)  Korea   1 (2)  Malaysia   2 (11)  1 (17)  4 (   5 ) Netherlands 2 (  5 ) New Zealand 1 (  2 ) Norway 1 (  6 ) Poland"
    },
    {
      "title": "Impact of technology, n (%)",
      "text": "16 (  89 ) 13 (  81 ) 6 (100) 41 (  93 ) 75 (  87 ) Yes 2 (  11 ) 3 (  19 ) 3 (  7 ) 11  (13)  No Usability assessment, n (%) 3 (  17 ) 8 (  50 ) 1 (  17 ) 8 (  18 ) 38 (  44 ) Yes 15 (83) 8 (  50 ) 5 (  83 ) 36 (  82 ) 48  (56)  No Patient engagement, n (%) 16 (  89 ) 13 (  81 ) 6 (  100 ) 38 (  86 ) 68 (  79 ) Yes 2 (  11 ) 3 (  19 ) 6 (  14 ) 18  (21)  No Theory of behavior change, n (%)\n\nBehavioral learning theory 2 (  13 ) 5 (  11 ) 5 (  6 ) Communication (social support theory) 1 (  6 ) 2 (  13 ) 2 (  33 ) 9 (  20 ) 40  (47)  Cognitive theory a (TPB, SOC, TTM, self-efficacy, information motivation, and behavioral skill)  13 ) 1 (  17 ) 6 (  7 ) Self-regulatory 16 (  88 ) 10 (  63 ) 3 (  33 ) 30 (  69 ) 31 (36) Not specified Sample size, n 10 51 6 2 1 Min. 784 1754 375 22337 13564 Max. Duration 2 mo 1 wk 1 mo 1 mo 1 mo Min. 39 mo 36 mo 3 mo 16 mo 48 mo Max. 1 3 1 1 3 Not specified a TPB= theory of planned behavior, SOC=stage of change, TTM= transtheoretical model."
    },
    {
      "title": "Impact of IT Platforms on Health Outcomes",
      "text": "Overall, IT platforms have been shown to improve health behavior among different disease categories (88.8%, 151/170), although the majority of the positive impact has been shown among hormonal disorders (20.6%, 35/170) (see Table  2 ). Among studies utilizing Internet-based platforms, 87% (75/86) of studies showed a significant impact on health outcomes. Studies also showed that the use of Internet-based tailored weight control programs was correlated with significant increases in weight loss  [30, 31]  and walking distance (P<.05)  [32] . Similarly, mobile-based platforms showed significant effects on health outcomes (91%, 40/44). For example, a study examined use of text messages among patients with diabetes and found a significant decrease in HbA1C level, improved medication adherence, and decreased in emergency service use  [33] . Social media showed a positive impact on health outcomes (81%, 13/16). For example, one study indicated that Twitter usage among cancer patients was a valuable medium for sharing information, discussing treatments, and also acted as a psychological support  [34] . The use of Facebook has also been found to help improve asthma care  [35] . As such, this review found that 100% (6/6) of studies had a positive impact on patient health behavior when implementing a video game as an intervention to change health behavior. In a specific example, King et al concluded that video games can be implemented successfully among hyperfunctional voice disorder as a \"voice therapeutic protocol\", a voice and speech therapy program including a set of vocal tasks using syllable repetitions and chanting of songs and phrases  [36] . Furthermore, the literature showed that telemonitoring improved health outcomes (89%, 16/18). One telemonitoring-based study assessed the effects of a glucose monitoring system on HbA1c levels in diabetic patients and found that usage of this system was correlated with a significant decrease in HbA1c (P=.001)  [37] . Another study evaluated the impact of home-based telemonitoring on patients with heart failure and showed a significant correlative improvement in patients' health outcomes  [38, 39] .\n\nIn contrast, 11% of studies  (19/170)  showed no impact of using IT platforms on health behavior. Among studies using Internet-based platforms, 13%  (11/86)  did not find significant results. One study using a Web-based behavior change program found no differences in smoking abstinence rates at 3-and 6-month follow-up assessment  [40]  and no maintenance of weight loss in an Internet-based intervention group compared to the study's control group  [41] . Also, 7% of (3/44) mobile phone studies reported non-significant impact  [33, [42] [43] [44] . Two mobile phone platform studies did not find a significant reduction in HbA1c level among diabetic patients when SMS text messaging was used to manage their health care (P<.10)  [33, 34] . Moreover, 18% (3/16) of studies showed undesirable effects from using social media  [35, 45, 46] . For instance, Kaplan et al found that psychiatric patients who participated in Internet peer support reported higher levels of distress compared to those who did not participate  [45] . The literature shows that 12% (2/18) of telemonitoring studies had no effect on health outcomes. One particular study found significant changes in neither readmission rate  [47]  nor medication adherence  [48]  among patients with heart failure."
    },
    {
      "title": "Patient Engagement",
      "text": "In total, 82.9% (141/170) of studies reported improvement in patient engagement after using IT platforms (see Table  3 ). Among Internet-based interventions, 79% (68/86) of studies reported a high level of patient engagement. For example, a research study reported that human immunodeficiency virus patients used the Internet-based intervention a majority of the time to access information and manage their health  [49, 50] . Among studies using mobile-based interventions, 86%  (38/44)  reported improvement in patient engagement. One mobile-based intervention study found that text messaging enhanced successful engagement of diabetic patients in their own health care. Patients were able to use this study's text message system for clinical data queries and communicating with health care providers  [51] . Similarly, 81% (13/16) of studies reported that social media was helpful in improving patient engagement. One study found that Facebook provided a forum for reporting personal experiences, asking questions, and receiving direct feedback for people living with diabetes  [46] . Another study showed that social media was helpful to individuals with lower patient activation  [52] [53] [54] . In addition, it was found that video games could enhance patients' active participation in the health care process (100%, 6/6). One video game-based study demonstrated that a health-based video game could help build an effective client-therapist relationship, help structure sessions, and improve patient engagement in the therapeutic process  [55, 56] . Likewise, the literature showed that telemonitoring has been particularly useful for improving patient engagement remotely  (88.8%, 16/18)    [57] [58] [59] [60] [61] [62] [63] , as traditional point-of-care-based ways to monitor patients are costly and difficult to implement  [64] .\n\nOverall, analysis showed significant correlations between patient engagement in health care and the impact of IT platforms (\u03c7 2 1 =39.8836, P .001). Only Internet-based platforms had a significant association between patient engagement and impact of technology on outcomes (\u03c7 2 1 =28.2558, P .001). 68 ) 16 (  37 ) 1 (  50 ) 1 (  6 ) 2 (  67 ) 1 (  8 ) 1 (  33 ) 5 (  12 ) 9 (  82 ) 9 (12) No 170 (100) 19 (100) 151 (100) 6 (100) 2 (100) 16 (100) 3 (100) 13 (100) 3 (100) 41 (100) 11 (100) 75 (100) Total"
    },
    {
      "title": "Behavior Theory",
      "text": "Overall results showed that 47.0% (80/170) of the literature explicitly referenced theory (see Table  4 ). Among Internet-based interventions, 64% (55/86) of studies mentioned the use of behavior theories. Cognitive theories dominated this category (47%, 40/86). Further, 32% (14/44) of mobile-based intervention studies reported use of behavior theories. Cognitive theories were also the most widely used among this category (30%, 13/44)  [42, 51, [65] [66] [67] [68] [69] [70] [71] . Moreover, 38% (6/16) of social media studies used behavior change theory. Social support, cognitive, and self-regulatory theories were the only models used in this category  [35, 45, 52, [72] [73] [74] . The analysis showed 50% (3/6) of video-game platforms used behavior change theories, where the cognitive and self-regulatory theories are the only used  [75, 76] . Only 11% (2/18) of telemonitoring studies used biomedical and cognitive theories  [77, 78] . Literature showed that 89% (71/80) of studies with behavior theories had a significant impact on health outcomes. Only 11% (9/80) of telemonitoring studies explicitly referenced the use of behavior theories and showed no impact of technology on health outcomes. The result failed to show any relationship between using behavior theory and the impact of technology on health outcomes (\u03c7 2 1 =0.008, P=.977).\n\nThe analysis also found no significant correlative relationship between behavior theory and patient engagement in health care (\u03c7 2 1 =0.3055, P=.580479). However, there was a significant relationship between patient engagement and Internet-based interventions using behavior theories (\u03c7 2  1 =7.3144, P=.00684) (see Table  5 ). 4 ) 1 (  6 ) 1 (  6 ) 1 (  2 ) 1 (1) 4 (  5 ) Communication (social support theory) 58 (  34 ) 5 (  3 ) 53 (  31 ) 2 (  33 ) 1 (  6 ) 2 (  13 ) 1 (  2 ) 12 (  27 ) 4 (  5 ) 36  (42)  Cognitive theory (TPB, SOC, TTM, self-efficacy, information motivation, and behavioral skill) 9 (  5 ) 1 (1) 8 (  5 ) 1 (  17 ) 2 (  13 ) 1 (  1 ) 5 (  6 ) Self-regulatory 80 (47) 9 (  5 ) 71 (  42 ) 3 (  50 ) 2 (  2 ) 1 (  6 ) 5 (  31 ) 1 (  2 ) 13 (  29 ) 7 (  8 ) 48  (56)  Total of used theory 90 (  53 ) 10 (  6 ) 80 (  47 ) 3 (  50 ) 2 (  11 ) 14 (  78 ) 2 (  13 ) 8 (  50 ) 2 (  5 ) 28 (  64 ) 4 (  5 ) 27  (31)  Theory not reported 170 (100) 19  (11)  151 (  89 ) 6 (100) 2 (  11 ) 16 (  89 ) 3 (  19 ) 13 (  81 ) 3 (  7 ) 41 (  93 ) 11 (  13 ) 75 (  87 ) Total   2 (1)  2 (1)  1 (6)  1 (1)  Biomedical theory   (chronic model)   3 (2)  1 (1)  2 (1)  1 (1)  2 (2)  Behavioral learning theory   8 (5)  8 (5)  2 (13)  1 (2)  5 (   6 ) Communication (social support theory) 58 (  34 ) 12 (  7 ) 46 (  27 ) 2 (  33 ) 1 (  6 ) 2 (  13 ) 2 (  5 ) 11 (  25 ) 10 (  12 ) 30  (35)  Cognitive theory (TPB, SOC, TTM, self-efficacy, information motivation, and behavioral skill) 9 (  5 ) 2 (  1 ) 7 (  4 ) 1 (  17 ) 2 (  13 ) 2 (  2 ) 4 (  5 ) Self-regulatory 80 (  47 ) 15 (  9 ) 65 (  38 ) 3 (  50 ) 2 (  11 ) 6 (  38 ) 2 (  5 ) 12 (  27 ) 13 (  12 ) 42 (  49 ) Total of used theory 90 (  53 ) 14 (  8 ) 76 (  45 ) 3 (  50 ) 2 (  11 ) 16 (  89 ) 3 (  19 ) 7 (  44 ) 4 (  9 ) 26 (  59 ) 5 (  2 ) 26  (30)  Theory not reported 170 (100) 29 (  17 ) 141 (  83 ) 6 (  100 ) 2 (  11 ) 3 (  19 ) 13 (  81 ) 6 (  14 ) 38 (  86 ) 18 (  15 ) 68  (79)  Grand Total"
    },
    {
      "title": "Methods to Measure Health Outcomes",
      "text": "Most studies used indirect ways (such as self-reports) to measure health outcomes  (65.9%, 112/170) . The literature showed that 57.6% (98/170) of studies showed a positive impact of IT platforms when the health outcomes were assessed using indirect ways. For example, self-reporting was used to assess whether a text message could increase smoking cessation  [68] , reduce methamphetamine use among human immunodeficiency virus patients  [79] , and to assess medication adherence among patients with congestive heart failure  [48] . The analysis showed no significant association between ways to measure health outcomes and technology impact (\u03c7 2 1 =0.5793, P=.446603) (see Table  6 ). 3 ) 53 (  31 ) 3 (  50 ) 6 (  33 ) 1 (  6 ) 2 (  5 ) 18 (  41 ) 3 (  3 ) 25 (  29 ) Direct 112 (66) 14 (  8 ) 98 (  58 ) 3 (  50 ) 2 (  11 ) 10 (  56 ) 3 (  19 ) 12 (  75 ) 1 (  2 ) 23 (  52 ) 8 (  9 ) 50 (  58 ) Indirect 170 (100) 19  (11)  151 (  89 ) 6 (100) 2 (  11 ) 16 (  89 ) 3 (  19 ) 13 (  81 ) 3 (  7 ) 41 (  93 ) 11 (  13 ) 75 (  87 ) Grand Total"
    },
    {
      "title": "Usability Assessment",
      "text": "Only 33.5% (57/170) of studies assessed the usability of IT platforms. Of those, the majority were considered by authors to be usable (89%, 51/57). Specifically, 75% (28/37) of Internet-based IT intervention studies showed positive health outcomes with usable interventions  [41, . In one study that gauged usability, Steele et al performed a 3-month randomized controlled trial among 192 participants and found an Internet-based physical activity behavior change program to be usable, feasible, and acceptable among inactive participants  [41] . Mobile-based interventions also showed 75% (6/8) of usable interventions had a positive impact on health outcomes  [42, 69, 93, [107] [108] [109] . In one study, SMS was found to be useful in helping patients to remember to take their medications and be engaged in treatment planning  [107] . SMS-based intervention was also found to be useful in promoting communication with health care providers by delivering, receiving health information, generating questions, and seeking information related to health conditions  [42] . Moreover, 87% (7/8) of studies reported that the usability of social media-based interventions was positively correlated with good impact on health outcomes  [34, 35, 46, 52, 53, 110, 111] .\n\nOne particular social networking-related study found that online health-related social networking was useful and acceptable in chronic disease management  [52] . In addition, one study reported the usability assessment in the video-game category and found that it was usable and had a positive impact among patients with hyperfunctional voice disorders  [36] . Overall, the analysis also found that telemonitoring also showed similar results (100%, 3/3). One telemonitoring-based study found that XSL \u2022 FO RenderX telecommunication-based reminder tools are useful for improving medication adherence  [112] .\n\nAlthough our results failed to report any relationship between usability of IT platforms and the impact on health outcomes (P=.1065), they showed significant association between usability and patient engagement in health care (P=.0216) (Fisher's exact test) (see Tables  7  and  8 ). 5 ) 43 (  25 ) 1 (  17 ) 3 (  17 ) 2 (  13 ) 5 (  31 ) 2 (  5 ) 6 (  14 ) 4 (  5 ) 28 (  33 ) Usable 6 (  4 ) 2 (  1 ) 4 (  2 ) 1 (  6 ) 4 (  5 ) 1 (  1 ) Not usable 57 (  34 ) 45 (  26 ) 12 (  7 ) 1 (  17 ) 3 (  17 ) 2 (  13 ) 6 (  38 ) 2 (  5 ) 6 (  14 ) 8 (  9 ) 29  (34)  Total of assessed usability 113 (  66 ) 106 (  62 ) 7 (  4 ) 5 (  83 ) 2 (  11 ) 13 (  72 ) 1 (  6 ) 7 (  44 ) 1 (  2 ) 35 (  80 ) 3 (  3 ) 46  (53)  Not assessed usability 170 (  100 ) 151 (  89 ) 19 (  11 ) 6 (  100 ) 2 (  11 ) 16 (  89 ) 3 (  19 ) 13 (  81 ) 3 (  7 ) 41 (  93 ) 11 (  13 ) 75 (  87 ) Grand total   5 ) 41 (  24 ) 1 (  17 ) 3 (  17 ) 2 (  13 ) 5 (  31 ) 1 (  2 ) 7 (  16 ) 6 (  7 ) 26  (30)  Usability assessed (usable) 6 (  4 ) 4 (  2 ) 2 (  1 ) 1 (  6 ) 4 (  5 ) 1 (1) Usability assessed (not usable) 57 (  34 ) 13 (  8 ) 43 (  25 ) 1 (  17 ) 3 (  17 ) 2 (  13 ) 6 (  38 ) 1 (  2 ) 7 (  16 ) 10 (  12 ) 27  (31)  Total usability assessed 113 (66) 16 (  9 ) 97 (  57 ) 5 (  83 ) 2 (  11 ) 13 (  72 ) 1 (  6 ) 7 (  44 ) 5 (  11 ) 31 (  70 ) 8 (  9 ) 41  (48)  Not assessed 170 (100) 29 (  17 ) 141 (  83 ) 6 (100) 2 (  11 ) 16 (  89 ) 3 (  19 ) 13 (  81 ) 6 (  14 ) 38 (  86 ) 18 (  21 ) 68  (79)  Grand total"
    },
    {
      "title": "Discussion"
    },
    {
      "title": "Principal Findings"
    },
    {
      "title": "Impact of IT Platforms on Health Outcomes",
      "text": "Overall, this review indicated that IT platform-based health interventions had a great impact on patients' health outcomes in the United States and in other nations. IT-based health interventions have been viewed as driving positive health behavior change through patient engagement with most technology platforms. IT-based health interventions also provide necessary information and advice and counseling related to certain diseases and conditions, such as mental disorders  [113] [114] [115] [116] [117] [118] [119] [120] , asthma  [57, 76, 96, [121] [122] [123] , obesity  [30, 32, [124] [125] [126] [127] [128] [129] [130] [131] [132] , smoking  [40, 68, 69, 88, [133] [134] [135] [136] , diabetes  [11,137-151], sleep disorder [152] , hypertension  [127, 153, 154] , cancer  [34, 58, 60, 74, 75, 82, 92, 97, 98, [155] [156] [157] , thereby encouraging healthy living  [30, 31, 72, 124, 158, 159] . Moreover, these interventions enable patients to be engaged in self-monitoring, thereby directing patients toward healthy eating, enhancing attendance rate  [136, [160] [161] [162] [163] [164] [165] [166] , improving medication adherence  [162, [167] [168] [169] [170] [171] [172] [173] , increasing knowledge about disease and treatment  [33, 42, 47, 75, 85, 90, 94, 96, 115, 119, 168, 174, 175] , and enhancing exercise use  [32, 56, [80] [81] [82] 122, 125, 126, [128] [129] [130] [131] [132] 153, 156, [176] [177] [178] [179] [180] [181] [182] [183] . Online coaching by specialists enables patients to recover quickly, ensuring that the pain they experience is reduced  [89, 184] , and doctor-patient communications are made readily available  [73, 157, [185] [186] [187] [188] [189] [190] [191] .\n\nApart from Internet-based technologies, mobile phone technologies have been used extensively to engage patients and ensure there is patient health behavior change. Mobile phone technologies engage patients by using SMS to contact them and provide necessary health information. This technology can be very effective and efficient, since it is less expensive and therefore more people can afford it. Studies have shown that patients can receive health-related information, receive reminders of their health care attendance, as well as be encouraged to adhere to their treatment  [35, 107, 192] .\n\nSocial media outlets, such as Twitter and Facebook, can ensure patients get and exchange necessary health information  [34, 46] . Video game and telemonitoring technologies served a similar purpose; these technologies tried to engage patients in order to provide necessary health information and provided a platform for helping patients adhere to treatment and helped patients actively become involved in the treatment process. These technologies are of great importance to patients as well as helpful to health care providers, therefore ensuring effectiveness and efficiency.\n\nAlthough several studies demonstrated the positive impact of IT platform usage, others showed no impact  [33, 35, 41, 43, [45] [46] [47] [48] 81, 83, 91, 133, 141, 178, [193] [194] [195] [196] [197] [198] . This could be due to the timing of the follow-up assessments ranging from one extremely short follow-up timing (1 week) to a relatively long-term follow-up timing  (48 months) . The lack of consistency in follow-up timing made it unclear as to how long these effects on patient health last. Moreover, the technology adoption rate may decline after a certain time period, thus diminishing its effectiveness after significant results at the beginning of the study. This occurred in a study by Williamson et al who found that after 2 years of an IT-based intervention, the decrease in body weight did not differ between the intervention and control group  [28] . Similarly, another research study found a slow decline in HbA1c at 3 months follow-up (1.22%) versus (1.09%) 6 months follow-up  [199, 137] . Therefore, designing and evaluating IT platforms may become a significant challenge because researchers are dealing with a large volume of interventions that have different impacts on patient health behavior. Thus, several issues need to be addressed if such interventions are to be evaluated or assessed, such as length of intervention, type of technology, usability of the technology, application of behavior theory, and how health outcomes are measured."
    },
    {
      "title": "Patient Engagement in Health Care Using IT Platforms",
      "text": "Our review showed that IT platforms are playing a significant role in patient engagement. This review implies that higher patient participation in condition self-management was correlated with greater improvement in health outcomes. Many studies have shown that patients who actively participated in health care experience better health outcomes compared to less involved patients. One specific study showed a significant association between patient engagement using the Internet and weight loss at 6 months (P .001) [77] . Another study reported that a text messaging-based intervention could enhance patient engagement  [33] . Social networks can also be particularly helpful to individuals with lower patient activation  [52] . Despite the evidence regarding the importance of patient engagement, it is challenging to draw solid conclusions. Many of the studies conducted qualitative surveys to measure patient engagement or relied solely on the number of times patients logged in or uploaded data to determine their engagement. However, system log-ins and upload and download data are not engagement. Patient engagement is basically about interaction and participation in managing one's health to achieve desired goals. Therefore, further research is needed to determine the best ways to measure patient engagement."
    },
    {
      "title": "Association Between Usability of IT Platforms and Their Impact",
      "text": "Our review found limited levels of evidence supporting the correlation between usability and impact of technology on health outcomes (P=.1065). Several factors may hinder the positive impact of technology on health outcomes other than usability issues. Patients' willingness to participate in managing their health care could be one of the main reasons. The review found a significant relationship with patient engagement and impact of technology. It found also a significant positive correlation between patient engagement and usability of IT platforms. Even though the aim of this study was not to discover determinants of patient engagement, several issues were identified including unequal access to technology, technical issues, poor interface design, suboptimal message content, privacy and confidentiality issues  [46, 108, 110, 121, 165, 193, 200] , and patients' self-perceived health illiteracy. The latter issue was seen in social media, where patients think such a discussion should be restricted to health care professionals  [46] . Also, the majority of technologies rely on patient-provider engagement from both sides to exchange information and manage health conditions, such as in two-way SMS, thus increasing burden on providers as well as patients. Moreover, in some countries like Sweden, information dissemination can be restricted by legal and ethical regulations for online patient-provider communication  [201] . Therefore, more research on the usability and acceptability of these technologies and discovering the different factors that impact patient engagement and their meaningful use will be required in the future."
    },
    {
      "title": "Association Between Technology Impact and Intervention Grounded in Behavior Change Theories",
      "text": "This review found that only a limited number of specific behavioral theories and models were referenced among multiple articles inferring a theoretical design. This could imply that several IT interventions are designed in an ad hoc way, without using any theoretical frameworks. This finding supports the results of a previous study showing the majority of mobile-based interventions used for improving medication adherence and disease management were developed without a theoretical basis  [202] . The review failed to detect any relationship between (1) behavioral theories and impact of technology or (2) theories and patient engagement. This could imply that existing theories/model were not developed to be used with these technologies. We found a significant association between patient engagement in Internet-based interventions and use of behavior theories in these interventions (\u03c7 2 1 =7.3144, P=.00684). This could imply that existing theories or models may have limited applicability. However, it was difficult to draw a clear conclusion whether or not using theory influenced intervention effectiveness. Possible reasons for the lack of theory may include the investigator not citing the theory, researchers' lack of knowledge of the theories, struggling to define appropriate theories, poorly operationalized theories, an absence of good evaluation methods and usability testing, and theories containing overlapping constructs and inconsistent use of terminology. For example, the construct of self-efficacy can be found in Social Cognitive Theory, Protection Motivation Theory, the Theory of Planned Behavior, the Health Belief Model, and Self-Regulation Theory. In addition, the simplicity of the interventions could be another reason for not including behavior theories. For example, reminding patients to take their treatment through text message appears simple and consistent with the \"cue to action\" constituent of many health behavior theories or models, but these theories were not always described. Our findings of the lack of association between use of theory and outcomes was based on the theory description within each published article and should be interpreted cautiously."
    },
    {
      "title": "Association Between Methods to Measure Health Outcomes and the Impact of These Technologies",
      "text": "Overall, slightly more than half of the reviewed articles had a positive impact when assessed with patient questionnaires, patient self-reports, pill counts, rates of prescription refills, assessment of patients' clinical response, and electronic medication monitors. Even though the way to measure health outcomes is an important factor in determining the impact of technology, the review failed to detect any relationship between methods used to measure health outcomes and the impact of technology. Therefore, further study is needed to replicate our results, because for each approach, there are different assumptions related to what data to collect, how to collect that data, and how to make decisions about success. Indirect methods may overestimate patient adherence. For instance, metformin treatment adherence can be monitored either by recording the number of times the medication bottle was opened, or alternately, adherence could be gauged by metformin plasma levels. Both health behaviors are part of the same behavioral class to control blood sugar levels. However, measuring metformin in blood is more effective at measuring adherence than recording the time when the bottle is opened because patients may open and close the bottle without taking any medication."
    },
    {
      "title": "Limitations",
      "text": "Our review included some limitations. First, due to the heterogeneity of the research studies and the fact that some data were not available for certain types of interventions and their characteristics, some statistical tests could not be performed, hindering optimal quantitative assessment. Second, we excluded studies not written in English; this criterion might have omitted certain relevant research. Third, the majority of studies were performed in the United States, which limits generalizability of findings. Finally, because of possible publication bias toward positive findings, our review may overestimate the actual impact of these technologies."
    },
    {
      "title": "Implications",
      "text": "The results from this review reveal several practical applications worthy of future study (summarized in Table  9 ).\n\nTable 9. Implications of study. Implications Suggestion Information technology platforms It would be valuable to further evaluate IT platform-based interventions to form a more coherent picture of their effectiveness in encouraging patient engagement for the purpose of enhancing lasting health behavior change.\n\nA study with a long time frame may be useful to draw a clear conclusion on the effectiveness of these technologies and to determine the best ways to guarantee positive long-term effects in patients.\n\nAlso, due to low availability of studies meeting our criteria, we could not provide or conclude relationships between factors. Therefore, we recommend doing another review when there are more studies available in future.\n\nIn future, we can increase the quality of the review by limiting sample size and study time frame.\n\nIT platform interventions reviewed in this study are mutually inclusive; they use different labels and contexts to describe the same concepts and lack of formal definitions. Therefore, a common framework for analyzing these concepts is needed. A framework with an ontological approach may serve this purpose.\n\nThe outreach and engagement period prior to the intervention enrollment are critical to the success of any intervention. Therefore, studies should consider that when implementing the interventions"
    },
    {
      "title": "Patient engagements",
      "text": "A study assessing determinant of patient engagement is highly recommended.\n\nAssessment of user satisfaction toward IT platforms and their usability of these platforms are needed, and could be done through qualitative evaluations of user opinions of the respective IT platform(s)."
    },
    {
      "title": "Usability",
      "text": "The literature also needs to focus more on referencing, selecting, and implementing behavioral theory to achieve the best possible impact. Reporting accurate information about interventions is essential to assessing the effectiveness of these interventions and facilitating their successful implementation.\n\nTheories of health behavior Also, new theories are needed to better understand how patients can participate and facilitate health behavior change, theories building on past conceptual and focus only on one aspect, a triangulation model would provide internally logical and comprehensible perception to achieve these goals.\n\nIt would be valuable to further examine how different types of measurement could affect patient outcomes reported in the study. A comparison between direct and indirect methods could be helpful to draw a clear conclusion."
    },
    {
      "title": "Methods measure health outcomes"
    },
    {
      "title": "Conclusions",
      "text": "Based on our review, there is moderately strong evidence that IT platforms can engage patients in health care and improve health outcomes. The usefulness and acceptability of IT platforms can have great power in engagement and outcomes. Studies grounded in behavior theory appeared to show a positive impact on patient health behavior. To exploit the full potential of IT platforms in health care, new theories may be needed to better understand how patients can participate and facilitate health behavior change. Selecting appropriate ways to measure health behavior change and developing a common framework to analyze and understand the different components of IT platforms and their safety, effectiveness, efficiency, and acceptability will also be of great importance."
    },
    {
      "text": "Figure 1. Flow diagram of included and excluded studies."
    },
    {
      "text": "Summary of the review results based on types of IT platforms."
    },
    {
      "text": "Impact of IT platforms on patient engagement (Yes=positive impact, No=no impact)."
    },
    {
      "text": "Impact of IT platforms and theories of health behavior (Yes=positive impact, No=no impact)."
    },
    {
      "text": "Patient engagement and theories of health behavior (Yes=positive impact, No=no impact)."
    },
    {
      "text": "Impact of IT platforms and methods to measure health outcomes (Yes=positive impact, No=no impact)."
    },
    {
      "text": "Impact of IT platforms and usability (Yes=positive impact, No=no impact)."
    },
    {
      "text": "Patient engagement and usability (Yes=positive impact, No=no impact)."
    },
    {
      "title": "Conflicts of Interest",
      "text": "None declared."
    },
    {
      "title": "Multimedia Appendix 1",
      "text": "Quality Assessment of Included Articles.\n\n[PDF File (Adobe PDF File), 137KB-Multimedia  Appendix   \u00a9Suhila Sawesi, Mohamed Rashrash, Kanitha Phalakornkule, Janet S Carpenter, Josette F Jones. Originally published in JMIR Medical Informatics ( http://medinform.jmir.org ), 21.01.2016. This is an open-access article distributed under the terms of the Creative Commons Attribution License ( http://creativecommons.org/licenses/by/2.0/ ), which permits unrestricted use, distribution, and reproduction in any medium, provided the original work, first published in JMIR Medical Informatics, is properly cited. The complete bibliographic information, a link to the original publication on  http://medinform.jmir.org/ , as well as this copyright and license information must be included."
    }
  ],
  "references": [
    {
      "title": "The challenges of conceptualizing patient engagement in healthcare: a lexicographic literature review",
      "authors": [
        "S Barello",
        "G Graffigna",
        "E Vegni",
        "A Bosio"
      ],
      "year": 2014,
      "journal": "J Particip Med",
      "volume": "6",
      "issue": "9",
      "raw": "The challenges of conceptualizing patient engagement in healthcare: a lexicographic literature review \n\t\t \n\t\t\t S Barello \n\t\t \n\t\t \n\t\t\t G Graffigna \n\t\t \n\t\t \n\t\t\t E Vegni \n\t\t \n\t\t \n\t\t\t A C Bosio \n\t\t \n\t \n\t \n\t\t J Particip Med \n\t\t \n\t\t\t 6 \n\t\t\t 9 \n\t\t\t 2014 \n\t\t \n\t \n\t FREE Full text \n\t Barello S, Graffigna G, Vegni E, Bosio AC. The challenges of conceptualizing patient engagement in healthcare: a lexicographic literature review. J Particip Med 2014;6:e9 [FREE Full text]"
    },
    {
      "title": "Where are the patients in decision-making about their own care?",
      "authors": [
        "A Coulter",
        "S Parsons",
        "J Askham"
      ],
      "year": 2008,
      "raw": "Where are the patients in decision-making about their own care? \n\t\t \n\t\t\t A Coulter \n\t\t \n\t\t \n\t\t\t S Parsons \n\t\t \n\t\t \n\t\t\t J Askham \n\t\t \n\t\t \n\t\t \n\t\t\t 2008. 2015-11-30 \n\t\t\t World Health Organization Regional Office for Europe \n\t\t \n\t \n\t 6dQy9PBNI \n\t Coulter A, Parsons S, Askham J. Where are the patients in decision-making about their own care?.: World Health Organization Regional Office for Europe; 2008. URL: http://www.who.int/management/general/decisionmaking/ WhereArePatientsinDecisionMaking.pdf [accessed 2015-11-30] [WebCite Cache ID 6dQy9PBNI]"
    },
    {
      "title": "Winning their trust",
      "authors": [
        "A Parekh"
      ],
      "year": 2011,
      "doi": "10.1056/nejmp1105645",
      "journal": "N Engl J Med",
      "volume": "364",
      "issue": "24",
      "pages": "e51",
      "raw": "Winning their trust \n\t\t \n\t\t\t A K Parekh \n\t\t \n\t\t 10.1056/nejmp1105645 \n\t\t Medline: 21631314 \n\t \n\t \n\t\t N Engl J Med \n\t\t \n\t\t\t 364 \n\t\t\t 24 \n\t\t\t e51 \n\t\t\t 2011 Jun 16 \n\t\t \n\t \n\t Parekh AK. Winning their trust. N Engl J Med 2011 Jun 16;364(24):e51. [doi: 10.1056/NEJMp1105645] [Medline: 21631314]"
    },
    {
      "title": "Changing patient behavior: The next frontier in healthcare value",
      "authors": [
        "D Sundiatu",
        "G Shonu",
        "P Thomas"
      ],
      "year": 2012,
      "doi": "10.1017/9781839701252.002",
      "journal": "Health Int",
      "volume": "12",
      "raw": "Changing patient behavior: The next frontier in healthcare value \n\t\t \n\t\t\t D Sundiatu \n\t\t \n\t\t \n\t\t\t G Shonu \n\t\t \n\t\t \n\t\t\t P Thomas \n\t\t \n\t\t \n\t\t\t Angela S \n\t\t \n\t\t 10.1017/9781839701252.002 \n\t \n\t \n\t\t Health Int \n\t\t \n\t\t\t 12 \n\t\t\t \n\t\t\t 2012 \n\t\t \n\t \n\t Sundiatu D, Shonu G, Thomas P, Angela S. Changing patient behavior: The next frontier in healthcare value. Health Int 2012;12:65-73."
    },
    {
      "title": "Some novel aspects of health communication from a dialogue systems perspective",
      "authors": [
        "T Bickmore",
        "T Giorgino"
      ],
      "year": 2004,
      "doi": "10.1109/glocom.2004.1378996",
      "raw": "Some novel aspects of health communication from a dialogue systems perspective \n\t\t \n\t\t\t T Bickmore \n\t\t \n\t\t \n\t\t\t T Giorgino \n\t\t \n\t\t 10.1109/glocom.2004.1378996 \n\t\t \n\t \n\t \n\t\t AAAI Fall Symposium on Dialogue Systems for Health Communication \n\t\t Washington, DC \n\t\t \n\t\t\t 2004 Oct 24. 2004 \n\t\t\t \n\t\t \n\t \n\t Presented at \n\t Bickmore T, Giorgino T. Some novel aspects of health communication from a dialogue systems perspective. 2004 Oct 24 Presented at: AAAI Fall Symposium on Dialogue Systems for Health Communication; 2004; Washington, DC p. 275-291 URL: http://www.aaai.org/Papers/Symposia/Fall/2004/FS-04-04/FS04-04-002.pdf"
    },
    {
      "title": "Use of health information technology to improve medication adherence",
      "authors": [
        "W Vollmer",
        "A Feldstein",
        "D Smith",
        "J Dubanoski",
        "A Waterbury",
        "J Schneider"
      ],
      "year": 2011,
      "journal": "Am J Manag Care",
      "volume": "17",
      "issue": "12 Spec",
      "raw": "Use of health information technology to improve medication adherence \n\t\t \n\t\t\t W M Vollmer \n\t\t \n\t\t \n\t\t\t A Feldstein \n\t\t \n\t\t \n\t\t\t D Smith \n\t\t \n\t\t \n\t\t\t J P Dubanoski \n\t\t \n\t\t \n\t\t\t A Waterbury \n\t\t \n\t\t \n\t\t\t J L Schneider \n\t\t \n\t\t Medline: 22216772 \n\t \n\t \n\t\t Am J Manag Care \n\t\t \n\t\t\t 17 \n\t\t\t 12 Spec \n\t\t\t \n\t\t\t 2011 Dec \n\t\t \n\t \n\t FREE Full text \n\t Vollmer WM, Feldstein A, Smith D, Dubanoski JP, Waterbury A, Schneider JL, et al. Use of health information technology to improve medication adherence. Am J Manag Care 2011 Dec;17(12 Spec No):SP79-SP87 [FREE Full text] [Medline: 22216772]"
    },
    {
      "title": "A systematic review of patient acceptance of consumer health information technology",
      "authors": [
        "C Or",
        "B Karsh"
      ],
      "year": 2009,
      "doi": "10.1197/jamia.m2888",
      "journal": "J Am Med Inform Assoc",
      "volume": "16",
      "issue": "4",
      "raw": "A systematic review of patient acceptance of consumer health information technology \n\t\t \n\t\t\t C Or \n\t\t \n\t\t \n\t\t\t B Karsh \n\t\t \n\t\t 10.1197/jamia.m2888 \n\t \n\t \n\t\t J Am Med Inform Assoc \n\t\t \n\t\t\t 16 \n\t\t\t 4 \n\t\t\t \n\t\t\t 2009 \n\t\t \n\t \n\t Or C, Karsh B. A systematic review of patient acceptance of consumer health information technology. J Am Med Inform Assoc 2009;16(4):550-560. [doi: 10.1197/jamia.M2888]"
    },
    {
      "title": "Using the internet to promote health behavior change: a systematic review and meta-analysis of the impact of theoretical basis, use of behavior change techniques, and mode of delivery on efficacy",
      "authors": [
        "T Webb",
        "J Joseph",
        "L Yardley",
        "S Michie"
      ],
      "year": 2010,
      "doi": "10.2196/jmir.1376",
      "journal": "J Med Internet Res",
      "volume": "12",
      "issue": "1",
      "raw": "Using the internet to promote health behavior change: a systematic review and meta-analysis of the impact of theoretical basis, use of behavior change techniques, and mode of delivery on efficacy \n\t\t \n\t\t\t T L Webb \n\t\t \n\t\t \n\t\t\t J Joseph \n\t\t \n\t\t \n\t\t\t L Yardley \n\t\t \n\t\t \n\t\t\t S Michie \n\t\t \n\t\t 10.2196/jmir.1376 \n\t\t Medline: 20164043 \n\t \n\t \n\t\t J Med Internet Res \n\t\t \n\t\t\t 12 \n\t\t\t 1 \n\t\t\t 2010 \n\t\t \n\t \n\t FREE Full text \n\t Webb TL, Joseph J, Yardley L, Michie S. Using the internet to promote health behavior change: a systematic review and meta-analysis of the impact of theoretical basis, use of behavior change techniques, and mode of delivery on efficacy. J Med Internet Res 2010;12(1):e4 [FREE Full text] [doi: 10.2196/jmir.1376] [Medline: 20164043]"
    },
    {
      "title": "Systematic review of communication technologies to promote access and engagement of young people with diabetes into healthcare",
      "authors": [
        "P Sutcliffe",
        "S Martin",
        "J Sturt",
        "J Powell",
        "F Griffiths",
        "A Adams"
      ],
      "year": 2011,
      "doi": "10.1186/1472-6823-11-1",
      "journal": "BMC Endocr Disord",
      "volume": "11",
      "issue": "1",
      "raw": "Systematic review of communication technologies to promote access and engagement of young people with diabetes into healthcare \n\t\t \n\t\t\t P Sutcliffe \n\t\t \n\t\t \n\t\t\t S Martin \n\t\t \n\t\t \n\t\t\t J Sturt \n\t\t \n\t\t \n\t\t\t J Powell \n\t\t \n\t\t \n\t\t\t F Griffiths \n\t\t \n\t\t \n\t\t\t A Adams \n\t\t \n\t\t 10.1186/1472-6823-11-1 \n\t\t Medline: 21210964 \n\t \n\t \n\t\t BMC Endocr Disord \n\t\t \n\t\t\t 11 \n\t\t\t 1 \n\t\t\t 2011 \n\t\t \n\t \n\t FREE Full text \n\t Sutcliffe P, Martin S, Sturt J, Powell J, Griffiths F, Adams A, et al. Systematic review of communication technologies to promote access and engagement of young people with diabetes into healthcare. BMC Endocr Disord 2011;11:1 [FREE Full text] [doi: 10.1186/1472-6823-11-1] [Medline: 21210964]"
    },
    {
      "title": "Over 50 and wired: Web-based stakeholder communication",
      "authors": [
        "H Martyn",
        "L Gallant"
      ],
      "year": 2012,
      "doi": "10.5210/fm.v17i6.3449",
      "journal": "FM",
      "volume": "17",
      "issue": "6",
      "pages": "17",
      "raw": "Over 50 and wired: Web-based stakeholder communication \n\t\t \n\t\t\t H Martyn \n\t\t \n\t\t \n\t\t\t L M Gallant \n\t\t \n\t\t 10.5210/fm.v17i6.3449 \n\t \n\t \n\t\t FM \n\t\t \n\t\t\t 17 \n\t\t\t 6 \n\t\t\t 17 \n\t\t\t 2012 Jun 08 \n\t\t \n\t \n\t FREE Full text \n\t Martyn H, Gallant LM. Over 50 and wired: Web-based stakeholder communication. FM 2012 Jun 08;17(6) 17(6) [FREE Full text] [doi: 10.5210/fm.v17i6.3449]"
    },
    {
      "title": "Health empowerment technologies (HET): building a web-based tool to empower older African American patient-doctor relationships",
      "authors": [
        "G Winbush",
        "L Mcdougle",
        "L Labranche"
      ],
      "year": 2014,
      "doi": "10.1353/hpu.2014.0017",
      "journal": "J Health Care Poor Underserved",
      "volume": "24",
      "issue": "4",
      "raw": "Health empowerment technologies (HET): building a web-based tool to empower older African American patient-doctor relationships \n\t\t \n\t\t\t G B Winbush \n\t\t \n\t\t \n\t\t\t L Mcdougle \n\t\t \n\t\t \n\t\t\t L Labranche \n\t\t \n\t\t 10.1353/hpu.2014.0017 \n\t \n\t \n\t\t J Health Care Poor Underserved \n\t\t \n\t\t\t 24 \n\t\t\t 4 \n\t\t\t \n\t\t\t 2014 \n\t\t \n\t \n\t Winbush GB, McDougle L, Labranche L. Health empowerment technologies (HET): building a web-based tool to empower older African American patient-doctor relationships. J Health Care Poor Underserved 2014;24(4):106-117. [doi: 10.1353/hpu.2014.0017]"
    },
    {
      "title": "The effects on health behavior and health outcomes of Internet-based asynchronous communication between health providers and patients with a chronic condition: a systematic review",
      "authors": [
        "C De Jong",
        "Ros Schrijvers"
      ],
      "year": 2014,
      "doi": "10.2196/jmir.3000",
      "journal": "J Med Internet Res",
      "volume": "16",
      "issue": "1",
      "pages": "19",
      "raw": "The effects on health behavior and health outcomes of Internet-based asynchronous communication between health providers and patients with a chronic condition: a systematic review \n\t\t \n\t\t\t C De Jong \n\t\t \n\t\t \n\t\t\t Ros Wj Schrijvers \n\t\t \n\t\t \n\t\t\t G \n\t\t \n\t\t 10.2196/jmir.3000 \n\t\t Medline: 24434570 \n\t \n\t \n\t\t J Med Internet Res \n\t\t \n\t\t\t 16 \n\t\t\t 1 \n\t\t\t 19 \n\t\t\t 2014 \n\t\t \n\t \n\t FREE Full text \n\t de Jong C, Ros WJ, Schrijvers G. The effects on health behavior and health outcomes of Internet-based asynchronous communication between health providers and patients with a chronic condition: a systematic review. J Med Internet Res 2014;16(1):e19 [FREE Full text] [doi: 10.2196/jmir.3000] [Medline: 24434570]"
    },
    {
      "title": "A review of eHealth interventions for physical activity and dietary behavior change",
      "authors": [
        "G Norman",
        "M Zabinski",
        "M Adams",
        "D Rosenberg",
        "A Yaroch",
        "A Atienza"
      ],
      "year": 2007,
      "doi": "10.1016/j.amepre.2007.05.007",
      "journal": "Am J Prev Med",
      "volume": "33",
      "issue": "4",
      "raw": "A review of eHealth interventions for physical activity and dietary behavior change \n\t\t \n\t\t\t G J Norman \n\t\t \n\t\t \n\t\t\t M F Zabinski \n\t\t \n\t\t \n\t\t\t M A Adams \n\t\t \n\t\t \n\t\t\t D E Rosenberg \n\t\t \n\t\t \n\t\t\t A L Yaroch \n\t\t \n\t\t \n\t\t\t A A Atienza \n\t\t \n\t\t 10.1016/j.amepre.2007.05.007 \n\t\t Medline: 17888860 \n\t \n\t \n\t\t Am J Prev Med \n\t\t \n\t\t\t 33 \n\t\t\t 4 \n\t\t\t \n\t\t\t 2007 Oct \n\t\t \n\t \n\t FREE Full text \n\t Norman GJ, Zabinski MF, Adams MA, Rosenberg DE, Yaroch AL, Atienza AA. A review of eHealth interventions for physical activity and dietary behavior change. Am J Prev Med 2007 Oct;33(4):336-345 [FREE Full text] [doi: 10.1016/j.amepre.2007.05.007] [Medline: 17888860]"
    },
    {
      "title": "The effectiveness of Web-based vs. non-Web-based interventions: a meta-analysis of behavioral change outcomes",
      "authors": [
        "D Wantland",
        "C Portillo",
        "W Holzemer",
        "R Slaughter",
        "E Mcghee"
      ],
      "year": 2004,
      "doi": "10.2196/jmir.6.4.e40",
      "journal": "J Med Internet Res",
      "volume": "6",
      "issue": "4",
      "raw": "The effectiveness of Web-based vs. non-Web-based interventions: a meta-analysis of behavioral change outcomes \n\t\t \n\t\t\t D J Wantland \n\t\t \n\t\t \n\t\t\t C J Portillo \n\t\t \n\t\t \n\t\t\t W L Holzemer \n\t\t \n\t\t \n\t\t\t R Slaughter \n\t\t \n\t\t \n\t\t\t E M Mcghee \n\t\t \n\t\t 10.2196/jmir.6.4.e40 \n\t\t Medline: 15631964 \n\t \n\t \n\t\t J Med Internet Res \n\t\t \n\t\t\t 6 \n\t\t\t 4 \n\t\t\t 2004 Nov 10 \n\t\t \n\t \n\t FREE Full text \n\t Wantland DJ, Portillo CJ, Holzemer WL, Slaughter R, McGhee EM. The effectiveness of Web-based vs. non-Web-based interventions: a meta-analysis of behavioral change outcomes. J Med Internet Res 2004 Nov 10;6(4):e40 [FREE Full text] [doi: 10.2196/jmir.6.4.e40] [Medline: 15631964]"
    },
    {
      "title": "A systematic review of IT for diabetes self-management: are we there yet?",
      "authors": [
        "O El-Gayar",
        "P Timsina",
        "N Nawar",
        "W Eid"
      ],
      "year": 2013,
      "doi": "10.1016/j.ijmedinf.2013.05.006",
      "journal": "Int J Med Inform",
      "volume": "82",
      "issue": "8",
      "raw": "A systematic review of IT for diabetes self-management: are we there yet? \n\t\t \n\t\t\t O El-Gayar \n\t\t \n\t\t \n\t\t\t P Timsina \n\t\t \n\t\t \n\t\t\t N Nawar \n\t\t \n\t\t \n\t\t\t W Eid \n\t\t \n\t\t 10.1016/j.ijmedinf.2013.05.006 \n\t\t Medline: 23792137 \n\t \n\t \n\t\t Int J Med Inform \n\t\t \n\t\t\t 82 \n\t\t\t 8 \n\t\t\t \n\t\t\t 2013 Aug \n\t\t \n\t \n\t El-Gayar O, Timsina P, Nawar N, Eid W. A systematic review of IT for diabetes self-management: are we there yet? Int J Med Inform 2013 Aug;82(8):637-652. [doi: 10.1016/j.ijmedinf.2013.05.006] [Medline: 23792137]"
    },
    {
      "title": "The role of behavioral science theory in development and implementation of public health interventions",
      "authors": [
        "K Glanz",
        "D Bishop"
      ],
      "year": 2010,
      "doi": "10.1146/annurev.publhealth.012809.103604",
      "journal": "Annu Rev Public Health",
      "volume": "31",
      "raw": "The role of behavioral science theory in development and implementation of public health interventions \n\t\t \n\t\t\t K Glanz \n\t\t \n\t\t \n\t\t\t D B Bishop \n\t\t \n\t\t 10.1146/annurev.publhealth.012809.103604 \n\t\t Medline: 20070207 \n\t \n\t \n\t\t Annu Rev Public Health \n\t\t \n\t\t\t 31 \n\t\t\t \n\t\t\t 2010 \n\t\t \n\t \n\t Glanz K, Bishop DB. The role of behavioral science theory in development and implementation of public health interventions. Annu Rev Public Health 2010;31:399-418. [doi: 10.1146/annurev.publhealth.012809.103604] [Medline: 20070207]"
    },
    {
      "title": "Diabetes patient education: a meta-analysis and meta-regression",
      "authors": [
        "S Ellis",
        "T Speroff",
        "R Dittus",
        "A Brown",
        "J Pichert",
        "T Elasy"
      ],
      "year": 2004,
      "doi": "10.1016/s0738-3991(03)00016-8",
      "journal": "Patient Education and Counseling",
      "volume": "52",
      "issue": "1",
      "raw": "Diabetes patient education: a meta-analysis and meta-regression \n\t\t \n\t\t\t S E Ellis \n\t\t \n\t\t \n\t\t\t T Speroff \n\t\t \n\t\t \n\t\t\t R S Dittus \n\t\t \n\t\t \n\t\t\t A Brown \n\t\t \n\t\t \n\t\t\t J W Pichert \n\t\t \n\t\t \n\t\t\t T Elasy \n\t\t \n\t\t 10.1016/s0738-3991(03)00016-8 \n\t \n\t \n\t\t Patient Education and Counseling \n\t\t \n\t\t\t 52 \n\t\t\t 1 \n\t\t\t \n\t\t\t 2004 Jan \n\t\t \n\t \n\t Ellis SE, Speroff T, Dittus RS, Brown A, Pichert JW, Elasy T. Diabetes patient education: a meta-analysis and meta-regression. Patient Education and Counseling 2004 Jan;52(1):97-105. [doi: 10.1016/S0738-3991(03)00016-8]"
    },
    {
      "title": "Emerging Theories in Health Promotion Practice and Research",
      "authors": [
        "R Diclemente",
        "R Crosby",
        "M Kegler"
      ],
      "year": 2009,
      "raw": "R Diclemente \n\t\t \n\t\t \n\t\t\t R A Crosby \n\t\t \n\t\t \n\t\t\t M Kegler \n\t\t \n\t\t Emerging Theories in Health Promotion Practice and Research \n\t\t San Francisco, CA \n\t\t \n\t\t\t Jossey-Bass \n\t\t\t 2009 \n\t\t \n\t \n\t DiClemente R, Crosby RA, Kegler M, editors. Emerging Theories in Health Promotion Practice and Research. San Francisco, CA: Jossey-Bass; 2009."
    },
    {
      "title": "Design and implementation of a randomized controlled social and mobile weight loss trial for young adults (project SMART)",
      "authors": [
        "K Patrick",
        "S Marshall",
        "E Davila",
        "J Kolodziejczyk",
        "J Fowler",
        "K Calfas"
      ],
      "year": 2014,
      "doi": "10.1016/j.cct.2013.11.001",
      "journal": "Contemp Clin Trials",
      "volume": "37",
      "issue": "1",
      "raw": "Design and implementation of a randomized controlled social and mobile weight loss trial for young adults (project SMART) \n\t\t \n\t\t\t K Patrick \n\t\t \n\t\t \n\t\t\t S J Marshall \n\t\t \n\t\t \n\t\t\t E P Davila \n\t\t \n\t\t \n\t\t\t J K Kolodziejczyk \n\t\t \n\t\t \n\t\t\t J H Fowler \n\t\t \n\t\t \n\t\t\t K J Calfas \n\t\t \n\t\t 10.1016/j.cct.2013.11.001 \n\t\t Medline: 24215774 \n\t \n\t \n\t\t Contemp Clin Trials \n\t\t \n\t\t\t 37 \n\t\t\t 1 \n\t\t\t \n\t\t\t 2014 Jan \n\t\t \n\t \n\t FREE Full text \n\t Patrick K, Marshall SJ, Davila EP, Kolodziejczyk JK, Fowler JH, Calfas KJ, et al. Design and implementation of a randomized controlled social and mobile weight loss trial for young adults (project SMART). Contemp Clin Trials 2014 Jan;37(1):10-18 [FREE Full text] [doi: 10.1016/j.cct.2013.11.001] [Medline: 24215774]"
    },
    {
      "title": "Why innovations and advances in health behavior change will arise if interventions are used to test and refine theory",
      "authors": [
        "A Rothman"
      ],
      "year": 2004,
      "doi": "10.1186/1479-5868-1-11",
      "journal": "Int J Behav Nutr Phys Act",
      "volume": "1",
      "issue": "1",
      "pages": "11",
      "raw": "Why innovations and advances in health behavior change will arise if interventions are used to test and refine theory \n\t\t \n\t\t\t A J Rothman \n\t\t \n\t\t 10.1186/1479-5868-1-11 \n\t\t Medline: 15279674 \n\t \n\t \n\t\t Int J Behav Nutr Phys Act \n\t\t \n\t\t\t 1 \n\t\t\t 1 \n\t\t\t 11 \n\t\t\t 2004 Jul 27 \n\t\t \n\t \n\t Is there nothing more practical than a good theory? FREE Full text \n\t Rothman AJ. \"Is there nothing more practical than a good theory?\": Why innovations and advances in health behavior change will arise if interventions are used to test and refine theory. Int J Behav Nutr Phys Act 2004 Jul 27;1(1):11 [FREE Full text] [doi: 10.1186/1479-5868-1-11] [Medline: 15279674]"
    },
    {
      "title": "Active assistance technology for health-related behavior change: an interdisciplinary review",
      "authors": [
        "C Kennedy",
        "J Powell",
        "T Payne",
        "J Ainsworth",
        "A Boyd",
        "I Buchan"
      ],
      "year": 2012,
      "doi": "10.2196/jmir.1893",
      "journal": "J Med Internet Res",
      "volume": "14",
      "issue": "3",
      "pages": "80",
      "raw": "Active assistance technology for health-related behavior change: an interdisciplinary review \n\t\t \n\t\t\t C M Kennedy \n\t\t \n\t\t \n\t\t\t J Powell \n\t\t \n\t\t \n\t\t\t T H Payne \n\t\t \n\t\t \n\t\t\t J Ainsworth \n\t\t \n\t\t \n\t\t\t A Boyd \n\t\t \n\t\t \n\t\t\t I Buchan \n\t\t \n\t\t 10.2196/jmir.1893 \n\t\t Medline: 22698679 \n\t \n\t \n\t\t J Med Internet Res \n\t\t \n\t\t\t 14 \n\t\t\t 3 \n\t\t\t 80 \n\t\t\t 2012 \n\t\t \n\t \n\t FREE Full text \n\t Kennedy CM, Powell J, Payne TH, Ainsworth J, Boyd A, Buchan I. Active assistance technology for health-related behavior change: an interdisciplinary review. J Med Internet Res 2012;14(3):e80 [FREE Full text] [doi: 10.2196/jmir.1893] [Medline: 22698679]"
    },
    {
      "title": "How scholarly is Google Scholar? A comparison to library databases",
      "authors": [
        "J Howland",
        "T Wright",
        "R Boughan",
        "B Roberts"
      ],
      "year": 2009,
      "doi": "10.5860/crl.70.3.227",
      "journal": "College & Research Libraries",
      "volume": "70",
      "issue": "3",
      "raw": "How scholarly is Google Scholar? A comparison to library databases \n\t\t \n\t\t\t J L Howland \n\t\t \n\t\t \n\t\t\t T C Wright \n\t\t \n\t\t \n\t\t\t R Boughan \n\t\t \n\t\t \n\t\t\t B Roberts \n\t\t \n\t\t 10.5860/crl.70.3.227 \n\t \n\t \n\t\t College & Research Libraries \n\t\t \n\t\t\t 70 \n\t\t\t 3 \n\t\t\t \n\t\t\t 2009 May 01 \n\t\t \n\t \n\t FREE Full text \n\t Howland JL, Wright TC, Boughan R, Roberts B. How scholarly is Google Scholar? A comparison to library databases. College & Research Libraries 2009 May 01;70(3):227-234 [FREE Full text] [doi: 10.5860/crl.70.3.227]"
    },
    {
      "title": "Google Scholar coverage of a multidisciplinary field",
      "authors": [
        "W Walters"
      ],
      "year": 2007,
      "doi": "10.1016/j.ipm.2006.08.006",
      "journal": "Information Processing & Management",
      "volume": "43",
      "issue": "4",
      "raw": "Google Scholar coverage of a multidisciplinary field \n\t\t \n\t\t\t W H Walters \n\t\t \n\t\t 10.1016/j.ipm.2006.08.006 \n\t \n\t \n\t\t Information Processing & Management \n\t\t \n\t\t\t 43 \n\t\t\t 4 \n\t\t\t \n\t\t\t 2007 Jul \n\t\t \n\t \n\t FREE Full text \n\t Walters WH. Google Scholar coverage of a multidisciplinary field. Information Processing & Management 2007 Jul;43(4):1121-1132 [FREE Full text] [doi: 10.1016/j.ipm.2006.08.006]"
    },
    {
      "title": "Making sense of evidence. 10 questions to help you make sense of qualitative research",
      "year": 2006,
      "raw": "Making sense of evidence. 10 questions to help you make sense of qualitative research \n\t\t England \n\t\t \n\t\t\t Public Health Resource Unit \n\t\t\t 2006. 2015-11-21 \n\t\t \n\t \n\t Critical Appraisal Skills Programme (CASP) 6dD1uPjZQ \n\t Critical Appraisal Skills Programme (CASP). Making sense of evidence. 10 questions to help you make sense of qualitative research. England: Public Health Resource Unit; 2006. URL: http://www.caspuk.net/wpcontent/uploads/2011/11/ CASPQualitativeResearchChecklist31.05.13.pdf [accessed 2015-11-21] [WebCite Cache ID 6dD1uPjZQ]"
    },
    {
      "title": "Evaluating meta-ethnography: a synthesis of qualitative research on lay experiences of diabetes and diabetes care",
      "authors": [
        "R Campbell",
        "P Pound",
        "C Pope",
        "N Britten",
        "R Pill",
        "M Morgan"
      ],
      "year": 2003,
      "doi": "10.1016/s0277-9536(02)00064-3",
      "journal": "Soc Sci Med",
      "volume": "56",
      "issue": "4",
      "raw": "Evaluating meta-ethnography: a synthesis of qualitative research on lay experiences of diabetes and diabetes care \n\t\t \n\t\t\t R Campbell \n\t\t \n\t\t \n\t\t\t P Pound \n\t\t \n\t\t \n\t\t\t C Pope \n\t\t \n\t\t \n\t\t\t N Britten \n\t\t \n\t\t \n\t\t\t R Pill \n\t\t \n\t\t \n\t\t\t M Morgan \n\t\t \n\t\t 10.1016/s0277-9536(02)00064-3 \n\t\t Medline: 12560003 \n\t \n\t \n\t\t Soc Sci Med \n\t\t \n\t\t\t 56 \n\t\t\t 4 \n\t\t\t \n\t\t\t 2003 Feb \n\t\t \n\t \n\t Campbell R, Pound P, Pope C, Britten N, Pill R, Morgan M, et al. Evaluating meta-ethnography: a synthesis of qualitative research on lay experiences of diabetes and diabetes care. Soc Sci Med 2003 Feb;56(4):671-684. [Medline: 12560003]"
    },
    {
      "title": "A systematic review of the relationship between parenting styles and children's physical activity. Health, physical activity and sport in South Africa: issues and challenges",
      "authors": [
        "E Davids",
        "N Roman"
      ],
      "year": 2014,
      "journal": "Afr J Phys Health Educ Recreat Dance",
      "volume": "20",
      "raw": "A systematic review of the relationship between parenting styles and children's physical activity. Health, physical activity and sport in South Africa: issues and challenges \n\t\t \n\t\t\t E L Davids \n\t\t \n\t\t \n\t\t\t N V Roman \n\t\t \n\t \n\t \n\t\t Afr J Phys Health Educ Recreat Dance \n\t\t \n\t\t\t 20 \n\t\t\t \n\t\t\t 2014 Oct \n\t\t \n\t \n\t Davids EL, Roman NV. A systematic review of the relationship between parenting styles and children's physical activity. Health, physical activity and sport in South Africa: issues and challenges. Afr J Phys Health Educ Recreat Dance 2014 Oct;20:228-246."
    },
    {
      "title": "Adherence to long-term therapies: evidence for action",
      "authors": [
        "S Degeest",
        "E Sabat\u00e9"
      ],
      "year": 2003,
      "doi": "10.1016/s1474-5151(03)00091-4",
      "journal": "Eur J Cardiovasc Nurs",
      "volume": "2",
      "issue": "4",
      "pages": "323",
      "raw": "Adherence to long-term therapies: evidence for action \n\t\t \n\t\t\t S Degeest \n\t\t \n\t\t \n\t\t\t E Sabat\u00e9 \n\t\t \n\t\t 10.1016/s1474-5151(03)00091-4 \n\t\t Medline: 14667488 \n\t \n\t \n\t\t Eur J Cardiovasc Nurs \n\t\t \n\t\t\t 2 \n\t\t\t 4 \n\t\t\t 323 \n\t\t\t 2003 Dec \n\t\t \n\t \n\t DeGeest S, Sabat\u00e9 E. Adherence to long-term therapies: evidence for action. Eur J Cardiovasc Nurs 2003 Dec;2(4):323. [Medline: 14667488]"
    },
    {
      "title": "Behavioral theories and the problem of compliance",
      "authors": [
        "H Leventhal",
        "L Cameron"
      ],
      "year": 1987,
      "doi": "10.1016/0738-3991(87)90093-0",
      "journal": "Patient Education and Counseling",
      "volume": "10",
      "issue": "2",
      "raw": "Behavioral theories and the problem of compliance \n\t\t \n\t\t\t H Leventhal \n\t\t \n\t\t \n\t\t\t L Cameron \n\t\t \n\t\t 10.1016/0738-3991(87)90093-0 \n\t \n\t \n\t\t Patient Education and Counseling \n\t\t \n\t\t\t 10 \n\t\t\t 2 \n\t\t\t \n\t\t\t 1987 Oct \n\t\t \n\t \n\t Leventhal H, Cameron L. Behavioral theories and the problem of compliance. Patient Education and Counseling 1987 Oct;10(2):117-138. [doi: 10.1016/0738-3991(87)90093-0]"
    },
    {
      "title": "A review of health behaviour theories: how useful are these for developing interventions to promote long-term medication adherence for TB and HIV/AIDS?",
      "authors": [
        "S Munro",
        "S Lewin",
        "T Swart",
        "J Volmink"
      ],
      "year": 2007,
      "doi": "10.1186/1471-2458-7-104",
      "journal": "BMC Public Health",
      "volume": "7",
      "pages": "104",
      "raw": "A review of health behaviour theories: how useful are these for developing interventions to promote long-term medication adherence for TB and HIV/AIDS? \n\t\t \n\t\t\t S Munro \n\t\t \n\t\t \n\t\t\t S Lewin \n\t\t \n\t\t \n\t\t\t T Swart \n\t\t \n\t\t \n\t\t\t J Volmink \n\t\t \n\t\t 10.1186/1471-2458-7-104 \n\t\t Medline: 17561997 \n\t \n\t \n\t\t BMC Public Health \n\t\t \n\t\t\t 7 \n\t\t\t 104 \n\t\t\t 2007 \n\t\t \n\t \n\t FREE Full text \n\t Munro S, Lewin S, Swart T, Volmink J. A review of health behaviour theories: how useful are these for developing interventions to promote long-term medication adherence for TB and HIV/AIDS? BMC Public Health 2007;7:104 [FREE Full text] [doi: 10.1186/1471-2458-7-104] [Medline: 17561997]"
    },
    {
      "title": "Innovation in weight loss programs: a 3-dimensional virtual-world approach",
      "authors": [
        "J Johnston",
        "A Massey",
        "C Devaneaux"
      ],
      "year": 2012,
      "doi": "10.2196/jmir.2254",
      "journal": "J Med Internet Res",
      "volume": "14",
      "issue": "5",
      "pages": "120",
      "raw": "Innovation in weight loss programs: a 3-dimensional virtual-world approach \n\t\t \n\t\t\t J D Johnston \n\t\t \n\t\t \n\t\t\t A P Massey \n\t\t \n\t\t \n\t\t\t C A Devaneaux \n\t\t \n\t\t 10.2196/jmir.2254 \n\t\t Medline: 22995535 \n\t \n\t \n\t\t J Med Internet Res \n\t\t \n\t\t\t 14 \n\t\t\t 5 \n\t\t\t 120 \n\t\t\t 2012 \n\t\t \n\t \n\t FREE Full text \n\t Johnston JD, Massey AP, Devaneaux CA. Innovation in weight loss programs: a 3-dimensional virtual-world approach. J Med Internet Res 2012;14(5):e120 [FREE Full text] [doi: 10.2196/jmir.2254] [Medline: 22995535]"
    },
    {
      "title": "A randomized controlled trial on the long-term effects of a 1-month behavioral weight control program assisted by computer tailored advice",
      "authors": [
        "Y Adachi",
        "C Sato",
        "K Yamatsu",
        "S Ito",
        "K Adachi",
        "T Yamagami"
      ],
      "year": 2007,
      "doi": "10.1016/j.brat.2006.03.017",
      "journal": "Behav Res Ther",
      "volume": "45",
      "issue": "3",
      "raw": "A randomized controlled trial on the long-term effects of a 1-month behavioral weight control program assisted by computer tailored advice \n\t\t \n\t\t\t Y Adachi \n\t\t \n\t\t \n\t\t\t C Sato \n\t\t \n\t\t \n\t\t\t K Yamatsu \n\t\t \n\t\t \n\t\t\t S Ito \n\t\t \n\t\t \n\t\t\t K Adachi \n\t\t \n\t\t \n\t\t\t T Yamagami \n\t\t \n\t\t 10.1016/j.brat.2006.03.017 \n\t\t Medline: 16713991 \n\t \n\t \n\t\t Behav Res Ther \n\t\t \n\t\t\t 45 \n\t\t\t 3 \n\t\t\t \n\t\t\t 2007 Mar \n\t\t \n\t \n\t Adachi Y, Sato C, Yamatsu K, Ito S, Adachi K, Yamagami T. A randomized controlled trial on the long-term effects of a 1-month behavioral weight control program assisted by computer tailored advice. Behav Res Ther 2007 Mar;45(3):459-470. [doi: 10.1016/j.brat.2006.03.017] [Medline: 16713991]"
    },
    {
      "title": "Evaluation of an internet-based physical activity intervention: a preliminary investigation",
      "authors": [
        "M Napolitano",
        "M Fotheringham",
        "D Tate",
        "C Sciamanna",
        "Leslie Owen"
      ],
      "year": 2003,
      "journal": "Ann Behav Med",
      "volume": "25",
      "issue": "2",
      "raw": "Evaluation of an internet-based physical activity intervention: a preliminary investigation \n\t\t \n\t\t\t M A Napolitano \n\t\t \n\t\t \n\t\t\t M Fotheringham \n\t\t \n\t\t \n\t\t\t D Tate \n\t\t \n\t\t \n\t\t\t C Sciamanna \n\t\t \n\t\t \n\t\t\t Leslie E Owen \n\t\t \n\t\t \n\t\t\t N \n\t\t \n\t\t Medline: 12704010 \n\t \n\t \n\t\t Ann Behav Med \n\t\t \n\t\t\t 25 \n\t\t\t 2 \n\t\t\t \n\t\t\t 2003 \n\t\t \n\t \n\t Napolitano MA, Fotheringham M, Tate D, Sciamanna C, Leslie E, Owen N, et al. Evaluation of an internet-based physical activity intervention: a preliminary investigation. Ann Behav Med 2003;25(2):92-99. [Medline: 12704010]"
    },
    {
      "title": "Trial to examine text message-based mHealth in emergency department patients with diabetes (TExT-MED): a randomized controlled trial",
      "authors": [
        "S Arora",
        "A Peters",
        "E Burner",
        "C Lam",
        "M Menchine"
      ],
      "year": 2014,
      "doi": "10.1016/j.annemergmed.2013.10.012",
      "journal": "Ann Emerg Med",
      "volume": "63",
      "issue": "6",
      "raw": "Trial to examine text message-based mHealth in emergency department patients with diabetes (TExT-MED): a randomized controlled trial \n\t\t \n\t\t\t S Arora \n\t\t \n\t\t \n\t\t\t A L Peters \n\t\t \n\t\t \n\t\t\t E Burner \n\t\t \n\t\t \n\t\t\t C N Lam \n\t\t \n\t\t \n\t\t\t M Menchine \n\t\t \n\t\t 10.1016/j.annemergmed.2013.10.012 \n\t\t Medline: 24225332 \n\t \n\t \n\t\t Ann Emerg Med \n\t\t \n\t\t\t 63 \n\t\t\t 6 \n\t\t\t \n\t\t\t 2014 Jun \n\t\t \n\t \n\t Arora S, Peters AL, Burner E, Lam CN, Menchine M. Trial to examine text message-based mHealth in emergency department patients with diabetes (TExT-MED): a randomized controlled trial. Ann Emerg Med 2014 Jun;63(6):745-754.e6. [doi: 10.1016/j.annemergmed.2013.10.012] [Medline: 24225332]"
    },
    {
      "title": "Cancer patients on Twitter: a novel patient community on social media",
      "authors": [
        "Y Sugawara",
        "H Narimatsu",
        "A Hozawa",
        "L Shao",
        "K Otani",
        "A Fukao"
      ],
      "year": 2012,
      "doi": "10.1186/1756-0500-5-699",
      "journal": "BMC Res Notes",
      "volume": "5",
      "pages": "699",
      "raw": "Cancer patients on Twitter: a novel patient community on social media \n\t\t \n\t\t\t Y Sugawara \n\t\t \n\t\t \n\t\t\t H Narimatsu \n\t\t \n\t\t \n\t\t\t A Hozawa \n\t\t \n\t\t \n\t\t\t L Shao \n\t\t \n\t\t \n\t\t\t K Otani \n\t\t \n\t\t \n\t\t\t A Fukao \n\t\t \n\t\t 10.1186/1756-0500-5-699 \n\t\t Medline: 23270426 \n\t \n\t \n\t\t BMC Res Notes \n\t\t \n\t\t\t 5 \n\t\t\t 699 \n\t\t\t 2012 \n\t\t \n\t \n\t FREE Full text \n\t Sugawara Y, Narimatsu H, Hozawa A, Shao L, Otani K, Fukao A. Cancer patients on Twitter: a novel patient community on social media. BMC Res Notes 2012;5:699 [FREE Full text] [doi: 10.1186/1756-0500-5-699] [Medline: 23270426]"
    },
    {
      "title": "A pilot study of delivering peer health messages in an HIV clinic via mobile media",
      "authors": [
        "C Winstead-Derlega",
        "M Rafaly",
        "S Delgado",
        "J Freeman",
        "K Cutitta",
        "T Miles"
      ],
      "year": 2012,
      "doi": "10.1089/tmj.2011.0236",
      "journal": "Telemed J E Health",
      "volume": "18",
      "issue": "6",
      "raw": "A pilot study of delivering peer health messages in an HIV clinic via mobile media \n\t\t \n\t\t\t C Winstead-Derlega \n\t\t \n\t\t \n\t\t\t M Rafaly \n\t\t \n\t\t \n\t\t\t S Delgado \n\t\t \n\t\t \n\t\t\t J Freeman \n\t\t \n\t\t \n\t\t\t K Cutitta \n\t\t \n\t\t \n\t\t\t T Miles \n\t\t \n\t\t 10.1089/tmj.2011.0236 \n\t\t Medline: 22732025 \n\t \n\t \n\t\t Telemed J E Health \n\t\t \n\t\t\t 18 \n\t\t\t 6 \n\t\t\t \n\t\t\t 2012 \n\t\t \n\t \n\t FREE Full text \n\t Winstead-Derlega C, Rafaly M, Delgado S, Freeman J, Cutitta K, Miles T, et al. A pilot study of delivering peer health messages in an HIV clinic via mobile media. Telemed J E Health 2012;18(6):464-469 [FREE Full text] [doi: 10.1089/tmj.2011.0236] [Medline: 22732025]"
    },
    {
      "title": "A model for treating voice disorders in school-age children within a video gaming environment",
      "authors": [
        "S King",
        "L Davis",
        "J Lehman",
        "B Ruddy"
      ],
      "year": 2012,
      "doi": "10.1016/j.jvoice.2011.08.002",
      "journal": "J Voice",
      "volume": "26",
      "issue": "5",
      "raw": "A model for treating voice disorders in school-age children within a video gaming environment \n\t\t \n\t\t\t S N King \n\t\t \n\t\t \n\t\t\t L Davis \n\t\t \n\t\t \n\t\t\t J J Lehman \n\t\t \n\t\t \n\t\t\t B H Ruddy \n\t\t \n\t\t 10.1016/j.jvoice.2011.08.002 \n\t\t Medline: 22209055 \n\t \n\t \n\t\t J Voice \n\t\t \n\t\t\t 26 \n\t\t\t 5 \n\t\t\t \n\t\t\t 2012 Sep \n\t\t \n\t \n\t King SN, Davis L, Lehman JJ, Ruddy BH. A model for treating voice disorders in school-age children within a video gaming environment. J Voice 2012 Sep;26(5):656-663. [doi: 10.1016/j.jvoice.2011.08.002] [Medline: 22209055]"
    },
    {
      "title": "Effect of Internet therapeutic intervention on A1C levels in patients with type 2 diabetes treated with insulin",
      "authors": [
        "H Tildesley",
        "A Mazanderani",
        "S Ross"
      ],
      "year": 2010,
      "doi": "10.2337/dc09-2256",
      "journal": "Diabetes Care",
      "volume": "33",
      "issue": "8",
      "raw": "Effect of Internet therapeutic intervention on A1C levels in patients with type 2 diabetes treated with insulin \n\t\t \n\t\t\t H D Tildesley \n\t\t \n\t\t \n\t\t\t A B Mazanderani \n\t\t \n\t\t \n\t\t\t S A Ross \n\t\t \n\t\t 10.2337/dc09-2256 \n\t\t Medline: 20668152 \n\t \n\t \n\t\t Diabetes Care \n\t\t \n\t\t\t 33 \n\t\t\t 8 \n\t\t\t \n\t\t\t 2010 Aug \n\t\t \n\t \n\t FREE Full text \n\t Tildesley HD, Mazanderani AB, Ross SA. Effect of Internet therapeutic intervention on A1C levels in patients with type 2 diabetes treated with insulin. Diabetes Care 2010 Aug;33(8):1738-1740 [FREE Full text] [doi: 10.2337/dc09-2256] [Medline: 20668152]"
    },
    {
      "title": "Effect of home-based telemonitoring using mobile phone technology on the outcome of heart failure patients after an episode of acute decompensation: randomized controlled trial",
      "authors": [
        "D Scherr",
        "P Kastner",
        "A Kollmann",
        "A Hallas",
        "J Auer",
        "H Krappinger"
      ],
      "year": 2009,
      "doi": "10.2196/jmir.1252",
      "journal": "J Med Internet Res",
      "volume": "11",
      "issue": "3",
      "pages": "34",
      "raw": "Effect of home-based telemonitoring using mobile phone technology on the outcome of heart failure patients after an episode of acute decompensation: randomized controlled trial \n\t\t \n\t\t\t D Scherr \n\t\t \n\t\t \n\t\t\t P Kastner \n\t\t \n\t\t \n\t\t\t A Kollmann \n\t\t \n\t\t \n\t\t\t A Hallas \n\t\t \n\t\t \n\t\t\t J Auer \n\t\t \n\t\t \n\t\t\t H Krappinger \n\t\t \n\t\t 10.2196/jmir.1252 \n\t\t Medline: 19687005 \n\t \n\t \n\t\t J Med Internet Res \n\t\t \n\t\t\t 11 \n\t\t\t 3 \n\t\t\t 34 \n\t\t\t 2009 \n\t\t \n\t \n\t FREE Full text \n\t Scherr D, Kastner P, Kollmann A, Hallas A, Auer J, Krappinger H, et al. Effect of home-based telemonitoring using mobile phone technology on the outcome of heart failure patients after an episode of acute decompensation: randomized controlled trial. J Med Internet Res 2009;11(3):e34 [FREE Full text] [doi: 10.2196/jmir.1252] [Medline: 19687005]"
    },
    {
      "title": "Establishment of blood glucose monitoring system using the internet",
      "authors": [
        "H Kwon",
        "J Cho",
        "H Kim",
        "B Song",
        "S Ko",
        "J Lee"
      ],
      "year": 2004,
      "doi": "10.2337/diacare.27.2.478",
      "journal": "Diabetes Care",
      "volume": "27",
      "issue": "2",
      "raw": "Establishment of blood glucose monitoring system using the internet \n\t\t \n\t\t\t H Kwon \n\t\t \n\t\t \n\t\t\t J Cho \n\t\t \n\t\t \n\t\t\t H Kim \n\t\t \n\t\t \n\t\t\t B Song \n\t\t \n\t\t \n\t\t\t S Ko \n\t\t \n\t\t \n\t\t\t J Lee \n\t\t \n\t\t 10.2337/diacare.27.2.478 \n\t\t Medline: 14747232 \n\t \n\t \n\t\t Diabetes Care \n\t\t \n\t\t\t 27 \n\t\t\t 2 \n\t\t\t \n\t\t\t 2004 Feb \n\t\t \n\t \n\t Kwon H, Cho J, Kim H, Song B, Ko S, Lee J, et al. Establishment of blood glucose monitoring system using the internet. Diabetes Care 2004 Feb;27(2):478-483. [Medline: 14747232]"
    },
    {
      "title": "Defining participant exposure measures in Web-based health behavior change programs",
      "authors": [
        "B Danaher",
        "S Boles",
        "M Akers"
      ],
      "year": 2006,
      "doi": "10.2196/jmir.8.3.e15",
      "journal": "J Med Internet Res",
      "volume": "8",
      "issue": "3",
      "pages": "15",
      "raw": "Defining participant exposure measures in Web-based health behavior change programs \n\t\t \n\t\t\t B G Danaher \n\t\t \n\t\t \n\t\t\t S M Boles \n\t\t \n\t\t \n\t\t\t M Akers \n\t\t \n\t\t 10.2196/jmir.8.3.e15 \n\t \n\t \n\t\t J Med Internet Res \n\t\t \n\t\t\t 8 \n\t\t\t 3 \n\t\t\t 15 \n\t\t\t 2006 \n\t\t \n\t \n\t Danaher BG, Boles SM, Akers M. Defining participant exposure measures in Web-based health behavior change programs. J Med Internet Res 2006;8(3):e15. [doi: 10.2196/jmir.8.3.e15]"
    },
    {
      "title": "Development and process evaluation of an internet-based physical activity behaviour change program",
      "authors": [
        "R Steele",
        "K Mummery",
        "T Dwyer"
      ],
      "year": 2007,
      "doi": "10.1016/j.pec.2007.02.013",
      "journal": "Patient Educ Couns",
      "volume": "67",
      "issue": "1-2",
      "raw": "Development and process evaluation of an internet-based physical activity behaviour change program \n\t\t \n\t\t\t R Steele \n\t\t \n\t\t \n\t\t\t K W Mummery \n\t\t \n\t\t \n\t\t\t T Dwyer \n\t\t \n\t\t 10.1016/j.pec.2007.02.013 \n\t\t Medline: 17416479 \n\t \n\t \n\t\t Patient Educ Couns \n\t\t \n\t\t\t 67 \n\t\t\t 1-2 \n\t\t\t \n\t\t\t 2007 Jul \n\t\t \n\t \n\t Steele R, Mummery KW, Dwyer T. Development and process evaluation of an internet-based physical activity behaviour change program. Patient Educ Couns 2007 Jul;67(1-2):127-136. [doi: 10.1016/j.pec.2007.02.013] [Medline: 17416479]"
    },
    {
      "title": "A two-way text-messaging system answering health questions for low-income pregnant women",
      "authors": [
        "H Song",
        "A May",
        "V Vaidhyanathan",
        "E Cramer",
        "R Owais",
        "S Mcroy"
      ],
      "year": 2013,
      "doi": "10.1016/j.pec.2013.04.016",
      "journal": "Patient Educ Couns",
      "volume": "92",
      "issue": "2",
      "raw": "A two-way text-messaging system answering health questions for low-income pregnant women \n\t\t \n\t\t\t H Song \n\t\t \n\t\t \n\t\t\t A May \n\t\t \n\t\t \n\t\t\t V Vaidhyanathan \n\t\t \n\t\t \n\t\t\t E M Cramer \n\t\t \n\t\t \n\t\t\t R W Owais \n\t\t \n\t\t \n\t\t\t S Mcroy \n\t\t \n\t\t 10.1016/j.pec.2013.04.016 \n\t\t Medline: 23711635 \n\t \n\t \n\t\t Patient Educ Couns \n\t\t \n\t\t\t 92 \n\t\t\t 2 \n\t\t\t \n\t\t\t 2013 Aug \n\t\t \n\t \n\t Song H, May A, Vaidhyanathan V, Cramer EM, Owais RW, McRoy S. A two-way text-messaging system answering health questions for low-income pregnant women. Patient Educ Couns 2013 Aug;92(2):182-187. [doi: 10.1016/j.pec.2013.04.016] [Medline: 23711635]"
    },
    {
      "title": "One-year efficacy and safety of Web-based follow-up using cellular phone in type 1 diabetic patients under insulin pump therapy: the PumpNet study",
      "authors": [
        "P Benhamou",
        "V Melki",
        "R Boizel",
        "F Perreal",
        "J Quesada",
        "S Bessieres-Lacombe"
      ],
      "year": 2007,
      "doi": "10.1016/j.diabet.2007.01.002",
      "journal": "Diabetes Metab",
      "volume": "33",
      "issue": "3",
      "raw": "One-year efficacy and safety of Web-based follow-up using cellular phone in type 1 diabetic patients under insulin pump therapy: the PumpNet study \n\t\t \n\t\t\t P Benhamou \n\t\t \n\t\t \n\t\t\t V Melki \n\t\t \n\t\t \n\t\t\t R Boizel \n\t\t \n\t\t \n\t\t\t F Perreal \n\t\t \n\t\t \n\t\t\t J Quesada \n\t\t \n\t\t \n\t\t\t S Bessieres-Lacombe \n\t\t \n\t\t 10.1016/j.diabet.2007.01.002 \n\t\t Medline: 17395516 \n\t \n\t \n\t\t Diabetes Metab \n\t\t \n\t\t\t 33 \n\t\t\t 3 \n\t\t\t \n\t\t\t 2007 Jun \n\t\t \n\t \n\t FREE Full text \n\t Benhamou P, Melki V, Boizel R, Perreal F, Quesada J, Bessieres-Lacombe S, et al. One-year efficacy and safety of Web-based follow-up using cellular phone in type 1 diabetic patients under insulin pump therapy: the PumpNet study. Diabetes Metab 2007 Jun;33(3):220-226 [FREE Full text] [doi: 10.1016/j.diabet.2007.01.002] [Medline: 17395516]"
    },
    {
      "title": "Comparison of an SMS text messaging and phone reminder to improve attendance at a health promotion center: a randomized controlled trial",
      "authors": [
        "Z Chen",
        "L Fang",
        "L Chen",
        "H Dai"
      ],
      "year": 2008,
      "doi": "10.1631/jzus.b071464",
      "journal": "J Zhejiang Univ Sci B",
      "volume": "9",
      "issue": "1",
      "raw": "Comparison of an SMS text messaging and phone reminder to improve attendance at a health promotion center: a randomized controlled trial \n\t\t \n\t\t\t Z W Chen \n\t\t \n\t\t \n\t\t\t L Z Fang \n\t\t \n\t\t \n\t\t\t L Y Chen \n\t\t \n\t\t \n\t\t\t H L Dai \n\t\t \n\t\t 10.1631/jzus.b071464 \n\t\t Medline: 18196610 \n\t \n\t \n\t\t J Zhejiang Univ Sci B \n\t\t \n\t\t\t 9 \n\t\t\t 1 \n\t\t\t \n\t\t\t 2008 Jan \n\t\t \n\t \n\t FREE Full text \n\t Chen ZW, Fang LZ, Chen LY, Dai HL. Comparison of an SMS text messaging and phone reminder to improve attendance at a health promotion center: a randomized controlled trial. J Zhejiang Univ Sci B 2008 Jan;9(1):34-38 [FREE Full text] [doi: 10.1631/jzus.B071464] [Medline: 18196610]"
    },
    {
      "title": "Internet peer support for individuals with psychiatric disabilities: A randomized controlled trial",
      "authors": [
        "K Kaplan",
        "M Salzer",
        "P Solomon",
        "E Brusilovskiy",
        "P Cousounis"
      ],
      "year": 2011,
      "doi": "10.1016/j.socscimed.2010.09.037",
      "journal": "Soc Sci Med",
      "volume": "72",
      "issue": "1",
      "raw": "Internet peer support for individuals with psychiatric disabilities: A randomized controlled trial \n\t\t \n\t\t\t K Kaplan \n\t\t \n\t\t \n\t\t\t M S Salzer \n\t\t \n\t\t \n\t\t\t P Solomon \n\t\t \n\t\t \n\t\t\t E Brusilovskiy \n\t\t \n\t\t \n\t\t\t P Cousounis \n\t\t \n\t\t 10.1016/j.socscimed.2010.09.037 \n\t\t Medline: 21112682 \n\t \n\t \n\t\t Soc Sci Med \n\t\t \n\t\t\t 72 \n\t\t\t 1 \n\t\t\t \n\t\t\t 2011 Jan \n\t\t \n\t \n\t Kaplan K, Salzer MS, Solomon P, Brusilovskiy E, Cousounis P. Internet peer support for individuals with psychiatric disabilities: A randomized controlled trial. Soc Sci Med 2011 Jan;72(1):54-62. [doi: 10.1016/j.socscimed.2010.09.037] [Medline: 21112682]"
    },
    {
      "title": "Correlates of health-related social media use among adults",
      "authors": [
        "R Thackeray",
        "B Crookston",
        "J West"
      ],
      "year": 2013,
      "doi": "10.2196/jmir.2297",
      "journal": "J Med Internet Res",
      "volume": "15",
      "issue": "1",
      "raw": "Correlates of health-related social media use among adults \n\t\t \n\t\t\t R Thackeray \n\t\t \n\t\t \n\t\t\t B T Crookston \n\t\t \n\t\t \n\t\t\t J H West \n\t\t \n\t\t 10.2196/jmir.2297 \n\t\t Medline: 23367505 \n\t \n\t \n\t\t J Med Internet Res \n\t\t \n\t\t\t 15 \n\t\t\t 1 \n\t\t\t 2013 \n\t\t \n\t \n\t FREE Full text \n\t Thackeray R, Crookston BT, West JH. Correlates of health-related social media use among adults. J Med Internet Res 2013;15(1):e21 [FREE Full text] [doi: 10.2196/jmir.2297] [Medline: 23367505]"
    },
    {
      "title": "Evaluation of home telehealth following hospitalization for heart failure: a randomized trial",
      "authors": [
        "B Wakefield",
        "M Ward",
        "J Holman",
        "A Ray",
        "M Scherubel",
        "T Burns"
      ],
      "year": 2008,
      "doi": "10.1089/tmj.2007.0131",
      "journal": "Telemed J E Health",
      "volume": "14",
      "issue": "8",
      "raw": "Evaluation of home telehealth following hospitalization for heart failure: a randomized trial \n\t\t \n\t\t\t B J Wakefield \n\t\t \n\t\t \n\t\t\t M M Ward \n\t\t \n\t\t \n\t\t\t J E Holman \n\t\t \n\t\t \n\t\t\t A Ray \n\t\t \n\t\t \n\t\t\t M Scherubel \n\t\t \n\t\t \n\t\t\t T L Burns \n\t\t \n\t\t 10.1089/tmj.2007.0131 \n\t\t Medline: 18954244 \n\t \n\t \n\t\t Telemed J E Health \n\t\t \n\t\t\t 14 \n\t\t\t 8 \n\t\t\t \n\t\t\t 2008 Oct \n\t\t \n\t \n\t Wakefield BJ, Ward MM, Holman JE, Ray A, Scherubel M, Burns TL, et al. Evaluation of home telehealth following hospitalization for heart failure: a randomized trial. Telemed J E Health 2008 Oct;14(8):753-761. [doi: 10.1089/tmj.2007.0131] [Medline: 18954244]"
    },
    {
      "title": "Adherence among telemonitored patients with heart failure to pharmacological and nonpharmacological recommendations",
      "authors": [
        "B Ramaekers",
        "J Janssen-Boyne",
        "A Gorgels",
        "H Vrijhoef"
      ],
      "year": 2009,
      "doi": "10.1089/tmj.2008.0160",
      "journal": "Telemed J E Health",
      "volume": "15",
      "issue": "6",
      "raw": "Adherence among telemonitored patients with heart failure to pharmacological and nonpharmacological recommendations \n\t\t \n\t\t\t B T Ramaekers \n\t\t \n\t\t \n\t\t\t J J Janssen-Boyne \n\t\t \n\t\t \n\t\t\t A M Gorgels \n\t\t \n\t\t \n\t\t\t H M Vrijhoef \n\t\t \n\t\t 10.1089/tmj.2008.0160 \n\t\t Medline: 19566401 \n\t \n\t \n\t\t Telemed J E Health \n\t\t \n\t\t\t 15 \n\t\t\t 6 \n\t\t\t \n\t\t\t 2009 \n\t\t \n\t \n\t Ramaekers BT, Janssen-Boyne JJ, Gorgels AM, Vrijhoef HM. Adherence among telemonitored patients with heart failure to pharmacological and nonpharmacological recommendations. Telemed J E Health 2009;15(6):517-524. [doi: 10.1089/tmj.2008.0160] [Medline: 19566401]"
    },
    {
      "title": "A programmable prompting device improves adherence to highly active antiretroviral therapy in HIV-infected subjects with memory impairment",
      "authors": [
        "A Andrade",
        "H Mcgruder",
        "A Wu",
        "S Celano",
        "R Skolasky",
        "O Selnes"
      ],
      "year": 2005,
      "doi": "10.1086/432877",
      "journal": "Clin Infect Dis",
      "volume": "41",
      "issue": "6",
      "raw": "A programmable prompting device improves adherence to highly active antiretroviral therapy in HIV-infected subjects with memory impairment \n\t\t \n\t\t\t A A Andrade \n\t\t \n\t\t \n\t\t\t H F Mcgruder \n\t\t \n\t\t \n\t\t\t A W Wu \n\t\t \n\t\t \n\t\t\t S A Celano \n\t\t \n\t\t \n\t\t\t R L Skolasky \n\t\t \n\t\t \n\t\t\t O A Selnes \n\t\t \n\t\t 10.1086/432877 \n\t\t Medline: 16107989 \n\t \n\t \n\t\t Clin Infect Dis \n\t\t \n\t\t\t 41 \n\t\t\t 6 \n\t\t\t \n\t\t\t 2005 Sep 15 \n\t\t \n\t \n\t FREE Full text \n\t Andrade AA, McGruder HF, Wu AW, Celano SA, Skolasky RL, Selnes OA, et al. A programmable prompting device improves adherence to highly active antiretroviral therapy in HIV-infected subjects with memory impairment. Clin Infect Dis 2005 Sep 15;41(6):875-882 [FREE Full text] [doi: 10.1086/432877] [Medline: 16107989]"
    },
    {
      "title": "In defense of the internet: the relationship between Internet communication and depression, loneliness, self-esteem, and perceived social support",
      "authors": [
        "L Shaw",
        "L Gant"
      ],
      "year": 2002,
      "doi": "10.1089/109493102753770552",
      "journal": "Cyberpsychol Behav",
      "volume": "5",
      "issue": "2",
      "raw": "In defense of the internet: the relationship between Internet communication and depression, loneliness, self-esteem, and perceived social support \n\t\t \n\t\t\t L H Shaw \n\t\t \n\t\t \n\t\t\t L M Gant \n\t\t \n\t\t 10.1089/109493102753770552 \n\t\t Medline: 12025883 \n\t \n\t \n\t\t Cyberpsychol Behav \n\t\t \n\t\t\t 5 \n\t\t\t 2 \n\t\t\t \n\t\t\t 2002 Apr \n\t\t \n\t \n\t Shaw LH, Gant LM. In defense of the internet: the relationship between Internet communication and depression, loneliness, self-esteem, and perceived social support. Cyberpsychol Behav 2002 Apr;5(2):157-171. [Medline: 12025883]"
    },
    {
      "title": "Patients' engagement with \"Sweet Talk\" -a text messaging support system for young people with diabetes",
      "authors": [
        "V Franklin",
        "A Greene",
        "A Waller",
        "S Greene",
        "C Pagliari"
      ],
      "year": 2008,
      "doi": "10.2196/jmir.962",
      "journal": "J Med Internet Res",
      "volume": "10",
      "issue": "2",
      "raw": "Patients' engagement with \"Sweet Talk\" -a text messaging support system for young people with diabetes \n\t\t \n\t\t\t V L Franklin \n\t\t \n\t\t \n\t\t\t A Greene \n\t\t \n\t\t \n\t\t\t A Waller \n\t\t \n\t\t \n\t\t\t S A Greene \n\t\t \n\t\t \n\t\t\t C Pagliari \n\t\t \n\t\t 10.2196/jmir.962 \n\t\t Medline: 18653444 \n\t \n\t \n\t\t J Med Internet Res \n\t\t \n\t\t\t 10 \n\t\t\t 2 \n\t\t\t 2008 \n\t\t \n\t \n\t FREE Full text \n\t Franklin VL, Greene A, Waller A, Greene SA, Pagliari C. Patients' engagement with \"Sweet Talk\" -a text messaging support system for young people with diabetes. J Med Internet Res 2008;10(2):e20 [FREE Full text] [doi: 10.2196/jmir.962] [Medline: 18653444]"
    },
    {
      "title": "Online activity and participation in treatment affects the perceived efficacy of social health networks among patients with chronic illness",
      "authors": [
        "R Magnezi",
        "Y Bergman",
        "D Grosberg"
      ],
      "year": 2014,
      "doi": "10.2196/jmir.2630",
      "journal": "J Med Internet Res",
      "volume": "16",
      "issue": "1",
      "pages": "12",
      "raw": "Online activity and participation in treatment affects the perceived efficacy of social health networks among patients with chronic illness \n\t\t \n\t\t\t R Magnezi \n\t\t \n\t\t \n\t\t\t Y S Bergman \n\t\t \n\t\t \n\t\t\t D Grosberg \n\t\t \n\t\t 10.2196/jmir.2630 \n\t\t Medline: 24413148 \n\t \n\t \n\t\t J Med Internet Res \n\t\t \n\t\t\t 16 \n\t\t\t 1 \n\t\t\t 12 \n\t\t\t 2014 \n\t\t \n\t \n\t FREE Full text \n\t Magnezi R, Bergman YS, Grosberg D. Online activity and participation in treatment affects the perceived efficacy of social health networks among patients with chronic illness. J Med Internet Res 2014;16(1):e12 [FREE Full text] [doi: 10.2196/jmir.2630] [Medline: 24413148]"
    },
    {
      "title": "Internet-based diabetes self-management and support: Initial outcomes from the Diabetes Network project",
      "authors": [
        "H Mckay",
        "R Glasgow",
        "E Feil",
        "S Boles",
        "M Barrera"
      ],
      "year": 2002,
      "doi": "10.1037/0090-5550.47.1.31",
      "journal": "Rehabilitation Psychology",
      "volume": "47",
      "issue": "1",
      "raw": "Internet-based diabetes self-management and support: Initial outcomes from the Diabetes Network project \n\t\t \n\t\t\t H G Mckay \n\t\t \n\t\t \n\t\t\t R E Glasgow \n\t\t \n\t\t \n\t\t\t E G Feil \n\t\t \n\t\t \n\t\t\t S M Boles \n\t\t \n\t\t \n\t\t\t M J Barrera \n\t\t \n\t\t 10.1037/0090-5550.47.1.31 \n\t \n\t \n\t\t Rehabilitation Psychology \n\t\t \n\t\t\t 47 \n\t\t\t 1 \n\t\t\t \n\t\t\t 2002 Jul \n\t\t \n\t \n\t McKay HG, Glasgow RE, Feil EG, Boles SM, Barrera MJ. Internet-based diabetes self-management and support: Initial outcomes from the Diabetes Network project. Rehabilitation Psychology 2002 Jul;47(1):31-48. [doi: 10.1037/0090-5550.47.1.31]"
    },
    {
      "title": "The diabetes network internet-based physical activity intervention: a randomized pilot study",
      "authors": [
        "H Mckay",
        "D King",
        "E Eakin",
        "J Seeley",
        "R Glasgow"
      ],
      "year": 2001,
      "doi": "10.2337/diacare.24.8.1328",
      "journal": "Diabetes Care",
      "volume": "24",
      "issue": "8",
      "raw": "The diabetes network internet-based physical activity intervention: a randomized pilot study \n\t\t \n\t\t\t H G Mckay \n\t\t \n\t\t \n\t\t\t D King \n\t\t \n\t\t \n\t\t\t E G Eakin \n\t\t \n\t\t \n\t\t\t J R Seeley \n\t\t \n\t\t \n\t\t\t R E Glasgow \n\t\t \n\t\t 10.2337/diacare.24.8.1328 \n\t\t Medline: 11473065 \n\t \n\t \n\t\t Diabetes Care \n\t\t \n\t\t\t 24 \n\t\t\t 8 \n\t\t\t \n\t\t\t 2001 Aug \n\t\t \n\t \n\t McKay HG, King D, Eakin EG, Seeley JR, Glasgow RE. The diabetes network internet-based physical activity intervention: a randomized pilot study. Diabetes Care 2001 Aug;24(8):1328-1334. [Medline: 11473065]"
    },
    {
      "title": "An evaluation of a solution focused computer game in adolescent interventions",
      "authors": [
        "D Coyle",
        "G Doherty",
        "J Sharry"
      ],
      "year": 2009,
      "doi": "10.1177/1359104508100884",
      "journal": "Clin Child Psychol Psychiatry",
      "volume": "14",
      "issue": "3",
      "raw": "An evaluation of a solution focused computer game in adolescent interventions \n\t\t \n\t\t\t D Coyle \n\t\t \n\t\t \n\t\t\t G Doherty \n\t\t \n\t\t \n\t\t\t J Sharry \n\t\t \n\t\t 10.1177/1359104508100884 \n\t\t Medline: 19515752 \n\t \n\t \n\t\t Clin Child Psychol Psychiatry \n\t\t \n\t\t\t 14 \n\t\t\t 3 \n\t\t\t \n\t\t\t 2009 Jul \n\t\t \n\t \n\t Coyle D, Doherty G, Sharry J. An evaluation of a solution focused computer game in adolescent interventions. Clin Child Psychol Psychiatry 2009 Jul;14(3):345-360. [doi: 10.1177/1359104508100884] [Medline: 19515752]"
    },
    {
      "title": "The impact of Wii Fit intervention on dynamic balance control in children with probable Developmental Coordination Disorder and balance problems",
      "authors": [
        "D Jelsma",
        "R Geuze",
        "R Mombarg",
        "B Smits-Engelsman"
      ],
      "year": 2014,
      "doi": "10.1016/j.humov.2013.12.007",
      "journal": "Hum Mov Sci",
      "volume": "33",
      "raw": "The impact of Wii Fit intervention on dynamic balance control in children with probable Developmental Coordination Disorder and balance problems \n\t\t \n\t\t\t D Jelsma \n\t\t \n\t\t \n\t\t\t R H Geuze \n\t\t \n\t\t \n\t\t\t R Mombarg \n\t\t \n\t\t \n\t\t\t B Smits-Engelsman \n\t\t \n\t\t 10.1016/j.humov.2013.12.007 \n\t\t Medline: 24444657 \n\t \n\t \n\t\t Hum Mov Sci \n\t\t \n\t\t\t 33 \n\t\t\t \n\t\t\t 2014 Feb \n\t\t \n\t \n\t Jelsma D, Geuze RH, Mombarg R, Smits-Engelsman B. The impact of Wii Fit intervention on dynamic balance control in children with probable Developmental Coordination Disorder and balance problems. Hum Mov Sci 2014 Feb;33:404-418. [doi: 10.1016/j.humov.2013.12.007] [Medline: 24444657]"
    },
    {
      "title": "An Internet-based store-and-forward video home telehealth system for improving asthma outcomes in children",
      "authors": [
        "D Chan",
        "C Callahan",
        "S Sheets",
        "C Moreno",
        "F Malone"
      ],
      "year": 2003,
      "doi": "10.1093/ajhp/60.19.1976",
      "journal": "Am J Health Syst Pharm",
      "volume": "60",
      "issue": "19",
      "raw": "An Internet-based store-and-forward video home telehealth system for improving asthma outcomes in children \n\t\t \n\t\t\t D S Chan \n\t\t \n\t\t \n\t\t\t C W Callahan \n\t\t \n\t\t \n\t\t\t S J Sheets \n\t\t \n\t\t \n\t\t\t C N Moreno \n\t\t \n\t\t \n\t\t\t F J Malone \n\t\t \n\t\t 10.1093/ajhp/60.19.1976 \n\t\t Medline: 14531243 \n\t \n\t \n\t\t Am J Health Syst Pharm \n\t\t \n\t\t\t 60 \n\t\t\t 19 \n\t\t\t \n\t\t\t 2003 Oct 1 \n\t\t \n\t \n\t Chan DS, Callahan CW, Sheets SJ, Moreno CN, Malone FJ. An Internet-based store-and-forward video home telehealth system for improving asthma outcomes in children. Am J Health Syst Pharm 2003 Oct 1;60(19):1976-1981. [Medline: 14531243]"
    },
    {
      "title": "Agreement between telerehabilitation involving caregivers and face-to-face clinical assessment of lymphedema in breast cancer survivors",
      "authors": [
        "N Galiano-Castillo",
        "A Ariza-Garc\u00eda",
        "Cantarero- Villanueva",
        "I Fern\u00e1ndez-Lao",
        "C S\u00e1nchez-Salado",
        "C Arroyo-Morales"
      ],
      "year": 2014,
      "doi": "10.1007/s00520-013-1971-8",
      "journal": "Support Care Cancer",
      "volume": "22",
      "issue": "1",
      "raw": "Agreement between telerehabilitation involving caregivers and face-to-face clinical assessment of lymphedema in breast cancer survivors \n\t\t \n\t\t\t N Galiano-Castillo \n\t\t \n\t\t \n\t\t\t A Ariza-Garc\u00eda \n\t\t \n\t\t \n\t\t\t Cantarero- Villanueva \n\t\t \n\t\t \n\t\t\t I Fern\u00e1ndez-Lao \n\t\t \n\t\t \n\t\t\t C S\u00e1nchez-Salado \n\t\t \n\t\t \n\t\t\t C Arroyo-Morales \n\t\t \n\t\t \n\t\t\t M \n\t\t \n\t\t 10.1007/s00520-013-1971-8 \n\t\t Medline: 24043290 \n\t \n\t \n\t\t Support Care Cancer \n\t\t \n\t\t\t 22 \n\t\t\t 1 \n\t\t\t \n\t\t\t 2014 Jan \n\t\t \n\t \n\t Galiano-Castillo N, Ariza-Garc\u00eda A, Cantarero-Villanueva I, Fern\u00e1ndez-Lao C, S\u00e1nchez-Salado C, Arroyo-Morales M. Agreement between telerehabilitation involving caregivers and face-to-face clinical assessment of lymphedema in breast cancer survivors. Support Care Cancer 2014 Jan;22(1):253-258. [doi: 10.1007/s00520-013-1971-8] [Medline: 24043290]"
    },
    {
      "title": "Baby CareLink: using the internet and telemedicine to improve care for high-risk infants",
      "authors": [
        "J Gray",
        "C Safran",
        "R Davis",
        "G Pompilio-Weitzner",
        "J Stewart",
        "L Zaccagnini"
      ],
      "year": 2000,
      "journal": "Pediatrics",
      "volume": "106",
      "issue": "6",
      "raw": "Baby CareLink: using the internet and telemedicine to improve care for high-risk infants \n\t\t \n\t\t\t J E Gray \n\t\t \n\t\t \n\t\t\t C Safran \n\t\t \n\t\t \n\t\t\t R B Davis \n\t\t \n\t\t \n\t\t\t G Pompilio-Weitzner \n\t\t \n\t\t \n\t\t\t J E Stewart \n\t\t \n\t\t \n\t\t\t L Zaccagnini \n\t\t \n\t\t Medline: 11099583 \n\t \n\t \n\t\t Pediatrics \n\t\t \n\t\t\t 106 \n\t\t\t 6 \n\t\t\t \n\t\t\t 2000 Dec \n\t\t \n\t \n\t Gray JE, Safran C, Davis RB, Pompilio-Weitzner G, Stewart JE, Zaccagnini L, et al. Baby CareLink: using the internet and telemedicine to improve care for high-risk infants. Pediatrics 2000 Dec;106(6):1318-1324. [Medline: 11099583]"
    },
    {
      "title": "Telehealth personalized cancer risk communication to motivate colonoscopy in relatives of patients with colorectal cancer: the family CARE Randomized controlled trial",
      "authors": [
        "A Kinney",
        "W Boonyasiriwat",
        "S Walters",
        "L Pappas",
        "A Stroup",
        "M Schwartz"
      ],
      "year": 2014,
      "doi": "10.1200/JCO.2013.51.6765",
      "journal": "J Clin Oncol",
      "volume": "32",
      "issue": "7",
      "raw": "Telehealth personalized cancer risk communication to motivate colonoscopy in relatives of patients with colorectal cancer: the family CARE Randomized controlled trial \n\t\t \n\t\t\t A Y Kinney \n\t\t \n\t\t \n\t\t\t W Boonyasiriwat \n\t\t \n\t\t \n\t\t\t S T Walters \n\t\t \n\t\t \n\t\t\t L M Pappas \n\t\t \n\t\t \n\t\t\t A M Stroup \n\t\t \n\t\t \n\t\t\t M D Schwartz \n\t\t \n\t\t 10.1200/JCO.2013.51.6765 \n\t\t Medline: 24449229 \n\t \n\t \n\t\t J Clin Oncol \n\t\t \n\t\t\t 32 \n\t\t\t 7 \n\t\t\t \n\t\t\t 2014 Mar 1 \n\t\t \n\t \n\t FREE Full text \n\t Kinney AY, Boonyasiriwat W, Walters ST, Pappas LM, Stroup AM, Schwartz MD, et al. Telehealth personalized cancer risk communication to motivate colonoscopy in relatives of patients with colorectal cancer: the family CARE Randomized controlled trial. J Clin Oncol 2014 Mar 1;32(7):654-662 [FREE Full text] [doi: 10.1200/JCO.2013.51.6765] [Medline: 24449229]"
    },
    {
      "title": "Participation of end users in the design of assistive technology for people with mild to severe cognitive problems; the European Rosetta project",
      "authors": [
        "F Meiland",
        "B Hattink",
        "T Overmars-Marx",
        "M De Boer",
        "A Jedlitschka",
        "Pwg Ebben"
      ],
      "year": 2014,
      "doi": "10.1017/s1041610214000088",
      "journal": "Int Psychogeriatr",
      "volume": "26",
      "issue": "5",
      "raw": "Participation of end users in the design of assistive technology for people with mild to severe cognitive problems; the European Rosetta project \n\t\t \n\t\t\t F M Meiland \n\t\t \n\t\t \n\t\t\t B J Hattink \n\t\t \n\t\t \n\t\t\t T Overmars-Marx \n\t\t \n\t\t \n\t\t\t M E De Boer \n\t\t \n\t\t \n\t\t\t A Jedlitschka \n\t\t \n\t\t \n\t\t\t Pwg Ebben \n\t\t \n\t\t 10.1017/s1041610214000088 \n\t\t Medline: 24507571 \n\t \n\t \n\t\t Int Psychogeriatr \n\t\t \n\t\t\t 26 \n\t\t\t 5 \n\t\t\t \n\t\t\t 2014 May \n\t\t \n\t \n\t Meiland FM, Hattink BJ, Overmars-Marx T, de Boer ME, Jedlitschka A, Ebben PWG, et al. Participation of end users in the design of assistive technology for people with mild to severe cognitive problems; the European Rosetta project. Int Psychogeriatr 2014 May;26(5):769-779. [doi: 10.1017/S1041610214000088] [Medline: 24507571]"
    },
    {
      "title": "Examination of prior experience with telehealth and comfort with telehealth technology as a moderator of treatment response for PTSD and depression in veterans",
      "authors": [
        "M Price",
        "D Gros"
      ],
      "year": 2014,
      "doi": "10.2190/PM.48.1.e",
      "journal": "Int J Psychiatry Med",
      "volume": "48",
      "issue": "1",
      "raw": "Examination of prior experience with telehealth and comfort with telehealth technology as a moderator of treatment response for PTSD and depression in veterans \n\t\t \n\t\t\t M Price \n\t\t \n\t\t \n\t\t\t D F Gros \n\t\t \n\t\t 10.2190/PM.48.1.e \n\t\t Medline: 25354926 \n\t \n\t \n\t\t Int J Psychiatry Med \n\t\t \n\t\t\t 48 \n\t\t\t 1 \n\t\t\t \n\t\t\t 2014 \n\t\t \n\t \n\t Price M, Gros DF. Examination of prior experience with telehealth and comfort with telehealth technology as a moderator of treatment response for PTSD and depression in veterans. Int J Psychiatry Med 2014;48(1):57-67. [doi: 10.2190/PM.48.1.e] [Medline: 25354926]"
    },
    {
      "title": "ITAREPS: information technology aided relapse prevention programme in schizophrenia",
      "authors": [
        "F Spaniel",
        "P Vohl\u00eddka",
        "J Hrdlicka",
        "J Kozen\u00fd",
        "T Nov\u00e1k",
        "L Motlov\u00e1"
      ],
      "year": 2008,
      "doi": "10.1016/j.schres.2007.09.005",
      "journal": "Schizophr Res",
      "volume": "98",
      "issue": "1-3",
      "raw": "ITAREPS: information technology aided relapse prevention programme in schizophrenia \n\t\t \n\t\t\t F Spaniel \n\t\t \n\t\t \n\t\t\t P Vohl\u00eddka \n\t\t \n\t\t \n\t\t\t J Hrdlicka \n\t\t \n\t\t \n\t\t\t J Kozen\u00fd \n\t\t \n\t\t \n\t\t\t T Nov\u00e1k \n\t\t \n\t\t \n\t\t\t L Motlov\u00e1 \n\t\t \n\t\t 10.1016/j.schres.2007.09.005 \n\t\t Medline: 17920245 \n\t \n\t \n\t\t Schizophr Res \n\t\t \n\t\t\t 98 \n\t\t\t 1-3 \n\t\t\t \n\t\t\t 2008 Jan \n\t\t \n\t \n\t Spaniel F, Vohl\u00eddka P, Hrdlicka J, Kozen\u00fd J, Nov\u00e1k T, Motlov\u00e1 L, et al. ITAREPS: information technology aided relapse prevention programme in schizophrenia. Schizophr Res 2008 Jan;98(1-3):312-317. [doi: 10.1016/j.schres.2007.09.005] [Medline: 17920245]"
    },
    {
      "title": "Lessened decline in physical activity and impairment of older adults with diabetes with telemedicine and pedometer use: results from the IDEATel study",
      "authors": [
        "R Weinstock",
        "G Brooks",
        "W Palmas",
        "P Morin",
        "J Teresi",
        "J Eimicke"
      ],
      "year": 2011,
      "doi": "10.1093/ageing/afq147",
      "journal": "Age Ageing",
      "volume": "40",
      "issue": "1",
      "raw": "Lessened decline in physical activity and impairment of older adults with diabetes with telemedicine and pedometer use: results from the IDEATel study \n\t\t \n\t\t\t R S Weinstock \n\t\t \n\t\t \n\t\t\t G Brooks \n\t\t \n\t\t \n\t\t\t W Palmas \n\t\t \n\t\t \n\t\t\t P C Morin \n\t\t \n\t\t \n\t\t\t J A Teresi \n\t\t \n\t\t \n\t\t\t J P Eimicke \n\t\t \n\t\t 10.1093/ageing/afq147 \n\t\t Medline: 21081539 \n\t \n\t \n\t\t Age Ageing \n\t\t \n\t\t\t 40 \n\t\t\t 1 \n\t\t\t \n\t\t\t 2011 Jan \n\t\t \n\t \n\t FREE Full text \n\t Weinstock RS, Brooks G, Palmas W, Morin PC, Teresi JA, Eimicke JP, et al. Lessened decline in physical activity and impairment of older adults with diabetes with telemedicine and pedometer use: results from the IDEATel study. Age Ageing 2011 Jan;40(1):98-105 [FREE Full text] [doi: 10.1093/ageing/afq147] [Medline: 21081539]"
    },
    {
      "title": "A randomized controlled trial of Sweet Talk, a text-messaging system to support young people with diabetes",
      "authors": [
        "V Franklin",
        "A Waller",
        "C Pagliari",
        "S Greene"
      ],
      "year": 2006,
      "doi": "10.1111/j.1464-5491.2006.01989.x",
      "journal": "Diabet Med",
      "volume": "23",
      "issue": "12",
      "raw": "A randomized controlled trial of Sweet Talk, a text-messaging system to support young people with diabetes \n\t\t \n\t\t\t V L Franklin \n\t\t \n\t\t \n\t\t\t A Waller \n\t\t \n\t\t \n\t\t\t C Pagliari \n\t\t \n\t\t \n\t\t\t S A Greene \n\t\t \n\t\t 10.1111/j.1464-5491.2006.01989.x \n\t\t Medline: 17116184 \n\t \n\t \n\t\t Diabet Med \n\t\t \n\t\t\t 23 \n\t\t\t 12 \n\t\t\t \n\t\t\t 2006 Dec \n\t\t \n\t \n\t Franklin VL, Waller A, Pagliari C, Greene SA. A randomized controlled trial of Sweet Talk, a text-messaging system to support young people with diabetes. Diabet Med 2006 Dec;23(12):1332-1338. [doi: 10.1111/j.1464-5491.2006.01989.x] [Medline: 17116184]"
    },
    {
      "title": "Incorporating tailored interactive patient solutions using interactive voice response technology to improve statin adherence: results of a randomized clinical trial in a managed care setting",
      "authors": [
        "J Stacy",
        "S Schwartz",
        "D Ershoff",
        "M Shreve"
      ],
      "year": 2009,
      "doi": "10.1089/pop.2008.0046",
      "journal": "Popul Health Manag",
      "volume": "12",
      "issue": "5",
      "raw": "Incorporating tailored interactive patient solutions using interactive voice response technology to improve statin adherence: results of a randomized clinical trial in a managed care setting \n\t\t \n\t\t\t J N Stacy \n\t\t \n\t\t \n\t\t\t S M Schwartz \n\t\t \n\t\t \n\t\t\t D Ershoff \n\t\t \n\t\t \n\t\t\t M S Shreve \n\t\t \n\t\t 10.1089/pop.2008.0046 \n\t\t Medline: 19848566 \n\t \n\t \n\t\t Popul Health Manag \n\t\t \n\t\t\t 12 \n\t\t\t 5 \n\t\t\t \n\t\t\t 2009 Oct \n\t\t \n\t \n\t Stacy JN, Schwartz SM, Ershoff D, Shreve MS. Incorporating tailored interactive patient solutions using interactive voice response technology to improve statin adherence: results of a randomized clinical trial in a managed care setting. Popul Health Manag 2009 Oct;12(5):241-254. [doi: 10.1089/pop.2008.0046] [Medline: 19848566]"
    },
    {
      "title": "Mobile Assessment and Treatment for Schizophrenia (MATS): a pilot trial of an interactive text-messaging intervention for medication adherence, socialization, and auditory hallucinations",
      "authors": [
        "E Granholm",
        "D Ben-Zeev",
        "P Link",
        "K Bradshaw",
        "J Holden"
      ],
      "year": 2012,
      "doi": "10.1093/schbul/sbr155",
      "journal": "Schizophr Bull",
      "volume": "38",
      "issue": "3",
      "raw": "Mobile Assessment and Treatment for Schizophrenia (MATS): a pilot trial of an interactive text-messaging intervention for medication adherence, socialization, and auditory hallucinations \n\t\t \n\t\t\t E Granholm \n\t\t \n\t\t \n\t\t\t D Ben-Zeev \n\t\t \n\t\t \n\t\t\t P C Link \n\t\t \n\t\t \n\t\t\t K R Bradshaw \n\t\t \n\t\t \n\t\t\t J L Holden \n\t\t \n\t\t 10.1093/schbul/sbr155 \n\t\t Medline: 22080492 \n\t \n\t \n\t\t Schizophr Bull \n\t\t \n\t\t\t 38 \n\t\t\t 3 \n\t\t\t \n\t\t\t 2012 May \n\t\t \n\t \n\t FREE Full text \n\t Granholm E, Ben-Zeev D, Link PC, Bradshaw KR, Holden JL. Mobile Assessment and Treatment for Schizophrenia (MATS): a pilot trial of an interactive text-messaging intervention for medication adherence, socialization, and auditory hallucinations. Schizophr Bull 2012 May;38(3):414-425 [FREE Full text] [doi: 10.1093/schbul/sbr155] [Medline: 22080492]"
    },
    {
      "title": "Do u smoke after txt? Results of a randomised trial of smoking cessation using mobile phone text messaging",
      "authors": [
        "A Rodgers",
        "T Corbett",
        "D Bramley",
        "T Riddell",
        "M Wills",
        "R Lin"
      ],
      "year": 2005,
      "doi": "10.1136/tc.2005.011577",
      "journal": "Tob Control",
      "volume": "14",
      "issue": "4",
      "raw": "Do u smoke after txt? Results of a randomised trial of smoking cessation using mobile phone text messaging \n\t\t \n\t\t\t A Rodgers \n\t\t \n\t\t \n\t\t\t T Corbett \n\t\t \n\t\t \n\t\t\t D Bramley \n\t\t \n\t\t \n\t\t\t T Riddell \n\t\t \n\t\t \n\t\t\t M Wills \n\t\t \n\t\t \n\t\t\t R B Lin \n\t\t \n\t\t 10.1136/tc.2005.011577 \n\t\t Medline: 16046689 \n\t \n\t \n\t\t Tob Control \n\t\t \n\t\t\t 14 \n\t\t\t 4 \n\t\t\t \n\t\t\t 2005 Aug \n\t\t \n\t \n\t FREE Full text \n\t Rodgers A, Corbett T, Bramley D, Riddell T, Wills M, Lin RB, et al. Do u smoke after txt? Results of a randomised trial of smoking cessation using mobile phone text messaging. Tob Control 2005 Aug;14(4):255-261 [FREE Full text] [doi: 10.1136/tc.2005.011577] [Medline: 16046689]"
    },
    {
      "title": "Happy ending: a randomized controlled trial of a digital multi-media smoking cessation intervention",
      "authors": [
        "H Brendryen",
        "P Kraft"
      ],
      "year": 2008,
      "doi": "10.1111/j.1360-0443.2007.02119.x",
      "journal": "Addiction",
      "volume": "103",
      "issue": "3",
      "raw": "Happy ending: a randomized controlled trial of a digital multi-media smoking cessation intervention \n\t\t \n\t\t\t H Brendryen \n\t\t \n\t\t \n\t\t\t P Kraft \n\t\t \n\t\t 10.1111/j.1360-0443.2007.02119.x \n\t\t Medline: 18269367 \n\t \n\t \n\t\t Addiction \n\t\t \n\t\t\t 103 \n\t\t\t 3 \n\t\t\t \n\t\t\t 2008 Mar \n\t\t \n\t \n\t discussion 485 \n\t Brendryen H, Kraft P. Happy ending: a randomized controlled trial of a digital multi-media smoking cessation intervention. Addiction 2008 Mar;103(3):478-84; discussion 485. [doi: 10.1111/j.1360-0443.2007.02119.x] [Medline: 18269367]"
    },
    {
      "title": "Using internet and mobile phone technology to deliver an automated physical activity program: randomized controlled trial",
      "authors": [
        "R Hurling",
        "M Catt",
        "M Boni",
        "B Fairley",
        "T Hurst",
        "P Murray"
      ],
      "year": 2007,
      "doi": "10.2196/jmir.9.2.e7",
      "journal": "J Med Internet Res",
      "volume": "9",
      "issue": "2",
      "raw": "Using internet and mobile phone technology to deliver an automated physical activity program: randomized controlled trial \n\t\t \n\t\t\t R Hurling \n\t\t \n\t\t \n\t\t\t M Catt \n\t\t \n\t\t \n\t\t\t M D Boni \n\t\t \n\t\t \n\t\t\t B W Fairley \n\t\t \n\t\t \n\t\t\t T Hurst \n\t\t \n\t\t \n\t\t\t P Murray \n\t\t \n\t\t 10.2196/jmir.9.2.e7 \n\t\t Medline: 17478409 \n\t \n\t \n\t\t J Med Internet Res \n\t\t \n\t\t\t 9 \n\t\t\t 2 \n\t\t\t 2007 \n\t\t \n\t \n\t FREE Full text \n\t Hurling R, Catt M, Boni MD, Fairley BW, Hurst T, Murray P, et al. Using internet and mobile phone technology to deliver an automated physical activity program: randomized controlled trial. J Med Internet Res 2007;9(2):e7 [FREE Full text] [doi: 10.2196/jmir.9.2.e7] [Medline: 17478409]"
    },
    {
      "title": "What's in a message? Delivering sexual health promotion to young people in Australia via text messaging",
      "authors": [
        "J Gold",
        "M Lim",
        "M Hellard",
        "J Hocking",
        "L Keogh"
      ],
      "year": 2010,
      "doi": "10.1186/1471-2458-10-792",
      "journal": "BMC Public Health",
      "volume": "10",
      "pages": "792",
      "raw": "What's in a message? Delivering sexual health promotion to young people in Australia via text messaging \n\t\t \n\t\t\t J Gold \n\t\t \n\t\t \n\t\t\t M C Lim \n\t\t \n\t\t \n\t\t\t M E Hellard \n\t\t \n\t\t \n\t\t\t J S Hocking \n\t\t \n\t\t \n\t\t\t L Keogh \n\t\t \n\t\t 10.1186/1471-2458-10-792 \n\t\t Medline: 21190584 \n\t \n\t \n\t\t BMC Public Health \n\t\t \n\t\t\t 10 \n\t\t\t 792 \n\t\t\t 2010 \n\t\t \n\t \n\t FREE Full text \n\t Gold J, Lim MC, Hellard ME, Hocking JS, Keogh L. What's in a message? Delivering sexual health promotion to young people in Australia via text messaging. BMC Public Health 2010;10:792 [FREE Full text] [doi: 10.1186/1471-2458-10-792] [Medline: 21190584]"
    },
    {
      "title": "Directive and nondirective e-coach support for weight loss in overweight adults",
      "authors": [
        "J Gabriele",
        "B Carpenter",
        "D Tate",
        "E Fisher"
      ],
      "year": 2011,
      "doi": "10.1007/s12160-010-9240-2",
      "journal": "Ann Behav Med",
      "volume": "41",
      "issue": "2",
      "raw": "Directive and nondirective e-coach support for weight loss in overweight adults \n\t\t \n\t\t\t J M Gabriele \n\t\t \n\t\t \n\t\t\t B D Carpenter \n\t\t \n\t\t \n\t\t\t D F Tate \n\t\t \n\t\t \n\t\t\t E B Fisher \n\t\t \n\t\t 10.1007/s12160-010-9240-2 \n\t\t Medline: 21108032 \n\t \n\t \n\t\t Ann Behav Med \n\t\t \n\t\t\t 41 \n\t\t\t 2 \n\t\t\t \n\t\t\t 2011 Apr \n\t\t \n\t \n\t FREE Full text \n\t Gabriele JM, Carpenter BD, Tate DF, Fisher EB. Directive and nondirective e-coach support for weight loss in overweight adults. Ann Behav Med 2011 Apr;41(2):252-263 [FREE Full text] [doi: 10.1007/s12160-010-9240-2] [Medline: 21108032]"
    },
    {
      "title": "An online recovery plan program: can peer coaching increase participation?",
      "authors": [
        "G Simon",
        "E Ludman",
        "L Goodale",
        "D Dykstra",
        "E Stone",
        "D Cutsogeorge"
      ],
      "year": 2011,
      "doi": "10.1176/ps.62.6.pss6206_0666",
      "journal": "Psychiatr Serv",
      "volume": "62",
      "issue": "6",
      "raw": "An online recovery plan program: can peer coaching increase participation? \n\t\t \n\t\t\t G E Simon \n\t\t \n\t\t \n\t\t\t E J Ludman \n\t\t \n\t\t \n\t\t\t L C Goodale \n\t\t \n\t\t \n\t\t\t D M Dykstra \n\t\t \n\t\t \n\t\t\t E Stone \n\t\t \n\t\t \n\t\t\t D Cutsogeorge \n\t\t \n\t\t 10.1176/ps.62.6.pss6206_0666 \n\t\t Medline: 21632737 \n\t \n\t \n\t\t Psychiatr Serv \n\t\t \n\t\t\t 62 \n\t\t\t 6 \n\t\t\t \n\t\t\t 2011 Jun \n\t\t \n\t \n\t FREE Full text \n\t Simon GE, Ludman EJ, Goodale LC, Dykstra DM, Stone E, Cutsogeorge D, et al. An online recovery plan program: can peer coaching increase participation? Psychiatr Serv 2011 Jun;62(6):666-669 [FREE Full text] [doi: 10.1176/ps.62.6.pss6206_0666] [Medline: 21632737]"
    },
    {
      "title": "Effect of computer support on younger women with breast cancer",
      "authors": [
        "D Gustafson",
        "R Hawkins",
        "S Pingree",
        "F Mctavish",
        "N Arora",
        "J Mendenhall"
      ],
      "year": 2001,
      "doi": "10.1046/j.1525-1497.2001.016007435.x",
      "journal": "J Gen Intern Med",
      "volume": "16",
      "issue": "7",
      "raw": "Effect of computer support on younger women with breast cancer \n\t\t \n\t\t\t D H Gustafson \n\t\t \n\t\t \n\t\t\t R Hawkins \n\t\t \n\t\t \n\t\t\t S Pingree \n\t\t \n\t\t \n\t\t\t F Mctavish \n\t\t \n\t\t \n\t\t\t N K Arora \n\t\t \n\t\t \n\t\t\t J Mendenhall \n\t\t \n\t\t 10.1046/j.1525-1497.2001.016007435.x \n\t \n\t \n\t\t J Gen Intern Med \n\t\t \n\t\t\t 16 \n\t\t\t 7 \n\t\t\t \n\t\t\t 2001 Jul 14 \n\t\t \n\t \n\t Gustafson DH, Hawkins R, Pingree S, McTavish F, Arora NK, Mendenhall J, et al. Effect of computer support on younger women with breast cancer. J Gen Intern Med 2001 Jul 14;16(7):435-445. [doi: 10.1046/j.1525-1497.2001.016007435.x]"
    },
    {
      "title": "A video game improves behavioral outcomes in adolescents and young adults with cancer: a randomized trial",
      "authors": [
        "P Kato",
        "S Cole",
        "A Bradlyn",
        "B Pollock"
      ],
      "year": 2008,
      "doi": "10.1542/peds.2007-3134",
      "journal": "Pediatrics",
      "volume": "122",
      "issue": "2",
      "raw": "A video game improves behavioral outcomes in adolescents and young adults with cancer: a randomized trial \n\t\t \n\t\t\t P M Kato \n\t\t \n\t\t \n\t\t\t S W Cole \n\t\t \n\t\t \n\t\t\t A S Bradlyn \n\t\t \n\t\t \n\t\t\t B H Pollock \n\t\t \n\t\t 10.1542/peds.2007-3134 \n\t\t Medline: 18676516 \n\t \n\t \n\t\t Pediatrics \n\t\t \n\t\t\t 122 \n\t\t\t 2 \n\t\t\t \n\t\t\t 2008 Aug \n\t\t \n\t \n\t Kato PM, Cole SW, Bradlyn AS, Pollock BH. A video game improves behavioral outcomes in adolescents and young adults with cancer: a randomized trial. Pediatrics 2008 Aug;122(2):e305-e317. [doi: 10.1542/peds.2007-3134] [Medline: 18676516]"
    },
    {
      "title": "Pilot trial of spirometer games for airway clearance practice in cystic fibrosis",
      "authors": [
        "P Bingham",
        "T Lahiri",
        "T Ashikaga"
      ],
      "year": 2012,
      "doi": "10.4187/respcare.01263",
      "journal": "Respir Care",
      "volume": "57",
      "issue": "8",
      "raw": "Pilot trial of spirometer games for airway clearance practice in cystic fibrosis \n\t\t \n\t\t\t P M Bingham \n\t\t \n\t\t \n\t\t\t T Lahiri \n\t\t \n\t\t \n\t\t\t T Ashikaga \n\t\t \n\t\t 10.4187/respcare.01263 \n\t\t Medline: 22348602 \n\t \n\t \n\t\t Respir Care \n\t\t \n\t\t\t 57 \n\t\t\t 8 \n\t\t\t \n\t\t\t 2012 Aug \n\t\t \n\t \n\t FREE Full text \n\t Bingham PM, Lahiri T, Ashikaga T. Pilot trial of spirometer games for airway clearance practice in cystic fibrosis. Respir Care 2012 Aug;57(8):1278-1284 [FREE Full text] [doi: 10.4187/respcare.01263] [Medline: 22348602]"
    },
    {
      "title": "Effectiveness of home blood pressure monitoring, Web communication, and pharmacist care on hypertension control: a randomized controlled trial",
      "authors": [
        "B Green",
        "A Cook",
        "J Ralston",
        "P Fishman",
        "S Catz",
        "J Carlson"
      ],
      "year": 2008,
      "doi": "10.1001/jama.299.24.2857",
      "journal": "JAMA",
      "volume": "299",
      "issue": "24",
      "raw": "Effectiveness of home blood pressure monitoring, Web communication, and pharmacist care on hypertension control: a randomized controlled trial \n\t\t \n\t\t\t B B Green \n\t\t \n\t\t \n\t\t\t A J Cook \n\t\t \n\t\t \n\t\t\t J D Ralston \n\t\t \n\t\t \n\t\t\t P A Fishman \n\t\t \n\t\t \n\t\t\t S L Catz \n\t\t \n\t\t \n\t\t\t J Carlson \n\t\t \n\t\t 10.1001/jama.299.24.2857 \n\t\t Medline: 18577730 \n\t \n\t \n\t\t JAMA \n\t\t \n\t\t\t 299 \n\t\t\t 24 \n\t\t\t \n\t\t\t 2008 Jun 25 \n\t\t \n\t \n\t FREE Full text \n\t Green BB, Cook AJ, Ralston JD, Fishman PA, Catz SL, Carlson J, et al. Effectiveness of home blood pressure monitoring, Web communication, and pharmacist care on hypertension control: a randomized controlled trial. JAMA 2008 Jun 25;299(24):2857-2867 [FREE Full text] [doi: 10.1001/jama.299.24.2857] [Medline: 18577730]"
    },
    {
      "title": "Feasibility of the Diabetes and Technology for Increased Activity (DaTA) Study: a pilot intervention in high-risk rural adults",
      "authors": [
        "E Read"
      ],
      "year": 2014,
      "doi": "10.1123/jpah.2011-0381",
      "journal": "J Phys Act Health",
      "volume": "11",
      "issue": "1",
      "raw": "Feasibility of the Diabetes and Technology for Increased Activity (DaTA) Study: a pilot intervention in high-risk rural adults \n\t\t \n\t\t\t E Read \n\t\t \n\t\t 10.1123/jpah.2011-0381 \n\t\t Medline: 23249608 \n\t \n\t \n\t\t J Phys Act Health \n\t\t \n\t\t\t 11 \n\t\t\t 1 \n\t\t\t \n\t\t\t 2014 Jan \n\t\t \n\t \n\t Read E. Feasibility of the Diabetes and Technology for Increased Activity (DaTA) Study: a pilot intervention in high-risk rural adults. J Phys Act Health 2014 Jan;11(1):118-126. [doi: 10.1123/jpah.2011-0381] [Medline: 23249608]"
    },
    {
      "title": "Text messaging reduces HIV risk behaviors among methamphetamine-using men who have sex with men",
      "authors": [
        "C Reback",
        "D Grant",
        "J Fletcher",
        "C Branson",
        "S Shoptaw",
        "J Bowers"
      ],
      "year": 2012,
      "doi": "10.1007/s10461-012-0200-7",
      "journal": "AIDS Behav",
      "volume": "16",
      "issue": "7",
      "raw": "Text messaging reduces HIV risk behaviors among methamphetamine-using men who have sex with men \n\t\t \n\t\t\t C J Reback \n\t\t \n\t\t \n\t\t\t D L Grant \n\t\t \n\t\t \n\t\t\t J B Fletcher \n\t\t \n\t\t \n\t\t\t C M Branson \n\t\t \n\t\t \n\t\t\t S Shoptaw \n\t\t \n\t\t \n\t\t\t J R Bowers \n\t\t \n\t\t 10.1007/s10461-012-0200-7 \n\t\t Medline: 22610370 \n\t \n\t \n\t\t AIDS Behav \n\t\t \n\t\t\t 16 \n\t\t\t 7 \n\t\t\t \n\t\t\t 2012 Oct \n\t\t \n\t \n\t Reback CJ, Grant DL, Fletcher JB, Branson CM, Shoptaw S, Bowers JR, et al. Text messaging reduces HIV risk behaviors among methamphetamine-using men who have sex with men. AIDS Behav 2012 Oct;16(7):1993-2002. [doi: 10.1007/s10461-012-0200-7] [Medline: 22610370]"
    },
    {
      "title": "Engagement in a diabetes self-management website: usage patterns and generalizability of program use",
      "authors": [
        "R Glasgow",
        "S Christiansen",
        "D Kurz",
        "D King",
        "T Woolley",
        "A Faber"
      ],
      "year": 2011,
      "doi": "10.2196/jmir.1391",
      "journal": "J Med Internet Res",
      "volume": "13",
      "issue": "1",
      "raw": "Engagement in a diabetes self-management website: usage patterns and generalizability of program use \n\t\t \n\t\t\t R E Glasgow \n\t\t \n\t\t \n\t\t\t S M Christiansen \n\t\t \n\t\t \n\t\t\t D Kurz \n\t\t \n\t\t \n\t\t\t D K King \n\t\t \n\t\t \n\t\t\t T Woolley \n\t\t \n\t\t \n\t\t\t A J Faber \n\t\t \n\t\t 10.2196/jmir.1391 \n\t\t Medline: 21371992 \n\t \n\t \n\t\t J Med Internet Res \n\t\t \n\t\t\t 13 \n\t\t\t 1 \n\t\t\t 2011 \n\t\t \n\t \n\t FREE Full text \n\t Glasgow RE, Christiansen SM, Kurz D, King DK, Woolley T, Faber AJ, et al. Engagement in a diabetes self-management website: usage patterns and generalizability of program use. J Med Internet Res 2011;13(1):e9 [FREE Full text] [doi: 10.2196/jmir.1391] [Medline: 21371992]"
    },
    {
      "title": "Pilot study examining the efficacy of an electronic intervention to promote HIV medication adherence",
      "authors": [
        "K Claborn",
        "T Leffingwell",
        "M Miller",
        "E Meier",
        "J Stephens"
      ],
      "year": 2014,
      "doi": "10.1080/09540121.2013.824534",
      "journal": "AIDS Care",
      "volume": "26",
      "issue": "3",
      "raw": "Pilot study examining the efficacy of an electronic intervention to promote HIV medication adherence \n\t\t \n\t\t\t K R Claborn \n\t\t \n\t\t \n\t\t\t T R Leffingwell \n\t\t \n\t\t \n\t\t\t M B Miller \n\t\t \n\t\t \n\t\t\t E Meier \n\t\t \n\t\t \n\t\t\t J R Stephens \n\t\t \n\t\t 10.1080/09540121.2013.824534 \n\t\t Medline: 23909858 \n\t \n\t \n\t\t AIDS Care \n\t\t \n\t\t\t 26 \n\t\t\t 3 \n\t\t\t \n\t\t\t 2014 \n\t\t \n\t \n\t Claborn KR, Leffingwell TR, Miller MB, Meier E, Stephens JR. Pilot study examining the efficacy of an electronic intervention to promote HIV medication adherence. AIDS Care 2014;26(3):404-409. [doi: 10.1080/09540121.2013.824534] [Medline: 23909858]"
    },
    {
      "title": "Surviving and thriving with cancer using a Web-based health behavior change intervention: randomized controlled trial",
      "authors": [
        "E Bantum",
        "C Albright",
        "K White",
        "J Berenberg",
        "G Layi",
        "P Ritter"
      ],
      "year": 2014,
      "doi": "10.2196/jmir.3020",
      "journal": "J Med Internet Res",
      "volume": "16",
      "issue": "2",
      "pages": "54",
      "raw": "Surviving and thriving with cancer using a Web-based health behavior change intervention: randomized controlled trial \n\t\t \n\t\t\t E O Bantum \n\t\t \n\t\t \n\t\t\t C L Albright \n\t\t \n\t\t \n\t\t\t K K White \n\t\t \n\t\t \n\t\t\t J L Berenberg \n\t\t \n\t\t \n\t\t\t G Layi \n\t\t \n\t\t \n\t\t\t P L Ritter \n\t\t \n\t\t 10.2196/jmir.3020 \n\t\t Medline: 24566820 \n\t \n\t \n\t\t J Med Internet Res \n\t\t \n\t\t\t 16 \n\t\t\t 2 \n\t\t\t 54 \n\t\t\t 2014 \n\t\t \n\t \n\t FREE Full text \n\t Bantum EO, Albright CL, White KK, Berenberg JL, Layi G, Ritter PL, et al. Surviving and thriving with cancer using a Web-based health behavior change intervention: randomized controlled trial. J Med Internet Res 2014;16(2):e54 [FREE Full text] [doi: 10.2196/jmir.3020] [Medline: 24566820]"
    },
    {
      "title": "Health literacy, health information seeking behaviors and internet use among patients attending a private and public clinic in the same geographic area",
      "authors": [
        "N Gutierrez",
        "T Kindratt",
        "P Pagels",
        "B Foster",
        "N Gimpel"
      ],
      "year": 2014,
      "doi": "10.1007/s10900-013-9742-5",
      "journal": "J Community Health",
      "volume": "39",
      "issue": "1",
      "raw": "Health literacy, health information seeking behaviors and internet use among patients attending a private and public clinic in the same geographic area \n\t\t \n\t\t\t N Gutierrez \n\t\t \n\t\t \n\t\t\t T B Kindratt \n\t\t \n\t\t \n\t\t\t P Pagels \n\t\t \n\t\t \n\t\t\t B Foster \n\t\t \n\t\t \n\t\t\t N E Gimpel \n\t\t \n\t\t 10.1007/s10900-013-9742-5 \n\t\t Medline: 23900880 \n\t \n\t \n\t\t J Community Health \n\t\t \n\t\t\t 39 \n\t\t\t 1 \n\t\t\t \n\t\t\t 2014 Feb \n\t\t \n\t \n\t Gutierrez N, Kindratt TB, Pagels P, Foster B, Gimpel NE. Health literacy, health information seeking behaviors and internet use among patients attending a private and public clinic in the same geographic area. J Community Health 2014 Feb;39(1):83-89. [doi: 10.1007/s10900-013-9742-5] [Medline: 23900880]"
    },
    {
      "title": "If we offer it, will they accept? Factors affecting patient use intentions of personal health records and secure messaging",
      "authors": [
        "R Agarwal",
        "C Anderson",
        "J Zarate",
        "C Ward"
      ],
      "year": 2013,
      "doi": "10.2196/jmir.2243",
      "journal": "J Med Internet Res",
      "volume": "15",
      "issue": "2",
      "pages": "43",
      "raw": "If we offer it, will they accept? Factors affecting patient use intentions of personal health records and secure messaging \n\t\t \n\t\t\t R Agarwal \n\t\t \n\t\t \n\t\t\t C Anderson \n\t\t \n\t\t \n\t\t\t J Zarate \n\t\t \n\t\t \n\t\t\t C Ward \n\t\t \n\t\t 10.2196/jmir.2243 \n\t\t Medline: 23470453 \n\t \n\t \n\t\t J Med Internet Res \n\t\t \n\t\t\t 15 \n\t\t\t 2 \n\t\t\t 43 \n\t\t\t 2013 \n\t\t \n\t \n\t FREE Full text \n\t Agarwal R, Anderson C, Zarate J, Ward C. If we offer it, will they accept? Factors affecting patient use intentions of personal health records and secure messaging. J Med Internet Res 2013;15(2):e43 [FREE Full text] [doi: 10.2196/jmir.2243] [Medline: 23470453]"
    },
    {
      "title": "A cohort study of a tailored web intervention for preconception care",
      "authors": [
        "E Agricola",
        "E Pandolfi",
        "M Gonfiantini",
        "F Gesualdo",
        "M Romano",
        "E Carloni"
      ],
      "year": 2014,
      "doi": "10.1186/1472-6947-14-33",
      "journal": "BMC Med Inform Decis Mak",
      "volume": "14",
      "pages": "33",
      "raw": "A cohort study of a tailored web intervention for preconception care \n\t\t \n\t\t\t E Agricola \n\t\t \n\t\t \n\t\t\t E Pandolfi \n\t\t \n\t\t \n\t\t\t M V Gonfiantini \n\t\t \n\t\t \n\t\t\t F Gesualdo \n\t\t \n\t\t \n\t\t\t M Romano \n\t\t \n\t\t \n\t\t\t E Carloni \n\t\t \n\t\t 10.1186/1472-6947-14-33 \n\t\t Medline: 24731520 \n\t \n\t \n\t\t BMC Med Inform Decis Mak \n\t\t \n\t\t\t 14 \n\t\t\t 33 \n\t\t\t 2014 \n\t\t \n\t \n\t FREE Full text \n\t Agricola E, Pandolfi E, Gonfiantini MV, Gesualdo F, Romano M, Carloni E, et al. A cohort study of a tailored web intervention for preconception care. BMC Med Inform Decis Mak 2014;14:33 [FREE Full text] [doi: 10.1186/1472-6947-14-33] [Medline: 24731520]"
    },
    {
      "title": "The effects of a web-based tool on patient-provider communication and satisfaction with hormone therapy: a randomized evaluation",
      "authors": [
        "V Barnabei",
        "O' Connor",
        "J Nimphius",
        "N Vierkant",
        "R Eaker"
      ],
      "year": 2008,
      "doi": "10.1089/jwh.2007.0369",
      "journal": "J Womens Health (Larchmt)",
      "volume": "17",
      "issue": "1",
      "raw": "The effects of a web-based tool on patient-provider communication and satisfaction with hormone therapy: a randomized evaluation \n\t\t \n\t\t\t V M Barnabei \n\t\t \n\t\t \n\t\t\t O' Connor \n\t\t \n\t\t \n\t\t\t J J Nimphius \n\t\t \n\t\t \n\t\t\t N M Vierkant \n\t\t \n\t\t \n\t\t\t R A Eaker \n\t\t \n\t\t \n\t\t\t E D \n\t\t \n\t\t 10.1089/jwh.2007.0369 \n\t\t Medline: 18240991 \n\t \n\t \n\t\t J Womens Health (Larchmt) \n\t\t \n\t\t\t 17 \n\t\t\t 1 \n\t\t\t \n\t\t\t 2008 \n\t\t \n\t \n\t Barnabei VM, O'Connor JJ, Nimphius NM, Vierkant RA, Eaker ED. The effects of a web-based tool on patient-provider communication and satisfaction with hormone therapy: a randomized evaluation. J Womens Health (Larchmt) 2008;17(1):147-158. [doi: 10.1089/jwh.2007.0369] [Medline: 18240991]"
    },
    {
      "title": "HealthATM: personal health cyberinfrastructure for underserved populations",
      "authors": [
        "N Botts",
        "T Horan",
        "B Thoms"
      ],
      "year": 2011,
      "doi": "10.1016/j.amepre.2011.01.016",
      "journal": "Am J Prev Med",
      "volume": "40",
      "issue": "5 Suppl 2",
      "raw": "HealthATM: personal health cyberinfrastructure for underserved populations \n\t\t \n\t\t\t N E Botts \n\t\t \n\t\t \n\t\t\t T A Horan \n\t\t \n\t\t \n\t\t\t B P Thoms \n\t\t \n\t\t 10.1016/j.amepre.2011.01.016 \n\t\t Medline: 21521584 \n\t \n\t \n\t\t Am J Prev Med \n\t\t \n\t\t\t 40 \n\t\t\t 5 Suppl 2 \n\t\t\t \n\t\t\t 2011 May \n\t\t \n\t \n\t Botts NE, Horan TA, Thoms BP. HealthATM: personal health cyberinfrastructure for underserved populations. Am J Prev Med 2011 May;40(5 Suppl 2):S115-S122. [doi: 10.1016/j.amepre.2011.01.016] [Medline: 21521584]"
    },
    {
      "title": "The Computer-Assisted Brief Intervention for Tobacco (CABIT) program: a pilot study",
      "authors": [
        "E Boudreaux",
        "K Bedek",
        "N Byrne",
        "B Baumann",
        "S Lord",
        "G Grissom"
      ],
      "year": 2012,
      "doi": "10.2196/jmir.2074",
      "journal": "J Med Internet Res",
      "volume": "14",
      "issue": "6",
      "pages": "163",
      "raw": "The Computer-Assisted Brief Intervention for Tobacco (CABIT) program: a pilot study \n\t\t \n\t\t\t E D Boudreaux \n\t\t \n\t\t \n\t\t\t K L Bedek \n\t\t \n\t\t \n\t\t\t N J Byrne \n\t\t \n\t\t \n\t\t\t B M Baumann \n\t\t \n\t\t \n\t\t\t S A Lord \n\t\t \n\t\t \n\t\t\t G Grissom \n\t\t \n\t\t 10.2196/jmir.2074 \n\t\t Medline: 23208070 \n\t \n\t \n\t\t J Med Internet Res \n\t\t \n\t\t\t 14 \n\t\t\t 6 \n\t\t\t 163 \n\t\t\t 2012 \n\t\t \n\t \n\t FREE Full text \n\t Boudreaux ED, Bedek KL, Byrne NJ, Baumann BM, Lord SA, Grissom G. The Computer-Assisted Brief Intervention for Tobacco (CABIT) program: a pilot study. J Med Internet Res 2012;14(6):e163 [FREE Full text] [doi: 10.2196/jmir.2074] [Medline: 23208070]"
    },
    {
      "title": "Guided internet-delivered acceptance and commitment therapy for chronic pain patients: a randomized controlled trial",
      "authors": [
        "M Buhrman",
        "A Skoglund",
        "J Husell",
        "K Bergstr\u00f6m",
        "T Gordh",
        "T Hursti"
      ],
      "year": 2013,
      "doi": "10.1016/j.brat.2013.02.010",
      "journal": "Behav Res Ther",
      "volume": "51",
      "issue": "6",
      "raw": "Guided internet-delivered acceptance and commitment therapy for chronic pain patients: a randomized controlled trial \n\t\t \n\t\t\t M Buhrman \n\t\t \n\t\t \n\t\t\t A Skoglund \n\t\t \n\t\t \n\t\t\t J Husell \n\t\t \n\t\t \n\t\t\t K Bergstr\u00f6m \n\t\t \n\t\t \n\t\t\t T Gordh \n\t\t \n\t\t \n\t\t\t T Hursti \n\t\t \n\t\t 10.1016/j.brat.2013.02.010 \n\t\t Medline: 23548250 \n\t \n\t \n\t\t Behav Res Ther \n\t\t \n\t\t\t 51 \n\t\t\t 6 \n\t\t\t \n\t\t\t 2013 Jun \n\t\t \n\t \n\t Buhrman M, Skoglund A, Husell J, Bergstr\u00f6m K, Gordh T, Hursti T, et al. Guided internet-delivered acceptance and commitment therapy for chronic pain patients: a randomized controlled trial. Behav Res Ther 2013 Jun;51(6):307-315. [doi: 10.1016/j.brat.2013.02.010] [Medline: 23548250]"
    },
    {
      "title": "Just-in-time evidence-based e-mail \"reminders\" in home health care: impact on patient outcomes",
      "authors": [
        "P Feldman",
        "C Murtaugh",
        "L Pezzin",
        "M Mcdonald",
        "T Peng"
      ],
      "year": 2005,
      "doi": "10.1111/j.1475-6773.2005.00389.x",
      "journal": "Health Serv Res",
      "volume": "40",
      "issue": "3",
      "raw": "Just-in-time evidence-based e-mail \"reminders\" in home health care: impact on patient outcomes \n\t\t \n\t\t\t P H Feldman \n\t\t \n\t\t \n\t\t\t C M Murtaugh \n\t\t \n\t\t \n\t\t\t L E Pezzin \n\t\t \n\t\t \n\t\t\t M V Mcdonald \n\t\t \n\t\t \n\t\t\t T R Peng \n\t\t \n\t\t 10.1111/j.1475-6773.2005.00389.x \n\t\t Medline: 15960695 \n\t \n\t \n\t\t Health Serv Res \n\t\t \n\t\t\t 40 \n\t\t\t 3 \n\t\t\t \n\t\t\t 2005 Jun \n\t\t \n\t \n\t FREE Full text \n\t Feldman PH, Murtaugh CM, Pezzin LE, McDonald MV, Peng TR. Just-in-time evidence-based e-mail \"reminders\" in home health care: impact on patient outcomes. Health Serv Res 2005 Jun;40(3):865-885 [FREE Full text] [doi: 10.1111/j.1475-6773.2005.00389.x] [Medline: 15960695]"
    },
    {
      "title": "A proof of concept trial of an online psychoeducational program for relatives of both veterans and civilians living with schizophrenia",
      "authors": [
        "S Glynn",
        "E Randolph",
        "T Garrick",
        "A Lui"
      ],
      "year": 2010,
      "doi": "10.2975/33.4.2010.278.287",
      "journal": "Psychiatr Rehabil J",
      "volume": "33",
      "issue": "4",
      "raw": "A proof of concept trial of an online psychoeducational program for relatives of both veterans and civilians living with schizophrenia \n\t\t \n\t\t\t S M Glynn \n\t\t \n\t\t \n\t\t\t E T Randolph \n\t\t \n\t\t \n\t\t\t T Garrick \n\t\t \n\t\t \n\t\t\t A Lui \n\t\t \n\t\t 10.2975/33.4.2010.278.287 \n\t\t Medline: 20374986 \n\t \n\t \n\t\t Psychiatr Rehabil J \n\t\t \n\t\t\t 33 \n\t\t\t 4 \n\t\t\t \n\t\t\t 2010 \n\t\t \n\t \n\t Glynn SM, Randolph ET, Garrick T, Lui A. A proof of concept trial of an online psychoeducational program for relatives of both veterans and civilians living with schizophrenia. Psychiatr Rehabil J 2010;33(4):278-287. [doi: 10.2975/33.4.2010.278.287] [Medline: 20374986]"
    },
    {
      "title": "Use and Impact of eHealth System by Low-income Women With Breast Cancer",
      "authors": [
        "D Gustafson",
        "F Mctavish",
        "W Stengle",
        "D Ballard",
        "R Hawkins",
        "B Shaw"
      ],
      "year": 2005,
      "doi": "10.1080/10810730500263257",
      "journal": "J Health Commun",
      "volume": "10",
      "issue": "Suppl 1",
      "raw": "Use and Impact of eHealth System by Low-income Women With Breast Cancer \n\t\t \n\t\t\t D H Gustafson \n\t\t \n\t\t \n\t\t\t F M Mctavish \n\t\t \n\t\t \n\t\t\t W Stengle \n\t\t \n\t\t \n\t\t\t D Ballard \n\t\t \n\t\t \n\t\t\t R Hawkins \n\t\t \n\t\t \n\t\t\t B R Shaw \n\t\t \n\t\t 10.1080/10810730500263257 \n\t\t Medline: 16377608 \n\t \n\t \n\t\t J Health Commun \n\t\t \n\t\t\t 10 \n\t\t\t Suppl 1 \n\t\t\t \n\t\t\t 2005 \n\t\t \n\t \n\t Gustafson DH, McTavish FM, Stengle W, Ballard D, Hawkins R, Shaw BR, et al. Use and Impact of eHealth System by Low-income Women With Breast Cancer. J Health Commun 2005;10 Suppl 1:195-218. [doi: 10.1080/10810730500263257] [Medline: 16377608]"
    },
    {
      "title": "HealthCall for the smartphone: technology enhancement of brief intervention in HIV alcohol dependent patients",
      "authors": [
        "D Hasin",
        "E Aharonovich",
        "E Greenstein"
      ],
      "year": 2014,
      "doi": "10.1186/1940-0640-9-5",
      "journal": "Addict Sci Clin Pract",
      "volume": "9",
      "issue": "5",
      "raw": "HealthCall for the smartphone: technology enhancement of brief intervention in HIV alcohol dependent patients \n\t\t \n\t\t\t D S Hasin \n\t\t \n\t\t \n\t\t\t E Aharonovich \n\t\t \n\t\t \n\t\t\t E Greenstein \n\t\t \n\t\t 10.1186/1940-0640-9-5 \n\t\t Medline: 24533631 \n\t \n\t \n\t\t Addict Sci Clin Pract \n\t\t \n\t\t\t 9 \n\t\t\t 5 \n\t\t\t 2014 \n\t\t \n\t \n\t FREE Full text \n\t Hasin DS, Aharonovich E, Greenstein E. HealthCall for the smartphone: technology enhancement of brief intervention in HIV alcohol dependent patients. Addict Sci Clin Pract 2014;9:5 [FREE Full text] [doi: 10.1186/1940-0640-9-5] [Medline: 24533631]"
    },
    {
      "title": "Web-based intervention to promote physical activity by sedentary older adults: randomized controlled trial",
      "authors": [
        "A Irvine",
        "V Gelatt",
        "J Seeley",
        "P Macfarlane",
        "J Gau"
      ],
      "year": 2013,
      "doi": "10.2196/jmir.2158",
      "journal": "J Med Internet Res",
      "volume": "15",
      "issue": "2",
      "raw": "Web-based intervention to promote physical activity by sedentary older adults: randomized controlled trial \n\t\t \n\t\t\t A B Irvine \n\t\t \n\t\t \n\t\t\t V A Gelatt \n\t\t \n\t\t \n\t\t\t J R Seeley \n\t\t \n\t\t \n\t\t\t P Macfarlane \n\t\t \n\t\t \n\t\t\t J M Gau \n\t\t \n\t\t 10.2196/jmir.2158 \n\t\t Medline: 23470322 \n\t \n\t \n\t\t J Med Internet Res \n\t\t \n\t\t\t 15 \n\t\t\t 2 \n\t\t\t 2013 \n\t\t \n\t \n\t FREE Full text \n\t Irvine AB, Gelatt VA, Seeley JR, Macfarlane P, Gau JM. Web-based intervention to promote physical activity by sedentary older adults: randomized controlled trial. J Med Internet Res 2013;15(2):e19 [FREE Full text] [doi: 10.2196/jmir.2158] [Medline: 23470322]"
    },
    {
      "title": "Impact of internet use on health-related behaviors and the patient-physician relationship: a survey-based study and review",
      "authors": [
        "S Iverson",
        "K Howard",
        "B Penney"
      ],
      "year": 2008,
      "journal": "J Am Osteopath Assoc",
      "volume": "108",
      "issue": "12",
      "raw": "Impact of internet use on health-related behaviors and the patient-physician relationship: a survey-based study and review \n\t\t \n\t\t\t S A Iverson \n\t\t \n\t\t \n\t\t\t K B Howard \n\t\t \n\t\t \n\t\t\t B K Penney \n\t\t \n\t\t Medline: 19075034 \n\t \n\t \n\t\t J Am Osteopath Assoc \n\t\t \n\t\t\t 108 \n\t\t\t 12 \n\t\t\t \n\t\t\t 2008 Dec \n\t\t \n\t \n\t Iverson SA, Howard KB, Penney BK. Impact of internet use on health-related behaviors and the patient-physician relationship: a survey-based study and review. J Am Osteopath Assoc 2008 Dec;108(12):699-711. [Medline: 19075034]"
    },
    {
      "title": "Internet-enabled interactive multimedia asthma education program: a randomized trial",
      "authors": [
        "S Krishna",
        "B Francisco",
        "E Balas",
        "P K\u00f6nig",
        "G Graff",
        "R Madsen"
      ],
      "year": 2003,
      "doi": "10.1542/peds.111.3.503",
      "journal": "Pediatrics",
      "volume": "111",
      "issue": "3",
      "raw": "Internet-enabled interactive multimedia asthma education program: a randomized trial \n\t\t \n\t\t\t S Krishna \n\t\t \n\t\t \n\t\t\t B D Francisco \n\t\t \n\t\t \n\t\t\t E A Balas \n\t\t \n\t\t \n\t\t\t P K\u00f6nig \n\t\t \n\t\t \n\t\t\t G R Graff \n\t\t \n\t\t \n\t\t\t R W Madsen \n\t\t \n\t\t 10.1542/peds.111.3.503 \n\t\t Medline: 12612228 \n\t \n\t \n\t\t Pediatrics \n\t\t \n\t\t\t 111 \n\t\t\t 3 \n\t\t\t \n\t\t\t 2003 Mar \n\t\t \n\t \n\t Krishna S, Francisco BD, Balas EA, K\u00f6nig P, Graff GR, Madsen RW, et al. Internet-enabled interactive multimedia asthma education program: a randomized trial. Pediatrics 2003 Mar;111(3):503-510. [Medline: 12612228]"
    },
    {
      "title": "Internet use leads cancer patients to be active health care consumers",
      "authors": [
        "C Lee",
        "S Gray",
        "N Lewis"
      ],
      "year": 2010,
      "doi": "10.1016/j.pec.2010.09.004",
      "journal": "Patient Educ Couns",
      "volume": "81",
      "raw": "Internet use leads cancer patients to be active health care consumers \n\t\t \n\t\t\t C J Lee \n\t\t \n\t\t \n\t\t\t S W Gray \n\t\t \n\t\t \n\t\t\t N Lewis \n\t\t \n\t\t 10.1016/j.pec.2010.09.004 \n\t\t Medline: 20889279 \n\t \n\t \n\t\t Patient Educ Couns \n\t\t \n\t\t\t 81 \n\t\t\t \n\t\t\t 2010 Dec \n\t\t \n\t \n\t Suppl FREE Full text \n\t Lee CJ, Gray SW, Lewis N. Internet use leads cancer patients to be active health care consumers. Patient Educ Couns 2010 Dec;81 Suppl:S63-S69 [FREE Full text] [doi: 10.1016/j.pec.2010.09.004] [Medline: 20889279]"
    },
    {
      "title": "Examining cross-source engagement with cancer-related information and its impact on doctor-patient relations",
      "authors": [
        "N Lewis",
        "S Gray",
        "D Freres",
        "R Hornik"
      ],
      "year": 2009,
      "doi": "10.1080/10410230903264030",
      "journal": "Health Commun",
      "volume": "24",
      "issue": "8",
      "raw": "Examining cross-source engagement with cancer-related information and its impact on doctor-patient relations \n\t\t \n\t\t\t N Lewis \n\t\t \n\t\t \n\t\t\t S W Gray \n\t\t \n\t\t \n\t\t\t D R Freres \n\t\t \n\t\t \n\t\t\t R C Hornik \n\t\t \n\t\t 10.1080/10410230903264030 \n\t\t Medline: 20183381 \n\t \n\t \n\t\t Health Commun \n\t\t \n\t\t\t 24 \n\t\t\t 8 \n\t\t\t \n\t\t\t 2009 Dec \n\t\t \n\t \n\t FREE Full text \n\t Lewis N, Gray SW, Freres DR, Hornik RC. Examining cross-source engagement with cancer-related information and its impact on doctor-patient relations. Health Commun 2009 Dec;24(8):723-734 [FREE Full text] [doi: 10.1080/10410230903264030] [Medline: 20183381]"
    },
    {
      "title": "Internet-based chronic disease self-management: a randomized trial",
      "authors": [
        "K Lorig",
        "P Ritter",
        "D Laurent",
        "K Plant"
      ],
      "year": 2006,
      "doi": "10.1097/01.mlr.0000233678.80203.c1",
      "journal": "Med Care",
      "volume": "44",
      "issue": "11",
      "raw": "Internet-based chronic disease self-management: a randomized trial \n\t\t \n\t\t\t K R Lorig \n\t\t \n\t\t \n\t\t\t P L Ritter \n\t\t \n\t\t \n\t\t\t D D Laurent \n\t\t \n\t\t \n\t\t\t K Plant \n\t\t \n\t\t 10.1097/01.mlr.0000233678.80203.c1 \n\t\t Medline: 17063127] 100 \n\t \n\t \n\t\t Med Care \n\t\t \n\t\t\t 44 \n\t\t\t 11 \n\t\t\t \n\t\t\t 2006 Nov \n\t\t \n\t \n\t Lorig KR, Ritter PL, Laurent DD, Plant K. Internet-based chronic disease self-management: a randomized trial. Med Care 2006 Nov;44(11):964-971. [doi: 10.1097/01.mlr.0000233678.80203.c1] [Medline: 17063127] 100"
    },
    {
      "title": "Understanding patient portal use: implications for medication management",
      "authors": [
        "C Osborn",
        "L Mayberry",
        "K Wallston",
        "K Johnson",
        "T Elasy"
      ],
      "year": 2013,
      "doi": "10.2196/jmir.2589",
      "journal": "J Med Internet Res",
      "volume": "15",
      "issue": "7",
      "pages": "133",
      "raw": "Understanding patient portal use: implications for medication management \n\t\t \n\t\t\t C Y Osborn \n\t\t \n\t\t \n\t\t\t L S Mayberry \n\t\t \n\t\t \n\t\t\t K A Wallston \n\t\t \n\t\t \n\t\t\t K B Johnson \n\t\t \n\t\t \n\t\t\t T A Elasy \n\t\t \n\t\t 10.2196/jmir.2589 \n\t\t Medline: 23823974] 101 \n\t \n\t \n\t\t J Med Internet Res \n\t\t \n\t\t\t 15 \n\t\t\t 7 \n\t\t\t 133 \n\t\t\t 2013 \n\t\t \n\t \n\t FREE Full text \n\t Osborn CY, Mayberry LS, Wallston KA, Johnson KB, Elasy TA. Understanding patient portal use: implications for medication management. J Med Internet Res 2013;15(7):e133 [FREE Full text] [doi: 10.2196/jmir.2589] [Medline: 23823974] 101"
    },
    {
      "title": "Applying technology to the treatment of cannabis use disorder: Comparing telephone versus Internet delivery using data from two completed trials",
      "authors": [
        "S Rooke",
        "P Gates",
        "M Norberg",
        "J Copeland"
      ],
      "year": 2014,
      "doi": "10.1016/j.jsat.2013.08.007",
      "journal": "J Subst Abuse Treat",
      "volume": "46",
      "issue": "1",
      "raw": "Applying technology to the treatment of cannabis use disorder: Comparing telephone versus Internet delivery using data from two completed trials \n\t\t \n\t\t\t S Rooke \n\t\t \n\t\t \n\t\t\t P Gates \n\t\t \n\t\t \n\t\t\t M Norberg \n\t\t \n\t\t \n\t\t\t J Copeland \n\t\t \n\t\t 10.1016/j.jsat.2013.08.007 \n\t \n\t \n\t\t J Subst Abuse Treat \n\t\t \n\t\t\t 46 \n\t\t\t 1 \n\t\t\t \n\t\t\t 2014 \n\t\t \n\t \n\t Rooke S, Gates P, Norberg M, Copeland J. Applying technology to the treatment of cannabis use disorder: Comparing telephone versus Internet delivery using data from two completed trials. J Subst Abuse Treat 2014;46(1):78-84. [doi: 10.1016/j.jsat.2013.08.007] 102"
    },
    {
      "title": "Providing a web-based online medical record with electronic communication capabilities to patients with congestive heart failure: randomized trial",
      "authors": [
        "S Ross",
        "L Moore",
        "M Earnest",
        "L Wittevrongel",
        "C Lin"
      ],
      "year": 2004,
      "doi": "10.2196/jmir.6.2.e12",
      "journal": "J Med Internet Res",
      "volume": "6",
      "issue": "2",
      "raw": "Providing a web-based online medical record with electronic communication capabilities to patients with congestive heart failure: randomized trial \n\t\t \n\t\t\t S E Ross \n\t\t \n\t\t \n\t\t\t L A Moore \n\t\t \n\t\t \n\t\t\t M A Earnest \n\t\t \n\t\t \n\t\t\t L Wittevrongel \n\t\t \n\t\t \n\t\t\t C T Lin \n\t\t \n\t\t 10.2196/jmir.6.2.e12 \n\t\t Medline: 15249261] 103 \n\t \n\t \n\t\t J Med Internet Res \n\t\t \n\t\t\t 6 \n\t\t\t 2 \n\t\t\t 2004 May 14 \n\t\t \n\t \n\t FREE Full text \n\t Ross SE, Moore LA, Earnest MA, Wittevrongel L, Lin CT. Providing a web-based online medical record with electronic communication capabilities to patients with congestive heart failure: randomized trial. J Med Internet Res 2004 May 14;6(2):e12 [FREE Full text] [doi: 10.2196/jmir.6.2.e12] [Medline: 15249261] 103"
    },
    {
      "title": "Improving diabetes management with a patient portal: a qualitative study of diabetes self-management portal",
      "authors": [
        "S Urowitz",
        "D Wiljer",
        "K Dupak",
        "Z Kuehner",
        "K Leonard",
        "E Lovrics"
      ],
      "year": 2012,
      "doi": "10.2196/jmir.2265",
      "journal": "J Med Internet Res",
      "volume": "14",
      "issue": "6",
      "pages": "158",
      "raw": "Improving diabetes management with a patient portal: a qualitative study of diabetes self-management portal \n\t\t \n\t\t\t S Urowitz \n\t\t \n\t\t \n\t\t\t D Wiljer \n\t\t \n\t\t \n\t\t\t K Dupak \n\t\t \n\t\t \n\t\t\t Z Kuehner \n\t\t \n\t\t \n\t\t\t K Leonard \n\t\t \n\t\t \n\t\t\t E Lovrics \n\t\t \n\t\t 10.2196/jmir.2265 \n\t\t Medline: 23195925] 104 \n\t \n\t \n\t\t J Med Internet Res \n\t\t \n\t\t\t 14 \n\t\t\t 6 \n\t\t\t 158 \n\t\t\t 2012 \n\t\t \n\t \n\t FREE Full text \n\t Urowitz S, Wiljer D, Dupak K, Kuehner Z, Leonard K, Lovrics E, et al. Improving diabetes management with a patient portal: a qualitative study of diabetes self-management portal. J Med Internet Res 2012;14(6):e158 [FREE Full text] [doi: 10.2196/jmir.2265] [Medline: 23195925] 104"
    },
    {
      "title": "Engagement and satisfaction with an Internet-based physical activity intervention in patients with rheumatoid arthritis",
      "authors": [
        "M Van Den Berg",
        "H Ronday",
        "A Peeters",
        "E Voogt-Van Der Harst",
        "M Munneke",
        "F Breedveld"
      ],
      "year": 2007,
      "doi": "10.1093/rheumatology/kel341",
      "journal": "Rheumatology",
      "volume": "46",
      "issue": "3",
      "raw": "Engagement and satisfaction with an Internet-based physical activity intervention in patients with rheumatoid arthritis \n\t\t \n\t\t\t M H Van Den Berg \n\t\t \n\t\t \n\t\t\t H K Ronday \n\t\t \n\t\t \n\t\t\t A J Peeters \n\t\t \n\t\t \n\t\t\t E M Voogt-Van Der Harst \n\t\t \n\t\t \n\t\t\t M Munneke \n\t\t \n\t\t \n\t\t\t F C Breedveld \n\t\t \n\t\t 10.1093/rheumatology/kel341 \n\t\t Medline: 17043050] 105 \n\t \n\t \n\t\t Rheumatology \n\t\t \n\t\t\t 46 \n\t\t\t 3 \n\t\t\t \n\t\t\t 2007 Mar \n\t\t\t Oxford \n\t\t \n\t \n\t FREE Full text \n\t van den Berg MH, Ronday HK, Peeters AJ, Voogt-van der Harst EM, Munneke M, Breedveld FC, et al. Engagement and satisfaction with an Internet-based physical activity intervention in patients with rheumatoid arthritis. Rheumatology (Oxford) 2007 Mar;46(3):545-552 [FREE Full text] [doi: 10.1093/rheumatology/kel341] [Medline: 17043050] 105"
    },
    {
      "title": "The development, feasibility and acceptability of an Internet-based STI-HIV prevention intervention for young Chilean women",
      "authors": [
        "N Villegas",
        "D Santisteban",
        "R Cianelli",
        "L Ferrer",
        "T Ambrosia",
        "N Peragallo"
      ],
      "year": 2014,
      "doi": "10.1111/inr.12080",
      "journal": "Int Nurs Rev",
      "volume": "61",
      "issue": "1",
      "raw": "The development, feasibility and acceptability of an Internet-based STI-HIV prevention intervention for young Chilean women \n\t\t \n\t\t\t N Villegas \n\t\t \n\t\t \n\t\t\t D Santisteban \n\t\t \n\t\t \n\t\t\t R Cianelli \n\t\t \n\t\t \n\t\t\t L Ferrer \n\t\t \n\t\t \n\t\t\t T Ambrosia \n\t\t \n\t\t \n\t\t\t N Peragallo \n\t\t \n\t\t 10.1111/inr.12080 \n\t\t Medline: 24512261] 106 \n\t \n\t \n\t\t Int Nurs Rev \n\t\t \n\t\t\t 61 \n\t\t\t 1 \n\t\t\t \n\t\t\t 2014 Mar \n\t\t \n\t \n\t FREE Full text \n\t Villegas N, Santisteban D, Cianelli R, Ferrer L, Ambrosia T, Peragallo N, et al. The development, feasibility and acceptability of an Internet-based STI-HIV prevention intervention for young Chilean women. Int Nurs Rev 2014 Mar;61(1):55-63 [FREE Full text] [doi: 10.1111/inr.12080] [Medline: 24512261] 106"
    },
    {
      "title": "Effectiveness of an Internet-based program for reducing risk factors for eating disorders",
      "authors": [
        "A Winzelberg",
        "D Eppstein",
        "K Eldredge",
        "D Wilfley",
        "R Dasmahapatra",
        "P Dev"
      ],
      "year": 2000,
      "journal": "J Consult Clin Psychol",
      "volume": "68",
      "issue": "2",
      "raw": "Effectiveness of an Internet-based program for reducing risk factors for eating disorders \n\t\t \n\t\t\t A J Winzelberg \n\t\t \n\t\t \n\t\t\t D Eppstein \n\t\t \n\t\t \n\t\t\t K L Eldredge \n\t\t \n\t\t \n\t\t\t D Wilfley \n\t\t \n\t\t \n\t\t\t R Dasmahapatra \n\t\t \n\t\t \n\t\t\t P Dev \n\t\t \n\t\t Medline: 10780136] 107 \n\t \n\t \n\t\t J Consult Clin Psychol \n\t\t \n\t\t\t 68 \n\t\t\t 2 \n\t\t\t \n\t\t\t 2000 Apr \n\t\t \n\t \n\t Winzelberg AJ, Eppstein D, Eldredge KL, Wilfley D, Dasmahapatra R, Dev P, et al. Effectiveness of an Internet-based program for reducing risk factors for eating disorders. J Consult Clin Psychol 2000 Apr;68(2):346-350. [Medline: 10780136] 107"
    },
    {
      "title": "Two-way text messaging for health behavior change among human immunodeficiency virus-positive individuals",
      "authors": [
        "L Harris",
        "K Lehavot",
        "D Huh",
        "S Yard",
        "M Andrasik",
        "P Dunbar"
      ],
      "year": 2010,
      "doi": "10.1089/tmj.2010.0050",
      "journal": "Telemed J E Health",
      "volume": "16",
      "issue": "10",
      "raw": "Two-way text messaging for health behavior change among human immunodeficiency virus-positive individuals \n\t\t \n\t\t\t L T Harris \n\t\t \n\t\t \n\t\t\t K Lehavot \n\t\t \n\t\t \n\t\t\t D Huh \n\t\t \n\t\t \n\t\t\t S Yard \n\t\t \n\t\t \n\t\t\t M P Andrasik \n\t\t \n\t\t \n\t\t\t P J Dunbar \n\t\t \n\t\t 10.1089/tmj.2010.0050 \n\t\t Medline: 21087122] 108 \n\t \n\t \n\t\t Telemed J E Health \n\t\t \n\t\t\t 16 \n\t\t\t 10 \n\t\t\t \n\t\t\t 2010 Dec \n\t\t \n\t \n\t FREE Full text \n\t Harris LT, Lehavot K, Huh D, Yard S, Andrasik MP, Dunbar PJ, et al. Two-way text messaging for health behavior change among human immunodeficiency virus-positive individuals. Telemed J E Health 2010 Dec;16(10):1024-1029 [FREE Full text] [doi: 10.1089/tmj.2010.0050] [Medline: 21087122] 108"
    },
    {
      "title": "Mobile phone-based antiretroviral adherence support in Vietnam: feasibility, patient's preference, and willingness-to-pay",
      "authors": [
        "B Tran",
        "S Houston"
      ],
      "year": 2012,
      "doi": "10.1007/s10461-012-0271-5",
      "journal": "AIDS Behav",
      "volume": "16",
      "issue": "7",
      "raw": "Mobile phone-based antiretroviral adherence support in Vietnam: feasibility, patient's preference, and willingness-to-pay \n\t\t \n\t\t\t B X Tran \n\t\t \n\t\t \n\t\t\t S Houston \n\t\t \n\t\t 10.1007/s10461-012-0271-5 \n\t\t Medline: 22814571] 109 \n\t \n\t \n\t\t AIDS Behav \n\t\t \n\t\t\t 16 \n\t\t\t 7 \n\t\t\t \n\t\t\t 2012 Oct \n\t\t \n\t \n\t Tran BX, Houston S. Mobile phone-based antiretroviral adherence support in Vietnam: feasibility, patient's preference, and willingness-to-pay. AIDS Behav 2012 Oct;16(7):1988-1992. [doi: 10.1007/s10461-012-0271-5] [Medline: 22814571] 109"
    },
    {
      "title": "Real-time, contextual intervention using mobile technology to reduce marijuana use among youth: A Pilot Study",
      "authors": [
        "L Shrier",
        "A Rhoads",
        "P Burke",
        "C Walls",
        "E Blood"
      ],
      "year": 2014,
      "doi": "10.1016/j.addbeh.2013.09.028",
      "journal": "Addict Behav",
      "volume": "39",
      "issue": "1",
      "raw": "Real-time, contextual intervention using mobile technology to reduce marijuana use among youth: A Pilot Study \n\t\t \n\t\t\t L A Shrier \n\t\t \n\t\t \n\t\t\t A Rhoads \n\t\t \n\t\t \n\t\t\t P Burke \n\t\t \n\t\t \n\t\t\t C Walls \n\t\t \n\t\t \n\t\t\t E A Blood \n\t\t \n\t\t 10.1016/j.addbeh.2013.09.028 \n\t \n\t \n\t\t Addict Behav \n\t\t \n\t\t\t 39 \n\t\t\t 1 \n\t\t\t \n\t\t\t 2014 \n\t\t \n\t \n\t Shrier LA, Rhoads A, Burke P, Walls C, Blood EA. Real-time, contextual intervention using mobile technology to reduce marijuana use among youth: A Pilot Study. Addict Behav 2014;39(1):173-180. [doi: 10.1016/j.addbeh.2013.09.028] 110"
    },
    {
      "title": "Who gives a tweet: assessing patients' interest in the use of social media for health care",
      "authors": [
        "J Fisher",
        "M Clayton"
      ],
      "year": 2012,
      "doi": "10.1111/j.1741-6787.2012.00243.x",
      "journal": "Worldviews Evid Based Nurs",
      "volume": "9",
      "issue": "2",
      "raw": "Who gives a tweet: assessing patients' interest in the use of social media for health care \n\t\t \n\t\t\t J Fisher \n\t\t \n\t\t \n\t\t\t M Clayton \n\t\t \n\t\t 10.1111/j.1741-6787.2012.00243.x \n\t\t Medline: 22432730] 111 \n\t \n\t \n\t\t Worldviews Evid Based Nurs \n\t\t \n\t\t\t 9 \n\t\t\t 2 \n\t\t\t \n\t\t\t 2012 Apr \n\t\t \n\t \n\t Fisher J, Clayton M. Who gives a tweet: assessing patients' interest in the use of social media for health care. Worldviews Evid Based Nurs 2012 Apr;9(2):100-108. [doi: 10.1111/j.1741-6787.2012.00243.x] [Medline: 22432730] 111"
    },
    {
      "title": "Online social networking by patients with diabetes: a qualitative evaluation of communication with Facebook",
      "authors": [
        "J Greene",
        "N Choudhry",
        "E Kilabuk",
        "W Shrank"
      ],
      "year": 2011,
      "doi": "10.1007/s11606-010-1526-3",
      "journal": "J Gen Intern Med",
      "volume": "26",
      "issue": "3",
      "raw": "Online social networking by patients with diabetes: a qualitative evaluation of communication with Facebook \n\t\t \n\t\t\t J A Greene \n\t\t \n\t\t \n\t\t\t N K Choudhry \n\t\t \n\t\t \n\t\t\t E Kilabuk \n\t\t \n\t\t \n\t\t\t W H Shrank \n\t\t \n\t\t 10.1007/s11606-010-1526-3 \n\t\t Medline: 20945113] 112 \n\t \n\t \n\t\t J Gen Intern Med \n\t\t \n\t\t\t 26 \n\t\t\t 3 \n\t\t\t \n\t\t\t 2011 Mar \n\t\t \n\t \n\t FREE Full text \n\t Greene JA, Choudhry NK, Kilabuk E, Shrank WH. Online social networking by patients with diabetes: a qualitative evaluation of communication with Facebook. J Gen Intern Med 2011 Mar;26(3):287-292 [FREE Full text] [doi: 10.1007/s11606-010-1526-3] [Medline: 20945113] 112"
    },
    {
      "title": "Automated telecommunication-based reminders and adherence with once-daily glaucoma medication dosing: the automated dosing reminder study",
      "authors": [
        "M Boland",
        "D Chang",
        "T Frazier",
        "R Plyler",
        "J Jefferys",
        "D Friedman"
      ],
      "year": 2014,
      "doi": "10.1001/jamaophthalmol.2014.857",
      "journal": "JAMA Ophthalmol",
      "volume": "132",
      "issue": "7",
      "raw": "Automated telecommunication-based reminders and adherence with once-daily glaucoma medication dosing: the automated dosing reminder study \n\t\t \n\t\t\t M V Boland \n\t\t \n\t\t \n\t\t\t D S Chang \n\t\t \n\t\t \n\t\t\t T Frazier \n\t\t \n\t\t \n\t\t\t R Plyler \n\t\t \n\t\t \n\t\t\t J L Jefferys \n\t\t \n\t\t \n\t\t\t D S Friedman \n\t\t \n\t\t 10.1001/jamaophthalmol.2014.857 \n\t\t Medline: 24831037] 113 \n\t \n\t \n\t\t JAMA Ophthalmol \n\t\t \n\t\t\t 132 \n\t\t\t 7 \n\t\t\t \n\t\t\t 2014 Jul \n\t\t \n\t \n\t Boland MV, Chang DS, Frazier T, Plyler R, Jefferys JL, Friedman DS. Automated telecommunication-based reminders and adherence with once-daily glaucoma medication dosing: the automated dosing reminder study. JAMA Ophthalmol 2014 Jul;132(7):845-850. [doi: 10.1001/jamaophthalmol.2014.857] [Medline: 24831037] 113"
    },
    {
      "title": "The effects of a web-based intervention on psychosocial well-being among adults aged 60 and older with diabetes: a randomized trial",
      "authors": [
        "G Bond",
        "R Burr",
        "F Wolf",
        "K Feldt"
      ],
      "year": 2010,
      "doi": "10.1177/0145721710366758",
      "journal": "Diabetes Educ",
      "volume": "36",
      "issue": "3",
      "raw": "The effects of a web-based intervention on psychosocial well-being among adults aged 60 and older with diabetes: a randomized trial \n\t\t \n\t\t\t G E Bond \n\t\t \n\t\t \n\t\t\t R L Burr \n\t\t \n\t\t \n\t\t\t F M Wolf \n\t\t \n\t\t \n\t\t\t K Feldt \n\t\t \n\t\t 10.1177/0145721710366758 \n\t\t Medline: 20375351] 114 \n\t \n\t \n\t\t Diabetes Educ \n\t\t \n\t\t\t 36 \n\t\t\t 3 \n\t\t\t \n\t\t\t 2010 \n\t\t \n\t \n\t Bond GE, Burr RL, Wolf FM, Feldt K. The effects of a web-based intervention on psychosocial well-being among adults aged 60 and older with diabetes: a randomized trial. Diabetes Educ 2010;36(3):446-456. [doi: 10.1177/0145721710366758] [Medline: 20375351] 114"
    },
    {
      "title": "Controlled trial of Internet-based treatment with telephone support for chronic back pain",
      "authors": [
        "M Buhrman",
        "S F\u00e4ltenhag",
        "L Str\u00f6m",
        "G Andersson"
      ],
      "year": 2004,
      "doi": "10.1016/j.pain.2004.07.021",
      "journal": "Pain",
      "volume": "111",
      "issue": "3",
      "raw": "Controlled trial of Internet-based treatment with telephone support for chronic back pain \n\t\t \n\t\t\t M Buhrman \n\t\t \n\t\t \n\t\t\t S F\u00e4ltenhag \n\t\t \n\t\t \n\t\t\t L Str\u00f6m \n\t\t \n\t\t \n\t\t\t G Andersson \n\t\t \n\t\t 10.1016/j.pain.2004.07.021 \n\t\t Medline: 15363881] 115 \n\t \n\t \n\t\t Pain \n\t\t \n\t\t\t 111 \n\t\t\t 3 \n\t\t\t \n\t\t\t 2004 Oct \n\t\t \n\t \n\t Buhrman M, F\u00e4ltenhag S, Str\u00f6m L, Andersson G. Controlled trial of Internet-based treatment with telephone support for chronic back pain. Pain 2004 Oct;111(3):368-377. [doi: 10.1016/j.pain.2004.07.021] [Medline: 15363881] 115"
    },
    {
      "title": "Delivering interventions for depression by using the internet: randomised controlled trial",
      "authors": [
        "H Christensen",
        "K Griffiths",
        "A Jorm"
      ],
      "year": 2004,
      "doi": "10.1136/bmj.37945.566632.ee",
      "journal": "BMJ",
      "volume": "328",
      "issue": "7434",
      "pages": "265",
      "raw": "Delivering interventions for depression by using the internet: randomised controlled trial \n\t\t \n\t\t\t H Christensen \n\t\t \n\t\t \n\t\t\t K M Griffiths \n\t\t \n\t\t \n\t\t\t A F Jorm \n\t\t \n\t\t 10.1136/bmj.37945.566632.ee \n\t\t Medline: 14742346] 116 \n\t \n\t \n\t\t BMJ \n\t\t \n\t\t\t 328 \n\t\t\t 7434 \n\t\t\t 265 \n\t\t\t 2004 Jan 31 \n\t\t \n\t \n\t FREE Full text \n\t Christensen H, Griffiths KM, Jorm AF. Delivering interventions for depression by using the internet: randomised controlled trial. BMJ 2004 Jan 31;328(7434):265 [FREE Full text] [doi: 10.1136/bmj.37945.566632.EE] [Medline: 14742346] 116"
    },
    {
      "title": "No talking, just writing! Efficacy of an Internet-based cognitive behavioral therapy with exposure and response prevention in obsessive compulsive disorder",
      "authors": [
        "N Herbst",
        "U Voderholzer",
        "N Thiel",
        "R Schaub",
        "C Knaevelsrud",
        "S Stracke"
      ],
      "year": 2014,
      "doi": "10.1159/000357570",
      "journal": "Psychother Psychosom",
      "volume": "83",
      "issue": "3",
      "raw": "No talking, just writing! Efficacy of an Internet-based cognitive behavioral therapy with exposure and response prevention in obsessive compulsive disorder \n\t\t \n\t\t\t N Herbst \n\t\t \n\t\t \n\t\t\t U Voderholzer \n\t\t \n\t\t \n\t\t\t N Thiel \n\t\t \n\t\t \n\t\t\t R Schaub \n\t\t \n\t\t \n\t\t\t C Knaevelsrud \n\t\t \n\t\t \n\t\t\t S Stracke \n\t\t \n\t\t 10.1159/000357570 \n\t\t Medline: 24732962] 117 \n\t \n\t \n\t\t Psychother Psychosom \n\t\t \n\t\t\t 83 \n\t\t\t 3 \n\t\t\t \n\t\t\t 2014 \n\t\t \n\t \n\t Herbst N, Voderholzer U, Thiel N, Schaub R, Knaevelsrud C, Stracke S, et al. No talking, just writing! Efficacy of an Internet-based cognitive behavioral therapy with exposure and response prevention in obsessive compulsive disorder. Psychother Psychosom 2014;83(3):165-175. [doi: 10.1159/000357570] [Medline: 24732962] 117"
    },
    {
      "title": "Internet support groups for depression: a 1-year prospective cohort study",
      "authors": [
        "T Houston",
        "L Cooper",
        "D Ford"
      ],
      "year": 2002,
      "doi": "10.1176/appi.ajp.159.12.2062",
      "journal": "Am J Psychiatry",
      "volume": "159",
      "issue": "12",
      "raw": "Internet support groups for depression: a 1-year prospective cohort study \n\t\t \n\t\t\t T K Houston \n\t\t \n\t\t \n\t\t\t L A Cooper \n\t\t \n\t\t \n\t\t\t D E Ford \n\t\t \n\t\t 10.1176/appi.ajp.159.12.2062 \n\t\t Medline: 12450957] 118 \n\t \n\t \n\t\t Am J Psychiatry \n\t\t \n\t\t\t 159 \n\t\t\t 12 \n\t\t\t \n\t\t\t 2002 Dec \n\t\t \n\t \n\t Houston TK, Cooper LA, Ford DE. Internet support groups for depression: a 1-year prospective cohort study. Am J Psychiatry 2002 Dec;159(12):2062-2068. [doi: 10.1176/appi.ajp.159.12.2062] [Medline: 12450957] 118"
    },
    {
      "title": "Randomized control trial of a behavioral intervention for overweight women: impact on depressive symptoms",
      "authors": [
        "J Kerr",
        "K Patrick",
        "G Norman",
        "M Stein",
        "K Calfas",
        "M Zabinski"
      ],
      "year": 2008,
      "doi": "10.1002/da.20320",
      "journal": "Depress Anxiety",
      "volume": "25",
      "issue": "7",
      "raw": "Randomized control trial of a behavioral intervention for overweight women: impact on depressive symptoms \n\t\t \n\t\t\t J Kerr \n\t\t \n\t\t \n\t\t\t K Patrick \n\t\t \n\t\t \n\t\t\t G Norman \n\t\t \n\t\t \n\t\t\t M B Stein \n\t\t \n\t\t \n\t\t\t K Calfas \n\t\t \n\t\t \n\t\t\t M Zabinski \n\t\t \n\t\t 10.1002/da.20320 \n\t\t Medline: 17557319] 119 \n\t \n\t \n\t\t Depress Anxiety \n\t\t \n\t\t\t 25 \n\t\t\t 7 \n\t\t\t \n\t\t\t 2008 \n\t\t \n\t \n\t Kerr J, Patrick K, Norman G, Stein MB, Calfas K, Zabinski M, et al. Randomized control trial of a behavioral intervention for overweight women: impact on depressive symptoms. Depress Anxiety 2008;25(7):555-558. [doi: 10.1002/da.20320] [Medline: 17557319] 119"
    },
    {
      "title": "Web-based psychoeducational intervention for persons with schizophrenia and their supporters: one-year outcomes",
      "authors": [
        "A Rotondi",
        "C Anderson",
        "G Haas",
        "S Eack",
        "M Spring",
        "R Ganguli"
      ],
      "year": 2010,
      "doi": "10.1176/ps.2010.61.11.1099",
      "journal": "Psychiatr Serv",
      "volume": "61",
      "issue": "11",
      "raw": "Web-based psychoeducational intervention for persons with schizophrenia and their supporters: one-year outcomes \n\t\t \n\t\t\t A J Rotondi \n\t\t \n\t\t \n\t\t\t C M Anderson \n\t\t \n\t\t \n\t\t\t G L Haas \n\t\t \n\t\t \n\t\t\t S M Eack \n\t\t \n\t\t \n\t\t\t M B Spring \n\t\t \n\t\t \n\t\t\t R Ganguli \n\t\t \n\t\t 10.1176/ps.2010.61.11.1099 \n\t\t Medline: 21041348] 120 \n\t \n\t \n\t\t Psychiatr Serv \n\t\t \n\t\t\t 61 \n\t\t\t 11 \n\t\t\t \n\t\t\t 2010 Nov \n\t\t \n\t \n\t Rotondi AJ, Anderson CM, Haas GL, Eack SM, Spring MB, Ganguli R, et al. Web-based psychoeducational intervention for persons with schizophrenia and their supporters: one-year outcomes. Psychiatr Serv 2010 Nov;61(11):1099-1105. [doi: 10.1176/ps.2010.61.11.1099] [Medline: 21041348] 120"
    },
    {
      "title": "E-mail: a new technique for forming a therapeutic alliance with high-risk young people failing to engage with mental health services? A case study",
      "authors": [
        "H Roy",
        "T Gillett"
      ],
      "year": 2008,
      "doi": "10.1177/1359104507086344",
      "journal": "Clin Child Psychol Psychiatry",
      "volume": "13",
      "issue": "1",
      "raw": "E-mail: a new technique for forming a therapeutic alliance with high-risk young people failing to engage with mental health services? A case study \n\t\t \n\t\t\t H Roy \n\t\t \n\t\t \n\t\t\t T Gillett \n\t\t \n\t\t 10.1177/1359104507086344 \n\t\t Medline: 18411868] 121 \n\t \n\t \n\t\t Clin Child Psychol Psychiatry \n\t\t \n\t\t\t 13 \n\t\t\t 1 \n\t\t\t \n\t\t\t 2008 Jan \n\t\t \n\t \n\t Roy H, Gillett T. E-mail: a new technique for forming a therapeutic alliance with high-risk young people failing to engage with mental health services? A case study. Clin Child Psychol Psychiatry 2008 Jan;13(1):95-103. [Medline: 18411868] 121."
    },
    {
      "title": "Social media, text messaging, and email-preferences of asthma patients between 12 and 40 years old",
      "authors": [
        "A Baptist",
        "M Thompson",
        "K Grossman",
        "L Mohammed",
        "A Sy",
        "G Sanders"
      ],
      "year": 2011,
      "doi": "10.3109/02770903.2011.608460",
      "journal": "J Asthma",
      "volume": "48",
      "issue": "8",
      "raw": "Social media, text messaging, and email-preferences of asthma patients between 12 and 40 years old \n\t\t \n\t\t\t A P Baptist \n\t\t \n\t\t \n\t\t\t M Thompson \n\t\t \n\t\t \n\t\t\t K S Grossman \n\t\t \n\t\t \n\t\t\t L Mohammed \n\t\t \n\t\t \n\t\t\t A Sy \n\t\t \n\t\t \n\t\t\t G M Sanders \n\t\t \n\t\t 10.3109/02770903.2011.608460 \n\t\t Medline: 21864099] 122 \n\t \n\t \n\t\t J Asthma \n\t\t \n\t\t\t 48 \n\t\t\t 8 \n\t\t\t \n\t\t\t 2011 Oct \n\t\t \n\t \n\t Baptist AP, Thompson M, Grossman KS, Mohammed L, Sy A, Sanders GM. Social media, text messaging, and email-preferences of asthma patients between 12 and 40 years old. J Asthma 2011 Oct;48(8):824-830. [doi: 10.3109/02770903.2011.608460] [Medline: 21864099] 122"
    },
    {
      "title": "Randomized controlled trial of an internet-based versus face-to-face dyspnea self-management program for patients with chronic obstructive pulmonary disease: pilot study",
      "authors": [
        "H Nguyen",
        "D Donesky-Cuenco",
        "S Wolpin",
        "L Reinke",
        "J Benditt",
        "S Paul"
      ],
      "year": 2008,
      "doi": "10.2196/jmir.990",
      "journal": "J Med Internet Res",
      "volume": "10",
      "issue": "2",
      "raw": "Randomized controlled trial of an internet-based versus face-to-face dyspnea self-management program for patients with chronic obstructive pulmonary disease: pilot study \n\t\t \n\t\t\t H Q Nguyen \n\t\t \n\t\t \n\t\t\t D Donesky-Cuenco \n\t\t \n\t\t \n\t\t\t S Wolpin \n\t\t \n\t\t \n\t\t\t L F Reinke \n\t\t \n\t\t \n\t\t\t J O Benditt \n\t\t \n\t\t \n\t\t\t S M Paul \n\t\t \n\t\t 10.2196/jmir.990 \n\t\t Medline: 18417444] 123 \n\t \n\t \n\t\t J Med Internet Res \n\t\t \n\t\t\t 10 \n\t\t\t 2 \n\t\t\t 2008 \n\t\t \n\t \n\t FREE Full text \n\t Nguyen HQ, Donesky-Cuenco D, Wolpin S, Reinke LF, Benditt JO, Paul SM, et al. Randomized controlled trial of an internet-based versus face-to-face dyspnea self-management program for patients with chronic obstructive pulmonary disease: pilot study. J Med Internet Res 2008;10(2):e9 [FREE Full text] [doi: 10.2196/jmir.990] [Medline: 18417444] 123"
    },
    {
      "title": "Improving asthma control through telemedicine: a study of short-message service",
      "authors": [
        "V Ostojic",
        "B Cvoriscec",
        "S Ostojic",
        "D Reznikoff",
        "A Stipic-Markovic",
        "Z Tudjman"
      ],
      "year": 2005,
      "doi": "10.1089/tmj.2005.11.28",
      "journal": "Telemed J E Health",
      "volume": "11",
      "issue": "1",
      "raw": "Improving asthma control through telemedicine: a study of short-message service \n\t\t \n\t\t\t V Ostojic \n\t\t \n\t\t \n\t\t\t B Cvoriscec \n\t\t \n\t\t \n\t\t\t S B Ostojic \n\t\t \n\t\t \n\t\t\t D Reznikoff \n\t\t \n\t\t \n\t\t\t A Stipic-Markovic \n\t\t \n\t\t \n\t\t\t Z Tudjman \n\t\t \n\t\t 10.1089/tmj.2005.11.28 \n\t\t Medline: 15785218] 124 \n\t \n\t \n\t\t Telemed J E Health \n\t\t \n\t\t\t 11 \n\t\t\t 1 \n\t\t\t \n\t\t\t 2005 Feb \n\t\t \n\t \n\t Ostojic V, Cvoriscec B, Ostojic SB, Reznikoff D, Stipic-Markovic A, Tudjman Z. Improving asthma control through telemedicine: a study of short-message service. Telemed J E Health 2005 Feb;11(1):28-35. [doi: 10.1089/tmj.2005.11.28] [Medline: 15785218] 124"
    },
    {
      "title": "A randomized trial comparing human e-mail counseling, computer-automated tailored counseling, and no counseling in an Internet weight loss program",
      "authors": [
        "D Tate",
        "E Jackvony",
        "R Wing"
      ],
      "year": 2006,
      "doi": "10.1001/archinte.166.15.1620",
      "journal": "Arch Intern Med",
      "volume": "166",
      "issue": "15",
      "raw": "A randomized trial comparing human e-mail counseling, computer-automated tailored counseling, and no counseling in an Internet weight loss program \n\t\t \n\t\t\t D F Tate \n\t\t \n\t\t \n\t\t\t E H Jackvony \n\t\t \n\t\t \n\t\t\t R R Wing \n\t\t \n\t\t 10.1001/archinte.166.15.1620 \n\t\t Medline: 16908795] 125 \n\t \n\t \n\t\t Arch Intern Med \n\t\t \n\t\t\t 166 \n\t\t\t 15 \n\t\t\t \n\t\t\t 2006 \n\t\t \n\t \n\t Tate DF, Jackvony EH, Wing RR. A randomized trial comparing human e-mail counseling, computer-automated tailored counseling, and no counseling in an Internet weight loss program. Arch Intern Med 2006;166(15):1620-1625. [doi: 10.1001/archinte.166.15.1620] [Medline: 16908795] 125"
    },
    {
      "title": "The association between weight loss and engagement with a web-based food and exercise diary in a commercial weight loss programme: a retrospective analysis",
      "authors": [
        "F Johnson",
        "J Wardle"
      ],
      "year": 2011,
      "doi": "10.1186/1479-5868-8-83",
      "journal": "Int J Behav Nutr Phys Act",
      "volume": "8",
      "pages": "83",
      "raw": "The association between weight loss and engagement with a web-based food and exercise diary in a commercial weight loss programme: a retrospective analysis \n\t\t \n\t\t\t F Johnson \n\t\t \n\t\t \n\t\t\t J Wardle \n\t\t \n\t\t 10.1186/1479-5868-8-83 \n\t\t Medline: 21810222] 126 \n\t \n\t \n\t\t Int J Behav Nutr Phys Act \n\t\t \n\t\t\t 8 \n\t\t\t 83 \n\t\t\t 2011 \n\t\t \n\t \n\t FREE Full text \n\t Johnson F, Wardle J. The association between weight loss and engagement with a web-based food and exercise diary in a commercial weight loss programme: a retrospective analysis. Int J Behav Nutr Phys Act 2011;8:83 [FREE Full text] [doi: 10.1186/1479-5868-8-83] [Medline: 21810222] 126"
    },
    {
      "title": "Electronic therapeutic contact for adolescent weight management: the Loozit study",
      "authors": [
        "K Kornman",
        "V Shrewsbury",
        "A Chou",
        "B Nguyen",
        "A Lee",
        "O' Connor"
      ],
      "year": 2010,
      "doi": "10.1089/tmj.2009.0180",
      "journal": "Telemed J E Health",
      "volume": "16",
      "issue": "6",
      "raw": "Electronic therapeutic contact for adolescent weight management: the Loozit study \n\t\t \n\t\t\t K P Kornman \n\t\t \n\t\t \n\t\t\t V A Shrewsbury \n\t\t \n\t\t \n\t\t\t A C Chou \n\t\t \n\t\t \n\t\t\t B Nguyen \n\t\t \n\t\t \n\t\t\t A Lee \n\t\t \n\t\t \n\t\t\t O' Connor \n\t\t \n\t\t \n\t\t\t J \n\t\t \n\t\t 10.1089/tmj.2009.0180 \n\t\t Medline: 20575613] 127 \n\t \n\t \n\t\t Telemed J E Health \n\t\t \n\t\t\t 16 \n\t\t\t 6 \n\t\t\t \n\t\t\t 2010 \n\t\t \n\t \n\t Kornman KP, Shrewsbury VA, Chou AC, Nguyen B, Lee A, O'Connor J, et al. Electronic therapeutic contact for adolescent weight management: the Loozit study. Telemed J E Health 2010;16(6):678-685. [doi: 10.1089/tmj.2009.0180] [Medline: 20575613] 127"
    },
    {
      "title": "Evaluation of mobile phone and Internet intervention on waist circumference and blood pressure in post-menopausal women with abdominal obesity",
      "authors": [
        "M Park",
        "H Kim"
      ],
      "year": 2012,
      "doi": "10.1016/j.ijmedinf.2011.12.011",
      "journal": "Int J Med Inform",
      "volume": "81",
      "issue": "6",
      "raw": "Evaluation of mobile phone and Internet intervention on waist circumference and blood pressure in post-menopausal women with abdominal obesity \n\t\t \n\t\t\t M J Park \n\t\t \n\t\t \n\t\t\t H S Kim \n\t\t \n\t\t 10.1016/j.ijmedinf.2011.12.011 \n\t\t Medline: 22265810] 128 \n\t \n\t \n\t\t Int J Med Inform \n\t\t \n\t\t\t 81 \n\t\t\t 6 \n\t\t\t \n\t\t\t 2012 Jun \n\t\t \n\t \n\t Park MJ, Kim HS. Evaluation of mobile phone and Internet intervention on waist circumference and blood pressure in post-menopausal women with abdominal obesity. Int J Med Inform 2012 Jun;81(6):388-394. [doi: 10.1016/j.ijmedinf.2011.12.011] [Medline: 22265810] 128"
    },
    {
      "title": "A text message-based intervention for weight loss: randomized controlled trial",
      "authors": [
        "K Patrick",
        "F Raab",
        "M Adams",
        "L Dillon",
        "M Zabinski",
        "C Rock"
      ],
      "year": 2009,
      "doi": "10.2196/jmir.1100",
      "journal": "J Med Internet Res",
      "volume": "11",
      "issue": "1",
      "raw": "A text message-based intervention for weight loss: randomized controlled trial \n\t\t \n\t\t\t K Patrick \n\t\t \n\t\t \n\t\t\t F Raab \n\t\t \n\t\t \n\t\t\t M A Adams \n\t\t \n\t\t \n\t\t\t L Dillon \n\t\t \n\t\t \n\t\t\t M Zabinski \n\t\t \n\t\t \n\t\t\t C L Rock \n\t\t \n\t\t 10.2196/jmir.1100 \n\t\t Medline: 19141433] 129 \n\t \n\t \n\t\t J Med Internet Res \n\t\t \n\t\t\t 11 \n\t\t\t 1 \n\t\t\t 2009 \n\t\t \n\t \n\t FREE Full text \n\t Patrick K, Raab F, Adams MA, Dillon L, Zabinski M, Rock CL, et al. A text message-based intervention for weight loss: randomized controlled trial. J Med Internet Res 2009;11(1):e1 [FREE Full text] [doi: 10.2196/jmir.1100] [Medline: 19141433] 129"
    },
    {
      "title": "Effectiveness of employee internet-based weight management program",
      "authors": [
        "R Petersen",
        "S Sill",
        "C Lu",
        "J Young",
        "D Edington"
      ],
      "year": 2008,
      "doi": "10.1097/JOM.0b013e31815c6cf6",
      "journal": "J Occup Environ Med",
      "volume": "50",
      "issue": "2",
      "raw": "Effectiveness of employee internet-based weight management program \n\t\t \n\t\t\t R Petersen \n\t\t \n\t\t \n\t\t\t S Sill \n\t\t \n\t\t \n\t\t\t C Lu \n\t\t \n\t\t \n\t\t\t J Young \n\t\t \n\t\t \n\t\t\t D W Edington \n\t\t \n\t\t 10.1097/JOM.0b013e31815c6cf6 \n\t\t Medline: 18301173] 130 \n\t \n\t \n\t\t J Occup Environ Med \n\t\t \n\t\t\t 50 \n\t\t\t 2 \n\t\t\t \n\t\t\t 2008 Feb \n\t\t \n\t \n\t Petersen R, Sill S, Lu C, Young J, Edington DW. Effectiveness of employee internet-based weight management program. J Occup Environ Med 2008 Feb;50(2):163-171. [doi: 10.1097/JOM.0b013e31815c6cf6] [Medline: 18301173] 130"
    },
    {
      "title": "Adherence to self-monitoring via interactive voice response technology in an eHealth intervention targeting weight gain prevention among Black women: randomized controlled trial",
      "authors": [
        "D Steinberg",
        "E Levine",
        "I Lane",
        "S Askew",
        "P Foley",
        "E Puleo"
      ],
      "year": 2014,
      "doi": "10.2196/jmir.2996",
      "journal": "J Med Internet Res",
      "volume": "16",
      "issue": "4",
      "pages": "114",
      "raw": "Adherence to self-monitoring via interactive voice response technology in an eHealth intervention targeting weight gain prevention among Black women: randomized controlled trial \n\t\t \n\t\t\t D M Steinberg \n\t\t \n\t\t \n\t\t\t E L Levine \n\t\t \n\t\t \n\t\t\t I Lane \n\t\t \n\t\t \n\t\t\t S Askew \n\t\t \n\t\t \n\t\t\t P B Foley \n\t\t \n\t\t \n\t\t\t E Puleo \n\t\t \n\t\t 10.2196/jmir.2996 \n\t\t Medline: 24780934] 131 \n\t \n\t \n\t\t J Med Internet Res \n\t\t \n\t\t\t 16 \n\t\t\t 4 \n\t\t\t 114 \n\t\t\t 2014 \n\t\t \n\t \n\t FREE Full text \n\t Steinberg DM, Levine EL, Lane I, Askew S, Foley PB, Puleo E, et al. Adherence to self-monitoring via interactive voice response technology in an eHealth intervention targeting weight gain prevention among Black women: randomized controlled trial. J Med Internet Res 2014;16(4):e114 [FREE Full text] [doi: 10.2196/jmir.2996] [Medline: 24780934] 131"
    },
    {
      "title": "Are we sure that Mobile Health is really mobile? An examination of mobile device use during two remotely-delivered weight loss interventions",
      "authors": [
        "G Turner-Mcgrievy",
        "D Tate"
      ],
      "year": 2014,
      "doi": "10.1016/j.ijmedinf.2014.01.002",
      "journal": "Int J Med Inform",
      "volume": "83",
      "issue": "5",
      "raw": "Are we sure that Mobile Health is really mobile? An examination of mobile device use during two remotely-delivered weight loss interventions \n\t\t \n\t\t\t G M Turner-Mcgrievy \n\t\t \n\t\t \n\t\t\t D F Tate \n\t\t \n\t\t 10.1016/j.ijmedinf.2014.01.002 \n\t\t Medline: 24556530] 132 \n\t \n\t \n\t\t Int J Med Inform \n\t\t \n\t\t\t 83 \n\t\t\t 5 \n\t\t\t \n\t\t\t 2014 May \n\t\t \n\t \n\t FREE Full text \n\t Turner-McGrievy GM, Tate DF. Are we sure that Mobile Health is really mobile? An examination of mobile device use during two remotely-delivered weight loss interventions. Int J Med Inform 2014 May;83(5):313-319 [FREE Full text] [doi: 10.1016/j.ijmedinf.2014.01.002] [Medline: 24556530] 132"
    },
    {
      "title": "Rates and determinants of uptake and use of an internet physical activity and weight management program in office and manufacturing work sites in England: cohort study",
      "authors": [
        "L Ware",
        "R Hurling",
        "O Bataveljic",
        "B Fairley",
        "T Hurst",
        "P Murray"
      ],
      "year": 2008,
      "doi": "10.2196/jmir.1108",
      "journal": "J Med Internet Res",
      "volume": "10",
      "issue": "4",
      "pages": "56",
      "raw": "Rates and determinants of uptake and use of an internet physical activity and weight management program in office and manufacturing work sites in England: cohort study \n\t\t \n\t\t\t L J Ware \n\t\t \n\t\t \n\t\t\t R Hurling \n\t\t \n\t\t \n\t\t\t O Bataveljic \n\t\t \n\t\t \n\t\t\t B W Fairley \n\t\t \n\t\t \n\t\t\t T L Hurst \n\t\t \n\t\t \n\t\t\t P Murray \n\t\t \n\t\t 10.2196/jmir.1108 \n\t\t Medline: 19117828] 133 \n\t \n\t \n\t\t J Med Internet Res \n\t\t \n\t\t\t 10 \n\t\t\t 4 \n\t\t\t 56 \n\t\t\t 2008 \n\t\t \n\t \n\t FREE Full text \n\t Ware LJ, Hurling R, Bataveljic O, Fairley BW, Hurst TL, Murray P, et al. Rates and determinants of uptake and use of an internet physical activity and weight management program in office and manufacturing work sites in England: cohort study. J Med Internet Res 2008;10(4):e56 [FREE Full text] [doi: 10.2196/jmir.1108] [Medline: 19117828] 133"
    },
    {
      "title": "Comparing two web-based smoking cessation programs: randomized controlled trial",
      "authors": [
        "H Mckay",
        "B Danaher",
        "J Seeley",
        "E Lichtenstein",
        "J Gau"
      ],
      "year": 2008,
      "doi": "10.2196/jmir.993",
      "journal": "J Med Internet Res",
      "volume": "10",
      "issue": "5",
      "pages": "40",
      "raw": "Comparing two web-based smoking cessation programs: randomized controlled trial \n\t\t \n\t\t\t H G Mckay \n\t\t \n\t\t \n\t\t\t B G Danaher \n\t\t \n\t\t \n\t\t\t J R Seeley \n\t\t \n\t\t \n\t\t\t E Lichtenstein \n\t\t \n\t\t \n\t\t\t J M Gau \n\t\t \n\t\t 10.2196/jmir.993 \n\t\t Medline: 19017582] 134 \n\t \n\t \n\t\t J Med Internet Res \n\t\t \n\t\t\t 10 \n\t\t\t 5 \n\t\t\t 40 \n\t\t\t 2008 \n\t\t \n\t \n\t FREE Full text \n\t McKay HG, Danaher BG, Seeley JR, Lichtenstein E, Gau JM. Comparing two web-based smoking cessation programs: randomized controlled trial. J Med Internet Res 2008;10(5):e40 [FREE Full text] [doi: 10.2196/jmir.993] [Medline: 19017582] 134"
    },
    {
      "title": "Smoking cessation using mobile phone text messaging is as effective in Maori as non-Maori",
      "authors": [
        "D Bramley",
        "T Riddell",
        "R Whittaker",
        "T Corbett",
        "R Lin",
        "M Wills"
      ],
      "journal": "N Z Med J",
      "volume": "118",
      "pages": "U1494",
      "raw": "Smoking cessation using mobile phone text messaging is as effective in Maori as non-Maori \n\t\t \n\t\t\t D Bramley \n\t\t \n\t\t \n\t\t\t T Riddell \n\t\t \n\t\t \n\t\t\t R Whittaker \n\t\t \n\t\t \n\t\t\t T Corbett \n\t\t \n\t\t \n\t\t\t R B Lin \n\t\t \n\t\t \n\t\t\t M Wills \n\t\t \n\t\t Medline: 15937529] 135 \n\t \n\t \n\t\t N Z Med J \n\t\t \n\t\t\t 118 \n\t\t\t U1494 \n\t\t\t 2005 Jun 3. 1216 \n\t\t \n\t \n\t Bramley D, Riddell T, Whittaker R, Corbett T, Lin RB, Wills M, et al. Smoking cessation using mobile phone text messaging is as effective in Maori as non-Maori. N Z Med J 2005 Jun 3;118(1216):U1494. [Medline: 15937529] 135"
    },
    {
      "title": "Engagement promotes abstinence in a web-based cessation intervention: cohort study",
      "authors": [
        "A Richardson",
        "A Graham",
        "N Cobb",
        "H Xiao",
        "A Mushro",
        "D Abrams"
      ],
      "year": 2013,
      "doi": "10.2196/jmir.2277",
      "journal": "J Med Internet Res",
      "volume": "15",
      "issue": "1",
      "raw": "Engagement promotes abstinence in a web-based cessation intervention: cohort study \n\t\t \n\t\t\t A Richardson \n\t\t \n\t\t \n\t\t\t A L Graham \n\t\t \n\t\t \n\t\t\t N Cobb \n\t\t \n\t\t \n\t\t\t H Xiao \n\t\t \n\t\t \n\t\t\t A Mushro \n\t\t \n\t\t \n\t\t\t D Abrams \n\t\t \n\t\t 10.2196/jmir.2277 \n\t\t Medline: 23353649] 136 \n\t \n\t \n\t\t J Med Internet Res \n\t\t \n\t\t\t 15 \n\t\t\t 1 \n\t\t\t 2013 \n\t\t \n\t \n\t FREE Full text \n\t Richardson A, Graham AL, Cobb N, Xiao H, Mushro A, Abrams D, et al. Engagement promotes abstinence in a web-based cessation intervention: cohort study. J Med Internet Res 2013;15(1):e14 [FREE Full text] [doi: 10.2196/jmir.2277] [Medline: 23353649] 136"
    },
    {
      "title": "The role of engagement in a tailored web-based smoking cessation program: randomized controlled trial",
      "authors": [
        "V Strecher",
        "J Mcclure",
        "G Alexander",
        "B Chakraborty",
        "V Nair",
        "J Konkel"
      ],
      "year": 2008,
      "doi": "10.2196/jmir.1002",
      "journal": "J Med Internet Res",
      "volume": "10",
      "issue": "5",
      "pages": "36",
      "raw": "The role of engagement in a tailored web-based smoking cessation program: randomized controlled trial \n\t\t \n\t\t\t V J Strecher \n\t\t \n\t\t \n\t\t\t J Mcclure \n\t\t \n\t\t \n\t\t\t G Alexander \n\t\t \n\t\t \n\t\t\t B Chakraborty \n\t\t \n\t\t \n\t\t\t V Nair \n\t\t \n\t\t \n\t\t\t J Konkel \n\t\t \n\t\t 10.2196/jmir.1002 \n\t\t Medline: 18984557] 137 \n\t \n\t \n\t\t J Med Internet Res \n\t\t \n\t\t\t 10 \n\t\t\t 5 \n\t\t\t 36 \n\t\t\t 2008 \n\t\t \n\t \n\t FREE Full text \n\t Strecher VJ, McClure J, Alexander G, Chakraborty B, Nair V, Konkel J, et al. The role of engagement in a tailored web-based smoking cessation program: randomized controlled trial. J Med Internet Res 2008;10(5):e36 [FREE Full text] [doi: 10.2196/jmir.1002] [Medline: 18984557] 137"
    },
    {
      "title": "A nurse short message service by cellular phone in type-2 diabetic patients for six months",
      "authors": [
        "H Kim",
        "H Jeong"
      ],
      "year": 2007,
      "doi": "10.1111/j.1365-2702.2007.01698.x",
      "journal": "J Clin Nurs",
      "volume": "16",
      "issue": "6",
      "raw": "A nurse short message service by cellular phone in type-2 diabetic patients for six months \n\t\t \n\t\t\t H S Kim \n\t\t \n\t\t \n\t\t\t H S Jeong \n\t\t \n\t\t 10.1111/j.1365-2702.2007.01698.x \n\t\t Medline: 17518883] 138 \n\t \n\t \n\t\t J Clin Nurs \n\t\t \n\t\t\t 16 \n\t\t\t 6 \n\t\t\t \n\t\t\t 2007 Jun \n\t\t \n\t \n\t Kim HS, Jeong HS. A nurse short message service by cellular phone in type-2 diabetic patients for six months. J Clin Nurs 2007 Jun;16(6):1082-1087. [doi: 10.1111/j.1365-2702.2007.01698.x] [Medline: 17518883] 138"
    },
    {
      "title": "Long-term effect of the Internet-based glucose monitoring system on HbA1c reduction and glucose stability: a 30-month follow-up study for diabetes management with a ubiquitous medical care system",
      "authors": [
        "J Cho",
        "S Chang",
        "H Kwon",
        "Y Choi",
        "S Ko",
        "S Moon"
      ],
      "year": 2006,
      "doi": "10.2337/dc05-2371",
      "journal": "Diabetes Care",
      "volume": "29",
      "issue": "12",
      "raw": "Long-term effect of the Internet-based glucose monitoring system on HbA1c reduction and glucose stability: a 30-month follow-up study for diabetes management with a ubiquitous medical care system \n\t\t \n\t\t\t J H Cho \n\t\t \n\t\t \n\t\t\t S A Chang \n\t\t \n\t\t \n\t\t\t H S Kwon \n\t\t \n\t\t \n\t\t\t Y H Choi \n\t\t \n\t\t \n\t\t\t S H Ko \n\t\t \n\t\t \n\t\t\t S D Moon \n\t\t \n\t\t 10.2337/dc05-2371 \n\t\t Medline: 17130195] 139 \n\t \n\t \n\t\t Diabetes Care \n\t\t \n\t\t\t 29 \n\t\t\t 12 \n\t\t\t \n\t\t\t 2006 Dec \n\t\t \n\t \n\t Cho JH, Chang SA, Kwon HS, Choi YH, Ko SH, Moon SD, et al. Long-term effect of the Internet-based glucose monitoring system on HbA1c reduction and glucose stability: a 30-month follow-up study for diabetes management with a ubiquitous medical care system. Diabetes Care 2006 Dec;29(12):2625-2631. [doi: 10.2337/dc05-2371] [Medline: 17130195] 139"
    },
    {
      "title": "Changes in diabetes distress related to participation in an internet-based diabetes care management program and glycemic control",
      "authors": [
        "S Fonda",
        "G Mcmahon",
        "H Gomes",
        "S Hickson",
        "P Conlin"
      ],
      "year": 2009,
      "doi": "10.1177/193229680900300113",
      "journal": "J Diabetes Sci Technol",
      "volume": "3",
      "issue": "1",
      "raw": "Changes in diabetes distress related to participation in an internet-based diabetes care management program and glycemic control \n\t\t \n\t\t\t S J Fonda \n\t\t \n\t\t \n\t\t\t G T Mcmahon \n\t\t \n\t\t \n\t\t\t H E Gomes \n\t\t \n\t\t \n\t\t\t S Hickson \n\t\t \n\t\t \n\t\t\t P R Conlin \n\t\t \n\t\t 10.1177/193229680900300113 \n\t\t Medline: 20046656] 140 \n\t \n\t \n\t\t J Diabetes Sci Technol \n\t\t \n\t\t\t 3 \n\t\t\t 1 \n\t\t\t \n\t\t\t 2009 Jan \n\t\t \n\t \n\t FREE Full text \n\t Fonda SJ, McMahon GT, Gomes HE, Hickson S, Conlin PR. Changes in diabetes distress related to participation in an internet-based diabetes care management program and glycemic control. J Diabetes Sci Technol 2009 Jan;3(1):117-124 [FREE Full text] [Medline: 20046656] 140"
    },
    {
      "title": "Effectiveness of mobile and internet intervention in patients with obese type 2 diabetes",
      "authors": [
        "C Kim",
        "H Kim"
      ],
      "year": 2008,
      "doi": "10.1016/j.ijmedinf.2007.07.006",
      "journal": "Int J Med Inform",
      "volume": "77",
      "issue": "6",
      "raw": "Effectiveness of mobile and internet intervention in patients with obese type 2 diabetes \n\t\t \n\t\t\t C J Kim \n\t\t \n\t\t \n\t\t\t H S Kim \n\t\t \n\t\t 10.1016/j.ijmedinf.2007.07.006 \n\t\t Medline: 17881285] 141 \n\t \n\t \n\t\t Int J Med Inform \n\t\t \n\t\t\t 77 \n\t\t\t 6 \n\t\t\t \n\t\t\t 2008 Jun \n\t\t \n\t \n\t Kim CJ, Kim HS. Effectiveness of mobile and internet intervention in patients with obese type 2 diabetes. Int J Med Inform 2008 Jun;77(6):399-404. [doi: 10.1016/j.ijmedinf.2007.07.006] [Medline: 17881285] 141"
    },
    {
      "title": "Web-based collaborative care for type 1 diabetes: a pilot randomized trial",
      "authors": [
        "K Mccarrier",
        "J Ralston",
        "I Hirsch",
        "G Lewis",
        "D Martin",
        "F Zimmerman"
      ],
      "year": 2009,
      "doi": "10.1089/dia.2008.0063",
      "journal": "Diabetes Technol Ther",
      "volume": "11",
      "issue": "4",
      "raw": "Web-based collaborative care for type 1 diabetes: a pilot randomized trial \n\t\t \n\t\t\t K P Mccarrier \n\t\t \n\t\t \n\t\t\t J D Ralston \n\t\t \n\t\t \n\t\t\t I B Hirsch \n\t\t \n\t\t \n\t\t\t G Lewis \n\t\t \n\t\t \n\t\t\t D P Martin \n\t\t \n\t\t \n\t\t\t F J Zimmerman \n\t\t \n\t\t 10.1089/dia.2008.0063 \n\t\t Medline: 19344195] 142 \n\t \n\t \n\t\t Diabetes Technol Ther \n\t\t \n\t\t\t 11 \n\t\t\t 4 \n\t\t\t \n\t\t\t 2009 Apr \n\t\t \n\t \n\t FREE Full text \n\t McCarrier KP, Ralston JD, Hirsch IB, Lewis G, Martin DP, Zimmerman FJ, et al. Web-based collaborative care for type 1 diabetes: a pilot randomized trial. Diabetes Technol Ther 2009 Apr;11(4):211-217 [FREE Full text] [doi: 10.1089/dia.2008.0063] [Medline: 19344195] 142"
    },
    {
      "title": "Telemedical support to improve glycemic control in adolescents with type 1 diabetes mellitus",
      "authors": [
        "B Rami",
        "C Popow",
        "W Horn",
        "T Waldhoer",
        "E Schober"
      ],
      "year": 2006,
      "doi": "10.1007/s00431-006-0156-6",
      "journal": "Eur J Pediatr",
      "volume": "165",
      "issue": "10",
      "raw": "Telemedical support to improve glycemic control in adolescents with type 1 diabetes mellitus \n\t\t \n\t\t\t B Rami \n\t\t \n\t\t \n\t\t\t C Popow \n\t\t \n\t\t \n\t\t\t W Horn \n\t\t \n\t\t \n\t\t\t T Waldhoer \n\t\t \n\t\t \n\t\t\t E Schober \n\t\t \n\t\t 10.1007/s00431-006-0156-6 \n\t\t Medline: 16670859] 143 \n\t \n\t \n\t\t Eur J Pediatr \n\t\t \n\t\t\t 165 \n\t\t\t 10 \n\t\t\t \n\t\t\t 2006 Oct \n\t\t \n\t \n\t Rami B, Popow C, Horn W, Waldhoer T, Schober E. Telemedical support to improve glycemic control in adolescents with type 1 diabetes mellitus. Eur J Pediatr 2006 Oct;165(10):701-705. [doi: 10.1007/s00431-006-0156-6] [Medline: 16670859] 143"
    },
    {
      "title": "Web-based care management in patients with poorly controlled diabetes",
      "authors": [
        "G Mcmahon",
        "H Gomes",
        "H Hickson",
        "Tmj Hu",
        "B Levine",
        "P Conlin"
      ],
      "year": 2005,
      "doi": "10.2337/diacare.28.7.1624",
      "journal": "Diabetes Care",
      "volume": "28",
      "issue": "7",
      "raw": "Web-based care management in patients with poorly controlled diabetes \n\t\t \n\t\t\t G T Mcmahon \n\t\t \n\t\t \n\t\t\t H E Gomes \n\t\t \n\t\t \n\t\t\t H S Hickson \n\t\t \n\t\t \n\t\t\t Tmj Hu \n\t\t \n\t\t \n\t\t\t B A Levine \n\t\t \n\t\t \n\t\t\t P R Conlin \n\t\t \n\t\t 10.2337/diacare.28.7.1624 \n\t\t Medline: 15983311] 144 \n\t \n\t \n\t\t Diabetes Care \n\t\t \n\t\t\t 28 \n\t\t\t 7 \n\t\t\t \n\t\t\t 2005 Jul \n\t\t \n\t \n\t FREE Full text \n\t McMahon GT, Gomes HE, Hickson HS, Hu TMJ, Levine BA, Conlin PR. Web-based care management in patients with poorly controlled diabetes. Diabetes Care 2005 Jul;28(7):1624-1629 [FREE Full text] [Medline: 15983311] 144"
    },
    {
      "title": "A controlled trial of web-based diabetes disease management: the MGH diabetes primary care improvement project",
      "authors": [
        "J Meigs",
        "E Cagliero",
        "A Dubey",
        "P Murphy-Sheehy",
        "C Gildesgame",
        "H Chueh"
      ],
      "year": 2003,
      "journal": "Diabetes Care",
      "volume": "26",
      "issue": "3",
      "raw": "A controlled trial of web-based diabetes disease management: the MGH diabetes primary care improvement project \n\t\t \n\t\t\t J B Meigs \n\t\t \n\t\t \n\t\t\t E Cagliero \n\t\t \n\t\t \n\t\t\t A Dubey \n\t\t \n\t\t \n\t\t\t P Murphy-Sheehy \n\t\t \n\t\t \n\t\t\t C Gildesgame \n\t\t \n\t\t \n\t\t\t H Chueh \n\t\t \n\t\t Medline: 12610033] 145 \n\t \n\t \n\t\t Diabetes Care \n\t\t \n\t\t\t 26 \n\t\t\t 3 \n\t\t\t \n\t\t\t 2003 Mar \n\t\t \n\t \n\t Meigs JB, Cagliero E, Dubey A, Murphy-Sheehy P, Gildesgame C, Chueh H, et al. A controlled trial of web-based diabetes disease management: the MGH diabetes primary care improvement project. Diabetes Care 2003 Mar;26(3):750-757. [Medline: 12610033] 145"
    },
    {
      "title": "WellDoc mobile diabetes management randomized controlled trial: change in clinical and behavioral outcomes and patient and physician satisfaction",
      "authors": [
        "C Quinn",
        "S Clough",
        "J Minor",
        "D Lender",
        "M Okafor",
        "A Gruber-Baldini"
      ],
      "year": 2008,
      "doi": "10.1089/dia.2008.0283",
      "journal": "Diabetes Technol Ther",
      "volume": "10",
      "issue": "3",
      "raw": "WellDoc mobile diabetes management randomized controlled trial: change in clinical and behavioral outcomes and patient and physician satisfaction \n\t\t \n\t\t\t C C Quinn \n\t\t \n\t\t \n\t\t\t S S Clough \n\t\t \n\t\t \n\t\t\t J M Minor \n\t\t \n\t\t \n\t\t\t D Lender \n\t\t \n\t\t \n\t\t\t M C Okafor \n\t\t \n\t\t \n\t\t\t A Gruber-Baldini \n\t\t \n\t\t 10.1089/dia.2008.0283 \n\t\t Medline: 18473689] 146 \n\t \n\t \n\t\t Diabetes Technol Ther \n\t\t \n\t\t\t 10 \n\t\t\t 3 \n\t\t\t \n\t\t\t 2008 Jun \n\t\t \n\t \n\t Quinn CC, Clough SS, Minor JM, Lender D, Okafor MC, Gruber-Baldini A. WellDoc mobile diabetes management randomized controlled trial: change in clinical and behavioral outcomes and patient and physician satisfaction. Diabetes Technol Ther 2008 Jun;10(3):160-168. [doi: 10.1089/dia.2008.0283] [Medline: 18473689] 146"
    },
    {
      "title": "Web-based collaborative care for type 2 diabetes: a pilot randomized trial",
      "authors": [
        "J Ralston",
        "I Hirsch",
        "J Hoath",
        "M Mullen",
        "A Cheadle",
        "H Goldberg"
      ],
      "year": 2009,
      "doi": "10.2337/dc08-1220",
      "journal": "Diabetes Care",
      "volume": "32",
      "issue": "2",
      "raw": "Web-based collaborative care for type 2 diabetes: a pilot randomized trial \n\t\t \n\t\t\t J D Ralston \n\t\t \n\t\t \n\t\t\t I B Hirsch \n\t\t \n\t\t \n\t\t\t J Hoath \n\t\t \n\t\t \n\t\t\t M Mullen \n\t\t \n\t\t \n\t\t\t A Cheadle \n\t\t \n\t\t \n\t\t\t H I Goldberg \n\t\t \n\t\t 10.2337/dc08-1220 \n\t\t Medline: 19017773] 147 \n\t \n\t \n\t\t Diabetes Care \n\t\t \n\t\t\t 32 \n\t\t\t 2 \n\t\t\t \n\t\t\t 2009 Feb \n\t\t \n\t \n\t FREE Full text \n\t Ralston JD, Hirsch IB, Hoath J, Mullen M, Cheadle A, Goldberg HI. Web-based collaborative care for type 2 diabetes: a pilot randomized trial. Diabetes Care 2009 Feb;32(2):234-239 [FREE Full text] [doi: 10.2337/dc08-1220] [Medline: 19017773] 147"
    },
    {
      "title": "Mobile phone-based video messages for diabetes self-care support",
      "authors": [
        "A Bell",
        "S Fonda",
        "M Walker",
        "V Schmidt",
        "R Vigersky"
      ],
      "year": 2012,
      "journal": "J Diabetes Sci Technol",
      "volume": "6",
      "issue": "2",
      "raw": "Mobile phone-based video messages for diabetes self-care support \n\t\t \n\t\t\t A M Bell \n\t\t \n\t\t \n\t\t\t S J Fonda \n\t\t \n\t\t \n\t\t\t M S Walker \n\t\t \n\t\t \n\t\t\t V Schmidt \n\t\t \n\t\t \n\t\t\t R A Vigersky \n\t\t \n\t\t Medline: 22538140] 148 \n\t \n\t \n\t\t J Diabetes Sci Technol \n\t\t \n\t\t\t 6 \n\t\t\t 2 \n\t\t\t \n\t\t\t 2012 Mar \n\t\t \n\t \n\t FREE Full text \n\t Bell AM, Fonda SJ, Walker MS, Schmidt V, Vigersky RA. Mobile phone-based video messages for diabetes self-care support. J Diabetes Sci Technol 2012 Mar;6(2):310-319 [FREE Full text] [Medline: 22538140] 148"
    },
    {
      "title": "Impact of MyCareTeam for poorly controlled diabetes mellitus",
      "authors": [
        "K Smith",
        "B Levine",
        "S Clement",
        "M Hu",
        "A Alaoui",
        "S Mun"
      ],
      "year": 2004,
      "doi": "10.1089/dia.2004.6.828",
      "journal": "Diabetes Technol Ther",
      "volume": "6",
      "issue": "6",
      "raw": "Impact of MyCareTeam for poorly controlled diabetes mellitus \n\t\t \n\t\t\t K E Smith \n\t\t \n\t\t \n\t\t\t B A Levine \n\t\t \n\t\t \n\t\t\t S C Clement \n\t\t \n\t\t \n\t\t\t M J Hu \n\t\t \n\t\t \n\t\t\t A Alaoui \n\t\t \n\t\t \n\t\t\t S K Mun \n\t\t \n\t\t 10.1089/dia.2004.6.828 \n\t\t Medline: 15684636] 149 \n\t \n\t \n\t\t Diabetes Technol Ther \n\t\t \n\t\t\t 6 \n\t\t\t 6 \n\t\t\t \n\t\t\t 2004 Dec \n\t\t \n\t \n\t Smith KE, Levine BA, Clement SC, Hu MJ, Alaoui A, Mun SK. Impact of MyCareTeam for poorly controlled diabetes mellitus. Diabetes Technol Ther 2004 Dec;6(6):828-835. [doi: 10.1089/dia.2004.6.828] [Medline: 15684636] 149"
    },
    {
      "title": "What is the frequency of symptomatic mild hypoglycemia in type 1 diabetes in the young?: assessment by novel mobile phone technology and computer-based interviewing",
      "authors": [
        "Apb Tasker",
        "L Gibson",
        "V Franklin",
        "P Gregor",
        "S Greene"
      ],
      "year": 2007,
      "doi": "10.1111/j.1399-5448.2006.00220.x",
      "journal": "Pediatr Diabetes",
      "volume": "8",
      "issue": "1",
      "raw": "What is the frequency of symptomatic mild hypoglycemia in type 1 diabetes in the young?: assessment by novel mobile phone technology and computer-based interviewing \n\t\t \n\t\t\t Apb Tasker \n\t\t \n\t\t \n\t\t\t L Gibson \n\t\t \n\t\t \n\t\t\t V Franklin \n\t\t \n\t\t \n\t\t\t P Gregor \n\t\t \n\t\t \n\t\t\t S Greene \n\t\t \n\t\t 10.1111/j.1399-5448.2006.00220.x \n\t\t Medline: 17341287] 150 \n\t \n\t \n\t\t Pediatr Diabetes \n\t\t \n\t\t\t 8 \n\t\t\t 1 \n\t\t\t \n\t\t\t 2007 Feb \n\t\t \n\t \n\t Tasker APB, Gibson L, Franklin V, Gregor P, Greene S. What is the frequency of symptomatic mild hypoglycemia in type 1 diabetes in the young?: assessment by novel mobile phone technology and computer-based interviewing. Pediatr Diabetes 2007 Feb;8(1):15-20. [doi: 10.1111/j.1399-5448.2006.00220.x] [Medline: 17341287] 150"
    },
    {
      "title": "Use of a shared medical record with secure messaging by older patients with diabetes",
      "authors": [
        "W Weppner",
        "J Ralston",
        "T Koepsell",
        "L Grothaus",
        "R Reid",
        "L Jordan"
      ],
      "year": 2010,
      "doi": "10.2337/dc10-1124",
      "journal": "Diabetes Care",
      "volume": "33",
      "issue": "11",
      "raw": "Use of a shared medical record with secure messaging by older patients with diabetes \n\t\t \n\t\t\t W G Weppner \n\t\t \n\t\t \n\t\t\t J D Ralston \n\t\t \n\t\t \n\t\t\t T D Koepsell \n\t\t \n\t\t \n\t\t\t L C Grothaus \n\t\t \n\t\t \n\t\t\t R J Reid \n\t\t \n\t\t \n\t\t\t L Jordan \n\t\t \n\t\t 10.2337/dc10-1124 \n\t\t Medline: 20739686] 151 \n\t \n\t \n\t\t Diabetes Care \n\t\t \n\t\t\t 33 \n\t\t\t 11 \n\t\t\t \n\t\t\t 2010 Nov \n\t\t \n\t \n\t FREE Full text \n\t Weppner WG, Ralston JD, Koepsell TD, Grothaus LC, Reid RJ, Jordan L, et al. Use of a shared medical record with secure messaging by older patients with diabetes. Diabetes Care 2010 Nov;33(11):2314-2319 [FREE Full text] [doi: 10.2337/dc10-1124] [Medline: 20739686] 151"
    },
    {
      "title": "A short message service by cellular phone in type 2 diabetic patients for 12 months",
      "authors": [
        "K Yoon",
        "H Kim"
      ],
      "year": 2008,
      "doi": "10.1016/j.diabres.2007.09.007",
      "journal": "Diabetes Res Clin Pract",
      "volume": "79",
      "issue": "2",
      "raw": "A short message service by cellular phone in type 2 diabetic patients for 12 months \n\t\t \n\t\t\t K H Yoon \n\t\t \n\t\t \n\t\t\t H S Kim \n\t\t \n\t\t 10.1016/j.diabres.2007.09.007 \n\t\t Medline: 17988756] 152 \n\t \n\t \n\t\t Diabetes Res Clin Pract \n\t\t \n\t\t\t 79 \n\t\t\t 2 \n\t\t\t \n\t\t\t 2008 Feb \n\t\t \n\t \n\t Yoon KH, Kim HS. A short message service by cellular phone in type 2 diabetic patients for 12 months. Diabetes Res Clin Pract 2008 Feb;79(2):256-261. [doi: 10.1016/j.diabres.2007.09.007] [Medline: 17988756] 152"
    },
    {
      "title": "A randomized, placebo-controlled trial of online cognitive behavioral therapy for chronic insomnia disorder delivered via an automated media-rich web application",
      "authors": [
        "C Espie",
        "S Kyle",
        "C Williams",
        "J Ong",
        "N Douglas",
        "P Hames"
      ],
      "year": 2012,
      "doi": "10.5665/sleep.1872",
      "journal": "Sleep",
      "volume": "35",
      "issue": "6",
      "raw": "A randomized, placebo-controlled trial of online cognitive behavioral therapy for chronic insomnia disorder delivered via an automated media-rich web application \n\t\t \n\t\t\t C A Espie \n\t\t \n\t\t \n\t\t\t S D Kyle \n\t\t \n\t\t \n\t\t\t C Williams \n\t\t \n\t\t \n\t\t\t J C Ong \n\t\t \n\t\t \n\t\t\t N J Douglas \n\t\t \n\t\t \n\t\t\t P Hames \n\t\t \n\t\t 10.5665/sleep.1872 \n\t\t Medline: 22654196] 153 \n\t \n\t \n\t\t Sleep \n\t\t \n\t\t\t 35 \n\t\t\t 6 \n\t\t\t \n\t\t\t 2012 Jun \n\t\t \n\t \n\t FREE Full text \n\t Espie CA, Kyle SD, Williams C, Ong JC, Douglas NJ, Hames P, et al. A randomized, placebo-controlled trial of online cognitive behavioral therapy for chronic insomnia disorder delivered via an automated media-rich web application. Sleep 2012 Jun;35(6):769-781 [FREE Full text] [doi: 10.5665/sleep.1872] [Medline: 22654196] 153"
    },
    {
      "title": "Active ambulatory care management supported by short message services and mobile phone technology in patients with arterial hypertension",
      "authors": [
        "A Kiselev",
        "V Gridnev",
        "V Shvartz",
        "O Posnenkova",
        "P Dovgalevsky"
      ],
      "year": 2012,
      "doi": "10.1016/j.jash.2012.08.001",
      "journal": "J Am Soc Hypertens",
      "volume": "6",
      "issue": "5",
      "raw": "Active ambulatory care management supported by short message services and mobile phone technology in patients with arterial hypertension \n\t\t \n\t\t\t A R Kiselev \n\t\t \n\t\t \n\t\t\t V I Gridnev \n\t\t \n\t\t \n\t\t\t V A Shvartz \n\t\t \n\t\t \n\t\t\t O M Posnenkova \n\t\t \n\t\t \n\t\t\t P Y Dovgalevsky \n\t\t \n\t\t 10.1016/j.jash.2012.08.001 \n\t\t Medline: 22995803] 154 \n\t \n\t \n\t\t J Am Soc Hypertens \n\t\t \n\t\t\t 6 \n\t\t\t 5 \n\t\t\t \n\t\t\t 2012 \n\t\t \n\t \n\t Kiselev AR, Gridnev VI, Shvartz VA, Posnenkova OM, Dovgalevsky PY. Active ambulatory care management supported by short message services and mobile phone technology in patients with arterial hypertension. J Am Soc Hypertens 2012;6(5):346-355. [doi: 10.1016/j.jash.2012.08.001] [Medline: 22995803] 154"
    },
    {
      "title": "Cellular phone and Internet-based individual intervention on blood pressure and obesity in obese patients with hypertension",
      "authors": [
        "M Park",
        "H Kim",
        "K Kim"
      ],
      "year": 2009,
      "doi": "10.1016/j.ijmedinf.2009.06.004",
      "journal": "Int J Med Inform",
      "volume": "78",
      "issue": "10",
      "raw": "Cellular phone and Internet-based individual intervention on blood pressure and obesity in obese patients with hypertension \n\t\t \n\t\t\t M J Park \n\t\t \n\t\t \n\t\t\t H S Kim \n\t\t \n\t\t \n\t\t\t K S Kim \n\t\t \n\t\t 10.1016/j.ijmedinf.2009.06.004 \n\t\t Medline: 19643661] 155 \n\t \n\t \n\t\t Int J Med Inform \n\t\t \n\t\t\t 78 \n\t\t\t 10 \n\t\t\t \n\t\t\t 2009 Oct \n\t\t \n\t \n\t Park MJ, Kim HS, Kim KS. Cellular phone and Internet-based individual intervention on blood pressure and obesity in obese patients with hypertension. Int J Med Inform 2009 Oct;78(10):704-710. [doi: 10.1016/j.ijmedinf.2009.06.004] [Medline: 19643661] 155"
    },
    {
      "title": "An mHealth model to increase clinic attendance for breast symptoms in rural Bangladesh: can bridging the digital divide help close the cancer divide?",
      "authors": [
        "O Ginsburg",
        "M Chowdhury",
        "W Wu",
        "T Chowdhury",
        "B Pal",
        "R Hasan"
      ],
      "year": 2014,
      "doi": "10.1634/theoncologist.2013-0314",
      "journal": "Oncologist",
      "volume": "19",
      "issue": "2",
      "raw": "An mHealth model to increase clinic attendance for breast symptoms in rural Bangladesh: can bridging the digital divide help close the cancer divide? \n\t\t \n\t\t\t O M Ginsburg \n\t\t \n\t\t \n\t\t\t M Chowdhury \n\t\t \n\t\t \n\t\t\t W Wu \n\t\t \n\t\t \n\t\t\t T I Chowdhury \n\t\t \n\t\t \n\t\t\t B C Pal \n\t\t \n\t\t \n\t\t\t R Hasan \n\t\t \n\t\t 10.1634/theoncologist.2013-0314 \n\t\t Medline: 24396050] 156 \n\t \n\t \n\t\t Oncologist \n\t\t \n\t\t\t 19 \n\t\t\t 2 \n\t\t\t \n\t\t\t 2014 Feb \n\t\t \n\t \n\t FREE Full text \n\t Ginsburg OM, Chowdhury M, Wu W, Chowdhury TI, Pal BC, Hasan R, et al. An mHealth model to increase clinic attendance for breast symptoms in rural Bangladesh: can bridging the digital divide help close the cancer divide? Oncologist 2014 Feb;19(2):177-185 [FREE Full text] [doi: 10.1634/theoncologist.2013-0314] [Medline: 24396050] 156"
    },
    {
      "title": "A randomized wait-list controlled trial of feasibility and efficacy of an online mindfulness-based cancer recovery program: the eTherapy for cancer applying mindfulness trial",
      "authors": [
        "K Zernicke",
        "T Campbell",
        "M Speca",
        "K Mccabe-Ruff",
        "S Flowers",
        "L Carlson"
      ],
      "year": 2014,
      "doi": "10.1097/PSY.0000000000000053",
      "journal": "Psychosom Med",
      "volume": "76",
      "issue": "4",
      "raw": "A randomized wait-list controlled trial of feasibility and efficacy of an online mindfulness-based cancer recovery program: the eTherapy for cancer applying mindfulness trial \n\t\t \n\t\t\t K A Zernicke \n\t\t \n\t\t \n\t\t\t T S Campbell \n\t\t \n\t\t \n\t\t\t M Speca \n\t\t \n\t\t \n\t\t\t K Mccabe-Ruff \n\t\t \n\t\t \n\t\t\t S Flowers \n\t\t \n\t\t \n\t\t\t L E Carlson \n\t\t \n\t\t 10.1097/PSY.0000000000000053 \n\t\t Medline: 24804884] 157 \n\t \n\t \n\t\t Psychosom Med \n\t\t \n\t\t\t 76 \n\t\t\t 4 \n\t\t\t \n\t\t\t 2014 May \n\t\t \n\t \n\t Zernicke KA, Campbell TS, Speca M, McCabe-Ruff K, Flowers S, Carlson LE. A randomized wait-list controlled trial of feasibility and efficacy of an online mindfulness-based cancer recovery program: the eTherapy for cancer applying mindfulness trial. Psychosom Med 2014 May;76(4):257-267. [doi: 10.1097/PSY.0000000000000053] [Medline: 24804884] 157"
    },
    {
      "title": "Patients' perceptions and experiences of using a mobile phone-based advanced symptom management system (ASyMS) to monitor and manage chemotherapy related toxicity",
      "authors": [
        "L Mccann",
        "R Maguire",
        "M Miller",
        "N Kearney"
      ],
      "year": 2009,
      "doi": "10.1111/j.1365-2354.2008.00938.x",
      "journal": "Eur J Cancer Care (Engl)",
      "volume": "18",
      "issue": "2",
      "raw": "Patients' perceptions and experiences of using a mobile phone-based advanced symptom management system (ASyMS) to monitor and manage chemotherapy related toxicity \n\t\t \n\t\t\t L Mccann \n\t\t \n\t\t \n\t\t\t R Maguire \n\t\t \n\t\t \n\t\t\t M Miller \n\t\t \n\t\t \n\t\t\t N Kearney \n\t\t \n\t\t 10.1111/j.1365-2354.2008.00938.x \n\t\t Medline: 19267731] 158 \n\t \n\t \n\t\t Eur J Cancer Care (Engl) \n\t\t \n\t\t\t 18 \n\t\t\t 2 \n\t\t\t \n\t\t\t 2009 Mar \n\t\t \n\t \n\t McCann L, Maguire R, Miller M, Kearney N. Patients' perceptions and experiences of using a mobile phone-based advanced symptom management system (ASyMS) to monitor and manage chemotherapy related toxicity. Eur J Cancer Care (Engl) 2009 Mar;18(2):156-164. [doi: 10.1111/j.1365-2354.2008.00938.x] [Medline: 19267731] 158"
    },
    {
      "title": "The impact of an electronic monitoring and reminder device on patient compliance with antihypertensive therapy: a randomized controlled trial",
      "authors": [
        "A Christensen",
        "L Christrup",
        "P Fabricius",
        "M Chrostowska",
        "M Wronka",
        "K Narkiewicz"
      ],
      "year": 2010,
      "doi": "10.1097/hjh.0b013e328331b718",
      "journal": "J Hypertens",
      "volume": "28",
      "issue": "1",
      "raw": "The impact of an electronic monitoring and reminder device on patient compliance with antihypertensive therapy: a randomized controlled trial \n\t\t \n\t\t\t A Christensen \n\t\t \n\t\t \n\t\t\t L L Christrup \n\t\t \n\t\t \n\t\t\t P E Fabricius \n\t\t \n\t\t \n\t\t\t M Chrostowska \n\t\t \n\t\t \n\t\t\t M Wronka \n\t\t \n\t\t \n\t\t\t K Narkiewicz \n\t\t \n\t\t 10.1097/hjh.0b013e328331b718 \n\t\t Medline: 19770778] 159 \n\t \n\t \n\t\t J Hypertens \n\t\t \n\t\t\t 28 \n\t\t\t 1 \n\t\t\t \n\t\t\t 2010 Jan \n\t\t \n\t \n\t Christensen A, Christrup LL, Fabricius PE, Chrostowska M, Wronka M, Narkiewicz K, et al. The impact of an electronic monitoring and reminder device on patient compliance with antihypertensive therapy: a randomized controlled trial. J Hypertens 2010 Jan;28(1):194-200. [doi: 10.1097/HJH.0b013e328331b718] [Medline: 19770778] 159"
    },
    {
      "title": "Perceived helpfulness of websites for mental health information: a national survey of young Australians",
      "authors": [
        "E Oh",
        "A Jorm",
        "A Wright"
      ],
      "year": 2009,
      "doi": "10.1007/s00127-008-0443-9",
      "journal": "Soc Psychiatry Psychiatr Epidemiol",
      "volume": "44",
      "issue": "4",
      "raw": "Perceived helpfulness of websites for mental health information: a national survey of young Australians \n\t\t \n\t\t\t E Oh \n\t\t \n\t\t \n\t\t\t A F Jorm \n\t\t \n\t\t \n\t\t\t A Wright \n\t\t \n\t\t 10.1007/s00127-008-0443-9 \n\t\t Medline: 18830552] 160 \n\t \n\t \n\t\t Soc Psychiatry Psychiatr Epidemiol \n\t\t \n\t\t\t 44 \n\t\t\t 4 \n\t\t\t \n\t\t\t 2009 Apr \n\t\t \n\t \n\t Oh E, Jorm AF, Wright A. Perceived helpfulness of websites for mental health information: a national survey of young Australians. Soc Psychiatry Psychiatr Epidemiol 2009 Apr;44(4):293-299. [doi: 10.1007/s00127-008-0443-9] [Medline: 18830552] 160"
    },
    {
      "title": "Use of SMS text messaging to improve outpatient attendance",
      "authors": [
        "S Downer",
        "J Meara",
        "Da Costa"
      ],
      "year": 2005,
      "doi": "10.5694/j.1326-5377.2005.tb07085.x",
      "journal": "Med J Aust",
      "volume": "183",
      "issue": "7",
      "raw": "Use of SMS text messaging to improve outpatient attendance \n\t\t \n\t\t\t S R Downer \n\t\t \n\t\t \n\t\t\t J G Meara \n\t\t \n\t\t \n\t\t\t Da Costa \n\t\t \n\t\t \n\t\t\t A C \n\t\t \n\t\t 10.5694/j.1326-5377.2005.tb07085.x \n\t\t Medline: 16201955] 161 \n\t \n\t \n\t\t Med J Aust \n\t\t \n\t\t\t 183 \n\t\t\t 7 \n\t\t\t \n\t\t\t 2005 Oct 3 \n\t\t \n\t \n\t Downer SR, Meara JG, Da Costa AC. Use of SMS text messaging to improve outpatient attendance. Med J Aust 2005 Oct 3;183(7):366-368. [Medline: 16201955] 161"
    },
    {
      "title": "Using short message service text reminders to reduce 'did not attend' rates in sexual health and HIV appointment clinics",
      "authors": [
        "T Farmer",
        "G Brook",
        "J Mcsorley",
        "S Murphy"
      ],
      "year": 2014,
      "doi": "10.1177/0956462413502325",
      "journal": "Int J STD AIDS",
      "volume": "25",
      "issue": "4",
      "raw": "Using short message service text reminders to reduce 'did not attend' rates in sexual health and HIV appointment clinics \n\t\t \n\t\t\t T Farmer \n\t\t \n\t\t \n\t\t\t G Brook \n\t\t \n\t\t \n\t\t\t J Mcsorley \n\t\t \n\t\t \n\t\t\t S Murphy \n\t\t \n\t\t \n\t\t\t Mohamed A \n\t\t \n\t\t 10.1177/0956462413502325 \n\t\t Medline: 23999939] 162 \n\t \n\t \n\t\t Int J STD AIDS \n\t\t \n\t\t\t 25 \n\t\t\t 4 \n\t\t\t \n\t\t\t 2014 Mar \n\t\t \n\t \n\t Farmer T, Brook G, McSorley J, Murphy S, Mohamed A. Using short message service text reminders to reduce 'did not attend' rates in sexual health and HIV appointment clinics. Int J STD AIDS 2014 Mar;25(4):289-293. [doi: 10.1177/0956462413502325] [Medline: 23999939] 162"
    },
    {
      "title": "Acceptability of a clinician-assisted computerized psychological intervention for comorbid mental health and substance use problems: treatment adherence data from a randomized controlled trial",
      "authors": [
        "F Kay-Lambkin",
        "A Baker",
        "T Lewin",
        "V Carr"
      ],
      "year": 2011,
      "doi": "10.2196/jmir.1522",
      "journal": "J Med Internet Res",
      "volume": "13",
      "issue": "1",
      "raw": "Acceptability of a clinician-assisted computerized psychological intervention for comorbid mental health and substance use problems: treatment adherence data from a randomized controlled trial \n\t\t \n\t\t\t F Kay-Lambkin \n\t\t \n\t\t \n\t\t\t A Baker \n\t\t \n\t\t \n\t\t\t T Lewin \n\t\t \n\t\t \n\t\t\t V Carr \n\t\t \n\t\t 10.2196/jmir.1522 \n\t\t Medline: 21273184] 163 \n\t \n\t \n\t\t J Med Internet Res \n\t\t \n\t\t\t 13 \n\t\t\t 1 \n\t\t\t 2011 \n\t\t \n\t \n\t FREE Full text \n\t Kay-Lambkin F, Baker A, Lewin T, Carr V. Acceptability of a clinician-assisted computerized psychological intervention for comorbid mental health and substance use problems: treatment adherence data from a randomized controlled trial. J Med Internet Res 2011;13(1):e11 [FREE Full text] [doi: 10.2196/jmir.1522] [Medline: 21273184] 163"
    },
    {
      "title": "Text messaging reminders to reduce non-attendance in chronic disease follow-up: a clinical trial",
      "authors": [
        "S Liew",
        "S Tong",
        "Lee Verna",
        "K Ng",
        "C Leong",
        "K Teng"
      ],
      "year": 2009,
      "doi": "10.3399/bjgp09X472250",
      "journal": "Br J Gen Pract",
      "volume": "59",
      "issue": "569",
      "raw": "Text messaging reminders to reduce non-attendance in chronic disease follow-up: a clinical trial \n\t\t \n\t\t\t S M Liew \n\t\t \n\t\t \n\t\t\t S F Tong \n\t\t \n\t\t \n\t\t\t Lee Verna \n\t\t \n\t\t \n\t\t\t K M Ng \n\t\t \n\t\t \n\t\t\t C J Leong \n\t\t \n\t\t \n\t\t\t K C Teng \n\t\t \n\t\t \n\t\t\t C L \n\t\t \n\t\t 10.3399/bjgp09X472250 \n\t\t Medline: 19712544] 164 \n\t \n\t \n\t\t Br J Gen Pract \n\t\t \n\t\t\t 59 \n\t\t\t 569 \n\t\t\t \n\t\t\t 2009 Dec \n\t\t \n\t \n\t FREE Full text \n\t Liew SM, Tong SF, Lee Verna KM, Ng CJ, Leong KC, Teng CL. Text messaging reminders to reduce non-attendance in chronic disease follow-up: a clinical trial. Br J Gen Pract 2009 Dec;59(569):916-920 [FREE Full text] [doi: 10.3399/bjgp09X472250] [Medline: 19712544] 164"
    },
    {
      "title": "Retaining homeless veterans in outpatient care: a pilot study of mobile phone text message appointment reminders",
      "authors": [
        "D Mcinnes",
        "B Petrakis",
        "A Gifford",
        "S Rao",
        "T Houston",
        "S Asch"
      ],
      "year": 2014,
      "doi": "10.2105/AJPH.2014.302061",
      "journal": "Am J Public Health",
      "volume": "104",
      "issue": "Suppl 4",
      "raw": "Retaining homeless veterans in outpatient care: a pilot study of mobile phone text message appointment reminders \n\t\t \n\t\t\t D K Mcinnes \n\t\t \n\t\t \n\t\t\t B A Petrakis \n\t\t \n\t\t \n\t\t\t A L Gifford \n\t\t \n\t\t \n\t\t\t S R Rao \n\t\t \n\t\t \n\t\t\t T K Houston \n\t\t \n\t\t \n\t\t\t S M Asch \n\t\t \n\t\t 10.2105/AJPH.2014.302061 \n\t\t Medline: 25100425] 165 \n\t \n\t \n\t\t Am J Public Health \n\t\t \n\t\t\t 104 \n\t\t\t Suppl 4 \n\t\t\t \n\t\t\t 2014 Sep \n\t\t \n\t \n\t McInnes DK, Petrakis BA, Gifford AL, Rao SR, Houston TK, Asch SM, et al. Retaining homeless veterans in outpatient care: a pilot study of mobile phone text message appointment reminders. Am J Public Health 2014 Sep;104 Suppl 4:S588-S594. [doi: 10.2105/AJPH.2014.302061] [Medline: 25100425] 165"
    },
    {
      "title": "Text message reminders of appointments: a pilot intervention at four community mental health clinics in London",
      "authors": [
        "H Sims",
        "H Sanghara",
        "D Hayes",
        "S Wandiembe",
        "M Finch",
        "H Jakobsen"
      ],
      "year": 2012,
      "doi": "10.1176/appi.ps.201100211",
      "journal": "Psychiatr Serv",
      "volume": "63",
      "issue": "2",
      "raw": "Text message reminders of appointments: a pilot intervention at four community mental health clinics in London \n\t\t \n\t\t\t H Sims \n\t\t \n\t\t \n\t\t\t H Sanghara \n\t\t \n\t\t \n\t\t\t D Hayes \n\t\t \n\t\t \n\t\t\t S Wandiembe \n\t\t \n\t\t \n\t\t\t M Finch \n\t\t \n\t\t \n\t\t\t H Jakobsen \n\t\t \n\t\t 10.1176/appi.ps.201100211 \n\t\t Medline: 22302334] 166 \n\t \n\t \n\t\t Psychiatr Serv \n\t\t \n\t\t\t 63 \n\t\t\t 2 \n\t\t\t \n\t\t\t 2012 Feb 1 \n\t\t \n\t \n\t Sims H, Sanghara H, Hayes D, Wandiembe S, Finch M, Jakobsen H, et al. Text message reminders of appointments: a pilot intervention at four community mental health clinics in London. Psychiatr Serv 2012 Feb 1;63(2):161-168. [doi: 10.1176/appi.ps.201100211] [Medline: 22302334] 166"
    },
    {
      "title": "Effect of a text messaging intervention on influenza vaccination in an urban, low-income pediatric and adolescent population: a randomized controlled trial",
      "authors": [
        "M Stockwell",
        "E Kharbanda",
        "R Martinez",
        "C Vargas",
        "D Vawdrey",
        "S Camargo"
      ],
      "year": 2012,
      "doi": "10.1001/jama.2012.502",
      "journal": "JAMA",
      "volume": "307",
      "issue": "16",
      "raw": "Effect of a text messaging intervention on influenza vaccination in an urban, low-income pediatric and adolescent population: a randomized controlled trial \n\t\t \n\t\t\t M S Stockwell \n\t\t \n\t\t \n\t\t\t E O Kharbanda \n\t\t \n\t\t \n\t\t\t R A Martinez \n\t\t \n\t\t \n\t\t\t C Y Vargas \n\t\t \n\t\t \n\t\t\t D K Vawdrey \n\t\t \n\t\t \n\t\t\t S Camargo \n\t\t \n\t\t 10.1001/jama.2012.502 \n\t\t Medline: 22535855] 167 \n\t \n\t \n\t\t JAMA \n\t\t \n\t\t\t 307 \n\t\t\t 16 \n\t\t\t \n\t\t\t 2012 Apr 25 \n\t\t \n\t \n\t Stockwell MS, Kharbanda EO, Martinez RA, Vargas CY, Vawdrey DK, Camargo S. Effect of a text messaging intervention on influenza vaccination in an urban, low-income pediatric and adolescent population: a randomized controlled trial. JAMA 2012 Apr 25;307(16):1702-1708. [doi: 10.1001/jama.2012.502] [Medline: 22535855] 167"
    },
    {
      "title": "Twelve-month outcomes of an Internet-based diabetes self-management support program",
      "authors": [
        "R Glasgow",
        "D Kurz",
        "D King",
        "J Dickman",
        "A Faber",
        "E Halterman"
      ],
      "year": 2012,
      "doi": "10.1016/j.pec.2011.07.024",
      "journal": "Patient Educ Couns",
      "volume": "87",
      "issue": "1",
      "raw": "Twelve-month outcomes of an Internet-based diabetes self-management support program \n\t\t \n\t\t\t R E Glasgow \n\t\t \n\t\t \n\t\t\t D Kurz \n\t\t \n\t\t \n\t\t\t D King \n\t\t \n\t\t \n\t\t\t J M Dickman \n\t\t \n\t\t \n\t\t\t A J Faber \n\t\t \n\t\t \n\t\t\t E Halterman \n\t\t \n\t\t 10.1016/j.pec.2011.07.024 \n\t\t Medline: 21924576] 168 \n\t \n\t \n\t\t Patient Educ Couns \n\t\t \n\t\t\t 87 \n\t\t\t 1 \n\t\t\t \n\t\t\t 2012 Apr \n\t\t \n\t \n\t FREE Full text \n\t Glasgow RE, Kurz D, King D, Dickman JM, Faber AJ, Halterman E, et al. Twelve-month outcomes of an Internet-based diabetes self-management support program. Patient Educ Couns 2012 Apr;87(1):81-92 [FREE Full text] [doi: 10.1016/j.pec.2011.07.024] [Medline: 21924576] 168"
    },
    {
      "title": "Comparison of community health worker-led diabetes medication decision-making support for low-income Latino and African American adults with diabetes using e-health tools versus print materials: a randomized, controlled trial",
      "authors": [
        "M Heisler",
        "H Choi",
        "G Palmisano",
        "R Mase",
        "C Richardson",
        "A Fagerlin"
      ],
      "year": 2014,
      "doi": "10.7326/m13-3012",
      "journal": "Ann Intern Med",
      "volume": "161",
      "issue": "10",
      "raw": "Comparison of community health worker-led diabetes medication decision-making support for low-income Latino and African American adults with diabetes using e-health tools versus print materials: a randomized, controlled trial \n\t\t \n\t\t\t M Heisler \n\t\t \n\t\t \n\t\t\t H Choi \n\t\t \n\t\t \n\t\t\t G Palmisano \n\t\t \n\t\t \n\t\t\t R Mase \n\t\t \n\t\t \n\t\t\t C Richardson \n\t\t \n\t\t \n\t\t\t A Fagerlin \n\t\t \n\t\t 10.7326/m13-3012 \n\t\t Medline: 25402398] 169 \n\t \n\t \n\t\t Ann Intern Med \n\t\t \n\t\t\t 161 \n\t\t\t 10 \n\t\t\t \n\t\t\t 2014 Nov 18 \n\t\t \n\t \n\t Suppl FREE Full text \n\t Heisler M, Choi H, Palmisano G, Mase R, Richardson C, Fagerlin A, et al. Comparison of community health worker-led diabetes medication decision-making support for low-income Latino and African American adults with diabetes using e-health tools versus print materials: a randomized, controlled trial. Ann Intern Med 2014 Nov 18;161(10 Suppl):S13-S22 [FREE Full text] [doi: 10.7326/M13-3012] [Medline: 25402398] 169"
    },
    {
      "title": "Engaging patients in medication reconciliation via a patient portal following hospital discharge",
      "authors": [
        "L Heyworth",
        "A Paquin",
        "J Clark",
        "V Kamenker",
        "M Stewart",
        "T Martin"
      ],
      "year": 2014,
      "doi": "10.1136/amiajnl-2013-001995",
      "journal": "J Am Med Inform Assoc",
      "volume": "21",
      "issue": "1",
      "raw": "Engaging patients in medication reconciliation via a patient portal following hospital discharge \n\t\t \n\t\t\t L Heyworth \n\t\t \n\t\t \n\t\t\t A M Paquin \n\t\t \n\t\t \n\t\t\t J Clark \n\t\t \n\t\t \n\t\t\t V Kamenker \n\t\t \n\t\t \n\t\t\t M Stewart \n\t\t \n\t\t \n\t\t\t T Martin \n\t\t \n\t\t 10.1136/amiajnl-2013-001995 \n\t\t Medline: 24036155] 170 \n\t \n\t \n\t\t J Am Med Inform Assoc \n\t\t \n\t\t\t 21 \n\t\t\t 1 \n\t\t\t \n\t\t\t 2014 Feb \n\t\t \n\t \n\t FREE Full text \n\t Heyworth L, Paquin AM, Clark J, Kamenker V, Stewart M, Martin T, et al. Engaging patients in medication reconciliation via a patient portal following hospital discharge. J Am Med Inform Assoc 2014 Feb;21(e1):e157-e162 [FREE Full text] [doi: 10.1136/amiajnl-2013-001995] [Medline: 24036155] 170"
    },
    {
      "title": "Feasibility of an eHealth service to support collaborative depression care: results of a pilot study",
      "authors": [
        "M Meglic",
        "M Furlan",
        "M Kuzmanic",
        "D Kozel",
        "D Baraga",
        "I Kuhar"
      ],
      "year": 2010,
      "doi": "10.2196/jmir.1510",
      "journal": "J Med Internet Res",
      "volume": "12",
      "issue": "5",
      "pages": "63",
      "raw": "Feasibility of an eHealth service to support collaborative depression care: results of a pilot study \n\t\t \n\t\t\t M Meglic \n\t\t \n\t\t \n\t\t\t M Furlan \n\t\t \n\t\t \n\t\t\t M Kuzmanic \n\t\t \n\t\t \n\t\t\t D Kozel \n\t\t \n\t\t \n\t\t\t D Baraga \n\t\t \n\t\t \n\t\t\t I Kuhar \n\t\t \n\t\t 10.2196/jmir.1510 \n\t\t Medline: 21172765] 171 \n\t \n\t \n\t\t J Med Internet Res \n\t\t \n\t\t\t 12 \n\t\t\t 5 \n\t\t\t 63 \n\t\t\t 2010 \n\t\t \n\t \n\t FREE Full text \n\t Meglic M, Furlan M, Kuzmanic M, Kozel D, Baraga D, Kuhar I, et al. Feasibility of an eHealth service to support collaborative depression care: results of a pilot study. J Med Internet Res 2010;12(5):e63 [FREE Full text] [doi: 10.2196/jmir.1510] [Medline: 21172765] 171"
    },
    {
      "title": "Acceptability of cognitive-behaviour therapy via the Internet for cessation of benzodiazepine use",
      "authors": [
        "J Parr",
        "D Kavanagh",
        "R Young",
        "G Mitchell"
      ],
      "year": 2011,
      "doi": "10.1111/j.1465-3362.2010.00183.x",
      "journal": "Drug Alcohol Rev",
      "volume": "30",
      "issue": "3",
      "raw": "Acceptability of cognitive-behaviour therapy via the Internet for cessation of benzodiazepine use \n\t\t \n\t\t\t J M Parr \n\t\t \n\t\t \n\t\t\t D J Kavanagh \n\t\t \n\t\t \n\t\t\t R M Young \n\t\t \n\t\t \n\t\t\t G Mitchell \n\t\t \n\t\t 10.1111/j.1465-3362.2010.00183.x \n\t\t Medline: 21545562] 172 \n\t \n\t \n\t\t Drug Alcohol Rev \n\t\t \n\t\t\t 30 \n\t\t\t 3 \n\t\t\t \n\t\t\t 2011 May \n\t\t \n\t \n\t Parr JM, Kavanagh DJ, Young RM, Mitchell G. Acceptability of cognitive-behaviour therapy via the Internet for cessation of benzodiazepine use. Drug Alcohol Rev 2011 May;30(3):306-314. [doi: 10.1111/j.1465-3362.2010.00183.x] [Medline: 21545562] 172"
    },
    {
      "title": "Clinical evaluation of IDAS II, a new electronic device enabling drug adherence monitoring",
      "authors": [
        "V Santschi",
        "G Wuerzner",
        "M Schneider",
        "O Bugnon",
        "M Burnier"
      ],
      "year": 2007,
      "doi": "10.1007/s00228-007-0364-7",
      "journal": "Eur J Clin Pharmacol",
      "volume": "63",
      "issue": "12",
      "raw": "Clinical evaluation of IDAS II, a new electronic device enabling drug adherence monitoring \n\t\t \n\t\t\t V Santschi \n\t\t \n\t\t \n\t\t\t G Wuerzner \n\t\t \n\t\t \n\t\t\t M P Schneider \n\t\t \n\t\t \n\t\t\t O Bugnon \n\t\t \n\t\t \n\t\t\t M Burnier \n\t\t \n\t\t 10.1007/s00228-007-0364-7 \n\t\t Medline: 17899047] 173 \n\t \n\t \n\t\t Eur J Clin Pharmacol \n\t\t \n\t\t\t 63 \n\t\t\t 12 \n\t\t\t \n\t\t\t 2007 Dec \n\t\t \n\t \n\t Santschi V, Wuerzner G, Schneider MP, Bugnon O, Burnier M. Clinical evaluation of IDAS II, a new electronic device enabling drug adherence monitoring. Eur J Clin Pharmacol 2007 Dec;63(12):1179-1184. [doi: 10.1007/s00228-007-0364-7] [Medline: 17899047] 173"
    },
    {
      "title": "The role of mobile phones in improving vaccination rates in travelers",
      "authors": [
        "A Vilella",
        "J Bayas",
        "M Diaz",
        "C Guinovart",
        "C Diez",
        "D Sim\u00f3"
      ],
      "year": 2004,
      "doi": "10.1016/j.ypmed.2003.12.005",
      "journal": "Prev Med",
      "volume": "38",
      "issue": "4",
      "raw": "The role of mobile phones in improving vaccination rates in travelers \n\t\t \n\t\t\t A Vilella \n\t\t \n\t\t \n\t\t\t J M Bayas \n\t\t \n\t\t \n\t\t\t M T Diaz \n\t\t \n\t\t \n\t\t\t C Guinovart \n\t\t \n\t\t \n\t\t\t C Diez \n\t\t \n\t\t \n\t\t\t D Sim\u00f3 \n\t\t \n\t\t 10.1016/j.ypmed.2003.12.005 \n\t\t Medline: 15020186] 174 \n\t \n\t \n\t\t Prev Med \n\t\t \n\t\t\t 38 \n\t\t\t 4 \n\t\t\t \n\t\t\t 2004 Apr \n\t\t \n\t \n\t Vilella A, Bayas JM, Diaz MT, Guinovart C, Diez C, Sim\u00f3 D, et al. The role of mobile phones in improving vaccination rates in travelers. Prev Med 2004 Apr;38(4):503-509. [doi: 10.1016/j.ypmed.2003.12.005] [Medline: 15020186] 174"
    },
    {
      "title": "Impact of patient-accessible electronic medical records in rheumatology: use, satisfaction and effects on empowerment among patients",
      "authors": [
        "R Van Der Vaart",
        "C Drossaert",
        "E Taal",
        "K Drossaers-Bakker",
        "H Vonkeman",
        "M Van Der Laar"
      ],
      "year": 2014,
      "doi": "10.1186/1471-2474-15-102",
      "journal": "BMC Musculoskelet Disord",
      "volume": "15",
      "issue": "1",
      "pages": "102",
      "raw": "Impact of patient-accessible electronic medical records in rheumatology: use, satisfaction and effects on empowerment among patients \n\t\t \n\t\t\t R Van Der Vaart \n\t\t \n\t\t \n\t\t\t C H Drossaert \n\t\t \n\t\t \n\t\t\t E Taal \n\t\t \n\t\t \n\t\t\t K W Drossaers-Bakker \n\t\t \n\t\t \n\t\t\t H E Vonkeman \n\t\t \n\t\t \n\t\t\t M A Van Der Laar \n\t\t \n\t\t 10.1186/1471-2474-15-102 \n\t\t Medline: 19017773] 175 \n\t \n\t \n\t\t BMC Musculoskelet Disord \n\t\t \n\t\t\t 15 \n\t\t\t 1 \n\t\t\t 102 \n\t\t\t 2014 Feb \n\t\t \n\t \n\t van der Vaart R, Drossaert CH, Taal E, Drossaers-Bakker KW, Vonkeman HE, van der Laar MA. Impact of patient-accessible electronic medical records in rheumatology: use, satisfaction and effects on empowerment among patients. BMC Musculoskelet Disord 2014 Feb;15(1):102. [doi: 10.1186/1471-2474-15-102] [Medline: 19017773] 175"
    },
    {
      "title": "Web-based education and attitude to delivery by caesarean section in nulliparous women",
      "authors": [
        "A Kulkarni",
        "E Wright",
        "J Kingdom"
      ],
      "year": 2014,
      "journal": "J Obstet Gynaecol Can",
      "volume": "36",
      "issue": "9",
      "raw": "Web-based education and attitude to delivery by caesarean section in nulliparous women \n\t\t \n\t\t\t A Kulkarni \n\t\t \n\t\t \n\t\t\t E Wright \n\t\t \n\t\t \n\t\t\t J Kingdom \n\t\t \n\t\t Medline: 25222355] 176 \n\t \n\t \n\t\t J Obstet Gynaecol Can \n\t\t \n\t\t\t 36 \n\t\t\t 9 \n\t\t\t \n\t\t\t 2014 Sep \n\t\t \n\t \n\t Kulkarni A, Wright E, Kingdom J. Web-based education and attitude to delivery by caesarean section in nulliparous women. J Obstet Gynaecol Can 2014 Sep;36(9):768-775. [Medline: 25222355] 176"
    },
    {
      "title": "A comparison of live counseling with a web-based lifestyle and medication intervention to reduce coronary heart disease risk: a randomized clinical trial",
      "authors": [
        "T Keyserling",
        "S Sheridan",
        "L Draeger",
        "E Finkelstein",
        "Z Gizlice",
        "E Kruger"
      ],
      "year": 2014,
      "doi": "10.1001/jamainternmed.2014.1984",
      "journal": "JAMA Intern Med",
      "volume": "174",
      "issue": "7",
      "raw": "A comparison of live counseling with a web-based lifestyle and medication intervention to reduce coronary heart disease risk: a randomized clinical trial \n\t\t \n\t\t\t T C Keyserling \n\t\t \n\t\t \n\t\t\t S L Sheridan \n\t\t \n\t\t \n\t\t\t L B Draeger \n\t\t \n\t\t \n\t\t\t E A Finkelstein \n\t\t \n\t\t \n\t\t\t Z Gizlice \n\t\t \n\t\t \n\t\t\t E Kruger \n\t\t \n\t\t 10.1001/jamainternmed.2014.1984 \n\t\t Medline: 24861959] 177 \n\t \n\t \n\t\t JAMA Intern Med \n\t\t \n\t\t\t 174 \n\t\t\t 7 \n\t\t\t \n\t\t\t 2014 Jul \n\t\t \n\t \n\t FREE Full text \n\t Keyserling TC, Sheridan SL, Draeger LB, Finkelstein EA, Gizlice Z, Kruger E, et al. A comparison of live counseling with a web-based lifestyle and medication intervention to reduce coronary heart disease risk: a randomized clinical trial. JAMA Intern Med 2014 Jul;174(7):1144-1157 [FREE Full text] [doi: 10.1001/jamainternmed.2014.1984] [Medline: 24861959] 177"
    },
    {
      "title": "Diabetes self-management support using mHealth and enhanced informal caregiving",
      "authors": [
        "J Aikens",
        "K Zivin",
        "R Trivedi",
        "J Piette"
      ],
      "year": 2014,
      "doi": "10.1016/j.jdiacomp.2013.11.008",
      "journal": "J Diabetes Complications",
      "volume": "28",
      "issue": "2",
      "raw": "Diabetes self-management support using mHealth and enhanced informal caregiving \n\t\t \n\t\t\t J E Aikens \n\t\t \n\t\t \n\t\t\t K Zivin \n\t\t \n\t\t \n\t\t\t R Trivedi \n\t\t \n\t\t \n\t\t\t J D Piette \n\t\t \n\t\t 10.1016/j.jdiacomp.2013.11.008 \n\t\t Medline: 24374137] 178 \n\t \n\t \n\t\t J Diabetes Complications \n\t\t \n\t\t\t 28 \n\t\t\t 2 \n\t\t\t \n\t\t\t 2014 \n\t\t \n\t \n\t FREE Full text \n\t Aikens JE, Zivin K, Trivedi R, Piette JD. Diabetes self-management support using mHealth and enhanced informal caregiving. J Diabetes Complications 2014;28(2):171-176 [FREE Full text] [doi: 10.1016/j.jdiacomp.2013.11.008] [Medline: 24374137] 178"
    },
    {
      "title": "Factors related to sustained use of a free mobile app for dietary self-monitoring with photography and peer feedback: retrospective cohort study",
      "authors": [
        "E Helander",
        "K Kaipainen",
        "I Korhonen",
        "B Wansink"
      ],
      "year": 2014,
      "doi": "10.2196/jmir.3084",
      "journal": "J Med Internet Res",
      "volume": "16",
      "issue": "4",
      "pages": "109",
      "raw": "Factors related to sustained use of a free mobile app for dietary self-monitoring with photography and peer feedback: retrospective cohort study \n\t\t \n\t\t\t E Helander \n\t\t \n\t\t \n\t\t\t K Kaipainen \n\t\t \n\t\t \n\t\t\t I Korhonen \n\t\t \n\t\t \n\t\t\t B Wansink \n\t\t \n\t\t 10.2196/jmir.3084 \n\t\t Medline: 24735567] 179 \n\t \n\t \n\t\t J Med Internet Res \n\t\t \n\t\t\t 16 \n\t\t\t 4 \n\t\t\t 109 \n\t\t\t 2014 \n\t\t \n\t \n\t FREE Full text \n\t Helander E, Kaipainen K, Korhonen I, Wansink B. Factors related to sustained use of a free mobile app for dietary self-monitoring with photography and peer feedback: retrospective cohort study. J Med Internet Res 2014;16(4):e109 [FREE Full text] [doi: 10.2196/jmir.3084] [Medline: 24735567] 179"
    },
    {
      "title": "Comparison of Veteran experiences of low-cost, home-based diet and exercise interventions",
      "authors": [
        "B Holtz",
        "S Krein",
        "D Bentley",
        "M Hughes",
        "N Giardino",
        "C Richardson"
      ],
      "year": 2014,
      "doi": "10.1682/JRRD.2013.04.0088",
      "journal": "J Rehabil Res Dev",
      "volume": "51",
      "issue": "1",
      "raw": "Comparison of Veteran experiences of low-cost, home-based diet and exercise interventions \n\t\t \n\t\t\t B Holtz \n\t\t \n\t\t \n\t\t\t S L Krein \n\t\t \n\t\t \n\t\t\t D R Bentley \n\t\t \n\t\t \n\t\t\t M E Hughes \n\t\t \n\t\t \n\t\t\t N D Giardino \n\t\t \n\t\t \n\t\t\t C R Richardson \n\t\t \n\t\t 10.1682/JRRD.2013.04.0088 \n\t\t Medline: 24805901] 180 \n\t \n\t \n\t\t J Rehabil Res Dev \n\t\t \n\t\t\t 51 \n\t\t\t 1 \n\t\t\t \n\t\t\t 2014 \n\t\t \n\t \n\t FREE Full text \n\t Holtz B, Krein SL, Bentley DR, Hughes ME, Giardino ND, Richardson CR. Comparison of Veteran experiences of low-cost, home-based diet and exercise interventions. J Rehabil Res Dev 2014;51(1):149-160 [FREE Full text] [doi: 10.1682/JRRD.2013.04.0088] [Medline: 24805901] 180"
    },
    {
      "title": "Weight management using the internet a randomized controlled trial",
      "authors": [
        "C Hunter",
        "A Peterson",
        "L Alvarez",
        "W Poston",
        "A Brundige",
        "C Haddock"
      ],
      "year": 2008,
      "doi": "10.1016/j.amepre.2007.09.026",
      "journal": "Am J Prev Med",
      "volume": "34",
      "issue": "2",
      "raw": "Weight management using the internet a randomized controlled trial \n\t\t \n\t\t\t C M Hunter \n\t\t \n\t\t \n\t\t\t A L Peterson \n\t\t \n\t\t \n\t\t\t L M Alvarez \n\t\t \n\t\t \n\t\t\t W C Poston \n\t\t \n\t\t \n\t\t\t A R Brundige \n\t\t \n\t\t \n\t\t\t C K Haddock \n\t\t \n\t\t 10.1016/j.amepre.2007.09.026 \n\t\t Medline: 18201641] 181 \n\t \n\t \n\t\t Am J Prev Med \n\t\t \n\t\t\t 34 \n\t\t\t 2 \n\t\t\t \n\t\t\t 2008 Feb \n\t\t \n\t \n\t Hunter CM, Peterson AL, Alvarez LM, Poston WC, Brundige AR, Haddock CK, et al. Weight management using the internet a randomized controlled trial. Am J Prev Med 2008 Feb;34(2):119-126. [doi: 10.1016/j.amepre.2007.09.026] [Medline: 18201641] 181"
    },
    {
      "title": "Utility of a Web-based intervention for individuals with type 2 diabetes: the impact on physical activity levels and glycemic control",
      "authors": [
        "C Kim",
        "D Kang"
      ],
      "year": 2006,
      "doi": "10.1097/00024665-200611000-00008",
      "journal": "Comput Inform Nurs",
      "volume": "24",
      "issue": "6",
      "raw": "Utility of a Web-based intervention for individuals with type 2 diabetes: the impact on physical activity levels and glycemic control \n\t\t \n\t\t\t C J Kim \n\t\t \n\t\t \n\t\t\t D H Kang \n\t\t \n\t\t 10.1097/00024665-200611000-00008 \n\t\t Medline: 17108753] 182 \n\t \n\t \n\t\t Comput Inform Nurs \n\t\t \n\t\t\t 24 \n\t\t\t 6 \n\t\t\t \n\t\t\t 2006 \n\t\t \n\t \n\t Kim CJ, Kang DH. Utility of a Web-based intervention for individuals with type 2 diabetes: the impact on physical activity levels and glycemic control. Comput Inform Nurs 2006;24(6):337-345. [Medline: 17108753] 182"
    },
    {
      "title": "Efficacy of an E-mail intervention for the promotion of physical activity and nutrition behavior in the workplace context",
      "authors": [
        "R Plotnikoff",
        "L Mccargar",
        "P Wilson",
        "C Loucaides"
      ],
      "year": 2005,
      "journal": "Am J Health Promot",
      "volume": "19",
      "issue": "6",
      "raw": "Efficacy of an E-mail intervention for the promotion of physical activity and nutrition behavior in the workplace context \n\t\t \n\t\t\t R C Plotnikoff \n\t\t \n\t\t \n\t\t\t L J Mccargar \n\t\t \n\t\t \n\t\t\t P M Wilson \n\t\t \n\t\t \n\t\t\t C A Loucaides \n\t\t \n\t\t Medline: 16022206] 183 \n\t \n\t \n\t\t Am J Health Promot \n\t\t \n\t\t\t 19 \n\t\t\t 6 \n\t\t\t \n\t\t\t 2005 \n\t\t \n\t \n\t Plotnikoff RC, McCargar LJ, Wilson PM, Loucaides CA. Efficacy of an E-mail intervention for the promotion of physical activity and nutrition behavior in the workplace context. Am J Health Promot 2005;19(6):422-429. [Medline: 16022206] 183"
    },
    {
      "title": "Web-based treatment program using intensive therapeutic contact for patients with eating disorders: before-after study",
      "authors": [
        "E Ter Huurne",
        "M Postel",
        "H De Haan",
        "Chc Drossaert",
        "Caj Dejong"
      ],
      "year": 2013,
      "doi": "10.2196/jmir.2211",
      "journal": "J Med Internet Res",
      "volume": "15",
      "issue": "2",
      "raw": "Web-based treatment program using intensive therapeutic contact for patients with eating disorders: before-after study \n\t\t \n\t\t\t E D Ter Huurne \n\t\t \n\t\t \n\t\t\t M G Postel \n\t\t \n\t\t \n\t\t\t H A De Haan \n\t\t \n\t\t \n\t\t\t Chc Drossaert \n\t\t \n\t\t \n\t\t\t Caj Dejong \n\t\t \n\t\t 10.2196/jmir.2211 \n\t\t Medline: 23380291] 184 \n\t \n\t \n\t\t J Med Internet Res \n\t\t \n\t\t\t 15 \n\t\t\t 2 \n\t\t\t 2013 \n\t\t \n\t \n\t FREE Full text \n\t ter Huurne ED, Postel MG, de Haan HA, Drossaert CHC, DeJong CAJ. Web-based treatment program using intensive therapeutic contact for patients with eating disorders: before-after study. J Med Internet Res 2013;15(2):e12 [FREE Full text] [doi: 10.2196/jmir.2211] [Medline: 23380291] 184"
    },
    {
      "title": "Internet-based self-help training for children and adolescents with recurrent headache: a pilot study URL",
      "authors": [
        "E Trautmann",
        "B Kroner-Herwig"
      ],
      "year": 2008,
      "doi": "10.1017/s1352465808004219",
      "pages": "185",
      "raw": "E Trautmann \n\t\t \n\t\t \n\t\t\t B Kroner-Herwig \n\t\t \n\t\t \n\t\t\t Babcp \n\t\t \n\t\t 10.1017/s1352465808004219 \n\t\t \n\t\t Internet-based self-help training for children and adolescents with recurrent headache: a pilot study URL \n\t\t \n\t\t\t 2008. 2015-11-30 \n\t\t\t 185 \n\t\t \n\t \n\t WebCite Cache ID 6dRRLxYJs \n\t Trautmann E, Kroner-Herwig B. BABCP. 2008. Internet-based self-help training for children and adolescents with recurrent headache: a pilot study URL: https://www.psych.uni-goettingen.de/de/clinical/team/bkroene/ TrautmannpilotstudieIBI_BCP_2008.pdf [accessed 2015-11-30] [WebCite Cache ID 6dRRLxYJs] 185"
    },
    {
      "title": "Development and evaluation of a patient-oriented education system for diabetes management",
      "authors": [
        "T Lee",
        "Y Yeh",
        "C Liu",
        "P Chen"
      ],
      "year": 2007,
      "doi": "10.1016/j.ijmedinf.2006.05.030",
      "journal": "Int J Med Inform",
      "volume": "76",
      "issue": "9",
      "raw": "Development and evaluation of a patient-oriented education system for diabetes management \n\t\t \n\t\t\t T I Lee \n\t\t \n\t\t \n\t\t\t Y T Yeh \n\t\t \n\t\t \n\t\t\t C T Liu \n\t\t \n\t\t \n\t\t\t P L Chen \n\t\t \n\t\t 10.1016/j.ijmedinf.2006.05.030 \n\t\t Medline: 16815741] 186 \n\t \n\t \n\t\t Int J Med Inform \n\t\t \n\t\t\t 76 \n\t\t\t 9 \n\t\t\t \n\t\t\t 2007 Sep \n\t\t \n\t \n\t Lee TI, Yeh YT, Liu CT, Chen PL. Development and evaluation of a patient-oriented education system for diabetes management. Int J Med Inform 2007 Sep;76(9):655-663. [doi: 10.1016/j.ijmedinf.2006.05.030] [Medline: 16815741] 186"
    },
    {
      "title": "Effects of a Website designed to improve the management of migraines",
      "authors": [
        "C Sciamanna",
        "R Nicholson",
        "J Lofland",
        "M Manocchia",
        "S Mui",
        "C Hartman"
      ],
      "year": 2006,
      "doi": "10.1111/j.1526-4610.2006.00312.x",
      "journal": "Headache",
      "volume": "46",
      "issue": "1",
      "raw": "Effects of a Website designed to improve the management of migraines \n\t\t \n\t\t\t C N Sciamanna \n\t\t \n\t\t \n\t\t\t R A Nicholson \n\t\t \n\t\t \n\t\t\t J H Lofland \n\t\t \n\t\t \n\t\t\t M Manocchia \n\t\t \n\t\t \n\t\t\t S Mui \n\t\t \n\t\t \n\t\t\t C W Hartman \n\t\t \n\t\t 10.1111/j.1526-4610.2006.00312.x \n\t\t Medline: 16412156] 187 \n\t \n\t \n\t\t Headache \n\t\t \n\t\t\t 46 \n\t\t\t 1 \n\t\t\t \n\t\t\t 2006 Jan \n\t\t \n\t \n\t Sciamanna CN, Nicholson RA, Lofland JH, Manocchia M, Mui S, Hartman CW. Effects of a Website designed to improve the management of migraines. Headache 2006 Jan;46(1):92-100. [doi: 10.1111/j.1526-4610.2006.00312.x] [Medline: 16412156] 187"
    },
    {
      "title": "Feasibility testing of a web-based symptom self-management system for persons living with HIV",
      "authors": [
        "R Schnall",
        "D Wantland",
        "O Velez",
        "K Cato",
        "H Jia"
      ],
      "year": 2014,
      "doi": "10.1016/j.jana.2013.09.002",
      "journal": "J Assoc Nurses AIDS Care",
      "volume": "25",
      "issue": "4",
      "raw": "Feasibility testing of a web-based symptom self-management system for persons living with HIV \n\t\t \n\t\t\t R Schnall \n\t\t \n\t\t \n\t\t\t D Wantland \n\t\t \n\t\t \n\t\t\t O Velez \n\t\t \n\t\t \n\t\t\t K Cato \n\t\t \n\t\t \n\t\t\t H Jia \n\t\t \n\t\t 10.1016/j.jana.2013.09.002 \n\t\t Medline: 24434198] 188 \n\t \n\t \n\t\t J Assoc Nurses AIDS Care \n\t\t \n\t\t\t 25 \n\t\t\t 4 \n\t\t\t \n\t\t\t 2014 \n\t\t \n\t \n\t FREE Full text \n\t Schnall R, Wantland D, Velez O, Cato K, Jia H. Feasibility testing of a web-based symptom self-management system for persons living with HIV. J Assoc Nurses AIDS Care 2014;25(4):364-371 [FREE Full text] [doi: 10.1016/j.jana.2013.09.002] [Medline: 24434198] 188"
    },
    {
      "title": "How adolescents use SMS (short message service) to micro-coordinate contact with youth mental health outreach services",
      "authors": [
        "G Furber",
        "A Crago",
        "K Meehan",
        "T Sheppard",
        "K Hooper",
        "D Abbot"
      ],
      "year": 2011,
      "doi": "10.1016/j.jadohealth.2010.05.022",
      "journal": "J Adolesc Health",
      "volume": "48",
      "issue": "1",
      "raw": "How adolescents use SMS (short message service) to micro-coordinate contact with youth mental health outreach services \n\t\t \n\t\t\t G V Furber \n\t\t \n\t\t \n\t\t\t A E Crago \n\t\t \n\t\t \n\t\t\t K Meehan \n\t\t \n\t\t \n\t\t\t T D Sheppard \n\t\t \n\t\t \n\t\t\t K Hooper \n\t\t \n\t\t \n\t\t\t D T Abbot \n\t\t \n\t\t 10.1016/j.jadohealth.2010.05.022 \n\t\t Medline: 21185535] 189 \n\t \n\t \n\t\t J Adolesc Health \n\t\t \n\t\t\t 48 \n\t\t\t 1 \n\t\t\t \n\t\t\t 2011 Jan \n\t\t \n\t \n\t Furber GV, Crago AE, Meehan K, Sheppard TD, Hooper K, Abbot DT, et al. How adolescents use SMS (short message service) to micro-coordinate contact with youth mental health outreach services. J Adolesc Health 2011 Jan;48(1):113-115. [doi: 10.1016/j.jadohealth.2010.05.022] [Medline: 21185535] 189"
    },
    {
      "title": "Tablet computers for hospitalized patients: a pilot study to improve inpatient engagement",
      "authors": [
        "S Greysen",
        "R Khanna",
        "R Jacolbia",
        "H Lee",
        "A Auerbach"
      ],
      "year": 2014,
      "doi": "10.1002/jhm.2169",
      "journal": "J Hosp Med",
      "volume": "9",
      "issue": "6",
      "raw": "Tablet computers for hospitalized patients: a pilot study to improve inpatient engagement \n\t\t \n\t\t\t S R Greysen \n\t\t \n\t\t \n\t\t\t R R Khanna \n\t\t \n\t\t \n\t\t\t R Jacolbia \n\t\t \n\t\t \n\t\t\t H M Lee \n\t\t \n\t\t \n\t\t\t A D Auerbach \n\t\t \n\t\t 10.1002/jhm.2169 \n\t\t Medline: 24523051] 190 \n\t \n\t \n\t\t J Hosp Med \n\t\t \n\t\t\t 9 \n\t\t\t 6 \n\t\t\t \n\t\t\t 2014 Jun \n\t\t \n\t \n\t FREE Full text \n\t Greysen SR, Khanna RR, Jacolbia R, Lee HM, Auerbach AD. Tablet computers for hospitalized patients: a pilot study to improve inpatient engagement. J Hosp Med 2014 Jun;9(6):396-399 [FREE Full text] [doi: 10.1002/jhm.2169] [Medline: 24523051] 190"
    },
    {
      "title": "The role of online support communities: benefits of expanded social networks to patients with psoriasis",
      "authors": [
        "S Idriss",
        "J Kvedar",
        "A Watson"
      ],
      "year": 2009,
      "doi": "10.1001/archdermatol.2008.529",
      "journal": "Arch Dermatol",
      "volume": "145",
      "issue": "1",
      "raw": "The role of online support communities: benefits of expanded social networks to patients with psoriasis \n\t\t \n\t\t\t S Z Idriss \n\t\t \n\t\t \n\t\t\t J C Kvedar \n\t\t \n\t\t \n\t\t\t A J Watson \n\t\t \n\t\t 10.1001/archdermatol.2008.529 \n\t\t Medline: 19153342] 191 \n\t \n\t \n\t\t Arch Dermatol \n\t\t \n\t\t\t 145 \n\t\t\t 1 \n\t\t\t \n\t\t\t 2009 Jan \n\t\t \n\t \n\t Idriss SZ, Kvedar JC, Watson AJ. The role of online support communities: benefits of expanded social networks to patients with psoriasis. Arch Dermatol 2009 Jan;145(1):46-51. [doi: 10.1001/archdermatol.2008.529] [Medline: 19153342] 191"
    },
    {
      "title": "Technology-aided programs for assisting communication and leisure engagement of persons with amyotrophic lateral sclerosis: two single-case studies",
      "authors": [
        "G Lancioni",
        "N Singh",
        "O' Reilly",
        "M Sigafoos",
        "J Ferlisi",
        "G Ferrarese"
      ],
      "year": 2012,
      "doi": "10.1016/j.ridd.2012.03.028",
      "journal": "Res Dev Disabil",
      "volume": "33",
      "issue": "5",
      "raw": "Technology-aided programs for assisting communication and leisure engagement of persons with amyotrophic lateral sclerosis: two single-case studies \n\t\t \n\t\t\t G E Lancioni \n\t\t \n\t\t \n\t\t\t N N Singh \n\t\t \n\t\t \n\t\t\t O' Reilly \n\t\t \n\t\t \n\t\t\t M F Sigafoos \n\t\t \n\t\t \n\t\t\t J Ferlisi \n\t\t \n\t\t \n\t\t\t G Ferrarese \n\t\t \n\t\t \n\t\t\t G \n\t\t \n\t\t 10.1016/j.ridd.2012.03.028 \n\t\t Medline: 22537857] 192 \n\t \n\t \n\t\t Res Dev Disabil \n\t\t \n\t\t\t 33 \n\t\t\t 5 \n\t\t\t \n\t\t\t 2012 \n\t\t \n\t \n\t Lancioni GE, Singh NN, O'Reilly MF, Sigafoos J, Ferlisi G, Ferrarese G, et al. Technology-aided programs for assisting communication and leisure engagement of persons with amyotrophic lateral sclerosis: two single-case studies. Res Dev Disabil 2012;33(5):1605-1614. [doi: 10.1016/j.ridd.2012.03.028] [Medline: 22537857] 192"
    },
    {
      "title": "Effects of a mobile phone short message service on antiretroviral treatment adherence in Kenya (WelTel Kenya1): a randomised trial",
      "authors": [
        "R Lester",
        "P Ritvo",
        "E Mills",
        "A Kariri",
        "S Karanja",
        "M Chung"
      ],
      "year": 2010,
      "doi": "10.1016/s0140-6736(10)61997-6",
      "journal": "The Lancet",
      "volume": "376",
      "raw": "Effects of a mobile phone short message service on antiretroviral treatment adherence in Kenya (WelTel Kenya1): a randomised trial \n\t\t \n\t\t\t R Lester \n\t\t \n\t\t \n\t\t\t P Ritvo \n\t\t \n\t\t \n\t\t\t E Mills \n\t\t \n\t\t \n\t\t\t A Kariri \n\t\t \n\t\t \n\t\t\t S Karanja \n\t\t \n\t\t \n\t\t\t M Chung \n\t\t \n\t\t 10.1016/s0140-6736(10)61997-6 \n\t \n\t \n\t\t The Lancet \n\t\t \n\t\t\t 376 \n\t\t\t \n\t\t\t 2010 Nov 15. 9755 \n\t\t \n\t \n\t Lester R, Ritvo P, Mills E, Kariri A, Karanja S, Chung M, et al. Effects of a mobile phone short message service on antiretroviral treatment adherence in Kenya (WelTel Kenya1): a randomised trial. The Lancet 2010 Nov 15;376(9755):1838-1845. [doi: 10.1016/S0140-6736(10)61997-6] 193"
    },
    {
      "title": "A randomized controlled trial of a commercial internet weight loss program",
      "authors": [
        "L Womble",
        "T Wadden",
        "B Mcguckin",
        "S Sargent",
        "R Rothman",
        "E Krauthamer-Ewing"
      ],
      "year": 2004,
      "doi": "10.1038/oby.2004.124",
      "journal": "Obes Res",
      "volume": "12",
      "issue": "6",
      "raw": "A randomized controlled trial of a commercial internet weight loss program \n\t\t \n\t\t\t L G Womble \n\t\t \n\t\t \n\t\t\t T A Wadden \n\t\t \n\t\t \n\t\t\t B G Mcguckin \n\t\t \n\t\t \n\t\t\t S L Sargent \n\t\t \n\t\t \n\t\t\t R A Rothman \n\t\t \n\t\t \n\t\t\t E S Krauthamer-Ewing \n\t\t \n\t\t 10.1038/oby.2004.124 \n\t\t Medline: 15229342] 194 \n\t \n\t \n\t\t Obes Res \n\t\t \n\t\t\t 12 \n\t\t\t 6 \n\t\t\t \n\t\t\t 2004 Jun \n\t\t \n\t \n\t Womble LG, Wadden TA, McGuckin BG, Sargent SL, Rothman RA, Krauthamer-Ewing ES. A randomized controlled trial of a commercial internet weight loss program. Obes Res 2004 Jun;12(6):1011-1018. [doi: 10.1038/oby.2004.124] [Medline: 15229342] 194"
    },
    {
      "title": "Two-year internet-based randomized controlled trial for weight loss in African-American girls",
      "authors": [
        "D Williamson",
        "H Walden",
        "M White",
        "E York-Crowe",
        "R Newton",
        "A Alfonso"
      ],
      "year": 2006,
      "doi": "10.1038/oby.2006.140",
      "journal": "Obesity (Silver Spring)",
      "volume": "14",
      "issue": "7",
      "raw": "Two-year internet-based randomized controlled trial for weight loss in African-American girls \n\t\t \n\t\t\t D A Williamson \n\t\t \n\t\t \n\t\t\t H M Walden \n\t\t \n\t\t \n\t\t\t M A White \n\t\t \n\t\t \n\t\t\t E York-Crowe \n\t\t \n\t\t \n\t\t\t R L Newton \n\t\t \n\t\t \n\t\t\t A Alfonso \n\t\t \n\t\t 10.1038/oby.2006.140 \n\t\t Medline: 16899804] 195 \n\t \n\t \n\t\t Obesity (Silver Spring) \n\t\t \n\t\t\t 14 \n\t\t\t 7 \n\t\t\t \n\t\t\t 2006 Jul \n\t\t \n\t \n\t Williamson DA, Walden HM, White MA, York-Crowe E, Newton RL, Alfonso A, et al. Two-year internet-based randomized controlled trial for weight loss in African-American girls. Obesity (Silver Spring) 2006 Jul;14(7):1231-1243. [doi: 10.1038/oby.2006.140] [Medline: 16899804] 195"
    },
    {
      "title": "Can mobile phone multimedia messages and text messages improve clinic attendance for Aboriginal children with chronic otitis media? A randomised controlled trial",
      "authors": [
        "J Phillips",
        "C Wigger",
        "J Beissbarth",
        "G Mccallum",
        "A Leach",
        "P Morris"
      ],
      "year": 2014,
      "doi": "10.1111/jpc.12496",
      "journal": "J Paediatr Child Health",
      "volume": "50",
      "issue": "5",
      "raw": "Can mobile phone multimedia messages and text messages improve clinic attendance for Aboriginal children with chronic otitis media? A randomised controlled trial \n\t\t \n\t\t\t J H Phillips \n\t\t \n\t\t \n\t\t\t C Wigger \n\t\t \n\t\t \n\t\t\t J Beissbarth \n\t\t \n\t\t \n\t\t\t G B Mccallum \n\t\t \n\t\t \n\t\t\t A Leach \n\t\t \n\t\t \n\t\t\t P S Morris \n\t\t \n\t\t 10.1111/jpc.12496 \n\t\t Medline: 24612007] 196 \n\t \n\t \n\t\t J Paediatr Child Health \n\t\t \n\t\t\t 50 \n\t\t\t 5 \n\t\t\t \n\t\t\t 2014 May \n\t\t \n\t \n\t Phillips JH, Wigger C, Beissbarth J, McCallum GB, Leach A, Morris PS. Can mobile phone multimedia messages and text messages improve clinic attendance for Aboriginal children with chronic otitis media? A randomised controlled trial. J Paediatr Child Health 2014 May;50(5):362-367. [doi: 10.1111/jpc.12496] [Medline: 24612007] 196"
    },
    {
      "title": "A web-based peer-modeling intervention aimed at lifestyle changes in patients with coronary heart disease and chronic back pain: sequential controlled trial",
      "authors": [
        "R Schweier",
        "M Romppel",
        "C Richter",
        "E Hoberg",
        "H Hahmann",
        "I Scherwinski"
      ],
      "year": 2014,
      "doi": "10.2196/jmir.3434",
      "journal": "J Med Internet Res",
      "volume": "16",
      "issue": "7",
      "pages": "177",
      "raw": "A web-based peer-modeling intervention aimed at lifestyle changes in patients with coronary heart disease and chronic back pain: sequential controlled trial \n\t\t \n\t\t\t R Schweier \n\t\t \n\t\t \n\t\t\t M Romppel \n\t\t \n\t\t \n\t\t\t C Richter \n\t\t \n\t\t \n\t\t\t E Hoberg \n\t\t \n\t\t \n\t\t\t H Hahmann \n\t\t \n\t\t \n\t\t\t I Scherwinski \n\t\t \n\t\t 10.2196/jmir.3434 \n\t\t Medline: 25057119] 197 \n\t \n\t \n\t\t J Med Internet Res \n\t\t \n\t\t\t 16 \n\t\t\t 7 \n\t\t\t 177 \n\t\t\t 2014 \n\t\t \n\t \n\t FREE Full text \n\t Schweier R, Romppel M, Richter C, Hoberg E, Hahmann H, Scherwinski I, et al. A web-based peer-modeling intervention aimed at lifestyle changes in patients with coronary heart disease and chronic back pain: sequential controlled trial. J Med Internet Res 2014;16(7):e177 [FREE Full text] [doi: 10.2196/jmir.3434] [Medline: 25057119] 197"
    },
    {
      "title": "Attrition and adherence in a WEB-Based Distress Management Program for Implantable Cardioverter defibrillator Patients (WEBCARE): randomized controlled trial",
      "authors": [
        "M Habibovi\u0107",
        "P Cuijpers",
        "M Alings",
        "P Van Der Voort",
        "D Theuns",
        "L Bouwels"
      ],
      "year": 2014,
      "doi": "10.2196/jmir.2809",
      "journal": "J Med Internet Res",
      "volume": "16",
      "issue": "2",
      "pages": "52",
      "raw": "Attrition and adherence in a WEB-Based Distress Management Program for Implantable Cardioverter defibrillator Patients (WEBCARE): randomized controlled trial \n\t\t \n\t\t\t M Habibovi\u0107 \n\t\t \n\t\t \n\t\t\t P Cuijpers \n\t\t \n\t\t \n\t\t\t M Alings \n\t\t \n\t\t \n\t\t\t P Van Der Voort \n\t\t \n\t\t \n\t\t\t D Theuns \n\t\t \n\t\t \n\t\t\t L Bouwels \n\t\t \n\t\t 10.2196/jmir.2809 \n\t\t Medline: 24583632] 198 \n\t \n\t \n\t\t J Med Internet Res \n\t\t \n\t\t\t 16 \n\t\t\t 2 \n\t\t\t 52 \n\t\t\t 2014 \n\t\t \n\t \n\t FREE Full text \n\t Habibovi\u0107 M, Cuijpers P, Alings M, van der Voort P, Theuns D, Bouwels L, et al. Attrition and adherence in a WEB-Based Distress Management Program for Implantable Cardioverter defibrillator Patients (WEBCARE): randomized controlled trial. J Med Internet Res 2014;16(2):e52 [FREE Full text] [doi: 10.2196/jmir.2809] [Medline: 24583632] 198"
    },
    {
      "title": "Development and evaluation of an internet and personal health record training program for low-income patients with HIV or hepatitis C",
      "authors": [
        "D Mcinnes",
        "J Solomon",
        "S Shimada",
        "B Petrakis",
        "B Bokhour",
        "S Asch"
      ],
      "year": 2013,
      "doi": "10.1097/mlr.0b013e31827808bf",
      "journal": "Med Care",
      "volume": "51",
      "issue": "3 Suppl 1",
      "raw": "Development and evaluation of an internet and personal health record training program for low-income patients with HIV or hepatitis C \n\t\t \n\t\t\t D K Mcinnes \n\t\t \n\t\t \n\t\t\t J L Solomon \n\t\t \n\t\t \n\t\t\t S L Shimada \n\t\t \n\t\t \n\t\t\t B A Petrakis \n\t\t \n\t\t \n\t\t\t B G Bokhour \n\t\t \n\t\t \n\t\t\t S M Asch \n\t\t \n\t\t 10.1097/mlr.0b013e31827808bf \n\t\t Medline: 23407015] 199 \n\t \n\t \n\t\t Med Care \n\t\t \n\t\t\t 51 \n\t\t\t 3 Suppl 1 \n\t\t\t \n\t\t\t 2013 Mar \n\t\t \n\t \n\t McInnes DK, Solomon JL, Shimada SL, Petrakis BA, Bokhour BG, Asch SM, et al. Development and evaluation of an internet and personal health record training program for low-income patients with HIV or hepatitis C. Med Care 2013 Mar;51(3 Suppl 1):S62-S66. [doi: 10.1097/MLR.0b013e31827808bf] [Medline: 23407015] 199"
    },
    {
      "title": "Technological intervention for obese patients with type 2 diabetes",
      "authors": [
        "H Kim",
        "M Song"
      ],
      "year": 2008,
      "doi": "10.1016/j.apnr.2007.01.007",
      "journal": "Appl Nurs Res",
      "volume": "21",
      "issue": "2",
      "raw": "Technological intervention for obese patients with type 2 diabetes \n\t\t \n\t\t\t H S Kim \n\t\t \n\t\t \n\t\t\t M S Song \n\t\t \n\t\t 10.1016/j.apnr.2007.01.007 \n\t\t Medline: 18457747] 200 \n\t \n\t \n\t\t Appl Nurs Res \n\t\t \n\t\t\t 21 \n\t\t\t 2 \n\t\t\t \n\t\t\t 2008 May \n\t\t \n\t \n\t Kim HS, Song MS. Technological intervention for obese patients with type 2 diabetes. Appl Nurs Res 2008 May;21(2):84-89. [doi: 10.1016/j.apnr.2007.01.007] [Medline: 18457747] 200"
    },
    {
      "title": "Inviting Patients to Read Their Doctors' Notes: Patients and Doctors Look Ahead",
      "authors": [
        "T Delbanco",
        "J Walker",
        "S Bell",
        "J Darer",
        "J Elmore",
        "N Farag"
      ],
      "year": 2011,
      "doi": "10.7326/0003-4819-155-12-201112200-00003",
      "journal": "Ann Intern Med",
      "volume": "155",
      "issue": "12",
      "raw": "Inviting Patients to Read Their Doctors' Notes: Patients and Doctors Look Ahead \n\t\t \n\t\t\t T Delbanco \n\t\t \n\t\t \n\t\t\t J Walker \n\t\t \n\t\t \n\t\t\t S K Bell \n\t\t \n\t\t \n\t\t\t J D Darer \n\t\t \n\t\t \n\t\t\t J G Elmore \n\t\t \n\t\t \n\t\t\t N Farag \n\t\t \n\t\t 10.7326/0003-4819-155-12-201112200-00003 \n\t \n\t \n\t\t Ann Intern Med \n\t\t \n\t\t\t 155 \n\t\t\t 12 \n\t\t\t \n\t\t\t 2011 Apr \n\t\t \n\t \n\t Delbanco T, Walker J, Bell SK, Darer JD, Elmore JG, Farag N, et al. Inviting Patients to Read Their Doctors' Notes: Patients and Doctors Look Ahead. Ann Intern Med 2011 Apr;155(12):818-819. [doi: 10.7326/0003-4819-155-12-201112200-00003] 201"
    },
    {
      "title": "Guided self-help via internet for panic disorder: Dissemination across countries",
      "authors": [
        "T Nordgreen",
        "B Standal",
        "H Mannes",
        "T Haug",
        "B Sivertsen",
        "P Carlbring"
      ],
      "year": 2010,
      "doi": "10.1016/j.chb.2009.12.011",
      "journal": "Computers in Human Behavior",
      "volume": "26",
      "issue": "4",
      "raw": "Guided self-help via internet for panic disorder: Dissemination across countries \n\t\t \n\t\t\t T Nordgreen \n\t\t \n\t\t \n\t\t\t B Standal \n\t\t \n\t\t \n\t\t\t H Mannes \n\t\t \n\t\t \n\t\t\t T Haug \n\t\t \n\t\t \n\t\t\t B Sivertsen \n\t\t \n\t\t \n\t\t\t P Carlbring \n\t\t \n\t\t 10.1016/j.chb.2009.12.011 \n\t \n\t \n\t\t Computers in Human Behavior \n\t\t \n\t\t\t 26 \n\t\t\t 4 \n\t\t\t \n\t\t\t 2010 Jul \n\t\t \n\t \n\t Nordgreen T, Standal B, Mannes H, Haug T, Sivertsen B, Carlbring P, et al. Guided self-help via internet for panic disorder: Dissemination across countries. Computers in Human Behavior 2010 Jul;26(4):592-596. [doi: 10.1016/j.chb.2009.12.011] 202"
    },
    {
      "title": "Health behavior models in the age of mobile interventions: are our theories up to the task?",
      "authors": [
        "W Riley",
        "D Rivera",
        "A Atienza",
        "W Nilsen",
        "S Allison",
        "R Mermelstein"
      ],
      "year": 2011,
      "doi": "10.1007/s13142-011-0021-7",
      "journal": "Transl Behav Med",
      "volume": "1",
      "issue": "1",
      "raw": "Health behavior models in the age of mobile interventions: are our theories up to the task? \n\t\t \n\t\t\t W T Riley \n\t\t \n\t\t \n\t\t\t D E Rivera \n\t\t \n\t\t \n\t\t\t A Atienza \n\t\t \n\t\t \n\t\t\t W Nilsen \n\t\t \n\t\t \n\t\t\t S M Allison \n\t\t \n\t\t \n\t\t\t R Mermelstein \n\t\t \n\t\t 10.1007/s13142-011-0021-7 \n\t \n\t \n\t\t Transl Behav Med \n\t\t \n\t\t\t 1 \n\t\t\t 1 \n\t\t\t \n\t\t\t 2011 \n\t\t \n\t \n\t Riley WT, Rivera DE, Atienza A, Nilsen W, Allison SM, Mermelstein R. Health behavior models in the age of mobile interventions: are our theories up to the task? Transl Behav Med 2011;1(1):53-71. [doi: 10.1007/s13142-011-0021-7]"
    }
  ],
  "num_references": 202,
  "figures": [
    {
      "caption": "Figure 1 .",
      "description": "Figure 1. Flow diagram of included and excluded studies."
    },
    {
      "type": "table",
      "caption": "Table 1 .",
      "description": "Summary of the review results based on types of IT platforms."
    },
    {
      "type": "table",
      "caption": "Table 3 .",
      "description": "Impact of IT platforms on patient engagement (Yes=positive impact, No=no impact)."
    },
    {
      "type": "table",
      "caption": "Table 4 .",
      "description": "Impact of IT platforms and theories of health behavior (Yes=positive impact, No=no impact)."
    },
    {
      "type": "table",
      "caption": "Table 5 .",
      "description": "Patient engagement and theories of health behavior (Yes=positive impact, No=no impact)."
    },
    {
      "type": "table",
      "caption": "Table 6 .",
      "description": "Impact of IT platforms and methods to measure health outcomes (Yes=positive impact, No=no impact)."
    },
    {
      "type": "table",
      "caption": "Table 7 .",
      "description": "Impact of IT platforms and usability (Yes=positive impact, No=no impact)."
    },
    {
      "type": "table",
      "caption": "Table 8 .",
      "description": "Patient engagement and usability (Yes=positive impact, No=no impact)."
    }
  ],
  "num_figures": 8,
  "tables": [
    {
      "content": "Internet (N=86) Phone (N=44) Video game (N=6) Social network Tele-monitoring (N=16) (N=18) Health condition, n (%) Bone, joint, and 3 (3) muscle disorders"
    },
    {
      "content": "Engagement Impact of IT platforms, n (%) Internet Mobile Social media Tele-monitoring Video game Total yes Total Total Yes No Yes No Yes No Yes No Yes no Yes 66 2 (18) 36 (88) 2 (67) 12 (92) 1 (33) 15 (94) 1 (50) 6 (100) 135 (63) 6 (32) 141 (88) (83) 13 29 ( (17)"
    },
    {
      "content": "Behavior theory Impact of IT platforms, n (%) Internet Mobile Social media Tele-monitoring Video game Yes No Yes No Yes No Yes No Yes Total Total no Total yes Biomedical theory 1 (1) 1 (6) 2 (1) 2 (1) (chronic model) Behavioral learning theory 2 (2) 1 (1) 2 (1) 1 (1) 3 (2) 6 ( 2 (1) 8 (5)"
    },
    {
      "content": "Behavior theory Patient engagement, n (%) Internet Mobile Social media Tele-monitoring Video game Yes No Yes No Yes No Yes No Yes Total Total no Total yes"
    },
    {
      "content": "Methods to measure health Impact of information technology platforms, n (%) outcomes Internet Mobile Social media Tele-monitoring Video game Yes No Yes No Yes No Yes No Yes Total Total no Total yes 5 ( 58 (34)"
    },
    {
      "content": "Usability Impact of information technology platforms, n (%) Internet Mobile Social media Tele-monitoring Video game Yes No Yes No Yes No Yes No Yes Total Total no Total yes 8 ( 51 (30)"
    },
    {
      "content": "Usability Impact of information technology platforms, n (%) Internet Mobile Social media Tele-monitoring Video game Yes No Yes No Yes No Yes No Yes Total Total no Total yes 9 ( 51 (30)"
    }
  ],
  "num_tables": 7,
  "formulas": [
    {
      "text": "1 (6) 1 (2) Skin disorders 1 (2) 3 (3)"
    },
    {
      "text": "1 (6) 1 (1) Biomedical theory (chronic model) 3 (3)"
    },
    {
      "text": "Tele-monitoring (N=18) Social network (N=16) Video game (N=6) Phone (N=44) Internet (N=86) 2 ("
    }
  ],
  "num_formulas": 3,
  "num_citations": 308,
  "cited_references": [
    "b43",
    "b39",
    "b14",
    "b20",
    "b41",
    "b51",
    "b76",
    "b27",
    "b33",
    "b66",
    "b49",
    "b16",
    "b57",
    "b30",
    "b71",
    "b45",
    "b17",
    "b53",
    "b84",
    "b95",
    "b26",
    "b79",
    "b78",
    "b13",
    "b93",
    "b62",
    "b73",
    "b46",
    "b52",
    "b35",
    "b31",
    "b58",
    "b10",
    "b68",
    "b88",
    "b64",
    "b56",
    "b75",
    "b36",
    "b96",
    "b54",
    "b59",
    "b32",
    "b92",
    "b67",
    "b77",
    "b55",
    "b28",
    "b97",
    "b61",
    "b80",
    "b70",
    "b91",
    "b29",
    "b6",
    "b18",
    "b9",
    "b3",
    "b5",
    "b8",
    "b15",
    "b11",
    "b37",
    "b22",
    "b2",
    "b72",
    "b82",
    "b89",
    "b48",
    "b38",
    "b4",
    "b40",
    "b7",
    "b19",
    "b63",
    "b42",
    "b69",
    "b1",
    "b90",
    "b87",
    "b34",
    "b47",
    "b12",
    "b60",
    "b81",
    "b65",
    "b0",
    "b21",
    "b50",
    "b44",
    "b74"
  ],
  "notes": [
    "[raw_affiliation] 1  School of Informatics and Computing -Indianapolis , Department of BioHealth Informatics , IUPUI , Indianapolis , IN , United States",
    "[raw_affiliation] c  ) School of Informatics and Computing -Indianapolis Department of BioHealth Informatics IUPUI Walker Plaza ( WK) 120 719 Indiana Avenue Indianapolis , IN , 46202 United States",
    "[raw_affiliation] 2  School of Pharmacy , Chapman University , Irvine , CA , United States",
    "[raw_affiliation] 1  School of Informatics and Computing -Indianapolis , Department of BioHealth Informatics , IUPUI , Indianapolis , IN , United States",
    "[raw_affiliation] c  ) School of Informatics and Computing -Indianapolis Department of BioHealth Informatics IUPUI Walker Plaza ( WK) 120 719 Indiana Avenue Indianapolis , IN , 46202 United States",
    "[raw_affiliation] 3  Indiana University School of Nursing , Science of Nursing Care Department , Indiana University , Indianapolis , IN , United States (",
    "[raw_affiliation] 1  School of Informatics and Computing -Indianapolis , Department of BioHealth Informatics , IUPUI , Indianapolis , IN , United States",
    "JMIR Med Inform 2016 | vol. 4 | iss. 1 | e1 | p. 3 http://medinform.jmir.org/2016/1/e1/ (page number not for citation purposes)",
    "JMIR Med Inform 2016 | vol. 4 | iss. 1 | e1 | p. 4 http://medinform.jmir.org/2016/1/e1/ (page number not for citation purposes)",
    "JMIR Med Inform 2016 | vol. 4 | iss. 1 | e1 | p. 5 http://medinform.jmir.org/2016/1/e1/ (page number not for citation purposes)",
    "(page number not for citation purposes)",
    "JMIR Med Inform 2016 | vol. 4 | iss. 1 | e1 | p. 7 http://medinform.jmir.org/2016/1/e1/ (page number not for citation purposes)",
    "JMIR Med Inform 2016 | vol. 4 | iss. 1 | e1 | p. 9 http://medinform.jmir.org/2016/1/e1/ (page number not for citation purposes)",
    "JMIR Med Inform 2016 | vol. 4 | iss. 1 | e1 | p. 10 http://medinform.jmir.org/2016/1/e1/ (page number not for citation purposes)",
    "JMIR Med Inform 2016 | vol. 4 | iss. 1 | e1 | p. 19 http://medinform.jmir.org/2016/1/e1/ (page number not for citation purposes)",
    "JMIR Med Inform 2016 | vol. 4 | iss. 1 | e1 | p. 24 http://medinform.jmir.org/2016/1/e1/ (page number not for citation purposes)",
    "FREE Full text",
    "[raw_reference] Barello S, Graffigna G, Vegni E, Bosio AC. The challenges of conceptualizing patient engagement in healthcare: a lexicographic literature review. J Particip Med 2014;6:e9 [FREE Full text]",
    "6dQy9PBNI",
    "[raw_reference] Coulter A, Parsons S, Askham J. Where are the patients in decision-making about their own care?.: World Health Organization Regional Office for Europe; 2008. URL: http://www.who.int/management/general/decisionmaking/ WhereArePatientsinDecisionMaking.pdf [accessed 2015-11-30] [WebCite Cache ID 6dQy9PBNI]",
    "[raw_reference] Parekh AK. Winning their trust. N Engl J Med 2011 Jun 16;364(24):e51. [doi: 10.1056/NEJMp1105645] [Medline: 21631314]",
    "[raw_reference] Sundiatu D, Shonu G, Thomas P, Angela S. Changing patient behavior: The next frontier in healthcare value. Health Int 2012;12:65-73.",
    "Presented at",
    "[raw_reference] Bickmore T, Giorgino T. Some novel aspects of health communication from a dialogue systems perspective. 2004 Oct 24 Presented at: AAAI Fall Symposium on Dialogue Systems for Health Communication; 2004; Washington, DC p. 275-291 URL: http://www.aaai.org/Papers/Symposia/Fall/2004/FS-04-04/FS04-04-002.pdf",
    "FREE Full text",
    "[raw_reference] Vollmer WM, Feldstein A, Smith D, Dubanoski JP, Waterbury A, Schneider JL, et al. Use of health information technology to improve medication adherence. Am J Manag Care 2011 Dec;17(12 Spec No):SP79-SP87 [FREE Full text] [Medline: 22216772]",
    "[raw_reference] Or C, Karsh B. A systematic review of patient acceptance of consumer health information technology. J Am Med Inform Assoc 2009;16(4):550-560. [doi: 10.1197/jamia.M2888]",
    "FREE Full text",
    "[raw_reference] Webb TL, Joseph J, Yardley L, Michie S. Using the internet to promote health behavior change: a systematic review and meta-analysis of the impact of theoretical basis, use of behavior change techniques, and mode of delivery on efficacy. J Med Internet Res 2010;12(1):e4 [FREE Full text] [doi: 10.2196/jmir.1376] [Medline: 20164043]",
    "FREE Full text",
    "[raw_reference] Sutcliffe P, Martin S, Sturt J, Powell J, Griffiths F, Adams A, et al. Systematic review of communication technologies to promote access and engagement of young people with diabetes into healthcare. BMC Endocr Disord 2011;11:1 [FREE Full text] [doi: 10.1186/1472-6823-11-1] [Medline: 21210964]",
    "FREE Full text",
    "[raw_reference] Martyn H, Gallant LM. Over 50 and wired: Web-based stakeholder communication. FM 2012 Jun 08;17(6) 17(6) [FREE Full text] [doi: 10.5210/fm.v17i6.3449]",
    "[raw_reference] Winbush GB, McDougle L, Labranche L. Health empowerment technologies (HET): building a web-based tool to empower older African American patient-doctor relationships. J Health Care Poor Underserved 2014;24(4):106-117. [doi: 10.1353/hpu.2014.0017]",
    "FREE Full text",
    "[raw_reference] de Jong C, Ros WJ, Schrijvers G. The effects on health behavior and health outcomes of Internet-based asynchronous communication between health providers and patients with a chronic condition: a systematic review. J Med Internet Res 2014;16(1):e19 [FREE Full text] [doi: 10.2196/jmir.3000] [Medline: 24434570]",
    "FREE Full text",
    "[raw_reference] Norman GJ, Zabinski MF, Adams MA, Rosenberg DE, Yaroch AL, Atienza AA. A review of eHealth interventions for physical activity and dietary behavior change. Am J Prev Med 2007 Oct;33(4):336-345 [FREE Full text] [doi: 10.1016/j.amepre.2007.05.007] [Medline: 17888860]",
    "FREE Full text",
    "[raw_reference] Wantland DJ, Portillo CJ, Holzemer WL, Slaughter R, McGhee EM. The effectiveness of Web-based vs. non-Web-based interventions: a meta-analysis of behavioral change outcomes. J Med Internet Res 2004 Nov 10;6(4):e40 [FREE Full text] [doi: 10.2196/jmir.6.4.e40] [Medline: 15631964]",
    "[raw_reference] El-Gayar O, Timsina P, Nawar N, Eid W. A systematic review of IT for diabetes self-management: are we there yet? Int J Med Inform 2013 Aug;82(8):637-652. [doi: 10.1016/j.ijmedinf.2013.05.006] [Medline: 23792137]",
    "[raw_reference] Glanz K, Bishop DB. The role of behavioral science theory in development and implementation of public health interventions. Annu Rev Public Health 2010;31:399-418. [doi: 10.1146/annurev.publhealth.012809.103604] [Medline: 20070207]",
    "[raw_reference] Ellis SE, Speroff T, Dittus RS, Brown A, Pichert JW, Elasy T. Diabetes patient education: a meta-analysis and meta-regression. Patient Education and Counseling 2004 Jan;52(1):97-105. [doi: 10.1016/S0738-3991(03)00016-8]",
    "[raw_reference] DiClemente R, Crosby RA, Kegler M, editors. Emerging Theories in Health Promotion Practice and Research. San Francisco, CA: Jossey-Bass; 2009.",
    "FREE Full text",
    "[raw_reference] Patrick K, Marshall SJ, Davila EP, Kolodziejczyk JK, Fowler JH, Calfas KJ, et al. Design and implementation of a randomized controlled social and mobile weight loss trial for young adults (project SMART). Contemp Clin Trials 2014 Jan;37(1):10-18 [FREE Full text] [doi: 10.1016/j.cct.2013.11.001] [Medline: 24215774]",
    "Is there nothing more practical than a good theory? FREE Full text",
    "[raw_reference] Rothman AJ. \"Is there nothing more practical than a good theory?\": Why innovations and advances in health behavior change will arise if interventions are used to test and refine theory. Int J Behav Nutr Phys Act 2004 Jul 27;1(1):11 [FREE Full text] [doi: 10.1186/1479-5868-1-11] [Medline: 15279674]",
    "FREE Full text",
    "[raw_reference] Kennedy CM, Powell J, Payne TH, Ainsworth J, Boyd A, Buchan I. Active assistance technology for health-related behavior change: an interdisciplinary review. J Med Internet Res 2012;14(3):e80 [FREE Full text] [doi: 10.2196/jmir.1893] [Medline: 22698679]",
    "FREE Full text",
    "[raw_reference] Howland JL, Wright TC, Boughan R, Roberts B. How scholarly is Google Scholar? A comparison to library databases. College & Research Libraries 2009 May 01;70(3):227-234 [FREE Full text] [doi: 10.5860/crl.70.3.227]",
    "FREE Full text",
    "[raw_reference] Walters WH. Google Scholar coverage of a multidisciplinary field. Information Processing & Management 2007 Jul;43(4):1121-1132 [FREE Full text] [doi: 10.1016/j.ipm.2006.08.006]",
    "Critical Appraisal Skills Programme (CASP) 6dD1uPjZQ",
    "[raw_reference] Critical Appraisal Skills Programme (CASP). Making sense of evidence. 10 questions to help you make sense of qualitative research. England: Public Health Resource Unit; 2006. URL: http://www.caspuk.net/wpcontent/uploads/2011/11/ CASPQualitativeResearchChecklist31.05.13.pdf [accessed 2015-11-21] [WebCite Cache ID 6dD1uPjZQ]",
    "[raw_reference] Campbell R, Pound P, Pope C, Britten N, Pill R, Morgan M, et al. Evaluating meta-ethnography: a synthesis of qualitative research on lay experiences of diabetes and diabetes care. Soc Sci Med 2003 Feb;56(4):671-684. [Medline: 12560003]",
    "[raw_reference] Davids EL, Roman NV. A systematic review of the relationship between parenting styles and children's physical activity. Health, physical activity and sport in South Africa: issues and challenges. Afr J Phys Health Educ Recreat Dance 2014 Oct;20:228-246.",
    "[raw_reference] DeGeest S, Sabat\u00e9 E. Adherence to long-term therapies: evidence for action. Eur J Cardiovasc Nurs 2003 Dec;2(4):323. [Medline: 14667488]",
    "[raw_reference] Leventhal H, Cameron L. Behavioral theories and the problem of compliance. Patient Education and Counseling 1987 Oct;10(2):117-138. [doi: 10.1016/0738-3991(87)90093-0]",
    "FREE Full text",
    "[raw_reference] Munro S, Lewin S, Swart T, Volmink J. A review of health behaviour theories: how useful are these for developing interventions to promote long-term medication adherence for TB and HIV/AIDS? BMC Public Health 2007;7:104 [FREE Full text] [doi: 10.1186/1471-2458-7-104] [Medline: 17561997]",
    "FREE Full text",
    "[raw_reference] Johnston JD, Massey AP, Devaneaux CA. Innovation in weight loss programs: a 3-dimensional virtual-world approach. J Med Internet Res 2012;14(5):e120 [FREE Full text] [doi: 10.2196/jmir.2254] [Medline: 22995535]",
    "[raw_reference] Adachi Y, Sato C, Yamatsu K, Ito S, Adachi K, Yamagami T. A randomized controlled trial on the long-term effects of a 1-month behavioral weight control program assisted by computer tailored advice. Behav Res Ther 2007 Mar;45(3):459-470. [doi: 10.1016/j.brat.2006.03.017] [Medline: 16713991]",
    "[raw_reference] Napolitano MA, Fotheringham M, Tate D, Sciamanna C, Leslie E, Owen N, et al. Evaluation of an internet-based physical activity intervention: a preliminary investigation. Ann Behav Med 2003;25(2):92-99. [Medline: 12704010]",
    "[raw_reference] Arora S, Peters AL, Burner E, Lam CN, Menchine M. Trial to examine text message-based mHealth in emergency department patients with diabetes (TExT-MED): a randomized controlled trial. Ann Emerg Med 2014 Jun;63(6):745-754.e6. [doi: 10.1016/j.annemergmed.2013.10.012] [Medline: 24225332]",
    "FREE Full text",
    "[raw_reference] Sugawara Y, Narimatsu H, Hozawa A, Shao L, Otani K, Fukao A. Cancer patients on Twitter: a novel patient community on social media. BMC Res Notes 2012;5:699 [FREE Full text] [doi: 10.1186/1756-0500-5-699] [Medline: 23270426]",
    "FREE Full text",
    "[raw_reference] Winstead-Derlega C, Rafaly M, Delgado S, Freeman J, Cutitta K, Miles T, et al. A pilot study of delivering peer health messages in an HIV clinic via mobile media. Telemed J E Health 2012;18(6):464-469 [FREE Full text] [doi: 10.1089/tmj.2011.0236] [Medline: 22732025]",
    "[raw_reference] King SN, Davis L, Lehman JJ, Ruddy BH. A model for treating voice disorders in school-age children within a video gaming environment. J Voice 2012 Sep;26(5):656-663. [doi: 10.1016/j.jvoice.2011.08.002] [Medline: 22209055]",
    "FREE Full text",
    "[raw_reference] Tildesley HD, Mazanderani AB, Ross SA. Effect of Internet therapeutic intervention on A1C levels in patients with type 2 diabetes treated with insulin. Diabetes Care 2010 Aug;33(8):1738-1740 [FREE Full text] [doi: 10.2337/dc09-2256] [Medline: 20668152]",
    "FREE Full text",
    "[raw_reference] Scherr D, Kastner P, Kollmann A, Hallas A, Auer J, Krappinger H, et al. Effect of home-based telemonitoring using mobile phone technology on the outcome of heart failure patients after an episode of acute decompensation: randomized controlled trial. J Med Internet Res 2009;11(3):e34 [FREE Full text] [doi: 10.2196/jmir.1252] [Medline: 19687005]",
    "[raw_reference] Kwon H, Cho J, Kim H, Song B, Ko S, Lee J, et al. Establishment of blood glucose monitoring system using the internet. Diabetes Care 2004 Feb;27(2):478-483. [Medline: 14747232]",
    "[raw_reference] Danaher BG, Boles SM, Akers M. Defining participant exposure measures in Web-based health behavior change programs. J Med Internet Res 2006;8(3):e15. [doi: 10.2196/jmir.8.3.e15]",
    "[raw_reference] Steele R, Mummery KW, Dwyer T. Development and process evaluation of an internet-based physical activity behaviour change program. Patient Educ Couns 2007 Jul;67(1-2):127-136. [doi: 10.1016/j.pec.2007.02.013] [Medline: 17416479]",
    "[raw_reference] Song H, May A, Vaidhyanathan V, Cramer EM, Owais RW, McRoy S. A two-way text-messaging system answering health questions for low-income pregnant women. Patient Educ Couns 2013 Aug;92(2):182-187. [doi: 10.1016/j.pec.2013.04.016] [Medline: 23711635]",
    "FREE Full text",
    "[raw_reference] Benhamou P, Melki V, Boizel R, Perreal F, Quesada J, Bessieres-Lacombe S, et al. One-year efficacy and safety of Web-based follow-up using cellular phone in type 1 diabetic patients under insulin pump therapy: the PumpNet study. Diabetes Metab 2007 Jun;33(3):220-226 [FREE Full text] [doi: 10.1016/j.diabet.2007.01.002] [Medline: 17395516]",
    "FREE Full text",
    "[raw_reference] Chen ZW, Fang LZ, Chen LY, Dai HL. Comparison of an SMS text messaging and phone reminder to improve attendance at a health promotion center: a randomized controlled trial. J Zhejiang Univ Sci B 2008 Jan;9(1):34-38 [FREE Full text] [doi: 10.1631/jzus.B071464] [Medline: 18196610]",
    "[raw_reference] Kaplan K, Salzer MS, Solomon P, Brusilovskiy E, Cousounis P. Internet peer support for individuals with psychiatric disabilities: A randomized controlled trial. Soc Sci Med 2011 Jan;72(1):54-62. [doi: 10.1016/j.socscimed.2010.09.037] [Medline: 21112682]",
    "FREE Full text",
    "[raw_reference] Thackeray R, Crookston BT, West JH. Correlates of health-related social media use among adults. J Med Internet Res 2013;15(1):e21 [FREE Full text] [doi: 10.2196/jmir.2297] [Medline: 23367505]",
    "[raw_reference] Wakefield BJ, Ward MM, Holman JE, Ray A, Scherubel M, Burns TL, et al. Evaluation of home telehealth following hospitalization for heart failure: a randomized trial. Telemed J E Health 2008 Oct;14(8):753-761. [doi: 10.1089/tmj.2007.0131] [Medline: 18954244]",
    "[raw_reference] Ramaekers BT, Janssen-Boyne JJ, Gorgels AM, Vrijhoef HM. Adherence among telemonitored patients with heart failure to pharmacological and nonpharmacological recommendations. Telemed J E Health 2009;15(6):517-524. [doi: 10.1089/tmj.2008.0160] [Medline: 19566401]",
    "FREE Full text",
    "[raw_reference] Andrade AA, McGruder HF, Wu AW, Celano SA, Skolasky RL, Selnes OA, et al. A programmable prompting device improves adherence to highly active antiretroviral therapy in HIV-infected subjects with memory impairment. Clin Infect Dis 2005 Sep 15;41(6):875-882 [FREE Full text] [doi: 10.1086/432877] [Medline: 16107989]",
    "[raw_reference] Shaw LH, Gant LM. In defense of the internet: the relationship between Internet communication and depression, loneliness, self-esteem, and perceived social support. Cyberpsychol Behav 2002 Apr;5(2):157-171. [Medline: 12025883]",
    "FREE Full text",
    "[raw_reference] Franklin VL, Greene A, Waller A, Greene SA, Pagliari C. Patients' engagement with \"Sweet Talk\" -a text messaging support system for young people with diabetes. J Med Internet Res 2008;10(2):e20 [FREE Full text] [doi: 10.2196/jmir.962] [Medline: 18653444]",
    "FREE Full text",
    "[raw_reference] Magnezi R, Bergman YS, Grosberg D. Online activity and participation in treatment affects the perceived efficacy of social health networks among patients with chronic illness. J Med Internet Res 2014;16(1):e12 [FREE Full text] [doi: 10.2196/jmir.2630] [Medline: 24413148]",
    "[raw_reference] McKay HG, Glasgow RE, Feil EG, Boles SM, Barrera MJ. Internet-based diabetes self-management and support: Initial outcomes from the Diabetes Network project. Rehabilitation Psychology 2002 Jul;47(1):31-48. [doi: 10.1037/0090-5550.47.1.31]",
    "[raw_reference] McKay HG, King D, Eakin EG, Seeley JR, Glasgow RE. The diabetes network internet-based physical activity intervention: a randomized pilot study. Diabetes Care 2001 Aug;24(8):1328-1334. [Medline: 11473065]",
    "[raw_reference] Coyle D, Doherty G, Sharry J. An evaluation of a solution focused computer game in adolescent interventions. Clin Child Psychol Psychiatry 2009 Jul;14(3):345-360. [doi: 10.1177/1359104508100884] [Medline: 19515752]",
    "[raw_reference] Jelsma D, Geuze RH, Mombarg R, Smits-Engelsman B. The impact of Wii Fit intervention on dynamic balance control in children with probable Developmental Coordination Disorder and balance problems. Hum Mov Sci 2014 Feb;33:404-418. [doi: 10.1016/j.humov.2013.12.007] [Medline: 24444657]",
    "[raw_reference] Chan DS, Callahan CW, Sheets SJ, Moreno CN, Malone FJ. An Internet-based store-and-forward video home telehealth system for improving asthma outcomes in children. Am J Health Syst Pharm 2003 Oct 1;60(19):1976-1981. [Medline: 14531243]",
    "[raw_reference] Galiano-Castillo N, Ariza-Garc\u00eda A, Cantarero-Villanueva I, Fern\u00e1ndez-Lao C, S\u00e1nchez-Salado C, Arroyo-Morales M. Agreement between telerehabilitation involving caregivers and face-to-face clinical assessment of lymphedema in breast cancer survivors. Support Care Cancer 2014 Jan;22(1):253-258. [doi: 10.1007/s00520-013-1971-8] [Medline: 24043290]",
    "[raw_reference] Gray JE, Safran C, Davis RB, Pompilio-Weitzner G, Stewart JE, Zaccagnini L, et al. Baby CareLink: using the internet and telemedicine to improve care for high-risk infants. Pediatrics 2000 Dec;106(6):1318-1324. [Medline: 11099583]",
    "FREE Full text",
    "[raw_reference] Kinney AY, Boonyasiriwat W, Walters ST, Pappas LM, Stroup AM, Schwartz MD, et al. Telehealth personalized cancer risk communication to motivate colonoscopy in relatives of patients with colorectal cancer: the family CARE Randomized controlled trial. J Clin Oncol 2014 Mar 1;32(7):654-662 [FREE Full text] [doi: 10.1200/JCO.2013.51.6765] [Medline: 24449229]",
    "[raw_reference] Meiland FM, Hattink BJ, Overmars-Marx T, de Boer ME, Jedlitschka A, Ebben PWG, et al. Participation of end users in the design of assistive technology for people with mild to severe cognitive problems; the European Rosetta project. Int Psychogeriatr 2014 May;26(5):769-779. [doi: 10.1017/S1041610214000088] [Medline: 24507571]",
    "[raw_reference] Price M, Gros DF. Examination of prior experience with telehealth and comfort with telehealth technology as a moderator of treatment response for PTSD and depression in veterans. Int J Psychiatry Med 2014;48(1):57-67. [doi: 10.2190/PM.48.1.e] [Medline: 25354926]",
    "[raw_reference] Spaniel F, Vohl\u00eddka P, Hrdlicka J, Kozen\u00fd J, Nov\u00e1k T, Motlov\u00e1 L, et al. ITAREPS: information technology aided relapse prevention programme in schizophrenia. Schizophr Res 2008 Jan;98(1-3):312-317. [doi: 10.1016/j.schres.2007.09.005] [Medline: 17920245]",
    "FREE Full text",
    "[raw_reference] Weinstock RS, Brooks G, Palmas W, Morin PC, Teresi JA, Eimicke JP, et al. Lessened decline in physical activity and impairment of older adults with diabetes with telemedicine and pedometer use: results from the IDEATel study. Age Ageing 2011 Jan;40(1):98-105 [FREE Full text] [doi: 10.1093/ageing/afq147] [Medline: 21081539]",
    "[raw_reference] Franklin VL, Waller A, Pagliari C, Greene SA. A randomized controlled trial of Sweet Talk, a text-messaging system to support young people with diabetes. Diabet Med 2006 Dec;23(12):1332-1338. [doi: 10.1111/j.1464-5491.2006.01989.x] [Medline: 17116184]",
    "[raw_reference] Stacy JN, Schwartz SM, Ershoff D, Shreve MS. Incorporating tailored interactive patient solutions using interactive voice response technology to improve statin adherence: results of a randomized clinical trial in a managed care setting. Popul Health Manag 2009 Oct;12(5):241-254. [doi: 10.1089/pop.2008.0046] [Medline: 19848566]",
    "FREE Full text",
    "[raw_reference] Granholm E, Ben-Zeev D, Link PC, Bradshaw KR, Holden JL. Mobile Assessment and Treatment for Schizophrenia (MATS): a pilot trial of an interactive text-messaging intervention for medication adherence, socialization, and auditory hallucinations. Schizophr Bull 2012 May;38(3):414-425 [FREE Full text] [doi: 10.1093/schbul/sbr155] [Medline: 22080492]",
    "FREE Full text",
    "[raw_reference] Rodgers A, Corbett T, Bramley D, Riddell T, Wills M, Lin RB, et al. Do u smoke after txt? Results of a randomised trial of smoking cessation using mobile phone text messaging. Tob Control 2005 Aug;14(4):255-261 [FREE Full text] [doi: 10.1136/tc.2005.011577] [Medline: 16046689]",
    "discussion 485",
    "[raw_reference] Brendryen H, Kraft P. Happy ending: a randomized controlled trial of a digital multi-media smoking cessation intervention. Addiction 2008 Mar;103(3):478-84; discussion 485. [doi: 10.1111/j.1360-0443.2007.02119.x] [Medline: 18269367]",
    "FREE Full text",
    "[raw_reference] Hurling R, Catt M, Boni MD, Fairley BW, Hurst T, Murray P, et al. Using internet and mobile phone technology to deliver an automated physical activity program: randomized controlled trial. J Med Internet Res 2007;9(2):e7 [FREE Full text] [doi: 10.2196/jmir.9.2.e7] [Medline: 17478409]",
    "FREE Full text",
    "[raw_reference] Gold J, Lim MC, Hellard ME, Hocking JS, Keogh L. What's in a message? Delivering sexual health promotion to young people in Australia via text messaging. BMC Public Health 2010;10:792 [FREE Full text] [doi: 10.1186/1471-2458-10-792] [Medline: 21190584]",
    "FREE Full text",
    "[raw_reference] Gabriele JM, Carpenter BD, Tate DF, Fisher EB. Directive and nondirective e-coach support for weight loss in overweight adults. Ann Behav Med 2011 Apr;41(2):252-263 [FREE Full text] [doi: 10.1007/s12160-010-9240-2] [Medline: 21108032]",
    "FREE Full text",
    "[raw_reference] Simon GE, Ludman EJ, Goodale LC, Dykstra DM, Stone E, Cutsogeorge D, et al. An online recovery plan program: can peer coaching increase participation? Psychiatr Serv 2011 Jun;62(6):666-669 [FREE Full text] [doi: 10.1176/ps.62.6.pss6206_0666] [Medline: 21632737]",
    "[raw_reference] Gustafson DH, Hawkins R, Pingree S, McTavish F, Arora NK, Mendenhall J, et al. Effect of computer support on younger women with breast cancer. J Gen Intern Med 2001 Jul 14;16(7):435-445. [doi: 10.1046/j.1525-1497.2001.016007435.x]",
    "[raw_reference] Kato PM, Cole SW, Bradlyn AS, Pollock BH. A video game improves behavioral outcomes in adolescents and young adults with cancer: a randomized trial. Pediatrics 2008 Aug;122(2):e305-e317. [doi: 10.1542/peds.2007-3134] [Medline: 18676516]",
    "FREE Full text",
    "[raw_reference] Bingham PM, Lahiri T, Ashikaga T. Pilot trial of spirometer games for airway clearance practice in cystic fibrosis. Respir Care 2012 Aug;57(8):1278-1284 [FREE Full text] [doi: 10.4187/respcare.01263] [Medline: 22348602]",
    "FREE Full text",
    "[raw_reference] Green BB, Cook AJ, Ralston JD, Fishman PA, Catz SL, Carlson J, et al. Effectiveness of home blood pressure monitoring, Web communication, and pharmacist care on hypertension control: a randomized controlled trial. JAMA 2008 Jun 25;299(24):2857-2867 [FREE Full text] [doi: 10.1001/jama.299.24.2857] [Medline: 18577730]",
    "[raw_reference] Read E. Feasibility of the Diabetes and Technology for Increased Activity (DaTA) Study: a pilot intervention in high-risk rural adults. J Phys Act Health 2014 Jan;11(1):118-126. [doi: 10.1123/jpah.2011-0381] [Medline: 23249608]",
    "[raw_reference] Reback CJ, Grant DL, Fletcher JB, Branson CM, Shoptaw S, Bowers JR, et al. Text messaging reduces HIV risk behaviors among methamphetamine-using men who have sex with men. AIDS Behav 2012 Oct;16(7):1993-2002. [doi: 10.1007/s10461-012-0200-7] [Medline: 22610370]",
    "FREE Full text",
    "[raw_reference] Glasgow RE, Christiansen SM, Kurz D, King DK, Woolley T, Faber AJ, et al. Engagement in a diabetes self-management website: usage patterns and generalizability of program use. J Med Internet Res 2011;13(1):e9 [FREE Full text] [doi: 10.2196/jmir.1391] [Medline: 21371992]",
    "[raw_reference] Claborn KR, Leffingwell TR, Miller MB, Meier E, Stephens JR. Pilot study examining the efficacy of an electronic intervention to promote HIV medication adherence. AIDS Care 2014;26(3):404-409. [doi: 10.1080/09540121.2013.824534] [Medline: 23909858]",
    "FREE Full text",
    "[raw_reference] Bantum EO, Albright CL, White KK, Berenberg JL, Layi G, Ritter PL, et al. Surviving and thriving with cancer using a Web-based health behavior change intervention: randomized controlled trial. J Med Internet Res 2014;16(2):e54 [FREE Full text] [doi: 10.2196/jmir.3020] [Medline: 24566820]",
    "[raw_reference] Gutierrez N, Kindratt TB, Pagels P, Foster B, Gimpel NE. Health literacy, health information seeking behaviors and internet use among patients attending a private and public clinic in the same geographic area. J Community Health 2014 Feb;39(1):83-89. [doi: 10.1007/s10900-013-9742-5] [Medline: 23900880]",
    "FREE Full text",
    "[raw_reference] Agarwal R, Anderson C, Zarate J, Ward C. If we offer it, will they accept? Factors affecting patient use intentions of personal health records and secure messaging. J Med Internet Res 2013;15(2):e43 [FREE Full text] [doi: 10.2196/jmir.2243] [Medline: 23470453]",
    "FREE Full text",
    "[raw_reference] Agricola E, Pandolfi E, Gonfiantini MV, Gesualdo F, Romano M, Carloni E, et al. A cohort study of a tailored web intervention for preconception care. BMC Med Inform Decis Mak 2014;14:33 [FREE Full text] [doi: 10.1186/1472-6947-14-33] [Medline: 24731520]",
    "[raw_reference] Barnabei VM, O'Connor JJ, Nimphius NM, Vierkant RA, Eaker ED. The effects of a web-based tool on patient-provider communication and satisfaction with hormone therapy: a randomized evaluation. J Womens Health (Larchmt) 2008;17(1):147-158. [doi: 10.1089/jwh.2007.0369] [Medline: 18240991]",
    "[raw_reference] Botts NE, Horan TA, Thoms BP. HealthATM: personal health cyberinfrastructure for underserved populations. Am J Prev Med 2011 May;40(5 Suppl 2):S115-S122. [doi: 10.1016/j.amepre.2011.01.016] [Medline: 21521584]",
    "FREE Full text",
    "[raw_reference] Boudreaux ED, Bedek KL, Byrne NJ, Baumann BM, Lord SA, Grissom G. The Computer-Assisted Brief Intervention for Tobacco (CABIT) program: a pilot study. J Med Internet Res 2012;14(6):e163 [FREE Full text] [doi: 10.2196/jmir.2074] [Medline: 23208070]",
    "[raw_reference] Buhrman M, Skoglund A, Husell J, Bergstr\u00f6m K, Gordh T, Hursti T, et al. Guided internet-delivered acceptance and commitment therapy for chronic pain patients: a randomized controlled trial. Behav Res Ther 2013 Jun;51(6):307-315. [doi: 10.1016/j.brat.2013.02.010] [Medline: 23548250]",
    "FREE Full text",
    "[raw_reference] Feldman PH, Murtaugh CM, Pezzin LE, McDonald MV, Peng TR. Just-in-time evidence-based e-mail \"reminders\" in home health care: impact on patient outcomes. Health Serv Res 2005 Jun;40(3):865-885 [FREE Full text] [doi: 10.1111/j.1475-6773.2005.00389.x] [Medline: 15960695]",
    "[raw_reference] Glynn SM, Randolph ET, Garrick T, Lui A. A proof of concept trial of an online psychoeducational program for relatives of both veterans and civilians living with schizophrenia. Psychiatr Rehabil J 2010;33(4):278-287. [doi: 10.2975/33.4.2010.278.287] [Medline: 20374986]",
    "[raw_reference] Gustafson DH, McTavish FM, Stengle W, Ballard D, Hawkins R, Shaw BR, et al. Use and Impact of eHealth System by Low-income Women With Breast Cancer. J Health Commun 2005;10 Suppl 1:195-218. [doi: 10.1080/10810730500263257] [Medline: 16377608]",
    "FREE Full text",
    "[raw_reference] Hasin DS, Aharonovich E, Greenstein E. HealthCall for the smartphone: technology enhancement of brief intervention in HIV alcohol dependent patients. Addict Sci Clin Pract 2014;9:5 [FREE Full text] [doi: 10.1186/1940-0640-9-5] [Medline: 24533631]",
    "FREE Full text",
    "[raw_reference] Irvine AB, Gelatt VA, Seeley JR, Macfarlane P, Gau JM. Web-based intervention to promote physical activity by sedentary older adults: randomized controlled trial. J Med Internet Res 2013;15(2):e19 [FREE Full text] [doi: 10.2196/jmir.2158] [Medline: 23470322]",
    "[raw_reference] Iverson SA, Howard KB, Penney BK. Impact of internet use on health-related behaviors and the patient-physician relationship: a survey-based study and review. J Am Osteopath Assoc 2008 Dec;108(12):699-711. [Medline: 19075034]",
    "[raw_reference] Krishna S, Francisco BD, Balas EA, K\u00f6nig P, Graff GR, Madsen RW, et al. Internet-enabled interactive multimedia asthma education program: a randomized trial. Pediatrics 2003 Mar;111(3):503-510. [Medline: 12612228]",
    "Suppl FREE Full text",
    "[raw_reference] Lee CJ, Gray SW, Lewis N. Internet use leads cancer patients to be active health care consumers. Patient Educ Couns 2010 Dec;81 Suppl:S63-S69 [FREE Full text] [doi: 10.1016/j.pec.2010.09.004] [Medline: 20889279]",
    "FREE Full text",
    "[raw_reference] Lewis N, Gray SW, Freres DR, Hornik RC. Examining cross-source engagement with cancer-related information and its impact on doctor-patient relations. Health Commun 2009 Dec;24(8):723-734 [FREE Full text] [doi: 10.1080/10410230903264030] [Medline: 20183381]",
    "[raw_reference] Lorig KR, Ritter PL, Laurent DD, Plant K. Internet-based chronic disease self-management: a randomized trial. Med Care 2006 Nov;44(11):964-971. [doi: 10.1097/01.mlr.0000233678.80203.c1] [Medline: 17063127] 100",
    "FREE Full text",
    "[raw_reference] Osborn CY, Mayberry LS, Wallston KA, Johnson KB, Elasy TA. Understanding patient portal use: implications for medication management. J Med Internet Res 2013;15(7):e133 [FREE Full text] [doi: 10.2196/jmir.2589] [Medline: 23823974] 101",
    "[raw_reference] Rooke S, Gates P, Norberg M, Copeland J. Applying technology to the treatment of cannabis use disorder: Comparing telephone versus Internet delivery using data from two completed trials. J Subst Abuse Treat 2014;46(1):78-84. [doi: 10.1016/j.jsat.2013.08.007] 102",
    "FREE Full text",
    "[raw_reference] Ross SE, Moore LA, Earnest MA, Wittevrongel L, Lin CT. Providing a web-based online medical record with electronic communication capabilities to patients with congestive heart failure: randomized trial. J Med Internet Res 2004 May 14;6(2):e12 [FREE Full text] [doi: 10.2196/jmir.6.2.e12] [Medline: 15249261] 103",
    "FREE Full text",
    "[raw_reference] Urowitz S, Wiljer D, Dupak K, Kuehner Z, Leonard K, Lovrics E, et al. Improving diabetes management with a patient portal: a qualitative study of diabetes self-management portal. J Med Internet Res 2012;14(6):e158 [FREE Full text] [doi: 10.2196/jmir.2265] [Medline: 23195925] 104",
    "FREE Full text",
    "[raw_reference] van den Berg MH, Ronday HK, Peeters AJ, Voogt-van der Harst EM, Munneke M, Breedveld FC, et al. Engagement and satisfaction with an Internet-based physical activity intervention in patients with rheumatoid arthritis. Rheumatology (Oxford) 2007 Mar;46(3):545-552 [FREE Full text] [doi: 10.1093/rheumatology/kel341] [Medline: 17043050] 105",
    "FREE Full text",
    "[raw_reference] Villegas N, Santisteban D, Cianelli R, Ferrer L, Ambrosia T, Peragallo N, et al. The development, feasibility and acceptability of an Internet-based STI-HIV prevention intervention for young Chilean women. Int Nurs Rev 2014 Mar;61(1):55-63 [FREE Full text] [doi: 10.1111/inr.12080] [Medline: 24512261] 106",
    "[raw_reference] Winzelberg AJ, Eppstein D, Eldredge KL, Wilfley D, Dasmahapatra R, Dev P, et al. Effectiveness of an Internet-based program for reducing risk factors for eating disorders. J Consult Clin Psychol 2000 Apr;68(2):346-350. [Medline: 10780136] 107",
    "FREE Full text",
    "[raw_reference] Harris LT, Lehavot K, Huh D, Yard S, Andrasik MP, Dunbar PJ, et al. Two-way text messaging for health behavior change among human immunodeficiency virus-positive individuals. Telemed J E Health 2010 Dec;16(10):1024-1029 [FREE Full text] [doi: 10.1089/tmj.2010.0050] [Medline: 21087122] 108",
    "[raw_reference] Tran BX, Houston S. Mobile phone-based antiretroviral adherence support in Vietnam: feasibility, patient's preference, and willingness-to-pay. AIDS Behav 2012 Oct;16(7):1988-1992. [doi: 10.1007/s10461-012-0271-5] [Medline: 22814571] 109",
    "[raw_reference] Shrier LA, Rhoads A, Burke P, Walls C, Blood EA. Real-time, contextual intervention using mobile technology to reduce marijuana use among youth: A Pilot Study. Addict Behav 2014;39(1):173-180. [doi: 10.1016/j.addbeh.2013.09.028] 110",
    "[raw_reference] Fisher J, Clayton M. Who gives a tweet: assessing patients' interest in the use of social media for health care. Worldviews Evid Based Nurs 2012 Apr;9(2):100-108. [doi: 10.1111/j.1741-6787.2012.00243.x] [Medline: 22432730] 111",
    "FREE Full text",
    "[raw_reference] Greene JA, Choudhry NK, Kilabuk E, Shrank WH. Online social networking by patients with diabetes: a qualitative evaluation of communication with Facebook. J Gen Intern Med 2011 Mar;26(3):287-292 [FREE Full text] [doi: 10.1007/s11606-010-1526-3] [Medline: 20945113] 112",
    "[raw_reference] Boland MV, Chang DS, Frazier T, Plyler R, Jefferys JL, Friedman DS. Automated telecommunication-based reminders and adherence with once-daily glaucoma medication dosing: the automated dosing reminder study. JAMA Ophthalmol 2014 Jul;132(7):845-850. [doi: 10.1001/jamaophthalmol.2014.857] [Medline: 24831037] 113",
    "[raw_reference] Bond GE, Burr RL, Wolf FM, Feldt K. The effects of a web-based intervention on psychosocial well-being among adults aged 60 and older with diabetes: a randomized trial. Diabetes Educ 2010;36(3):446-456. [doi: 10.1177/0145721710366758] [Medline: 20375351] 114",
    "[raw_reference] Buhrman M, F\u00e4ltenhag S, Str\u00f6m L, Andersson G. Controlled trial of Internet-based treatment with telephone support for chronic back pain. Pain 2004 Oct;111(3):368-377. [doi: 10.1016/j.pain.2004.07.021] [Medline: 15363881] 115",
    "FREE Full text",
    "[raw_reference] Christensen H, Griffiths KM, Jorm AF. Delivering interventions for depression by using the internet: randomised controlled trial. BMJ 2004 Jan 31;328(7434):265 [FREE Full text] [doi: 10.1136/bmj.37945.566632.EE] [Medline: 14742346] 116",
    "[raw_reference] Herbst N, Voderholzer U, Thiel N, Schaub R, Knaevelsrud C, Stracke S, et al. No talking, just writing! Efficacy of an Internet-based cognitive behavioral therapy with exposure and response prevention in obsessive compulsive disorder. Psychother Psychosom 2014;83(3):165-175. [doi: 10.1159/000357570] [Medline: 24732962] 117",
    "[raw_reference] Houston TK, Cooper LA, Ford DE. Internet support groups for depression: a 1-year prospective cohort study. Am J Psychiatry 2002 Dec;159(12):2062-2068. [doi: 10.1176/appi.ajp.159.12.2062] [Medline: 12450957] 118",
    "[raw_reference] Kerr J, Patrick K, Norman G, Stein MB, Calfas K, Zabinski M, et al. Randomized control trial of a behavioral intervention for overweight women: impact on depressive symptoms. Depress Anxiety 2008;25(7):555-558. [doi: 10.1002/da.20320] [Medline: 17557319] 119",
    "[raw_reference] Rotondi AJ, Anderson CM, Haas GL, Eack SM, Spring MB, Ganguli R, et al. Web-based psychoeducational intervention for persons with schizophrenia and their supporters: one-year outcomes. Psychiatr Serv 2010 Nov;61(11):1099-1105. [doi: 10.1176/ps.2010.61.11.1099] [Medline: 21041348] 120",
    "[raw_reference] Roy H, Gillett T. E-mail: a new technique for forming a therapeutic alliance with high-risk young people failing to engage with mental health services? A case study. Clin Child Psychol Psychiatry 2008 Jan;13(1):95-103. [Medline: 18411868] 121.",
    "[raw_reference] Baptist AP, Thompson M, Grossman KS, Mohammed L, Sy A, Sanders GM. Social media, text messaging, and email-preferences of asthma patients between 12 and 40 years old. J Asthma 2011 Oct;48(8):824-830. [doi: 10.3109/02770903.2011.608460] [Medline: 21864099] 122",
    "FREE Full text",
    "[raw_reference] Nguyen HQ, Donesky-Cuenco D, Wolpin S, Reinke LF, Benditt JO, Paul SM, et al. Randomized controlled trial of an internet-based versus face-to-face dyspnea self-management program for patients with chronic obstructive pulmonary disease: pilot study. J Med Internet Res 2008;10(2):e9 [FREE Full text] [doi: 10.2196/jmir.990] [Medline: 18417444] 123",
    "[raw_reference] Ostojic V, Cvoriscec B, Ostojic SB, Reznikoff D, Stipic-Markovic A, Tudjman Z. Improving asthma control through telemedicine: a study of short-message service. Telemed J E Health 2005 Feb;11(1):28-35. [doi: 10.1089/tmj.2005.11.28] [Medline: 15785218] 124",
    "[raw_reference] Tate DF, Jackvony EH, Wing RR. A randomized trial comparing human e-mail counseling, computer-automated tailored counseling, and no counseling in an Internet weight loss program. Arch Intern Med 2006;166(15):1620-1625. [doi: 10.1001/archinte.166.15.1620] [Medline: 16908795] 125",
    "FREE Full text",
    "[raw_reference] Johnson F, Wardle J. The association between weight loss and engagement with a web-based food and exercise diary in a commercial weight loss programme: a retrospective analysis. Int J Behav Nutr Phys Act 2011;8:83 [FREE Full text] [doi: 10.1186/1479-5868-8-83] [Medline: 21810222] 126",
    "[raw_reference] Kornman KP, Shrewsbury VA, Chou AC, Nguyen B, Lee A, O'Connor J, et al. Electronic therapeutic contact for adolescent weight management: the Loozit study. Telemed J E Health 2010;16(6):678-685. [doi: 10.1089/tmj.2009.0180] [Medline: 20575613] 127",
    "[raw_reference] Park MJ, Kim HS. Evaluation of mobile phone and Internet intervention on waist circumference and blood pressure in post-menopausal women with abdominal obesity. Int J Med Inform 2012 Jun;81(6):388-394. [doi: 10.1016/j.ijmedinf.2011.12.011] [Medline: 22265810] 128",
    "FREE Full text",
    "[raw_reference] Patrick K, Raab F, Adams MA, Dillon L, Zabinski M, Rock CL, et al. A text message-based intervention for weight loss: randomized controlled trial. J Med Internet Res 2009;11(1):e1 [FREE Full text] [doi: 10.2196/jmir.1100] [Medline: 19141433] 129",
    "[raw_reference] Petersen R, Sill S, Lu C, Young J, Edington DW. Effectiveness of employee internet-based weight management program. J Occup Environ Med 2008 Feb;50(2):163-171. [doi: 10.1097/JOM.0b013e31815c6cf6] [Medline: 18301173] 130",
    "FREE Full text",
    "[raw_reference] Steinberg DM, Levine EL, Lane I, Askew S, Foley PB, Puleo E, et al. Adherence to self-monitoring via interactive voice response technology in an eHealth intervention targeting weight gain prevention among Black women: randomized controlled trial. J Med Internet Res 2014;16(4):e114 [FREE Full text] [doi: 10.2196/jmir.2996] [Medline: 24780934] 131",
    "FREE Full text",
    "[raw_reference] Turner-McGrievy GM, Tate DF. Are we sure that Mobile Health is really mobile? An examination of mobile device use during two remotely-delivered weight loss interventions. Int J Med Inform 2014 May;83(5):313-319 [FREE Full text] [doi: 10.1016/j.ijmedinf.2014.01.002] [Medline: 24556530] 132",
    "FREE Full text",
    "[raw_reference] Ware LJ, Hurling R, Bataveljic O, Fairley BW, Hurst TL, Murray P, et al. Rates and determinants of uptake and use of an internet physical activity and weight management program in office and manufacturing work sites in England: cohort study. J Med Internet Res 2008;10(4):e56 [FREE Full text] [doi: 10.2196/jmir.1108] [Medline: 19117828] 133",
    "FREE Full text",
    "[raw_reference] McKay HG, Danaher BG, Seeley JR, Lichtenstein E, Gau JM. Comparing two web-based smoking cessation programs: randomized controlled trial. J Med Internet Res 2008;10(5):e40 [FREE Full text] [doi: 10.2196/jmir.993] [Medline: 19017582] 134",
    "[raw_reference] Bramley D, Riddell T, Whittaker R, Corbett T, Lin RB, Wills M, et al. Smoking cessation using mobile phone text messaging is as effective in Maori as non-Maori. N Z Med J 2005 Jun 3;118(1216):U1494. [Medline: 15937529] 135",
    "FREE Full text",
    "[raw_reference] Richardson A, Graham AL, Cobb N, Xiao H, Mushro A, Abrams D, et al. Engagement promotes abstinence in a web-based cessation intervention: cohort study. J Med Internet Res 2013;15(1):e14 [FREE Full text] [doi: 10.2196/jmir.2277] [Medline: 23353649] 136",
    "FREE Full text",
    "[raw_reference] Strecher VJ, McClure J, Alexander G, Chakraborty B, Nair V, Konkel J, et al. The role of engagement in a tailored web-based smoking cessation program: randomized controlled trial. J Med Internet Res 2008;10(5):e36 [FREE Full text] [doi: 10.2196/jmir.1002] [Medline: 18984557] 137",
    "[raw_reference] Kim HS, Jeong HS. A nurse short message service by cellular phone in type-2 diabetic patients for six months. J Clin Nurs 2007 Jun;16(6):1082-1087. [doi: 10.1111/j.1365-2702.2007.01698.x] [Medline: 17518883] 138",
    "[raw_reference] Cho JH, Chang SA, Kwon HS, Choi YH, Ko SH, Moon SD, et al. Long-term effect of the Internet-based glucose monitoring system on HbA1c reduction and glucose stability: a 30-month follow-up study for diabetes management with a ubiquitous medical care system. Diabetes Care 2006 Dec;29(12):2625-2631. [doi: 10.2337/dc05-2371] [Medline: 17130195] 139",
    "FREE Full text",
    "[raw_reference] Fonda SJ, McMahon GT, Gomes HE, Hickson S, Conlin PR. Changes in diabetes distress related to participation in an internet-based diabetes care management program and glycemic control. J Diabetes Sci Technol 2009 Jan;3(1):117-124 [FREE Full text] [Medline: 20046656] 140",
    "[raw_reference] Kim CJ, Kim HS. Effectiveness of mobile and internet intervention in patients with obese type 2 diabetes. Int J Med Inform 2008 Jun;77(6):399-404. [doi: 10.1016/j.ijmedinf.2007.07.006] [Medline: 17881285] 141",
    "FREE Full text",
    "[raw_reference] McCarrier KP, Ralston JD, Hirsch IB, Lewis G, Martin DP, Zimmerman FJ, et al. Web-based collaborative care for type 1 diabetes: a pilot randomized trial. Diabetes Technol Ther 2009 Apr;11(4):211-217 [FREE Full text] [doi: 10.1089/dia.2008.0063] [Medline: 19344195] 142",
    "[raw_reference] Rami B, Popow C, Horn W, Waldhoer T, Schober E. Telemedical support to improve glycemic control in adolescents with type 1 diabetes mellitus. Eur J Pediatr 2006 Oct;165(10):701-705. [doi: 10.1007/s00431-006-0156-6] [Medline: 16670859] 143",
    "FREE Full text",
    "[raw_reference] McMahon GT, Gomes HE, Hickson HS, Hu TMJ, Levine BA, Conlin PR. Web-based care management in patients with poorly controlled diabetes. Diabetes Care 2005 Jul;28(7):1624-1629 [FREE Full text] [Medline: 15983311] 144",
    "[raw_reference] Meigs JB, Cagliero E, Dubey A, Murphy-Sheehy P, Gildesgame C, Chueh H, et al. A controlled trial of web-based diabetes disease management: the MGH diabetes primary care improvement project. Diabetes Care 2003 Mar;26(3):750-757. [Medline: 12610033] 145",
    "[raw_reference] Quinn CC, Clough SS, Minor JM, Lender D, Okafor MC, Gruber-Baldini A. WellDoc mobile diabetes management randomized controlled trial: change in clinical and behavioral outcomes and patient and physician satisfaction. Diabetes Technol Ther 2008 Jun;10(3):160-168. [doi: 10.1089/dia.2008.0283] [Medline: 18473689] 146",
    "FREE Full text",
    "[raw_reference] Ralston JD, Hirsch IB, Hoath J, Mullen M, Cheadle A, Goldberg HI. Web-based collaborative care for type 2 diabetes: a pilot randomized trial. Diabetes Care 2009 Feb;32(2):234-239 [FREE Full text] [doi: 10.2337/dc08-1220] [Medline: 19017773] 147",
    "FREE Full text",
    "[raw_reference] Bell AM, Fonda SJ, Walker MS, Schmidt V, Vigersky RA. Mobile phone-based video messages for diabetes self-care support. J Diabetes Sci Technol 2012 Mar;6(2):310-319 [FREE Full text] [Medline: 22538140] 148",
    "[raw_reference] Smith KE, Levine BA, Clement SC, Hu MJ, Alaoui A, Mun SK. Impact of MyCareTeam for poorly controlled diabetes mellitus. Diabetes Technol Ther 2004 Dec;6(6):828-835. [doi: 10.1089/dia.2004.6.828] [Medline: 15684636] 149",
    "[raw_reference] Tasker APB, Gibson L, Franklin V, Gregor P, Greene S. What is the frequency of symptomatic mild hypoglycemia in type 1 diabetes in the young?: assessment by novel mobile phone technology and computer-based interviewing. Pediatr Diabetes 2007 Feb;8(1):15-20. [doi: 10.1111/j.1399-5448.2006.00220.x] [Medline: 17341287] 150",
    "FREE Full text",
    "[raw_reference] Weppner WG, Ralston JD, Koepsell TD, Grothaus LC, Reid RJ, Jordan L, et al. Use of a shared medical record with secure messaging by older patients with diabetes. Diabetes Care 2010 Nov;33(11):2314-2319 [FREE Full text] [doi: 10.2337/dc10-1124] [Medline: 20739686] 151",
    "[raw_reference] Yoon KH, Kim HS. A short message service by cellular phone in type 2 diabetic patients for 12 months. Diabetes Res Clin Pract 2008 Feb;79(2):256-261. [doi: 10.1016/j.diabres.2007.09.007] [Medline: 17988756] 152",
    "FREE Full text",
    "[raw_reference] Espie CA, Kyle SD, Williams C, Ong JC, Douglas NJ, Hames P, et al. A randomized, placebo-controlled trial of online cognitive behavioral therapy for chronic insomnia disorder delivered via an automated media-rich web application. Sleep 2012 Jun;35(6):769-781 [FREE Full text] [doi: 10.5665/sleep.1872] [Medline: 22654196] 153",
    "[raw_reference] Kiselev AR, Gridnev VI, Shvartz VA, Posnenkova OM, Dovgalevsky PY. Active ambulatory care management supported by short message services and mobile phone technology in patients with arterial hypertension. J Am Soc Hypertens 2012;6(5):346-355. [doi: 10.1016/j.jash.2012.08.001] [Medline: 22995803] 154",
    "[raw_reference] Park MJ, Kim HS, Kim KS. Cellular phone and Internet-based individual intervention on blood pressure and obesity in obese patients with hypertension. Int J Med Inform 2009 Oct;78(10):704-710. [doi: 10.1016/j.ijmedinf.2009.06.004] [Medline: 19643661] 155",
    "FREE Full text",
    "[raw_reference] Ginsburg OM, Chowdhury M, Wu W, Chowdhury TI, Pal BC, Hasan R, et al. An mHealth model to increase clinic attendance for breast symptoms in rural Bangladesh: can bridging the digital divide help close the cancer divide? Oncologist 2014 Feb;19(2):177-185 [FREE Full text] [doi: 10.1634/theoncologist.2013-0314] [Medline: 24396050] 156",
    "[raw_reference] Zernicke KA, Campbell TS, Speca M, McCabe-Ruff K, Flowers S, Carlson LE. A randomized wait-list controlled trial of feasibility and efficacy of an online mindfulness-based cancer recovery program: the eTherapy for cancer applying mindfulness trial. Psychosom Med 2014 May;76(4):257-267. [doi: 10.1097/PSY.0000000000000053] [Medline: 24804884] 157",
    "[raw_reference] McCann L, Maguire R, Miller M, Kearney N. Patients' perceptions and experiences of using a mobile phone-based advanced symptom management system (ASyMS) to monitor and manage chemotherapy related toxicity. Eur J Cancer Care (Engl) 2009 Mar;18(2):156-164. [doi: 10.1111/j.1365-2354.2008.00938.x] [Medline: 19267731] 158",
    "[raw_reference] Christensen A, Christrup LL, Fabricius PE, Chrostowska M, Wronka M, Narkiewicz K, et al. The impact of an electronic monitoring and reminder device on patient compliance with antihypertensive therapy: a randomized controlled trial. J Hypertens 2010 Jan;28(1):194-200. [doi: 10.1097/HJH.0b013e328331b718] [Medline: 19770778] 159",
    "[raw_reference] Oh E, Jorm AF, Wright A. Perceived helpfulness of websites for mental health information: a national survey of young Australians. Soc Psychiatry Psychiatr Epidemiol 2009 Apr;44(4):293-299. [doi: 10.1007/s00127-008-0443-9] [Medline: 18830552] 160",
    "[raw_reference] Downer SR, Meara JG, Da Costa AC. Use of SMS text messaging to improve outpatient attendance. Med J Aust 2005 Oct 3;183(7):366-368. [Medline: 16201955] 161",
    "[raw_reference] Farmer T, Brook G, McSorley J, Murphy S, Mohamed A. Using short message service text reminders to reduce 'did not attend' rates in sexual health and HIV appointment clinics. Int J STD AIDS 2014 Mar;25(4):289-293. [doi: 10.1177/0956462413502325] [Medline: 23999939] 162",
    "FREE Full text",
    "[raw_reference] Kay-Lambkin F, Baker A, Lewin T, Carr V. Acceptability of a clinician-assisted computerized psychological intervention for comorbid mental health and substance use problems: treatment adherence data from a randomized controlled trial. J Med Internet Res 2011;13(1):e11 [FREE Full text] [doi: 10.2196/jmir.1522] [Medline: 21273184] 163",
    "FREE Full text",
    "[raw_reference] Liew SM, Tong SF, Lee Verna KM, Ng CJ, Leong KC, Teng CL. Text messaging reminders to reduce non-attendance in chronic disease follow-up: a clinical trial. Br J Gen Pract 2009 Dec;59(569):916-920 [FREE Full text] [doi: 10.3399/bjgp09X472250] [Medline: 19712544] 164",
    "[raw_reference] McInnes DK, Petrakis BA, Gifford AL, Rao SR, Houston TK, Asch SM, et al. Retaining homeless veterans in outpatient care: a pilot study of mobile phone text message appointment reminders. Am J Public Health 2014 Sep;104 Suppl 4:S588-S594. [doi: 10.2105/AJPH.2014.302061] [Medline: 25100425] 165",
    "[raw_reference] Sims H, Sanghara H, Hayes D, Wandiembe S, Finch M, Jakobsen H, et al. Text message reminders of appointments: a pilot intervention at four community mental health clinics in London. Psychiatr Serv 2012 Feb 1;63(2):161-168. [doi: 10.1176/appi.ps.201100211] [Medline: 22302334] 166",
    "[raw_reference] Stockwell MS, Kharbanda EO, Martinez RA, Vargas CY, Vawdrey DK, Camargo S. Effect of a text messaging intervention on influenza vaccination in an urban, low-income pediatric and adolescent population: a randomized controlled trial. JAMA 2012 Apr 25;307(16):1702-1708. [doi: 10.1001/jama.2012.502] [Medline: 22535855] 167",
    "FREE Full text",
    "[raw_reference] Glasgow RE, Kurz D, King D, Dickman JM, Faber AJ, Halterman E, et al. Twelve-month outcomes of an Internet-based diabetes self-management support program. Patient Educ Couns 2012 Apr;87(1):81-92 [FREE Full text] [doi: 10.1016/j.pec.2011.07.024] [Medline: 21924576] 168",
    "Suppl FREE Full text",
    "[raw_reference] Heisler M, Choi H, Palmisano G, Mase R, Richardson C, Fagerlin A, et al. Comparison of community health worker-led diabetes medication decision-making support for low-income Latino and African American adults with diabetes using e-health tools versus print materials: a randomized, controlled trial. Ann Intern Med 2014 Nov 18;161(10 Suppl):S13-S22 [FREE Full text] [doi: 10.7326/M13-3012] [Medline: 25402398] 169",
    "FREE Full text",
    "[raw_reference] Heyworth L, Paquin AM, Clark J, Kamenker V, Stewart M, Martin T, et al. Engaging patients in medication reconciliation via a patient portal following hospital discharge. J Am Med Inform Assoc 2014 Feb;21(e1):e157-e162 [FREE Full text] [doi: 10.1136/amiajnl-2013-001995] [Medline: 24036155] 170",
    "FREE Full text",
    "[raw_reference] Meglic M, Furlan M, Kuzmanic M, Kozel D, Baraga D, Kuhar I, et al. Feasibility of an eHealth service to support collaborative depression care: results of a pilot study. J Med Internet Res 2010;12(5):e63 [FREE Full text] [doi: 10.2196/jmir.1510] [Medline: 21172765] 171",
    "[raw_reference] Parr JM, Kavanagh DJ, Young RM, Mitchell G. Acceptability of cognitive-behaviour therapy via the Internet for cessation of benzodiazepine use. Drug Alcohol Rev 2011 May;30(3):306-314. [doi: 10.1111/j.1465-3362.2010.00183.x] [Medline: 21545562] 172",
    "[raw_reference] Santschi V, Wuerzner G, Schneider MP, Bugnon O, Burnier M. Clinical evaluation of IDAS II, a new electronic device enabling drug adherence monitoring. Eur J Clin Pharmacol 2007 Dec;63(12):1179-1184. [doi: 10.1007/s00228-007-0364-7] [Medline: 17899047] 173",
    "[raw_reference] Vilella A, Bayas JM, Diaz MT, Guinovart C, Diez C, Sim\u00f3 D, et al. The role of mobile phones in improving vaccination rates in travelers. Prev Med 2004 Apr;38(4):503-509. [doi: 10.1016/j.ypmed.2003.12.005] [Medline: 15020186] 174",
    "[raw_reference] van der Vaart R, Drossaert CH, Taal E, Drossaers-Bakker KW, Vonkeman HE, van der Laar MA. Impact of patient-accessible electronic medical records in rheumatology: use, satisfaction and effects on empowerment among patients. BMC Musculoskelet Disord 2014 Feb;15(1):102. [doi: 10.1186/1471-2474-15-102] [Medline: 19017773] 175",
    "[raw_reference] Kulkarni A, Wright E, Kingdom J. Web-based education and attitude to delivery by caesarean section in nulliparous women. J Obstet Gynaecol Can 2014 Sep;36(9):768-775. [Medline: 25222355] 176",
    "FREE Full text",
    "[raw_reference] Keyserling TC, Sheridan SL, Draeger LB, Finkelstein EA, Gizlice Z, Kruger E, et al. A comparison of live counseling with a web-based lifestyle and medication intervention to reduce coronary heart disease risk: a randomized clinical trial. JAMA Intern Med 2014 Jul;174(7):1144-1157 [FREE Full text] [doi: 10.1001/jamainternmed.2014.1984] [Medline: 24861959] 177",
    "FREE Full text",
    "[raw_reference] Aikens JE, Zivin K, Trivedi R, Piette JD. Diabetes self-management support using mHealth and enhanced informal caregiving. J Diabetes Complications 2014;28(2):171-176 [FREE Full text] [doi: 10.1016/j.jdiacomp.2013.11.008] [Medline: 24374137] 178",
    "FREE Full text",
    "[raw_reference] Helander E, Kaipainen K, Korhonen I, Wansink B. Factors related to sustained use of a free mobile app for dietary self-monitoring with photography and peer feedback: retrospective cohort study. J Med Internet Res 2014;16(4):e109 [FREE Full text] [doi: 10.2196/jmir.3084] [Medline: 24735567] 179",
    "FREE Full text",
    "[raw_reference] Holtz B, Krein SL, Bentley DR, Hughes ME, Giardino ND, Richardson CR. Comparison of Veteran experiences of low-cost, home-based diet and exercise interventions. J Rehabil Res Dev 2014;51(1):149-160 [FREE Full text] [doi: 10.1682/JRRD.2013.04.0088] [Medline: 24805901] 180",
    "[raw_reference] Hunter CM, Peterson AL, Alvarez LM, Poston WC, Brundige AR, Haddock CK, et al. Weight management using the internet a randomized controlled trial. Am J Prev Med 2008 Feb;34(2):119-126. [doi: 10.1016/j.amepre.2007.09.026] [Medline: 18201641] 181",
    "[raw_reference] Kim CJ, Kang DH. Utility of a Web-based intervention for individuals with type 2 diabetes: the impact on physical activity levels and glycemic control. Comput Inform Nurs 2006;24(6):337-345. [Medline: 17108753] 182",
    "[raw_reference] Plotnikoff RC, McCargar LJ, Wilson PM, Loucaides CA. Efficacy of an E-mail intervention for the promotion of physical activity and nutrition behavior in the workplace context. Am J Health Promot 2005;19(6):422-429. [Medline: 16022206] 183",
    "FREE Full text",
    "[raw_reference] ter Huurne ED, Postel MG, de Haan HA, Drossaert CHC, DeJong CAJ. Web-based treatment program using intensive therapeutic contact for patients with eating disorders: before-after study. J Med Internet Res 2013;15(2):e12 [FREE Full text] [doi: 10.2196/jmir.2211] [Medline: 23380291] 184",
    "WebCite Cache ID 6dRRLxYJs",
    "[raw_reference] Trautmann E, Kroner-Herwig B. BABCP. 2008. Internet-based self-help training for children and adolescents with recurrent headache: a pilot study URL: https://www.psych.uni-goettingen.de/de/clinical/team/bkroene/ TrautmannpilotstudieIBI_BCP_2008.pdf [accessed 2015-11-30] [WebCite Cache ID 6dRRLxYJs] 185",
    "[raw_reference] Lee TI, Yeh YT, Liu CT, Chen PL. Development and evaluation of a patient-oriented education system for diabetes management. Int J Med Inform 2007 Sep;76(9):655-663. [doi: 10.1016/j.ijmedinf.2006.05.030] [Medline: 16815741] 186",
    "[raw_reference] Sciamanna CN, Nicholson RA, Lofland JH, Manocchia M, Mui S, Hartman CW. Effects of a Website designed to improve the management of migraines. Headache 2006 Jan;46(1):92-100. [doi: 10.1111/j.1526-4610.2006.00312.x] [Medline: 16412156] 187",
    "FREE Full text",
    "[raw_reference] Schnall R, Wantland D, Velez O, Cato K, Jia H. Feasibility testing of a web-based symptom self-management system for persons living with HIV. J Assoc Nurses AIDS Care 2014;25(4):364-371 [FREE Full text] [doi: 10.1016/j.jana.2013.09.002] [Medline: 24434198] 188",
    "[raw_reference] Furber GV, Crago AE, Meehan K, Sheppard TD, Hooper K, Abbot DT, et al. How adolescents use SMS (short message service) to micro-coordinate contact with youth mental health outreach services. J Adolesc Health 2011 Jan;48(1):113-115. [doi: 10.1016/j.jadohealth.2010.05.022] [Medline: 21185535] 189",
    "FREE Full text",
    "[raw_reference] Greysen SR, Khanna RR, Jacolbia R, Lee HM, Auerbach AD. Tablet computers for hospitalized patients: a pilot study to improve inpatient engagement. J Hosp Med 2014 Jun;9(6):396-399 [FREE Full text] [doi: 10.1002/jhm.2169] [Medline: 24523051] 190",
    "[raw_reference] Idriss SZ, Kvedar JC, Watson AJ. The role of online support communities: benefits of expanded social networks to patients with psoriasis. Arch Dermatol 2009 Jan;145(1):46-51. [doi: 10.1001/archdermatol.2008.529] [Medline: 19153342] 191",
    "[raw_reference] Lancioni GE, Singh NN, O'Reilly MF, Sigafoos J, Ferlisi G, Ferrarese G, et al. Technology-aided programs for assisting communication and leisure engagement of persons with amyotrophic lateral sclerosis: two single-case studies. Res Dev Disabil 2012;33(5):1605-1614. [doi: 10.1016/j.ridd.2012.03.028] [Medline: 22537857] 192",
    "[raw_reference] Lester R, Ritvo P, Mills E, Kariri A, Karanja S, Chung M, et al. Effects of a mobile phone short message service on antiretroviral treatment adherence in Kenya (WelTel Kenya1): a randomised trial. The Lancet 2010 Nov 15;376(9755):1838-1845. [doi: 10.1016/S0140-6736(10)61997-6] 193",
    "[raw_reference] Womble LG, Wadden TA, McGuckin BG, Sargent SL, Rothman RA, Krauthamer-Ewing ES. A randomized controlled trial of a commercial internet weight loss program. Obes Res 2004 Jun;12(6):1011-1018. [doi: 10.1038/oby.2004.124] [Medline: 15229342] 194",
    "[raw_reference] Williamson DA, Walden HM, White MA, York-Crowe E, Newton RL, Alfonso A, et al. Two-year internet-based randomized controlled trial for weight loss in African-American girls. Obesity (Silver Spring) 2006 Jul;14(7):1231-1243. [doi: 10.1038/oby.2006.140] [Medline: 16899804] 195",
    "[raw_reference] Phillips JH, Wigger C, Beissbarth J, McCallum GB, Leach A, Morris PS. Can mobile phone multimedia messages and text messages improve clinic attendance for Aboriginal children with chronic otitis media? A randomised controlled trial. J Paediatr Child Health 2014 May;50(5):362-367. [doi: 10.1111/jpc.12496] [Medline: 24612007] 196",
    "FREE Full text",
    "[raw_reference] Schweier R, Romppel M, Richter C, Hoberg E, Hahmann H, Scherwinski I, et al. A web-based peer-modeling intervention aimed at lifestyle changes in patients with coronary heart disease and chronic back pain: sequential controlled trial. J Med Internet Res 2014;16(7):e177 [FREE Full text] [doi: 10.2196/jmir.3434] [Medline: 25057119] 197",
    "FREE Full text",
    "[raw_reference] Habibovi\u0107 M, Cuijpers P, Alings M, van der Voort P, Theuns D, Bouwels L, et al. Attrition and adherence in a WEB-Based Distress Management Program for Implantable Cardioverter defibrillator Patients (WEBCARE): randomized controlled trial. J Med Internet Res 2014;16(2):e52 [FREE Full text] [doi: 10.2196/jmir.2809] [Medline: 24583632] 198",
    "[raw_reference] McInnes DK, Solomon JL, Shimada SL, Petrakis BA, Bokhour BG, Asch SM, et al. Development and evaluation of an internet and personal health record training program for low-income patients with HIV or hepatitis C. Med Care 2013 Mar;51(3 Suppl 1):S62-S66. [doi: 10.1097/MLR.0b013e31827808bf] [Medline: 23407015] 199",
    "[raw_reference] Kim HS, Song MS. Technological intervention for obese patients with type 2 diabetes. Appl Nurs Res 2008 May;21(2):84-89. [doi: 10.1016/j.apnr.2007.01.007] [Medline: 18457747] 200",
    "[raw_reference] Delbanco T, Walker J, Bell SK, Darer JD, Elmore JG, Farag N, et al. Inviting Patients to Read Their Doctors' Notes: Patients and Doctors Look Ahead. Ann Intern Med 2011 Apr;155(12):818-819. [doi: 10.7326/0003-4819-155-12-201112200-00003] 201",
    "[raw_reference] Nordgreen T, Standal B, Mannes H, Haug T, Sivertsen B, Carlbring P, et al. Guided self-help via internet for panic disorder: Dissemination across countries. Computers in Human Behavior 2010 Jul;26(4):592-596. [doi: 10.1016/j.chb.2009.12.011] 202",
    "[raw_reference] Riley WT, Rivera DE, Atienza A, Nilsen W, Allison SM, Mermelstein R. Health behavior models in the age of mobile interventions: are our theories up to the task? Transl Behav Med 2011;1(1):53-71. [doi: 10.1007/s13142-011-0021-7]"
  ],
  "processing_software": {
    "GROBID": "0.8.2"
  },
  "journal": "JMIR Medical Informatics",
  "volume": "4",
  "issue": "1",
  "pages": "e1",
  "zotero_recovery": {
    "fields_recovered": [
      "journal"
    ],
    "timestamp": "2025-09-01T11:08:21.452064",
    "zotero_item_type": "journalArticle"
  }
}
