{
  "paper_id": "U4L6UWYA",
  "title": "Digital Health in Diabetes Care: A Narrative Review from Monitoring to the Management of Systemic and Neurologic Complications",
  "abstract": "Background/Objectives: Despite the recent advances in glucose-lowering therapy, achieving diabetes control remains challenging. With the advancing progress of innovative digital health technologies, management of diabetes is taking advantage from telehealth and telemedicine, which allow for remote assistance, virtual visits, and monitoring of diabetes-related parameters, and facilitate the exchange of documents and reports to support clinical decisions. We aim to provide an overview of the impact of telehealth and digital technologies on the care of people with diabetes, from therapeutic management to the assessment of complications. Methods: A comprehensive literature search was conducted using PubMed to assess the impact of digital technologies and telemedicine on diabetes care. Results: From the comprehensive PubMed search, 86 peer-reviewed studies were selected based on relevance, clinical significance, and methodological quality. The selected literature addressed digital health tools such as continuous glucose monitoring, connected insulin pens, automatic insulin delivery systems, mobile applications, and telemedicine systems. These interventions were associated with improved glycemic control (e.g., reduced HbA1c, increased time in range), better adherence to therapy, enhanced patient engagement, and more efficient management of complications such as neuropathy, retinopathy, and cardiovascular risk. Conclusions: Telehealth may offer a fully patientcentered approach to disease management through a tailored individual management plan. This may lead to an improvement in adherence to proper therapy and lifestyle, resulting in a subsequent increase in the quality of life.",
  "year": 2025,
  "date": "2025-06-14",
  "authors": [
    {
      "name": "Elisabetta Maida",
      "email": "elisabetta.maida@studenti.unicampania.it",
      "affiliation": {
        "organization": "Department of Advanced Medical and Surgical Sciences",
        "department": "Department of Advanced Medical and Surgical Sciences",
        "institution": "University of Campania \"Luigi Vanvitelli\"",
        "address": "80138, Naples, Italy;"
      }
    },
    {
      "name": "Paola Caruso",
      "email": "paola.caruso@unicampania.it",
      "orcid": "0000-0002-4756-2022",
      "affiliation": {
        "organization": "Department of Advanced Medical and Surgical Sciences",
        "department": "Department of Advanced Medical and Surgical Sciences",
        "institution": "University of Campania \"Luigi Vanvitelli\"",
        "address": "80138, Naples, Italy;"
      }
    },
    {
      "name": "Simona Bonavita",
      "email": "simona.bonavita@unicampania.it",
      "orcid": "0000-0002-8561-9720"
    },
    {
      "name": "Gianmarco Abbadessa",
      "email": "gianmarco.abbadessa@unicampania.it",
      "orcid": "0000-0002-8561-9720",
      "affiliation": {
        "organization": "Department of Brain Sciences",
        "department": "Department of Brain Sciences",
        "institution": "Imperial College London",
        "address": "W120BZ, London, UK"
      }
    },
    {
      "name": "Giuseppina Miele",
      "email": "giuseppina.miele@unicampania.it"
    },
    {
      "name": "Miriam Longo",
      "email": "miriam.longo@unicampania.it",
      "orcid": "0000-0002-6459-5854"
    },
    {
      "name": "Lorenzo Scappaticcio",
      "email": "lorenzo.scappaticcio@unicampania.it",
      "orcid": "0000-0002-6459-5854"
    },
    {
      "name": "Eleonora Ruocco",
      "email": "eleonora.ruocco@unicampania.it",
      "orcid": "0000-0002-3500-0153",
      "affiliation": {
        "organization": "Department of Mental and Physical Health and Preventive Medicine",
        "department": "Department of Mental and Physical Health and Preventive Medicine",
        "institution": "University of Campania \"Luigi Vanvitelli\"",
        "address": "80138, Naples, Italy;"
      }
    },
    {
      "name": "Francesca Trojsi",
      "email": "francesca.trojsi@unicampania.it",
      "orcid": "0000-0002-3790-8018"
    },
    {
      "name": "Katherine Esposito",
      "email": "katherine.esposito@unicampania.it",
      "orcid": "0000-0002-3790-8018",
      "affiliation": {
        "organization": "Department of Advanced Medical and Surgical Sciences",
        "department": "Department of Advanced Medical and Surgical Sciences",
        "institution": "University of Campania \"Luigi Vanvitelli\"",
        "address": "80138, Naples, Italy;"
      }
    },
    {
      "name": "Luigi Lavorgna",
      "email": "luigi.lavorgna@policliniconapoli.it"
    },
    {
      "name": "Maria Maiorino",
      "email": "mariaida.maiorino@unicampania.it",
      "orcid": "0000-0003-4659-7546",
      "affiliation": {
        "organization": "Department of Advanced Medical and Surgical Sciences",
        "department": "Department of Advanced Medical and Surgical Sciences",
        "institution": "University of Campania \"Luigi Vanvitelli\"",
        "address": "80138, Naples, Italy;"
      }
    },
    {
      "affiliation": {
        "organization": "Pediatric Neurology",
        "department": "Pediatric Neurology",
        "institution": "Santobono-Pausilipon Childrens Hospital",
        "address": "80129, Naples, Italy"
      }
    }
  ],
  "doi": "10.3390/jcm14124240",
  "orcid": "0000-0003-4659-7546",
  "md5": "DF5997BB8C80D5E145FF055FAFCA3BE5",
  "publication": {
    "journal": "Diabetes Care",
    "journal_inferred": true
  },
  "keywords": [
    "diabetes",
    "digital health",
    "neurological complications",
    "technology"
  ],
  "sections": [
    {
      "title": "1.. Introduction",
      "text": "Together with cardiovascular diseases, cancer, and respiratory chronic diseases, diabetes mellitus (DM) is included in the category of \"non communicable chronic diseases\" (NCDs). NCDs are responsible for the highest burden of morbidity and mortality worldwide, and these four groups of diseases account for over 80% of all NCD-related premature deaths  [1] . With a worldwide prevalence on the rise, type 1 diabetes (T1DM) and type 2 diabetes (T2DM) represent significant global health threats  [2] . Projections show that by 2045, one in eight adults (approximately 783 million) will be living with DM, indicating a 46% increase in its prevalence rate. This scenario implies an ever-growing number of people requiring lifelong care and clinical assistance, with an increasing burden on National Healthcare Systems.\n\nAs a \"pervasive\" disease, diabetes requires continuous monitoring, frequent followups and multidisciplinary management to optimize the achievement of therapeutic targets within a holistic person-centered approach  [3] . Additionally, the management of DM has to address not only glucose-lowering therapy but also the control of the other cardiovascular risk factors and related comorbidities  [3] .\n\nDespite the recent advances in glucose-lowering therapy, achieving diabetes control remains challenging. Key contributors to therapeutic failure include poor patients' adherence to medications and clinical inertia, which is the reluctance of clinicians to initiate or intensify therapy according to evidence-based guidelines  [4] . To overcome the multiple and challenging obstacles to the optimal diabetes control, an organized and structured model of chronic care should be proposed for people with diabetes (PwD)  [5] . With the increasing progress of innovative digital health technologies, the development of a \"digital virtual diabetes clinic\" has provided a valuable opportunity to implement effective and efficient diabetes management (Figure  1 )  [6] . The figure illustrates the conceptual framework of a digital, virtual diabetes clinic, highlighting the integration of innovative digital health technologies for effective and efficient diabetes management. Through at-home blood glucose monitoring, telemedicine consultations, and personalized digital interventions, the digital virtual clinic offers a comprehensive approach to diabetes management, enhancing patient engagement and clinical outcomes.\n\nThe aim of this narrative review was to evaluate the impact of telehealth and digital technologies on the care of PwD, from therapeutic management to the assessment of complications. The goal was to provide a comprehensive understanding of how telehealth can revolutionize diabetes care, enhance patient care, and contribute to the efficiency of national healthcare systems."
    },
    {
      "title": "2.. Materials and Methods",
      "text": "This narrative review aimed to explore the role of telemedicine and digital health technologies in the management of diabetes, with a particular focus on their application in addressing both systemic and neurological complications. To this end, a comprehensive literature search was conducted in PubMed, targeting publications from January 2015 to December 2024; however, no lower time limit was strictly applied, and earlier studies were included if deemed conceptually or clinically relevant.\n\nThe search strategy included combinations of the following terms and keywords: \"diabetes\", \"type 1 diabetes\", \"type 2 diabetes\", \"diabetes care\", \"diabetes complications\", \"diabetes risk factors\", \"digital health\", \"digital therapeutics\", \"telemedicine\", \"telehealth\", \"televisits\", \"mobile applications\", \"web-based interventions\", \"continuous glucose monitoring\", \"connected insulin pens\", \"automatic insulin delivery\", \"unmet needs\", \"treatment gaps\", \"patient needs\".\n\nInclusion criteria were as follows:\n\n1. Peer-reviewed articles published in English; 2. Studies addressing the use of digital health tools in diabetes care, including type 1 diabetes, type 2 diabetes, and gestational diabetes; 3. Articles focusing on therapeutic strategies, monitoring technologies, and the management or prevention of complications.\n\nWe prioritized peer-reviewed studies reporting clinical outcomes in people with diabetes, including reviews, meta-analyses, randomized controlled trials, and observational studies, if relevant to the scope. Non-English publications, editorials, and opinion pieces were excluded. Relevant articles were identified and located to examine citing and cited-by articles. In total, 86 articles were selected for inclusion based on their thematic relevance and scientific contribution. The review followed the Scale for the Assessment of Narrative Review Articles (SANRA) criteria.\n\nA narrative synthesis was developed to describe the various digital health technologies and to assess their role in symptom management, therapeutic intervention, and complication prevention in diabetes care. An overview of the principal digital health interventions, their key proximal outcomes, and the long-term complications they target is provided in Table  S1  of Supplementary Materials."
    },
    {
      "title": "3.. Results"
    },
    {
      "title": "3.1.. Unmet Needs in PwD",
      "text": "Several studies have attempted to investigate the unmet needs of people with both T1DM and T2DM  [7] [8] [9] , defined as the range of difficulties and challenges experienced by individuals throughout the course of the disease, from diagnosis to long-term therapeutic, clinical, and psychosocial management.\n\nThe DAWN2 study  [8] , which took its name from its predecessor, the DAWN study  [7] , was conducted in 17 states on more than 16,000 individuals, including patients with both T1DM and T2DM, caregivers, family members, and healthcare professionals. An online questionnaire was administered, covering several topics, such as the impact of the disease on their quality of life, diabetes management and control, support from family members, society and healthcare system, and unmet needs and hopes for the future. The results showed a clear need for psychosocial support, with 44.6% reporting distress related to the diagnosis and 13.8% showing signs of potential depression. The majority of PwD reported to be poorly involved by their physician and emphasized the need to be provided with a better education on self-management as well as psychological and social support. The issue of support was also raised by family members and caregivers who perceived diabetes as a physical and emotional burden (35.3%), with a struggle to find the appropriate way to help their loved ones.\n\nRaposo and colleagues  [9]  administered an online questionnaire to 300 individuals newly diagnosed with T2DM and currently treated with glucose-lowering drugs. The responses revealed a low-to-medium level of knowledge of diabetes and related conditions prior to diagnosis (mean: 4.4 on a scale of 0 to 10); after the first visit, most responders were very satisfied with the information received. The most important unmet needs that emerged were the need to improve both the awareness and information about T2DM to enable early diagnosis; the desire for better support concerning diet and dietary habits; and lastly, the expectation for a new method of blood glucose monitoring that could be real-time and painless.\n\nIn the light of these considerations, it became essential to highlight possible solutions and assess the corresponding patient satisfaction. Digital health applied to the complexities of chronic conditions has the enormous potential to improve clinical care, thus leading to a decrease in the rate of acute and chronic complications and to an improvement of the quality of life, relieving the economic and social burden on the healthcare system and caregivers  [10] ."
    },
    {
      "title": "3.2.. Telehealth and Its Application in Diabetes Care",
      "text": "Telehealth is defined as the utilization of digital technologies to deliver medical care, health education, and public health services by connecting multiple users in separate locations  [11] , indicating a model of care delivery rather than a specific treatment or therapeutic strategy. As a subset of telehealth, telemedicine refers to the exchange of medical information from one site to another via electronic communications to improve a patient's clinical health status  [11]  (Table  1 ). As a chronic disease requiring frequent interaction between patients and healthcare providers (HCPs), diabetes could benefit from a remote approach based on digital technologies.\n\nNumerous guidelines or international panels have identified three key areas of application for telemedicine in diabetes care to improve patients' outcomes, increase access to care and reduce costs: 1. secondary prevention; 2. diagnosis; and 3. treatment  [6, 12] . In general, telemedicine allows for remote assistance and virtual visits monitoring diabetesrelated parameters and facilitates communications between HCPs for consultations and the exchange of documents and reports to support clinical decisions. For these purposes, various technologies can be employed to support telehealth delivery of programs and services, including digital technologies such as continuous glucose monitoring (CGM) and automatic insulin delivery (AID), smartphone apps for mobile phones, websites or cloud-upload technologies for data download and remote monitoring algorithms, along with combinations of multiple technologies.\n\nIn a recent systematic review, Eberle and colleagues  [13]  addressed the role of telemedicine for T1DM and T2DM management, categorizing the available intervention protocols into four groups: real-time audio intervention, real-time video intervention, asynchronous intervention, and lastly, combined intervention. The results showed an equivalence of these approaches for the remote management of diabetic patients; however, it is imperative to adapt each of them to the specific needs of each patient  [14] .\n\nA recent meta-analysis conducted by Tchero and colleagues  [15]  reviewed 42 randomized controlled trials (RCTs) with the aim of comparing clinical effectiveness of telemedicine in the management of diabetes with the traditional approach. The results showed that telemedicine could be more effective than traditional practice. In particular, telemedicine interventions lasting longer than 6 months tended to provide better results than those of shorter durations. Moreover, telemedicine programs have proved to be more successful in older people and T2DM, as these subjects may undergo cognitive and memory decline. Although this finding may seem a contradiction, it may be explained by the observation that in patients with mild cognitive impairment, telemedicine can compensate for possible forgetfulness in diabetes management. On the other hand, in patients with a more advanced cognitive deterioration, remote telemanagement can help caregivers in their difficult task of daily organization.\n\nTable  1 . Definitions and components of telehealth in diabetes management. The table provides definitions of components of telehealth in diabetes management. Telehealth, defined as the utilization of digital technologies to deliver medical care and healthcare services remotely, includes different modalities such as televisit, teleconsultation, tele-education, and telemonitoring. Each modality performs distinct functions in the delivery of remote healthcare, contributing to improved patient care and outcomes in diabetes management."
    },
    {
      "title": "TELEHEALTH TELEMEDICINE IN DIABETES MANAGEMENT"
    },
    {
      "title": "Televisit",
      "text": "Televisit is a healthcare act in which the doctor interacts remotely with the patient, with the prescription of drugs or treatments during the televisit. The visit must take place in real or deferred time. A healthcare professional who is close to the patient can assist the doctor."
    },
    {
      "title": "Teleconsultation",
      "text": "Teleconsultation represents a remote consultancy activity between doctors that allows a doctor to ask the advice of one or more doctors on the indication of diagnosis and/or choice of therapy without the physical presence of the patient, on the basis of medical information related to patient care."
    },
    {
      "title": "Tele-education",
      "text": "Tele-education refers to any educational or learning process in which the learner is geographically apart from the instructor and/or the educational resources.\n\nTele-education can be synchronized and not-synchronized and is commonly associated with in-person lessons or professional training procedures.\n\nTelemonitoring Telemonitoring corresponds to the transmission and/or the sharing of clinical data to a healthcare provider through electronic and web-based systems. Telemonitoring can include both non-reactive data collection and delayed and/or continuous analytic and decision-making functions.\n\nFinally, a recent review  [16]  sought to shed light on the cost-benefit of telemedicine for diabetes to facilitate its widespread adoption. Telemonitoring interventions together with teleophthalmology interventions for the assessment of microvascular complications in the retina were evaluated. The most important result in terms of cost savings was in teleophthalmology, which was found to be promising for early detection of microvascular ocular complications. A similar significant result was not observed for telemonitoring tools; however, several studies  [17, 18]  showed the need to implement telemedicine techniques especially for rural populations."
    },
    {
      "title": "3.2.1.. Continuous Glucose Monitoring",
      "text": "Glucose monitoring plays a key role in both the treatment and management of insulintreated PwD  [19, 20] . A CGM system measures blood glucose levels on a near-continuous basis, providing information of blood glucose response to insulin dosing, meals, exercise, daily activities and other factors. This information enables HCPs to make necessary adjustments to the therapy as needed. Currently, two types of CGM devices are available: 1. real-time CGM (rtCGM), which continuously assesses glucose levels and are equipped with automated alarms to alerts at specific glucose thresholds and 2. intermittently scanned CGM (isCGM), which displays glucose values when swiped by a reader or a smart phone, revealing the current glucose levels. Finally, the so called \"blinded\" CGM measures glucose levels that are not immediately shown to the user but retrospectively analyzed by both patients and physicians to evaluate glycemic patterns and trends.\n\nData derived from CGM can be summarized and analyzed with software that generates reports (glucose indices, trends and statistics related to sensor usage, the time spent in the range of normoglycemia, hypoglycemia or hyperglycemia). Numerous international consensus statements recommend the Ambulatory Glucose Profile as the default report to summarize CGM data over multiple days of wear  [21] .\n\nIn numerous RCTs, rtCGM has demonstrated an improvement of glucose control in terms of reduction in HbA1c, increase in time in range (TIR) and a decrease in the time spent in hypoglycemia and hyperglycemia. The benefits were more significant in PwD who employed the sensor for an extended period  [22] [23] [24] [25] [26] [27] [28] [29] [30] [31] . Most of the studies were conducted on adults and youth with T1DM treated with continuous subcutaneous insulin infusion (CSII) or multiple daily injections of insulin (MDI). The results showed substantial benefits associated with the use of rtCGM in adults of all ages, as long as participants in the studies continued to use the device  [32] . Few studies have evaluated the effect of rtCGM compared with usual care in people with T2DM  [27, 33]  or in pregnant women with T1DM on intensive insulin regimen  [34] , with encouraging results.\n\nStudies focusing on isCGM are more limited. However, there is evidence that isCGM with optional alarms is associated with a reduction in HbA1c in people with T1DM  [35]  and a decreased rate of hypoglycemia in T2DM  [36, 37] . Emerging evidence associates the use of isCGM with the reduction in diabetes-related events and all-cause hospitalizations in PwD following therapies with less intensive insulin regimen or glucose-lowering oral drugs  [38, 39] . Moreover, a meta-analysis of RCTs reported that, in T1DM and T2DM, both rtCGM and isCGM are associated with a modest reduction in HbA1c (-0.2%) with an overall increase in TIR of 70 min and fewer episodes of hypoglycemia and hyperglycemia  [40] .\n\nFinally, T1DM, T2DM, pregnancy during intensive insulin therapy, monitoring during regular physical exercise, new onset of diabetes, and frailty have been recognized as the clinical scenarios best fitting the need for using rtCGM or isCGM, regardless of baseline HbA1c or individualized HbA1c target  [41] ."
    },
    {
      "title": "3.2.2.. Connected Insulin Pens",
      "text": "\"Connected\" insulin pens are devices capable of automatically transmitting data via Bluetooth to management apps on smartphones, representing a new valuable frontier for MDI therapy. These pens include tracking insulin pens (TIPs) and smart insulin pens (SIPs). TIPs record the last dose of insulin administered by the device and offer reminders for insulin doses through cloud connectivity. SIPs integrate data such as glucose and carbohydrates from other technological devices or apps, elaborate reports that can be shared with HCPs and provide clinical decision support through an automated insulin dose calculator based on individualized insulin therapy settings.\n\nEmerging evidence suggests that the use of connected insulin pens is associated with increased TIR and fewer missed boluses in T1DM treated with a basal-bolus insulin regimen  [42] , indicating a beneficial impact on glucose control and dosing behavior  [43] .\n\nIn a cost-effectiveness analysis, the use of SIPs was associated with a per-patient improvement of 0.90 years in mean life expectancy and an increased 1.15 quality-adjusted life-years, along with mean cost savings over standard care  [44] . These results were mainly driven by a lower frequency and delayed onset of complications. Moreover, the lower number of severe hypoglycemia events observed when these devices are used in combination with CGM may further contribute to the potential beneficial economic impact of SIPs  [45] ."
    },
    {
      "title": "3.2.3.. Automatic Insulin Delivery",
      "text": "AID systems include technologies that integrate data from CGM, insulin pumps and control algorithms to automatically regulate subcutaneous insulin delivery. The earlier AID system included insulin pumps with automated suspension of insulin delivery at low glucose levels (low glucose suspend, LGS) or for predictive hypoglycemia (predictive low glucose suspend, PLGS). These technologies initially enabled the glucose-responsive regulation of insulin delivery to address hypoglycemia  [46, 47] .\n\nThe most recent closed-loop technology currently available is the advanced hybrid closed-loop system, which automatically and continually modulate basal insulin delivery in response to sensor glucose levels. It can also deliver automatic correction boluses in case of glycemic spikes but still requires the manual entry of carbohydrates consumed to calculate prandial doses. The \"full\" AID will automatically adjust all the required insulin, including prandial insulin at meals.\n\nStudies focusing on various AID systems with different algorithms, pumps, and sensors have been conducted in both adults and children with diabetes  [48] [49] [50] [51] . Meta-analysis of RCTs provides evidence that AID systems may improve TIR, reduce hyperglycemia and hypoglycemia and modestly decrease HbA1c levels, compared with control therapy (conventional pump therapy or sensor-augmented pump therapy)  [52, 53] . PwD preference and the selection of individuals (and caregivers) capable of safely and effectively using the devices are relevant aspects for a valuable and effective therapy with AIDs  [20, 54] . This scenario is currently expanding with the advent of \"Do-it-yourself\" AID systems, which use commercially available CGM systems and insulin pumps combined with an open-source algorithm  [54] ."
    },
    {
      "title": "3.2.4.. Digital Health Apps",
      "text": "The recent and rapid progress in the field of diabetes technologies has led to the development of numerous mobile apps intended to increase the self-management abilities of PwD, facilitate communication between PwD and HCPs and improve compliance with tailored treatment. These Apps may help PwD improve health outcomes by supporting healthy behaviors, promoting glucose monitoring, assisting with result interpretation, guiding medication change, providing alerts for blood glucose variation, and ultimately, reducing complications.\n\nThe most commonly used digital health apps in diabetes care can be divided into three categories: 1. Apps used for tracking health and wellness, 2. apps acting as standalone medical devices, and 3. apps that display, download, share and/or use data from devices involved in self-blood glucose monitoring, CGM, insulin pumps or integrated system of insulin delivery and CGM, such as AID or artificial pancreas.\n\nApps used for tracking wellness include both nutrition and physical activity apps. These tools enable users to check the energy content of food, serve as nutrition tracker or food diary, support in planning meals and insulin dosing  [55] , monitor daily physical activity, count calories and set goals for exercise and weight management  [56] .\n\nGlucose monitoring apps offer the possibility to aggregate data often derived from an external device (i.e., a glucometer or a CGM) and build graphs to show glucose trends. These apps are frequently integrated with a \"bolus calculator\", which allows PwD to establish the insulin dose in response to the carbohydrate content of each meal, the basal insulin dose or correction doses needed in case of sudden glucose spikes. Apps supporting insulin delivery are connected to pens or insulin pumps to collect and display data, suggest boluses, download insulin and glucose data, providing a comprehensive overview for decision assistance. Finally, AID systems consist of a CGM, an insulin pump and an algorithm that adjust the basal insulin rate or provide automatic correction boluses (advanced closed loop) based on glucose levels captured by the sensor on patients  [54] .\n\nSeveral clinical trials focusing on interventions based on apps to manage diabetes have been conducted in various population, including in children and adolescents with T1DM  [57, 58] , adults with both T1DM and T2DM  [59] [60] [61] [62]  and women with pregnancy diabetes  [63] .\n\nMost studies identified the reduction in HbA1c as the primary outcome associated with the use of apps, compared with control strategies  [59] [60] [61] [62] 64] . In many cases, the improvement of glycemic outcomes was enhanced with healthcare professional feedback  [60, 62, 64]  highlighting the importance of creating connections and sharing data between PwD and HCPs for an effective care process. The main limitation of these studies were the short duration of the intervention and the relatively small number of participants. Moreover, there is evidence suggesting that mobile app intervention may have beneficial impacts on medication adherence and glycemic parameters in people with T2DM  [65] .\n\nHowever, since mobile apps designed for health and wellness are largely unregulated, there is need for regulation, standardization, and quality control, to promote a safe and effective approach, increase patient engagement, and improve disease outcomes  [66] ."
    },
    {
      "title": "3.2.5.. Websites and Cloud-Upload Technologies",
      "text": "Websites and cloud-upload technologies represent a relatively recent opportunity for managing diabetes remotely. This is further emphasized by the growing adoption of blood glucose monitoring systems (self-blood glucose monitoring (SBGM), isCGM, rtCGM) in clinical practice. These systems have significantly contributed to diabetes management, regardless of the type of glucose-lowering treatment, whether MDI or CSII  [40, 41] .\n\nGlucose monitoring data can be collected over time and sent to the cloud to review summary statistics and recognize trends of glucose levels. Downloading these data may help HCPs provide individualized recommendations for therapy, evaluate the efficacy of glucose-lowering therapy and educate patients on interventions that can improve their clinical status. In addition, remote monitoring represents a valuable strategy to intervene promptly with appropriate and immediate feedback providing treatment modification if needed.\n\nTools for downloading data include software and web-based platforms that are accessible by both PwD or HCPs. Data are typically summarized in tables, charts or graphs that report patterns and trends in blood glucose levels. Additionally, information on meals, insulin doses, and physical activity can also be visualized. PwD may link their personal accounts to HCP's professional account for data sharing and remotely reviewing the information.\n\nDownloading and reviewing glucose data through web-based platforms have been associated with a significant reduction in HbA1c in RCTs  [67] [68] [69] . Evidence from clinical trials also suggests that telemonitoring in people with T2DM leads to improvement in diabetes control  [70] [71] [72] , comorbidities  [71, 73]  and a better quality of life  [73, 74] . Moreover, a recent meta-analysis of 30 RCTs, including 4678 PwD, reported that system practicality, user engagement, patient characteristics and disease education are the main factors influencing the effect of telemonitoring on glucose control  [70] ."
    },
    {
      "title": "3.2.6.. Televisits",
      "text": "A higher frequency of visits has been associated by Kaufman and colleagues with a better control of HbA1c  [75] . Indeed, results of their 3-year study showed a significantly lower HbA1C value for patients with 3-4 visits per year, compared to those with only 1 or 2 visits. On this basis, it should be mandatory to improve patients' adherence to follow-up. For patients skipping appointments for reasons like work, school or distance from DM centers, telemedicine could be a suitable tool to overcome such obstacles.\n\nThe promising results of telemedicine for diabetes management were already investigated prior to the COVID-19 pandemic. Kassar et al.  [76]  conducted a study on 106 inmates with diabetes who agreed to remote visits with experienced endocrinologists, amounting to a total of 264 televisits. At the end of the follow-up, there was an improvement in HbA1c levels in more than half of the patients, as well as better control of cardiovascular risk factors such as hypertension and hyperlipidemia. A pre-pandemic study conducted by Tonyushkina and colleagues  [77]  recruited 10 young patients with DMT1 to attend remote monitoring visits. At the end of each televisit, which took 25 to 45 min, the diabetologist informed the patients about any therapeutic and lifestyle adjustments. Although no significant changes in HbA1c values were recorded, all patients were very satisfied with the telemedicine visits and wanted to continue clinical follow-up with the same modality.\n\nThe COVID-19 pandemic made it impossible for many patients with chronic diseases to attend their regular check-ups at their referral centers. As a result, the number of remote visits increased considerably, leading consequentially to an increasing number of studies on the issue with a wider number of participants. A survey of approximately 1300 patients who performed at least one televisit for clinical therapeutic management of diabetes showed an overall satisfaction with remote visits  [78] .\n\nAnother study  [79]  conducted on patients with both T1DM and T2DM investigated patients' satisfaction with telemedicine visits. Of 111 patients, 82% were pleased with the telehealth modality and 69% were interested in continuing in remote mode even after the emergency status had ceased.\n\nAn anonymous questionnaire  [80] , including questions about the use and perception of telemedicine in the management of diabetes during the COVID-19 pandemic, was administered via social media in about 40 countries. A large percentage of responders (67%) said they had consulted their doctor remotely since the pandemic began, a significant increase from the 28% reported in a similar survey in 2020; furthermore, 83% of responders considered remote appointments useful."
    },
    {
      "title": "3.3.. Management of Diabetes Complications Risk Factors",
      "text": "Common cardio-metabolic risk factors in patients with diabetes are represented by hypertension and hyperlipidemia (or hypercholesterolemia) and in recent years, their coprevalence has been increasing more and more  [81] . Several interventions in telemedicine have proved to significantly improve systolic and diastolic blood pressure, triglycerides, and total cholesterol serum levels  [82] .\n\nTelehealth could be used to help reach the objective of reducing high cholesterol level by 1. checking tolerability when starting treatment with anti-diabetic drugs; 2. real-time monitoring of LDL cholesterol levels to ensure that the ongoing anti-diabetic treatment and a proper diet are effective in controlling the disease; 3. providing opportunities to discuss cost concerns and treatment alternatives; and 4. setting goals for healthy lifestyle changes  [83] .\n\nA RCT showed that telemedicine, through home blood pressure monitoring and remote consultations, can improve blood pressure control and treatment adherence by facilitating timely therapeutic adjustments and reducing logistical barriers to in-person care  [84] . By allowing the exchange of clinical data in either a synchronous or asynchronous way and by enabling remote visits, telemedicine enabled clinicians to make treatment changes at a distance, thus saving the time required to travel to the hospital and the waiting time prior to the visit  [84] .\n\nSalisbury and colleagues  [85]  have proved that people at high risk of cardiovascular diseases who received telehealth monitoring combined with in-office visits have slightly improved their adherence to diet, exercise and medication usage and have better satisfaction with medical care when compared with people using in-person follow up alone.\n\nA recent cross-sectional study  [83]  of 375 newly diagnosed T2DM patients has shown that telemedicine, in addition to standard antidiabetic therapy, helped reduce LDL cholesterol levels (110 mg/dL vs. 93.1 mg/dL, p < 0.001). Notably, the intervention group relied on messaging software through which they were able to keep in touch with a diabetologist and send him/her daily photos of meals and glucose values. Likewise, the clinician used this application to contact patients to make therapeutic changes or provide advice on diet and lifestyle."
    },
    {
      "title": "3.4.. Reduction in Diabetic Complications"
    },
    {
      "title": "3.4.1.. Stroke and Cardiovascular Diseases",
      "text": "A meta-analysis conducted by Lieber and colleagues  [86]  evaluated five clinical trials to assess the role of telemedicine in reducing HbA1c levels in post-stroke PwD. Compliance with diabetes treatment regimens is associated with an improvement in HbA1c blood levels and therefore, a reduction in mortality and morbidity. The enrolled patients had a digital glucometer transmitting data to the clinic at different frequencies. Four out of the five trials showed a greater reduction in HbA1c in the intervention group using telemedicine than in the traditional control group. Furthermore, in the group receiving remote consultations, there was a greater propensity to adjust treatment to achieve better glycemic control  [86] .\n\nMoreover, another meta-analysis of 55 RCTs including people with T1DM (15 RTCs), T2DM (31 RTCs) or both types of diabetes (9 RCTs), revealed that when patients use telemedicine programs, better glucose monitoring was reached, with a substantial reduction in HbA1c levels compared to patients not using telemedicine programs  [82] . A subgroup analysis according to diabetes type showed that T2DM patients had a significantly greater reduction in HbA1c than those with type 1 diabetes  [82] ."
    },
    {
      "title": "3.4.2.. Diabetic Neuropathy and Diabetic Foot Syndrome",
      "text": "Telehealth may allow self-monitoring of foot health status for preventative, diagnostic and therapeutic purposes. Different approaches are available such as audio-video consultation, photographic imaging, dermal thermography and hyperspectral imaging.\n\nTwo RCTs  [87, 88]  compared the effect of phone/online platform tools on ulcer healing, amputation and death with standard care. In detail, Rassmussen and colleagues  [87]  evaluated the effectiveness of audio-video consultation in addition to outpatient visits on ulcer healing compared to standard care. Smith-Str\u00f8m et al.  [88]  compared a weekly phone and interactive web-based ulcer record consultation in addition to outpatient visits (every 6 weeks) to standard care (outpatient visit every 2 weeks). Both studies found no differences between the two groups in amputation and healing time, highlighting the non-inferiority of telemedicine over its traditional counterpart. A secondary outcome study of the Norwegian trial [89] explored the changes in self-reported quality of life and well-being in patients with diabetic foot receiving the telemedicine intervention compared to those receiving standard care and found no differences between the two groups. Further, patients reported outcome measures were found to be stable overtime (from baseline to several assessment time-points). In line with this evidence, two non-randomized studies  [90, 91]  comparing video consultation with in-person outpatient visit found no difference in ulcer healing between the two approaches.\n\nRemote ulcer area measurement from photographs could allow a continuous and reliable monitoring of ulcer evolution. Two studies  [92, 93]  revealed a strong association between remote and live assessments of ulcer area (correlation coefficient > 0.95). Further two studies  [94, 95]  reported a lower inter-observer variability in ulcer area measurement from a photograph compared to live assessment. Hazenberg and colleagues  [96]  found good feasibility and perceived usability of photographic ulcer assessment. Results of their study showed a good reliability of the combination of photographic assessment and infrared thermography in the diagnosis of foot infection (sensitivity > 60% and specificity > 79%). They also found that the combined use of both techniques was more reliable than each one on its own. Foot temperature alteration in DFS are the results of compromised thermoregulation due to both peripheral arterial disease and neuropathy. It can be estimated through different techniques: temperature sensors based on thermistor, infrared thermography and liquid-crystal thermography. Four RCTs  [97] [98] [99] [100]  explored the effectiveness of infrared thermography in ulcer prevention. Patients allocated to the intervention group were instructed to measure foot temperature in six different locations per foot, daily. Patients were invited to contact the HCP in case they revealed a 2.2 \u2022 C temperature difference between the left and the right foot in the same location for at least two consecutive days. Patients in the control group received traditional monitoring that did not include temperature monitoring. Three studies out of four  [97] [98] [99] , including, respectively, 85, 225 and 173 patients found a significant reduction in ulceration or recurrent ulcer rate in the intervention group compared to the control one (respectively: p = 0.01; p = 0.038; p = 0.0046). The fourth study [100] did not find any significant difference between the two groups (p = 0.532); however, the sample size of the patients was not as large as that reported in the other studies  (45 patients) .\n\nThe effectiveness of liquid-crystal thermography in ulcer prevention and diagnosis was explored only in three small clinical studies  [101] [102] [103] . No studies are available on patients suffering from diabetes, suggesting a low applicability. Therefore, available data does not allow any reliable conclusion. Only one study [104] explored the diagnostic effectiveness of a wireless temperature sensor based on a thermistor and found that using a temperature difference between the two sides of 2.2 \u2022 C as cut off, the tool correctly recognized 97% of diabetic foot ulcers. However, the authors also found a high rate of false-positives (specificity of 43%). Even in this case the available data did not allow the researchers to reach a conclusion.\n\nHyperspectral imaging is a technique that measures tissue oxygenation levels and generate maps of microcirculatory changes through the collection and processing of information of the near-infrared range of the electromagnetic spectrum. Four case-control studies [105-108] on ulcers before healing revealed a reduction in oxyhemoglobin level in healed ulcers compared to no change in oxyhemoglobin level in non-healed ulcers. Conversely, three case-control studies [109-111] explored the specificity and sensitivity of hyperspectral imaging for prediction of ulcer healing. The first two [110,111] found a sensitivity, respectively, of 93% and 80% and specificity of 86 and 74% to predict ulcers healing in 24 weeks; conversely, the third one [109] found a sensitivity of 90% and a specificity of 86% in one month."
    },
    {
      "title": "3.4.3.. Mental Illness",
      "text": "Mental illness is considered to play a key role among the risk factors of chronic diseases; comorbid depression predicts the onset and progression of several chronic diseases. Indeed, having strong coping mechanisms such as emotional expression, acceptance of the condition and problem solving was associated with a better quality of life and lower HbA1c levels  [112] . Conversely, low scores on the PROMIS, a questionnaire assessing several aspects of the quality of life, were associated with depression and less frequent blood glucose checks  [113] .\n\nA systematic review [114] including seventeen RCTs evaluated the effectiveness of digital tools in mental illness management in chronic diseases such as cardiovascular diseases, chronic obstructive pulmonary disease (COPD), stroke and diabetes. The studies included in the review described different types of tele-interventions; several offered digital educational content specific to the disease along with lifestyle advice and recommendations; others included telemonitoring applications for symptoms of depression; finally, some also provided remote psychotherapy interventions. Study results revealed a moderate beneficial effect on depression outcomes. Moreover, patients suffering from both COPD and diabetes received a higher benefit from the interventions compared to those affected by cardiovascular diseases and stroke."
    },
    {
      "title": "4.. Conclusions",
      "text": "In this narrative review, we have highlighted the established yet ever-growing role of telemedicine in the management of diabetes, covering daily management of risk factors and complications and the administration of antidiabetic therapy. The presented studies revealed an overall satisfaction among PwD and their caregivers regarding remote telemedicine management. Telehealth has demonstrated the capability to provide a fully patient-centered approach to disease management through highly personalized management plans. This has led to improved adherence to appropriate therapy and lifestyle, ultimately contributing to better quality of life.\n\nWhilst telemedicine has clearly a wide spectrum of potential benefits, it also presents challenges that must be addressed. Firstly, many elements of the traditional approach may be missing. Physical presence and emotional connection may be limited by remote visits, and a complete objective examination may not always be possible due to technological constraints. Furthermore, real-world implementation faces additional barriers, including disparities in access to digital tools, particularly in rural or underserved areas. Inadequate broadband coverage and unaffordable costs of digital tools may prevent equitable access to telemedicine, reinforcing the existing disparities known as the digital divide. Moreover, limited digital literacy, whether due to age, educational background, or sensory or cognitive impairments, can represent a significant barrier to telemedicine access. Concerns about data privacy, cybersecurity, and unclear reimbursement policies further complicate integration into standard care models. Finally, other limitations are represented by the lack of standardized protocols of intervention, the lack of regulation and reimbursement guidelines and the limited validation of the digital devices in non-English languages. Although telemedicine is already widely implemented, its future potential lies in enabling fully patient-centered care, bringing diabetes management closer to the patient's home.\n\nAt present telemedicine represents a valuable tool for managing diabetes and its related risk factors and complications. However certain aspects of care may still benefit from in-person interaction. For now, the best approach remains a balanced integration of telemedicine and face-to-face consultations to achieve the best possible treatment and an improved quality of life."
    },
    {
      "title": "Supplementary Materials:",
      "text": "The following supporting information can be downloaded at:  https:  //www.mdpi.com/article/10.3390/jcm14124240/s1 , Table  S1 : Digital health interventions in diabetes care and associated outcomes."
    },
    {
      "text": "Figure1. Conceptual framework of a digital virtual diabetes clinic. The figure illustrates the conceptual framework of a digital, virtual diabetes clinic, highlighting the integration of innovative digital health technologies for effective and efficient diabetes management. Through at-home blood glucose monitoring, telemedicine consultations, and personalized digital interventions, the digital virtual clinic offers a comprehensive approach to diabetes management, enhancing patient engagement and clinical outcomes."
    },
    {
      "text": "Contributions: Conceptualization, L.L. and M.I.M.; methodology, E.M. and G.A.; data curation, E.M., G.A. and G.M.; writing-original draft preparation, E.M., G.A., G.M., P.C., M.L., E.R.,"
    },
    {
      "text": "Funding: This research received no external funding."
    },
    {
      "title": "Conflicts of Interest:",
      "text": "The authors declare no conflicts of interest."
    },
    {
      "title": "Abbreviations",
      "text": "The following abbreviations are used in this manuscript:"
    }
  ],
  "references": [
    {
      "title": "Global, regional, and national burden of diabetes from 1990 to 2021, with projections of prevalence to 2050: A systematic analysis for the Global Burden of Disease Study 2021",
      "year": 2021,
      "doi": "10.1016/S0140-6736(23)01301-6",
      "journal": "Lancet",
      "volume": "402",
      "raw": "Global, regional, and national burden of diabetes from 1990 to 2021, with projections of prevalence to 2050: A systematic analysis for the Global Burden of Disease Study 2021 \n\t\t \n\t\t\t Gbd \n\t\t\t \n\t\t\t\t Diabetes Collaborators \n\t\t\t \n\t\t \n\t\t 10.1016/S0140-6736(23)01301-6 \n\t \n\t \n\t\t Lancet \n\t\t \n\t\t\t 402 \n\t\t\t \n\t\t\t 2021. 2023 \n\t\t \n\t \n\t GBD 2021 Diabetes Collaborators. Global, regional, and national burden of diabetes from 1990 to 2021, with projections of prevalence to 2050: A systematic analysis for the Global Burden of Disease Study 2021. Lancet 2023, 402, 203-234. [CrossRef] [PubMed]"
    },
    {
      "title": "Management of Hyperglycemia in Type 2 Diabetes, 2022. A Consensus Report by the American Diabetes Association (ADA) and the European Association for the Study of Diabetes (EASD)",
      "authors": [
        "M Davies",
        "V Aroda",
        "B Collins",
        "R Gabbay",
        "J Green",
        "N Maruthur",
        "S Rosas",
        "S Del Prato",
        "C Mathieu",
        "G Mingrone"
      ],
      "year": 2022,
      "doi": "10.2337/dci22-0034",
      "journal": "Diabetes Care",
      "volume": "45",
      "raw": "Management of Hyperglycemia in Type 2 Diabetes, 2022. A Consensus Report by the American Diabetes Association (ADA) and the European Association for the Study of Diabetes (EASD) \n\t\t \n\t\t\t M J Davies \n\t\t \n\t\t \n\t\t\t V R Aroda \n\t\t \n\t\t \n\t\t\t B S Collins \n\t\t \n\t\t \n\t\t\t R A Gabbay \n\t\t \n\t\t \n\t\t\t J Green \n\t\t \n\t\t \n\t\t\t N M Maruthur \n\t\t \n\t\t \n\t\t\t S E Rosas \n\t\t \n\t\t \n\t\t\t S Del Prato \n\t\t \n\t\t \n\t\t\t C Mathieu \n\t\t \n\t\t \n\t\t\t G Mingrone \n\t\t \n\t\t 10.2337/dci22-0034 \n\t \n\t \n\t\t Diabetes Care \n\t\t \n\t\t\t 45 \n\t\t\t \n\t\t\t 2022 \n\t\t \n\t \n\t Davies, M.J.; Aroda, V.R.; Collins, B.S.; Gabbay, R.A.; Green, J.; Maruthur, N.M.; Rosas, S.E.; Del Prato, S.; Mathieu, C.; Mingrone, G.; et al. Management of Hyperglycemia in Type 2 Diabetes, 2022. A Consensus Report by the American Diabetes Association (ADA) and the European Association for the Study of Diabetes (EASD). Diabetes Care 2022, 45, 2753-2786. [CrossRef]"
    },
    {
      "title": "Clinical inertia, reverse clinical inertia, and medication non-adherence in type 2 diabetes",
      "authors": [
        "D Giugliano",
        "M Maiorino",
        "G Bellastella",
        "K Esposito"
      ],
      "year": 2019,
      "doi": "10.1007/s40618-018-0951-8",
      "journal": "J. Endocrinol. Invest",
      "volume": "42",
      "raw": "Clinical inertia, reverse clinical inertia, and medication non-adherence in type 2 diabetes \n\t\t \n\t\t\t D Giugliano \n\t\t \n\t\t \n\t\t\t M I Maiorino \n\t\t \n\t\t \n\t\t\t G Bellastella \n\t\t \n\t\t \n\t\t\t K Esposito \n\t\t \n\t\t 10.1007/s40618-018-0951-8 \n\t \n\t \n\t\t J. Endocrinol. Invest \n\t\t \n\t\t\t 42 \n\t\t\t \n\t\t\t 2019 \n\t\t \n\t \n\t Giugliano, D.; Maiorino, M.I.; Bellastella, G.; Esposito, K. Clinical inertia, reverse clinical inertia, and medication non-adherence in type 2 diabetes. J. Endocrinol. Invest. 2019, 42, 495-503. [CrossRef]"
    },
    {
      "title": "Shared decision making in endocrinology: Present and future directions",
      "authors": [
        "R Rodriguez-Gutierrez",
        "M Gionfriddo",
        "N Ospina",
        "S Maraka",
        "S Tamhane",
        "V Montori",
        "J Brito"
      ],
      "year": 2016,
      "doi": "10.1016/s2213-8587(15)00468-4",
      "journal": "Lancet Diabetes Endocrinol",
      "volume": "4",
      "raw": "Shared decision making in endocrinology: Present and future directions \n\t\t \n\t\t\t R Rodriguez-Gutierrez \n\t\t \n\t\t \n\t\t\t M R Gionfriddo \n\t\t \n\t\t \n\t\t\t N S Ospina \n\t\t \n\t\t \n\t\t\t S Maraka \n\t\t \n\t\t \n\t\t\t S Tamhane \n\t\t \n\t\t \n\t\t\t V M Montori \n\t\t \n\t\t \n\t\t\t J P Brito \n\t\t \n\t\t 10.1016/s2213-8587(15)00468-4 \n\t \n\t \n\t\t Lancet Diabetes Endocrinol \n\t\t \n\t\t\t 4 \n\t\t\t \n\t\t\t 2016 \n\t\t \n\t \n\t Rodriguez-Gutierrez, R.; Gionfriddo, M.R.; Ospina, N.S.; Maraka, S.; Tamhane, S.; Montori, V.M.; Brito, J.P. Shared decision making in endocrinology: Present and future directions. Lancet Diabetes Endocrinol. 2016, 4, 706-716. [CrossRef] [PubMed]"
    },
    {
      "title": "The Digital/Virtual Diabetes Clinic: The Future Is Now-Recommendations from an International Panel on Diabetes Digital Technologies Introduction",
      "authors": [
        "M Phillip",
        "R Bergenstal",
        "K Close",
        "T Danne",
        "S Garg",
        "L Heinemann",
        "I Hirsch",
        "B Kovatchev",
        "L Laffel",
        "V Mohan"
      ],
      "year": 2021,
      "doi": "10.1089/dia.2020.0375",
      "journal": "Diabetes Technol. Ther",
      "volume": "23",
      "raw": "The Digital/Virtual Diabetes Clinic: The Future Is Now-Recommendations from an International Panel on Diabetes Digital Technologies Introduction \n\t\t \n\t\t\t M Phillip \n\t\t \n\t\t \n\t\t\t R M Bergenstal \n\t\t \n\t\t \n\t\t\t K L Close \n\t\t \n\t\t \n\t\t\t T Danne \n\t\t \n\t\t \n\t\t\t S K Garg \n\t\t \n\t\t \n\t\t\t L Heinemann \n\t\t \n\t\t \n\t\t\t I B Hirsch \n\t\t \n\t\t \n\t\t\t B P Kovatchev \n\t\t \n\t\t \n\t\t\t L M Laffel \n\t\t \n\t\t \n\t\t\t V Mohan \n\t\t \n\t\t 10.1089/dia.2020.0375 \n\t \n\t \n\t\t Diabetes Technol. Ther \n\t\t \n\t\t\t 23 \n\t\t\t \n\t\t\t 2021 \n\t\t \n\t \n\t Phillip, M.; Bergenstal, R.M.; Close, K.L.; Danne, T.; Garg, S.K.; Heinemann, L.; Hirsch, I.B.; Kovatchev, B.P.; Laffel, L.M.; Mohan, V.; et al. The Digital/Virtual Diabetes Clinic: The Future Is Now-Recommendations from an International Panel on Diabetes Digital Technologies Introduction. Diabetes Technol. Ther. 2021, 23, 146-154. [CrossRef]"
    },
    {
      "title": "Psychosocial problems and barriers to improved diabetes management: Results of the Cross-National Diabetes Attitudes, Wishes and Needs (DAWN) Study",
      "authors": [
        "M Peyrot",
        "R Rubin",
        "T Lauritzen",
        "F Snoek",
        "D Matthews",
        "S Skovlund"
      ],
      "year": 2005,
      "doi": "10.1111/j.1464-5491.2005.01644.x",
      "journal": "Diabet. Med",
      "volume": "22",
      "raw": "Psychosocial problems and barriers to improved diabetes management: Results of the Cross-National Diabetes Attitudes, Wishes and Needs (DAWN) Study \n\t\t \n\t\t\t M Peyrot \n\t\t \n\t\t \n\t\t\t R R Rubin \n\t\t \n\t\t \n\t\t\t T Lauritzen \n\t\t \n\t\t \n\t\t\t F J Snoek \n\t\t \n\t\t \n\t\t\t D R Matthews \n\t\t \n\t\t \n\t\t\t S E Skovlund \n\t\t \n\t\t 10.1111/j.1464-5491.2005.01644.x \n\t \n\t \n\t\t Diabet. Med \n\t\t \n\t\t\t 22 \n\t\t\t \n\t\t\t 2005 \n\t\t \n\t \n\t Peyrot, M.; Rubin, R.R.; Lauritzen, T.; Snoek, F.J.; Matthews, D.R.; Skovlund, S.E. Psychosocial problems and barriers to improved diabetes management: Results of the Cross-National Diabetes Attitudes, Wishes and Needs (DAWN) Study. Diabet. Med. 2005, 22, 1379-1385. [CrossRef]"
    },
    {
      "title": "Diabetes Attitudes Wishes and Needs 2 (DAWN2): A multinational, multi-stakeholder study of psychosocial issues in diabetes and person-centred diabetes care",
      "authors": [
        "M Peyrot",
        "R Rubin",
        "T Lauritzen",
        "F Snoek",
        "D Matthews",
        "S Skovlund"
      ],
      "year": 2013,
      "doi": "10.1016/j.diabres.2012.11.016",
      "journal": "Diabetes Res. Clin. Pract",
      "volume": "99",
      "raw": "Diabetes Attitudes Wishes and Needs 2 (DAWN2): A multinational, multi-stakeholder study of psychosocial issues in diabetes and person-centred diabetes care \n\t\t \n\t\t\t M Peyrot \n\t\t \n\t\t \n\t\t\t R R Rubin \n\t\t \n\t\t \n\t\t\t T Lauritzen \n\t\t \n\t\t \n\t\t\t F J Snoek \n\t\t \n\t\t \n\t\t\t D R Matthews \n\t\t \n\t\t \n\t\t\t S E Skovlund \n\t\t \n\t\t 10.1016/j.diabres.2012.11.016 \n\t \n\t \n\t\t Diabetes Res. Clin. Pract \n\t\t \n\t\t\t 99 \n\t\t\t \n\t\t\t 2013 \n\t\t \n\t \n\t Peyrot, M.; Rubin, R.R.; Lauritzen, T.; Snoek, F.J.; Matthews, D.R.; Skovlund, S.E. Diabetes Attitudes Wishes and Needs 2 (DAWN2): A multinational, multi-stakeholder study of psychosocial issues in diabetes and person-centred diabetes care. Diabetes Res. Clin. Pract. 2013, 99, 174-184. [CrossRef] [PubMed]"
    },
    {
      "title": "Identifying the unmet needs of individuals with Type 2 diabetes: An international web-based survey",
      "authors": [
        "J Raposo",
        "M Shestakova",
        "J Lu",
        "E Court",
        "A Mayorov"
      ],
      "year": 2021,
      "doi": "10.2217/cer-2020-0271",
      "journal": "J. Comp. Eff. Res",
      "volume": "10",
      "raw": "Identifying the unmet needs of individuals with Type 2 diabetes: An international web-based survey \n\t\t \n\t\t\t J F Raposo \n\t\t \n\t\t \n\t\t\t M V Shestakova \n\t\t \n\t\t \n\t\t\t J Lu \n\t\t \n\t\t \n\t\t\t E Court \n\t\t \n\t\t \n\t\t\t A Y Mayorov \n\t\t \n\t\t 10.2217/cer-2020-0271 \n\t \n\t \n\t\t J. Comp. Eff. Res \n\t\t \n\t\t\t 10 \n\t\t\t \n\t\t\t 2021 \n\t\t \n\t \n\t Raposo, J.F.; Shestakova, M.V.; Lu, J.; Court, E.; Mayorov, A.Y. Identifying the unmet needs of individuals with Type 2 diabetes: An international web-based survey. J. Comp. Eff. Res. 2021, 10, 613-624. [CrossRef]"
    },
    {
      "title": "Digital Health Technologies Enabling Partnerships in Chronic Care Management: Scoping Review",
      "authors": [
        "C Wannheden",
        "M \u00c5berg-Wennerholm",
        "M Dahlberg",
        "\u00c5 Reven\u00e4s",
        "S Tolf",
        "E Eftimovska",
        "M Brommels"
      ],
      "year": 2022,
      "doi": "10.2196/38980",
      "journal": "J. Med. Internet Res",
      "volume": "24",
      "pages": "38980",
      "raw": "Digital Health Technologies Enabling Partnerships in Chronic Care Management: Scoping Review \n\t\t \n\t\t\t C Wannheden \n\t\t \n\t\t \n\t\t\t M \u00c5berg-Wennerholm \n\t\t \n\t\t \n\t\t\t M Dahlberg \n\t\t \n\t\t \n\t\t\t \u00c5 Reven\u00e4s \n\t\t \n\t\t \n\t\t\t S Tolf \n\t\t \n\t\t \n\t\t\t E Eftimovska \n\t\t \n\t\t \n\t\t\t M Brommels \n\t\t \n\t\t 10.2196/38980 \n\t \n\t \n\t\t J. Med. Internet Res \n\t\t \n\t\t\t 24 \n\t\t\t 38980 \n\t\t\t 2022 \n\t\t \n\t \n\t Wannheden, C.; \u00c5berg-Wennerholm, M.; Dahlberg, M.; Reven\u00e4s, \u00c5.; Tolf, S.; Eftimovska, E.; Brommels, M. Digital Health Technologies Enabling Partnerships in Chronic Care Management: Scoping Review. J. Med. Internet Res. 2022, 24, e38980. [CrossRef]"
    },
    {
      "title": "Tele-health Start-Up and Resource Guide, Version 1.1",
      "year": 2010,
      "doi": "10.1089/tmj.2008.8477",
      "raw": "Tele-health Start-Up and Resource Guide, Version 1.1 \n\t\t 10.1089/tmj.2008.8477 \n\t\t \n\t \n\t \n\t\t Telling and gpTRAC (Great Plains Tele-health Resource & Assistance Center) \n\t\t \n\t\t\t October 2010. 10 April 2025 \n\t\t \n\t \n\t Telling and gpTRAC (Great Plains Tele-health Resource & Assistance Center). Tele-health Start-Up and Resource Guide, Version 1.1, October 2010. Available online: https://www.healthit.gov/sites/default/files/playbook/pdf/telehealth-startup- and-resource-guide.pdf (accessed on 10 April 2025)."
    },
    {
      "title": "Telemedicina Linee di Indirizzo Nazionali",
      "year": 2025,
      "doi": "10.4081/mem.2021.945",
      "raw": "10.4081/mem.2021.945 \n\t\t \n\t\t Telemedicina Linee di Indirizzo Nazionali \n\t\t \n\t\t\t Ministero della Salute \n\t\t\t 10 April 2025 \n\t\t \n\t \n\t Ministero della Salute. Telemedicina Linee di Indirizzo Nazionali. Available online: https://www.salute.gov.it/new/it/tema/ telemedicina/linee-di-indirizzo-nazionali-sulla-telemedicina/ (accessed on 10 April 2025)."
    },
    {
      "title": "Clinical Improvements by Telemedicine Interventions Managing Type 1 and Type 2 Diabetes: Systematic Meta-review",
      "authors": [
        "C Eberle",
        "S Stichling"
      ],
      "year": 2021,
      "doi": "10.2196/23244",
      "journal": "J. Med. Internet Res",
      "volume": "23",
      "pages": "23244",
      "raw": "Clinical Improvements by Telemedicine Interventions Managing Type 1 and Type 2 Diabetes: Systematic Meta-review \n\t\t \n\t\t\t C Eberle \n\t\t \n\t\t \n\t\t\t S Stichling \n\t\t \n\t\t 10.2196/23244 \n\t \n\t \n\t\t J. Med. Internet Res \n\t\t \n\t\t\t 23 \n\t\t\t 23244 \n\t\t\t 2021 \n\t\t \n\t \n\t Eberle, C.; Stichling, S. Clinical Improvements by Telemedicine Interventions Managing Type 1 and Type 2 Diabetes: Systematic Meta-review. J. Med. Internet Res. 2021, 23, e23244. [CrossRef]"
    },
    {
      "title": "Enablers and barriers to using two-way information technology in the management of adults with diabetes: A descriptive systematic review",
      "authors": [
        "E Macdonald",
        "B Perrin",
        "M Kingsley"
      ],
      "year": 2018,
      "doi": "10.1177/1357633x17699990",
      "journal": "J. Telemed. Telecare",
      "volume": "24",
      "raw": "Enablers and barriers to using two-way information technology in the management of adults with diabetes: A descriptive systematic review \n\t\t \n\t\t\t E M Macdonald \n\t\t \n\t\t \n\t\t\t B M Perrin \n\t\t \n\t\t \n\t\t\t M I Kingsley \n\t\t \n\t\t 10.1177/1357633x17699990 \n\t \n\t \n\t\t J. Telemed. Telecare \n\t\t \n\t\t\t 24 \n\t\t\t \n\t\t\t 2018 \n\t\t \n\t \n\t Macdonald, E.M.; Perrin, B.M.; Kingsley, M.I. Enablers and barriers to using two-way information technology in the management of adults with diabetes: A descriptive systematic review. J. Telemed. Telecare. 2018, 24, 319-340. [CrossRef]"
    },
    {
      "title": "Clinical Effectiveness of Telemedicine in Diabetes Mellitus: A Meta-Analysis of 42 Randomized Controlled Trials",
      "authors": [
        "H Tchero",
        "P Kangambega",
        "C Briatte",
        "S Brunet-Houdard",
        "G Retali",
        "E Rusch"
      ],
      "year": 2019,
      "doi": "10.1089/tmj.2018.0128",
      "journal": "Telemed. J. E Health",
      "volume": "25",
      "raw": "Clinical Effectiveness of Telemedicine in Diabetes Mellitus: A Meta-Analysis of 42 Randomized Controlled Trials \n\t\t \n\t\t\t H Tchero \n\t\t \n\t\t \n\t\t\t P Kangambega \n\t\t \n\t\t \n\t\t\t C Briatte \n\t\t \n\t\t \n\t\t\t S Brunet-Houdard \n\t\t \n\t\t \n\t\t\t G R Retali \n\t\t \n\t\t \n\t\t\t E Rusch \n\t\t \n\t\t 10.1089/tmj.2018.0128 \n\t \n\t \n\t\t Telemed. J. E Health \n\t\t \n\t\t\t 25 \n\t\t\t \n\t\t\t 2019 \n\t\t \n\t \n\t Tchero, H.; Kangambega, P.; Briatte, C.; Brunet-Houdard, S.; Retali, G.R.; Rusch, E. Clinical Effectiveness of Telemedicine in Diabetes Mellitus: A Meta-Analysis of 42 Randomized Controlled Trials. Telemed. J. E Health 2019, 25, 569-583. [CrossRef]"
    },
    {
      "title": "Telemedicine Cost-Effectiveness for Diabetes Management: A Systematic Review",
      "authors": [
        "J Lee",
        "S Lee"
      ],
      "year": 2018,
      "doi": "10.1089/dia.2018.0098",
      "journal": "Diabetes Technol. Ther",
      "volume": "20",
      "raw": "Telemedicine Cost-Effectiveness for Diabetes Management: A Systematic Review \n\t\t \n\t\t\t J Y Lee \n\t\t \n\t\t \n\t\t\t S W H Lee \n\t\t \n\t\t 10.1089/dia.2018.0098 \n\t \n\t \n\t\t Diabetes Technol. Ther \n\t\t \n\t\t\t 20 \n\t\t\t \n\t\t\t 2018 \n\t\t \n\t \n\t Lee, J.Y.; Lee, S.W.H. Telemedicine Cost-Effectiveness for Diabetes Management: A Systematic Review. Diabetes Technol. Ther. 2018, 20, 492-500. [CrossRef] [PubMed]"
    },
    {
      "title": "Care Coordination/Home Telehealth: The systematic implementation of health informatics, home telehealth, and disease management to support the care of veteran patients with chronic conditions",
      "authors": [
        "A Darkins",
        "P Ryan",
        "R Kobb",
        "L Foster",
        "E Edmonson",
        "B Wakefield",
        "A Lancaster"
      ],
      "year": 2008,
      "doi": "10.1089/tmj.2008.0021",
      "journal": "Telemed. J. E Health",
      "volume": "14",
      "raw": "Care Coordination/Home Telehealth: The systematic implementation of health informatics, home telehealth, and disease management to support the care of veteran patients with chronic conditions \n\t\t \n\t\t\t A Darkins \n\t\t \n\t\t \n\t\t\t P Ryan \n\t\t \n\t\t \n\t\t\t R Kobb \n\t\t \n\t\t \n\t\t\t L Foster \n\t\t \n\t\t \n\t\t\t E Edmonson \n\t\t \n\t\t \n\t\t\t B Wakefield \n\t\t \n\t\t \n\t\t\t A E Lancaster \n\t\t \n\t\t 10.1089/tmj.2008.0021 \n\t \n\t \n\t\t Telemed. J. E Health \n\t\t \n\t\t\t 14 \n\t\t\t \n\t\t\t 2008 \n\t\t \n\t \n\t Darkins, A.; Ryan, P.; Kobb, R.; Foster, L.; Edmonson, E.; Wakefield, B.; Lancaster, A.E. Care Coordination/Home Telehealth: The systematic implementation of health informatics, home telehealth, and disease management to support the care of veteran patients with chronic conditions. Telemed. J. E Health 2008, 14, 1118-1126. [CrossRef] [PubMed]"
    },
    {
      "title": "Telemedicine and advances in urban and rural healthcare delivery in Africa",
      "authors": [
        "M Mars"
      ],
      "year": 2013,
      "doi": "10.1016/j.pcad.2013.10.006",
      "journal": "Prog. Cardiovasc. Dis",
      "volume": "56",
      "raw": "Telemedicine and advances in urban and rural healthcare delivery in Africa \n\t\t \n\t\t\t M Mars \n\t\t \n\t\t 10.1016/j.pcad.2013.10.006 \n\t \n\t \n\t\t Prog. Cardiovasc. Dis \n\t\t \n\t\t\t 56 \n\t\t\t \n\t\t\t 2013 \n\t\t \n\t \n\t Mars, M. Telemedicine and advances in urban and rural healthcare delivery in Africa. Prog. Cardiovasc. Dis. 2013, 56, 326-335. [CrossRef] [PubMed]"
    },
    {
      "title": "International Consensus on Use of Continuous Glucose Monitoring",
      "authors": [
        "T Danne",
        "R Nimri",
        "T Battelino",
        "R Bergenstal",
        "K Close",
        "J Devries",
        "S Garg",
        "L Heinemann",
        "I Hirsch",
        "S Amiel"
      ],
      "year": 2017,
      "doi": "10.2337/dc17-1600",
      "journal": "Diabetes Care",
      "volume": "40",
      "raw": "International Consensus on Use of Continuous Glucose Monitoring \n\t\t \n\t\t\t T Danne \n\t\t \n\t\t \n\t\t\t R Nimri \n\t\t \n\t\t \n\t\t\t T Battelino \n\t\t \n\t\t \n\t\t\t R M Bergenstal \n\t\t \n\t\t \n\t\t\t K L Close \n\t\t \n\t\t \n\t\t\t J H Devries \n\t\t \n\t\t \n\t\t\t S Garg \n\t\t \n\t\t \n\t\t\t L Heinemann \n\t\t \n\t\t \n\t\t\t I Hirsch \n\t\t \n\t\t \n\t\t\t S A Amiel \n\t\t \n\t\t 10.2337/dc17-1600 \n\t \n\t \n\t\t Diabetes Care \n\t\t \n\t\t\t 40 \n\t\t\t \n\t\t\t 2017 \n\t\t \n\t \n\t Danne, T.; Nimri, R.; Battelino, T.; Bergenstal, R.M.; Close, K.L.; DeVries, J.H.; Garg, S.; Heinemann, L.; Hirsch, I.; Amiel, S.A.; et al. International Consensus on Use of Continuous Glucose Monitoring. Diabetes Care 2017, 40, 1631-1640. [CrossRef]"
    },
    {
      "title": "Diabetes Technology: Standards of Care in Diabetes-2024",
      "year": 2024,
      "doi": "10.2337/dc24-s007",
      "journal": "Diabetes Care",
      "volume": "7",
      "raw": "Diabetes Technology: Standards of Care in Diabetes-2024 \n\t\t 10.2337/dc24-s007 \n\t \n\t \n\t\t Diabetes Care \n\t\t \n\t\t\t 7 \n\t\t\t \n\t\t\t 2024 \n\t\t\t American Diabetes Association Professional Practice Committee \n\t\t \n\t \n\t Suppl. S1 \n\t American Diabetes Association Professional Practice Committee. 7. Diabetes Technology: Standards of Care in Diabetes-2024. Diabetes Care 2024, 47 (Suppl. S1), S126-S144. [CrossRef]"
    },
    {
      "title": "Clinical Targets for Continuous Glucose Monitoring Data Interpretation: Recommendations From the International Consensus on Time in Range",
      "authors": [
        "T Battelino",
        "T Danne",
        "R Bergenstal",
        "S Amiel",
        "R Beck",
        "T Biester",
        "E Bosi",
        "B Buckingham",
        "W Cefalu",
        "K Close"
      ],
      "year": 2019,
      "doi": "10.2337/dci19-0028",
      "journal": "Diabetes Care",
      "volume": "42",
      "raw": "Clinical Targets for Continuous Glucose Monitoring Data Interpretation: Recommendations From the International Consensus on Time in Range \n\t\t \n\t\t\t T Battelino \n\t\t \n\t\t \n\t\t\t T Danne \n\t\t \n\t\t \n\t\t\t R M Bergenstal \n\t\t \n\t\t \n\t\t\t S A Amiel \n\t\t \n\t\t \n\t\t\t R Beck \n\t\t \n\t\t \n\t\t\t T Biester \n\t\t \n\t\t \n\t\t\t E Bosi \n\t\t \n\t\t \n\t\t\t B A Buckingham \n\t\t \n\t\t \n\t\t\t W T Cefalu \n\t\t \n\t\t \n\t\t\t K L Close \n\t\t \n\t\t 10.2337/dci19-0028 \n\t \n\t \n\t\t Diabetes Care \n\t\t \n\t\t\t 42 \n\t\t\t \n\t\t\t 2019 \n\t\t \n\t \n\t Battelino, T.; Danne, T.; Bergenstal, R.M.; Amiel, S.A.; Beck, R.; Biester, T.; Bosi, E.; Buckingham, B.A.; Cefalu, W.T.; Close, K.L.; et al. Clinical Targets for Continuous Glucose Monitoring Data Interpretation: Recommendations From the International Consensus on Time in Range. Diabetes Care 2019, 42, 1593-1603. [CrossRef]"
    },
    {
      "title": "Continuous Glucose Monitoring Study Group. Continuous glucose monitoring and intensive treatment of type 1 diabetes",
      "authors": [
        "W Tamborlane",
        "R Beck",
        "B Bode",
        "B Buckingham",
        "H Chase",
        "R Clemons",
        "R Fiallo-Scharer",
        "L Fox",
        "L Gilliam",
        "I Hirsch"
      ],
      "year": 2008,
      "doi": "10.1056/nejmoa0805017",
      "journal": "N. Engl. J. Med",
      "volume": "359",
      "raw": "Continuous Glucose Monitoring Study Group. Continuous glucose monitoring and intensive treatment of type 1 diabetes \n\t\t \n\t\t\t W V Tamborlane \n\t\t \n\t\t \n\t\t\t R W Beck \n\t\t \n\t\t \n\t\t\t B W Bode \n\t\t \n\t\t \n\t\t\t B Buckingham \n\t\t \n\t\t \n\t\t\t H P Chase \n\t\t \n\t\t \n\t\t\t R Clemons \n\t\t \n\t\t \n\t\t\t R Fiallo-Scharer \n\t\t \n\t\t \n\t\t\t L A Fox \n\t\t \n\t\t \n\t\t\t L K Gilliam \n\t\t \n\t\t \n\t\t\t I B Hirsch \n\t\t \n\t\t 10.1056/nejmoa0805017 \n\t \n\t \n\t\t N. Engl. J. Med \n\t\t \n\t\t\t 359 \n\t\t\t \n\t\t\t 2008 \n\t\t \n\t \n\t Tamborlane, W.V.; Beck, R.W.; Bode, B.W.; Buckingham, B.; Chase, H.P.; Clemons, R.; Fiallo-Scharer, R.; Fox, L.A.; Gilliam, L.K.; Hirsch, I.B.; et al. Continuous Glucose Monitoring Study Group. Continuous glucose monitoring and intensive treatment of type 1 diabetes. N. Engl. J. Med. 2008, 359, 1464-1476."
    },
    {
      "title": "Effect of continuous glucose monitoring on hypoglycemia in type 1 diabetes",
      "authors": [
        "T Battelino",
        "M Phillip",
        "N Bratina",
        "R Nimri",
        "P Oskarsson",
        "J Bolinder"
      ],
      "year": 2011,
      "doi": "10.2337/dc10-1989",
      "journal": "Diabetes Care",
      "volume": "34",
      "raw": "Effect of continuous glucose monitoring on hypoglycemia in type 1 diabetes \n\t\t \n\t\t\t T Battelino \n\t\t \n\t\t \n\t\t\t M Phillip \n\t\t \n\t\t \n\t\t\t N Bratina \n\t\t \n\t\t \n\t\t\t R Nimri \n\t\t \n\t\t \n\t\t\t P Oskarsson \n\t\t \n\t\t \n\t\t\t J Bolinder \n\t\t \n\t\t 10.2337/dc10-1989 \n\t \n\t \n\t\t Diabetes Care \n\t\t \n\t\t\t 34 \n\t\t\t \n\t\t\t 2011 \n\t\t \n\t \n\t Battelino, T.; Phillip, M.; Bratina, N.; Nimri, R.; Oskarsson, P.; Bolinder, J. Effect of continuous glucose monitoring on hypoglycemia in type 1 diabetes. Diabetes Care 2011, 34, 795-800. [CrossRef]"
    },
    {
      "title": "The use and efficacy of continuous glucose monitoring in type 1 diabetes treated with insulin pump therapy: A randomised controlled trial",
      "authors": [
        "T Battelino",
        "I Conget",
        "B Olsen",
        "I Sch\u00fctz-Fuhrmann",
        "E Hommel",
        "R Hoogma",
        "U Schierloh",
        "N Sulli",
        "J Bolinder"
      ],
      "year": 2012,
      "doi": "10.1007/s00125-012-2708-9",
      "journal": "Diabetologia",
      "volume": "55",
      "raw": "The use and efficacy of continuous glucose monitoring in type 1 diabetes treated with insulin pump therapy: A randomised controlled trial \n\t\t \n\t\t\t T Battelino \n\t\t \n\t\t \n\t\t\t I Conget \n\t\t \n\t\t \n\t\t\t B Olsen \n\t\t \n\t\t \n\t\t\t I Sch\u00fctz-Fuhrmann \n\t\t \n\t\t \n\t\t\t E Hommel \n\t\t \n\t\t \n\t\t\t R Hoogma \n\t\t \n\t\t \n\t\t\t U Schierloh \n\t\t \n\t\t \n\t\t\t N Sulli \n\t\t \n\t\t \n\t\t\t J Bolinder \n\t\t \n\t\t \n\t\t\t Switch Study \n\t\t \n\t\t \n\t\t\t Group \n\t\t \n\t\t 10.1007/s00125-012-2708-9 \n\t \n\t \n\t\t Diabetologia \n\t\t \n\t\t\t 55 \n\t\t\t \n\t\t\t 2012 \n\t\t \n\t \n\t Battelino, T.; Conget, I.; Olsen, B.; Sch\u00fctz-Fuhrmann, I.; Hommel, E.; Hoogma, R.; Schierloh, U.; Sulli, N.; Bolinder, J.; SWITCH Study Group. The use and efficacy of continuous glucose monitoring in type 1 diabetes treated with insulin pump therapy: A randomised controlled trial. Diabetologia 2012, 55, 3155-3162. [CrossRef] [PubMed]"
    },
    {
      "title": "Recovery of hypoglycemia awareness in long-standing type 1 diabetes: A multicenter 2 \u00d7 2 factorial randomized controlled trial comparing insulin pump with multiple daily injections and continuous with conventional glucose self-monitoring (HypoCOMPaSS)",
      "authors": [
        "S Little",
        "L Leelarathna",
        "E Walkinshaw",
        "H Tan",
        "O Chapple",
        "A Lubina-Solomon",
        "T Chadwick",
        "S Barendse",
        "D Stocken",
        "C Brennand"
      ],
      "year": 2014,
      "doi": "10.2337/dc14-0030",
      "journal": "Diabetes Care",
      "volume": "37",
      "raw": "Recovery of hypoglycemia awareness in long-standing type 1 diabetes: A multicenter 2 \u00d7 2 factorial randomized controlled trial comparing insulin pump with multiple daily injections and continuous with conventional glucose self-monitoring (HypoCOMPaSS) \n\t\t \n\t\t\t S A Little \n\t\t \n\t\t \n\t\t\t L Leelarathna \n\t\t \n\t\t \n\t\t\t E Walkinshaw \n\t\t \n\t\t \n\t\t\t H K Tan \n\t\t \n\t\t \n\t\t\t O Chapple \n\t\t \n\t\t \n\t\t\t A Lubina-Solomon \n\t\t \n\t\t \n\t\t\t T J Chadwick \n\t\t \n\t\t \n\t\t\t S Barendse \n\t\t \n\t\t \n\t\t\t D D Stocken \n\t\t \n\t\t \n\t\t\t C Brennand \n\t\t \n\t\t 10.2337/dc14-0030 \n\t \n\t \n\t\t Diabetes Care \n\t\t \n\t\t\t 37 \n\t\t\t \n\t\t\t 2014 \n\t\t \n\t \n\t Little, S.A.; Leelarathna, L.; Walkinshaw, E.; Tan, H.K.; Chapple, O.; Lubina-Solomon, A.; Chadwick, T.J.; Barendse, S.; Stocken, D.D.; Brennand, C.; et al. Recovery of hypoglycemia awareness in long-standing type 1 diabetes: A multicenter 2 \u00d7 2 factorial randomized controlled trial comparing insulin pump with multiple daily injections and continuous with conventional glucose self-monitoring (HypoCOMPaSS). Diabetes Care 2014, 37, 2114-2122. [CrossRef]"
    },
    {
      "title": "Continuous glucose monitoring for patients with type 1 diabetes and impaired awareness of hypoglycaemia (IN CONTROL): A randomised, open-label, crossover trial",
      "authors": [
        "C Van Beers",
        "J Devries",
        "S Kleijer",
        "M Smits",
        "P Geelhoed-Duijvestijn",
        "M Kramer",
        "M Diamant",
        "F Snoek",
        "E Sern\u00e9"
      ],
      "year": 2016,
      "doi": "10.1016/s2213-8587(16)30193-0",
      "journal": "Lancet Diabetes Endocrinol",
      "volume": "4",
      "raw": "Continuous glucose monitoring for patients with type 1 diabetes and impaired awareness of hypoglycaemia (IN CONTROL): A randomised, open-label, crossover trial \n\t\t \n\t\t\t C A Van Beers \n\t\t \n\t\t \n\t\t\t J H Devries \n\t\t \n\t\t \n\t\t\t S J Kleijer \n\t\t \n\t\t \n\t\t\t M M Smits \n\t\t \n\t\t \n\t\t\t P H Geelhoed-Duijvestijn \n\t\t \n\t\t \n\t\t\t M H Kramer \n\t\t \n\t\t \n\t\t\t M Diamant \n\t\t \n\t\t \n\t\t\t F J Snoek \n\t\t \n\t\t \n\t\t\t E H Sern\u00e9 \n\t\t \n\t\t 10.1016/s2213-8587(16)30193-0 \n\t \n\t \n\t\t Lancet Diabetes Endocrinol \n\t\t \n\t\t\t 4 \n\t\t\t \n\t\t\t 2016 \n\t\t \n\t \n\t van Beers, C.A.; DeVries, J.H.; Kleijer, S.J.; Smits, M.M.; Geelhoed-Duijvestijn, P.H.; Kramer, M.H.; Diamant, M.; Snoek, F.J.; Sern\u00e9, E.H. Continuous glucose monitoring for patients with type 1 diabetes and impaired awareness of hypoglycaemia (IN CONTROL): A randomised, open-label, crossover trial. Lancet Diabetes Endocrinol. 2016, 4, 893-902. [CrossRef] [PubMed]"
    },
    {
      "title": "Effect of Continuous Glucose Monitoring on Glycemic Control in Adults With Type 1 Diabetes Using Insulin Injections: The DIAMOND Randomized Clinical Trial",
      "authors": [
        "R Beck",
        "T Riddlesworth",
        "K Ruedy",
        "A Ahmann",
        "R Bergenstal",
        "S Haller",
        "C Kollman",
        "D Kruger",
        "J Mcgill",
        "W Polonsky"
      ],
      "year": 2017,
      "doi": "10.1001/jama.2016.19975",
      "journal": "JAMA",
      "volume": "317",
      "raw": "Effect of Continuous Glucose Monitoring on Glycemic Control in Adults With Type 1 Diabetes Using Insulin Injections: The DIAMOND Randomized Clinical Trial \n\t\t \n\t\t\t R W Beck \n\t\t \n\t\t \n\t\t\t T Riddlesworth \n\t\t \n\t\t \n\t\t\t K Ruedy \n\t\t \n\t\t \n\t\t\t A Ahmann \n\t\t \n\t\t \n\t\t\t R Bergenstal \n\t\t \n\t\t \n\t\t\t S Haller \n\t\t \n\t\t \n\t\t\t C Kollman \n\t\t \n\t\t \n\t\t\t D Kruger \n\t\t \n\t\t \n\t\t\t J B Mcgill \n\t\t \n\t\t \n\t\t\t W Polonsky \n\t\t \n\t\t 10.1001/jama.2016.19975 \n\t \n\t \n\t\t JAMA \n\t\t \n\t\t\t 317 \n\t\t\t \n\t\t\t 2017 \n\t\t \n\t \n\t Beck, R.W.; Riddlesworth, T.; Ruedy, K.; Ahmann, A.; Bergenstal, R.; Haller, S.; Kollman, C.; Kruger, D.; McGill, J.B.; Polonsky, W.; et al. Effect of Continuous Glucose Monitoring on Glycemic Control in Adults With Type 1 Diabetes Using Insulin Injections: The DIAMOND Randomized Clinical Trial. JAMA 2017, 317, 371-378. [CrossRef]"
    },
    {
      "title": "Continuous Glucose Monitoring Versus Usual Care in Patients With Type 2 Diabetes Receiving Multiple Daily Insulin Injections: A Randomized Trial",
      "authors": [
        "R Beck",
        "T Riddlesworth",
        "K Ruedy",
        "A Ahmann",
        "S Haller",
        "D Kruger",
        "J Mcgill",
        "W Polonsky",
        "D Price",
        "S Aronoff"
      ],
      "year": 2017,
      "doi": "10.7326/M16-2855",
      "journal": "Ann. Intern. Med",
      "volume": "167",
      "raw": "Continuous Glucose Monitoring Versus Usual Care in Patients With Type 2 Diabetes Receiving Multiple Daily Insulin Injections: A Randomized Trial \n\t\t \n\t\t\t R W Beck \n\t\t \n\t\t \n\t\t\t T D Riddlesworth \n\t\t \n\t\t \n\t\t\t K Ruedy \n\t\t \n\t\t \n\t\t\t A Ahmann \n\t\t \n\t\t \n\t\t\t S Haller \n\t\t \n\t\t \n\t\t\t D Kruger \n\t\t \n\t\t \n\t\t\t J B Mcgill \n\t\t \n\t\t \n\t\t\t W Polonsky \n\t\t \n\t\t \n\t\t\t D Price \n\t\t \n\t\t \n\t\t\t S Aronoff \n\t\t \n\t\t 10.7326/M16-2855 \n\t \n\t \n\t\t Ann. Intern. Med \n\t\t \n\t\t\t 167 \n\t\t\t \n\t\t\t 2017 \n\t\t \n\t \n\t Beck, R.W.; Riddlesworth, T.D.; Ruedy, K.; Ahmann, A.; Haller, S.; Kruger, D.; McGill, J.B.; Polonsky, W.; Price, D.; Aronoff, S.; et al. Continuous Glucose Monitoring Versus Usual Care in Patients With Type 2 Diabetes Receiving Multiple Daily Insulin Injections: A Randomized Trial. Ann. Intern. Med. 2017, 167, 365-374. [CrossRef] [PubMed]"
    },
    {
      "title": "Real-time continuous glucose monitoring in adults with type 1 diabetes and impaired hypoglycaemia awareness or severe hypoglycaemia treated with multiple daily insulin injections (HypoDE): A multicentre, randomised controlled trial",
      "authors": [
        "L Heinemann",
        "G Freckmann",
        "D Ehrmann",
        "G Faber-Heinemann",
        "S Guerra",
        "D Waldenmaier",
        "N Hermanns"
      ],
      "year": 2018,
      "doi": "10.1016/S0140-6736(18)30297-6",
      "journal": "Lancet",
      "volume": "391",
      "raw": "Real-time continuous glucose monitoring in adults with type 1 diabetes and impaired hypoglycaemia awareness or severe hypoglycaemia treated with multiple daily insulin injections (HypoDE): A multicentre, randomised controlled trial \n\t\t \n\t\t\t L Heinemann \n\t\t \n\t\t \n\t\t\t G Freckmann \n\t\t \n\t\t \n\t\t\t D Ehrmann \n\t\t \n\t\t \n\t\t\t G Faber-Heinemann \n\t\t \n\t\t \n\t\t\t S Guerra \n\t\t \n\t\t \n\t\t\t D Waldenmaier \n\t\t \n\t\t \n\t\t\t N Hermanns \n\t\t \n\t\t 10.1016/S0140-6736(18)30297-6 \n\t \n\t \n\t\t Lancet \n\t\t \n\t\t\t 391 \n\t\t\t \n\t\t\t 2018 \n\t\t \n\t \n\t Heinemann, L.; Freckmann, G.; Ehrmann, D.; Faber-Heinemann, G.; Guerra, S.; Waldenmaier, D.; Hermanns, N. Real-time continuous glucose monitoring in adults with type 1 diabetes and impaired hypoglycaemia awareness or severe hypoglycaemia treated with multiple daily insulin injections (HypoDE): A multicentre, randomised controlled trial. Lancet 2018, 391, 1367-1377. [CrossRef]"
    },
    {
      "title": "Wireless Innovation for Seniors with Diabetes Mellitus (WISDM) Study Group. Effect of Continuous Glucose Monitoring on Hypoglycemia in Older Adults with Type 1 Diabetes: A Randomized Clinical Trial",
      "authors": [
        "R Pratley",
        "L Kanapka",
        "M Ahmann",
        "A Aleppo",
        "G Beck",
        "R Bhargava",
        "A Bode",
        "B Carlson",
        "A Chaytor"
      ],
      "year": 2020,
      "doi": "10.1001/jama.2020.6928",
      "journal": "JAMA",
      "volume": "323",
      "raw": "Wireless Innovation for Seniors with Diabetes Mellitus (WISDM) Study Group. Effect of Continuous Glucose Monitoring on Hypoglycemia in Older Adults with Type 1 Diabetes: A Randomized Clinical Trial \n\t\t \n\t\t\t R E Pratley \n\t\t \n\t\t \n\t\t\t L G Kanapka \n\t\t \n\t\t \n\t\t\t M R Ahmann \n\t\t \n\t\t \n\t\t\t A Aleppo \n\t\t \n\t\t \n\t\t\t G Beck \n\t\t \n\t\t \n\t\t\t R Bhargava \n\t\t \n\t\t \n\t\t\t A Bode \n\t\t \n\t\t \n\t\t\t B W Carlson \n\t\t \n\t\t \n\t\t\t A Chaytor \n\t\t \n\t\t \n\t\t\t N S \n\t\t \n\t\t 10.1001/jama.2020.6928 \n\t \n\t \n\t\t JAMA \n\t\t \n\t\t\t 323 \n\t\t\t \n\t\t\t 2020 \n\t\t \n\t \n\t Pratley, R.E.; Kanapka, L.G.; M.R.; Ahmann, A.; Aleppo, G.; Beck, R.; Bhargava, A.; Bode, B.W.; Carlson, A.; Chaytor, N.S.; et al. Wireless Innovation for Seniors with Diabetes Mellitus (WISDM) Study Group. Effect of Continuous Glucose Monitoring on Hypoglycemia in Older Adults with Type 1 Diabetes: A Randomized Clinical Trial. JAMA 2020, 323, 2397-2406. [CrossRef]"
    },
    {
      "title": "Effect of Continuous Glucose Monitoring on Glycemic Control in Patients with Type 2 Diabetes Treated with Basal Insulin: A Randomized Clinical Trial",
      "authors": [
        "T Martens",
        "R Beck",
        "R Bailey",
        "K Ruedy",
        "P Calhoun",
        "A Peters",
        "R Pop-Busui",
        "A Philis-Tsimikas",
        "S Bao",
        "G Umpierrez"
      ],
      "year": 2021,
      "doi": "10.1001/jama.2021.7444",
      "journal": "JAMA",
      "volume": "325",
      "raw": "Effect of Continuous Glucose Monitoring on Glycemic Control in Patients with Type 2 Diabetes Treated with Basal Insulin: A Randomized Clinical Trial \n\t\t \n\t\t\t T Martens \n\t\t \n\t\t \n\t\t\t R W Beck \n\t\t \n\t\t \n\t\t\t R Bailey \n\t\t \n\t\t \n\t\t\t K J Ruedy \n\t\t \n\t\t \n\t\t\t P Calhoun \n\t\t \n\t\t \n\t\t\t A L Peters \n\t\t \n\t\t \n\t\t\t R Pop-Busui \n\t\t \n\t\t \n\t\t\t A Philis-Tsimikas \n\t\t \n\t\t \n\t\t\t S Bao \n\t\t \n\t\t \n\t\t\t G Umpierrez \n\t\t \n\t\t 10.1001/jama.2021.7444 \n\t \n\t \n\t\t JAMA \n\t\t \n\t\t\t 325 \n\t\t\t \n\t\t\t 2021 \n\t\t \n\t \n\t Martens, T.; Beck, R.W.; Bailey, R.; Ruedy, K.J.; Calhoun, P.; Peters, A.L.; Pop-Busui, R.; Philis-Tsimikas, A.; Bao, S.; Umpierrez, G.; et al. Effect of Continuous Glucose Monitoring on Glycemic Control in Patients with Type 2 Diabetes Treated with Basal Insulin: A Randomized Clinical Trial. JAMA 2021, 325, 2262-2272. [CrossRef]"
    },
    {
      "title": "Glycaemic control in type 1 diabetes during real time continuous glucose monitoring compared with self monitoring of blood glucose: Meta-analysis of randomised controlled trials using individual patient data",
      "authors": [
        "J Pickup",
        "S Freeman",
        "A Sutton"
      ],
      "year": 2011,
      "doi": "10.1136/bmj.d3805",
      "journal": "BMJ",
      "volume": "343",
      "pages": "3805",
      "raw": "Glycaemic control in type 1 diabetes during real time continuous glucose monitoring compared with self monitoring of blood glucose: Meta-analysis of randomised controlled trials using individual patient data \n\t\t \n\t\t\t J C Pickup \n\t\t \n\t\t \n\t\t\t S C Freeman \n\t\t \n\t\t \n\t\t\t A J Sutton \n\t\t \n\t\t 10.1136/bmj.d3805 \n\t \n\t \n\t\t BMJ \n\t\t \n\t\t\t 343 \n\t\t\t 3805 \n\t\t\t 2011 \n\t\t \n\t \n\t Pickup, J.C.; Freeman, S.C.; Sutton, A.J. Glycaemic control in type 1 diabetes during real time continuous glucose monitoring compared with self monitoring of blood glucose: Meta-analysis of randomised controlled trials using individual patient data. BMJ 2011, 343, d3805. [CrossRef]"
    },
    {
      "title": "Type 2 Diabetes and the Use of Real-Time Continuous Glucose Monitoring",
      "authors": [
        "M Jackson",
        "A Ahmann",
        "V Shah"
      ],
      "year": 2021,
      "doi": "10.1089/dia.2021.0007",
      "journal": "Diabetes Technol Ther",
      "volume": "23",
      "issue": "1",
      "raw": "Type 2 Diabetes and the Use of Real-Time Continuous Glucose Monitoring \n\t\t \n\t\t\t M A Jackson \n\t\t \n\t\t \n\t\t\t A Ahmann \n\t\t \n\t\t \n\t\t\t V N Shah \n\t\t \n\t\t 10.1089/dia.2021.0007 \n\t \n\t \n\t\t Diabetes Technol Ther \n\t\t \n\t\t\t 23 \n\t\t\t 1 \n\t\t\t \n\t\t\t 2021 \n\t\t \n\t \n\t Jackson, M.A.; Ahmann, A.; Shah, V.N. Type 2 Diabetes and the Use of Real-Time Continuous Glucose Monitoring. Diabetes Technol Ther. 2021, 23 (S1), S27-S34. [CrossRef]"
    },
    {
      "title": "Continuous glucose monitoring in pregnant women with type 1 diabetes (CONCEPTT): A multicentre international randomised controlled trial",
      "authors": [
        "D Feig",
        "L Donovan",
        "R Corcoy",
        "K Murphy",
        "S Amiel",
        "K Hunt",
        "E Asztalos",
        "J Barrett",
        "J Sanchez",
        "A De Leiva"
      ],
      "year": 2017,
      "doi": "10.1016/s0140-6736(17)32400-5",
      "journal": "Lancet",
      "volume": "390",
      "raw": "Continuous glucose monitoring in pregnant women with type 1 diabetes (CONCEPTT): A multicentre international randomised controlled trial \n\t\t \n\t\t\t D S Feig \n\t\t \n\t\t \n\t\t\t L E Donovan \n\t\t \n\t\t \n\t\t\t R Corcoy \n\t\t \n\t\t \n\t\t\t K E Murphy \n\t\t \n\t\t \n\t\t\t S A Amiel \n\t\t \n\t\t \n\t\t\t K F Hunt \n\t\t \n\t\t \n\t\t\t E Asztalos \n\t\t \n\t\t \n\t\t\t J F R Barrett \n\t\t \n\t\t \n\t\t\t J J Sanchez \n\t\t \n\t\t \n\t\t\t A De Leiva \n\t\t \n\t\t 10.1016/s0140-6736(17)32400-5 \n\t \n\t \n\t\t Lancet \n\t\t \n\t\t\t 390 \n\t\t\t \n\t\t\t 2017 \n\t\t \n\t \n\t Feig, D.S.; Donovan, L.E.; Corcoy, R.; Murphy, K.E.; Amiel, S.A.; Hunt, K.F.; Asztalos, E.; Barrett, J.F.R.; Sanchez, J.J.; de Leiva, A.; et al. Continuous glucose monitoring in pregnant women with type 1 diabetes (CONCEPTT): A multicentre international randomised controlled trial. Lancet 2017, 390, 2347-2359. [CrossRef] [PubMed]"
    },
    {
      "title": "Intermittently Scanned Continuous Glucose Monitoring for Type 1 Diabetes",
      "authors": [
        "L Leelarathna",
        "M Evans",
        "S Neupane",
        "G Rayman",
        "S Lumley",
        "I Cranston",
        "P Narendran",
        "K Barnard-Kelly",
        "C Sutton",
        "R Elliott"
      ],
      "year": 2022,
      "doi": "10.1056/nejmoa2205650",
      "journal": "N. Engl. J. Med",
      "volume": "387",
      "raw": "Intermittently Scanned Continuous Glucose Monitoring for Type 1 Diabetes \n\t\t \n\t\t\t L Leelarathna \n\t\t \n\t\t \n\t\t\t M L Evans \n\t\t \n\t\t \n\t\t\t S Neupane \n\t\t \n\t\t \n\t\t\t G Rayman \n\t\t \n\t\t \n\t\t\t S Lumley \n\t\t \n\t\t \n\t\t\t I Cranston \n\t\t \n\t\t \n\t\t\t P Narendran \n\t\t \n\t\t \n\t\t\t K Barnard-Kelly \n\t\t \n\t\t \n\t\t\t C J Sutton \n\t\t \n\t\t \n\t\t\t R A Elliott \n\t\t \n\t\t 10.1056/nejmoa2205650 \n\t \n\t \n\t\t N. Engl. J. Med \n\t\t \n\t\t\t 387 \n\t\t\t \n\t\t\t 2022 \n\t\t \n\t \n\t Leelarathna, L.; Evans, M.L.; Neupane, S.; Rayman, G.; Lumley, S.; Cranston, I.; Narendran, P.; Barnard-Kelly, K.; Sutton, C.J.; Elliott, R.A.; et al. Intermittently Scanned Continuous Glucose Monitoring for Type 1 Diabetes. N. Engl. J. Med. 2022, 387, 1477-1487. [CrossRef]"
    },
    {
      "title": "Flash Glucose-Sensing Technology as a Replacement for Blood Glucose Monitoring for the Management of Insulin-Treated Type 2 Diabetes: A Multicenter, Open-Label Randomized Controlled Trial",
      "authors": [
        "T Haak",
        "H Hanaire",
        "R Ajjan",
        "N Hermanns",
        "J Riveline",
        "G Rayman"
      ],
      "year": 2017,
      "doi": "10.1007/s13300-016-0223-6",
      "journal": "Diabetes Ther",
      "volume": "8",
      "raw": "Flash Glucose-Sensing Technology as a Replacement for Blood Glucose Monitoring for the Management of Insulin-Treated Type 2 Diabetes: A Multicenter, Open-Label Randomized Controlled Trial \n\t\t \n\t\t\t T Haak \n\t\t \n\t\t \n\t\t\t H Hanaire \n\t\t \n\t\t \n\t\t\t R Ajjan \n\t\t \n\t\t \n\t\t\t N Hermanns \n\t\t \n\t\t \n\t\t\t J P Riveline \n\t\t \n\t\t \n\t\t\t G Rayman \n\t\t \n\t\t 10.1007/s13300-016-0223-6 \n\t \n\t \n\t\t Diabetes Ther \n\t\t \n\t\t\t 8 \n\t\t\t \n\t\t\t 2017 \n\t\t \n\t \n\t Haak, T.; Hanaire, H.; Ajjan, R.; Hermanns, N.; Riveline, J.P.; Rayman, G. Flash Glucose-Sensing Technology as a Replacement for Blood Glucose Monitoring for the Management of Insulin-Treated Type 2 Diabetes: A Multicenter, Open-Label Randomized Controlled Trial. Diabetes Ther. 2017, 8, 55-73. [CrossRef]"
    },
    {
      "title": "Effect of Flash Glucose Monitoring Technology on Glycemic Control and Treatment Satisfaction in Patients With Type 2 Diabetes",
      "authors": [
        "M Yaron",
        "E Roitman",
        "G Aharon-Hananel",
        "Z Landau",
        "T Ganz",
        "I Yanuv",
        "A Rozenberg",
        "M Karp",
        "M Ish-Shalom",
        "J Singer"
      ],
      "year": 2019,
      "doi": "10.2337/dc18-0166",
      "journal": "Diabetes Care",
      "volume": "42",
      "raw": "Effect of Flash Glucose Monitoring Technology on Glycemic Control and Treatment Satisfaction in Patients With Type 2 Diabetes \n\t\t \n\t\t\t M Yaron \n\t\t \n\t\t \n\t\t\t E Roitman \n\t\t \n\t\t \n\t\t\t G Aharon-Hananel \n\t\t \n\t\t \n\t\t\t Z Landau \n\t\t \n\t\t \n\t\t\t T Ganz \n\t\t \n\t\t \n\t\t\t I Yanuv \n\t\t \n\t\t \n\t\t\t A Rozenberg \n\t\t \n\t\t \n\t\t\t M Karp \n\t\t \n\t\t \n\t\t\t M Ish-Shalom \n\t\t \n\t\t \n\t\t\t J Singer \n\t\t \n\t\t 10.2337/dc18-0166 \n\t \n\t \n\t\t Diabetes Care \n\t\t \n\t\t\t 42 \n\t\t\t \n\t\t\t 2019 \n\t\t \n\t \n\t Yaron, M.; Roitman, E.; Aharon-Hananel, G.; Landau, Z.; Ganz, T.; Yanuv, I.; Rozenberg, A.; Karp, M.; Ish-Shalom, M.; Singer, J.; et al. Effect of Flash Glucose Monitoring Technology on Glycemic Control and Treatment Satisfaction in Patients With Type 2 Diabetes. Diabetes Care 2019, 42, 1178-1184. [CrossRef] [PubMed]"
    },
    {
      "title": "Effects of COVID-19 Lockdown on Glucose Control: Continuous Glucose Monitoring Data from People with Diabetes on Intensive Insulin Therapy",
      "authors": [
        "E Maddaloni",
        "L Coraggio",
        "S Pieralice",
        "A Carlone",
        "P Pozzilli",
        "R Buzzetti"
      ],
      "year": 2020,
      "doi": "10.2337/dc20-0954",
      "journal": "Diabetes Care",
      "volume": "43",
      "raw": "Effects of COVID-19 Lockdown on Glucose Control: Continuous Glucose Monitoring Data from People with Diabetes on Intensive Insulin Therapy \n\t\t \n\t\t\t E Maddaloni \n\t\t \n\t\t \n\t\t\t L Coraggio \n\t\t \n\t\t \n\t\t\t S Pieralice \n\t\t \n\t\t \n\t\t\t A Carlone \n\t\t \n\t\t \n\t\t\t P Pozzilli \n\t\t \n\t\t \n\t\t\t R Buzzetti \n\t\t \n\t\t 10.2337/dc20-0954 \n\t \n\t \n\t\t Diabetes Care \n\t\t \n\t\t\t 43 \n\t\t\t \n\t\t\t 2020 \n\t\t \n\t \n\t Maddaloni, E.; Coraggio, L.; Pieralice, S.; Carlone, A.; Pozzilli, P.; Buzzetti, R. Effects of COVID-19 Lockdown on Glucose Control: Continuous Glucose Monitoring Data from People with Diabetes on Intensive Insulin Therapy. Diabetes Care 2020, 43, e86-e87. [CrossRef]"
    },
    {
      "title": "Blood Glucose Control During Lockdown for COVID-19: CGM Metrics in Italian Adults With Type 1 Diabetes",
      "authors": [
        "B Capaldo",
        "G Annuzzi",
        "A Creanza",
        "C Giglio",
        "R De Angelis",
        "R Lupoli",
        "M Masulli",
        "G Riccardi",
        "A Rivellese",
        "L Bozzetto"
      ],
      "year": 2020,
      "doi": "10.2337/dc20-1127",
      "journal": "Diabetes Care",
      "volume": "43",
      "raw": "Blood Glucose Control During Lockdown for COVID-19: CGM Metrics in Italian Adults With Type 1 Diabetes \n\t\t \n\t\t\t B Capaldo \n\t\t \n\t\t \n\t\t\t G Annuzzi \n\t\t \n\t\t \n\t\t\t A Creanza \n\t\t \n\t\t \n\t\t\t C Giglio \n\t\t \n\t\t \n\t\t\t R De Angelis \n\t\t \n\t\t \n\t\t\t R Lupoli \n\t\t \n\t\t \n\t\t\t M Masulli \n\t\t \n\t\t \n\t\t\t G Riccardi \n\t\t \n\t\t \n\t\t\t A A Rivellese \n\t\t \n\t\t \n\t\t\t L Bozzetto \n\t\t \n\t\t 10.2337/dc20-1127 \n\t \n\t \n\t\t Diabetes Care \n\t\t \n\t\t\t 43 \n\t\t\t \n\t\t\t 2020 \n\t\t \n\t \n\t Capaldo, B.; Annuzzi, G.; Creanza, A.; Giglio, C.; De Angelis, R.; Lupoli, R.; Masulli, M.; Riccardi, G.; Rivellese, A.A.; Bozzetto, L. Blood Glucose Control During Lockdown for COVID-19: CGM Metrics in Italian Adults With Type 1 Diabetes. Diabetes Care 2020, 43, e88-e89. [CrossRef] [PubMed]"
    },
    {
      "title": "Effects of Continuous Glucose Monitoring on Metrics of Glycemic Control in Diabetes: A Systematic Review With Meta-analysis of Randomized Controlled Trials",
      "authors": [
        "M Maiorino",
        "S Signoriello",
        "A Maio",
        "P Chiodini",
        "G Bellastella",
        "L Scappaticcio",
        "M Longo",
        "D Giugliano",
        "K Esposito"
      ],
      "year": 2020,
      "doi": "10.2337/dc19-1459",
      "journal": "Diabetes Care",
      "volume": "43",
      "raw": "Effects of Continuous Glucose Monitoring on Metrics of Glycemic Control in Diabetes: A Systematic Review With Meta-analysis of Randomized Controlled Trials \n\t\t \n\t\t\t M I Maiorino \n\t\t \n\t\t \n\t\t\t S Signoriello \n\t\t \n\t\t \n\t\t\t A Maio \n\t\t \n\t\t \n\t\t\t P Chiodini \n\t\t \n\t\t \n\t\t\t G Bellastella \n\t\t \n\t\t \n\t\t\t L Scappaticcio \n\t\t \n\t\t \n\t\t\t M Longo \n\t\t \n\t\t \n\t\t\t D Giugliano \n\t\t \n\t\t \n\t\t\t K Esposito \n\t\t \n\t\t 10.2337/dc19-1459 \n\t \n\t \n\t\t Diabetes Care \n\t\t \n\t\t\t 43 \n\t\t\t \n\t\t\t 2020 \n\t\t \n\t \n\t Maiorino, M.I.; Signoriello, S.; Maio, A.; Chiodini, P.; Bellastella, G.; Scappaticcio, L.; Longo, M.; Giugliano, D.; Esposito, K. Effects of Continuous Glucose Monitoring on Metrics of Glycemic Control in Diabetes: A Systematic Review With Meta-analysis of Randomized Controlled Trials. Diabetes Care 2020, 43, 1146-1156. [CrossRef]"
    },
    {
      "title": "An. updated algorithm for an effective choice of continuous glucose monitoring for people with insulin-treated diabetes",
      "authors": [
        "M Maiorino",
        "R Buzzetti",
        "C Irace",
        "L Laviola",
        "N Napoli",
        "D Pitocco",
        "K Esposito"
      ],
      "year": 2023,
      "doi": "10.1007/s12020-023-03473-w",
      "journal": "Endocrine",
      "volume": "82",
      "raw": "An. updated algorithm for an effective choice of continuous glucose monitoring for people with insulin-treated diabetes \n\t\t \n\t\t\t M I Maiorino \n\t\t \n\t\t \n\t\t\t R Buzzetti \n\t\t \n\t\t \n\t\t\t C Irace \n\t\t \n\t\t \n\t\t\t L Laviola \n\t\t \n\t\t \n\t\t\t N Napoli \n\t\t \n\t\t \n\t\t\t D Pitocco \n\t\t \n\t\t \n\t\t\t K Esposito \n\t\t \n\t\t \n\t\t\t Cgm \n\t\t \n\t\t \n\t\t\t Group \n\t\t \n\t\t 10.1007/s12020-023-03473-w \n\t \n\t \n\t\t Endocrine \n\t\t \n\t\t\t 82 \n\t\t\t \n\t\t\t 2023 \n\t\t \n\t \n\t Maiorino, M.I.; Buzzetti, R.; Irace, C.; Laviola, L.; Napoli, N.; Pitocco, D.; Esposito, K. LIVE CGM working group. An. updated algorithm for an effective choice of continuous glucose monitoring for people with insulin-treated diabetes. Endocrine 2023, 82, 215-225. [CrossRef]"
    },
    {
      "title": "Increased Time in Range and Fewer Missed Bolus Injections After Introduction of a Smart Connected Insulin Pen",
      "authors": [
        "P Adolfsson",
        "N Hartvig",
        "A Kaas",
        "J M\u00f8ller",
        "J Hellman"
      ],
      "year": 2020,
      "doi": "10.1089/dia.2019.0411",
      "journal": "Diabetes Technol. Ther",
      "volume": "22",
      "raw": "Increased Time in Range and Fewer Missed Bolus Injections After Introduction of a Smart Connected Insulin Pen \n\t\t \n\t\t\t P Adolfsson \n\t\t \n\t\t \n\t\t\t N V Hartvig \n\t\t \n\t\t \n\t\t\t A Kaas \n\t\t \n\t\t \n\t\t\t J B M\u00f8ller \n\t\t \n\t\t \n\t\t\t J Hellman \n\t\t \n\t\t 10.1089/dia.2019.0411 \n\t \n\t \n\t\t Diabetes Technol. Ther \n\t\t \n\t\t\t 22 \n\t\t\t \n\t\t\t 2020 \n\t\t \n\t \n\t Adolfsson, P.; Hartvig, N.V.; Kaas, A.; M\u00f8ller, J.B.; Hellman, J. Increased Time in Range and Fewer Missed Bolus Injections After Introduction of a Smart Connected Insulin Pen. Diabetes Technol. Ther. 2020, 22, 709-718. [CrossRef]"
    },
    {
      "title": "Use of Connected Pen as a Diagnostic Tool to Evaluate Missed Bolus Dosing Behavior in People with Type 1 and Type 2 Diabetes",
      "authors": [
        "S Edwards",
        "X He",
        "W Wang",
        "J Poon",
        "E Meadows",
        "D Price",
        "J Johnson",
        "H Wolpert",
        "W Polonsky"
      ],
      "year": 2022,
      "doi": "10.1089/dia.2021.0239",
      "journal": "Diabetes Technol. Ther",
      "volume": "24",
      "raw": "Use of Connected Pen as a Diagnostic Tool to Evaluate Missed Bolus Dosing Behavior in People with Type 1 and Type 2 Diabetes \n\t\t \n\t\t\t S Edwards \n\t\t \n\t\t \n\t\t\t X He \n\t\t \n\t\t \n\t\t\t W Wang \n\t\t \n\t\t \n\t\t\t J L Poon \n\t\t \n\t\t \n\t\t\t E Meadows \n\t\t \n\t\t \n\t\t\t D Price \n\t\t \n\t\t \n\t\t\t J Johnson \n\t\t \n\t\t \n\t\t\t H Wolpert \n\t\t \n\t\t \n\t\t\t W Polonsky \n\t\t \n\t\t 10.1089/dia.2021.0239 \n\t \n\t \n\t\t Diabetes Technol. Ther \n\t\t \n\t\t\t 24 \n\t\t\t \n\t\t\t 2022 \n\t\t \n\t \n\t Edwards, S.; He, X.; Wang, W.; Poon, J.L.; Meadows, E.; Price, D.; Johnson, J.; Wolpert, H.; Polonsky, W. Use of Connected Pen as a Diagnostic Tool to Evaluate Missed Bolus Dosing Behavior in People with Type 1 and Type 2 Diabetes. Diabetes Technol. Ther. 2022, 24, 61-66. [CrossRef]"
    },
    {
      "title": "Smart Insulin Pens are Associated with Improved Clinical Outcomes at Lower Cost Versus Standard-of-Care Treatment of Type 1 Diabetes in Sweden: A Cost-Effectiveness Analysis",
      "authors": [
        "J Jendle",
        "\u00c5 Ericsson",
        "J Gundgaard",
        "J M\u00f8ller",
        "W Valentine",
        "B Hunt"
      ],
      "year": 2021,
      "doi": "10.1007/s13300-020-00980-1",
      "journal": "Diabetes Ther",
      "volume": "12",
      "raw": "Smart Insulin Pens are Associated with Improved Clinical Outcomes at Lower Cost Versus Standard-of-Care Treatment of Type 1 Diabetes in Sweden: A Cost-Effectiveness Analysis \n\t\t \n\t\t\t J Jendle \n\t\t \n\t\t \n\t\t\t \u00c5 Ericsson \n\t\t \n\t\t \n\t\t\t J Gundgaard \n\t\t \n\t\t \n\t\t\t J B M\u00f8ller \n\t\t \n\t\t \n\t\t\t W J Valentine \n\t\t \n\t\t \n\t\t\t B Hunt \n\t\t \n\t\t 10.1007/s13300-020-00980-1 \n\t \n\t \n\t\t Diabetes Ther \n\t\t \n\t\t\t 12 \n\t\t\t \n\t\t\t 2021 \n\t\t \n\t \n\t Jendle, J.; Ericsson, \u00c5.; Gundgaard, J.; M\u00f8ller, J.B.; Valentine, W.J.; Hunt, B. Smart Insulin Pens are Associated with Improved Clinical Outcomes at Lower Cost Versus Standard-of-Care Treatment of Type 1 Diabetes in Sweden: A Cost-Effectiveness Analysis. Diabetes Ther. 2021, 12, 373-388. [CrossRef] [PubMed]"
    },
    {
      "title": "Potential cost savings in the United States from a reduction in sensor-detected severe hypoglycemia among users of the InPen smart insulin pen system",
      "authors": [
        "A Chien",
        "S Thanasekaran",
        "A Gaetano",
        "G Im",
        "K Wherry",
        "J Macleod",
        "R Vigersky"
      ],
      "year": 2023,
      "doi": "10.18553/jmcp.2023.22283",
      "journal": "J. Manag. Care Spec. Pharm",
      "volume": "29",
      "raw": "Potential cost savings in the United States from a reduction in sensor-detected severe hypoglycemia among users of the InPen smart insulin pen system \n\t\t \n\t\t\t A Chien \n\t\t \n\t\t \n\t\t\t S Thanasekaran \n\t\t \n\t\t \n\t\t\t A Gaetano \n\t\t \n\t\t \n\t\t\t G Im \n\t\t \n\t\t \n\t\t\t K Wherry \n\t\t \n\t\t \n\t\t\t J Macleod \n\t\t \n\t\t \n\t\t\t R A Vigersky \n\t\t \n\t\t 10.18553/jmcp.2023.22283 \n\t \n\t \n\t\t J. Manag. Care Spec. Pharm \n\t\t \n\t\t\t 29 \n\t\t\t \n\t\t\t 2023 \n\t\t \n\t \n\t Chien, A.; Thanasekaran, S.; Gaetano, A.; Im, G.; Wherry, K.; MacLeod, J.; Vigersky, R.A. Potential cost savings in the United States from a reduction in sensor-detected severe hypoglycemia among users of the InPen smart insulin pen system. J. Manag. Care Spec. Pharm. 2023, 29, 285-292. [CrossRef] [PubMed]"
    },
    {
      "title": "Threshold-based insulin-pump interruption for reduction of hypoglycemia",
      "authors": [
        "R Bergenstal",
        "D Klonoff",
        "S Garg",
        "B Bode",
        "M Meredith",
        "R Slover",
        "A Ahmann",
        "J Welsh",
        "S Lee",
        "F Kaufman",
        "Study Aspire In-Home"
      ],
      "year": 2013,
      "doi": "10.1056/NEJMoa1303576",
      "journal": "N. Engl. J. Med",
      "volume": "369",
      "raw": "Threshold-based insulin-pump interruption for reduction of hypoglycemia \n\t\t \n\t\t\t R M Bergenstal \n\t\t \n\t\t \n\t\t\t D C Klonoff \n\t\t \n\t\t \n\t\t\t S K Garg \n\t\t \n\t\t \n\t\t\t B W Bode \n\t\t \n\t\t \n\t\t\t M Meredith \n\t\t \n\t\t \n\t\t\t R H Slover \n\t\t \n\t\t \n\t\t\t A J Ahmann \n\t\t \n\t\t \n\t\t\t J B Welsh \n\t\t \n\t\t \n\t\t\t S W Lee \n\t\t \n\t\t \n\t\t\t F R Kaufman \n\t\t \n\t\t \n\t\t\t Study Aspire In-Home \n\t\t \n\t\t \n\t\t\t Group \n\t\t \n\t\t 10.1056/NEJMoa1303576 \n\t \n\t \n\t\t N. Engl. J. Med \n\t\t \n\t\t\t 369 \n\t\t\t \n\t\t\t 2013 \n\t\t \n\t \n\t Bergenstal, R.M.; Klonoff, D.C.; Garg, S.K.; Bode, B.W.; Meredith, M.; Slover, R.H.; Ahmann, A.J.; Welsh, J.B.; Lee, S.W.; Kaufman, F.R. ASPIRE In-Home Study Group. Threshold-based insulin-pump interruption for reduction of hypoglycemia. N. Engl. J. Med. 2013, 369, 224-232. [CrossRef]"
    },
    {
      "title": "Predictive Low-Glucose Suspend Reduces Hypoglycemia in Adults, Adolescents, and Children with Type 1 Diabetes in an At-Home Randomized Crossover Study: Results of the PROLOG Trial",
      "authors": [
        "G Forlenza",
        "Z Li",
        "B Buckingham",
        "J Pinsker",
        "E Cengiz",
        "R Wadwa",
        "L Ekhlaspour",
        "M Church",
        "S Weinzimer",
        "E Jost"
      ],
      "year": 2018,
      "doi": "10.2337/dc18-0771",
      "journal": "Diabetes Care",
      "volume": "41",
      "raw": "Predictive Low-Glucose Suspend Reduces Hypoglycemia in Adults, Adolescents, and Children with Type 1 Diabetes in an At-Home Randomized Crossover Study: Results of the PROLOG Trial \n\t\t \n\t\t\t G P Forlenza \n\t\t \n\t\t \n\t\t\t Z Li \n\t\t \n\t\t \n\t\t\t B A Buckingham \n\t\t \n\t\t \n\t\t\t J E Pinsker \n\t\t \n\t\t \n\t\t\t E Cengiz \n\t\t \n\t\t \n\t\t\t R P Wadwa \n\t\t \n\t\t \n\t\t\t L Ekhlaspour \n\t\t \n\t\t \n\t\t\t M M Church \n\t\t \n\t\t \n\t\t\t S A Weinzimer \n\t\t \n\t\t \n\t\t\t E Jost \n\t\t \n\t\t 10.2337/dc18-0771 \n\t \n\t \n\t\t Diabetes Care \n\t\t \n\t\t\t 41 \n\t\t\t \n\t\t\t 2018 \n\t\t \n\t \n\t Forlenza, G.P.; Li, Z.; Buckingham, B.A.; Pinsker, J.E.; Cengiz, E.; Wadwa, R.P.; Ekhlaspour, L.; Church, M.M.; Weinzimer, S.A.; Jost, E.; et al. Predictive Low-Glucose Suspend Reduces Hypoglycemia in Adults, Adolescents, and Children with Type 1 Diabetes in an At-Home Randomized Crossover Study: Results of the PROLOG Trial. Diabetes Care 2018, 41, 2155-2161. [CrossRef]"
    },
    {
      "title": "Safety of a Hybrid Closed-Loop Insulin Delivery System in Patients with Type 1 Diabetes",
      "authors": [
        "R Bergenstal",
        "S Garg",
        "S Weinzimer",
        "B Buckingham",
        "B Bode",
        "W Tamborlane",
        "F Kaufman"
      ],
      "year": 2016,
      "doi": "10.1001/jama.2016.11708",
      "journal": "JAMA",
      "volume": "316",
      "raw": "Safety of a Hybrid Closed-Loop Insulin Delivery System in Patients with Type 1 Diabetes \n\t\t \n\t\t\t R M Bergenstal \n\t\t \n\t\t \n\t\t\t S Garg \n\t\t \n\t\t \n\t\t\t S A Weinzimer \n\t\t \n\t\t \n\t\t\t B A Buckingham \n\t\t \n\t\t \n\t\t\t B W Bode \n\t\t \n\t\t \n\t\t\t W V Tamborlane \n\t\t \n\t\t \n\t\t\t F R Kaufman \n\t\t \n\t\t 10.1001/jama.2016.11708 \n\t \n\t \n\t\t JAMA \n\t\t \n\t\t\t 316 \n\t\t\t \n\t\t\t 2016 \n\t\t \n\t \n\t Bergenstal, R.M.; Garg, S.; Weinzimer, S.A.; Buckingham, B.A.; Bode, B.W.; Tamborlane, W.V.; Kaufman, F.R. Safety of a Hybrid Closed-Loop Insulin Delivery System in Patients with Type 1 Diabetes. JAMA 2016, 316, 1407-1408."
    },
    {
      "doi": "10.1001/jama.2016.11708",
      "raw": "10.1001/jama.2016.11708 \n\t\t \n\t \n\t CrossRef"
    },
    {
      "title": "APCam11 Consortium. Closed-loop insulin delivery in suboptimally controlled type 1 diabetes: A multicentre, 12-week randomised trial",
      "authors": [
        "M Tauschmann",
        "H Thabit",
        "L Bally",
        "J Allen",
        "S Hartnell",
        "M Wilinska",
        "Y Ruan",
        "J Sibayan",
        "C Kollman",
        "P Cheng"
      ],
      "year": 2018,
      "doi": "10.1016/s0140-6736(18)31947-0",
      "journal": "Lancet",
      "volume": "392",
      "raw": "APCam11 Consortium. Closed-loop insulin delivery in suboptimally controlled type 1 diabetes: A multicentre, 12-week randomised trial \n\t\t \n\t\t\t M Tauschmann \n\t\t \n\t\t \n\t\t\t H Thabit \n\t\t \n\t\t \n\t\t\t L Bally \n\t\t \n\t\t \n\t\t\t J M Allen \n\t\t \n\t\t \n\t\t\t S Hartnell \n\t\t \n\t\t \n\t\t\t M E Wilinska \n\t\t \n\t\t \n\t\t\t Y Ruan \n\t\t \n\t\t \n\t\t\t J Sibayan \n\t\t \n\t\t \n\t\t\t C Kollman \n\t\t \n\t\t \n\t\t\t P Cheng \n\t\t \n\t\t 10.1016/s0140-6736(18)31947-0 \n\t \n\t \n\t\t Lancet \n\t\t \n\t\t\t 392 \n\t\t\t \n\t\t\t 2018 \n\t\t \n\t \n\t Tauschmann, M.; Thabit, H.; Bally, L.; Allen, J.M.; Hartnell, S.; Wilinska, M.E.; Ruan, Y.; Sibayan, J.; Kollman, C.; Cheng, P.; et al. APCam11 Consortium. Closed-loop insulin delivery in suboptimally controlled type 1 diabetes: A multicentre, 12-week randomised trial. Lancet 2018, 392, 1321-1329. [CrossRef]"
    },
    {
      "title": "A Randomized Trial of Closed-Loop Control in Children with Type 1 Diabetes",
      "authors": [
        "M Breton",
        "L Kanapka",
        "R Beck",
        "L Ekhlaspour",
        "G Forlenza",
        "E Cengiz",
        "M Schoelwer",
        "K Ruedy",
        "E Jost",
        "L Carria"
      ],
      "year": 2020,
      "doi": "10.1056/nejmoa2004736",
      "journal": "N. Engl. J. Med",
      "volume": "383",
      "raw": "A Randomized Trial of Closed-Loop Control in Children with Type 1 Diabetes \n\t\t \n\t\t\t M D Breton \n\t\t \n\t\t \n\t\t\t L G Kanapka \n\t\t \n\t\t \n\t\t\t R W Beck \n\t\t \n\t\t \n\t\t\t L Ekhlaspour \n\t\t \n\t\t \n\t\t\t G P Forlenza \n\t\t \n\t\t \n\t\t\t E Cengiz \n\t\t \n\t\t \n\t\t\t M Schoelwer \n\t\t \n\t\t \n\t\t\t K J Ruedy \n\t\t \n\t\t \n\t\t\t E Jost \n\t\t \n\t\t \n\t\t\t L Carria \n\t\t \n\t\t 10.1056/nejmoa2004736 \n\t \n\t \n\t\t N. Engl. J. Med \n\t\t \n\t\t\t 383 \n\t\t\t \n\t\t\t 2020 \n\t\t \n\t \n\t Breton, M.D.; Kanapka, L.G.; Beck, R.W.; Ekhlaspour, L.; Forlenza, G.P.; Cengiz, E.; Schoelwer, M.; Ruedy, K.J.; Jost, E.; Carria, L.; et al. A Randomized Trial of Closed-Loop Control in Children with Type 1 Diabetes. N. Engl. J. Med. 2020, 383, 836-845. [CrossRef]"
    },
    {
      "title": "Randomized Trial of Closed-Loop Control in Very Young Children with Type 1 Diabetes",
      "authors": [
        "J Ware",
        "J Allen",
        "C Boughton",
        "M Wilinska",
        "S Hartnell",
        "A Thankamony",
        "C De Beaufort",
        "U Schierloh",
        "E Fr\u00f6hlich-Reiterer",
        "J Mader"
      ],
      "year": 2022,
      "doi": "10.1056/nejmoa2111673",
      "journal": "N. Engl. J. Med",
      "volume": "386",
      "raw": "Randomized Trial of Closed-Loop Control in Very Young Children with Type 1 Diabetes \n\t\t \n\t\t\t J Ware \n\t\t \n\t\t \n\t\t\t J M Allen \n\t\t \n\t\t \n\t\t\t C K Boughton \n\t\t \n\t\t \n\t\t\t M E Wilinska \n\t\t \n\t\t \n\t\t\t S Hartnell \n\t\t \n\t\t \n\t\t\t A Thankamony \n\t\t \n\t\t \n\t\t\t C De Beaufort \n\t\t \n\t\t \n\t\t\t U Schierloh \n\t\t \n\t\t \n\t\t\t E Fr\u00f6hlich-Reiterer \n\t\t \n\t\t \n\t\t\t J K Mader \n\t\t \n\t\t 10.1056/nejmoa2111673 \n\t \n\t \n\t\t N. Engl. J. Med \n\t\t \n\t\t\t 386 \n\t\t\t \n\t\t\t 2022 \n\t\t \n\t \n\t Ware, J.; Allen, J.M.; Boughton, C.K.; Wilinska, M.E.; Hartnell, S.; Thankamony, A.; de Beaufort, C.; Schierloh, U.; Fr\u00f6hlich-Reiterer, E.; Mader, J.K.; et al. Randomized Trial of Closed-Loop Control in Very Young Children with Type 1 Diabetes. N. Engl. J. Med. 2022, 386, 209-219. [CrossRef] [PubMed]"
    },
    {
      "title": "Effect of artificial pancreas systems on glycaemic control in patients with type 1 diabetes: A systematic review and meta-analysis of outpatient randomised controlled trials",
      "authors": [
        "A Weisman",
        "J Bai",
        "M Cardinez",
        "C Kramer",
        "B Perkins"
      ],
      "year": 2017,
      "doi": "10.1016/s2213-8587(17)30167-5",
      "journal": "Lancet Diabetes Endocrinol",
      "volume": "5",
      "raw": "Effect of artificial pancreas systems on glycaemic control in patients with type 1 diabetes: A systematic review and meta-analysis of outpatient randomised controlled trials \n\t\t \n\t\t\t A Weisman \n\t\t \n\t\t \n\t\t\t J W Bai \n\t\t \n\t\t \n\t\t\t M Cardinez \n\t\t \n\t\t \n\t\t\t C K Kramer \n\t\t \n\t\t \n\t\t\t B A Perkins \n\t\t \n\t\t 10.1016/s2213-8587(17)30167-5 \n\t \n\t \n\t\t Lancet Diabetes Endocrinol \n\t\t \n\t\t\t 5 \n\t\t\t \n\t\t\t 2017 \n\t\t \n\t \n\t Weisman, A.; Bai, J.W.; Cardinez, M.; Kramer, C.K.; Perkins, B.A. Effect of artificial pancreas systems on glycaemic control in patients with type 1 diabetes: A systematic review and meta-analysis of outpatient randomised controlled trials. Lancet Diabetes Endocrinol. 2017, 5, 501-512. [CrossRef]"
    },
    {
      "title": "Artificial pancreas treatment for outpatients with type 1 diabetes: Systematic review and meta-analysis",
      "authors": [
        "E Bekiari",
        "K Kitsios",
        "H Thabit",
        "M Tauschmann",
        "E Athanasiadou",
        "T Karagiannis",
        "A Haidich",
        "R Hovorka",
        "A Tsapas"
      ],
      "year": 2018,
      "doi": "10.1136/bmj.k1310",
      "journal": "BMJ",
      "volume": "361",
      "pages": "1310",
      "raw": "Artificial pancreas treatment for outpatients with type 1 diabetes: Systematic review and meta-analysis \n\t\t \n\t\t\t E Bekiari \n\t\t \n\t\t \n\t\t\t K Kitsios \n\t\t \n\t\t \n\t\t\t H Thabit \n\t\t \n\t\t \n\t\t\t M Tauschmann \n\t\t \n\t\t \n\t\t\t E Athanasiadou \n\t\t \n\t\t \n\t\t\t T Karagiannis \n\t\t \n\t\t \n\t\t\t A B Haidich \n\t\t \n\t\t \n\t\t\t R Hovorka \n\t\t \n\t\t \n\t\t\t A Tsapas \n\t\t \n\t\t 10.1136/bmj.k1310 \n\t \n\t \n\t\t BMJ \n\t\t \n\t\t\t 361 \n\t\t\t 1310 \n\t\t\t 2018 \n\t\t \n\t \n\t Bekiari, E.; Kitsios, K.; Thabit, H.; Tauschmann, M.; Athanasiadou, E.; Karagiannis, T.; Haidich, A.B.; Hovorka, R.; Tsapas, A. Artificial pancreas treatment for outpatients with type 1 diabetes: Systematic review and meta-analysis. BMJ 2018, 361, k1310. [CrossRef]"
    },
    {
      "title": "Automated insulin delivery: Benefits, challenges, and recommendations. A Consensus Report of the Joint Diabetes Technology Working Group of the European Association for the Study of Diabetes and the American Diabetes Association",
      "authors": [
        "J Sherr",
        "L Heinemann",
        "G Fleming",
        "R Bergenstal",
        "D Bruttomesso",
        "H Hanaire",
        "R Holl",
        "J Petrie",
        "A Peters",
        "M Evans"
      ],
      "year": 2023,
      "doi": "10.1007/s00125-022-05744-z",
      "journal": "Diabetologia",
      "volume": "66",
      "raw": "Automated insulin delivery: Benefits, challenges, and recommendations. A Consensus Report of the Joint Diabetes Technology Working Group of the European Association for the Study of Diabetes and the American Diabetes Association \n\t\t \n\t\t\t J L Sherr \n\t\t \n\t\t \n\t\t\t L Heinemann \n\t\t \n\t\t \n\t\t\t G A Fleming \n\t\t \n\t\t \n\t\t\t R M Bergenstal \n\t\t \n\t\t \n\t\t\t D Bruttomesso \n\t\t \n\t\t \n\t\t\t H Hanaire \n\t\t \n\t\t \n\t\t\t R W Holl \n\t\t \n\t\t \n\t\t\t J R Petrie \n\t\t \n\t\t \n\t\t\t A L Peters \n\t\t \n\t\t \n\t\t\t M Evans \n\t\t \n\t\t 10.1007/s00125-022-05744-z \n\t \n\t \n\t\t Diabetologia \n\t\t \n\t\t\t 66 \n\t\t\t \n\t\t\t 2023 \n\t\t \n\t \n\t Sherr, J.L.; Heinemann, L.; Fleming, G.A.; Bergenstal, R.M.; Bruttomesso, D.; Hanaire, H.; Holl, R.W.; Petrie, J.R.; Peters, A.L.; Evans, M. Automated insulin delivery: Benefits, challenges, and recommendations. A Consensus Report of the Joint Diabetes Technology Working Group of the European Association for the Study of Diabetes and the American Diabetes Association. Diabetologia 2023, 66, 3-22. [CrossRef] [PubMed]"
    },
    {
      "title": "Adjust to target in type 2 diabetes: Comparison of a simple algorithm with carbohydrate counting for adjustment of mealtime insulin glulisine",
      "authors": [
        "R Bergenstal",
        "M Johnson",
        "M Powers",
        "A Wynne",
        "A Vlajnic",
        "P Hollander",
        "M Rendell"
      ],
      "year": 2008,
      "doi": "10.2337/dc07-2137",
      "journal": "Diabetes Care",
      "volume": "31",
      "raw": "Adjust to target in type 2 diabetes: Comparison of a simple algorithm with carbohydrate counting for adjustment of mealtime insulin glulisine \n\t\t \n\t\t\t R M Bergenstal \n\t\t \n\t\t \n\t\t\t M Johnson \n\t\t \n\t\t \n\t\t\t M A Powers \n\t\t \n\t\t \n\t\t\t A Wynne \n\t\t \n\t\t \n\t\t\t A Vlajnic \n\t\t \n\t\t \n\t\t\t P Hollander \n\t\t \n\t\t \n\t\t\t M Rendell \n\t\t \n\t\t 10.2337/dc07-2137 \n\t \n\t \n\t\t Diabetes Care \n\t\t \n\t\t\t 31 \n\t\t\t \n\t\t\t 2008 \n\t\t \n\t \n\t Bergenstal, R.M.; Johnson, M.; Powers, M.A.; Wynne, A.; Vlajnic, A.; Hollander, P.; Rendell, M. Adjust to target in type 2 diabetes: Comparison of a simple algorithm with carbohydrate counting for adjustment of mealtime insulin glulisine. Diabetes Care 2008, 31, 1305-1310. [CrossRef]"
    },
    {
      "title": "Behavior change techniques in top-ranked mobile apps for physical activity",
      "authors": [
        "D Conroy",
        "C Yang",
        "J Maher"
      ],
      "year": 2014,
      "doi": "10.1016/j.amepre.2014.01.010",
      "journal": "Am. J. Prev. Med",
      "volume": "46",
      "raw": "Behavior change techniques in top-ranked mobile apps for physical activity \n\t\t \n\t\t\t D E Conroy \n\t\t \n\t\t \n\t\t\t C H Yang \n\t\t \n\t\t \n\t\t\t J P Maher \n\t\t \n\t\t 10.1016/j.amepre.2014.01.010 \n\t \n\t \n\t\t Am. J. Prev. Med \n\t\t \n\t\t\t 46 \n\t\t\t \n\t\t\t 2014 \n\t\t \n\t \n\t Conroy, D.E.; Yang, C.H.; Maher, J.P. Behavior change techniques in top-ranked mobile apps for physical activity. Am. J. Prev. Med. 2014, 46, 649-652. [CrossRef]"
    },
    {
      "title": "A Mobile App for the Self-Management of Type 1 Diabetes Among Adolescents: A Randomized Controlled Trial",
      "authors": [
        "S Goyal",
        "C Nunn",
        "M Rotondi",
        "A Couperthwaite",
        "S Reiser",
        "A Simone",
        "D Katzman",
        "J Cafazzo",
        "M Palmert"
      ],
      "year": 2017,
      "doi": "10.2196/mhealth.7336",
      "journal": "JMIR Mhealth Uhealth",
      "volume": "5",
      "raw": "A Mobile App for the Self-Management of Type 1 Diabetes Among Adolescents: A Randomized Controlled Trial \n\t\t \n\t\t\t S Goyal \n\t\t \n\t\t \n\t\t\t C A Nunn \n\t\t \n\t\t \n\t\t\t M Rotondi \n\t\t \n\t\t \n\t\t\t A B Couperthwaite \n\t\t \n\t\t \n\t\t\t S Reiser \n\t\t \n\t\t \n\t\t\t A Simone \n\t\t \n\t\t \n\t\t\t D K Katzman \n\t\t \n\t\t \n\t\t\t J A Cafazzo \n\t\t \n\t\t \n\t\t\t M R Palmert \n\t\t \n\t\t 10.2196/mhealth.7336 \n\t \n\t \n\t\t JMIR Mhealth Uhealth \n\t\t \n\t\t\t 5 \n\t\t\t 2017 \n\t\t \n\t \n\t Goyal, S.; Nunn, C.A.; Rotondi, M.; Couperthwaite, A.B.; Reiser, S.; Simone, A.; Katzman, D.K.; Cafazzo, J.A.; Palmert, M.R. A Mobile App for the Self-Management of Type 1 Diabetes Among Adolescents: A Randomized Controlled Trial. JMIR Mhealth Uhealth 2017, 5, e82. [CrossRef] [PubMed]"
    },
    {
      "title": "Feasibility and Impact of Remote Glucose Monitoring Among Patients With Newly Diagnosed Type 1 Diabetes: Single-Center Pilot Study",
      "authors": [
        "S Crossen",
        "C Romero",
        "A Reggiardo",
        "J Michel",
        "N Glaser"
      ],
      "year": 2022,
      "doi": "10.2196/33639",
      "journal": "JMIR Diabetes",
      "volume": "7",
      "pages": "33639",
      "raw": "Feasibility and Impact of Remote Glucose Monitoring Among Patients With Newly Diagnosed Type 1 Diabetes: Single-Center Pilot Study \n\t\t \n\t\t\t S Crossen \n\t\t \n\t\t \n\t\t\t C Romero \n\t\t \n\t\t \n\t\t\t A Reggiardo \n\t\t \n\t\t \n\t\t\t J Michel \n\t\t \n\t\t \n\t\t\t N Glaser \n\t\t \n\t\t 10.2196/33639 \n\t \n\t \n\t\t JMIR Diabetes \n\t\t \n\t\t\t 7 \n\t\t\t 33639 \n\t\t\t 2022 \n\t\t \n\t \n\t Crossen, S.; Romero, C.; Reggiardo, A.; Michel, J.; Glaser, N. Feasibility and Impact of Remote Glucose Monitoring Among Patients With Newly Diagnosed Type 1 Diabetes: Single-Center Pilot Study. JMIR Diabetes 2022, 7, e33639. [CrossRef]"
    },
    {
      "title": "Diabetes App-Related Text Messages From Health Care Professionals in Conjunction With a New Wireless Glucose Meter With a Color Range Indicator Improves Glycemic Control in Patients With Type 1 and Type 2 Diabetes: Randomized Controlled Trial",
      "authors": [
        "M Grady",
        "L Katz",
        "H Cameron",
        "B Levy"
      ],
      "year": 2017,
      "doi": "10.2196/diabetes.7454",
      "journal": "JMIR Diabetes",
      "volume": "2",
      "raw": "Diabetes App-Related Text Messages From Health Care Professionals in Conjunction With a New Wireless Glucose Meter With a Color Range Indicator Improves Glycemic Control in Patients With Type 1 and Type 2 Diabetes: Randomized Controlled Trial \n\t\t \n\t\t\t M Grady \n\t\t \n\t\t \n\t\t\t L B Katz \n\t\t \n\t\t \n\t\t\t H Cameron \n\t\t \n\t\t \n\t\t\t B L Levy \n\t\t \n\t\t 10.2196/diabetes.7454 \n\t \n\t \n\t\t JMIR Diabetes \n\t\t \n\t\t\t 2 \n\t\t\t 2017 \n\t\t \n\t \n\t Grady, M.; Katz, L.B.; Cameron, H.; Levy, B.L. Diabetes App-Related Text Messages From Health Care Professionals in Conjunction With a New Wireless Glucose Meter With a Color Range Indicator Improves Glycemic Control in Patients With Type 1 and Type 2 Diabetes: Randomized Controlled Trial. JMIR Diabetes 2017, 2, e19. [CrossRef]"
    },
    {
      "title": "Mobile phone applications and self-management of diabetes: A systematic review with meta-analysis, meta-regression of 21 randomized trials and GRADE",
      "authors": [
        "C Hou",
        "Q Xu",
        "S Diao",
        "J Hewitt",
        "J Li",
        "B Carter"
      ],
      "year": 2018,
      "doi": "10.1111/dom.13307",
      "journal": "Diabetes Obes. Metab",
      "volume": "20",
      "raw": "Mobile phone applications and self-management of diabetes: A systematic review with meta-analysis, meta-regression of 21 randomized trials and GRADE \n\t\t \n\t\t\t C Hou \n\t\t \n\t\t \n\t\t\t Q Xu \n\t\t \n\t\t \n\t\t\t S Diao \n\t\t \n\t\t \n\t\t\t J Hewitt \n\t\t \n\t\t \n\t\t\t J Li \n\t\t \n\t\t \n\t\t\t B Carter \n\t\t \n\t\t 10.1111/dom.13307 \n\t \n\t \n\t\t Diabetes Obes. Metab \n\t\t \n\t\t\t 20 \n\t\t\t \n\t\t\t 2018 \n\t\t \n\t \n\t Hou, C.; Xu, Q.; Diao, S.; Hewitt, J.; Li, J.; Carter, B. Mobile phone applications and self-management of diabetes: A systematic review with meta-analysis, meta-regression of 21 randomized trials and GRADE. Diabetes Obes. Metab. 2018, 20, 2009-2013. [CrossRef]"
    },
    {
      "title": "Effect of a Smartphone App on Weight Change and Metabolic Outcomes in Asian Adults with Type 2 Diabetes: A Randomized Clinical Trial",
      "authors": [
        "S Lim",
        "K Ong",
        "J Johal",
        "C Han",
        "Q Yap",
        "Y Chan",
        "Y Chooi",
        "Z Zhang",
        "C Chandra",
        "A Thiagarajah"
      ],
      "year": 2021,
      "doi": "10.1001/jamanetworkopen.2021.12417",
      "journal": "JAMA Netw Open",
      "volume": "4",
      "pages": "2112417",
      "raw": "Effect of a Smartphone App on Weight Change and Metabolic Outcomes in Asian Adults with Type 2 Diabetes: A Randomized Clinical Trial \n\t\t \n\t\t\t S L Lim \n\t\t \n\t\t \n\t\t\t K W Ong \n\t\t \n\t\t \n\t\t\t J Johal \n\t\t \n\t\t \n\t\t\t C Y Han \n\t\t \n\t\t \n\t\t\t Q V Yap \n\t\t \n\t\t \n\t\t\t Y H Chan \n\t\t \n\t\t \n\t\t\t Y C Chooi \n\t\t \n\t\t \n\t\t\t Z P Zhang \n\t\t \n\t\t \n\t\t\t C C Chandra \n\t\t \n\t\t \n\t\t\t A G Thiagarajah \n\t\t \n\t\t 10.1001/jamanetworkopen.2021.12417 \n\t \n\t \n\t\t JAMA Netw Open \n\t\t \n\t\t\t 4 \n\t\t\t 2112417 \n\t\t\t 2021 \n\t\t \n\t \n\t Lim, S.L.; Ong, K.W.; Johal, J.; Han, C.Y.; Yap, Q.V.; Chan, Y.H.; Chooi, Y.C.; Zhang, Z.P.; Chandra, C.C.; Thiagarajah, A.G.; et al. Effect of a Smartphone App on Weight Change and Metabolic Outcomes in Asian Adults with Type 2 Diabetes: A Randomized Clinical Trial. JAMA Netw Open 2021, 4, e2112417. [CrossRef] [PubMed]"
    },
    {
      "title": "Efficacy of Personalized Diabetes Self-care Using an Electronic Medical Record-Integrated Mobile App in Patients with Type 2 Diabetes: 6-Month Randomized Controlled Trial",
      "authors": [
        "E Lee",
        "S Cha",
        "J Yun",
        "S Lim",
        "J Lee",
        "Y Ahn",
        "K Yoon",
        "M Hyun",
        "S Ko"
      ],
      "year": 2022,
      "doi": "10.2196/37430",
      "journal": "J. Med. Internet Res",
      "volume": "24",
      "pages": "37430",
      "raw": "Efficacy of Personalized Diabetes Self-care Using an Electronic Medical Record-Integrated Mobile App in Patients with Type 2 Diabetes: 6-Month Randomized Controlled Trial \n\t\t \n\t\t\t E Y Lee \n\t\t \n\t\t \n\t\t\t S A Cha \n\t\t \n\t\t \n\t\t\t J S Yun \n\t\t \n\t\t \n\t\t\t S Y Lim \n\t\t \n\t\t \n\t\t\t J H Lee \n\t\t \n\t\t \n\t\t\t Y B Ahn \n\t\t \n\t\t \n\t\t\t K H Yoon \n\t\t \n\t\t \n\t\t\t M K Hyun \n\t\t \n\t\t \n\t\t\t S H Ko \n\t\t \n\t\t 10.2196/37430 \n\t \n\t \n\t\t J. Med. Internet Res \n\t\t \n\t\t\t 24 \n\t\t\t 37430 \n\t\t\t 2022 \n\t\t \n\t \n\t Lee, E.Y.; Cha, S.A.; Yun, J.S.; Lim, S.Y.; Lee, J.H.; Ahn, Y.B.; Yoon, K.H.; Hyun, M.K.; Ko, S.H. Efficacy of Personalized Diabetes Self-care Using an Electronic Medical Record-Integrated Mobile App in Patients with Type 2 Diabetes: 6-Month Randomized Controlled Trial. J. Med. Internet Res. 2022, 24, e37430. [CrossRef]"
    },
    {
      "title": "Effectivness of specific mobile health applications (mHealth-apps) in gestational diabtetes mellitus: A systematic review",
      "authors": [
        "C Eberle",
        "M Loehnert",
        "S Stichling"
      ],
      "year": 2021,
      "doi": "10.1186/s12884-021-04274-7",
      "journal": "BMC Pregnancy Childbirth",
      "volume": "21",
      "pages": "808",
      "raw": "Effectivness of specific mobile health applications (mHealth-apps) in gestational diabtetes mellitus: A systematic review \n\t\t \n\t\t\t C Eberle \n\t\t \n\t\t \n\t\t\t M Loehnert \n\t\t \n\t\t \n\t\t\t S Stichling \n\t\t \n\t\t 10.1186/s12884-021-04274-7 \n\t \n\t \n\t\t BMC Pregnancy Childbirth \n\t\t \n\t\t\t 21 \n\t\t\t 808 \n\t\t\t 2021 \n\t\t \n\t \n\t Eberle, C.; Loehnert, M.; Stichling, S. Effectivness of specific mobile health applications (mHealth-apps) in gestational diabtetes mellitus: A systematic review. BMC Pregnancy Childbirth 2021, 21, 808. [CrossRef]"
    },
    {
      "title": "Do Mobile Phone Applications Improve Glycemic Control (HbA1c) in the Self-management of Diabetes? A Systematic Review, Meta-analysis, and GRADE of 14 Randomized Trials",
      "authors": [
        "C Hou",
        "B Carter",
        "J Hewitt",
        "T Francisa",
        "S Mayor"
      ],
      "year": 2016,
      "doi": "10.2337/dc16-0346",
      "journal": "Diabetes Care",
      "volume": "39",
      "raw": "Do Mobile Phone Applications Improve Glycemic Control (HbA1c) in the Self-management of Diabetes? A Systematic Review, Meta-analysis, and GRADE of 14 Randomized Trials \n\t\t \n\t\t\t C Hou \n\t\t \n\t\t \n\t\t\t B Carter \n\t\t \n\t\t \n\t\t\t J Hewitt \n\t\t \n\t\t \n\t\t\t T Francisa \n\t\t \n\t\t \n\t\t\t S Mayor \n\t\t \n\t\t 10.2337/dc16-0346 \n\t \n\t \n\t\t Diabetes Care \n\t\t \n\t\t\t 39 \n\t\t\t \n\t\t\t 2016 \n\t\t \n\t \n\t Hou, C.; Carter, B.; Hewitt, J.; Francisa, T.; Mayor, S. Do Mobile Phone Applications Improve Glycemic Control (HbA1c) in the Self-management of Diabetes? A Systematic Review, Meta-analysis, and GRADE of 14 Randomized Trials. Diabetes Care 2016, 39, 2089-2095. [CrossRef] [PubMed]"
    },
    {
      "title": "Effects of mobile apps intervention on medication adherence and type 2 diabetes mellitus control: A systematic review and meta-analysis",
      "authors": [
        "C Chong",
        "M Bakry",
        "E Hatah",
        "N Mohd Tahir",
        "N Mustafa"
      ],
      "year": 2023,
      "doi": "10.1177/1357633x231174933",
      "journal": "J. Telemed. Telecare",
      "raw": "Effects of mobile apps intervention on medication adherence and type 2 diabetes mellitus control: A systematic review and meta-analysis \n\t\t \n\t\t\t C J Chong \n\t\t \n\t\t \n\t\t\t M M Bakry \n\t\t \n\t\t \n\t\t\t E Hatah \n\t\t \n\t\t \n\t\t\t N A Mohd Tahir \n\t\t \n\t\t \n\t\t\t N Mustafa \n\t\t \n\t\t 10.1177/1357633x231174933 \n\t \n\t \n\t\t J. Telemed. Telecare \n\t\t \n\t\t\t \n\t\t\t 2023 \n\t\t \n\t \n\t Chong, C.J.; Bakry, M.M.; Hatah, E.; Mohd Tahir, N.A.; Mustafa, N. Effects of mobile apps intervention on medication adherence and type 2 diabetes mellitus control: A systematic review and meta-analysis. J. Telemed. Telecare 2023, 1357633X231174933. [CrossRef]"
    },
    {
      "title": "Diabetes Digital App Technology: Benefits, Challenges, and Recommendations. A Consensus Report by the European Association for the Study of Diabetes (EASD) and the American Diabetes Association (ADA) Diabetes Technology Working Group",
      "authors": [
        "G Fleming",
        "J Petrie",
        "R Bergenstal",
        "R Holl",
        "A Peters",
        "L Heinemann"
      ],
      "year": 2020,
      "doi": "10.2337/dci19-0062",
      "journal": "Diabetes Care",
      "volume": "43",
      "raw": "Diabetes Digital App Technology: Benefits, Challenges, and Recommendations. A Consensus Report by the European Association for the Study of Diabetes (EASD) and the American Diabetes Association (ADA) Diabetes Technology Working Group \n\t\t \n\t\t\t G A Fleming \n\t\t \n\t\t \n\t\t\t J R Petrie \n\t\t \n\t\t \n\t\t\t R M Bergenstal \n\t\t \n\t\t \n\t\t\t R W Holl \n\t\t \n\t\t \n\t\t\t A L Peters \n\t\t \n\t\t \n\t\t\t L Heinemann \n\t\t \n\t\t 10.2337/dci19-0062 \n\t \n\t \n\t\t Diabetes Care \n\t\t \n\t\t\t 43 \n\t\t\t \n\t\t\t 2020 \n\t\t \n\t \n\t Fleming, G.A.; Petrie, J.R.; Bergenstal, R.M.; Holl, R.W.; Peters, A.L.; Heinemann, L. Diabetes Digital App Technology: Benefits, Challenges, and Recommendations. A Consensus Report by the European Association for the Study of Diabetes (EASD) and the American Diabetes Association (ADA) Diabetes Technology Working Group. Diabetes Care 2020, 43, 250-260. [CrossRef]"
    },
    {
      "title": "Web-based telemedicine for management of type 2 diabetes through glucose uploads: A randomized controlled trial",
      "authors": [
        "P Zhou",
        "L Xu",
        "X Liu",
        "J Huang",
        "W Xu",
        "W Chen"
      ],
      "year": 2014,
      "journal": "Int. J. Clin. Exp. Pathol",
      "volume": "7",
      "raw": "Web-based telemedicine for management of type 2 diabetes through glucose uploads: A randomized controlled trial \n\t\t \n\t\t\t P Zhou \n\t\t \n\t\t \n\t\t\t L Xu \n\t\t \n\t\t \n\t\t\t X Liu \n\t\t \n\t\t \n\t\t\t J Huang \n\t\t \n\t\t \n\t\t\t W Xu \n\t\t \n\t\t \n\t\t\t W Chen \n\t\t \n\t \n\t \n\t\t Int. J. Clin. Exp. Pathol \n\t\t \n\t\t\t 7 \n\t\t\t \n\t\t\t 2014 \n\t\t \n\t \n\t Zhou, P.; Xu, L.; Liu, X.; Huang, J.; Xu, W.; Chen, W. Web-based telemedicine for management of type 2 diabetes through glucose uploads: A randomized controlled trial. Int. J. Clin. Exp. Pathol. 2014, 7, 8848-8854."
    },
    {
      "title": "The impact of electronic education on metabolic control indicators in patients with diabetes who need insulin: A randomised clinical control trial",
      "authors": [
        "M Moattari",
        "M Dabbaghmanesh"
      ],
      "year": 2013,
      "doi": "10.1111/j.1365-2702.2012.04200.x",
      "journal": "J. Clin. Nurs",
      "volume": "22",
      "raw": "The impact of electronic education on metabolic control indicators in patients with diabetes who need insulin: A randomised clinical control trial \n\t\t \n\t\t\t M Moattari \n\t\t \n\t\t \n\t\t\t Hashemi \n\t\t \n\t\t \n\t\t\t M H Dabbaghmanesh \n\t\t \n\t\t 10.1111/j.1365-2702.2012.04200.x \n\t \n\t \n\t\t J. Clin. Nurs \n\t\t \n\t\t\t 22 \n\t\t\t \n\t\t\t 2013 \n\t\t \n\t \n\t Moattari, M.; Hashemi, Dabbaghmanesh, M.H. The impact of electronic education on metabolic control indicators in patients with diabetes who need insulin: A randomised clinical control trial. J. Clin. Nurs. 2013, 22, 32-38. [CrossRef]"
    },
    {
      "title": "Successful Delivery of Diabetes Self-Care Education and Follow-Up through eHealth Media",
      "authors": [
        "D Pacaud",
        "H Kelley",
        "A Downey",
        "M Chiasson"
      ],
      "year": 2012,
      "doi": "10.1016/j.jcjd.2012.08.006",
      "journal": "Can. J. Diab",
      "volume": "36",
      "raw": "Successful Delivery of Diabetes Self-Care Education and Follow-Up through eHealth Media \n\t\t \n\t\t\t D Pacaud \n\t\t \n\t\t \n\t\t\t H Kelley \n\t\t \n\t\t \n\t\t\t A M Downey \n\t\t \n\t\t \n\t\t\t M Chiasson \n\t\t \n\t\t 10.1016/j.jcjd.2012.08.006 \n\t \n\t \n\t\t Can. J. Diab \n\t\t \n\t\t\t 36 \n\t\t\t \n\t\t\t 2012 \n\t\t \n\t \n\t Pacaud, D.; Kelley, H.; Downey, A.M.; Chiasson, M. Successful Delivery of Diabetes Self-Care Education and Follow-Up through eHealth Media. Can. J. Diab. 2012, 36, 257-262. [CrossRef]"
    },
    {
      "title": "Effectiveness of telemonitoring intervention on glycaemic control in patients with type 2 diabetes mellitus: A systematic review and meta-analysis",
      "authors": [
        "J Cai",
        "H Xu",
        "S Jiang",
        "J Sung",
        "R Sawhney",
        "S Broadley",
        "J Sun"
      ],
      "year": 2023,
      "doi": "10.1016/j.diabres.2023.110727",
      "journal": "Diabetes Res. Clin. Pract",
      "volume": "201",
      "pages": "110727",
      "raw": "Effectiveness of telemonitoring intervention on glycaemic control in patients with type 2 diabetes mellitus: A systematic review and meta-analysis \n\t\t \n\t\t\t J Cai \n\t\t \n\t\t \n\t\t\t H Xu \n\t\t \n\t\t \n\t\t\t S Jiang \n\t\t \n\t\t \n\t\t\t J Sung \n\t\t \n\t\t \n\t\t\t R Sawhney \n\t\t \n\t\t \n\t\t\t S Broadley \n\t\t \n\t\t \n\t\t\t J Sun \n\t\t \n\t\t 10.1016/j.diabres.2023.110727 \n\t \n\t \n\t\t Diabetes Res. Clin. Pract \n\t\t \n\t\t\t 201 \n\t\t\t 110727 \n\t\t\t 2023 \n\t\t \n\t \n\t Cai, J.; Xu, H.; Jiang, S.; Sung, J.; Sawhney, R.; Broadley, S.; Sun, J. Effectiveness of telemonitoring intervention on glycaemic control in patients with type 2 diabetes mellitus: A systematic review and meta-analysis. Diabetes Res. Clin. Pract. 2023, 201, 110727. [CrossRef] [PubMed]"
    },
    {
      "title": "A Randomized Trial on Home Telemonitoring for the Management of Metabolic and Cardiovascular Risk in Patients with Type 2 Diabetes",
      "authors": [
        "A Nicolucci",
        "S Cercone",
        "A Chiriatti",
        "F Muscas",
        "G Gensini"
      ],
      "year": 2015,
      "doi": "10.1089/dia.2014.0355",
      "journal": "Diabetes Technol. Ther",
      "volume": "17",
      "raw": "A Randomized Trial on Home Telemonitoring for the Management of Metabolic and Cardiovascular Risk in Patients with Type 2 Diabetes \n\t\t \n\t\t\t A Nicolucci \n\t\t \n\t\t \n\t\t\t S Cercone \n\t\t \n\t\t \n\t\t\t A Chiriatti \n\t\t \n\t\t \n\t\t\t F Muscas \n\t\t \n\t\t \n\t\t\t G Gensini \n\t\t \n\t\t 10.1089/dia.2014.0355 \n\t \n\t \n\t\t Diabetes Technol. Ther \n\t\t \n\t\t\t 17 \n\t\t\t \n\t\t\t 2015 \n\t\t \n\t \n\t Nicolucci, A.; Cercone, S.; Chiriatti, A.; Muscas, F.; Gensini, G. A Randomized Trial on Home Telemonitoring for the Management of Metabolic and Cardiovascular Risk in Patients with Type 2 Diabetes. Diabetes Technol. Ther. 2015, 17, 563-570. [CrossRef]"
    },
    {
      "title": "DIABEO System Combining a Mobile App Software with and Without Telemonitoring Versus Standard Care: A Randomized Controlled Trial in Diabetes Patients Poorly Controlled with a Basal-Bolus Insulin Regimen",
      "authors": [
        "S Franc",
        "H Hanaire",
        "P Benhamou",
        "P Schaepelynck",
        "B Catargi",
        "A Farret",
        "P Fontaine",
        "B Guerci",
        "Y Reznik",
        "N Jeandidier"
      ],
      "year": 2020,
      "doi": "10.1089/dia.2020.0021",
      "journal": "Diabetes Technol. Ther",
      "volume": "22",
      "raw": "DIABEO System Combining a Mobile App Software with and Without Telemonitoring Versus Standard Care: A Randomized Controlled Trial in Diabetes Patients Poorly Controlled with a Basal-Bolus Insulin Regimen \n\t\t \n\t\t\t S Franc \n\t\t \n\t\t \n\t\t\t H Hanaire \n\t\t \n\t\t \n\t\t\t P Y Benhamou \n\t\t \n\t\t \n\t\t\t P Schaepelynck \n\t\t \n\t\t \n\t\t\t B Catargi \n\t\t \n\t\t \n\t\t\t A Farret \n\t\t \n\t\t \n\t\t\t P Fontaine \n\t\t \n\t\t \n\t\t\t B Guerci \n\t\t \n\t\t \n\t\t\t Y Reznik \n\t\t \n\t\t \n\t\t\t N Jeandidier \n\t\t \n\t\t 10.1089/dia.2020.0021 \n\t \n\t \n\t\t Diabetes Technol. Ther \n\t\t \n\t\t\t 22 \n\t\t\t \n\t\t\t 2020 \n\t\t \n\t \n\t Franc, S.; Hanaire, H.; Benhamou, P.Y.; Schaepelynck, P.; Catargi, B.; Farret, A.; Fontaine, P.; Guerci, B.; Reznik, Y.; Jeandi- dier, N.; et al. DIABEO System Combining a Mobile App Software with and Without Telemonitoring Versus Standard Care: A Randomized Controlled Trial in Diabetes Patients Poorly Controlled with a Basal-Bolus Insulin Regimen. Diabetes Technol. Ther. 2020, 22, 904-911. [CrossRef]"
    },
    {
      "title": "Supported Telemonitoring and Glycemic Control in People with Type 2 Diabetes: The Telescot Diabetes Pragmatic Multicenter Randomized Controlled Trial",
      "authors": [
        "S Wild",
        "J Hanley",
        "S Lewis",
        "J Mcknight",
        "L Mccloughan",
        "P Padfield",
        "R Parker",
        "M Paterson",
        "H Pinnock",
        "A Sheikh"
      ],
      "year": 2016,
      "journal": "PLoS Med",
      "volume": "13",
      "pages": "1002098",
      "raw": "Supported Telemonitoring and Glycemic Control in People with Type 2 Diabetes: The Telescot Diabetes Pragmatic Multicenter Randomized Controlled Trial \n\t\t \n\t\t\t S H Wild \n\t\t \n\t\t \n\t\t\t J Hanley \n\t\t \n\t\t \n\t\t\t S C Lewis \n\t\t \n\t\t \n\t\t\t J A Mcknight \n\t\t \n\t\t \n\t\t\t L B Mccloughan \n\t\t \n\t\t \n\t\t\t P L Padfield \n\t\t \n\t\t \n\t\t\t R A Parker \n\t\t \n\t\t \n\t\t\t M Paterson \n\t\t \n\t\t \n\t\t\t H Pinnock \n\t\t \n\t\t \n\t\t\t A Sheikh \n\t\t \n\t \n\t \n\t\t PLoS Med \n\t\t \n\t\t\t 13 \n\t\t\t 1002098 \n\t\t\t 2016 \n\t\t \n\t \n\t Wild, S.H.; Hanley, J.; Lewis, S.C.; McKnight, J.A.; McCloughan, L.B.; Padfield, P.L.; Parker, R.A.; Paterson, M.; Pinnock, H.; Sheikh, A.; et al. Supported Telemonitoring and Glycemic Control in People with Type 2 Diabetes: The Telescot Diabetes Pragmatic Multicenter Randomized Controlled Trial. PLoS Med. 2016, 13, e1002098."
    },
    {
      "title": "Experimentation of 2.0 telemedicine in elderly patients with chronic heart failure: A study prospective in 175 patients",
      "authors": [
        "E Andr\u00e8s",
        "S Talha",
        "M Hajjam",
        "J Hajjam",
        "S Erv\u00e9",
        "A Hajjam"
      ],
      "year": 2018,
      "doi": "10.1016/j.ejim.2018.02.022",
      "journal": "Eur. J. Intern. Med",
      "volume": "51",
      "raw": "Experimentation of 2.0 telemedicine in elderly patients with chronic heart failure: A study prospective in 175 patients \n\t\t \n\t\t\t E Andr\u00e8s \n\t\t \n\t\t \n\t\t\t S Talha \n\t\t \n\t\t \n\t\t\t M Hajjam \n\t\t \n\t\t \n\t\t\t J Hajjam \n\t\t \n\t\t \n\t\t\t S Erv\u00e9 \n\t\t \n\t\t \n\t\t\t A Hajjam \n\t\t \n\t\t 10.1016/j.ejim.2018.02.022 \n\t \n\t \n\t\t Eur. J. Intern. Med \n\t\t \n\t\t\t 51 \n\t\t\t \n\t\t\t 2018 \n\t\t \n\t \n\t Andr\u00e8s, E.; Talha, S.; Hajjam, M.; Hajjam, J.; Erv\u00e9, S.; Hajjam, A. Experimentation of 2.0 telemedicine in elderly patients with chronic heart failure: A study prospective in 175 patients. Eur. J. Intern. Med. 2018, 51, e11-e12. [CrossRef] [PubMed]"
    },
    {
      "title": "Association between diabetes control and visits to a multidisciplinary pediatric diabetes clinic",
      "authors": [
        "F Kaufman",
        "M Halvorson",
        "S Carpenter"
      ],
      "year": 1999,
      "doi": "10.1542/peds.103.5.948",
      "journal": "Pediatrics",
      "volume": "103",
      "raw": "Association between diabetes control and visits to a multidisciplinary pediatric diabetes clinic \n\t\t \n\t\t\t F R Kaufman \n\t\t \n\t\t \n\t\t\t M Halvorson \n\t\t \n\t\t \n\t\t\t S Carpenter \n\t\t \n\t\t 10.1542/peds.103.5.948 \n\t \n\t \n\t\t Pediatrics \n\t\t \n\t\t\t 103 \n\t\t\t \n\t\t\t 1999 \n\t\t \n\t \n\t Kaufman, F.R.; Halvorson, M.; Carpenter, S. Association between diabetes control and visits to a multidisciplinary pediatric diabetes clinic. Pediatrics 1999, 103, 948-951. [CrossRef]"
    },
    {
      "title": "Use of Telemedicine for Management of Diabetes in Correctional Facilities",
      "authors": [
        "K Kassar",
        "C Roe",
        "M Desimone"
      ],
      "year": 2017,
      "doi": "10.1089/tmj.2016.0036",
      "journal": "Telemed. J. E Health",
      "volume": "23",
      "raw": "Use of Telemedicine for Management of Diabetes in Correctional Facilities \n\t\t \n\t\t\t K Kassar \n\t\t \n\t\t \n\t\t\t C Roe \n\t\t \n\t\t \n\t\t\t M Desimone \n\t\t \n\t\t 10.1089/tmj.2016.0036 \n\t \n\t \n\t\t Telemed. J. E Health \n\t\t \n\t\t\t 23 \n\t\t\t \n\t\t\t 2017 \n\t\t \n\t \n\t Kassar, K.; Roe, C.; Desimone, M. Use of Telemedicine for Management of Diabetes in Correctional Facilities. Telemed. J. E Health 2017, 23, 55-59. [CrossRef] [PubMed]"
    },
    {
      "title": "Televisits to Partially Substitute for Clinic Visits Are Feasible and Well Accepted by Tech-Savvy Patients With T1DM and Their Families: A Prospective Pilot Study",
      "authors": [
        "K Tonyushkina",
        "V Cobb",
        "A Moskovitz",
        "H Allen"
      ],
      "year": 2018,
      "doi": "10.1177/1932296818775438",
      "journal": "J. Diabetes Sci. Technol",
      "volume": "12",
      "raw": "Televisits to Partially Substitute for Clinic Visits Are Feasible and Well Accepted by Tech-Savvy Patients With T1DM and Their Families: A Prospective Pilot Study \n\t\t \n\t\t\t K N Tonyushkina \n\t\t \n\t\t \n\t\t\t V Cobb \n\t\t \n\t\t \n\t\t\t A Moskovitz \n\t\t \n\t\t \n\t\t\t H F Allen \n\t\t \n\t\t 10.1177/1932296818775438 \n\t \n\t \n\t\t J. Diabetes Sci. Technol \n\t\t \n\t\t\t 12 \n\t\t\t \n\t\t\t 2018 \n\t\t \n\t \n\t Tonyushkina, K.N.; Cobb, V.; Moskovitz, A.; Allen, H.F. Televisits to Partially Substitute for Clinic Visits Are Feasible and Well Accepted by Tech-Savvy Patients With T1DM and Their Families: A Prospective Pilot Study. J. Diabetes Sci. Technol. 2018, 12, 1084-1085. [CrossRef]"
    },
    {
      "title": "Diabetes Education and Support Tele-Visit Needs Differ in Duration, Content, and Satisfaction in Older Versus Younger Adults",
      "authors": [
        "M Greenfield",
        "D Stuber",
        "D Stegman-Barber",
        "K Kemmis",
        "B Matthews",
        "C Feuerstein-Simon",
        "P Saha",
        "B Wells",
        "T Mcarthur",
        "C Morley"
      ],
      "year": 2022,
      "doi": "10.1089/tmr.2022.0007",
      "journal": "Telemed. Rep",
      "volume": "3",
      "raw": "Diabetes Education and Support Tele-Visit Needs Differ in Duration, Content, and Satisfaction in Older Versus Younger Adults \n\t\t \n\t\t\t M Greenfield \n\t\t \n\t\t \n\t\t\t D Stuber \n\t\t \n\t\t \n\t\t\t D Stegman-Barber \n\t\t \n\t\t \n\t\t\t K Kemmis \n\t\t \n\t\t \n\t\t\t B Matthews \n\t\t \n\t\t \n\t\t\t C B Feuerstein-Simon \n\t\t \n\t\t \n\t\t\t P Saha \n\t\t \n\t\t \n\t\t\t B Wells \n\t\t \n\t\t \n\t\t\t T Mcarthur \n\t\t \n\t\t \n\t\t\t C P Morley \n\t\t \n\t\t 10.1089/tmr.2022.0007 \n\t \n\t \n\t\t Telemed. Rep \n\t\t \n\t\t\t 3 \n\t\t\t \n\t\t\t 2022 \n\t\t \n\t \n\t Greenfield, M.; Stuber, D.; Stegman-Barber, D.; Kemmis, K.; Matthews, B.; Feuerstein-Simon, C.B.; Saha, P.; Wells, B.; McArthur, T.; Morley, C.P.; et al. Diabetes Education and Support Tele-Visit Needs Differ in Duration, Content, and Satisfaction in Older Versus Younger Adults. Telemed. Rep. 2022, 3, 107-116. [CrossRef] [PubMed]"
    },
    {
      "title": "First televisits provided by the public health system for patients affected by diabetes mellitus in COVID-19 pandemic",
      "authors": [
        "B Pintaudi",
        "G Garavaglia",
        "O Disoteo",
        "E Meneghini",
        "O Epis",
        "F Colombo",
        "F Bertuzzi"
      ],
      "year": 2021,
      "doi": "10.1016/j.diabres.2021.108697",
      "journal": "Diabetes Res. Clin. Pract",
      "volume": "173",
      "pages": "108697",
      "raw": "First televisits provided by the public health system for patients affected by diabetes mellitus in COVID-19 pandemic \n\t\t \n\t\t\t B Pintaudi \n\t\t \n\t\t \n\t\t\t G Garavaglia \n\t\t \n\t\t \n\t\t\t O E Disoteo \n\t\t \n\t\t \n\t\t\t E Meneghini \n\t\t \n\t\t \n\t\t\t O M Epis \n\t\t \n\t\t \n\t\t\t F Colombo \n\t\t \n\t\t \n\t\t\t F Bertuzzi \n\t\t \n\t\t 10.1016/j.diabres.2021.108697 \n\t \n\t \n\t\t Diabetes Res. Clin. Pract \n\t\t \n\t\t\t 173 \n\t\t\t 108697 \n\t\t\t 2021 \n\t\t \n\t \n\t CrossRef \n\t Pintaudi, B.; Garavaglia, G.; Disoteo, O.E.; Meneghini, E.; Epis, O.M.; Colombo, F.; Bertuzzi, F. First televisits provided by the public health system for patients affected by diabetes mellitus in COVID-19 pandemic. Diabetes Res. Clin. Pract. 2021, 173, 108697. [CrossRef]"
    },
    {
      "title": "Use and Perception of Telemedicine in People with Type 1 Diabetes During the COVID-19 Pandemic: A 1-Year Follow-Up",
      "authors": [
        "S Scott",
        "F Fontana",
        "S Helleputte",
        "J Pickles",
        "M Laimer",
        "T Zueger",
        "C Stettler"
      ],
      "year": 2022,
      "doi": "10.1089/dia.2021.0426",
      "journal": "Diabetes Technol Ther",
      "volume": "24",
      "raw": "Use and Perception of Telemedicine in People with Type 1 Diabetes During the COVID-19 Pandemic: A 1-Year Follow-Up \n\t\t \n\t\t\t S N Scott \n\t\t \n\t\t \n\t\t\t F Y Fontana \n\t\t \n\t\t \n\t\t\t S Helleputte \n\t\t \n\t\t \n\t\t\t J Pickles \n\t\t \n\t\t \n\t\t\t M Laimer \n\t\t \n\t\t \n\t\t\t T Zueger \n\t\t \n\t\t \n\t\t\t C Stettler \n\t\t \n\t\t 10.1089/dia.2021.0426 \n\t \n\t \n\t\t Diabetes Technol Ther \n\t\t \n\t\t\t 24 \n\t\t\t \n\t\t\t 2022 \n\t\t \n\t \n\t Scott, S.N.; Fontana, F.Y.; Helleputte, S.; Pickles, J.; Laimer, M.; Zueger, T.; Stettler, C. Use and Perception of Telemedicine in People with Type 1 Diabetes During the COVID-19 Pandemic: A 1-Year Follow-Up. Diabetes Technol Ther. 2022, 24, 276-280. [CrossRef]"
    },
    {
      "title": "Prevalence and co-prevalence of comorbidities among patients with type 2 diabetes mellitus",
      "authors": [
        "K Iglay",
        "H Hannachi",
        "P Joseph Howie",
        "J Xu",
        "X Li",
        "S Engel",
        "L Moore",
        "S Rajpathak"
      ],
      "year": 2016,
      "doi": "10.1185/03007995.2016.1168291",
      "journal": "Curr. Med. Res. Opin",
      "volume": "2",
      "raw": "Prevalence and co-prevalence of comorbidities among patients with type 2 diabetes mellitus \n\t\t \n\t\t\t K Iglay \n\t\t \n\t\t \n\t\t\t H Hannachi \n\t\t \n\t\t \n\t\t\t P Joseph Howie \n\t\t \n\t\t \n\t\t\t J Xu \n\t\t \n\t\t \n\t\t\t X Li \n\t\t \n\t\t \n\t\t\t S S Engel \n\t\t \n\t\t \n\t\t\t L M Moore \n\t\t \n\t\t \n\t\t\t S Rajpathak \n\t\t \n\t\t 10.1185/03007995.2016.1168291 \n\t \n\t \n\t\t Curr. Med. Res. Opin \n\t\t \n\t\t\t 2 \n\t\t\t \n\t\t\t 2016 \n\t\t \n\t \n\t Iglay, K.; Hannachi, H.; Joseph Howie, P.; Xu, J.; Li, X.; Engel, S.S.; Moore, L.M.; Rajpathak, S. Prevalence and co-prevalence of comorbidities among patients with type 2 diabetes mellitus. Curr. Med. Res. Opin. 2016, 2, 1243-1252. [CrossRef]"
    },
    {
      "title": "Does telemedicine improve treatment outcomes for diabetes? A meta-analysis of results from 55 randomized controlled trials",
      "authors": [
        "D Su",
        "J Zhou",
        "M Kelley",
        "T Michaud",
        "M Siahpush",
        "J Kim",
        "F Wilson",
        "J Stimpson",
        "J Pag\u00e1n"
      ],
      "year": 2016,
      "doi": "10.1016/j.diabres.2016.04.019",
      "journal": "Diabetes Res. Clin. Pract",
      "volume": "116",
      "raw": "Does telemedicine improve treatment outcomes for diabetes? A meta-analysis of results from 55 randomized controlled trials \n\t\t \n\t\t\t D Su \n\t\t \n\t\t \n\t\t\t J Zhou \n\t\t \n\t\t \n\t\t\t M S Kelley \n\t\t \n\t\t \n\t\t\t T L Michaud \n\t\t \n\t\t \n\t\t\t M Siahpush \n\t\t \n\t\t \n\t\t\t J Kim \n\t\t \n\t\t \n\t\t\t F Wilson \n\t\t \n\t\t \n\t\t\t J P Stimpson \n\t\t \n\t\t \n\t\t\t J A Pag\u00e1n \n\t\t \n\t\t 10.1016/j.diabres.2016.04.019 \n\t \n\t \n\t\t Diabetes Res. Clin. Pract \n\t\t \n\t\t\t 116 \n\t\t\t \n\t\t\t 2016 \n\t\t \n\t \n\t Su, D.; Zhou, J.; Kelley, M.S.; Michaud, T.L.; Siahpush, M.; Kim, J.; Wilson, F.; Stimpson, J.P.; Pag\u00e1n, J.A. Does telemedicine improve treatment outcomes for diabetes? A meta-analysis of results from 55 randomized controlled trials. Diabetes Res. Clin. Pract. 2016, 116, 136-148. [CrossRef]"
    },
    {
      "title": "Telemedicine assists in the management of proatherogenic dyslipidemia and postprandial glucose variability in patients with type 2 diabetes mellitus: A cross-sectional study",
      "authors": [
        "P Cheng",
        "C Kao"
      ],
      "year": 2021,
      "doi": "10.1530/EC-21-0209",
      "journal": "Endocr. Connect",
      "volume": "10",
      "raw": "Telemedicine assists in the management of proatherogenic dyslipidemia and postprandial glucose variability in patients with type 2 diabetes mellitus: A cross-sectional study \n\t\t \n\t\t\t P C Cheng \n\t\t \n\t\t \n\t\t\t C H Kao \n\t\t \n\t\t 10.1530/EC-21-0209 \n\t \n\t \n\t\t Endocr. Connect \n\t\t \n\t\t\t 10 \n\t\t\t \n\t\t\t 2021 \n\t\t \n\t \n\t Cheng, P.C.; Kao, C.H. Telemedicine assists in the management of proatherogenic dyslipidemia and postprandial glucose variability in patients with type 2 diabetes mellitus: A cross-sectional study. Endocr. Connect. 2021, 10, 789-795. [CrossRef]"
    },
    {
      "title": "Efficacy of Telemedicine in Hypertension Care Through Home Blood Pressure Monitoring and Videoconferencing: Randomized Controlled Trial",
      "authors": [
        "J Yatabe",
        "M Yatabe",
        "R Okada",
        "A Ichihara"
      ],
      "year": 2021,
      "doi": "10.2196/27347",
      "journal": "JMIR Cardio",
      "volume": "5",
      "pages": "27347",
      "raw": "Efficacy of Telemedicine in Hypertension Care Through Home Blood Pressure Monitoring and Videoconferencing: Randomized Controlled Trial \n\t\t \n\t\t\t J Yatabe \n\t\t \n\t\t \n\t\t\t M S Yatabe \n\t\t \n\t\t \n\t\t\t R Okada \n\t\t \n\t\t \n\t\t\t A Ichihara \n\t\t \n\t\t 10.2196/27347 \n\t \n\t \n\t\t JMIR Cardio \n\t\t \n\t\t\t 5 \n\t\t\t 27347 \n\t\t\t 2021 \n\t\t \n\t \n\t Yatabe, J.; Yatabe, M.S.; Okada, R.; Ichihara, A. Efficacy of Telemedicine in Hypertension Care Through Home Blood Pressure Monitoring and Videoconferencing: Randomized Controlled Trial. JMIR Cardio. 2021, 5, e27347. [CrossRef] [PubMed]"
    },
    {
      "title": "Telehealth for patients at high risk of cardiovascular disease: Pragmatic randomised controlled trial",
      "authors": [
        "C Salisbury",
        "A O'cathain",
        "C Thomas",
        "L Edwards",
        "D Gaunt",
        "P Dixon",
        "S Hollinghurst",
        "J Nicholl",
        "S Large",
        "L Yardley"
      ],
      "year": 2016,
      "doi": "10.1136/bmj.i2647",
      "journal": "BMJ",
      "volume": "353",
      "pages": "2647",
      "raw": "Telehealth for patients at high risk of cardiovascular disease: Pragmatic randomised controlled trial \n\t\t \n\t\t\t C Salisbury \n\t\t \n\t\t \n\t\t\t A O'cathain \n\t\t \n\t\t \n\t\t\t C Thomas \n\t\t \n\t\t \n\t\t\t L Edwards \n\t\t \n\t\t \n\t\t\t D Gaunt \n\t\t \n\t\t \n\t\t\t P Dixon \n\t\t \n\t\t \n\t\t\t S Hollinghurst \n\t\t \n\t\t \n\t\t\t J Nicholl \n\t\t \n\t\t \n\t\t\t S Large \n\t\t \n\t\t \n\t\t\t L Yardley \n\t\t \n\t\t 10.1136/bmj.i2647 \n\t \n\t \n\t\t BMJ \n\t\t \n\t\t\t 353 \n\t\t\t 2647 \n\t\t\t 2016 \n\t\t \n\t \n\t Salisbury, C.; O'Cathain, A.; Thomas, C.; Edwards, L.; Gaunt, D.; Dixon, P.; Hollinghurst, S.; Nicholl, J.; Large, S.; Yardley, L.; et al. Telehealth for patients at high risk of cardiovascular disease: Pragmatic randomised controlled trial. BMJ 2016, 353, i2647. [CrossRef] [PubMed]"
    },
    {
      "title": "Meta-analysis of telemonitoring to improve HbA1c levels: Promise for stroke survivors",
      "authors": [
        "B Lieber",
        "B Taylor",
        "G Appelboom",
        "K Prasad",
        "S Bruce",
        "A Yang",
        "E Bruce",
        "B Christophe",
        "E Connolly"
      ],
      "year": 2015,
      "doi": "10.1016/j.jocn.2014.11.009",
      "journal": "J. Clin. Neurosci",
      "volume": "22",
      "raw": "Meta-analysis of telemonitoring to improve HbA1c levels: Promise for stroke survivors \n\t\t \n\t\t\t B A Lieber \n\t\t \n\t\t \n\t\t\t B Taylor \n\t\t \n\t\t \n\t\t\t G Appelboom \n\t\t \n\t\t \n\t\t\t K Prasad \n\t\t \n\t\t \n\t\t\t S Bruce \n\t\t \n\t\t \n\t\t\t A Yang \n\t\t \n\t\t \n\t\t\t E Bruce \n\t\t \n\t\t \n\t\t\t B Christophe \n\t\t \n\t\t \n\t\t\t E S Connolly \n\t\t \n\t\t \n\t\t\t Jr \n\t\t \n\t\t 10.1016/j.jocn.2014.11.009 \n\t \n\t \n\t\t J. Clin. Neurosci \n\t\t \n\t\t\t 22 \n\t\t\t \n\t\t\t 2015 \n\t\t \n\t \n\t Lieber, B.A.; Taylor, B.; Appelboom, G.; Prasad, K.; Bruce, S.; Yang, A.; Bruce, E.; Christophe, B.; Connolly, E.S., Jr. Meta-analysis of telemonitoring to improve HbA1c levels: Promise for stroke survivors. J. Clin. Neurosci. 2015, 22, 807-811. [CrossRef]"
    },
    {
      "title": "A Randomized Controlled Trial Comparing Telemedical and Standard Outpatient Monitoring of Diabetic Foot Ulcers",
      "authors": [
        "B Rasmussen",
        "J Froekjaer",
        "M Bjerregaard",
        "J Lauritsen",
        "J Hangaard",
        "C Henriksen",
        "U Halekoh",
        "K Yderstraede"
      ],
      "year": 2015,
      "doi": "10.2337/dc15-0332",
      "journal": "Diabetes Care",
      "volume": "38",
      "raw": "A Randomized Controlled Trial Comparing Telemedical and Standard Outpatient Monitoring of Diabetic Foot Ulcers \n\t\t \n\t\t\t B S Rasmussen \n\t\t \n\t\t \n\t\t\t J Froekjaer \n\t\t \n\t\t \n\t\t\t M R Bjerregaard \n\t\t \n\t\t \n\t\t\t J Lauritsen \n\t\t \n\t\t \n\t\t\t J Hangaard \n\t\t \n\t\t \n\t\t\t C W Henriksen \n\t\t \n\t\t \n\t\t\t U Halekoh \n\t\t \n\t\t \n\t\t\t K B Yderstraede \n\t\t \n\t\t 10.2337/dc15-0332 \n\t \n\t \n\t\t Diabetes Care \n\t\t \n\t\t\t 38 \n\t\t\t \n\t\t\t 2015 \n\t\t \n\t \n\t Rasmussen, B.S.; Froekjaer, J.; Bjerregaard, M.R.; Lauritsen, J.; Hangaard, J.; Henriksen, C.W.; Halekoh, U.; Yderstraede, K.B. A Randomized Controlled Trial Comparing Telemedical and Standard Outpatient Monitoring of Diabetic Foot Ulcers. Diabetes Care 2015, 38, 1723-1729. [CrossRef]"
    },
    {
      "title": "The Effect of Telemedicine Follow-up Care on Diabetes-Related Foot Ulcers: A Cluster-Randomized Controlled Noninferiority Trial",
      "authors": [
        "H Smith-Str\u00f8m",
        "J Igland",
        "T \u00d8stbye",
        "G Tell",
        "M Hausken",
        "M Graue",
        "S Skeie",
        "J Cooper",
        "M Iversen"
      ],
      "year": 2018,
      "journal": "Diabetes Care",
      "volume": "41",
      "raw": "The Effect of Telemedicine Follow-up Care on Diabetes-Related Foot Ulcers: A Cluster-Randomized Controlled Noninferiority Trial \n\t\t \n\t\t\t H Smith-Str\u00f8m \n\t\t \n\t\t \n\t\t\t J Igland \n\t\t \n\t\t \n\t\t\t T \u00d8stbye \n\t\t \n\t\t \n\t\t\t G S Tell \n\t\t \n\t\t \n\t\t\t M F Hausken \n\t\t \n\t\t \n\t\t\t M Graue \n\t\t \n\t\t \n\t\t\t S Skeie \n\t\t \n\t\t \n\t\t\t J G Cooper \n\t\t \n\t\t \n\t\t\t M M Iversen \n\t\t \n\t \n\t \n\t\t Diabetes Care \n\t\t \n\t\t\t 41 \n\t\t\t \n\t\t\t 2018 \n\t\t \n\t \n\t Smith-Str\u00f8m, H.; Igland, J.; \u00d8stbye, T.; Tell, G.S.; Hausken, M.F.; Graue, M.; Skeie, S.; Cooper, J.G.; Iversen, M.M. The Effect of Telemedicine Follow-up Care on Diabetes-Related Foot Ulcers: A Cluster-Randomized Controlled Noninferiority Trial. Diabetes Care 2018, 41, 96-103."
    },
    {
      "doi": "10.2337/dc17-1025",
      "raw": "10.2337/dc17-1025 \n\t\t \n\t \n\t CrossRef"
    },
    {
      "title": "Effect of a telemedicine intervention for diabetes-related foot ulcers on health, well-being and quality of life: Secondary outcomes from a cluster randomized controlled trial (DiaFOTo)",
      "authors": [
        "M Iversen",
        "J Igland",
        "H Smith-Str\u00f8m",
        "T \u00d8stbye",
        "G Tell",
        "S Skeie",
        "J Cooper",
        "M Peyrot",
        "M Graue"
      ],
      "year": 2020,
      "doi": "10.1186/s12902-020-00637-x",
      "journal": "BMC Endocr. Disord",
      "volume": "20",
      "pages": "157",
      "raw": "Effect of a telemedicine intervention for diabetes-related foot ulcers on health, well-being and quality of life: Secondary outcomes from a cluster randomized controlled trial (DiaFOTo) \n\t\t \n\t\t\t M M Iversen \n\t\t \n\t\t \n\t\t\t J Igland \n\t\t \n\t\t \n\t\t\t H Smith-Str\u00f8m \n\t\t \n\t\t \n\t\t\t T \u00d8stbye \n\t\t \n\t\t \n\t\t\t G S Tell \n\t\t \n\t\t \n\t\t\t S Skeie \n\t\t \n\t\t \n\t\t\t J G Cooper \n\t\t \n\t\t \n\t\t\t M Peyrot \n\t\t \n\t\t \n\t\t\t M Graue \n\t\t \n\t\t 10.1186/s12902-020-00637-x \n\t \n\t \n\t\t BMC Endocr. Disord \n\t\t \n\t\t\t 20 \n\t\t\t 157 \n\t\t\t 2020 \n\t\t \n\t \n\t Iversen, M.M.; Igland, J.; Smith-Str\u00f8m, H.; \u00d8stbye, T.; Tell, G.S.; Skeie, S.; Cooper, J.G.; Peyrot, M.; Graue, M. Effect of a telemedicine intervention for diabetes-related foot ulcers on health, well-being and quality of life: Secondary outcomes from a cluster randomized controlled trial (DiaFOTo). BMC Endocr. Disord. 2020, 20, 157. [CrossRef] [PubMed]"
    },
    {
      "title": "The use of telemedicine in the management of diabetes-related foot ulceration: A pilot study",
      "authors": [
        "W Wilbright",
        "J Birke",
        "C Patout",
        "M Varnado",
        "R Horswell"
      ],
      "year": 2004,
      "doi": "10.1097/00129334-200406000-00012",
      "journal": "Adv. Skin Wound Care",
      "volume": "17",
      "raw": "The use of telemedicine in the management of diabetes-related foot ulceration: A pilot study \n\t\t \n\t\t\t W A Wilbright \n\t\t \n\t\t \n\t\t\t J A Birke \n\t\t \n\t\t \n\t\t\t C A Patout \n\t\t \n\t\t \n\t\t\t M Varnado \n\t\t \n\t\t \n\t\t\t R Horswell \n\t\t \n\t\t 10.1097/00129334-200406000-00012 \n\t \n\t \n\t\t Adv. Skin Wound Care \n\t\t \n\t\t\t 17 \n\t\t\t \n\t\t\t 2004 \n\t\t \n\t \n\t Wilbright, W.A.; Birke, J.A.; Patout, C.A.; Varnado, M.; Horswell, R. The use of telemedicine in the management of diabetes-related foot ulceration: A pilot study. Adv. Skin Wound Care 2004, 17, 232-238. [CrossRef]"
    },
    {
      "title": "Patient attitudes toward a Web-based system for monitoring chronic wounds",
      "authors": [
        "H Kim",
        "J Lowery",
        "J Hamill",
        "E Wilkins"
      ],
      "year": 2004,
      "doi": "10.1089/1530562042632074",
      "journal": "Telemed. J. E Health",
      "volume": "10",
      "raw": "Patient attitudes toward a Web-based system for monitoring chronic wounds \n\t\t \n\t\t\t H M Kim \n\t\t \n\t\t \n\t\t\t J C Lowery \n\t\t \n\t\t \n\t\t\t J B Hamill \n\t\t \n\t\t \n\t\t\t E G Wilkins \n\t\t \n\t\t 10.1089/1530562042632074 \n\t \n\t \n\t\t Telemed. J. E Health \n\t\t \n\t\t\t 10 \n\t\t\t \n\t\t\t 2004 \n\t\t \n\t \n\t Suppl. S2 \n\t Kim, H.M.; Lowery, J.C.; Hamill, J.B.; Wilkins, E.G. Patient attitudes toward a Web-based system for monitoring chronic wounds. Telemed. J. E Health 2004, 10 (Suppl. S2), S-26-34. [CrossRef]"
    },
    {
      "title": "An assessment of the accuracy and usability of a novel optical wound measurement system",
      "authors": [
        "F Bowling",
        "L King",
        "H Fadavi",
        "J Paterson",
        "K Preece",
        "R Daniel",
        "D Matthews",
        "A Boulton"
      ],
      "year": 2009,
      "doi": "10.1111/j.1464-5491.2008.02611.x",
      "journal": "Diabet. Med",
      "volume": "26",
      "raw": "An assessment of the accuracy and usability of a novel optical wound measurement system \n\t\t \n\t\t\t F L Bowling \n\t\t \n\t\t \n\t\t\t L King \n\t\t \n\t\t \n\t\t\t H Fadavi \n\t\t \n\t\t \n\t\t\t J A Paterson \n\t\t \n\t\t \n\t\t\t K Preece \n\t\t \n\t\t \n\t\t\t R W Daniel \n\t\t \n\t\t \n\t\t\t D J Matthews \n\t\t \n\t\t \n\t\t\t A J Boulton \n\t\t \n\t\t 10.1111/j.1464-5491.2008.02611.x \n\t \n\t \n\t\t Diabet. Med \n\t\t \n\t\t\t 26 \n\t\t\t \n\t\t\t 2009 \n\t\t \n\t \n\t Bowling, F.L.; King, L.; Fadavi, H.; Paterson, J.A.; Preece, K.; Daniel, R.W.; Matthews, D.J.; Boulton, A.J. An assessment of the accuracy and usability of a novel optical wound measurement system. Diabet. Med. 2009, 26, 93-96. [CrossRef]"
    },
    {
      "title": "Area of the diabetic ulcers estimated applying a foot scanner-based home telecare system and three reference methods",
      "authors": [
        "P Ladyzynski",
        "P Foltynski",
        "M Molik",
        "J Tarwacka",
        "K Migalska-Musial",
        "M Mlynarczuk",
        "J Wojcicki",
        "J Krzymien",
        "W Karnafel"
      ],
      "year": 2011,
      "doi": "10.1089/dia.2011.0082",
      "journal": "Diabetes Technol. Ther",
      "volume": "13",
      "raw": "Area of the diabetic ulcers estimated applying a foot scanner-based home telecare system and three reference methods \n\t\t \n\t\t\t P Ladyzynski \n\t\t \n\t\t \n\t\t\t P Foltynski \n\t\t \n\t\t \n\t\t\t M Molik \n\t\t \n\t\t \n\t\t\t J Tarwacka \n\t\t \n\t\t \n\t\t\t K Migalska-Musial \n\t\t \n\t\t \n\t\t\t M Mlynarczuk \n\t\t \n\t\t \n\t\t\t J M Wojcicki \n\t\t \n\t\t \n\t\t\t J Krzymien \n\t\t \n\t\t \n\t\t\t W Karnafel \n\t\t \n\t\t 10.1089/dia.2011.0082 \n\t \n\t \n\t\t Diabetes Technol. Ther \n\t\t \n\t\t\t 13 \n\t\t\t \n\t\t\t 2011 \n\t\t \n\t \n\t Ladyzynski, P.; Foltynski, P.; Molik, M.; Tarwacka, J.; Migalska-Musial, K.; Mlynarczuk, M.; Wojcicki, J.M.; Krzymien, J.; Karnafel, W. Area of the diabetic ulcers estimated applying a foot scanner-based home telecare system and three reference methods. Diabetes Technol. Ther. 2011, 13, 1101-1107. [CrossRef]"
    },
    {
      "title": "Remote assessment of diabetic foot ulcers using a novel wound imaging system",
      "authors": [
        "F Bowling",
        "L King",
        "J Paterson",
        "J Hu",
        "B Lipsky",
        "D Matthews",
        "A Boulton"
      ],
      "year": 2011,
      "doi": "10.1111/j.1524-475X.2010.00645.x",
      "journal": "Wound Repair. Regen",
      "volume": "19",
      "raw": "Remote assessment of diabetic foot ulcers using a novel wound imaging system \n\t\t \n\t\t\t F L Bowling \n\t\t \n\t\t \n\t\t\t L King \n\t\t \n\t\t \n\t\t\t J A Paterson \n\t\t \n\t\t \n\t\t\t J Hu \n\t\t \n\t\t \n\t\t\t B A Lipsky \n\t\t \n\t\t \n\t\t\t D R Matthews \n\t\t \n\t\t \n\t\t\t A J Boulton \n\t\t \n\t\t 10.1111/j.1524-475X.2010.00645.x \n\t \n\t \n\t\t Wound Repair. Regen \n\t\t \n\t\t\t 19 \n\t\t\t \n\t\t\t 2011 \n\t\t \n\t \n\t Bowling, F.L.; King, L.; Paterson, J.A.; Hu, J.; Lipsky, B.A.; Matthews, D.R.; Boulton, A.J. Remote assessment of diabetic foot ulcers using a novel wound imaging system. Wound Repair. Regen. 2011, 19, 25-30. [CrossRef] [PubMed]"
    },
    {
      "title": "Digital imaging: An accurate and easy method of measuring foot ulcers",
      "authors": [
        "S Rajbhandari",
        "N Harris",
        "M Sutton",
        "C Lockett",
        "S Eaton",
        "M Gadour",
        "S Tesfaye",
        "J Ward"
      ],
      "year": 1999,
      "doi": "10.1046/j.1464-5491.1999.00053.x",
      "journal": "Diabet. Med",
      "volume": "16",
      "raw": "Digital imaging: An accurate and easy method of measuring foot ulcers \n\t\t \n\t\t\t S M Rajbhandari \n\t\t \n\t\t \n\t\t\t N D Harris \n\t\t \n\t\t \n\t\t\t M Sutton \n\t\t \n\t\t \n\t\t\t C Lockett \n\t\t \n\t\t \n\t\t\t S Eaton \n\t\t \n\t\t \n\t\t\t M Gadour \n\t\t \n\t\t \n\t\t\t S Tesfaye \n\t\t \n\t\t \n\t\t\t J D Ward \n\t\t \n\t\t 10.1046/j.1464-5491.1999.00053.x \n\t \n\t \n\t\t Diabet. Med \n\t\t \n\t\t\t 16 \n\t\t\t \n\t\t\t 1999 \n\t\t \n\t \n\t Rajbhandari, S.M.; Harris, N.D.; Sutton, M.; Lockett, C.; Eaton, S.; Gadour, M.; Tesfaye, S.; Ward, J.D. Digital imaging: An accurate and easy method of measuring foot ulcers. Diabet. Med. 1999, 16, 339-342. [CrossRef]"
    },
    {
      "title": "Assessment of signs of foot infection in diabetes patients using photographic foot imaging and infrared thermography",
      "authors": [
        "C Hazenberg",
        "J Van Netten",
        "S Van Baal",
        "S Bus"
      ],
      "year": 2014,
      "doi": "10.1089/dia.2013.0251",
      "journal": "Diabetes Technol. Ther",
      "volume": "16",
      "raw": "Assessment of signs of foot infection in diabetes patients using photographic foot imaging and infrared thermography \n\t\t \n\t\t\t C E Hazenberg \n\t\t \n\t\t \n\t\t\t J J Van Netten \n\t\t \n\t\t \n\t\t\t S G Van Baal \n\t\t \n\t\t \n\t\t\t S A Bus \n\t\t \n\t\t 10.1089/dia.2013.0251 \n\t \n\t \n\t\t Diabetes Technol. Ther \n\t\t \n\t\t\t 16 \n\t\t\t \n\t\t\t 2014 \n\t\t \n\t \n\t Hazenberg, C.E.; van Netten, J.J.; van Baal, S.G.; Bus, S.A. Assessment of signs of foot infection in diabetes patients using photographic foot imaging and infrared thermography. Diabetes Technol. Ther. 2014, 16, 370-377. [CrossRef] [PubMed]"
    },
    {
      "title": "Skin temperature monitoring reduces the risk for diabetic foot ulceration in high-risk patients",
      "authors": [
        "D Armstrong",
        "K Holtz-Neiderer",
        "C Wendel",
        "M Mohler",
        "H Kimbriel",
        "L Lavery"
      ],
      "year": 2007,
      "doi": "10.1016/j.amjmed.2007.06.028",
      "journal": "Am. J. Med",
      "volume": "120",
      "raw": "Skin temperature monitoring reduces the risk for diabetic foot ulceration in high-risk patients \n\t\t \n\t\t\t D G Armstrong \n\t\t \n\t\t \n\t\t\t K Holtz-Neiderer \n\t\t \n\t\t \n\t\t\t C Wendel \n\t\t \n\t\t \n\t\t\t M J Mohler \n\t\t \n\t\t \n\t\t\t H R Kimbriel \n\t\t \n\t\t \n\t\t\t L A Lavery \n\t\t \n\t\t 10.1016/j.amjmed.2007.06.028 \n\t \n\t \n\t\t Am. J. Med \n\t\t \n\t\t\t 120 \n\t\t\t \n\t\t\t 2007 \n\t\t \n\t \n\t Armstrong, D.G.; Holtz-Neiderer, K.; Wendel, C.; Mohler, M.J.; Kimbriel, H.R.; Lavery, L.A. Skin temperature monitoring reduces the risk for diabetic foot ulceration in high-risk patients. Am. J. Med. 2007, 120, 1042-1046. [CrossRef]"
    },
    {
      "title": "Home monitoring of foot skin temperatures to prevent ulceration",
      "authors": [
        "L Lavery",
        "K Higgins",
        "D Lanctot",
        "G Constantinides",
        "R Zamorano",
        "D Armstrong",
        "K Athanasiou",
        "C Agrawal"
      ],
      "year": 2004,
      "doi": "10.2337/diacare.27.11.2642",
      "journal": "Diabetes Care",
      "volume": "27",
      "raw": "Home monitoring of foot skin temperatures to prevent ulceration \n\t\t \n\t\t\t L A Lavery \n\t\t \n\t\t \n\t\t\t K R Higgins \n\t\t \n\t\t \n\t\t\t D R Lanctot \n\t\t \n\t\t \n\t\t\t G P Constantinides \n\t\t \n\t\t \n\t\t\t R G Zamorano \n\t\t \n\t\t \n\t\t\t D G Armstrong \n\t\t \n\t\t \n\t\t\t K A Athanasiou \n\t\t \n\t\t \n\t\t\t C M Agrawal \n\t\t \n\t\t 10.2337/diacare.27.11.2642 \n\t \n\t \n\t\t Diabetes Care \n\t\t \n\t\t\t 27 \n\t\t\t \n\t\t\t 2004 \n\t\t \n\t \n\t Lavery, L.A.; Higgins, K.R.; Lanctot, D.R.; Constantinides, G.P.; Zamorano, R.G.; Armstrong, D.G.; Athanasiou, K.A.; Agrawal, C.M. Home monitoring of foot skin temperatures to prevent ulceration. Diabetes Care 2004, 27, 2642-2647. [CrossRef] [PubMed]"
    },
    {
      "title": "Preventing diabetic foot ulcer recurrence in high-risk patients: Use of temperature monitoring as a self-assessment tool",
      "authors": [
        "L Lavery",
        "K Higgins",
        "D Lanctot",
        "G Constantinides",
        "R Zamorano",
        "K Athanasiou",
        "D Armstrong",
        "C Agrawal"
      ],
      "year": 2007,
      "doi": "10.2337/dc06-1600",
      "journal": "Diabetes Care",
      "volume": "30",
      "raw": "Preventing diabetic foot ulcer recurrence in high-risk patients: Use of temperature monitoring as a self-assessment tool \n\t\t \n\t\t\t L A Lavery \n\t\t \n\t\t \n\t\t\t K R Higgins \n\t\t \n\t\t \n\t\t\t D R Lanctot \n\t\t \n\t\t \n\t\t\t G P Constantinides \n\t\t \n\t\t \n\t\t\t R G Zamorano \n\t\t \n\t\t \n\t\t\t K A Athanasiou \n\t\t \n\t\t \n\t\t\t D G Armstrong \n\t\t \n\t\t \n\t\t\t C M Agrawal \n\t\t \n\t\t 10.2337/dc06-1600 \n\t\t 100 \n\t \n\t \n\t\t Diabetes Care \n\t\t \n\t\t\t 30 \n\t\t\t \n\t\t\t 2007 \n\t\t \n\t \n\t Lavery, L.A.; Higgins, K.R.; Lanctot, D.R.; Constantinides, G.P.; Zamorano, R.G.; Athanasiou, K.A.; Armstrong, D.G.; Agrawal, C.M. Preventing diabetic foot ulcer recurrence in high-risk patients: Use of temperature monitoring as a self-assessment tool. Diabetes Care 2007, 30, 14-20. [CrossRef] 100"
    },
    {
      "title": "A pilot study testing the feasibility of skin temperature monitoring to reduce recurrent foot ulcers in patients with diabetes--a randomized controlled trial",
      "authors": [
        "A Skafjeld",
        "M Iversen",
        "I Holme",
        "L Ribu",
        "K Hvaal",
        "B Kilhovd"
      ],
      "year": 2015,
      "doi": "10.1186/s12902-015-0054-x",
      "journal": "BMC Endocr. Disord",
      "volume": "15",
      "pages": "55",
      "raw": "A pilot study testing the feasibility of skin temperature monitoring to reduce recurrent foot ulcers in patients with diabetes--a randomized controlled trial \n\t\t \n\t\t\t A Skafjeld \n\t\t \n\t\t \n\t\t\t M M Iversen \n\t\t \n\t\t \n\t\t\t I Holme \n\t\t \n\t\t \n\t\t\t L Ribu \n\t\t \n\t\t \n\t\t\t K Hvaal \n\t\t \n\t\t \n\t\t\t B K Kilhovd \n\t\t \n\t\t 10.1186/s12902-015-0054-x \n\t\t 101 \n\t \n\t \n\t\t BMC Endocr. Disord \n\t\t \n\t\t\t 15 \n\t\t\t 55 \n\t\t\t 2015 \n\t\t \n\t \n\t Skafjeld, A.; Iversen, M.M.; Holme, I.; Ribu, L.; Hvaal, K.; Kilhovd, B.K. A pilot study testing the feasibility of skin temperature monitoring to reduce recurrent foot ulcers in patients with diabetes--a randomized controlled trial. BMC Endocr. Disord. 2015, 15, 55. [CrossRef] 101"
    },
    {
      "title": "Use of liquid crystal thermography in the evaluation of the diabetic foot",
      "authors": [
        "R Stess",
        "P Sisney",
        "K Moss",
        "P Graf",
        "K Louie",
        "G Gooding",
        "C Grunfeld"
      ],
      "year": 1986,
      "doi": "10.2337/diacare.9.3.267",
      "journal": "Diabetes Care",
      "volume": "9",
      "raw": "Use of liquid crystal thermography in the evaluation of the diabetic foot \n\t\t \n\t\t\t R M Stess \n\t\t \n\t\t \n\t\t\t P C Sisney \n\t\t \n\t\t \n\t\t\t K M Moss \n\t\t \n\t\t \n\t\t\t P M Graf \n\t\t \n\t\t \n\t\t\t K S Louie \n\t\t \n\t\t \n\t\t\t G A Gooding \n\t\t \n\t\t \n\t\t\t C Grunfeld \n\t\t \n\t\t 10.2337/diacare.9.3.267 \n\t\t 102 \n\t \n\t \n\t\t Diabetes Care \n\t\t \n\t\t\t 9 \n\t\t\t \n\t\t\t 1986 \n\t\t \n\t \n\t Stess, R.M.; Sisney, P.C.; Moss, K.M.; Graf, P.M.; Louie, K.S.; Gooding, G.A.; Grunfeld, C. Use of liquid crystal thermography in the evaluation of the diabetic foot. Diabetes Care 1986, 9, 267-272. [CrossRef] 102"
    },
    {
      "title": "The prediction of diabetic neuropathic plantar foot ulceration by liquid-crystal contact thermography",
      "authors": [
        "S Benbow",
        "A Chan",
        "D Bowsher",
        "G Williams",
        "I Macfarlane"
      ],
      "year": 1994,
      "doi": "10.2337/diacare.17.8.835",
      "journal": "Diabetes Care",
      "volume": "17",
      "raw": "The prediction of diabetic neuropathic plantar foot ulceration by liquid-crystal contact thermography \n\t\t \n\t\t\t S J Benbow \n\t\t \n\t\t \n\t\t\t A W Chan \n\t\t \n\t\t \n\t\t\t D R Bowsher \n\t\t \n\t\t \n\t\t\t G Williams \n\t\t \n\t\t \n\t\t\t I A Macfarlane \n\t\t \n\t\t 10.2337/diacare.17.8.835 \n\t\t 103 \n\t \n\t \n\t\t Diabetes Care \n\t\t \n\t\t\t 17 \n\t\t\t \n\t\t\t 1994 \n\t\t \n\t \n\t Benbow, S.J.; Chan, A.W.; Bowsher, D.R.; Williams, G.; Macfarlane, I.A. The prediction of diabetic neuropathic plantar foot ulceration by liquid-crystal contact thermography. Diabetes Care 1994, 17, 835-839. [CrossRef] 103"
    },
    {
      "title": "Feasibility of a thermographic method for early detection of foot disorders in diabetes",
      "authors": [
        "K Roback",
        "M Johansson",
        "A Starkhammar"
      ],
      "year": 2009,
      "doi": "10.1089/dia.2009.0053",
      "journal": "Diabetes Technol. Ther",
      "volume": "11",
      "raw": "Feasibility of a thermographic method for early detection of foot disorders in diabetes \n\t\t \n\t\t\t K Roback \n\t\t \n\t\t \n\t\t\t M Johansson \n\t\t \n\t\t \n\t\t\t A Starkhammar \n\t\t \n\t\t 10.1089/dia.2009.0053 \n\t\t 104 \n\t \n\t \n\t\t Diabetes Technol. Ther \n\t\t \n\t\t\t 11 \n\t\t\t \n\t\t\t 2009 \n\t\t \n\t \n\t Roback, K.; Johansson, M.; Starkhammar, A. Feasibility of a thermographic method for early detection of foot disorders in diabetes. Diabetes Technol. Ther. 2009, 11, 663-667. [CrossRef] 104"
    },
    {
      "title": "Feasibility and Efficacy of a Smart Mat Technology to Predict Development of Diabetic Plantar Ulcers",
      "authors": [
        "R Frykberg",
        "I Gordon",
        "A Reyzelman",
        "S Cazzell",
        "R Fitzgerald",
        "G Rothenberg",
        "J Bloom",
        "B Petersen",
        "D Linders",
        "A Nouvong"
      ],
      "year": 2017,
      "doi": "10.2337/dc16-2294",
      "journal": "Diabetes Care",
      "volume": "40",
      "raw": "Feasibility and Efficacy of a Smart Mat Technology to Predict Development of Diabetic Plantar Ulcers \n\t\t \n\t\t\t R G Frykberg \n\t\t \n\t\t \n\t\t\t I L Gordon \n\t\t \n\t\t \n\t\t\t A M Reyzelman \n\t\t \n\t\t \n\t\t\t S M Cazzell \n\t\t \n\t\t \n\t\t\t R H Fitzgerald \n\t\t \n\t\t \n\t\t\t G M Rothenberg \n\t\t \n\t\t \n\t\t\t J D Bloom \n\t\t \n\t\t \n\t\t\t B J Petersen \n\t\t \n\t\t \n\t\t\t D R Linders \n\t\t \n\t\t \n\t\t\t A Nouvong \n\t\t \n\t\t 10.2337/dc16-2294 \n\t\t 105 \n\t \n\t \n\t\t Diabetes Care \n\t\t \n\t\t\t 40 \n\t\t\t \n\t\t\t 2017 \n\t\t \n\t \n\t Frykberg, R.G.; Gordon, I.L.; Reyzelman, A.M.; Cazzell, S.M.; Fitzgerald, R.H.; Rothenberg, G.M.; Bloom, J.D.; Petersen, B.J.; Linders, D.R.; Nouvong, A.; et al. Feasibility and Efficacy of a Smart Mat Technology to Predict Development of Diabetic Plantar Ulcers. Diabetes Care 2017, 40, 973-980. [CrossRef] [PubMed] 105"
    },
    {
      "title": "Early identification of diabetic foot ulcers that may require intervention using the micro lightguide spectrophotometer",
      "authors": [
        "S Rajbhandari",
        "N Harris",
        "S Tesfaye",
        "J Ward"
      ],
      "year": 1999,
      "doi": "10.2337/diacare.22.8.1292",
      "journal": "Diabetes Care",
      "volume": "22",
      "raw": "Early identification of diabetic foot ulcers that may require intervention using the micro lightguide spectrophotometer \n\t\t \n\t\t\t S M Rajbhandari \n\t\t \n\t\t \n\t\t\t N D Harris \n\t\t \n\t\t \n\t\t\t S Tesfaye \n\t\t \n\t\t \n\t\t\t J D Ward \n\t\t \n\t\t 10.2337/diacare.22.8.1292 \n\t\t 106 \n\t \n\t \n\t\t Diabetes Care \n\t\t \n\t\t\t 22 \n\t\t\t \n\t\t\t 1999 \n\t\t \n\t \n\t Rajbhandari, S.M.; Harris, N.D.; Tesfaye, S.; Ward, J.D. Early identification of diabetic foot ulcers that may require intervention using the micro lightguide spectrophotometer. Diabetes Care 1999, 22, 1292-1295. [CrossRef] [PubMed] 106"
    },
    {
      "title": "Noninvasive assessment of diabetic foot ulcers with diffuse photon density wave methodology: Pilot human study",
      "authors": [
        "E Papazoglou",
        "M Neidrauer",
        "L Zubkov",
        "M Weingarten",
        "K Pourrezaei"
      ],
      "year": 2009,
      "doi": "10.1117/1.3275467",
      "journal": "J. Biomed. Opt",
      "volume": "14",
      "pages": "64032",
      "raw": "Noninvasive assessment of diabetic foot ulcers with diffuse photon density wave methodology: Pilot human study \n\t\t \n\t\t\t E S Papazoglou \n\t\t \n\t\t \n\t\t\t M Neidrauer \n\t\t \n\t\t \n\t\t\t L Zubkov \n\t\t \n\t\t \n\t\t\t M S Weingarten \n\t\t \n\t\t \n\t\t\t K Pourrezaei \n\t\t \n\t\t 10.1117/1.3275467 \n\t\t 107 \n\t \n\t \n\t\t J. Biomed. Opt \n\t\t \n\t\t\t 14 \n\t\t\t 64032 \n\t\t\t 2009 \n\t\t \n\t \n\t Papazoglou, E.S.; Neidrauer, M.; Zubkov, L.; Weingarten, M.S.; Pourrezaei, K. Noninvasive assessment of diabetic foot ulcers with diffuse photon density wave methodology: Pilot human study. J. Biomed. Opt. 2009, 14, 064032. [CrossRef] 107"
    },
    {
      "title": "Near infrared wound monitor helps clinical assessment of diabetic foot ulcers",
      "authors": [
        "M Neidrauer",
        "L Zubkov",
        "M Weingarten",
        "K Pourrezaei",
        "E Papazoglou"
      ],
      "year": 2010,
      "doi": "10.1177/193229681000400404",
      "journal": "J. Diabetes Sci. Technol",
      "volume": "4",
      "raw": "Near infrared wound monitor helps clinical assessment of diabetic foot ulcers \n\t\t \n\t\t\t M Neidrauer \n\t\t \n\t\t \n\t\t\t L Zubkov \n\t\t \n\t\t \n\t\t\t M S Weingarten \n\t\t \n\t\t \n\t\t\t K Pourrezaei \n\t\t \n\t\t \n\t\t\t E S Papazoglou \n\t\t \n\t\t 10.1177/193229681000400404 \n\t\t 108 \n\t \n\t \n\t\t J. Diabetes Sci. Technol \n\t\t \n\t\t\t 4 \n\t\t\t \n\t\t\t 2010 \n\t\t \n\t \n\t Neidrauer, M.; Zubkov, L.; Weingarten, M.S.; Pourrezaei, K.; Papazoglou, E.S. Near infrared wound monitor helps clinical assessment of diabetic foot ulcers. J. Diabetes Sci. Technol. 2010, 4, 792-798. [CrossRef] 108"
    },
    {
      "title": "Prediction of wound healing in human diabetic foot ulcers by diffuse near-infrared spectroscopy: A pilot study",
      "authors": [
        "M Weingarten",
        "M Neidrauer",
        "A Mateo",
        "X Mao",
        "J Mcdaniel",
        "L Jenkins",
        "S Bouraee",
        "L Zubkov",
        "K Pourrezaei",
        "E Papazoglou"
      ],
      "year": 2010,
      "doi": "10.1111/j.1524-475x.2010.00583.x",
      "journal": "Wound Repair. Regen",
      "volume": "18",
      "raw": "Prediction of wound healing in human diabetic foot ulcers by diffuse near-infrared spectroscopy: A pilot study \n\t\t \n\t\t\t M S Weingarten \n\t\t \n\t\t \n\t\t\t M Neidrauer \n\t\t \n\t\t \n\t\t\t A Mateo \n\t\t \n\t\t \n\t\t\t X Mao \n\t\t \n\t\t \n\t\t\t J E Mcdaniel \n\t\t \n\t\t \n\t\t\t L Jenkins \n\t\t \n\t\t \n\t\t\t S Bouraee \n\t\t \n\t\t \n\t\t\t L Zubkov \n\t\t \n\t\t \n\t\t\t K Pourrezaei \n\t\t \n\t\t \n\t\t\t E S Papazoglou \n\t\t \n\t\t 10.1111/j.1524-475x.2010.00583.x \n\t\t 109 \n\t \n\t \n\t\t Wound Repair. Regen \n\t\t \n\t\t\t 18 \n\t\t\t \n\t\t\t 2010 \n\t\t \n\t \n\t Weingarten, M.S.; Neidrauer, M.; Mateo, A.; Mao, X.; McDaniel, J.E.; Jenkins, L.; Bouraee, S.; Zubkov, L.; Pourrezaei, K.; Papazoglou, E.S. Prediction of wound healing in human diabetic foot ulcers by diffuse near-infrared spectroscopy: A pilot study. Wound Repair. Regen. 2010, 18, 180-185. [CrossRef] 109"
    },
    {
      "title": "Diffuse near-infrared spectroscopy prediction of healing in diabetic foot ulcers: A human study and cost analysis",
      "authors": [
        "M Weingarten",
        "J Samuels",
        "M Neidrauer",
        "X Mao",
        "D Diaz",
        "J Mcguire",
        "J Mcdaniel",
        "L Jenkins",
        "L Zubkov",
        "E Papazoglou"
      ],
      "year": 2012,
      "doi": "10.1111/j.1524-475x.2012.00843.x",
      "journal": "Wound Repair. Regen",
      "volume": "20",
      "pages": "110",
      "raw": "Diffuse near-infrared spectroscopy prediction of healing in diabetic foot ulcers: A human study and cost analysis \n\t\t \n\t\t\t M S Weingarten \n\t\t \n\t\t \n\t\t\t J A Samuels \n\t\t \n\t\t \n\t\t\t M Neidrauer \n\t\t \n\t\t \n\t\t\t X Mao \n\t\t \n\t\t \n\t\t\t D Diaz \n\t\t \n\t\t \n\t\t\t J Mcguire \n\t\t \n\t\t \n\t\t\t J Mcdaniel \n\t\t \n\t\t \n\t\t\t L Jenkins \n\t\t \n\t\t \n\t\t\t L Zubkov \n\t\t \n\t\t \n\t\t\t E S Papazoglou \n\t\t \n\t\t 10.1111/j.1524-475x.2012.00843.x \n\t \n\t \n\t\t Wound Repair. Regen \n\t\t \n\t\t\t 20 \n\t\t\t 110 \n\t\t\t 2012 \n\t\t \n\t \n\t Weingarten, M.S.; Samuels, J.A.; Neidrauer, M.; Mao, X.; Diaz, D.; McGuire, J.; McDaniel, J.; Jenkins, L.; Zubkov, L.; Papazoglou, E.S. Diffuse near-infrared spectroscopy prediction of healing in diabetic foot ulcers: A human study and cost analysis. Wound Repair. Regen. 2012, 20, 911-917. [CrossRef] 110"
    },
    {
      "title": "Evaluation of diabetic foot ulcer healing with hyperspectral imaging of oxyhemoglobin and deoxyhemoglobin",
      "authors": [
        "A Nouvong",
        "B Hoogwerf",
        "E Mohler",
        "B Davis",
        "A Tajaddini",
        "E Medenilla"
      ],
      "year": 2009,
      "doi": "10.2337/dc08-2246",
      "journal": "Diabetes Care",
      "volume": "32",
      "raw": "Evaluation of diabetic foot ulcer healing with hyperspectral imaging of oxyhemoglobin and deoxyhemoglobin \n\t\t \n\t\t\t A Nouvong \n\t\t \n\t\t \n\t\t\t B Hoogwerf \n\t\t \n\t\t \n\t\t\t E Mohler \n\t\t \n\t\t \n\t\t\t B Davis \n\t\t \n\t\t \n\t\t\t A Tajaddini \n\t\t \n\t\t \n\t\t\t E Medenilla \n\t\t \n\t\t 10.2337/dc08-2246 \n\t\t 111 \n\t \n\t \n\t\t Diabetes Care \n\t\t \n\t\t\t 32 \n\t\t\t \n\t\t\t 2009 \n\t\t \n\t \n\t Nouvong, A.; Hoogwerf, B.; Mohler, E.; Davis, B.; Tajaddini, A.; Medenilla, E. Evaluation of diabetic foot ulcer healing with hyperspectral imaging of oxyhemoglobin and deoxyhemoglobin. Diabetes Care 2009, 32, 2056-2061. [CrossRef] 111"
    },
    {
      "title": "The use of medical hyperspectral technology to evaluate microcirculatory changes in diabetic foot ulcers and to predict clinical outcomes",
      "authors": [
        "L Khaodhiar",
        "T Dinh",
        "K Schomacker",
        "S Panasyuk",
        "J Freeman",
        "R Lew",
        "T Vo",
        "A Panasyuk",
        "C Lima",
        "J Giurini"
      ],
      "year": 2007,
      "doi": "10.2337/dc06-2209",
      "journal": "Diabetes Care",
      "volume": "30",
      "raw": "The use of medical hyperspectral technology to evaluate microcirculatory changes in diabetic foot ulcers and to predict clinical outcomes \n\t\t \n\t\t\t L Khaodhiar \n\t\t \n\t\t \n\t\t\t T Dinh \n\t\t \n\t\t \n\t\t\t K T Schomacker \n\t\t \n\t\t \n\t\t\t S V Panasyuk \n\t\t \n\t\t \n\t\t\t J E Freeman \n\t\t \n\t\t \n\t\t\t R Lew \n\t\t \n\t\t \n\t\t\t T Vo \n\t\t \n\t\t \n\t\t\t A A Panasyuk \n\t\t \n\t\t \n\t\t\t C Lima \n\t\t \n\t\t \n\t\t\t J M Giurini \n\t\t \n\t\t 10.2337/dc06-2209 \n\t\t 112 \n\t \n\t \n\t\t Diabetes Care \n\t\t \n\t\t\t 30 \n\t\t\t \n\t\t\t 2007 \n\t\t \n\t \n\t Khaodhiar, L.; Dinh, T.; Schomacker, K.T.; Panasyuk, S.V.; Freeman, J.E.; Lew, R.; Vo, T.; Panasyuk, A.A.; Lima, C.; Giurini, J.M.; et al. The use of medical hyperspectral technology to evaluate microcirculatory changes in diabetic foot ulcers and to predict clinical outcomes. Diabetes Care 2007, 30, 903-910. [CrossRef] [PubMed] 112"
    },
    {
      "title": "Coping and resilience in adolescents with type 1 diabetes",
      "authors": [
        "S Jaser"
      ],
      "year": 2011,
      "doi": "10.1111/j.1365-2214.2010.01184.x",
      "journal": "Child Care Health Dev",
      "volume": "37",
      "raw": "Coping and resilience in adolescents with type 1 diabetes \n\t\t \n\t\t\t S S Jaser \n\t\t \n\t\t \n\t\t\t White \n\t\t \n\t\t 10.1111/j.1365-2214.2010.01184.x \n\t\t 113 \n\t \n\t \n\t\t Child Care Health Dev \n\t\t \n\t\t\t 37 \n\t\t\t \n\t\t\t 2011 \n\t\t \n\t \n\t Jaser, S.S.; White, Coping and resilience in adolescents with type 1 diabetes. Child Care Health Dev. 2011, 37, 335-342. [CrossRef] 113"
    },
    {
      "title": "Implementation of Depression Screening and Global Health Assessment in Pediatric Subspecialty Clinics",
      "authors": [
        "E Iturralde",
        "R Adams",
        "R Barley",
        "R Bensen",
        "M Christofferson",
        "S Hanes",
        "D Maahs",
        "C Milla",
        "D Naranjo",
        "A Shah"
      ],
      "year": 2017,
      "doi": "10.1016/j.jadohealth.2017.05.030",
      "journal": "J. Adolesc. Health",
      "volume": "61",
      "raw": "Implementation of Depression Screening and Global Health Assessment in Pediatric Subspecialty Clinics \n\t\t \n\t\t\t E Iturralde \n\t\t \n\t\t \n\t\t\t R N Adams \n\t\t \n\t\t \n\t\t\t R C Barley \n\t\t \n\t\t \n\t\t\t R Bensen \n\t\t \n\t\t \n\t\t\t M Christofferson \n\t\t \n\t\t \n\t\t\t S J Hanes \n\t\t \n\t\t \n\t\t\t D M Maahs \n\t\t \n\t\t \n\t\t\t C Milla \n\t\t \n\t\t \n\t\t\t D Naranjo \n\t\t \n\t\t \n\t\t\t A C Shah \n\t\t \n\t\t 10.1016/j.jadohealth.2017.05.030 \n\t\t 114 \n\t \n\t \n\t\t J. Adolesc. Health \n\t\t \n\t\t\t 61 \n\t\t\t \n\t\t\t 2017 \n\t\t \n\t \n\t Iturralde, E.; Adams, R.N.; Barley, R.C.; Bensen, R.; Christofferson, M.; Hanes, S.J.; Maahs, D.M.; Milla, C.; Naranjo, D.; Shah, A.C.; et al. Implementation of Depression Screening and Global Health Assessment in Pediatric Subspecialty Clinics. J. Adolesc. Health 2017, 61, 591-598. [CrossRef] 114"
    },
    {
      "title": "Digital Interventions for Psychological Comorbidities in Chronic Diseases-A Systematic Review",
      "authors": [
        "M Maisto",
        "B Diana",
        "S Di Tella",
        "M Matamala-Gomez",
        "J Montana",
        "F Rossetto",
        "P Mavrodiev",
        "C Cavalera",
        "V Blasi",
        "F Mantovani"
      ],
      "year": 2021,
      "doi": "10.3390/jpm11010030",
      "journal": "J. Pers. Med",
      "volume": "11",
      "pages": "30",
      "raw": "Digital Interventions for Psychological Comorbidities in Chronic Diseases-A Systematic Review \n\t\t \n\t\t\t M Maisto \n\t\t \n\t\t \n\t\t\t B Diana \n\t\t \n\t\t \n\t\t\t S Di Tella \n\t\t \n\t\t \n\t\t\t M Matamala-Gomez \n\t\t \n\t\t \n\t\t\t J I Montana \n\t\t \n\t\t \n\t\t\t F Rossetto \n\t\t \n\t\t \n\t\t\t P A Mavrodiev \n\t\t \n\t\t \n\t\t\t C Cavalera \n\t\t \n\t\t \n\t\t\t V Blasi \n\t\t \n\t\t \n\t\t\t F Mantovani \n\t\t \n\t\t 10.3390/jpm11010030 \n\t \n\t \n\t\t J. Pers. Med \n\t\t \n\t\t\t 11 \n\t\t\t 30 \n\t\t\t 2021 \n\t\t \n\t \n\t PubMedDisclaimer/Publisher's Note: The statements, opinions and data contained in all publications are solely those of the individual author(s) and contributor(s) and not of MDPI and/or the editor(s). MDPI and/or the editor(s) disclaim responsibility for any injury to people or property resulting from any ideas, methods, instructions or products referred to in the content \n\t Maisto, M.; Diana, B.; Di Tella, S.; Matamala-Gomez, M.; Montana, J.I.; Rossetto, F.; Mavrodiev, P.A.; Cavalera, C.; Blasi, V.; Mantovani, F.; et al. Digital Interventions for Psychological Comorbidities in Chronic Diseases-A Systematic Review. J. Pers. Med. 2021, 11, 30. [CrossRef] PubMedDisclaimer/Publisher's Note: The statements, opinions and data contained in all publications are solely those of the individual author(s) and contributor(s) and not of MDPI and/or the editor(s). MDPI and/or the editor(s) disclaim responsibility for any injury to people or property resulting from any ideas, methods, instructions or products referred to in the content."
    }
  ],
  "num_references": 115,
  "figures": [
    {
      "caption": "Figure 1 .",
      "description": "Figure1. Conceptual framework of a digital virtual diabetes clinic. The figure illustrates the conceptual framework of a digital, virtual diabetes clinic, highlighting the integration of innovative digital health technologies for effective and efficient diabetes management. Through at-home blood glucose monitoring, telemedicine consultations, and personalized digital interventions, the digital virtual clinic offers a comprehensive approach to diabetes management, enhancing patient engagement and clinical outcomes."
    },
    {
      "caption": "Author",
      "description": "Contributions: Conceptualization, L.L. and M.I.M.; methodology, E.M. and G.A.; data curation, E.M., G.A. and G.M.; writing-original draft preparation, E.M., G.A., G.M., P.C., M.L., E.R.,"
    }
  ],
  "num_figures": 2,
  "license": "\u00a9 2025 by the authors. Licensee MDPI, Basel, Switzerland. This article is an open access article distributed under the terms and conditions of the Creative Commons Attribution (CC BY) license (https://creativecommons.org/ licenses/by/4.0/).",
  "license_type": "unknown",
  "num_citations": 137,
  "cited_references": [
    "b43",
    "b39",
    "b14",
    "b41",
    "b51",
    "b76",
    "b83",
    "b27",
    "b33",
    "b66",
    "b49",
    "b16",
    "b57",
    "b94",
    "b30",
    "b71",
    "b45",
    "b17",
    "b53",
    "b84",
    "b95",
    "b26",
    "b86",
    "b79",
    "b78",
    "b13",
    "b93",
    "b62",
    "b73",
    "b46",
    "b23",
    "b52",
    "b35",
    "b31",
    "b58",
    "b10",
    "b68",
    "b64",
    "b56",
    "b75",
    "b36",
    "b96",
    "b25",
    "b54",
    "b59",
    "b32",
    "b92",
    "b67",
    "b77",
    "b55",
    "b28",
    "b97",
    "b61",
    "b80",
    "b70",
    "b91",
    "b99",
    "b29",
    "b6",
    "b18",
    "b9",
    "b3",
    "b5",
    "b8",
    "b15",
    "b11",
    "b37",
    "b98",
    "b22",
    "b2",
    "b72",
    "b82",
    "b38",
    "b4",
    "b24",
    "b40",
    "b7",
    "b19",
    "b63",
    "b42",
    "b69",
    "b1",
    "b90",
    "b87",
    "b34",
    "b12",
    "b60",
    "b81",
    "b85",
    "b65",
    "b0",
    "b21",
    "b50",
    "b44",
    "b74"
  ],
  "notes": [
    "[raw_affiliation] 2  Department of Advanced Medical and Surgical Sciences , University of Campania \"Luigi Vanvitelli\" , 80138 Naples , Italy;",
    "[raw_affiliation] 3  Department of Advanced Medical and Surgical Sciences , Division of Endocrinology and Metabolic Diseases , University of Campania \"Luigi Vanvitelli\" , 80138 Naples , Italy;",
    "[raw_affiliation] 4  Department of Brain Sciences , Imperial College London , London W120BZ , UK",
    "[raw_affiliation] 5  Dermatology Unit , Department of Mental and Physical Health and Preventive Medicine , University of Campania \"Luigi Vanvitelli\" , 80138 Naples , Italy;",
    "[raw_affiliation] 3  Department of Advanced Medical and Surgical Sciences , Division of Endocrinology and Metabolic Diseases , University of Campania \"Luigi Vanvitelli\" , 80138 Naples , Italy;",
    "[raw_affiliation] 3  Department of Advanced Medical and Surgical Sciences , Division of Endocrinology and Metabolic Diseases , University of Campania \"Luigi Vanvitelli\" , 80138 Naples , Italy;",
    "[raw_affiliation] Pediatric Neurology , Santobono-Pausilipon Childrens Hospital , 80129 Naples , Italy",
    "[submission] Received: 28 April 2025 Revised: 5 June 2025 Accepted: 11 June 2025",
    "[raw_reference] GBD 2021 Diabetes Collaborators. Global, regional, and national burden of diabetes from 1990 to 2021, with projections of prevalence to 2050: A systematic analysis for the Global Burden of Disease Study 2021. Lancet 2023, 402, 203-234. [CrossRef] [PubMed]",
    "[raw_reference] Davies, M.J.; Aroda, V.R.; Collins, B.S.; Gabbay, R.A.; Green, J.; Maruthur, N.M.; Rosas, S.E.; Del Prato, S.; Mathieu, C.; Mingrone, G.; et al. Management of Hyperglycemia in Type 2 Diabetes, 2022. A Consensus Report by the American Diabetes Association (ADA) and the European Association for the Study of Diabetes (EASD). Diabetes Care 2022, 45, 2753-2786. [CrossRef]",
    "[raw_reference] Giugliano, D.; Maiorino, M.I.; Bellastella, G.; Esposito, K. Clinical inertia, reverse clinical inertia, and medication non-adherence in type 2 diabetes. J. Endocrinol. Invest. 2019, 42, 495-503. [CrossRef]",
    "[raw_reference] Rodriguez-Gutierrez, R.; Gionfriddo, M.R.; Ospina, N.S.; Maraka, S.; Tamhane, S.; Montori, V.M.; Brito, J.P. Shared decision making in endocrinology: Present and future directions. Lancet Diabetes Endocrinol. 2016, 4, 706-716. [CrossRef] [PubMed]",
    "[raw_reference] Phillip, M.; Bergenstal, R.M.; Close, K.L.; Danne, T.; Garg, S.K.; Heinemann, L.; Hirsch, I.B.; Kovatchev, B.P.; Laffel, L.M.; Mohan, V.; et al. The Digital/Virtual Diabetes Clinic: The Future Is Now-Recommendations from an International Panel on Diabetes Digital Technologies Introduction. Diabetes Technol. Ther. 2021, 23, 146-154. [CrossRef]",
    "[raw_reference] Peyrot, M.; Rubin, R.R.; Lauritzen, T.; Snoek, F.J.; Matthews, D.R.; Skovlund, S.E. Psychosocial problems and barriers to improved diabetes management: Results of the Cross-National Diabetes Attitudes, Wishes and Needs (DAWN) Study. Diabet. Med. 2005, 22, 1379-1385. [CrossRef]",
    "[raw_reference] Peyrot, M.; Rubin, R.R.; Lauritzen, T.; Snoek, F.J.; Matthews, D.R.; Skovlund, S.E. Diabetes Attitudes Wishes and Needs 2 (DAWN2): A multinational, multi-stakeholder study of psychosocial issues in diabetes and person-centred diabetes care. Diabetes Res. Clin. Pract. 2013, 99, 174-184. [CrossRef] [PubMed]",
    "[raw_reference] Raposo, J.F.; Shestakova, M.V.; Lu, J.; Court, E.; Mayorov, A.Y. Identifying the unmet needs of individuals with Type 2 diabetes: An international web-based survey. J. Comp. Eff. Res. 2021, 10, 613-624. [CrossRef]",
    "[raw_reference] Wannheden, C.; \u00c5berg-Wennerholm, M.; Dahlberg, M.; Reven\u00e4s, \u00c5.; Tolf, S.; Eftimovska, E.; Brommels, M. Digital Health Technologies Enabling Partnerships in Chronic Care Management: Scoping Review. J. Med. Internet Res. 2022, 24, e38980. [CrossRef]",
    "[raw_reference] Telling and gpTRAC (Great Plains Tele-health Resource & Assistance Center). Tele-health Start-Up and Resource Guide, Version 1.1, October 2010. Available online: https://www.healthit.gov/sites/default/files/playbook/pdf/telehealth-startup- and-resource-guide.pdf (accessed on 10 April 2025).",
    "[raw_reference] Ministero della Salute. Telemedicina Linee di Indirizzo Nazionali. Available online: https://www.salute.gov.it/new/it/tema/ telemedicina/linee-di-indirizzo-nazionali-sulla-telemedicina/ (accessed on 10 April 2025).",
    "[raw_reference] Eberle, C.; Stichling, S. Clinical Improvements by Telemedicine Interventions Managing Type 1 and Type 2 Diabetes: Systematic Meta-review. J. Med. Internet Res. 2021, 23, e23244. [CrossRef]",
    "[raw_reference] Macdonald, E.M.; Perrin, B.M.; Kingsley, M.I. Enablers and barriers to using two-way information technology in the management of adults with diabetes: A descriptive systematic review. J. Telemed. Telecare. 2018, 24, 319-340. [CrossRef]",
    "[raw_reference] Tchero, H.; Kangambega, P.; Briatte, C.; Brunet-Houdard, S.; Retali, G.R.; Rusch, E. Clinical Effectiveness of Telemedicine in Diabetes Mellitus: A Meta-Analysis of 42 Randomized Controlled Trials. Telemed. J. E Health 2019, 25, 569-583. [CrossRef]",
    "[raw_reference] Lee, J.Y.; Lee, S.W.H. Telemedicine Cost-Effectiveness for Diabetes Management: A Systematic Review. Diabetes Technol. Ther. 2018, 20, 492-500. [CrossRef] [PubMed]",
    "[raw_reference] Darkins, A.; Ryan, P.; Kobb, R.; Foster, L.; Edmonson, E.; Wakefield, B.; Lancaster, A.E. Care Coordination/Home Telehealth: The systematic implementation of health informatics, home telehealth, and disease management to support the care of veteran patients with chronic conditions. Telemed. J. E Health 2008, 14, 1118-1126. [CrossRef] [PubMed]",
    "[raw_reference] Mars, M. Telemedicine and advances in urban and rural healthcare delivery in Africa. Prog. Cardiovasc. Dis. 2013, 56, 326-335. [CrossRef] [PubMed]",
    "[raw_reference] Danne, T.; Nimri, R.; Battelino, T.; Bergenstal, R.M.; Close, K.L.; DeVries, J.H.; Garg, S.; Heinemann, L.; Hirsch, I.; Amiel, S.A.; et al. International Consensus on Use of Continuous Glucose Monitoring. Diabetes Care 2017, 40, 1631-1640. [CrossRef]",
    "Suppl. S1",
    "[raw_reference] American Diabetes Association Professional Practice Committee. 7. Diabetes Technology: Standards of Care in Diabetes-2024. Diabetes Care 2024, 47 (Suppl. S1), S126-S144. [CrossRef]",
    "[raw_reference] Battelino, T.; Danne, T.; Bergenstal, R.M.; Amiel, S.A.; Beck, R.; Biester, T.; Bosi, E.; Buckingham, B.A.; Cefalu, W.T.; Close, K.L.; et al. Clinical Targets for Continuous Glucose Monitoring Data Interpretation: Recommendations From the International Consensus on Time in Range. Diabetes Care 2019, 42, 1593-1603. [CrossRef]",
    "[raw_reference] Tamborlane, W.V.; Beck, R.W.; Bode, B.W.; Buckingham, B.; Chase, H.P.; Clemons, R.; Fiallo-Scharer, R.; Fox, L.A.; Gilliam, L.K.; Hirsch, I.B.; et al. Continuous Glucose Monitoring Study Group. Continuous glucose monitoring and intensive treatment of type 1 diabetes. N. Engl. J. Med. 2008, 359, 1464-1476.",
    "[raw_reference] Battelino, T.; Phillip, M.; Bratina, N.; Nimri, R.; Oskarsson, P.; Bolinder, J. Effect of continuous glucose monitoring on hypoglycemia in type 1 diabetes. Diabetes Care 2011, 34, 795-800. [CrossRef]",
    "[raw_reference] Battelino, T.; Conget, I.; Olsen, B.; Sch\u00fctz-Fuhrmann, I.; Hommel, E.; Hoogma, R.; Schierloh, U.; Sulli, N.; Bolinder, J.; SWITCH Study Group. The use and efficacy of continuous glucose monitoring in type 1 diabetes treated with insulin pump therapy: A randomised controlled trial. Diabetologia 2012, 55, 3155-3162. [CrossRef] [PubMed]",
    "[raw_reference] Little, S.A.; Leelarathna, L.; Walkinshaw, E.; Tan, H.K.; Chapple, O.; Lubina-Solomon, A.; Chadwick, T.J.; Barendse, S.; Stocken, D.D.; Brennand, C.; et al. Recovery of hypoglycemia awareness in long-standing type 1 diabetes: A multicenter 2 \u00d7 2 factorial randomized controlled trial comparing insulin pump with multiple daily injections and continuous with conventional glucose self-monitoring (HypoCOMPaSS). Diabetes Care 2014, 37, 2114-2122. [CrossRef]",
    "[raw_reference] van Beers, C.A.; DeVries, J.H.; Kleijer, S.J.; Smits, M.M.; Geelhoed-Duijvestijn, P.H.; Kramer, M.H.; Diamant, M.; Snoek, F.J.; Sern\u00e9, E.H. Continuous glucose monitoring for patients with type 1 diabetes and impaired awareness of hypoglycaemia (IN CONTROL): A randomised, open-label, crossover trial. Lancet Diabetes Endocrinol. 2016, 4, 893-902. [CrossRef] [PubMed]",
    "[raw_reference] Beck, R.W.; Riddlesworth, T.; Ruedy, K.; Ahmann, A.; Bergenstal, R.; Haller, S.; Kollman, C.; Kruger, D.; McGill, J.B.; Polonsky, W.; et al. Effect of Continuous Glucose Monitoring on Glycemic Control in Adults With Type 1 Diabetes Using Insulin Injections: The DIAMOND Randomized Clinical Trial. JAMA 2017, 317, 371-378. [CrossRef]",
    "[raw_reference] Beck, R.W.; Riddlesworth, T.D.; Ruedy, K.; Ahmann, A.; Haller, S.; Kruger, D.; McGill, J.B.; Polonsky, W.; Price, D.; Aronoff, S.; et al. Continuous Glucose Monitoring Versus Usual Care in Patients With Type 2 Diabetes Receiving Multiple Daily Insulin Injections: A Randomized Trial. Ann. Intern. Med. 2017, 167, 365-374. [CrossRef] [PubMed]",
    "[raw_reference] Heinemann, L.; Freckmann, G.; Ehrmann, D.; Faber-Heinemann, G.; Guerra, S.; Waldenmaier, D.; Hermanns, N. Real-time continuous glucose monitoring in adults with type 1 diabetes and impaired hypoglycaemia awareness or severe hypoglycaemia treated with multiple daily insulin injections (HypoDE): A multicentre, randomised controlled trial. Lancet 2018, 391, 1367-1377. [CrossRef]",
    "[raw_reference] Pratley, R.E.; Kanapka, L.G.; M.R.; Ahmann, A.; Aleppo, G.; Beck, R.; Bhargava, A.; Bode, B.W.; Carlson, A.; Chaytor, N.S.; et al. Wireless Innovation for Seniors with Diabetes Mellitus (WISDM) Study Group. Effect of Continuous Glucose Monitoring on Hypoglycemia in Older Adults with Type 1 Diabetes: A Randomized Clinical Trial. JAMA 2020, 323, 2397-2406. [CrossRef]",
    "[raw_reference] Martens, T.; Beck, R.W.; Bailey, R.; Ruedy, K.J.; Calhoun, P.; Peters, A.L.; Pop-Busui, R.; Philis-Tsimikas, A.; Bao, S.; Umpierrez, G.; et al. Effect of Continuous Glucose Monitoring on Glycemic Control in Patients with Type 2 Diabetes Treated with Basal Insulin: A Randomized Clinical Trial. JAMA 2021, 325, 2262-2272. [CrossRef]",
    "[raw_reference] Pickup, J.C.; Freeman, S.C.; Sutton, A.J. Glycaemic control in type 1 diabetes during real time continuous glucose monitoring compared with self monitoring of blood glucose: Meta-analysis of randomised controlled trials using individual patient data. BMJ 2011, 343, d3805. [CrossRef]",
    "[raw_reference] Jackson, M.A.; Ahmann, A.; Shah, V.N. Type 2 Diabetes and the Use of Real-Time Continuous Glucose Monitoring. Diabetes Technol Ther. 2021, 23 (S1), S27-S34. [CrossRef]",
    "[raw_reference] Feig, D.S.; Donovan, L.E.; Corcoy, R.; Murphy, K.E.; Amiel, S.A.; Hunt, K.F.; Asztalos, E.; Barrett, J.F.R.; Sanchez, J.J.; de Leiva, A.; et al. Continuous glucose monitoring in pregnant women with type 1 diabetes (CONCEPTT): A multicentre international randomised controlled trial. Lancet 2017, 390, 2347-2359. [CrossRef] [PubMed]",
    "[raw_reference] Leelarathna, L.; Evans, M.L.; Neupane, S.; Rayman, G.; Lumley, S.; Cranston, I.; Narendran, P.; Barnard-Kelly, K.; Sutton, C.J.; Elliott, R.A.; et al. Intermittently Scanned Continuous Glucose Monitoring for Type 1 Diabetes. N. Engl. J. Med. 2022, 387, 1477-1487. [CrossRef]",
    "[raw_reference] Haak, T.; Hanaire, H.; Ajjan, R.; Hermanns, N.; Riveline, J.P.; Rayman, G. Flash Glucose-Sensing Technology as a Replacement for Blood Glucose Monitoring for the Management of Insulin-Treated Type 2 Diabetes: A Multicenter, Open-Label Randomized Controlled Trial. Diabetes Ther. 2017, 8, 55-73. [CrossRef]",
    "[raw_reference] Yaron, M.; Roitman, E.; Aharon-Hananel, G.; Landau, Z.; Ganz, T.; Yanuv, I.; Rozenberg, A.; Karp, M.; Ish-Shalom, M.; Singer, J.; et al. Effect of Flash Glucose Monitoring Technology on Glycemic Control and Treatment Satisfaction in Patients With Type 2 Diabetes. Diabetes Care 2019, 42, 1178-1184. [CrossRef] [PubMed]",
    "[raw_reference] Maddaloni, E.; Coraggio, L.; Pieralice, S.; Carlone, A.; Pozzilli, P.; Buzzetti, R. Effects of COVID-19 Lockdown on Glucose Control: Continuous Glucose Monitoring Data from People with Diabetes on Intensive Insulin Therapy. Diabetes Care 2020, 43, e86-e87. [CrossRef]",
    "[raw_reference] Capaldo, B.; Annuzzi, G.; Creanza, A.; Giglio, C.; De Angelis, R.; Lupoli, R.; Masulli, M.; Riccardi, G.; Rivellese, A.A.; Bozzetto, L. Blood Glucose Control During Lockdown for COVID-19: CGM Metrics in Italian Adults With Type 1 Diabetes. Diabetes Care 2020, 43, e88-e89. [CrossRef] [PubMed]",
    "[raw_reference] Maiorino, M.I.; Signoriello, S.; Maio, A.; Chiodini, P.; Bellastella, G.; Scappaticcio, L.; Longo, M.; Giugliano, D.; Esposito, K. Effects of Continuous Glucose Monitoring on Metrics of Glycemic Control in Diabetes: A Systematic Review With Meta-analysis of Randomized Controlled Trials. Diabetes Care 2020, 43, 1146-1156. [CrossRef]",
    "[raw_reference] Maiorino, M.I.; Buzzetti, R.; Irace, C.; Laviola, L.; Napoli, N.; Pitocco, D.; Esposito, K. LIVE CGM working group. An. updated algorithm for an effective choice of continuous glucose monitoring for people with insulin-treated diabetes. Endocrine 2023, 82, 215-225. [CrossRef]",
    "[raw_reference] Adolfsson, P.; Hartvig, N.V.; Kaas, A.; M\u00f8ller, J.B.; Hellman, J. Increased Time in Range and Fewer Missed Bolus Injections After Introduction of a Smart Connected Insulin Pen. Diabetes Technol. Ther. 2020, 22, 709-718. [CrossRef]",
    "[raw_reference] Edwards, S.; He, X.; Wang, W.; Poon, J.L.; Meadows, E.; Price, D.; Johnson, J.; Wolpert, H.; Polonsky, W. Use of Connected Pen as a Diagnostic Tool to Evaluate Missed Bolus Dosing Behavior in People with Type 1 and Type 2 Diabetes. Diabetes Technol. Ther. 2022, 24, 61-66. [CrossRef]",
    "[raw_reference] Jendle, J.; Ericsson, \u00c5.; Gundgaard, J.; M\u00f8ller, J.B.; Valentine, W.J.; Hunt, B. Smart Insulin Pens are Associated with Improved Clinical Outcomes at Lower Cost Versus Standard-of-Care Treatment of Type 1 Diabetes in Sweden: A Cost-Effectiveness Analysis. Diabetes Ther. 2021, 12, 373-388. [CrossRef] [PubMed]",
    "[raw_reference] Chien, A.; Thanasekaran, S.; Gaetano, A.; Im, G.; Wherry, K.; MacLeod, J.; Vigersky, R.A. Potential cost savings in the United States from a reduction in sensor-detected severe hypoglycemia among users of the InPen smart insulin pen system. J. Manag. Care Spec. Pharm. 2023, 29, 285-292. [CrossRef] [PubMed]",
    "[raw_reference] Bergenstal, R.M.; Klonoff, D.C.; Garg, S.K.; Bode, B.W.; Meredith, M.; Slover, R.H.; Ahmann, A.J.; Welsh, J.B.; Lee, S.W.; Kaufman, F.R. ASPIRE In-Home Study Group. Threshold-based insulin-pump interruption for reduction of hypoglycemia. N. Engl. J. Med. 2013, 369, 224-232. [CrossRef]",
    "[raw_reference] Forlenza, G.P.; Li, Z.; Buckingham, B.A.; Pinsker, J.E.; Cengiz, E.; Wadwa, R.P.; Ekhlaspour, L.; Church, M.M.; Weinzimer, S.A.; Jost, E.; et al. Predictive Low-Glucose Suspend Reduces Hypoglycemia in Adults, Adolescents, and Children with Type 1 Diabetes in an At-Home Randomized Crossover Study: Results of the PROLOG Trial. Diabetes Care 2018, 41, 2155-2161. [CrossRef]",
    "[raw_reference] Bergenstal, R.M.; Garg, S.; Weinzimer, S.A.; Buckingham, B.A.; Bode, B.W.; Tamborlane, W.V.; Kaufman, F.R. Safety of a Hybrid Closed-Loop Insulin Delivery System in Patients with Type 1 Diabetes. JAMA 2016, 316, 1407-1408.",
    "[raw_reference] CrossRef",
    "[raw_reference] Tauschmann, M.; Thabit, H.; Bally, L.; Allen, J.M.; Hartnell, S.; Wilinska, M.E.; Ruan, Y.; Sibayan, J.; Kollman, C.; Cheng, P.; et al. APCam11 Consortium. Closed-loop insulin delivery in suboptimally controlled type 1 diabetes: A multicentre, 12-week randomised trial. Lancet 2018, 392, 1321-1329. [CrossRef]",
    "[raw_reference] Breton, M.D.; Kanapka, L.G.; Beck, R.W.; Ekhlaspour, L.; Forlenza, G.P.; Cengiz, E.; Schoelwer, M.; Ruedy, K.J.; Jost, E.; Carria, L.; et al. A Randomized Trial of Closed-Loop Control in Children with Type 1 Diabetes. N. Engl. J. Med. 2020, 383, 836-845. [CrossRef]",
    "[raw_reference] Ware, J.; Allen, J.M.; Boughton, C.K.; Wilinska, M.E.; Hartnell, S.; Thankamony, A.; de Beaufort, C.; Schierloh, U.; Fr\u00f6hlich-Reiterer, E.; Mader, J.K.; et al. Randomized Trial of Closed-Loop Control in Very Young Children with Type 1 Diabetes. N. Engl. J. Med. 2022, 386, 209-219. [CrossRef] [PubMed]",
    "[raw_reference] Weisman, A.; Bai, J.W.; Cardinez, M.; Kramer, C.K.; Perkins, B.A. Effect of artificial pancreas systems on glycaemic control in patients with type 1 diabetes: A systematic review and meta-analysis of outpatient randomised controlled trials. Lancet Diabetes Endocrinol. 2017, 5, 501-512. [CrossRef]",
    "[raw_reference] Bekiari, E.; Kitsios, K.; Thabit, H.; Tauschmann, M.; Athanasiadou, E.; Karagiannis, T.; Haidich, A.B.; Hovorka, R.; Tsapas, A. Artificial pancreas treatment for outpatients with type 1 diabetes: Systematic review and meta-analysis. BMJ 2018, 361, k1310. [CrossRef]",
    "[raw_reference] Sherr, J.L.; Heinemann, L.; Fleming, G.A.; Bergenstal, R.M.; Bruttomesso, D.; Hanaire, H.; Holl, R.W.; Petrie, J.R.; Peters, A.L.; Evans, M. Automated insulin delivery: Benefits, challenges, and recommendations. A Consensus Report of the Joint Diabetes Technology Working Group of the European Association for the Study of Diabetes and the American Diabetes Association. Diabetologia 2023, 66, 3-22. [CrossRef] [PubMed]",
    "[raw_reference] Bergenstal, R.M.; Johnson, M.; Powers, M.A.; Wynne, A.; Vlajnic, A.; Hollander, P.; Rendell, M. Adjust to target in type 2 diabetes: Comparison of a simple algorithm with carbohydrate counting for adjustment of mealtime insulin glulisine. Diabetes Care 2008, 31, 1305-1310. [CrossRef]",
    "[raw_reference] Conroy, D.E.; Yang, C.H.; Maher, J.P. Behavior change techniques in top-ranked mobile apps for physical activity. Am. J. Prev. Med. 2014, 46, 649-652. [CrossRef]",
    "[raw_reference] Goyal, S.; Nunn, C.A.; Rotondi, M.; Couperthwaite, A.B.; Reiser, S.; Simone, A.; Katzman, D.K.; Cafazzo, J.A.; Palmert, M.R. A Mobile App for the Self-Management of Type 1 Diabetes Among Adolescents: A Randomized Controlled Trial. JMIR Mhealth Uhealth 2017, 5, e82. [CrossRef] [PubMed]",
    "[raw_reference] Crossen, S.; Romero, C.; Reggiardo, A.; Michel, J.; Glaser, N. Feasibility and Impact of Remote Glucose Monitoring Among Patients With Newly Diagnosed Type 1 Diabetes: Single-Center Pilot Study. JMIR Diabetes 2022, 7, e33639. [CrossRef]",
    "[raw_reference] Grady, M.; Katz, L.B.; Cameron, H.; Levy, B.L. Diabetes App-Related Text Messages From Health Care Professionals in Conjunction With a New Wireless Glucose Meter With a Color Range Indicator Improves Glycemic Control in Patients With Type 1 and Type 2 Diabetes: Randomized Controlled Trial. JMIR Diabetes 2017, 2, e19. [CrossRef]",
    "[raw_reference] Hou, C.; Xu, Q.; Diao, S.; Hewitt, J.; Li, J.; Carter, B. Mobile phone applications and self-management of diabetes: A systematic review with meta-analysis, meta-regression of 21 randomized trials and GRADE. Diabetes Obes. Metab. 2018, 20, 2009-2013. [CrossRef]",
    "[raw_reference] Lim, S.L.; Ong, K.W.; Johal, J.; Han, C.Y.; Yap, Q.V.; Chan, Y.H.; Chooi, Y.C.; Zhang, Z.P.; Chandra, C.C.; Thiagarajah, A.G.; et al. Effect of a Smartphone App on Weight Change and Metabolic Outcomes in Asian Adults with Type 2 Diabetes: A Randomized Clinical Trial. JAMA Netw Open 2021, 4, e2112417. [CrossRef] [PubMed]",
    "[raw_reference] Lee, E.Y.; Cha, S.A.; Yun, J.S.; Lim, S.Y.; Lee, J.H.; Ahn, Y.B.; Yoon, K.H.; Hyun, M.K.; Ko, S.H. Efficacy of Personalized Diabetes Self-care Using an Electronic Medical Record-Integrated Mobile App in Patients with Type 2 Diabetes: 6-Month Randomized Controlled Trial. J. Med. Internet Res. 2022, 24, e37430. [CrossRef]",
    "[raw_reference] Eberle, C.; Loehnert, M.; Stichling, S. Effectivness of specific mobile health applications (mHealth-apps) in gestational diabtetes mellitus: A systematic review. BMC Pregnancy Childbirth 2021, 21, 808. [CrossRef]",
    "[raw_reference] Hou, C.; Carter, B.; Hewitt, J.; Francisa, T.; Mayor, S. Do Mobile Phone Applications Improve Glycemic Control (HbA1c) in the Self-management of Diabetes? A Systematic Review, Meta-analysis, and GRADE of 14 Randomized Trials. Diabetes Care 2016, 39, 2089-2095. [CrossRef] [PubMed]",
    "[raw_reference] Chong, C.J.; Bakry, M.M.; Hatah, E.; Mohd Tahir, N.A.; Mustafa, N. Effects of mobile apps intervention on medication adherence and type 2 diabetes mellitus control: A systematic review and meta-analysis. J. Telemed. Telecare 2023, 1357633X231174933. [CrossRef]",
    "[raw_reference] Fleming, G.A.; Petrie, J.R.; Bergenstal, R.M.; Holl, R.W.; Peters, A.L.; Heinemann, L. Diabetes Digital App Technology: Benefits, Challenges, and Recommendations. A Consensus Report by the European Association for the Study of Diabetes (EASD) and the American Diabetes Association (ADA) Diabetes Technology Working Group. Diabetes Care 2020, 43, 250-260. [CrossRef]",
    "[raw_reference] Zhou, P.; Xu, L.; Liu, X.; Huang, J.; Xu, W.; Chen, W. Web-based telemedicine for management of type 2 diabetes through glucose uploads: A randomized controlled trial. Int. J. Clin. Exp. Pathol. 2014, 7, 8848-8854.",
    "[raw_reference] Moattari, M.; Hashemi, Dabbaghmanesh, M.H. The impact of electronic education on metabolic control indicators in patients with diabetes who need insulin: A randomised clinical control trial. J. Clin. Nurs. 2013, 22, 32-38. [CrossRef]",
    "[raw_reference] Pacaud, D.; Kelley, H.; Downey, A.M.; Chiasson, M. Successful Delivery of Diabetes Self-Care Education and Follow-Up through eHealth Media. Can. J. Diab. 2012, 36, 257-262. [CrossRef]",
    "[raw_reference] Cai, J.; Xu, H.; Jiang, S.; Sung, J.; Sawhney, R.; Broadley, S.; Sun, J. Effectiveness of telemonitoring intervention on glycaemic control in patients with type 2 diabetes mellitus: A systematic review and meta-analysis. Diabetes Res. Clin. Pract. 2023, 201, 110727. [CrossRef] [PubMed]",
    "[raw_reference] Nicolucci, A.; Cercone, S.; Chiriatti, A.; Muscas, F.; Gensini, G. A Randomized Trial on Home Telemonitoring for the Management of Metabolic and Cardiovascular Risk in Patients with Type 2 Diabetes. Diabetes Technol. Ther. 2015, 17, 563-570. [CrossRef]",
    "[raw_reference] Franc, S.; Hanaire, H.; Benhamou, P.Y.; Schaepelynck, P.; Catargi, B.; Farret, A.; Fontaine, P.; Guerci, B.; Reznik, Y.; Jeandi- dier, N.; et al. DIABEO System Combining a Mobile App Software with and Without Telemonitoring Versus Standard Care: A Randomized Controlled Trial in Diabetes Patients Poorly Controlled with a Basal-Bolus Insulin Regimen. Diabetes Technol. Ther. 2020, 22, 904-911. [CrossRef]",
    "[raw_reference] Wild, S.H.; Hanley, J.; Lewis, S.C.; McKnight, J.A.; McCloughan, L.B.; Padfield, P.L.; Parker, R.A.; Paterson, M.; Pinnock, H.; Sheikh, A.; et al. Supported Telemonitoring and Glycemic Control in People with Type 2 Diabetes: The Telescot Diabetes Pragmatic Multicenter Randomized Controlled Trial. PLoS Med. 2016, 13, e1002098.",
    "[raw_reference] Andr\u00e8s, E.; Talha, S.; Hajjam, M.; Hajjam, J.; Erv\u00e9, S.; Hajjam, A. Experimentation of 2.0 telemedicine in elderly patients with chronic heart failure: A study prospective in 175 patients. Eur. J. Intern. Med. 2018, 51, e11-e12. [CrossRef] [PubMed]",
    "[raw_reference] Kaufman, F.R.; Halvorson, M.; Carpenter, S. Association between diabetes control and visits to a multidisciplinary pediatric diabetes clinic. Pediatrics 1999, 103, 948-951. [CrossRef]",
    "[raw_reference] Kassar, K.; Roe, C.; Desimone, M. Use of Telemedicine for Management of Diabetes in Correctional Facilities. Telemed. J. E Health 2017, 23, 55-59. [CrossRef] [PubMed]",
    "[raw_reference] Tonyushkina, K.N.; Cobb, V.; Moskovitz, A.; Allen, H.F. Televisits to Partially Substitute for Clinic Visits Are Feasible and Well Accepted by Tech-Savvy Patients With T1DM and Their Families: A Prospective Pilot Study. J. Diabetes Sci. Technol. 2018, 12, 1084-1085. [CrossRef]",
    "[raw_reference] Greenfield, M.; Stuber, D.; Stegman-Barber, D.; Kemmis, K.; Matthews, B.; Feuerstein-Simon, C.B.; Saha, P.; Wells, B.; McArthur, T.; Morley, C.P.; et al. Diabetes Education and Support Tele-Visit Needs Differ in Duration, Content, and Satisfaction in Older Versus Younger Adults. Telemed. Rep. 2022, 3, 107-116. [CrossRef] [PubMed]",
    "CrossRef",
    "[raw_reference] Pintaudi, B.; Garavaglia, G.; Disoteo, O.E.; Meneghini, E.; Epis, O.M.; Colombo, F.; Bertuzzi, F. First televisits provided by the public health system for patients affected by diabetes mellitus in COVID-19 pandemic. Diabetes Res. Clin. Pract. 2021, 173, 108697. [CrossRef]",
    "[raw_reference] Scott, S.N.; Fontana, F.Y.; Helleputte, S.; Pickles, J.; Laimer, M.; Zueger, T.; Stettler, C. Use and Perception of Telemedicine in People with Type 1 Diabetes During the COVID-19 Pandemic: A 1-Year Follow-Up. Diabetes Technol Ther. 2022, 24, 276-280. [CrossRef]",
    "[raw_reference] Iglay, K.; Hannachi, H.; Joseph Howie, P.; Xu, J.; Li, X.; Engel, S.S.; Moore, L.M.; Rajpathak, S. Prevalence and co-prevalence of comorbidities among patients with type 2 diabetes mellitus. Curr. Med. Res. Opin. 2016, 2, 1243-1252. [CrossRef]",
    "[raw_reference] Su, D.; Zhou, J.; Kelley, M.S.; Michaud, T.L.; Siahpush, M.; Kim, J.; Wilson, F.; Stimpson, J.P.; Pag\u00e1n, J.A. Does telemedicine improve treatment outcomes for diabetes? A meta-analysis of results from 55 randomized controlled trials. Diabetes Res. Clin. Pract. 2016, 116, 136-148. [CrossRef]",
    "[raw_reference] Cheng, P.C.; Kao, C.H. Telemedicine assists in the management of proatherogenic dyslipidemia and postprandial glucose variability in patients with type 2 diabetes mellitus: A cross-sectional study. Endocr. Connect. 2021, 10, 789-795. [CrossRef]",
    "[raw_reference] Yatabe, J.; Yatabe, M.S.; Okada, R.; Ichihara, A. Efficacy of Telemedicine in Hypertension Care Through Home Blood Pressure Monitoring and Videoconferencing: Randomized Controlled Trial. JMIR Cardio. 2021, 5, e27347. [CrossRef] [PubMed]",
    "[raw_reference] Salisbury, C.; O'Cathain, A.; Thomas, C.; Edwards, L.; Gaunt, D.; Dixon, P.; Hollinghurst, S.; Nicholl, J.; Large, S.; Yardley, L.; et al. Telehealth for patients at high risk of cardiovascular disease: Pragmatic randomised controlled trial. BMJ 2016, 353, i2647. [CrossRef] [PubMed]",
    "[raw_reference] Lieber, B.A.; Taylor, B.; Appelboom, G.; Prasad, K.; Bruce, S.; Yang, A.; Bruce, E.; Christophe, B.; Connolly, E.S., Jr. Meta-analysis of telemonitoring to improve HbA1c levels: Promise for stroke survivors. J. Clin. Neurosci. 2015, 22, 807-811. [CrossRef]",
    "[raw_reference] Rasmussen, B.S.; Froekjaer, J.; Bjerregaard, M.R.; Lauritsen, J.; Hangaard, J.; Henriksen, C.W.; Halekoh, U.; Yderstraede, K.B. A Randomized Controlled Trial Comparing Telemedical and Standard Outpatient Monitoring of Diabetic Foot Ulcers. Diabetes Care 2015, 38, 1723-1729. [CrossRef]",
    "[raw_reference] Smith-Str\u00f8m, H.; Igland, J.; \u00d8stbye, T.; Tell, G.S.; Hausken, M.F.; Graue, M.; Skeie, S.; Cooper, J.G.; Iversen, M.M. The Effect of Telemedicine Follow-up Care on Diabetes-Related Foot Ulcers: A Cluster-Randomized Controlled Noninferiority Trial. Diabetes Care 2018, 41, 96-103.",
    "[raw_reference] CrossRef",
    "[raw_reference] Iversen, M.M.; Igland, J.; Smith-Str\u00f8m, H.; \u00d8stbye, T.; Tell, G.S.; Skeie, S.; Cooper, J.G.; Peyrot, M.; Graue, M. Effect of a telemedicine intervention for diabetes-related foot ulcers on health, well-being and quality of life: Secondary outcomes from a cluster randomized controlled trial (DiaFOTo). BMC Endocr. Disord. 2020, 20, 157. [CrossRef] [PubMed]",
    "[raw_reference] Wilbright, W.A.; Birke, J.A.; Patout, C.A.; Varnado, M.; Horswell, R. The use of telemedicine in the management of diabetes-related foot ulceration: A pilot study. Adv. Skin Wound Care 2004, 17, 232-238. [CrossRef]",
    "Suppl. S2",
    "[raw_reference] Kim, H.M.; Lowery, J.C.; Hamill, J.B.; Wilkins, E.G. Patient attitudes toward a Web-based system for monitoring chronic wounds. Telemed. J. E Health 2004, 10 (Suppl. S2), S-26-34. [CrossRef]",
    "[raw_reference] Bowling, F.L.; King, L.; Fadavi, H.; Paterson, J.A.; Preece, K.; Daniel, R.W.; Matthews, D.J.; Boulton, A.J. An assessment of the accuracy and usability of a novel optical wound measurement system. Diabet. Med. 2009, 26, 93-96. [CrossRef]",
    "[raw_reference] Ladyzynski, P.; Foltynski, P.; Molik, M.; Tarwacka, J.; Migalska-Musial, K.; Mlynarczuk, M.; Wojcicki, J.M.; Krzymien, J.; Karnafel, W. Area of the diabetic ulcers estimated applying a foot scanner-based home telecare system and three reference methods. Diabetes Technol. Ther. 2011, 13, 1101-1107. [CrossRef]",
    "[raw_reference] Bowling, F.L.; King, L.; Paterson, J.A.; Hu, J.; Lipsky, B.A.; Matthews, D.R.; Boulton, A.J. Remote assessment of diabetic foot ulcers using a novel wound imaging system. Wound Repair. Regen. 2011, 19, 25-30. [CrossRef] [PubMed]",
    "[raw_reference] Rajbhandari, S.M.; Harris, N.D.; Sutton, M.; Lockett, C.; Eaton, S.; Gadour, M.; Tesfaye, S.; Ward, J.D. Digital imaging: An accurate and easy method of measuring foot ulcers. Diabet. Med. 1999, 16, 339-342. [CrossRef]",
    "[raw_reference] Hazenberg, C.E.; van Netten, J.J.; van Baal, S.G.; Bus, S.A. Assessment of signs of foot infection in diabetes patients using photographic foot imaging and infrared thermography. Diabetes Technol. Ther. 2014, 16, 370-377. [CrossRef] [PubMed]",
    "[raw_reference] Armstrong, D.G.; Holtz-Neiderer, K.; Wendel, C.; Mohler, M.J.; Kimbriel, H.R.; Lavery, L.A. Skin temperature monitoring reduces the risk for diabetic foot ulceration in high-risk patients. Am. J. Med. 2007, 120, 1042-1046. [CrossRef]",
    "[raw_reference] Lavery, L.A.; Higgins, K.R.; Lanctot, D.R.; Constantinides, G.P.; Zamorano, R.G.; Armstrong, D.G.; Athanasiou, K.A.; Agrawal, C.M. Home monitoring of foot skin temperatures to prevent ulceration. Diabetes Care 2004, 27, 2642-2647. [CrossRef] [PubMed]",
    "[raw_reference] Lavery, L.A.; Higgins, K.R.; Lanctot, D.R.; Constantinides, G.P.; Zamorano, R.G.; Athanasiou, K.A.; Armstrong, D.G.; Agrawal, C.M. Preventing diabetic foot ulcer recurrence in high-risk patients: Use of temperature monitoring as a self-assessment tool. Diabetes Care 2007, 30, 14-20. [CrossRef] 100",
    "[raw_reference] Skafjeld, A.; Iversen, M.M.; Holme, I.; Ribu, L.; Hvaal, K.; Kilhovd, B.K. A pilot study testing the feasibility of skin temperature monitoring to reduce recurrent foot ulcers in patients with diabetes--a randomized controlled trial. BMC Endocr. Disord. 2015, 15, 55. [CrossRef] 101",
    "[raw_reference] Stess, R.M.; Sisney, P.C.; Moss, K.M.; Graf, P.M.; Louie, K.S.; Gooding, G.A.; Grunfeld, C. Use of liquid crystal thermography in the evaluation of the diabetic foot. Diabetes Care 1986, 9, 267-272. [CrossRef] 102",
    "[raw_reference] Benbow, S.J.; Chan, A.W.; Bowsher, D.R.; Williams, G.; Macfarlane, I.A. The prediction of diabetic neuropathic plantar foot ulceration by liquid-crystal contact thermography. Diabetes Care 1994, 17, 835-839. [CrossRef] 103",
    "[raw_reference] Roback, K.; Johansson, M.; Starkhammar, A. Feasibility of a thermographic method for early detection of foot disorders in diabetes. Diabetes Technol. Ther. 2009, 11, 663-667. [CrossRef] 104",
    "[raw_reference] Frykberg, R.G.; Gordon, I.L.; Reyzelman, A.M.; Cazzell, S.M.; Fitzgerald, R.H.; Rothenberg, G.M.; Bloom, J.D.; Petersen, B.J.; Linders, D.R.; Nouvong, A.; et al. Feasibility and Efficacy of a Smart Mat Technology to Predict Development of Diabetic Plantar Ulcers. Diabetes Care 2017, 40, 973-980. [CrossRef] [PubMed] 105",
    "[raw_reference] Rajbhandari, S.M.; Harris, N.D.; Tesfaye, S.; Ward, J.D. Early identification of diabetic foot ulcers that may require intervention using the micro lightguide spectrophotometer. Diabetes Care 1999, 22, 1292-1295. [CrossRef] [PubMed] 106",
    "[raw_reference] Papazoglou, E.S.; Neidrauer, M.; Zubkov, L.; Weingarten, M.S.; Pourrezaei, K. Noninvasive assessment of diabetic foot ulcers with diffuse photon density wave methodology: Pilot human study. J. Biomed. Opt. 2009, 14, 064032. [CrossRef] 107",
    "[raw_reference] Neidrauer, M.; Zubkov, L.; Weingarten, M.S.; Pourrezaei, K.; Papazoglou, E.S. Near infrared wound monitor helps clinical assessment of diabetic foot ulcers. J. Diabetes Sci. Technol. 2010, 4, 792-798. [CrossRef] 108",
    "[raw_reference] Weingarten, M.S.; Neidrauer, M.; Mateo, A.; Mao, X.; McDaniel, J.E.; Jenkins, L.; Bouraee, S.; Zubkov, L.; Pourrezaei, K.; Papazoglou, E.S. Prediction of wound healing in human diabetic foot ulcers by diffuse near-infrared spectroscopy: A pilot study. Wound Repair. Regen. 2010, 18, 180-185. [CrossRef] 109",
    "[raw_reference] Weingarten, M.S.; Samuels, J.A.; Neidrauer, M.; Mao, X.; Diaz, D.; McGuire, J.; McDaniel, J.; Jenkins, L.; Zubkov, L.; Papazoglou, E.S. Diffuse near-infrared spectroscopy prediction of healing in diabetic foot ulcers: A human study and cost analysis. Wound Repair. Regen. 2012, 20, 911-917. [CrossRef] 110",
    "[raw_reference] Nouvong, A.; Hoogwerf, B.; Mohler, E.; Davis, B.; Tajaddini, A.; Medenilla, E. Evaluation of diabetic foot ulcer healing with hyperspectral imaging of oxyhemoglobin and deoxyhemoglobin. Diabetes Care 2009, 32, 2056-2061. [CrossRef] 111",
    "[raw_reference] Khaodhiar, L.; Dinh, T.; Schomacker, K.T.; Panasyuk, S.V.; Freeman, J.E.; Lew, R.; Vo, T.; Panasyuk, A.A.; Lima, C.; Giurini, J.M.; et al. The use of medical hyperspectral technology to evaluate microcirculatory changes in diabetic foot ulcers and to predict clinical outcomes. Diabetes Care 2007, 30, 903-910. [CrossRef] [PubMed] 112",
    "[raw_reference] Jaser, S.S.; White, Coping and resilience in adolescents with type 1 diabetes. Child Care Health Dev. 2011, 37, 335-342. [CrossRef] 113",
    "[raw_reference] Iturralde, E.; Adams, R.N.; Barley, R.C.; Bensen, R.; Christofferson, M.; Hanes, S.J.; Maahs, D.M.; Milla, C.; Naranjo, D.; Shah, A.C.; et al. Implementation of Depression Screening and Global Health Assessment in Pediatric Subspecialty Clinics. J. Adolesc. Health 2017, 61, 591-598. [CrossRef] 114",
    "PubMedDisclaimer/Publisher's Note: The statements, opinions and data contained in all publications are solely those of the individual author(s) and contributor(s) and not of MDPI and/or the editor(s). MDPI and/or the editor(s) disclaim responsibility for any injury to people or property resulting from any ideas, methods, instructions or products referred to in the content"
  ],
  "processing_software": {
    "GROBID": "0.8.2"
  },
  "journal": "Journal of Clinical Medicine",
  "volume": "14",
  "issue": "12",
  "pages": "4240",
  "zotero_recovery": {
    "fields_recovered": [
      "journal"
    ],
    "timestamp": "2025-09-01T11:08:20.349740",
    "zotero_item_type": "journalArticle"
  }
}
