{
  "paper_id": "7BVIQC6B",
  "title": "Patient Portals and Patient Engagement: A State of the Science Review",
  "abstract": "Background: Patient portals (ie, electronic personal health records tethered to institutional electronic health records) are recognized as a promising mechanism to support greater patient engagement, yet questions remain about how health care leaders, policy makers, and designers can encourage adoption of patient portals and what factors might contribute to sustained utilization. \n Objective: The purposes of this state of the science review are to (1) present the definition, background, and how current literature addresses the encouragement and support of patient engagement through the patient portal, and (2) provide a summary of future directions for patient portal research and development to meaningfully impact patient engagement. \n Methods: We reviewed literature from 2006 through 2014 in PubMed, Ovid Medline, and PsycInfo using the search terms \"patient portal\" OR \"personal health record\" OR \"electronic personal health record\". Final inclusion criterion dictated that studies report on the patient experience and/or ways that patients may be supported to make competent health care decisions and act on those decisions using patient portal functionality. Results: We found 120 studies that met the inclusion criteria. Based on the research questions, explicit and implicit aims of the studies, and related measures addressed, the studies were grouped into five major topics (patient adoption, provider endorsement, health literacy, usability, and utility). We discuss the findings and conclusions of studies that address the five topical areas. Conclusions: Current research has demonstrated that patients' interest and ability to use patient portals is strongly influenced by personal factors such age, ethnicity, education level, health literacy, health status, and role as a caregiver. Health care delivery factors, mainly provider endorsement and patient portal usability also contribute to patient's ability to engage through and with the patient portal. Future directions of research should focus on identifying specific populations and contextual considerations that would benefit most from a greater degree of patient engagement through a patient portal. Ultimately, adoption by patients and endorsement by providers will come when existing patient portal features align with patients' and providers' information needs and functionality.",
  "year": 2012,
  "date": "2012",
  "authors": [
    {
      "name": "Taya Irizarry",
      "affiliation": {
        "organization": "School of Nursing",
        "department": "School of Nursing",
        "institution": "University of Pittsburgh",
        "address": "Pittsburgh, PA, United States"
      }
    },
    {
      "name": "Annette Devito Dabbs",
      "affiliation": {
        "organization": "School of Nursing",
        "department": "School of Nursing",
        "institution": "University of Pittsburgh",
        "address": "Pittsburgh, PA, United States"
      }
    },
    {
      "name": "Christine Curran",
      "affiliation": {
        "organization": "School of Nursing",
        "department": "School of Nursing",
        "institution": "University of Pittsburgh",
        "address": "Pittsburgh, PA, United States"
      }
    }
  ],
  "doi": "10.2196/jmir.4255",
  "md5": "A4372B05B4141B65737CDC81626947E2",
  "publication": {
    "journal": "J Am Med Inform Assoc",
    "journal_inferred": true
  },
  "keywords": [
    "electronic personal health record",
    "patient portal",
    "patient engagement",
    "meaningful use XSL",
    "FO RenderX"
  ],
  "funding": [
    "",
    "Acknowledgments TI was funded on T32:  Technology Research in Chronic and Critical Illness  ( 2NR008857 ,  Erlen & DeVito Dabbs , Directors). The funding agency had no role in the preparation, review, or approval of the manuscript. The opinions, results, and conclusions reported in this paper are those of the authors and are independent of the funding source."
  ],
  "sections": [
    {
      "title": "Introduction"
    },
    {
      "title": "Patient Engagement and Patient Portals",
      "text": "Patient engagement has been identified as an essential dimension of the multifaceted solution to the cost/quality crisis in US health care. The patient-centric definition of patient engagement by the Agency for Healthcare Research and Quality (AHRQ) is \"the involvement in their own care by individuals (and others they designate to engage on their behalf), with the goal that they make competent, well-informed decisions about their health and health care and take action to support those decisions\"  [1] .\n\nAHRQ also defines patient engagement from a systems perspective as \"a set of behaviors by patients, family members, and health professionals and a set of organizational policies and procedures that foster both the inclusion of patients and family members as active members of the health care team and collaborative partnerships with providers and provider organizations\"  [1] .\n\nCurrently, there is an increasing awareness of health care system's responsibility to provide easily accessible ways for patients to be engaged in their own care by creating effective partnerships that lead to the patient's ability to make competent and well-informed decisions  [2] . While an electronic personal health record (ePHR) tethered to an electronic health record (EHR), also known as a patient portal, is currently recognized as a promising mechanism to support greater patient engagement, questions remain about how health care leaders, policy makers, and designers can encourage adoption by both providers and patients and what factors might contribute to sustained utilization."
    },
    {
      "title": "Definition and Background of Patient Portals",
      "text": "An ePHR that directly links, or is \"tethered\", to an EHR is most commonly referred to as a patient portal. In general, patient information from the EHR such as the problem list, allergies, and lab test results populate the patient portal. In some instances, patients may enter data to populate the EHR. In contrast, an untethered ePHR is under the control of the patient. This means an individual manually enters all information or grants permission for the information to be transferred to the ePHR, from a specific source like a laboratory or pharmacy, and determines who will have access. Thus, the value of an untethered ePHR is determined by a person's willingness to manage and maintain their ePHR information. Because there is little that health care organizations can do to initiate patient engagement using an untethered ePHR, this literature review is focused exclusively on the patient portal, directly linked to an EHR. Patient portals were introduced and adopted by a few large health care organizations in the late 1990s (eg, MyChart at the Palo Alto Medical Foundation and Indivo at Boston Children's Hospital)  [3, 4] . However, patient portals did not gain widespread use until 2006 when several initiatives coincided, including the launch of ePHRs by Microsoft and Google, the awarding of Centers for Medicare and Medicaid Services (CMS) contracts to private firms to conduct feasibility studies of ePHRs using existing claims data from Medicare programs, and Blue Cross and Blue Shield Association and America's Health Insurance Plans' announcement to develop data-sharing programs that would ultimately support ePHR development  [5] . These initiatives also coincided with the broad social movement towards adoption and daily use of powerful information and communication sharing tools such as smartphones and social media, illustrating the readiness of the general population to embrace technology in a new socially interactive way.\n\nThe current principal driver of patient portal development is the meaningful use (MU) criteria of the CMS EHR incentive program  [6] . Features mandated by MU that directly relate to patient portal functionality include providing (1) a clinical summary to the patient after each visit, (2) secure messaging (SM) between patient and provider, (3) ability to view, download, and transmit personal health record data, (4) patient specific education, (5) patient reminders for preventative services, and (6) medication reconciliation  [7] . While these criteria clearly outline tasks and goals, they do little to reflect the value proposition to the end users (patients and providers) or the steps required to engage patients in a sustained and relevant way. Therefore, an aim of this review was to explore the current research addressing the encouragement and support of patient engagement through the patient portal."
    },
    {
      "title": "Methods"
    },
    {
      "title": "Search Strategy",
      "text": "Due to the advances in technology and consumer readiness in the mid-2000s, the review was limited to recent literature to better reflect current trends in design, functionality, and perceived user readiness of patient portals. We reviewed literature from 2006 through 2014 in PubMed, Ovid Medline, and PsycInfo using the search terms \"patient portal\" OR \"personal health record\" OR \"electronic personal health record\". Bibliographies and the literature reviews from these sources were used to identify additional studies  [8, 9] . Initial inclusion criteria were (1) original, peer-reviewed, qualitative, and quantitative research of tethered ePHRs or patient portals, (2) English language, and (3) available in full text. The final inclusion criterion was that the studies reported on the patient experience and/or ways that patients may be supported to make competent health care decisions and act on those decisions using patient portal functionality. Studies were not targeted to any particular patient subgroup, disease, or clinical setting.\n\nOf the 440 articles identified by the search, 176 were excluded based on title and abstract. Further review based on the final inclusion criterion resulted in 120 articles, which were reviewed in depth (see Multimedia Appendix 1 for summaries of each). Excluded articles focused on the provider perspective only, technicalities of patient portal implementation (eg, policy issues, safety, security), implications for Health Information Exchange, economics impacts, or the utility of patient portal data for research purposes (see Figure  1 )."
    },
    {
      "title": "Results"
    },
    {
      "title": "Overview",
      "text": "We grouped the studies into five major topics based on the research questions, explicit and implicit aims of the studies, and related measures addressed. The topics identified included patient adoption, provider endorsement, health literacy, usability, and utility (Table  1 ). Of the 120 articles that were reviewed, 66 (55.0%) were non-experimental descriptive, 26 (21.7%) were qualitative or mixed-methods, 14 (11.7%) were randomized controlled trials, 10 were pilot studies or case reports (8.3%), and 4 were cohort studies (3.3%) (Table  2 ). Only 11 articles explicitly identified a guiding theoretical framework, with the Chronic Care Model being the most common among them. The year 2011 was a turning point in the number of published articles, which coincides with the initiation of CMS EHR incentives program. The topical areas that showed the greatest increase in volume were patient adoption and utility (Table  1 ). See Multimedia Appendix 1 for a brief description of each article and the topical areas addressed. The following section describes each topical area and discusses relevant implications for research, development, and implementation of patient portals."
    },
    {
      "title": "Patient Adoption",
      "text": "Before a patient portal can serve as a tool for individuals to become more engaged and involved in their own care, patients must first adopt it. CMS 2014 stage 2 MU regulations define adoption in terms of institutional reporting for reimbursement and require that 5% of the institutions' patient population  (1)  download or view electronic health information and (2) use secure electronic messages (eg, email)  [6] . However, in our review, various operational definitions of adoption were used. For example, many observational studies used usage data of the initial login to the patient portal site to represent adoption; others used data from surveys about patients' intention to use the portal. Several randomized controlled trials (RCTs) used rates of patient portal intervention adherence to study protocol to define adoption, and for some of these trials, those who completed the studies were considered adopters; in others, adoption was defined as the frequency of intervention use.\n\nOf the 62 articles  [5, ] that focused on or described patient portal adoption as part of the report, six RCTs included detailed descriptions of intervention group participants who completed the study (and therefore were considered adopters) in comparison to those who did not. We found 12 qualitative or mixed-method studies that collected data about adoption from patients through focus groups or semistructured interviews; 21 studies focused on interest and barriers to adoption for specific populations or patient portal functions (eg, elderly, safety-net, human immunodeficiency populations, secure messaging, prescription refills).\n\nThe term \"digital divide\" is often used to describe major potential barriers to access of electronic tools such as a patient portal and refers to disparities among subgroups based on access to the Internet and computer literacy. However, this term does not encompass the many other factors that may contribute to adoption such as language barriers, age, race and ethnicity, social economic status, and level of patient activation  [32, 50, 54, 71] . Several studies examining adoption have shown that ethnic minorities (African American, Latino, Asian) and patients who are younger (under 35 years), healthier, and less educated were less likely to adopt patient portals  [15, 55, 72] ; however, results are mixed regarding gender differences  [50, 63] . People with disabilities and chronic conditions, frequent users of health care services, and caregivers of elderly parents or children tend to have the most interest in patient portals  [28, 50, 62, 73] . Other important factors of patient portal adoption include provider acceptance and promotion, and usability of the patient portal interface including ease of registration, navigation, and perceived privacy and security  [18] [19] [20] 74] ."
    },
    {
      "title": "Provider Endorsement",
      "text": "Provider endorsement and continued engagement with the patient portal have been identified as important factors in a patient's decision to adopt and continue to use the patient portal functions to achieve and sustain anticipated positive outcomes  [19, 75] . Of the 8 articles that addressed physician endorsement  [12, 19, 34, [76] [77] [78] [79] [80] , 5 studies were qualitative or mixed-method studies, and one RCT included a retrospective survey of physicians' use and satisfaction.\n\nFour of the studies sought to capture attitudes of clinicians towards patient portals prior to having firsthand experience interacting with them. Prior to actual use of patient portals, clinicians expressed concerns related to patient engagement including: the potential for inducing patient anxiety regarding test results; the accuracy of patient entered data; the potential liability for tracking and acting on critical clinical information, such as blood glucose levels and blood pressure readings; implications for changes in the patient-provider relationship; and the anticipated increased workload  [34, 77, 78, 81] .\n\nRetrospective studies showed that the pre-portal concerns regarding patient anxiety about test results were not justified as demonstrated by numerous patients who found the test result feature one of the most useful  [82] . In addition, while perceived increases in workload and duration of clinic visits varied among studies, clinicians believed patients were more interested in participating in their care and found that verifying the additional information in the patient portal provided during face-to-face visits was helpful, thus eliminating the accuracy concern  [19] . Overall, the workflow of individual providers and the health care team as a whole, including nurses, pharmacists, support staff, and physicians, must be adapted in order to incorporate patient portal functionality, and the patient engagement it allows, into the delivery of preventative services and illness management processes  [45] ."
    },
    {
      "title": "Health Literacy",
      "text": "The definition of health literacy developed for the National Library of Medicine and used by the Healthy People 2010 initiative is \"the degree to which individuals have the capacity to obtain, process and understand basic health information and services needed to make appropriate health decisions\"  [83] . Of the 16 studies that specifically addressed health literacy  [11, 14, 30, 40, 42, 64, 65, 74, [84] [85] [86] [87] [88] [89] [90] [91] , the majority included self-reported health literacy measures via survey questions or open-ended questions; only Noblin et al  (42)  and Taha et al  [91]  included validated health literacy measures. Four studies  [64, 85, 88, 91]  identified conceptual knowledge, numeracy, and computer skills as particularly important literacy factors that contributed to successful patient engagement via a patient portal.\n\nNoblin et al  [42]  found that 65% of participants who intended to adopt the outpatient clinic's patient portal had a higher eHealth literacy score than those who were not interested in patient portal adoption. Taha et al  [91]  results indicated that if health texts involved numeric concepts, users encountered problems, even if they were considered to have \"adequate\" health literacy. These studies underscore the importance of evaluating health literacy and health numeracy separately in order to identify specific risk factors and design flaws that could impact patient comprehension and ultimately jeopardize the accuracy of patient input and interpretation of results.\n\nFour studies directly addressed the impact of health literacy of intended users on the successful completion of specific tasks  [64, 84, 88, 92] . Results showed that patients responded better when medical jargon and abbreviations were translated into \"patient friendly\" language. These results echo Haggstrom et al  [85]  and Monkman & Kushniruk's  [88]  findings of the dangers of low health and computer literacy to safe and effective use of patient portals.\n\nSchnipper et al  [92]  and Sox et al  [84]  revealed that, despite patient involvement in early design and testing of patient portals, subsequent scenario-based usability testing uncovered navigation difficulties primarily due to the unfamiliarity with complex medical language and confusion of how and when to correct identified errors. Monkman & Kushniruk  [88]  suggest that including health literacy assessments in usability testing of consumer health information systems, such as patient portals, would inform the design of systems for better navigation, data input, and conceptual understanding of health information included throughout the patient portal.\n\nMonkman & Kushniruk  [88]  also proposed a specific heuristic for health literacy whose purpose is to identify and categorize when clinical information within the patient portal would most likely be misunderstood by a layperson who does not possess a health care background. This study, along with several other qualitative studies showed that specific health topics (eg, medications, lab results, and allergies) required extra attention to designing with health literacy considerations in mind  [45, 89, 93] . Proposed navigation and aiding tools that increased patients' ability to understand their personal health information more fully include integrating links to definitions of terms and detailed explanations, using movies and illustrations, substituting lay language for medical terminology and using graphs to track trending data, such as blood pressure and blood glucose levels  [84, 85, 94] ."
    },
    {
      "title": "Usability",
      "text": "Usability testing is the term used to describe the assessment of how easy a user interface is to operate. The word \"usability\" also refers to methods for improving ease of use during the design process  [95] . One such method is heuristic evaluation, a method of testing a preliminary prototype by examining the interface and judging its compliance with recognized usability principles (ie, \"heuristics\"). Further iterative usability testing is accomplished using a series of prototypes and participatory scenario-based and \"think-aloud\" sessions with intended users in order to redesign the interface and workflows to better match user needs and preferences. Early usability testing, and its role in patient portal design, is important because it directly impacts whether or not a patient can easily adopt a patient portal. It also impacts the ability of the user to successfully navigate portal functions, accurately input information, and comprehend the information presented, ultimately contributing to its usefulness as a tool for patient engagement.\n\nOf the 20 studies that addressed usability of patient portals, 6 performed some form of heuristic and usability testing with objective observation and various forms of \"think aloud\" sessions  [25, 84, 85, 92, 94, 96] . Only Schnipper et al  [92]  included usability testing of both the clinician and patient interfaces. The remaining 14 studies assessed users' subjective satisfaction and ease of use with questionnaires and/or interviews to evaluate overall adoption and utilization  [11, 38, 45, 47, 48, 64, 65, 73, 82, 88, 89, 91, 97, 98] .\n\nSchnipper et al  [92]  addressed the needs of both end users (ie, clinicians and patients) in the usability testing of a medication management module embedded within the patient portal. The study highlighted the need for end user-specific interfaces and functionality in order to make the user experience easier and more efficient, thus demonstrating its value and promoting sustained use. For patients, this meant striking a balance between free-text, structured, and coded data fields in order to leverage the usefulness of patient-entered data without confusing or overwhelming patients. For example, drop-down menus and scrolls bars were found to be less confusing and more efficient than dynamic text boxes that would react to the word being typed when inputting data, such as medications and allergies. In the case of clinicians, this meant integrating the clinician side of the application with their workflow so that clinicians could verify and correct patient-entered data while simultaneously facilitating the flow of that data into the EHR.\n\nMuch of the literature surrounding usability confirms that adoption and sustained use of technology are directly related to ease of navigation and the perceived usefulness of the available information  [99] . While nearly all the patient portal usability studies that used subjective assessments showed positive results for ease of use and satisfaction, the in-depth objective usability studies were more effective at uncovering a variety of barriers to safe and effective use."
    },
    {
      "title": "Utility",
      "text": "Utility refers to the availability of needed features. Utility and usability are equally important and together determine whether something is useful  [99] ; 76 studies focused in some way on patient portal utility  [5, 12, 13, 15, 19, 22, 23, [25] [26] [27] 30, 34, 37, 41, 44, 47, 52, 53, 56, 57, 59, 60, 64, 65, 69, 70, 79, 82, [84] [85] [86] [87] 89, 90, 92, 96, 98, . The majority of descriptive, qualitative, and mixed-method studies focused on eliciting patient preferences for specific functions. Patients preferred functions that offered convenience, such as an easy way to contact and communicate with providers, order prescription refills, and access multiple family medical records. Easy-to-read, printer-friendly summaries were also viewed as helpful for sharing information with family members and providers who did not have patient portal access. The top two patient portal qualities that were deemed most utilitarian for patients were personalization and collaborative communication between patients and providers  [67, 138] ."
    },
    {
      "title": "Personalization",
      "text": "While numerous descriptive and qualitative studies attest to the desire for personalized patient portal functionality, there is little research about what kind of personalization would lead to greater patient engagement. Currently, the greatest research focus is on chronic disease medication management and preventative services. Only 3 RCTs specifically tested the efficacy of patient-tailored interventions  [13, 30, 90] . Grant et al  [13]  provided patient-tailored decision support and enabled the patient to author a \"Diabetes Care Plan\" for electronic submission to the physician prior to upcoming appointments. This intervention led to increases in pre-visit use of the patient portal and increased rates of diabetes-related medication adjustment at 12 months. Krist et al  [62]  provided a personally tailored list of prevention recommendations and found that at 16 months, 1 in 4 users were up-to-date on all preventive services-nearly double that of non-users. Sequist et al  [30]  sent personalized electronic messages that included (1) alerts for overdue health screenings and information on screening options, (2) a mechanism for patients to submit requests to schedule screening examinations, and (3) a link to a Web-based tool for patients to assess their personal risk of colorectal cancer. Findings showed that screening rates were significantly higher at 1 month for patients who received electronic messages than for those who did not, but the difference was no longer significant at 4 months."
    },
    {
      "title": "Collaborative Communication",
      "text": "Collaborative communication refers to the ability for patients and providers to share timely and pertinent information, enabling patients to participate as active members of the care team beyond the hospital or clinic setting. SM and medication reconciliation are the two most common patient portal functions that offer the opportunity for such communication. Both functions also pose the greatest potential changes to provider workflow and overall impact on the patient-provider relationship.\n\nFor example, the difficulty aligning information management tools with current provider workflow and care delivery priorities was highlighted in a study of an interactive medication reconciliation module that emailed primary care physicians when a patient added or changed information  [106] . Results showed that patients were willing and able to annotate their medication list, offering the most up-to-date and complete information, but email notifications were ineffective at prompting providers to update the EHR medication list outside of a clinic visit  [106] . Thus, while the notion of designing patient portals to support patient involvement in their care, such as opportunities for their participation in medication reconciliation, shows promise, their effectiveness will depend on the ability to better incorporate these functions into provider workflow and delivery of care.\n\nOther implications of electronic forms of communication via a patient portal are the potential to improve efficiency by way of substituting SM for face-to-face encounters and using SM reminders to decrease missed appointments and promote timely preventative care. However, research shows mixed results leading researchers to believe that the relationship between SM and utilization is more complex than the simple substitution of online for in-person care suggests. For example, while an earlier study at Kaiser Permanente showed a decrease in face-to-face encounters after the initiation of SM  [22] , a subsequent study in a different Kaiser region showed the opposite effect  [115] .\n\nA study done at the Mayo Clinic, aimed at clarifying this discrepancy, focused on frequency of messages, long-term use, and importance of SM among certain subgroups  [121] , which showed neither an increase nor decrease in face-to-face provider visits with the use of SM.\n\nSM is also being used as a one-way communication tool to deliver reminders for preventative care and appointments. A 2011 study at seven Duke medical clinics showed that email reminders, in combination with scheduling functionality within the patient portal, demonstrated significant declines in \"no-shows\"  [27] . A meta-analysis and systematic review by  Guy et al [139]  demonstrated a substantial increase in the likelihood of attending clinic appointments when patients received SM reminders. Perhaps the most encouraging results with SM were the large reduction in missed appointments among historically disadvantaged groups, such as Medicaid recipients, the uninsured, and black patients  [27] .\n\nSM reminders via email have also been shown to be generally successful at encouraging higher rates of preventative services use. For example, a multi-practice randomized controlled trial showed improvement in the rates of certain preventive screenings and vaccinations, but preventative services as a whole were not impacted  [113] . Findings suggest that SM reminders are most effective when they are tailored to the population and context, thus targeting specific goals such as herpes zoster vaccinations for older adults, or pediatric preventative care visit reminders for parents  [119, 129] ."
    },
    {
      "title": "Discussion"
    },
    {
      "title": "Principal Findings",
      "text": "The current principal driver of patient portal development is CMS and Medicaid EHR incentive program meaningful use (MU) criteria  [6] . While MU criteria clearly outline requirements of basic functionality and targeted adoption rates, they do not delineate the steps or features required to engage patients in a sustained and relevant way. Presently there is no clear definition of patient portal adoption beyond the minimum use requirements outlined in the MU criteria. However, in order for health care institutions to track the success of patient portals in terms of patient engagement, a multi-dimensional definition of portal adoption should include both motivating factors for initiation and use over time A definition of this kind would inform a set of universal quality and efficiency reporting measures beyond the current minimal MU criteria to include more relevant patient engagement data.\n\nCurrent research has demonstrated that patients' interest and ability to use patient portals is strongly influenced by personal factors such age, ethnicity, education level, health literacy, health status, and role as a caregiver. Health care delivery factors, mainly provider endorsement and patient portal usability, also contribute to patients' ability to engage through and with the patient portal.\n\nWhile health literacy has been identified as an important factor in the successful use of patient portals, few studies have used validated health literacy measures, making it difficult for future research to build on the findings. Research demonstrates that specific aspects of health literacy, mainly numeracy and familiarity with medical terminology, greatly impact the ability of patients to accurately input data and interpret the information provided in the patient portal. The direct relationship between health literacy and effective use of the patient portal supports the argument for the use of specific health literacy heuristics as part of overall usability testing.\n\nResearch also demonstrates that objective testing (as opposed to solely subjective) should also be a part of patient portal usability testing. Although objective usability testing is expensive and time consuming, studies demonstrate the need for continued work in this area in order to ensure patient portal interfaces promote patient comprehension and data entry accuracy. The promotion of content accuracy and patient comprehension impacts the overall usefulness of the information for both patients and providers.\n\nThe perceived usefulness of patient portals from the providers' perspectives cannot be underestimated. Provider endorsement is one of the most influential factors impacting patients' initial adoption, as well as its continued use as a tool for collaborative communication  [20] . Yet, current research demonstrates the difficulty in aligning information management tools, such as the patient portal, with current provider workflow and care delivery priorities.\n\nWhile current development and research is focused on demonstrating feasibility and efficiency of medication reconciliation and SM reminders, the research has revealed roadblocks to successful implementation rooted in the lack of provider workflow adaptations A greater understanding of the essential adjustments in provider workflow, including potential changes in the roles and responsibilities of the care team overall, is necessary in order to translate findings into practice. Few studies have focused on exploring how patient portal use should unfold within the context of the patient-provider interaction, or how it might impact the overall organization and workflow of the health care team including potential liability concerns, reimbursement, and relationships with patients.\n\nUltimately, successful implementation requires health care institutions to invest time and resources to systematically assess the health needs of their specific patient and caregiver populations, their individual stages of readiness to adopt a patient portal, and the types of assistance needed to do so  [140] . Ideally, interactive sites would collect information on individuals' health, health behaviors and personal goals, and assess health literacy and functional ability, which would then inform the adaptation of the patient portal to accommodate the needs of the individual and/or what additional or alternative resources may be useful  [2] . Such adaptations include personalized content and tailored data presentations specifically designed to enhance interpretation and comprehension of key personal health concerns and timely and pertinent action steps.\n\nIn addition, external environmental and contextual factors, such as distance between patient and clinic, and complexity and trajectory of health concerns, may impact which form of access is preferred for a specific person, provider, location, and situation. Future directions of research should focus on identifying specific populations and contextual considerations that would benefit most from a greater degree of patient engagement through a patient portal. This information could then lead to the creation of health care service policies that promote the use of a patient portal by both providers and patients within the most appropriate settings."
    },
    {
      "title": "Conclusions",
      "text": "If institutions are to engage patients via the patient portal in a way that encourages them to become active members of the care team, support their competence in making health-related decisions, and help them to act on those decisions, institutional leaders must consider the contributing factors that impact efficacy and sustained use of patient portals. According to this review, these factors include attention to the topical areas of patient adoption, provider endorsement, health literacy, usability, and utility. Ultimately, adoption by patients and endorsement by providers will come when existing patient portal features align with patients' and providers' information needs and functionality. Conceptualizing patient portals as a dynamic component of the patient-provider relationship and health care delivery system as a synergetic whole, rather than an isolated repository of information or a set of disconnected functions meant to collect patient data for provider use, may help to inform future research, improve patient portal design, and efforts to promote adoption and effectiveness."
    },
    {
      "text": "Figure 1. Literature review flow chart."
    },
    {
      "text": "Summary of articles on categories of patient portals for patient engagement."
    },
    {
      "text": "Levels of evidence adapted from Melnyk & Fineout-Overholt, 2005."
    },
    {
      "title": "Acknowledgments",
      "text": "TI was funded on T32:  Technology Research in Chronic and Critical Illness  ( 2NR008857 ,  Erlen & DeVito Dabbs , Directors). The funding agency had no role in the preparation, review, or approval of the manuscript. The opinions, results, and conclusions reported in this paper are those of the authors and are independent of the funding source."
    },
    {
      "title": "Conflicts of Interest",
      "text": "None declared."
    },
    {
      "title": "Multimedia Appendix 1",
      "text": "A brief description of each article and the topical areas it addresses.\n\n[PDF File (Adobe PDF File), 306KB-Multimedia Appendix 1] Abbreviations AHRQ: Agency for Health care Research and Quality ePHR: electronic personal health record"
    }
  ],
  "references": [
    {
      "title": "Guide to Patient and Family Engagement: Environmental Scan Report",
      "authors": [
        "M Rockville",
        "M Maurer",
        "P Dardess",
        "K Carman",
        "K Frazier",
        "L Smeeding"
      ],
      "year": 2012,
      "raw": "Guide to Patient and Family Engagement: Environmental Scan Report \n\t\t \n\t\t\t M D Rockville \n\t\t \n\t\t \n\t\t\t M Maurer \n\t\t \n\t\t \n\t\t\t P Dardess \n\t\t \n\t\t \n\t\t\t K L Carman \n\t\t \n\t\t \n\t\t\t K Frazier \n\t\t \n\t\t \n\t\t\t L Smeeding \n\t\t \n\t\t \n\t\t \n\t\t\t 2012. 2015-01-17 \n\t\t \n\t \n\t 6Vel4kPos \n\t Rockville MD, Maurer M, Dardess P, Carman KL, Frazier K, Smeeding L. Guide to Patient and Family Engagement: Environmental Scan Report. 2012. URL: http://www.ahrq.gov/research/findings/final-reports/ptfamilyscan/ptfamilyscan. pdf [accessed 2015-01-17] [WebCite Cache ID 6Vel4kPos]"
    },
    {
      "title": "Personal health record: new opportunity for patient education",
      "authors": [
        "W Kupchunas"
      ],
      "year": 2007,
      "doi": "10.1097/01.nor.0000276971.86937.c4",
      "journal": "Orthop Nurs",
      "volume": "26",
      "issue": "3",
      "raw": "Personal health record: new opportunity for patient education \n\t\t \n\t\t\t W R Kupchunas \n\t\t \n\t\t 10.1097/01.nor.0000276971.86937.c4 \n\t\t Medline: 17538475 \n\t \n\t \n\t\t Orthop Nurs \n\t\t \n\t\t\t 26 \n\t\t\t 3 \n\t\t\t \n\t\t\t 2007 \n\t\t \n\t \n\t quiz 192 \n\t Kupchunas WR. Personal health record: new opportunity for patient education. Orthop Nurs 2007;26(3):185-91; quiz 192. [doi: 10.1097/01.NOR.0000276971.86937.c4] [Medline: 17538475]"
    },
    {
      "title": "Early experiences with personal health records",
      "authors": [
        "J Halamka",
        "K Mandl",
        "P Tang"
      ],
      "year": 2008,
      "doi": "10.1197/jamia.m2562",
      "journal": "J Am Med Inform Assoc",
      "volume": "15",
      "issue": "1",
      "raw": "Early experiences with personal health records \n\t\t \n\t\t\t J D Halamka \n\t\t \n\t\t \n\t\t\t K D Mandl \n\t\t \n\t\t \n\t\t\t P C Tang \n\t\t \n\t\t 10.1197/jamia.m2562 \n\t\t Medline: 17947615 \n\t \n\t \n\t\t J Am Med Inform Assoc \n\t\t \n\t\t\t 15 \n\t\t\t 1 \n\t\t\t \n\t\t\t 2008 \n\t\t \n\t \n\t FREE Full text \n\t Halamka JD, Mandl KD, Tang PC. Early experiences with personal health records. J Am Med Inform Assoc 2008;15(1):1-7 [FREE Full text] [doi: 10.1197/jamia.M2562] [Medline: 17947615]"
    },
    {
      "title": "Indivo: a personally controlled health record for health information exchange and communication",
      "authors": [
        "K Mandl",
        "W Simons",
        "Wcr Crawford",
        "J Abbett"
      ],
      "year": 2007,
      "doi": "10.1186/1472-6947-7-25",
      "journal": "BMC Med Inform Decis Mak",
      "volume": "7",
      "pages": "25",
      "raw": "Indivo: a personally controlled health record for health information exchange and communication \n\t\t \n\t\t\t K D Mandl \n\t\t \n\t\t \n\t\t\t W W Simons \n\t\t \n\t\t \n\t\t\t Wcr Crawford \n\t\t \n\t\t \n\t\t\t J M Abbett \n\t\t \n\t\t 10.1186/1472-6947-7-25 \n\t\t Medline: 17850667 \n\t \n\t \n\t\t BMC Med Inform Decis Mak \n\t\t \n\t\t\t 7 \n\t\t\t 25 \n\t\t\t 2007 \n\t\t \n\t \n\t FREE Full text \n\t Mandl KD, Simons WW, Crawford WCR, Abbett JM. Indivo: a personally controlled health record for health information exchange and communication. BMC Med Inform Decis Mak 2007;7:25 [FREE Full text] [doi: 10.1186/1472-6947-7-25] [Medline: 17850667]"
    },
    {
      "title": "Acceptability of a personally controlled health record in a community-based setting: implications for policy and design",
      "authors": [
        "E Weitzman",
        "L Kaci",
        "K Mandl"
      ],
      "year": 2009,
      "doi": "10.2196/jmir.1187",
      "journal": "J Med Internet Res",
      "volume": "11",
      "issue": "2",
      "pages": "14",
      "raw": "Acceptability of a personally controlled health record in a community-based setting: implications for policy and design \n\t\t \n\t\t\t E R Weitzman \n\t\t \n\t\t \n\t\t\t L Kaci \n\t\t \n\t\t \n\t\t\t K D Mandl \n\t\t \n\t\t 10.2196/jmir.1187 \n\t\t Medline: 19403467 \n\t \n\t \n\t\t J Med Internet Res \n\t\t \n\t\t\t 11 \n\t\t\t 2 \n\t\t\t 14 \n\t\t\t 2009 \n\t\t \n\t \n\t FREE Full text \n\t Weitzman ER, Kaci L, Mandl KD. Acceptability of a personally controlled health record in a community-based setting: implications for policy and design. J Med Internet Res 2009;11(2):e14 [FREE Full text] [doi: 10.2196/jmir.1187] [Medline: 19403467]"
    },
    {
      "title": "The Medicare Electronic Health Record Incentive Program: provider performance on core and menu measures",
      "authors": [
        "A Wright",
        "J Feblowitz",
        "L Samal",
        "A Mccoy",
        "D Sittig"
      ],
      "year": 2014,
      "doi": "10.1111/1475-6773.12134",
      "journal": "Health Serv Res",
      "volume": "49",
      "issue": "1 Pt 2",
      "raw": "The Medicare Electronic Health Record Incentive Program: provider performance on core and menu measures \n\t\t \n\t\t\t A Wright \n\t\t \n\t\t \n\t\t\t J Feblowitz \n\t\t \n\t\t \n\t\t\t L Samal \n\t\t \n\t\t \n\t\t\t A B Mccoy \n\t\t \n\t\t \n\t\t\t D F Sittig \n\t\t \n\t\t 10.1111/1475-6773.12134 \n\t\t Medline: 24359554 \n\t \n\t \n\t\t Health Serv Res \n\t\t \n\t\t\t 49 \n\t\t\t 1 Pt 2 \n\t\t\t \n\t\t\t 2014 Feb \n\t\t \n\t \n\t FREE Full text \n\t Wright A, Feblowitz J, Samal L, McCoy AB, Sittig DF. The Medicare Electronic Health Record Incentive Program: provider performance on core and menu measures. Health Serv Res 2014 Feb;49(1 Pt 2):325-346 [FREE Full text] [doi: 10.1111/1475-6773.12134] [Medline: 24359554]"
    },
    {
      "title": "Promise of and potential for patient-facing technologies to enable meaningful use",
      "authors": [
        "D Ahern",
        "S Woods",
        "M Lightowler",
        "S Finley",
        "T Houston"
      ],
      "year": 2011,
      "doi": "10.1016/j.amepre.2011.01.005",
      "journal": "Am J Prev Med",
      "volume": "40",
      "issue": "5 Suppl 2",
      "raw": "Promise of and potential for patient-facing technologies to enable meaningful use \n\t\t \n\t\t\t D K Ahern \n\t\t \n\t\t \n\t\t\t S S Woods \n\t\t \n\t\t \n\t\t\t M C Lightowler \n\t\t \n\t\t \n\t\t\t S W Finley \n\t\t \n\t\t \n\t\t\t T K Houston \n\t\t \n\t\t 10.1016/j.amepre.2011.01.005 \n\t\t Medline: 21521591 \n\t \n\t \n\t\t Am J Prev Med \n\t\t \n\t\t\t 40 \n\t\t\t 5 Suppl 2 \n\t\t\t \n\t\t\t 2011 May \n\t\t \n\t \n\t Ahern DK, Woods SS, Lightowler MC, Finley SW, Houston TK. Promise of and potential for patient-facing technologies to enable meaningful use. Am J Prev Med 2011 May;40(5 Suppl 2):S162-S172. [doi: 10.1016/j.amepre.2011.01.005] [Medline: 21521591]"
    },
    {
      "title": "History and Trends of \"Personal Health Record\" Research in PubMed",
      "authors": [
        "J Kim",
        "H Jung",
        "D Bates"
      ],
      "year": 2011,
      "doi": "10.4258/hir.2011.17.1.3",
      "journal": "Healthc Inform Res",
      "volume": "17",
      "issue": "1",
      "raw": "History and Trends of \"Personal Health Record\" Research in PubMed \n\t\t \n\t\t\t J Kim \n\t\t \n\t\t \n\t\t\t H Jung \n\t\t \n\t\t \n\t\t\t D W Bates \n\t\t \n\t\t 10.4258/hir.2011.17.1.3 \n\t\t Medline: 21818452 \n\t \n\t \n\t\t Healthc Inform Res \n\t\t \n\t\t\t 17 \n\t\t\t 1 \n\t\t\t \n\t\t\t 2011 Mar \n\t\t \n\t \n\t FREE Full text \n\t Kim J, Jung H, Bates DW. History and Trends of \"Personal Health Record\" Research in PubMed. Healthc Inform Res 2011 Mar;17(1):3-17 [FREE Full text] [doi: 10.4258/hir.2011.17.1.3] [Medline: 21818452]"
    },
    {
      "title": "Electronic patient portals: evidence on health outcomes, satisfaction, efficiency, and attitudes: a systematic review",
      "authors": [
        "C Goldzweig",
        "G Orshansky",
        "N Paige",
        "A Towfigh",
        "D Haggstrom",
        "I Miake-Lye"
      ],
      "year": 2013,
      "doi": "10.7326/0003-4819-159-10-201311190-00006",
      "journal": "Ann Intern Med",
      "volume": "159",
      "issue": "10",
      "raw": "Electronic patient portals: evidence on health outcomes, satisfaction, efficiency, and attitudes: a systematic review \n\t\t \n\t\t\t C L Goldzweig \n\t\t \n\t\t \n\t\t\t G Orshansky \n\t\t \n\t\t \n\t\t\t N M Paige \n\t\t \n\t\t \n\t\t\t A A Towfigh \n\t\t \n\t\t \n\t\t\t D A Haggstrom \n\t\t \n\t\t \n\t\t\t I Miake-Lye \n\t\t \n\t\t 10.7326/0003-4819-159-10-201311190-00006 \n\t\t Medline: 24247673 \n\t \n\t \n\t\t Ann Intern Med \n\t\t \n\t\t\t 159 \n\t\t\t 10 \n\t\t\t \n\t\t\t 2013 Nov 19 \n\t\t \n\t \n\t Goldzweig CL, Orshansky G, Paige NM, Towfigh AA, Haggstrom DA, Miake-Lye I, et al. Electronic patient portals: evidence on health outcomes, satisfaction, efficiency, and attitudes: a systematic review. Ann Intern Med 2013 Nov 19;159(10):677-687. [doi: 10.7326/0003-4819-159-10-201311190-00006] [Medline: 24247673]"
    },
    {
      "title": "Who uses the patient internet portal? The PatientSite experience",
      "authors": [
        "S Weingart",
        "D Rind",
        "Z Tofias",
        "D Sands"
      ],
      "year": 2006,
      "doi": "10.1197/jamia.m1833",
      "journal": "J Am Med Inform Assoc",
      "volume": "13",
      "issue": "1",
      "raw": "Who uses the patient internet portal? The PatientSite experience \n\t\t \n\t\t\t S N Weingart \n\t\t \n\t\t \n\t\t\t D Rind \n\t\t \n\t\t \n\t\t\t Z Tofias \n\t\t \n\t\t \n\t\t\t D Z Sands \n\t\t \n\t\t 10.1197/jamia.m1833 \n\t\t Medline: 16221943 \n\t \n\t \n\t\t J Am Med Inform Assoc \n\t\t \n\t\t\t 13 \n\t\t\t 1 \n\t\t\t \n\t\t\t 2006 \n\t\t \n\t \n\t FREE Full text \n\t Weingart SN, Rind D, Tofias Z, Sands DZ. Who uses the patient internet portal? The PatientSite experience. J Am Med Inform Assoc 2006;13(1):91-95 [FREE Full text] [doi: 10.1197/jamia.M1833] [Medline: 16221943]"
    },
    {
      "title": "Towards consumer-friendly PHRs: patients' experience with reviewing their health records",
      "authors": [
        "A Keselman",
        "L Slaughter",
        "C Smith",
        "H Kim",
        "G Divita",
        "A Browne"
      ],
      "journal": "AMIA Annu Symp Proc",
      "volume": "2007",
      "raw": "Towards consumer-friendly PHRs: patients' experience with reviewing their health records \n\t\t \n\t\t\t A Keselman \n\t\t \n\t\t \n\t\t\t L Slaughter \n\t\t \n\t\t \n\t\t\t C A Smith \n\t\t \n\t\t \n\t\t\t H Kim \n\t\t \n\t\t \n\t\t\t G Divita \n\t\t \n\t\t \n\t\t\t A Browne \n\t\t \n\t\t Medline: 18693866 \n\t \n\t \n\t\t AMIA Annu Symp Proc \n\t\t \n\t\t\t 2007 \n\t\t\t \n\t\t \n\t \n\t FREE Full text \n\t Keselman A, Slaughter L, Smith CA, Kim H, Divita G, Browne A, et al. Towards consumer-friendly PHRs: patients' experience with reviewing their health records. AMIA Annu Symp Proc 2007:399-403 [FREE Full text] [Medline: 18693866]"
    },
    {
      "title": "Sharing electronic laboratory results in a patient portal--a feasibility pilot",
      "authors": [
        "J Wald",
        "K Burk",
        "K Gardner",
        "R Feygin",
        "E Nelson",
        "M Epstein"
      ],
      "year": 2007,
      "journal": "Stud Health Technol Inform",
      "volume": "129",
      "issue": "Pt 1",
      "raw": "Sharing electronic laboratory results in a patient portal--a feasibility pilot \n\t\t \n\t\t\t J S Wald \n\t\t \n\t\t \n\t\t\t K Burk \n\t\t \n\t\t \n\t\t\t K Gardner \n\t\t \n\t\t \n\t\t\t R Feygin \n\t\t \n\t\t \n\t\t\t E Nelson \n\t\t \n\t\t \n\t\t\t M Epstein \n\t\t \n\t\t Medline: 17911670 \n\t \n\t \n\t\t Stud Health Technol Inform \n\t\t \n\t\t\t 129 \n\t\t\t Pt 1 \n\t\t\t \n\t\t\t 2007 \n\t\t \n\t \n\t Wald JS, Burk K, Gardner K, Feygin R, Nelson E, Epstein M, et al. Sharing electronic laboratory results in a patient portal--a feasibility pilot. Stud Health Technol Inform 2007;129(Pt 1):18-22. [Medline: 17911670]"
    },
    {
      "title": "Practice-linked online personal health records for type 2 diabetes mellitus: a randomized controlled trial",
      "authors": [
        "R Grant",
        "J Wald",
        "J Schnipper",
        "T Gandhi",
        "E Poon",
        "E Orav"
      ],
      "year": 2008,
      "doi": "10.1001/archinte.168.16.1776",
      "journal": "Arch Intern Med",
      "volume": "168",
      "issue": "16",
      "raw": "Practice-linked online personal health records for type 2 diabetes mellitus: a randomized controlled trial \n\t\t \n\t\t\t R W Grant \n\t\t \n\t\t \n\t\t\t J S Wald \n\t\t \n\t\t \n\t\t\t J L Schnipper \n\t\t \n\t\t \n\t\t\t T K Gandhi \n\t\t \n\t\t \n\t\t\t E G Poon \n\t\t \n\t\t \n\t\t\t E J Orav \n\t\t \n\t\t 10.1001/archinte.168.16.1776 \n\t\t Medline: 18779465 \n\t \n\t \n\t\t Arch Intern Med \n\t\t \n\t\t\t 168 \n\t\t\t 16 \n\t\t\t \n\t\t\t 2008 Sep 8 \n\t\t \n\t \n\t FREE Full text \n\t Grant RW, Wald JS, Schnipper JL, Gandhi TK, Poon EG, Orav EJ, et al. Practice-linked online personal health records for type 2 diabetes mellitus: a randomized controlled trial. Arch Intern Med 2008 Sep 8;168(16):1776-1782 [FREE Full text] [doi: 10.1001/archinte.168.16.1776] [Medline: 18779465]"
    },
    {
      "title": "Patients' attitudes to the summary care record and HealthSpace: qualitative study",
      "authors": [
        "T Greenhalgh",
        "G Wood",
        "T Bratan",
        "K Stramer",
        "S Hinder"
      ],
      "year": 2008,
      "doi": "10.1136/bmj.a114",
      "journal": "BMJ",
      "volume": "336",
      "issue": "7656",
      "raw": "Patients' attitudes to the summary care record and HealthSpace: qualitative study \n\t\t \n\t\t\t T Greenhalgh \n\t\t \n\t\t \n\t\t\t G W Wood \n\t\t \n\t\t \n\t\t\t T Bratan \n\t\t \n\t\t \n\t\t\t K Stramer \n\t\t \n\t\t \n\t\t\t S Hinder \n\t\t \n\t\t 10.1136/bmj.a114 \n\t\t Medline: 18511764 \n\t \n\t \n\t\t BMJ \n\t\t \n\t\t\t 336 \n\t\t\t 7656 \n\t\t\t \n\t\t\t 2008 Jun 7 \n\t\t \n\t \n\t FREE Full text \n\t Greenhalgh T, Wood GW, Bratan T, Stramer K, Hinder S. Patients' attitudes to the summary care record and HealthSpace: qualitative study. BMJ 2008 Jun 7;336(7656):1290-1295 [FREE Full text] [doi: 10.1136/bmj.a114] [Medline: 18511764]"
    },
    {
      "title": "Prospective personal health record use among different user groups: results of a multi-wave study",
      "authors": [
        "D Lafky",
        "T Horan"
      ],
      "year": 2008,
      "doi": "10.1109/hicss.2008.363",
      "raw": "Prospective personal health record use among different user groups: results of a multi-wave study \n\t\t \n\t\t\t D B Lafky \n\t\t \n\t\t \n\t\t\t T A Horan \n\t\t \n\t\t 10.1109/hicss.2008.363 \n\t \n\t \n\t\t Proceedings of the 41st Annual Hawaii International Conference on System Sciences \n\t\t the 41st Annual Hawaii International Conference on System Sciences Hawaii \n\t\t \n\t\t\t IEEE \n\t\t\t 2008. Jan. 7-10, 2008 \n\t\t \n\t \n\t Annual International Conference on System Sciences \n\t Lafky DB, Horan TA. Prospective personal health record use among different user groups: results of a multi-wave study. In: Proceedings of the 41st Annual Hawaii International Conference on System Sciences.: IEEE; 2008 Presented at: 41st Annual International Conference on System Sciences; Jan. 7-10, 2008; Hawaii. [doi: 10.1109/HICSS.2008.363]"
    },
    {
      "title": "Interest in the use of computerized patient portals: role of the provider-patient relationship",
      "authors": [
        "S Zickmund",
        "R Hess",
        "C Bryce",
        "K Mctigue",
        "E Olshansky",
        "K Fitzgerald"
      ],
      "year": 2008,
      "doi": "10.1007/s11606-007-0273-6",
      "journal": "J Gen Intern Med",
      "volume": "23",
      "issue": "Suppl 1",
      "raw": "Interest in the use of computerized patient portals: role of the provider-patient relationship \n\t\t \n\t\t\t S L Zickmund \n\t\t \n\t\t \n\t\t\t R Hess \n\t\t \n\t\t \n\t\t\t C L Bryce \n\t\t \n\t\t \n\t\t\t K Mctigue \n\t\t \n\t\t \n\t\t\t E Olshansky \n\t\t \n\t\t \n\t\t\t K Fitzgerald \n\t\t \n\t\t 10.1007/s11606-007-0273-6 \n\t\t Medline: 18095039 \n\t \n\t \n\t\t J Gen Intern Med \n\t\t \n\t\t\t 23 \n\t\t\t Suppl 1 \n\t\t\t \n\t\t\t 2008 Jan \n\t\t \n\t \n\t FREE Full text \n\t Zickmund SL, Hess R, Bryce CL, McTigue K, Olshansky E, Fitzgerald K, et al. Interest in the use of computerized patient portals: role of the provider-patient relationship. J Gen Intern Med 2008 Jan;23 Suppl 1:20-26 [FREE Full text] [doi: 10.1007/s11606-007-0273-6] [Medline: 18095039]"
    },
    {
      "title": "The Kaiser Permanente Electronic Health Record: transforming and streamlining modalities of care",
      "authors": [
        "C Chen",
        "T Garrido",
        "D Chock",
        "G Okawa",
        "L Liang"
      ],
      "year": 2009,
      "doi": "10.1377/hlthaff.28.2.323",
      "journal": "Health Aff (Millwood)",
      "volume": "28",
      "issue": "2",
      "raw": "The Kaiser Permanente Electronic Health Record: transforming and streamlining modalities of care \n\t\t \n\t\t\t C Chen \n\t\t \n\t\t \n\t\t\t T Garrido \n\t\t \n\t\t \n\t\t\t D Chock \n\t\t \n\t\t \n\t\t\t G Okawa \n\t\t \n\t\t \n\t\t\t L Liang \n\t\t \n\t\t 10.1377/hlthaff.28.2.323 \n\t\t Medline: 19275987 \n\t \n\t \n\t\t Health Aff (Millwood) \n\t\t \n\t\t\t 28 \n\t\t\t 2 \n\t\t\t \n\t\t\t 2009 Apr \n\t\t \n\t \n\t FREE Full text \n\t Chen C, Garrido T, Chock D, Okawa G, Liang L. The Kaiser Permanente Electronic Health Record: transforming and streamlining modalities of care. Health Aff (Millwood) 2009 Apr;28(2):323-333 [FREE Full text] [doi: 10.1377/hlthaff.28.2.323] [Medline: 19275987]"
    },
    {
      "title": "Disparities in use of a personal health record in a managed care organization",
      "authors": [
        "D Roblin",
        "T Houston",
        "J Allison",
        "P Joski",
        "E Becker"
      ],
      "year": 2009,
      "doi": "10.1197/jamia.m3169",
      "journal": "J Am Med Inform Assoc",
      "volume": "16",
      "issue": "5",
      "raw": "Disparities in use of a personal health record in a managed care organization \n\t\t \n\t\t\t D W Roblin \n\t\t \n\t\t \n\t\t\t T K Houston \n\t\t \n\t\t \n\t\t\t J J Allison \n\t\t \n\t\t \n\t\t\t P J Joski \n\t\t \n\t\t \n\t\t\t E R Becker \n\t\t \n\t\t 10.1197/jamia.m3169 \n\t\t Medline: 19567790 \n\t \n\t \n\t\t J Am Med Inform Assoc \n\t\t \n\t\t\t 16 \n\t\t\t 5 \n\t\t\t \n\t\t\t 2009 \n\t\t \n\t \n\t FREE Full text \n\t Roblin DW, Houston TK, Allison JJ, Joski PJ, Becker ER. Disparities in use of a personal health record in a managed care organization. J Am Med Inform Assoc 2009;16(5):683-689 [FREE Full text] [doi: 10.1197/jamia.M3169] [Medline: 19567790]"
    },
    {
      "title": "Implementing practice-linked pre-visit electronic journals in primary care: patient and physician use and satisfaction",
      "authors": [
        "J Wald",
        "A Businger",
        "T Gandhi",
        "R Grant",
        "E Poon",
        "J Schnipper"
      ],
      "year": 2010,
      "doi": "10.1136/jamia.2009.001362",
      "journal": "J Am Med Inform Assoc",
      "volume": "17",
      "issue": "5",
      "raw": "Implementing practice-linked pre-visit electronic journals in primary care: patient and physician use and satisfaction \n\t\t \n\t\t\t J S Wald \n\t\t \n\t\t \n\t\t\t A Businger \n\t\t \n\t\t \n\t\t\t T K Gandhi \n\t\t \n\t\t \n\t\t\t R W Grant \n\t\t \n\t\t \n\t\t\t E G Poon \n\t\t \n\t\t \n\t\t\t J L Schnipper \n\t\t \n\t\t 10.1136/jamia.2009.001362 \n\t\t Medline: 20819852 \n\t \n\t \n\t\t J Am Med Inform Assoc \n\t\t \n\t\t\t 17 \n\t\t\t 5 \n\t\t\t \n\t\t\t 2010 \n\t\t \n\t \n\t FREE Full text \n\t Wald JS, Businger A, Gandhi TK, Grant RW, Poon EG, Schnipper JL, et al. Implementing practice-linked pre-visit electronic journals in primary care: patient and physician use and satisfaction. J Am Med Inform Assoc 2010;17(5):502-506 [FREE Full text] [doi: 10.1136/jamia.2009.001362] [Medline: 20819852]"
    },
    {
      "title": "Variations in patient portal adoption in four primary care practices",
      "authors": [
        "J Wald"
      ],
      "year": 2010,
      "journal": "AMIA Annu Symp Proc",
      "volume": "2010",
      "raw": "Variations in patient portal adoption in four primary care practices \n\t\t \n\t\t\t J S Wald \n\t\t \n\t\t Medline: 21347096 \n\t \n\t \n\t\t AMIA Annu Symp Proc \n\t\t \n\t\t\t 2010 \n\t\t\t \n\t\t\t 2010 \n\t\t \n\t \n\t FREE Full text \n\t Wald JS. Variations in patient portal adoption in four primary care practices. AMIA Annu Symp Proc 2010;2010:837-841 [FREE Full text] [Medline: 21347096]"
    },
    {
      "title": "Consumers' perceptions about and use of the internet for personal health records and health information exchange: analysis of the 2007 Health Information National Trends Survey",
      "authors": [
        "K Wen",
        "G Kreps",
        "F Zhu",
        "S Miller"
      ],
      "year": 2010,
      "doi": "10.2196/jmir.1668",
      "journal": "J Med Internet Res",
      "volume": "12",
      "issue": "4",
      "pages": "73",
      "raw": "Consumers' perceptions about and use of the internet for personal health records and health information exchange: analysis of the 2007 Health Information National Trends Survey \n\t\t \n\t\t\t K Y Wen \n\t\t \n\t\t \n\t\t\t G Kreps \n\t\t \n\t\t \n\t\t\t F Zhu \n\t\t \n\t\t \n\t\t\t S Miller \n\t\t \n\t\t 10.2196/jmir.1668 \n\t\t Medline: 21169163 \n\t \n\t \n\t\t J Med Internet Res \n\t\t \n\t\t\t 12 \n\t\t\t 4 \n\t\t\t 73 \n\t\t\t 2010 \n\t\t \n\t \n\t FREE Full text \n\t Wen KY, Kreps G, Zhu F, Miller S. Consumers' perceptions about and use of the internet for personal health records and health information exchange: analysis of the 2007 Health Information National Trends Survey. J Med Internet Res 2010;12(4):e73 [FREE Full text] [doi: 10.2196/jmir.1668] [Medline: 21169163]"
    },
    {
      "title": "Improved quality at Kaiser Permanente through e-mail between physicians and patients",
      "authors": [
        "Y Zhou",
        "M Kanter",
        "J Wang",
        "T Garrido"
      ],
      "year": 2010,
      "doi": "10.1377/hlthaff.2010.0048",
      "journal": "Health Aff (Millwood)",
      "volume": "29",
      "issue": "7",
      "raw": "Improved quality at Kaiser Permanente through e-mail between physicians and patients \n\t\t \n\t\t\t Y Y Zhou \n\t\t \n\t\t \n\t\t\t M H Kanter \n\t\t \n\t\t \n\t\t\t J J Wang \n\t\t \n\t\t \n\t\t\t T Garrido \n\t\t \n\t\t 10.1377/hlthaff.2010.0048 \n\t\t Medline: 20606190 \n\t \n\t \n\t\t Health Aff (Millwood) \n\t\t \n\t\t\t 29 \n\t\t\t 7 \n\t\t\t \n\t\t\t 2010 Jul \n\t\t \n\t \n\t FREE Full text \n\t Zhou YY, Kanter MH, Wang JJ, Garrido T. Improved quality at Kaiser Permanente through e-mail between physicians and patients. Health Aff (Millwood) 2010 Jul;29(7):1370-1375 [FREE Full text] [doi: 10.1377/hlthaff.2010.0048] [Medline: 20606190]"
    },
    {
      "title": "Veterans' voices: use of the American Customer Satisfaction Index (ACSI) Survey to identify My HealtheVet personal health record users' characteristics, needs, and preferences",
      "authors": [
        "K Nazi"
      ],
      "year": 2010,
      "doi": "10.1136/jamia.2009.000240",
      "journal": "J Am Med Inform Assoc",
      "volume": "17",
      "issue": "2",
      "raw": "Veterans' voices: use of the American Customer Satisfaction Index (ACSI) Survey to identify My HealtheVet personal health record users' characteristics, needs, and preferences \n\t\t \n\t\t\t K M Nazi \n\t\t \n\t\t 10.1136/jamia.2009.000240 \n\t\t Medline: 20190065 \n\t \n\t \n\t\t J Am Med Inform Assoc \n\t\t \n\t\t\t 17 \n\t\t\t 2 \n\t\t\t \n\t\t\t 2010 \n\t\t \n\t \n\t FREE Full text \n\t Nazi KM. Veterans' voices: use of the American Customer Satisfaction Index (ACSI) Survey to identify My HealtheVet personal health record users' characteristics, needs, and preferences. J Am Med Inform Assoc 2010;17(2):203-211 [FREE Full text] [doi: 10.1136/jamia.2009.000240] [Medline: 20190065]"
    },
    {
      "title": "Personal health records in a public hospital: experience at the HIV/AIDS clinic at San Francisco General Hospital",
      "authors": [
        "J Kahn",
        "J Hilton",
        "N Van",
        "S Leasure",
        "K Bryant",
        "C Hare"
      ],
      "year": 2010,
      "doi": "10.1136/jamia.2009.000315",
      "journal": "J Am Med Inform Assoc",
      "volume": "17",
      "issue": "2",
      "raw": "Personal health records in a public hospital: experience at the HIV/AIDS clinic at San Francisco General Hospital \n\t\t \n\t\t\t J S Kahn \n\t\t \n\t\t \n\t\t\t J F Hilton \n\t\t \n\t\t \n\t\t\t N T Van \n\t\t \n\t\t \n\t\t\t S Leasure \n\t\t \n\t\t \n\t\t\t K M Bryant \n\t\t \n\t\t \n\t\t\t C B Hare \n\t\t \n\t\t 10.1136/jamia.2009.000315 \n\t\t Medline: 20190069 \n\t \n\t \n\t\t J Am Med Inform Assoc \n\t\t \n\t\t\t 17 \n\t\t\t 2 \n\t\t\t \n\t\t\t 2010 \n\t\t \n\t \n\t FREE Full text \n\t Kahn JS, Hilton JF, Van NT, Leasure S, Bryant KM, Hare CB, et al. Personal health records in a public hospital: experience at the HIV/AIDS clinic at San Francisco General Hospital. J Am Med Inform Assoc 2010;17(2):224-228 [FREE Full text] [doi: 10.1136/jamia.2009.000315] [Medline: 20190069]"
    },
    {
      "title": "Adoption, non-adoption, and abandonment of a personal electronic health record: case study of HealthSpace",
      "authors": [
        "T Greenhalgh",
        "S Hinder",
        "K Stramer",
        "T Bratan",
        "J Russell"
      ],
      "year": 2010,
      "journal": "BMJ",
      "volume": "341",
      "pages": "5814",
      "raw": "Adoption, non-adoption, and abandonment of a personal electronic health record: case study of HealthSpace \n\t\t \n\t\t\t T Greenhalgh \n\t\t \n\t\t \n\t\t\t S Hinder \n\t\t \n\t\t \n\t\t\t K Stramer \n\t\t \n\t\t \n\t\t\t T Bratan \n\t\t \n\t\t \n\t\t\t J Russell \n\t\t \n\t\t Medline: 21081595 \n\t \n\t \n\t\t BMJ \n\t\t \n\t\t\t 341 \n\t\t\t 5814 \n\t\t\t 2010 \n\t\t \n\t \n\t FREE Full text \n\t Greenhalgh T, Hinder S, Stramer K, Bratan T, Russell J. Adoption, non-adoption, and abandonment of a personal electronic health record: case study of HealthSpace. BMJ 2010;341:c5814 [FREE Full text] [Medline: 21081595]"
    },
    {
      "title": "Use of an electronic patient portal among disadvantaged populations",
      "authors": [
        "J Ancker",
        "Y Barr\u00f3n",
        "M Rockoff",
        "D Hauser",
        "M Pichardo",
        "A Szerencsy"
      ],
      "year": 2011,
      "doi": "10.1007/s11606-011-1749-y",
      "journal": "J Gen Intern Med",
      "volume": "26",
      "issue": "10",
      "raw": "Use of an electronic patient portal among disadvantaged populations \n\t\t \n\t\t\t J S Ancker \n\t\t \n\t\t \n\t\t\t Y Barr\u00f3n \n\t\t \n\t\t \n\t\t\t M L Rockoff \n\t\t \n\t\t \n\t\t\t D Hauser \n\t\t \n\t\t \n\t\t\t M Pichardo \n\t\t \n\t\t \n\t\t\t A Szerencsy \n\t\t \n\t\t 10.1007/s11606-011-1749-y \n\t\t Medline: 21647748 \n\t \n\t \n\t\t J Gen Intern Med \n\t\t \n\t\t\t 26 \n\t\t\t 10 \n\t\t\t \n\t\t\t 2011 Oct \n\t\t \n\t \n\t FREE Full text \n\t Ancker JS, Barr\u00f3n Y, Rockoff ML, Hauser D, Pichardo M, Szerencsy A, et al. Use of an electronic patient portal among disadvantaged populations. J Gen Intern Med 2011 Oct;26(10):1117-1123 [FREE Full text] [doi: 10.1007/s11606-011-1749-y] [Medline: 21647748]"
    },
    {
      "title": "Impact of health portal enrollment with email reminders on adherence to clinic appointments: a pilot study",
      "authors": [
        "M Horvath",
        "J Levy",
        "L 'engle",
        "P Carlson",
        "B Ahmad",
        "A Ferranti"
      ],
      "year": 2011,
      "doi": "10.2196/jmir.1702",
      "journal": "J Med Internet Res",
      "volume": "13",
      "issue": "2",
      "pages": "41",
      "raw": "Impact of health portal enrollment with email reminders on adherence to clinic appointments: a pilot study \n\t\t \n\t\t\t M Horvath \n\t\t \n\t\t \n\t\t\t J Levy \n\t\t \n\t\t \n\t\t\t L 'engle \n\t\t \n\t\t \n\t\t\t P Carlson \n\t\t \n\t\t \n\t\t\t B Ahmad \n\t\t \n\t\t \n\t\t\t A Ferranti \n\t\t \n\t\t \n\t\t\t J \n\t\t \n\t\t 10.2196/jmir.1702 \n\t\t Medline: 21616784 \n\t \n\t \n\t\t J Med Internet Res \n\t\t \n\t\t\t 13 \n\t\t\t 2 \n\t\t\t 41 \n\t\t\t 2011 \n\t\t \n\t \n\t FREE Full text \n\t Horvath M, Levy J, L'Engle P, Carlson B, Ahmad A, Ferranti J. Impact of health portal enrollment with email reminders on adherence to clinic appointments: a pilot study. J Med Internet Res 2011;13(2):e41 [FREE Full text] [doi: 10.2196/jmir.1702] [Medline: 21616784]"
    },
    {
      "title": "Patient reported barriers to enrolling in a patient portal",
      "authors": [
        "M Goel",
        "T Brown",
        "A Williams",
        "A Cooper",
        "R Hasnain-Wynia",
        "D Baker"
      ],
      "year": 2011,
      "doi": "10.1136/amiajnl-2011-000473",
      "journal": "J Am Med Inform Assoc",
      "volume": "18",
      "issue": "Suppl 1",
      "raw": "Patient reported barriers to enrolling in a patient portal \n\t\t \n\t\t\t M S Goel \n\t\t \n\t\t \n\t\t\t T L Brown \n\t\t \n\t\t \n\t\t\t A Williams \n\t\t \n\t\t \n\t\t\t A J Cooper \n\t\t \n\t\t \n\t\t\t R Hasnain-Wynia \n\t\t \n\t\t \n\t\t\t D W Baker \n\t\t \n\t\t 10.1136/amiajnl-2011-000473 \n\t\t Medline: 22071530 \n\t \n\t \n\t\t J Am Med Inform Assoc \n\t\t \n\t\t\t 18 \n\t\t\t Suppl 1 \n\t\t\t \n\t\t\t 2011 Dec \n\t\t \n\t \n\t FREE Full text \n\t Goel MS, Brown TL, Williams A, Cooper AJ, Hasnain-Wynia R, Baker DW. Patient reported barriers to enrolling in a patient portal. J Am Med Inform Assoc 2011 Dec;18 Suppl 1:i8-12 [FREE Full text] [doi: 10.1136/amiajnl-2011-000473] [Medline: 22071530]"
    },
    {
      "title": "Disparities in enrollment and use of an electronic patient portal",
      "authors": [
        "M Goel",
        "T Brown",
        "A Williams",
        "R Hasnain-Wynia",
        "J Thompson",
        "D Baker"
      ],
      "year": 2011,
      "doi": "10.1007/s11606-011-1728-3",
      "journal": "J Gen Intern Med",
      "volume": "26",
      "issue": "10",
      "raw": "Disparities in enrollment and use of an electronic patient portal \n\t\t \n\t\t\t M S Goel \n\t\t \n\t\t \n\t\t\t T L Brown \n\t\t \n\t\t \n\t\t\t A Williams \n\t\t \n\t\t \n\t\t\t R Hasnain-Wynia \n\t\t \n\t\t \n\t\t\t J A Thompson \n\t\t \n\t\t \n\t\t\t D W Baker \n\t\t \n\t\t 10.1007/s11606-011-1728-3 \n\t\t Medline: 21538166 \n\t \n\t \n\t\t J Gen Intern Med \n\t\t \n\t\t\t 26 \n\t\t\t 10 \n\t\t\t \n\t\t\t 2011 Oct \n\t\t \n\t \n\t FREE Full text \n\t Goel MS, Brown TL, Williams A, Hasnain-Wynia R, Thompson JA, Baker DW. Disparities in enrollment and use of an electronic patient portal. J Gen Intern Med 2011 Oct;26(10):1112-1116 [FREE Full text] [doi: 10.1007/s11606-011-1728-3] [Medline: 21538166]"
    },
    {
      "title": "Electronic patient messages to promote colorectal cancer screening: a randomized controlled trial",
      "authors": [
        "T Sequist",
        "A Zaslavsky",
        "G Colditz",
        "J Ayanian"
      ],
      "year": 2011,
      "doi": "10.1001/archinternmed.2010.467",
      "journal": "Arch Intern Med",
      "volume": "171",
      "issue": "7",
      "raw": "Electronic patient messages to promote colorectal cancer screening: a randomized controlled trial \n\t\t \n\t\t\t T D Sequist \n\t\t \n\t\t \n\t\t\t A M Zaslavsky \n\t\t \n\t\t \n\t\t\t G A Colditz \n\t\t \n\t\t \n\t\t\t J Z Ayanian \n\t\t \n\t\t 10.1001/archinternmed.2010.467 \n\t\t Medline: 21149743 \n\t \n\t \n\t\t Arch Intern Med \n\t\t \n\t\t\t 171 \n\t\t\t 7 \n\t\t\t \n\t\t\t 2011 Apr 11 \n\t\t \n\t \n\t FREE Full text \n\t Sequist TD, Zaslavsky AM, Colditz GA, Ayanian JZ. Electronic patient messages to promote colorectal cancer screening: a randomized controlled trial. Arch Intern Med 2011 Apr 11;171(7):636-641 [FREE Full text] [doi: 10.1001/archinternmed.2010.467] [Medline: 21149743]"
    },
    {
      "title": "Patient interest in sharing personal health record information: a web-based survey",
      "authors": [
        "D Zulman",
        "K Nazi",
        "C Turvey",
        "T Wagner",
        "S Woods",
        "L An"
      ],
      "year": 2011,
      "doi": "10.7326/0003-4819-155-12-201112200-00002",
      "journal": "Ann Intern Med",
      "volume": "155",
      "issue": "12",
      "raw": "Patient interest in sharing personal health record information: a web-based survey \n\t\t \n\t\t\t D M Zulman \n\t\t \n\t\t \n\t\t\t K M Nazi \n\t\t \n\t\t \n\t\t\t C L Turvey \n\t\t \n\t\t \n\t\t\t T H Wagner \n\t\t \n\t\t \n\t\t\t S S Woods \n\t\t \n\t\t \n\t\t\t L C An \n\t\t \n\t\t 10.7326/0003-4819-155-12-201112200-00002 \n\t\t Medline: 22184687 \n\t \n\t \n\t\t Ann Intern Med \n\t\t \n\t\t\t 155 \n\t\t\t 12 \n\t\t\t \n\t\t\t 2011 Dec 20 \n\t\t \n\t \n\t Zulman DM, Nazi KM, Turvey CL, Wagner TH, Woods SS, An LC. Patient interest in sharing personal health record information: a web-based survey. Ann Intern Med 2011 Dec 20;155(12):805-810. [doi: 10.7326/0003-4819-155-12-201112200-00002] [Medline: 22184687]"
    },
    {
      "title": "Social disparities in internet patient portal use in diabetes: evidence that the digital divide extends beyond access",
      "authors": [
        "U Sarkar",
        "A Karter",
        "J Liu",
        "N Adler",
        "R Nguyen",
        "A L\u00f3pez"
      ],
      "year": 2011,
      "doi": "10.1136/jamia.2010.006015",
      "journal": "J Am Med Inform Assoc",
      "volume": "18",
      "issue": "3",
      "raw": "Social disparities in internet patient portal use in diabetes: evidence that the digital divide extends beyond access \n\t\t \n\t\t\t U Sarkar \n\t\t \n\t\t \n\t\t\t A J Karter \n\t\t \n\t\t \n\t\t\t J Y Liu \n\t\t \n\t\t \n\t\t\t N E Adler \n\t\t \n\t\t \n\t\t\t R Nguyen \n\t\t \n\t\t \n\t\t\t A L\u00f3pez \n\t\t \n\t\t 10.1136/jamia.2010.006015 \n\t\t Medline: 21262921 \n\t \n\t \n\t\t J Am Med Inform Assoc \n\t\t \n\t\t\t 18 \n\t\t\t 3 \n\t\t\t \n\t\t\t 2011 May 1 \n\t\t \n\t \n\t FREE Full text \n\t Sarkar U, Karter AJ, Liu JY, Adler NE, Nguyen R, L\u00f3pez A, et al. Social disparities in internet patient portal use in diabetes: evidence that the digital divide extends beyond access. J Am Med Inform Assoc 2011 May 1;18(3):318-321 [FREE Full text] [doi: 10.1136/jamia.2010.006015] [Medline: 21262921]"
    },
    {
      "title": "Patient portal doldrums: does an exam room promotional video during an office visit increase patient portal registrations and portal use?",
      "authors": [
        "F North",
        "B Hanna",
        "S Crane",
        "S Smith",
        "S Tulledge-Scheitel",
        "R Stroebel"
      ],
      "year": 2011,
      "doi": "10.1136/amiajnl-2011-000381",
      "journal": "J Am Med Inform Assoc",
      "volume": "18",
      "issue": "Suppl 1",
      "raw": "Patient portal doldrums: does an exam room promotional video during an office visit increase patient portal registrations and portal use? \n\t\t \n\t\t\t F North \n\t\t \n\t\t \n\t\t\t B K Hanna \n\t\t \n\t\t \n\t\t\t S J Crane \n\t\t \n\t\t \n\t\t\t S A Smith \n\t\t \n\t\t \n\t\t\t S M Tulledge-Scheitel \n\t\t \n\t\t \n\t\t\t R J Stroebel \n\t\t \n\t\t 10.1136/amiajnl-2011-000381 \n\t\t Medline: 21976028 \n\t \n\t \n\t\t J Am Med Inform Assoc \n\t\t \n\t\t\t 18 \n\t\t\t Suppl 1 \n\t\t\t \n\t\t\t 2011 Dec \n\t\t \n\t \n\t FREE Full text \n\t North F, Hanna BK, Crane SJ, Smith SA, Tulledge-Scheitel SM, Stroebel RJ. Patient portal doldrums: does an exam room promotional video during an office visit increase patient portal registrations and portal use? J Am Med Inform Assoc 2011 Dec;18 Suppl 1:i24-i27 [FREE Full text] [doi: 10.1136/amiajnl-2011-000381] [Medline: 21976028]"
    },
    {
      "title": "Use of electronic personal health record systems to encourage HIV screening: an exploratory study of patient and provider perspectives",
      "authors": [
        "D Mcinnes",
        "J Solomon",
        "B Bokhour",
        "S Asch",
        "D Ross",
        "K Nazi"
      ],
      "year": 2011,
      "doi": "10.1186/1756-0500-4-295",
      "journal": "BMC Res Notes",
      "volume": "4",
      "pages": "295",
      "raw": "Use of electronic personal health record systems to encourage HIV screening: an exploratory study of patient and provider perspectives \n\t\t \n\t\t\t D K Mcinnes \n\t\t \n\t\t \n\t\t\t J L Solomon \n\t\t \n\t\t \n\t\t\t B G Bokhour \n\t\t \n\t\t \n\t\t\t S M Asch \n\t\t \n\t\t \n\t\t\t D Ross \n\t\t \n\t\t \n\t\t\t K M Nazi \n\t\t \n\t\t 10.1186/1756-0500-4-295 \n\t\t Medline: 21843313 \n\t \n\t \n\t\t BMC Res Notes \n\t\t \n\t\t\t 4 \n\t\t\t 295 \n\t\t\t 2011 \n\t\t \n\t \n\t FREE Full text \n\t McInnes DK, Solomon JL, Bokhour BG, Asch SM, Ross D, Nazi KM, et al. Use of electronic personal health record systems to encourage HIV screening: an exploratory study of patient and provider perspectives. BMC Res Notes 2011;4:295 [FREE Full text] [doi: 10.1186/1756-0500-4-295] [Medline: 21843313]"
    },
    {
      "title": "Integrated information systems for electronic chemotherapy medication administration",
      "authors": [
        "M Levy",
        "D Giuse",
        "C Eck",
        "G Holder",
        "G Lippard",
        "J Cartwright"
      ],
      "year": 2011,
      "doi": "10.1200/jop.2011.000259",
      "journal": "J Oncol Pract",
      "volume": "7",
      "issue": "4",
      "raw": "Integrated information systems for electronic chemotherapy medication administration \n\t\t \n\t\t\t M A Levy \n\t\t \n\t\t \n\t\t\t D A Giuse \n\t\t \n\t\t \n\t\t\t C Eck \n\t\t \n\t\t \n\t\t\t G Holder \n\t\t \n\t\t \n\t\t\t G Lippard \n\t\t \n\t\t \n\t\t\t J Cartwright \n\t\t \n\t\t 10.1200/jop.2011.000259 \n\t\t Medline: 22043185 \n\t \n\t \n\t\t J Oncol Pract \n\t\t \n\t\t\t 7 \n\t\t\t 4 \n\t\t\t \n\t\t\t 2011 Jul \n\t\t \n\t \n\t FREE Full text \n\t Levy MA, Giuse DA, Eck C, Holder G, Lippard G, Cartwright J, et al. Integrated information systems for electronic chemotherapy medication administration. J Oncol Pract 2011 Jul;7(4):226-230 [FREE Full text] [doi: 10.1200/JOP.2011.000259] [Medline: 22043185]"
    },
    {
      "title": "Who are portal users vs. early e-Visit adopters? A preliminary analysis",
      "authors": [
        "C Jung",
        "R Padman",
        "G Shevchik",
        "S Paone"
      ],
      "year": 2011,
      "journal": "AMIA Annu Symp Proc",
      "volume": "2011",
      "raw": "Who are portal users vs. early e-Visit adopters? A preliminary analysis \n\t\t \n\t\t\t C Jung \n\t\t \n\t\t \n\t\t\t R Padman \n\t\t \n\t\t \n\t\t\t G Shevchik \n\t\t \n\t\t \n\t\t\t S Paone \n\t\t \n\t\t Medline: 22195168 \n\t \n\t \n\t\t AMIA Annu Symp Proc \n\t\t \n\t\t\t 2011 \n\t\t\t \n\t\t\t 2011 \n\t\t \n\t \n\t FREE Full text \n\t Jung C, Padman R, Shevchik G, Paone S. Who are portal users vs. early e-Visit adopters? A preliminary analysis. AMIA Annu Symp Proc 2011;2011:1070-1079 [FREE Full text] [Medline: 22195168]"
    },
    {
      "title": "Impact of a Wellness Portal on the delivery of patient-centered preventive care",
      "authors": [
        "Z Nagykaldi",
        "C Aspy",
        "A Chou",
        "J Mold"
      ],
      "year": 2012,
      "doi": "10.3122/jabfm.2012.02.110130",
      "journal": "J Am Board Fam Med",
      "volume": "25",
      "issue": "2",
      "raw": "Impact of a Wellness Portal on the delivery of patient-centered preventive care \n\t\t \n\t\t\t Z Nagykaldi \n\t\t \n\t\t \n\t\t\t C B Aspy \n\t\t \n\t\t \n\t\t\t A Chou \n\t\t \n\t\t \n\t\t\t J W Mold \n\t\t \n\t\t 10.3122/jabfm.2012.02.110130 \n\t\t Medline: 22403196 \n\t \n\t \n\t\t J Am Board Fam Med \n\t\t \n\t\t\t 25 \n\t\t\t 2 \n\t\t\t \n\t\t\t 2012 Apr \n\t\t \n\t \n\t FREE Full text \n\t Nagykaldi Z, Aspy CB, Chou A, Mold JW. Impact of a Wellness Portal on the delivery of patient-centered preventive care. J Am Board Fam Med 2012 Apr;25(2):158-167 [FREE Full text] [doi: 10.3122/jabfm.2012.02.110130] [Medline: 22403196]"
    },
    {
      "title": "Internet portal use in an academic multiple sclerosis center",
      "authors": [
        "A Nielsen",
        "J Halamka",
        "R Kinkel"
      ],
      "year": 2012,
      "doi": "10.1136/amiajnl-2011-000177",
      "journal": "J Am Med Inform Assoc",
      "volume": "19",
      "issue": "1",
      "raw": "Internet portal use in an academic multiple sclerosis center \n\t\t \n\t\t\t A S Nielsen \n\t\t \n\t\t \n\t\t\t J D Halamka \n\t\t \n\t\t \n\t\t\t R P Kinkel \n\t\t \n\t\t 10.1136/amiajnl-2011-000177 \n\t\t Medline: 21571744 \n\t \n\t \n\t\t J Am Med Inform Assoc \n\t\t \n\t\t\t 19 \n\t\t\t 1 \n\t\t\t \n\t\t\t 2012 Feb \n\t\t \n\t \n\t FREE Full text \n\t Nielsen AS, Halamka JD, Kinkel RP. Internet portal use in an academic multiple sclerosis center. J Am Med Inform Assoc 2012 Feb;19(1):128-133 [FREE Full text] [doi: 10.1136/amiajnl-2011-000177] [Medline: 21571744]"
    },
    {
      "title": "The association between personal health record use and diabetes quality measures",
      "authors": [
        "M Tenforde",
        "A Nowacki",
        "A Jain",
        "J Hickner"
      ],
      "year": 2012,
      "doi": "10.1007/s11606-011-1889-0",
      "journal": "J Gen Intern Med",
      "volume": "27",
      "issue": "4",
      "raw": "The association between personal health record use and diabetes quality measures \n\t\t \n\t\t\t M Tenforde \n\t\t \n\t\t \n\t\t\t A Nowacki \n\t\t \n\t\t \n\t\t\t A Jain \n\t\t \n\t\t \n\t\t\t J Hickner \n\t\t \n\t\t 10.1007/s11606-011-1889-0 \n\t\t Medline: 22005937 \n\t \n\t \n\t\t J Gen Intern Med \n\t\t \n\t\t\t 27 \n\t\t\t 4 \n\t\t\t \n\t\t\t 2012 Apr \n\t\t \n\t \n\t FREE Full text \n\t Tenforde M, Nowacki A, Jain A, Hickner J. The association between personal health record use and diabetes quality measures. J Gen Intern Med 2012 Apr;27(4):420-424 [FREE Full text] [doi: 10.1007/s11606-011-1889-0] [Medline: 22005937]"
    },
    {
      "title": "Access to radiologic reports via a patient portal: clinical simulations to investigate patient preferences",
      "authors": [
        "A Johnson",
        "D Easterling",
        "R Nelson",
        "M Chen",
        "R Frankel"
      ],
      "doi": "10.1016/j.jacr.2011.12.023",
      "journal": "J Am Coll Radiol Apr",
      "volume": "9",
      "issue": "4",
      "raw": "Access to radiologic reports via a patient portal: clinical simulations to investigate patient preferences \n\t\t \n\t\t\t A J Johnson \n\t\t \n\t\t \n\t\t\t D Easterling \n\t\t \n\t\t \n\t\t\t R Nelson \n\t\t \n\t\t \n\t\t\t M Y Chen \n\t\t \n\t\t \n\t\t\t R M Frankel \n\t\t \n\t\t 10.1016/j.jacr.2011.12.023 \n\t\t Medline: 22469376 \n\t \n\t \n\t\t J Am Coll Radiol Apr \n\t\t \n\t\t\t 9 \n\t\t\t 4 \n\t\t\t \n\t\t \n\t \n\t Johnson AJ, Easterling D, Nelson R, Chen MY, Frankel RM. Access to radiologic reports via a patient portal: clinical simulations to investigate patient preferences. J Am Coll Radiol Apr;9(4):256-263. [doi: 10.1016/j.jacr.2011.12.023] [Medline: 22469376]"
    },
    {
      "title": "Triaging patients at risk of influenza using a patient portal",
      "authors": [
        "S Rosenbloom",
        "T Daniels",
        "T Talbot",
        "T Mcclain",
        "R Hennes",
        "S Stenner"
      ],
      "year": 2012,
      "doi": "10.1136/amiajnl-2011-000382",
      "journal": "J Am Med Inform Assoc",
      "volume": "19",
      "issue": "4",
      "raw": "Triaging patients at risk of influenza using a patient portal \n\t\t \n\t\t\t S T Rosenbloom \n\t\t \n\t\t \n\t\t\t T L Daniels \n\t\t \n\t\t \n\t\t\t T R Talbot \n\t\t \n\t\t \n\t\t\t T Mcclain \n\t\t \n\t\t \n\t\t\t R Hennes \n\t\t \n\t\t \n\t\t\t S Stenner \n\t\t \n\t\t 10.1136/amiajnl-2011-000382 \n\t\t Medline: 22140208 \n\t \n\t \n\t\t J Am Med Inform Assoc \n\t\t \n\t\t\t 19 \n\t\t\t 4 \n\t\t\t \n\t\t\t 2012 \n\t\t \n\t \n\t FREE Full text \n\t Rosenbloom ST, Daniels TL, Talbot TR, McClain T, Hennes R, Stenner S, et al. Triaging patients at risk of influenza using a patient portal. J Am Med Inform Assoc 2012;19(4):549-554 [FREE Full text] [doi: 10.1136/amiajnl-2011-000382] [Medline: 22140208]"
    },
    {
      "title": "The impact of health literacy on a patient's decision to adopt a personal health record",
      "authors": [
        "A Noblin",
        "Tth Wan",
        "M Fottler"
      ],
      "year": 2012,
      "doi": "10.1504/ijhtm.2013.055085",
      "journal": "Perspect Health Inf Manag",
      "volume": "9",
      "raw": "The impact of health literacy on a patient's decision to adopt a personal health record \n\t\t \n\t\t\t A M Noblin \n\t\t \n\t\t \n\t\t\t Tth Wan \n\t\t \n\t\t \n\t\t\t M Fottler \n\t\t \n\t\t 10.1504/ijhtm.2013.055085 \n\t\t Medline: 23209454 \n\t \n\t \n\t\t Perspect Health Inf Manag \n\t\t \n\t\t\t 9 \n\t\t\t \n\t\t\t 2012 \n\t\t \n\t \n\t FREE Full text \n\t Noblin AM, Wan TTH, Fottler M. The impact of health literacy on a patient's decision to adopt a personal health record. Perspect Health Inf Manag 2012;9:1-13 [FREE Full text] [Medline: 23209454]"
    },
    {
      "title": "Consistency of patient preferences about a secure Internet-based patient communications portal: contemplating, enrolling, and using",
      "authors": [
        "D Wakefield",
        "R Kruse",
        "B Wakefield",
        "R Koopman",
        "L Keplinger",
        "S Canfield"
      ],
      "year": 2012,
      "doi": "10.1177/1062860611436246",
      "journal": "Am J Med Qual",
      "volume": "27",
      "issue": "6",
      "raw": "Consistency of patient preferences about a secure Internet-based patient communications portal: contemplating, enrolling, and using \n\t\t \n\t\t\t D S Wakefield \n\t\t \n\t\t \n\t\t\t R L Kruse \n\t\t \n\t\t \n\t\t\t B J Wakefield \n\t\t \n\t\t \n\t\t\t R J Koopman \n\t\t \n\t\t \n\t\t\t L E Keplinger \n\t\t \n\t\t \n\t\t\t S M Canfield \n\t\t \n\t\t 10.1177/1062860611436246 \n\t\t Medline: 22517909 \n\t \n\t \n\t\t Am J Med Qual \n\t\t \n\t\t\t 27 \n\t\t\t 6 \n\t\t\t \n\t\t\t 2012 \n\t\t \n\t \n\t Wakefield DS, Kruse RL, Wakefield BJ, Koopman RJ, Keplinger LE, Canfield SM, et al. Consistency of patient preferences about a secure Internet-based patient communications portal: contemplating, enrolling, and using. Am J Med Qual 2012;27(6):494-502. [doi: 10.1177/1062860611436246] [Medline: 22517909]"
    },
    {
      "title": "Personal health records and hypertension control: a randomized trial",
      "authors": [
        "P Wagner",
        "J Dias",
        "S Howard",
        "K Kintziger",
        "M Hudson",
        "Y Seol"
      ],
      "year": 2012,
      "doi": "10.1136/amiajnl-2011-000349",
      "journal": "J Am Med Inform Assoc",
      "volume": "19",
      "issue": "4",
      "raw": "Personal health records and hypertension control: a randomized trial \n\t\t \n\t\t\t P J Wagner \n\t\t \n\t\t \n\t\t\t J Dias \n\t\t \n\t\t \n\t\t\t S Howard \n\t\t \n\t\t \n\t\t\t K W Kintziger \n\t\t \n\t\t \n\t\t\t M F Hudson \n\t\t \n\t\t \n\t\t\t Y H Seol \n\t\t \n\t\t 10.1136/amiajnl-2011-000349 \n\t\t Medline: 22234404 \n\t \n\t \n\t\t J Am Med Inform Assoc \n\t\t \n\t\t\t 19 \n\t\t\t 4 \n\t\t\t \n\t\t\t 2012 Aug \n\t\t \n\t \n\t FREE Full text \n\t Wagner PJ, Dias J, Howard S, Kintziger KW, Hudson MF, Seol YH, et al. Personal health records and hypertension control: a randomized trial. J Am Med Inform Assoc 2012 Aug;19(4):626-634 [FREE Full text] [doi: 10.1136/amiajnl-2011-000349] [Medline: 22234404]"
    },
    {
      "title": "Improving diabetes management with a patient portal: a qualitative study of diabetes self-management portal",
      "authors": [
        "S Urowitz",
        "D Wiljer",
        "K Dupak",
        "Z Kuehner",
        "K Leonard",
        "E Lovrics"
      ],
      "year": 2012,
      "doi": "10.2196/jmir.2265",
      "journal": "J Med Internet Res",
      "volume": "14",
      "issue": "6",
      "pages": "158",
      "raw": "Improving diabetes management with a patient portal: a qualitative study of diabetes self-management portal \n\t\t \n\t\t\t S Urowitz \n\t\t \n\t\t \n\t\t\t D Wiljer \n\t\t \n\t\t \n\t\t\t K Dupak \n\t\t \n\t\t \n\t\t\t Z Kuehner \n\t\t \n\t\t \n\t\t\t K Leonard \n\t\t \n\t\t \n\t\t\t E Lovrics \n\t\t \n\t\t 10.2196/jmir.2265 \n\t\t Medline: 23195925 \n\t \n\t \n\t\t J Med Internet Res \n\t\t \n\t\t\t 14 \n\t\t\t 6 \n\t\t\t 158 \n\t\t\t 2012 \n\t\t \n\t \n\t FREE Full text \n\t Urowitz S, Wiljer D, Dupak K, Kuehner Z, Leonard K, Lovrics E, et al. Improving diabetes management with a patient portal: a qualitative study of diabetes self-management portal. J Med Internet Res 2012;14(6):e158 [FREE Full text] [doi: 10.2196/jmir.2265] [Medline: 23195925]"
    },
    {
      "title": "Use of the internet and an online personal health record system by US veterans: comparison of Veterans Affairs mental health service users and other veterans nationally",
      "authors": [
        "J Tsai",
        "R Rosenheck"
      ],
      "year": 2012,
      "doi": "10.1136/amiajnl-2012-000971",
      "journal": "J Am Med Inform Assoc",
      "volume": "19",
      "issue": "6",
      "raw": "Use of the internet and an online personal health record system by US veterans: comparison of Veterans Affairs mental health service users and other veterans nationally \n\t\t \n\t\t\t J Tsai \n\t\t \n\t\t \n\t\t\t R A Rosenheck \n\t\t \n\t\t 10.1136/amiajnl-2012-000971 \n\t\t Medline: 22847305 \n\t \n\t \n\t\t J Am Med Inform Assoc \n\t\t \n\t\t\t 19 \n\t\t\t 6 \n\t\t\t \n\t\t\t 2012 \n\t\t \n\t \n\t FREE Full text \n\t Tsai J, Rosenheck RA. Use of the internet and an online personal health record system by US veterans: comparison of Veterans Affairs mental health service users and other veterans nationally. J Am Med Inform Assoc 2012;19(6):1089-1094 [FREE Full text] [doi: 10.1136/amiajnl-2012-000971] [Medline: 22847305]"
    },
    {
      "title": "Patient perceptions of a personal health record: a test of the diffusion of innovation model",
      "authors": [
        "S Emani",
        "C Yamin",
        "E Peters",
        "A Karson",
        "S Lipsitz",
        "J Wald"
      ],
      "year": 2012,
      "doi": "10.2196/jmir.2278",
      "journal": "J Med Internet Res",
      "volume": "14",
      "issue": "6",
      "pages": "150",
      "raw": "Patient perceptions of a personal health record: a test of the diffusion of innovation model \n\t\t \n\t\t\t S Emani \n\t\t \n\t\t \n\t\t\t C K Yamin \n\t\t \n\t\t \n\t\t\t E Peters \n\t\t \n\t\t \n\t\t\t A S Karson \n\t\t \n\t\t \n\t\t\t S R Lipsitz \n\t\t \n\t\t \n\t\t\t J S Wald \n\t\t \n\t\t 10.2196/jmir.2278 \n\t\t Medline: 23128775 \n\t \n\t \n\t\t J Med Internet Res \n\t\t \n\t\t\t 14 \n\t\t\t 6 \n\t\t\t 150 \n\t\t\t 2012 \n\t\t \n\t \n\t FREE Full text \n\t Emani S, Yamin CK, Peters E, Karson AS, Lipsitz SR, Wald JS, et al. Patient perceptions of a personal health record: a test of the diffusion of innovation model. J Med Internet Res 2012;14(6):e150 [FREE Full text] [doi: 10.2196/jmir.2278] [Medline: 23128775]"
    },
    {
      "title": "Parent intention to use a patient portal as related to their children following a facilitated demonstration",
      "authors": [
        "C Ahlers-Schmidt",
        "M Nguyen"
      ],
      "year": 2013,
      "doi": "10.1089/tmj.2013.0041",
      "journal": "Telemed J E Health",
      "volume": "19",
      "issue": "12",
      "raw": "Parent intention to use a patient portal as related to their children following a facilitated demonstration \n\t\t \n\t\t\t C R Ahlers-Schmidt \n\t\t \n\t\t \n\t\t\t M Nguyen \n\t\t \n\t\t 10.1089/tmj.2013.0041 \n\t\t Medline: 24050608 \n\t \n\t \n\t\t Telemed J E Health \n\t\t \n\t\t\t 19 \n\t\t\t 12 \n\t\t\t \n\t\t\t 2013 Dec \n\t\t \n\t \n\t Ahlers-Schmidt CR, Nguyen M. Parent intention to use a patient portal as related to their children following a facilitated demonstration. Telemed J E Health 2013 Dec;19(12):979-981. [doi: 10.1089/tmj.2013.0041] [Medline: 24050608]"
    },
    {
      "title": "Access, interest, and attitudes toward electronic communication for health care among patients in the medical safety net",
      "authors": [
        "A Schickedanz",
        "D Huang",
        "A Lopez",
        "E Cheung",
        "C Lyles",
        "T Bodenheimer"
      ],
      "year": 2013,
      "doi": "10.1007/s11606-012-2329-5",
      "journal": "J Gen Intern Med",
      "volume": "28",
      "issue": "7",
      "raw": "Access, interest, and attitudes toward electronic communication for health care among patients in the medical safety net \n\t\t \n\t\t\t A Schickedanz \n\t\t \n\t\t \n\t\t\t D Huang \n\t\t \n\t\t \n\t\t\t A Lopez \n\t\t \n\t\t \n\t\t\t E Cheung \n\t\t \n\t\t \n\t\t\t C R Lyles \n\t\t \n\t\t \n\t\t\t T Bodenheimer \n\t\t \n\t\t 10.1007/s11606-012-2329-5 \n\t\t Medline: 23423453 \n\t \n\t \n\t\t J Gen Intern Med \n\t\t \n\t\t\t 28 \n\t\t\t 7 \n\t\t\t \n\t\t\t 2013 Jul \n\t\t \n\t \n\t FREE Full text \n\t Schickedanz A, Huang D, Lopez A, Cheung E, Lyles CR, Bodenheimer T, et al. Access, interest, and attitudes toward electronic communication for health care among patients in the medical safety net. J Gen Intern Med 2013 Jul;28(7):914-920 [FREE Full text] [doi: 10.1007/s11606-012-2329-5] [Medline: 23423453]"
    },
    {
      "title": "Internet access and patient portal readiness among patients in a group of inner-city safety-net practices",
      "authors": [
        "M Sanders",
        "P Winters",
        "R Fortuna",
        "M Mendoza",
        "M Berliant",
        "L Clark"
      ],
      "year": 2013,
      "doi": "10.1097/jac.0b013e31829702f9",
      "journal": "J Ambul Care Manage",
      "volume": "36",
      "issue": "3",
      "raw": "Internet access and patient portal readiness among patients in a group of inner-city safety-net practices \n\t\t \n\t\t\t M R Sanders \n\t\t \n\t\t \n\t\t\t P Winters \n\t\t \n\t\t \n\t\t\t R J Fortuna \n\t\t \n\t\t \n\t\t\t M Mendoza \n\t\t \n\t\t \n\t\t\t M Berliant \n\t\t \n\t\t \n\t\t\t L Clark \n\t\t \n\t\t 10.1097/jac.0b013e31829702f9 \n\t\t Medline: 23748274 \n\t \n\t \n\t\t J Ambul Care Manage \n\t\t \n\t\t\t 36 \n\t\t\t 3 \n\t\t\t \n\t\t\t 2013 \n\t\t \n\t \n\t Sanders MR, Winters P, Fortuna RJ, Mendoza M, Berliant M, Clark L, et al. Internet access and patient portal readiness among patients in a group of inner-city safety-net practices. J Ambul Care Manage 2013;36(3):251-259. [doi: 10.1097/JAC.0b013e31829702f9] [Medline: 23748274]"
    },
    {
      "title": "Differences between diabetes patients who are interested or not in the use of a patient Web portal",
      "authors": [
        "Mcm Ronda",
        "L Dijkhorst-Oei",
        "K Gorter",
        "Jwj Beulens",
        "Gehm Rutten"
      ],
      "year": 2013,
      "doi": "10.1089/dia.2013.0023",
      "journal": "Diabetes Technol Ther",
      "volume": "15",
      "issue": "7",
      "raw": "Differences between diabetes patients who are interested or not in the use of a patient Web portal \n\t\t \n\t\t\t Mcm Ronda \n\t\t \n\t\t \n\t\t\t L T Dijkhorst-Oei \n\t\t \n\t\t \n\t\t\t K J Gorter \n\t\t \n\t\t \n\t\t\t Jwj Beulens \n\t\t \n\t\t \n\t\t\t Gehm Rutten \n\t\t \n\t\t 10.1089/dia.2013.0023 \n\t\t Medline: 23777369 \n\t \n\t \n\t\t Diabetes Technol Ther \n\t\t \n\t\t\t 15 \n\t\t\t 7 \n\t\t\t \n\t\t\t 2013 Jul \n\t\t \n\t \n\t FREE Full text \n\t Ronda MCM, Dijkhorst-Oei LT, Gorter KJ, Beulens JWJ, Rutten GEHM. Differences between diabetes patients who are interested or not in the use of a patient Web portal. Diabetes Technol Ther 2013 Jul;15(7):556-563 [FREE Full text] [doi: 10.1089/dia.2013.0023] [Medline: 23777369]"
    },
    {
      "title": "Understanding patient portal use: implications for medication management",
      "authors": [
        "C Osborn",
        "L Mayberry",
        "K Wallston",
        "K Johnson",
        "T Elasy"
      ],
      "year": 2013,
      "doi": "10.2196/jmir.2589",
      "journal": "J Med Internet Res",
      "volume": "15",
      "issue": "7",
      "pages": "133",
      "raw": "Understanding patient portal use: implications for medication management \n\t\t \n\t\t\t C Y Osborn \n\t\t \n\t\t \n\t\t\t L S Mayberry \n\t\t \n\t\t \n\t\t\t K A Wallston \n\t\t \n\t\t \n\t\t\t K B Johnson \n\t\t \n\t\t \n\t\t\t T A Elasy \n\t\t \n\t\t 10.2196/jmir.2589 \n\t\t Medline: 23823974 \n\t \n\t \n\t\t J Med Internet Res \n\t\t \n\t\t\t 15 \n\t\t\t 7 \n\t\t\t 133 \n\t\t\t 2013 \n\t\t \n\t \n\t FREE Full text \n\t Osborn CY, Mayberry LS, Wallston KA, Johnson KB, Elasy TA. Understanding patient portal use: implications for medication management. J Med Internet Res 2013;15(7):e133 [FREE Full text] [doi: 10.2196/jmir.2589] [Medline: 23823974]"
    },
    {
      "title": "Evaluating patient access to Electronic Health Records: results from a survey of veterans",
      "authors": [
        "K Nazi",
        "T Hogan",
        "D Mcinnes",
        "S Woods",
        "G Graham"
      ],
      "year": 2013,
      "doi": "10.1097/mlr.0b013e31827808db",
      "journal": "Med Care",
      "volume": "51",
      "issue": "3 Suppl 1",
      "raw": "Evaluating patient access to Electronic Health Records: results from a survey of veterans \n\t\t \n\t\t\t K M Nazi \n\t\t \n\t\t \n\t\t\t T P Hogan \n\t\t \n\t\t \n\t\t\t D K Mcinnes \n\t\t \n\t\t \n\t\t\t S S Woods \n\t\t \n\t\t \n\t\t\t G Graham \n\t\t \n\t\t 10.1097/mlr.0b013e31827808db \n\t\t Medline: 23407012 \n\t \n\t \n\t\t Med Care \n\t\t \n\t\t\t 51 \n\t\t\t 3 Suppl 1 \n\t\t\t \n\t\t\t 2013 Mar \n\t\t \n\t \n\t Nazi KM, Hogan TP, McInnes DK, Woods SS, Graham G. Evaluating patient access to Electronic Health Records: results from a survey of veterans. Med Care 2013 Mar;51(3 Suppl 1):S52-S56. [doi: 10.1097/MLR.0b013e31827808db] [Medline: 23407012]"
    },
    {
      "title": "Patient-provider communication and trust in relation to use of an online patient portal among diabetes patients: The Diabetes and Aging Study",
      "authors": [
        "C Lyles",
        "U Sarkar",
        "J Ralston",
        "N Adler",
        "D Schillinger",
        "H Moffet"
      ],
      "year": 2013,
      "doi": "10.1136/amiajnl-2012-001567",
      "journal": "J Am Med Inform Assoc",
      "volume": "20",
      "issue": "6",
      "raw": "Patient-provider communication and trust in relation to use of an online patient portal among diabetes patients: The Diabetes and Aging Study \n\t\t \n\t\t\t C R Lyles \n\t\t \n\t\t \n\t\t\t U Sarkar \n\t\t \n\t\t \n\t\t\t J D Ralston \n\t\t \n\t\t \n\t\t\t N Adler \n\t\t \n\t\t \n\t\t\t D Schillinger \n\t\t \n\t\t \n\t\t\t H H Moffet \n\t\t \n\t\t 10.1136/amiajnl-2012-001567 \n\t\t Medline: 23676243 \n\t \n\t \n\t\t J Am Med Inform Assoc \n\t\t \n\t\t\t 20 \n\t\t\t 6 \n\t\t\t \n\t\t\t 2013 \n\t\t \n\t \n\t FREE Full text \n\t Lyles CR, Sarkar U, Ralston JD, Adler N, Schillinger D, Moffet HH, et al. Patient-provider communication and trust in relation to use of an online patient portal among diabetes patients: The Diabetes and Aging Study. J Am Med Inform Assoc 2013;20(6):1128-1131 [FREE Full text] [doi: 10.1136/amiajnl-2012-001567] [Medline: 23676243]"
    },
    {
      "title": "Correlates of patient portal enrollment and activation in primary care pediatrics",
      "authors": [
        "T Ketterer",
        "D West",
        "V Sanders",
        "J Hossain",
        "M Kondo",
        "I Sharif"
      ],
      "year": 2013,
      "doi": "10.1016/j.acap.2013.02.002",
      "journal": "Acad Pediatr",
      "volume": "13",
      "issue": "3",
      "raw": "Correlates of patient portal enrollment and activation in primary care pediatrics \n\t\t \n\t\t\t T Ketterer \n\t\t \n\t\t \n\t\t\t D W West \n\t\t \n\t\t \n\t\t\t V P Sanders \n\t\t \n\t\t \n\t\t\t J Hossain \n\t\t \n\t\t \n\t\t\t M C Kondo \n\t\t \n\t\t \n\t\t\t I Sharif \n\t\t \n\t\t 10.1016/j.acap.2013.02.002 \n\t\t Medline: 23680344 \n\t \n\t \n\t\t Acad Pediatr \n\t\t \n\t\t\t 13 \n\t\t\t 3 \n\t\t\t \n\t\t\t 2013 \n\t\t \n\t \n\t Ketterer T, West DW, Sanders VP, Hossain J, Kondo MC, Sharif I. Correlates of patient portal enrollment and activation in primary care pediatrics. Acad Pediatr 2013;13(3):264-271. [doi: 10.1016/j.acap.2013.02.002] [Medline: 23680344]"
    },
    {
      "title": "How patients want to engage with their personal health record: a qualitative study",
      "authors": [
        "J Kerns",
        "A Krist",
        "D Longo",
        "A Kuzel",
        "S Woolf"
      ],
      "year": 2013,
      "doi": "10.1136/bmjopen-2013-002931",
      "journal": "BMJ Open",
      "volume": "3",
      "issue": "7",
      "raw": "How patients want to engage with their personal health record: a qualitative study \n\t\t \n\t\t\t J W Kerns \n\t\t \n\t\t \n\t\t\t A H Krist \n\t\t \n\t\t \n\t\t\t D R Longo \n\t\t \n\t\t \n\t\t\t A J Kuzel \n\t\t \n\t\t \n\t\t\t S H Woolf \n\t\t \n\t\t 10.1136/bmjopen-2013-002931 \n\t\t Medline: 23901027 \n\t \n\t \n\t\t BMJ Open \n\t\t \n\t\t\t 3 \n\t\t\t 7 \n\t\t\t \n\t\t\t 2013 \n\t\t \n\t \n\t FREE Full text \n\t Kerns JW, Krist AH, Longo DR, Kuzel AJ, Woolf SH. How patients want to engage with their personal health record: a qualitative study. BMJ Open 2013;3(7):1-10 [FREE Full text] [doi: 10.1136/bmjopen-2013-002931] [Medline: 23901027]"
    },
    {
      "title": "Use of a web 2.0 portal to improve education and communication in young patients with families: randomized controlled trial",
      "authors": [
        "L Hanberger",
        "J Ludvigsson",
        "S Nordfeldt"
      ],
      "year": 2013,
      "doi": "10.2196/jmir.2425",
      "journal": "J Med Internet Res",
      "volume": "15",
      "issue": "8",
      "pages": "175",
      "raw": "Use of a web 2.0 portal to improve education and communication in young patients with families: randomized controlled trial \n\t\t \n\t\t\t L Hanberger \n\t\t \n\t\t \n\t\t\t J Ludvigsson \n\t\t \n\t\t \n\t\t\t S Nordfeldt \n\t\t \n\t\t 10.2196/jmir.2425 \n\t\t Medline: 23973555 \n\t \n\t \n\t\t J Med Internet Res \n\t\t \n\t\t\t 15 \n\t\t\t 8 \n\t\t\t 175 \n\t\t\t 2013 \n\t\t \n\t \n\t FREE Full text \n\t Hanberger L, Ludvigsson J, Nordfeldt S. Use of a web 2.0 portal to improve education and communication in young patients with families: randomized controlled trial. J Med Internet Res 2013;15(8):e175 [FREE Full text] [doi: 10.2196/jmir.2425] [Medline: 23973555]"
    },
    {
      "title": "Understanding adoption of a personal health record in rural health care clinics: revealing barriers and facilitators of adoption including attributions about potential patient portal users and self-reported characteristics of early adopting users",
      "authors": [
        "J Butler",
        "M Carter",
        "C Hayden",
        "B Gibson",
        "C Weir",
        "L Snow"
      ],
      "year": 2013,
      "journal": "AMIA Annu Symp Proc",
      "volume": "2013",
      "raw": "Understanding adoption of a personal health record in rural health care clinics: revealing barriers and facilitators of adoption including attributions about potential patient portal users and self-reported characteristics of early adopting users \n\t\t \n\t\t\t J M Butler \n\t\t \n\t\t \n\t\t\t M Carter \n\t\t \n\t\t \n\t\t\t C Hayden \n\t\t \n\t\t \n\t\t\t B Gibson \n\t\t \n\t\t \n\t\t\t C Weir \n\t\t \n\t\t \n\t\t\t L Snow \n\t\t \n\t\t Medline: 24551328 \n\t \n\t \n\t\t AMIA Annu Symp Proc \n\t\t \n\t\t\t 2013 \n\t\t\t \n\t\t\t 2013 \n\t\t \n\t \n\t FREE Full text \n\t Butler JM, Carter M, Hayden C, Gibson B, Weir C, Snow L, et al. Understanding adoption of a personal health record in rural health care clinics: revealing barriers and facilitators of adoption including attributions about potential patient portal users and self-reported characteristics of early adopting users. AMIA Annu Symp Proc 2013;2013:152-161 [FREE Full text] [Medline: 24551328]"
    },
    {
      "title": "Propensity of people with long-term conditions to use personal health records",
      "authors": [
        "Y Gu",
        "K Day"
      ],
      "year": 2013,
      "journal": "Stud Health Technol Inform",
      "volume": "188",
      "raw": "Propensity of people with long-term conditions to use personal health records \n\t\t \n\t\t\t Y Gu \n\t\t \n\t\t \n\t\t\t K Day \n\t\t \n\t\t Medline: 23823287 \n\t \n\t \n\t\t Stud Health Technol Inform \n\t\t \n\t\t\t 188 \n\t\t\t \n\t\t\t 2013 \n\t\t \n\t \n\t Gu Y, Day K. Propensity of people with long-term conditions to use personal health records. Stud Health Technol Inform 2013;188:46-51. [Medline: 23823287]"
    },
    {
      "title": "Predictors and intensity of online access to electronic medical records among patients with cancer",
      "authors": [
        "D Gerber",
        "A Laccetti",
        "Chen Yan",
        "J Cai",
        "J Gates"
      ],
      "year": 2014,
      "doi": "10.1200/jop.2013.001347",
      "journal": "J Oncol Pract",
      "volume": "10",
      "issue": "5",
      "raw": "Predictors and intensity of online access to electronic medical records among patients with cancer \n\t\t \n\t\t\t D E Gerber \n\t\t \n\t\t \n\t\t\t A L Laccetti \n\t\t \n\t\t \n\t\t\t Chen B Yan \n\t\t \n\t\t \n\t\t\t J Cai \n\t\t \n\t\t \n\t\t\t J Gates \n\t\t \n\t\t \n\t\t\t S \n\t\t \n\t\t 10.1200/jop.2013.001347 \n\t\t Medline: 25006222 \n\t \n\t \n\t\t J Oncol Pract \n\t\t \n\t\t\t 10 \n\t\t\t 5 \n\t\t\t \n\t\t\t 2014 Sep \n\t\t \n\t \n\t FREE Full text \n\t Gerber DE, Laccetti AL, Chen B, Yan J, Cai J, Gates S, et al. Predictors and intensity of online access to electronic medical records among patients with cancer. J Oncol Pract 2014 Sep;10(5):e307-e312 [FREE Full text] [doi: 10.1200/JOP.2013.001347] [Medline: 25006222]"
    },
    {
      "title": "Development of interactive empowerment services in support of personalised medicine",
      "authors": [
        "H Kondylakis",
        "E Kazantzaki",
        "L Koumakis",
        "I Genitsaridi",
        "K Marias",
        "A Gorini"
      ],
      "year": 2014,
      "doi": "10.3332/ecancer.2014.400",
      "journal": "Ecancermedicalscience",
      "volume": "8",
      "pages": "400",
      "raw": "Development of interactive empowerment services in support of personalised medicine \n\t\t \n\t\t\t H Kondylakis \n\t\t \n\t\t \n\t\t\t E Kazantzaki \n\t\t \n\t\t \n\t\t\t L Koumakis \n\t\t \n\t\t \n\t\t\t I Genitsaridi \n\t\t \n\t\t \n\t\t\t K Marias \n\t\t \n\t\t \n\t\t\t A Gorini \n\t\t \n\t\t 10.3332/ecancer.2014.400 \n\t\t Medline: 24567757 \n\t \n\t \n\t\t Ecancermedicalscience \n\t\t \n\t\t\t 8 \n\t\t\t 400 \n\t\t\t 2014 \n\t\t \n\t \n\t FREE Full text \n\t Kondylakis H, Kazantzaki E, Koumakis L, Genitsaridi I, Marias K, Gorini A, et al. Development of interactive empowerment services in support of personalised medicine. Ecancermedicalscience 2014;8:400 [FREE Full text] [doi: 10.3332/ecancer.2014.400] [Medline: 24567757]"
    },
    {
      "title": "Engaging primary care patients to use a patient-centered personal health record",
      "authors": [
        "A Krist",
        "S Woolf",
        "G Bello",
        "R Sabo",
        "D Longo",
        "P Kashiri"
      ],
      "year": 2014,
      "doi": "10.1370/afm.1691",
      "journal": "Ann Fam Med",
      "volume": "12",
      "issue": "5",
      "raw": "Engaging primary care patients to use a patient-centered personal health record \n\t\t \n\t\t\t A H Krist \n\t\t \n\t\t \n\t\t\t S H Woolf \n\t\t \n\t\t \n\t\t\t G A Bello \n\t\t \n\t\t \n\t\t\t R T Sabo \n\t\t \n\t\t \n\t\t\t D R Longo \n\t\t \n\t\t \n\t\t\t P Kashiri \n\t\t \n\t\t 10.1370/afm.1691 \n\t\t Medline: 25354405 \n\t \n\t \n\t\t Ann Fam Med \n\t\t \n\t\t\t 12 \n\t\t\t 5 \n\t\t\t \n\t\t\t 2014 \n\t\t \n\t \n\t FREE Full text \n\t Krist AH, Woolf SH, Bello GA, Sabo RT, Longo DR, Kashiri P, et al. Engaging primary care patients to use a patient-centered personal health record. Ann Fam Med 2014;12(5):418-426 [FREE Full text] [doi: 10.1370/afm.1691] [Medline: 25354405]"
    },
    {
      "title": "Virtualized healthcare delivery: understanding users and their usage patterns of online medical consultations",
      "authors": [
        "C Jung",
        "R Padman"
      ],
      "year": 2014,
      "doi": "10.1016/j.ijmedinf.2014.08.004",
      "journal": "Int J Med Inform",
      "volume": "83",
      "issue": "12",
      "raw": "Virtualized healthcare delivery: understanding users and their usage patterns of online medical consultations \n\t\t \n\t\t\t C Jung \n\t\t \n\t\t \n\t\t\t R Padman \n\t\t \n\t\t 10.1016/j.ijmedinf.2014.08.004 \n\t\t Medline: 25193501 \n\t \n\t \n\t\t Int J Med Inform \n\t\t \n\t\t\t 83 \n\t\t\t 12 \n\t\t\t \n\t\t\t 2014 Dec \n\t\t \n\t \n\t Jung C, Padman R. Virtualized healthcare delivery: understanding users and their usage patterns of online medical consultations. Int J Med Inform 2014 Dec;83(12):901-914. [doi: 10.1016/j.ijmedinf.2014.08.004] [Medline: 25193501]"
    },
    {
      "title": "Evaluating user experiences of the secure messaging tool on the Veterans Affairs' patient portal system",
      "authors": [
        "J Haun",
        "J Lind",
        "S Shimada",
        "T Martin",
        "R Gosline",
        "N Antinori"
      ],
      "year": 2014,
      "doi": "10.2196/jmir.2976",
      "journal": "J Med Internet Res",
      "volume": "16",
      "issue": "3",
      "pages": "75",
      "raw": "Evaluating user experiences of the secure messaging tool on the Veterans Affairs' patient portal system \n\t\t \n\t\t\t J N Haun \n\t\t \n\t\t \n\t\t\t J D Lind \n\t\t \n\t\t \n\t\t\t S L Shimada \n\t\t \n\t\t \n\t\t\t T L Martin \n\t\t \n\t\t \n\t\t\t R M Gosline \n\t\t \n\t\t \n\t\t\t N Antinori \n\t\t \n\t\t 10.2196/jmir.2976 \n\t\t Medline: 24610454 \n\t \n\t \n\t\t J Med Internet Res \n\t\t \n\t\t\t 16 \n\t\t\t 3 \n\t\t\t 75 \n\t\t\t 2014 \n\t\t \n\t \n\t FREE Full text \n\t Haun JN, Lind JD, Shimada SL, Martin TL, Gosline RM, Antinori N, et al. Evaluating user experiences of the secure messaging tool on the Veterans Affairs' patient portal system. J Med Internet Res 2014;16(3):e75 [FREE Full text] [doi: 10.2196/jmir.2976] [Medline: 24610454]"
    },
    {
      "title": "Impact of patient-accessible electronic medical records in rheumatology: use, satisfaction and effects on empowerment among patients",
      "authors": [
        "R Van Der Vaart",
        "Chc Drossaert",
        "E Taal",
        "K Drossaers-Bakker",
        "H Vonkeman",
        "Mafj Van De Laar"
      ],
      "year": 2014,
      "doi": "10.1186/1471-2474-15-102",
      "journal": "BMC Musculoskelet Disord",
      "volume": "15",
      "pages": "102",
      "raw": "Impact of patient-accessible electronic medical records in rheumatology: use, satisfaction and effects on empowerment among patients \n\t\t \n\t\t\t R Van Der Vaart \n\t\t \n\t\t \n\t\t\t Chc Drossaert \n\t\t \n\t\t \n\t\t\t E Taal \n\t\t \n\t\t \n\t\t\t K W Drossaers-Bakker \n\t\t \n\t\t \n\t\t\t H E Vonkeman \n\t\t \n\t\t \n\t\t\t Mafj Van De Laar \n\t\t \n\t\t 10.1186/1471-2474-15-102 \n\t\t Medline: 24673997 \n\t \n\t \n\t\t BMC Musculoskelet Disord \n\t\t \n\t\t\t 15 \n\t\t\t 102 \n\t\t\t 2014 \n\t\t \n\t \n\t FREE Full text \n\t van der Vaart R, Drossaert CHC, Taal E, Drossaers-Bakker KW, Vonkeman HE, van de Laar MAFJ. Impact of patient-accessible electronic medical records in rheumatology: use, satisfaction and effects on empowerment among patients. BMC Musculoskelet Disord 2014;15:102 [FREE Full text] [doi: 10.1186/1471-2474-15-102] [Medline: 24673997]"
    },
    {
      "title": "Rapid growth in use of personal health records in New York, 2012-2013",
      "authors": [
        "J Ancker",
        "M Silver",
        "R Kaushal"
      ],
      "year": 2014,
      "doi": "10.1007/s11606-014-2792-2",
      "journal": "J Gen Intern Med",
      "volume": "29",
      "issue": "6",
      "raw": "Rapid growth in use of personal health records in New York, 2012-2013 \n\t\t \n\t\t\t J S Ancker \n\t\t \n\t\t \n\t\t\t M Silver \n\t\t \n\t\t \n\t\t\t R Kaushal \n\t\t \n\t\t 10.1007/s11606-014-2792-2 \n\t\t Medline: 24519102 \n\t \n\t \n\t\t J Gen Intern Med \n\t\t \n\t\t\t 29 \n\t\t\t 6 \n\t\t\t \n\t\t\t 2014 Jun \n\t\t \n\t \n\t Ancker JS, Silver M, Kaushal R. Rapid growth in use of personal health records in New York, 2012-2013. J Gen Intern Med 2014 Jun;29(6):850-854. [doi: 10.1007/s11606-014-2792-2] [Medline: 24519102]"
    },
    {
      "title": "Consumer perspectives on personal health records: a 4-community study",
      "authors": [
        "E Abramson",
        "V Patel",
        "A Edwards",
        "R Kaushal"
      ],
      "year": 2014,
      "journal": "Am J Manag Care",
      "volume": "20",
      "issue": "4",
      "raw": "Consumer perspectives on personal health records: a 4-community study \n\t\t \n\t\t\t E L Abramson \n\t\t \n\t\t \n\t\t\t V Patel \n\t\t \n\t\t \n\t\t\t A Edwards \n\t\t \n\t\t \n\t\t\t R Kaushal \n\t\t \n\t\t Medline: 24884860 \n\t \n\t \n\t\t Am J Manag Care \n\t\t \n\t\t\t 20 \n\t\t\t 4 \n\t\t\t \n\t\t\t 2014 Apr \n\t\t \n\t \n\t FREE Full text \n\t Abramson EL, Patel V, Edwards A, Kaushal R. Consumer perspectives on personal health records: a 4-community study. Am J Manag Care 2014 Apr;20(4):287-296 [FREE Full text] [Medline: 24884860]"
    },
    {
      "title": "Patients' continuing use of an online health record: a quantitative evaluation of 14,000 patient years of access data",
      "authors": [
        "R Phelps",
        "J Taylor",
        "K Simpson",
        "J Samuel",
        "A Turner"
      ],
      "year": 2014,
      "doi": "10.2196/jmir.3371",
      "journal": "J Med Internet Res",
      "volume": "16",
      "issue": "10",
      "pages": "241",
      "raw": "Patients' continuing use of an online health record: a quantitative evaluation of 14,000 patient years of access data \n\t\t \n\t\t\t R G Phelps \n\t\t \n\t\t \n\t\t\t J Taylor \n\t\t \n\t\t \n\t\t\t K Simpson \n\t\t \n\t\t \n\t\t\t J Samuel \n\t\t \n\t\t \n\t\t\t A N Turner \n\t\t \n\t\t 10.2196/jmir.3371 \n\t\t Medline: 25344621 \n\t \n\t \n\t\t J Med Internet Res \n\t\t \n\t\t\t 16 \n\t\t\t 10 \n\t\t\t 241 \n\t\t\t 2014 \n\t\t \n\t \n\t FREE Full text \n\t Phelps RG, Taylor J, Simpson K, Samuel J, Turner AN. Patients' continuing use of an online health record: a quantitative evaluation of 14,000 patient years of access data. J Med Internet Res 2014;16(10):e241 [FREE Full text] [doi: 10.2196/jmir.3371] [Medline: 25344621]"
    },
    {
      "title": "Meaningful use and the patient portal: patient enrollment, use, and satisfaction with patient portals at a later-adopting center",
      "authors": [
        "J Neuner",
        "M Fedders",
        "M Caravella",
        "L Bradford",
        "M Schapira"
      ],
      "year": 2015,
      "doi": "10.1177/1062860614523488",
      "journal": "Am J Med Qual",
      "volume": "30",
      "issue": "2",
      "raw": "Meaningful use and the patient portal: patient enrollment, use, and satisfaction with patient portals at a later-adopting center \n\t\t \n\t\t\t J Neuner \n\t\t \n\t\t \n\t\t\t M Fedders \n\t\t \n\t\t \n\t\t\t M Caravella \n\t\t \n\t\t \n\t\t\t L Bradford \n\t\t \n\t\t \n\t\t\t M Schapira \n\t\t \n\t\t 10.1177/1062860614523488 \n\t\t Medline: 24563085 \n\t \n\t \n\t\t Am J Med Qual \n\t\t \n\t\t\t 30 \n\t\t\t 2 \n\t\t\t \n\t\t\t 2015 \n\t\t \n\t \n\t Neuner J, Fedders M, Caravella M, Bradford L, Schapira M. Meaningful use and the patient portal: patient enrollment, use, and satisfaction with patient portals at a later-adopting center. Am J Med Qual 2015;30(2):105-113. [doi: 10.1177/1062860614523488] [Medline: 24563085]"
    },
    {
      "title": "The effect of a patient portal with electronic messaging on patient activation among chronically ill patients: controlled before-and-after study",
      "authors": [
        "I Riippa",
        "M Linna",
        "I R\u00f6nkk\u00f6"
      ],
      "year": 2014,
      "doi": "10.2196/jmir.3462",
      "journal": "J Med Internet Res",
      "volume": "16",
      "issue": "11",
      "pages": "257",
      "raw": "The effect of a patient portal with electronic messaging on patient activation among chronically ill patients: controlled before-and-after study \n\t\t \n\t\t\t I Riippa \n\t\t \n\t\t \n\t\t\t M Linna \n\t\t \n\t\t \n\t\t\t I R\u00f6nkk\u00f6 \n\t\t \n\t\t 10.2196/jmir.3462 \n\t\t Medline: 25413368 \n\t \n\t \n\t\t J Med Internet Res \n\t\t \n\t\t\t 16 \n\t\t\t 11 \n\t\t\t 257 \n\t\t\t 2014 \n\t\t \n\t \n\t FREE Full text \n\t Riippa I, Linna M, R\u00f6nkk\u00f6 I. The effect of a patient portal with electronic messaging on patient activation among chronically ill patients: controlled before-and-after study. J Med Internet Res 2014;16(11):e257 [FREE Full text] [doi: 10.2196/jmir.3462] [Medline: 25413368]"
    },
    {
      "title": "Patient activation and use of an electronic patient portal",
      "authors": [
        "J Ancker",
        "S Osorio",
        "A Cheriff",
        "C Cole",
        "M Silver",
        "R Kaushal"
      ],
      "year": 2014,
      "doi": "10.3109/17538157.2014.908200",
      "journal": "Inform Health Soc Care",
      "raw": "Patient activation and use of an electronic patient portal \n\t\t \n\t\t\t J S Ancker \n\t\t \n\t\t \n\t\t\t S N Osorio \n\t\t \n\t\t \n\t\t\t A Cheriff \n\t\t \n\t\t \n\t\t\t C L Cole \n\t\t \n\t\t \n\t\t\t M Silver \n\t\t \n\t\t \n\t\t\t R Kaushal \n\t\t \n\t\t 10.3109/17538157.2014.908200 \n\t\t Medline: 24786648 \n\t \n\t \n\t\t Inform Health Soc Care \n\t\t \n\t\t\t \n\t\t\t 2014 Apr 30 \n\t\t \n\t \n\t Ancker JS, Osorio SN, Cheriff A, Cole CL, Silver M, Kaushal R. Patient activation and use of an electronic patient portal. Inform Health Soc Care 2014 Apr 30:1-13. [doi: 10.3109/17538157.2014.908200] [Medline: 24786648]"
    },
    {
      "title": "Barriers to the use of a personal health record by an elderly population",
      "authors": [
        "W Lober",
        "B Zierler",
        "A Herbaugh",
        "S Shinstrom",
        "A Stolyar",
        "E Kim"
      ],
      "year": 2006,
      "journal": "AMIA Annu Symp Proc",
      "raw": "Barriers to the use of a personal health record by an elderly population \n\t\t \n\t\t\t W B Lober \n\t\t \n\t\t \n\t\t\t B Zierler \n\t\t \n\t\t \n\t\t\t A Herbaugh \n\t\t \n\t\t \n\t\t\t S E Shinstrom \n\t\t \n\t\t \n\t\t\t A Stolyar \n\t\t \n\t\t \n\t\t\t E H Kim \n\t\t \n\t\t Medline: 17238394 \n\t \n\t \n\t\t AMIA Annu Symp Proc \n\t\t \n\t\t\t \n\t\t\t 2006 \n\t\t \n\t \n\t FREE Full text \n\t Lober WB, Zierler B, Herbaugh A, Shinstrom SE, Stolyar A, Kim EH, et al. Barriers to the use of a personal health record by an elderly population. AMIA Annu Symp Proc 2006:514-518 [FREE Full text] [Medline: 17238394]"
    },
    {
      "title": "Factors affecting usage of a personal health record (PHR) to manage health",
      "authors": [
        "J Taha",
        "S Czaja",
        "J Sharit",
        "D Morrow"
      ],
      "year": 2013,
      "doi": "10.1037/a0033911",
      "journal": "Psychol Aging",
      "volume": "28",
      "issue": "4",
      "raw": "Factors affecting usage of a personal health record (PHR) to manage health \n\t\t \n\t\t\t J Taha \n\t\t \n\t\t \n\t\t\t S J Czaja \n\t\t \n\t\t \n\t\t\t J Sharit \n\t\t \n\t\t \n\t\t\t D G Morrow \n\t\t \n\t\t 10.1037/a0033911 \n\t\t Medline: 24364414 \n\t \n\t \n\t\t Psychol Aging \n\t\t \n\t\t\t 28 \n\t\t\t 4 \n\t\t\t \n\t\t\t 2013 Dec \n\t\t \n\t \n\t Taha J, Czaja SJ, Sharit J, Morrow DG. Factors affecting usage of a personal health record (PHR) to manage health. Psychol Aging 2013 Dec;28(4):1124-1139. [doi: 10.1037/a0033911] [Medline: 24364414]"
    },
    {
      "title": "The literacy divide: health literacy and the use of an internet-based patient portal in an integrated health system-results from the diabetes study of northern California (DISTANCE)",
      "authors": [
        "U Sarkar",
        "A Karter",
        "J Liu",
        "N Adler",
        "R Nguyen",
        "A Lopez"
      ],
      "year": 2010,
      "doi": "10.1080/10810730.2010.499988",
      "journal": "J Health Commun",
      "volume": "15",
      "issue": "Suppl 2",
      "raw": "The literacy divide: health literacy and the use of an internet-based patient portal in an integrated health system-results from the diabetes study of northern California (DISTANCE) \n\t\t \n\t\t\t U Sarkar \n\t\t \n\t\t \n\t\t\t A J Karter \n\t\t \n\t\t \n\t\t\t J Y Liu \n\t\t \n\t\t \n\t\t\t N E Adler \n\t\t \n\t\t \n\t\t\t R Nguyen \n\t\t \n\t\t \n\t\t\t A Lopez \n\t\t \n\t\t 10.1080/10810730.2010.499988 \n\t\t Medline: 20845203 \n\t \n\t \n\t\t J Health Commun \n\t\t \n\t\t\t 15 \n\t\t\t Suppl 2 \n\t\t\t \n\t\t\t 2010 \n\t\t \n\t \n\t FREE Full text \n\t Sarkar U, Karter AJ, Liu JY, Adler NE, Nguyen R, Lopez A, et al. The literacy divide: health literacy and the use of an internet-based patient portal in an integrated health system-results from the diabetes study of northern California (DISTANCE). J Health Commun 2010;15 Suppl 2:183-196 [FREE Full text] [doi: 10.1080/10810730.2010.499988] [Medline: 20845203]"
    },
    {
      "title": "Modeling factors that influence personal health records adoption",
      "authors": [
        "M Logue",
        "J Effken"
      ],
      "year": 2012,
      "doi": "10.1097/nxn.0b013e3182510717",
      "journal": "Comput Inform Nurs",
      "volume": "30",
      "issue": "7",
      "raw": "Modeling factors that influence personal health records adoption \n\t\t \n\t\t\t M D Logue \n\t\t \n\t\t \n\t\t\t J A Effken \n\t\t \n\t\t 10.1097/nxn.0b013e3182510717 \n\t\t Medline: 22525046 \n\t \n\t \n\t\t Comput Inform Nurs \n\t\t \n\t\t\t 30 \n\t\t\t 7 \n\t\t\t \n\t\t\t 2012 Jul \n\t\t \n\t \n\t Logue MD, Effken JA. Modeling factors that influence personal health records adoption. Comput Inform Nurs 2012 Jul;30(7):354-362. [doi: 10.1097/NXN.0b013e3182510717] [Medline: 22525046]"
    },
    {
      "title": "Many physicians are willing to use patients' electronic personal health records, but doctors differ by location, gender, and practice",
      "authors": [
        "M Wynia",
        "G Torres",
        "J Lemieux"
      ],
      "year": 2011,
      "doi": "10.1377/hlthaff.2010.0342",
      "journal": "Health Aff (Millwood)",
      "volume": "30",
      "issue": "2",
      "raw": "Many physicians are willing to use patients' electronic personal health records, but doctors differ by location, gender, and practice \n\t\t \n\t\t\t M K Wynia \n\t\t \n\t\t \n\t\t\t G W Torres \n\t\t \n\t\t \n\t\t\t J Lemieux \n\t\t \n\t\t 10.1377/hlthaff.2010.0342 \n\t\t Medline: 21289348 \n\t \n\t \n\t\t Health Aff (Millwood) \n\t\t \n\t\t\t 30 \n\t\t\t 2 \n\t\t\t \n\t\t\t 2011 Feb \n\t\t \n\t \n\t FREE Full text \n\t Wynia MK, Torres GW, Lemieux J. Many physicians are willing to use patients' electronic personal health records, but doctors differ by location, gender, and practice. Health Aff (Millwood) 2011 Feb;30(2):266-273 [FREE Full text] [doi: 10.1377/hlthaff.2010.0342] [Medline: 21289348]"
    },
    {
      "title": "The personal health record paradox: health care professionals' perspectives and the information ecology of personal health record systems in organizational and clinical settings",
      "authors": [
        "K Nazi"
      ],
      "year": 2013,
      "doi": "10.2196/jmir.2443",
      "journal": "J Med Internet Res",
      "volume": "15",
      "issue": "4",
      "pages": "70",
      "raw": "The personal health record paradox: health care professionals' perspectives and the information ecology of personal health record systems in organizational and clinical settings \n\t\t \n\t\t\t K M Nazi \n\t\t \n\t\t 10.2196/jmir.2443 \n\t\t Medline: 23557596 \n\t \n\t \n\t\t J Med Internet Res \n\t\t \n\t\t\t 15 \n\t\t\t 4 \n\t\t\t 70 \n\t\t\t 2013 \n\t\t \n\t \n\t FREE Full text \n\t Nazi KM. The personal health record paradox: health care professionals' perspectives and the information ecology of personal health record systems in organizational and clinical settings. J Med Internet Res 2013;15(4):e70 [FREE Full text] [doi: 10.2196/jmir.2443] [Medline: 23557596]"
    },
    {
      "title": "Family physicians' perspectives on personal health records: qualitative study",
      "authors": [
        "G Yau",
        "A Williams",
        "J Brown"
      ],
      "year": 2011,
      "journal": "Can Fam Physician",
      "volume": "57",
      "issue": "5",
      "raw": "Family physicians' perspectives on personal health records: qualitative study \n\t\t \n\t\t\t G L Yau \n\t\t \n\t\t \n\t\t\t A S Williams \n\t\t \n\t\t \n\t\t\t J B Brown \n\t\t \n\t\t Medline: 21642732 \n\t \n\t \n\t\t Can Fam Physician \n\t\t \n\t\t\t 57 \n\t\t\t 5 \n\t\t\t \n\t\t\t 2011 May \n\t\t \n\t \n\t FREE Full text \n\t Yau GL, Williams AS, Brown JB. Family physicians' perspectives on personal health records: qualitative study. Can Fam Physician 2011 May;57(5):e178-e184 [FREE Full text] [Medline: 21642732]"
    },
    {
      "title": "Giving rheumatology patients online home access to their electronic medical record (EMR): advantages, drawbacks and preconditions according to care providers",
      "authors": [
        "R Van Der Vaart",
        "Chc Drossaert",
        "E Taal",
        "Mafj Van De Laar"
      ],
      "year": 2013,
      "doi": "10.1007/s00296-012-2408-2",
      "journal": "Rheumatol Int",
      "volume": "33",
      "issue": "9",
      "raw": "Giving rheumatology patients online home access to their electronic medical record (EMR): advantages, drawbacks and preconditions according to care providers \n\t\t \n\t\t\t R Van Der Vaart \n\t\t \n\t\t \n\t\t\t Chc Drossaert \n\t\t \n\t\t \n\t\t\t E Taal \n\t\t \n\t\t \n\t\t\t Mafj Van De Laar \n\t\t \n\t\t 10.1007/s00296-012-2408-2 \n\t\t Medline: 22453527 \n\t \n\t \n\t\t Rheumatol Int \n\t\t \n\t\t\t 33 \n\t\t\t 9 \n\t\t\t \n\t\t\t 2013 Sep \n\t\t \n\t \n\t FREE Full text \n\t van der Vaart R, Drossaert CHC, Taal E, van de Laar MAFJ. Giving rheumatology patients online home access to their electronic medical record (EMR): advantages, drawbacks and preconditions according to care providers. Rheumatol Int 2013 Sep;33(9):2405-2410 [FREE Full text] [doi: 10.1007/s00296-012-2408-2] [Medline: 22453527]"
    },
    {
      "title": "Is Canada ready for patient accessible electronic health records? A national scan",
      "authors": [
        "S Urowitz",
        "D Wiljer",
        "E Apatu",
        "G Eysenbach",
        "C Delenardo",
        "T Harth"
      ],
      "year": 2008,
      "doi": "10.1186/1472-6947-8-33",
      "journal": "BMC Med Inform Decis Mak",
      "volume": "8",
      "pages": "33",
      "raw": "Is Canada ready for patient accessible electronic health records? A national scan \n\t\t \n\t\t\t S Urowitz \n\t\t \n\t\t \n\t\t\t D Wiljer \n\t\t \n\t\t \n\t\t\t E Apatu \n\t\t \n\t\t \n\t\t\t G Eysenbach \n\t\t \n\t\t \n\t\t\t C Delenardo \n\t\t \n\t\t \n\t\t\t T Harth \n\t\t \n\t\t 10.1186/1472-6947-8-33 \n\t\t Medline: 18652695 \n\t \n\t \n\t\t BMC Med Inform Decis Mak \n\t\t \n\t\t\t 8 \n\t\t\t 33 \n\t\t\t 2008 \n\t\t \n\t \n\t FREE Full text \n\t Urowitz S, Wiljer D, Apatu E, Eysenbach G, Delenardo C, Harth T, et al. Is Canada ready for patient accessible electronic health records? A national scan. BMC Med Inform Decis Mak 2008;8:33 [FREE Full text] [doi: 10.1186/1472-6947-8-33] [Medline: 18652695]"
    },
    {
      "title": "Family physician perceptions of personal health records",
      "authors": [
        "M Witry",
        "W Doucette",
        "J Daly",
        "B Levy",
        "E Chrischilles"
      ],
      "year": 2010,
      "journal": "Perspect Health Inf Manag",
      "volume": "7",
      "issue": "1",
      "raw": "Family physician perceptions of personal health records \n\t\t \n\t\t\t M J Witry \n\t\t \n\t\t \n\t\t\t W R Doucette \n\t\t \n\t\t \n\t\t\t J M Daly \n\t\t \n\t\t \n\t\t\t B T Levy \n\t\t \n\t\t \n\t\t\t E A Chrischilles \n\t\t \n\t\t Medline: 20697465 \n\t \n\t \n\t\t Perspect Health Inf Manag \n\t\t \n\t\t\t 7 \n\t\t\t 1 \n\t\t\t 2010 \n\t\t \n\t \n\t FREE Full text \n\t Witry MJ, Doucette WR, Daly JM, Levy BT, Chrischilles EA. Family physician perceptions of personal health records. Perspect Health Inf Manag 2010;7:1d [FREE Full text] [Medline: 20697465]"
    },
    {
      "title": "Meeting the health information needs of prostate cancer patients using personal health records",
      "authors": [
        "H Pai",
        "F Lau",
        "J Barnett",
        "S Jones"
      ],
      "year": 2013,
      "doi": "10.3747/co.20.1584",
      "journal": "Curr Oncol",
      "volume": "20",
      "issue": "6",
      "raw": "Meeting the health information needs of prostate cancer patients using personal health records \n\t\t \n\t\t\t H H Pai \n\t\t \n\t\t \n\t\t\t F Lau \n\t\t \n\t\t \n\t\t\t J Barnett \n\t\t \n\t\t \n\t\t\t S Jones \n\t\t \n\t\t 10.3747/co.20.1584 \n\t\t Medline: 24311957 \n\t \n\t \n\t\t Curr Oncol \n\t\t \n\t\t\t 20 \n\t\t\t 6 \n\t\t\t \n\t\t\t 2013 Dec \n\t\t \n\t \n\t FREE Full text \n\t Pai HH, Lau F, Barnett J, Jones S. Meeting the health information needs of prostate cancer patients using personal health records. Curr Oncol 2013 Dec;20(6):e561-e569 [FREE Full text] [doi: 10.3747/co.20.1584] [Medline: 24311957]"
    },
    {
      "title": "National Library of Medicine Current Bibliographies in Medicine: Health Literacy",
      "authors": [
        "C Selden",
        "M Zorn",
        "S Ratzan",
        "R Parker"
      ],
      "year": 2000,
      "doi": "10.1037/e306642003-001",
      "raw": "C R Selden \n\t\t \n\t\t \n\t\t\t M Zorn \n\t\t \n\t\t \n\t\t\t S C Ratzan \n\t\t \n\t\t \n\t\t\t R M Parker \n\t\t \n\t\t 10.1037/e306642003-001 \n\t\t \n\t\t National Library of Medicine Current Bibliographies in Medicine: Health Literacy \n\t\t Washington, DC \n\t\t \n\t\t\t US Department of Health and Human Services. Healthy People \n\t\t\t 2000. 2010. 2015-06-02 \n\t\t \n\t \n\t 6YzJ53nyH \n\t Selden CR, Zorn M, Ratzan SC, Parker RM. National Library of Medicine Current Bibliographies in Medicine: Health Literacy. Washington, DC: U.S. Government Printing Office; 2000. US Department of Health and Human Services. Healthy People 2010. Introduction URL: http://chirr.nlm.nih.gov/health-literacy.php [accessed 2015-06-02] [WebCite Cache ID 6YzJ53nyH]"
    },
    {
      "title": "Patient-centered design of an information management module for a personally controlled health record",
      "authors": [
        "C Sox",
        "W Gribbons",
        "B Loring",
        "K Mandl",
        "R Batista",
        "S Porter"
      ],
      "year": 2010,
      "doi": "10.2196/jmir.1269",
      "journal": "J Med Internet Res",
      "volume": "12",
      "issue": "3",
      "pages": "36",
      "raw": "Patient-centered design of an information management module for a personally controlled health record \n\t\t \n\t\t\t C M Sox \n\t\t \n\t\t \n\t\t\t W M Gribbons \n\t\t \n\t\t \n\t\t\t B A Loring \n\t\t \n\t\t \n\t\t\t K D Mandl \n\t\t \n\t\t \n\t\t\t R Batista \n\t\t \n\t\t \n\t\t\t S C Porter \n\t\t \n\t\t 10.2196/jmir.1269 \n\t\t Medline: 20805091 \n\t \n\t \n\t\t J Med Internet Res \n\t\t \n\t\t\t 12 \n\t\t\t 3 \n\t\t\t 36 \n\t\t\t 2010 \n\t\t \n\t \n\t FREE Full text \n\t Sox CM, Gribbons WM, Loring BA, Mandl KD, Batista R, Porter SC. Patient-centered design of an information management module for a personally controlled health record. J Med Internet Res 2010;12(3):e36 [FREE Full text] [doi: 10.2196/jmir.1269] [Medline: 20805091]"
    },
    {
      "title": "Lessons learned from usability testing of the VA's personal health record",
      "authors": [
        "D Haggstrom",
        "J Saleem",
        "A Russ",
        "J Jones",
        "S Russell",
        "N Chumbler"
      ],
      "year": 2011,
      "doi": "10.1136/amiajnl-2010-000082",
      "journal": "J Am Med Inform Assoc",
      "volume": "18",
      "issue": "Suppl 1",
      "raw": "Lessons learned from usability testing of the VA's personal health record \n\t\t \n\t\t\t D A Haggstrom \n\t\t \n\t\t \n\t\t\t J J Saleem \n\t\t \n\t\t \n\t\t\t A L Russ \n\t\t \n\t\t \n\t\t\t J Jones \n\t\t \n\t\t \n\t\t\t S A Russell \n\t\t \n\t\t \n\t\t\t N R Chumbler \n\t\t \n\t\t 10.1136/amiajnl-2010-000082 \n\t\t Medline: 21984604 \n\t \n\t \n\t\t J Am Med Inform Assoc \n\t\t \n\t\t\t 18 \n\t\t\t Suppl 1 \n\t\t\t \n\t\t\t 2011 Dec \n\t\t \n\t \n\t FREE Full text \n\t Haggstrom DA, Saleem JJ, Russ AL, Jones J, Russell SA, Chumbler NR. Lessons learned from usability testing of the VA's personal health record. J Am Med Inform Assoc 2011 Dec;18 Suppl 1:i13-i17 [FREE Full text] [doi: 10.1136/amiajnl-2010-000082] [Medline: 21984604]"
    },
    {
      "title": "Designing a patient-centered personal health record to promote preventive care",
      "authors": [
        "A Krist",
        "E Peele",
        "S Woolf",
        "S Rothemich",
        "J Loomis",
        "D Longo"
      ],
      "year": 2011,
      "doi": "10.1186/1472-6947-11-73",
      "journal": "BMC Med Inform Decis Mak",
      "volume": "11",
      "pages": "73",
      "raw": "Designing a patient-centered personal health record to promote preventive care \n\t\t \n\t\t\t A H Krist \n\t\t \n\t\t \n\t\t\t E Peele \n\t\t \n\t\t \n\t\t\t S H Woolf \n\t\t \n\t\t \n\t\t\t S F Rothemich \n\t\t \n\t\t \n\t\t\t J F Loomis \n\t\t \n\t\t \n\t\t\t D R Longo \n\t\t \n\t\t 10.1186/1472-6947-11-73 \n\t\t Medline: 22115059 \n\t \n\t \n\t\t BMC Med Inform Decis Mak \n\t\t \n\t\t\t 11 \n\t\t\t 73 \n\t\t\t 2011 \n\t\t \n\t \n\t FREE Full text \n\t Krist AH, Peele E, Woolf SH, Rothemich SF, Loomis JF, Longo DR, et al. Designing a patient-centered personal health record to promote preventive care. BMC Med Inform Decis Mak 2011;11:73 [FREE Full text] [doi: 10.1186/1472-6947-11-73] [Medline: 22115059]"
    },
    {
      "title": "Patient experiences with full electronic access to health records and clinical notes through the My HealtheVet Personal Health Record Pilot: qualitative study",
      "authors": [
        "S Woods",
        "E Schwartz",
        "A Tuepker",
        "N Press",
        "K Nazi",
        "C Turvey"
      ],
      "year": 2013,
      "doi": "10.2196/jmir.2356",
      "journal": "J Med Internet Res",
      "volume": "15",
      "issue": "3",
      "pages": "65",
      "raw": "Patient experiences with full electronic access to health records and clinical notes through the My HealtheVet Personal Health Record Pilot: qualitative study \n\t\t \n\t\t\t S S Woods \n\t\t \n\t\t \n\t\t\t E Schwartz \n\t\t \n\t\t \n\t\t\t A Tuepker \n\t\t \n\t\t \n\t\t\t N A Press \n\t\t \n\t\t \n\t\t\t K M Nazi \n\t\t \n\t\t \n\t\t\t C L Turvey \n\t\t \n\t\t 10.2196/jmir.2356 \n\t\t Medline: 23535584 \n\t \n\t \n\t\t J Med Internet Res \n\t\t \n\t\t\t 15 \n\t\t\t 3 \n\t\t\t 65 \n\t\t\t 2013 \n\t\t \n\t \n\t FREE Full text \n\t Woods SS, Schwartz E, Tuepker A, Press NA, Nazi KM, Turvey CL, et al. Patient experiences with full electronic access to health records and clinical notes through the My HealtheVet Personal Health Record Pilot: qualitative study. J Med Internet Res 2013;15(3):e65 [FREE Full text] [doi: 10.2196/jmir.2356] [Medline: 23535584]"
    },
    {
      "title": "Applying usability methods to identify health literacy issues: an example using a Personal Health Record",
      "authors": [
        "H Monkman",
        "A Kushniruk"
      ],
      "year": 2013,
      "journal": "Stud Health Technol Inform",
      "volume": "183",
      "raw": "Applying usability methods to identify health literacy issues: an example using a Personal Health Record \n\t\t \n\t\t\t H Monkman \n\t\t \n\t\t \n\t\t\t A Kushniruk \n\t\t \n\t\t Medline: 23388278 \n\t \n\t \n\t\t Stud Health Technol Inform \n\t\t \n\t\t\t 183 \n\t\t\t \n\t\t\t 2013 \n\t\t \n\t \n\t Monkman H, Kushniruk A. Applying usability methods to identify health literacy issues: an example using a Personal Health Record. Stud Health Technol Inform 2013;183:179-185. [Medline: 23388278]"
    },
    {
      "title": "Consumers' perceptions of patient-accessible electronic medical records",
      "authors": [
        "C Zarcadoolas",
        "W Vaughon",
        "S Czaja",
        "J Levy",
        "M Rockoff"
      ],
      "year": 2013,
      "doi": "10.2196/jmir.2507",
      "journal": "J Med Internet Res",
      "volume": "15",
      "issue": "8",
      "pages": "168",
      "raw": "Consumers' perceptions of patient-accessible electronic medical records \n\t\t \n\t\t\t C Zarcadoolas \n\t\t \n\t\t \n\t\t\t W L Vaughon \n\t\t \n\t\t \n\t\t\t S J Czaja \n\t\t \n\t\t \n\t\t\t J Levy \n\t\t \n\t\t \n\t\t\t M L Rockoff \n\t\t \n\t\t 10.2196/jmir.2507 \n\t\t Medline: 23978618 \n\t \n\t \n\t\t J Med Internet Res \n\t\t \n\t\t\t 15 \n\t\t\t 8 \n\t\t\t 168 \n\t\t\t 2013 \n\t\t \n\t \n\t FREE Full text \n\t Zarcadoolas C, Vaughon WL, Czaja SJ, Levy J, Rockoff ML. Consumers' perceptions of patient-accessible electronic medical records. J Med Internet Res 2013;15(8):e168 [FREE Full text] [doi: 10.2196/jmir.2507] [Medline: 23978618]"
    },
    {
      "title": "Interactive preventive health record to enhance delivery of recommended care: a randomized trial",
      "authors": [
        "A Krist",
        "S Woolf",
        "S Rothemich",
        "R Johnson",
        "J Peele",
        "T Cunningham"
      ],
      "year": 2012,
      "doi": "10.1370/afm.1383",
      "journal": "Ann Fam Med",
      "volume": "10",
      "issue": "4",
      "raw": "Interactive preventive health record to enhance delivery of recommended care: a randomized trial \n\t\t \n\t\t\t A H Krist \n\t\t \n\t\t \n\t\t\t S H Woolf \n\t\t \n\t\t \n\t\t\t S F Rothemich \n\t\t \n\t\t \n\t\t\t R E Johnson \n\t\t \n\t\t \n\t\t\t J E Peele \n\t\t \n\t\t \n\t\t\t T D Cunningham \n\t\t \n\t\t 10.1370/afm.1383 \n\t\t Medline: 22778119 \n\t \n\t \n\t\t Ann Fam Med \n\t\t \n\t\t\t 10 \n\t\t\t 4 \n\t\t\t \n\t\t\t 2012 \n\t\t \n\t \n\t FREE Full text \n\t Krist AH, Woolf SH, Rothemich SF, Johnson RE, Peele JE, Cunningham TD, et al. Interactive preventive health record to enhance delivery of recommended care: a randomized trial. Ann Fam Med 2012;10(4):312-319 [FREE Full text] [doi: 10.1370/afm.1383] [Medline: 22778119]"
    },
    {
      "title": "The impact of numeracy ability and technology skills on older adults' performance of health management tasks using a patient portal",
      "authors": [
        "J Taha",
        "J Sharit",
        "S Czaja"
      ],
      "year": 2014,
      "doi": "10.1177/0733464812447283",
      "journal": "J Appl Gerontol",
      "volume": "33",
      "issue": "4",
      "raw": "The impact of numeracy ability and technology skills on older adults' performance of health management tasks using a patient portal \n\t\t \n\t\t\t J Taha \n\t\t \n\t\t \n\t\t\t J Sharit \n\t\t \n\t\t \n\t\t\t S J Czaja \n\t\t \n\t\t 10.1177/0733464812447283 \n\t\t Medline: 24781964 \n\t \n\t \n\t\t J Appl Gerontol \n\t\t \n\t\t\t 33 \n\t\t\t 4 \n\t\t\t \n\t\t\t 2014 Jun \n\t\t \n\t \n\t Taha J, Sharit J, Czaja SJ. The impact of numeracy ability and technology skills on older adults' performance of health management tasks using a patient portal. J Appl Gerontol 2014 Jun;33(4):416-436. [doi: 10.1177/0733464812447283] [Medline: 24781964]"
    },
    {
      "title": "Design and implementation of a web-based patient portal linked to an electronic health record designed to improve medication safety: the Patient Gateway medications module",
      "authors": [
        "J Schnipper",
        "T Gandhi",
        "J Wald",
        "R Grant",
        "E Poon",
        "L Volk"
      ],
      "year": 2008,
      "doi": "10.14236/jhi.v16i2.686",
      "journal": "Inform Prim Care",
      "volume": "16",
      "issue": "2",
      "raw": "Design and implementation of a web-based patient portal linked to an electronic health record designed to improve medication safety: the Patient Gateway medications module \n\t\t \n\t\t\t J L Schnipper \n\t\t \n\t\t \n\t\t\t T K Gandhi \n\t\t \n\t\t \n\t\t\t J S Wald \n\t\t \n\t\t \n\t\t\t R W Grant \n\t\t \n\t\t \n\t\t\t E G Poon \n\t\t \n\t\t \n\t\t\t L A Volk \n\t\t \n\t\t 10.14236/jhi.v16i2.686 \n\t\t Medline: 18713531 \n\t \n\t \n\t\t Inform Prim Care \n\t\t \n\t\t\t 16 \n\t\t\t 2 \n\t\t\t \n\t\t\t 2008 \n\t\t \n\t \n\t Schnipper JL, Gandhi TK, Wald JS, Grant RW, Poon EG, Volk LA, et al. Design and implementation of a web-based patient portal linked to an electronic health record designed to improve medication safety: the Patient Gateway medications module. Inform Prim Care 2008;16(2):147-155. [Medline: 18713531]"
    },
    {
      "title": "Personal health record design: qualitative exploration of issues inhibiting optimal use",
      "authors": [
        "K Fuji",
        "A Abbott",
        "K Galt"
      ],
      "year": 2014,
      "doi": "10.2337/dc13-1630",
      "journal": "Diabetes Care",
      "volume": "37",
      "issue": "1",
      "raw": "Personal health record design: qualitative exploration of issues inhibiting optimal use \n\t\t \n\t\t\t K T Fuji \n\t\t \n\t\t \n\t\t\t A A Abbott \n\t\t \n\t\t \n\t\t\t K A Galt \n\t\t \n\t\t 10.2337/dc13-1630 \n\t\t Medline: 24356602 \n\t \n\t \n\t\t Diabetes Care \n\t\t \n\t\t\t 37 \n\t\t\t 1 \n\t\t\t \n\t\t\t 2014 \n\t\t \n\t \n\t FREE Full text \n\t Fuji KT, Abbott AA, Galt KA. Personal health record design: qualitative exploration of issues inhibiting optimal use. Diabetes Care 2014;37(1):e13-e14 [FREE Full text] [doi: 10.2337/dc13-1630] [Medline: 24356602]"
    },
    {
      "title": "Usability testing finds problems for novice users of pediatric portals",
      "authors": [
        "M Britto",
        "H Jimison",
        "J Munafo",
        "J Wissman",
        "M Rogers"
      ],
      "year": 2009,
      "doi": "10.1197/jamia.m3154",
      "journal": "J Am Med Inform Assoc",
      "volume": "16",
      "issue": "5",
      "raw": "Usability testing finds problems for novice users of pediatric portals \n\t\t \n\t\t\t M T Britto \n\t\t \n\t\t \n\t\t\t H B Jimison \n\t\t \n\t\t \n\t\t\t J K Munafo \n\t\t \n\t\t \n\t\t\t J Wissman \n\t\t \n\t\t \n\t\t\t M L Rogers \n\t\t \n\t\t \n\t\t\t Hersh W \n\t\t \n\t\t 10.1197/jamia.m3154 \n\t\t Medline: 19567793 \n\t \n\t \n\t\t J Am Med Inform Assoc \n\t\t \n\t\t\t 16 \n\t\t\t 5 \n\t\t\t \n\t\t\t 2009 \n\t\t \n\t \n\t FREE Full text \n\t Britto MT, Jimison HB, Munafo JK, Wissman J, Rogers ML, Hersh W. Usability testing finds problems for novice users of pediatric portals. J Am Med Inform Assoc 2009;16(5):660-669 [FREE Full text] [doi: 10.1197/jamia.M3154] [Medline: 19567793]"
    },
    {
      "title": "Context mediated usability testing",
      "authors": [
        "C Kuziemsky",
        "A Kushniruk"
      ],
      "year": 2014,
      "journal": "Stud Health Technol Inform",
      "volume": "205",
      "raw": "Context mediated usability testing \n\t\t \n\t\t\t C E Kuziemsky \n\t\t \n\t\t \n\t\t\t A Kushniruk \n\t\t \n\t\t Medline: 25160319 \n\t \n\t \n\t\t Stud Health Technol Inform \n\t\t \n\t\t\t 205 \n\t\t\t \n\t\t\t 2014 \n\t\t \n\t \n\t Kuziemsky CE, Kushniruk A. Context mediated usability testing. Stud Health Technol Inform 2014;205:905-909. [Medline: 25160319]"
    },
    {
      "title": "The military health system's personal health record pilot with Microsoft HealthVault and Google Health",
      "authors": [
        "N Do",
        "R Barnhill",
        "K Heermann-Do",
        "K Salzman",
        "R Gimbel"
      ],
      "year": 2011,
      "doi": "10.1136/jamia.2010.004671",
      "journal": "J Am Med Inform Assoc",
      "volume": "18",
      "issue": "2",
      "raw": "The military health system's personal health record pilot with Microsoft HealthVault and Google Health \n\t\t \n\t\t\t N V Do \n\t\t \n\t\t \n\t\t\t R Barnhill \n\t\t \n\t\t \n\t\t\t K A Heermann-Do \n\t\t \n\t\t \n\t\t\t K L Salzman \n\t\t \n\t\t \n\t\t\t R W Gimbel \n\t\t \n\t\t 10.1136/jamia.2010.004671 \n\t\t Medline: 21292705 \n\t \n\t \n\t\t J Am Med Inform Assoc \n\t\t \n\t\t\t 18 \n\t\t\t 2 \n\t\t\t \n\t\t\t 2011 \n\t\t \n\t \n\t FREE Full text \n\t Do NV, Barnhill R, Heermann-Do KA, Salzman KL, Gimbel RW. The military health system's personal health record pilot with Microsoft HealthVault and Google Health. J Am Med Inform Assoc 2011;18(2):118-124 [FREE Full text] [doi: 10.1136/jamia.2010.004671] [Medline: 21292705]"
    },
    {
      "title": "Sociotechnical Challenges of Developing an Interoperable Personal Health Record: Lessons Learned",
      "authors": [
        "G Gaskin",
        "C Longhurst",
        "R Slayton",
        "A Das"
      ],
      "year": 2011,
      "doi": "10.4338/ACI-2011-06-RA-0035",
      "journal": "Appl Clin Inform",
      "volume": "2",
      "issue": "4",
      "raw": "Sociotechnical Challenges of Developing an Interoperable Personal Health Record: Lessons Learned \n\t\t \n\t\t\t G L Gaskin \n\t\t \n\t\t \n\t\t\t C A Longhurst \n\t\t \n\t\t \n\t\t\t R Slayton \n\t\t \n\t\t \n\t\t\t A K Das \n\t\t \n\t\t 10.4338/ACI-2011-06-RA-0035 \n\t\t Medline: 22003373 \n\t \n\t \n\t\t Appl Clin Inform \n\t\t \n\t\t\t 2 \n\t\t\t 4 \n\t\t\t \n\t\t\t 2011 \n\t\t \n\t \n\t FREE Full text \n\t Gaskin GL, Longhurst CA, Slayton R, Das AK. Sociotechnical Challenges of Developing an Interoperable Personal Health Record: Lessons Learned. Appl Clin Inform 2011;2(4):406-419 [FREE Full text] [doi: 10.4338/ACI-2011-06-RA-0035] [Medline: 22003373]"
    },
    {
      "title": "Collaborative development of an electronic Personal Health Record for people with severe and enduring mental health problems",
      "authors": [
        "L Ennis",
        "D Robotham",
        "M Denis",
        "N Pandit",
        "D Newton",
        "D Rose"
      ],
      "year": 2014,
      "doi": "10.1186/s12888-014-0305-9",
      "journal": "BMC Psychiatry",
      "volume": "14",
      "issue": "1",
      "pages": "305",
      "raw": "Collaborative development of an electronic Personal Health Record for people with severe and enduring mental health problems \n\t\t \n\t\t\t L Ennis \n\t\t \n\t\t \n\t\t\t D Robotham \n\t\t \n\t\t \n\t\t\t M Denis \n\t\t \n\t\t \n\t\t\t N Pandit \n\t\t \n\t\t \n\t\t\t D Newton \n\t\t \n\t\t \n\t\t\t D Rose \n\t\t \n\t\t 10.1186/s12888-014-0305-9 \n\t\t Medline: 25403285 \n\t \n\t \n\t\t BMC Psychiatry \n\t\t \n\t\t\t 14 \n\t\t\t 1 \n\t\t\t 305 \n\t\t\t 2014 \n\t\t \n\t \n\t FREE Full text \n\t Ennis L, Robotham D, Denis M, Pandit N, Newton D, Rose D, et al. Collaborative development of an electronic Personal Health Record for people with severe and enduring mental health problems. BMC Psychiatry 2014;14(1):305 [FREE Full text] [doi: 10.1186/s12888-014-0305-9] [Medline: 25403285]"
    },
    {
      "title": "Cognitive and usability engineering methods for the evaluation of clinical information systems",
      "authors": [
        "A Kushniruk",
        "V Patel"
      ],
      "year": 2004,
      "doi": "10.1016/j.jbi.2004.01.003",
      "journal": "J Biomed Inform",
      "volume": "37",
      "issue": "1",
      "raw": "Cognitive and usability engineering methods for the evaluation of clinical information systems \n\t\t \n\t\t\t A W Kushniruk \n\t\t \n\t\t \n\t\t\t V L Patel \n\t\t \n\t\t 10.1016/j.jbi.2004.01.003 \n\t\t Medline: 15016386] 100 \n\t \n\t \n\t\t J Biomed Inform \n\t\t \n\t\t\t 37 \n\t\t\t 1 \n\t\t\t \n\t\t\t 2004 Feb \n\t\t \n\t \n\t Kushniruk AW, Patel VL. Cognitive and usability engineering methods for the evaluation of clinical information systems. J Biomed Inform 2004 Feb;37(1):56-76. [doi: 10.1016/j.jbi.2004.01.003] [Medline: 15016386] 100"
    },
    {
      "title": "Patient-centred care: using online personal medical records in IVF practice",
      "authors": [
        "W Tuil",
        "A Ten Hoopen",
        "Ddm Braat",
        "Rpf De Vries",
        "Jam Kremer"
      ],
      "year": 2006,
      "doi": "10.1093/humrep/del214",
      "journal": "Hum Reprod",
      "volume": "21",
      "issue": "11",
      "raw": "Patient-centred care: using online personal medical records in IVF practice \n\t\t \n\t\t\t W S Tuil \n\t\t \n\t\t \n\t\t\t A J Ten Hoopen \n\t\t \n\t\t \n\t\t\t Ddm Braat \n\t\t \n\t\t \n\t\t\t Rpf De Vries \n\t\t \n\t\t \n\t\t\t Jam Kremer \n\t\t \n\t\t 10.1093/humrep/del214 \n\t\t Medline: 16982658] 101 \n\t \n\t \n\t\t Hum Reprod \n\t\t \n\t\t\t 21 \n\t\t\t 11 \n\t\t\t \n\t\t\t 2006 Nov \n\t\t \n\t \n\t FREE Full text \n\t Tuil WS, ten Hoopen AJ, Braat DDM, de Vries RPF, Kremer JAM. Patient-centred care: using online personal medical records in IVF practice. Hum Reprod 2006 Nov;21(11):2955-2959 [FREE Full text] [doi: 10.1093/humrep/del214] [Medline: 16982658] 101"
    },
    {
      "title": "Design and implementation of a web-based patient portal linked to an ambulatory care electronic health record: patient gateway for diabetes collaborative care",
      "authors": [
        "R Grant",
        "J Wald",
        "E Poon",
        "J Schnipper",
        "T Gandhi",
        "L Volk"
      ],
      "year": 2006,
      "doi": "10.1089/dia.2006.8.576",
      "journal": "Diabetes Technol Ther",
      "volume": "8",
      "issue": "5",
      "raw": "Design and implementation of a web-based patient portal linked to an ambulatory care electronic health record: patient gateway for diabetes collaborative care \n\t\t \n\t\t\t R W Grant \n\t\t \n\t\t \n\t\t\t J S Wald \n\t\t \n\t\t \n\t\t\t E G Poon \n\t\t \n\t\t \n\t\t\t J L Schnipper \n\t\t \n\t\t \n\t\t\t T K Gandhi \n\t\t \n\t\t \n\t\t\t L A Volk \n\t\t \n\t\t 10.1089/dia.2006.8.576 \n\t\t Medline: 17037972] 102 \n\t \n\t \n\t\t Diabetes Technol Ther \n\t\t \n\t\t\t 8 \n\t\t\t 5 \n\t\t\t \n\t\t\t 2006 Oct \n\t\t \n\t \n\t FREE Full text \n\t Grant RW, Wald JS, Poon EG, Schnipper JL, Gandhi TK, Volk LA, et al. Design and implementation of a web-based patient portal linked to an ambulatory care electronic health record: patient gateway for diabetes collaborative care. Diabetes Technol Ther 2006 Oct;8(5):576-586 [FREE Full text] [doi: 10.1089/dia.2006.8.576] [Medline: 17037972] 102"
    },
    {
      "title": "Exploring challenges and potentials of personal health records in diabetes self-management: implementation and initial assessment",
      "authors": [
        "R Hess",
        "C Bryce",
        "S Paone",
        "G Fischer",
        "K Mctigue",
        "E Olshansky"
      ],
      "year": 2007,
      "doi": "10.1089/tmj.2006.0089",
      "journal": "Telemed J E Health",
      "volume": "13",
      "issue": "5",
      "raw": "Exploring challenges and potentials of personal health records in diabetes self-management: implementation and initial assessment \n\t\t \n\t\t\t R Hess \n\t\t \n\t\t \n\t\t\t C L Bryce \n\t\t \n\t\t \n\t\t\t S Paone \n\t\t \n\t\t \n\t\t\t G Fischer \n\t\t \n\t\t \n\t\t\t K M Mctigue \n\t\t \n\t\t \n\t\t\t E Olshansky \n\t\t \n\t\t 10.1089/tmj.2006.0089 \n\t\t Medline: 17999613] 103 \n\t \n\t \n\t\t Telemed J E Health \n\t\t \n\t\t\t 13 \n\t\t\t 5 \n\t\t\t \n\t\t\t 2007 Oct \n\t\t \n\t \n\t Hess R, Bryce CL, Paone S, Fischer G, McTigue KM, Olshansky E, et al. Exploring challenges and potentials of personal health records in diabetes self-management: implementation and initial assessment. Telemed J E Health 2007 Oct;13(5):509-517. [doi: 10.1089/tmj.2006.0089] [Medline: 17999613] 103"
    },
    {
      "title": "Usage patterns of a personal health record by elderly and disabled users",
      "authors": [
        "E Kim",
        "A Stolyar",
        "W Lober",
        "A Herbaugh",
        "S Shinstrom",
        "B Zierler"
      ],
      "year": 2007,
      "doi": "10.2196/jmir.1256",
      "journal": "AMIA Annu Symp Proc",
      "raw": "Usage patterns of a personal health record by elderly and disabled users \n\t\t \n\t\t\t E H Kim \n\t\t \n\t\t \n\t\t\t A Stolyar \n\t\t \n\t\t \n\t\t\t W B Lober \n\t\t \n\t\t \n\t\t\t A L Herbaugh \n\t\t \n\t\t \n\t\t\t S E Shinstrom \n\t\t \n\t\t \n\t\t\t B K Zierler \n\t\t \n\t\t 10.2196/jmir.1256 \n\t\t Medline: 18693868] 104 \n\t \n\t \n\t\t AMIA Annu Symp Proc \n\t\t \n\t\t\t \n\t\t\t 2007 \n\t\t \n\t \n\t FREE Full text \n\t Kim EH, Stolyar A, Lober WB, Herbaugh AL, Shinstrom SE, Zierler BK, et al. Usage patterns of a personal health record by elderly and disabled users. AMIA Annu Symp Proc 2007:409-413 [FREE Full text] [Medline: 18693868] 104"
    },
    {
      "title": "Teen use of a patient portal: a qualitative study of parent and teen attitudes",
      "authors": [
        "D Bergman",
        "N Brown",
        "S Wilson"
      ],
      "year": 2008,
      "journal": "Perspect Health Inf Manag",
      "volume": "5",
      "pages": "13",
      "raw": "Teen use of a patient portal: a qualitative study of parent and teen attitudes \n\t\t \n\t\t\t D A Bergman \n\t\t \n\t\t \n\t\t\t N L Brown \n\t\t \n\t\t \n\t\t\t S Wilson \n\t\t \n\t\t Medline: 18923702] 105 \n\t \n\t \n\t\t Perspect Health Inf Manag \n\t\t \n\t\t\t 5 \n\t\t\t 13 \n\t\t\t 2008 \n\t\t \n\t \n\t FREE Full text \n\t Bergman DA, Brown NL, Wilson S. Teen use of a patient portal: a qualitative study of parent and teen attitudes. Perspect Health Inf Manag 2008;5:13 [FREE Full text] [Medline: 18923702] 105"
    },
    {
      "title": "Effectiveness of home blood pressure monitoring, Web communication, and pharmacist care on hypertension control: a randomized controlled trial",
      "authors": [
        "B Green",
        "A Cook",
        "J Ralston",
        "P Fishman",
        "S Catz",
        "J Carlson"
      ],
      "year": 2008,
      "doi": "10.1001/jama.299.24.2857",
      "journal": "JAMA",
      "volume": "299",
      "issue": "24",
      "raw": "Effectiveness of home blood pressure monitoring, Web communication, and pharmacist care on hypertension control: a randomized controlled trial \n\t\t \n\t\t\t B B Green \n\t\t \n\t\t \n\t\t\t A J Cook \n\t\t \n\t\t \n\t\t\t J D Ralston \n\t\t \n\t\t \n\t\t\t P A Fishman \n\t\t \n\t\t \n\t\t\t S L Catz \n\t\t \n\t\t \n\t\t\t J Carlson \n\t\t \n\t\t 10.1001/jama.299.24.2857 \n\t\t Medline: 18577730] 106 \n\t \n\t \n\t\t JAMA \n\t\t \n\t\t\t 299 \n\t\t\t 24 \n\t\t\t \n\t\t\t 2008 Jun 25 \n\t\t \n\t \n\t FREE Full text \n\t Green BB, Cook AJ, Ralston JD, Fishman PA, Catz SL, Carlson J, et al. Effectiveness of home blood pressure monitoring, Web communication, and pharmacist care on hypertension control: a randomized controlled trial. JAMA 2008 Jun 25;299(24):2857-2867 [FREE Full text] [doi: 10.1001/jama.299.24.2857] [Medline: 18577730] 106"
    },
    {
      "title": "An effort to improve electronic health record medication list accuracy between visits: patients' and physicians' response",
      "authors": [
        "M Staroselsky",
        "L Volk",
        "R Tsurikova",
        "L Newmark",
        "M Lippincott",
        "I Litvak"
      ],
      "year": 2008,
      "doi": "10.1016/j.ijmedinf.2007.03.001",
      "journal": "Int J Med Inform",
      "volume": "77",
      "issue": "3",
      "raw": "An effort to improve electronic health record medication list accuracy between visits: patients' and physicians' response \n\t\t \n\t\t\t M Staroselsky \n\t\t \n\t\t \n\t\t\t L A Volk \n\t\t \n\t\t \n\t\t\t R Tsurikova \n\t\t \n\t\t \n\t\t\t L P Newmark \n\t\t \n\t\t \n\t\t\t M Lippincott \n\t\t \n\t\t \n\t\t\t I Litvak \n\t\t \n\t\t 10.1016/j.ijmedinf.2007.03.001 \n\t\t Medline: 17434337] 107 \n\t \n\t \n\t\t Int J Med Inform \n\t\t \n\t\t\t 77 \n\t\t\t 3 \n\t\t\t \n\t\t\t 2008 Mar \n\t\t \n\t \n\t Staroselsky M, Volk LA, Tsurikova R, Newmark LP, Lippincott M, Litvak I, et al. An effort to improve electronic health record medication list accuracy between visits: patients' and physicians' response. Int J Med Inform 2008 Mar;77(3):153-160. [doi: 10.1016/j.ijmedinf.2007.03.001] [Medline: 17434337] 107"
    },
    {
      "title": "Survey analysis of patient experience using a practice-linked PHR for type 2 diabetes mellitus",
      "authors": [
        "J Wald",
        "R Grant",
        "J Schnipper",
        "T Gandhi",
        "E Poon",
        "A Businger"
      ],
      "year": 2009,
      "journal": "AMIA Annu Symp Proc",
      "volume": "2009",
      "raw": "Survey analysis of patient experience using a practice-linked PHR for type 2 diabetes mellitus \n\t\t \n\t\t\t J S Wald \n\t\t \n\t\t \n\t\t\t R W Grant \n\t\t \n\t\t \n\t\t\t J L Schnipper \n\t\t \n\t\t \n\t\t\t T K Gandhi \n\t\t \n\t\t \n\t\t\t E G Poon \n\t\t \n\t\t \n\t\t\t A C Businger \n\t\t \n\t\t Medline: 20351940] 108 \n\t \n\t \n\t\t AMIA Annu Symp Proc \n\t\t \n\t\t\t 2009 \n\t\t\t \n\t\t\t 2009 \n\t\t \n\t \n\t FREE Full text \n\t Wald JS, Grant RW, Schnipper JL, Gandhi TK, Poon EG, Businger AC, et al. Survey analysis of patient experience using a practice-linked PHR for type 2 diabetes mellitus. AMIA Annu Symp Proc 2009;2009:678-682 [FREE Full text] [Medline: 20351940] 108"
    },
    {
      "title": "Health coaching via an internet portal for primary care patients with chronic conditions: a randomized controlled trial",
      "authors": [
        "S Leveille",
        "A Huang",
        "S Tsai",
        "M Allen",
        "S Weingart",
        "L Iezzoni"
      ],
      "year": 2009,
      "doi": "10.1097/mlr.0b013e3181844dd0",
      "journal": "Med Care",
      "volume": "47",
      "issue": "1",
      "raw": "Health coaching via an internet portal for primary care patients with chronic conditions: a randomized controlled trial \n\t\t \n\t\t\t S G Leveille \n\t\t \n\t\t \n\t\t\t A Huang \n\t\t \n\t\t \n\t\t\t S B Tsai \n\t\t \n\t\t \n\t\t\t M Allen \n\t\t \n\t\t \n\t\t\t S N Weingart \n\t\t \n\t\t \n\t\t\t L I Iezzoni \n\t\t \n\t\t 10.1097/mlr.0b013e3181844dd0 \n\t\t Medline: 19106729] 109 \n\t \n\t \n\t\t Med Care \n\t\t \n\t\t\t 47 \n\t\t\t 1 \n\t\t\t \n\t\t\t 2009 Jan \n\t\t \n\t \n\t Leveille SG, Huang A, Tsai SB, Allen M, Weingart SN, Iezzoni LI. Health coaching via an internet portal for primary care patients with chronic conditions: a randomized controlled trial. Med Care 2009 Jan;47(1):41-47. [doi: 10.1097/MLR.0b013e3181844dd0] [Medline: 19106729] 109"
    },
    {
      "title": "Challenges to using an electronic personal health record by a low-income elderly population",
      "authors": [
        "E Kim",
        "A Stolyar",
        "W Lober",
        "A Herbaugh",
        "S Shinstrom",
        "B Zierler"
      ],
      "year": 2009,
      "doi": "10.2196/jmir.1256",
      "journal": "J Med Internet Res",
      "volume": "11",
      "issue": "4",
      "pages": "44",
      "raw": "Challenges to using an electronic personal health record by a low-income elderly population \n\t\t \n\t\t\t E H Kim \n\t\t \n\t\t \n\t\t\t A Stolyar \n\t\t \n\t\t \n\t\t\t W B Lober \n\t\t \n\t\t \n\t\t\t A L Herbaugh \n\t\t \n\t\t \n\t\t\t S E Shinstrom \n\t\t \n\t\t \n\t\t\t B K Zierler \n\t\t \n\t\t 10.2196/jmir.1256 \n\t\t Medline: 19861298] 110 \n\t \n\t \n\t\t J Med Internet Res \n\t\t \n\t\t\t 11 \n\t\t\t 4 \n\t\t\t 44 \n\t\t\t 2009 \n\t\t \n\t \n\t FREE Full text \n\t Kim EH, Stolyar A, Lober WB, Herbaugh AL, Shinstrom SE, Zierler BK, et al. Challenges to using an electronic personal health record by a low-income elderly population. J Med Internet Res 2009;11(4):e44 [FREE Full text] [doi: 10.2196/jmir.1256] [Medline: 19861298] 110"
    },
    {
      "title": "The anxious wait: assessing the impact of patient accessible EHRs for breast cancer patients",
      "authors": [
        "D Wiljer",
        "K Leonard",
        "S Urowitz",
        "E Apatu",
        "C Massey",
        "N Quartey"
      ],
      "year": 2010,
      "doi": "10.1186/1472-6947-10-46",
      "journal": "BMC Med Inform Decis Mak",
      "volume": "10",
      "pages": "46",
      "raw": "The anxious wait: assessing the impact of patient accessible EHRs for breast cancer patients \n\t\t \n\t\t\t D Wiljer \n\t\t \n\t\t \n\t\t\t K J Leonard \n\t\t \n\t\t \n\t\t\t S Urowitz \n\t\t \n\t\t \n\t\t\t E Apatu \n\t\t \n\t\t \n\t\t\t C Massey \n\t\t \n\t\t \n\t\t\t N K Quartey \n\t\t \n\t\t 10.1186/1472-6947-10-46 \n\t\t Medline: 20809950] 111 \n\t \n\t \n\t\t BMC Med Inform Decis Mak \n\t\t \n\t\t\t 10 \n\t\t\t 46 \n\t\t\t 2010 \n\t\t \n\t \n\t FREE Full text \n\t Wiljer D, Leonard KJ, Urowitz S, Apatu E, Massey C, Quartey NK, et al. The anxious wait: assessing the impact of patient accessible EHRs for breast cancer patients. BMC Med Inform Decis Mak 2010;10:46 [FREE Full text] [doi: 10.1186/1472-6947-10-46] [Medline: 20809950] 111"
    },
    {
      "title": "Improving personal health records for patient-centered care",
      "authors": [
        "S Reti",
        "H Feldman",
        "S Ross",
        "C Safran"
      ],
      "year": 2010,
      "doi": "10.1136/jamia.2009.000927",
      "journal": "J Am Med Inform Assoc",
      "volume": "17",
      "issue": "2",
      "raw": "Improving personal health records for patient-centered care \n\t\t \n\t\t\t S R Reti \n\t\t \n\t\t \n\t\t\t H J Feldman \n\t\t \n\t\t \n\t\t\t S E Ross \n\t\t \n\t\t \n\t\t\t C Safran \n\t\t \n\t\t 10.1136/jamia.2009.000927 \n\t\t Medline: 20190063] 112 \n\t \n\t \n\t\t J Am Med Inform Assoc \n\t\t \n\t\t\t 17 \n\t\t\t 2 \n\t\t\t \n\t\t\t 2010 \n\t\t \n\t \n\t FREE Full text \n\t Reti SR, Feldman HJ, Ross SE, Safran C. Improving personal health records for patient-centered care. J Am Med Inform Assoc 2010;17(2):192-195 [FREE Full text] [doi: 10.1136/jamia.2009.000927] [Medline: 20190063] 112"
    },
    {
      "title": "Patient-provider internet portals--patient outcomes and use",
      "authors": [
        "R Shaw",
        "J Ferranti"
      ],
      "year": 2011,
      "doi": "10.1097/ncn.0b013e318224b597",
      "journal": "Comput Inform Nurs",
      "volume": "29",
      "issue": "12",
      "raw": "Patient-provider internet portals--patient outcomes and use \n\t\t \n\t\t\t R J Shaw \n\t\t \n\t\t \n\t\t\t J Ferranti \n\t\t \n\t\t 10.1097/ncn.0b013e318224b597 \n\t\t Medline: 21697705] 113 \n\t \n\t \n\t\t Comput Inform Nurs \n\t\t \n\t\t\t 29 \n\t\t\t 12 \n\t\t\t \n\t\t\t 2011 Dec \n\t\t \n\t \n\t quiz 719 \n\t Shaw RJ, Ferranti J. Patient-provider internet portals--patient outcomes and use. Comput Inform Nurs 2011 Dec;29(12):714-8; quiz 719. [doi: 10.1097/NCN.0b013e318224b597] [Medline: 21697705] 113"
    },
    {
      "title": "Randomized controlled trial of health maintenance reminders provided directly to patients through an electronic PHR",
      "authors": [
        "A Wright",
        "E Poon",
        "J Wald",
        "J Feblowitz",
        "J Pang",
        "J Schnipper"
      ],
      "year": 2012,
      "doi": "10.1007/s11606-011-1859-6",
      "journal": "J Gen Intern Med",
      "volume": "27",
      "issue": "1",
      "raw": "Randomized controlled trial of health maintenance reminders provided directly to patients through an electronic PHR \n\t\t \n\t\t\t A Wright \n\t\t \n\t\t \n\t\t\t E G Poon \n\t\t \n\t\t \n\t\t\t J Wald \n\t\t \n\t\t \n\t\t\t J Feblowitz \n\t\t \n\t\t \n\t\t\t J E Pang \n\t\t \n\t\t \n\t\t\t J L Schnipper \n\t\t \n\t\t 10.1007/s11606-011-1859-6 \n\t\t Medline: 21904945] 114 \n\t \n\t \n\t\t J Gen Intern Med \n\t\t \n\t\t\t 27 \n\t\t\t 1 \n\t\t\t \n\t\t\t 2012 Jan \n\t\t \n\t \n\t FREE Full text \n\t Wright A, Poon EG, Wald J, Feblowitz J, Pang JE, Schnipper JL, et al. Randomized controlled trial of health maintenance reminders provided directly to patients through an electronic PHR. J Gen Intern Med 2012 Jan;27(1):85-92 [FREE Full text] [doi: 10.1007/s11606-011-1859-6] [Medline: 21904945] 114"
    },
    {
      "title": "Effects of an online personal health record on medication accuracy and safety: a cluster-randomized trial",
      "authors": [
        "J Schnipper",
        "T Gandhi",
        "J Wald",
        "R Grant",
        "E Poon",
        "L Volk"
      ],
      "year": 2012,
      "doi": "10.1136/amiajnl-2011-000723",
      "journal": "J Am Med Inform Assoc",
      "volume": "19",
      "issue": "5",
      "raw": "Effects of an online personal health record on medication accuracy and safety: a cluster-randomized trial \n\t\t \n\t\t\t J L Schnipper \n\t\t \n\t\t \n\t\t\t T K Gandhi \n\t\t \n\t\t \n\t\t\t J S Wald \n\t\t \n\t\t \n\t\t\t R W Grant \n\t\t \n\t\t \n\t\t\t E G Poon \n\t\t \n\t\t \n\t\t\t L A Volk \n\t\t \n\t\t 10.1136/amiajnl-2011-000723 \n\t\t Medline: 22556186] 115 \n\t \n\t \n\t\t J Am Med Inform Assoc \n\t\t \n\t\t\t 19 \n\t\t\t 5 \n\t\t\t \n\t\t\t 2012 \n\t\t \n\t \n\t FREE Full text \n\t Schnipper JL, Gandhi TK, Wald JS, Grant RW, Poon EG, Volk LA, et al. Effects of an online personal health record on medication accuracy and safety: a cluster-randomized trial. J Am Med Inform Assoc 2012;19(5):728-734 [FREE Full text] [doi: 10.1136/amiajnl-2011-000723] [Medline: 22556186] 115"
    },
    {
      "title": "Association of online patient access to clinicians and medical records with use of clinical services",
      "authors": [
        "T Palen",
        "C Ross",
        "J Powers",
        "S Xu"
      ],
      "year": 2012,
      "doi": "10.1001/jama.2012.14126",
      "journal": "JAMA",
      "volume": "308",
      "issue": "19",
      "raw": "Association of online patient access to clinicians and medical records with use of clinical services \n\t\t \n\t\t\t T E Palen \n\t\t \n\t\t \n\t\t\t C Ross \n\t\t \n\t\t \n\t\t\t J D Powers \n\t\t \n\t\t \n\t\t\t S Xu \n\t\t \n\t\t 10.1001/jama.2012.14126 \n\t\t Medline: 23168824] 116 \n\t \n\t \n\t\t JAMA \n\t\t \n\t\t\t 308 \n\t\t\t 19 \n\t\t\t \n\t\t\t 2012 Nov 21 \n\t\t \n\t \n\t Palen TE, Ross C, Powers JD, Xu S. Association of online patient access to clinicians and medical records with use of clinical services. JAMA 2012 Nov 21;308(19):2012-2019. [doi: 10.1001/jama.2012.14126] [Medline: 23168824] 116"
    },
    {
      "title": "Effects of an online personal health record on medication accuracy and safety: a cluster-randomized trial",
      "authors": [
        "J Schnipper",
        "T Gandhi",
        "J Wald",
        "R Grant",
        "E Poon",
        "L Volk"
      ],
      "year": 2012,
      "doi": "10.1136/amiajnl-2011-000723",
      "journal": "J Am Med Inform Assoc",
      "volume": "19",
      "issue": "5",
      "raw": "Effects of an online personal health record on medication accuracy and safety: a cluster-randomized trial \n\t\t \n\t\t\t J L Schnipper \n\t\t \n\t\t \n\t\t\t T K Gandhi \n\t\t \n\t\t \n\t\t\t J S Wald \n\t\t \n\t\t \n\t\t\t R W Grant \n\t\t \n\t\t \n\t\t\t E G Poon \n\t\t \n\t\t \n\t\t\t L A Volk \n\t\t \n\t\t 10.1136/amiajnl-2011-000723 \n\t\t Medline: 22556186] 117 \n\t \n\t \n\t\t J Am Med Inform Assoc \n\t\t \n\t\t\t 19 \n\t\t\t 5 \n\t\t\t \n\t\t\t 2012 \n\t\t \n\t \n\t FREE Full text \n\t Schnipper JL, Gandhi TK, Wald JS, Grant RW, Poon EG, Volk LA, et al. Effects of an online personal health record on medication accuracy and safety: a cluster-randomized trial. J Am Med Inform Assoc 2012;19(5):728-734 [FREE Full text] [doi: 10.1136/amiajnl-2011-000723] [Medline: 22556186] 117"
    },
    {
      "title": "Secure messaging and diabetes management: experiences and perspectives of patient portal users",
      "authors": [
        "A Wade-Vuturo",
        "L Mayberry",
        "C Osborn"
      ],
      "year": 2013,
      "doi": "10.1136/amiajnl-2012-001253",
      "journal": "J Am Med Inform Assoc",
      "volume": "20",
      "issue": "3",
      "raw": "Secure messaging and diabetes management: experiences and perspectives of patient portal users \n\t\t \n\t\t\t A E Wade-Vuturo \n\t\t \n\t\t \n\t\t\t L S Mayberry \n\t\t \n\t\t \n\t\t\t C Y Osborn \n\t\t \n\t\t 10.1136/amiajnl-2012-001253 \n\t\t Medline: 23242764] 118 \n\t \n\t \n\t\t J Am Med Inform Assoc \n\t\t \n\t\t\t 20 \n\t\t\t 3 \n\t\t\t \n\t\t\t 2013 May 1 \n\t\t \n\t \n\t FREE Full text \n\t Wade-Vuturo AE, Mayberry LS, Osborn CY. Secure messaging and diabetes management: experiences and perspectives of patient portal users. J Am Med Inform Assoc 2013 May 1;20(3):519-525 [FREE Full text] [doi: 10.1136/amiajnl-2012-001253] [Medline: 23242764] 118"
    },
    {
      "title": "Use of the refill function through an online patient portal is associated with improved adherence to statins in an integrated health system",
      "authors": [
        "U Sarkar",
        "C Lyles",
        "M Parker",
        "J Allen",
        "R Nguyen",
        "H Moffet"
      ],
      "year": 2014,
      "doi": "10.1097/mlr.0000000000000069",
      "journal": "Med Care",
      "volume": "52",
      "issue": "3",
      "raw": "Use of the refill function through an online patient portal is associated with improved adherence to statins in an integrated health system \n\t\t \n\t\t\t U Sarkar \n\t\t \n\t\t \n\t\t\t C R Lyles \n\t\t \n\t\t \n\t\t\t M M Parker \n\t\t \n\t\t \n\t\t\t J Allen \n\t\t \n\t\t \n\t\t\t R Nguyen \n\t\t \n\t\t \n\t\t\t H H Moffet \n\t\t \n\t\t 10.1097/mlr.0000000000000069 \n\t\t Medline: 24374412] 119 \n\t \n\t \n\t\t Med Care \n\t\t \n\t\t\t 52 \n\t\t\t 3 \n\t\t\t \n\t\t\t 2014 Mar \n\t\t \n\t \n\t FREE Full text \n\t Sarkar U, Lyles CR, Parker MM, Allen J, Nguyen R, Moffet HH, et al. Use of the refill function through an online patient portal is associated with improved adherence to statins in an integrated health system. Med Care 2014 Mar;52(3):194-201 [FREE Full text] [doi: 10.1097/MLR.0000000000000069] [Medline: 24374412] 119"
    },
    {
      "title": "Improving herpes zoster vaccination rates through use of a clinical pharmacist and a personal health record",
      "authors": [
        "S Otsuka",
        "N Tayal",
        "K Porter",
        "P Embi",
        "S Beatty"
      ],
      "year": 2013,
      "doi": "10.1016/j.amjmed.2013.02.018",
      "journal": "Am J Med",
      "volume": "126",
      "issue": "9",
      "raw": "Improving herpes zoster vaccination rates through use of a clinical pharmacist and a personal health record \n\t\t \n\t\t\t S H Otsuka \n\t\t \n\t\t \n\t\t\t N H Tayal \n\t\t \n\t\t \n\t\t\t K Porter \n\t\t \n\t\t \n\t\t\t P J Embi \n\t\t \n\t\t \n\t\t\t S J Beatty \n\t\t \n\t\t 10.1016/j.amjmed.2013.02.018 \n\t\t Medline: 23830534] 120 \n\t \n\t \n\t\t Am J Med \n\t\t \n\t\t\t 126 \n\t\t\t 9 \n\t\t\t \n\t\t\t 2013 Sep \n\t\t \n\t \n\t FREE Full text \n\t Otsuka SH, Tayal NH, Porter K, Embi PJ, Beatty SJ. Improving herpes zoster vaccination rates through use of a clinical pharmacist and a personal health record. Am J Med 2013 Sep;126(9):832.e1-832.e6 [FREE Full text] [doi: 10.1016/j.amjmed.2013.02.018] [Medline: 23830534] 120"
    },
    {
      "title": "Patient-generated secure messages and eVisits on a patient portal: are patients at risk?",
      "authors": [
        "F North",
        "S Crane",
        "R Stroebel",
        "S Cha",
        "E Edell",
        "Tulledge Scheitel"
      ],
      "year": 2013,
      "doi": "10.1136/amiajnl-2012-001208",
      "journal": "J Am Med Inform Assoc",
      "volume": "20",
      "issue": "6",
      "raw": "Patient-generated secure messages and eVisits on a patient portal: are patients at risk? \n\t\t \n\t\t\t F North \n\t\t \n\t\t \n\t\t\t S J Crane \n\t\t \n\t\t \n\t\t\t R J Stroebel \n\t\t \n\t\t \n\t\t\t S S Cha \n\t\t \n\t\t \n\t\t\t E S Edell \n\t\t \n\t\t \n\t\t\t Tulledge - Scheitel \n\t\t \n\t\t \n\t\t\t S M \n\t\t \n\t\t 10.1136/amiajnl-2012-001208 \n\t\t Medline: 23703826] 121 \n\t \n\t \n\t\t J Am Med Inform Assoc \n\t\t \n\t\t\t 20 \n\t\t\t 6 \n\t\t\t \n\t\t\t 2013 \n\t\t \n\t \n\t FREE Full text \n\t North F, Crane SJ, Stroebel RJ, Cha SS, Edell ES, Tulledge-Scheitel SM. Patient-generated secure messages and eVisits on a patient portal: are patients at risk? J Am Med Inform Assoc 2013;20(6):1143-1149 [FREE Full text] [doi: 10.1136/amiajnl-2012-001208] [Medline: 23703826] 121"
    },
    {
      "title": "Impact of patient portal secure messages and electronic visits on adult primary care office visits",
      "authors": [
        "F North",
        "S Crane",
        "R Chaudhry",
        "J Ebbert",
        "K Ytterberg",
        "Tulledge Scheitel"
      ],
      "year": 2014,
      "doi": "10.1089/tmj.2013.0097",
      "journal": "Telemed J E Health",
      "volume": "20",
      "issue": "3",
      "raw": "Impact of patient portal secure messages and electronic visits on adult primary care office visits \n\t\t \n\t\t\t F North \n\t\t \n\t\t \n\t\t\t S J Crane \n\t\t \n\t\t \n\t\t\t R Chaudhry \n\t\t \n\t\t \n\t\t\t J O Ebbert \n\t\t \n\t\t \n\t\t\t K Ytterberg \n\t\t \n\t\t \n\t\t\t Tulledge - Scheitel \n\t\t \n\t\t \n\t\t\t S M \n\t\t \n\t\t 10.1089/tmj.2013.0097 \n\t\t Medline: 24350803] 122 \n\t \n\t \n\t\t Telemed J E Health \n\t\t \n\t\t\t 20 \n\t\t\t 3 \n\t\t\t \n\t\t\t 2014 Mar \n\t\t \n\t \n\t FREE Full text \n\t North F, Crane SJ, Chaudhry R, Ebbert JO, Ytterberg K, Tulledge-Scheitel SM, et al. Impact of patient portal secure messages and electronic visits on adult primary care office visits. Telemed J E Health 2014 Mar;20(3):192-198 [FREE Full text] [doi: 10.1089/tmj.2013.0097] [Medline: 24350803] 122"
    },
    {
      "title": "Comparing electronic health record portals to obtain patient-entered family health history in primary care",
      "authors": [
        "M Murray",
        "M Giovanni",
        "E Klinger",
        "E George",
        "L Marinacci",
        "G Getty"
      ],
      "year": 2013,
      "doi": "10.1007/s11606-013-2442-0",
      "journal": "J Gen Intern Med",
      "volume": "28",
      "issue": "12",
      "raw": "Comparing electronic health record portals to obtain patient-entered family health history in primary care \n\t\t \n\t\t\t M F Murray \n\t\t \n\t\t \n\t\t\t M A Giovanni \n\t\t \n\t\t \n\t\t\t E Klinger \n\t\t \n\t\t \n\t\t\t E George \n\t\t \n\t\t \n\t\t\t L Marinacci \n\t\t \n\t\t \n\t\t\t G Getty \n\t\t \n\t\t 10.1007/s11606-013-2442-0 \n\t\t Medline: 23588670] 123 \n\t \n\t \n\t\t J Gen Intern Med \n\t\t \n\t\t\t 28 \n\t\t\t 12 \n\t\t\t \n\t\t\t 2013 Dec \n\t\t \n\t \n\t FREE Full text \n\t Murray MF, Giovanni MA, Klinger E, George E, Marinacci L, Getty G, et al. Comparing electronic health record portals to obtain patient-entered family health history in primary care. J Gen Intern Med 2013 Dec;28(12):1558-1564 [FREE Full text] [doi: 10.1007/s11606-013-2442-0] [Medline: 23588670] 123"
    },
    {
      "title": "Engaging patients in medication reconciliation via a patient portal following hospital discharge",
      "authors": [
        "L Heyworth",
        "A Paquin",
        "J Clark",
        "V Kamenker",
        "M Stewart",
        "T Martin"
      ],
      "year": 2014,
      "doi": "10.1136/amiajnl-2013-001995",
      "journal": "J Am Med Inform Assoc",
      "volume": "21",
      "issue": "1",
      "raw": "Engaging patients in medication reconciliation via a patient portal following hospital discharge \n\t\t \n\t\t\t L Heyworth \n\t\t \n\t\t \n\t\t\t A M Paquin \n\t\t \n\t\t \n\t\t\t J Clark \n\t\t \n\t\t \n\t\t\t V Kamenker \n\t\t \n\t\t \n\t\t\t M Stewart \n\t\t \n\t\t \n\t\t\t T Martin \n\t\t \n\t\t 10.1136/amiajnl-2013-001995 \n\t\t Medline: 24036155] 124 \n\t \n\t \n\t\t J Am Med Inform Assoc \n\t\t \n\t\t\t 21 \n\t\t\t 1 \n\t\t\t \n\t\t\t 2014 Feb \n\t\t \n\t \n\t FREE Full text \n\t Heyworth L, Paquin AM, Clark J, Kamenker V, Stewart M, Martin T, et al. Engaging patients in medication reconciliation via a patient portal following hospital discharge. J Am Med Inform Assoc 2014 Feb;21(e1):e157-e162 [FREE Full text] [doi: 10.1136/amiajnl-2013-001995] [Medline: 24036155] 124"
    },
    {
      "title": "Parents' perceptions of a patient portal for managing their child's chronic illness",
      "authors": [
        "M Britto",
        "E Hesse",
        "O Kamdar",
        "J Munafo"
      ],
      "year": 2013,
      "doi": "10.1016/j.jpeds.2013.02.041",
      "journal": "J Pediatr",
      "volume": "163",
      "issue": "1",
      "raw": "Parents' perceptions of a patient portal for managing their child's chronic illness \n\t\t \n\t\t\t M T Britto \n\t\t \n\t\t \n\t\t\t E A Hesse \n\t\t \n\t\t \n\t\t\t O J Kamdar \n\t\t \n\t\t \n\t\t\t J K Munafo \n\t\t \n\t\t 10.1016/j.jpeds.2013.02.041 \n\t\t Medline: 23541773] 125 \n\t \n\t \n\t\t J Pediatr \n\t\t \n\t\t\t 163 \n\t\t\t 1 \n\t\t\t \n\t\t\t 2013 Jul \n\t\t \n\t \n\t Britto MT, Hesse EA, Kamdar OJ, Munafo JK. Parents' perceptions of a patient portal for managing their child's chronic illness. J Pediatr 2013 Jul;163(1):280-1.e1. [doi: 10.1016/j.jpeds.2013.02.041] [Medline: 23541773] 125"
    },
    {
      "title": "Enhancing patient engagement and blood pressure management for renal transplant recipients via home electronic monitoring and web-enabled collaborative care",
      "authors": [
        "E Aberger",
        "D Migliozzi",
        "M Follick",
        "T Malick",
        "D Ahern"
      ],
      "year": 2014,
      "doi": "10.1089/tmj.2013.0317",
      "journal": "Telemed J E Health",
      "volume": "20",
      "issue": "9",
      "raw": "Enhancing patient engagement and blood pressure management for renal transplant recipients via home electronic monitoring and web-enabled collaborative care \n\t\t \n\t\t\t E W Aberger \n\t\t \n\t\t \n\t\t\t D Migliozzi \n\t\t \n\t\t \n\t\t\t M J Follick \n\t\t \n\t\t \n\t\t\t T Malick \n\t\t \n\t\t \n\t\t\t D K Ahern \n\t\t \n\t\t 10.1089/tmj.2013.0317 \n\t\t Medline: 25046403] 126 \n\t \n\t \n\t\t Telemed J E Health \n\t\t \n\t\t\t 20 \n\t\t\t 9 \n\t\t\t \n\t\t\t 2014 Sep \n\t\t \n\t \n\t Aberger EW, Migliozzi D, Follick MJ, Malick T, Ahern DK. Enhancing patient engagement and blood pressure management for renal transplant recipients via home electronic monitoring and web-enabled collaborative care. Telemed J E Health 2014 Sep;20(9):850-854. [doi: 10.1089/tmj.2013.0317] [Medline: 25046403] 126"
    },
    {
      "title": "Exploring three perspectives on feasibility of a patient portal for older adults",
      "authors": [
        "J Barron",
        "M Bedra",
        "J Wood",
        "J Finkelstein"
      ],
      "year": 2014,
      "journal": "Stud Health Technol Inform",
      "volume": "202",
      "raw": "Exploring three perspectives on feasibility of a patient portal for older adults \n\t\t \n\t\t\t J Barron \n\t\t \n\t\t \n\t\t\t M Bedra \n\t\t \n\t\t \n\t\t\t J Wood \n\t\t \n\t\t \n\t\t\t J Finkelstein \n\t\t \n\t\t Medline: 25000046] 127 \n\t \n\t \n\t\t Stud Health Technol Inform \n\t\t \n\t\t\t 202 \n\t\t\t \n\t\t\t 2014 \n\t\t \n\t \n\t Barron J, Bedra M, Wood J, Finkelstein J. Exploring three perspectives on feasibility of a patient portal for older adults. Stud Health Technol Inform 2014;202:181-184. [Medline: 25000046] 127"
    },
    {
      "title": "Integrating personalized health information from MedlinePlus in a patient portal",
      "authors": [
        "D Borbolla",
        "F Del",
        "V Taliercio",
        "C Otero",
        "F Campos",
        "M Martinez"
      ],
      "year": 2014,
      "journal": "Stud Health Technol Inform",
      "volume": "205",
      "raw": "Integrating personalized health information from MedlinePlus in a patient portal \n\t\t \n\t\t\t D Borbolla \n\t\t \n\t\t \n\t\t\t F G Del \n\t\t \n\t\t \n\t\t\t V Taliercio \n\t\t \n\t\t \n\t\t\t C Otero \n\t\t \n\t\t \n\t\t\t F Campos \n\t\t \n\t\t \n\t\t\t M Martinez \n\t\t \n\t\t Medline: 25160204] 128 \n\t \n\t \n\t\t Stud Health Technol Inform \n\t\t \n\t\t\t 205 \n\t\t\t \n\t\t\t 2014 \n\t\t \n\t \n\t Borbolla D, Del FG, Taliercio V, Otero C, Campos F, Martinez M, et al. Integrating personalized health information from MedlinePlus in a patient portal. Stud Health Technol Inform 2014;205:348-352. [Medline: 25160204] 128"
    },
    {
      "title": "Increasing patient engagement: patients' responses to viewing problem lists online",
      "authors": [
        "A Wright",
        "J Feblowitz",
        "F Maloney",
        "S Henkin",
        "H Ramelson",
        "J Feltman"
      ],
      "year": 2014,
      "doi": "10.4338/ACI-2014-07-RA-0057",
      "journal": "Appl Clin Inform",
      "volume": "5",
      "issue": "4",
      "raw": "Increasing patient engagement: patients' responses to viewing problem lists online \n\t\t \n\t\t\t A Wright \n\t\t \n\t\t \n\t\t\t J Feblowitz \n\t\t \n\t\t \n\t\t\t F L Maloney \n\t\t \n\t\t \n\t\t\t S Henkin \n\t\t \n\t\t \n\t\t\t H Ramelson \n\t\t \n\t\t \n\t\t\t J Feltman \n\t\t \n\t\t 10.4338/ACI-2014-07-RA-0057 \n\t\t Medline: 25589908] 129 \n\t \n\t \n\t\t Appl Clin Inform \n\t\t \n\t\t\t 5 \n\t\t\t 4 \n\t\t\t \n\t\t\t 2014 \n\t\t \n\t \n\t Wright A, Feblowitz J, Maloney FL, Henkin S, Ramelson H, Feltman J, et al. Increasing patient engagement: patients' responses to viewing problem lists online. Appl Clin Inform 2014;5(4):930-942. [doi: 10.4338/ACI-2014-07-RA-0057] [Medline: 25589908] 129"
    },
    {
      "title": "Personal health record use and association with immunizations and well-child care visits recommendations",
      "authors": [
        "J Tom",
        "C Chen",
        "Y Zhou"
      ],
      "year": 2014,
      "doi": "10.1016/j.jpeds.2013.08.046",
      "journal": "J Pediatr",
      "volume": "164",
      "issue": "1",
      "raw": "Personal health record use and association with immunizations and well-child care visits recommendations \n\t\t \n\t\t\t J O Tom \n\t\t \n\t\t \n\t\t\t C Chen \n\t\t \n\t\t \n\t\t\t Y Y Zhou \n\t\t \n\t\t 10.1016/j.jpeds.2013.08.046 \n\t\t Medline: 24120019] 130 \n\t \n\t \n\t\t J Pediatr \n\t\t \n\t\t\t 164 \n\t\t\t 1 \n\t\t\t \n\t\t\t 2014 Jan \n\t\t \n\t \n\t Tom JO, Chen C, Zhou YY. Personal health record use and association with immunizations and well-child care visits recommendations. J Pediatr 2014 Jan;164(1):112-117. [doi: 10.1016/j.jpeds.2013.08.046] [Medline: 24120019] 130"
    },
    {
      "title": "VA OpenNotes: exploring the experiences of early patient adopters with access to clinical notes",
      "authors": [
        "K Nazi",
        "C Turvey",
        "D Klein",
        "T Hogan",
        "S Woods"
      ],
      "year": 2015,
      "doi": "10.1136/amiajnl-2014-003144",
      "journal": "J Am Med Inform Assoc",
      "volume": "22",
      "issue": "2",
      "raw": "VA OpenNotes: exploring the experiences of early patient adopters with access to clinical notes \n\t\t \n\t\t\t K M Nazi \n\t\t \n\t\t \n\t\t\t C L Turvey \n\t\t \n\t\t \n\t\t\t D M Klein \n\t\t \n\t\t \n\t\t\t T P Hogan \n\t\t \n\t\t \n\t\t\t S S Woods \n\t\t \n\t\t 10.1136/amiajnl-2014-003144 \n\t\t Medline: 25352570] 131 \n\t \n\t \n\t\t J Am Med Inform Assoc \n\t\t \n\t\t\t 22 \n\t\t\t 2 \n\t\t\t \n\t\t\t 2015 Mar \n\t\t \n\t \n\t Nazi KM, Turvey CL, Klein DM, Hogan TP, Woods SS. VA OpenNotes: exploring the experiences of early patient adopters with access to clinical notes. J Am Med Inform Assoc 2015 Mar;22(2):380-389. [doi: 10.1136/amiajnl-2014-003144] [Medline: 25352570] 131"
    },
    {
      "title": "Impact of patient use of an online patient portal on diabetes outcomes",
      "authors": [
        "M Lau",
        "H Campbell",
        "T Tang",
        "Djs Thompson",
        "T Elliott"
      ],
      "year": 2014,
      "doi": "10.1016/j.jcjd.2013.10.005",
      "journal": "Can J Diabetes",
      "volume": "38",
      "issue": "1",
      "raw": "Impact of patient use of an online patient portal on diabetes outcomes \n\t\t \n\t\t\t M Lau \n\t\t \n\t\t \n\t\t\t H Campbell \n\t\t \n\t\t \n\t\t\t T Tang \n\t\t \n\t\t \n\t\t\t Djs Thompson \n\t\t \n\t\t \n\t\t\t T Elliott \n\t\t \n\t\t 10.1016/j.jcjd.2013.10.005 \n\t\t Medline: 24485208] 132 \n\t \n\t \n\t\t Can J Diabetes \n\t\t \n\t\t\t 38 \n\t\t\t 1 \n\t\t\t \n\t\t\t 2014 Feb \n\t\t \n\t \n\t Lau M, Campbell H, Tang T, Thompson DJS, Elliott T. Impact of patient use of an online patient portal on diabetes outcomes. Can J Diabetes 2014 Feb;38(1):17-21. [doi: 10.1016/j.jcjd.2013.10.005] [Medline: 24485208] 132"
    },
    {
      "title": "Patterns of response to patient-centered decision support through a personal health record",
      "authors": [
        "R Hess",
        "G Fischer",
        "S Sullivan",
        "X Dong",
        "M Weimer",
        "C Zeith"
      ],
      "year": 2014,
      "doi": "10.1089/tmj.2013.0332",
      "journal": "Telemed J E Health",
      "volume": "20",
      "issue": "11",
      "raw": "Patterns of response to patient-centered decision support through a personal health record \n\t\t \n\t\t\t R Hess \n\t\t \n\t\t \n\t\t\t G S Fischer \n\t\t \n\t\t \n\t\t\t S M Sullivan \n\t\t \n\t\t \n\t\t\t X Dong \n\t\t \n\t\t \n\t\t\t M Weimer \n\t\t \n\t\t \n\t\t\t C Zeith \n\t\t \n\t\t 10.1089/tmj.2013.0332 \n\t\t Medline: 25243350] 133 \n\t \n\t \n\t\t Telemed J E Health \n\t\t \n\t\t\t 20 \n\t\t\t 11 \n\t\t\t \n\t\t\t 2014 Nov \n\t\t \n\t \n\t Hess R, Fischer GS, Sullivan SM, Dong X, Weimer M, Zeith C, et al. Patterns of response to patient-centered decision support through a personal health record. Telemed J E Health 2014 Nov;20(11):984-989. [doi: 10.1089/tmj.2013.0332] [Medline: 25243350] 133"
    },
    {
      "title": "Direct-to-patient disclosure of results of mismatch repair screening for Lynch syndrome via electronic personal health record: a feasibility study",
      "authors": [
        "M Hall",
        "M Herda",
        "E Handorf",
        "C Rybak",
        "C Keleher",
        "M Siemon"
      ],
      "year": 2014,
      "doi": "10.1038/gim.2014.42",
      "journal": "Genet Med",
      "volume": "16",
      "issue": "11",
      "raw": "Direct-to-patient disclosure of results of mismatch repair screening for Lynch syndrome via electronic personal health record: a feasibility study \n\t\t \n\t\t\t M J Hall \n\t\t \n\t\t \n\t\t\t M M Herda \n\t\t \n\t\t \n\t\t\t E A Handorf \n\t\t \n\t\t \n\t\t\t C C Rybak \n\t\t \n\t\t \n\t\t\t C A Keleher \n\t\t \n\t\t \n\t\t\t M Siemon \n\t\t \n\t\t 10.1038/gim.2014.42 \n\t\t Medline: 24784156] 134 \n\t \n\t \n\t\t Genet Med \n\t\t \n\t\t\t 16 \n\t\t\t 11 \n\t\t\t \n\t\t\t 2014 Nov \n\t\t \n\t \n\t Hall MJ, Herda MM, Handorf EA, Rybak CC, Keleher CA, Siemon M, et al. Direct-to-patient disclosure of results of mismatch repair screening for Lynch syndrome via electronic personal health record: a feasibility study. Genet Med 2014 Nov;16(11):854-861. [doi: 10.1038/gim.2014.42] [Medline: 24784156] 134"
    },
    {
      "title": "Randomized trial of an electronic personal health record for patients with serious mental illnesses",
      "authors": [
        "B Druss",
        "X Ji",
        "G Glick",
        "Von Esenwein"
      ],
      "year": 2014,
      "doi": "10.1176/appi.ajp.2013.13070913",
      "journal": "Am J Psychiatry",
      "volume": "171",
      "issue": "3",
      "raw": "Randomized trial of an electronic personal health record for patients with serious mental illnesses \n\t\t \n\t\t\t B G Druss \n\t\t \n\t\t \n\t\t\t X Ji \n\t\t \n\t\t \n\t\t\t G Glick \n\t\t \n\t\t \n\t\t\t Von Esenwein \n\t\t \n\t\t \n\t\t\t S A \n\t\t \n\t\t 10.1176/appi.ajp.2013.13070913 \n\t\t Medline: 24435025] 135 \n\t \n\t \n\t\t Am J Psychiatry \n\t\t \n\t\t\t 171 \n\t\t\t 3 \n\t\t\t \n\t\t\t 2014 Mar \n\t\t \n\t \n\t Druss BG, Ji X, Glick G, von Esenwein SA. Randomized trial of an electronic personal health record for patients with serious mental illnesses. Am J Psychiatry 2014 Mar;171(3):360-368. [doi: 10.1176/appi.ajp.2013.13070913] [Medline: 24435025] 135"
    },
    {
      "title": "Patient-to-physician messaging: volume nearly tripled as more patients joined system, but per capita rate plateaued",
      "authors": [
        "B Crotty",
        "Y Tamrat",
        "A Mostaghimi",
        "C Safran",
        "B Landon"
      ],
      "year": 2014,
      "doi": "10.1377/hlthaff.2013.1145",
      "journal": "Health Aff (Millwood)",
      "volume": "33",
      "issue": "10",
      "raw": "Patient-to-physician messaging: volume nearly tripled as more patients joined system, but per capita rate plateaued \n\t\t \n\t\t\t B H Crotty \n\t\t \n\t\t \n\t\t\t Y Tamrat \n\t\t \n\t\t \n\t\t\t A Mostaghimi \n\t\t \n\t\t \n\t\t\t C Safran \n\t\t \n\t\t \n\t\t\t B E Landon \n\t\t \n\t\t 10.1377/hlthaff.2013.1145 \n\t\t Medline: 25288428] 136 \n\t \n\t \n\t\t Health Aff (Millwood) \n\t\t \n\t\t\t 33 \n\t\t\t 10 \n\t\t\t \n\t\t\t 2014 Oct \n\t\t \n\t \n\t Crotty BH, Tamrat Y, Mostaghimi A, Safran C, Landon BE. Patient-to-physician messaging: volume nearly tripled as more patients joined system, but per capita rate plateaued. Health Aff (Millwood) 2014 Oct;33(10):1817-1822. [doi: 10.1377/hlthaff.2013.1145] [Medline: 25288428] 136"
    },
    {
      "title": "Personal health records: a randomized trial of effects on elder medication safety",
      "authors": [
        "E Chrischilles",
        "J Hourcade",
        "W Doucette",
        "D Eichmann",
        "B Gryzlak",
        "R Lorentzen"
      ],
      "year": 2014,
      "doi": "10.1136/amiajnl-2013-002284",
      "journal": "J Am Med Inform Assoc",
      "volume": "21",
      "issue": "4",
      "raw": "Personal health records: a randomized trial of effects on elder medication safety \n\t\t \n\t\t\t E A Chrischilles \n\t\t \n\t\t \n\t\t\t J P Hourcade \n\t\t \n\t\t \n\t\t\t W Doucette \n\t\t \n\t\t \n\t\t\t D Eichmann \n\t\t \n\t\t \n\t\t\t B Gryzlak \n\t\t \n\t\t \n\t\t\t R Lorentzen \n\t\t \n\t\t 10.1136/amiajnl-2013-002284 \n\t\t Medline: 24326536] 137 \n\t \n\t \n\t\t J Am Med Inform Assoc \n\t\t \n\t\t\t 21 \n\t\t\t 4 \n\t\t\t \n\t\t\t 2014 \n\t\t \n\t \n\t Chrischilles EA, Hourcade JP, Doucette W, Eichmann D, Gryzlak B, Lorentzen R, et al. Personal health records: a randomized trial of effects on elder medication safety. J Am Med Inform Assoc 2014;21(4):679-686. [doi: 10.1136/amiajnl-2013-002284] [Medline: 24326536] 137"
    },
    {
      "title": "User-driven prioritization of features for a prospective InterPersonal Health Record: perceptions from the Italian context",
      "authors": [
        "F Cabitza",
        "C Simone",
        "M De"
      ],
      "year": 2015,
      "doi": "10.1016/j.compbiomed.2014.03.009",
      "journal": "Comput Biol Med",
      "volume": "59",
      "raw": "User-driven prioritization of features for a prospective InterPersonal Health Record: perceptions from the Italian context \n\t\t \n\t\t\t F Cabitza \n\t\t \n\t\t \n\t\t\t C Simone \n\t\t \n\t\t \n\t\t\t M G De \n\t\t \n\t\t 10.1016/j.compbiomed.2014.03.009 \n\t\t Medline: 24768267] 138 \n\t \n\t \n\t\t Comput Biol Med \n\t\t \n\t\t\t 59 \n\t\t\t \n\t\t\t 2015 Apr \n\t\t \n\t \n\t Cabitza F, Simone C, De MG. User-driven prioritization of features for a prospective InterPersonal Health Record: perceptions from the Italian context. Comput Biol Med 2015 Apr;59:202-210. [doi: 10.1016/j.compbiomed.2014.03.009] [Medline: 24768267] 138"
    },
    {
      "title": "Will electronic personal health records benefit providers and patients in rural America?",
      "authors": [
        "J Hargreaves"
      ],
      "year": 2010,
      "doi": "10.1089/tmj.2009.0063",
      "journal": "Telemed J E Health",
      "volume": "16",
      "issue": "2",
      "raw": "Will electronic personal health records benefit providers and patients in rural America? \n\t\t \n\t\t\t J S Hargreaves \n\t\t \n\t\t 10.1089/tmj.2009.0063 \n\t\t Medline: 20082592] 139 \n\t \n\t \n\t\t Telemed J E Health \n\t\t \n\t\t\t 16 \n\t\t\t 2 \n\t\t\t \n\t\t\t 2010 Mar \n\t\t \n\t \n\t Hargreaves JS. Will electronic personal health records benefit providers and patients in rural America? Telemed J E Health 2010 Mar;16(2):167-176. [doi: 10.1089/tmj.2009.0063] [Medline: 20082592] 139"
    },
    {
      "title": "How effective are short message service reminders at increasing clinic attendance? A meta-analysis and systematic review",
      "authors": [
        "R Guy",
        "J Hocking",
        "H Wand",
        "S Stott",
        "H Ali",
        "J Kaldor"
      ],
      "year": 2012,
      "doi": "10.1111/j.1475-6773.2011.01342.x",
      "journal": "Health Serv Res",
      "volume": "47",
      "issue": "2",
      "raw": "How effective are short message service reminders at increasing clinic attendance? A meta-analysis and systematic review \n\t\t \n\t\t\t R Guy \n\t\t \n\t\t \n\t\t\t J Hocking \n\t\t \n\t\t \n\t\t\t H Wand \n\t\t \n\t\t \n\t\t\t S Stott \n\t\t \n\t\t \n\t\t\t H Ali \n\t\t \n\t\t \n\t\t\t J Kaldor \n\t\t \n\t\t 10.1111/j.1475-6773.2011.01342.x \n\t\t Medline: 22091980] 140 \n\t \n\t \n\t\t Health Serv Res \n\t\t \n\t\t\t 47 \n\t\t\t 2 \n\t\t\t \n\t\t\t 2012 Apr \n\t\t \n\t \n\t FREE Full text \n\t Guy R, Hocking J, Wand H, Stott S, Ali H, Kaldor J. How effective are short message service reminders at increasing clinic attendance? A meta-analysis and systematic review. Health Serv Res 2012 Apr;47(2):614-632 [FREE Full text] [doi: 10.1111/j.1475-6773.2011.01342.x] [Medline: 22091980] 140"
    },
    {
      "title": "Patient engagement as a risk factor in personalized health care: a systematic review of the literature on chronic disease",
      "authors": [
        "L Simmons",
        "R Wolever",
        "E Bechard",
        "R Snyderman"
      ],
      "year": 2014,
      "doi": "10.1186/gm533",
      "journal": "Genome Med",
      "volume": "6",
      "issue": "2",
      "pages": "16",
      "raw": "Patient engagement as a risk factor in personalized health care: a systematic review of the literature on chronic disease \n\t\t \n\t\t\t L A Simmons \n\t\t \n\t\t \n\t\t\t R Q Wolever \n\t\t \n\t\t \n\t\t\t E M Bechard \n\t\t \n\t\t \n\t\t\t R Snyderman \n\t\t \n\t\t 10.1186/gm533 \n\t\t Medline: 24571651 \n\t \n\t \n\t\t Genome Med \n\t\t \n\t\t\t 6 \n\t\t\t 2 \n\t\t\t 16 \n\t\t\t 2014 \n\t\t \n\t \n\t FREE Full text Medicare and Medicaid Services MU: meaningful use SM: secure messaging Edited by G Eysenbach; submitted 20.01.15; peer-reviewed by D Amante, A Benis; comments to author 05.02.15 revised version received 10.03.15; accepted 03.04.15; published 23.06.15 Please cite as \n\t Simmons LA, Wolever RQ, Bechard EM, Snyderman R. Patient engagement as a risk factor in personalized health care: a systematic review of the literature on chronic disease. Genome Med 2014;6(2):16 [FREE Full text] [doi: 10.1186/gm533] [Medline: 24571651] EHR: electronic health record CMS: Centers for Medicare and Medicaid Services MU: meaningful use SM: secure messaging Edited by G Eysenbach; submitted 20.01.15; peer-reviewed by D Amante, A Benis; comments to author 05.02.15; revised version received 10.03.15; accepted 03.04.15; published 23.06.15 Please cite as:"
    },
    {
      "title": "Patient Portals and Patient Engagement: A State of the Science Review",
      "authors": [
        "T Irizarry",
        "Devito Dabbs",
        "A Curran"
      ],
      "year": 2015,
      "doi": "10.2196/jmir.4255",
      "journal": "J Med Internet Res",
      "volume": "17",
      "issue": "6",
      "pages": "148",
      "raw": "Patient Portals and Patient Engagement: A State of the Science Review \n\t\t \n\t\t\t T Irizarry \n\t\t \n\t\t \n\t\t\t Devito Dabbs \n\t\t \n\t\t \n\t\t\t A Curran \n\t\t \n\t\t \n\t\t\t C R \n\t\t \n\t\t 10.2196/jmir.4255 \n\t\t \n\t \n\t \n\t\t J Med Internet Res \n\t\t \n\t\t\t 17 \n\t\t\t 6 \n\t\t\t 148 \n\t\t\t 2015 \n\t\t \n\t \n\t Irizarry T, DeVito Dabbs A, Curran CR Patient Portals and Patient Engagement: A State of the Science Review J Med Internet Res 2015;17(6):e148 URL: http://www.jmir.org/2015/6/e148/ doi: 10.2196/jmir.4255 PMID: 26104044"
    },
    {
      "authors": [
        "Annette Irizarry",
        "Christine Dabbs"
      ],
      "doi": "10.2196/jmir.4255",
      "journal": "Originally published in the Journal of Medical Internet Research",
      "raw": "Annette Devito Irizarry \n\t\t \n\t\t \n\t\t\t Christine R Dabbs \n\t\t \n\t\t \n\t\t\t Curran \n\t\t \n\t\t 10.2196/jmir.4255 \n\t\t \n\t \n\t \n\t\t Originally published in the Journal of Medical Internet Research \n\t\t \n\t \n\t \u00a9Taya Irizarry, Annette DeVito Dabbs, Christine R Curran. Originally published in the Journal of Medical Internet Research (http://www.jmir.org), 23.06"
    }
  ],
  "num_references": 142,
  "figures": [
    {
      "caption": "Figure 1 .",
      "description": "Figure 1. Literature review flow chart."
    },
    {
      "type": "table",
      "caption": "Table 1 .",
      "description": "Summary of articles on categories of patient portals for patient engagement."
    },
    {
      "type": "table",
      "caption": "Table 2 .",
      "description": "Levels of evidence adapted from Melnyk & Fineout-Overholt, 2005."
    }
  ],
  "num_figures": 3,
  "tables": [
    {
      "content": "Year Provider endorsement Health literacy Usability Patient adoption Utility Total # of articles 2006 0 0 0 1 2 3 2007 1 1 1 2 3 4 2008 0 1 1 4 6 8 2009 0 0 1 3 4 7 2010 1 2 2 7 7 11 2011 3 3 2 11 8 17 2012 1 3 3 11 10 16 2013 2 3 5 12 17 27 2014 0 3 5 11 19 27 Total 8 16 20 62 76 120"
    },
    {
      "content": "Level of evidence # of studies"
    }
  ],
  "num_tables": 2,
  "num_citations": 173,
  "cited_references": [
    "b72",
    "b13",
    "b79",
    "b41",
    "b44",
    "b14",
    "b25",
    "b1",
    "b92",
    "b90",
    "b71",
    "b74",
    "b51",
    "b96",
    "b29",
    "b4",
    "b56",
    "b85",
    "b62",
    "b11",
    "b22",
    "b58",
    "b6",
    "b0",
    "b73",
    "b2",
    "b17",
    "b77",
    "b43",
    "b66",
    "b68",
    "b12",
    "b78",
    "b98",
    "b52",
    "b97",
    "b75",
    "b82",
    "b84",
    "b89",
    "b81",
    "b33",
    "b8",
    "b27",
    "b39",
    "b49",
    "b94",
    "b36",
    "b59",
    "b21",
    "b64",
    "b40",
    "b54",
    "b91",
    "b46",
    "b10",
    "b55",
    "b7",
    "b76",
    "b3",
    "b86",
    "b18",
    "b87",
    "b69",
    "b95",
    "b47",
    "b93",
    "b31",
    "b70",
    "b61",
    "b37",
    "b5",
    "b19",
    "b88",
    "b24",
    "b53",
    "b63",
    "b80",
    "b83",
    "b26"
  ],
  "notes": [
    "[raw_affiliation] School of Nursing , University of Pittsburgh , Pittsburgh , PA , United States",
    "[raw_affiliation] School of Nursing , University of Pittsburgh , Pittsburgh , PA , United States",
    "[raw_affiliation] School of Nursing , University of Pittsburgh , Pittsburgh , PA , United States",
    "[raw_affiliation] School of Nursing , University of Pittsburgh , Pittsburgh , PA , United States",
    "J Med Internet Res 2015 | vol. 17 | iss. 6 | e148 | p. 1 http://www.jmir.org/2015/6/e148/ (page number not for citation purposes)",
    "J Med Internet Res 2015 | vol. 17 | iss. 6 | e148 | p. 2 http://www.jmir.org/2015/6/e148/ (page number not for citation purposes)",
    "J Med Internet Res 2015 | vol. 17 | iss. 6 | e148 | p. 3 http://www.jmir.org/2015/6/e148/ (page number not for citation purposes)",
    "J Med Internet Res 2015 | vol. 17 | iss. 6 | e148 | p. 4 http://www.jmir.org/2015/6/e148/ (page number not for citation purposes)",
    "J Med Internet Res 2015 | vol. 17 | iss. 6 | e148 | p. 5 http://www.jmir.org/2015/6/e148/ (page number not for citation purposes)",
    "J Med Internet Res 2015 | vol. 17 | iss. 6 | e148 | p. 6 http://www.jmir.org/2015/6/e148/ (page number not for citation purposes)",
    "J Med Internet Res 2015 | vol. 17 | iss. 6 | e148 | p. 7 http://www.jmir.org/2015/6/e148/ (page number not for citation purposes)",
    "(page number not for citation purposes)",
    "J Med Internet Res 2015 | vol. 17 | iss. 6 | e148 | p. 9 http://www.jmir.org/2015/6/e148/ (page number not for citation purposes)",
    "J Med Internet Res 2015 | vol. 17 | iss. 6 | e148 | p. 10 http://www.jmir.org/2015/6/e148/ (page number not for citation purposes)",
    "J Med Internet Res 2015 | vol. 17 | iss. 6 | e148 | p. 11 http://www.jmir.org/2015/6/e148/ (page number not for citation purposes)",
    "J Med Internet Res 2015 | vol. 17 | iss. 6 | e148 | p. 14 http://www.jmir.org/2015/6/e148/ (page number not for citation purposes)",
    "J Med Internet Res 2015 | vol. 17 | iss. 6 | e148 | p. 15 http://www.jmir.org/2015/6/e148/ (page number not for citation purposes)",
    "6Vel4kPos",
    "[raw_reference] Rockville MD, Maurer M, Dardess P, Carman KL, Frazier K, Smeeding L. Guide to Patient and Family Engagement: Environmental Scan Report. 2012. URL: http://www.ahrq.gov/research/findings/final-reports/ptfamilyscan/ptfamilyscan. pdf [accessed 2015-01-17] [WebCite Cache ID 6Vel4kPos]",
    "quiz 192",
    "[raw_reference] Kupchunas WR. Personal health record: new opportunity for patient education. Orthop Nurs 2007;26(3):185-91; quiz 192. [doi: 10.1097/01.NOR.0000276971.86937.c4] [Medline: 17538475]",
    "FREE Full text",
    "[raw_reference] Halamka JD, Mandl KD, Tang PC. Early experiences with personal health records. J Am Med Inform Assoc 2008;15(1):1-7 [FREE Full text] [doi: 10.1197/jamia.M2562] [Medline: 17947615]",
    "FREE Full text",
    "[raw_reference] Mandl KD, Simons WW, Crawford WCR, Abbett JM. Indivo: a personally controlled health record for health information exchange and communication. BMC Med Inform Decis Mak 2007;7:25 [FREE Full text] [doi: 10.1186/1472-6947-7-25] [Medline: 17850667]",
    "FREE Full text",
    "[raw_reference] Weitzman ER, Kaci L, Mandl KD. Acceptability of a personally controlled health record in a community-based setting: implications for policy and design. J Med Internet Res 2009;11(2):e14 [FREE Full text] [doi: 10.2196/jmir.1187] [Medline: 19403467]",
    "FREE Full text",
    "[raw_reference] Wright A, Feblowitz J, Samal L, McCoy AB, Sittig DF. The Medicare Electronic Health Record Incentive Program: provider performance on core and menu measures. Health Serv Res 2014 Feb;49(1 Pt 2):325-346 [FREE Full text] [doi: 10.1111/1475-6773.12134] [Medline: 24359554]",
    "[raw_reference] Ahern DK, Woods SS, Lightowler MC, Finley SW, Houston TK. Promise of and potential for patient-facing technologies to enable meaningful use. Am J Prev Med 2011 May;40(5 Suppl 2):S162-S172. [doi: 10.1016/j.amepre.2011.01.005] [Medline: 21521591]",
    "FREE Full text",
    "[raw_reference] Kim J, Jung H, Bates DW. History and Trends of \"Personal Health Record\" Research in PubMed. Healthc Inform Res 2011 Mar;17(1):3-17 [FREE Full text] [doi: 10.4258/hir.2011.17.1.3] [Medline: 21818452]",
    "[raw_reference] Goldzweig CL, Orshansky G, Paige NM, Towfigh AA, Haggstrom DA, Miake-Lye I, et al. Electronic patient portals: evidence on health outcomes, satisfaction, efficiency, and attitudes: a systematic review. Ann Intern Med 2013 Nov 19;159(10):677-687. [doi: 10.7326/0003-4819-159-10-201311190-00006] [Medline: 24247673]",
    "FREE Full text",
    "[raw_reference] Weingart SN, Rind D, Tofias Z, Sands DZ. Who uses the patient internet portal? The PatientSite experience. J Am Med Inform Assoc 2006;13(1):91-95 [FREE Full text] [doi: 10.1197/jamia.M1833] [Medline: 16221943]",
    "FREE Full text",
    "[raw_reference] Keselman A, Slaughter L, Smith CA, Kim H, Divita G, Browne A, et al. Towards consumer-friendly PHRs: patients' experience with reviewing their health records. AMIA Annu Symp Proc 2007:399-403 [FREE Full text] [Medline: 18693866]",
    "[raw_reference] Wald JS, Burk K, Gardner K, Feygin R, Nelson E, Epstein M, et al. Sharing electronic laboratory results in a patient portal--a feasibility pilot. Stud Health Technol Inform 2007;129(Pt 1):18-22. [Medline: 17911670]",
    "FREE Full text",
    "[raw_reference] Grant RW, Wald JS, Schnipper JL, Gandhi TK, Poon EG, Orav EJ, et al. Practice-linked online personal health records for type 2 diabetes mellitus: a randomized controlled trial. Arch Intern Med 2008 Sep 8;168(16):1776-1782 [FREE Full text] [doi: 10.1001/archinte.168.16.1776] [Medline: 18779465]",
    "FREE Full text",
    "[raw_reference] Greenhalgh T, Wood GW, Bratan T, Stramer K, Hinder S. Patients' attitudes to the summary care record and HealthSpace: qualitative study. BMJ 2008 Jun 7;336(7656):1290-1295 [FREE Full text] [doi: 10.1136/bmj.a114] [Medline: 18511764]",
    "Annual International Conference on System Sciences",
    "[raw_reference] Lafky DB, Horan TA. Prospective personal health record use among different user groups: results of a multi-wave study. In: Proceedings of the 41st Annual Hawaii International Conference on System Sciences.: IEEE; 2008 Presented at: 41st Annual International Conference on System Sciences; Jan. 7-10, 2008; Hawaii. [doi: 10.1109/HICSS.2008.363]",
    "FREE Full text",
    "[raw_reference] Zickmund SL, Hess R, Bryce CL, McTigue K, Olshansky E, Fitzgerald K, et al. Interest in the use of computerized patient portals: role of the provider-patient relationship. J Gen Intern Med 2008 Jan;23 Suppl 1:20-26 [FREE Full text] [doi: 10.1007/s11606-007-0273-6] [Medline: 18095039]",
    "FREE Full text",
    "[raw_reference] Chen C, Garrido T, Chock D, Okawa G, Liang L. The Kaiser Permanente Electronic Health Record: transforming and streamlining modalities of care. Health Aff (Millwood) 2009 Apr;28(2):323-333 [FREE Full text] [doi: 10.1377/hlthaff.28.2.323] [Medline: 19275987]",
    "FREE Full text",
    "[raw_reference] Roblin DW, Houston TK, Allison JJ, Joski PJ, Becker ER. Disparities in use of a personal health record in a managed care organization. J Am Med Inform Assoc 2009;16(5):683-689 [FREE Full text] [doi: 10.1197/jamia.M3169] [Medline: 19567790]",
    "FREE Full text",
    "[raw_reference] Wald JS, Businger A, Gandhi TK, Grant RW, Poon EG, Schnipper JL, et al. Implementing practice-linked pre-visit electronic journals in primary care: patient and physician use and satisfaction. J Am Med Inform Assoc 2010;17(5):502-506 [FREE Full text] [doi: 10.1136/jamia.2009.001362] [Medline: 20819852]",
    "FREE Full text",
    "[raw_reference] Wald JS. Variations in patient portal adoption in four primary care practices. AMIA Annu Symp Proc 2010;2010:837-841 [FREE Full text] [Medline: 21347096]",
    "FREE Full text",
    "[raw_reference] Wen KY, Kreps G, Zhu F, Miller S. Consumers' perceptions about and use of the internet for personal health records and health information exchange: analysis of the 2007 Health Information National Trends Survey. J Med Internet Res 2010;12(4):e73 [FREE Full text] [doi: 10.2196/jmir.1668] [Medline: 21169163]",
    "FREE Full text",
    "[raw_reference] Zhou YY, Kanter MH, Wang JJ, Garrido T. Improved quality at Kaiser Permanente through e-mail between physicians and patients. Health Aff (Millwood) 2010 Jul;29(7):1370-1375 [FREE Full text] [doi: 10.1377/hlthaff.2010.0048] [Medline: 20606190]",
    "FREE Full text",
    "[raw_reference] Nazi KM. Veterans' voices: use of the American Customer Satisfaction Index (ACSI) Survey to identify My HealtheVet personal health record users' characteristics, needs, and preferences. J Am Med Inform Assoc 2010;17(2):203-211 [FREE Full text] [doi: 10.1136/jamia.2009.000240] [Medline: 20190065]",
    "FREE Full text",
    "[raw_reference] Kahn JS, Hilton JF, Van NT, Leasure S, Bryant KM, Hare CB, et al. Personal health records in a public hospital: experience at the HIV/AIDS clinic at San Francisco General Hospital. J Am Med Inform Assoc 2010;17(2):224-228 [FREE Full text] [doi: 10.1136/jamia.2009.000315] [Medline: 20190069]",
    "FREE Full text",
    "[raw_reference] Greenhalgh T, Hinder S, Stramer K, Bratan T, Russell J. Adoption, non-adoption, and abandonment of a personal electronic health record: case study of HealthSpace. BMJ 2010;341:c5814 [FREE Full text] [Medline: 21081595]",
    "FREE Full text",
    "[raw_reference] Ancker JS, Barr\u00f3n Y, Rockoff ML, Hauser D, Pichardo M, Szerencsy A, et al. Use of an electronic patient portal among disadvantaged populations. J Gen Intern Med 2011 Oct;26(10):1117-1123 [FREE Full text] [doi: 10.1007/s11606-011-1749-y] [Medline: 21647748]",
    "FREE Full text",
    "[raw_reference] Horvath M, Levy J, L'Engle P, Carlson B, Ahmad A, Ferranti J. Impact of health portal enrollment with email reminders on adherence to clinic appointments: a pilot study. J Med Internet Res 2011;13(2):e41 [FREE Full text] [doi: 10.2196/jmir.1702] [Medline: 21616784]",
    "FREE Full text",
    "[raw_reference] Goel MS, Brown TL, Williams A, Cooper AJ, Hasnain-Wynia R, Baker DW. Patient reported barriers to enrolling in a patient portal. J Am Med Inform Assoc 2011 Dec;18 Suppl 1:i8-12 [FREE Full text] [doi: 10.1136/amiajnl-2011-000473] [Medline: 22071530]",
    "FREE Full text",
    "[raw_reference] Goel MS, Brown TL, Williams A, Hasnain-Wynia R, Thompson JA, Baker DW. Disparities in enrollment and use of an electronic patient portal. J Gen Intern Med 2011 Oct;26(10):1112-1116 [FREE Full text] [doi: 10.1007/s11606-011-1728-3] [Medline: 21538166]",
    "FREE Full text",
    "[raw_reference] Sequist TD, Zaslavsky AM, Colditz GA, Ayanian JZ. Electronic patient messages to promote colorectal cancer screening: a randomized controlled trial. Arch Intern Med 2011 Apr 11;171(7):636-641 [FREE Full text] [doi: 10.1001/archinternmed.2010.467] [Medline: 21149743]",
    "[raw_reference] Zulman DM, Nazi KM, Turvey CL, Wagner TH, Woods SS, An LC. Patient interest in sharing personal health record information: a web-based survey. Ann Intern Med 2011 Dec 20;155(12):805-810. [doi: 10.7326/0003-4819-155-12-201112200-00002] [Medline: 22184687]",
    "FREE Full text",
    "[raw_reference] Sarkar U, Karter AJ, Liu JY, Adler NE, Nguyen R, L\u00f3pez A, et al. Social disparities in internet patient portal use in diabetes: evidence that the digital divide extends beyond access. J Am Med Inform Assoc 2011 May 1;18(3):318-321 [FREE Full text] [doi: 10.1136/jamia.2010.006015] [Medline: 21262921]",
    "FREE Full text",
    "[raw_reference] North F, Hanna BK, Crane SJ, Smith SA, Tulledge-Scheitel SM, Stroebel RJ. Patient portal doldrums: does an exam room promotional video during an office visit increase patient portal registrations and portal use? J Am Med Inform Assoc 2011 Dec;18 Suppl 1:i24-i27 [FREE Full text] [doi: 10.1136/amiajnl-2011-000381] [Medline: 21976028]",
    "FREE Full text",
    "[raw_reference] McInnes DK, Solomon JL, Bokhour BG, Asch SM, Ross D, Nazi KM, et al. Use of electronic personal health record systems to encourage HIV screening: an exploratory study of patient and provider perspectives. BMC Res Notes 2011;4:295 [FREE Full text] [doi: 10.1186/1756-0500-4-295] [Medline: 21843313]",
    "FREE Full text",
    "[raw_reference] Levy MA, Giuse DA, Eck C, Holder G, Lippard G, Cartwright J, et al. Integrated information systems for electronic chemotherapy medication administration. J Oncol Pract 2011 Jul;7(4):226-230 [FREE Full text] [doi: 10.1200/JOP.2011.000259] [Medline: 22043185]",
    "FREE Full text",
    "[raw_reference] Jung C, Padman R, Shevchik G, Paone S. Who are portal users vs. early e-Visit adopters? A preliminary analysis. AMIA Annu Symp Proc 2011;2011:1070-1079 [FREE Full text] [Medline: 22195168]",
    "FREE Full text",
    "[raw_reference] Nagykaldi Z, Aspy CB, Chou A, Mold JW. Impact of a Wellness Portal on the delivery of patient-centered preventive care. J Am Board Fam Med 2012 Apr;25(2):158-167 [FREE Full text] [doi: 10.3122/jabfm.2012.02.110130] [Medline: 22403196]",
    "FREE Full text",
    "[raw_reference] Nielsen AS, Halamka JD, Kinkel RP. Internet portal use in an academic multiple sclerosis center. J Am Med Inform Assoc 2012 Feb;19(1):128-133 [FREE Full text] [doi: 10.1136/amiajnl-2011-000177] [Medline: 21571744]",
    "FREE Full text",
    "[raw_reference] Tenforde M, Nowacki A, Jain A, Hickner J. The association between personal health record use and diabetes quality measures. J Gen Intern Med 2012 Apr;27(4):420-424 [FREE Full text] [doi: 10.1007/s11606-011-1889-0] [Medline: 22005937]",
    "[raw_reference] Johnson AJ, Easterling D, Nelson R, Chen MY, Frankel RM. Access to radiologic reports via a patient portal: clinical simulations to investigate patient preferences. J Am Coll Radiol Apr;9(4):256-263. [doi: 10.1016/j.jacr.2011.12.023] [Medline: 22469376]",
    "FREE Full text",
    "[raw_reference] Rosenbloom ST, Daniels TL, Talbot TR, McClain T, Hennes R, Stenner S, et al. Triaging patients at risk of influenza using a patient portal. J Am Med Inform Assoc 2012;19(4):549-554 [FREE Full text] [doi: 10.1136/amiajnl-2011-000382] [Medline: 22140208]",
    "FREE Full text",
    "[raw_reference] Noblin AM, Wan TTH, Fottler M. The impact of health literacy on a patient's decision to adopt a personal health record. Perspect Health Inf Manag 2012;9:1-13 [FREE Full text] [Medline: 23209454]",
    "[raw_reference] Wakefield DS, Kruse RL, Wakefield BJ, Koopman RJ, Keplinger LE, Canfield SM, et al. Consistency of patient preferences about a secure Internet-based patient communications portal: contemplating, enrolling, and using. Am J Med Qual 2012;27(6):494-502. [doi: 10.1177/1062860611436246] [Medline: 22517909]",
    "FREE Full text",
    "[raw_reference] Wagner PJ, Dias J, Howard S, Kintziger KW, Hudson MF, Seol YH, et al. Personal health records and hypertension control: a randomized trial. J Am Med Inform Assoc 2012 Aug;19(4):626-634 [FREE Full text] [doi: 10.1136/amiajnl-2011-000349] [Medline: 22234404]",
    "FREE Full text",
    "[raw_reference] Urowitz S, Wiljer D, Dupak K, Kuehner Z, Leonard K, Lovrics E, et al. Improving diabetes management with a patient portal: a qualitative study of diabetes self-management portal. J Med Internet Res 2012;14(6):e158 [FREE Full text] [doi: 10.2196/jmir.2265] [Medline: 23195925]",
    "FREE Full text",
    "[raw_reference] Tsai J, Rosenheck RA. Use of the internet and an online personal health record system by US veterans: comparison of Veterans Affairs mental health service users and other veterans nationally. J Am Med Inform Assoc 2012;19(6):1089-1094 [FREE Full text] [doi: 10.1136/amiajnl-2012-000971] [Medline: 22847305]",
    "FREE Full text",
    "[raw_reference] Emani S, Yamin CK, Peters E, Karson AS, Lipsitz SR, Wald JS, et al. Patient perceptions of a personal health record: a test of the diffusion of innovation model. J Med Internet Res 2012;14(6):e150 [FREE Full text] [doi: 10.2196/jmir.2278] [Medline: 23128775]",
    "[raw_reference] Ahlers-Schmidt CR, Nguyen M. Parent intention to use a patient portal as related to their children following a facilitated demonstration. Telemed J E Health 2013 Dec;19(12):979-981. [doi: 10.1089/tmj.2013.0041] [Medline: 24050608]",
    "FREE Full text",
    "[raw_reference] Schickedanz A, Huang D, Lopez A, Cheung E, Lyles CR, Bodenheimer T, et al. Access, interest, and attitudes toward electronic communication for health care among patients in the medical safety net. J Gen Intern Med 2013 Jul;28(7):914-920 [FREE Full text] [doi: 10.1007/s11606-012-2329-5] [Medline: 23423453]",
    "[raw_reference] Sanders MR, Winters P, Fortuna RJ, Mendoza M, Berliant M, Clark L, et al. Internet access and patient portal readiness among patients in a group of inner-city safety-net practices. J Ambul Care Manage 2013;36(3):251-259. [doi: 10.1097/JAC.0b013e31829702f9] [Medline: 23748274]",
    "FREE Full text",
    "[raw_reference] Ronda MCM, Dijkhorst-Oei LT, Gorter KJ, Beulens JWJ, Rutten GEHM. Differences between diabetes patients who are interested or not in the use of a patient Web portal. Diabetes Technol Ther 2013 Jul;15(7):556-563 [FREE Full text] [doi: 10.1089/dia.2013.0023] [Medline: 23777369]",
    "FREE Full text",
    "[raw_reference] Osborn CY, Mayberry LS, Wallston KA, Johnson KB, Elasy TA. Understanding patient portal use: implications for medication management. J Med Internet Res 2013;15(7):e133 [FREE Full text] [doi: 10.2196/jmir.2589] [Medline: 23823974]",
    "[raw_reference] Nazi KM, Hogan TP, McInnes DK, Woods SS, Graham G. Evaluating patient access to Electronic Health Records: results from a survey of veterans. Med Care 2013 Mar;51(3 Suppl 1):S52-S56. [doi: 10.1097/MLR.0b013e31827808db] [Medline: 23407012]",
    "FREE Full text",
    "[raw_reference] Lyles CR, Sarkar U, Ralston JD, Adler N, Schillinger D, Moffet HH, et al. Patient-provider communication and trust in relation to use of an online patient portal among diabetes patients: The Diabetes and Aging Study. J Am Med Inform Assoc 2013;20(6):1128-1131 [FREE Full text] [doi: 10.1136/amiajnl-2012-001567] [Medline: 23676243]",
    "[raw_reference] Ketterer T, West DW, Sanders VP, Hossain J, Kondo MC, Sharif I. Correlates of patient portal enrollment and activation in primary care pediatrics. Acad Pediatr 2013;13(3):264-271. [doi: 10.1016/j.acap.2013.02.002] [Medline: 23680344]",
    "FREE Full text",
    "[raw_reference] Kerns JW, Krist AH, Longo DR, Kuzel AJ, Woolf SH. How patients want to engage with their personal health record: a qualitative study. BMJ Open 2013;3(7):1-10 [FREE Full text] [doi: 10.1136/bmjopen-2013-002931] [Medline: 23901027]",
    "FREE Full text",
    "[raw_reference] Hanberger L, Ludvigsson J, Nordfeldt S. Use of a web 2.0 portal to improve education and communication in young patients with families: randomized controlled trial. J Med Internet Res 2013;15(8):e175 [FREE Full text] [doi: 10.2196/jmir.2425] [Medline: 23973555]",
    "FREE Full text",
    "[raw_reference] Butler JM, Carter M, Hayden C, Gibson B, Weir C, Snow L, et al. Understanding adoption of a personal health record in rural health care clinics: revealing barriers and facilitators of adoption including attributions about potential patient portal users and self-reported characteristics of early adopting users. AMIA Annu Symp Proc 2013;2013:152-161 [FREE Full text] [Medline: 24551328]",
    "[raw_reference] Gu Y, Day K. Propensity of people with long-term conditions to use personal health records. Stud Health Technol Inform 2013;188:46-51. [Medline: 23823287]",
    "FREE Full text",
    "[raw_reference] Gerber DE, Laccetti AL, Chen B, Yan J, Cai J, Gates S, et al. Predictors and intensity of online access to electronic medical records among patients with cancer. J Oncol Pract 2014 Sep;10(5):e307-e312 [FREE Full text] [doi: 10.1200/JOP.2013.001347] [Medline: 25006222]",
    "FREE Full text",
    "[raw_reference] Kondylakis H, Kazantzaki E, Koumakis L, Genitsaridi I, Marias K, Gorini A, et al. Development of interactive empowerment services in support of personalised medicine. Ecancermedicalscience 2014;8:400 [FREE Full text] [doi: 10.3332/ecancer.2014.400] [Medline: 24567757]",
    "FREE Full text",
    "[raw_reference] Krist AH, Woolf SH, Bello GA, Sabo RT, Longo DR, Kashiri P, et al. Engaging primary care patients to use a patient-centered personal health record. Ann Fam Med 2014;12(5):418-426 [FREE Full text] [doi: 10.1370/afm.1691] [Medline: 25354405]",
    "[raw_reference] Jung C, Padman R. Virtualized healthcare delivery: understanding users and their usage patterns of online medical consultations. Int J Med Inform 2014 Dec;83(12):901-914. [doi: 10.1016/j.ijmedinf.2014.08.004] [Medline: 25193501]",
    "FREE Full text",
    "[raw_reference] Haun JN, Lind JD, Shimada SL, Martin TL, Gosline RM, Antinori N, et al. Evaluating user experiences of the secure messaging tool on the Veterans Affairs' patient portal system. J Med Internet Res 2014;16(3):e75 [FREE Full text] [doi: 10.2196/jmir.2976] [Medline: 24610454]",
    "FREE Full text",
    "[raw_reference] van der Vaart R, Drossaert CHC, Taal E, Drossaers-Bakker KW, Vonkeman HE, van de Laar MAFJ. Impact of patient-accessible electronic medical records in rheumatology: use, satisfaction and effects on empowerment among patients. BMC Musculoskelet Disord 2014;15:102 [FREE Full text] [doi: 10.1186/1471-2474-15-102] [Medline: 24673997]",
    "[raw_reference] Ancker JS, Silver M, Kaushal R. Rapid growth in use of personal health records in New York, 2012-2013. J Gen Intern Med 2014 Jun;29(6):850-854. [doi: 10.1007/s11606-014-2792-2] [Medline: 24519102]",
    "FREE Full text",
    "[raw_reference] Abramson EL, Patel V, Edwards A, Kaushal R. Consumer perspectives on personal health records: a 4-community study. Am J Manag Care 2014 Apr;20(4):287-296 [FREE Full text] [Medline: 24884860]",
    "FREE Full text",
    "[raw_reference] Phelps RG, Taylor J, Simpson K, Samuel J, Turner AN. Patients' continuing use of an online health record: a quantitative evaluation of 14,000 patient years of access data. J Med Internet Res 2014;16(10):e241 [FREE Full text] [doi: 10.2196/jmir.3371] [Medline: 25344621]",
    "[raw_reference] Neuner J, Fedders M, Caravella M, Bradford L, Schapira M. Meaningful use and the patient portal: patient enrollment, use, and satisfaction with patient portals at a later-adopting center. Am J Med Qual 2015;30(2):105-113. [doi: 10.1177/1062860614523488] [Medline: 24563085]",
    "FREE Full text",
    "[raw_reference] Riippa I, Linna M, R\u00f6nkk\u00f6 I. The effect of a patient portal with electronic messaging on patient activation among chronically ill patients: controlled before-and-after study. J Med Internet Res 2014;16(11):e257 [FREE Full text] [doi: 10.2196/jmir.3462] [Medline: 25413368]",
    "[raw_reference] Ancker JS, Osorio SN, Cheriff A, Cole CL, Silver M, Kaushal R. Patient activation and use of an electronic patient portal. Inform Health Soc Care 2014 Apr 30:1-13. [doi: 10.3109/17538157.2014.908200] [Medline: 24786648]",
    "FREE Full text",
    "[raw_reference] Lober WB, Zierler B, Herbaugh A, Shinstrom SE, Stolyar A, Kim EH, et al. Barriers to the use of a personal health record by an elderly population. AMIA Annu Symp Proc 2006:514-518 [FREE Full text] [Medline: 17238394]",
    "[raw_reference] Taha J, Czaja SJ, Sharit J, Morrow DG. Factors affecting usage of a personal health record (PHR) to manage health. Psychol Aging 2013 Dec;28(4):1124-1139. [doi: 10.1037/a0033911] [Medline: 24364414]",
    "FREE Full text",
    "[raw_reference] Sarkar U, Karter AJ, Liu JY, Adler NE, Nguyen R, Lopez A, et al. The literacy divide: health literacy and the use of an internet-based patient portal in an integrated health system-results from the diabetes study of northern California (DISTANCE). J Health Commun 2010;15 Suppl 2:183-196 [FREE Full text] [doi: 10.1080/10810730.2010.499988] [Medline: 20845203]",
    "[raw_reference] Logue MD, Effken JA. Modeling factors that influence personal health records adoption. Comput Inform Nurs 2012 Jul;30(7):354-362. [doi: 10.1097/NXN.0b013e3182510717] [Medline: 22525046]",
    "FREE Full text",
    "[raw_reference] Wynia MK, Torres GW, Lemieux J. Many physicians are willing to use patients' electronic personal health records, but doctors differ by location, gender, and practice. Health Aff (Millwood) 2011 Feb;30(2):266-273 [FREE Full text] [doi: 10.1377/hlthaff.2010.0342] [Medline: 21289348]",
    "FREE Full text",
    "[raw_reference] Nazi KM. The personal health record paradox: health care professionals' perspectives and the information ecology of personal health record systems in organizational and clinical settings. J Med Internet Res 2013;15(4):e70 [FREE Full text] [doi: 10.2196/jmir.2443] [Medline: 23557596]",
    "FREE Full text",
    "[raw_reference] Yau GL, Williams AS, Brown JB. Family physicians' perspectives on personal health records: qualitative study. Can Fam Physician 2011 May;57(5):e178-e184 [FREE Full text] [Medline: 21642732]",
    "FREE Full text",
    "[raw_reference] van der Vaart R, Drossaert CHC, Taal E, van de Laar MAFJ. Giving rheumatology patients online home access to their electronic medical record (EMR): advantages, drawbacks and preconditions according to care providers. Rheumatol Int 2013 Sep;33(9):2405-2410 [FREE Full text] [doi: 10.1007/s00296-012-2408-2] [Medline: 22453527]",
    "FREE Full text",
    "[raw_reference] Urowitz S, Wiljer D, Apatu E, Eysenbach G, Delenardo C, Harth T, et al. Is Canada ready for patient accessible electronic health records? A national scan. BMC Med Inform Decis Mak 2008;8:33 [FREE Full text] [doi: 10.1186/1472-6947-8-33] [Medline: 18652695]",
    "FREE Full text",
    "[raw_reference] Witry MJ, Doucette WR, Daly JM, Levy BT, Chrischilles EA. Family physician perceptions of personal health records. Perspect Health Inf Manag 2010;7:1d [FREE Full text] [Medline: 20697465]",
    "FREE Full text",
    "[raw_reference] Pai HH, Lau F, Barnett J, Jones S. Meeting the health information needs of prostate cancer patients using personal health records. Curr Oncol 2013 Dec;20(6):e561-e569 [FREE Full text] [doi: 10.3747/co.20.1584] [Medline: 24311957]",
    "6YzJ53nyH",
    "[raw_reference] Selden CR, Zorn M, Ratzan SC, Parker RM. National Library of Medicine Current Bibliographies in Medicine: Health Literacy. Washington, DC: U.S. Government Printing Office; 2000. US Department of Health and Human Services. Healthy People 2010. Introduction URL: http://chirr.nlm.nih.gov/health-literacy.php [accessed 2015-06-02] [WebCite Cache ID 6YzJ53nyH]",
    "FREE Full text",
    "[raw_reference] Sox CM, Gribbons WM, Loring BA, Mandl KD, Batista R, Porter SC. Patient-centered design of an information management module for a personally controlled health record. J Med Internet Res 2010;12(3):e36 [FREE Full text] [doi: 10.2196/jmir.1269] [Medline: 20805091]",
    "FREE Full text",
    "[raw_reference] Haggstrom DA, Saleem JJ, Russ AL, Jones J, Russell SA, Chumbler NR. Lessons learned from usability testing of the VA's personal health record. J Am Med Inform Assoc 2011 Dec;18 Suppl 1:i13-i17 [FREE Full text] [doi: 10.1136/amiajnl-2010-000082] [Medline: 21984604]",
    "FREE Full text",
    "[raw_reference] Krist AH, Peele E, Woolf SH, Rothemich SF, Loomis JF, Longo DR, et al. Designing a patient-centered personal health record to promote preventive care. BMC Med Inform Decis Mak 2011;11:73 [FREE Full text] [doi: 10.1186/1472-6947-11-73] [Medline: 22115059]",
    "FREE Full text",
    "[raw_reference] Woods SS, Schwartz E, Tuepker A, Press NA, Nazi KM, Turvey CL, et al. Patient experiences with full electronic access to health records and clinical notes through the My HealtheVet Personal Health Record Pilot: qualitative study. J Med Internet Res 2013;15(3):e65 [FREE Full text] [doi: 10.2196/jmir.2356] [Medline: 23535584]",
    "[raw_reference] Monkman H, Kushniruk A. Applying usability methods to identify health literacy issues: an example using a Personal Health Record. Stud Health Technol Inform 2013;183:179-185. [Medline: 23388278]",
    "FREE Full text",
    "[raw_reference] Zarcadoolas C, Vaughon WL, Czaja SJ, Levy J, Rockoff ML. Consumers' perceptions of patient-accessible electronic medical records. J Med Internet Res 2013;15(8):e168 [FREE Full text] [doi: 10.2196/jmir.2507] [Medline: 23978618]",
    "FREE Full text",
    "[raw_reference] Krist AH, Woolf SH, Rothemich SF, Johnson RE, Peele JE, Cunningham TD, et al. Interactive preventive health record to enhance delivery of recommended care: a randomized trial. Ann Fam Med 2012;10(4):312-319 [FREE Full text] [doi: 10.1370/afm.1383] [Medline: 22778119]",
    "[raw_reference] Taha J, Sharit J, Czaja SJ. The impact of numeracy ability and technology skills on older adults' performance of health management tasks using a patient portal. J Appl Gerontol 2014 Jun;33(4):416-436. [doi: 10.1177/0733464812447283] [Medline: 24781964]",
    "[raw_reference] Schnipper JL, Gandhi TK, Wald JS, Grant RW, Poon EG, Volk LA, et al. Design and implementation of a web-based patient portal linked to an electronic health record designed to improve medication safety: the Patient Gateway medications module. Inform Prim Care 2008;16(2):147-155. [Medline: 18713531]",
    "FREE Full text",
    "[raw_reference] Fuji KT, Abbott AA, Galt KA. Personal health record design: qualitative exploration of issues inhibiting optimal use. Diabetes Care 2014;37(1):e13-e14 [FREE Full text] [doi: 10.2337/dc13-1630] [Medline: 24356602]",
    "FREE Full text",
    "[raw_reference] Britto MT, Jimison HB, Munafo JK, Wissman J, Rogers ML, Hersh W. Usability testing finds problems for novice users of pediatric portals. J Am Med Inform Assoc 2009;16(5):660-669 [FREE Full text] [doi: 10.1197/jamia.M3154] [Medline: 19567793]",
    "[raw_reference] Kuziemsky CE, Kushniruk A. Context mediated usability testing. Stud Health Technol Inform 2014;205:905-909. [Medline: 25160319]",
    "FREE Full text",
    "[raw_reference] Do NV, Barnhill R, Heermann-Do KA, Salzman KL, Gimbel RW. The military health system's personal health record pilot with Microsoft HealthVault and Google Health. J Am Med Inform Assoc 2011;18(2):118-124 [FREE Full text] [doi: 10.1136/jamia.2010.004671] [Medline: 21292705]",
    "FREE Full text",
    "[raw_reference] Gaskin GL, Longhurst CA, Slayton R, Das AK. Sociotechnical Challenges of Developing an Interoperable Personal Health Record: Lessons Learned. Appl Clin Inform 2011;2(4):406-419 [FREE Full text] [doi: 10.4338/ACI-2011-06-RA-0035] [Medline: 22003373]",
    "FREE Full text",
    "[raw_reference] Ennis L, Robotham D, Denis M, Pandit N, Newton D, Rose D, et al. Collaborative development of an electronic Personal Health Record for people with severe and enduring mental health problems. BMC Psychiatry 2014;14(1):305 [FREE Full text] [doi: 10.1186/s12888-014-0305-9] [Medline: 25403285]",
    "[raw_reference] Kushniruk AW, Patel VL. Cognitive and usability engineering methods for the evaluation of clinical information systems. J Biomed Inform 2004 Feb;37(1):56-76. [doi: 10.1016/j.jbi.2004.01.003] [Medline: 15016386] 100",
    "FREE Full text",
    "[raw_reference] Tuil WS, ten Hoopen AJ, Braat DDM, de Vries RPF, Kremer JAM. Patient-centred care: using online personal medical records in IVF practice. Hum Reprod 2006 Nov;21(11):2955-2959 [FREE Full text] [doi: 10.1093/humrep/del214] [Medline: 16982658] 101",
    "FREE Full text",
    "[raw_reference] Grant RW, Wald JS, Poon EG, Schnipper JL, Gandhi TK, Volk LA, et al. Design and implementation of a web-based patient portal linked to an ambulatory care electronic health record: patient gateway for diabetes collaborative care. Diabetes Technol Ther 2006 Oct;8(5):576-586 [FREE Full text] [doi: 10.1089/dia.2006.8.576] [Medline: 17037972] 102",
    "[raw_reference] Hess R, Bryce CL, Paone S, Fischer G, McTigue KM, Olshansky E, et al. Exploring challenges and potentials of personal health records in diabetes self-management: implementation and initial assessment. Telemed J E Health 2007 Oct;13(5):509-517. [doi: 10.1089/tmj.2006.0089] [Medline: 17999613] 103",
    "FREE Full text",
    "[raw_reference] Kim EH, Stolyar A, Lober WB, Herbaugh AL, Shinstrom SE, Zierler BK, et al. Usage patterns of a personal health record by elderly and disabled users. AMIA Annu Symp Proc 2007:409-413 [FREE Full text] [Medline: 18693868] 104",
    "FREE Full text",
    "[raw_reference] Bergman DA, Brown NL, Wilson S. Teen use of a patient portal: a qualitative study of parent and teen attitudes. Perspect Health Inf Manag 2008;5:13 [FREE Full text] [Medline: 18923702] 105",
    "FREE Full text",
    "[raw_reference] Green BB, Cook AJ, Ralston JD, Fishman PA, Catz SL, Carlson J, et al. Effectiveness of home blood pressure monitoring, Web communication, and pharmacist care on hypertension control: a randomized controlled trial. JAMA 2008 Jun 25;299(24):2857-2867 [FREE Full text] [doi: 10.1001/jama.299.24.2857] [Medline: 18577730] 106",
    "[raw_reference] Staroselsky M, Volk LA, Tsurikova R, Newmark LP, Lippincott M, Litvak I, et al. An effort to improve electronic health record medication list accuracy between visits: patients' and physicians' response. Int J Med Inform 2008 Mar;77(3):153-160. [doi: 10.1016/j.ijmedinf.2007.03.001] [Medline: 17434337] 107",
    "FREE Full text",
    "[raw_reference] Wald JS, Grant RW, Schnipper JL, Gandhi TK, Poon EG, Businger AC, et al. Survey analysis of patient experience using a practice-linked PHR for type 2 diabetes mellitus. AMIA Annu Symp Proc 2009;2009:678-682 [FREE Full text] [Medline: 20351940] 108",
    "[raw_reference] Leveille SG, Huang A, Tsai SB, Allen M, Weingart SN, Iezzoni LI. Health coaching via an internet portal for primary care patients with chronic conditions: a randomized controlled trial. Med Care 2009 Jan;47(1):41-47. [doi: 10.1097/MLR.0b013e3181844dd0] [Medline: 19106729] 109",
    "FREE Full text",
    "[raw_reference] Kim EH, Stolyar A, Lober WB, Herbaugh AL, Shinstrom SE, Zierler BK, et al. Challenges to using an electronic personal health record by a low-income elderly population. J Med Internet Res 2009;11(4):e44 [FREE Full text] [doi: 10.2196/jmir.1256] [Medline: 19861298] 110",
    "FREE Full text",
    "[raw_reference] Wiljer D, Leonard KJ, Urowitz S, Apatu E, Massey C, Quartey NK, et al. The anxious wait: assessing the impact of patient accessible EHRs for breast cancer patients. BMC Med Inform Decis Mak 2010;10:46 [FREE Full text] [doi: 10.1186/1472-6947-10-46] [Medline: 20809950] 111",
    "FREE Full text",
    "[raw_reference] Reti SR, Feldman HJ, Ross SE, Safran C. Improving personal health records for patient-centered care. J Am Med Inform Assoc 2010;17(2):192-195 [FREE Full text] [doi: 10.1136/jamia.2009.000927] [Medline: 20190063] 112",
    "quiz 719",
    "[raw_reference] Shaw RJ, Ferranti J. Patient-provider internet portals--patient outcomes and use. Comput Inform Nurs 2011 Dec;29(12):714-8; quiz 719. [doi: 10.1097/NCN.0b013e318224b597] [Medline: 21697705] 113",
    "FREE Full text",
    "[raw_reference] Wright A, Poon EG, Wald J, Feblowitz J, Pang JE, Schnipper JL, et al. Randomized controlled trial of health maintenance reminders provided directly to patients through an electronic PHR. J Gen Intern Med 2012 Jan;27(1):85-92 [FREE Full text] [doi: 10.1007/s11606-011-1859-6] [Medline: 21904945] 114",
    "FREE Full text",
    "[raw_reference] Schnipper JL, Gandhi TK, Wald JS, Grant RW, Poon EG, Volk LA, et al. Effects of an online personal health record on medication accuracy and safety: a cluster-randomized trial. J Am Med Inform Assoc 2012;19(5):728-734 [FREE Full text] [doi: 10.1136/amiajnl-2011-000723] [Medline: 22556186] 115",
    "[raw_reference] Palen TE, Ross C, Powers JD, Xu S. Association of online patient access to clinicians and medical records with use of clinical services. JAMA 2012 Nov 21;308(19):2012-2019. [doi: 10.1001/jama.2012.14126] [Medline: 23168824] 116",
    "FREE Full text",
    "[raw_reference] Schnipper JL, Gandhi TK, Wald JS, Grant RW, Poon EG, Volk LA, et al. Effects of an online personal health record on medication accuracy and safety: a cluster-randomized trial. J Am Med Inform Assoc 2012;19(5):728-734 [FREE Full text] [doi: 10.1136/amiajnl-2011-000723] [Medline: 22556186] 117",
    "FREE Full text",
    "[raw_reference] Wade-Vuturo AE, Mayberry LS, Osborn CY. Secure messaging and diabetes management: experiences and perspectives of patient portal users. J Am Med Inform Assoc 2013 May 1;20(3):519-525 [FREE Full text] [doi: 10.1136/amiajnl-2012-001253] [Medline: 23242764] 118",
    "FREE Full text",
    "[raw_reference] Sarkar U, Lyles CR, Parker MM, Allen J, Nguyen R, Moffet HH, et al. Use of the refill function through an online patient portal is associated with improved adherence to statins in an integrated health system. Med Care 2014 Mar;52(3):194-201 [FREE Full text] [doi: 10.1097/MLR.0000000000000069] [Medline: 24374412] 119",
    "FREE Full text",
    "[raw_reference] Otsuka SH, Tayal NH, Porter K, Embi PJ, Beatty SJ. Improving herpes zoster vaccination rates through use of a clinical pharmacist and a personal health record. Am J Med 2013 Sep;126(9):832.e1-832.e6 [FREE Full text] [doi: 10.1016/j.amjmed.2013.02.018] [Medline: 23830534] 120",
    "FREE Full text",
    "[raw_reference] North F, Crane SJ, Stroebel RJ, Cha SS, Edell ES, Tulledge-Scheitel SM. Patient-generated secure messages and eVisits on a patient portal: are patients at risk? J Am Med Inform Assoc 2013;20(6):1143-1149 [FREE Full text] [doi: 10.1136/amiajnl-2012-001208] [Medline: 23703826] 121",
    "FREE Full text",
    "[raw_reference] North F, Crane SJ, Chaudhry R, Ebbert JO, Ytterberg K, Tulledge-Scheitel SM, et al. Impact of patient portal secure messages and electronic visits on adult primary care office visits. Telemed J E Health 2014 Mar;20(3):192-198 [FREE Full text] [doi: 10.1089/tmj.2013.0097] [Medline: 24350803] 122",
    "FREE Full text",
    "[raw_reference] Murray MF, Giovanni MA, Klinger E, George E, Marinacci L, Getty G, et al. Comparing electronic health record portals to obtain patient-entered family health history in primary care. J Gen Intern Med 2013 Dec;28(12):1558-1564 [FREE Full text] [doi: 10.1007/s11606-013-2442-0] [Medline: 23588670] 123",
    "FREE Full text",
    "[raw_reference] Heyworth L, Paquin AM, Clark J, Kamenker V, Stewart M, Martin T, et al. Engaging patients in medication reconciliation via a patient portal following hospital discharge. J Am Med Inform Assoc 2014 Feb;21(e1):e157-e162 [FREE Full text] [doi: 10.1136/amiajnl-2013-001995] [Medline: 24036155] 124",
    "[raw_reference] Britto MT, Hesse EA, Kamdar OJ, Munafo JK. Parents' perceptions of a patient portal for managing their child's chronic illness. J Pediatr 2013 Jul;163(1):280-1.e1. [doi: 10.1016/j.jpeds.2013.02.041] [Medline: 23541773] 125",
    "[raw_reference] Aberger EW, Migliozzi D, Follick MJ, Malick T, Ahern DK. Enhancing patient engagement and blood pressure management for renal transplant recipients via home electronic monitoring and web-enabled collaborative care. Telemed J E Health 2014 Sep;20(9):850-854. [doi: 10.1089/tmj.2013.0317] [Medline: 25046403] 126",
    "[raw_reference] Barron J, Bedra M, Wood J, Finkelstein J. Exploring three perspectives on feasibility of a patient portal for older adults. Stud Health Technol Inform 2014;202:181-184. [Medline: 25000046] 127",
    "[raw_reference] Borbolla D, Del FG, Taliercio V, Otero C, Campos F, Martinez M, et al. Integrating personalized health information from MedlinePlus in a patient portal. Stud Health Technol Inform 2014;205:348-352. [Medline: 25160204] 128",
    "[raw_reference] Wright A, Feblowitz J, Maloney FL, Henkin S, Ramelson H, Feltman J, et al. Increasing patient engagement: patients' responses to viewing problem lists online. Appl Clin Inform 2014;5(4):930-942. [doi: 10.4338/ACI-2014-07-RA-0057] [Medline: 25589908] 129",
    "[raw_reference] Tom JO, Chen C, Zhou YY. Personal health record use and association with immunizations and well-child care visits recommendations. J Pediatr 2014 Jan;164(1):112-117. [doi: 10.1016/j.jpeds.2013.08.046] [Medline: 24120019] 130",
    "[raw_reference] Nazi KM, Turvey CL, Klein DM, Hogan TP, Woods SS. VA OpenNotes: exploring the experiences of early patient adopters with access to clinical notes. J Am Med Inform Assoc 2015 Mar;22(2):380-389. [doi: 10.1136/amiajnl-2014-003144] [Medline: 25352570] 131",
    "[raw_reference] Lau M, Campbell H, Tang T, Thompson DJS, Elliott T. Impact of patient use of an online patient portal on diabetes outcomes. Can J Diabetes 2014 Feb;38(1):17-21. [doi: 10.1016/j.jcjd.2013.10.005] [Medline: 24485208] 132",
    "[raw_reference] Hess R, Fischer GS, Sullivan SM, Dong X, Weimer M, Zeith C, et al. Patterns of response to patient-centered decision support through a personal health record. Telemed J E Health 2014 Nov;20(11):984-989. [doi: 10.1089/tmj.2013.0332] [Medline: 25243350] 133",
    "[raw_reference] Hall MJ, Herda MM, Handorf EA, Rybak CC, Keleher CA, Siemon M, et al. Direct-to-patient disclosure of results of mismatch repair screening for Lynch syndrome via electronic personal health record: a feasibility study. Genet Med 2014 Nov;16(11):854-861. [doi: 10.1038/gim.2014.42] [Medline: 24784156] 134",
    "[raw_reference] Druss BG, Ji X, Glick G, von Esenwein SA. Randomized trial of an electronic personal health record for patients with serious mental illnesses. Am J Psychiatry 2014 Mar;171(3):360-368. [doi: 10.1176/appi.ajp.2013.13070913] [Medline: 24435025] 135",
    "[raw_reference] Crotty BH, Tamrat Y, Mostaghimi A, Safran C, Landon BE. Patient-to-physician messaging: volume nearly tripled as more patients joined system, but per capita rate plateaued. Health Aff (Millwood) 2014 Oct;33(10):1817-1822. [doi: 10.1377/hlthaff.2013.1145] [Medline: 25288428] 136",
    "[raw_reference] Chrischilles EA, Hourcade JP, Doucette W, Eichmann D, Gryzlak B, Lorentzen R, et al. Personal health records: a randomized trial of effects on elder medication safety. J Am Med Inform Assoc 2014;21(4):679-686. [doi: 10.1136/amiajnl-2013-002284] [Medline: 24326536] 137",
    "[raw_reference] Cabitza F, Simone C, De MG. User-driven prioritization of features for a prospective InterPersonal Health Record: perceptions from the Italian context. Comput Biol Med 2015 Apr;59:202-210. [doi: 10.1016/j.compbiomed.2014.03.009] [Medline: 24768267] 138",
    "[raw_reference] Hargreaves JS. Will electronic personal health records benefit providers and patients in rural America? Telemed J E Health 2010 Mar;16(2):167-176. [doi: 10.1089/tmj.2009.0063] [Medline: 20082592] 139",
    "FREE Full text",
    "[raw_reference] Guy R, Hocking J, Wand H, Stott S, Ali H, Kaldor J. How effective are short message service reminders at increasing clinic attendance? A meta-analysis and systematic review. Health Serv Res 2012 Apr;47(2):614-632 [FREE Full text] [doi: 10.1111/j.1475-6773.2011.01342.x] [Medline: 22091980] 140",
    "FREE Full text Medicare and Medicaid Services MU: meaningful use SM: secure messaging Edited by G Eysenbach; submitted 20.01.15; peer-reviewed by D Amante, A Benis; comments to author 05.02.15 revised version received 10.03.15; accepted 03.04.15; published 23.06.15 Please cite as",
    "[raw_reference] Irizarry T, DeVito Dabbs A, Curran CR Patient Portals and Patient Engagement: A State of the Science Review J Med Internet Res 2015;17(6):e148 URL: http://www.jmir.org/2015/6/e148/ doi: 10.2196/jmir.4255 PMID: 26104044",
    "[raw_reference] \u00a9Taya Irizarry, Annette DeVito Dabbs, Christine R Curran. Originally published in the Journal of Medical Internet Research (http://www.jmir.org), 23.06"
  ],
  "processing_software": {
    "GROBID": "0.8.2"
  }
}
