{
  "paper_id": "BCDIKDGA",
  "title": "Mapping Factors That Affect the Uptake of Digital Therapeutics Within Health Systems: Scoping Review",
  "abstract": "Background: Digital therapeutics are patient-facing digital health interventions that can significantly alter the health care landscape. Despite digital therapeutics being used to successfully treat a range of conditions, their uptake in health systems remains limited. Understanding the full spectrum of uptake factors is essential to identify ways in which policy makers and providers can facilitate the adoption of effective digital therapeutics within a health system, as well as the steps developers can take to assist in the deployment of products. Objective: In this review, we aimed to map the most frequently discussed factors that determine the integration of digital therapeutics into health systems and practical use of digital therapeutics by patients and professionals. Methods: A scoping review was conducted in MEDLINE, Web of Science, Cochrane Database of Systematic Reviews, and Google Scholar. Relevant data were extracted and synthesized using a thematic analysis. \n Results: We identified 35,541 academic and 221 gray literature reports, with 244 (0.69%) included in the review, covering 35 countries. Overall, 85 factors that can impact the uptake of digital therapeutics were extracted and pooled into 5 categories: policy and system, patient characteristics, properties of digital therapeutics, characteristics of health professionals, and outcomes. The need for a regulatory framework for digital therapeutics was the most stated factor at the policy level. Demographic characteristics formed the most iterated patient-related factor, whereas digital literacy was considered the most important factor for health professionals. Among the properties of digital therapeutics, their interoperability across the broader health system was most emphasized. Finally, the ability to expand access to health care was the most frequently stated outcome measure. \n Conclusions: The map of factors developed in this review offers a multistakeholder approach to recognizing the uptake factors of digital therapeutics in the health care pathway and provides an analytical tool for policy makers to assess their health system's readiness for digital therapeutics.",
  "year": 2021,
  "date": "2021",
  "authors": [
    {
      "name": "Robin Van Kessel",
      "affiliation": {
        "organization": "LSE Health",
        "department": "LSE Health",
        "institution": "London School of Economics and Political Science",
        "address": "London, United Kingdom"
      }
    },
    {
      "name": "Andres Roman-Urrestarazu",
      "affiliation": {
        "organization": "Department of Psychiatry",
        "department": "Department of Psychiatry",
        "institution": "University of Cambridge",
        "address": "Cambridge, United Kingdom"
      }
    },
    {
      "name": "Michael Anderson",
      "affiliation": {
        "organization": "LSE Health",
        "department": "LSE Health",
        "institution": "London School of Economics and Political Science",
        "address": "London, United Kingdom"
      }
    },
    {
      "name": "Ilias Kyriopoulos",
      "affiliation": {
        "organization": "LSE Health",
        "department": "LSE Health",
        "institution": "London School of Economics and Political Science",
        "address": "London, United Kingdom"
      }
    },
    {
      "name": "Samantha Field",
      "affiliation": {
        "organization": "Department of Health Services Research and Policy",
        "department": "Department of Health Services Research and Policy",
        "institution": "London School of Hygiene and Tropical Medicine",
        "address": "London, United Kingdom"
      }
    },
    {
      "name": "Giovanni Monti",
      "affiliation": {
        "organization": "LSE Health",
        "department": "LSE Health",
        "institution": "London School of Economics and Political Science",
        "address": "London, United Kingdom"
      }
    },
    {
      "name": "Shelby Reed",
      "affiliation": {
        "organization": "Duke Clinical Research Institute",
        "department": "Duke Clinical Research Institute",
        "institution": "Duke University School of Medicine",
        "address": "Durham, NC, United States"
      }
    },
    {
      "name": "Milena Pavlova",
      "affiliation": {
        "organization": "Department of Health Services Research",
        "department": "Department of Health Services Research",
        "institution": "Maastricht University",
        "address": "Maastricht, Netherlands"
      }
    },
    {
      "name": "George Wharton",
      "affiliation": {
        "organization": "LSE Health",
        "department": "LSE Health",
        "institution": "London School of Economics and Political Science",
        "address": "London, United Kingdom"
      }
    },
    {
      "name": "Elias Mossialos",
      "email": "e.a.mossialos@lse.ac.uk",
      "affiliation": {
        "organization": "LSE Health",
        "department": "LSE Health",
        "institution": "London School of Economics and Political Science",
        "address": "London, United Kingdom"
      }
    },
    {
      "affiliation": {
        "organization": "LSE Health Department of Health Policy London School of Economics and Political Science",
        "department": "LSE Health Department of Health Policy London School of Economics and Political Science",
        "address": "WC2A 2AE, London, United Kingdom"
      }
    }
  ],
  "doi": "10.2196/48000",
  "md5": "6CFFF57B03938DC08FD0993AAB542537",
  "publication": {
    "journal": "Telemed J E Health",
    "journal_inferred": true
  },
  "keywords": [
    "digital health",
    "uptake",
    "implementation",
    "adoption",
    "framework",
    "digital therapeutics",
    "scoping review",
    "thematic analysis",
    "digital medicine",
    "policy"
  ],
  "funding": [
    "Acknowledgments The authors would like to thank  Ms Andra Fry  at the  London School of Economics and Political Science Library  for her input on the methodology. The authors declare that no funding was acquired for this research."
  ],
  "sections": [
    {
      "title": "Introduction"
    },
    {
      "title": "Background",
      "text": "The digital health landscape encompasses a broad range of technologies that promote, improve, or support health system functioning and the delivery of health care, including electronic health records, telemedicine, mobile health apps, and health data analytics  [1] . Digital therapeutics are a specific subset of the overarching digital health landscape that generate and deliver clinically validated medical interventions and are used as part of a clinical treatment pathway for various health conditions  [2, 3] . As a result, they can be regulated and prescribed as therapeutics or medical devices, which distinguishes them from more generic digital health applications in the well-being and lifestyle space  [4] .\n\nDespite digital therapeutics being used to successfully treat a range of conditions, including insomnia, attention-deficit/hyperactivity disorder in children, and substance use disorder  [5] [6] [7] [8] [9] , as well as showing cost-reducing properties  [8, 10] , there are several barriers that reduce their uptake. These include issues around reimbursing them  [11, 12]  and a lack of standardization in evaluating the technologies and their outcome measures. This makes it difficult to use standard approaches to compare different interventions using traditional clinical and cost-effectiveness evaluations  [1, 11, 13, 14] . The resulting lack of data on the comparative effectiveness and cost-effectiveness of digital therapeutics can limit market access for innovative technologies  [13, 15]  and present challenges for policy makers and providers when establishing reimbursement mechanisms. There are also factors that influence uptake at the patient level, including digital infrastructure and literacy  [2, [15] [16] [17] [18] , and at the health professional level, including lack of training, uncertainties surrounding accountability, and shifts in professional workflow  [13, 19] . Although the COVID-19 pandemic boosted the implementation of digital health across the health ecosystem  [17, 18, 20] , the uptake was not sustainable, as patients reverted back to traditional health services over time  [21] ."
    },
    {
      "title": "Objective",
      "text": "A number of studies have identified a range of barriers to the uptake of digital health products at different levels  [15, 19, 22, 23] . Understanding the full spectrum of uptake factors is essential to identify ways in which policy makers and providers can facilitate the adoption of effective digital therapeutics within a health system, as well as the steps developers can take to assist in the deployment of products  [24, 25] . In this review, we aimed to map the most frequently discussed uptake factors of digital therapeutics using a scoping review of the digital health literature."
    },
    {
      "title": "Methods"
    },
    {
      "title": "Overview",
      "text": "We performed a scoping review with thematic synthesis in accordance with the scoping review framework developed by Arksey and O'Malley  [26]  and  Levac [27] . This method allows for the rapid mapping of the key concepts underpinning a broad research area, which is particularly valuable for complex issues that have not been reviewed comprehensively to date  [26] [27] [28] . In this specific context, our scoping review sought to identify articles with characteristics relevant to the uptake factors of digital therapeutics until additional articles no longer expand the argumentation and thematic saturation is reached instead of providing an exhaustive list of published literature  [29] . As such, a representative sample of the digital health literature is sufficient in this context  [29] . We followed Joanna Briggs Institute Manual for Evidence Synthesis for Scoping Reviews and reported the findings according to the PRISMA-ScR (Preferred Reporting Items for Systematic Reviews and Meta-Analyses extension for Scoping Reviews) guidelines (Table  S1  in Multimedia Appendix 1)  [30, 31] . As is the case with most scoping reviews, no review protocol was published."
    },
    {
      "title": "Eligibility Criteria",
      "text": "To be eligible for inclusion, publications had to discuss factors determining digital therapeutic uptake in the health care sector. Uptake, in this context, refers to both the integration of digital therapeutics into the health system and the acceptability and practical use of digital therapeutics by patients and health professionals. Publications from 2000 onward were considered, as this year marks the start of digitalization in health  [1, 17, 21] . Only publications in English were considered. In terms of study designs, research protocols, conference abstracts, theses, preprints, news articles, and workshop proceedings were excluded. Publications that explicitly focused on electronic health records were also excluded. Given the nature of a scoping review, the inclusion criteria were kept broad to ensure that all aspects and dimensions of the uptake factors of digital therapeutics were covered."
    },
    {
      "title": "Search Strategy and Data Collection",
      "text": "Scientific articles were systematically identified through 3 scientific databases (MEDLINE, Cochrane Database of Systematic Reviews, and Web of Science). These databases were chosen to cover both health-specific and interdisciplinary academic fields. The scientific search was supplemented with a nonsystematic search for gray literature using Google Scholar (first 200 hits)  [32] . The full query for the scientific databases is shown in Table  S2  in Multimedia Appendix 1. An information specialist at the London School of Economics and Political Science Library further validated the search strategy.\n\nThe initial search was conducted on December 12, 2022, and an updated search was conducted on March 9, 2023. The complete screening process (title or abstract and full-text screening) was performed by 1 reviewer in counterchronological order to ensure that recent evidence that might capture novel developments in the uptake of digital therapeutics is not overlooked. To further improve the robustness of the methodology, a subset (828/35,541, 2.33%) of the articles was also assessed by a second reviewer for verification, and interrater agreement scores were computed. Disagreements between the reviewers were resolved by consensus, and no third person was involved. The interrater agreement between the 2 reviewers was calculated using Cohen \u03ba in R (version 4.1.2; R Foundation for Statistical Computing)  [33, 34] . Deduplication was performed using Endnote (version 22; Clarivate Plc), and screening was performed using Covidence (Veritas Health Innovation)  [35] . Reference lists of the included articles were also screened for relevant articles."
    },
    {
      "title": "Data Synthesis",
      "text": "A thematic analysis was used to extract data relevant to the uptake of digital therapeutics  [36] . Salient factors were extracted by 1 author (RvK) and clustered post hoc into relevant domains of the Consolidated Framework for Implementation Research (CFIR)  [37] :  (1)  outer and inner settings, (2) individuals, and (3) innovation. In this review, we decided to pool the outer and inner settings into 1 domain, seeing as their contents are entangled and not mutually exclusive in the context of digital therapeutics  [38] . The clustering was reviewed and verified by other authors (AR-U, MA, IK, and EM). We also applied frequency categories to the salient factors to indicate how often a particular factor was reported in the included documents: very frequent was applied when >15% of the included documents mention a factor, frequent was applied when between 5% and 15% of the included documents reported a factor, and regular was applied when <5% of the included documents reported a factor that can affect the uptake of digital therapeutics. It is important to note that these frequency labels do not communicate the relative importance of the uptake factors. They only capture how often a factor was mentioned in the included documents. These frequency categories were translated into color codes in the development of the map of uptake factors, with red indicating the factors very frequently cited, yellow indicating the factors frequently cited, and blue indicating the factors infrequently cited.\n\nThe results were further clustered according to Donabedian quality framework, which makes a distinction among structure, process, and outcome measures  [39] . In this review, structure measures refer to the uptake factors that describe the physical, institutional, or organizational context in which care is delivered (eg, policy context or demographic characteristics). Process measures capture the transactional uptake factors of digital therapeutics (eg, the preferences, perceptions, or attitudes of patients and professionals). Outcome measures capture all the direct and indirect effects of digital therapeutics on the health care ecosystem. The policy category exclusively includes structure factors. For the patient and health professional characteristics, as well as the properties of digital therapeutics, a subclassification between structure and process measures was made. The outcome category exclusively covers outcome measures, which were divided into 4 subcategories: patient-level, health system, public health, and data science outcomes."
    },
    {
      "title": "Ethical Considerations",
      "text": "The results presented in this manuscript have no inherent ethical implications or considerations. No animals or human participants were involved in this research. No personal data were used in this research. Thus, we did not seek a review of our study design from an institutional review board."
    },
    {
      "title": "Results"
    },
    {
      "title": "Search Results",
      "text": "Our search strategy yielded  49, 192  results from academic database searches (n=35,541, 72.24% after deduplication) and 221 results from supplementary searches, amassing 35,762 unique records. Ultimately, out of 35,541 documents, we included 244 (0.69%) documents (n=234, 95.9% scientific articles; n=6, 2.5% organizational reports; n=2, 0.8% health technology assessment frameworks [although the included literature covered additional frameworks]; and n=2, 0.8% web pages) in this review (Figure  1 ). Out of 244 documents, our final sample comprised 60 (24.6%) literature reviews  [19, ;  49 (20.1%) viewpoints, commentaries, and editorials [11,13,17,99-144] ; 43 (17.6%) cross-sectional studies  [83, ; 39 (16%) qualitative research articles  [1, 15, ; 13 (5.3%) case reports  [4, 5, 12, [224] [225] [226] [227] [228] [229] [230] [231] [232] [233] ; 11 (4.5%) longitudinal studies [234-244]; 9 (3.7%) mixed methods studies [245-253]; 5 (2%) economic evaluations [254-258]; 5 (2%) randomized controlled trials [259-263]; 4 (1.6%) policy documents [264-267]; 3 (1.2%) preference studies [268-270]; 2 (0.8%) websites [271,272]; and 1 (0.4%) book chapter [273]. Of the 244 included studies, 23 (9.4%) were published before 2014  [41, 66, 71, 96, 98, 116, 122, [124] [125] [126] 129, 130, 132, 158, 163, 167, 171, 192, 211, 227, 237, 238, 268] . The included articles covered 35 distinct countries from all continents. Articles representing the United States (67/244, 27.5%) constituted the largest share of the included articles, followed by those with no specific country focus  (62/244, 25.4%)  and those focusing on Germany  (21/244, 8.6%) . Figures  S1  and  S2  in Multimedia Appendix 1 show an overview of the article types published per geographic region. In the subset screening of the total sample by the second reviewer (828/35,541, 2.33%), we found a crude interrater agreement score of 88.6% (734/828 observations) between the 2 reviewers. We also accounted for the possibility of reaching interrater agreement by chance by computing Cohen \u03ba (0.589), which indicated a moderate agreement between the observers."
    },
    {
      "title": "Outer and Inner Setting Domains",
      "text": "An important uptake factor of digital therapeutics was the presence of a legal framework to (1) distinguish digital therapeutics from commercial lifestyle and well-being apps, accrediting the former as a reimbursable form of health care, and (2) protect patients' privacy, confidentiality, and (health) data security  [1, 4, 5, 13, 15, 47, 52, [54] [55] [56] 59, 66, 77, 80, 87, 96, 99, 108, 109, 112, 116, 120, 123, 133, 139, 148, 149, 157, 161, 166, 167, 169, 186, 190, 208, 209, 212, 231] . A clear example of such a legal framework is the mHealthBelgium validation pyramid in Belgium, which consists of 3 levels: the first level determines the basic requirements, such as the need for Conformit\u00e9 Europ\u00e9ene marking, which indicates that a product adheres to the European Union health, safety, and environmental protection standards; the second level is designed to ensure interoperability and connectivity with the broader health informatics system; and the third level regulates the funding of digital health apps by the National Institute of Health and Disability Insurance, which is acquired after a digital health app has passed the clinical review process  [224] . In terms of evidence requirements, establishing different evidence tiers to distinguish digital therapeutics from other types of digital health applications (eg, those aimed at communication or administrative functions) was considered vital  [5, 12, 93, 123, 157, 161, 203, 212, 224, 231, 265] . In practice, this is already observed in the United Kingdom, where the National Institute of Health and Care Excellence (NICE) has devised a 3-level evidence framework that distinguishes (1) digital tools with no patient-relevant outcomes, (2) digital tools that aid in communication and education, and (3) digital therapeutics that are designed to generate and deliver medical interventions  [5, 224, 265] . These 3 evidence tiers also each have their respective evidence requirements (Table  S3  in Multimedia Appendix 1), with the highest level requiring evidence of effectiveness for the claimed benefits of the digital therapeutic on top of the requirements for the second evidence tier. The establishment of a formal body to transparently assess and certify digital therapeutics also influenced uptake  [15, 121, 166, 174, 213] . Practical examples include the NICE in the United Kingdom, the Federal Institute for Drugs and Medical Devices (Bundesinstitut f\u00fcr Arzneimittel und Medizinprodukte) in Germany, and the Finnish Coordinating Center for Health Technology Assessment  [75, 224, 229, 265] . The NICE has also established an early value assessment process for digital therapeutics, which can provide preliminary insights into how digital therapeutics can benefit the health system (particularly surrounding their ability to address unmet health needs) while also assessing what types of evidence are available and what types of evidence are missing  [272] .\n\nThe financing model for digital therapeutics was considered highly influential with respect to their uptake in the health care system  [12, 65, 81, 87, 127, 139, 162, 170, 203, 205, 212, 229, 230, 232] . In the included literature, eleven distinct financing models for digital therapeutics were identified: (1) periodical subscription (Germany and the United Kingdom), (2) 1-time license fee (Germany), (3) part of bundle packages with other (nondigital) therapeutics (the United States), (4) financing through (innovation) grants, subsidies, or fundraisers (the Netherlands and Germany), (  5 ) sponsor-based agreements in which the digital therapeutic is sponsored by a large platform or institution (eg, Alzheimer Netherlands sponsors a digital health intervention for Dutch patients with dementia at no charge to caregivers), (  6 ) public-private partnerships (eg, a private actor helps develop the local digital health infrastructure on the condition that their digital therapeutic is added in the local health care inventory),  (7)  inclusion in data plans,  (8)  performance-based contracts (the United States), (  9 ) risk-benefit sharing contracts (the United States),  (10)  part of employment benefit plans, and (  11 ) pay-as-you-go arrangements  [12, 65, 86, 87, 127, 143, 162, 170, 203, 205, 212, 229, 230, 232, 239] . In addition, some form of reimbursement parity (eg, service or payment parity) with traditional biomedical therapeutics was considered important  [68, 70, 119, 123, 153, 169, 206, 238] . Incentives for the uptake of digital therapeutics were also identified as an important means of bolstering the development of a reimbursement pathway for digital therapeutics (eg, dedicated funding or financial compensation for offsetting the high fixed costs of implementing digital therapeutics in practice)  [1, 19, 62, 87, 122, 126, 133, 140, 143, 145, 169, 174, 187, 188, 200, 218, 225, 227, 231 ]. An important aspect of these incentives is the development of reimbursement codes for digital therapeutics  [2, 53, 99, 148, 153, 169, 170, 212] . The United States created reimbursement codes for Medicare and Medicaid to be able to better reimburse digital health, but these payment codes are used for digital health as a whole and not specifically for digital therapeutics  [53, 160] . After certification, the uptake of digital therapeutics is facilitated by the ability of health care professionals or health insurers to identify accredited digital therapeutics through an openly accessible register or inventory  [4, 59, 224, 226, 229, 231, 232 ]. These registers have already been established in Germany, Belgium, and France  [15, 224] , whereas the National Health Service (NHS) App Library in England was decommissioned in December 2021 during a restructuring of the NHS website  [271] .\n\nAnother vital element is the development of funding options for digital therapeutics during and after the research phase (eg, innovation and research grants, pay-for-performance constructs, or payment/completed digital therapeutic use cycle). For the latter, it is important that the financial responsibility is not placed on patients to protect them from disproportionate out-of-pocket payments and ensure that digital therapeutics do not become an exclusive domain of higher socioeconomic groups  [12, 15, 46, 58, 61, 72, 86, 99, 100, 105, 106, 114, 116, 146, 149, 154, 164, 172, 190, 192, 197, 200, 202, [226] [227] [228] 249] . It was emphasized that there were benefits to allowing the procurement of digital therapeutics as locally as possible, as health purchasers (eg, Integrated Care Boards in the United Kingdom, insurance companies in the Netherlands, and employer groups in the United States) are best placed to assess the needs and preferences of their covered population, although this could translate into longer adoption times and higher uptake costs, as each individual insurer needs to invest in the digital infrastructure. There was a stated need to adjust or redesign the existing protocols and professional guidelines, commonly created for the provision of face-to-face health care, to create opportunities for digital therapeutics and address the liability and risk-sharing concerns with using digital therapeutics  [19, 51, 52, 57, [63] [64] [65] [66] 81, 87, 106, 110, 112, 114, 118, 121, 126, 139, 149, 158, 192, 205, 207, 225, 233] .\n\nThe presence or development of a high-quality digital infrastructure that can be accessed by all population groups  [1, 5, 13, 40, 45, 47, 63, 66, 74, 87, 100, 106, 119, 122, 124, 134, 135, 137, 140, 153, 162, 199, 201, 209, 218, 238, 270, 273] , the availability of testing environments so that health professionals can gain experience with digital therapeutics  [129, 201] , and the inclusion of digital therapeutic modules in medical curricula were identified as facilitators of the uptake of digital therapeutics  [52, 58, 61, 62, 70, 78, 80, 81, 87, 105, 110, 115, 134, 149, 190, 197, 207, 208 ]. A good practice example of this can be found in the United Kingdom with the establishment of the NHS Digital Academy, which trains health professionals according to a comprehensive framework on digital health competencies (Figure  S3  in Multimedia Appendix 1)  [97, 267] . Finally, the included articles emphasized the importance of developing a formal license for health professionals to allow them to prescribe digital therapeutics  [13, 64, 68, 70, 87, 123, 124, 131] ."
    },
    {
      "title": "Individuals Domain"
    },
    {
      "title": "Patients",
      "text": "In terms of the Donabedian framework structure measures, the characteristics of the population group targeted by a digital therapeutic are important uptake determinants, as they influence the impact that any digital therapeutic might have on different clinical pathways and different diseases. Demographic characteristics are associated with patients' uptake of digital therapeutics.\n\nYounger age  [5, 19, 40, 43, 49, [52] [53] [54] 63, 83, 100, 101, 126, 135, 139, 175, 177, 181, 182, 196, 203, 206, 235, 236, 256, 259] , sex (male or female depending on the circumstances)  [17, 53, 62, 63, 101, 181, 182, 235, 256] , higher language skills  [19, 53, 126] , higher education level  [5, 17, 43, 49, 54, 62, 63, 83, 100, 101, 107, 135, 175, 177, 181, 182] , higher health literacy  [40, 47] , being employed  [5, 17, 62, 100, 101] , higher income level  [17, 40, 52, 54, 62, 100, 101, 107, 152, 153, 171, 175, 269, 270] , and living in an urban environment (compared with living in a rural environment or being homeless)  [17, 40, 53, 54, 62, 100, 101, 139, 156, 170, 171, 181, 258, 269]  were associated with increased uptake of digital therapeutics. Furthermore, cultural and social environments  [49, 62, 71, 82, 86, 115, 135, 142, 159, 193, 195, 235] ; ethnic background  [40, 101, 102, 107, 142, 175, 193, 195, 235] ; being unhealthy or living with a disability  [11, 17, 40, 52, 62, 80, [100] [101] [102] [103] 107, 181, 190, 206, 236, 259, 270] ; patient-specific needs, attitudes, and habits  [1, 80, 102, 109, 110, 193, 195] ; distance to health services  [152, 171, 185, 236] , risk of contracting a disease  [165] ; insurance status  [175, 270] ; time since diagnosis  [177] ; and past health care experiences  [217]  can influence the uptake of digital therapeutics. The extent to which the target group can access the internet is an additional determinant of the uptake of digital therapeutics  [17, 19, 52, 53, 62, 63, 76, 77, 80, 88, [100] [101] [102] 115, 137, 139, 182, 206, 269] , as well as the target group's (perceived) digital skills and capabilities and ability to understand the risks associated with using digital tools  [1, 5, 13, 17, 40, 45, 49, 50, 52, 62, 63, [80] [81] [82] [100] [101] [102] 105, 107, 115, 135, 139, 147, 175, 177, 188, 191, 192, 194, [199] [200] [201] 210, 224, 225, 237, 245, 252] .\n\nFor process measures, it was considered vital to understand how patients perceive the need to use the digital therapeutic (on its own as well as compared with in-person visits); their views, doubts, and comfort regarding the use of the digital therapeutic and its potential benefits; resilience to setbacks; waiting times van Kessel et al JOURNAL OF MEDICAL INTERNET RESEARCH XSL \u2022 FO RenderX for the health care in question; and the ease of using the digital therapeutic  [13, 15, 19, [42] [43] [44] 48, 50, 52, 62, 82, 83, 88, 107, 133, 141, 150, 159, 170, 177, 178, 186, 188, 189, 193, [201] [202] [203] 208, 216, 220, 221, 245, 247, 251, 252, 254, 269, 270] . Articles from the United States and Germany indicate that individuals who rate their health status as being lower favor the use of digital tools to aid them in their health care  [43, 50, 195] , although none of these articles focused on digital therapeutics specifically. Nevertheless, patients' preferences for using digital therapeutics instead or alongside of traditional care form a core part of whether digital therapeutics are used in practice  [42, 50, 62, 73, 82, 165, 199, 209, 246, 247] ."
    },
    {
      "title": "Health Professionals",
      "text": "As with the target patient group, health professionals' perceptions are also key factors of the uptake of digital therapeutics. Relevant factors include how easy the digital therapeutic is to use  [13, 42, 44, 202, 218] , how health professionals perceive the digital capabilities and risk profile of the patient and the quality of the digital therapeutic  [90, 145, 172, 184, 211, 218] , how the technology will affect organizational workflow, and professional responsibilities and autonomy  [13, 42, 54, 62, 110, 116, 133, 155, 189, 197, 198, 202, 207, 211, 221, 273] . Barriers to implementation (eg, financial, human resource, or time-and workload-related barriers) were also frequently cited  [42, 43, 62, 63, 90, 104, 115, 139, 145, 155, 156, 199, 200, 202, 218] .\n\nWith respect to structure measures, the demographic characteristics of health professionals play a role. Female and younger health professionals were reported to favor the prescription of digital therapeutics in Germany and the Netherlands  [147, 196] , as did health professionals located in rural environments in Australia, the United States, and Taiwan  [62, 151, 155, 236] . The digital connectivity and literacy of health professionals were widely recognized as key components in determining their willingness toward and likelihood of prescribing digital therapeutics across countries  [1, 5, 17, [42] [43] [44] [45] [46] 62, 70, 76, 80, 81, 90, 100, 101, 104, 106, 116, 117, 135, 145, 146, 162, 174, 183, 184, 187, 189, 191, 192, 194, 196, 197, [199] [200] [201] 203, 210, 224, 225, 228, 231] , as were their personal attitudes toward, familiarity with, and trust in digital therapeutics  [1, 42, 43, 62, 70, 104, 105, 116, 139, [145] [146] [147] 183, 184, 187, 189, 192, 196, [198] [199] [200] 203, 209, 210, 230, 231, 236, 248] .\n\nWith respect to process measures, professionals reported rigidity in their work process  [146, 187, 192, 196] , as well as a tendency to be risk averse and to resist change unless a digital therapeutic had been nationally accredited or endorsed  [63, 104, 139, 147, 231, 248] , reemphasizing the need for policy mechanisms aimed at the accreditation of digital therapeutics. Approval from the institutional or social environment was also reported as an important indicator of the uptake and use of digital therapeutics by health professionals  [19, 42, 62, 104, 112, 115, 139, 156, 159, 174, 200, 202, 203] . Finally, certain medical specialties (eg, psychology, psychiatry, and neurology) may be more amenable to adopting digital therapeutics than other specialties (eg, ophthalmology, dermatology, and surgery)  [140, 145, 146, 162, 167, 183, 196, 213, 235, 236, 247] , which may be explained by the varying degrees of availability or applicability of digital therapeutics for different medical specialties  [183, 196] ."
    },
    {
      "title": "Innovation Domain"
    },
    {
      "title": "Characteristics of Digital Therapeutics and Manufacturer Provisions",
      "text": "On the basis of the mapped literature, the nature, content, and structure of digital therapeutics are major determinants of their uptake and effectiveness across countries  [1, 4, 13, 19, 40, 63, 100, 102, 189, [191] [192] [193] [194] 200, 205, 230, 246, 265, 266] . The design of digital therapeutics needs to be driven by the needs and expectations of patients  [56, 61, 66, 68, 84, 100, 102, 117, 118, 122, 132, 136, 140, 141, 168, 177, 189, [191] [192] [193] [194] 200, 202, 208, [214] [215] [216] 221, 230, 233, 250, 266, 273, 274]  while acknowledging that patient needs may shift with time and disease progression  [140] . They need to have clear aims and a position in the health care pathway that is understood by patients and professionals, with comprehensive and trusted information provided about the qualities and services of the devices and targeted health condition  [56, 57, 93, 118, 142, 174, 177, 178, 186, 190, 214, 221, 228, 250, 252, 259, 265, 266, 273] . They should also be easy and straightforward to understand and use  [1, 4, 13, 19, 40, 42, 117, 135, 141, 150, 193, 194, 203, 208, 217, 250, 252, 265, 266, 273] , as well as have the ability to be personalized according to patient needs and preferences  [4, 13, 62, 117, 208, 216, 217, 220, 246] . Finally, a key property and enabler of the reimbursement of digital therapeutics is their interaction with the target population: they should be co-designed and coimplemented with patients and health professionals to maximize the likelihood of their uptake by the relevant stakeholders, with the recognition of the fact that engagement might differ across population groups in different countries  [4, 13, 19, 40, 47, 56, 57, 89, 129, 166, 174, 189, 190, 200, 214, 215, 220, 230, 250] .\n\nWith respect to structure measures, the interoperability of digital therapeutics (ie, the ability to communicate with local health informatics systems, such as electronic health records) was the most often emphasized requirement from a design viewpoint  [1, 4, 13, 15, 17, 19, 44, 45, 54, 57, 61, 66, 80, 82, 103, 106, 107, 110, 111, 124, 147, [189] [190] [191] [192] 197, 199, 200, 202, 222, 224, 230, 231, 246, [264] [265] [266] 270, 273] . However, it is important that digital therapeutics remain compliant with local privacy and security legislation and prevent direct-to-consumer advertisements through the application  [4, [47] [48] [49] 51, 57, 93, 115, 125, 138, 187, 211, 219, 220, 224] , as well as identification through secondary data sharing  [79, 91, 93, 138, 217] . The hardware and software requirements  [63, 91, 163, 194, 233] , implementation and upkeep costs  [41, 63, 65, 133, 146, 198, 211, 231, 237, 238, 254] , required input and oversight from health professionals  [11, 107, 254, 265] , ability to work without a constant internet connection  [91, 135, 217, 233] , price  [165, 222] , and scalability were also deemed important factors, as they dictate the investment threshold for adopting digital therapeutics and how widely and cost-effectively digital therapeutics can be deployed, including the potential to realize economies of scale  [164, 199, 231, 265] .\n\nvan Kessel et al JOURNAL OF MEDICAL INTERNET RESEARCH XSL \u2022 FO"
    },
    {
      "title": "RenderX",
      "text": "With respect to process measures, certain additional provisions from the developer broaden the potential uptake of digital therapeutics in addition to enhancing the digital therapeutics themselves. These additional provisions include dedicated training courses for the digital therapeutic aimed at patients and health professionals, and user support during and after implementation were noted as critical uptake factors  [13, 19, [61] [62] [63] 66, 73, 115, 118, 145, 148, 159, 184, 199, 203, 206, 252] .\n\nFinally, a key property of digital therapeutics was the existence of a strong evidence base that matches the corresponding evidence tier of the national regulatory framework. This should contain data on the positive health effects of using the digital therapeutic compared with the status quo or preexisting treatment options (eg, pragmatic randomized controlled trials using a real-world data arm), the context in which the digital therapeutic is to be implemented, how it affects the clinical workflow in the target setting, economic evaluations (cost-effectiveness, cost utility, and cost benefit), economic risk to the payer, budget impact, qualitative evidence on patients' and health professionals' experiences with using the tool, health system needs assessment, the safety of the patient and their data (eg, reports of regular penetration testing), and transferability and generalizability across population groups  [1, 4, 13, 15, 44, 46, 49, 54, 61, 65, 85, 86, 91, 98, 105, 106, [108] [109] [110] [111] [112] 117, 118, 133, 144, 188, 196, 197, 200, 210, 228, 229, 232, 266] . In this context, positive health effects include not only medical benefits, such as improved health status, shortening of the duration of disease, prolongation of survival, and improvement of the quality of life, but also broader elements, such as treatment adherence, patient safety and sovereignty, coping capabilities, and the reduction of therapy-related efforts  [108, 109, 229] ."
    },
    {
      "title": "Relative Advantages of Digital Therapeutics",
      "text": "The mapped literature highlighted the multidimensionality and versatility of digital therapeutics by showcasing their relative advantages compared with their competitors. At the patient level, the most reported relative advantages were improvements in health outcomes and shortened disease duration through novel health care options, faster diagnoses, decrease in adverse medical events, and improved monitoring of clinical and patient-reported outcome measures  [11, 17, 41, 43, 45, [47] [48] [49] 53, 60, 61, 69, 71, 74, 80, 81, 88, 92, 94, 95, 100, 102, 105, 124, 128, 130, 132, 133, 135, 137, 138, 146, 153, 163, 172, 173, 179, 189, 202, 207, 218, 224, 226, 228, 229, 231, 232, 234, [239] [240] [241] [242] 244, 246, 248, 257, 260, 262, 263, 265, 266, 270, 275] , as well as changes in the quality of life, well-being, and life expectancy  [13, 47, 48, 58, 88, 92, 120, 128, 153, 224, 226, 229, 244, 246, 257] . Digital therapeutics can also induce changes in the quality of care, patient satisfaction, and diagnostic accuracy  [48, 52, 53, 55, 60, 69, 76, 88, 89, 92, 102, 128, 137, 147, 165, 168, 179, 189, 203, 219, 242, 243, 270, 273]  while empowering the patient to have a more active role in their health care and further enabling shared decision-making  [4, 56, 82, 92, 102, 105, 134, 139, 175, 189, 191, 201, 216, 225, 226, 229, 231, 241, 246, 248, 258, 266, 273] .\n\nAt the behavioral level, digital therapeutics have been shown to positively affect treatment adherence  [41, 48, 69, 137, 196, 226, 229, 231, 246, 266, 273] , patients' coping and health management abilities  [4, 13, 76, 82, 126, 134, 137, 145, 175, 226, 229, 244, 254, 257, 263, 266, 270, 273] , and general behavioral and lifestyle aspects  [13, 43, 56, 246, 254] . Furthermore, digital therapeutics could improve access to health care, reduce waiting times, and lower thresholds for seeking out health services  [1, 41, 43, 45, 48, 49, 53, 55, 61, 62, 67, 70, 71, 74, 76, 80, 88, 90, 91, 95, 99, 102, 111, 113, 120, 124, [130] [131] [132] [133] [137] [138] [139] 142, 150, 151, 162, 171, 173, 181, 183, 185, 193, 196, 203, 216, 217, [224] [225] [226] 229, 232, 234, 239, 240, 242, 247, 249, 253, 256, 261, 262, 269, 273, 275] . They can also aid in the development of (digital) health literacy  [4, 13, 41, 43, 47, 76, 82, 83, 89, 92, 139, 147, 165, 196, 202, 208, 219, 226, 229, 242, 250, 251, 257, 266, 270, 274] .\n\nAt the health system level, digital therapeutics can influence health care costs and resource use  [41,47,48, 53,69,71,72,80,81,94,95,105,107,111,113,121,124,128,131,133,147, 153,154,160,164,171,172,180,189,207,211,212,228,231,232,237,238,255-258, 261,262,265,269,273]  and affect the workload and workflow of the health workforce, potentially bringing about significant improvements  [19, 47, 60, 62, 78, 80, 90, 105, 116, 124, 126, 128, 134, 146, 147, 176, 188, 194, 196, 221, 231] . They can also improve coordination among health professionals  [60, 90, 92, 225, 226, 229, 232, 273] . Furthermore, as they require less health professional input, digital therapeutics can help address clinical workforce shortages  [47, 72, 80, 124, 128, 173, 176, 228, 243, 270] .\n\nDigital therapeutics have secondary relative advantages at the public health and data science levels. The data generated through their use can allow for the tracking of disease burden  [1, 100, 151, 253] , resulting in the ability to monitor and model the spread patterns of infectious diseases and inform national priorities for health care procurement and resource allocation  [1, 17, 41, 45, 151] . As they reduce the need for patients to travel to health care facilities, they are both environmentally friendly and can reduce the risk of hospital-borne infections  [120, 139, 165, 171, 180, 185] . When designed and deployed adequately, digital therapeutics can also contribute to the reduction of health inequalities; however, when designed poorly or without the consideration of the potential for the digital exclusion of groups with lower levels of digital literacy, they have the potential to exacerbate health inequalities  [47, 53, 68, 70, 81, 95, 99, 100, 102, 107, 120, 127, 132, 139, 140, 142, 143, 173, 182, 210, 218, 221, 242] . Finally, digital therapeutics can aid in the generation and analysis of meaningful real-world (health) data through their integration with electronic health records  [5, 136, 231, 273] , enable the use of cloud-based diagnostics and (big data) analyses  [48, 72, 223] , and be continuously developed and improved through iterative user feedback  [201] . However, privacy-conscious data-sharing platforms (eg, PhysioNet and the US National Institute of Health All of Us research program) are vital for minimizing the risk of reidentification  [79] ."
    },
    {
      "title": "Comprehensive Map of Uptake Factors",
      "text": "From the 244 included documents, we extracted 85 factors that determine the uptake of digital therapeutics within a health system. At the policy level, the need to develop a legal framework for digital therapeutics was very frequently iterated  (37/244, 15.2%) . As for patients, their demographics (57/244, 23.4%), perceptions of digital therapeutics (39/244, 16%), and digital skills and risk perceptions  (38/244, 15.6%)  were very van Kessel et al JOURNAL OF MEDICAL INTERNET RESEARCH"
    },
    {
      "title": "XSL \u2022 FO"
    },
    {
      "title": "RenderX",
      "text": "frequently reported to influence the potential uptake of digital therapeutics. The interoperability of digital therapeutics was also very frequently reported to influence their uptake  (39/244, 16%) . As for health professionals, their digital connectivity and literacy were the most stated factors affecting their uptake of digital therapeutics  (43/244, 17.6%) . In terms of the relative advantages of digital therapeutics, improved access to health services  (65/244, 26.6%) , improved health outcomes  (63/244, 25.8%) , and changes in health care costs and resource use  (46/244, 18.9%)  were very frequently reported. Further details on the frequency with which uptake factors were reported in the included studies are shown in Table  1 . Finally, a visual map that outlines all the extracted factors color coded by frequency is shown in Figure  2 .\n\nTable  1 . Frequency table of the most reported uptake factors in the included documents (n=244)."
    },
    {
      "title": "Frequency, n (%) Domain and factors"
    },
    {
      "title": "Policy",
      "text": "Very frequently reported factors (\u226515%)  37 (15.2)  Developing a legal framework Frequently reported factors (5%-15%)  28 (11.5) Implementing a high-quality digital infrastructure 27  (11.1) Developing funding options  25 (10.2)  Redesigning protocols and professional guidelines 18  (7.4) Inclusion of digital health modules in medical education 17  (7)  Financing model for digital therapeutics"
    },
    {
      "title": "Patient characteristics",
      "text": "Very frequently reported factors (\u226515%)  57 (23.4 ) Demographic characteristics 39  (16)  Patient perceptions of digital therapeutics  38 (15.6) Digital skills and risk perceptions"
    },
    {
      "title": "Digital therapeutic",
      "text": "Very frequently reported factors (\u226515%)"
    },
    {
      "title": "39. (16) Interoperability",
      "text": "Frequently reported factors (5%-15%)  34 (13.9) Need-driven and patient-centered design 33  (13.5) Evidence base  20 (8.2)  Simple and straightforward to use 19  (7.8)  Clear aim that is understood by patients and professionals  19 (7.8)  Accounting for different needs across populations and disease stages 17  (7)  Provision of training courses for patients and professionals  15 (6.1) Remaining compliant with local privacy and security legislation"
    },
    {
      "title": "Health professional",
      "text": "Very frequently reported factors (\u226515%)  43 (17.6)"
    },
    {
      "title": "Digital literacy",
      "text": "Frequently reported factors (5%-15%)  28 (11.5) Professional preference  16 (6.6) Effect on clinical workflow and professional autonomy 15 (6.1) Financial, human resource, or time-and workload-related barriers  13 (5.3) Approval from the institutional or social environment"
    },
    {
      "title": "Outcome",
      "text": "Very frequently reported factors (\u226515%)  65 (26.6) Improved access to health services  63 (25.8) Improved health outcomes  46 (18.9) Change in health care costs and resource use Frequently reported factors (5%-15%)  26 (10.7) Improving digital literacy, health literacy, or digital health literacy in patients  24 (9.8) Improving the quality of care, patient satisfaction, and diagnostic accuracy van Kessel et al JOURNAL OF MEDICAL INTERNET RESEARCH XSL \u2022 FO RenderX Items in yellow are reported in 5% to 15% of included articles. Items in blue are reported in less than 5% of the included articles."
    },
    {
      "title": "Discussion"
    },
    {
      "title": "Principal Findings",
      "text": "This review aimed to create the first map of the most frequently discussed uptake factors of digital therapeutics that will aid their implementation across different health systems. Our map contains 85 factors that can affect the uptake of digital therapeutics within a health system. This map offers a novel and comprehensive overview of the known uptake factors from both technological and human perspectives. This bridges the dichotomy of the digital health literature in which articles either focus on the technological or patient and professional perspectives, which inadvertently highlights the novelty of this review. The map is intended to be scaled and adopted by countries looking to introduce digital therapeutics in their health service portfolio, expand the proportion of their population that benefits from digital therapeutics, or extend access to digital therapeutics to excluded communities. As this map was based on a standardized set of constructs in the CFIR, it can support future research on and implementation endeavors of digital therapeutics. It offers policy makers, health insurers, and other change agents specific digital health-related action points to focus on in their pursuit of implementing digital therapeutics in the health care system. In doing so, it can help address the existing barriers to the uptake of digital therapeutics, harmonize digital therapeutic infrastructure across health systems, and aid researchers in analyzing health system readiness for using digital therapeutics.\n\nThis map of factors aims to guide the integration of digital therapeutics into clinical practice by helping stakeholders identify, assess, and address key uptake barriers unique to digital therapeutics, including issues related to policy readiness, regulatory approval, reimbursement, engagement, data privacy and security, adoption, and clinical effectiveness. It highlights the finding that the innovation and individuals domains of the CFIR contain the most frequently cited uptake factors of digital therapeutics. The relative focus on these factors is unsurprising, seeing how digital therapeutics are unprecedented in terms of the required user input. It also signals these uptake factors as action points for policy makers, health insurers, and health promotion experts. Patient groups may need to be sensitized to the concept of digital therapeutics before they are ready and willing to use these novel tools in their health care pathways  [22] . Simultaneously, it points to an opportunity for investors to update funding requirements to better enfranchise future users of digital therapeutics, especially if they are designed to combat the existing health inequalities.\n\nUsers of this map should consider the unique characteristics and needs of different health care settings and digital therapeutics on a per-case basis. Consequently, health care organizations can ensure that they are able to effectively leverage the potential of digital therapeutics to improve patient outcomes and address pressing health care challenges  [1, 71, 128, 194] . The map is not solely reliant on clinical health outcomes but allows room for a broader interpretation of positive health effects, such as treatment adherence, patient safety and sovereignty, coping capabilities, and reduction of therapy-related efforts  [109, 229] . This interpretation allows for a more versatile and holistic assessment of digital therapeutics, which could contribute to the value-based pricing of digital therapeutics  [12, 229] .\n\nThe focus on the United States in the digital health literature included in this review is likely related to the current health system challenges worldwide. In particular, the United States is experiencing stark rises in health care costs, inequitable access to health care, and labor shortages in the health workforce  [276] , for which digital therapeutics can be seen as a potential (partial) solution. Although these issues exist worldwide, the United States has a favorable environment for developing and adopting innovations, as it hosts the largest technology companies and venture capital investors  [277] . By contrast, the focus on Germany, for example, is attributable to the recent adoption of the Digital Healthcare Act, which only now formally enabled digital therapeutics to be prescribed by general practitioners  [266] .\n\nIn this review, we also found that countries with multipayer reimbursement systems (the United States, Germany, and the Netherlands) form the predominant countries of interest in the literature on reimbursing digital therapeutics. These health systems are built on the basis of (managed) competition and a mix of supplementary and substitutive private health insurance markets  [278] . Stereotypically, these types of systems are more conducive to adopting health care innovations, as insurers are actively incentivized to look for a competitive advantage and potential cost-saving solutions  [279] . This reasoning also suggests a partial explanation for why countries with a single-payer system (eg, Australia, Canada, or the European Nordic countries) are poorly represented in the current digital health literature. The outlier here is the United Kingdom, where there has been a broad policy discussion around this topic with a strong impetus from national bodies (eg, NHS England)  [280] . A downside of introducing digital therapeutics in multipayer countries is the high investment cost of setting up the digital infrastructure in a health system. The Netherlands offers a partial solution to this problem by allowing health insurers to pool their resources and collectively buy the digital infrastructure required to run digital therapeutics  [281] ."
    },
    {
      "title": "Limitations and Future Research",
      "text": "Some limitations of this review need to be considered. First, the findings of this review should be interpreted as scoping, meaning it provides a high-level overview of the literature and may not capture more intricate and field-specific factors that can affect the uptake of digital therapeutics in health care. Second, the quality of the included sources was not assessed, which should be considered when interpreting the results. Third, we acknowledge the presence of evidence selection bias, as only 3 academic databases and Google Scholar were used, and the search strategy was not exhaustive. That said, an exhaustive search was not required to reach the aim of this review, namely the development of a map of uptake factors. In fact, we reached data saturation during the extraction of the current sample of articles. Fourth, we acknowledge that this review only captures the uptake factors that are considered important within the current digital health literature. Fifth, the high representation of the United States in the included articles might skew our results to be geared toward the US health ecosystem, although we believe that this is counterbalanced by the articles that focused on countries other than the United States. Sixth, these results cannot be directly transferred to the context of artificial intelligence, even though it overlaps to some degree with digital therapeutics, as the latter are often powered by some form of artificial intelligence. Finally, we acknowledge that this review makes broad conclusions about digital therapeutics holistically and may not be applicable to individual applications.\n\nVarious avenues for further research were also identified in this review. A comprehensive evidence synthesis for each domain within the map of factors could further improve its quality and robustness. An assessment of the relative importance of the uptake factors within each domain can provide more actionable guidance for policy makers, health professionals, and patients. Patient engagement and empowerment lie at the core of digital therapeutics, yet these concepts remain unquantified. Future research should investigate conceptualizing key performance indicators for patient activity and engagement with digital therapeutics. Even though qualitative studies comprised a decent proportion of the included studies  (39/244, 16%) , these studies focused predominantly on the experiences of implementing digital health applications in finalized or near-finalized development stages into practical situations. However, research on the process by which a digital therapeutic is developed and how patients can be enfranchised within that process is lacking. Future research should also investigate the possibility, risks, and benefits of migrating the necessary health data infrastructure for digital therapeutics to cloud-based environments compared with local storage. Finally, future research should explore how different financing models for digital therapeutics interact with different types of health systems to identify best practices and further streamline the integration of digital therapeutics in health care pathways."
    },
    {
      "title": "Conclusions",
      "text": "Ultimately, digital therapeutics are set to disrupt the delivery of health care by challenging the fundamental assumption that health care needs to be location bound and episodic in nature  [130] . Understanding the array of factors that determine the uptake of digital therapeutics in the health care landscape is a vital step in progressing the development of digitally augmented health systems. The map of factors developed in this review offers a multistakeholder approach to recognizing the uptake factors of digital therapeutics in the health care pathway and provides an analytical tool for policy makers to assess their health system's readiness for digital therapeutics."
    },
    {
      "text": "Figure 1. A PRISMA (Preferred Reporting Items for Systematic Reviews and Meta-Analyses) flowchart outlining the data collection process. HTA: health technology assessment."
    },
    {
      "text": "Figure 2. Map of the factors that can affect the uptake of digital therapeutics. The items in red are reported in 15% or more of the included articles.Items in yellow are reported in 5% to 15% of included articles. Items in blue are reported in less than 5% of the included articles."
    },
    {
      "title": "Acknowledgments",
      "text": "The authors would like to thank  Ms Andra Fry  at the  London School of Economics and Political Science Library  for her input on the methodology.\n\nThe authors declare that no funding was acquired for this research."
    },
    {
      "title": "Authors' Contributions",
      "text": "RvK contributed to conceptualization, the methodology, visualization, software use, validation, formal analysis, writing (original draft, as well as review and editing), data curation, supervision, and project administration. AR-U contributed to conceptualization, the methodology, validation, visualization, formal analysis, and writing (original draft, as well as review and editing). MA contributed to the methodology, validation, and writing (review and editing). IK contributed to the methodology, validation, and writing (review and editing). SF contributed to validation and writing (review and editing). GM contributed to validation and writing (review and editing). SDR contributed to validation and writing (review and editing). MP contributed to validation and writing (review and editing). GW contributed to validation and writing (review and editing). EM contributed to conceptualization, the methodology, validation, writing (original draft, as well as review and editing), supervision, and project administration."
    },
    {
      "title": "Conflicts of Interest",
      "text": "None declared. K Williams; submitted 07.04.23; E Onaku; comments to author 23.05.23; revised version received 31.05.23; accepted 16.06.23; published 25.07.23  Please cite as: van Kessel R, Roman-Urrestarazu A,  Anderson M, Kyriopoulos I, Field S, Monti G, Reed SD, Pavlova M, Wharton G, Mossialos E Mapping Factors That   \u00a9Robin van Kessel, Andres Roman-Urrestarazu, Michael Anderson, Ilias Kyriopoulos, Samantha Field, Giovanni Monti, Shelby D Reed, Milena Pavlova, George Wharton, Elias Mossialos. Originally published in the Journal of Medical Internet Research ( https://www.jmir.org ), 25.07.2023. This is an open-access article distributed under the terms of the Creative Commons Attribution License ( https://creativecommons.org/licenses/by/4.0/ ), which permits unrestricted use, distribution, and reproduction in any medium, provided the original work, first published in the Journal of Medical Internet Research, is properly cited. The complete bibliographic information, a link to the original publication on  https://www.jmir.org/ , as well as this copyright and license information must be included."
    },
    {
      "title": "Multimedia Appendix 1"
    }
  ],
  "references": [
    {
      "title": "Use of Digital Health Tools in Europe: Before, During and After COVID-19",
      "authors": [
        "N Fahy",
        "G Williams",
        "T Habicht",
        "K K\u00f6hler",
        "V Jormanainen",
        "M Satokangas"
      ],
      "year": 2021,
      "doi": "10.1787/2dce8636-en",
      "raw": "N Fahy \n\t\t \n\t\t \n\t\t\t G A Williams \n\t\t \n\t\t \n\t\t\t T Habicht \n\t\t \n\t\t \n\t\t\t K K\u00f6hler \n\t\t \n\t\t \n\t\t\t V Jormanainen \n\t\t \n\t\t \n\t\t\t M Satokangas \n\t\t \n\t\t 10.1787/2dce8636-en \n\t\t \n\t\t Use of Digital Health Tools in Europe: Before, During and After COVID-19 \n\t\t Copenhagen (Denmark) \n\t\t \n\t\t\t European Observatory on Health Systems and Policies \n\t\t\t 2021 \n\t\t \n\t \n\t Fahy N, Williams GA, Habicht T, K\u00f6hler K, Jormanainen V, Satokangas M, et al. Use of Digital Health Tools in Europe: Before, During and After COVID-19. Copenhagen (Denmark): European Observatory on Health Systems and Policies; 2021. URL: https://www.ncbi.nlm.nih.gov/books/NBK576970/ [accessed 2022-11-01]"
    },
    {
      "title": "Characteristics and challenges of the clinical pipeline of digital therapeutics",
      "authors": [
        "N Patel",
        "A Butte"
      ],
      "year": 2020,
      "doi": "10.1038/s41746-020-00370-8",
      "journal": "NPJ Digit Med",
      "volume": "3",
      "issue": "1",
      "pages": "159",
      "raw": "Characteristics and challenges of the clinical pipeline of digital therapeutics \n\t\t \n\t\t\t N A Patel \n\t\t \n\t\t \n\t\t\t A J Butte \n\t\t \n\t\t 10.1038/s41746-020-00370-8 \n\t\t Medline: 33311567 \n\t \n\t \n\t\t NPJ Digit Med \n\t\t \n\t\t\t 3 \n\t\t\t 1 \n\t\t\t 159 \n\t\t\t 2020 Dec 11 \n\t\t \n\t \n\t FREE Full text \n\t Patel NA, Butte AJ. Characteristics and challenges of the clinical pipeline of digital therapeutics. NPJ Digit Med 2020 Dec 11;3(1):159 [FREE Full text] [doi: 10.1038/s41746-020-00370-8] [Medline: 33311567]"
    },
    {
      "title": "What is the clinical value of mHealth for patients?",
      "authors": [
        "S Rowland",
        "J Fitzgerald",
        "T Holme",
        "J Powell",
        "A Mcgregor"
      ],
      "year": 2020,
      "doi": "10.1038/s41746-019-0206-x",
      "journal": "NPJ Digit Med",
      "volume": "3",
      "issue": "4",
      "raw": "What is the clinical value of mHealth for patients? \n\t\t \n\t\t\t S P Rowland \n\t\t \n\t\t \n\t\t\t J E Fitzgerald \n\t\t \n\t\t \n\t\t\t T Holme \n\t\t \n\t\t \n\t\t\t J Powell \n\t\t \n\t\t \n\t\t\t A Mcgregor \n\t\t \n\t\t 10.1038/s41746-019-0206-x \n\t\t Medline: 31970289 \n\t \n\t \n\t\t NPJ Digit Med \n\t\t \n\t\t\t 3 \n\t\t\t 4 \n\t\t\t 2020 Jan 13 \n\t\t \n\t \n\t FREE Full text \n\t Rowland SP, Fitzgerald JE, Holme T, Powell J, McGregor A. What is the clinical value of mHealth for patients? NPJ Digit Med 2020 Jan 13;3:4 [FREE Full text] [doi: 10.1038/s41746-019-0206-x] [Medline: 31970289]"
    },
    {
      "title": "Health app policy: international comparison of nine countries' approaches",
      "authors": [
        "A Ess\u00e9n",
        "A Stern",
        "C Haase",
        "J Car",
        "F Greaves",
        "D Paparova"
      ],
      "year": 2022,
      "doi": "10.1038/s41746-022-00573-1",
      "journal": "NPJ Digit Med",
      "volume": "5",
      "issue": "1",
      "pages": "31",
      "raw": "Health app policy: international comparison of nine countries' approaches \n\t\t \n\t\t\t A Ess\u00e9n \n\t\t \n\t\t \n\t\t\t A D Stern \n\t\t \n\t\t \n\t\t\t C B Haase \n\t\t \n\t\t \n\t\t\t J Car \n\t\t \n\t\t \n\t\t\t F Greaves \n\t\t \n\t\t \n\t\t\t D Paparova \n\t\t \n\t\t 10.1038/s41746-022-00573-1 \n\t\t Medline: 35304561 \n\t \n\t \n\t\t NPJ Digit Med \n\t\t \n\t\t\t 5 \n\t\t\t 1 \n\t\t\t 31 \n\t\t\t 2022 Mar 18 \n\t\t \n\t \n\t FREE Full text \n\t Ess\u00e9n A, Stern AD, Haase CB, Car J, Greaves F, Paparova D, et al. Health app policy: international comparison of nine countries' approaches. NPJ Digit Med 2022 Mar 18;5(1):31 [FREE Full text] [doi: 10.1038/s41746-022-00573-1] [Medline: 35304561]"
    },
    {
      "title": "Navigating the landscape of digital health",
      "authors": [
        "S Brassel",
        "P Radu",
        "E Bell",
        "M Garau"
      ],
      "year": 2022,
      "raw": "Navigating the landscape of digital health \n\t\t \n\t\t\t S Brassel \n\t\t \n\t\t \n\t\t\t P Radu \n\t\t \n\t\t \n\t\t\t E Bell \n\t\t \n\t\t \n\t\t\t M Garau \n\t\t \n\t\t \n\t\t \n\t\t\t 2022. 2023-01-11 \n\t\t\t Office of Health Economics \n\t\t \n\t \n\t Brassel S, Radu P, Bell E, Garau M. Navigating the landscape of digital health. Office of Health Economics. 2022. URL: https://www.ohe.org/publications/navigating-the-landscape-of-digital-health/ [accessed 2023-01-11]"
    },
    {
      "title": "A novel digital intervention for actively reducing severity of paediatric ADHD (STARS-ADHD): a randomised controlled trial",
      "authors": [
        "S Kollins",
        "D Deloss",
        "E Ca\u00f1adas",
        "J Lutz",
        "R Findling",
        "R Keefe"
      ],
      "year": 2020,
      "doi": "10.1016/S2589-7500(20)30017-0",
      "journal": "Lancet Digit Health",
      "volume": "2",
      "issue": "4",
      "raw": "A novel digital intervention for actively reducing severity of paediatric ADHD (STARS-ADHD): a randomised controlled trial \n\t\t \n\t\t\t S H Kollins \n\t\t \n\t\t \n\t\t\t D J Deloss \n\t\t \n\t\t \n\t\t\t E Ca\u00f1adas \n\t\t \n\t\t \n\t\t\t J Lutz \n\t\t \n\t\t \n\t\t\t R L Findling \n\t\t \n\t\t \n\t\t\t R S Keefe \n\t\t \n\t\t 10.1016/S2589-7500(20)30017-0 \n\t\t Medline: 33334505 \n\t \n\t \n\t\t Lancet Digit Health \n\t\t \n\t\t\t 2 \n\t\t\t 4 \n\t\t\t \n\t\t\t 2020 Apr \n\t\t \n\t \n\t FREE Full text \n\t Kollins SH, DeLoss DJ, Ca\u00f1adas E, Lutz J, Findling RL, Keefe RS, et al. A novel digital intervention for actively reducing severity of paediatric ADHD (STARS-ADHD): a randomised controlled trial. Lancet Digit Health 2020 Apr;2(4):e168-e178 [FREE Full text] [doi: 10.1016/S2589-7500(20)30017-0] [Medline: 33334505]"
    },
    {
      "title": "Effectiveness of a digital therapeutic as adjunct to treatment with medication in pediatric ADHD",
      "authors": [
        "S Kollins",
        "A Childress",
        "A Heusser",
        "J Lutz"
      ],
      "year": 2021,
      "doi": "10.1038/s41746-021-00429-0",
      "journal": "NPJ Digit Med",
      "volume": "4",
      "issue": "1",
      "pages": "58",
      "raw": "Effectiveness of a digital therapeutic as adjunct to treatment with medication in pediatric ADHD \n\t\t \n\t\t\t S H Kollins \n\t\t \n\t\t \n\t\t\t A Childress \n\t\t \n\t\t \n\t\t\t A C Heusser \n\t\t \n\t\t \n\t\t\t J Lutz \n\t\t \n\t\t 10.1038/s41746-021-00429-0 \n\t\t Medline: 33772095 \n\t \n\t \n\t\t NPJ Digit Med \n\t\t \n\t\t\t 4 \n\t\t\t 1 \n\t\t\t 58 \n\t\t\t 2021 Mar 26 \n\t\t \n\t \n\t FREE Full text \n\t Kollins SH, Childress A, Heusser AC, Lutz J. Effectiveness of a digital therapeutic as adjunct to treatment with medication in pediatric ADHD. NPJ Digit Med 2021 Mar 26;4(1):58 [FREE Full text] [doi: 10.1038/s41746-021-00429-0] [Medline: 33772095]"
    },
    {
      "title": "The rise of prescription digital therapeutics in behavioral health",
      "authors": [
        "C Brezing",
        "D Brixner"
      ],
      "year": 2022,
      "doi": "10.1007/s12325-022-02320-0",
      "journal": "Adv Ther",
      "volume": "39",
      "issue": "12",
      "raw": "The rise of prescription digital therapeutics in behavioral health \n\t\t \n\t\t\t C A Brezing \n\t\t \n\t\t \n\t\t\t D I Brixner \n\t\t \n\t\t 10.1007/s12325-022-02320-0 \n\t\t Medline: 36242730 \n\t \n\t \n\t\t Adv Ther \n\t\t \n\t\t\t 39 \n\t\t\t 12 \n\t\t\t \n\t\t\t 2022 Dec \n\t\t \n\t \n\t FREE Full text \n\t Brezing CA, Brixner DI. The rise of prescription digital therapeutics in behavioral health. Adv Ther 2022 Dec;39(12):5301-5306 [FREE Full text] [doi: 10.1007/s12325-022-02320-0] [Medline: 36242730]"
    },
    {
      "title": "The evolution of telepsychiatry for substance use disorders during COVID-19: a narrative review",
      "authors": [
        "N Fast",
        "R Van Kessel",
        "K Humphreys",
        "N Ward"
      ],
      "year": 2023,
      "doi": "10.1007/s40429-023-00480-9",
      "journal": "Curr Addict Rep",
      "volume": "10",
      "issue": "2",
      "raw": "The evolution of telepsychiatry for substance use disorders during COVID-19: a narrative review \n\t\t \n\t\t\t N Fast \n\t\t \n\t\t \n\t\t\t R Van Kessel \n\t\t \n\t\t \n\t\t\t K Humphreys \n\t\t \n\t\t \n\t\t\t N F Ward \n\t\t \n\t\t \n\t\t\t Roman-Urrestarazu A \n\t\t \n\t\t 10.1007/s40429-023-00480-9 \n\t\t Medline: 37266192 \n\t \n\t \n\t\t Curr Addict Rep \n\t\t \n\t\t\t 10 \n\t\t\t 2 \n\t\t\t \n\t\t\t 2023 \n\t\t \n\t \n\t FREE Full text \n\t Fast N, van Kessel R, Humphreys K, Ward NF, Roman-Urrestarazu A. The evolution of telepsychiatry for substance use disorders during COVID-19: a narrative review. Curr Addict Rep 2023;10(2):187-197 [FREE Full text] [doi: 10.1007/s40429-023-00480-9] [Medline: 37266192]"
    },
    {
      "title": "Real-world reductions in healthcare resource utilization over 6 months in patients with substance use disorders treated with a prescription digital therapeutic",
      "authors": [
        "N Shah",
        "F Velez",
        "S Colman",
        "L Kauffman",
        "C Ruetsch",
        "K Anastassopoulos"
      ],
      "year": 2022,
      "doi": "10.1007/s12325-022-02215-0",
      "journal": "Adv Ther",
      "volume": "39",
      "issue": "9",
      "raw": "Real-world reductions in healthcare resource utilization over 6 months in patients with substance use disorders treated with a prescription digital therapeutic \n\t\t \n\t\t\t N Shah \n\t\t \n\t\t \n\t\t\t F F Velez \n\t\t \n\t\t \n\t\t\t S Colman \n\t\t \n\t\t \n\t\t\t L Kauffman \n\t\t \n\t\t \n\t\t\t C Ruetsch \n\t\t \n\t\t \n\t\t\t K Anastassopoulos \n\t\t \n\t\t 10.1007/s12325-022-02215-0 \n\t\t Medline: 35819569 \n\t \n\t \n\t\t Adv Ther \n\t\t \n\t\t\t 39 \n\t\t\t 9 \n\t\t\t \n\t\t\t 2022 Sep \n\t\t \n\t \n\t FREE Full text \n\t Shah N, Velez FF, Colman S, Kauffman L, Ruetsch C, Anastassopoulos K, et al. Real-world reductions in healthcare resource utilization over 6 months in patients with substance use disorders treated with a prescription digital therapeutic. Adv Ther 2022 Sep;39(9):4146-4156 [FREE Full text] [doi: 10.1007/s12325-022-02215-0] [Medline: 35819569]"
    },
    {
      "title": "Benefit assessment and reimbursement of digital health applications: concepts for setting up a new system for public coverage",
      "authors": [
        "H Lantzsch",
        "D Panteli",
        "F Martino",
        "V Stephani",
        "D Sei\u00dfler",
        "C P\u00fcschel"
      ],
      "year": 2022,
      "doi": "10.3389/fpubh.2022.832870",
      "journal": "Front Public Health",
      "volume": "10",
      "pages": "832870",
      "raw": "Benefit assessment and reimbursement of digital health applications: concepts for setting up a new system for public coverage \n\t\t \n\t\t\t H Lantzsch \n\t\t \n\t\t \n\t\t\t D Panteli \n\t\t \n\t\t \n\t\t\t F Martino \n\t\t \n\t\t \n\t\t\t V Stephani \n\t\t \n\t\t \n\t\t\t D Sei\u00dfler \n\t\t \n\t\t \n\t\t\t C P\u00fcschel \n\t\t \n\t\t 10.3389/fpubh.2022.832870 \n\t\t Medline: 35530738 \n\t \n\t \n\t\t Front Public Health \n\t\t \n\t\t\t 10 \n\t\t\t 832870 \n\t\t\t 2022 Apr 21 \n\t\t \n\t \n\t FREE Full text \n\t Lantzsch H, Panteli D, Martino F, Stephani V, Sei\u00dfler D, P\u00fcschel C, et al. Benefit assessment and reimbursement of digital health applications: concepts for setting up a new system for public coverage. Front Public Health 2022 Apr 21;10:832870 [FREE Full text] [doi: 10.3389/fpubh.2022.832870] [Medline: 35530738]"
    },
    {
      "title": "Reimbursement of digital therapeutics: future perspectives in Korea",
      "authors": [
        "J Ju",
        "B Sim",
        "J Lee",
        "J Lee"
      ],
      "year": 2022,
      "doi": "10.4070/kcj.2022.0014",
      "journal": "Korean Circ J",
      "volume": "52",
      "issue": "4",
      "raw": "Reimbursement of digital therapeutics: future perspectives in Korea \n\t\t \n\t\t\t J H Ju \n\t\t \n\t\t \n\t\t\t B Sim \n\t\t \n\t\t \n\t\t\t J Lee \n\t\t \n\t\t \n\t\t\t J Y Lee \n\t\t \n\t\t 10.4070/kcj.2022.0014 \n\t\t Medline: 35388995 \n\t \n\t \n\t\t Korean Circ J \n\t\t \n\t\t\t 52 \n\t\t\t 4 \n\t\t\t \n\t\t\t 2022 Apr \n\t\t \n\t \n\t FREE Full text \n\t Ju JH, Sim B, Lee J, Lee JY. Reimbursement of digital therapeutics: future perspectives in Korea. Korean Circ J 2022 Apr;52(4):265-279 [FREE Full text] [doi: 10.4070/kcj.2022.0014] [Medline: 35388995]"
    },
    {
      "title": "World heart federation roadmap for digital health in cardiology",
      "authors": [
        "J Tromp",
        "D Jindal",
        "J Redfern",
        "A Bhatt",
        "T S\u00e9verin",
        "A Banerjee"
      ],
      "year": 2022,
      "doi": "10.5334/gh.1141",
      "journal": "Glob Heart",
      "volume": "17",
      "issue": "1",
      "pages": "61",
      "raw": "World heart federation roadmap for digital health in cardiology \n\t\t \n\t\t\t J Tromp \n\t\t \n\t\t \n\t\t\t D Jindal \n\t\t \n\t\t \n\t\t\t J Redfern \n\t\t \n\t\t \n\t\t\t A Bhatt \n\t\t \n\t\t \n\t\t\t T S\u00e9verin \n\t\t \n\t\t \n\t\t\t A Banerjee \n\t\t \n\t\t 10.5334/gh.1141 \n\t\t Medline: 36051317 \n\t \n\t \n\t\t Glob Heart \n\t\t \n\t\t\t 17 \n\t\t\t 1 \n\t\t\t 61 \n\t\t\t 2022 Aug 26 \n\t\t \n\t \n\t FREE Full text \n\t Tromp J, Jindal D, Redfern J, Bhatt A, S\u00e9verin T, Banerjee A, et al. World heart federation roadmap for digital health in cardiology. Glob Heart 2022 Aug 26;17(1):61 [FREE Full text] [doi: 10.5334/gh.1141] [Medline: 36051317]"
    },
    {
      "title": "Health technology assessment for digital technologies that manage chronic disease: a systematic review",
      "authors": [
        "A Von Huben",
        "M Howell",
        "K Howard",
        "J Carrello",
        "S Norris"
      ],
      "year": 2021,
      "doi": "10.1017/s0266462321000362",
      "journal": "Int J Technol Assess Health Care",
      "volume": "37",
      "issue": "1",
      "pages": "66",
      "raw": "Health technology assessment for digital technologies that manage chronic disease: a systematic review \n\t\t \n\t\t\t A Von Huben \n\t\t \n\t\t \n\t\t\t M Howell \n\t\t \n\t\t \n\t\t\t K Howard \n\t\t \n\t\t \n\t\t\t J Carrello \n\t\t \n\t\t \n\t\t\t S Norris \n\t\t \n\t\t 10.1017/s0266462321000362 \n\t\t Medline: 34034851 \n\t \n\t \n\t\t Int J Technol Assess Health Care \n\t\t \n\t\t\t 37 \n\t\t\t 1 \n\t\t\t 66 \n\t\t\t 2021 May 26 \n\t\t \n\t \n\t von Huben A, Howell M, Howard K, Carrello J, Norris S. Health technology assessment for digital technologies that manage chronic disease: a systematic review. Int J Technol Assess Health Care 2021 May 26;37(1):e66 [doi: 10.1017/S0266462321000362] [Medline: 34034851]"
    },
    {
      "title": "Success factors for scaling up the adoption of digital therapeutics towards the realization of P5 medicine",
      "authors": [
        "A Prodan",
        "L Deimel",
        "J Ahlqvist",
        "S Birov",
        "R Thiel",
        "M Toivanen"
      ],
      "year": 2022,
      "doi": "10.3389/fmed.2022.854665",
      "journal": "Front Med",
      "volume": "9",
      "pages": "854665",
      "raw": "Success factors for scaling up the adoption of digital therapeutics towards the realization of P5 medicine \n\t\t \n\t\t\t A Prodan \n\t\t \n\t\t \n\t\t\t L Deimel \n\t\t \n\t\t \n\t\t\t J Ahlqvist \n\t\t \n\t\t \n\t\t\t S Birov \n\t\t \n\t\t \n\t\t\t R Thiel \n\t\t \n\t\t \n\t\t\t M Toivanen \n\t\t \n\t\t 10.3389/fmed.2022.854665 \n\t\t Medline: 35492346 \n\t \n\t \n\t\t Front Med \n\t\t \n\t\t\t 9 \n\t\t\t 854665 \n\t\t\t 2022 Apr 12 \n\t\t\t Lausanne \n\t\t \n\t \n\t FREE Full text \n\t Prodan A, Deimel L, Ahlqvist J, Birov S, Thiel R, Toivanen M, et al. Success factors for scaling up the adoption of digital therapeutics towards the realization of P5 medicine. Front Med (Lausanne) 2022 Apr 12;9:854665 [FREE Full text] [doi: 10.3389/fmed.2022.854665] [Medline: 35492346]"
    },
    {
      "title": "Is Europe prepared to go digital? Making the case for developing digital capacity: an exploratory analysis of Eurostat survey data",
      "authors": [
        "R Van Kessel",
        "B Wong",
        "I Rubini\u0107",
        "O 'nuallain",
        "E Czabanowska"
      ],
      "year": 2022,
      "doi": "10.1371/journal.pdig.0000013",
      "journal": "PLOS Digit Health",
      "volume": "1",
      "issue": "2",
      "pages": "e0000013",
      "raw": "Is Europe prepared to go digital? Making the case for developing digital capacity: an exploratory analysis of Eurostat survey data \n\t\t \n\t\t\t R Van Kessel \n\t\t \n\t\t \n\t\t\t B L Wong \n\t\t \n\t\t \n\t\t\t I Rubini\u0107 \n\t\t \n\t\t \n\t\t\t O 'nuallain \n\t\t \n\t\t \n\t\t\t E Czabanowska \n\t\t \n\t\t \n\t\t\t K \n\t\t \n\t\t 10.1371/journal.pdig.0000013 \n\t\t Medline: 36812527 \n\t \n\t \n\t\t PLOS Digit Health \n\t\t \n\t\t\t 1 \n\t\t\t 2 \n\t\t\t e0000013 \n\t\t\t 2022 Feb 17 \n\t\t \n\t \n\t FREE Full text \n\t van Kessel R, Wong BL, Rubini\u0107 I, O'Nuallain E, Czabanowska K. Is Europe prepared to go digital? Making the case for developing digital capacity: an exploratory analysis of Eurostat survey data. PLOS Digit Health 2022 Feb 17;1(2):e0000013 [FREE Full text] [doi: 10.1371/journal.pdig.0000013] [Medline: 36812527]"
    },
    {
      "title": "EUPHA) Digital Health Section. The dawn of digital public health in Europe: for public health policy and practice",
      "authors": [
        "B Wong",
        "L Maa\u00df",
        "A Vodden",
        "R Van Kessel",
        "S Sorbello",
        "S Buttigieg",
        "European Health Association"
      ],
      "year": 2022,
      "doi": "10.1016/j.lanepe.2022.100316",
      "journal": "Lancet Reg Health Eur",
      "volume": "14",
      "pages": "100316",
      "raw": "EUPHA) Digital Health Section. The dawn of digital public health in Europe: for public health policy and practice \n\t\t \n\t\t\t B L Wong \n\t\t \n\t\t \n\t\t\t L Maa\u00df \n\t\t \n\t\t \n\t\t\t A Vodden \n\t\t \n\t\t \n\t\t\t R Van Kessel \n\t\t \n\t\t \n\t\t\t S Sorbello \n\t\t \n\t\t \n\t\t\t S Buttigieg \n\t\t \n\t\t \n\t\t\t European Public Health Association \n\t\t \n\t\t 10.1016/j.lanepe.2022.100316 \n\t\t Medline: 35132399 \n\t \n\t \n\t\t Lancet Reg Health Eur \n\t\t \n\t\t\t 14 \n\t\t\t 100316 \n\t\t\t 2022 Mar \n\t\t \n\t \n\t FREE Full text \n\t Wong BL, Maa\u00df L, Vodden A, van Kessel R, Sorbello S, Buttigieg S, European Public Health Association (EUPHA) Digital Health Section. The dawn of digital public health in Europe: for public health policy and practice. Lancet Reg Health Eur 2022 Mar;14:100316 [FREE Full text] [doi: 10.1016/j.lanepe.2022.100316] [Medline: 35132399]"
    },
    {
      "title": "Optimising adolescent wellbeing in a digital age",
      "authors": [
        "L Holly",
        "B Wong",
        "R Van Kessel",
        "I Awah",
        "A Agrawal",
        "N Ndili"
      ],
      "year": 2023,
      "doi": "10.1136/bmj-2021-068279",
      "journal": "BMJ",
      "volume": "380",
      "pages": "68279",
      "raw": "Optimising adolescent wellbeing in a digital age \n\t\t \n\t\t\t L Holly \n\t\t \n\t\t \n\t\t\t B L Wong \n\t\t \n\t\t \n\t\t\t R Van Kessel \n\t\t \n\t\t \n\t\t\t I Awah \n\t\t \n\t\t \n\t\t\t A Agrawal \n\t\t \n\t\t \n\t\t\t N Ndili \n\t\t \n\t\t 10.1136/bmj-2021-068279 \n\t\t Medline: 36940933 \n\t \n\t \n\t\t BMJ \n\t\t \n\t\t\t 380 \n\t\t\t 68279 \n\t\t\t 2023 Mar 20 \n\t\t \n\t \n\t FREE Full text \n\t Holly L, Wong BL, van Kessel R, Awah I, Agrawal A, Ndili N. Optimising adolescent wellbeing in a digital age. BMJ 2023 Mar 20;380:e068279 [FREE Full text] [doi: 10.1136/bmj-2021-068279] [Medline: 36940933]"
    },
    {
      "title": "Barriers and facilitators of the uptake of digital health technology in cardiovascular care: a systematic scoping review",
      "authors": [
        "S Whitelaw",
        "D Pellegrini",
        "M Mamas",
        "M Cowie",
        "Van Spall"
      ],
      "year": 2021,
      "doi": "10.1093/ehjdh/ztab005",
      "journal": "Eur Heart J Digit Health",
      "volume": "2",
      "issue": "1",
      "raw": "Barriers and facilitators of the uptake of digital health technology in cardiovascular care: a systematic scoping review \n\t\t \n\t\t\t S Whitelaw \n\t\t \n\t\t \n\t\t\t D M Pellegrini \n\t\t \n\t\t \n\t\t\t M A Mamas \n\t\t \n\t\t \n\t\t\t M Cowie \n\t\t \n\t\t \n\t\t\t Van Spall \n\t\t \n\t\t \n\t\t\t H G \n\t\t \n\t\t 10.1093/ehjdh/ztab005 \n\t\t Medline: 34048508 \n\t \n\t \n\t\t Eur Heart J Digit Health \n\t\t \n\t\t\t 2 \n\t\t\t 1 \n\t\t\t \n\t\t\t 2021 Feb 04 \n\t\t \n\t \n\t FREE Full text \n\t Whitelaw S, Pellegrini DM, Mamas MA, Cowie M, Van Spall HG. Barriers and facilitators of the uptake of digital health technology in cardiovascular care: a systematic scoping review. Eur Heart J Digit Health 2021 Feb 04;2(1):62-74 [FREE Full text] [doi: 10.1093/ehjdh/ztab005] [Medline: 34048508]"
    },
    {
      "title": "Changes in digital healthcare search behavior during the early months of the COVID-19 pandemic: a study of six English-speaking countries",
      "authors": [
        "R Van Kessel",
        "I Kyriopoulos",
        "A Mastylak",
        "E Mossialos"
      ],
      "year": 2023,
      "doi": "10.1371/journal.pdig.0000241",
      "journal": "PLOS Digit Health",
      "volume": "2",
      "issue": "5",
      "pages": "e0000241",
      "raw": "Changes in digital healthcare search behavior during the early months of the COVID-19 pandemic: a study of six English-speaking countries \n\t\t \n\t\t\t R Van Kessel \n\t\t \n\t\t \n\t\t\t I Kyriopoulos \n\t\t \n\t\t \n\t\t\t A Mastylak \n\t\t \n\t\t \n\t\t\t E Mossialos \n\t\t \n\t\t 10.1371/journal.pdig.0000241 \n\t\t Medline: 37126489 \n\t \n\t \n\t\t PLOS Digit Health \n\t\t \n\t\t\t 2 \n\t\t\t 5 \n\t\t\t e0000241 \n\t\t\t 2023 May 01 \n\t\t \n\t \n\t FREE Full text \n\t van Kessel R, Kyriopoulos I, Mastylak A, Mossialos E. Changes in digital healthcare search behavior during the early months of the COVID-19 pandemic: a study of six English-speaking countries. PLOS Digit Health 2023 May 01;2(5):e0000241 [FREE Full text] [doi: 10.1371/journal.pdig.0000241] [Medline: 37126489]"
    },
    {
      "title": "The effect of the COVID-19 pandemic on digital health-seeking behavior: big data interrupted time-series analysis of Google trends",
      "authors": [
        "R Van Kessel",
        "I Kyriopoulos",
        "B Wong",
        "E Mossialos"
      ],
      "year": 2023,
      "doi": "10.2196/42401",
      "journal": "J Med Internet Res",
      "volume": "25",
      "pages": "42401",
      "raw": "The effect of the COVID-19 pandemic on digital health-seeking behavior: big data interrupted time-series analysis of Google trends \n\t\t \n\t\t\t R Van Kessel \n\t\t \n\t\t \n\t\t\t I Kyriopoulos \n\t\t \n\t\t \n\t\t\t B L Wong \n\t\t \n\t\t \n\t\t\t E Mossialos \n\t\t \n\t\t 10.2196/42401 \n\t\t Medline: 36603152 \n\t \n\t \n\t\t J Med Internet Res \n\t\t \n\t\t\t 25 \n\t\t\t 42401 \n\t\t\t 2023 Jan 16 \n\t\t \n\t \n\t FREE Full text \n\t van Kessel R, Kyriopoulos I, Wong BL, Mossialos E. The effect of the COVID-19 pandemic on digital health-seeking behavior: big data interrupted time-series analysis of Google trends. J Med Internet Res 2023 Jan 16;25:e42401 [FREE Full text] [doi: 10.2196/42401] [Medline: 36603152]"
    },
    {
      "title": "Beyond adoption: a new framework for theorizing and evaluating nonadoption, abandonment, and challenges to the scale-up, spread, and sustainability of health and care technologies",
      "authors": [
        "T Greenhalgh",
        "J Wherton",
        "C Papoutsi",
        "J Lynch",
        "G Hughes",
        "A Court"
      ],
      "year": 2017,
      "doi": "10.2196/jmir.8775",
      "journal": "J Med Internet Res",
      "volume": "19",
      "issue": "11",
      "pages": "367",
      "raw": "Beyond adoption: a new framework for theorizing and evaluating nonadoption, abandonment, and challenges to the scale-up, spread, and sustainability of health and care technologies \n\t\t \n\t\t\t T Greenhalgh \n\t\t \n\t\t \n\t\t\t J Wherton \n\t\t \n\t\t \n\t\t\t C Papoutsi \n\t\t \n\t\t \n\t\t\t J Lynch \n\t\t \n\t\t \n\t\t\t G Hughes \n\t\t \n\t\t \n\t\t\t A Court \n\t\t \n\t\t \n\t\t\t C \n\t\t \n\t\t 10.2196/jmir.8775 \n\t\t Medline: 29092808 \n\t \n\t \n\t\t J Med Internet Res \n\t\t \n\t\t\t 19 \n\t\t\t 11 \n\t\t\t 367 \n\t\t\t 2017 Nov 01 \n\t\t \n\t \n\t FREE Full text \n\t Greenhalgh T, Wherton J, Papoutsi C, Lynch J, Hughes G, A'Court C, et al. Beyond adoption: a new framework for theorizing and evaluating nonadoption, abandonment, and challenges to the scale-up, spread, and sustainability of health and care technologies. J Med Internet Res 2017 Nov 01;19(11):e367 [FREE Full text] [doi: 10.2196/jmir.8775] [Medline: 29092808]"
    },
    {
      "title": "Beyond validation: getting health apps into clinical practice",
      "authors": [
        "W Gordon",
        "A Landman",
        "H Zhang",
        "D Bates"
      ],
      "year": 2020,
      "doi": "10.1038/s41746-019-0212-z",
      "journal": "NPJ Digit Med",
      "volume": "3",
      "pages": "14",
      "raw": "Beyond validation: getting health apps into clinical practice \n\t\t \n\t\t\t W J Gordon \n\t\t \n\t\t \n\t\t\t A Landman \n\t\t \n\t\t \n\t\t\t H Zhang \n\t\t \n\t\t \n\t\t\t D W Bates \n\t\t \n\t\t 10.1038/s41746-019-0212-z \n\t\t Medline: 32047860 \n\t \n\t \n\t\t NPJ Digit Med \n\t\t \n\t\t\t 3 \n\t\t\t 14 \n\t\t\t 2020 Feb 03 \n\t\t \n\t \n\t FREE Full text \n\t Gordon WJ, Landman A, Zhang H, Bates DW. Beyond validation: getting health apps into clinical practice. NPJ Digit Med 2020 Feb 03;3:14 [FREE Full text] [doi: 10.1038/s41746-019-0212-z] [Medline: 32047860]"
    },
    {
      "title": "Where is the money in digital health? The roadmap to digital health app reimbursement in Europe",
      "authors": [
        "V Chawla"
      ],
      "year": 2022,
      "doi": "10.3030/101223563",
      "raw": "Where is the money in digital health? The roadmap to digital health app reimbursement in Europe \n\t\t \n\t\t\t V Chawla \n\t\t \n\t\t 10.3030/101223563 \n\t\t \n\t \n\t \n\t\t Research 2 Guidance \n\t\t \n\t\t\t 2022. 2022-11-11 \n\t\t \n\t \n\t Chawla V. Where is the money in digital health? The roadmap to digital health app reimbursement in Europe. Research 2 Guidance. 2022. URL: https://research2guidance.com/ where-is-the-money-in-digital-health-the-roadmap-to-digital-health-app-reimbursement-in-europe/ [accessed 2022-11-11]"
    },
    {
      "title": "Virtual primary care: fragmentation or integration?",
      "authors": [
        "G Wharton",
        "H Sood",
        "A Sissons",
        "E Mossialos"
      ],
      "year": 2019,
      "doi": "10.1016/s2589-7500(19)30152-9",
      "journal": "Lancet Digit Health",
      "volume": "1",
      "issue": "7",
      "raw": "Virtual primary care: fragmentation or integration? \n\t\t \n\t\t\t G A Wharton \n\t\t \n\t\t \n\t\t\t H S Sood \n\t\t \n\t\t \n\t\t\t A Sissons \n\t\t \n\t\t \n\t\t\t E Mossialos \n\t\t \n\t\t 10.1016/s2589-7500(19)30152-9 \n\t\t Medline: 33323207 \n\t \n\t \n\t\t Lancet Digit Health \n\t\t \n\t\t\t 1 \n\t\t\t 7 \n\t\t\t \n\t\t\t 2019 Nov \n\t\t \n\t \n\t FREE Full text \n\t Wharton GA, Sood HS, Sissons A, Mossialos E. Virtual primary care: fragmentation or integration? Lancet Digit Health 2019 Nov;1(7):e330-e331 [FREE Full text] [doi: 10.1016/S2589-7500(19)30152-9] [Medline: 33323207]"
    },
    {
      "title": "Scoping studies: towards a methodological framework",
      "authors": [
        "H Arksey",
        "O' Malley"
      ],
      "year": 2005,
      "doi": "10.1080/1364557032000119616",
      "journal": "Int J Soc Res Methodol",
      "volume": "8",
      "issue": "1",
      "raw": "Scoping studies: towards a methodological framework \n\t\t \n\t\t\t H Arksey \n\t\t \n\t\t \n\t\t\t O' Malley \n\t\t \n\t\t \n\t\t\t L \n\t\t \n\t\t 10.1080/1364557032000119616 \n\t \n\t \n\t\t Int J Soc Res Methodol \n\t\t \n\t\t\t 8 \n\t\t\t 1 \n\t\t\t \n\t\t\t 2005 Feb \n\t\t \n\t \n\t FREE Full text \n\t Arksey H, O'Malley L. Scoping studies: towards a methodological framework. Int J Soc Res Methodol 2005 Feb;8(1):19-32 [FREE Full text] [doi: 10.1080/1364557032000119616]"
    },
    {
      "title": "Scoping studies: advancing the methodology",
      "authors": [
        "D Levac",
        "H Colquhoun",
        "O' Brien"
      ],
      "year": 2010,
      "doi": "10.1186/1748-5908-5-69",
      "journal": "Implement Sci",
      "volume": "5",
      "pages": "69",
      "raw": "Scoping studies: advancing the methodology \n\t\t \n\t\t\t D Levac \n\t\t \n\t\t \n\t\t\t H Colquhoun \n\t\t \n\t\t \n\t\t\t O' Brien \n\t\t \n\t\t \n\t\t\t K K \n\t\t \n\t\t 10.1186/1748-5908-5-69 \n\t\t Medline: 20854677 \n\t \n\t \n\t\t Implement Sci \n\t\t \n\t\t\t 5 \n\t\t\t 69 \n\t\t\t 2010 Sep 20 \n\t\t \n\t \n\t FREE Full text \n\t Levac D, Colquhoun H, O'Brien KK. Scoping studies: advancing the methodology. Implement Sci 2010 Sep 20;5:69 [FREE Full text] [doi: 10.1186/1748-5908-5-69] [Medline: 20854677]"
    },
    {
      "title": "Meeting the review family: exploring review types and associated information retrieval requirements",
      "authors": [
        "A Sutton",
        "M Clowes",
        "L Preston",
        "A Booth"
      ],
      "year": 2019,
      "doi": "10.1111/hir.12276",
      "journal": "Health Info Libr J",
      "volume": "36",
      "issue": "3",
      "raw": "Meeting the review family: exploring review types and associated information retrieval requirements \n\t\t \n\t\t\t A Sutton \n\t\t \n\t\t \n\t\t\t M Clowes \n\t\t \n\t\t \n\t\t\t L Preston \n\t\t \n\t\t \n\t\t\t A Booth \n\t\t \n\t\t 10.1111/hir.12276 \n\t\t Medline: 31541534 \n\t \n\t \n\t\t Health Info Libr J \n\t\t \n\t\t\t 36 \n\t\t\t 3 \n\t\t\t \n\t\t\t 2019 Sep \n\t\t \n\t \n\t FREE Full text \n\t Sutton A, Clowes M, Preston L, Booth A. Meeting the review family: exploring review types and associated information retrieval requirements. Health Info Libr J 2019 Sep;36(3):202-222 [FREE Full text] [doi: 10.1111/hir.12276] [Medline: 31541534]"
    },
    {
      "title": "Searching for qualitative research for inclusion in systematic reviews: a structured methodological review",
      "authors": [
        "A Booth"
      ],
      "year": 2016,
      "doi": "10.1186/s13643-016-0249-x",
      "journal": "Syst Rev",
      "volume": "5",
      "pages": "74",
      "raw": "Searching for qualitative research for inclusion in systematic reviews: a structured methodological review \n\t\t \n\t\t\t A Booth \n\t\t \n\t\t 10.1186/s13643-016-0249-x \n\t\t Medline: 27145932 \n\t \n\t \n\t\t Syst Rev \n\t\t \n\t\t\t 5 \n\t\t\t 74 \n\t\t\t 2016 May 04 \n\t\t \n\t \n\t FREE Full text \n\t Booth A. Searching for qualitative research for inclusion in systematic reviews: a structured methodological review. Syst Rev 2016 May 04;5:74 [FREE Full text] [doi: 10.1186/s13643-016-0249-x] [Medline: 27145932]"
    },
    {
      "title": "PRISMA extension for scoping reviews (PRISMA-ScR): checklist and explanation",
      "authors": [
        "A Tricco",
        "Lillie Zarin",
        "O' Brien",
        "K Colquhoun",
        "H Levac"
      ],
      "year": 2018,
      "doi": "10.7326/m18-0850",
      "journal": "Ann Intern Med",
      "volume": "169",
      "issue": "7",
      "raw": "PRISMA extension for scoping reviews (PRISMA-ScR): checklist and explanation \n\t\t \n\t\t\t A C Tricco \n\t\t \n\t\t \n\t\t\t Lillie E Zarin \n\t\t \n\t\t \n\t\t\t W \n\t\t \n\t\t \n\t\t\t O' Brien \n\t\t \n\t\t \n\t\t\t K K Colquhoun \n\t\t \n\t\t \n\t\t\t H Levac \n\t\t \n\t\t \n\t\t\t D \n\t\t \n\t\t 10.7326/m18-0850 \n\t\t Medline: 30178033 \n\t \n\t \n\t\t Ann Intern Med \n\t\t \n\t\t\t 169 \n\t\t\t 7 \n\t\t\t \n\t\t\t 2018 Oct 02 \n\t\t \n\t \n\t FREE Full text \n\t Tricco AC, Lillie E, Zarin W, O'Brien KK, Colquhoun H, Levac D, et al. PRISMA extension for scoping reviews (PRISMA-ScR): checklist and explanation. Ann Intern Med 2018 Oct 02;169(7):467-473 [FREE Full text] [doi: 10.7326/M18-0850] [Medline: 30178033]"
    },
    {
      "title": "Scoping reviews",
      "authors": [
        "M Peters",
        "C Godfrey",
        "P Mcinerney",
        "Z Munn",
        "A Tricco",
        "H Khalil"
      ],
      "year": 2020,
      "doi": "10.46658/jbimes-24-09",
      "raw": "Scoping reviews \n\t\t \n\t\t\t M D Peters \n\t\t \n\t\t \n\t\t\t C Godfrey \n\t\t \n\t\t \n\t\t\t P Mcinerney \n\t\t \n\t\t \n\t\t\t Z Munn \n\t\t \n\t\t \n\t\t\t A C Tricco \n\t\t \n\t\t \n\t\t\t H Khalil \n\t\t \n\t\t 10.46658/jbimes-24-09 \n\t \n\t \n\t\t JBI Manual for Evidence Synthesis \n\t\t \n\t\t\t E Aromataris \n\t\t \n\t\t \n\t\t\t Z Munn \n\t\t \n\t\t Adelaide, Australia \n\t\t \n\t\t\t JBI \n\t\t\t 2020 \n\t\t \n\t \n\t Peters MD, Godfrey C, McInerney P, Munn Z, Tricco AC, Khalil H. Scoping reviews. In: Aromataris E, Munn Z, editors. JBI Manual for Evidence Synthesis. Adelaide, Australia: JBI; 2020."
    },
    {
      "title": "The role of Google scholar in evidence reviews and its applicability to grey literature searching",
      "authors": [
        "N Haddaway",
        "A Collins",
        "D Coughlin",
        "S Kirk"
      ],
      "year": 2015,
      "doi": "10.1371/journal.pone.0138237",
      "journal": "PLoS One",
      "volume": "10",
      "issue": "9",
      "pages": "138237",
      "raw": "The role of Google scholar in evidence reviews and its applicability to grey literature searching \n\t\t \n\t\t\t N R Haddaway \n\t\t \n\t\t \n\t\t\t A M Collins \n\t\t \n\t\t \n\t\t\t D Coughlin \n\t\t \n\t\t \n\t\t\t S Kirk \n\t\t \n\t\t 10.1371/journal.pone.0138237 \n\t\t Medline: 26379270 \n\t \n\t \n\t\t PLoS One \n\t\t \n\t\t\t 10 \n\t\t\t 9 \n\t\t\t 138237 \n\t\t\t 2015 Sep 17 \n\t\t \n\t \n\t FREE Full text \n\t Haddaway NR, Collins AM, Coughlin D, Kirk S. The role of Google scholar in evidence reviews and its applicability to grey literature searching. PLoS One 2015 Sep 17;10(9):e0138237 [FREE Full text] [doi: 10.1371/journal.pone.0138237] [Medline: 26379270]"
    },
    {
      "title": "A coefficient of agreement for nominal scales",
      "authors": [
        "J Cohen"
      ],
      "year": 1960,
      "doi": "10.1177/001316446002000104",
      "journal": "Educ Psychol Meas",
      "volume": "20",
      "issue": "1",
      "raw": "A coefficient of agreement for nominal scales \n\t\t \n\t\t\t J Cohen \n\t\t \n\t\t 10.1177/001316446002000104 \n\t \n\t \n\t\t Educ Psychol Meas \n\t\t \n\t\t\t 20 \n\t\t\t 1 \n\t\t\t \n\t\t\t 1960 Apr \n\t\t \n\t \n\t FREE Full text \n\t Cohen J. A coefficient of agreement for nominal scales. Educ Psychol Meas 1960 Apr;20(1):37-46 [FREE Full text]"
    },
    {
      "title": "The measurement of observer agreement for categorical data",
      "authors": [
        "J Landis",
        "G Koch"
      ],
      "year": 1977,
      "doi": "10.2307/2529310",
      "journal": "Biometrics",
      "volume": "33",
      "issue": "1",
      "raw": "The measurement of observer agreement for categorical data \n\t\t \n\t\t\t J R Landis \n\t\t \n\t\t \n\t\t\t G G Koch \n\t\t \n\t\t 10.2307/2529310 \n\t\t Medline: 843571 \n\t \n\t \n\t\t Biometrics \n\t\t \n\t\t\t 33 \n\t\t\t 1 \n\t\t\t \n\t\t\t 1977 Mar \n\t\t \n\t \n\t Landis JR, Koch GG. The measurement of observer agreement for categorical data. Biometrics 1977 Mar;33(1):159-174 [Medline: 843571]"
    },
    {
      "title": "Better systematic review management",
      "year": 2023,
      "doi": "10.1097/01.xeb.0000511346.12446.f2",
      "raw": "10.1097/01.xeb.0000511346.12446.f2 \n\t\t \n\t\t Better systematic review management \n\t\t \n\t\t\t Covidence \n\t\t\t 2023-03-14 \n\t\t \n\t \n\t Better systematic review management. Covidence. URL: https://www.covidence.org/ [accessed 2023-03-14]"
    },
    {
      "title": "Using thematic analysis in psychology",
      "authors": [
        "V Braun",
        "V Clarke"
      ],
      "year": 2006,
      "doi": "10.1007/s10597-020-00591-x",
      "journal": "Qual Res Psychol",
      "volume": "3",
      "issue": "2",
      "raw": "Using thematic analysis in psychology \n\t\t \n\t\t\t V Braun \n\t\t \n\t\t \n\t\t\t V Clarke \n\t\t \n\t\t 10.1007/s10597-020-00591-x \n\t \n\t \n\t\t Qual Res Psychol \n\t\t \n\t\t\t 3 \n\t\t\t 2 \n\t\t\t \n\t\t\t 2006 \n\t\t \n\t \n\t FREE Full text \n\t Braun V, Clarke V. Using thematic analysis in psychology. Qual Res Psychol 2006;3(2):77-101 [FREE Full text] [doi: 10.1007/s10597-020-00591-x]"
    },
    {
      "title": "The updated consolidated framework for implementation research based on user feedback",
      "authors": [
        "L Damschroder",
        "C Reardon",
        "M Widerquist",
        "J Lowery"
      ],
      "year": 2022,
      "doi": "10.1186/s13012-022-01245-0",
      "journal": "Implement Sci",
      "volume": "17",
      "issue": "1",
      "pages": "75",
      "raw": "The updated consolidated framework for implementation research based on user feedback \n\t\t \n\t\t\t L J Damschroder \n\t\t \n\t\t \n\t\t\t C M Reardon \n\t\t \n\t\t \n\t\t\t M A Widerquist \n\t\t \n\t\t \n\t\t\t J Lowery \n\t\t \n\t\t 10.1186/s13012-022-01245-0 \n\t\t Medline: 36309746 \n\t \n\t \n\t\t Implement Sci \n\t\t \n\t\t\t 17 \n\t\t\t 1 \n\t\t\t 75 \n\t\t\t 2022 Oct 29 \n\t\t \n\t \n\t FREE Full text \n\t Damschroder LJ, Reardon CM, Widerquist MA, Lowery J. The updated consolidated framework for implementation research based on user feedback. Implement Sci 2022 Oct 29;17(1):75 [FREE Full text] [doi: 10.1186/s13012-022-01245-0] [Medline: 36309746]"
    },
    {
      "title": "Implementing health apps for digital public health -an implementation science approach adopting the consolidated framework for implementation research",
      "authors": [
        "J Wienert",
        "H Zeeb"
      ],
      "year": 2021,
      "doi": "10.3389/fpubh.2021.610237",
      "journal": "Front Public Health",
      "volume": "9",
      "pages": "610237",
      "raw": "Implementing health apps for digital public health -an implementation science approach adopting the consolidated framework for implementation research \n\t\t \n\t\t\t J Wienert \n\t\t \n\t\t \n\t\t\t H Zeeb \n\t\t \n\t\t 10.3389/fpubh.2021.610237 \n\t\t Medline: 34026702 \n\t \n\t \n\t\t Front Public Health \n\t\t \n\t\t\t 9 \n\t\t\t 610237 \n\t\t\t 2021 May 07 \n\t\t \n\t \n\t FREE Full text \n\t Wienert J, Zeeb H. Implementing health apps for digital public health -an implementation science approach adopting the consolidated framework for implementation research. Front Public Health 2021 May 07;9:610237 [FREE Full text] [doi: 10.3389/fpubh.2021.610237] [Medline: 34026702]"
    },
    {
      "title": "Evaluating the quality of medical care",
      "authors": [
        "A Donabedian"
      ],
      "year": 1966,
      "doi": "10.1111/j.1468-0009.2005.00397.x",
      "journal": "Milbank Q",
      "volume": "83",
      "issue": "4",
      "raw": "Evaluating the quality of medical care \n\t\t \n\t\t\t A Donabedian \n\t\t \n\t\t 10.1111/j.1468-0009.2005.00397.x \n\t\t Medline: 16279964 \n\t \n\t \n\t\t Milbank Q \n\t\t \n\t\t\t 83 \n\t\t\t 4 \n\t\t\t \n\t\t\t 1966. 2005 \n\t\t \n\t \n\t FREE Full text \n\t Donabedian A. Evaluating the quality of medical care. 1966. Milbank Q 2005;83(4):691-729 [FREE Full text] [doi: 10.1111/j.1468-0009.2005.00397.x] [Medline: 16279964]"
    },
    {
      "title": "Digital Technology and Health Inequalities: A Scoping Review",
      "authors": [
        "M Honeyman",
        "D Maguire",
        "H Evans",
        "A Davies"
      ],
      "year": 2020,
      "doi": "10.52964/amja.0042",
      "raw": "M Honeyman \n\t\t \n\t\t \n\t\t\t D Maguire \n\t\t \n\t\t \n\t\t\t H Evans \n\t\t \n\t\t \n\t\t\t A Davies \n\t\t \n\t\t 10.52964/amja.0042 \n\t\t Digital Technology and Health Inequalities: A Scoping Review \n\t\t Cardiff, Wales \n\t\t \n\t\t\t Public Health Wales NHS Trust \n\t\t\t 2020 \n\t\t \n\t \n\t Honeyman M, Maguire D, Evans H, Davies A. Digital Technology and Health Inequalities: A Scoping Review. Cardiff, Wales: Public Health Wales NHS Trust; 2020."
    },
    {
      "title": "Economic evaluation of telemedicine: review of the literature and research guidelines for benefit-cost analysis",
      "authors": [
        "M D\u00e1valos",
        "M French",
        "A Burdick",
        "S Simmons"
      ],
      "year": 2009,
      "doi": "10.1089/tmj.2009.0067",
      "journal": "Telemed J E Health",
      "volume": "15",
      "issue": "10",
      "raw": "Economic evaluation of telemedicine: review of the literature and research guidelines for benefit-cost analysis \n\t\t \n\t\t\t M E D\u00e1valos \n\t\t \n\t\t \n\t\t\t M T French \n\t\t \n\t\t \n\t\t\t A E Burdick \n\t\t \n\t\t \n\t\t\t S C Simmons \n\t\t \n\t\t 10.1089/tmj.2009.0067 \n\t\t Medline: 19954346 \n\t \n\t \n\t\t Telemed J E Health \n\t\t \n\t\t\t 15 \n\t\t\t 10 \n\t\t\t \n\t\t\t 2009 Dec \n\t\t \n\t \n\t D\u00e1valos ME, French MT, Burdick AE, Simmons SC. Economic evaluation of telemedicine: review of the literature and research guidelines for benefit-cost analysis. Telemed J E Health 2009 Dec;15(10):933-948 [doi: 10.1089/tmj.2009.0067] [Medline: 19954346]"
    },
    {
      "title": "m-Health adoption by healthcare professionals: a systematic review",
      "authors": [
        "M Gagnon",
        "P Ngangue",
        "J Payne-Gagnon",
        "M Desmartis"
      ],
      "year": 2016,
      "doi": "10.1093/jamia/ocv052",
      "journal": "J Am Med Inform Assoc",
      "volume": "23",
      "issue": "1",
      "raw": "m-Health adoption by healthcare professionals: a systematic review \n\t\t \n\t\t\t M P Gagnon \n\t\t \n\t\t \n\t\t\t P Ngangue \n\t\t \n\t\t \n\t\t\t J Payne-Gagnon \n\t\t \n\t\t \n\t\t\t M Desmartis \n\t\t \n\t\t 10.1093/jamia/ocv052 \n\t\t Medline: 26078410 \n\t \n\t \n\t\t J Am Med Inform Assoc \n\t\t \n\t\t\t 23 \n\t\t\t 1 \n\t\t\t \n\t\t\t 2016 Jan \n\t\t \n\t \n\t FREE Full text \n\t Gagnon MP, Ngangue P, Payne-Gagnon J, Desmartis M. m-Health adoption by healthcare professionals: a systematic review. J Am Med Inform Assoc 2016 Jan;23(1):212-220 [FREE Full text] [doi: 10.1093/jamia/ocv052] [Medline: 26078410]"
    },
    {
      "title": "eHealth as the next-generation perinatal care: an overview of the literature",
      "authors": [
        "J Van Den Heuvel",
        "T Groenhof",
        "J Veerbeek",
        "W Van Solinge",
        "A Lely",
        "A Franx"
      ],
      "year": 2018,
      "doi": "10.2196/jmir.9262",
      "journal": "J Med Internet Res",
      "volume": "20",
      "issue": "6",
      "pages": "e202",
      "raw": "eHealth as the next-generation perinatal care: an overview of the literature \n\t\t \n\t\t\t J F Van Den Heuvel \n\t\t \n\t\t \n\t\t\t T K Groenhof \n\t\t \n\t\t \n\t\t\t J H Veerbeek \n\t\t \n\t\t \n\t\t\t W W Van Solinge \n\t\t \n\t\t \n\t\t\t A T Lely \n\t\t \n\t\t \n\t\t\t A Franx \n\t\t \n\t\t 10.2196/jmir.9262 \n\t\t Medline: 29871855 \n\t \n\t \n\t\t J Med Internet Res \n\t\t \n\t\t\t 20 \n\t\t\t 6 \n\t\t\t e202 \n\t\t\t 2018 Jun 05 \n\t\t \n\t \n\t FREE Full text \n\t van den Heuvel JF, Groenhof TK, Veerbeek JH, van Solinge WW, Lely AT, Franx A, et al. eHealth as the next-generation perinatal care: an overview of the literature. J Med Internet Res 2018 Jun 05;20(6):e202 [FREE Full text] [doi: 10.2196/jmir.9262] [Medline: 29871855]"
    },
    {
      "title": "How to value digital health interventions? A systematic literature review",
      "authors": [
        "K Kolasa",
        "G Kozinski"
      ],
      "year": 2020,
      "doi": "10.3390/ijerph17062119",
      "journal": "Int J Environ Res Public Health",
      "volume": "17",
      "issue": "6",
      "pages": "2119",
      "raw": "How to value digital health interventions? A systematic literature review \n\t\t \n\t\t\t K Kolasa \n\t\t \n\t\t \n\t\t\t G Kozinski \n\t\t \n\t\t 10.3390/ijerph17062119 \n\t\t Medline: 32209988 \n\t \n\t \n\t\t Int J Environ Res Public Health \n\t\t \n\t\t\t 17 \n\t\t\t 6 \n\t\t\t 2119 \n\t\t\t 2020 Mar 23 \n\t\t \n\t \n\t FREE Full text \n\t Kolasa K, Kozinski G. How to value digital health interventions? A systematic literature review. Int J Environ Res Public Health 2020 Mar 23;17(6):2119 [FREE Full text] [doi: 10.3390/ijerph17062119] [Medline: 32209988]"
    },
    {
      "title": "The worldwide impact of telemedicine during COVID-19: current evidence and recommendations for the future",
      "authors": [
        "S Omboni",
        "R Padwal",
        "T Alessa",
        "B Bencz\u00far",
        "B Green",
        "I Hubbard"
      ],
      "year": 2022,
      "doi": "10.20517/ch.2021.03",
      "journal": "Connect Health",
      "volume": "1",
      "raw": "The worldwide impact of telemedicine during COVID-19: current evidence and recommendations for the future \n\t\t \n\t\t\t S Omboni \n\t\t \n\t\t \n\t\t\t R S Padwal \n\t\t \n\t\t \n\t\t\t T Alessa \n\t\t \n\t\t \n\t\t\t B Bencz\u00far \n\t\t \n\t\t \n\t\t\t B B Green \n\t\t \n\t\t \n\t\t\t I Hubbard \n\t\t \n\t\t 10.20517/ch.2021.03 \n\t\t Medline: 35233563 \n\t \n\t \n\t\t Connect Health \n\t\t \n\t\t\t 1 \n\t\t\t \n\t\t\t 2022 Jan 04 \n\t\t \n\t \n\t FREE Full text \n\t Omboni S, Padwal RS, Alessa T, Bencz\u00far B, Green BB, Hubbard I, et al. The worldwide impact of telemedicine during COVID-19: current evidence and recommendations for the future. Connect Health 2022 Jan 04;1:7-35 [FREE Full text] [doi: 10.20517/ch.2021.03] [Medline: 35233563]"
    },
    {
      "title": "The impact of digital therapeutics on current health technology assessment frameworks",
      "authors": [
        "K Yan",
        "C Balijepalli",
        "E Druyts"
      ],
      "year": 2021,
      "doi": "10.3389/fdgth.2021.667016",
      "journal": "Front Digit Health",
      "volume": "3",
      "pages": "667016",
      "raw": "The impact of digital therapeutics on current health technology assessment frameworks \n\t\t \n\t\t\t K Yan \n\t\t \n\t\t \n\t\t\t C Balijepalli \n\t\t \n\t\t \n\t\t\t E Druyts \n\t\t \n\t\t 10.3389/fdgth.2021.667016 \n\t\t Medline: 34713140 \n\t \n\t \n\t\t Front Digit Health \n\t\t \n\t\t\t 3 \n\t\t\t 667016 \n\t\t\t 2021 Jun 09 \n\t\t \n\t \n\t FREE Full text \n\t Yan K, Balijepalli C, Druyts E. The impact of digital therapeutics on current health technology assessment frameworks. Front Digit Health 2021 Jun 09;3:667016 [FREE Full text] [doi: 10.3389/fdgth.2021.667016] [Medline: 34713140]"
    },
    {
      "title": "The challenges of telemedicine in rheumatology",
      "authors": [
        "Y Song",
        "L Bernard",
        "C Jorgensen",
        "G Dusfour",
        "Y Pers"
      ],
      "year": 2021,
      "doi": "10.3389/fmed.2021.746219",
      "journal": "Front Med",
      "volume": "8",
      "pages": "746219",
      "raw": "The challenges of telemedicine in rheumatology \n\t\t \n\t\t\t Y Song \n\t\t \n\t\t \n\t\t\t L Bernard \n\t\t \n\t\t \n\t\t\t C Jorgensen \n\t\t \n\t\t \n\t\t\t G Dusfour \n\t\t \n\t\t \n\t\t\t Y M Pers \n\t\t \n\t\t 10.3389/fmed.2021.746219 \n\t\t Medline: 34722584 \n\t \n\t \n\t\t Front Med \n\t\t \n\t\t\t 8 \n\t\t\t 746219 \n\t\t\t 2021 Oct 13 \n\t\t\t Lausanne \n\t\t \n\t \n\t FREE Full text \n\t Song Y, Bernard L, Jorgensen C, Dusfour G, Pers YM. The challenges of telemedicine in rheumatology. Front Med (Lausanne) 2021 Oct 13;8:746219 [FREE Full text] [doi: 10.3389/fmed.2021.746219] [Medline: 34722584]"
    },
    {
      "title": "Telehealth and its implementation in respiratory sleep medicine",
      "authors": [
        "G Nilius",
        "M Schroeder",
        "C Schoebel"
      ],
      "year": 2021,
      "doi": "10.1097/mcp.0000000000000830",
      "journal": "Curr Opin Pulm Med",
      "volume": "27",
      "issue": "6",
      "raw": "Telehealth and its implementation in respiratory sleep medicine \n\t\t \n\t\t\t G Nilius \n\t\t \n\t\t \n\t\t\t M Schroeder \n\t\t \n\t\t \n\t\t\t C Schoebel \n\t\t \n\t\t 10.1097/mcp.0000000000000830 \n\t\t Medline: 34494980 \n\t \n\t \n\t\t Curr Opin Pulm Med \n\t\t \n\t\t\t 27 \n\t\t\t 6 \n\t\t\t \n\t\t\t 2021 Nov 01 \n\t\t \n\t \n\t Nilius G, Schroeder M, Schoebel C. Telehealth and its implementation in respiratory sleep medicine. Curr Opin Pulm Med 2021 Nov 01;27(6):523-528 [doi: 10.1097/MCP.0000000000000830] [Medline: 34494980]"
    },
    {
      "title": "The role of tele-medicine in patients with respiratory diseases",
      "authors": [
        "N Ambrosino",
        "C Fracchia"
      ],
      "year": 2017,
      "doi": "10.1080/17476348.2017.1383898",
      "journal": "Expert Rev Respir Med",
      "volume": "11",
      "issue": "11",
      "raw": "The role of tele-medicine in patients with respiratory diseases \n\t\t \n\t\t\t N Ambrosino \n\t\t \n\t\t \n\t\t\t C Fracchia \n\t\t \n\t\t 10.1080/17476348.2017.1383898 \n\t\t Medline: 28942692 \n\t \n\t \n\t\t Expert Rev Respir Med \n\t\t \n\t\t\t 11 \n\t\t\t 11 \n\t\t\t \n\t\t\t 2017 Nov \n\t\t \n\t \n\t Ambrosino N, Fracchia C. The role of tele-medicine in patients with respiratory diseases. Expert Rev Respir Med 2017 Nov;11(11):893-900 [doi: 10.1080/17476348.2017.1383898] [Medline: 28942692]"
    },
    {
      "title": "Exploring barriers to and enablers of the adoption of information and communication technology for the care of older adults with chronic diseases: scoping review",
      "authors": [
        "S Zaman",
        "R Khan",
        "R Evans",
        "A Thrift",
        "R Maddison",
        "S Islam"
      ],
      "year": 2022,
      "doi": "10.2196/25251",
      "journal": "JMIR Aging",
      "volume": "5",
      "issue": "1",
      "pages": "25251",
      "raw": "Exploring barriers to and enablers of the adoption of information and communication technology for the care of older adults with chronic diseases: scoping review \n\t\t \n\t\t\t S B Zaman \n\t\t \n\t\t \n\t\t\t R K Khan \n\t\t \n\t\t \n\t\t\t R G Evans \n\t\t \n\t\t \n\t\t\t A G Thrift \n\t\t \n\t\t \n\t\t\t R Maddison \n\t\t \n\t\t \n\t\t\t S M Islam \n\t\t \n\t\t 10.2196/25251 \n\t\t Medline: 34994695 \n\t \n\t \n\t\t JMIR Aging \n\t\t \n\t\t\t 5 \n\t\t\t 1 \n\t\t\t 25251 \n\t\t\t 2022 Jan 07 \n\t\t \n\t \n\t FREE Full text \n\t Zaman SB, Khan RK, Evans RG, Thrift AG, Maddison R, Islam SM. Exploring barriers to and enablers of the adoption of information and communication technology for the care of older adults with chronic diseases: scoping review. JMIR Aging 2022 Jan 07;5(1):e25251 [FREE Full text] [doi: 10.2196/25251] [Medline: 34994695]"
    },
    {
      "title": "Digital technologies in cancer care: a review from the clinician's perspective",
      "authors": [
        "L Briggs",
        "M Labban",
        "K Alkhatib",
        "D Nguyen",
        "A Cole",
        "Q Trinh"
      ],
      "year": 2022,
      "doi": "10.2217/cer-2021-0263",
      "journal": "J Comp Eff Res",
      "volume": "11",
      "issue": "7",
      "raw": "Digital technologies in cancer care: a review from the clinician's perspective \n\t\t \n\t\t\t L G Briggs \n\t\t \n\t\t \n\t\t\t M Labban \n\t\t \n\t\t \n\t\t\t K Alkhatib \n\t\t \n\t\t \n\t\t\t D D Nguyen \n\t\t \n\t\t \n\t\t\t A P Cole \n\t\t \n\t\t \n\t\t\t Q D Trinh \n\t\t \n\t\t 10.2217/cer-2021-0263 \n\t\t Medline: 35416050 \n\t \n\t \n\t\t J Comp Eff Res \n\t\t \n\t\t\t 11 \n\t\t\t 7 \n\t\t\t \n\t\t\t 2022 May \n\t\t \n\t \n\t FREE Full text \n\t Briggs LG, Labban M, Alkhatib K, Nguyen DD, Cole AP, Trinh QD. Digital technologies in cancer care: a review from the clinician's perspective. J Comp Eff Res 2022 May;11(7):533-544 [FREE Full text] [doi: 10.2217/cer-2021-0263] [Medline: 35416050]"
    },
    {
      "title": "User experience reevaluation and diffusion of technology in the context of compulsory usage illustrated by the example of telepsychotherapy-a literature review",
      "authors": [
        "B Butz",
        "L Kloep",
        "B Kriegesmann"
      ],
      "year": 2022,
      "doi": "10.1177/20552076221134448",
      "journal": "Digit Health",
      "volume": "8",
      "pages": "20552076221134448",
      "raw": "User experience reevaluation and diffusion of technology in the context of compulsory usage illustrated by the example of telepsychotherapy-a literature review \n\t\t \n\t\t\t B Butz \n\t\t \n\t\t \n\t\t\t L Kloep \n\t\t \n\t\t \n\t\t\t B Kriegesmann \n\t\t \n\t\t 10.1177/20552076221134448 \n\t\t Medline: 36386248 \n\t \n\t \n\t\t Digit Health \n\t\t \n\t\t\t 8 \n\t\t\t 20552076221134448 \n\t\t\t 2022 Nov 13 \n\t\t \n\t \n\t FREE Full text \n\t Butz B, Kloep L, Kriegesmann B. User experience reevaluation and diffusion of technology in the context of compulsory usage illustrated by the example of telepsychotherapy-a literature review. Digit Health 2022 Nov 13;8:20552076221134448 [FREE Full text] [doi: 10.1177/20552076221134448] [Medline: 36386248]"
    },
    {
      "title": "Optimizing the potential for telehealth in cardiovascular care (in the era of COVID-19): time will tell",
      "authors": [
        "P Patel",
        "D Dhindsa",
        "D Eapen",
        "A Khera",
        "M Gulati",
        "N Stone"
      ],
      "year": 2021,
      "doi": "10.1016/j.amjmed.2021.03.007",
      "journal": "Am J Med",
      "volume": "134",
      "issue": "8",
      "raw": "Optimizing the potential for telehealth in cardiovascular care (in the era of COVID-19): time will tell \n\t\t \n\t\t\t P Patel \n\t\t \n\t\t \n\t\t\t D Dhindsa \n\t\t \n\t\t \n\t\t\t D J Eapen \n\t\t \n\t\t \n\t\t\t A Khera \n\t\t \n\t\t \n\t\t\t M Gulati \n\t\t \n\t\t \n\t\t\t N J Stone \n\t\t \n\t\t 10.1016/j.amjmed.2021.03.007 \n\t\t Medline: 33845033 \n\t \n\t \n\t\t Am J Med \n\t\t \n\t\t\t 134 \n\t\t\t 8 \n\t\t\t \n\t\t\t 2021 Aug \n\t\t \n\t \n\t FREE Full text \n\t Patel P, Dhindsa D, Eapen DJ, Khera A, Gulati M, Stone NJ, et al. Optimizing the potential for telehealth in cardiovascular care (in the era of COVID-19): time will tell. Am J Med 2021 Aug;134(8):945-951 [FREE Full text] [doi: 10.1016/j.amjmed.2021.03.007] [Medline: 33845033]"
    },
    {
      "title": "Mobile health in preventive cardiology: current status and future perspective",
      "authors": [
        "M Kozik",
        "N Isakadze",
        "S Martin"
      ],
      "year": 2021,
      "doi": "10.1097/hco.0000000000000891",
      "journal": "Curr Opin Cardiol",
      "volume": "36",
      "issue": "5",
      "raw": "Mobile health in preventive cardiology: current status and future perspective \n\t\t \n\t\t\t M Kozik \n\t\t \n\t\t \n\t\t\t N Isakadze \n\t\t \n\t\t \n\t\t\t S S Martin \n\t\t \n\t\t 10.1097/hco.0000000000000891 \n\t\t Medline: 34224437 \n\t \n\t \n\t\t Curr Opin Cardiol \n\t\t \n\t\t\t 36 \n\t\t\t 5 \n\t\t\t \n\t\t\t 2021 Sep 01 \n\t\t \n\t \n\t FREE Full text \n\t Kozik M, Isakadze N, Martin SS. Mobile health in preventive cardiology: current status and future perspective. Curr Opin Cardiol 2021 Sep 01;36(5):580-588 [FREE Full text] [doi: 10.1097/HCO.0000000000000891] [Medline: 34224437]"
    },
    {
      "title": "Telehealth in type 1 diabetes",
      "authors": [
        "T Kompala",
        "A Neinstein"
      ],
      "year": 2021,
      "doi": "10.1097/MED.0000000000000600",
      "journal": "Curr Opin Endocrinol Diabetes Obes",
      "volume": "28",
      "issue": "1",
      "raw": "Telehealth in type 1 diabetes \n\t\t \n\t\t\t T Kompala \n\t\t \n\t\t \n\t\t\t A B Neinstein \n\t\t \n\t\t 10.1097/MED.0000000000000600 \n\t\t Medline: 33332927 \n\t \n\t \n\t\t Curr Opin Endocrinol Diabetes Obes \n\t\t \n\t\t\t 28 \n\t\t\t 1 \n\t\t\t \n\t\t\t 2021 Feb 01 \n\t\t \n\t \n\t Kompala T, Neinstein AB. Telehealth in type 1 diabetes. Curr Opin Endocrinol Diabetes Obes 2021 Feb 01;28(1):21-29 [doi: 10.1097/MED.0000000000000600] [Medline: 33332927]"
    },
    {
      "title": "Health apps for combating COVID-19: descriptive review and taxonomy",
      "authors": [
        "M Almalki",
        "A Giannicchi"
      ],
      "year": 2021,
      "doi": "10.2196/24322",
      "journal": "JMIR Mhealth Uhealth",
      "volume": "9",
      "issue": "3",
      "pages": "24322",
      "raw": "Health apps for combating COVID-19: descriptive review and taxonomy \n\t\t \n\t\t\t M Almalki \n\t\t \n\t\t \n\t\t\t A Giannicchi \n\t\t \n\t\t 10.2196/24322 \n\t\t Medline: 33626017 \n\t \n\t \n\t\t JMIR Mhealth Uhealth \n\t\t \n\t\t\t 9 \n\t\t\t 3 \n\t\t\t 24322 \n\t\t\t 2021 Mar 02 \n\t\t \n\t \n\t FREE Full text \n\t Almalki M, Giannicchi A. Health apps for combating COVID-19: descriptive review and taxonomy. JMIR Mhealth Uhealth 2021 Mar 02;9(3):e24322 [FREE Full text] [doi: 10.2196/24322] [Medline: 33626017]"
    },
    {
      "title": "A systematic review of mHealth funded R and D activities in EU: trends, technologies and obstacles",
      "authors": [
        "Y Koumpouros",
        "A Georgoulas"
      ],
      "year": 2020,
      "doi": "10.1080/17538157.2019.1656208",
      "journal": "Inform Health Soc Care",
      "volume": "45",
      "issue": "2",
      "raw": "A systematic review of mHealth funded R and D activities in EU: trends, technologies and obstacles \n\t\t \n\t\t\t Y Koumpouros \n\t\t \n\t\t \n\t\t\t A Georgoulas \n\t\t \n\t\t 10.1080/17538157.2019.1656208 \n\t\t Medline: 31743060 \n\t \n\t \n\t\t Inform Health Soc Care \n\t\t \n\t\t\t 45 \n\t\t\t 2 \n\t\t\t \n\t\t\t 2020 \n\t\t \n\t \n\t Koumpouros Y, Georgoulas A. A systematic review of mHealth funded R and D activities in EU: trends, technologies and obstacles. Inform Health Soc Care 2020;45(2):168-187 [doi: 10.1080/17538157.2019.1656208] [Medline: 31743060]"
    },
    {
      "title": "Delivering healthcare remotely to cardiovascular patients during COVID-19: a rapid review of the evidence",
      "authors": [
        "L Neubeck",
        "T Hansen",
        "T Jaarsma",
        "L Klompstra",
        "R Gallagher"
      ],
      "year": 2020,
      "doi": "10.1177/1474515120924530",
      "journal": "Eur J Cardiovasc Nurs",
      "volume": "19",
      "issue": "6",
      "raw": "Delivering healthcare remotely to cardiovascular patients during COVID-19: a rapid review of the evidence \n\t\t \n\t\t\t L Neubeck \n\t\t \n\t\t \n\t\t\t T Hansen \n\t\t \n\t\t \n\t\t\t T Jaarsma \n\t\t \n\t\t \n\t\t\t L Klompstra \n\t\t \n\t\t \n\t\t\t R Gallagher \n\t\t \n\t\t 10.1177/1474515120924530 \n\t\t Medline: 32380858 \n\t \n\t \n\t\t Eur J Cardiovasc Nurs \n\t\t \n\t\t\t 19 \n\t\t\t 6 \n\t\t\t \n\t\t\t 2020 Aug \n\t\t \n\t \n\t FREE Full text \n\t Neubeck L, Hansen T, Jaarsma T, Klompstra L, Gallagher R. Delivering healthcare remotely to cardiovascular patients during COVID-19: a rapid review of the evidence. Eur J Cardiovasc Nurs 2020 Aug;19(6):486-494 [FREE Full text] [doi: 10.1177/1474515120924530] [Medline: 32380858]"
    },
    {
      "title": "DiGA -a chance for the German healthcare system",
      "authors": [
        "S Sauermann",
        "J Herzberg",
        "S Burkert",
        "S Habetha"
      ],
      "year": 2022,
      "doi": "10.1080/21614083.2021.2014047",
      "journal": "J Eur CME",
      "volume": "11",
      "issue": "1",
      "pages": "2014047",
      "raw": "DiGA -a chance for the German healthcare system \n\t\t \n\t\t\t S Sauermann \n\t\t \n\t\t \n\t\t\t J Herzberg \n\t\t \n\t\t \n\t\t\t S Burkert \n\t\t \n\t\t \n\t\t\t S Habetha \n\t\t \n\t\t 10.1080/21614083.2021.2014047 \n\t\t Medline: 34992948 \n\t \n\t \n\t\t J Eur CME \n\t\t \n\t\t\t 11 \n\t\t\t 1 \n\t\t\t 2014047 \n\t\t\t 2022 Dec 23 \n\t\t \n\t \n\t FREE Full text \n\t Sauermann S, Herzberg J, Burkert S, Habetha S. DiGA -a chance for the German healthcare system. J Eur CME 2022 Dec 23;11(1):2014047 [FREE Full text] [doi: 10.1080/21614083.2021.2014047] [Medline: 34992948]"
    },
    {
      "title": "Digital health applications in oncology: an opportunity to seize",
      "authors": [
        "R Parikh",
        "K Basen-Enquist",
        "C Bradley",
        "D Estrin",
        "M Levy",
        "J Lichtenfeld"
      ],
      "year": 2022,
      "doi": "10.1093/jnci/djac108",
      "journal": "J Natl Cancer Inst",
      "volume": "114",
      "issue": "10",
      "raw": "Digital health applications in oncology: an opportunity to seize \n\t\t \n\t\t\t R B Parikh \n\t\t \n\t\t \n\t\t\t K M Basen-Enquist \n\t\t \n\t\t \n\t\t\t C Bradley \n\t\t \n\t\t \n\t\t\t D Estrin \n\t\t \n\t\t \n\t\t\t M Levy \n\t\t \n\t\t \n\t\t\t J L Lichtenfeld \n\t\t \n\t\t 10.1093/jnci/djac108 \n\t\t Medline: 35640986 \n\t \n\t \n\t\t J Natl Cancer Inst \n\t\t \n\t\t\t 114 \n\t\t\t 10 \n\t\t\t \n\t\t\t 2022 Oct 06 \n\t\t \n\t \n\t FREE Full text \n\t Parikh RB, Basen-Enquist KM, Bradley C, Estrin D, Levy M, Lichtenfeld JL, et al. Digital health applications in oncology: an opportunity to seize. J Natl Cancer Inst 2022 Oct 06;114(10):1338-1339 [FREE Full text] [doi: 10.1093/jnci/djac108] [Medline: 35640986]"
    },
    {
      "title": "Digitally driven integrated primary care and behavioral health: how technology can expand access to effective treatment",
      "authors": [
        "L Raney",
        "D Bergman",
        "J Torous",
        "M Hasselberg"
      ],
      "year": 2017,
      "doi": "10.1007/s11920-017-0838-y",
      "journal": "Curr Psychiatry Rep",
      "volume": "19",
      "issue": "11",
      "pages": "86",
      "raw": "Digitally driven integrated primary care and behavioral health: how technology can expand access to effective treatment \n\t\t \n\t\t\t L Raney \n\t\t \n\t\t \n\t\t\t D Bergman \n\t\t \n\t\t \n\t\t\t J Torous \n\t\t \n\t\t \n\t\t\t M Hasselberg \n\t\t \n\t\t 10.1007/s11920-017-0838-y \n\t\t Medline: 28965319 \n\t \n\t \n\t\t Curr Psychiatry Rep \n\t\t \n\t\t\t 19 \n\t\t\t 11 \n\t\t\t 86 \n\t\t\t 2017 Sep 30 \n\t\t \n\t \n\t Raney L, Bergman D, Torous J, Hasselberg M. Digitally driven integrated primary care and behavioral health: how technology can expand access to effective treatment. Curr Psychiatry Rep 2017 Sep 30;19(11):86 [doi: 10.1007/s11920-017-0838-y] [Medline: 28965319]"
    },
    {
      "title": "Establishing and governing e-Mental health care in Australia: a systematic review of challenges and a call for policy-focussed research",
      "authors": [
        "C Meurk",
        "J Leung",
        "W Hall",
        "B Head",
        "H Whiteford"
      ],
      "year": 2016,
      "doi": "10.2196/jmir.4827",
      "journal": "J Med Internet Res",
      "volume": "18",
      "issue": "1",
      "raw": "Establishing and governing e-Mental health care in Australia: a systematic review of challenges and a call for policy-focussed research \n\t\t \n\t\t\t C Meurk \n\t\t \n\t\t \n\t\t\t J Leung \n\t\t \n\t\t \n\t\t\t W Hall \n\t\t \n\t\t \n\t\t\t B W Head \n\t\t \n\t\t \n\t\t\t H Whiteford \n\t\t \n\t\t 10.2196/jmir.4827 \n\t\t Medline: 26764181 \n\t \n\t \n\t\t J Med Internet Res \n\t\t \n\t\t\t 18 \n\t\t\t 1 \n\t\t\t 2016 Jan 13 \n\t\t \n\t \n\t FREE Full text \n\t Meurk C, Leung J, Hall W, Head BW, Whiteford H. Establishing and governing e-Mental health care in Australia: a systematic review of challenges and a call for policy-focussed research. J Med Internet Res 2016 Jan 13;18(1):e10 [FREE Full text] [doi: 10.2196/jmir.4827] [Medline: 26764181]"
    },
    {
      "title": "Evaluating barriers to adopting telemedicine worldwide: a systematic review",
      "authors": [
        "Scott Kruse",
        "C Karem",
        "P Shifflett",
        "K Vegi",
        "L Ravi",
        "K Brooks"
      ],
      "year": 2018,
      "doi": "10.1177/1357633X16674087",
      "journal": "J Telemed Telecare",
      "volume": "24",
      "issue": "1",
      "raw": "Evaluating barriers to adopting telemedicine worldwide: a systematic review \n\t\t \n\t\t\t Scott Kruse \n\t\t \n\t\t \n\t\t\t C Karem \n\t\t \n\t\t \n\t\t\t P Shifflett \n\t\t \n\t\t \n\t\t\t K Vegi \n\t\t \n\t\t \n\t\t\t L Ravi \n\t\t \n\t\t \n\t\t\t K Brooks \n\t\t \n\t\t \n\t\t\t M \n\t\t \n\t\t 10.1177/1357633X16674087 \n\t\t Medline: 29320966 \n\t \n\t \n\t\t J Telemed Telecare \n\t\t \n\t\t\t 24 \n\t\t\t 1 \n\t\t\t \n\t\t\t 2018 Jan \n\t\t \n\t \n\t FREE Full text \n\t Scott Kruse C, Karem P, Shifflett K, Vegi L, Ravi K, Brooks M. Evaluating barriers to adopting telemedicine worldwide: a systematic review. J Telemed Telecare 2018 Jan;24(1):4-12 [FREE Full text] [doi: 10.1177/1357633X16674087] [Medline: 29320966]"
    },
    {
      "title": "Legal and regulatory issues with teledermatology",
      "authors": [
        "T Goodspeed",
        "R Page",
        "L Koman",
        "A Hollenbeck",
        "A Gilroy"
      ],
      "year": 2019,
      "doi": "10.1007/s13671-019-0254-0",
      "journal": "Curr Derm Rep",
      "volume": "8",
      "issue": "2",
      "raw": "Legal and regulatory issues with teledermatology \n\t\t \n\t\t\t T A Goodspeed \n\t\t \n\t\t \n\t\t\t R E Page \n\t\t \n\t\t \n\t\t\t L E Koman \n\t\t \n\t\t \n\t\t\t A T Hollenbeck \n\t\t \n\t\t \n\t\t\t A S Gilroy \n\t\t \n\t\t 10.1007/s13671-019-0254-0 \n\t \n\t \n\t\t Curr Derm Rep \n\t\t \n\t\t\t 8 \n\t\t\t 2 \n\t\t\t \n\t\t\t 2019 May 3 \n\t\t \n\t \n\t FREE Full text \n\t Goodspeed TA, Page RE, Koman LE, Hollenbeck AT, Gilroy AS. Legal and regulatory issues with teledermatology. Curr Derm Rep 2019 May 3;8(2):46-51 [FREE Full text] [doi: 10.1007/s13671-019-0254-0]"
    },
    {
      "title": "Performance-based risk-sharing arrangements for devices and procedures in cardiac electrophysiology: an innovative perspective",
      "authors": [
        "G Boriani",
        "M Vitolo",
        "E Svennberg",
        "R Casado-Arroyo",
        "J Merino",
        "C Leclercq"
      ],
      "year": 2022,
      "doi": "10.1093/europace/euac045",
      "journal": "Europace",
      "volume": "24",
      "issue": "10",
      "raw": "Performance-based risk-sharing arrangements for devices and procedures in cardiac electrophysiology: an innovative perspective \n\t\t \n\t\t\t G Boriani \n\t\t \n\t\t \n\t\t\t M Vitolo \n\t\t \n\t\t \n\t\t\t E Svennberg \n\t\t \n\t\t \n\t\t\t R Casado-Arroyo \n\t\t \n\t\t \n\t\t\t J L Merino \n\t\t \n\t\t \n\t\t\t C Leclercq \n\t\t \n\t\t 10.1093/europace/euac045 \n\t\t Medline: 35531864 \n\t \n\t \n\t\t Europace \n\t\t \n\t\t\t 24 \n\t\t\t 10 \n\t\t\t \n\t\t\t 2022 Oct 13 \n\t\t \n\t \n\t FREE Full text \n\t Boriani G, Vitolo M, Svennberg E, Casado-Arroyo R, Merino JL, Leclercq C. Performance-based risk-sharing arrangements for devices and procedures in cardiac electrophysiology: an innovative perspective. Europace 2022 Oct 13;24(10):1541-1547 [FREE Full text] [doi: 10.1093/europace/euac045] [Medline: 35531864]"
    },
    {
      "title": "Policy implications associated with the socioeconomic and health system impact of telehealth: a case study from Canada",
      "authors": [
        "P Jennett",
        "R Scott",
        "Affleck Hall",
        "L Hailey",
        "D Ohinmaa",
        "A Anderson"
      ],
      "year": 2004,
      "doi": "10.1089/153056204773644616",
      "journal": "Telemed J E Health",
      "volume": "10",
      "issue": "1",
      "raw": "Policy implications associated with the socioeconomic and health system impact of telehealth: a case study from Canada \n\t\t \n\t\t\t P A Jennett \n\t\t \n\t\t \n\t\t\t R E Scott \n\t\t \n\t\t \n\t\t\t Affleck Hall \n\t\t \n\t\t \n\t\t\t L Hailey \n\t\t \n\t\t \n\t\t\t D Ohinmaa \n\t\t \n\t\t \n\t\t\t A Anderson \n\t\t \n\t\t \n\t\t\t C \n\t\t \n\t\t 10.1089/153056204773644616 \n\t\t Medline: 15104919 \n\t \n\t \n\t\t Telemed J E Health \n\t\t \n\t\t\t 10 \n\t\t\t 1 \n\t\t\t \n\t\t\t 2004 \n\t\t \n\t \n\t Jennett PA, Scott RE, Affleck Hall L, Hailey D, Ohinmaa A, Anderson C, et al. Policy implications associated with the socioeconomic and health system impact of telehealth: a case study from Canada. Telemed J E Health 2004;10(1):77-83 [doi: 10.1089/153056204773644616] [Medline: 15104919]"
    },
    {
      "title": "mHealth in low-and middle-income countries: status, requirements and strategies",
      "authors": [
        "D Lop\u00e9z",
        "B Blobel"
      ],
      "year": 2015,
      "journal": "Stud Health Technol Inform",
      "volume": "211",
      "raw": "mHealth in low-and middle-income countries: status, requirements and strategies \n\t\t \n\t\t\t D M Lop\u00e9z \n\t\t \n\t\t \n\t\t\t B Blobel \n\t\t \n\t\t Medline: 25980851 \n\t \n\t \n\t\t Stud Health Technol Inform \n\t\t \n\t\t\t 211 \n\t\t\t \n\t\t\t 2015 \n\t\t \n\t \n\t Lop\u00e9z DM, Blobel B. mHealth in low-and middle-income countries: status, requirements and strategies. Stud Health Technol Inform 2015;211:79-87 [Medline: 25980851]"
    },
    {
      "title": "Telemedicine, telehealth, and mobile health applications that work: opportunities and barriers",
      "authors": [
        "R Weinstein",
        "A Lopez",
        "B Joseph",
        "K Erps",
        "M Holcomb",
        "G Barker"
      ],
      "year": 2014,
      "doi": "10.1016/j.amjmed.2013.09.032",
      "journal": "Am J Med",
      "volume": "127",
      "issue": "3",
      "raw": "Telemedicine, telehealth, and mobile health applications that work: opportunities and barriers \n\t\t \n\t\t\t R S Weinstein \n\t\t \n\t\t \n\t\t\t A M Lopez \n\t\t \n\t\t \n\t\t\t B A Joseph \n\t\t \n\t\t \n\t\t\t K A Erps \n\t\t \n\t\t \n\t\t\t M Holcomb \n\t\t \n\t\t \n\t\t\t G P Barker \n\t\t \n\t\t 10.1016/j.amjmed.2013.09.032 \n\t\t Medline: 24384059 \n\t \n\t \n\t\t Am J Med \n\t\t \n\t\t\t 127 \n\t\t\t 3 \n\t\t\t \n\t\t\t 2014 Mar \n\t\t \n\t \n\t Weinstein RS, Lopez AM, Joseph BA, Erps KA, Holcomb M, Barker GP, et al. Telemedicine, telehealth, and mobile health applications that work: opportunities and barriers. Am J Med 2014 Mar;127(3):183-187 [doi: 10.1016/j.amjmed.2013.09.032] [Medline: 24384059]"
    },
    {
      "title": "The first software as medical device of evidence-based hypertension digital therapeutics for clinical practice",
      "authors": [
        "K Kario",
        "N Harada",
        "A Okura"
      ],
      "year": 2022,
      "doi": "10.1038/s41440-022-01016-w",
      "journal": "Hypertens Res",
      "volume": "45",
      "issue": "12",
      "raw": "The first software as medical device of evidence-based hypertension digital therapeutics for clinical practice \n\t\t \n\t\t\t K Kario \n\t\t \n\t\t \n\t\t\t N Harada \n\t\t \n\t\t \n\t\t\t A Okura \n\t\t \n\t\t 10.1038/s41440-022-01016-w \n\t\t Medline: 36207530 \n\t \n\t \n\t\t Hypertens Res \n\t\t \n\t\t\t 45 \n\t\t\t 12 \n\t\t\t \n\t\t\t 2022 Dec \n\t\t \n\t \n\t FREE Full text \n\t Kario K, Harada N, Okura A. The first software as medical device of evidence-based hypertension digital therapeutics for clinical practice. Hypertens Res 2022 Dec;45(12):1899-1905 [FREE Full text] [doi: 10.1038/s41440-022-01016-w] [Medline: 36207530]"
    },
    {
      "title": "The digital revolution in behavioral health",
      "authors": [
        "M Hasselberg"
      ],
      "year": 2020,
      "doi": "10.1177/1078390319879750",
      "journal": "J Am Psychiatr Nurses Assoc",
      "volume": "26",
      "issue": "1",
      "raw": "The digital revolution in behavioral health \n\t\t \n\t\t\t M J Hasselberg \n\t\t \n\t\t 10.1177/1078390319879750 \n\t\t Medline: 31587624 \n\t \n\t \n\t\t J Am Psychiatr Nurses Assoc \n\t\t \n\t\t\t 26 \n\t\t\t 1 \n\t\t\t \n\t\t\t 2020 Jan \n\t\t \n\t \n\t Hasselberg MJ. The digital revolution in behavioral health. J Am Psychiatr Nurses Assoc 2020 Jan;26(1):102-111 [doi: 10.1177/1078390319879750] [Medline: 31587624]"
    },
    {
      "title": "The promise of e-Health -a Canadian perspective",
      "authors": [
        "R Alvarez"
      ],
      "year": 2002,
      "doi": "10.1186/1476-3591-1-4",
      "journal": "eHealth Int",
      "volume": "1",
      "issue": "1",
      "pages": "4",
      "raw": "The promise of e-Health -a Canadian perspective \n\t\t \n\t\t\t R C Alvarez \n\t\t \n\t\t 10.1186/1476-3591-1-4 \n\t\t Medline: 12459044 \n\t \n\t \n\t\t eHealth Int \n\t\t \n\t\t\t 1 \n\t\t\t 1 \n\t\t\t 4 \n\t\t\t 2002 Sep 17 \n\t\t \n\t \n\t FREE Full text \n\t Alvarez RC. The promise of e-Health -a Canadian perspective. eHealth Int 2002 Sep 17;1(1):4 [FREE Full text] [doi: 10.1186/1476-3591-1-4] [Medline: 12459044]"
    },
    {
      "title": "The role of digital strategies in financing health care for universal health coverage in low-and middle-income countries",
      "authors": [
        "B Meessen"
      ],
      "year": 2018,
      "doi": "10.9745/GHSP-D-18-00271",
      "journal": "Glob Health Sci Pract",
      "volume": "6",
      "issue": "Suppl 1",
      "raw": "The role of digital strategies in financing health care for universal health coverage in low-and middle-income countries \n\t\t \n\t\t\t B Meessen \n\t\t \n\t\t 10.9745/GHSP-D-18-00271 \n\t\t Medline: 30305337 \n\t \n\t \n\t\t Glob Health Sci Pract \n\t\t \n\t\t\t 6 \n\t\t\t Suppl 1 \n\t\t\t \n\t\t\t 2018 Oct 10 \n\t\t \n\t \n\t FREE Full text \n\t Meessen B. The role of digital strategies in financing health care for universal health coverage in low-and middle-income countries. Glob Health Sci Pract 2018 Oct 10;6(Suppl 1):S29-S40 [FREE Full text] [doi: 10.9745/GHSP-D-18-00271] [Medline: 30305337]"
    },
    {
      "title": "The willingness to pay for telemedicine among patients with chronic diseases: systematic review",
      "authors": [
        "V Chua",
        "J Koh",
        "C Koh",
        "S Tyagi"
      ],
      "year": 2022,
      "doi": "10.2196/33372",
      "journal": "J Med Internet Res",
      "volume": "24",
      "issue": "4",
      "pages": "33372",
      "raw": "The willingness to pay for telemedicine among patients with chronic diseases: systematic review \n\t\t \n\t\t\t V Chua \n\t\t \n\t\t \n\t\t\t J H Koh \n\t\t \n\t\t \n\t\t\t C H Koh \n\t\t \n\t\t \n\t\t\t S Tyagi \n\t\t \n\t\t 10.2196/33372 \n\t\t Medline: 35416779 \n\t \n\t \n\t\t J Med Internet Res \n\t\t \n\t\t\t 24 \n\t\t\t 4 \n\t\t\t 33372 \n\t\t\t 2022 Apr 13 \n\t\t \n\t \n\t FREE Full text \n\t Chua V, Koh JH, Koh CH, Tyagi S. The willingness to pay for telemedicine among patients with chronic diseases: systematic review. J Med Internet Res 2022 Apr 13;24(4):e33372 [FREE Full text] [doi: 10.2196/33372] [Medline: 35416779]"
    },
    {
      "title": "Routine Health Information System (RHIS) improvements for strengthened health system management",
      "authors": [
        "N Leon",
        "Y Balakrishna",
        "A Hohlfeld",
        "W Odendaal",
        "B Schmidt",
        "V Zweigenthal"
      ],
      "year": 2020,
      "doi": "10.1002/14651858.CD012012.pub2",
      "journal": "Cochrane Database Syst Rev",
      "volume": "8",
      "issue": "8",
      "pages": "12012",
      "raw": "Routine Health Information System (RHIS) improvements for strengthened health system management \n\t\t \n\t\t\t N Leon \n\t\t \n\t\t \n\t\t\t Y Balakrishna \n\t\t \n\t\t \n\t\t\t A Hohlfeld \n\t\t \n\t\t \n\t\t\t W A Odendaal \n\t\t \n\t\t \n\t\t\t B M Schmidt \n\t\t \n\t\t \n\t\t\t V Zweigenthal \n\t\t \n\t\t 10.1002/14651858.CD012012.pub2 \n\t\t Medline: 32803893 \n\t \n\t \n\t\t Cochrane Database Syst Rev \n\t\t \n\t\t\t 8 \n\t\t\t 8 \n\t\t\t 12012 \n\t\t\t 2020 Aug 13 \n\t\t \n\t \n\t FREE Full text \n\t Leon N, Balakrishna Y, Hohlfeld A, Odendaal WA, Schmidt BM, Zweigenthal V, et al. Routine Health Information System (RHIS) improvements for strengthened health system management. Cochrane Database Syst Rev 2020 Aug 13;8(8):CD012012 [FREE Full text] [doi: 10.1002/14651858.CD012012.pub2] [Medline: 32803893]"
    },
    {
      "title": "Digi-HTA: health technology assessment framework for digital healthcare services",
      "authors": [
        "J Haverinen",
        "N Ker\u00e4nen",
        "P Falkenbach",
        "A Maijala",
        "T Kolehmainen",
        "J Reponen"
      ],
      "year": 2019,
      "doi": "10.23996/fjhw.82538",
      "journal": "FinJeHeW",
      "volume": "11",
      "issue": "4",
      "raw": "Digi-HTA: health technology assessment framework for digital healthcare services \n\t\t \n\t\t\t J Haverinen \n\t\t \n\t\t \n\t\t\t N Ker\u00e4nen \n\t\t \n\t\t \n\t\t\t P Falkenbach \n\t\t \n\t\t \n\t\t\t A Maijala \n\t\t \n\t\t \n\t\t\t T Kolehmainen \n\t\t \n\t\t \n\t\t\t J Reponen \n\t\t \n\t\t 10.23996/fjhw.82538 \n\t \n\t \n\t\t FinJeHeW \n\t\t \n\t\t\t 11 \n\t\t\t 4 \n\t\t\t \n\t\t\t 2019 Nov 02 \n\t\t \n\t \n\t FREE Full text \n\t Haverinen J, Ker\u00e4nen N, Falkenbach P, Maijala A, Kolehmainen T, Reponen J. Digi-HTA: health technology assessment framework for digital healthcare services. FinJeHeW 2019 Nov 02;11(4):326-341 [FREE Full text] [doi: 10.23996/fjhw.82538]"
    },
    {
      "title": "A review of patient satisfaction and experience with telemedicine: a virtual solution during and beyond COVID-19 pandemic",
      "authors": [
        "M Nanda",
        "R Sharma"
      ],
      "year": 2021,
      "doi": "10.1089/tmj.2020.0570",
      "journal": "Telemed J E Health",
      "volume": "27",
      "issue": "12",
      "raw": "A review of patient satisfaction and experience with telemedicine: a virtual solution during and beyond COVID-19 pandemic \n\t\t \n\t\t\t M Nanda \n\t\t \n\t\t \n\t\t\t R Sharma \n\t\t \n\t\t 10.1089/tmj.2020.0570 \n\t\t Medline: 33719577 \n\t \n\t \n\t\t Telemed J E Health \n\t\t \n\t\t\t 27 \n\t\t\t 12 \n\t\t\t \n\t\t\t 2021 Dec \n\t\t \n\t \n\t Nanda M, Sharma R. A review of patient satisfaction and experience with telemedicine: a virtual solution during and beyond COVID-19 pandemic. Telemed J E Health 2021 Dec;27(12):1325-1331 [doi: 10.1089/tmj.2020.0570] [Medline: 33719577]"
    },
    {
      "title": "Digital therapeutics in neurology",
      "authors": [
        "G Abbadessa",
        "F Brigo",
        "M Clerico",
        "De Mercanti",
        "S Trojsi",
        "F Tedeschi"
      ],
      "year": 2022,
      "doi": "10.1007/s00415-021-10608-4",
      "journal": "J Neurol",
      "volume": "269",
      "issue": "3",
      "raw": "Digital therapeutics in neurology \n\t\t \n\t\t\t G Abbadessa \n\t\t \n\t\t \n\t\t\t F Brigo \n\t\t \n\t\t \n\t\t\t M Clerico \n\t\t \n\t\t \n\t\t\t De Mercanti \n\t\t \n\t\t \n\t\t\t S Trojsi \n\t\t \n\t\t \n\t\t\t F Tedeschi \n\t\t \n\t\t \n\t\t\t G \n\t\t \n\t\t 10.1007/s00415-021-10608-4 \n\t\t Medline: 34018047 \n\t \n\t \n\t\t J Neurol \n\t\t \n\t\t\t 269 \n\t\t\t 3 \n\t\t\t \n\t\t\t 2022 Mar \n\t\t \n\t \n\t FREE Full text \n\t Abbadessa G, Brigo F, Clerico M, De Mercanti S, Trojsi F, Tedeschi G, et al. Digital therapeutics in neurology. J Neurol 2022 Mar;269(3):1209-1224 [FREE Full text] [doi: 10.1007/s00415-021-10608-4] [Medline: 34018047]"
    },
    {
      "title": "Compassionate nursing care and the use of digital health technologies: a scoping review",
      "authors": [
        "S Ali",
        "M Kleib",
        "P Paul",
        "O Petrovskaya",
        "M Kennedy"
      ],
      "year": 2022,
      "doi": "10.1016/j.ijnurstu.2021.104161",
      "journal": "Int J Nurs Stud",
      "volume": "127",
      "pages": "104161",
      "raw": "Compassionate nursing care and the use of digital health technologies: a scoping review \n\t\t \n\t\t\t S Ali \n\t\t \n\t\t \n\t\t\t M Kleib \n\t\t \n\t\t \n\t\t\t P Paul \n\t\t \n\t\t \n\t\t\t O Petrovskaya \n\t\t \n\t\t \n\t\t\t M Kennedy \n\t\t \n\t\t 10.1016/j.ijnurstu.2021.104161 \n\t\t Medline: 35032743 \n\t \n\t \n\t\t Int J Nurs Stud \n\t\t \n\t\t\t 127 \n\t\t\t 104161 \n\t\t\t 2022 Mar \n\t\t \n\t \n\t Ali S, Kleib M, Paul P, Petrovskaya O, Kennedy M. Compassionate nursing care and the use of digital health technologies: a scoping review. Int J Nurs Stud 2022 Mar;127:104161 [doi: 10.1016/j.ijnurstu.2021.104161] [Medline: 35032743]"
    },
    {
      "title": "Does deidentification of data from wearable devices give us a false sense of security? A systematic review",
      "authors": [
        "L Chikwetu",
        "Y Miao",
        "M Woldetensae",
        "D Bell",
        "D Goldenholz",
        "J Dunn"
      ],
      "year": 2023,
      "doi": "10.1016/s2589-7500(22)00234-5",
      "journal": "Lancet Digit Health",
      "volume": "5",
      "issue": "4",
      "raw": "Does deidentification of data from wearable devices give us a false sense of security? A systematic review \n\t\t \n\t\t\t L Chikwetu \n\t\t \n\t\t \n\t\t\t Y Miao \n\t\t \n\t\t \n\t\t\t M K Woldetensae \n\t\t \n\t\t \n\t\t\t D Bell \n\t\t \n\t\t \n\t\t\t D M Goldenholz \n\t\t \n\t\t \n\t\t\t J Dunn \n\t\t \n\t\t 10.1016/s2589-7500(22)00234-5 \n\t\t Medline: 36797124 \n\t \n\t \n\t\t Lancet Digit Health \n\t\t \n\t\t\t 5 \n\t\t\t 4 \n\t\t\t \n\t\t\t 2023 Apr \n\t\t \n\t \n\t FREE Full text \n\t Chikwetu L, Miao Y, Woldetensae MK, Bell D, Goldenholz DM, Dunn J. Does deidentification of data from wearable devices give us a false sense of security? A systematic review. Lancet Digit Health 2023 Apr;5(4):e239-e247 [FREE Full text] [doi: 10.1016/S2589-7500(22)00234-5] [Medline: 36797124]"
    },
    {
      "title": "Role of telemedicine in the management of oral anticoagulation in atrial fibrillation: a practical clinical approach",
      "authors": [
        "V Barrios",
        "S Cinza-Sanjurjo",
        "J Garc\u00eda-Alegr\u00eda",
        "R Freixa-Pamias",
        "F Llordachs-Marques",
        "C Molina"
      ],
      "year": 2022,
      "doi": "10.2217/fca-2022-0044",
      "journal": "Future Cardiol",
      "volume": "18",
      "issue": "9",
      "raw": "Role of telemedicine in the management of oral anticoagulation in atrial fibrillation: a practical clinical approach \n\t\t \n\t\t\t V Barrios \n\t\t \n\t\t \n\t\t\t S Cinza-Sanjurjo \n\t\t \n\t\t \n\t\t\t J Garc\u00eda-Alegr\u00eda \n\t\t \n\t\t \n\t\t\t R Freixa-Pamias \n\t\t \n\t\t \n\t\t\t F Llordachs-Marques \n\t\t \n\t\t \n\t\t\t C A Molina \n\t\t \n\t\t 10.2217/fca-2022-0044 \n\t\t Medline: 35822847 \n\t \n\t \n\t\t Future Cardiol \n\t\t \n\t\t\t 18 \n\t\t\t 9 \n\t\t\t \n\t\t\t 2022 Sep \n\t\t \n\t \n\t FREE Full text \n\t Barrios V, Cinza-Sanjurjo S, Garc\u00eda-Alegr\u00eda J, Freixa-Pamias R, Llordachs-Marques F, Molina CA, et al. Role of telemedicine in the management of oral anticoagulation in atrial fibrillation: a practical clinical approach. Future Cardiol 2022 Sep;18(9):743-754 [FREE Full text] [doi: 10.2217/fca-2022-0044] [Medline: 35822847]"
    },
    {
      "title": "Digital communication in visceral medicine: regulatory framework for digital communication",
      "authors": [
        "F Burg",
        "A Pscherer",
        "O Opitz"
      ],
      "year": 2021,
      "doi": "10.1159/000519359",
      "journal": "Visc Med",
      "volume": "96",
      "issue": "6",
      "raw": "Digital communication in visceral medicine: regulatory framework for digital communication \n\t\t \n\t\t\t F Burg \n\t\t \n\t\t \n\t\t\t A Pscherer \n\t\t \n\t\t \n\t\t\t O G Opitz \n\t\t \n\t\t 10.1159/000519359 \n\t\t Medline: 34934767 \n\t \n\t \n\t\t Visc Med \n\t\t \n\t\t\t 96 \n\t\t\t 6 \n\t\t\t \n\t\t\t 2021 Oct 20 \n\t\t \n\t \n\t FREE Full text \n\t Burg F, Pscherer A, Opitz OG. Digital communication in visceral medicine: regulatory framework for digital communication. Visc Med 2021 Oct 20;96(6):1-7 [FREE Full text] [doi: 10.1159/000519359] [Medline: 34934767]"
    },
    {
      "title": "The pediatric cancer survivors' user experiences with digital health interventions: a systematic review of qualitative data",
      "authors": [
        "L Cheng",
        "F Liu",
        "X Mao",
        "W Peng",
        "Y Wang",
        "H Huang"
      ],
      "year": 2022,
      "doi": "10.1097/ncc.0000000000000885",
      "journal": "Cancer Nurs",
      "volume": "45",
      "issue": "1",
      "raw": "The pediatric cancer survivors' user experiences with digital health interventions: a systematic review of qualitative data \n\t\t \n\t\t\t L Cheng \n\t\t \n\t\t \n\t\t\t F Liu \n\t\t \n\t\t \n\t\t\t X Mao \n\t\t \n\t\t \n\t\t\t W Peng \n\t\t \n\t\t \n\t\t\t Y Wang \n\t\t \n\t\t \n\t\t\t H Huang \n\t\t \n\t\t 10.1097/ncc.0000000000000885 \n\t\t Medline: 34870939 \n\t \n\t \n\t\t Cancer Nurs \n\t\t \n\t\t\t 45 \n\t\t\t 1 \n\t\t\t \n\t\t\t 2022 Jan \n\t\t \n\t \n\t Cheng L, Liu F, Mao X, Peng W, Wang Y, Huang H, et al. The pediatric cancer survivors' user experiences with digital health interventions: a systematic review of qualitative data. Cancer Nurs 2022 Jan;45(1):E68-E82 [doi: 10.1097/NCC.0000000000000885] [Medline: 34870939]"
    },
    {
      "title": "Free interactive counselling program in a mobile communication application for improving health education on indwelling ureteric stents after ureterorenoscopic lithotripsy: an observational study",
      "authors": [
        "T Chuang",
        "W Cheng",
        "Y Chiu",
        "Y Fan",
        "C Chi",
        "C Chang"
      ],
      "year": 2022,
      "doi": "10.1177/20552076221117754",
      "journal": "Digit Health",
      "volume": "8",
      "pages": "20552076221117754",
      "raw": "Free interactive counselling program in a mobile communication application for improving health education on indwelling ureteric stents after ureterorenoscopic lithotripsy: an observational study \n\t\t \n\t\t\t T Y Chuang \n\t\t \n\t\t \n\t\t\t W Cheng \n\t\t \n\t\t \n\t\t\t Y C Chiu \n\t\t \n\t\t \n\t\t\t Y H Fan \n\t\t \n\t\t \n\t\t\t C C Chi \n\t\t \n\t\t \n\t\t\t C C Chang \n\t\t \n\t\t 10.1177/20552076221117754 \n\t\t Medline: 35959198 \n\t \n\t \n\t\t Digit Health \n\t\t \n\t\t\t 8 \n\t\t\t 20552076221117754 \n\t\t\t 2022 Aug 04 \n\t\t \n\t \n\t FREE Full text \n\t Chuang TY, Cheng W, Chiu YC, Fan YH, Chi CC, Chang CC, et al. Free interactive counselling program in a mobile communication application for improving health education on indwelling ureteric stents after ureterorenoscopic lithotripsy: an observational study. Digit Health 2022 Aug 04;8:20552076221117754 [FREE Full text] [doi: 10.1177/20552076221117754] [Medline: 35959198]"
    },
    {
      "title": "Mobile health as a primary mode of intervention for women at risk of or diagnosed with gestational diabetes mellitus: a scoping review",
      "authors": [
        "K Edwards",
        "K Maslin",
        "J Andrade",
        "R Jones",
        "J Shawe"
      ],
      "year": 2022,
      "doi": "10.11124/JBIES-21-00294",
      "journal": "JBI Evid Synth",
      "volume": "20",
      "issue": "9",
      "raw": "Mobile health as a primary mode of intervention for women at risk of or diagnosed with gestational diabetes mellitus: a scoping review \n\t\t \n\t\t\t K J Edwards \n\t\t \n\t\t \n\t\t\t K Maslin \n\t\t \n\t\t \n\t\t\t J Andrade \n\t\t \n\t\t \n\t\t\t R B Jones \n\t\t \n\t\t \n\t\t\t J Shawe \n\t\t \n\t\t 10.11124/JBIES-21-00294 \n\t\t Medline: 35152244 \n\t \n\t \n\t\t JBI Evid Synth \n\t\t \n\t\t\t 20 \n\t\t\t 9 \n\t\t\t \n\t\t\t 2022 Sep 01 \n\t\t \n\t \n\t Edwards KJ, Maslin K, Andrade J, Jones RB, Shawe J. Mobile health as a primary mode of intervention for women at risk of or diagnosed with gestational diabetes mellitus: a scoping review. JBI Evid Synth 2022 Sep 01;20(9):2195-2243 [doi: 10.11124/JBIES-21-00294] [Medline: 35152244]"
    },
    {
      "title": "A systematic review of mHealth application interventions for peripartum mood disorders: trends and evidence in academia and industry",
      "authors": [
        "N Feldman",
        "D Back",
        "R Boland",
        "J Torous"
      ],
      "year": 2021,
      "doi": "10.1007/s00737-021-01138-z",
      "journal": "Arch Womens Ment Health",
      "volume": "24",
      "issue": "6",
      "raw": "A systematic review of mHealth application interventions for peripartum mood disorders: trends and evidence in academia and industry \n\t\t \n\t\t\t N Feldman \n\t\t \n\t\t \n\t\t\t D Back \n\t\t \n\t\t \n\t\t\t R Boland \n\t\t \n\t\t \n\t\t\t J Torous \n\t\t \n\t\t 10.1007/s00737-021-01138-z \n\t\t Medline: 33929636 \n\t \n\t \n\t\t Arch Womens Ment Health \n\t\t \n\t\t\t 24 \n\t\t\t 6 \n\t\t\t \n\t\t\t 2021 Dec \n\t\t \n\t \n\t FREE Full text \n\t Feldman N, Back D, Boland R, Torous J. A systematic review of mHealth application interventions for peripartum mood disorders: trends and evidence in academia and industry. Arch Womens Ment Health 2021 Dec;24(6):881-892 [FREE Full text] [doi: 10.1007/s00737-021-01138-z] [Medline: 33929636]"
    },
    {
      "title": "A telehealth and telepsychiatry economic cost analysis framework: scoping review",
      "authors": [
        "D Hilty",
        "E Serhal",
        "A Crawford"
      ],
      "year": 2023,
      "doi": "10.1089/tmj.2022.0016",
      "journal": "Telemed J E Health",
      "volume": "29",
      "issue": "1",
      "raw": "A telehealth and telepsychiatry economic cost analysis framework: scoping review \n\t\t \n\t\t\t D M Hilty \n\t\t \n\t\t \n\t\t\t E Serhal \n\t\t \n\t\t \n\t\t\t A Crawford \n\t\t \n\t\t 10.1089/tmj.2022.0016 \n\t\t Medline: 35639444 \n\t \n\t \n\t\t Telemed J E Health \n\t\t \n\t\t\t 29 \n\t\t\t 1 \n\t\t\t \n\t\t\t 2023 Jan \n\t\t \n\t \n\t Hilty DM, Serhal E, Crawford A. A telehealth and telepsychiatry economic cost analysis framework: scoping review. Telemed J E Health 2023 Jan;29(1):23-37 [doi: 10.1089/tmj.2022.0016] [Medline: 35639444]"
    },
    {
      "title": "Telemedicine guidelines in South East Asia-a scoping review",
      "authors": [
        "Intan Sabrina",
        "M Defi"
      ],
      "year": 2020,
      "doi": "10.3389/fneur.2020.581649",
      "journal": "Front Neurol",
      "volume": "11",
      "pages": "581649",
      "raw": "Telemedicine guidelines in South East Asia-a scoping review \n\t\t \n\t\t\t Intan Sabrina \n\t\t \n\t\t \n\t\t\t M Defi \n\t\t \n\t\t \n\t\t\t I R \n\t\t \n\t\t 10.3389/fneur.2020.581649 \n\t\t Medline: 33519669 \n\t \n\t \n\t\t Front Neurol \n\t\t \n\t\t\t 11 \n\t\t\t 581649 \n\t\t\t 2020 Jan 13 \n\t\t \n\t \n\t FREE Full text \n\t Intan Sabrina M, Defi IR. Telemedicine guidelines in South East Asia-a scoping review. Front Neurol 2020 Jan 13;11:581649 [FREE Full text] [doi: 10.3389/fneur.2020.581649] [Medline: 33519669]"
    },
    {
      "title": "Virtual trauma-focused therapy for military members, veterans, and public safety personnel with posttraumatic stress injury: systematic scoping review",
      "authors": [
        "C Jones",
        "A Miguel-Cruz",
        "L Smith-Macdonald",
        "E Cruikshank",
        "D Baghoori",
        "Kaur Chohan"
      ],
      "year": 2020,
      "doi": "10.2196/22079",
      "journal": "JMIR Mhealth Uhealth",
      "volume": "8",
      "issue": "9",
      "pages": "e22079",
      "raw": "Virtual trauma-focused therapy for military members, veterans, and public safety personnel with posttraumatic stress injury: systematic scoping review \n\t\t \n\t\t\t C Jones \n\t\t \n\t\t \n\t\t\t A Miguel-Cruz \n\t\t \n\t\t \n\t\t\t L Smith-Macdonald \n\t\t \n\t\t \n\t\t\t E Cruikshank \n\t\t \n\t\t \n\t\t\t D Baghoori \n\t\t \n\t\t \n\t\t\t Kaur Chohan \n\t\t \n\t\t \n\t\t\t A \n\t\t \n\t\t 10.2196/22079 \n\t\t Medline: 32955456 \n\t \n\t \n\t\t JMIR Mhealth Uhealth \n\t\t \n\t\t\t 8 \n\t\t\t 9 \n\t\t\t e22079 \n\t\t\t 2020 Sep 21 \n\t\t \n\t \n\t FREE Full text \n\t Jones C, Miguel-Cruz A, Smith-MacDonald L, Cruikshank E, Baghoori D, Kaur Chohan A, et al. Virtual trauma-focused therapy for military members, veterans, and public safety personnel with posttraumatic stress injury: systematic scoping review. JMIR Mhealth Uhealth 2020 Sep 21;8(9):e22079 [FREE Full text] [doi: 10.2196/22079] [Medline: 32955456]"
    },
    {
      "title": "mHealth and telemedicine utility in the monitoring of allergic diseases",
      "authors": [
        "Kvedarien\u0117 Burzdikait\u0117",
        "P \u010cesnavi\u010di\u016bt\u0117"
      ],
      "year": 2022,
      "doi": "10.3389/falgy.2022.919746",
      "journal": "Front Allergy",
      "volume": "3",
      "pages": "919746",
      "raw": "mHealth and telemedicine utility in the monitoring of allergic diseases \n\t\t \n\t\t\t Kvedarien\u0117 Burzdikait\u0117 \n\t\t \n\t\t \n\t\t\t P \u010cesnavi\u010di\u016bt\u0117 \n\t\t \n\t\t \n\t\t\t I \n\t\t \n\t\t 10.3389/falgy.2022.919746 \n\t\t Medline: 36118170 \n\t \n\t \n\t\t Front Allergy \n\t\t \n\t\t\t 3 \n\t\t\t 919746 \n\t\t\t 2022 Sep 02 \n\t\t \n\t \n\t FREE Full text \n\t Kvedarien\u0117 Burzdikait\u0117 P, \u010cesnavi\u010di\u016bt\u0117 I. mHealth and telemedicine utility in the monitoring of allergic diseases. Front Allergy 2022 Sep 02;3:919746 [FREE Full text] [doi: 10.3389/falgy.2022.919746] [Medline: 36118170]"
    },
    {
      "title": "Health workers' perceptions and experiences of using mHealth technologies to deliver primary healthcare services: a qualitative evidence synthesis",
      "authors": [
        "W Odendaal",
        "Anstey Watkins",
        "J Leon",
        "N Goudge",
        "J Griffiths",
        "F Tomlinson"
      ],
      "year": 2020,
      "doi": "10.1002/14651858.CD011942.pub2",
      "journal": "Cochrane Database Syst Rev",
      "volume": "3",
      "issue": "3",
      "pages": "11942",
      "raw": "Health workers' perceptions and experiences of using mHealth technologies to deliver primary healthcare services: a qualitative evidence synthesis \n\t\t \n\t\t\t W A Odendaal \n\t\t \n\t\t \n\t\t\t Anstey Watkins \n\t\t \n\t\t \n\t\t\t J Leon \n\t\t \n\t\t \n\t\t\t N Goudge \n\t\t \n\t\t \n\t\t\t J Griffiths \n\t\t \n\t\t \n\t\t\t F Tomlinson \n\t\t \n\t\t \n\t\t\t M \n\t\t \n\t\t 10.1002/14651858.CD011942.pub2 \n\t\t Medline: 32216074 \n\t \n\t \n\t\t Cochrane Database Syst Rev \n\t\t \n\t\t\t 3 \n\t\t\t 3 \n\t\t\t 11942 \n\t\t\t 2020 Mar 26 \n\t\t \n\t \n\t FREE Full text \n\t Odendaal WA, Anstey Watkins J, Leon N, Goudge J, Griffiths F, Tomlinson M, et al. Health workers' perceptions and experiences of using mHealth technologies to deliver primary healthcare services: a qualitative evidence synthesis. Cochrane Database Syst Rev 2020 Mar 26;3(3):CD011942 [FREE Full text] [doi: 10.1002/14651858.CD011942.pub2] [Medline: 32216074]"
    },
    {
      "title": "mHealth for transgender and gender-expansive youth: harnessing gender-affirmative cross-disciplinary innovations to advance HIV prevention and care interventions",
      "authors": [
        "S Skeen",
        "D Cain",
        "K Gamarel",
        "L Hightow-Weidman",
        "C Reback"
      ],
      "year": 2021,
      "doi": "10.21037/mhealth-20-60",
      "journal": "Mhealth",
      "volume": "7",
      "pages": "37",
      "raw": "mHealth for transgender and gender-expansive youth: harnessing gender-affirmative cross-disciplinary innovations to advance HIV prevention and care interventions \n\t\t \n\t\t\t S J Skeen \n\t\t \n\t\t \n\t\t\t D Cain \n\t\t \n\t\t \n\t\t\t K E Gamarel \n\t\t \n\t\t \n\t\t\t L Hightow-Weidman \n\t\t \n\t\t \n\t\t\t C J Reback \n\t\t \n\t\t 10.21037/mhealth-20-60 \n\t\t Medline: 33898606 \n\t \n\t \n\t\t Mhealth \n\t\t \n\t\t\t 7 \n\t\t\t 37 \n\t\t\t 2021 Apr 20 \n\t\t \n\t \n\t FREE Full text \n\t Skeen SJ, Cain D, Gamarel KE, Hightow-Weidman L, Reback CJ. mHealth for transgender and gender-expansive youth: harnessing gender-affirmative cross-disciplinary innovations to advance HIV prevention and care interventions. Mhealth 2021 Apr 20;7:37 [FREE Full text] [doi: 10.21037/mhealth-20-60] [Medline: 33898606]"
    },
    {
      "title": "Telemedicine and pancreatic cancer: a systematic review",
      "authors": [
        "M Tripepi",
        "E Pizzocaro",
        "A Giardino",
        "I Frigerio",
        "A Guglielmi",
        "G Butturini"
      ],
      "year": 2023,
      "doi": "10.1089/tmj.2022.0140",
      "journal": "Telemed J E Health",
      "volume": "29",
      "issue": "3",
      "raw": "Telemedicine and pancreatic cancer: a systematic review \n\t\t \n\t\t\t M Tripepi \n\t\t \n\t\t \n\t\t\t E Pizzocaro \n\t\t \n\t\t \n\t\t\t A Giardino \n\t\t \n\t\t \n\t\t\t I Frigerio \n\t\t \n\t\t \n\t\t\t A Guglielmi \n\t\t \n\t\t \n\t\t\t G Butturini \n\t\t \n\t\t 10.1089/tmj.2022.0140 \n\t\t Medline: 35861761 \n\t \n\t \n\t\t Telemed J E Health \n\t\t \n\t\t\t 29 \n\t\t\t 3 \n\t\t\t \n\t\t\t 2023 Mar \n\t\t \n\t \n\t Tripepi M, Pizzocaro E, Giardino A, Frigerio I, Guglielmi A, Butturini G. Telemedicine and pancreatic cancer: a systematic review. Telemed J E Health 2023 Mar;29(3):352-360 [doi: 10.1089/tmj.2022.0140] [Medline: 35861761]"
    },
    {
      "title": "Digital health technology to enhance adolescent and young adult clinical preventive services: affordances and challenges",
      "authors": [
        "C Wong",
        "F Madanay",
        "E Ozer",
        "S Harris",
        "M Moore",
        "S Master"
      ],
      "year": 2020,
      "doi": "10.1016/j.jadohealth.2019.10.018",
      "journal": "J Adolesc Health",
      "volume": "67",
      "issue": "2S",
      "raw": "Digital health technology to enhance adolescent and young adult clinical preventive services: affordances and challenges \n\t\t \n\t\t\t C A Wong \n\t\t \n\t\t \n\t\t\t F Madanay \n\t\t \n\t\t \n\t\t\t E M Ozer \n\t\t \n\t\t \n\t\t\t S K Harris \n\t\t \n\t\t \n\t\t\t M Moore \n\t\t \n\t\t \n\t\t\t S O Master \n\t\t \n\t\t 10.1016/j.jadohealth.2019.10.018 \n\t\t Medline: 32718511 \n\t \n\t \n\t\t J Adolesc Health \n\t\t \n\t\t\t 67 \n\t\t\t 2S \n\t\t\t \n\t\t\t 2020 Aug \n\t\t \n\t \n\t FREE Full text \n\t Wong CA, Madanay F, Ozer EM, Harris SK, Moore M, Master SO, et al. Digital health technology to enhance adolescent and young adult clinical preventive services: affordances and challenges. J Adolesc Health 2020 Aug;67(2S):S24-S33 [FREE Full text] [doi: 10.1016/j.jadohealth.2019.10.018] [Medline: 32718511]"
    },
    {
      "title": "Intervention and evaluation of mobile health technologies in management of patients undergoing chronic dialysis: scoping review",
      "authors": [
        "Y Yang",
        "H Chen",
        "H Qazi",
        "P Morita"
      ],
      "year": 2020,
      "doi": "10.2196/15549",
      "journal": "JMIR Mhealth Uhealth",
      "volume": "8",
      "issue": "4",
      "pages": "15549",
      "raw": "Intervention and evaluation of mobile health technologies in management of patients undergoing chronic dialysis: scoping review \n\t\t \n\t\t\t Y Yang \n\t\t \n\t\t \n\t\t\t H Chen \n\t\t \n\t\t \n\t\t\t H Qazi \n\t\t \n\t\t \n\t\t\t P P Morita \n\t\t \n\t\t 10.2196/15549 \n\t\t Medline: 32242823 \n\t \n\t \n\t\t JMIR Mhealth Uhealth \n\t\t \n\t\t\t 8 \n\t\t\t 4 \n\t\t\t 15549 \n\t\t\t 2020 Apr 03 \n\t\t \n\t \n\t FREE Full text \n\t Yang Y, Chen H, Qazi H, Morita PP. Intervention and evaluation of mobile health technologies in management of patients undergoing chronic dialysis: scoping review. JMIR Mhealth Uhealth 2020 Apr 03;8(4):e15549 [FREE Full text] [doi: 10.2196/15549] [Medline: 32242823]"
    },
    {
      "title": "Telemedicine for the care of neuromuscular disorders",
      "authors": [
        "J Grogan",
        "Z Simmons"
      ],
      "year": 2020,
      "doi": "10.1007/s11940-020-00625-5",
      "journal": "Curr Treat Options Neurol",
      "volume": "22",
      "issue": "6",
      "pages": "17",
      "raw": "Telemedicine for the care of neuromuscular disorders \n\t\t \n\t\t\t J Grogan \n\t\t \n\t\t \n\t\t\t Z Simmons \n\t\t \n\t\t 10.1007/s11940-020-00625-5 \n\t \n\t \n\t\t Curr Treat Options Neurol \n\t\t \n\t\t\t 22 \n\t\t\t 6 \n\t\t\t 17 \n\t\t\t 2020 May 11 \n\t\t \n\t \n\t FREE Full text \n\t Grogan J, Simmons Z. Telemedicine for the care of neuromuscular disorders. Curr Treat Options Neurol 2020 May 11;22(6):17 [FREE Full text] [doi: 10.1007/s11940-020-00625-5]"
    },
    {
      "title": "Information technology law and health systems in the European Union",
      "authors": [
        "E Mossialos",
        "S Thomson",
        "Ter Linden"
      ],
      "year": 2004,
      "doi": "10.1017/s0266462304001424",
      "journal": "Int J Technol Assess Health Care",
      "volume": "20",
      "issue": "4",
      "raw": "Information technology law and health systems in the European Union \n\t\t \n\t\t\t E Mossialos \n\t\t \n\t\t \n\t\t\t S Thomson \n\t\t \n\t\t \n\t\t\t Ter Linden \n\t\t \n\t\t \n\t\t\t A \n\t\t \n\t\t 10.1017/s0266462304001424 \n\t\t Medline: 15609802 \n\t \n\t \n\t\t Int J Technol Assess Health Care \n\t\t \n\t\t\t 20 \n\t\t\t 4 \n\t\t\t \n\t\t\t 2004 \n\t\t \n\t \n\t Mossialos E, Thomson S, Ter Linden A. Information technology law and health systems in the European Union. Int J Technol Assess Health Care 2004;20(4):498-508 [doi: 10.1017/s0266462304001424] [Medline: 15609802]"
    },
    {
      "title": "Health information technology and digital innovation for national learning health and care systems",
      "authors": [
        "A Sheikh",
        "M Anderson",
        "S Albala",
        "B Casadei",
        "B Franklin",
        "M Richards"
      ],
      "year": 2021,
      "doi": "10.1016/s2589-7500(21)00005-4",
      "journal": "Lancet Digit Health",
      "volume": "3",
      "issue": "6",
      "raw": "Health information technology and digital innovation for national learning health and care systems \n\t\t \n\t\t\t A Sheikh \n\t\t \n\t\t \n\t\t\t M Anderson \n\t\t \n\t\t \n\t\t\t S Albala \n\t\t \n\t\t \n\t\t\t B Casadei \n\t\t \n\t\t \n\t\t\t B D Franklin \n\t\t \n\t\t \n\t\t\t M Richards \n\t\t \n\t\t 10.1016/s2589-7500(21)00005-4 \n\t\t Medline: 33967002 \n\t \n\t \n\t\t Lancet Digit Health \n\t\t \n\t\t\t 3 \n\t\t\t 6 \n\t\t\t \n\t\t\t 2021 Jun \n\t\t \n\t \n\t FREE Full text \n\t Sheikh A, Anderson M, Albala S, Casadei B, Franklin BD, Richards M, et al. Health information technology and digital innovation for national learning health and care systems. Lancet Digit Health 2021 Jun;3(6):e383-e396 [FREE Full text] [doi: 10.1016/S2589-7500(21)00005-4] [Medline: 33967002]"
    },
    {
      "title": "Health technology assessment and its influence on health-care priority setting",
      "authors": [
        "A Oliver",
        "E Mossialos",
        "R Robinson"
      ],
      "year": 2004,
      "doi": "10.1017/s026646230400073x",
      "journal": "Int J Technol Assess Health Care",
      "volume": "20",
      "issue": "1",
      "raw": "Health technology assessment and its influence on health-care priority setting \n\t\t \n\t\t\t A Oliver \n\t\t \n\t\t \n\t\t\t E Mossialos \n\t\t \n\t\t \n\t\t\t R Robinson \n\t\t \n\t\t 10.1017/s026646230400073x \n\t\t Medline: 15176172 \n\t \n\t \n\t\t Int J Technol Assess Health Care \n\t\t \n\t\t\t 20 \n\t\t\t 1 \n\t\t\t \n\t\t\t 2004 \n\t\t \n\t \n\t Oliver A, Mossialos E, Robinson R. Health technology assessment and its influence on health-care priority setting. Int J Technol Assess Health Care 2004;20(1):1-10 [doi: 10.1017/s026646230400073x] [Medline: 15176172]"
    },
    {
      "title": "Paying for telemedicine after the pandemic",
      "authors": [
        "A Mehrotra",
        "R Bhatia",
        "C Snoswell"
      ],
      "year": 2021,
      "doi": "10.1001/jama.2020.25706",
      "journal": "JAMA",
      "volume": "325",
      "issue": "5",
      "raw": "Paying for telemedicine after the pandemic \n\t\t \n\t\t\t A Mehrotra \n\t\t \n\t\t \n\t\t\t R S Bhatia \n\t\t \n\t\t \n\t\t\t C L Snoswell \n\t\t \n\t\t 10.1001/jama.2020.25706 \n\t\t Medline: 33528545] 100 \n\t \n\t \n\t\t JAMA \n\t\t \n\t\t\t 325 \n\t\t\t 5 \n\t\t\t \n\t\t\t 2021 Feb 02 \n\t\t \n\t \n\t FREE Full text \n\t Mehrotra A, Bhatia RS, Snoswell CL. Paying for telemedicine after the pandemic. JAMA 2021 Feb 02;325(5):431-432 [FREE Full text] [doi: 10.1001/jama.2020.25706] [Medline: 33528545] 100"
    },
    {
      "title": "Digital health paradox: international policy perspectives to address increased health inequalities for people living with disabilities",
      "authors": [
        "R Van Kessel",
        "R Hrzic",
        "O 'nuallain",
        "E Weir",
        "E Wong",
        "B Anderson"
      ],
      "year": 2022,
      "doi": "10.2196/33819",
      "journal": "J Med Internet Res",
      "volume": "24",
      "issue": "2",
      "pages": "33819",
      "raw": "Digital health paradox: international policy perspectives to address increased health inequalities for people living with disabilities \n\t\t \n\t\t\t R Van Kessel \n\t\t \n\t\t \n\t\t\t R Hrzic \n\t\t \n\t\t \n\t\t\t O 'nuallain \n\t\t \n\t\t \n\t\t\t E Weir \n\t\t \n\t\t \n\t\t\t E Wong \n\t\t \n\t\t \n\t\t\t B L Anderson \n\t\t \n\t\t \n\t\t\t M \n\t\t \n\t\t 10.2196/33819 \n\t\t Medline: 35191848] 101 \n\t \n\t \n\t\t J Med Internet Res \n\t\t \n\t\t\t 24 \n\t\t\t 2 \n\t\t\t 33819 \n\t\t\t 2022 Feb 22 \n\t\t \n\t \n\t FREE Full text \n\t van Kessel R, Hrzic R, O'Nuallain E, Weir E, Wong BL, Anderson M, et al. Digital health paradox: international policy perspectives to address increased health inequalities for people living with disabilities. J Med Internet Res 2022 Feb 22;24(2):e33819 [FREE Full text] [doi: 10.2196/33819] [Medline: 35191848] 101"
    },
    {
      "title": "Digital health literacy as a super determinant of health: more than simply the sum of its parts",
      "authors": [
        "R Van Kessel",
        "B Wong",
        "T Clemens",
        "H Brand"
      ],
      "year": 2022,
      "doi": "10.1016/j.invent.2022.100500",
      "journal": "Internet Interv",
      "volume": "27",
      "pages": "100500",
      "raw": "Digital health literacy as a super determinant of health: more than simply the sum of its parts \n\t\t \n\t\t\t R Van Kessel \n\t\t \n\t\t \n\t\t\t B L Wong \n\t\t \n\t\t \n\t\t\t T Clemens \n\t\t \n\t\t \n\t\t\t H Brand \n\t\t \n\t\t 10.1016/j.invent.2022.100500 \n\t\t Medline: 35242586] 102 \n\t \n\t \n\t\t Internet Interv \n\t\t \n\t\t\t 27 \n\t\t\t 100500 \n\t\t\t 2022 Feb 07 \n\t\t \n\t \n\t FREE Full text \n\t van Kessel R, Wong BL, Clemens T, Brand H. Digital health literacy as a super determinant of health: more than simply the sum of its parts. Internet Interv 2022 Feb 07;27:100500 [FREE Full text] [doi: 10.1016/j.invent.2022.100500] [Medline: 35242586] 102"
    },
    {
      "title": "The European health data space fails to bridge digital divides",
      "authors": [
        "R Van Kessel",
        "B Wong",
        "R Forman",
        "J Gabrani",
        "E Mossialos"
      ],
      "year": 2022,
      "doi": "10.1136/bmj-2022-071913",
      "journal": "BMJ",
      "volume": "378",
      "pages": "71913",
      "raw": "The European health data space fails to bridge digital divides \n\t\t \n\t\t\t R Van Kessel \n\t\t \n\t\t \n\t\t\t B L Wong \n\t\t \n\t\t \n\t\t\t R Forman \n\t\t \n\t\t \n\t\t\t J Gabrani \n\t\t \n\t\t \n\t\t\t E Mossialos \n\t\t \n\t\t 10.1136/bmj-2022-071913 \n\t\t Medline: 35803600] 103 \n\t \n\t \n\t\t BMJ \n\t\t \n\t\t\t 378 \n\t\t\t 71913 \n\t\t\t 2022 Jul 08 \n\t\t \n\t \n\t van Kessel R, Wong BL, Forman R, Gabrani J, Mossialos E. The European health data space fails to bridge digital divides. BMJ 2022 Jul 08;378:e071913 [doi: 10.1136/bmj-2022-071913] [Medline: 35803600] 103"
    },
    {
      "title": "Ensuring evidence-based safe and effective mHealth applications",
      "authors": [
        "B Vallespin",
        "J Cornet",
        "A Kotzeva"
      ],
      "year": 2016,
      "journal": "Stud Health Technol Inform",
      "volume": "222",
      "raw": "Ensuring evidence-based safe and effective mHealth applications \n\t\t \n\t\t\t B Vallespin \n\t\t \n\t\t \n\t\t\t J Cornet \n\t\t \n\t\t \n\t\t\t A Kotzeva \n\t\t \n\t\t Medline: 27198107] 104 \n\t \n\t \n\t\t Stud Health Technol Inform \n\t\t \n\t\t\t 222 \n\t\t\t \n\t\t\t 2016 \n\t\t \n\t \n\t Vallespin B, Cornet J, Kotzeva A. Ensuring evidence-based safe and effective mHealth applications. Stud Health Technol Inform 2016;222:248-261 [Medline: 27198107] 104"
    },
    {
      "title": "Why does the NHS struggle to adopt eHealth innovations? A review of macro, meso and micro factors",
      "authors": [
        "S Asthana",
        "R Jones",
        "R Sheaff"
      ],
      "year": 2019,
      "doi": "10.1186/s12913-019-4790-x",
      "journal": "BMC Health Serv Res",
      "volume": "19",
      "issue": "1",
      "pages": "984",
      "raw": "Why does the NHS struggle to adopt eHealth innovations? A review of macro, meso and micro factors \n\t\t \n\t\t\t S Asthana \n\t\t \n\t\t \n\t\t\t R Jones \n\t\t \n\t\t \n\t\t\t R Sheaff \n\t\t \n\t\t 10.1186/s12913-019-4790-x \n\t\t Medline: 31864370] 105 \n\t \n\t \n\t\t BMC Health Serv Res \n\t\t \n\t\t\t 19 \n\t\t\t 1 \n\t\t\t 984 \n\t\t\t 2019 Dec 21 \n\t\t \n\t \n\t FREE Full text \n\t Asthana S, Jones R, Sheaff R. Why does the NHS struggle to adopt eHealth innovations? A review of macro, meso and micro factors. BMC Health Serv Res 2019 Dec 21;19(1):984 [FREE Full text] [doi: 10.1186/s12913-019-4790-x] [Medline: 31864370] 105"
    },
    {
      "title": "COVID-19's impact on the future of digital health technology in primary care",
      "authors": [
        "N Van Hattem",
        "A Silven",
        "T Bonten",
        "N Chavannes"
      ],
      "year": 2021,
      "doi": "10.1093/fampra/cmab081",
      "journal": "Fam Pract",
      "volume": "38",
      "issue": "6",
      "raw": "COVID-19's impact on the future of digital health technology in primary care \n\t\t \n\t\t\t N E Van Hattem \n\t\t \n\t\t \n\t\t\t A V Silven \n\t\t \n\t\t \n\t\t\t T N Bonten \n\t\t \n\t\t \n\t\t\t N H Chavannes \n\t\t \n\t\t 10.1093/fampra/cmab081 \n\t\t Medline: 34268563] 106 \n\t \n\t \n\t\t Fam Pract \n\t\t \n\t\t\t 38 \n\t\t\t 6 \n\t\t\t \n\t\t\t 2021 Nov 24 \n\t\t \n\t \n\t FREE Full text \n\t van Hattem NE, Silven AV, Bonten TN, Chavannes NH. COVID-19's impact on the future of digital health technology in primary care. Fam Pract 2021 Nov 24;38(6):845-847 [FREE Full text] [doi: 10.1093/fampra/cmab081] [Medline: 34268563] 106"
    },
    {
      "title": "COVID-19 and the use of digital health tools: opportunity amid crisis that could transform health care delivery",
      "authors": [
        "G Williams",
        "N Fahy",
        "D Aissat",
        "M Lenormand",
        "L St\u00fcwe",
        "I Zablit-Schmidt"
      ],
      "year": 2022,
      "journal": "Eurohealth",
      "volume": "28",
      "issue": "1",
      "pages": "107",
      "raw": "COVID-19 and the use of digital health tools: opportunity amid crisis that could transform health care delivery \n\t\t \n\t\t\t G Williams \n\t\t \n\t\t \n\t\t\t N Fahy \n\t\t \n\t\t \n\t\t\t D Aissat \n\t\t \n\t\t \n\t\t\t M Lenormand \n\t\t \n\t\t \n\t\t\t L St\u00fcwe \n\t\t \n\t\t \n\t\t\t I Zablit-Schmidt \n\t\t \n\t \n\t \n\t\t Eurohealth \n\t\t \n\t\t\t 28 \n\t\t\t 1 \n\t\t\t 107 \n\t\t\t 2022 \n\t\t \n\t \n\t FREE Full text \n\t Williams G, Fahy N, Aissat D, Lenormand M, St\u00fcwe L, Zablit-Schmidt I, et al. COVID-19 and the use of digital health tools: opportunity amid crisis that could transform health care delivery. Eurohealth 2022;28(1):29-34 [FREE Full text] 107"
    },
    {
      "title": "Parkinson's disease and COVID-19: the effect and use of telemedicine",
      "authors": [
        "A Podlewska",
        "D Van Wamelen"
      ],
      "year": 2022,
      "doi": "10.1016/bs.irn.2022.04.002",
      "journal": "Int Rev Neurobiol",
      "volume": "165",
      "raw": "Parkinson's disease and COVID-19: the effect and use of telemedicine \n\t\t \n\t\t\t A M Podlewska \n\t\t \n\t\t \n\t\t\t D J Van Wamelen \n\t\t \n\t\t 10.1016/bs.irn.2022.04.002 \n\t\t Medline: 36208904] 108 \n\t \n\t \n\t\t Int Rev Neurobiol \n\t\t \n\t\t\t 165 \n\t\t\t \n\t\t\t 2022 \n\t\t \n\t \n\t FREE Full text \n\t Podlewska AM, van Wamelen DJ. Parkinson's disease and COVID-19: the effect and use of telemedicine. Int Rev Neurobiol 2022;165:263-281 [FREE Full text] [doi: 10.1016/bs.irn.2022.04.002] [Medline: 36208904] 108"
    },
    {
      "title": "Germany's digital health reforms in the COVID-19 era: lessons and opportunities for other countries",
      "authors": [
        "S Gerke",
        "A Stern",
        "T Minssen"
      ],
      "year": 2020,
      "doi": "10.1038/s41746-020-0306-7",
      "journal": "NPJ Digit Med",
      "volume": "3",
      "issue": "94",
      "raw": "Germany's digital health reforms in the COVID-19 era: lessons and opportunities for other countries \n\t\t \n\t\t\t S Gerke \n\t\t \n\t\t \n\t\t\t A D Stern \n\t\t \n\t\t \n\t\t\t T Minssen \n\t\t \n\t\t 10.1038/s41746-020-0306-7 \n\t\t Medline: 32685700] 109 \n\t \n\t \n\t\t NPJ Digit Med \n\t\t \n\t\t\t 3 \n\t\t\t 94 \n\t\t\t 2020 Jul 10 \n\t\t \n\t \n\t FREE Full text \n\t Gerke S, Stern AD, Minssen T. Germany's digital health reforms in the COVID-19 era: lessons and opportunities for other countries. NPJ Digit Med 2020 Jul 10;3:94 [FREE Full text] [doi: 10.1038/s41746-020-0306-7] [Medline: 32685700] 109"
    },
    {
      "title": "Advancing digital health applications: priorities for innovation in real-world evidence generation",
      "authors": [
        "A Stern",
        "J Br\u00f6nneke",
        "J Debatin",
        "J Hagen",
        "H Matthies",
        "S Patel"
      ],
      "year": 2022,
      "doi": "10.1016/s2589-7500(21)00292-2",
      "journal": "Lancet Digit Health",
      "volume": "4",
      "issue": "3",
      "raw": "Advancing digital health applications: priorities for innovation in real-world evidence generation \n\t\t \n\t\t\t A D Stern \n\t\t \n\t\t \n\t\t\t J Br\u00f6nneke \n\t\t \n\t\t \n\t\t\t J F Debatin \n\t\t \n\t\t \n\t\t\t J Hagen \n\t\t \n\t\t \n\t\t\t H Matthies \n\t\t \n\t\t \n\t\t\t S Patel \n\t\t \n\t\t 10.1016/s2589-7500(21)00292-2 \n\t\t Medline: 35216754] 110 \n\t \n\t \n\t\t Lancet Digit Health \n\t\t \n\t\t\t 4 \n\t\t\t 3 \n\t\t\t \n\t\t\t 2022 Mar \n\t\t \n\t \n\t FREE Full text \n\t Stern AD, Br\u00f6nneke J, Debatin JF, Hagen J, Matthies H, Patel S, et al. Advancing digital health applications: priorities for innovation in real-world evidence generation. Lancet Digit Health 2022 Mar;4(3):e200-e206 [FREE Full text] [doi: 10.1016/S2589-7500(21)00292-2] [Medline: 35216754] 110"
    },
    {
      "title": "The European health data space: a step towards digital and integrated care systems",
      "authors": [
        "S Genovese",
        "R Bengoa",
        "J Bowis",
        "M Harney",
        "B Hauck",
        "M Pinget"
      ],
      "year": 2022,
      "doi": "10.1108/jica-11-2021-0059",
      "journal": "J Integr Care",
      "volume": "30",
      "issue": "4",
      "raw": "The European health data space: a step towards digital and integrated care systems \n\t\t \n\t\t\t S Genovese \n\t\t \n\t\t \n\t\t\t R Bengoa \n\t\t \n\t\t \n\t\t\t J Bowis \n\t\t \n\t\t \n\t\t\t M Harney \n\t\t \n\t\t \n\t\t\t B Hauck \n\t\t \n\t\t \n\t\t\t M Pinget \n\t\t \n\t\t 10.1108/jica-11-2021-0059 \n\t \n\t \n\t\t J Integr Care \n\t\t \n\t\t\t 30 \n\t\t\t 4 \n\t\t\t \n\t\t\t 2022 Oct 12 \n\t\t \n\t \n\t FREE Full text \n\t Genovese S, Bengoa R, Bowis J, Harney M, Hauck B, Pinget M, et al. The European health data space: a step towards digital and integrated care systems. J Integr Care 2022 Oct 12;30(4):363-372 [FREE Full text] [doi: 10.1108/jica-11-2021-0059] 111"
    },
    {
      "title": "Digital health and care in pandemic times: impact of COVID-19",
      "authors": [
        "N Peek",
        "M Sujan",
        "P Scott"
      ],
      "year": 2020,
      "doi": "10.1136/bmjhci-2020-100166",
      "journal": "BMJ Health Care Inform",
      "volume": "27",
      "issue": "1",
      "pages": "100166",
      "raw": "Digital health and care in pandemic times: impact of COVID-19 \n\t\t \n\t\t\t N Peek \n\t\t \n\t\t \n\t\t\t M Sujan \n\t\t \n\t\t \n\t\t\t P Scott \n\t\t \n\t\t 10.1136/bmjhci-2020-100166 \n\t\t Medline: 32565418] 112 \n\t \n\t \n\t\t BMJ Health Care Inform \n\t\t \n\t\t\t 27 \n\t\t\t 1 \n\t\t\t 100166 \n\t\t\t 2020 Jun \n\t\t \n\t \n\t FREE Full text \n\t Peek N, Sujan M, Scott P. Digital health and care in pandemic times: impact of COVID-19. BMJ Health Care Inform 2020 Jun;27(1):e100166 [FREE Full text] [doi: 10.1136/bmjhci-2020-100166] [Medline: 32565418] 112"
    },
    {
      "title": "View of wild west eHealth: time to hold our horses?",
      "authors": [
        "J Ruwaard",
        "R Kok"
      ],
      "year": 2015,
      "journal": "Eur Health Psychol",
      "volume": "17",
      "issue": "1",
      "pages": "113",
      "raw": "View of wild west eHealth: time to hold our horses? \n\t\t \n\t\t\t J Ruwaard \n\t\t \n\t\t \n\t\t\t R Kok \n\t\t \n\t \n\t \n\t\t Eur Health Psychol \n\t\t \n\t\t\t 17 \n\t\t\t 1 \n\t\t\t 113 \n\t\t\t 2015 \n\t\t \n\t \n\t FREE Full text \n\t Ruwaard J, Kok R. View of wild west eHealth: time to hold our horses? Eur Health Psychol 2015;17(1):45-49 [FREE Full text] 113"
    },
    {
      "title": "The difference in practice expense costs between telehealth and in-office care could serve as the basis for differential reimbursement structures",
      "authors": [
        "E Aremu",
        "J Heffernan",
        "J Kvedar"
      ],
      "year": 2022,
      "doi": "10.1089/tmj.2021.0229",
      "journal": "Telemed J E Health",
      "volume": "28",
      "issue": "6",
      "raw": "The difference in practice expense costs between telehealth and in-office care could serve as the basis for differential reimbursement structures \n\t\t \n\t\t\t E O Aremu \n\t\t \n\t\t \n\t\t\t J L Heffernan \n\t\t \n\t\t \n\t\t\t J C Kvedar \n\t\t \n\t\t 10.1089/tmj.2021.0229 \n\t\t Medline: 34637679] 114 \n\t \n\t \n\t\t Telemed J E Health \n\t\t \n\t\t\t 28 \n\t\t\t 6 \n\t\t\t \n\t\t\t 2022 Jun \n\t\t \n\t \n\t Aremu EO, Heffernan JL, Kvedar JC. The difference in practice expense costs between telehealth and in-office care could serve as the basis for differential reimbursement structures. Telemed J E Health 2022 Jun;28(6):912-916 [doi: 10.1089/tmj.2021.0229] [Medline: 34637679] 114"
    },
    {
      "title": "Beyond the COVID pandemic, telemedicine, and health care",
      "authors": [
        "R Bashshur",
        "C Doarn",
        "J Frenk",
        "J Kvedar",
        "G Shannon",
        "J Woolliscroft"
      ],
      "year": 2020,
      "doi": "10.1089/tmj.2020.0328",
      "journal": "Telemed J E Health",
      "volume": "26",
      "issue": "11",
      "raw": "Beyond the COVID pandemic, telemedicine, and health care \n\t\t \n\t\t\t R L Bashshur \n\t\t \n\t\t \n\t\t\t C R Doarn \n\t\t \n\t\t \n\t\t\t J M Frenk \n\t\t \n\t\t \n\t\t\t J C Kvedar \n\t\t \n\t\t \n\t\t\t G W Shannon \n\t\t \n\t\t \n\t\t\t J O Woolliscroft \n\t\t \n\t\t 10.1089/tmj.2020.0328 \n\t\t Medline: 32809913] 115 \n\t \n\t \n\t\t Telemed J E Health \n\t\t \n\t\t\t 26 \n\t\t\t 11 \n\t\t\t \n\t\t\t 2020 Nov \n\t\t \n\t \n\t Bashshur RL, Doarn CR, Frenk JM, Kvedar JC, Shannon GW, Woolliscroft JO. Beyond the COVID pandemic, telemedicine, and health care. Telemed J E Health 2020 Nov;26(11):1310-1313 [doi: 10.1089/tmj.2020.0328] [Medline: 32809913] 115"
    },
    {
      "title": "The RAFT telemedicine network: lessons learnt and perspectives from a decade of educational and clinical services in low-and middle-incomes countries",
      "authors": [
        "G Bediang",
        "C Perrin",
        "Ruiz De Casta\u00f1eda",
        "R Kamga",
        "Y Sawadogo",
        "A Bagayoko"
      ],
      "year": 2014,
      "doi": "10.3389/fpubh.2014.00180",
      "journal": "Front Public Health",
      "volume": "2",
      "pages": "180",
      "raw": "The RAFT telemedicine network: lessons learnt and perspectives from a decade of educational and clinical services in low-and middle-incomes countries \n\t\t \n\t\t\t G Bediang \n\t\t \n\t\t \n\t\t\t C Perrin \n\t\t \n\t\t \n\t\t\t Ruiz De Casta\u00f1eda \n\t\t \n\t\t \n\t\t\t R Kamga \n\t\t \n\t\t \n\t\t\t Y Sawadogo \n\t\t \n\t\t \n\t\t\t A Bagayoko \n\t\t \n\t\t \n\t\t\t C O \n\t\t \n\t\t 10.3389/fpubh.2014.00180 \n\t\t Medline: 25340048] 116 \n\t \n\t \n\t\t Front Public Health \n\t\t \n\t\t\t 2 \n\t\t\t 180 \n\t\t\t 2014 Oct 07 \n\t\t \n\t \n\t FREE Full text \n\t Bediang G, Perrin C, Ruiz de Casta\u00f1eda R, Kamga Y, Sawadogo A, Bagayoko CO, et al. The RAFT telemedicine network: lessons learnt and perspectives from a decade of educational and clinical services in low-and middle-incomes countries. Front Public Health 2014 Oct 07;2:180 [FREE Full text] [doi: 10.3389/fpubh.2014.00180] [Medline: 25340048] 116"
    },
    {
      "title": "Provider barriers to telemental health: obstacles overcome, obstacles remaining",
      "authors": [
        "E Brooks",
        "C Turvey",
        "E Augusterfer"
      ],
      "year": 2013,
      "doi": "10.1089/tmj.2013.0068",
      "journal": "Telemed J E Health",
      "volume": "19",
      "issue": "6",
      "raw": "Provider barriers to telemental health: obstacles overcome, obstacles remaining \n\t\t \n\t\t\t E Brooks \n\t\t \n\t\t \n\t\t\t C Turvey \n\t\t \n\t\t \n\t\t\t E F Augusterfer \n\t\t \n\t\t 10.1089/tmj.2013.0068 \n\t\t Medline: 23590176] 117 \n\t \n\t \n\t\t Telemed J E Health \n\t\t \n\t\t\t 19 \n\t\t\t 6 \n\t\t\t \n\t\t\t 2013 Jun \n\t\t \n\t \n\t Brooks E, Turvey C, Augusterfer EF. Provider barriers to telemental health: obstacles overcome, obstacles remaining. Telemed J E Health 2013 Jun;19(6):433-437 [doi: 10.1089/tmj.2013.0068] [Medline: 23590176] 117"
    },
    {
      "title": "Aligning mission to digital health strategy in academic medical centers",
      "authors": [
        "A Cohen",
        "L Stump",
        "H Krumholz",
        "M Cartiera",
        "S Jain",
        "Scott Sussman"
      ],
      "year": 2022,
      "doi": "10.1038/s41746-022-00608-7",
      "journal": "NPJ Digit Med",
      "volume": "5",
      "issue": "1",
      "pages": "67",
      "raw": "Aligning mission to digital health strategy in academic medical centers \n\t\t \n\t\t\t A B Cohen \n\t\t \n\t\t \n\t\t\t L Stump \n\t\t \n\t\t \n\t\t\t H M Krumholz \n\t\t \n\t\t \n\t\t\t M Cartiera \n\t\t \n\t\t \n\t\t\t S Jain \n\t\t \n\t\t \n\t\t\t Scott Sussman \n\t\t \n\t\t \n\t\t\t L \n\t\t \n\t\t 10.1038/s41746-022-00608-7 \n\t\t Medline: 35654885] 118 \n\t \n\t \n\t\t NPJ Digit Med \n\t\t \n\t\t\t 5 \n\t\t\t 1 \n\t\t\t 67 \n\t\t\t 2022 Jun 02 \n\t\t \n\t \n\t FREE Full text \n\t Cohen AB, Stump L, Krumholz HM, Cartiera M, Jain S, Scott Sussman L, et al. Aligning mission to digital health strategy in academic medical centers. NPJ Digit Med 2022 Jun 02;5(1):67 [FREE Full text] [doi: 10.1038/s41746-022-00608-7] [Medline: 35654885] 118"
    },
    {
      "title": "The emerging clinical role of wearables: factors for successful implementation in healthcare",
      "authors": [
        "M Smuck",
        "C Odonkor",
        "J Wilt",
        "N Schmidt",
        "M Swiernik"
      ],
      "year": 2021,
      "doi": "10.1038/s41746-021-00418-3",
      "journal": "NPJ Digit Med",
      "volume": "4",
      "issue": "1",
      "pages": "45",
      "raw": "The emerging clinical role of wearables: factors for successful implementation in healthcare \n\t\t \n\t\t\t M Smuck \n\t\t \n\t\t \n\t\t\t C A Odonkor \n\t\t \n\t\t \n\t\t\t J K Wilt \n\t\t \n\t\t \n\t\t\t N Schmidt \n\t\t \n\t\t \n\t\t\t M A Swiernik \n\t\t \n\t\t 10.1038/s41746-021-00418-3 \n\t\t Medline: 33692479] 119 \n\t \n\t \n\t\t NPJ Digit Med \n\t\t \n\t\t\t 4 \n\t\t\t 1 \n\t\t\t 45 \n\t\t\t 2021 Mar 10 \n\t\t \n\t \n\t FREE Full text \n\t Smuck M, Odonkor CA, Wilt JK, Schmidt N, Swiernik MA. The emerging clinical role of wearables: factors for successful implementation in healthcare. NPJ Digit Med 2021 Mar 10;4(1):45 [FREE Full text] [doi: 10.1038/s41746-021-00418-3] [Medline: 33692479] 119"
    },
    {
      "title": "Telehealth beyond COVID-19",
      "authors": [
        "S Haque"
      ],
      "year": 2021,
      "doi": "10.1176/appi.ps.202000368",
      "journal": "Psychiatr Serv",
      "volume": "72",
      "issue": "1",
      "raw": "Telehealth beyond COVID-19 \n\t\t \n\t\t\t S N Haque \n\t\t \n\t\t 10.1176/appi.ps.202000368 \n\t\t Medline: 32811284] 120 \n\t \n\t \n\t\t Psychiatr Serv \n\t\t \n\t\t\t 72 \n\t\t\t 1 \n\t\t\t \n\t\t\t 2021 Jan 01 \n\t\t \n\t \n\t Haque SN. Telehealth beyond COVID-19. Psychiatr Serv 2021 Jan 01;72(1):100-103 [doi: 10.1176/appi.ps.202000368] [Medline: 32811284] 120"
    },
    {
      "title": "Virtual nation: telemedicine's breakout moment",
      "authors": [
        "A Tenderich"
      ],
      "year": 2020,
      "doi": "10.1177/1932296820929359",
      "journal": "J Diabetes Sci Technol",
      "volume": "14",
      "issue": "4",
      "raw": "Virtual nation: telemedicine's breakout moment \n\t\t \n\t\t\t A Tenderich \n\t\t \n\t\t 10.1177/1932296820929359 \n\t\t Medline: 32429751] 121 \n\t \n\t \n\t\t J Diabetes Sci Technol \n\t\t \n\t\t\t 14 \n\t\t\t 4 \n\t\t\t \n\t\t\t 2020 Jul \n\t\t \n\t \n\t FREE Full text \n\t Tenderich A. Virtual nation: telemedicine's breakout moment. J Diabetes Sci Technol 2020 Jul;14(4):799-800 [FREE Full text] [doi: 10.1177/1932296820929359] [Medline: 32429751] 121"
    },
    {
      "title": "Artificial intelligence and health technology assessment: anticipating a new level of complexity",
      "authors": [
        "H Alami",
        "P Lehoux",
        "Y Auclair",
        "M De Guise",
        "M Gagnon",
        "J Shaw"
      ],
      "year": 2020,
      "doi": "10.2196/17707",
      "journal": "J Med Internet Res",
      "volume": "22",
      "issue": "7",
      "pages": "17707",
      "raw": "Artificial intelligence and health technology assessment: anticipating a new level of complexity \n\t\t \n\t\t\t H Alami \n\t\t \n\t\t \n\t\t\t P Lehoux \n\t\t \n\t\t \n\t\t\t Y Auclair \n\t\t \n\t\t \n\t\t\t M De Guise \n\t\t \n\t\t \n\t\t\t M P Gagnon \n\t\t \n\t\t \n\t\t\t J Shaw \n\t\t \n\t\t 10.2196/17707 \n\t\t Medline: 32406850] 122 \n\t \n\t \n\t\t J Med Internet Res \n\t\t \n\t\t\t 22 \n\t\t\t 7 \n\t\t\t 17707 \n\t\t\t 2020 Jul 07 \n\t\t \n\t \n\t FREE Full text \n\t Alami H, Lehoux P, Auclair Y, de Guise M, Gagnon MP, Shaw J, et al. Artificial intelligence and health technology assessment: anticipating a new level of complexity. J Med Internet Res 2020 Jul 07;22(7):e17707 [FREE Full text] [doi: 10.2196/17707] [Medline: 32406850] 122"
    },
    {
      "title": "Achieving the integrated and smart health and wellbeing paradigm: a call for policy research and action on governance and business models",
      "authors": [
        "K Stroetmann"
      ],
      "year": 2013,
      "doi": "10.1016/j.ijmedinf.2012.05.008",
      "journal": "Int J Med Inform",
      "volume": "82",
      "issue": "4",
      "raw": "Achieving the integrated and smart health and wellbeing paradigm: a call for policy research and action on governance and business models \n\t\t \n\t\t\t K A Stroetmann \n\t\t \n\t\t 10.1016/j.ijmedinf.2012.05.008 \n\t\t Medline: 22727880] 123 \n\t \n\t \n\t\t Int J Med Inform \n\t\t \n\t\t\t 82 \n\t\t\t 4 \n\t\t\t \n\t\t\t 2013 Apr \n\t\t \n\t \n\t Stroetmann KA. Achieving the integrated and smart health and wellbeing paradigm: a call for policy research and action on governance and business models. Int J Med Inform 2013 Apr;82(4):e29-e37 [doi: 10.1016/j.ijmedinf.2012.05.008] [Medline: 22727880] 123"
    },
    {
      "title": "Building a regulatory and payment framework flexible enough to withstand technological progress",
      "authors": [
        "D Flannery",
        "R Jarrin"
      ],
      "year": 2018,
      "doi": "10.1377/hlthaff.2018.05151",
      "journal": "Health Aff (Millwood)",
      "volume": "37",
      "issue": "12",
      "raw": "Building a regulatory and payment framework flexible enough to withstand technological progress \n\t\t \n\t\t\t D Flannery \n\t\t \n\t\t \n\t\t\t R Jarrin \n\t\t \n\t\t 10.1377/hlthaff.2018.05151 \n\t\t Medline: 30633665] 124 \n\t \n\t \n\t\t Health Aff (Millwood) \n\t\t \n\t\t\t 37 \n\t\t\t 12 \n\t\t\t \n\t\t\t 2018 Dec \n\t\t \n\t \n\t Flannery D, Jarrin R. Building a regulatory and payment framework flexible enough to withstand technological progress. Health Aff (Millwood) 2018 Dec;37(12):2052-2059 [doi: 10.1377/hlthaff.2018.05151] [Medline: 30633665] 124"
    },
    {
      "title": "Critical steps to scaling telehealth for national reform",
      "authors": [
        "J Tracy",
        "K Rheuban",
        "R Waters",
        "M Devany",
        "P Whitten"
      ],
      "year": 2008,
      "doi": "10.1089/tmj.2008.0125",
      "journal": "Telemed J E Health",
      "volume": "14",
      "issue": "9",
      "raw": "Critical steps to scaling telehealth for national reform \n\t\t \n\t\t\t J Tracy \n\t\t \n\t\t \n\t\t\t K Rheuban \n\t\t \n\t\t \n\t\t\t R J Waters \n\t\t \n\t\t \n\t\t\t M Devany \n\t\t \n\t\t \n\t\t\t P Whitten \n\t\t \n\t\t 10.1089/tmj.2008.0125 \n\t\t Medline: 19035814] 125 \n\t \n\t \n\t\t Telemed J E Health \n\t\t \n\t\t\t 14 \n\t\t\t 9 \n\t\t\t \n\t\t\t 2008 Nov \n\t\t \n\t \n\t Tracy J, Rheuban K, Waters RJ, DeVany M, Whitten P. Critical steps to scaling telehealth for national reform. Telemed J E Health 2008 Nov;14(9):990-994 [doi: 10.1089/tmj.2008.0125] [Medline: 19035814] 125"
    },
    {
      "title": "e-Health: technologic revolution meets regulatory constraint",
      "authors": [
        "B Fried",
        "G Weinreich",
        "G Cavalier",
        "K Lester"
      ],
      "year": 2000,
      "doi": "10.1377/hlthaff.19.6.124",
      "journal": "Health Aff (Millwood)",
      "volume": "19",
      "issue": "6",
      "raw": "e-Health: technologic revolution meets regulatory constraint \n\t\t \n\t\t\t B M Fried \n\t\t \n\t\t \n\t\t\t G Weinreich \n\t\t \n\t\t \n\t\t\t G M Cavalier \n\t\t \n\t\t \n\t\t\t K J Lester \n\t\t \n\t\t 10.1377/hlthaff.19.6.124 \n\t\t Medline: 11192395] 126 \n\t \n\t \n\t\t Health Aff (Millwood) \n\t\t \n\t\t\t 19 \n\t\t\t 6 \n\t\t\t \n\t\t\t 2000 Nov \n\t\t \n\t \n\t Fried BM, Weinreich G, Cavalier GM, Lester KJ. e-Health: technologic revolution meets regulatory constraint. Health Aff (Millwood) 2000 Nov;19(6):124-131 [doi: 10.1377/hlthaff.19.6.124] [Medline: 11192395] 126"
    },
    {
      "title": "Integration of self-management tools in personal and provider e-health records",
      "authors": [
        "M Jenkins",
        "J Levy",
        "E Cohen",
        "S Yoon",
        "J Singer",
        "F Mostashari"
      ],
      "year": 2009,
      "journal": "Stud Health Technol Inform",
      "volume": "146",
      "raw": "Integration of self-management tools in personal and provider e-health records \n\t\t \n\t\t\t M Jenkins \n\t\t \n\t\t \n\t\t\t J Levy \n\t\t \n\t\t \n\t\t\t E Cohen \n\t\t \n\t\t \n\t\t\t S Yoon \n\t\t \n\t\t \n\t\t\t J Singer \n\t\t \n\t\t \n\t\t\t F Mostashari \n\t\t \n\t\t Medline: 19592831] 127 \n\t \n\t \n\t\t Stud Health Technol Inform \n\t\t \n\t\t\t 146 \n\t\t\t \n\t\t\t 2009 \n\t\t \n\t \n\t Jenkins M, Levy J, Cohen E, Yoon S, Singer J, Mostashari F. Integration of self-management tools in personal and provider e-health records. Stud Health Technol Inform 2009;146:179-184 [Medline: 19592831] 127"
    },
    {
      "title": "Mobile health for all: public-private partnerships can create a new mental health landscape",
      "authors": [
        "D Ben-Zeev"
      ],
      "year": 2016,
      "doi": "10.2196/mental.5843",
      "journal": "JMIR Ment Health",
      "volume": "3",
      "issue": "2",
      "raw": "Mobile health for all: public-private partnerships can create a new mental health landscape \n\t\t \n\t\t\t D Ben-Zeev \n\t\t \n\t\t 10.2196/mental.5843 \n\t\t Medline: 27268283] 128 \n\t \n\t \n\t\t JMIR Ment Health \n\t\t \n\t\t\t 3 \n\t\t\t 2 \n\t\t\t 2016 Jun 06 \n\t\t \n\t \n\t FREE Full text \n\t Ben-Zeev D. Mobile health for all: public-private partnerships can create a new mental health landscape. JMIR Ment Health 2016 Jun 06;3(2):e26 [FREE Full text] [doi: 10.2196/mental.5843] [Medline: 27268283] 128"
    },
    {
      "title": "Show me the money: how do we justify spending health care dollars on digital health?",
      "authors": [
        "L Woods",
        "R Eden",
        "O Canfell",
        "K Nguyen",
        "T Comans",
        "C Sullivan"
      ],
      "year": 2023,
      "doi": "10.5694/mja2.51799",
      "journal": "Med J Aust",
      "volume": "218",
      "issue": "2",
      "raw": "Show me the money: how do we justify spending health care dollars on digital health? \n\t\t \n\t\t\t L Woods \n\t\t \n\t\t \n\t\t\t R Eden \n\t\t \n\t\t \n\t\t\t O J Canfell \n\t\t \n\t\t \n\t\t\t K H Nguyen \n\t\t \n\t\t \n\t\t\t T Comans \n\t\t \n\t\t \n\t\t\t C Sullivan \n\t\t \n\t\t 10.5694/mja2.51799 \n\t\t Medline: 36502453] 129 \n\t \n\t \n\t\t Med J Aust \n\t\t \n\t\t\t 218 \n\t\t\t 2 \n\t\t\t \n\t\t\t 2023 Feb 06 \n\t\t \n\t \n\t FREE Full text \n\t Woods L, Eden R, Canfell OJ, Nguyen KH, Comans T, Sullivan C. Show me the money: how do we justify spending health care dollars on digital health? Med J Aust 2023 Feb 06;218(2):53-57 [FREE Full text] [doi: 10.5694/mja2.51799] [Medline: 36502453] 129"
    },
    {
      "title": "Telehealth tools for public health, emergency, or disaster preparedness and response: a summary report",
      "authors": [
        "D Alverson",
        "K Edison",
        "L Flournoy",
        "B Korte",
        "C Magruder",
        "C Miller"
      ],
      "year": 2010,
      "doi": "10.1089/tmj.2009.0149",
      "journal": "Telemed J E Health",
      "volume": "16",
      "issue": "1",
      "raw": "Telehealth tools for public health, emergency, or disaster preparedness and response: a summary report \n\t\t \n\t\t\t D C Alverson \n\t\t \n\t\t \n\t\t\t K Edison \n\t\t \n\t\t \n\t\t\t L Flournoy \n\t\t \n\t\t \n\t\t\t B Korte \n\t\t \n\t\t \n\t\t\t C Magruder \n\t\t \n\t\t \n\t\t\t C Miller \n\t\t \n\t\t 10.1089/tmj.2009.0149 \n\t\t Medline: 20043703] 130 \n\t \n\t \n\t\t Telemed J E Health \n\t\t \n\t\t\t 16 \n\t\t\t 1 \n\t\t\t \n\t\t\t 2010 Jan \n\t\t \n\t \n\t Alverson DC, Edison K, Flournoy L, Korte B, Magruder C, Miller C. Telehealth tools for public health, emergency, or disaster preparedness and response: a summary report. Telemed J E Health 2010 Jan;16(1):112-114 [doi: 10.1089/tmj.2009.0149] [Medline: 20043703] 130"
    },
    {
      "title": "Telehealth: the promise of new care delivery models",
      "authors": [
        "S Speedie",
        "A Ferguson",
        "J Sanders",
        "C Doarn"
      ],
      "year": 2008,
      "doi": "10.1089/tmj.2008.0114",
      "journal": "Telemed J E Health",
      "volume": "14",
      "issue": "9",
      "raw": "Telehealth: the promise of new care delivery models \n\t\t \n\t\t\t S M Speedie \n\t\t \n\t\t \n\t\t\t A S Ferguson \n\t\t \n\t\t \n\t\t\t J Sanders \n\t\t \n\t\t \n\t\t\t C R Doarn \n\t\t \n\t\t 10.1089/tmj.2008.0114 \n\t\t Medline: 19035808] 131 \n\t \n\t \n\t\t Telemed J E Health \n\t\t \n\t\t\t 14 \n\t\t\t 9 \n\t\t\t \n\t\t\t 2008 Nov \n\t\t \n\t \n\t Speedie SM, Ferguson AS, Sanders J, Doarn CR. Telehealth: the promise of new care delivery models. Telemed J E Health 2008 Nov;14(9):964-967 [doi: 10.1089/tmj.2008.0114] [Medline: 19035808] 131"
    },
    {
      "title": "Telemedicine barriers associated with regional quality measures",
      "authors": [
        "F North",
        "S Crane",
        "P Takahashi",
        "W Ward",
        "S Tulledge-Scheitel",
        "K Ytterberg"
      ],
      "year": 2014,
      "doi": "10.1089/tmj.2013.0167",
      "journal": "Telemed J E Health",
      "volume": "20",
      "issue": "2",
      "raw": "Telemedicine barriers associated with regional quality measures \n\t\t \n\t\t\t F North \n\t\t \n\t\t \n\t\t\t S J Crane \n\t\t \n\t\t \n\t\t\t P Y Takahashi \n\t\t \n\t\t \n\t\t\t W J Ward \n\t\t \n\t\t \n\t\t\t S M Tulledge-Scheitel \n\t\t \n\t\t \n\t\t\t K Ytterberg \n\t\t \n\t\t 10.1089/tmj.2013.0167 \n\t\t Medline: 24205836] 132 \n\t \n\t \n\t\t Telemed J E Health \n\t\t \n\t\t\t 20 \n\t\t\t 2 \n\t\t\t \n\t\t\t 2014 Feb \n\t\t \n\t \n\t North F, Crane SJ, Takahashi PY, Ward WJ, Tulledge-Scheitel SM, Ytterberg K, et al. Telemedicine barriers associated with regional quality measures. Telemed J E Health 2014 Feb;20(2):179-181 [doi: 10.1089/tmj.2013.0167] [Medline: 24205836] 132"
    },
    {
      "title": "Telemental health: responding to mandates for reform in primary healthcare",
      "authors": [
        "K Myers",
        "D Lieberman"
      ],
      "year": 2013,
      "doi": "10.1089/tmj.2013.0084",
      "journal": "Telemed J E Health",
      "volume": "19",
      "issue": "6",
      "raw": "Telemental health: responding to mandates for reform in primary healthcare \n\t\t \n\t\t\t K M Myers \n\t\t \n\t\t \n\t\t\t D Lieberman \n\t\t \n\t\t 10.1089/tmj.2013.0084 \n\t\t Medline: 23611641] 133 \n\t \n\t \n\t\t Telemed J E Health \n\t\t \n\t\t\t 19 \n\t\t\t 6 \n\t\t\t \n\t\t\t 2013 Jun \n\t\t \n\t \n\t Myers KM, Lieberman D. Telemental health: responding to mandates for reform in primary healthcare. Telemed J E Health 2013 Jun;19(6):438-443 [doi: 10.1089/tmj.2013.0084] [Medline: 23611641] 133"
    },
    {
      "title": "The future of virtual care services: a payor's perspective",
      "authors": [
        "J Rajda",
        "H Paz"
      ],
      "year": 2020,
      "doi": "10.1089/tmj.2019.0020",
      "journal": "Telemed J E Health",
      "volume": "26",
      "issue": "3",
      "raw": "The future of virtual care services: a payor's perspective \n\t\t \n\t\t\t J Rajda \n\t\t \n\t\t \n\t\t\t H L Paz \n\t\t \n\t\t 10.1089/tmj.2019.0020 \n\t\t Medline: 31058584] 134 \n\t \n\t \n\t\t Telemed J E Health \n\t\t \n\t\t\t 26 \n\t\t\t 3 \n\t\t\t \n\t\t\t 2020 Mar \n\t\t \n\t \n\t Rajda J, Paz HL. The future of virtual care services: a payor's perspective. Telemed J E Health 2020 Mar;26(3):267-269 [doi: 10.1089/tmj.2019.0020] [Medline: 31058584] 134"
    },
    {
      "title": "Telehealth opportunities in the COVID-19 pandemic early days: what happened, did not happen, should have happened, and must happen in the near future?",
      "authors": [
        "P Amorim",
        "D Brito",
        "M Castelo-Branco",
        "C F\u00e0brega",
        "Gomes Da Costa",
        "F Martins"
      ],
      "year": 2021,
      "doi": "10.1089/tmj.2020.0386",
      "journal": "Telemed J E Health",
      "volume": "27",
      "issue": "10",
      "raw": "Telehealth opportunities in the COVID-19 pandemic early days: what happened, did not happen, should have happened, and must happen in the near future? \n\t\t \n\t\t\t P Amorim \n\t\t \n\t\t \n\t\t\t D Brito \n\t\t \n\t\t \n\t\t\t M Castelo-Branco \n\t\t \n\t\t \n\t\t\t C F\u00e0brega \n\t\t \n\t\t \n\t\t\t Gomes Da Costa \n\t\t \n\t\t \n\t\t\t F Martins \n\t\t \n\t\t \n\t\t\t H \n\t\t \n\t\t 10.1089/tmj.2020.0386 \n\t\t Medline: 33264071] 135 \n\t \n\t \n\t\t Telemed J E Health \n\t\t \n\t\t\t 27 \n\t\t\t 10 \n\t\t\t \n\t\t\t 2021 Oct \n\t\t \n\t \n\t Amorim P, Brito D, Castelo-Branco M, F\u00e0brega C, Gomes da Costa F, Martins H, et al. Telehealth opportunities in the COVID-19 pandemic early days: what happened, did not happen, should have happened, and must happen in the near future? Telemed J E Health 2021 Oct;27(10):1194-1199 [doi: 10.1089/tmj.2020.0386] [Medline: 33264071] 135"
    },
    {
      "title": "Mobile health solutions: an opportunity for rehabilitation in low-and middle income countries?",
      "authors": [
        "B Bonnech\u00e8re",
        "O Kossi",
        "J Mapinduzi",
        "J Panda",
        "A Rintala",
        "S Guidetti"
      ],
      "year": 2022,
      "doi": "10.3389/fpubh.2022.1072322",
      "journal": "Front Public Health",
      "volume": "10",
      "pages": "1072322",
      "raw": "Mobile health solutions: an opportunity for rehabilitation in low-and middle income countries? \n\t\t \n\t\t\t B Bonnech\u00e8re \n\t\t \n\t\t \n\t\t\t O Kossi \n\t\t \n\t\t \n\t\t\t J Mapinduzi \n\t\t \n\t\t \n\t\t\t J Panda \n\t\t \n\t\t \n\t\t\t A Rintala \n\t\t \n\t\t \n\t\t\t S Guidetti \n\t\t \n\t\t 10.3389/fpubh.2022.1072322 \n\t\t Medline: 36761328] 136 \n\t \n\t \n\t\t Front Public Health \n\t\t \n\t\t\t 10 \n\t\t\t 1072322 \n\t\t\t 2022 Jan 24 \n\t\t \n\t \n\t FREE Full text \n\t Bonnech\u00e8re B, Kossi O, Mapinduzi J, Panda J, Rintala A, Guidetti S, et al. Mobile health solutions: an opportunity for rehabilitation in low-and middle income countries? Front Public Health 2022 Jan 24;10:1072322 [FREE Full text] [doi: 10.3389/fpubh.2022.1072322] [Medline: 36761328] 136"
    },
    {
      "title": "Digital health and precision prevention: shifting from disease-centred care to consumer-centred health",
      "authors": [
        "O Canfell",
        "R Littlewood",
        "A Burton-Jones",
        "C Sullivan"
      ],
      "year": 2022,
      "doi": "10.1071/ah21063",
      "journal": "Aust Health Rev",
      "volume": "46",
      "issue": "3",
      "raw": "Digital health and precision prevention: shifting from disease-centred care to consumer-centred health \n\t\t \n\t\t\t O J Canfell \n\t\t \n\t\t \n\t\t\t R Littlewood \n\t\t \n\t\t \n\t\t\t A Burton-Jones \n\t\t \n\t\t \n\t\t\t C Sullivan \n\t\t \n\t\t 10.1071/ah21063 \n\t\t Medline: 34882538] 137 \n\t \n\t \n\t\t Aust Health Rev \n\t\t \n\t\t\t 46 \n\t\t\t 3 \n\t\t\t \n\t\t\t 2022 Jun \n\t\t \n\t \n\t Canfell OJ, Littlewood R, Burton-Jones A, Sullivan C. Digital health and precision prevention: shifting from disease-centred care to consumer-centred health. Aust Health Rev 2022 Jun;46(3):279-283 [doi: 10.1071/AH21063] [Medline: 34882538] 137"
    },
    {
      "title": "Digital health: unlocking value in a post-pandemic world",
      "authors": [
        "B D'anza",
        "P Pronovost"
      ],
      "year": 2022,
      "doi": "10.1089/pop.2021.0031",
      "journal": "Popul Health Manag",
      "volume": "25",
      "issue": "1",
      "raw": "Digital health: unlocking value in a post-pandemic world \n\t\t \n\t\t\t B D'anza \n\t\t \n\t\t \n\t\t\t P J Pronovost \n\t\t \n\t\t 10.1089/pop.2021.0031 \n\t\t Medline: 34042532] 138 \n\t \n\t \n\t\t Popul Health Manag \n\t\t \n\t\t\t 25 \n\t\t\t 1 \n\t\t\t \n\t\t\t 2022 Feb \n\t\t \n\t \n\t D'Anza B, Pronovost PJ. Digital health: unlocking value in a post-pandemic world. Popul Health Manag 2022 Feb;25(1):11-22 [doi: 10.1089/pop.2021.0031] [Medline: 34042532] 138"
    },
    {
      "title": "A road map for remote digital health technology for motor neuron disease",
      "authors": [
        "R Van Eijk",
        "A Beelen",
        "E Kruitwagen",
        "D Murray",
        "R Radakovic",
        "E Hobson"
      ],
      "year": 2021,
      "doi": "10.2196/28766",
      "journal": "J Med Internet Res",
      "volume": "23",
      "issue": "9",
      "pages": "28766",
      "raw": "A road map for remote digital health technology for motor neuron disease \n\t\t \n\t\t\t R P Van Eijk \n\t\t \n\t\t \n\t\t\t A Beelen \n\t\t \n\t\t \n\t\t\t E T Kruitwagen \n\t\t \n\t\t \n\t\t\t D Murray \n\t\t \n\t\t \n\t\t\t R Radakovic \n\t\t \n\t\t \n\t\t\t E Hobson \n\t\t \n\t\t 10.2196/28766 \n\t\t Medline: 34550089] 139 \n\t \n\t \n\t\t J Med Internet Res \n\t\t \n\t\t\t 23 \n\t\t\t 9 \n\t\t\t 28766 \n\t\t\t 2021 Sep 22 \n\t\t \n\t \n\t FREE Full text \n\t van Eijk RP, Beelen A, Kruitwagen ET, Murray D, Radakovic R, Hobson E, et al. A road map for remote digital health technology for motor neuron disease. J Med Internet Res 2021 Sep 22;23(9):e28766 [FREE Full text] [doi: 10.2196/28766] [Medline: 34550089] 139"
    },
    {
      "title": "Digital health for patients with multiple myeloma: an unmet need",
      "authors": [
        "S Jagannath",
        "J Mikhael",
        "O Nadeem",
        "N Raje"
      ],
      "year": 2021,
      "doi": "10.1200/CCI.20.00145",
      "journal": "JCO Clin Cancer Inform",
      "volume": "5",
      "raw": "Digital health for patients with multiple myeloma: an unmet need \n\t\t \n\t\t\t S Jagannath \n\t\t \n\t\t \n\t\t\t J Mikhael \n\t\t \n\t\t \n\t\t\t O Nadeem \n\t\t \n\t\t \n\t\t\t N Raje \n\t\t \n\t\t 10.1200/CCI.20.00145 \n\t\t Medline: 34735265] 140 \n\t \n\t \n\t\t JCO Clin Cancer Inform \n\t\t \n\t\t\t 5 \n\t\t\t \n\t\t\t 2021 Oct \n\t\t \n\t \n\t FREE Full text \n\t Jagannath S, Mikhael J, Nadeem O, Raje N. Digital health for patients with multiple myeloma: an unmet need. JCO Clin Cancer Inform 2021 Oct;5:1096-1105 [FREE Full text] [doi: 10.1200/CCI.20.00145] [Medline: 34735265] 140"
    },
    {
      "title": "Advancing digital health innovation in Oncology: priorities for high-value digital transformation in cancer care",
      "authors": [
        "S Patel",
        "J Goldsack",
        "G Cordovano",
        "A Downing",
        "K Fields",
        "C Geoghegan"
      ],
      "year": 2023,
      "doi": "10.2196/43404",
      "journal": "J Med Internet Res",
      "volume": "25",
      "pages": "43404",
      "raw": "Advancing digital health innovation in Oncology: priorities for high-value digital transformation in cancer care \n\t\t \n\t\t\t S Patel \n\t\t \n\t\t \n\t\t\t J C Goldsack \n\t\t \n\t\t \n\t\t\t G Cordovano \n\t\t \n\t\t \n\t\t\t A Downing \n\t\t \n\t\t \n\t\t\t K K Fields \n\t\t \n\t\t \n\t\t\t C Geoghegan \n\t\t \n\t\t 10.2196/43404 \n\t\t Medline: 36598811] 141 \n\t \n\t \n\t\t J Med Internet Res \n\t\t \n\t\t\t 25 \n\t\t\t 43404 \n\t\t\t 2023 Jan 04 \n\t\t \n\t \n\t FREE Full text \n\t Patel S, Goldsack JC, Cordovano G, Downing A, Fields KK, Geoghegan C, et al. Advancing digital health innovation in Oncology: priorities for high-value digital transformation in cancer care. J Med Internet Res 2023 Jan 04;25:e43404 [FREE Full text] [doi: 10.2196/43404] [Medline: 36598811] 141"
    },
    {
      "title": "Meaningful engagement: a crossfunctional framework for digital therapeutics",
      "authors": [
        "G Strauss",
        "J Flannery",
        "E Vierra",
        "X Koepsell",
        "E Berglund",
        "I Miller"
      ],
      "year": 2022,
      "doi": "10.3389/fdgth.2022.890081",
      "journal": "Front Digit Health",
      "volume": "4",
      "pages": "890081",
      "raw": "Meaningful engagement: a crossfunctional framework for digital therapeutics \n\t\t \n\t\t\t G Strauss \n\t\t \n\t\t \n\t\t\t J E Flannery \n\t\t \n\t\t \n\t\t\t E Vierra \n\t\t \n\t\t \n\t\t\t X Koepsell \n\t\t \n\t\t \n\t\t\t E Berglund \n\t\t \n\t\t \n\t\t\t I Miller \n\t\t \n\t\t 10.3389/fdgth.2022.890081 \n\t\t Medline: 36052316] 142 \n\t \n\t \n\t\t Front Digit Health \n\t\t \n\t\t\t 4 \n\t\t\t 890081 \n\t\t\t 2022 Aug 11 \n\t\t \n\t \n\t FREE Full text \n\t Strauss G, Flannery JE, Vierra E, Koepsell X, Berglund E, Miller I, et al. Meaningful engagement: a crossfunctional framework for digital therapeutics. Front Digit Health 2022 Aug 11;4:890081 [FREE Full text] [doi: 10.3389/fdgth.2022.890081] [Medline: 36052316] 142"
    },
    {
      "title": "Culturally responsive telepsychology and mHealth interventions for racial-ethnic minoritized youth: research gaps and future directions",
      "authors": [
        "H Willis",
        "J Gonzalez",
        "C Call",
        "D Quezada",
        "Scholars For",
        "Elevating Equity",
        "And Diversity",
        "C Gal\u00e1n",
        ") Seed",
        "C Gal\u00e1n"
      ],
      "year": 2022,
      "doi": "10.1080/15374416.2022.2124516",
      "journal": "J Clin Child Adolesc Psychol",
      "volume": "51",
      "issue": "6",
      "raw": "Culturally responsive telepsychology and mHealth interventions for racial-ethnic minoritized youth: research gaps and future directions \n\t\t \n\t\t\t H A Willis \n\t\t \n\t\t \n\t\t\t J C Gonzalez \n\t\t \n\t\t \n\t\t\t C C Call \n\t\t \n\t\t \n\t\t\t D Quezada \n\t\t \n\t\t \n\t\t\t Scholars For \n\t\t \n\t\t \n\t\t\t Elevating Equity \n\t\t \n\t\t \n\t\t\t And Diversity \n\t\t \n\t\t \n\t\t\t Seed \n\t\t \n\t\t \n\t\t\t C A Gal\u00e1n \n\t\t \n\t\t \n\t\t\t ) Seed \n\t\t \n\t\t \n\t\t\t C A Gal\u00e1n \n\t\t \n\t\t 10.1080/15374416.2022.2124516 \n\t\t Medline: 36227174] 143 \n\t \n\t \n\t\t J Clin Child Adolesc Psychol \n\t\t \n\t\t\t 51 \n\t\t\t 6 \n\t\t\t \n\t\t\t 2022 Nov \n\t\t \n\t \n\t Scholars for Elevating Equity and Diversity \n\t Willis HA, Gonzalez JC, Call CC, Quezada D, Scholars For Elevating Equity And Diversity Seed, Gal\u00e1n CA. Scholars for Elevating Equity and Diversity (SEED), Gal\u00e1n CA. Culturally responsive telepsychology and mHealth interventions for racial-ethnic minoritized youth: research gaps and future directions. J Clin Child Adolesc Psychol 2022 Nov;51(6):1053-1069 [doi: 10.1080/15374416.2022.2124516] [Medline: 36227174] 143"
    },
    {
      "title": "Framework for evaluating and developing sustainable telehealth programs",
      "authors": [
        "Y Zhang",
        "S Chandra",
        "M Pe\u00f1a",
        "L Lal",
        "R Summers",
        "J Swint"
      ],
      "year": 2023,
      "doi": "10.1089/tmj.2022.0407",
      "journal": "Telemed J E Health (Forthcoming",
      "raw": "Framework for evaluating and developing sustainable telehealth programs \n\t\t \n\t\t\t Y Zhang \n\t\t \n\t\t \n\t\t\t S Chandra \n\t\t \n\t\t \n\t\t\t M T Pe\u00f1a \n\t\t \n\t\t \n\t\t\t L Lal \n\t\t \n\t\t \n\t\t\t R L Summers \n\t\t \n\t\t \n\t\t\t J M Swint \n\t\t \n\t\t 10.1089/tmj.2022.0407 \n\t\t Medline: 36716266] 144 \n\t \n\t \n\t\t Telemed J E Health (Forthcoming \n\t\t \n\t\t\t 2023 Jan 30 \n\t\t \n\t \n\t Zhang Y, Chandra S, Pe\u00f1a MT, Lal L, Summers RL, Swint JM. Framework for evaluating and developing sustainable telehealth programs. Telemed J E Health (Forthcoming) 2023 Jan 30 [doi: 10.1089/tmj.2022.0407] [Medline: 36716266] 144"
    },
    {
      "title": "How should economic evaluation be used to measure value and set priorities in health care?",
      "authors": [
        "S Jayawardana",
        "E Mossialos"
      ],
      "year": 2021,
      "doi": "10.1001/amajethics.2021.613",
      "journal": "AMA J Ethics",
      "volume": "23",
      "issue": "8",
      "raw": "How should economic evaluation be used to measure value and set priorities in health care? \n\t\t \n\t\t\t S Jayawardana \n\t\t \n\t\t \n\t\t\t E Mossialos \n\t\t \n\t\t 10.1001/amajethics.2021.613 \n\t\t Medline: 34459728] 145 \n\t \n\t \n\t\t AMA J Ethics \n\t\t \n\t\t\t 23 \n\t\t\t 8 \n\t\t\t \n\t\t\t 2021 Aug 01 \n\t\t \n\t \n\t FREE Full text \n\t Jayawardana S, Mossialos E. How should economic evaluation be used to measure value and set priorities in health care? AMA J Ethics 2021 Aug 01;23(8):E613-E618 [FREE Full text] [doi: 10.1001/amajethics.2021.613] [Medline: 34459728] 145"
    },
    {
      "title": "Willingness of French general practitioners to prescribe mHealth apps and devices: quantitative study",
      "authors": [
        "Della Vecchia",
        "C Leroy",
        "T Bauquier",
        "C Pannard",
        "M Sarradon-Eck",
        "A Darmon"
      ],
      "year": 2022,
      "doi": "10.2196/28372",
      "journal": "JMIR Mhealth Uhealth",
      "volume": "10",
      "issue": "2",
      "pages": "28372",
      "raw": "Willingness of French general practitioners to prescribe mHealth apps and devices: quantitative study \n\t\t \n\t\t\t Della Vecchia \n\t\t \n\t\t \n\t\t\t C Leroy \n\t\t \n\t\t \n\t\t\t T Bauquier \n\t\t \n\t\t \n\t\t\t C Pannard \n\t\t \n\t\t \n\t\t\t M Sarradon-Eck \n\t\t \n\t\t \n\t\t\t A Darmon \n\t\t \n\t\t \n\t\t\t D \n\t\t \n\t\t 10.2196/28372 \n\t\t Medline: 35147508] 146 \n\t \n\t \n\t\t JMIR Mhealth Uhealth \n\t\t \n\t\t\t 10 \n\t\t\t 2 \n\t\t\t 28372 \n\t\t\t 2022 Feb 11 \n\t\t \n\t \n\t FREE Full text \n\t Della Vecchia C, Leroy T, Bauquier C, Pannard M, Sarradon-Eck A, Darmon D, et al. Willingness of French general practitioners to prescribe mHealth apps and devices: quantitative study. JMIR Mhealth Uhealth 2022 Feb 11;10(2):e28372 [FREE Full text] [doi: 10.2196/28372] [Medline: 35147508] 146"
    },
    {
      "title": "Acceptance of telerheumatology by rheumatologists and general practitioners in Germany: nationwide cross-sectional survey study",
      "authors": [
        "F Muehlensiepen",
        "J Knitza",
        "W Marquardt",
        "J Engler",
        "A Hueber",
        "M Welcker"
      ],
      "year": 2021,
      "doi": "10.2196/23742",
      "journal": "J Med Internet Res",
      "volume": "23",
      "issue": "3",
      "pages": "23742",
      "raw": "Acceptance of telerheumatology by rheumatologists and general practitioners in Germany: nationwide cross-sectional survey study \n\t\t \n\t\t\t F Muehlensiepen \n\t\t \n\t\t \n\t\t\t J Knitza \n\t\t \n\t\t \n\t\t\t W Marquardt \n\t\t \n\t\t \n\t\t\t J Engler \n\t\t \n\t\t \n\t\t\t A Hueber \n\t\t \n\t\t \n\t\t\t M Welcker \n\t\t \n\t\t 10.2196/23742 \n\t\t Medline: 33690147] 147 \n\t \n\t \n\t\t J Med Internet Res \n\t\t \n\t\t\t 23 \n\t\t\t 3 \n\t\t\t 23742 \n\t\t\t 2021 Mar 29 \n\t\t \n\t \n\t FREE Full text \n\t Muehlensiepen F, Knitza J, Marquardt W, Engler J, Hueber A, Welcker M. Acceptance of telerheumatology by rheumatologists and general practitioners in Germany: nationwide cross-sectional survey study. J Med Internet Res 2021 Mar 29;23(3):e23742 [FREE Full text] [doi: 10.2196/23742] [Medline: 33690147] 147"
    },
    {
      "title": "Expectations and perceived barriers to widespread implementation of eHealth in cardiology practice: results from a national survey in the Netherlands",
      "authors": [
        "R Treskes",
        "T Wildbergh",
        "M Schalij",
        "R Scherptong"
      ],
      "year": 2019,
      "doi": "10.1007/s12471-018-1199-9",
      "journal": "Neth Heart J",
      "volume": "27",
      "issue": "1",
      "raw": "Expectations and perceived barriers to widespread implementation of eHealth in cardiology practice: results from a national survey in the Netherlands \n\t\t \n\t\t\t R W Treskes \n\t\t \n\t\t \n\t\t\t T X Wildbergh \n\t\t \n\t\t \n\t\t\t M J Schalij \n\t\t \n\t\t \n\t\t\t R W Scherptong \n\t\t \n\t\t 10.1007/s12471-018-1199-9 \n\t\t Medline: 30488379] 148 \n\t \n\t \n\t\t Neth Heart J \n\t\t \n\t\t\t 27 \n\t\t\t 1 \n\t\t\t \n\t\t\t 2019 Jan \n\t\t \n\t \n\t FREE Full text \n\t Treskes RW, Wildbergh TX, Schalij MJ, Scherptong RW. Expectations and perceived barriers to widespread implementation of eHealth in cardiology practice: results from a national survey in the Netherlands. Neth Heart J 2019 Jan;27(1):18-23 [FREE Full text] [doi: 10.1007/s12471-018-1199-9] [Medline: 30488379] 148"
    },
    {
      "title": "Private payer telehealth reimbursement in the United States",
      "authors": [
        "N Antoniotti",
        "K Drude",
        "N Rowe"
      ],
      "year": 2014,
      "doi": "10.1089/tmj.2013.0256",
      "journal": "Telemed J E Health",
      "volume": "20",
      "issue": "6",
      "raw": "Private payer telehealth reimbursement in the United States \n\t\t \n\t\t\t N M Antoniotti \n\t\t \n\t\t \n\t\t\t K P Drude \n\t\t \n\t\t \n\t\t\t N Rowe \n\t\t \n\t\t 10.1089/tmj.2013.0256 \n\t\t Medline: 24654748] 149 \n\t \n\t \n\t\t Telemed J E Health \n\t\t \n\t\t\t 20 \n\t\t\t 6 \n\t\t\t \n\t\t\t 2014 Jun \n\t\t \n\t \n\t Antoniotti NM, Drude KP, Rowe N. Private payer telehealth reimbursement in the United States. Telemed J E Health 2014 Jun;20(6):539-543 [doi: 10.1089/tmj.2013.0256] [Medline: 24654748] 149"
    },
    {
      "title": "Worldwide implementation of telemedicine programs in association with research performance and health policy",
      "authors": [
        "A Avanesova",
        "T Shamliyan"
      ],
      "year": 2019,
      "doi": "10.1016/j.hlpt.2019.04.001",
      "journal": "Health Policy Technol",
      "volume": "8",
      "issue": "2",
      "raw": "Worldwide implementation of telemedicine programs in association with research performance and health policy \n\t\t \n\t\t\t A A Avanesova \n\t\t \n\t\t \n\t\t\t T A Shamliyan \n\t\t \n\t\t 10.1016/j.hlpt.2019.04.001 \n\t \n\t \n\t\t Health Policy Technol \n\t\t \n\t\t\t 8 \n\t\t\t 2 \n\t\t\t \n\t\t\t 2019 Jun \n\t\t \n\t \n\t FREE Full text \n\t Avanesova AA, Shamliyan TA. Worldwide implementation of telemedicine programs in association with research performance and health policy. Health Policy Technol 2019 Jun;8(2):179-191 [FREE Full text] [doi: 10.1016/j.hlpt.2019.04.001] 150"
    },
    {
      "title": "Telemedicine for patients with rheumatic and musculoskeletal diseases during the COVID-19 pandemic; a positive experience in the Netherlands",
      "authors": [
        "W Bos",
        "A Van Tubergen",
        "H Vonkeman"
      ],
      "year": 2021,
      "doi": "10.1007/s00296-020-04771-6",
      "journal": "Rheumatol Int",
      "volume": "41",
      "issue": "3",
      "raw": "Telemedicine for patients with rheumatic and musculoskeletal diseases during the COVID-19 pandemic; a positive experience in the Netherlands \n\t\t \n\t\t\t W H Bos \n\t\t \n\t\t \n\t\t\t A Van Tubergen \n\t\t \n\t\t \n\t\t\t H E Vonkeman \n\t\t \n\t\t 10.1007/s00296-020-04771-6 \n\t\t Medline: 33449162] 151 \n\t \n\t \n\t\t Rheumatol Int \n\t\t \n\t\t\t 41 \n\t\t\t 3 \n\t\t\t \n\t\t\t 2021 Mar \n\t\t \n\t \n\t FREE Full text \n\t Bos WH, van Tubergen A, Vonkeman HE. Telemedicine for patients with rheumatic and musculoskeletal diseases during the COVID-19 pandemic; a positive experience in the Netherlands. Rheumatol Int 2021 Mar;41(3):565-573 [FREE Full text] [doi: 10.1007/s00296-020-04771-6] [Medline: 33449162] 151"
    },
    {
      "title": "Using public datasets to identify priority areas for ocular telehealth",
      "authors": [
        "C Brady",
        "D 'amico",
        "S Withers",
        "N Kim"
      ],
      "year": 2021,
      "doi": "10.1089/tmj.2020.0433",
      "journal": "Telemed J E Health",
      "volume": "27",
      "issue": "11",
      "raw": "Using public datasets to identify priority areas for ocular telehealth \n\t\t \n\t\t\t C J Brady \n\t\t \n\t\t \n\t\t\t D 'amico \n\t\t \n\t\t \n\t\t\t S Withers \n\t\t \n\t\t \n\t\t\t N Kim \n\t\t \n\t\t \n\t\t\t B Y \n\t\t \n\t\t 10.1089/tmj.2020.0433 \n\t\t Medline: 33600257] 152 \n\t \n\t \n\t\t Telemed J E Health \n\t\t \n\t\t\t 27 \n\t\t\t 11 \n\t\t\t \n\t\t\t 2021 Nov \n\t\t \n\t \n\t FREE Full text \n\t Brady CJ, D'Amico S, Withers N, Kim BY. Using public datasets to identify priority areas for ocular telehealth. Telemed J E Health 2021 Nov;27(11):1293-1298 [FREE Full text] [doi: 10.1089/tmj.2020.0433] [Medline: 33600257] 152"
    },
    {
      "title": "Economic burden and health care access for patients with inflammatory bowel diseases in China: web-based survey study",
      "authors": [
        "Q Yu",
        "C Zhu",
        "S Feng",
        "L Xu",
        "S Hu",
        "H Chen"
      ],
      "year": 2021,
      "doi": "10.2196/20629",
      "journal": "J Med Internet Res",
      "volume": "23",
      "issue": "1",
      "pages": "e20629",
      "raw": "Economic burden and health care access for patients with inflammatory bowel diseases in China: web-based survey study \n\t\t \n\t\t\t Q Yu \n\t\t \n\t\t \n\t\t\t C Zhu \n\t\t \n\t\t \n\t\t\t S Feng \n\t\t \n\t\t \n\t\t\t L Xu \n\t\t \n\t\t \n\t\t\t S Hu \n\t\t \n\t\t \n\t\t\t H Chen \n\t\t \n\t\t 10.2196/20629 \n\t\t Medline: 33399540] 153 \n\t \n\t \n\t\t J Med Internet Res \n\t\t \n\t\t\t 23 \n\t\t\t 1 \n\t\t\t e20629 \n\t\t\t 2021 Jan 05 \n\t\t \n\t \n\t FREE Full text \n\t Yu Q, Zhu C, Feng S, Xu L, Hu S, Chen H, et al. Economic burden and health care access for patients with inflammatory bowel diseases in China: web-based survey study. J Med Internet Res 2021 Jan 05;23(1):e20629 [FREE Full text] [doi: 10.2196/20629] [Medline: 33399540] 153"
    },
    {
      "title": "The impact of the Medicaid expansion on telemental health utilization in four midwestern states",
      "authors": [
        "A Harju",
        "J Neufeld"
      ],
      "year": 2021,
      "doi": "10.1089/tmj.2020.0476",
      "journal": "Telemed J E Health",
      "volume": "27",
      "issue": "11",
      "raw": "The impact of the Medicaid expansion on telemental health utilization in four midwestern states \n\t\t \n\t\t\t A Harju \n\t\t \n\t\t \n\t\t\t J Neufeld \n\t\t \n\t\t 10.1089/tmj.2020.0476 \n\t\t Medline: 33428526] 154 \n\t \n\t \n\t\t Telemed J E Health \n\t\t \n\t\t\t 27 \n\t\t\t 11 \n\t\t\t \n\t\t\t 2021 Nov \n\t\t \n\t \n\t Harju A, Neufeld J. The impact of the Medicaid expansion on telemental health utilization in four midwestern states. Telemed J E Health 2021 Nov;27(11):1260-1267 [doi: 10.1089/tmj.2020.0476] [Medline: 33428526] 154"
    },
    {
      "title": "Telehealth: advances in alternative payment models",
      "authors": [
        "M Zhao",
        "H Hamadi",
        "D Haley",
        "J Xu",
        "C White-Williams",
        "S Park"
      ],
      "year": 2020,
      "doi": "10.1089/tmj.2019.0294",
      "journal": "Telemed J E Health",
      "volume": "26",
      "issue": "12",
      "raw": "Telehealth: advances in alternative payment models \n\t\t \n\t\t\t M Zhao \n\t\t \n\t\t \n\t\t\t H Hamadi \n\t\t \n\t\t \n\t\t\t D R Haley \n\t\t \n\t\t \n\t\t\t J Xu \n\t\t \n\t\t \n\t\t\t C White-Williams \n\t\t \n\t\t \n\t\t\t S Park \n\t\t \n\t\t 10.1089/tmj.2019.0294 \n\t\t Medline: 32101100] 155 \n\t \n\t \n\t\t Telemed J E Health \n\t\t \n\t\t\t 26 \n\t\t\t 12 \n\t\t\t \n\t\t\t 2020 Dec \n\t\t \n\t \n\t Zhao M, Hamadi H, Haley DR, Xu J, White-Williams C, Park S. Telehealth: advances in alternative payment models. Telemed J E Health 2020 Dec;26(12):1492-1499 [doi: 10.1089/tmj.2019.0294] [Medline: 32101100] 155"
    },
    {
      "title": "Key factors affecting the adoption of telemedicine by ambulatory clinics: insights from a statewide survey",
      "authors": [
        "C Ranganathan",
        "S Balaji"
      ],
      "year": 2020,
      "doi": "10.1089/tmj.2018.0114",
      "journal": "Telemed J E Health",
      "volume": "26",
      "issue": "2",
      "raw": "Key factors affecting the adoption of telemedicine by ambulatory clinics: insights from a statewide survey \n\t\t \n\t\t\t C Ranganathan \n\t\t \n\t\t \n\t\t\t S Balaji \n\t\t \n\t\t 10.1089/tmj.2018.0114 \n\t\t Medline: 30874484] 156 \n\t \n\t \n\t\t Telemed J E Health \n\t\t \n\t\t\t 26 \n\t\t\t 2 \n\t\t\t \n\t\t\t 2020 Feb \n\t\t \n\t \n\t Ranganathan C, Balaji S. Key factors affecting the adoption of telemedicine by ambulatory clinics: insights from a statewide survey. Telemed J E Health 2020 Feb;26(2):218-225 [doi: 10.1089/tmj.2018.0114] [Medline: 30874484] 156"
    },
    {
      "title": "Association of financial factors and telemedicine adoption for heart attack and stroke care among rural and urban hospitals: a longitudinal study",
      "authors": [
        "Alishahi Tabriz",
        "A Turner",
        "Williams Jr",
        "D Babu",
        "N North",
        "S Shea"
      ],
      "year": 2022,
      "doi": "10.1089/tmj.2021.0341",
      "journal": "Telemed J E Health",
      "volume": "28",
      "issue": "6",
      "raw": "Association of financial factors and telemedicine adoption for heart attack and stroke care among rural and urban hospitals: a longitudinal study \n\t\t \n\t\t\t Alishahi Tabriz \n\t\t \n\t\t \n\t\t\t A Turner \n\t\t \n\t\t \n\t\t\t K \n\t\t \n\t\t \n\t\t\t Williams Jr \n\t\t \n\t\t \n\t\t\t D Babu \n\t\t \n\t\t \n\t\t\t N North \n\t\t \n\t\t \n\t\t\t S Shea \n\t\t \n\t\t \n\t\t\t C M \n\t\t \n\t\t 10.1089/tmj.2021.0341 \n\t\t Medline: 34559014] 157 \n\t \n\t \n\t\t Telemed J E Health \n\t\t \n\t\t\t 28 \n\t\t\t 6 \n\t\t\t \n\t\t\t 2022 Jun \n\t\t \n\t \n\t FREE Full text \n\t Alishahi Tabriz A, Turner K, Williams Jr D, Babu N, North S, Shea CM. Association of financial factors and telemedicine adoption for heart attack and stroke care among rural and urban hospitals: a longitudinal study. Telemed J E Health 2022 Jun;28(6):781-788 [FREE Full text] [doi: 10.1089/tmj.2021.0341] [Medline: 34559014] 157"
    },
    {
      "title": "European Network to Advance Best Practices and Technology on Medication Adherence (ENABLE). Reimbursed medication adherence enhancing interventions in European countries: results of the EUREcA study",
      "authors": [
        "T \u00c1gh",
        "M Had\u017eiabdi\u0107",
        "K Garuoliene",
        "A Granas",
        "E Aarnio",
        "E Menditto"
      ],
      "year": 2022,
      "doi": "10.3389/fphar.2022.892240",
      "journal": "Front Pharmacol",
      "volume": "13",
      "pages": "892240",
      "raw": "European Network to Advance Best Practices and Technology on Medication Adherence (ENABLE). Reimbursed medication adherence enhancing interventions in European countries: results of the EUREcA study \n\t\t \n\t\t\t T \u00c1gh \n\t\t \n\t\t \n\t\t\t M O Had\u017eiabdi\u0107 \n\t\t \n\t\t \n\t\t\t K Garuoliene \n\t\t \n\t\t \n\t\t\t A G Granas \n\t\t \n\t\t \n\t\t\t E Aarnio \n\t\t \n\t\t \n\t\t\t E Menditto \n\t\t \n\t\t 10.3389/fphar.2022.892240 \n\t\t Medline: 35784711] 158 \n\t \n\t \n\t\t Front Pharmacol \n\t\t \n\t\t\t 13 \n\t\t\t 892240 \n\t\t\t 2022 Jun 17 \n\t\t \n\t \n\t FREE Full text \n\t \u00c1gh T, Had\u017eiabdi\u0107 MO, Garuoliene K, Granas AG, Aarnio E, Menditto E, European Network to Advance Best Practices and Technology on Medication Adherence (ENABLE). Reimbursed medication adherence enhancing interventions in European countries: results of the EUREcA study. Front Pharmacol 2022 Jun 17;13:892240 [FREE Full text] [doi: 10.3389/fphar.2022.892240] [Medline: 35784711] 158"
    },
    {
      "title": "A review of Medicare expenditure in Australia for psychiatric consultations delivered in person and via videoconference",
      "authors": [
        "A Smith",
        "N Armfield",
        "J Croll",
        "L Gray"
      ],
      "year": 2012,
      "doi": "10.1258/jtt.2012.sft111",
      "journal": "J Telemed Telecare",
      "volume": "18",
      "issue": "3",
      "raw": "A review of Medicare expenditure in Australia for psychiatric consultations delivered in person and via videoconference \n\t\t \n\t\t\t A C Smith \n\t\t \n\t\t \n\t\t\t N R Armfield \n\t\t \n\t\t \n\t\t\t J Croll \n\t\t \n\t\t \n\t\t\t L C Gray \n\t\t \n\t\t 10.1258/jtt.2012.sft111 \n\t\t Medline: 22362827] 159 \n\t \n\t \n\t\t J Telemed Telecare \n\t\t \n\t\t\t 18 \n\t\t\t 3 \n\t\t\t \n\t\t\t 2012 Apr \n\t\t \n\t \n\t Smith AC, Armfield NR, Croll J, Gray LC. A review of Medicare expenditure in Australia for psychiatric consultations delivered in person and via videoconference. J Telemed Telecare 2012 Apr;18(3):169-171 [doi: 10.1258/jtt.2012.SFT111] [Medline: 22362827] 159"
    },
    {
      "title": "Acceptance towards digital health interventions -model validation and further development of the unified theory of acceptance and use of technology",
      "authors": [
        "P Philippi",
        "H Baumeister",
        "J Apolin\u00e1rio-Hagen",
        "D Ebert",
        "S Hennemann",
        "L Kott"
      ],
      "year": 2021,
      "doi": "10.1016/j.invent.2021.100459",
      "journal": "Internet Interv",
      "volume": "26",
      "pages": "100459",
      "raw": "Acceptance towards digital health interventions -model validation and further development of the unified theory of acceptance and use of technology \n\t\t \n\t\t\t P Philippi \n\t\t \n\t\t \n\t\t\t H Baumeister \n\t\t \n\t\t \n\t\t\t J Apolin\u00e1rio-Hagen \n\t\t \n\t\t \n\t\t\t D D Ebert \n\t\t \n\t\t \n\t\t\t S Hennemann \n\t\t \n\t\t \n\t\t\t L Kott \n\t\t \n\t\t 10.1016/j.invent.2021.100459 \n\t\t Medline: 34603973] 160 \n\t \n\t \n\t\t Internet Interv \n\t\t \n\t\t\t 26 \n\t\t\t 100459 \n\t\t\t 2021 Sep 20 \n\t\t \n\t \n\t FREE Full text \n\t Philippi P, Baumeister H, Apolin\u00e1rio-Hagen J, Ebert DD, Hennemann S, Kott L, et al. Acceptance towards digital health interventions -model validation and further development of the unified theory of acceptance and use of technology. Internet Interv 2021 Sep 20;26:100459 [FREE Full text] [doi: 10.1016/j.invent.2021.100459] [Medline: 34603973] 160"
    },
    {
      "title": "An economic impact model for estimating the value to health systems of a digital intervention for diabetes primary care: development and usefulness study",
      "authors": [
        "B Powers",
        "A Bucher"
      ],
      "year": 2022,
      "doi": "10.2196/37745",
      "journal": "JMIR Form Res",
      "volume": "6",
      "issue": "9",
      "pages": "37745",
      "raw": "An economic impact model for estimating the value to health systems of a digital intervention for diabetes primary care: development and usefulness study \n\t\t \n\t\t\t B Powers \n\t\t \n\t\t \n\t\t\t A Bucher \n\t\t \n\t\t 10.2196/37745 \n\t\t Medline: 36155985] 161 \n\t \n\t \n\t\t JMIR Form Res \n\t\t \n\t\t\t 6 \n\t\t\t 9 \n\t\t\t 37745 \n\t\t\t 2022 Sep 26 \n\t\t \n\t \n\t FREE Full text \n\t Powers B, Bucher A. An economic impact model for estimating the value to health systems of a digital intervention for diabetes primary care: development and usefulness study. JMIR Form Res 2022 Sep 26;6(9):e37745 [FREE Full text] [doi: 10.2196/37745] [Medline: 36155985] 161"
    },
    {
      "title": "Chance of reimbursement for ADD-ON therapies in Poland and in the world -review of the reimbursement recommendations",
      "authors": [
        "E Borowiack",
        "M Marzec",
        "A Nowotarska",
        "J Jarosz",
        "A Orkisz",
        "P Prz\u0105da-Machno"
      ],
      "year": 2018,
      "journal": "Przegl Epidemiol",
      "volume": "72",
      "issue": "1",
      "raw": "Chance of reimbursement for ADD-ON therapies in Poland and in the world -review of the reimbursement recommendations \n\t\t \n\t\t\t E Borowiack \n\t\t \n\t\t \n\t\t\t M Marzec \n\t\t \n\t\t \n\t\t\t A Nowotarska \n\t\t \n\t\t \n\t\t\t J Jarosz \n\t\t \n\t\t \n\t\t\t A Orkisz \n\t\t \n\t\t \n\t\t\t P Prz\u0105da-Machno \n\t\t \n\t\t Medline: 29667385] 162 \n\t \n\t \n\t\t Przegl Epidemiol \n\t\t \n\t\t\t 72 \n\t\t\t 1 \n\t\t\t \n\t\t\t 2018 \n\t\t \n\t \n\t FREE Full text \n\t Borowiack E, Marzec M, Nowotarska A, Jarosz J, Orkisz A, Prz\u0105da-Machno P. Chance of reimbursement for ADD-ON therapies in Poland and in the world -review of the reimbursement recommendations. Przegl Epidemiol 2018;72(1):99-109 [FREE Full text] [Medline: 29667385] 162"
    },
    {
      "title": "Digital health care in public private partnership mode",
      "authors": [
        "K Ganapathy",
        "S Das",
        "S Reddy",
        "V Thaploo",
        "A Nazneen",
        "A Kosuru"
      ],
      "year": 2021,
      "doi": "10.1089/tmj.2020.0499",
      "journal": "Telemed J E Health",
      "volume": "27",
      "issue": "12",
      "raw": "Digital health care in public private partnership mode \n\t\t \n\t\t\t K Ganapathy \n\t\t \n\t\t \n\t\t\t S Das \n\t\t \n\t\t \n\t\t\t S Reddy \n\t\t \n\t\t \n\t\t\t V Thaploo \n\t\t \n\t\t \n\t\t\t A Nazneen \n\t\t \n\t\t \n\t\t\t A Kosuru \n\t\t \n\t\t 10.1089/tmj.2020.0499 \n\t\t Medline: 33819433] 163 \n\t \n\t \n\t\t Telemed J E Health \n\t\t \n\t\t\t 27 \n\t\t\t 12 \n\t\t\t \n\t\t\t 2021 Dec \n\t\t \n\t \n\t Ganapathy K, Das S, Reddy S, Thaploo V, Nazneen A, Kosuru A, et al. Digital health care in public private partnership mode. Telemed J E Health 2021 Dec;27(12):1363-1371 [doi: 10.1089/tmj.2020.0499] [Medline: 33819433] 163"
    },
    {
      "title": "E-health in low-and middle-income countries: findings from the center for health market innovations",
      "authors": [
        "T Lewis",
        "C Synowiec",
        "G Lagomarsino",
        "J Schweitzer"
      ],
      "year": 2012,
      "doi": "10.2471/BLT.11.099820",
      "journal": "Bull World Health Organ",
      "volume": "90",
      "issue": "5",
      "raw": "E-health in low-and middle-income countries: findings from the center for health market innovations \n\t\t \n\t\t\t T Lewis \n\t\t \n\t\t \n\t\t\t C Synowiec \n\t\t \n\t\t \n\t\t\t G Lagomarsino \n\t\t \n\t\t \n\t\t\t J Schweitzer \n\t\t \n\t\t 10.2471/BLT.11.099820 \n\t\t Medline: 22589566] 164 \n\t \n\t \n\t\t Bull World Health Organ \n\t\t \n\t\t\t 90 \n\t\t\t 5 \n\t\t\t \n\t\t\t 2012 May 01 \n\t\t \n\t \n\t FREE Full text \n\t Lewis T, Synowiec C, Lagomarsino G, Schweitzer J. E-health in low-and middle-income countries: findings from the center for health market innovations. Bull World Health Organ 2012 May 01;90(5):332-340 [FREE Full text] [doi: 10.2471/BLT.11.099820] [Medline: 22589566] 164"
    },
    {
      "title": "Healthcare digitalization and pay-for-performance incentives in smart hospital project financing",
      "authors": [
        "Moro Visconti",
        "R Morea"
      ],
      "year": 2020,
      "doi": "10.3390/ijerph17072318",
      "journal": "Int J Environ Res Public Health",
      "volume": "17",
      "issue": "7",
      "pages": "2318",
      "raw": "Healthcare digitalization and pay-for-performance incentives in smart hospital project financing \n\t\t \n\t\t\t Moro Visconti \n\t\t \n\t\t \n\t\t\t R Morea \n\t\t \n\t\t \n\t\t\t D \n\t\t \n\t\t 10.3390/ijerph17072318 \n\t\t Medline: 32235517] 165 \n\t \n\t \n\t\t Int J Environ Res Public Health \n\t\t \n\t\t\t 17 \n\t\t\t 7 \n\t\t\t 2318 \n\t\t\t 2020 Mar 30 \n\t\t \n\t \n\t FREE Full text \n\t Moro Visconti R, Morea D. Healthcare digitalization and pay-for-performance incentives in smart hospital project financing. Int J Environ Res Public Health 2020 Mar 30;17(7):2318 [FREE Full text] [doi: 10.3390/ijerph17072318] [Medline: 32235517] 165"
    },
    {
      "title": "How does service price influence patients' decisions? An examination of the free-market pricing mechanism in online health communities",
      "authors": [
        "H Wu",
        "Z Deng",
        "B Wang",
        "S Gupta"
      ],
      "year": 2021,
      "doi": "10.1007/s12525-020-00453-0",
      "journal": "Electron Mark",
      "volume": "31",
      "raw": "How does service price influence patients' decisions? An examination of the free-market pricing mechanism in online health communities \n\t\t \n\t\t\t H Wu \n\t\t \n\t\t \n\t\t\t Z Deng \n\t\t \n\t\t \n\t\t\t B Wang \n\t\t \n\t\t \n\t\t\t S Gupta \n\t\t \n\t\t 10.1007/s12525-020-00453-0 \n\t \n\t \n\t\t Electron Mark \n\t\t \n\t\t\t 31 \n\t\t\t \n\t\t\t 2021 Mar 12 \n\t\t \n\t \n\t FREE Full text \n\t Wu H, Deng Z, Wang B, Gupta S. How does service price influence patients' decisions? An examination of the free-market pricing mechanism in online health communities. Electron Mark 2021 Mar 12;31:877-893 [FREE Full text] [doi: 10.1007/s12525-020-00453-0] 166"
    },
    {
      "title": "Mobile apps for blood pressure monitoring: systematic search in app stores and content analysis",
      "authors": [
        "H Jamaladin",
        "T Van De Belt",
        "L Luijpers",
        "F De Graaff",
        "S Bredie",
        "N Roeleveld"
      ],
      "year": 2018,
      "doi": "10.2196/mhealth.9888",
      "journal": "JMIR Mhealth Uhealth",
      "volume": "6",
      "issue": "11",
      "pages": "e187",
      "raw": "Mobile apps for blood pressure monitoring: systematic search in app stores and content analysis \n\t\t \n\t\t\t H Jamaladin \n\t\t \n\t\t \n\t\t\t T H Van De Belt \n\t\t \n\t\t \n\t\t\t L C Luijpers \n\t\t \n\t\t \n\t\t\t F R De Graaff \n\t\t \n\t\t \n\t\t\t S J Bredie \n\t\t \n\t\t \n\t\t\t N Roeleveld \n\t\t \n\t\t 10.2196/mhealth.9888 \n\t\t Medline: 30429116] 167 \n\t \n\t \n\t\t JMIR Mhealth Uhealth \n\t\t \n\t\t\t 6 \n\t\t\t 11 \n\t\t\t e187 \n\t\t\t 2018 Nov 14 \n\t\t \n\t \n\t FREE Full text \n\t Jamaladin H, van de Belt TH, Luijpers LC, de Graaff FR, Bredie SJ, Roeleveld N, et al. Mobile apps for blood pressure monitoring: systematic search in app stores and content analysis. JMIR Mhealth Uhealth 2018 Nov 14;6(11):e187 [FREE Full text] [doi: 10.2196/mhealth.9888] [Medline: 30429116] 167"
    },
    {
      "title": "Private payer reimbursement for telemedicine services in the United States",
      "authors": [
        "P Whitten",
        "L Buis"
      ],
      "year": 2007,
      "doi": "10.1089/tmj.2006.0028",
      "journal": "Telemed J E Health",
      "volume": "13",
      "issue": "1",
      "raw": "Private payer reimbursement for telemedicine services in the United States \n\t\t \n\t\t\t P Whitten \n\t\t \n\t\t \n\t\t\t L Buis \n\t\t \n\t\t 10.1089/tmj.2006.0028 \n\t\t Medline: 17309350] 168 \n\t \n\t \n\t\t Telemed J E Health \n\t\t \n\t\t\t 13 \n\t\t\t 1 \n\t\t\t \n\t\t\t 2007 Feb \n\t\t \n\t \n\t Whitten P, Buis L. Private payer reimbursement for telemedicine services in the United States. Telemed J E Health 2007 Feb;13(1):15-23 [doi: 10.1089/tmj.2006.0028] [Medline: 17309350] 168"
    },
    {
      "title": "Service provision, pricing, and patient satisfaction in online health communities",
      "authors": [
        "H Wu",
        "N Lu"
      ],
      "year": 2018,
      "doi": "10.1016/j.ijmedinf.2017.11.009",
      "journal": "Int J Med Inform",
      "volume": "110",
      "raw": "Service provision, pricing, and patient satisfaction in online health communities \n\t\t \n\t\t\t H Wu \n\t\t \n\t\t \n\t\t\t N Lu \n\t\t \n\t\t 10.1016/j.ijmedinf.2017.11.009 \n\t\t Medline: 29331257] 169 \n\t \n\t \n\t\t Int J Med Inform \n\t\t \n\t\t\t 110 \n\t\t\t \n\t\t\t 2018 Feb \n\t\t \n\t \n\t Wu H, Lu N. Service provision, pricing, and patient satisfaction in online health communities. Int J Med Inform 2018 Feb;110:77-89 [doi: 10.1016/j.ijmedinf.2017.11.009] [Medline: 29331257] 169"
    },
    {
      "title": "State policies influence Medicare telemedicine utilization",
      "authors": [
        "J Neufeld",
        "C Doarn",
        "R Aly"
      ],
      "year": 2016,
      "doi": "10.1089/tmj.2015.0044",
      "journal": "Telemed J E Health",
      "volume": "22",
      "issue": "1",
      "raw": "State policies influence Medicare telemedicine utilization \n\t\t \n\t\t\t J D Neufeld \n\t\t \n\t\t \n\t\t\t C R Doarn \n\t\t \n\t\t \n\t\t\t R Aly \n\t\t \n\t\t 10.1089/tmj.2015.0044 \n\t\t Medline: 26218148] 170 \n\t \n\t \n\t\t Telemed J E Health \n\t\t \n\t\t\t 22 \n\t\t\t 1 \n\t\t\t \n\t\t\t 2016 Jan \n\t\t \n\t \n\t Neufeld JD, Doarn CR, Aly R. State policies influence Medicare telemedicine utilization. Telemed J E Health 2016 Jan;22(1):70-74 [doi: 10.1089/tmj.2015.0044] [Medline: 26218148] 170"
    },
    {
      "title": "Telemedicine spending by Medicare: a snapshot from 2012",
      "authors": [
        "J Neufeld",
        "C Doarn"
      ],
      "year": 2015,
      "doi": "10.1089/tmj.2014.0185",
      "journal": "Telemed J E Health",
      "volume": "21",
      "issue": "8",
      "raw": "Telemedicine spending by Medicare: a snapshot from 2012 \n\t\t \n\t\t\t J D Neufeld \n\t\t \n\t\t \n\t\t\t C R Doarn \n\t\t \n\t\t 10.1089/tmj.2014.0185 \n\t\t Medline: 25839672] 171 \n\t \n\t \n\t\t Telemed J E Health \n\t\t \n\t\t\t 21 \n\t\t\t 8 \n\t\t\t \n\t\t\t 2015 Aug \n\t\t \n\t \n\t Neufeld JD, Doarn CR. Telemedicine spending by Medicare: a snapshot from 2012. Telemed J E Health 2015 Aug;21(8):686-693 [doi: 10.1089/tmj.2014.0185] [Medline: 25839672] 171"
    },
    {
      "title": "The impact of telemedicine on patients' cost savings: some preliminary findings",
      "authors": [
        "A Bynum",
        "C Irwin",
        "C Cranford",
        "G Denny"
      ],
      "year": 2003,
      "doi": "10.1089/153056203772744680",
      "journal": "Telemed J E Health",
      "volume": "9",
      "issue": "4",
      "raw": "The impact of telemedicine on patients' cost savings: some preliminary findings \n\t\t \n\t\t\t A B Bynum \n\t\t \n\t\t \n\t\t\t C A Irwin \n\t\t \n\t\t \n\t\t\t C O Cranford \n\t\t \n\t\t \n\t\t\t G S Denny \n\t\t \n\t\t 10.1089/153056203772744680 \n\t\t Medline: 14980093] 172 \n\t \n\t \n\t\t Telemed J E Health \n\t\t \n\t\t\t 9 \n\t\t\t 4 \n\t\t\t \n\t\t\t 2003 \n\t\t \n\t \n\t Bynum AB, Irwin CA, Cranford CO, Denny GS. The impact of telemedicine on patients' cost savings: some preliminary findings. Telemed J E Health 2003;9(4):361-367 [doi: 10.1089/153056203772744680] [Medline: 14980093] 172"
    },
    {
      "title": "The promise of mHealth for chronic disease management under different payment systems",
      "authors": [
        "B Rajan",
        "A Sainathan",
        "S Agnihothri",
        "L Cui"
      ],
      "year": 2022,
      "doi": "10.1287/msom.2022.1143",
      "journal": "Manuf Serv Oper Manag",
      "volume": "24",
      "issue": "6",
      "raw": "The promise of mHealth for chronic disease management under different payment systems \n\t\t \n\t\t\t B Rajan \n\t\t \n\t\t \n\t\t\t A Sainathan \n\t\t \n\t\t \n\t\t\t S Agnihothri \n\t\t \n\t\t \n\t\t\t L Cui \n\t\t \n\t\t 10.1287/msom.2022.1143 \n\t \n\t \n\t\t Manuf Serv Oper Manag \n\t\t \n\t\t\t 24 \n\t\t\t 6 \n\t\t\t \n\t\t\t 2022 \n\t\t \n\t \n\t FREE Full text \n\t Rajan B, Sainathan A, Agnihothri S, Cui L. The promise of mHealth for chronic disease management under different payment systems. Manuf Serv Oper Manag 2022;24(6):3158-3176 [FREE Full text] [doi: 10.1287/msom.2022.1143] 173"
    },
    {
      "title": "Understanding and addressing the treatment gap in mental healthcare: economic perspectives and evidence from China",
      "authors": [
        "X Qin",
        "C Hsieh"
      ],
      "year": 2020,
      "doi": "10.1177/0046958020950566",
      "journal": "Inquiry",
      "volume": "57",
      "pages": "46958020950566",
      "raw": "Understanding and addressing the treatment gap in mental healthcare: economic perspectives and evidence from China \n\t\t \n\t\t\t X Qin \n\t\t \n\t\t \n\t\t\t C R Hsieh \n\t\t \n\t\t 10.1177/0046958020950566 \n\t\t Medline: 32964754] 174 \n\t \n\t \n\t\t Inquiry \n\t\t \n\t\t\t 57 \n\t\t\t 46958020950566 \n\t\t\t 2020 Jan \n\t\t \n\t \n\t FREE Full text \n\t Qin X, Hsieh CR. Understanding and addressing the treatment gap in mental healthcare: economic perspectives and evidence from China. Inquiry 2020 Jan;57:46958020950566 [FREE Full text] [doi: 10.1177/0046958020950566] [Medline: 32964754] 174"
    },
    {
      "title": "Validation study of a value-based digital health questionnaire",
      "authors": [
        "R Nu\u00f1o-Solin\u00eds",
        "E Urizar",
        "M Merino",
        "Del Barrio",
        "Errea Rodr\u00edguez"
      ],
      "year": 2022,
      "doi": "10.3390/ijerph19127034",
      "journal": "Int J Environ Res Public Health",
      "volume": "19",
      "issue": "12",
      "pages": "7034",
      "raw": "Validation study of a value-based digital health questionnaire \n\t\t \n\t\t\t R Nu\u00f1o-Solin\u00eds \n\t\t \n\t\t \n\t\t\t E Urizar \n\t\t \n\t\t \n\t\t\t M Merino \n\t\t \n\t\t \n\t\t\t Del Barrio \n\t\t \n\t\t \n\t\t\t J \n\t\t \n\t\t \n\t\t\t Errea Rodr\u00edguez \n\t\t \n\t\t \n\t\t\t M \n\t\t \n\t\t 10.3390/ijerph19127034 \n\t\t Medline: 35742288] 175 \n\t \n\t \n\t\t Int J Environ Res Public Health \n\t\t \n\t\t\t 19 \n\t\t\t 12 \n\t\t\t 7034 \n\t\t\t 2022 Jun 08 \n\t\t \n\t \n\t FREE Full text \n\t Nu\u00f1o-Solin\u00eds R, Urizar E, Merino M, Del Barrio J, Errea Rodr\u00edguez M. Validation study of a value-based digital health questionnaire. Int J Environ Res Public Health 2022 Jun 08;19(12):7034 [FREE Full text] [doi: 10.3390/ijerph19127034] [Medline: 35742288] 175"
    },
    {
      "title": "The use of digital health tools for health promotion among women with and without chronic diseases: insights from the 2017-2020 health information national trends survey",
      "authors": [
        "K Ajayi",
        "E Wachira",
        "H Onyeaka",
        "T Montour",
        "S Olowolaju",
        "W Garney"
      ],
      "year": 2022,
      "doi": "10.2196/39520",
      "journal": "JMIR Mhealth Uhealth",
      "volume": "10",
      "issue": "8",
      "pages": "39520",
      "raw": "The use of digital health tools for health promotion among women with and without chronic diseases: insights from the 2017-2020 health information national trends survey \n\t\t \n\t\t\t K V Ajayi \n\t\t \n\t\t \n\t\t\t E Wachira \n\t\t \n\t\t \n\t\t\t H K Onyeaka \n\t\t \n\t\t \n\t\t\t T Montour \n\t\t \n\t\t \n\t\t\t S Olowolaju \n\t\t \n\t\t \n\t\t\t W Garney \n\t\t \n\t\t 10.2196/39520 \n\t\t Medline: 35984680] 176 \n\t \n\t \n\t\t JMIR Mhealth Uhealth \n\t\t \n\t\t\t 10 \n\t\t\t 8 \n\t\t\t 39520 \n\t\t\t 2022 Aug 19 \n\t\t \n\t \n\t FREE Full text \n\t Ajayi KV, Wachira E, Onyeaka HK, Montour T, Olowolaju S, Garney W. The use of digital health tools for health promotion among women with and without chronic diseases: insights from the 2017-2020 health information national trends survey. JMIR Mhealth Uhealth 2022 Aug 19;10(8):e39520 [FREE Full text] [doi: 10.2196/39520] [Medline: 35984680] 176"
    },
    {
      "title": "Real-world evidence of implementing eHealth enables fluent symptom-based follow-up of a growing number of patients with breast cancer with the same healthcare resources",
      "authors": [
        "M B\u00e4rlund",
        "L Takala",
        "L Tianen",
        "P Kellokumpu-Lehtinen"
      ],
      "year": 2022,
      "doi": "10.1016/j.clbc.2021.09.005",
      "journal": "Clin Breast Cancer",
      "volume": "22",
      "issue": "3",
      "raw": "Real-world evidence of implementing eHealth enables fluent symptom-based follow-up of a growing number of patients with breast cancer with the same healthcare resources \n\t\t \n\t\t\t M B\u00e4rlund \n\t\t \n\t\t \n\t\t\t L Takala \n\t\t \n\t\t \n\t\t\t L Tianen \n\t\t \n\t\t \n\t\t\t P L Kellokumpu-Lehtinen \n\t\t \n\t\t 10.1016/j.clbc.2021.09.005 \n\t\t Medline: 34657816] 177 \n\t \n\t \n\t\t Clin Breast Cancer \n\t\t \n\t\t\t 22 \n\t\t\t 3 \n\t\t\t \n\t\t\t 2022 Apr \n\t\t \n\t \n\t FREE Full text \n\t B\u00e4rlund M, Takala L, Tianen L, Kellokumpu-Lehtinen PL. Real-world evidence of implementing eHealth enables fluent symptom-based follow-up of a growing number of patients with breast cancer with the same healthcare resources. Clin Breast Cancer 2022 Apr;22(3):261-268 [FREE Full text] [doi: 10.1016/j.clbc.2021.09.005] [Medline: 34657816] 177"
    },
    {
      "title": "Filling the gaps of patient information needs and information perception in chronic myeloid leukemia with the patient-physician co-produced web-based platform CMyLife",
      "authors": [
        "G Ector",
        "L Verweij",
        "R Hermens",
        "N Blijlevens"
      ],
      "year": 2022,
      "doi": "10.1016/j.pec.2021.06.025",
      "journal": "Patient Educ Couns",
      "volume": "105",
      "issue": "3",
      "raw": "Filling the gaps of patient information needs and information perception in chronic myeloid leukemia with the patient-physician co-produced web-based platform CMyLife \n\t\t \n\t\t\t G I Ector \n\t\t \n\t\t \n\t\t\t L Verweij \n\t\t \n\t\t \n\t\t\t R P Hermens \n\t\t \n\t\t \n\t\t\t N M Blijlevens \n\t\t \n\t\t 10.1016/j.pec.2021.06.025 \n\t\t Medline: 34226069] 178 \n\t \n\t \n\t\t Patient Educ Couns \n\t\t \n\t\t\t 105 \n\t\t\t 3 \n\t\t\t \n\t\t\t 2022 Mar \n\t\t \n\t \n\t FREE Full text \n\t Ector GI, Verweij L, Hermens RP, Blijlevens NM. Filling the gaps of patient information needs and information perception in chronic myeloid leukemia with the patient-physician co-produced web-based platform CMyLife. Patient Educ Couns 2022 Mar;105(3):686-694 [FREE Full text] [doi: 10.1016/j.pec.2021.06.025] [Medline: 34226069] 178"
    },
    {
      "title": "Digital health experiences of incarcerated populations using telemedicine in North Carolina prisons",
      "authors": [
        "S Khairat",
        "E Wallace",
        "A Bohlmann",
        "A Zebrowski",
        "K Stabile",
        "Y Yao"
      ],
      "year": 2022,
      "doi": "10.1177/23743735221092611",
      "journal": "J Patient Exp",
      "volume": "9",
      "pages": "23743735221092611",
      "raw": "Digital health experiences of incarcerated populations using telemedicine in North Carolina prisons \n\t\t \n\t\t\t S Khairat \n\t\t \n\t\t \n\t\t\t E Wallace \n\t\t \n\t\t \n\t\t\t A Bohlmann \n\t\t \n\t\t \n\t\t\t A Zebrowski \n\t\t \n\t\t \n\t\t\t K Stabile \n\t\t \n\t\t \n\t\t\t Y Yao \n\t\t \n\t\t 10.1177/23743735221092611 \n\t\t Medline: 35465408] 179 \n\t \n\t \n\t\t J Patient Exp \n\t\t \n\t\t\t 9 \n\t\t\t 23743735221092611 \n\t\t\t 2022 Apr 19 \n\t\t \n\t \n\t FREE Full text \n\t Khairat S, Wallace E, Bohlmann A, Zebrowski A, Stabile K, Yao Y, et al. Digital health experiences of incarcerated populations using telemedicine in North Carolina prisons. J Patient Exp 2022 Apr 19;9:23743735221092611 [FREE Full text] [doi: 10.1177/23743735221092611] [Medline: 35465408] 179"
    },
    {
      "title": "Eye movement desensitization and reprocessing in a primary care setting: assessing utility and comparing efficacy of virtual versus in-person methods",
      "authors": [
        "H Liou",
        "C Lane",
        "C Huang",
        "M Mookadam",
        "M Joseph",
        "Hecker Duval"
      ],
      "year": 2022,
      "doi": "10.1089/tmj.2021.0454",
      "journal": "Telemed J E Health",
      "volume": "28",
      "issue": "9",
      "raw": "Eye movement desensitization and reprocessing in a primary care setting: assessing utility and comparing efficacy of virtual versus in-person methods \n\t\t \n\t\t\t H Liou \n\t\t \n\t\t \n\t\t\t C Lane \n\t\t \n\t\t \n\t\t\t C Huang \n\t\t \n\t\t \n\t\t\t M Mookadam \n\t\t \n\t\t \n\t\t\t M Joseph \n\t\t \n\t\t \n\t\t\t Hecker Duval \n\t\t \n\t\t \n\t\t\t J \n\t\t \n\t\t 10.1089/tmj.2021.0454 \n\t\t Medline: 35133887] 180 \n\t \n\t \n\t\t Telemed J E Health \n\t\t \n\t\t\t 28 \n\t\t\t 9 \n\t\t\t \n\t\t\t 2022 Sep \n\t\t \n\t \n\t Liou H, Lane C, Huang C, Mookadam M, Joseph M, Hecker DuVal J. Eye movement desensitization and reprocessing in a primary care setting: assessing utility and comparing efficacy of virtual versus in-person methods. Telemed J E Health 2022 Sep;28(9):1359-1366 [doi: 10.1089/tmj.2021.0454] [Medline: 35133887] 180"
    },
    {
      "title": "Telemedicine has a social impact: an Italian national study for the evaluation of the cost-opportunity for patients and caregivers and the measurement of carbon emission savings",
      "authors": [
        "S Papavero",
        "A Fracasso",
        "P Ramaglia",
        "A Cicchetti",
        "A De Belvis",
        "F Ferrara"
      ],
      "year": 2023,
      "doi": "10.1089/tmj.2022.0333",
      "journal": "Telemed J E Health (Forthcoming)",
      "raw": "Telemedicine has a social impact: an Italian national study for the evaluation of the cost-opportunity for patients and caregivers and the measurement of carbon emission savings \n\t\t \n\t\t\t S Papavero \n\t\t \n\t\t \n\t\t\t A Fracasso \n\t\t \n\t\t \n\t\t\t P Ramaglia \n\t\t \n\t\t \n\t\t\t A Cicchetti \n\t\t \n\t\t \n\t\t\t A G De Belvis \n\t\t \n\t\t \n\t\t\t F M Ferrara \n\t\t \n\t\t 10.1089/tmj.2022.0333 \n\t\t Medline: 36637858] 181 \n\t \n\t \n\t\t Telemed J E Health (Forthcoming) \n\t\t \n\t\t\t 2023 Jan 13 \n\t\t \n\t \n\t Papavero S, Fracasso A, Ramaglia P, Cicchetti A, de Belvis AG, Ferrara FM. Telemedicine has a social impact: an Italian national study for the evaluation of the cost-opportunity for patients and caregivers and the measurement of carbon emission savings. Telemed J E Health (Forthcoming) 2023 Jan 13 [doi: 10.1089/tmj.2022.0333] [Medline: 36637858] 181"
    },
    {
      "title": "Digital technology access and health-related internet use among people experiencing homelessness in Hungary: quantitative survey",
      "authors": [
        "N Rad\u00f3",
        "E Girasek",
        "S B\u00e9k\u00e1si",
        "Z Gy\u0151rffy"
      ],
      "year": 2022,
      "doi": "10.2196/38729",
      "journal": "J Med Internet Res",
      "volume": "24",
      "issue": "10",
      "pages": "38729",
      "raw": "Digital technology access and health-related internet use among people experiencing homelessness in Hungary: quantitative survey \n\t\t \n\t\t\t N Rad\u00f3 \n\t\t \n\t\t \n\t\t\t E Girasek \n\t\t \n\t\t \n\t\t\t S B\u00e9k\u00e1si \n\t\t \n\t\t \n\t\t\t Z Gy\u0151rffy \n\t\t \n\t\t 10.2196/38729 \n\t\t Medline: 36260379] 182 \n\t \n\t \n\t\t J Med Internet Res \n\t\t \n\t\t\t 24 \n\t\t\t 10 \n\t\t\t 38729 \n\t\t\t 2022 Oct 19 \n\t\t \n\t \n\t FREE Full text \n\t Rad\u00f3 N, Girasek E, B\u00e9k\u00e1si S, Gy\u0151rffy Z. Digital technology access and health-related internet use among people experiencing homelessness in Hungary: quantitative survey. J Med Internet Res 2022 Oct 19;24(10):e38729 [FREE Full text] [doi: 10.2196/38729] [Medline: 36260379] 182"
    },
    {
      "title": "Digital health engagement in the us population: insights from the 2018 health information national trends survey",
      "authors": [
        "C Ratcliff",
        "M Krakow",
        "A Greenberg-Worisek",
        "B Hesse"
      ],
      "year": 2021,
      "doi": "10.2105/ajph.2021.306282",
      "journal": "Am J Public Health",
      "volume": "111",
      "issue": "7",
      "raw": "Digital health engagement in the us population: insights from the 2018 health information national trends survey \n\t\t \n\t\t\t C L Ratcliff \n\t\t \n\t\t \n\t\t\t M Krakow \n\t\t \n\t\t \n\t\t\t A Greenberg-Worisek \n\t\t \n\t\t \n\t\t\t B W Hesse \n\t\t \n\t\t 10.2105/ajph.2021.306282 \n\t\t Medline: 34014759] 183 \n\t \n\t \n\t\t Am J Public Health \n\t\t \n\t\t\t 111 \n\t\t\t 7 \n\t\t\t \n\t\t\t 2021 Jul \n\t\t \n\t \n\t Ratcliff CL, Krakow M, Greenberg-Worisek A, Hesse BW. Digital health engagement in the us population: insights from the 2018 health information national trends survey. Am J Public Health 2021 Jul;111(7):1348-1351 [doi: 10.2105/AJPH.2021.306282] [Medline: 34014759] 183"
    },
    {
      "title": "Clinician preferences for current and planned future use of telemedicine",
      "authors": [
        "A Rossano",
        "T Crijns",
        "D Ring",
        "J Reichenberg"
      ],
      "year": 2022,
      "doi": "10.1089/tmj.2021.0486",
      "journal": "Telemed J E Health",
      "volume": "28",
      "issue": "9",
      "raw": "Clinician preferences for current and planned future use of telemedicine \n\t\t \n\t\t\t A Rossano \n\t\t \n\t\t \n\t\t\t T Crijns \n\t\t \n\t\t \n\t\t\t D Ring \n\t\t \n\t\t \n\t\t\t J Reichenberg \n\t\t \n\t\t 10.1089/tmj.2021.0486 \n\t\t Medline: 35007442] 184 \n\t \n\t \n\t\t Telemed J E Health \n\t\t \n\t\t\t 28 \n\t\t\t 9 \n\t\t\t \n\t\t\t 2022 Sep \n\t\t \n\t \n\t Rossano A, Crijns T, Ring D, Reichenberg J. Clinician preferences for current and planned future use of telemedicine. Telemed J E Health 2022 Sep;28(9):1293-1299 [doi: 10.1089/tmj.2021.0486] [Medline: 35007442] 184"
    },
    {
      "title": "Smartphone medical app use and associated factors among physicians at referral hospitals in Amhara region, North Ethiopia, in 2019: cross-sectional study",
      "authors": [
        "G Teferi",
        "B Tilahun",
        "H Guadie",
        "A Amare"
      ],
      "year": 2021,
      "doi": "10.2196/19310",
      "journal": "JMIR Mhealth Uhealth",
      "volume": "9",
      "issue": "3",
      "pages": "e19310",
      "raw": "Smartphone medical app use and associated factors among physicians at referral hospitals in Amhara region, North Ethiopia, in 2019: cross-sectional study \n\t\t \n\t\t\t G H Teferi \n\t\t \n\t\t \n\t\t\t B C Tilahun \n\t\t \n\t\t \n\t\t\t H A Guadie \n\t\t \n\t\t \n\t\t\t A T Amare \n\t\t \n\t\t 10.2196/19310 \n\t\t Medline: 33769303] 185 \n\t \n\t \n\t\t JMIR Mhealth Uhealth \n\t\t \n\t\t\t 9 \n\t\t\t 3 \n\t\t\t e19310 \n\t\t\t 2021 Mar 26 \n\t\t \n\t \n\t FREE Full text \n\t Teferi GH, Tilahun BC, Guadie HA, Amare AT. Smartphone medical app use and associated factors among physicians at referral hospitals in Amhara region, North Ethiopia, in 2019: cross-sectional study. JMIR Mhealth Uhealth 2021 Mar 26;9(3):e19310 [FREE Full text] [doi: 10.2196/19310] [Medline: 33769303] 185"
    },
    {
      "title": "Telepsychology may improve treatment adherence in patients with psychogenic nonepileptic seizures",
      "authors": [
        "B Tilahun",
        "N Thompson",
        "J Bautista",
        "L Sankary",
        "S Stanton",
        "V Punia"
      ],
      "year": 2022,
      "doi": "10.1089/tmj.2021.0463",
      "journal": "Telemed J E Health",
      "volume": "28",
      "issue": "8",
      "raw": "Telepsychology may improve treatment adherence in patients with psychogenic nonepileptic seizures \n\t\t \n\t\t\t B B Tilahun \n\t\t \n\t\t \n\t\t\t N R Thompson \n\t\t \n\t\t \n\t\t\t J F Bautista \n\t\t \n\t\t \n\t\t\t L R Sankary \n\t\t \n\t\t \n\t\t\t S Stanton \n\t\t \n\t\t \n\t\t\t V Punia \n\t\t \n\t\t 10.1089/tmj.2021.0463 \n\t\t Medline: 34962145] 186 \n\t \n\t \n\t\t Telemed J E Health \n\t\t \n\t\t\t 28 \n\t\t\t 8 \n\t\t\t \n\t\t\t 2022 Aug \n\t\t \n\t \n\t Tilahun BB, Thompson NR, Bautista JF, Sankary LR, Stanton S, Punia V. Telepsychology may improve treatment adherence in patients with psychogenic nonepileptic seizures. Telemed J E Health 2022 Aug;28(8):1159-1165 [doi: 10.1089/tmj.2021.0463] [Medline: 34962145] 186"
    },
    {
      "title": "Patient acceptance of prescribed and fully reimbursed mHealth apps in Germany: an UTAUT2-based online survey study",
      "authors": [
        "M Uncovska",
        "B Freitag",
        "S Meister",
        "L Fehring"
      ],
      "year": 2023,
      "doi": "10.1007/s10916-023-01910-x",
      "journal": "J Med Syst",
      "volume": "47",
      "issue": "1",
      "pages": "14",
      "raw": "Patient acceptance of prescribed and fully reimbursed mHealth apps in Germany: an UTAUT2-based online survey study \n\t\t \n\t\t\t M Uncovska \n\t\t \n\t\t \n\t\t\t B Freitag \n\t\t \n\t\t \n\t\t\t S Meister \n\t\t \n\t\t \n\t\t\t L Fehring \n\t\t \n\t\t 10.1007/s10916-023-01910-x \n\t\t Medline: 36705853] 187 \n\t \n\t \n\t\t J Med Syst \n\t\t \n\t\t\t 47 \n\t\t\t 1 \n\t\t\t 14 \n\t\t\t 2023 Jan 27 \n\t\t \n\t \n\t FREE Full text \n\t Uncovska M, Freitag B, Meister S, Fehring L. Patient acceptance of prescribed and fully reimbursed mHealth apps in Germany: an UTAUT2-based online survey study. J Med Syst 2023 Jan 27;47(1):14 [FREE Full text] [doi: 10.1007/s10916-023-01910-x] [Medline: 36705853] 187"
    },
    {
      "title": "Legal and organizational barriers to the development of eHealth in France",
      "authors": [
        "R Bouvet",
        "P Desmarais",
        "E Minvielle"
      ],
      "year": 2015,
      "journal": "Med Law",
      "volume": "34",
      "issue": "1",
      "raw": "Legal and organizational barriers to the development of eHealth in France \n\t\t \n\t\t\t R Bouvet \n\t\t \n\t\t \n\t\t\t P Desmarais \n\t\t \n\t\t \n\t\t\t E Minvielle \n\t\t \n\t\t Medline: 30759942] 188 \n\t \n\t \n\t\t Med Law \n\t\t \n\t\t\t 34 \n\t\t\t 1 \n\t\t\t \n\t\t\t 2015 Sep \n\t\t \n\t \n\t Bouvet R, Desmarais P, Minvielle E. Legal and organizational barriers to the development of eHealth in France. Med Law 2015 Sep;34(1):361-379 [Medline: 30759942] 188"
    },
    {
      "title": "Use and uptake of eHealth in general practice: a cross-sectional survey and focus group study among health care users and general practitioners",
      "authors": [
        "J Peeters",
        "J Krijgsman",
        "A Brabers",
        "J Jong",
        "R Friele"
      ],
      "year": 2016,
      "doi": "10.2196/medinform.4515",
      "journal": "JMIR Med Inform",
      "volume": "4",
      "issue": "2",
      "raw": "Use and uptake of eHealth in general practice: a cross-sectional survey and focus group study among health care users and general practitioners \n\t\t \n\t\t\t J M Peeters \n\t\t \n\t\t \n\t\t\t J W Krijgsman \n\t\t \n\t\t \n\t\t\t A E Brabers \n\t\t \n\t\t \n\t\t\t J D Jong \n\t\t \n\t\t \n\t\t\t R D Friele \n\t\t \n\t\t 10.2196/medinform.4515 \n\t\t Medline: 27052805] 189 \n\t \n\t \n\t\t JMIR Med Inform \n\t\t \n\t\t\t 4 \n\t\t\t 2 \n\t\t\t 2016 Apr 06 \n\t\t \n\t \n\t FREE Full text \n\t Peeters JM, Krijgsman JW, Brabers AE, Jong JD, Friele RD. Use and uptake of eHealth in general practice: a cross-sectional survey and focus group study among health care users and general practitioners. JMIR Med Inform 2016 Apr 06;4(2):e11 [FREE Full text] [doi: 10.2196/medinform.4515] [Medline: 27052805] 189"
    },
    {
      "title": "Lessons learned from a living lab on the broad adoption of eHealth in primary health care",
      "authors": [
        "I Swinkels",
        "M Huygens",
        "T Schoenmakers",
        "Oude Nijeweme-D'hollosy",
        "W Van Velsen",
        "L Vermeulen"
      ],
      "year": 2018,
      "doi": "10.2196/jmir.9110",
      "journal": "J Med Internet Res",
      "volume": "20",
      "issue": "3",
      "raw": "Lessons learned from a living lab on the broad adoption of eHealth in primary health care \n\t\t \n\t\t\t I C Swinkels \n\t\t \n\t\t \n\t\t\t M W Huygens \n\t\t \n\t\t \n\t\t\t T M Schoenmakers \n\t\t \n\t\t \n\t\t\t Oude Nijeweme-D'hollosy \n\t\t \n\t\t \n\t\t\t W Van Velsen \n\t\t \n\t\t \n\t\t\t L Vermeulen \n\t\t \n\t\t \n\t\t\t J \n\t\t \n\t\t 10.2196/jmir.9110 \n\t\t Medline: 29599108] 190 \n\t \n\t \n\t\t J Med Internet Res \n\t\t \n\t\t\t 20 \n\t\t\t 3 \n\t\t\t 2018 Mar 29 \n\t\t \n\t \n\t FREE Full text \n\t Swinkels IC, Huygens MW, Schoenmakers TM, Oude Nijeweme-D'Hollosy W, van Velsen L, Vermeulen J, et al. Lessons learned from a living lab on the broad adoption of eHealth in primary health care. J Med Internet Res 2018 Mar 29;20(3):e83 [FREE Full text] [doi: 10.2196/jmir.9110] [Medline: 29599108] 190"
    },
    {
      "title": "Telemonitoring for patients with COVID-19: recommendations for design and implementation",
      "authors": [
        "A Silven",
        "A Petrus",
        "M Villalobos-Quesada",
        "E Dirikgil",
        "C Oerlemans",
        "C Landstra"
      ],
      "year": 2020,
      "doi": "10.2196/20953",
      "journal": "J Med Internet Res",
      "volume": "22",
      "issue": "9",
      "pages": "e20953",
      "raw": "Telemonitoring for patients with COVID-19: recommendations for design and implementation \n\t\t \n\t\t\t A V Silven \n\t\t \n\t\t \n\t\t\t A H Petrus \n\t\t \n\t\t \n\t\t\t M Villalobos-Quesada \n\t\t \n\t\t \n\t\t\t E Dirikgil \n\t\t \n\t\t \n\t\t\t C R Oerlemans \n\t\t \n\t\t \n\t\t\t C P Landstra \n\t\t \n\t\t 10.2196/20953 \n\t\t Medline: 32833660] 191 \n\t \n\t \n\t\t J Med Internet Res \n\t\t \n\t\t\t 22 \n\t\t\t 9 \n\t\t\t e20953 \n\t\t\t 2020 Sep 02 \n\t\t \n\t \n\t FREE Full text \n\t Silven AV, Petrus AH, Villalobos-Quesada M, Dirikgil E, Oerlemans CR, Landstra CP, et al. Telemonitoring for patients with COVID-19: recommendations for design and implementation. J Med Internet Res 2020 Sep 02;22(9):e20953 [FREE Full text] [doi: 10.2196/20953] [Medline: 32833660] 191"
    },
    {
      "title": "Public health policy-making for hearing loss: stakeholders' evaluation of a novel eHealth tool",
      "authors": [
        "G Dritsakis",
        "L Trenkova",
        "M \u015aliwi\u0144ska-Kowalska",
        "D Brdari\u0107",
        "N Pontoppidan",
        "P Katrakazas"
      ],
      "year": 2020,
      "doi": "10.1186/s12961-020-00637-2",
      "journal": "Health Res Policy Syst",
      "volume": "18",
      "issue": "1",
      "pages": "125",
      "raw": "Public health policy-making for hearing loss: stakeholders' evaluation of a novel eHealth tool \n\t\t \n\t\t\t G Dritsakis \n\t\t \n\t\t \n\t\t\t L Trenkova \n\t\t \n\t\t \n\t\t\t M \u015aliwi\u0144ska-Kowalska \n\t\t \n\t\t \n\t\t\t D Brdari\u0107 \n\t\t \n\t\t \n\t\t\t N H Pontoppidan \n\t\t \n\t\t \n\t\t\t P Katrakazas \n\t\t \n\t\t 10.1186/s12961-020-00637-2 \n\t\t Medline: 33121491] 192 \n\t \n\t \n\t\t Health Res Policy Syst \n\t\t \n\t\t\t 18 \n\t\t\t 1 \n\t\t\t 125 \n\t\t\t 2020 Oct 29 \n\t\t \n\t \n\t FREE Full text \n\t Dritsakis G, Trenkova L, \u015aliwi\u0144ska-Kowalska M, Brdari\u0107 D, Pontoppidan NH, Katrakazas P, et al. Public health policy-making for hearing loss: stakeholders' evaluation of a novel eHealth tool. Health Res Policy Syst 2020 Oct 29;18(1):125 [FREE Full text] [doi: 10.1186/s12961-020-00637-2] [Medline: 33121491] 192"
    },
    {
      "title": "Experience-based guidelines for the implementation of telemedicine services",
      "authors": [
        "J Brebner",
        "E Brebner",
        "H Ruddick-Bracken"
      ],
      "year": 2005,
      "doi": "10.1258/1357633054461778",
      "journal": "J Telemed Telecare",
      "volume": "11",
      "issue": "Suppl 1",
      "raw": "Experience-based guidelines for the implementation of telemedicine services \n\t\t \n\t\t\t J A Brebner \n\t\t \n\t\t \n\t\t\t E M Brebner \n\t\t \n\t\t \n\t\t\t H Ruddick-Bracken \n\t\t \n\t\t 10.1258/1357633054461778 \n\t\t Medline: 16035975] 193 \n\t \n\t \n\t\t J Telemed Telecare \n\t\t \n\t\t\t 11 \n\t\t\t Suppl 1 \n\t\t\t \n\t\t\t 2005 \n\t\t \n\t \n\t Brebner JA, Brebner EM, Ruddick-Bracken H. Experience-based guidelines for the implementation of telemedicine services. J Telemed Telecare 2005;11 Suppl 1:3-5 [doi: 10.1258/1357633054461778] [Medline: 16035975] 193"
    },
    {
      "title": "Digital prevention of depression for farmers? A qualitative study on participants' experiences regarding determinants of acceptance and satisfaction with a tailored guided internet intervention program",
      "authors": [
        "J Freund",
        "C Buntrock",
        "L Braun",
        "J Thielecke",
        "H Baumeister",
        "M Berking"
      ],
      "year": 2022,
      "doi": "10.1016/j.invent.2022.100566",
      "journal": "Internet Interv",
      "volume": "29",
      "pages": "100566",
      "raw": "Digital prevention of depression for farmers? A qualitative study on participants' experiences regarding determinants of acceptance and satisfaction with a tailored guided internet intervention program \n\t\t \n\t\t\t J Freund \n\t\t \n\t\t \n\t\t\t C Buntrock \n\t\t \n\t\t \n\t\t\t L Braun \n\t\t \n\t\t \n\t\t\t J Thielecke \n\t\t \n\t\t \n\t\t\t H Baumeister \n\t\t \n\t\t \n\t\t\t M Berking \n\t\t \n\t\t 10.1016/j.invent.2022.100566 \n\t\t Medline: 36039069] 194 \n\t \n\t \n\t\t Internet Interv \n\t\t \n\t\t\t 29 \n\t\t\t 100566 \n\t\t\t 2022 Aug 09 \n\t\t \n\t \n\t FREE Full text \n\t Freund J, Buntrock C, Braun L, Thielecke J, Baumeister H, Berking M, et al. Digital prevention of depression for farmers? A qualitative study on participants' experiences regarding determinants of acceptance and satisfaction with a tailored guided internet intervention program. Internet Interv 2022 Aug 09;29:100566 [FREE Full text] [doi: 10.1016/j.invent.2022.100566] [Medline: 36039069] 194"
    },
    {
      "title": "The impact of the COVID-19 pandemic on eHealth use in the daily practice and life of Dutch-speaking general practitioners in Belgium: qualitative study with semistructured interviews",
      "authors": [
        "J Yagiz",
        "G Goderis"
      ],
      "year": 2022,
      "doi": "10.2196/41847",
      "journal": "JMIR Form Res",
      "volume": "6",
      "issue": "11",
      "pages": "41847",
      "raw": "The impact of the COVID-19 pandemic on eHealth use in the daily practice and life of Dutch-speaking general practitioners in Belgium: qualitative study with semistructured interviews \n\t\t \n\t\t\t J I Yagiz \n\t\t \n\t\t \n\t\t\t G Goderis \n\t\t \n\t\t 10.2196/41847 \n\t\t Medline: 36399650] 195 \n\t \n\t \n\t\t JMIR Form Res \n\t\t \n\t\t\t 6 \n\t\t\t 11 \n\t\t\t 41847 \n\t\t\t 2022 Nov 28 \n\t\t \n\t \n\t FREE Full text \n\t Yagiz JI, Goderis G. The impact of the COVID-19 pandemic on eHealth use in the daily practice and life of Dutch-speaking general practitioners in Belgium: qualitative study with semistructured interviews. JMIR Form Res 2022 Nov 28;6(11):e41847 [FREE Full text] [doi: 10.2196/41847] [Medline: 36399650] 195"
    },
    {
      "title": "Cultural adaptation of internet interventions for refugees: results from a user experience study in Germany",
      "authors": [
        "K Spanhel",
        "J Schweizer",
        "D Wirsching",
        "D Lehr",
        "H Baumeister",
        "J Bengel"
      ],
      "year": 2019,
      "doi": "10.1016/j.invent.2019.100252",
      "journal": "Internet Interv",
      "volume": "18",
      "pages": "100252",
      "raw": "Cultural adaptation of internet interventions for refugees: results from a user experience study in Germany \n\t\t \n\t\t\t K Spanhel \n\t\t \n\t\t \n\t\t\t J S Schweizer \n\t\t \n\t\t \n\t\t\t D Wirsching \n\t\t \n\t\t \n\t\t\t D Lehr \n\t\t \n\t\t \n\t\t\t H Baumeister \n\t\t \n\t\t \n\t\t\t J Bengel \n\t\t \n\t\t 10.1016/j.invent.2019.100252 \n\t\t Medline: 31890608] 196 \n\t \n\t \n\t\t Internet Interv \n\t\t \n\t\t\t 18 \n\t\t\t 100252 \n\t\t\t 2019 May 21 \n\t\t \n\t \n\t FREE Full text \n\t Spanhel K, Schweizer JS, Wirsching D, Lehr D, Baumeister H, Bengel J, et al. Cultural adaptation of internet interventions for refugees: results from a user experience study in Germany. Internet Interv 2019 May 21;18:100252 [FREE Full text] [doi: 10.1016/j.invent.2019.100252] [Medline: 31890608] 196"
    },
    {
      "title": "Physicians' attitudes toward prescribable mHealth apps and implications for adoption in Germany: mixed methods study",
      "authors": [
        "F Dahlhausen",
        "M Zinner",
        "L Bieske",
        "J Ehlers",
        "P Boehme",
        "L Fehring"
      ],
      "year": 2021,
      "doi": "10.2196/33012",
      "journal": "JMIR Mhealth Uhealth",
      "volume": "9",
      "issue": "11",
      "pages": "33012",
      "raw": "Physicians' attitudes toward prescribable mHealth apps and implications for adoption in Germany: mixed methods study \n\t\t \n\t\t\t F Dahlhausen \n\t\t \n\t\t \n\t\t\t M Zinner \n\t\t \n\t\t \n\t\t\t L Bieske \n\t\t \n\t\t \n\t\t\t J P Ehlers \n\t\t \n\t\t \n\t\t\t P Boehme \n\t\t \n\t\t \n\t\t\t L Fehring \n\t\t \n\t\t 10.2196/33012 \n\t\t Medline: 34817385] 197 \n\t \n\t \n\t\t JMIR Mhealth Uhealth \n\t\t \n\t\t\t 9 \n\t\t\t 11 \n\t\t\t 33012 \n\t\t\t 2021 Nov 23 \n\t\t \n\t \n\t FREE Full text \n\t Dahlhausen F, Zinner M, Bieske L, Ehlers JP, Boehme P, Fehring L. Physicians' attitudes toward prescribable mHealth apps and implications for adoption in Germany: mixed methods study. JMIR Mhealth Uhealth 2021 Nov 23;9(11):e33012 [FREE Full text] [doi: 10.2196/33012] [Medline: 34817385] 197"
    },
    {
      "title": "There's an app for that, but nobody's using it: insights on improving patient access and adherence to digital therapeutics in Germany",
      "authors": [
        "F Dahlhausen",
        "M Zinner",
        "L Bieske",
        "J Ehlers",
        "P Boehme",
        "L Fehring"
      ],
      "year": 2022,
      "doi": "10.1177/20552076221104672",
      "journal": "Digit Health",
      "volume": "8",
      "pages": "20552076221104672",
      "raw": "There's an app for that, but nobody's using it: insights on improving patient access and adherence to digital therapeutics in Germany \n\t\t \n\t\t\t F Dahlhausen \n\t\t \n\t\t \n\t\t\t M Zinner \n\t\t \n\t\t \n\t\t\t L Bieske \n\t\t \n\t\t \n\t\t\t J P Ehlers \n\t\t \n\t\t \n\t\t\t P Boehme \n\t\t \n\t\t \n\t\t\t L Fehring \n\t\t \n\t\t 10.1177/20552076221104672 \n\t\t Medline: 35811758] 198 \n\t \n\t \n\t\t Digit Health \n\t\t \n\t\t\t 8 \n\t\t\t 20552076221104672 \n\t\t\t 2022 Jul 03 \n\t\t \n\t \n\t FREE Full text \n\t Dahlhausen F, Zinner M, Bieske L, Ehlers JP, Boehme P, Fehring L. There's an app for that, but nobody's using it: insights on improving patient access and adherence to digital therapeutics in Germany. Digit Health 2022 Jul 03;8:20552076221104672 [FREE Full text] [doi: 10.1177/20552076221104672] [Medline: 35811758] 198"
    },
    {
      "title": "Obstacles to Successful Implementation of eHealth Applications into Clinical Practice",
      "authors": [
        "M Voogt",
        "B Opmeer",
        "A Kastelein",
        "M Jaspers",
        "L Peute"
      ],
      "year": 2018,
      "journal": "Stud Health Technol Inform",
      "volume": "247",
      "raw": "Obstacles to Successful Implementation of eHealth Applications into Clinical Practice \n\t\t \n\t\t\t M P Voogt \n\t\t \n\t\t \n\t\t\t B C Opmeer \n\t\t \n\t\t \n\t\t\t A W Kastelein \n\t\t \n\t\t \n\t\t\t M Jaspers \n\t\t \n\t\t \n\t\t\t L Peute \n\t\t \n\t\t Medline: 29678015] 199 \n\t \n\t \n\t\t Stud Health Technol Inform \n\t\t \n\t\t\t 247 \n\t\t\t \n\t\t\t 2018 \n\t\t \n\t \n\t Voogt MP, Opmeer BC, Kastelein AW, Jaspers M, Peute L. Obstacles to Successful Implementation of eHealth Applications into Clinical Practice. Stud Health Technol Inform 2018;247:521-525 [Medline: 29678015] 199"
    },
    {
      "title": "Successful implementation of eHealth interventions in healthcare: development of an eHealth implementation guideline",
      "authors": [
        "H Cremers",
        "L Theunissen",
        "J Hiddink",
        "H Kemps",
        "L Dekker",
        "R Van De Ven"
      ],
      "year": 2021,
      "doi": "10.1177/0951484821994421",
      "journal": "Health Serv Manage Res",
      "volume": "34",
      "issue": "4",
      "raw": "Successful implementation of eHealth interventions in healthcare: development of an eHealth implementation guideline \n\t\t \n\t\t\t H P Cremers \n\t\t \n\t\t \n\t\t\t L Theunissen \n\t\t \n\t\t \n\t\t\t J Hiddink \n\t\t \n\t\t \n\t\t\t H Kemps \n\t\t \n\t\t \n\t\t\t L Dekker \n\t\t \n\t\t \n\t\t\t R Van De Ven \n\t\t \n\t\t 10.1177/0951484821994421 \n\t\t Medline: 33590794] 200 \n\t \n\t \n\t\t Health Serv Manage Res \n\t\t \n\t\t\t 34 \n\t\t\t 4 \n\t\t\t \n\t\t\t 2021 Nov \n\t\t \n\t \n\t Cremers HP, Theunissen L, Hiddink J, Kemps H, Dekker L, van de Ven R, et al. Successful implementation of eHealth interventions in healthcare: development of an eHealth implementation guideline. Health Serv Manage Res 2021 Nov;34(4):269-278 [doi: 10.1177/0951484821994421] [Medline: 33590794] 200"
    },
    {
      "title": "Toward integration of mHealth in primary care in the Netherlands: a qualitative analysis of stakeholder perspectives",
      "authors": [
        "E Bally",
        "T Cesuroglu"
      ],
      "year": 2020,
      "doi": "10.3389/fpubh.2019.00407",
      "journal": "Front Public Health",
      "volume": "7",
      "pages": "407",
      "raw": "Toward integration of mHealth in primary care in the Netherlands: a qualitative analysis of stakeholder perspectives \n\t\t \n\t\t\t E L Bally \n\t\t \n\t\t \n\t\t\t T Cesuroglu \n\t\t \n\t\t 10.3389/fpubh.2019.00407 \n\t\t Medline: 32010660] 201 \n\t \n\t \n\t\t Front Public Health \n\t\t \n\t\t\t 7 \n\t\t\t 407 \n\t\t\t 2020 Jan 15 \n\t\t \n\t \n\t FREE Full text \n\t Bally EL, Cesuroglu T. Toward integration of mHealth in primary care in the Netherlands: a qualitative analysis of stakeholder perspectives. Front Public Health 2020 Jan 15;7:407 [FREE Full text] [doi: 10.3389/fpubh.2019.00407] [Medline: 32010660] 201"
    },
    {
      "title": "Implementing a national Scottish digital health and wellbeing service at scale: a qualitative study of stakeholders' views",
      "authors": [
        "R Agbakoba",
        "M Mcgee-Lennon",
        "M Bouamrane",
        "N Watson",
        "F Mair"
      ],
      "year": 2015,
      "journal": "Stud Health Technol Inform",
      "volume": "216",
      "raw": "Implementing a national Scottish digital health and wellbeing service at scale: a qualitative study of stakeholders' views \n\t\t \n\t\t\t R Agbakoba \n\t\t \n\t\t \n\t\t\t M Mcgee-Lennon \n\t\t \n\t\t \n\t\t\t M M Bouamrane \n\t\t \n\t\t \n\t\t\t N Watson \n\t\t \n\t\t \n\t\t\t F Mair \n\t\t \n\t\t Medline: 26262098] 202 \n\t \n\t \n\t\t Stud Health Technol Inform \n\t\t \n\t\t\t 216 \n\t\t\t \n\t\t\t 2015 \n\t\t \n\t \n\t Agbakoba R, McGee-Lennon M, Bouamrane MM, Watson N, Mair F. Implementing a national Scottish digital health and wellbeing service at scale: a qualitative study of stakeholders' views. Stud Health Technol Inform 2015;216:487-491 [Medline: 26262098] 202"
    },
    {
      "title": "Development, usability and acceptability of an integrated eHealth system for spondyloarthritis in the Netherlands (SpA-Net)",
      "authors": [
        "C Webers",
        "E Beckers",
        "A Boonen",
        "Y Van Eijk-Hustings",
        "H Vonkeman",
        "M Van De Laar"
      ],
      "year": 2019,
      "doi": "10.1136/rmdopen-2018-000860",
      "journal": "RMD Open",
      "volume": "5",
      "issue": "1",
      "pages": "860",
      "raw": "Development, usability and acceptability of an integrated eHealth system for spondyloarthritis in the Netherlands (SpA-Net) \n\t\t \n\t\t\t C Webers \n\t\t \n\t\t \n\t\t\t E Beckers \n\t\t \n\t\t \n\t\t\t A Boonen \n\t\t \n\t\t \n\t\t\t Y Van Eijk-Hustings \n\t\t \n\t\t \n\t\t\t H Vonkeman \n\t\t \n\t\t \n\t\t\t M Van De Laar \n\t\t \n\t\t 10.1136/rmdopen-2018-000860 \n\t\t Medline: 31168405] 203 \n\t \n\t \n\t\t RMD Open \n\t\t \n\t\t\t 5 \n\t\t\t 1 \n\t\t\t 860 \n\t\t\t 2019 Apr 11 \n\t\t \n\t \n\t FREE Full text \n\t Webers C, Beckers E, Boonen A, van Eijk-Hustings Y, Vonkeman H, van de Laar M, et al. Development, usability and acceptability of an integrated eHealth system for spondyloarthritis in the Netherlands (SpA-Net). RMD Open 2019 Apr 11;5(1):e000860 [FREE Full text] [doi: 10.1136/rmdopen-2018-000860] [Medline: 31168405] 203"
    },
    {
      "title": "Developing a plan for the sustainable implementation of an electronic health intervention (partner in balance) to support caregivers of people with dementia: case study",
      "authors": [
        "H Christie",
        "L Boots",
        "K Peetoom",
        "H Tange",
        "F Verhey",
        "M De Vugt"
      ],
      "year": 2020,
      "doi": "10.2196/18624",
      "journal": "JMIR Aging",
      "volume": "3",
      "issue": "1",
      "pages": "18624",
      "raw": "Developing a plan for the sustainable implementation of an electronic health intervention (partner in balance) to support caregivers of people with dementia: case study \n\t\t \n\t\t\t H L Christie \n\t\t \n\t\t \n\t\t\t L M Boots \n\t\t \n\t\t \n\t\t\t K Peetoom \n\t\t \n\t\t \n\t\t\t H J Tange \n\t\t \n\t\t \n\t\t\t F R Verhey \n\t\t \n\t\t \n\t\t\t M E De Vugt \n\t\t \n\t\t 10.2196/18624 \n\t\t Medline: 32584261] 204 \n\t \n\t \n\t\t JMIR Aging \n\t\t \n\t\t\t 3 \n\t\t\t 1 \n\t\t\t 18624 \n\t\t\t 2020 Jun 25 \n\t\t \n\t \n\t FREE Full text \n\t Christie HL, Boots LM, Peetoom K, Tange HJ, Verhey FR, de Vugt ME. Developing a plan for the sustainable implementation of an electronic health intervention (partner in balance) to support caregivers of people with dementia: case study. JMIR Aging 2020 Jun 25;3(1):e18624 [FREE Full text] [doi: 10.2196/18624] [Medline: 32584261] 204"
    },
    {
      "title": "Satisfaction and usability of an information and communications technology-based system by clinically healthy patients with COVID-19 and medical professionals: cross-sectional survey and focus group interview study",
      "authors": [
        "Y Bae",
        "K Kim",
        "S Choi",
        "T Ko",
        "J Lim",
        "M Piao"
      ],
      "year": 2021,
      "doi": "10.2196/26227",
      "journal": "JMIR Form Res",
      "volume": "5",
      "issue": "8",
      "pages": "26227",
      "raw": "Satisfaction and usability of an information and communications technology-based system by clinically healthy patients with COVID-19 and medical professionals: cross-sectional survey and focus group interview study \n\t\t \n\t\t\t Y S Bae \n\t\t \n\t\t \n\t\t\t K H Kim \n\t\t \n\t\t \n\t\t\t S W Choi \n\t\t \n\t\t \n\t\t\t T Ko \n\t\t \n\t\t \n\t\t\t J S Lim \n\t\t \n\t\t \n\t\t\t M Piao \n\t\t \n\t\t 10.2196/26227 \n\t\t Medline: 34254946] 205 \n\t \n\t \n\t\t JMIR Form Res \n\t\t \n\t\t\t 5 \n\t\t\t 8 \n\t\t\t 26227 \n\t\t\t 2021 Aug 26 \n\t\t \n\t \n\t FREE Full text \n\t Bae YS, Kim KH, Choi SW, Ko T, Lim JS, Piao M. Satisfaction and usability of an information and communications technology-based system by clinically healthy patients with COVID-19 and medical professionals: cross-sectional survey and focus group interview study. JMIR Form Res 2021 Aug 26;5(8):e26227 [FREE Full text] [doi: 10.2196/26227] [Medline: 34254946] 205"
    },
    {
      "title": "Key components and critical factors for developing a telehealth business framework: a qualitative study",
      "authors": [
        "F Velayati",
        "H Ayatollahi",
        "M Hemmat",
        "R Dehghan"
      ],
      "year": 2021,
      "doi": "10.1186/s12911-021-01707-3",
      "journal": "BMC Med Inform Decis Mak",
      "volume": "21",
      "issue": "1",
      "pages": "339",
      "raw": "Key components and critical factors for developing a telehealth business framework: a qualitative study \n\t\t \n\t\t\t F Velayati \n\t\t \n\t\t \n\t\t\t H Ayatollahi \n\t\t \n\t\t \n\t\t\t M Hemmat \n\t\t \n\t\t \n\t\t\t R Dehghan \n\t\t \n\t\t 10.1186/s12911-021-01707-3 \n\t\t Medline: 34863170] 206 \n\t \n\t \n\t\t BMC Med Inform Decis Mak \n\t\t \n\t\t\t 21 \n\t\t\t 1 \n\t\t\t 339 \n\t\t\t 2021 Dec 04 \n\t\t \n\t \n\t FREE Full text \n\t Velayati F, Ayatollahi H, Hemmat M, Dehghan R. Key components and critical factors for developing a telehealth business framework: a qualitative study. BMC Med Inform Decis Mak 2021 Dec 04;21(1):339 [FREE Full text] [doi: 10.1186/s12911-021-01707-3] [Medline: 34863170] 206"
    },
    {
      "title": "Telebehavioral health during the COVID-19 pandemic: a qualitative analysis of provider experiences and perspectives",
      "authors": [
        "V Schoebel",
        "C Wayment",
        "M Gaiser",
        "C Page",
        "J Buche",
        "A Beck"
      ],
      "year": 2021,
      "doi": "10.1089/tmj.2021.0121",
      "journal": "Telemed J E Health",
      "volume": "27",
      "issue": "8",
      "raw": "Telebehavioral health during the COVID-19 pandemic: a qualitative analysis of provider experiences and perspectives \n\t\t \n\t\t\t V Schoebel \n\t\t \n\t\t \n\t\t\t C Wayment \n\t\t \n\t\t \n\t\t\t M Gaiser \n\t\t \n\t\t \n\t\t\t C Page \n\t\t \n\t\t \n\t\t\t J Buche \n\t\t \n\t\t \n\t\t\t A J Beck \n\t\t \n\t\t 10.1089/tmj.2021.0121 \n\t\t Medline: 34028302] 207 \n\t \n\t \n\t\t Telemed J E Health \n\t\t \n\t\t\t 27 \n\t\t\t 8 \n\t\t\t \n\t\t\t 2021 Aug \n\t\t \n\t \n\t Schoebel V, Wayment C, Gaiser M, Page C, Buche J, Beck AJ. Telebehavioral health during the COVID-19 pandemic: a qualitative analysis of provider experiences and perspectives. Telemed J E Health 2021 Aug;27(8):947-954 [doi: 10.1089/tmj.2021.0121] [Medline: 34028302] 207"
    },
    {
      "title": "Telemedicine platforms and their use in the coronavirus disease-19 era to deliver comprehensive vascular care",
      "authors": [
        "J Lin",
        "M Humphries",
        "W Shutze",
        "O Aalami",
        "U Fischer",
        "K Hodgson"
      ],
      "year": 2021,
      "doi": "10.1016/j.jvs.2020.06.051",
      "journal": "J Vasc Surg",
      "volume": "73",
      "issue": "2",
      "raw": "Telemedicine platforms and their use in the coronavirus disease-19 era to deliver comprehensive vascular care \n\t\t \n\t\t\t J C Lin \n\t\t \n\t\t \n\t\t\t M D Humphries \n\t\t \n\t\t \n\t\t\t W P Shutze \n\t\t \n\t\t \n\t\t\t O O Aalami \n\t\t \n\t\t \n\t\t\t U M Fischer \n\t\t \n\t\t \n\t\t\t K J Hodgson \n\t\t \n\t\t 10.1016/j.jvs.2020.06.051 \n\t\t Medline: 32622075] 208 \n\t \n\t \n\t\t J Vasc Surg \n\t\t \n\t\t\t 73 \n\t\t\t 2 \n\t\t\t \n\t\t\t 2021 Feb \n\t\t \n\t \n\t FREE Full text \n\t Lin JC, Humphries MD, Shutze WP, Aalami OO, Fischer UM, Hodgson KJ. Telemedicine platforms and their use in the coronavirus disease-19 era to deliver comprehensive vascular care. J Vasc Surg 2021 Feb;73(2):392-398 [FREE Full text] [doi: 10.1016/j.jvs.2020.06.051] [Medline: 32622075] 208"
    },
    {
      "title": "End-user perspectives on the development of an online intervention for parents of children on the autism spectrum",
      "authors": [
        "S Hermaszewska",
        "J Sin"
      ],
      "year": 2021,
      "doi": "10.1177/1362361320984895",
      "journal": "Autism",
      "volume": "25",
      "issue": "5",
      "raw": "End-user perspectives on the development of an online intervention for parents of children on the autism spectrum \n\t\t \n\t\t\t S Hermaszewska \n\t\t \n\t\t \n\t\t\t J Sin \n\t\t \n\t\t 10.1177/1362361320984895 \n\t\t Medline: 33423522] 209 \n\t \n\t \n\t\t Autism \n\t\t \n\t\t\t 25 \n\t\t\t 5 \n\t\t\t \n\t\t\t 2021 Jul \n\t\t \n\t \n\t FREE Full text \n\t Hermaszewska S, Sin J. End-user perspectives on the development of an online intervention for parents of children on the autism spectrum. Autism 2021 Jul;25(5):1234-1245 [FREE Full text] [doi: 10.1177/1362361320984895] [Medline: 33423522] 209"
    },
    {
      "title": "Overcoming barriers of retinal care delivery during a pandemic-attitudes and drivers for the implementation of digital health: a global expert survey",
      "authors": [
        "L Faes",
        "A Rosenblatt",
        "R Schwartz",
        "S Touhami",
        "C Ventura",
        "I Chatziralli",
        "International Retinal Collaborative"
      ],
      "year": 2021,
      "doi": "10.1136/bjophthalmol-2020-316882",
      "journal": "Br J Ophthalmol",
      "volume": "105",
      "issue": "12",
      "raw": "Overcoming barriers of retinal care delivery during a pandemic-attitudes and drivers for the implementation of digital health: a global expert survey \n\t\t \n\t\t\t L Faes \n\t\t \n\t\t \n\t\t\t A Rosenblatt \n\t\t \n\t\t \n\t\t\t R Schwartz \n\t\t \n\t\t \n\t\t\t S Touhami \n\t\t \n\t\t \n\t\t\t C V Ventura \n\t\t \n\t\t \n\t\t\t I P Chatziralli \n\t\t \n\t\t \n\t\t\t International Retinal Collaborative \n\t\t \n\t\t 10.1136/bjophthalmol-2020-316882 \n\t\t Medline: 33067360] 210 \n\t \n\t \n\t\t Br J Ophthalmol \n\t\t \n\t\t\t 105 \n\t\t\t 12 \n\t\t\t \n\t\t\t 2021 Dec \n\t\t \n\t \n\t Faes L, Rosenblatt A, Schwartz R, Touhami S, Ventura CV, Chatziralli IP, International Retinal Collaborative. Overcoming barriers of retinal care delivery during a pandemic-attitudes and drivers for the implementation of digital health: a global expert survey. Br J Ophthalmol 2021 Dec;105(12):1738-1743 [doi: 10.1136/bjophthalmol-2020-316882] [Medline: 33067360] 210"
    },
    {
      "title": "Development of a health technology assessment module for evaluating mobile medical applications",
      "authors": [
        "M Moshi",
        "R Tooher"
      ],
      "year": 2020,
      "doi": "10.1017/s0266462320000288",
      "journal": "Int J Technol Assess Health Care",
      "volume": "36",
      "issue": "3",
      "raw": "Development of a health technology assessment module for evaluating mobile medical applications \n\t\t \n\t\t\t M R Moshi \n\t\t \n\t\t \n\t\t\t R Tooher \n\t\t \n\t\t \n\t\t\t Merlin T \n\t\t \n\t\t 10.1017/s0266462320000288 \n\t\t Medline: 32419676] 211 \n\t \n\t \n\t\t Int J Technol Assess Health Care \n\t\t \n\t\t\t 36 \n\t\t\t 3 \n\t\t\t \n\t\t\t 2020 Jun \n\t\t \n\t \n\t Moshi MR, Tooher R, Merlin T. Development of a health technology assessment module for evaluating mobile medical applications. Int J Technol Assess Health Care 2020 Jun;36(3):252-261 [doi: 10.1017/S0266462320000288] [Medline: 32419676] 211"
    },
    {
      "title": "Long-term future of telemedicine in Germany: the patient's, physician's, and payer's perspective",
      "authors": [
        "C Thielscher",
        "C Doarn"
      ],
      "year": 2008,
      "doi": "10.1089/tmj.2007.0104",
      "journal": "Telemed J E Health",
      "volume": "14",
      "issue": "7",
      "raw": "Long-term future of telemedicine in Germany: the patient's, physician's, and payer's perspective \n\t\t \n\t\t\t C Thielscher \n\t\t \n\t\t \n\t\t\t C R Doarn \n\t\t \n\t\t 10.1089/tmj.2007.0104 \n\t\t Medline: 18817500] 212 \n\t \n\t \n\t\t Telemed J E Health \n\t\t \n\t\t\t 14 \n\t\t\t 7 \n\t\t\t \n\t\t\t 2008 Sep \n\t\t \n\t \n\t Thielscher C, Doarn CR. Long-term future of telemedicine in Germany: the patient's, physician's, and payer's perspective. Telemed J E Health 2008 Sep;14(7):701-706 [doi: 10.1089/tmj.2007.0104] [Medline: 18817500] 212"
    },
    {
      "title": "Reimbursement of apps for mental health: findings from interviews",
      "authors": [
        "A Powell",
        "M Bowman",
        "H Harbin"
      ],
      "year": 2019,
      "doi": "10.2196/14724",
      "journal": "JMIR Ment Health",
      "volume": "6",
      "issue": "8",
      "pages": "14724",
      "raw": "Reimbursement of apps for mental health: findings from interviews \n\t\t \n\t\t\t A C Powell \n\t\t \n\t\t \n\t\t\t M B Bowman \n\t\t \n\t\t \n\t\t\t H T Harbin \n\t\t \n\t\t 10.2196/14724 \n\t\t Medline: 31389336] 213 \n\t \n\t \n\t\t JMIR Ment Health \n\t\t \n\t\t\t 6 \n\t\t\t 8 \n\t\t\t 14724 \n\t\t\t 2019 Aug 06 \n\t\t \n\t \n\t FREE Full text \n\t Powell AC, Bowman MB, Harbin HT. Reimbursement of apps for mental health: findings from interviews. JMIR Ment Health 2019 Aug 06;6(8):e14724 [FREE Full text] [doi: 10.2196/14724] [Medline: 31389336] 213"
    },
    {
      "title": "Supporting innovation in health care: a short experience in a dedicated unit of the French ministry of public health",
      "authors": [
        "J Belghiti",
        "C Oget-Gendre",
        "A Berthon",
        "J Fagon"
      ],
      "year": 2021,
      "doi": "10.1016/j.jviscsurg.2021.01.009",
      "journal": "J Visc Surg",
      "volume": "158",
      "issue": "3S",
      "raw": "Supporting innovation in health care: a short experience in a dedicated unit of the French ministry of public health \n\t\t \n\t\t\t J Belghiti \n\t\t \n\t\t \n\t\t\t C Oget-Gendre \n\t\t \n\t\t \n\t\t\t A F Berthon \n\t\t \n\t\t \n\t\t\t J Y Fagon \n\t\t \n\t\t 10.1016/j.jviscsurg.2021.01.009 \n\t\t Medline: 33716003] 214 \n\t \n\t \n\t\t J Visc Surg \n\t\t \n\t\t\t 158 \n\t\t\t 3S \n\t\t\t \n\t\t\t 2021 Jun \n\t\t \n\t \n\t Belghiti J, Oget-Gendre C, Berthon AF, Fagon JY. Supporting innovation in health care: a short experience in a dedicated unit of the French ministry of public health. J Visc Surg 2021 Jun;158(3S):S6-11 [doi: 10.1016/j.jviscsurg.2021.01.009] [Medline: 33716003] 214"
    },
    {
      "title": "Co-created mobile apps for palliative care using community-partnered participatory research: development and usability study",
      "authors": [
        "J Al-Mondhiry",
        "D 'ambruoso",
        "S Pietras",
        "C Strouse",
        "T Benzeevi",
        "D Arevian"
      ],
      "year": 2022,
      "doi": "10.2196/33849",
      "journal": "JMIR Form Res",
      "volume": "6",
      "issue": "6",
      "pages": "33849",
      "raw": "Co-created mobile apps for palliative care using community-partnered participatory research: development and usability study \n\t\t \n\t\t\t J Al-Mondhiry \n\t\t \n\t\t \n\t\t\t D 'ambruoso \n\t\t \n\t\t \n\t\t\t S Pietras \n\t\t \n\t\t \n\t\t\t C Strouse \n\t\t \n\t\t \n\t\t\t T Benzeevi \n\t\t \n\t\t \n\t\t\t D Arevian \n\t\t \n\t\t \n\t\t\t A C \n\t\t \n\t\t 10.2196/33849 \n\t\t Medline: 35737441] 215 \n\t \n\t \n\t\t JMIR Form Res \n\t\t \n\t\t\t 6 \n\t\t\t 6 \n\t\t\t 33849 \n\t\t\t 2022 Jun 23 \n\t\t \n\t \n\t FREE Full text \n\t Al-Mondhiry J, D'Ambruoso S, Pietras C, Strouse T, Benzeevi D, Arevian AC, et al. Co-created mobile apps for palliative care using community-partnered participatory research: development and usability study. JMIR Form Res 2022 Jun 23;6(6):e33849 [FREE Full text] [doi: 10.2196/33849] [Medline: 35737441] 215"
    },
    {
      "title": "Applying user-centered design in the development of a supportive mHealth app for women in substance use recovery",
      "authors": [
        "E Eaves",
        "E Doerry",
        "S Lanzetta",
        "K Kruithoff",
        "K Negron",
        "K Dykman"
      ],
      "year": 2023,
      "doi": "10.1177/08901171221113834",
      "journal": "Am J Health Promot",
      "volume": "37",
      "issue": "1",
      "raw": "Applying user-centered design in the development of a supportive mHealth app for women in substance use recovery \n\t\t \n\t\t\t E R Eaves \n\t\t \n\t\t \n\t\t\t E Doerry \n\t\t \n\t\t \n\t\t\t S A Lanzetta \n\t\t \n\t\t \n\t\t\t K M Kruithoff \n\t\t \n\t\t \n\t\t\t K Negron \n\t\t \n\t\t \n\t\t\t K Dykman \n\t\t \n\t\t 10.1177/08901171221113834 \n\t\t Medline: 35815770] 216 \n\t \n\t \n\t\t Am J Health Promot \n\t\t \n\t\t\t 37 \n\t\t\t 1 \n\t\t\t \n\t\t\t 2023 Jan \n\t\t \n\t \n\t FREE Full text \n\t Eaves ER, Doerry E, Lanzetta SA, Kruithoff KM, Negron K, Dykman K, et al. Applying user-centered design in the development of a supportive mHealth app for women in substance use recovery. Am J Health Promot 2023 Jan;37(1):56-64 [FREE Full text] [doi: 10.1177/08901171221113834] [Medline: 35815770] 216"
    },
    {
      "title": "Digital health needs of women with postpartum depression: focus group study",
      "authors": [
        "M Lackie",
        "J Parrilla",
        "B Lavery",
        "A Kennedy",
        "D Ryan",
        "B Shulman"
      ],
      "year": 2021,
      "doi": "10.2196/18934",
      "journal": "J Med Internet Res",
      "volume": "23",
      "issue": "1",
      "pages": "18934",
      "raw": "Digital health needs of women with postpartum depression: focus group study \n\t\t \n\t\t\t M E Lackie \n\t\t \n\t\t \n\t\t\t J S Parrilla \n\t\t \n\t\t \n\t\t\t B M Lavery \n\t\t \n\t\t \n\t\t\t A L Kennedy \n\t\t \n\t\t \n\t\t\t D Ryan \n\t\t \n\t\t \n\t\t\t B Shulman \n\t\t \n\t\t 10.2196/18934 \n\t\t Medline: 33404506] 217 \n\t \n\t \n\t\t J Med Internet Res \n\t\t \n\t\t\t 23 \n\t\t\t 1 \n\t\t\t 18934 \n\t\t\t 2021 Jan 06 \n\t\t \n\t \n\t FREE Full text \n\t Lackie ME, Parrilla JS, Lavery BM, Kennedy AL, Ryan D, Shulman B, et al. Digital health needs of women with postpartum depression: focus group study. J Med Internet Res 2021 Jan 06;23(1):e18934 [FREE Full text] [doi: 10.2196/18934] [Medline: 33404506] 217"
    },
    {
      "title": "Perceptions on a mobile health intervention to improve maternal child health for Syrian refugees in Turkey: opportunities and challenges for end-user acceptability",
      "authors": [
        "C Meyer",
        "A Surmeli",
        "Hoeflin Hana",
        "C Narla"
      ],
      "year": 2022,
      "doi": "10.3389/fpubh.2022.1025675",
      "journal": "Front Public Health",
      "volume": "10",
      "pages": "1025675",
      "raw": "Perceptions on a mobile health intervention to improve maternal child health for Syrian refugees in Turkey: opportunities and challenges for end-user acceptability \n\t\t \n\t\t\t C L Meyer \n\t\t \n\t\t \n\t\t\t A Surmeli \n\t\t \n\t\t \n\t\t\t Hoeflin Hana \n\t\t \n\t\t \n\t\t\t C Narla \n\t\t \n\t\t \n\t\t\t N P \n\t\t \n\t\t 10.3389/fpubh.2022.1025675 \n\t\t Medline: 36483243] 218 \n\t \n\t \n\t\t Front Public Health \n\t\t \n\t\t\t 10 \n\t\t\t 1025675 \n\t\t\t 2022 Nov 22 \n\t\t \n\t \n\t FREE Full text \n\t Meyer CL, Surmeli A, Hoeflin Hana C, Narla NP. Perceptions on a mobile health intervention to improve maternal child health for Syrian refugees in Turkey: opportunities and challenges for end-user acceptability. Front Public Health 2022 Nov 22;10:1025675 [FREE Full text] [doi: 10.3389/fpubh.2022.1025675] [Medline: 36483243] 218"
    },
    {
      "title": "Perceptions of mobile health technology in elective surgery: a qualitative study of north American surgeons",
      "authors": [
        "N Panda",
        "R Sinyard",
        "J Margo",
        "N Henrich",
        "C Cauley",
        "J Onnela"
      ],
      "year": 2023,
      "doi": "10.1097/SLA.0000000000005208",
      "journal": "Ann Surg",
      "volume": "277",
      "issue": "3",
      "raw": "Perceptions of mobile health technology in elective surgery: a qualitative study of north American surgeons \n\t\t \n\t\t\t N Panda \n\t\t \n\t\t \n\t\t\t R Sinyard \n\t\t \n\t\t \n\t\t\t J Margo \n\t\t \n\t\t \n\t\t\t N Henrich \n\t\t \n\t\t \n\t\t\t C E Cauley \n\t\t \n\t\t \n\t\t\t J P Onnela \n\t\t \n\t\t 10.1097/SLA.0000000000005208 \n\t\t Medline: 34520422] 219 \n\t \n\t \n\t\t Ann Surg \n\t\t \n\t\t\t 277 \n\t\t\t 3 \n\t\t\t \n\t\t\t 2023 Mar 01 \n\t\t \n\t \n\t Panda N, Sinyard R, Margo J, Henrich N, Cauley CE, Onnela JP, et al. Perceptions of mobile health technology in elective surgery: a qualitative study of north American surgeons. Ann Surg 2023 Mar 01;277(3):423-428 [doi: 10.1097/SLA.0000000000005208] [Medline: 34520422] 219"
    },
    {
      "title": "Direct-to-consumer detection of atrial fibrillation in a smartwatch electrocardiogram: medical overuse, medicalisation and the experience of consumers",
      "authors": [
        "P Shih",
        "K Prokopovich",
        "C Degeling",
        "J Street",
        "S Carter"
      ],
      "year": 2022,
      "doi": "10.1016/j.socscimed.2022.114954",
      "journal": "Soc Sci Med",
      "volume": "303",
      "pages": "114954",
      "raw": "Direct-to-consumer detection of atrial fibrillation in a smartwatch electrocardiogram: medical overuse, medicalisation and the experience of consumers \n\t\t \n\t\t\t P Shih \n\t\t \n\t\t \n\t\t\t K Prokopovich \n\t\t \n\t\t \n\t\t\t C Degeling \n\t\t \n\t\t \n\t\t\t J Street \n\t\t \n\t\t \n\t\t\t S M Carter \n\t\t \n\t\t 10.1016/j.socscimed.2022.114954 \n\t\t Medline: 35569232] 220 \n\t \n\t \n\t\t Soc Sci Med \n\t\t \n\t\t\t 303 \n\t\t\t 114954 \n\t\t\t 2022 Jun \n\t\t \n\t \n\t Shih P, Prokopovich K, Degeling C, Street J, Carter SM. Direct-to-consumer detection of atrial fibrillation in a smartwatch electrocardiogram: medical overuse, medicalisation and the experience of consumers. Soc Sci Med 2022 Jun;303:114954 [doi: 10.1016/j.socscimed.2022.114954] [Medline: 35569232] 220"
    },
    {
      "title": "Stepwise design and evaluation of a values-oriented ambient intelligence healthcare monitoring platform",
      "authors": [
        "M Smits",
        "M Nacar",
        "D S Ludden",
        "G Van Goor"
      ],
      "year": 2022,
      "doi": "10.1016/j.jval.2021.11.1372",
      "journal": "Value Health",
      "volume": "25",
      "issue": "6",
      "raw": "Stepwise design and evaluation of a values-oriented ambient intelligence healthcare monitoring platform \n\t\t \n\t\t\t M Smits \n\t\t \n\t\t \n\t\t\t M Nacar \n\t\t \n\t\t \n\t\t\t D S Ludden \n\t\t \n\t\t \n\t\t\t G Van Goor \n\t\t \n\t\t \n\t\t\t H \n\t\t \n\t\t 10.1016/j.jval.2021.11.1372 \n\t\t Medline: 35525831] 221 \n\t \n\t \n\t\t Value Health \n\t\t \n\t\t\t 25 \n\t\t\t 6 \n\t\t\t \n\t\t\t 2022 Jun \n\t\t \n\t \n\t FREE Full text \n\t Smits M, Nacar M, D S Ludden G, van Goor H. Stepwise design and evaluation of a values-oriented ambient intelligence healthcare monitoring platform. Value Health 2022 Jun;25(6):914-923 [FREE Full text] [doi: 10.1016/j.jval.2021.11.1372] [Medline: 35525831] 221"
    },
    {
      "title": "Experiences with the implementation of remote monitoring in patients with COVID-19: a qualitative study with patients and healthcare professionals",
      "authors": [
        "B Van Grootven",
        "L Irusta",
        "W Christiaens",
        "P Mistiaen",
        "De Meester",
        "C Cornelis"
      ],
      "year": 2023,
      "doi": "10.1111/jnu.12814",
      "journal": "J Nurs Scholarsh",
      "volume": "55",
      "issue": "1",
      "raw": "Experiences with the implementation of remote monitoring in patients with COVID-19: a qualitative study with patients and healthcare professionals \n\t\t \n\t\t\t B Van Grootven \n\t\t \n\t\t \n\t\t\t L A Irusta \n\t\t \n\t\t \n\t\t\t W Christiaens \n\t\t \n\t\t \n\t\t\t P Mistiaen \n\t\t \n\t\t \n\t\t\t De Meester \n\t\t \n\t\t \n\t\t\t C Cornelis \n\t\t \n\t\t \n\t\t\t J \n\t\t \n\t\t 10.1111/jnu.12814 \n\t\t Medline: 36165577] 222 \n\t \n\t \n\t\t J Nurs Scholarsh \n\t\t \n\t\t\t 55 \n\t\t\t 1 \n\t\t\t \n\t\t\t 2023 Jan \n\t\t \n\t \n\t FREE Full text \n\t Van Grootven B, Irusta LA, Christiaens W, Mistiaen P, De Meester C, Cornelis J, et al. Experiences with the implementation of remote monitoring in patients with COVID-19: a qualitative study with patients and healthcare professionals. J Nurs Scholarsh 2023 Jan;55(1):67-78 [FREE Full text] [doi: 10.1111/jnu.12814] [Medline: 36165577] 222"
    },
    {
      "title": "Digitization of healthcare organizations: the digital health landscape and information theory",
      "authors": [
        "M Van Velthoven",
        "C Cordon",
        "G Challagalla"
      ],
      "year": 2019,
      "doi": "10.1016/j.ijmedinf.2019.01.007",
      "journal": "Int J Med Inform",
      "volume": "124",
      "raw": "Digitization of healthcare organizations: the digital health landscape and information theory \n\t\t \n\t\t\t M H Van Velthoven \n\t\t \n\t\t \n\t\t\t C Cordon \n\t\t \n\t\t \n\t\t\t G Challagalla \n\t\t \n\t\t 10.1016/j.ijmedinf.2019.01.007 \n\t\t Medline: 30784426] 223 \n\t \n\t \n\t\t Int J Med Inform \n\t\t \n\t\t\t 124 \n\t\t\t \n\t\t\t 2019 Apr \n\t\t \n\t \n\t van Velthoven MH, Cordon C, Challagalla G. Digitization of healthcare organizations: the digital health landscape and information theory. Int J Med Inform 2019 Apr;124:49-57 [doi: 10.1016/j.ijmedinf.2019.01.007] [Medline: 30784426] 223"
    },
    {
      "title": "Big data and health care: challenges and opportunities for coordinated policy development in the EU",
      "authors": [
        "S Salas-Vega",
        "A Haimann",
        "E Mossialos"
      ],
      "year": 2015,
      "doi": "10.1080/23288604.2015.1091538",
      "volume": "1",
      "pages": "226",
      "raw": "Big data and health care: challenges and opportunities for coordinated policy development in the EU \n\t\t \n\t\t\t S Salas-Vega \n\t\t \n\t\t \n\t\t\t A Haimann \n\t\t \n\t\t \n\t\t\t E Mossialos \n\t\t \n\t\t 10.1080/23288604.2015.1091538 \n\t\t Medline: 31519092] 224 \n\t\t \n\t \n\t \n\t\t Recognising the value of digital health apps: an assessment of five European healthcare systems \n\t\t MedTech Europe \n\t\t \n\t\t\t World Health Organization \n\t\t\t 2015 May 19. 2021 Nov 16. 2022-11-11] 225. 2016. 2022-12-15 \n\t\t\t 1 \n\t\t\t 226 \n\t\t \n\t \n\t From innovation to implementation: eHealth in the WHO European region \n\t Salas-Vega S, Haimann A, Mossialos E. Big data and health care: challenges and opportunities for coordinated policy development in the EU. Health Syst Reform 2015 May 19;1(4):285-300 [doi: 10.1080/23288604.2015.1091538] [Medline: 31519092] 224. Recognising the value of digital health apps: an assessment of five European healthcare systems. MedTech Europe. 2021 Nov 16. URL: https://www.medtecheurope.org/wp-content/uploads/2021/11/2111_v4.8_mte_dht_reimbursement16.11. 2021-2.pdf [accessed 2022-11-11] 225. From innovation to implementation: eHealth in the WHO European region. World Health Organization. 2016. URL: https:/ /apps.who.int/iris/bitstream/handle/10665/326317/9789289051378-eng.pdf [accessed 2022-12-15] 226"
    },
    {
      "title": "The German fast track toward reimbursement of Digital Health Applications (DiGA): opportunities and challenges for manufacturers, healthcare providers, and people with diabetes",
      "authors": [
        "F Schliess",
        "Affini Dicenzo",
        "T Gaus",
        "N Bourez",
        "J Stegbauer",
        "C Szecsenyi"
      ],
      "year": 2022,
      "doi": "10.1177/19322968221121660",
      "journal": "J Diabetes Sci Technol (Forthcoming",
      "pages": "19322968221121660",
      "raw": "The German fast track toward reimbursement of Digital Health Applications (DiGA): opportunities and challenges for manufacturers, healthcare providers, and people with diabetes \n\t\t \n\t\t\t F Schliess \n\t\t \n\t\t \n\t\t\t Affini Dicenzo \n\t\t \n\t\t \n\t\t\t T Gaus \n\t\t \n\t\t \n\t\t\t N Bourez \n\t\t \n\t\t \n\t\t\t J M Stegbauer \n\t\t \n\t\t \n\t\t\t C Szecsenyi \n\t\t \n\t\t \n\t\t\t J \n\t\t \n\t\t 10.1177/19322968221121660 \n\t\t Medline: 36059268] 227 \n\t \n\t \n\t\t J Diabetes Sci Technol (Forthcoming \n\t\t \n\t\t\t 19322968221121660 \n\t\t\t 2022 Sep 03 \n\t\t \n\t \n\t FREE Full text \n\t Schliess F, Affini Dicenzo T, Gaus N, Bourez JM, Stegbauer C, Szecsenyi J, et al. The German fast track toward reimbursement of Digital Health Applications (DiGA): opportunities and challenges for manufacturers, healthcare providers, and people with diabetes. J Diabetes Sci Technol (Forthcoming) 2022 Sep 03:19322968221121660 [FREE Full text] [doi: 10.1177/19322968221121660] [Medline: 36059268] 227"
    },
    {
      "title": "Incentives for telehealthcare deployment that support integrated care: a comparative analysis across eight European countries",
      "authors": [
        "M Lluch"
      ],
      "year": 2013,
      "doi": "10.5334/ijic.1062",
      "journal": "Int J Integr Care",
      "volume": "13",
      "pages": "e042",
      "raw": "Incentives for telehealthcare deployment that support integrated care: a comparative analysis across eight European countries \n\t\t \n\t\t\t M Lluch \n\t\t \n\t\t 10.5334/ijic.1062 \n\t\t Medline: 24250282] 228 \n\t \n\t \n\t\t Int J Integr Care \n\t\t \n\t\t\t 13 \n\t\t\t e042 \n\t\t\t 2013 Nov 04 \n\t\t \n\t \n\t FREE Full text \n\t Lluch M. Incentives for telehealthcare deployment that support integrated care: a comparative analysis across eight European countries. Int J Integr Care 2013 Nov 04;13:e042 [FREE Full text] [doi: 10.5334/ijic.1062] [Medline: 24250282] 228"
    },
    {
      "title": "Factors influencing procurement of digital healthcare: a case study in Dutch district nursing",
      "authors": [
        "S Holterman",
        "M Hettinga",
        "E Buskens",
        "M Lahr"
      ],
      "year": 2021,
      "doi": "10.34172/ijhpm.2021.115",
      "journal": "Int J Health Policy Manag",
      "volume": "11",
      "issue": "9",
      "raw": "Factors influencing procurement of digital healthcare: a case study in Dutch district nursing \n\t\t \n\t\t\t S Holterman \n\t\t \n\t\t \n\t\t\t M Hettinga \n\t\t \n\t\t \n\t\t\t E Buskens \n\t\t \n\t\t \n\t\t\t M Lahr \n\t\t \n\t\t 10.34172/ijhpm.2021.115 \n\t\t Medline: 34634888] 229 \n\t \n\t \n\t\t Int J Health Policy Manag \n\t\t \n\t\t\t 11 \n\t\t\t 9 \n\t\t\t \n\t\t\t 2021 Aug 29 \n\t\t \n\t \n\t FREE Full text \n\t Holterman S, Hettinga M, Buskens E, Lahr M. Factors influencing procurement of digital healthcare: a case study in Dutch district nursing. Int J Health Policy Manag 2021 Aug 29;11(9):1883-1893 [FREE Full text] [doi: 10.34172/ijhpm.2021.115] [Medline: 34634888] 229"
    },
    {
      "title": "Market access and value-based pricing of digital health applications in Germany",
      "authors": [
        "D Gensorowsky",
        "J Witte",
        "M Batram",
        "W Greiner"
      ],
      "year": 2022,
      "doi": "10.1186/s12962-022-00359-y",
      "journal": "Cost Eff Resour Alloc",
      "volume": "20",
      "issue": "1",
      "pages": "25",
      "raw": "Market access and value-based pricing of digital health applications in Germany \n\t\t \n\t\t\t D Gensorowsky \n\t\t \n\t\t \n\t\t\t J Witte \n\t\t \n\t\t \n\t\t\t M Batram \n\t\t \n\t\t \n\t\t\t W Greiner \n\t\t \n\t\t 10.1186/s12962-022-00359-y \n\t\t Medline: 35698135] 230 \n\t \n\t \n\t\t Cost Eff Resour Alloc \n\t\t \n\t\t\t 20 \n\t\t\t 1 \n\t\t\t 25 \n\t\t\t 2022 Jun 13 \n\t\t \n\t \n\t FREE Full text \n\t Gensorowsky D, Witte J, Batram M, Greiner W. Market access and value-based pricing of digital health applications in Germany. Cost Eff Resour Alloc 2022 Jun 13;20(1):25 [FREE Full text] [doi: 10.1186/s12962-022-00359-y] [Medline: 35698135] 230"
    },
    {
      "title": "Business models of eHealth interventions to support informal caregivers of people with dementia in the Netherlands: analysis of case studies",
      "authors": [
        "H Christie",
        "L Boots",
        "I Hermans",
        "M Govers",
        "H Tange",
        "F Verhey"
      ],
      "year": 2021,
      "doi": "10.2196/24724",
      "journal": "JMIR Aging",
      "volume": "4",
      "issue": "2",
      "pages": "24724",
      "raw": "Business models of eHealth interventions to support informal caregivers of people with dementia in the Netherlands: analysis of case studies \n\t\t \n\t\t\t H L Christie \n\t\t \n\t\t \n\t\t\t L M Boots \n\t\t \n\t\t \n\t\t\t I Hermans \n\t\t \n\t\t \n\t\t\t M Govers \n\t\t \n\t\t \n\t\t\t H J Tange \n\t\t \n\t\t \n\t\t\t F R Verhey \n\t\t \n\t\t 10.2196/24724 \n\t\t Medline: 34081009] 231 \n\t \n\t \n\t\t JMIR Aging \n\t\t \n\t\t\t 4 \n\t\t\t 2 \n\t\t\t 24724 \n\t\t\t 2021 Jun 03 \n\t\t \n\t \n\t FREE Full text \n\t Christie HL, Boots LM, Hermans I, Govers M, Tange HJ, Verhey FR, et al. Business models of eHealth interventions to support informal caregivers of people with dementia in the Netherlands: analysis of case studies. JMIR Aging 2021 Jun 03;4(2):e24724 [FREE Full text] [doi: 10.2196/24724] [Medline: 34081009] 231"
    },
    {
      "title": "How can digital therapeutics help Europe? Sitra",
      "authors": [
        "J Ahlqvist",
        "M Kalliola"
      ],
      "year": 2021,
      "pages": "232",
      "raw": "How can digital therapeutics help Europe? Sitra \n\t\t \n\t\t\t J Ahlqvist \n\t\t \n\t\t \n\t\t\t M Kalliola \n\t\t \n\t\t \n\t\t \n\t\t\t 2021. 2022-12-30 \n\t\t\t 232 \n\t\t \n\t \n\t Ahlqvist J, Kalliola M. How can digital therapeutics help Europe? Sitra. 2021. URL: https://www.sitra.fi/app/uploads/2021/ 11/sitra-how-can-digital-therapeutics-help-europe.pdf [accessed 2022-12-30] 232"
    },
    {
      "title": "Generating value with mental health apps",
      "authors": [
        "A Powell",
        "J Torous",
        "J Firth",
        "K Kaufman"
      ],
      "year": 2020,
      "doi": "10.1192/bjo.2019.98",
      "journal": "BJPsych Open",
      "volume": "6",
      "issue": "2",
      "raw": "Generating value with mental health apps \n\t\t \n\t\t\t A C Powell \n\t\t \n\t\t \n\t\t\t J B Torous \n\t\t \n\t\t \n\t\t\t J Firth \n\t\t \n\t\t \n\t\t\t K R Kaufman \n\t\t \n\t\t 10.1192/bjo.2019.98 \n\t\t Medline: 32019619] 233 \n\t \n\t \n\t\t BJPsych Open \n\t\t \n\t\t\t 6 \n\t\t\t 2 \n\t\t\t 2020 Feb 05 \n\t\t \n\t \n\t FREE Full text \n\t Powell AC, Torous JB, Firth J, Kaufman KR. Generating value with mental health apps. BJPsych Open 2020 Feb 05;6(2):e16 [FREE Full text] [doi: 10.1192/bjo.2019.98] [Medline: 32019619] 233"
    },
    {
      "title": "Using the consolidated framework for implementation research to inform the design of the mobile Inspecci\u00f3n Visual con \u00c1cido Ac\u00e9tico system: mixed methods case study",
      "authors": [
        "H Reid",
        "R Proeschold-Bell",
        "C Makarushka",
        "Melgar Vega",
        "K Huchko",
        "M Jeronimo"
      ],
      "year": 2022,
      "doi": "10.2196/32577",
      "journal": "JMIR Form Res",
      "volume": "6",
      "issue": "6",
      "pages": "32577",
      "raw": "Using the consolidated framework for implementation research to inform the design of the mobile Inspecci\u00f3n Visual con \u00c1cido Ac\u00e9tico system: mixed methods case study \n\t\t \n\t\t\t H W Reid \n\t\t \n\t\t \n\t\t\t R J Proeschold-Bell \n\t\t \n\t\t \n\t\t\t C Makarushka \n\t\t \n\t\t \n\t\t\t Melgar Vega \n\t\t \n\t\t \n\t\t\t K D Huchko \n\t\t \n\t\t \n\t\t\t M Jeronimo \n\t\t \n\t\t \n\t\t\t J \n\t\t \n\t\t 10.2196/32577 \n\t\t Medline: 35737455] 234 \n\t \n\t \n\t\t JMIR Form Res \n\t\t \n\t\t\t 6 \n\t\t\t 6 \n\t\t\t 32577 \n\t\t\t 2022 Jun 23 \n\t\t \n\t \n\t FREE Full text \n\t Reid HW, Proeschold-Bell RJ, Makarushka C, Melgar Vega KD, Huchko M, Jeronimo J, et al. Using the consolidated framework for implementation research to inform the design of the mobile Inspecci\u00f3n Visual con \u00c1cido Ac\u00e9tico system: mixed methods case study. JMIR Form Res 2022 Jun 23;6(6):e32577 [FREE Full text] [doi: 10.2196/32577] [Medline: 35737455] 234"
    },
    {
      "title": "Impact of a mobile health application on user engagement and pregnancy outcomes among Wyoming Medicaid members",
      "authors": [
        "J Bush",
        "D Barlow",
        "J Echols",
        "J Wilkerson",
        "K Bellevin"
      ],
      "year": 2017,
      "doi": "10.1089/tmj.2016.0242",
      "journal": "Telemed J E Health",
      "volume": "23",
      "issue": "11",
      "raw": "Impact of a mobile health application on user engagement and pregnancy outcomes among Wyoming Medicaid members \n\t\t \n\t\t\t J Bush \n\t\t \n\t\t \n\t\t\t D E Barlow \n\t\t \n\t\t \n\t\t\t J Echols \n\t\t \n\t\t \n\t\t\t J Wilkerson \n\t\t \n\t\t \n\t\t\t K Bellevin \n\t\t \n\t\t 10.1089/tmj.2016.0242 \n\t\t Medline: 28481167] 235 \n\t \n\t \n\t\t Telemed J E Health \n\t\t \n\t\t\t 23 \n\t\t\t 11 \n\t\t\t \n\t\t\t 2017 Nov \n\t\t \n\t \n\t FREE Full text \n\t Bush J, Barlow DE, Echols J, Wilkerson J, Bellevin K. Impact of a mobile health application on user engagement and pregnancy outcomes among Wyoming Medicaid members. Telemed J E Health 2017 Nov;23(11):891-898 [FREE Full text] [doi: 10.1089/tmj.2016.0242] [Medline: 28481167] 235"
    },
    {
      "title": "Understanding telemedicine's \"new normal\": variations in telemedicine use by specialty line and patient demographics",
      "authors": [
        "C Drake",
        "T Lian",
        "B Cameron",
        "K Medynskaya",
        "H Bosworth",
        "K Shah"
      ],
      "year": 2022,
      "doi": "10.1089/tmj.2021.0041",
      "journal": "Telemed J E Health",
      "volume": "28",
      "issue": "1",
      "raw": "Understanding telemedicine's \"new normal\": variations in telemedicine use by specialty line and patient demographics \n\t\t \n\t\t\t C Drake \n\t\t \n\t\t \n\t\t\t T Lian \n\t\t \n\t\t \n\t\t\t B Cameron \n\t\t \n\t\t \n\t\t\t K Medynskaya \n\t\t \n\t\t \n\t\t\t H B Bosworth \n\t\t \n\t\t \n\t\t\t K Shah \n\t\t \n\t\t 10.1089/tmj.2021.0041 \n\t\t Medline: 33769092] 236 \n\t \n\t \n\t\t Telemed J E Health \n\t\t \n\t\t\t 28 \n\t\t\t 1 \n\t\t\t \n\t\t\t 2022 Jan \n\t\t \n\t \n\t FREE Full text \n\t Drake C, Lian T, Cameron B, Medynskaya K, Bosworth HB, Shah K. Understanding telemedicine's \"new normal\": variations in telemedicine use by specialty line and patient demographics. Telemed J E Health 2022 Jan;28(1):51-59 [FREE Full text] [doi: 10.1089/tmj.2021.0041] [Medline: 33769092] 236"
    },
    {
      "title": "Factors associated with the utilization of outpatient virtual clinics: retrospective observational study using multilevel analysis",
      "authors": [
        "Y Tzeng",
        "W Yin",
        "K Lin",
        "J Wei",
        "H Liou",
        "H Sung"
      ],
      "year": 2022,
      "doi": "10.2196/40288",
      "journal": "J Med Internet Res",
      "volume": "24",
      "issue": "8",
      "pages": "40288",
      "raw": "Factors associated with the utilization of outpatient virtual clinics: retrospective observational study using multilevel analysis \n\t\t \n\t\t\t Y H Tzeng \n\t\t \n\t\t \n\t\t\t W H Yin \n\t\t \n\t\t \n\t\t\t K C Lin \n\t\t \n\t\t \n\t\t\t J Wei \n\t\t \n\t\t \n\t\t\t H R Liou \n\t\t \n\t\t \n\t\t\t H J Sung \n\t\t \n\t\t 10.2196/40288 \n\t\t Medline: 35917486] 237 \n\t \n\t \n\t\t J Med Internet Res \n\t\t \n\t\t\t 24 \n\t\t\t 8 \n\t\t\t 40288 \n\t\t\t 2022 Aug 12 \n\t\t \n\t \n\t FREE Full text \n\t Tzeng YH, Yin WH, Lin KC, Wei J, Liou HR, Sung HJ, et al. Factors associated with the utilization of outpatient virtual clinics: retrospective observational study using multilevel analysis. J Med Internet Res 2022 Aug 12;24(8):e40288 [FREE Full text] [doi: 10.2196/40288] [Medline: 35917486] 237"
    },
    {
      "title": "Cost analysis of telehomecare",
      "authors": [
        "K Dansky",
        "L Palmer",
        "D Shea",
        "K Bowles"
      ],
      "year": 2001,
      "doi": "10.1089/153056201316970920",
      "journal": "Telemed J E Health",
      "volume": "7",
      "issue": "3",
      "raw": "Cost analysis of telehomecare \n\t\t \n\t\t\t K H Dansky \n\t\t \n\t\t \n\t\t\t L Palmer \n\t\t \n\t\t \n\t\t\t D Shea \n\t\t \n\t\t \n\t\t\t K H Bowles \n\t\t \n\t\t 10.1089/153056201316970920 \n\t\t Medline: 11564358] 238 \n\t \n\t \n\t\t Telemed J E Health \n\t\t \n\t\t\t 7 \n\t\t\t 3 \n\t\t\t \n\t\t\t 2001 \n\t\t \n\t \n\t Dansky KH, Palmer L, Shea D, Bowles KH. Cost analysis of telehomecare. Telemed J E Health 2001;7(3):225-232 [doi: 10.1089/153056201316970920] [Medline: 11564358] 238"
    },
    {
      "title": "Economic evaluation of interactive teledermatology compared with conventional care",
      "authors": [
        "A Armstrong",
        "D Dorer",
        "N Lugn",
        "J Kvedar"
      ],
      "year": 2007,
      "doi": "10.1089/tmj.2006.0035",
      "journal": "Telemed J E Health",
      "volume": "13",
      "issue": "2",
      "raw": "Economic evaluation of interactive teledermatology compared with conventional care \n\t\t \n\t\t\t A W Armstrong \n\t\t \n\t\t \n\t\t\t D J Dorer \n\t\t \n\t\t \n\t\t\t N E Lugn \n\t\t \n\t\t \n\t\t\t J C Kvedar \n\t\t \n\t\t 10.1089/tmj.2006.0035 \n\t\t Medline: 17489695] 239 \n\t \n\t \n\t\t Telemed J E Health \n\t\t \n\t\t\t 13 \n\t\t\t 2 \n\t\t\t \n\t\t\t 2007 Apr \n\t\t \n\t \n\t Armstrong AW, Dorer DJ, Lugn NE, Kvedar JC. Economic evaluation of interactive teledermatology compared with conventional care. Telemed J E Health 2007 Apr;13(2):91-99 [doi: 10.1089/tmj.2006.0035] [Medline: 17489695] 239"
    },
    {
      "title": "Telemental health collaborative care medication management: implementation and outcomes",
      "authors": [
        "S Das",
        "J Wang",
        "S Chen",
        "C Chen"
      ],
      "year": 2022,
      "doi": "10.1089/tmj.2021.0401",
      "journal": "Telemed J E Health",
      "volume": "28",
      "issue": "7",
      "raw": "Telemental health collaborative care medication management: implementation and outcomes \n\t\t \n\t\t\t S Das \n\t\t \n\t\t \n\t\t\t J Wang \n\t\t \n\t\t \n\t\t\t S Y Chen \n\t\t \n\t\t \n\t\t\t C E Chen \n\t\t \n\t\t 10.1089/tmj.2021.0401 \n\t\t Medline: 34939839] 240 \n\t \n\t \n\t\t Telemed J E Health \n\t\t \n\t\t\t 28 \n\t\t\t 7 \n\t\t\t \n\t\t\t 2022 Jul \n\t\t \n\t \n\t FREE Full text \n\t Das S, Wang J, Chen SY, Chen CE. Telemental health collaborative care medication management: implementation and outcomes. Telemed J E Health 2022 Jul;28(7):1035-1043 [FREE Full text] [doi: 10.1089/tmj.2021.0401] [Medline: 34939839] 240"
    },
    {
      "title": "Real-world evaluation of a large-scale blended care-cognitive behavioral therapy program for symptoms of anxiety and depression",
      "authors": [
        "J Owusu",
        "P Wang",
        "R Wickham",
        "A Varra",
        "C Chen",
        "A Lungu"
      ],
      "year": 2022,
      "doi": "10.1089/tmj.2021.0590",
      "journal": "Telemed J E Health",
      "volume": "28",
      "issue": "10",
      "raw": "Real-world evaluation of a large-scale blended care-cognitive behavioral therapy program for symptoms of anxiety and depression \n\t\t \n\t\t\t J T Owusu \n\t\t \n\t\t \n\t\t\t P Wang \n\t\t \n\t\t \n\t\t\t R E Wickham \n\t\t \n\t\t \n\t\t\t A A Varra \n\t\t \n\t\t \n\t\t\t C Chen \n\t\t \n\t\t \n\t\t\t A Lungu \n\t\t \n\t\t 10.1089/tmj.2021.0590 \n\t\t Medline: 35263185] 241 \n\t \n\t \n\t\t Telemed J E Health \n\t\t \n\t\t\t 28 \n\t\t\t 10 \n\t\t\t \n\t\t\t 2022 Oct \n\t\t \n\t \n\t FREE Full text \n\t Owusu JT, Wang P, Wickham RE, Varra AA, Chen C, Lungu A. Real-world evaluation of a large-scale blended care-cognitive behavioral therapy program for symptoms of anxiety and depression. Telemed J E Health 2022 Oct;28(10):1412-1420 [FREE Full text] [doi: 10.1089/tmj.2021.0590] [Medline: 35263185] 241"
    },
    {
      "title": "Real-world evidence from users of a behavioral digital therapeutic for chronic insomnia",
      "authors": [
        "L Ritterband",
        "F Thorndike",
        "C Morin",
        "R Gerwien",
        "N Enman",
        "R Xiong"
      ],
      "year": 2022,
      "doi": "10.1016/j.brat.2022.104084",
      "journal": "Behav Res Ther",
      "volume": "153",
      "pages": "104084",
      "raw": "Real-world evidence from users of a behavioral digital therapeutic for chronic insomnia \n\t\t \n\t\t\t L M Ritterband \n\t\t \n\t\t \n\t\t\t F P Thorndike \n\t\t \n\t\t \n\t\t\t C M Morin \n\t\t \n\t\t \n\t\t\t R Gerwien \n\t\t \n\t\t \n\t\t\t N M Enman \n\t\t \n\t\t \n\t\t\t R Xiong \n\t\t \n\t\t 10.1016/j.brat.2022.104084 \n\t\t Medline: 35405424] 242 \n\t \n\t \n\t\t Behav Res Ther \n\t\t \n\t\t\t 153 \n\t\t\t 104084 \n\t\t\t 2022 Jun \n\t\t \n\t \n\t FREE Full text \n\t Ritterband LM, Thorndike FP, Morin CM, Gerwien R, Enman NM, Xiong R, et al. Real-world evidence from users of a behavioral digital therapeutic for chronic insomnia. Behav Res Ther 2022 Jun;153:104084 [FREE Full text] [doi: 10.1016/j.brat.2022.104084] [Medline: 35405424] 242"
    },
    {
      "title": "Engagement and utilization of a complete remote digital care program for musculoskeletal pain management in urban and rural areas across the United States: longitudinal cohort study",
      "authors": [
        "J Scheer",
        "A Areias",
        "M Molinos",
        "Janela Moulder",
        "R Lains"
      ],
      "year": 2023,
      "doi": "10.2196/44316",
      "journal": "JMIR Mhealth Uhealth",
      "volume": "11",
      "pages": "44316",
      "raw": "Engagement and utilization of a complete remote digital care program for musculoskeletal pain management in urban and rural areas across the United States: longitudinal cohort study \n\t\t \n\t\t\t J Scheer \n\t\t \n\t\t \n\t\t\t A C Areias \n\t\t \n\t\t \n\t\t\t M Molinos \n\t\t \n\t\t \n\t\t\t Janela D Moulder \n\t\t \n\t\t \n\t\t\t R Lains \n\t\t \n\t\t \n\t\t\t J \n\t\t \n\t\t 10.2196/44316 \n\t\t Medline: 36735933] 243 \n\t \n\t \n\t\t JMIR Mhealth Uhealth \n\t\t \n\t\t\t 11 \n\t\t\t 44316 \n\t\t\t 2023 Mar 16 \n\t\t \n\t \n\t FREE Full text \n\t Scheer J, Areias AC, Molinos M, Janela D, Moulder R, Lains J, et al. Engagement and utilization of a complete remote digital care program for musculoskeletal pain management in urban and rural areas across the United States: longitudinal cohort study. JMIR Mhealth Uhealth 2023 Mar 16;11:e44316 [FREE Full text] [doi: 10.2196/44316] [Medline: 36735933] 243"
    },
    {
      "title": "Practicality and reliability of self vs administered rapid geriatric assessment mobile app",
      "authors": [
        "L Tan",
        "Y Chan",
        "A Tay",
        "J Jayasundram",
        "N Low",
        "R Merchant"
      ],
      "year": 2021,
      "doi": "10.1007/s12603-021-1672-9",
      "journal": "J Nutr Health Aging",
      "volume": "25",
      "issue": "9",
      "raw": "Practicality and reliability of self vs administered rapid geriatric assessment mobile app \n\t\t \n\t\t\t L F Tan \n\t\t \n\t\t \n\t\t\t Y H Chan \n\t\t \n\t\t \n\t\t\t A Tay \n\t\t \n\t\t \n\t\t\t J Jayasundram \n\t\t \n\t\t \n\t\t\t N A Low \n\t\t \n\t\t \n\t\t\t R A Merchant \n\t\t \n\t\t 10.1007/s12603-021-1672-9 \n\t\t Medline: 34725662] 244 \n\t \n\t \n\t\t J Nutr Health Aging \n\t\t \n\t\t\t 25 \n\t\t\t 9 \n\t\t\t \n\t\t\t 2021 \n\t\t \n\t \n\t FREE Full text \n\t Tan LF, Chan YH, Tay A, Jayasundram J, Low NA, Merchant RA. Practicality and reliability of self vs administered rapid geriatric assessment mobile app. J Nutr Health Aging 2021;25(9):1064-1069 [FREE Full text] [doi: 10.1007/s12603-021-1672-9] [Medline: 34725662] 244"
    },
    {
      "title": "mHealth program for patients with advanced cancer receiving treatment in a public health hospital in Brazil",
      "authors": [
        "I Tumeh",
        "C Bergerot",
        "D Lee",
        "E Philip",
        "R Freitas-J\u00fanior"
      ],
      "year": 2023,
      "doi": "10.1002/pon.6059",
      "journal": "Psychooncology",
      "volume": "32",
      "issue": "1",
      "raw": "mHealth program for patients with advanced cancer receiving treatment in a public health hospital in Brazil \n\t\t \n\t\t\t I B Tumeh \n\t\t \n\t\t \n\t\t\t C D Bergerot \n\t\t \n\t\t \n\t\t\t D Lee \n\t\t \n\t\t \n\t\t\t E J Philip \n\t\t \n\t\t \n\t\t\t R Freitas-J\u00fanior \n\t\t \n\t\t 10.1002/pon.6059 \n\t\t Medline: 36284459] 245 \n\t \n\t \n\t\t Psychooncology \n\t\t \n\t\t\t 32 \n\t\t\t 1 \n\t\t\t \n\t\t\t 2023 Jan \n\t\t \n\t \n\t Tumeh IB, Bergerot CD, Lee D, Philip EJ, Freitas-J\u00fanior R. mHealth program for patients with advanced cancer receiving treatment in a public health hospital in Brazil. Psychooncology 2023 Jan;32(1):125-132 [doi: 10.1002/pon.6059] [Medline: 36284459] 245"
    },
    {
      "title": "on behalf of ICARE4EU Consortium. Integrated care programs for people with multimorbidity in European countries: eHealth adoption in health systems",
      "authors": [
        "M Melchiorre",
        "R Papa",
        "S Quattrini",
        "G Lamura",
        "F Barbabella"
      ],
      "year": 2020,
      "doi": "10.1155/2020/9025326",
      "journal": "Biomed Res Int",
      "volume": "2020",
      "pages": "9025326",
      "raw": "on behalf of ICARE4EU Consortium. Integrated care programs for people with multimorbidity in European countries: eHealth adoption in health systems \n\t\t \n\t\t\t M G Melchiorre \n\t\t \n\t\t \n\t\t\t R Papa \n\t\t \n\t\t \n\t\t\t S Quattrini \n\t\t \n\t\t \n\t\t\t G Lamura \n\t\t \n\t\t \n\t\t\t F Barbabella \n\t\t \n\t\t 10.1155/2020/9025326 \n\t\t Medline: 32337283] 246 \n\t \n\t \n\t\t Biomed Res Int \n\t\t \n\t\t\t 2020 \n\t\t\t 9025326 \n\t\t\t 2020 Apr 08 \n\t\t \n\t \n\t FREE Full text \n\t Melchiorre MG, Papa R, Quattrini S, Lamura G, Barbabella F, on behalf of ICARE4EU Consortium. Integrated care programs for people with multimorbidity in European countries: eHealth adoption in health systems. Biomed Res Int 2020 Apr 08;2020:9025326 [FREE Full text] [doi: 10.1155/2020/9025326] [Medline: 32337283] 246"
    },
    {
      "title": "Integrating a tailored e-health self-management application for chronic obstructive pulmonary disease patients into primary care: a pilot study",
      "authors": [
        "V Voncken-Brewster",
        "H Tange",
        "A Moser",
        "Z Nagykaldi",
        "H De Vries",
        "Van Der Weijden"
      ],
      "year": 2014,
      "doi": "10.1186/1471-2296-15-4",
      "journal": "BMC Fam Pract",
      "volume": "15",
      "issue": "4",
      "raw": "Integrating a tailored e-health self-management application for chronic obstructive pulmonary disease patients into primary care: a pilot study \n\t\t \n\t\t\t V Voncken-Brewster \n\t\t \n\t\t \n\t\t\t H Tange \n\t\t \n\t\t \n\t\t\t A Moser \n\t\t \n\t\t \n\t\t\t Z Nagykaldi \n\t\t \n\t\t \n\t\t\t H De Vries \n\t\t \n\t\t \n\t\t\t Van Der Weijden \n\t\t \n\t\t \n\t\t\t T \n\t\t \n\t\t 10.1186/1471-2296-15-4 \n\t\t Medline: 24400676] 247 \n\t \n\t \n\t\t BMC Fam Pract \n\t\t \n\t\t\t 15 \n\t\t\t 4 \n\t\t\t 2014 Jan 08 \n\t\t \n\t \n\t FREE Full text \n\t Voncken-Brewster V, Tange H, Moser A, Nagykaldi Z, de Vries H, van der Weijden T. Integrating a tailored e-health self-management application for chronic obstructive pulmonary disease patients into primary care: a pilot study. BMC Fam Pract 2014 Jan 08;15:4 [FREE Full text] [doi: 10.1186/1471-2296-15-4] [Medline: 24400676] 247"
    },
    {
      "title": "Assessing telehealth through the lens of the provider: considerations for the post-COVID-19 era",
      "authors": [
        "D Balchander",
        "C Cabrera",
        "B Zack",
        "S Porter",
        "J Sunshine",
        "D' Anza"
      ],
      "year": 2022,
      "doi": "10.1089/tmj.2021.0508",
      "journal": "Telemed J E Health",
      "volume": "28",
      "issue": "12",
      "raw": "Assessing telehealth through the lens of the provider: considerations for the post-COVID-19 era \n\t\t \n\t\t\t D Balchander \n\t\t \n\t\t \n\t\t\t C I Cabrera \n\t\t \n\t\t \n\t\t\t B Zack \n\t\t \n\t\t \n\t\t\t S Porter \n\t\t \n\t\t \n\t\t\t J Sunshine \n\t\t \n\t\t \n\t\t\t D' Anza \n\t\t \n\t\t \n\t\t\t B \n\t\t \n\t\t 10.1089/tmj.2021.0508 \n\t\t Medline: 35426745] 248 \n\t \n\t \n\t\t Telemed J E Health \n\t\t \n\t\t\t 28 \n\t\t\t 12 \n\t\t\t \n\t\t\t 2022 Dec \n\t\t \n\t \n\t Balchander D, Cabrera CI, Zack B, Porter S, Sunshine J, D'Anza B. Assessing telehealth through the lens of the provider: considerations for the post-COVID-19 era. Telemed J E Health 2022 Dec;28(12):1806-1816 [doi: 10.1089/tmj.2021.0508] [Medline: 35426745] 248"
    },
    {
      "title": "Remote care for caregivers of people with psychosis: mixed methods pilot study",
      "authors": [
        "K Romm",
        "L Nilsen",
        "K Gjermundsen",
        "M Holter",
        "A Fjell",
        "I Melle"
      ],
      "year": 2020,
      "doi": "10.2196/19497",
      "journal": "JMIR Ment Health",
      "volume": "7",
      "issue": "7",
      "pages": "e19497",
      "raw": "Remote care for caregivers of people with psychosis: mixed methods pilot study \n\t\t \n\t\t\t K L Romm \n\t\t \n\t\t \n\t\t\t L Nilsen \n\t\t \n\t\t \n\t\t\t K Gjermundsen \n\t\t \n\t\t \n\t\t\t M Holter \n\t\t \n\t\t \n\t\t\t A Fjell \n\t\t \n\t\t \n\t\t\t I Melle \n\t\t \n\t\t 10.2196/19497 \n\t\t Medline: 32720905] 249 \n\t \n\t \n\t\t JMIR Ment Health \n\t\t \n\t\t\t 7 \n\t\t\t 7 \n\t\t\t e19497 \n\t\t\t 2020 Jul 28 \n\t\t \n\t \n\t FREE Full text \n\t Romm KL, Nilsen L, Gjermundsen K, Holter M, Fjell A, Melle I, et al. Remote care for caregivers of people with psychosis: mixed methods pilot study. JMIR Ment Health 2020 Jul 28;7(7):e19497 [FREE Full text] [doi: 10.2196/19497] [Medline: 32720905] 249"
    },
    {
      "title": "Mobile health insurance system and associated costs: a cross-sectional survey of primary health centers in Abuja, Nigeria",
      "authors": [
        "E Chukwu",
        "L Garg",
        "G Eze"
      ],
      "year": 2016,
      "doi": "10.2196/mhealth.4342",
      "journal": "JMIR Mhealth Uhealth",
      "volume": "4",
      "issue": "2",
      "raw": "Mobile health insurance system and associated costs: a cross-sectional survey of primary health centers in Abuja, Nigeria \n\t\t \n\t\t\t E Chukwu \n\t\t \n\t\t \n\t\t\t L Garg \n\t\t \n\t\t \n\t\t\t G Eze \n\t\t \n\t\t 10.2196/mhealth.4342 \n\t\t Medline: 27189312] 250 \n\t \n\t \n\t\t JMIR Mhealth Uhealth \n\t\t \n\t\t\t 4 \n\t\t\t 2 \n\t\t\t 2016 May 17 \n\t\t \n\t \n\t FREE Full text \n\t Chukwu E, Garg L, Eze G. Mobile health insurance system and associated costs: a cross-sectional survey of primary health centers in Abuja, Nigeria. JMIR Mhealth Uhealth 2016 May 17;4(2):e37 [FREE Full text] [doi: 10.2196/mhealth.4342] [Medline: 27189312] 250"
    },
    {
      "title": "A smartphone remote monitoring app to follow up colorectal cancer survivors: requirement analysis",
      "authors": [
        "S Ayyoubzadeh",
        "M Shirkhoda",
        "R Niakan Kalhori",
        "S Mohammadzadeh",
        "N Zakerabasali"
      ],
      "year": 2022,
      "doi": "10.2196/18083",
      "journal": "JMIR Cancer",
      "volume": "8",
      "issue": "1",
      "pages": "18083",
      "raw": "A smartphone remote monitoring app to follow up colorectal cancer survivors: requirement analysis \n\t\t \n\t\t\t S M Ayyoubzadeh \n\t\t \n\t\t \n\t\t\t M Shirkhoda \n\t\t \n\t\t \n\t\t\t R Niakan Kalhori \n\t\t \n\t\t \n\t\t\t S Mohammadzadeh \n\t\t \n\t\t \n\t\t\t N Zakerabasali \n\t\t \n\t\t \n\t\t\t S \n\t\t \n\t\t 10.2196/18083 \n\t\t Medline: 34989685] 251 \n\t \n\t \n\t\t JMIR Cancer \n\t\t \n\t\t\t 8 \n\t\t\t 1 \n\t\t\t 18083 \n\t\t\t 2022 Jan 05 \n\t\t \n\t \n\t FREE Full text \n\t Ayyoubzadeh SM, Shirkhoda M, R Niakan Kalhori S, Mohammadzadeh N, Zakerabasali S. A smartphone remote monitoring app to follow up colorectal cancer survivors: requirement analysis. JMIR Cancer 2022 Jan 05;8(1):e18083 [FREE Full text] [doi: 10.2196/18083] [Medline: 34989685] 251"
    },
    {
      "title": "Parents' experience with a mobile health intervention to influence human papillomavirus vaccination decision making: mixed methods study",
      "authors": [
        "E Becker",
        "R Shegog",
        "L Savas",
        "E Frost",
        "S Coan",
        "C Healy"
      ],
      "year": 2022,
      "doi": "10.2196/30340",
      "journal": "JMIR Pediatr Parent",
      "volume": "5",
      "issue": "1",
      "pages": "30340",
      "raw": "Parents' experience with a mobile health intervention to influence human papillomavirus vaccination decision making: mixed methods study \n\t\t \n\t\t\t E R Becker \n\t\t \n\t\t \n\t\t\t R Shegog \n\t\t \n\t\t \n\t\t\t L S Savas \n\t\t \n\t\t \n\t\t\t E L Frost \n\t\t \n\t\t \n\t\t\t S P Coan \n\t\t \n\t\t \n\t\t\t C M Healy \n\t\t \n\t\t 10.2196/30340 \n\t\t Medline: 35188469] 252 \n\t \n\t \n\t\t JMIR Pediatr Parent \n\t\t \n\t\t\t 5 \n\t\t\t 1 \n\t\t\t 30340 \n\t\t\t 2022 Feb 21 \n\t\t \n\t \n\t FREE Full text \n\t Becker ER, Shegog R, Savas LS, Frost EL, Coan SP, Healy CM, et al. Parents' experience with a mobile health intervention to influence human papillomavirus vaccination decision making: mixed methods study. JMIR Pediatr Parent 2022 Feb 21;5(1):e30340 [FREE Full text] [doi: 10.2196/30340] [Medline: 35188469] 252"
    },
    {
      "title": "Acceptance and perception of digital health for managing nutrition in people with Parkinson's disease and their caregivers and their digital competence in the United States: a mixed-methods study",
      "authors": [
        "D Lobuono",
        "K Shea",
        "A Tovar",
        "S Leedahl",
        "L Mahler",
        "F Xu"
      ],
      "year": 2021,
      "doi": "10.1002/hsr2.412",
      "journal": "Health Sci Rep",
      "volume": "4",
      "issue": "4",
      "raw": "Acceptance and perception of digital health for managing nutrition in people with Parkinson's disease and their caregivers and their digital competence in the United States: a mixed-methods study \n\t\t \n\t\t\t D L Lobuono \n\t\t \n\t\t \n\t\t\t K S Shea \n\t\t \n\t\t \n\t\t\t A Tovar \n\t\t \n\t\t \n\t\t\t S N Leedahl \n\t\t \n\t\t \n\t\t\t L Mahler \n\t\t \n\t\t \n\t\t\t F Xu \n\t\t \n\t\t 10.1002/hsr2.412 \n\t\t Medline: 34796282] 253 \n\t \n\t \n\t\t Health Sci Rep \n\t\t \n\t\t\t 4 \n\t\t\t 4 \n\t\t\t 2021 Nov 11 \n\t\t \n\t \n\t FREE Full text \n\t LoBuono DL, Shea KS, Tovar A, Leedahl SN, Mahler L, Xu F, et al. Acceptance and perception of digital health for managing nutrition in people with Parkinson's disease and their caregivers and their digital competence in the United States: a mixed-methods study. Health Sci Rep 2021 Nov 11;4(4):e412 [FREE Full text] [doi: 10.1002/hsr2.412] [Medline: 34796282] 253"
    },
    {
      "title": "Does digitally enabling frontline health workers improve coverage and quality of maternal and child health services? Findings from a mixed methods evaluation of TECHO+ in Gujarat",
      "authors": [
        "S Saha",
        "Z Quazi"
      ],
      "year": 2022,
      "doi": "10.3389/fpubh.2022.856561",
      "journal": "Front Public Health",
      "volume": "10",
      "pages": "856561",
      "raw": "Does digitally enabling frontline health workers improve coverage and quality of maternal and child health services? Findings from a mixed methods evaluation of TECHO+ in Gujarat \n\t\t \n\t\t\t S Saha \n\t\t \n\t\t \n\t\t\t Z S Quazi \n\t\t \n\t\t 10.3389/fpubh.2022.856561 \n\t\t Medline: 35958841] 254 \n\t \n\t \n\t\t Front Public Health \n\t\t \n\t\t\t 10 \n\t\t\t 856561 \n\t\t\t 2022 Jul 22 \n\t\t \n\t \n\t FREE Full text \n\t Saha S, Quazi ZS. Does digitally enabling frontline health workers improve coverage and quality of maternal and child health services? Findings from a mixed methods evaluation of TECHO+ in Gujarat. Front Public Health 2022 Jul 22;10:856561 [FREE Full text] [doi: 10.3389/fpubh.2022.856561] [Medline: 35958841] 254"
    },
    {
      "title": "Digital therapeutic care apps with decision-support interventions for people with low back pain in Germany: cost-effectiveness analysis",
      "authors": [
        "D Lewkowicz",
        "A Wohlbrandt",
        "E Bottinger"
      ],
      "year": 2022,
      "doi": "10.2196/35042",
      "journal": "JMIR Mhealth Uhealth",
      "volume": "10",
      "issue": "2",
      "pages": "35042",
      "raw": "Digital therapeutic care apps with decision-support interventions for people with low back pain in Germany: cost-effectiveness analysis \n\t\t \n\t\t\t D Lewkowicz \n\t\t \n\t\t \n\t\t\t A M Wohlbrandt \n\t\t \n\t\t \n\t\t\t E Bottinger \n\t\t \n\t\t 10.2196/35042 \n\t\t Medline: 35129454] 255 \n\t \n\t \n\t\t JMIR Mhealth Uhealth \n\t\t \n\t\t\t 10 \n\t\t\t 2 \n\t\t\t 35042 \n\t\t\t 2022 Feb 07 \n\t\t \n\t \n\t FREE Full text \n\t Lewkowicz D, Wohlbrandt AM, Bottinger E. Digital therapeutic care apps with decision-support interventions for people with low back pain in Germany: cost-effectiveness analysis. JMIR Mhealth Uhealth 2022 Feb 07;10(2):e35042 [FREE Full text] [doi: 10.2196/35042] [Medline: 35129454] 255"
    },
    {
      "title": "Cost-utility of an internet-based intervention with or without therapist support in comparison with a waiting list for individuals with eating disorder symptoms: a randomized controlled trial",
      "authors": [
        "J Aardoom",
        "A Dingemans",
        "J Van Ginkel",
        "P Spinhoven",
        "E Van Furth",
        "M Van Den Akker-Van Marle"
      ],
      "year": 2016,
      "doi": "10.1002/eat.22587",
      "journal": "Int J Eat Disord",
      "volume": "49",
      "issue": "12",
      "raw": "Cost-utility of an internet-based intervention with or without therapist support in comparison with a waiting list for individuals with eating disorder symptoms: a randomized controlled trial \n\t\t \n\t\t\t J J Aardoom \n\t\t \n\t\t \n\t\t\t A E Dingemans \n\t\t \n\t\t \n\t\t\t J R Van Ginkel \n\t\t \n\t\t \n\t\t\t P Spinhoven \n\t\t \n\t\t \n\t\t\t E F Van Furth \n\t\t \n\t\t \n\t\t\t M E Van Den Akker-Van Marle \n\t\t \n\t\t 10.1002/eat.22587 \n\t\t Medline: 27441418] 256 \n\t \n\t \n\t\t Int J Eat Disord \n\t\t \n\t\t\t 49 \n\t\t\t 12 \n\t\t\t \n\t\t\t 2016 Dec \n\t\t \n\t \n\t Aardoom JJ, Dingemans AE, van Ginkel JR, Spinhoven P, Van Furth EF, Van den Akker-van Marle ME. Cost-utility of an internet-based intervention with or without therapist support in comparison with a waiting list for individuals with eating disorder symptoms: a randomized controlled trial. Int J Eat Disord 2016 Dec;49(12):1068-1076 [doi: 10.1002/eat.22587] [Medline: 27441418] 256"
    },
    {
      "title": "Economic evaluation of the e-Health StandingTall balance exercise programme for fall prevention in people aged 70 years and over",
      "authors": [
        "M Ambrens",
        "K Van Schooten",
        "T Lung",
        "L Clemson",
        "J Close",
        "K Howard"
      ],
      "year": 2022,
      "doi": "10.1093/ageing/afac130",
      "journal": "Age Ageing",
      "volume": "51",
      "issue": "6",
      "pages": "130",
      "raw": "Economic evaluation of the e-Health StandingTall balance exercise programme for fall prevention in people aged 70 years and over \n\t\t \n\t\t\t M Ambrens \n\t\t \n\t\t \n\t\t\t K S Van Schooten \n\t\t \n\t\t \n\t\t\t T Lung \n\t\t \n\t\t \n\t\t\t L Clemson \n\t\t \n\t\t \n\t\t\t J C Close \n\t\t \n\t\t \n\t\t\t K Howard \n\t\t \n\t\t 10.1093/ageing/afac130 \n\t\t Medline: 35679193] 257 \n\t \n\t \n\t\t Age Ageing \n\t\t \n\t\t\t 51 \n\t\t\t 6 \n\t\t\t 130 \n\t\t\t 2022 Jun 01 \n\t\t \n\t \n\t Ambrens M, van Schooten KS, Lung T, Clemson L, Close JC, Howard K, et al. Economic evaluation of the e-Health StandingTall balance exercise programme for fall prevention in people aged 70 years and over. Age Ageing 2022 Jun 01;51(6):afac130 [doi: 10.1093/ageing/afac130] [Medline: 35679193] 257"
    },
    {
      "title": "Cost-effectiveness analysis of a mobile-based intervention for patients with type 2 diabetes mellitus",
      "authors": [
        "J Li",
        "L Sun",
        "Y Hou",
        "L Chen"
      ],
      "year": 2021,
      "doi": "10.1155/2021/8827629",
      "journal": "Int J Endocrinol",
      "volume": "2021",
      "pages": "8827629",
      "raw": "Cost-effectiveness analysis of a mobile-based intervention for patients with type 2 diabetes mellitus \n\t\t \n\t\t\t J Li \n\t\t \n\t\t \n\t\t\t L Sun \n\t\t \n\t\t \n\t\t\t Y Hou \n\t\t \n\t\t \n\t\t\t L Chen \n\t\t \n\t\t 10.1155/2021/8827629 \n\t\t Medline: 34306072] 258 \n\t \n\t \n\t\t Int J Endocrinol \n\t\t \n\t\t\t 2021 \n\t\t\t 8827629 \n\t\t\t 2021 Jul 01 \n\t\t \n\t \n\t FREE Full text \n\t Li J, Sun L, Hou Y, Chen L. Cost-effectiveness analysis of a mobile-based intervention for patients with type 2 diabetes mellitus. Int J Endocrinol 2021 Jul 01;2021:8827629 [FREE Full text] [doi: 10.1155/2021/8827629] [Medline: 34306072] 258"
    },
    {
      "title": "Cost-effectiveness of mobile health-based integrated care for atrial fibrillation: model development and data analysis",
      "authors": [
        "X Luo",
        "W Xu",
        "W Ming",
        "X Jiang",
        "Q Yuan",
        "H Lai"
      ],
      "year": 2022,
      "doi": "10.2196/29408",
      "journal": "J Med Internet Res",
      "volume": "24",
      "issue": "4",
      "pages": "e29408",
      "raw": "Cost-effectiveness of mobile health-based integrated care for atrial fibrillation: model development and data analysis \n\t\t \n\t\t\t X Luo \n\t\t \n\t\t \n\t\t\t W Xu \n\t\t \n\t\t \n\t\t\t W K Ming \n\t\t \n\t\t \n\t\t\t X Jiang \n\t\t \n\t\t \n\t\t\t Q Yuan \n\t\t \n\t\t \n\t\t\t H Lai \n\t\t \n\t\t 10.2196/29408 \n\t\t Medline: 35438646] 259 \n\t \n\t \n\t\t J Med Internet Res \n\t\t \n\t\t\t 24 \n\t\t\t 4 \n\t\t\t e29408 \n\t\t\t 2022 Apr 19 \n\t\t \n\t \n\t FREE Full text \n\t Luo X, Xu W, Ming WK, Jiang X, Yuan Q, Lai H, et al. Cost-effectiveness of mobile health-based integrated care for atrial fibrillation: model development and data analysis. J Med Internet Res 2022 Apr 19;24(4):e29408 [FREE Full text] [doi: 10.2196/29408] [Medline: 35438646] 259"
    },
    {
      "title": "Home and Online Management and Evaluation of Blood Pressure (HOME BP) using a digital intervention in poorly controlled hypertension: randomised controlled trial",
      "authors": [
        "R Mcmanus",
        "P Little",
        "B Stuart",
        "K Morton",
        "J Raftery",
        "J Kelly",
        "Home Bp Investigators"
      ],
      "year": 2021,
      "doi": "10.1136/bmj.m4858",
      "journal": "BMJ",
      "volume": "372",
      "pages": "4858",
      "raw": "Home and Online Management and Evaluation of Blood Pressure (HOME BP) using a digital intervention in poorly controlled hypertension: randomised controlled trial \n\t\t \n\t\t\t R J Mcmanus \n\t\t \n\t\t \n\t\t\t P Little \n\t\t \n\t\t \n\t\t\t B Stuart \n\t\t \n\t\t \n\t\t\t K Morton \n\t\t \n\t\t \n\t\t\t J Raftery \n\t\t \n\t\t \n\t\t\t J Kelly \n\t\t \n\t\t \n\t\t\t Home Bp Investigators \n\t\t \n\t\t 10.1136/bmj.m4858 \n\t\t Medline: 33468518] 260 \n\t \n\t \n\t\t BMJ \n\t\t \n\t\t\t 372 \n\t\t\t 4858 \n\t\t\t 2021 Jan 19 \n\t\t \n\t \n\t FREE Full text \n\t McManus RJ, Little P, Stuart B, Morton K, Raftery J, Kelly J, HOME BP investigators. Home and Online Management and Evaluation of Blood Pressure (HOME BP) using a digital intervention in poorly controlled hypertension: randomised controlled trial. BMJ 2021 Jan 19;372:m4858 [FREE Full text] [doi: 10.1136/bmj.m4858] [Medline: 33468518] 260"
    },
    {
      "title": "Internet-delivered cognitive behaviour therapy for post-traumatic stress disorder: a randomised controlled trial and outcomes in routine care",
      "authors": [
        "A Allen",
        "J Smith",
        "M Hobbs",
        "S Loughnan",
        "M Sharrock",
        "J Newby"
      ],
      "year": 2022,
      "doi": "10.1017/S1352465822000285",
      "journal": "Behav Cogn Psychother",
      "volume": "50",
      "issue": "6",
      "raw": "Internet-delivered cognitive behaviour therapy for post-traumatic stress disorder: a randomised controlled trial and outcomes in routine care \n\t\t \n\t\t\t A R Allen \n\t\t \n\t\t \n\t\t\t J Smith \n\t\t \n\t\t \n\t\t\t M J Hobbs \n\t\t \n\t\t \n\t\t\t S A Loughnan \n\t\t \n\t\t \n\t\t\t M Sharrock \n\t\t \n\t\t \n\t\t\t J M Newby \n\t\t \n\t\t 10.1017/S1352465822000285 \n\t\t Medline: 35924312] 261 \n\t \n\t \n\t\t Behav Cogn Psychother \n\t\t \n\t\t\t 50 \n\t\t\t 6 \n\t\t\t \n\t\t\t 2022 Nov \n\t\t \n\t \n\t Allen AR, Smith J, Hobbs MJ, Loughnan SA, Sharrock M, Newby JM, et al. Internet-delivered cognitive behaviour therapy for post-traumatic stress disorder: a randomised controlled trial and outcomes in routine care. Behav Cogn Psychother 2022 Nov;50(6):649-655 [doi: 10.1017/S1352465822000285] [Medline: 35924312] 261"
    },
    {
      "title": "Cost-effectiveness of an app-based treatment for urinary incontinence in comparison with care-as-usual in Dutch general practice: a pragmatic randomised controlled trial over 12 months",
      "authors": [
        "A Loohuis",
        "H Van Der Worp",
        "N Wessels",
        "J Dekker",
        "M Slieker-Ten Hove",
        "M Berger"
      ],
      "year": 2022,
      "doi": "10.1111/1471-0528.17191",
      "journal": "BJOG",
      "volume": "129",
      "issue": "9",
      "raw": "Cost-effectiveness of an app-based treatment for urinary incontinence in comparison with care-as-usual in Dutch general practice: a pragmatic randomised controlled trial over 12 months \n\t\t \n\t\t\t A M Loohuis \n\t\t \n\t\t \n\t\t\t H Van Der Worp \n\t\t \n\t\t \n\t\t\t N J Wessels \n\t\t \n\t\t \n\t\t\t J H Dekker \n\t\t \n\t\t \n\t\t\t M C Slieker-Ten Hove \n\t\t \n\t\t \n\t\t\t M Y Berger \n\t\t \n\t\t 10.1111/1471-0528.17191 \n\t\t Medline: 35460163] 262 \n\t \n\t \n\t\t BJOG \n\t\t \n\t\t\t 129 \n\t\t\t 9 \n\t\t\t \n\t\t\t 2022 Aug \n\t\t \n\t \n\t FREE Full text \n\t Loohuis AM, Van Der Worp H, Wessels NJ, Dekker JH, Slieker-Ten Hove MC, Berger MY, et al. Cost-effectiveness of an app-based treatment for urinary incontinence in comparison with care-as-usual in Dutch general practice: a pragmatic randomised controlled trial over 12 months. BJOG 2022 Aug;129(9):1538-1545 [FREE Full text] [doi: 10.1111/1471-0528.17191] [Medline: 35460163] 262"
    },
    {
      "title": "Effectiveness and cost-effectiveness of a self-guided internet intervention for social anxiety symptoms in a general population sample: randomized controlled trial",
      "authors": [
        "J Powell",
        "V Williams",
        "H Atherton",
        "K Bennett",
        "Y Yang",
        "M Davoudianfar"
      ],
      "year": 2020,
      "doi": "10.2196/16804",
      "journal": "J Med Internet Res",
      "volume": "22",
      "issue": "1",
      "pages": "16804",
      "raw": "Effectiveness and cost-effectiveness of a self-guided internet intervention for social anxiety symptoms in a general population sample: randomized controlled trial \n\t\t \n\t\t\t J Powell \n\t\t \n\t\t \n\t\t\t V Williams \n\t\t \n\t\t \n\t\t\t H Atherton \n\t\t \n\t\t \n\t\t\t K Bennett \n\t\t \n\t\t \n\t\t\t Y Yang \n\t\t \n\t\t \n\t\t\t M Davoudianfar \n\t\t \n\t\t 10.2196/16804 \n\t\t Medline: 31821151] 263 \n\t \n\t \n\t\t J Med Internet Res \n\t\t \n\t\t\t 22 \n\t\t\t 1 \n\t\t\t 16804 \n\t\t\t 2020 Jan 10 \n\t\t \n\t \n\t FREE Full text \n\t Powell J, Williams V, Atherton H, Bennett K, Yang Y, Davoudianfar M, et al. Effectiveness and cost-effectiveness of a self-guided internet intervention for social anxiety symptoms in a general population sample: randomized controlled trial. J Med Internet Res 2020 Jan 10;22(1):e16804 [FREE Full text] [doi: 10.2196/16804] [Medline: 31821151] 263"
    },
    {
      "title": "A digital application and augmented physician rounds reduce postoperative pain and opioid consumption after primary total knee replacement (TKR): a randomized clinical trial",
      "authors": [
        "J Stuhlreyer",
        "C Roder",
        "F Krug",
        "C Z\u00f6llner",
        "H Flor",
        "R Klinger"
      ],
      "year": 2014,
      "doi": "10.1186/s12916-022-02638-0",
      "volume": "20",
      "pages": "266",
      "raw": "A digital application and augmented physician rounds reduce postoperative pain and opioid consumption after primary total knee replacement (TKR): a randomized clinical trial \n\t\t \n\t\t\t J Stuhlreyer \n\t\t \n\t\t \n\t\t\t C Roder \n\t\t \n\t\t \n\t\t\t F Krug \n\t\t \n\t\t \n\t\t\t C Z\u00f6llner \n\t\t \n\t\t \n\t\t\t H Flor \n\t\t \n\t\t \n\t\t\t R Klinger \n\t\t \n\t\t 10.1186/s12916-022-02638-0 \n\t\t Medline: 36464680] 264 \n\t\t \n\t \n\t \n\t\t Evidence standards framework (ESF) for digital health technologies \n\t\t , England \n\t\t \n\t\t\t National Institute for Health and Care Excellence \n\t\t\t 2022 Dec 05. 2014. 2022-11-30] 265. 2018. 2022-11-11 \n\t\t\t 20 \n\t\t\t 266 \n\t\t \n\t \n\t FREE Full text Open API architecture policy \n\t Stuhlreyer J, Roder C, Krug F, Z\u00f6llner C, Flor H, Klinger R. A digital application and augmented physician rounds reduce postoperative pain and opioid consumption after primary total knee replacement (TKR): a randomized clinical trial. BMC Med 2022 Dec 05;20(1):469 [FREE Full text] [doi: 10.1186/s12916-022-02638-0] [Medline: 36464680] 264. Open API architecture policy. National Health Service, England. 2014. URL: https://www.england.nhs.uk/wp-content/ uploads/2018/09/open-api-policy.pdf [accessed 2022-11-30] 265. Evidence standards framework (ESF) for digital health technologies. National Institute for Health and Care Excellence. 2018. URL: https://www.nice.org.uk/about/what-we-do/our-programmes/ evidence-standards-framework-for-digital-health-technologies [accessed 2022-11-11] 266"
    },
    {
      "title": "The Fast-Track process for digital health applications (DiGA) according to section 139e SGB V",
      "year": 2022,
      "doi": "10.1016/j.jval.2022.09.1914",
      "pages": "267",
      "raw": "10.1016/j.jval.2022.09.1914 \n\t\t \n\t\t The Fast-Track process for digital health applications (DiGA) according to section 139e SGB V \n\t\t \n\t\t\t Federal Institute for Drugs and Medical Devices \n\t\t\t 2022. 2022-10-15 \n\t\t\t 267 \n\t\t \n\t \n\t The Fast-Track process for digital health applications (DiGA) according to section 139e SGB V. Federal Institute for Drugs and Medical Devices. 2022. URL: https://www.bfarm.de/SharedDocs/Downloads/EN/MedicalDevices/DiGA_Guide. pdf?__blob=publicationFile&v=2 [accessed 2022-10-15] 267"
    },
    {
      "title": "Establishing the NHS digital academy: future vision and implementation areas for expansion",
      "authors": [
        "A Cowey"
      ],
      "year": 2021,
      "pages": "268",
      "raw": "Establishing the NHS digital academy: future vision and implementation areas for expansion \n\t\t \n\t\t\t A Cowey \n\t\t \n\t\t \n\t\t \n\t\t\t 2021. 2023-01-15 \n\t\t\t National Health Service Health Education \n\t\t\t 268 \n\t\t\t England \n\t\t \n\t \n\t Cowey A. Establishing the NHS digital academy: future vision and implementation areas for expansion. National Health Service Health Education, England. 2021. URL: https://digital-transformation.hee.nhs.uk/binaries/content/assets/ digital-transformation/nhs-digital-academy/digital-academy-future-vision-report---mar-2021.pdf [accessed 2023-01-15] 268"
    },
    {
      "title": "Comparing willingness to pay for telemedicine across a chronic heart failure and hypertension population",
      "authors": [
        "W Bradford",
        "A Kleit",
        "M Krousel-Wood",
        "R Re"
      ],
      "year": 2005,
      "doi": "10.1089/tmj.2005.11.430",
      "journal": "Telemed J E Health",
      "volume": "11",
      "issue": "4",
      "raw": "Comparing willingness to pay for telemedicine across a chronic heart failure and hypertension population \n\t\t \n\t\t\t W D Bradford \n\t\t \n\t\t \n\t\t\t A Kleit \n\t\t \n\t\t \n\t\t\t M A Krousel-Wood \n\t\t \n\t\t \n\t\t\t R M Re \n\t\t \n\t\t 10.1089/tmj.2005.11.430 \n\t\t Medline: 16149888] 269 \n\t \n\t \n\t\t Telemed J E Health \n\t\t \n\t\t\t 11 \n\t\t\t 4 \n\t\t\t \n\t\t\t 2005 Aug \n\t\t \n\t \n\t Bradford WD, Kleit A, Krousel-Wood MA, Re RM. Comparing willingness to pay for telemedicine across a chronic heart failure and hypertension population. Telemed J E Health 2005 Aug;11(4):430-438 [doi: 10.1089/tmj.2005.11.430] [Medline: 16149888] 269"
    },
    {
      "title": "Estimating willingness to pay for online health services with discrete-choice experiments",
      "authors": [
        "J Chang",
        "S Savage",
        "D Waldman"
      ],
      "year": 2017,
      "doi": "10.1007/s40258-017-0316-z",
      "journal": "Appl Health Econ Health Policy",
      "volume": "15",
      "issue": "4",
      "raw": "Estimating willingness to pay for online health services with discrete-choice experiments \n\t\t \n\t\t\t J Chang \n\t\t \n\t\t \n\t\t\t S J Savage \n\t\t \n\t\t \n\t\t\t D M Waldman \n\t\t \n\t\t 10.1007/s40258-017-0316-z \n\t\t Medline: 28290107] 270 \n\t \n\t \n\t\t Appl Health Econ Health Policy \n\t\t \n\t\t\t 15 \n\t\t\t 4 \n\t\t\t \n\t\t\t 2017 Aug \n\t\t \n\t \n\t Chang J, Savage SJ, Waldman DM. Estimating willingness to pay for online health services with discrete-choice experiments. Appl Health Econ Health Policy 2017 Aug;15(4):491-500 [doi: 10.1007/s40258-017-0316-z] [Medline: 28290107] 270"
    },
    {
      "title": "Assessing elderly user preference for telehealth solutions in China: exploratory quantitative study",
      "authors": [
        "N Chen",
        "P Liu"
      ],
      "year": 2021,
      "doi": "10.2196/27272",
      "journal": "JMIR Mhealth Uhealth",
      "volume": "10",
      "issue": "1",
      "pages": "273",
      "raw": "Assessing elderly user preference for telehealth solutions in China: exploratory quantitative study \n\t\t \n\t\t\t N Chen \n\t\t \n\t\t \n\t\t\t P Liu \n\t\t \n\t\t 10.2196/27272 \n\t\t Medline: 35019852] 271 \n\t\t \n\t \n\t \n\t\t JMIR Mhealth Uhealth \n\t\t \n\t\t\t 10 \n\t\t\t 1 \n\t\t\t 273 \n\t\t\t 2022 Jan 12. 2021. 2023-01-31] 272. 2023. 2023-02-20 \n\t\t\t EVA) for medtech. National Institute for Health and Care Excellence \n\t\t \n\t \n\t FREE Full text NHS apps library \n\t Chen N, Liu P. Assessing elderly user preference for telehealth solutions in China: exploratory quantitative study. JMIR Mhealth Uhealth 2022 Jan 12;10(1):e27272 [FREE Full text] [doi: 10.2196/27272] [Medline: 35019852] 271. NHS apps library. National Health Service Digit. 2021. URL: https://digital.nhs.uk/services/nhs-apps-library [accessed 2023-01-31] 272. Early Value Assessment (EVA) for medtech. National Institute for Health and Care Excellence. 2023. URL: https://www. nice.org.uk/about/what-we-do/eva-for-medtech [accessed 2023-02-20] 273"
    },
    {
      "title": "Strategies for building eHealth infrastructures",
      "authors": [
        "M Aanestad",
        "M Grisot",
        "O Hanseth",
        "P Vassilakopoulou"
      ],
      "year": 2017,
      "doi": "10.1007/978-3-319-51020-0_4",
      "pages": "274",
      "raw": "Strategies for building eHealth infrastructures \n\t\t \n\t\t\t M Aanestad \n\t\t \n\t\t \n\t\t\t M Grisot \n\t\t \n\t\t \n\t\t\t O Hanseth \n\t\t \n\t\t \n\t\t\t P Vassilakopoulou \n\t\t \n\t\t 10.1007/978-3-319-51020-0_4 \n\t \n\t \n\t\t Information Infrastructures within European Health Care: Working with the Installed Base \n\t\t Cham, Switzerland \n\t\t \n\t\t\t Springer \n\t\t\t 2017 \n\t\t\t 274 \n\t\t \n\t \n\t Aanestad M, Grisot M, Hanseth O, Vassilakopoulou P. Strategies for building eHealth infrastructures. In: Information Infrastructures within European Health Care: Working with the Installed Base. Cham, Switzerland: Springer; 2017. 274"
    },
    {
      "title": "Family caregiver needs and preferences for virtual training to manage behavioral and psychological symptoms of dementia: interview study",
      "authors": [
        "M Ramirez",
        "M Duran",
        "C Pabiniak",
        "K Hansen",
        "A Kelley",
        "J Ralston"
      ],
      "year": 2021,
      "doi": "10.2196/24965",
      "journal": "JMIR Aging",
      "volume": "4",
      "issue": "1",
      "pages": "24965",
      "raw": "Family caregiver needs and preferences for virtual training to manage behavioral and psychological symptoms of dementia: interview study \n\t\t \n\t\t\t M Ramirez \n\t\t \n\t\t \n\t\t\t M C Duran \n\t\t \n\t\t \n\t\t\t C J Pabiniak \n\t\t \n\t\t \n\t\t\t K E Hansen \n\t\t \n\t\t \n\t\t\t A Kelley \n\t\t \n\t\t \n\t\t\t J D Ralston \n\t\t \n\t\t 10.2196/24965 \n\t\t Medline: 33565984] 275 \n\t \n\t \n\t\t JMIR Aging \n\t\t \n\t\t\t 4 \n\t\t\t 1 \n\t\t\t 24965 \n\t\t\t 2021 Feb 10 \n\t\t \n\t \n\t FREE Full text \n\t Ramirez M, Duran MC, Pabiniak CJ, Hansen KE, Kelley A, Ralston JD, et al. Family caregiver needs and preferences for virtual training to manage behavioral and psychological symptoms of dementia: interview study. JMIR Aging 2021 Feb 10;4(1):e24965 [FREE Full text] [doi: 10.2196/24965] [Medline: 33565984] 275"
    },
    {
      "title": "Confronting challenges in the US health care system: potential opportunity in a time of crisis",
      "authors": [
        "N Cox",
        "Dal Corso",
        "S Hansen",
        "H Mcdonald",
        "C Hill",
        "C Zanaboni"
      ],
      "year": 2021,
      "doi": "10.1001/jama.2021.1471",
      "journal": "Cochrane Database Syst Rev",
      "volume": "1",
      "issue": "1",
      "raw": "Confronting challenges in the US health care system: potential opportunity in a time of crisis \n\t\t \n\t\t\t N S Cox \n\t\t \n\t\t \n\t\t\t Dal Corso \n\t\t \n\t\t \n\t\t\t S Hansen \n\t\t \n\t\t \n\t\t\t H Mcdonald \n\t\t \n\t\t \n\t\t\t C F Hill \n\t\t \n\t\t \n\t\t\t C J Zanaboni \n\t\t \n\t\t \n\t\t\t P \n\t\t \n\t\t 10.1001/jama.2021.1471 \n\t\t Medline: 33847726] 277. VC \n\t\t \n\t \n\t \n\t\t Cochrane Database Syst Rev \n\t\t \n\t\t\t 1 \n\t\t\t 1 \n\t\t\t \n\t\t\t 2021 Jan 29. 2021 Apr 13. 2023 \n\t\t \n\t \n\t FREE Full text Telerehabilitation for chronic respiratory disease JAMA digital health deal count by country worldwide HY1 2020. Statista. 2022 \n\t Cox NS, Dal Corso S, Hansen H, McDonald CF, Hill CJ, Zanaboni P, et al. Telerehabilitation for chronic respiratory disease. Cochrane Database Syst Rev 2021 Jan 29;1(1):CD013040 [FREE Full text] [doi: 10.1002/14651858.CD013040.pub2] [Medline: 33511633] 276. Buntin MB. Confronting challenges in the US health care system: potential opportunity in a time of crisis. JAMA 2021 Apr 13;325(14):1399-1400 [doi: 10.1001/jama.2021.1471] [Medline: 33847726] 277. VC digital health deal count by country worldwide HY1 2020. Statista. 2022. URL: https://www.statista.com/statistics/ 1063913/vc-backed-digital-health-deals-in-select-countries/ [accessed 2023-01-27] 278"
    },
    {
      "title": "International profiles of health care systems",
      "authors": [
        "R Tikkanen",
        "R Osborn",
        "E Mossialos",
        "A Djordjevic",
        "G Wharton"
      ],
      "year": 2020,
      "doi": "10.15868/socialsector.22501",
      "pages": "279",
      "raw": "International profiles of health care systems \n\t\t \n\t\t\t R Tikkanen \n\t\t \n\t\t \n\t\t\t R Osborn \n\t\t \n\t\t \n\t\t\t E Mossialos \n\t\t \n\t\t \n\t\t\t A Djordjevic \n\t\t \n\t\t \n\t\t\t G Wharton \n\t\t \n\t\t 10.15868/socialsector.22501 \n\t\t \n\t\t \n\t\t\t 2020. 2022-11-26 \n\t\t\t The Commonwealth Fund \n\t\t\t 279 \n\t\t \n\t \n\t Tikkanen R, Osborn R, Mossialos E, Djordjevic A, Wharton G. International profiles of health care systems. The Commonwealth Fund. 2020. URL: https://www.commonwealthfund.org/sites/default/files/2020-12/ International_Profiles_of_Health_Care_Systems_Dec2020.pdf [accessed 2022-11-26] 279"
    },
    {
      "title": "The economics of health and health care",
      "authors": [
        "S Folland",
        "A Goodman",
        "M Stano"
      ],
      "year": 2017,
      "doi": "10.4324/9781315103488",
      "pages": "280",
      "raw": "S Folland \n\t\t \n\t\t \n\t\t\t A Goodman \n\t\t \n\t\t \n\t\t\t M Stano \n\t\t \n\t\t 10.4324/9781315103488 \n\t\t The economics of health and health care \n\t\t London, United Kingdom \n\t\t \n\t\t\t Routledge, Taylor & Francis Group \n\t\t\t 2017 \n\t\t\t 280 \n\t\t \n\t \n\t 8th edition \n\t Folland S, Goodman A, Stano M. The economics of health and health care. 8th edition. London, United Kingdom: Routledge, Taylor & Francis Group; 2017. 280"
    },
    {
      "title": "LSE-Lancet Commission on the future of the NHS: re-laying the foundations for an equitable and efficient health and care service after COVID-19",
      "authors": [
        "M Anderson",
        "E Pitchforth",
        "M Asaria",
        "C Brayne",
        "B Casadei",
        "A Charlesworth"
      ],
      "year": 2021,
      "doi": "10.1016/s0140-6736(21)00232-4",
      "journal": "Lancet",
      "volume": "397",
      "issue": "10288",
      "raw": "LSE-Lancet Commission on the future of the NHS: re-laying the foundations for an equitable and efficient health and care service after COVID-19 \n\t\t \n\t\t\t M Anderson \n\t\t \n\t\t \n\t\t\t E Pitchforth \n\t\t \n\t\t \n\t\t\t M Asaria \n\t\t \n\t\t \n\t\t\t C Brayne \n\t\t \n\t\t \n\t\t\t B Casadei \n\t\t \n\t\t \n\t\t\t A Charlesworth \n\t\t \n\t\t 10.1016/s0140-6736(21)00232-4 \n\t\t Medline: 33965070] 281 \n\t\t \n\t \n\t \n\t\t Lancet \n\t\t \n\t\t\t 397 \n\t\t\t 10288 \n\t\t\t \n\t\t\t 2021 May 22. 2022 \n\t\t\t Dutch Healthcare Authority \n\t\t \n\t \n\t FREE Full text Wegwijzer bekostiging digitale zorg 2023 \n\t Anderson M, Pitchforth E, Asaria M, Brayne C, Casadei B, Charlesworth A, et al. LSE-Lancet Commission on the future of the NHS: re-laying the foundations for an equitable and efficient health and care service after COVID-19. Lancet 2021 May 22;397(10288):1915-1978 [FREE Full text] [doi: 10.1016/S0140-6736(21)00232-4] [Medline: 33965070] 281. Wegwijzer bekostiging digitale zorg 2023. Dutch Healthcare Authority. 2022. URL: https://puc.overheid.nl/nza/doc/ PUC_655318_22/1/ [accessed 2022-11-11]"
    }
  ],
  "num_references": 272,
  "figures": [
    {
      "caption": "Figure 1 .",
      "description": "Figure 1. A PRISMA (Preferred Reporting Items for Systematic Reviews and Meta-Analyses) flowchart outlining the data collection process. HTA: health technology assessment."
    },
    {
      "caption": "Figure 2 .",
      "description": "Figure 2. Map of the factors that can affect the uptake of digital therapeutics. The items in red are reported in 15% or more of the included articles.Items in yellow are reported in 5% to 15% of included articles. Items in blue are reported in less than 5% of the included articles."
    }
  ],
  "num_figures": 2,
  "num_citations": 1421,
  "cited_references": [
    "b72",
    "b13",
    "b65",
    "b79",
    "b41",
    "b44",
    "b14",
    "b25",
    "b1",
    "b35",
    "b20",
    "b92",
    "b90",
    "b71",
    "b74",
    "b51",
    "b42",
    "b30",
    "b96",
    "b29",
    "b28",
    "b83",
    "b4",
    "b56",
    "b85",
    "b50",
    "b62",
    "b11",
    "b22",
    "b34",
    "b58",
    "b6",
    "b0",
    "b73",
    "b2",
    "b17",
    "b77",
    "b60",
    "b43",
    "b66",
    "b68",
    "b12",
    "b98",
    "b78",
    "b52",
    "b97",
    "b75",
    "b82",
    "b84",
    "b89",
    "b81",
    "b33",
    "b8",
    "b27",
    "b57",
    "b39",
    "b49",
    "b94",
    "b36",
    "b59",
    "b21",
    "b64",
    "b40",
    "b54",
    "b91",
    "b16",
    "b46",
    "b32",
    "b45",
    "b10",
    "b67",
    "b55",
    "b7",
    "b76",
    "b3",
    "b86",
    "b18",
    "b87",
    "b9",
    "b69",
    "b95",
    "b47",
    "b93",
    "b31",
    "b70",
    "b61",
    "b37",
    "b15",
    "b5",
    "b19",
    "b38",
    "b88",
    "b24",
    "b48",
    "b53",
    "b63",
    "b80",
    "b23",
    "b26"
  ],
  "notes": [
    "[raw_affiliation] 1  LSE Health , Department of Health Policy , London School of Economics and Political Science , London , United Kingdom",
    "[raw_affiliation] 2  Department of International Health , Care and Public Health Research Institute , Faculty of Health , Medicine and Life Sciences , Maastricht University , Maastricht , Netherlands",
    "[raw_affiliation] 3  Department of Psychiatry , University of Cambridge , Cambridge , United Kingdom",
    "[raw_affiliation] 4  Department of Psychiatry and Behavioral Sciences , Stanford University , Stanford , CA , United States",
    "[raw_affiliation] 1  LSE Health , Department of Health Policy , London School of Economics and Political Science , London , United Kingdom",
    "[raw_affiliation] 1  LSE Health , Department of Health Policy , London School of Economics and Political Science , London , United Kingdom",
    "[raw_affiliation] 5  Department of Health Services Research and Policy , London School of Hygiene and Tropical Medicine , London , United Kingdom",
    "[raw_affiliation] 1  LSE Health , Department of Health Policy , London School of Economics and Political Science , London , United Kingdom",
    "[raw_affiliation] 6  Duke Clinical Research Institute , Duke University School of Medicine , Durham , NC , United States",
    "[raw_affiliation] 7  Department of Health Services Research , Care and Public Health Research Institute , Faculty of Health Medicine and Life Science , Maastricht University , Maastricht , Netherlands",
    "[raw_affiliation] 1  LSE Health , Department of Health Policy , London School of Economics and Political Science , London , United Kingdom",
    "[raw_affiliation] 1  LSE Health , Department of Health Policy , London School of Economics and Political Science , London , United Kingdom",
    "[raw_affiliation] 8  Institute of Global Health Innovation , Imperial College London , London , United Kingdom",
    "[raw_affiliation] LSE Health Department of Health Policy London School of Economics and Political Science London , WC2A 2AE United Kingdom",
    "J Med Internet Res 2023 | vol. 25 | e48000 | p. 2 https://www.jmir.org/2023/1/e48000 (page number not for citation purposes)",
    "J Med Internet Res 2023 | vol. 25 | e48000 | p. 3 https://www.jmir.org/2023/1/e48000 (page number not for citation purposes)",
    "J Med Internet Res 2023 | vol. 25 | e48000 | p. 4 https://www.jmir.org/2023/1/e48000 (page number not for citation purposes)",
    "J Med Internet Res 2023 | vol. 25 | e48000 | p. 5 https://www.jmir.org/2023/1/e48000(page number not for citation purposes)",
    "J Med Internet Res 2023 | vol. 25 | e48000 | p. 6 https://www.jmir.org/2023/1/e48000 (page number not for citation purposes)",
    "J Med Internet Res 2023 | vol. 25 | e48000 | p. 7 https://www.jmir.org/2023/1/e48000 (page number not for citation purposes)",
    "J Med Internet Res 2023 | vol. 25 | e48000 | p. 8 https://www.jmir.org/2023/1/e48000 (page number not for citation purposes)",
    "J Med Internet Res 2023 | vol. 25 | e48000 | p. 9 https://www.jmir.org/2023/1/e48000 (page number not for citation purposes)",
    "J Med Internet Res 2023 | vol. 25 | e48000 | p. 10 https://www.jmir.org/2023/1/e48000 (page number not for citation purposes)",
    "J Med Internet Res 2023 | vol. 25 | e48000 | p. 11 https://www.jmir.org/2023/1/e48000 (page number not for citation purposes)",
    "J Med Internet Res 2023 | vol. 25 | e48000 | p. 12 https://www.jmir.org/2023/1/e48000 (page number not for citation purposes)",
    "J Med Internet Res 2023 | vol. 25 | e48000 | p. 13 https://www.jmir.org/2023/1/e48000 (page number not for citation purposes)",
    "J Med Internet Res 2023 | vol. 25 | e48000 | p. 14 https://www.jmir.org/2023/1/e48000 (page number not for citation purposes)",
    "J Med Internet Res 2023 | vol. 25 | e48000 | p. 15 https://www.jmir.org/2023/1/e48000 (page number not for citation purposes)",
    "J Med Internet Res 2023 | vol. 25 | e48000 | p. 16 https://www.jmir.org/2023/1/e48000 (page number not for citation purposes)",
    "J Med Internet Res 2023 | vol. 25 | e48000 | p. 17 https://www.jmir.org/2023/1/e48000 (page number not for citation purposes)",
    "J Med Internet Res 2023 | vol. 25 | e48000 | p. 18 https://www.jmir.org/2023/1/e48000 (page number not for citation purposes)",
    "J Med Internet Res 2023 | vol. 25 | e48000 | p. 19 https://www.jmir.org/2023/1/e48000 (page number not for citation purposes)",
    "J Med Internet Res 2023 | vol. 25 | e48000 | p. 20 https://www.jmir.org/2023/1/e48000 (page number not for citation purposes)",
    "J Med Internet Res 2023 | vol. 25 | e48000 | p. 21 https://www.jmir.org/2023/1/e48000 (page number not for citation purposes)",
    "J Med Internet Res 2023 | vol. 25 | e48000 | p. 22 https://www.jmir.org/2023/1/e48000 (page number not for citation purposes)",
    "J Med Internet Res 2023 | vol. 25 | e48000 | p. 23 https://www.jmir.org/2023/1/e48000 (page number not for citation purposes)",
    "J Med Internet Res 2023 | vol. 25 | e48000 | p. 24 https://www.jmir.org/2023/1/e48000 (page number not for citation purposes) van Kessel et al JOURNAL OF MEDICAL INTERNET RESEARCH",
    "J Med Internet Res 2023 | vol. 25 | e48000 | p. 25 https://www.jmir.org/2023/1/e48000 (page number not for citation purposes)",
    "[raw_reference] Fahy N, Williams GA, Habicht T, K\u00f6hler K, Jormanainen V, Satokangas M, et al. Use of Digital Health Tools in Europe: Before, During and After COVID-19. Copenhagen (Denmark): European Observatory on Health Systems and Policies; 2021. URL: https://www.ncbi.nlm.nih.gov/books/NBK576970/ [accessed 2022-11-01]",
    "FREE Full text",
    "[raw_reference] Patel NA, Butte AJ. Characteristics and challenges of the clinical pipeline of digital therapeutics. NPJ Digit Med 2020 Dec 11;3(1):159 [FREE Full text] [doi: 10.1038/s41746-020-00370-8] [Medline: 33311567]",
    "FREE Full text",
    "[raw_reference] Rowland SP, Fitzgerald JE, Holme T, Powell J, McGregor A. What is the clinical value of mHealth for patients? NPJ Digit Med 2020 Jan 13;3:4 [FREE Full text] [doi: 10.1038/s41746-019-0206-x] [Medline: 31970289]",
    "FREE Full text",
    "[raw_reference] Ess\u00e9n A, Stern AD, Haase CB, Car J, Greaves F, Paparova D, et al. Health app policy: international comparison of nine countries' approaches. NPJ Digit Med 2022 Mar 18;5(1):31 [FREE Full text] [doi: 10.1038/s41746-022-00573-1] [Medline: 35304561]",
    "[raw_reference] Brassel S, Radu P, Bell E, Garau M. Navigating the landscape of digital health. Office of Health Economics. 2022. URL: https://www.ohe.org/publications/navigating-the-landscape-of-digital-health/ [accessed 2023-01-11]",
    "FREE Full text",
    "[raw_reference] Kollins SH, DeLoss DJ, Ca\u00f1adas E, Lutz J, Findling RL, Keefe RS, et al. A novel digital intervention for actively reducing severity of paediatric ADHD (STARS-ADHD): a randomised controlled trial. Lancet Digit Health 2020 Apr;2(4):e168-e178 [FREE Full text] [doi: 10.1016/S2589-7500(20)30017-0] [Medline: 33334505]",
    "FREE Full text",
    "[raw_reference] Kollins SH, Childress A, Heusser AC, Lutz J. Effectiveness of a digital therapeutic as adjunct to treatment with medication in pediatric ADHD. NPJ Digit Med 2021 Mar 26;4(1):58 [FREE Full text] [doi: 10.1038/s41746-021-00429-0] [Medline: 33772095]",
    "FREE Full text",
    "[raw_reference] Brezing CA, Brixner DI. The rise of prescription digital therapeutics in behavioral health. Adv Ther 2022 Dec;39(12):5301-5306 [FREE Full text] [doi: 10.1007/s12325-022-02320-0] [Medline: 36242730]",
    "FREE Full text",
    "[raw_reference] Fast N, van Kessel R, Humphreys K, Ward NF, Roman-Urrestarazu A. The evolution of telepsychiatry for substance use disorders during COVID-19: a narrative review. Curr Addict Rep 2023;10(2):187-197 [FREE Full text] [doi: 10.1007/s40429-023-00480-9] [Medline: 37266192]",
    "FREE Full text",
    "[raw_reference] Shah N, Velez FF, Colman S, Kauffman L, Ruetsch C, Anastassopoulos K, et al. Real-world reductions in healthcare resource utilization over 6 months in patients with substance use disorders treated with a prescription digital therapeutic. Adv Ther 2022 Sep;39(9):4146-4156 [FREE Full text] [doi: 10.1007/s12325-022-02215-0] [Medline: 35819569]",
    "FREE Full text",
    "[raw_reference] Lantzsch H, Panteli D, Martino F, Stephani V, Sei\u00dfler D, P\u00fcschel C, et al. Benefit assessment and reimbursement of digital health applications: concepts for setting up a new system for public coverage. Front Public Health 2022 Apr 21;10:832870 [FREE Full text] [doi: 10.3389/fpubh.2022.832870] [Medline: 35530738]",
    "FREE Full text",
    "[raw_reference] Ju JH, Sim B, Lee J, Lee JY. Reimbursement of digital therapeutics: future perspectives in Korea. Korean Circ J 2022 Apr;52(4):265-279 [FREE Full text] [doi: 10.4070/kcj.2022.0014] [Medline: 35388995]",
    "FREE Full text",
    "[raw_reference] Tromp J, Jindal D, Redfern J, Bhatt A, S\u00e9verin T, Banerjee A, et al. World heart federation roadmap for digital health in cardiology. Glob Heart 2022 Aug 26;17(1):61 [FREE Full text] [doi: 10.5334/gh.1141] [Medline: 36051317]",
    "[raw_reference] von Huben A, Howell M, Howard K, Carrello J, Norris S. Health technology assessment for digital technologies that manage chronic disease: a systematic review. Int J Technol Assess Health Care 2021 May 26;37(1):e66 [doi: 10.1017/S0266462321000362] [Medline: 34034851]",
    "FREE Full text",
    "[raw_reference] Prodan A, Deimel L, Ahlqvist J, Birov S, Thiel R, Toivanen M, et al. Success factors for scaling up the adoption of digital therapeutics towards the realization of P5 medicine. Front Med (Lausanne) 2022 Apr 12;9:854665 [FREE Full text] [doi: 10.3389/fmed.2022.854665] [Medline: 35492346]",
    "FREE Full text",
    "[raw_reference] van Kessel R, Wong BL, Rubini\u0107 I, O'Nuallain E, Czabanowska K. Is Europe prepared to go digital? Making the case for developing digital capacity: an exploratory analysis of Eurostat survey data. PLOS Digit Health 2022 Feb 17;1(2):e0000013 [FREE Full text] [doi: 10.1371/journal.pdig.0000013] [Medline: 36812527]",
    "FREE Full text",
    "[raw_reference] Wong BL, Maa\u00df L, Vodden A, van Kessel R, Sorbello S, Buttigieg S, European Public Health Association (EUPHA) Digital Health Section. The dawn of digital public health in Europe: for public health policy and practice. Lancet Reg Health Eur 2022 Mar;14:100316 [FREE Full text] [doi: 10.1016/j.lanepe.2022.100316] [Medline: 35132399]",
    "FREE Full text",
    "[raw_reference] Holly L, Wong BL, van Kessel R, Awah I, Agrawal A, Ndili N. Optimising adolescent wellbeing in a digital age. BMJ 2023 Mar 20;380:e068279 [FREE Full text] [doi: 10.1136/bmj-2021-068279] [Medline: 36940933]",
    "FREE Full text",
    "[raw_reference] Whitelaw S, Pellegrini DM, Mamas MA, Cowie M, Van Spall HG. Barriers and facilitators of the uptake of digital health technology in cardiovascular care: a systematic scoping review. Eur Heart J Digit Health 2021 Feb 04;2(1):62-74 [FREE Full text] [doi: 10.1093/ehjdh/ztab005] [Medline: 34048508]",
    "FREE Full text",
    "[raw_reference] van Kessel R, Kyriopoulos I, Mastylak A, Mossialos E. Changes in digital healthcare search behavior during the early months of the COVID-19 pandemic: a study of six English-speaking countries. PLOS Digit Health 2023 May 01;2(5):e0000241 [FREE Full text] [doi: 10.1371/journal.pdig.0000241] [Medline: 37126489]",
    "FREE Full text",
    "[raw_reference] van Kessel R, Kyriopoulos I, Wong BL, Mossialos E. The effect of the COVID-19 pandemic on digital health-seeking behavior: big data interrupted time-series analysis of Google trends. J Med Internet Res 2023 Jan 16;25:e42401 [FREE Full text] [doi: 10.2196/42401] [Medline: 36603152]",
    "FREE Full text",
    "[raw_reference] Greenhalgh T, Wherton J, Papoutsi C, Lynch J, Hughes G, A'Court C, et al. Beyond adoption: a new framework for theorizing and evaluating nonadoption, abandonment, and challenges to the scale-up, spread, and sustainability of health and care technologies. J Med Internet Res 2017 Nov 01;19(11):e367 [FREE Full text] [doi: 10.2196/jmir.8775] [Medline: 29092808]",
    "FREE Full text",
    "[raw_reference] Gordon WJ, Landman A, Zhang H, Bates DW. Beyond validation: getting health apps into clinical practice. NPJ Digit Med 2020 Feb 03;3:14 [FREE Full text] [doi: 10.1038/s41746-019-0212-z] [Medline: 32047860]",
    "[raw_reference] Chawla V. Where is the money in digital health? The roadmap to digital health app reimbursement in Europe. Research 2 Guidance. 2022. URL: https://research2guidance.com/ where-is-the-money-in-digital-health-the-roadmap-to-digital-health-app-reimbursement-in-europe/ [accessed 2022-11-11]",
    "FREE Full text",
    "[raw_reference] Wharton GA, Sood HS, Sissons A, Mossialos E. Virtual primary care: fragmentation or integration? Lancet Digit Health 2019 Nov;1(7):e330-e331 [FREE Full text] [doi: 10.1016/S2589-7500(19)30152-9] [Medline: 33323207]",
    "FREE Full text",
    "[raw_reference] Arksey H, O'Malley L. Scoping studies: towards a methodological framework. Int J Soc Res Methodol 2005 Feb;8(1):19-32 [FREE Full text] [doi: 10.1080/1364557032000119616]",
    "FREE Full text",
    "[raw_reference] Levac D, Colquhoun H, O'Brien KK. Scoping studies: advancing the methodology. Implement Sci 2010 Sep 20;5:69 [FREE Full text] [doi: 10.1186/1748-5908-5-69] [Medline: 20854677]",
    "FREE Full text",
    "[raw_reference] Sutton A, Clowes M, Preston L, Booth A. Meeting the review family: exploring review types and associated information retrieval requirements. Health Info Libr J 2019 Sep;36(3):202-222 [FREE Full text] [doi: 10.1111/hir.12276] [Medline: 31541534]",
    "FREE Full text",
    "[raw_reference] Booth A. Searching for qualitative research for inclusion in systematic reviews: a structured methodological review. Syst Rev 2016 May 04;5:74 [FREE Full text] [doi: 10.1186/s13643-016-0249-x] [Medline: 27145932]",
    "FREE Full text",
    "[raw_reference] Tricco AC, Lillie E, Zarin W, O'Brien KK, Colquhoun H, Levac D, et al. PRISMA extension for scoping reviews (PRISMA-ScR): checklist and explanation. Ann Intern Med 2018 Oct 02;169(7):467-473 [FREE Full text] [doi: 10.7326/M18-0850] [Medline: 30178033]",
    "[raw_reference] Peters MD, Godfrey C, McInerney P, Munn Z, Tricco AC, Khalil H. Scoping reviews. In: Aromataris E, Munn Z, editors. JBI Manual for Evidence Synthesis. Adelaide, Australia: JBI; 2020.",
    "FREE Full text",
    "[raw_reference] Haddaway NR, Collins AM, Coughlin D, Kirk S. The role of Google scholar in evidence reviews and its applicability to grey literature searching. PLoS One 2015 Sep 17;10(9):e0138237 [FREE Full text] [doi: 10.1371/journal.pone.0138237] [Medline: 26379270]",
    "FREE Full text",
    "[raw_reference] Cohen J. A coefficient of agreement for nominal scales. Educ Psychol Meas 1960 Apr;20(1):37-46 [FREE Full text]",
    "[raw_reference] Landis JR, Koch GG. The measurement of observer agreement for categorical data. Biometrics 1977 Mar;33(1):159-174 [Medline: 843571]",
    "[raw_reference] Better systematic review management. Covidence. URL: https://www.covidence.org/ [accessed 2023-03-14]",
    "FREE Full text",
    "[raw_reference] Braun V, Clarke V. Using thematic analysis in psychology. Qual Res Psychol 2006;3(2):77-101 [FREE Full text] [doi: 10.1007/s10597-020-00591-x]",
    "FREE Full text",
    "[raw_reference] Damschroder LJ, Reardon CM, Widerquist MA, Lowery J. The updated consolidated framework for implementation research based on user feedback. Implement Sci 2022 Oct 29;17(1):75 [FREE Full text] [doi: 10.1186/s13012-022-01245-0] [Medline: 36309746]",
    "FREE Full text",
    "[raw_reference] Wienert J, Zeeb H. Implementing health apps for digital public health -an implementation science approach adopting the consolidated framework for implementation research. Front Public Health 2021 May 07;9:610237 [FREE Full text] [doi: 10.3389/fpubh.2021.610237] [Medline: 34026702]",
    "FREE Full text",
    "[raw_reference] Donabedian A. Evaluating the quality of medical care. 1966. Milbank Q 2005;83(4):691-729 [FREE Full text] [doi: 10.1111/j.1468-0009.2005.00397.x] [Medline: 16279964]",
    "[raw_reference] Honeyman M, Maguire D, Evans H, Davies A. Digital Technology and Health Inequalities: A Scoping Review. Cardiff, Wales: Public Health Wales NHS Trust; 2020.",
    "[raw_reference] D\u00e1valos ME, French MT, Burdick AE, Simmons SC. Economic evaluation of telemedicine: review of the literature and research guidelines for benefit-cost analysis. Telemed J E Health 2009 Dec;15(10):933-948 [doi: 10.1089/tmj.2009.0067] [Medline: 19954346]",
    "FREE Full text",
    "[raw_reference] Gagnon MP, Ngangue P, Payne-Gagnon J, Desmartis M. m-Health adoption by healthcare professionals: a systematic review. J Am Med Inform Assoc 2016 Jan;23(1):212-220 [FREE Full text] [doi: 10.1093/jamia/ocv052] [Medline: 26078410]",
    "FREE Full text",
    "[raw_reference] van den Heuvel JF, Groenhof TK, Veerbeek JH, van Solinge WW, Lely AT, Franx A, et al. eHealth as the next-generation perinatal care: an overview of the literature. J Med Internet Res 2018 Jun 05;20(6):e202 [FREE Full text] [doi: 10.2196/jmir.9262] [Medline: 29871855]",
    "FREE Full text",
    "[raw_reference] Kolasa K, Kozinski G. How to value digital health interventions? A systematic literature review. Int J Environ Res Public Health 2020 Mar 23;17(6):2119 [FREE Full text] [doi: 10.3390/ijerph17062119] [Medline: 32209988]",
    "FREE Full text",
    "[raw_reference] Omboni S, Padwal RS, Alessa T, Bencz\u00far B, Green BB, Hubbard I, et al. The worldwide impact of telemedicine during COVID-19: current evidence and recommendations for the future. Connect Health 2022 Jan 04;1:7-35 [FREE Full text] [doi: 10.20517/ch.2021.03] [Medline: 35233563]",
    "FREE Full text",
    "[raw_reference] Yan K, Balijepalli C, Druyts E. The impact of digital therapeutics on current health technology assessment frameworks. Front Digit Health 2021 Jun 09;3:667016 [FREE Full text] [doi: 10.3389/fdgth.2021.667016] [Medline: 34713140]",
    "FREE Full text",
    "[raw_reference] Song Y, Bernard L, Jorgensen C, Dusfour G, Pers YM. The challenges of telemedicine in rheumatology. Front Med (Lausanne) 2021 Oct 13;8:746219 [FREE Full text] [doi: 10.3389/fmed.2021.746219] [Medline: 34722584]",
    "[raw_reference] Nilius G, Schroeder M, Schoebel C. Telehealth and its implementation in respiratory sleep medicine. Curr Opin Pulm Med 2021 Nov 01;27(6):523-528 [doi: 10.1097/MCP.0000000000000830] [Medline: 34494980]",
    "[raw_reference] Ambrosino N, Fracchia C. The role of tele-medicine in patients with respiratory diseases. Expert Rev Respir Med 2017 Nov;11(11):893-900 [doi: 10.1080/17476348.2017.1383898] [Medline: 28942692]",
    "FREE Full text",
    "[raw_reference] Zaman SB, Khan RK, Evans RG, Thrift AG, Maddison R, Islam SM. Exploring barriers to and enablers of the adoption of information and communication technology for the care of older adults with chronic diseases: scoping review. JMIR Aging 2022 Jan 07;5(1):e25251 [FREE Full text] [doi: 10.2196/25251] [Medline: 34994695]",
    "FREE Full text",
    "[raw_reference] Briggs LG, Labban M, Alkhatib K, Nguyen DD, Cole AP, Trinh QD. Digital technologies in cancer care: a review from the clinician's perspective. J Comp Eff Res 2022 May;11(7):533-544 [FREE Full text] [doi: 10.2217/cer-2021-0263] [Medline: 35416050]",
    "FREE Full text",
    "[raw_reference] Butz B, Kloep L, Kriegesmann B. User experience reevaluation and diffusion of technology in the context of compulsory usage illustrated by the example of telepsychotherapy-a literature review. Digit Health 2022 Nov 13;8:20552076221134448 [FREE Full text] [doi: 10.1177/20552076221134448] [Medline: 36386248]",
    "FREE Full text",
    "[raw_reference] Patel P, Dhindsa D, Eapen DJ, Khera A, Gulati M, Stone NJ, et al. Optimizing the potential for telehealth in cardiovascular care (in the era of COVID-19): time will tell. Am J Med 2021 Aug;134(8):945-951 [FREE Full text] [doi: 10.1016/j.amjmed.2021.03.007] [Medline: 33845033]",
    "FREE Full text",
    "[raw_reference] Kozik M, Isakadze N, Martin SS. Mobile health in preventive cardiology: current status and future perspective. Curr Opin Cardiol 2021 Sep 01;36(5):580-588 [FREE Full text] [doi: 10.1097/HCO.0000000000000891] [Medline: 34224437]",
    "[raw_reference] Kompala T, Neinstein AB. Telehealth in type 1 diabetes. Curr Opin Endocrinol Diabetes Obes 2021 Feb 01;28(1):21-29 [doi: 10.1097/MED.0000000000000600] [Medline: 33332927]",
    "FREE Full text",
    "[raw_reference] Almalki M, Giannicchi A. Health apps for combating COVID-19: descriptive review and taxonomy. JMIR Mhealth Uhealth 2021 Mar 02;9(3):e24322 [FREE Full text] [doi: 10.2196/24322] [Medline: 33626017]",
    "[raw_reference] Koumpouros Y, Georgoulas A. A systematic review of mHealth funded R and D activities in EU: trends, technologies and obstacles. Inform Health Soc Care 2020;45(2):168-187 [doi: 10.1080/17538157.2019.1656208] [Medline: 31743060]",
    "FREE Full text",
    "[raw_reference] Neubeck L, Hansen T, Jaarsma T, Klompstra L, Gallagher R. Delivering healthcare remotely to cardiovascular patients during COVID-19: a rapid review of the evidence. Eur J Cardiovasc Nurs 2020 Aug;19(6):486-494 [FREE Full text] [doi: 10.1177/1474515120924530] [Medline: 32380858]",
    "FREE Full text",
    "[raw_reference] Sauermann S, Herzberg J, Burkert S, Habetha S. DiGA -a chance for the German healthcare system. J Eur CME 2022 Dec 23;11(1):2014047 [FREE Full text] [doi: 10.1080/21614083.2021.2014047] [Medline: 34992948]",
    "FREE Full text",
    "[raw_reference] Parikh RB, Basen-Enquist KM, Bradley C, Estrin D, Levy M, Lichtenfeld JL, et al. Digital health applications in oncology: an opportunity to seize. J Natl Cancer Inst 2022 Oct 06;114(10):1338-1339 [FREE Full text] [doi: 10.1093/jnci/djac108] [Medline: 35640986]",
    "[raw_reference] Raney L, Bergman D, Torous J, Hasselberg M. Digitally driven integrated primary care and behavioral health: how technology can expand access to effective treatment. Curr Psychiatry Rep 2017 Sep 30;19(11):86 [doi: 10.1007/s11920-017-0838-y] [Medline: 28965319]",
    "FREE Full text",
    "[raw_reference] Meurk C, Leung J, Hall W, Head BW, Whiteford H. Establishing and governing e-Mental health care in Australia: a systematic review of challenges and a call for policy-focussed research. J Med Internet Res 2016 Jan 13;18(1):e10 [FREE Full text] [doi: 10.2196/jmir.4827] [Medline: 26764181]",
    "FREE Full text",
    "[raw_reference] Scott Kruse C, Karem P, Shifflett K, Vegi L, Ravi K, Brooks M. Evaluating barriers to adopting telemedicine worldwide: a systematic review. J Telemed Telecare 2018 Jan;24(1):4-12 [FREE Full text] [doi: 10.1177/1357633X16674087] [Medline: 29320966]",
    "FREE Full text",
    "[raw_reference] Goodspeed TA, Page RE, Koman LE, Hollenbeck AT, Gilroy AS. Legal and regulatory issues with teledermatology. Curr Derm Rep 2019 May 3;8(2):46-51 [FREE Full text] [doi: 10.1007/s13671-019-0254-0]",
    "FREE Full text",
    "[raw_reference] Boriani G, Vitolo M, Svennberg E, Casado-Arroyo R, Merino JL, Leclercq C. Performance-based risk-sharing arrangements for devices and procedures in cardiac electrophysiology: an innovative perspective. Europace 2022 Oct 13;24(10):1541-1547 [FREE Full text] [doi: 10.1093/europace/euac045] [Medline: 35531864]",
    "[raw_reference] Jennett PA, Scott RE, Affleck Hall L, Hailey D, Ohinmaa A, Anderson C, et al. Policy implications associated with the socioeconomic and health system impact of telehealth: a case study from Canada. Telemed J E Health 2004;10(1):77-83 [doi: 10.1089/153056204773644616] [Medline: 15104919]",
    "[raw_reference] Lop\u00e9z DM, Blobel B. mHealth in low-and middle-income countries: status, requirements and strategies. Stud Health Technol Inform 2015;211:79-87 [Medline: 25980851]",
    "[raw_reference] Weinstein RS, Lopez AM, Joseph BA, Erps KA, Holcomb M, Barker GP, et al. Telemedicine, telehealth, and mobile health applications that work: opportunities and barriers. Am J Med 2014 Mar;127(3):183-187 [doi: 10.1016/j.amjmed.2013.09.032] [Medline: 24384059]",
    "FREE Full text",
    "[raw_reference] Kario K, Harada N, Okura A. The first software as medical device of evidence-based hypertension digital therapeutics for clinical practice. Hypertens Res 2022 Dec;45(12):1899-1905 [FREE Full text] [doi: 10.1038/s41440-022-01016-w] [Medline: 36207530]",
    "[raw_reference] Hasselberg MJ. The digital revolution in behavioral health. J Am Psychiatr Nurses Assoc 2020 Jan;26(1):102-111 [doi: 10.1177/1078390319879750] [Medline: 31587624]",
    "FREE Full text",
    "[raw_reference] Alvarez RC. The promise of e-Health -a Canadian perspective. eHealth Int 2002 Sep 17;1(1):4 [FREE Full text] [doi: 10.1186/1476-3591-1-4] [Medline: 12459044]",
    "FREE Full text",
    "[raw_reference] Meessen B. The role of digital strategies in financing health care for universal health coverage in low-and middle-income countries. Glob Health Sci Pract 2018 Oct 10;6(Suppl 1):S29-S40 [FREE Full text] [doi: 10.9745/GHSP-D-18-00271] [Medline: 30305337]",
    "FREE Full text",
    "[raw_reference] Chua V, Koh JH, Koh CH, Tyagi S. The willingness to pay for telemedicine among patients with chronic diseases: systematic review. J Med Internet Res 2022 Apr 13;24(4):e33372 [FREE Full text] [doi: 10.2196/33372] [Medline: 35416779]",
    "FREE Full text",
    "[raw_reference] Leon N, Balakrishna Y, Hohlfeld A, Odendaal WA, Schmidt BM, Zweigenthal V, et al. Routine Health Information System (RHIS) improvements for strengthened health system management. Cochrane Database Syst Rev 2020 Aug 13;8(8):CD012012 [FREE Full text] [doi: 10.1002/14651858.CD012012.pub2] [Medline: 32803893]",
    "FREE Full text",
    "[raw_reference] Haverinen J, Ker\u00e4nen N, Falkenbach P, Maijala A, Kolehmainen T, Reponen J. Digi-HTA: health technology assessment framework for digital healthcare services. FinJeHeW 2019 Nov 02;11(4):326-341 [FREE Full text] [doi: 10.23996/fjhw.82538]",
    "[raw_reference] Nanda M, Sharma R. A review of patient satisfaction and experience with telemedicine: a virtual solution during and beyond COVID-19 pandemic. Telemed J E Health 2021 Dec;27(12):1325-1331 [doi: 10.1089/tmj.2020.0570] [Medline: 33719577]",
    "FREE Full text",
    "[raw_reference] Abbadessa G, Brigo F, Clerico M, De Mercanti S, Trojsi F, Tedeschi G, et al. Digital therapeutics in neurology. J Neurol 2022 Mar;269(3):1209-1224 [FREE Full text] [doi: 10.1007/s00415-021-10608-4] [Medline: 34018047]",
    "[raw_reference] Ali S, Kleib M, Paul P, Petrovskaya O, Kennedy M. Compassionate nursing care and the use of digital health technologies: a scoping review. Int J Nurs Stud 2022 Mar;127:104161 [doi: 10.1016/j.ijnurstu.2021.104161] [Medline: 35032743]",
    "FREE Full text",
    "[raw_reference] Chikwetu L, Miao Y, Woldetensae MK, Bell D, Goldenholz DM, Dunn J. Does deidentification of data from wearable devices give us a false sense of security? A systematic review. Lancet Digit Health 2023 Apr;5(4):e239-e247 [FREE Full text] [doi: 10.1016/S2589-7500(22)00234-5] [Medline: 36797124]",
    "FREE Full text",
    "[raw_reference] Barrios V, Cinza-Sanjurjo S, Garc\u00eda-Alegr\u00eda J, Freixa-Pamias R, Llordachs-Marques F, Molina CA, et al. Role of telemedicine in the management of oral anticoagulation in atrial fibrillation: a practical clinical approach. Future Cardiol 2022 Sep;18(9):743-754 [FREE Full text] [doi: 10.2217/fca-2022-0044] [Medline: 35822847]",
    "FREE Full text",
    "[raw_reference] Burg F, Pscherer A, Opitz OG. Digital communication in visceral medicine: regulatory framework for digital communication. Visc Med 2021 Oct 20;96(6):1-7 [FREE Full text] [doi: 10.1159/000519359] [Medline: 34934767]",
    "[raw_reference] Cheng L, Liu F, Mao X, Peng W, Wang Y, Huang H, et al. The pediatric cancer survivors' user experiences with digital health interventions: a systematic review of qualitative data. Cancer Nurs 2022 Jan;45(1):E68-E82 [doi: 10.1097/NCC.0000000000000885] [Medline: 34870939]",
    "FREE Full text",
    "[raw_reference] Chuang TY, Cheng W, Chiu YC, Fan YH, Chi CC, Chang CC, et al. Free interactive counselling program in a mobile communication application for improving health education on indwelling ureteric stents after ureterorenoscopic lithotripsy: an observational study. Digit Health 2022 Aug 04;8:20552076221117754 [FREE Full text] [doi: 10.1177/20552076221117754] [Medline: 35959198]",
    "[raw_reference] Edwards KJ, Maslin K, Andrade J, Jones RB, Shawe J. Mobile health as a primary mode of intervention for women at risk of or diagnosed with gestational diabetes mellitus: a scoping review. JBI Evid Synth 2022 Sep 01;20(9):2195-2243 [doi: 10.11124/JBIES-21-00294] [Medline: 35152244]",
    "FREE Full text",
    "[raw_reference] Feldman N, Back D, Boland R, Torous J. A systematic review of mHealth application interventions for peripartum mood disorders: trends and evidence in academia and industry. Arch Womens Ment Health 2021 Dec;24(6):881-892 [FREE Full text] [doi: 10.1007/s00737-021-01138-z] [Medline: 33929636]",
    "[raw_reference] Hilty DM, Serhal E, Crawford A. A telehealth and telepsychiatry economic cost analysis framework: scoping review. Telemed J E Health 2023 Jan;29(1):23-37 [doi: 10.1089/tmj.2022.0016] [Medline: 35639444]",
    "FREE Full text",
    "[raw_reference] Intan Sabrina M, Defi IR. Telemedicine guidelines in South East Asia-a scoping review. Front Neurol 2020 Jan 13;11:581649 [FREE Full text] [doi: 10.3389/fneur.2020.581649] [Medline: 33519669]",
    "FREE Full text",
    "[raw_reference] Jones C, Miguel-Cruz A, Smith-MacDonald L, Cruikshank E, Baghoori D, Kaur Chohan A, et al. Virtual trauma-focused therapy for military members, veterans, and public safety personnel with posttraumatic stress injury: systematic scoping review. JMIR Mhealth Uhealth 2020 Sep 21;8(9):e22079 [FREE Full text] [doi: 10.2196/22079] [Medline: 32955456]",
    "FREE Full text",
    "[raw_reference] Kvedarien\u0117 Burzdikait\u0117 P, \u010cesnavi\u010di\u016bt\u0117 I. mHealth and telemedicine utility in the monitoring of allergic diseases. Front Allergy 2022 Sep 02;3:919746 [FREE Full text] [doi: 10.3389/falgy.2022.919746] [Medline: 36118170]",
    "FREE Full text",
    "[raw_reference] Odendaal WA, Anstey Watkins J, Leon N, Goudge J, Griffiths F, Tomlinson M, et al. Health workers' perceptions and experiences of using mHealth technologies to deliver primary healthcare services: a qualitative evidence synthesis. Cochrane Database Syst Rev 2020 Mar 26;3(3):CD011942 [FREE Full text] [doi: 10.1002/14651858.CD011942.pub2] [Medline: 32216074]",
    "FREE Full text",
    "[raw_reference] Skeen SJ, Cain D, Gamarel KE, Hightow-Weidman L, Reback CJ. mHealth for transgender and gender-expansive youth: harnessing gender-affirmative cross-disciplinary innovations to advance HIV prevention and care interventions. Mhealth 2021 Apr 20;7:37 [FREE Full text] [doi: 10.21037/mhealth-20-60] [Medline: 33898606]",
    "[raw_reference] Tripepi M, Pizzocaro E, Giardino A, Frigerio I, Guglielmi A, Butturini G. Telemedicine and pancreatic cancer: a systematic review. Telemed J E Health 2023 Mar;29(3):352-360 [doi: 10.1089/tmj.2022.0140] [Medline: 35861761]",
    "FREE Full text",
    "[raw_reference] Wong CA, Madanay F, Ozer EM, Harris SK, Moore M, Master SO, et al. Digital health technology to enhance adolescent and young adult clinical preventive services: affordances and challenges. J Adolesc Health 2020 Aug;67(2S):S24-S33 [FREE Full text] [doi: 10.1016/j.jadohealth.2019.10.018] [Medline: 32718511]",
    "FREE Full text",
    "[raw_reference] Yang Y, Chen H, Qazi H, Morita PP. Intervention and evaluation of mobile health technologies in management of patients undergoing chronic dialysis: scoping review. JMIR Mhealth Uhealth 2020 Apr 03;8(4):e15549 [FREE Full text] [doi: 10.2196/15549] [Medline: 32242823]",
    "FREE Full text",
    "[raw_reference] Grogan J, Simmons Z. Telemedicine for the care of neuromuscular disorders. Curr Treat Options Neurol 2020 May 11;22(6):17 [FREE Full text] [doi: 10.1007/s11940-020-00625-5]",
    "[raw_reference] Mossialos E, Thomson S, Ter Linden A. Information technology law and health systems in the European Union. Int J Technol Assess Health Care 2004;20(4):498-508 [doi: 10.1017/s0266462304001424] [Medline: 15609802]",
    "FREE Full text",
    "[raw_reference] Sheikh A, Anderson M, Albala S, Casadei B, Franklin BD, Richards M, et al. Health information technology and digital innovation for national learning health and care systems. Lancet Digit Health 2021 Jun;3(6):e383-e396 [FREE Full text] [doi: 10.1016/S2589-7500(21)00005-4] [Medline: 33967002]",
    "[raw_reference] Oliver A, Mossialos E, Robinson R. Health technology assessment and its influence on health-care priority setting. Int J Technol Assess Health Care 2004;20(1):1-10 [doi: 10.1017/s026646230400073x] [Medline: 15176172]",
    "FREE Full text",
    "[raw_reference] Mehrotra A, Bhatia RS, Snoswell CL. Paying for telemedicine after the pandemic. JAMA 2021 Feb 02;325(5):431-432 [FREE Full text] [doi: 10.1001/jama.2020.25706] [Medline: 33528545] 100",
    "FREE Full text",
    "[raw_reference] van Kessel R, Hrzic R, O'Nuallain E, Weir E, Wong BL, Anderson M, et al. Digital health paradox: international policy perspectives to address increased health inequalities for people living with disabilities. J Med Internet Res 2022 Feb 22;24(2):e33819 [FREE Full text] [doi: 10.2196/33819] [Medline: 35191848] 101",
    "FREE Full text",
    "[raw_reference] van Kessel R, Wong BL, Clemens T, Brand H. Digital health literacy as a super determinant of health: more than simply the sum of its parts. Internet Interv 2022 Feb 07;27:100500 [FREE Full text] [doi: 10.1016/j.invent.2022.100500] [Medline: 35242586] 102",
    "[raw_reference] van Kessel R, Wong BL, Forman R, Gabrani J, Mossialos E. The European health data space fails to bridge digital divides. BMJ 2022 Jul 08;378:e071913 [doi: 10.1136/bmj-2022-071913] [Medline: 35803600] 103",
    "[raw_reference] Vallespin B, Cornet J, Kotzeva A. Ensuring evidence-based safe and effective mHealth applications. Stud Health Technol Inform 2016;222:248-261 [Medline: 27198107] 104",
    "FREE Full text",
    "[raw_reference] Asthana S, Jones R, Sheaff R. Why does the NHS struggle to adopt eHealth innovations? A review of macro, meso and micro factors. BMC Health Serv Res 2019 Dec 21;19(1):984 [FREE Full text] [doi: 10.1186/s12913-019-4790-x] [Medline: 31864370] 105",
    "FREE Full text",
    "[raw_reference] van Hattem NE, Silven AV, Bonten TN, Chavannes NH. COVID-19's impact on the future of digital health technology in primary care. Fam Pract 2021 Nov 24;38(6):845-847 [FREE Full text] [doi: 10.1093/fampra/cmab081] [Medline: 34268563] 106",
    "FREE Full text",
    "[raw_reference] Williams G, Fahy N, Aissat D, Lenormand M, St\u00fcwe L, Zablit-Schmidt I, et al. COVID-19 and the use of digital health tools: opportunity amid crisis that could transform health care delivery. Eurohealth 2022;28(1):29-34 [FREE Full text] 107",
    "FREE Full text",
    "[raw_reference] Podlewska AM, van Wamelen DJ. Parkinson's disease and COVID-19: the effect and use of telemedicine. Int Rev Neurobiol 2022;165:263-281 [FREE Full text] [doi: 10.1016/bs.irn.2022.04.002] [Medline: 36208904] 108",
    "FREE Full text",
    "[raw_reference] Gerke S, Stern AD, Minssen T. Germany's digital health reforms in the COVID-19 era: lessons and opportunities for other countries. NPJ Digit Med 2020 Jul 10;3:94 [FREE Full text] [doi: 10.1038/s41746-020-0306-7] [Medline: 32685700] 109",
    "FREE Full text",
    "[raw_reference] Stern AD, Br\u00f6nneke J, Debatin JF, Hagen J, Matthies H, Patel S, et al. Advancing digital health applications: priorities for innovation in real-world evidence generation. Lancet Digit Health 2022 Mar;4(3):e200-e206 [FREE Full text] [doi: 10.1016/S2589-7500(21)00292-2] [Medline: 35216754] 110",
    "FREE Full text",
    "[raw_reference] Genovese S, Bengoa R, Bowis J, Harney M, Hauck B, Pinget M, et al. The European health data space: a step towards digital and integrated care systems. J Integr Care 2022 Oct 12;30(4):363-372 [FREE Full text] [doi: 10.1108/jica-11-2021-0059] 111",
    "FREE Full text",
    "[raw_reference] Peek N, Sujan M, Scott P. Digital health and care in pandemic times: impact of COVID-19. BMJ Health Care Inform 2020 Jun;27(1):e100166 [FREE Full text] [doi: 10.1136/bmjhci-2020-100166] [Medline: 32565418] 112",
    "FREE Full text",
    "[raw_reference] Ruwaard J, Kok R. View of wild west eHealth: time to hold our horses? Eur Health Psychol 2015;17(1):45-49 [FREE Full text] 113",
    "[raw_reference] Aremu EO, Heffernan JL, Kvedar JC. The difference in practice expense costs between telehealth and in-office care could serve as the basis for differential reimbursement structures. Telemed J E Health 2022 Jun;28(6):912-916 [doi: 10.1089/tmj.2021.0229] [Medline: 34637679] 114",
    "[raw_reference] Bashshur RL, Doarn CR, Frenk JM, Kvedar JC, Shannon GW, Woolliscroft JO. Beyond the COVID pandemic, telemedicine, and health care. Telemed J E Health 2020 Nov;26(11):1310-1313 [doi: 10.1089/tmj.2020.0328] [Medline: 32809913] 115",
    "FREE Full text",
    "[raw_reference] Bediang G, Perrin C, Ruiz de Casta\u00f1eda R, Kamga Y, Sawadogo A, Bagayoko CO, et al. The RAFT telemedicine network: lessons learnt and perspectives from a decade of educational and clinical services in low-and middle-incomes countries. Front Public Health 2014 Oct 07;2:180 [FREE Full text] [doi: 10.3389/fpubh.2014.00180] [Medline: 25340048] 116",
    "[raw_reference] Brooks E, Turvey C, Augusterfer EF. Provider barriers to telemental health: obstacles overcome, obstacles remaining. Telemed J E Health 2013 Jun;19(6):433-437 [doi: 10.1089/tmj.2013.0068] [Medline: 23590176] 117",
    "FREE Full text",
    "[raw_reference] Cohen AB, Stump L, Krumholz HM, Cartiera M, Jain S, Scott Sussman L, et al. Aligning mission to digital health strategy in academic medical centers. NPJ Digit Med 2022 Jun 02;5(1):67 [FREE Full text] [doi: 10.1038/s41746-022-00608-7] [Medline: 35654885] 118",
    "FREE Full text",
    "[raw_reference] Smuck M, Odonkor CA, Wilt JK, Schmidt N, Swiernik MA. The emerging clinical role of wearables: factors for successful implementation in healthcare. NPJ Digit Med 2021 Mar 10;4(1):45 [FREE Full text] [doi: 10.1038/s41746-021-00418-3] [Medline: 33692479] 119",
    "[raw_reference] Haque SN. Telehealth beyond COVID-19. Psychiatr Serv 2021 Jan 01;72(1):100-103 [doi: 10.1176/appi.ps.202000368] [Medline: 32811284] 120",
    "FREE Full text",
    "[raw_reference] Tenderich A. Virtual nation: telemedicine's breakout moment. J Diabetes Sci Technol 2020 Jul;14(4):799-800 [FREE Full text] [doi: 10.1177/1932296820929359] [Medline: 32429751] 121",
    "FREE Full text",
    "[raw_reference] Alami H, Lehoux P, Auclair Y, de Guise M, Gagnon MP, Shaw J, et al. Artificial intelligence and health technology assessment: anticipating a new level of complexity. J Med Internet Res 2020 Jul 07;22(7):e17707 [FREE Full text] [doi: 10.2196/17707] [Medline: 32406850] 122",
    "[raw_reference] Stroetmann KA. Achieving the integrated and smart health and wellbeing paradigm: a call for policy research and action on governance and business models. Int J Med Inform 2013 Apr;82(4):e29-e37 [doi: 10.1016/j.ijmedinf.2012.05.008] [Medline: 22727880] 123",
    "[raw_reference] Flannery D, Jarrin R. Building a regulatory and payment framework flexible enough to withstand technological progress. Health Aff (Millwood) 2018 Dec;37(12):2052-2059 [doi: 10.1377/hlthaff.2018.05151] [Medline: 30633665] 124",
    "[raw_reference] Tracy J, Rheuban K, Waters RJ, DeVany M, Whitten P. Critical steps to scaling telehealth for national reform. Telemed J E Health 2008 Nov;14(9):990-994 [doi: 10.1089/tmj.2008.0125] [Medline: 19035814] 125",
    "[raw_reference] Fried BM, Weinreich G, Cavalier GM, Lester KJ. e-Health: technologic revolution meets regulatory constraint. Health Aff (Millwood) 2000 Nov;19(6):124-131 [doi: 10.1377/hlthaff.19.6.124] [Medline: 11192395] 126",
    "[raw_reference] Jenkins M, Levy J, Cohen E, Yoon S, Singer J, Mostashari F. Integration of self-management tools in personal and provider e-health records. Stud Health Technol Inform 2009;146:179-184 [Medline: 19592831] 127",
    "FREE Full text",
    "[raw_reference] Ben-Zeev D. Mobile health for all: public-private partnerships can create a new mental health landscape. JMIR Ment Health 2016 Jun 06;3(2):e26 [FREE Full text] [doi: 10.2196/mental.5843] [Medline: 27268283] 128",
    "FREE Full text",
    "[raw_reference] Woods L, Eden R, Canfell OJ, Nguyen KH, Comans T, Sullivan C. Show me the money: how do we justify spending health care dollars on digital health? Med J Aust 2023 Feb 06;218(2):53-57 [FREE Full text] [doi: 10.5694/mja2.51799] [Medline: 36502453] 129",
    "[raw_reference] Alverson DC, Edison K, Flournoy L, Korte B, Magruder C, Miller C. Telehealth tools for public health, emergency, or disaster preparedness and response: a summary report. Telemed J E Health 2010 Jan;16(1):112-114 [doi: 10.1089/tmj.2009.0149] [Medline: 20043703] 130",
    "[raw_reference] Speedie SM, Ferguson AS, Sanders J, Doarn CR. Telehealth: the promise of new care delivery models. Telemed J E Health 2008 Nov;14(9):964-967 [doi: 10.1089/tmj.2008.0114] [Medline: 19035808] 131",
    "[raw_reference] North F, Crane SJ, Takahashi PY, Ward WJ, Tulledge-Scheitel SM, Ytterberg K, et al. Telemedicine barriers associated with regional quality measures. Telemed J E Health 2014 Feb;20(2):179-181 [doi: 10.1089/tmj.2013.0167] [Medline: 24205836] 132",
    "[raw_reference] Myers KM, Lieberman D. Telemental health: responding to mandates for reform in primary healthcare. Telemed J E Health 2013 Jun;19(6):438-443 [doi: 10.1089/tmj.2013.0084] [Medline: 23611641] 133",
    "[raw_reference] Rajda J, Paz HL. The future of virtual care services: a payor's perspective. Telemed J E Health 2020 Mar;26(3):267-269 [doi: 10.1089/tmj.2019.0020] [Medline: 31058584] 134",
    "[raw_reference] Amorim P, Brito D, Castelo-Branco M, F\u00e0brega C, Gomes da Costa F, Martins H, et al. Telehealth opportunities in the COVID-19 pandemic early days: what happened, did not happen, should have happened, and must happen in the near future? Telemed J E Health 2021 Oct;27(10):1194-1199 [doi: 10.1089/tmj.2020.0386] [Medline: 33264071] 135",
    "FREE Full text",
    "[raw_reference] Bonnech\u00e8re B, Kossi O, Mapinduzi J, Panda J, Rintala A, Guidetti S, et al. Mobile health solutions: an opportunity for rehabilitation in low-and middle income countries? Front Public Health 2022 Jan 24;10:1072322 [FREE Full text] [doi: 10.3389/fpubh.2022.1072322] [Medline: 36761328] 136",
    "[raw_reference] Canfell OJ, Littlewood R, Burton-Jones A, Sullivan C. Digital health and precision prevention: shifting from disease-centred care to consumer-centred health. Aust Health Rev 2022 Jun;46(3):279-283 [doi: 10.1071/AH21063] [Medline: 34882538] 137",
    "[raw_reference] D'Anza B, Pronovost PJ. Digital health: unlocking value in a post-pandemic world. Popul Health Manag 2022 Feb;25(1):11-22 [doi: 10.1089/pop.2021.0031] [Medline: 34042532] 138",
    "FREE Full text",
    "[raw_reference] van Eijk RP, Beelen A, Kruitwagen ET, Murray D, Radakovic R, Hobson E, et al. A road map for remote digital health technology for motor neuron disease. J Med Internet Res 2021 Sep 22;23(9):e28766 [FREE Full text] [doi: 10.2196/28766] [Medline: 34550089] 139",
    "FREE Full text",
    "[raw_reference] Jagannath S, Mikhael J, Nadeem O, Raje N. Digital health for patients with multiple myeloma: an unmet need. JCO Clin Cancer Inform 2021 Oct;5:1096-1105 [FREE Full text] [doi: 10.1200/CCI.20.00145] [Medline: 34735265] 140",
    "FREE Full text",
    "[raw_reference] Patel S, Goldsack JC, Cordovano G, Downing A, Fields KK, Geoghegan C, et al. Advancing digital health innovation in Oncology: priorities for high-value digital transformation in cancer care. J Med Internet Res 2023 Jan 04;25:e43404 [FREE Full text] [doi: 10.2196/43404] [Medline: 36598811] 141",
    "FREE Full text",
    "[raw_reference] Strauss G, Flannery JE, Vierra E, Koepsell X, Berglund E, Miller I, et al. Meaningful engagement: a crossfunctional framework for digital therapeutics. Front Digit Health 2022 Aug 11;4:890081 [FREE Full text] [doi: 10.3389/fdgth.2022.890081] [Medline: 36052316] 142",
    "Scholars for Elevating Equity and Diversity",
    "[raw_reference] Willis HA, Gonzalez JC, Call CC, Quezada D, Scholars For Elevating Equity And Diversity Seed, Gal\u00e1n CA. Scholars for Elevating Equity and Diversity (SEED), Gal\u00e1n CA. Culturally responsive telepsychology and mHealth interventions for racial-ethnic minoritized youth: research gaps and future directions. J Clin Child Adolesc Psychol 2022 Nov;51(6):1053-1069 [doi: 10.1080/15374416.2022.2124516] [Medline: 36227174] 143",
    "[raw_reference] Zhang Y, Chandra S, Pe\u00f1a MT, Lal L, Summers RL, Swint JM. Framework for evaluating and developing sustainable telehealth programs. Telemed J E Health (Forthcoming) 2023 Jan 30 [doi: 10.1089/tmj.2022.0407] [Medline: 36716266] 144",
    "FREE Full text",
    "[raw_reference] Jayawardana S, Mossialos E. How should economic evaluation be used to measure value and set priorities in health care? AMA J Ethics 2021 Aug 01;23(8):E613-E618 [FREE Full text] [doi: 10.1001/amajethics.2021.613] [Medline: 34459728] 145",
    "FREE Full text",
    "[raw_reference] Della Vecchia C, Leroy T, Bauquier C, Pannard M, Sarradon-Eck A, Darmon D, et al. Willingness of French general practitioners to prescribe mHealth apps and devices: quantitative study. JMIR Mhealth Uhealth 2022 Feb 11;10(2):e28372 [FREE Full text] [doi: 10.2196/28372] [Medline: 35147508] 146",
    "FREE Full text",
    "[raw_reference] Muehlensiepen F, Knitza J, Marquardt W, Engler J, Hueber A, Welcker M. Acceptance of telerheumatology by rheumatologists and general practitioners in Germany: nationwide cross-sectional survey study. J Med Internet Res 2021 Mar 29;23(3):e23742 [FREE Full text] [doi: 10.2196/23742] [Medline: 33690147] 147",
    "FREE Full text",
    "[raw_reference] Treskes RW, Wildbergh TX, Schalij MJ, Scherptong RW. Expectations and perceived barriers to widespread implementation of eHealth in cardiology practice: results from a national survey in the Netherlands. Neth Heart J 2019 Jan;27(1):18-23 [FREE Full text] [doi: 10.1007/s12471-018-1199-9] [Medline: 30488379] 148",
    "[raw_reference] Antoniotti NM, Drude KP, Rowe N. Private payer telehealth reimbursement in the United States. Telemed J E Health 2014 Jun;20(6):539-543 [doi: 10.1089/tmj.2013.0256] [Medline: 24654748] 149",
    "FREE Full text",
    "[raw_reference] Avanesova AA, Shamliyan TA. Worldwide implementation of telemedicine programs in association with research performance and health policy. Health Policy Technol 2019 Jun;8(2):179-191 [FREE Full text] [doi: 10.1016/j.hlpt.2019.04.001] 150",
    "FREE Full text",
    "[raw_reference] Bos WH, van Tubergen A, Vonkeman HE. Telemedicine for patients with rheumatic and musculoskeletal diseases during the COVID-19 pandemic; a positive experience in the Netherlands. Rheumatol Int 2021 Mar;41(3):565-573 [FREE Full text] [doi: 10.1007/s00296-020-04771-6] [Medline: 33449162] 151",
    "FREE Full text",
    "[raw_reference] Brady CJ, D'Amico S, Withers N, Kim BY. Using public datasets to identify priority areas for ocular telehealth. Telemed J E Health 2021 Nov;27(11):1293-1298 [FREE Full text] [doi: 10.1089/tmj.2020.0433] [Medline: 33600257] 152",
    "FREE Full text",
    "[raw_reference] Yu Q, Zhu C, Feng S, Xu L, Hu S, Chen H, et al. Economic burden and health care access for patients with inflammatory bowel diseases in China: web-based survey study. J Med Internet Res 2021 Jan 05;23(1):e20629 [FREE Full text] [doi: 10.2196/20629] [Medline: 33399540] 153",
    "[raw_reference] Harju A, Neufeld J. The impact of the Medicaid expansion on telemental health utilization in four midwestern states. Telemed J E Health 2021 Nov;27(11):1260-1267 [doi: 10.1089/tmj.2020.0476] [Medline: 33428526] 154",
    "[raw_reference] Zhao M, Hamadi H, Haley DR, Xu J, White-Williams C, Park S. Telehealth: advances in alternative payment models. Telemed J E Health 2020 Dec;26(12):1492-1499 [doi: 10.1089/tmj.2019.0294] [Medline: 32101100] 155",
    "[raw_reference] Ranganathan C, Balaji S. Key factors affecting the adoption of telemedicine by ambulatory clinics: insights from a statewide survey. Telemed J E Health 2020 Feb;26(2):218-225 [doi: 10.1089/tmj.2018.0114] [Medline: 30874484] 156",
    "FREE Full text",
    "[raw_reference] Alishahi Tabriz A, Turner K, Williams Jr D, Babu N, North S, Shea CM. Association of financial factors and telemedicine adoption for heart attack and stroke care among rural and urban hospitals: a longitudinal study. Telemed J E Health 2022 Jun;28(6):781-788 [FREE Full text] [doi: 10.1089/tmj.2021.0341] [Medline: 34559014] 157",
    "FREE Full text",
    "[raw_reference] \u00c1gh T, Had\u017eiabdi\u0107 MO, Garuoliene K, Granas AG, Aarnio E, Menditto E, European Network to Advance Best Practices and Technology on Medication Adherence (ENABLE). Reimbursed medication adherence enhancing interventions in European countries: results of the EUREcA study. Front Pharmacol 2022 Jun 17;13:892240 [FREE Full text] [doi: 10.3389/fphar.2022.892240] [Medline: 35784711] 158",
    "[raw_reference] Smith AC, Armfield NR, Croll J, Gray LC. A review of Medicare expenditure in Australia for psychiatric consultations delivered in person and via videoconference. J Telemed Telecare 2012 Apr;18(3):169-171 [doi: 10.1258/jtt.2012.SFT111] [Medline: 22362827] 159",
    "FREE Full text",
    "[raw_reference] Philippi P, Baumeister H, Apolin\u00e1rio-Hagen J, Ebert DD, Hennemann S, Kott L, et al. Acceptance towards digital health interventions -model validation and further development of the unified theory of acceptance and use of technology. Internet Interv 2021 Sep 20;26:100459 [FREE Full text] [doi: 10.1016/j.invent.2021.100459] [Medline: 34603973] 160",
    "FREE Full text",
    "[raw_reference] Powers B, Bucher A. An economic impact model for estimating the value to health systems of a digital intervention for diabetes primary care: development and usefulness study. JMIR Form Res 2022 Sep 26;6(9):e37745 [FREE Full text] [doi: 10.2196/37745] [Medline: 36155985] 161",
    "FREE Full text",
    "[raw_reference] Borowiack E, Marzec M, Nowotarska A, Jarosz J, Orkisz A, Prz\u0105da-Machno P. Chance of reimbursement for ADD-ON therapies in Poland and in the world -review of the reimbursement recommendations. Przegl Epidemiol 2018;72(1):99-109 [FREE Full text] [Medline: 29667385] 162",
    "[raw_reference] Ganapathy K, Das S, Reddy S, Thaploo V, Nazneen A, Kosuru A, et al. Digital health care in public private partnership mode. Telemed J E Health 2021 Dec;27(12):1363-1371 [doi: 10.1089/tmj.2020.0499] [Medline: 33819433] 163",
    "FREE Full text",
    "[raw_reference] Lewis T, Synowiec C, Lagomarsino G, Schweitzer J. E-health in low-and middle-income countries: findings from the center for health market innovations. Bull World Health Organ 2012 May 01;90(5):332-340 [FREE Full text] [doi: 10.2471/BLT.11.099820] [Medline: 22589566] 164",
    "FREE Full text",
    "[raw_reference] Moro Visconti R, Morea D. Healthcare digitalization and pay-for-performance incentives in smart hospital project financing. Int J Environ Res Public Health 2020 Mar 30;17(7):2318 [FREE Full text] [doi: 10.3390/ijerph17072318] [Medline: 32235517] 165",
    "FREE Full text",
    "[raw_reference] Wu H, Deng Z, Wang B, Gupta S. How does service price influence patients' decisions? An examination of the free-market pricing mechanism in online health communities. Electron Mark 2021 Mar 12;31:877-893 [FREE Full text] [doi: 10.1007/s12525-020-00453-0] 166",
    "FREE Full text",
    "[raw_reference] Jamaladin H, van de Belt TH, Luijpers LC, de Graaff FR, Bredie SJ, Roeleveld N, et al. Mobile apps for blood pressure monitoring: systematic search in app stores and content analysis. JMIR Mhealth Uhealth 2018 Nov 14;6(11):e187 [FREE Full text] [doi: 10.2196/mhealth.9888] [Medline: 30429116] 167",
    "[raw_reference] Whitten P, Buis L. Private payer reimbursement for telemedicine services in the United States. Telemed J E Health 2007 Feb;13(1):15-23 [doi: 10.1089/tmj.2006.0028] [Medline: 17309350] 168",
    "[raw_reference] Wu H, Lu N. Service provision, pricing, and patient satisfaction in online health communities. Int J Med Inform 2018 Feb;110:77-89 [doi: 10.1016/j.ijmedinf.2017.11.009] [Medline: 29331257] 169",
    "[raw_reference] Neufeld JD, Doarn CR, Aly R. State policies influence Medicare telemedicine utilization. Telemed J E Health 2016 Jan;22(1):70-74 [doi: 10.1089/tmj.2015.0044] [Medline: 26218148] 170",
    "[raw_reference] Neufeld JD, Doarn CR. Telemedicine spending by Medicare: a snapshot from 2012. Telemed J E Health 2015 Aug;21(8):686-693 [doi: 10.1089/tmj.2014.0185] [Medline: 25839672] 171",
    "[raw_reference] Bynum AB, Irwin CA, Cranford CO, Denny GS. The impact of telemedicine on patients' cost savings: some preliminary findings. Telemed J E Health 2003;9(4):361-367 [doi: 10.1089/153056203772744680] [Medline: 14980093] 172",
    "FREE Full text",
    "[raw_reference] Rajan B, Sainathan A, Agnihothri S, Cui L. The promise of mHealth for chronic disease management under different payment systems. Manuf Serv Oper Manag 2022;24(6):3158-3176 [FREE Full text] [doi: 10.1287/msom.2022.1143] 173",
    "FREE Full text",
    "[raw_reference] Qin X, Hsieh CR. Understanding and addressing the treatment gap in mental healthcare: economic perspectives and evidence from China. Inquiry 2020 Jan;57:46958020950566 [FREE Full text] [doi: 10.1177/0046958020950566] [Medline: 32964754] 174",
    "FREE Full text",
    "[raw_reference] Nu\u00f1o-Solin\u00eds R, Urizar E, Merino M, Del Barrio J, Errea Rodr\u00edguez M. Validation study of a value-based digital health questionnaire. Int J Environ Res Public Health 2022 Jun 08;19(12):7034 [FREE Full text] [doi: 10.3390/ijerph19127034] [Medline: 35742288] 175",
    "FREE Full text",
    "[raw_reference] Ajayi KV, Wachira E, Onyeaka HK, Montour T, Olowolaju S, Garney W. The use of digital health tools for health promotion among women with and without chronic diseases: insights from the 2017-2020 health information national trends survey. JMIR Mhealth Uhealth 2022 Aug 19;10(8):e39520 [FREE Full text] [doi: 10.2196/39520] [Medline: 35984680] 176",
    "FREE Full text",
    "[raw_reference] B\u00e4rlund M, Takala L, Tianen L, Kellokumpu-Lehtinen PL. Real-world evidence of implementing eHealth enables fluent symptom-based follow-up of a growing number of patients with breast cancer with the same healthcare resources. Clin Breast Cancer 2022 Apr;22(3):261-268 [FREE Full text] [doi: 10.1016/j.clbc.2021.09.005] [Medline: 34657816] 177",
    "FREE Full text",
    "[raw_reference] Ector GI, Verweij L, Hermens RP, Blijlevens NM. Filling the gaps of patient information needs and information perception in chronic myeloid leukemia with the patient-physician co-produced web-based platform CMyLife. Patient Educ Couns 2022 Mar;105(3):686-694 [FREE Full text] [doi: 10.1016/j.pec.2021.06.025] [Medline: 34226069] 178",
    "FREE Full text",
    "[raw_reference] Khairat S, Wallace E, Bohlmann A, Zebrowski A, Stabile K, Yao Y, et al. Digital health experiences of incarcerated populations using telemedicine in North Carolina prisons. J Patient Exp 2022 Apr 19;9:23743735221092611 [FREE Full text] [doi: 10.1177/23743735221092611] [Medline: 35465408] 179",
    "[raw_reference] Liou H, Lane C, Huang C, Mookadam M, Joseph M, Hecker DuVal J. Eye movement desensitization and reprocessing in a primary care setting: assessing utility and comparing efficacy of virtual versus in-person methods. Telemed J E Health 2022 Sep;28(9):1359-1366 [doi: 10.1089/tmj.2021.0454] [Medline: 35133887] 180",
    "[raw_reference] Papavero S, Fracasso A, Ramaglia P, Cicchetti A, de Belvis AG, Ferrara FM. Telemedicine has a social impact: an Italian national study for the evaluation of the cost-opportunity for patients and caregivers and the measurement of carbon emission savings. Telemed J E Health (Forthcoming) 2023 Jan 13 [doi: 10.1089/tmj.2022.0333] [Medline: 36637858] 181",
    "FREE Full text",
    "[raw_reference] Rad\u00f3 N, Girasek E, B\u00e9k\u00e1si S, Gy\u0151rffy Z. Digital technology access and health-related internet use among people experiencing homelessness in Hungary: quantitative survey. J Med Internet Res 2022 Oct 19;24(10):e38729 [FREE Full text] [doi: 10.2196/38729] [Medline: 36260379] 182",
    "[raw_reference] Ratcliff CL, Krakow M, Greenberg-Worisek A, Hesse BW. Digital health engagement in the us population: insights from the 2018 health information national trends survey. Am J Public Health 2021 Jul;111(7):1348-1351 [doi: 10.2105/AJPH.2021.306282] [Medline: 34014759] 183",
    "[raw_reference] Rossano A, Crijns T, Ring D, Reichenberg J. Clinician preferences for current and planned future use of telemedicine. Telemed J E Health 2022 Sep;28(9):1293-1299 [doi: 10.1089/tmj.2021.0486] [Medline: 35007442] 184",
    "FREE Full text",
    "[raw_reference] Teferi GH, Tilahun BC, Guadie HA, Amare AT. Smartphone medical app use and associated factors among physicians at referral hospitals in Amhara region, North Ethiopia, in 2019: cross-sectional study. JMIR Mhealth Uhealth 2021 Mar 26;9(3):e19310 [FREE Full text] [doi: 10.2196/19310] [Medline: 33769303] 185",
    "[raw_reference] Tilahun BB, Thompson NR, Bautista JF, Sankary LR, Stanton S, Punia V. Telepsychology may improve treatment adherence in patients with psychogenic nonepileptic seizures. Telemed J E Health 2022 Aug;28(8):1159-1165 [doi: 10.1089/tmj.2021.0463] [Medline: 34962145] 186",
    "FREE Full text",
    "[raw_reference] Uncovska M, Freitag B, Meister S, Fehring L. Patient acceptance of prescribed and fully reimbursed mHealth apps in Germany: an UTAUT2-based online survey study. J Med Syst 2023 Jan 27;47(1):14 [FREE Full text] [doi: 10.1007/s10916-023-01910-x] [Medline: 36705853] 187",
    "[raw_reference] Bouvet R, Desmarais P, Minvielle E. Legal and organizational barriers to the development of eHealth in France. Med Law 2015 Sep;34(1):361-379 [Medline: 30759942] 188",
    "FREE Full text",
    "[raw_reference] Peeters JM, Krijgsman JW, Brabers AE, Jong JD, Friele RD. Use and uptake of eHealth in general practice: a cross-sectional survey and focus group study among health care users and general practitioners. JMIR Med Inform 2016 Apr 06;4(2):e11 [FREE Full text] [doi: 10.2196/medinform.4515] [Medline: 27052805] 189",
    "FREE Full text",
    "[raw_reference] Swinkels IC, Huygens MW, Schoenmakers TM, Oude Nijeweme-D'Hollosy W, van Velsen L, Vermeulen J, et al. Lessons learned from a living lab on the broad adoption of eHealth in primary health care. J Med Internet Res 2018 Mar 29;20(3):e83 [FREE Full text] [doi: 10.2196/jmir.9110] [Medline: 29599108] 190",
    "FREE Full text",
    "[raw_reference] Silven AV, Petrus AH, Villalobos-Quesada M, Dirikgil E, Oerlemans CR, Landstra CP, et al. Telemonitoring for patients with COVID-19: recommendations for design and implementation. J Med Internet Res 2020 Sep 02;22(9):e20953 [FREE Full text] [doi: 10.2196/20953] [Medline: 32833660] 191",
    "FREE Full text",
    "[raw_reference] Dritsakis G, Trenkova L, \u015aliwi\u0144ska-Kowalska M, Brdari\u0107 D, Pontoppidan NH, Katrakazas P, et al. Public health policy-making for hearing loss: stakeholders' evaluation of a novel eHealth tool. Health Res Policy Syst 2020 Oct 29;18(1):125 [FREE Full text] [doi: 10.1186/s12961-020-00637-2] [Medline: 33121491] 192",
    "[raw_reference] Brebner JA, Brebner EM, Ruddick-Bracken H. Experience-based guidelines for the implementation of telemedicine services. J Telemed Telecare 2005;11 Suppl 1:3-5 [doi: 10.1258/1357633054461778] [Medline: 16035975] 193",
    "FREE Full text",
    "[raw_reference] Freund J, Buntrock C, Braun L, Thielecke J, Baumeister H, Berking M, et al. Digital prevention of depression for farmers? A qualitative study on participants' experiences regarding determinants of acceptance and satisfaction with a tailored guided internet intervention program. Internet Interv 2022 Aug 09;29:100566 [FREE Full text] [doi: 10.1016/j.invent.2022.100566] [Medline: 36039069] 194",
    "FREE Full text",
    "[raw_reference] Yagiz JI, Goderis G. The impact of the COVID-19 pandemic on eHealth use in the daily practice and life of Dutch-speaking general practitioners in Belgium: qualitative study with semistructured interviews. JMIR Form Res 2022 Nov 28;6(11):e41847 [FREE Full text] [doi: 10.2196/41847] [Medline: 36399650] 195",
    "FREE Full text",
    "[raw_reference] Spanhel K, Schweizer JS, Wirsching D, Lehr D, Baumeister H, Bengel J, et al. Cultural adaptation of internet interventions for refugees: results from a user experience study in Germany. Internet Interv 2019 May 21;18:100252 [FREE Full text] [doi: 10.1016/j.invent.2019.100252] [Medline: 31890608] 196",
    "FREE Full text",
    "[raw_reference] Dahlhausen F, Zinner M, Bieske L, Ehlers JP, Boehme P, Fehring L. Physicians' attitudes toward prescribable mHealth apps and implications for adoption in Germany: mixed methods study. JMIR Mhealth Uhealth 2021 Nov 23;9(11):e33012 [FREE Full text] [doi: 10.2196/33012] [Medline: 34817385] 197",
    "FREE Full text",
    "[raw_reference] Dahlhausen F, Zinner M, Bieske L, Ehlers JP, Boehme P, Fehring L. There's an app for that, but nobody's using it: insights on improving patient access and adherence to digital therapeutics in Germany. Digit Health 2022 Jul 03;8:20552076221104672 [FREE Full text] [doi: 10.1177/20552076221104672] [Medline: 35811758] 198",
    "[raw_reference] Voogt MP, Opmeer BC, Kastelein AW, Jaspers M, Peute L. Obstacles to Successful Implementation of eHealth Applications into Clinical Practice. Stud Health Technol Inform 2018;247:521-525 [Medline: 29678015] 199",
    "[raw_reference] Cremers HP, Theunissen L, Hiddink J, Kemps H, Dekker L, van de Ven R, et al. Successful implementation of eHealth interventions in healthcare: development of an eHealth implementation guideline. Health Serv Manage Res 2021 Nov;34(4):269-278 [doi: 10.1177/0951484821994421] [Medline: 33590794] 200",
    "FREE Full text",
    "[raw_reference] Bally EL, Cesuroglu T. Toward integration of mHealth in primary care in the Netherlands: a qualitative analysis of stakeholder perspectives. Front Public Health 2020 Jan 15;7:407 [FREE Full text] [doi: 10.3389/fpubh.2019.00407] [Medline: 32010660] 201",
    "[raw_reference] Agbakoba R, McGee-Lennon M, Bouamrane MM, Watson N, Mair F. Implementing a national Scottish digital health and wellbeing service at scale: a qualitative study of stakeholders' views. Stud Health Technol Inform 2015;216:487-491 [Medline: 26262098] 202",
    "FREE Full text",
    "[raw_reference] Webers C, Beckers E, Boonen A, van Eijk-Hustings Y, Vonkeman H, van de Laar M, et al. Development, usability and acceptability of an integrated eHealth system for spondyloarthritis in the Netherlands (SpA-Net). RMD Open 2019 Apr 11;5(1):e000860 [FREE Full text] [doi: 10.1136/rmdopen-2018-000860] [Medline: 31168405] 203",
    "FREE Full text",
    "[raw_reference] Christie HL, Boots LM, Peetoom K, Tange HJ, Verhey FR, de Vugt ME. Developing a plan for the sustainable implementation of an electronic health intervention (partner in balance) to support caregivers of people with dementia: case study. JMIR Aging 2020 Jun 25;3(1):e18624 [FREE Full text] [doi: 10.2196/18624] [Medline: 32584261] 204",
    "FREE Full text",
    "[raw_reference] Bae YS, Kim KH, Choi SW, Ko T, Lim JS, Piao M. Satisfaction and usability of an information and communications technology-based system by clinically healthy patients with COVID-19 and medical professionals: cross-sectional survey and focus group interview study. JMIR Form Res 2021 Aug 26;5(8):e26227 [FREE Full text] [doi: 10.2196/26227] [Medline: 34254946] 205",
    "FREE Full text",
    "[raw_reference] Velayati F, Ayatollahi H, Hemmat M, Dehghan R. Key components and critical factors for developing a telehealth business framework: a qualitative study. BMC Med Inform Decis Mak 2021 Dec 04;21(1):339 [FREE Full text] [doi: 10.1186/s12911-021-01707-3] [Medline: 34863170] 206",
    "[raw_reference] Schoebel V, Wayment C, Gaiser M, Page C, Buche J, Beck AJ. Telebehavioral health during the COVID-19 pandemic: a qualitative analysis of provider experiences and perspectives. Telemed J E Health 2021 Aug;27(8):947-954 [doi: 10.1089/tmj.2021.0121] [Medline: 34028302] 207",
    "FREE Full text",
    "[raw_reference] Lin JC, Humphries MD, Shutze WP, Aalami OO, Fischer UM, Hodgson KJ. Telemedicine platforms and their use in the coronavirus disease-19 era to deliver comprehensive vascular care. J Vasc Surg 2021 Feb;73(2):392-398 [FREE Full text] [doi: 10.1016/j.jvs.2020.06.051] [Medline: 32622075] 208",
    "FREE Full text",
    "[raw_reference] Hermaszewska S, Sin J. End-user perspectives on the development of an online intervention for parents of children on the autism spectrum. Autism 2021 Jul;25(5):1234-1245 [FREE Full text] [doi: 10.1177/1362361320984895] [Medline: 33423522] 209",
    "[raw_reference] Faes L, Rosenblatt A, Schwartz R, Touhami S, Ventura CV, Chatziralli IP, International Retinal Collaborative. Overcoming barriers of retinal care delivery during a pandemic-attitudes and drivers for the implementation of digital health: a global expert survey. Br J Ophthalmol 2021 Dec;105(12):1738-1743 [doi: 10.1136/bjophthalmol-2020-316882] [Medline: 33067360] 210",
    "[raw_reference] Moshi MR, Tooher R, Merlin T. Development of a health technology assessment module for evaluating mobile medical applications. Int J Technol Assess Health Care 2020 Jun;36(3):252-261 [doi: 10.1017/S0266462320000288] [Medline: 32419676] 211",
    "[raw_reference] Thielscher C, Doarn CR. Long-term future of telemedicine in Germany: the patient's, physician's, and payer's perspective. Telemed J E Health 2008 Sep;14(7):701-706 [doi: 10.1089/tmj.2007.0104] [Medline: 18817500] 212",
    "FREE Full text",
    "[raw_reference] Powell AC, Bowman MB, Harbin HT. Reimbursement of apps for mental health: findings from interviews. JMIR Ment Health 2019 Aug 06;6(8):e14724 [FREE Full text] [doi: 10.2196/14724] [Medline: 31389336] 213",
    "[raw_reference] Belghiti J, Oget-Gendre C, Berthon AF, Fagon JY. Supporting innovation in health care: a short experience in a dedicated unit of the French ministry of public health. J Visc Surg 2021 Jun;158(3S):S6-11 [doi: 10.1016/j.jviscsurg.2021.01.009] [Medline: 33716003] 214",
    "FREE Full text",
    "[raw_reference] Al-Mondhiry J, D'Ambruoso S, Pietras C, Strouse T, Benzeevi D, Arevian AC, et al. Co-created mobile apps for palliative care using community-partnered participatory research: development and usability study. JMIR Form Res 2022 Jun 23;6(6):e33849 [FREE Full text] [doi: 10.2196/33849] [Medline: 35737441] 215",
    "FREE Full text",
    "[raw_reference] Eaves ER, Doerry E, Lanzetta SA, Kruithoff KM, Negron K, Dykman K, et al. Applying user-centered design in the development of a supportive mHealth app for women in substance use recovery. Am J Health Promot 2023 Jan;37(1):56-64 [FREE Full text] [doi: 10.1177/08901171221113834] [Medline: 35815770] 216",
    "FREE Full text",
    "[raw_reference] Lackie ME, Parrilla JS, Lavery BM, Kennedy AL, Ryan D, Shulman B, et al. Digital health needs of women with postpartum depression: focus group study. J Med Internet Res 2021 Jan 06;23(1):e18934 [FREE Full text] [doi: 10.2196/18934] [Medline: 33404506] 217",
    "FREE Full text",
    "[raw_reference] Meyer CL, Surmeli A, Hoeflin Hana C, Narla NP. Perceptions on a mobile health intervention to improve maternal child health for Syrian refugees in Turkey: opportunities and challenges for end-user acceptability. Front Public Health 2022 Nov 22;10:1025675 [FREE Full text] [doi: 10.3389/fpubh.2022.1025675] [Medline: 36483243] 218",
    "[raw_reference] Panda N, Sinyard R, Margo J, Henrich N, Cauley CE, Onnela JP, et al. Perceptions of mobile health technology in elective surgery: a qualitative study of north American surgeons. Ann Surg 2023 Mar 01;277(3):423-428 [doi: 10.1097/SLA.0000000000005208] [Medline: 34520422] 219",
    "[raw_reference] Shih P, Prokopovich K, Degeling C, Street J, Carter SM. Direct-to-consumer detection of atrial fibrillation in a smartwatch electrocardiogram: medical overuse, medicalisation and the experience of consumers. Soc Sci Med 2022 Jun;303:114954 [doi: 10.1016/j.socscimed.2022.114954] [Medline: 35569232] 220",
    "FREE Full text",
    "[raw_reference] Smits M, Nacar M, D S Ludden G, van Goor H. Stepwise design and evaluation of a values-oriented ambient intelligence healthcare monitoring platform. Value Health 2022 Jun;25(6):914-923 [FREE Full text] [doi: 10.1016/j.jval.2021.11.1372] [Medline: 35525831] 221",
    "FREE Full text",
    "[raw_reference] Van Grootven B, Irusta LA, Christiaens W, Mistiaen P, De Meester C, Cornelis J, et al. Experiences with the implementation of remote monitoring in patients with COVID-19: a qualitative study with patients and healthcare professionals. J Nurs Scholarsh 2023 Jan;55(1):67-78 [FREE Full text] [doi: 10.1111/jnu.12814] [Medline: 36165577] 222",
    "[raw_reference] van Velthoven MH, Cordon C, Challagalla G. Digitization of healthcare organizations: the digital health landscape and information theory. Int J Med Inform 2019 Apr;124:49-57 [doi: 10.1016/j.ijmedinf.2019.01.007] [Medline: 30784426] 223",
    "From innovation to implementation: eHealth in the WHO European region",
    "FREE Full text",
    "[raw_reference] Schliess F, Affini Dicenzo T, Gaus N, Bourez JM, Stegbauer C, Szecsenyi J, et al. The German fast track toward reimbursement of Digital Health Applications (DiGA): opportunities and challenges for manufacturers, healthcare providers, and people with diabetes. J Diabetes Sci Technol (Forthcoming) 2022 Sep 03:19322968221121660 [FREE Full text] [doi: 10.1177/19322968221121660] [Medline: 36059268] 227",
    "FREE Full text",
    "[raw_reference] Lluch M. Incentives for telehealthcare deployment that support integrated care: a comparative analysis across eight European countries. Int J Integr Care 2013 Nov 04;13:e042 [FREE Full text] [doi: 10.5334/ijic.1062] [Medline: 24250282] 228",
    "FREE Full text",
    "[raw_reference] Holterman S, Hettinga M, Buskens E, Lahr M. Factors influencing procurement of digital healthcare: a case study in Dutch district nursing. Int J Health Policy Manag 2021 Aug 29;11(9):1883-1893 [FREE Full text] [doi: 10.34172/ijhpm.2021.115] [Medline: 34634888] 229",
    "FREE Full text",
    "[raw_reference] Gensorowsky D, Witte J, Batram M, Greiner W. Market access and value-based pricing of digital health applications in Germany. Cost Eff Resour Alloc 2022 Jun 13;20(1):25 [FREE Full text] [doi: 10.1186/s12962-022-00359-y] [Medline: 35698135] 230",
    "FREE Full text",
    "[raw_reference] Christie HL, Boots LM, Hermans I, Govers M, Tange HJ, Verhey FR, et al. Business models of eHealth interventions to support informal caregivers of people with dementia in the Netherlands: analysis of case studies. JMIR Aging 2021 Jun 03;4(2):e24724 [FREE Full text] [doi: 10.2196/24724] [Medline: 34081009] 231",
    "[raw_reference] Ahlqvist J, Kalliola M. How can digital therapeutics help Europe? Sitra. 2021. URL: https://www.sitra.fi/app/uploads/2021/ 11/sitra-how-can-digital-therapeutics-help-europe.pdf [accessed 2022-12-30] 232",
    "FREE Full text",
    "[raw_reference] Powell AC, Torous JB, Firth J, Kaufman KR. Generating value with mental health apps. BJPsych Open 2020 Feb 05;6(2):e16 [FREE Full text] [doi: 10.1192/bjo.2019.98] [Medline: 32019619] 233",
    "FREE Full text",
    "[raw_reference] Reid HW, Proeschold-Bell RJ, Makarushka C, Melgar Vega KD, Huchko M, Jeronimo J, et al. Using the consolidated framework for implementation research to inform the design of the mobile Inspecci\u00f3n Visual con \u00c1cido Ac\u00e9tico system: mixed methods case study. JMIR Form Res 2022 Jun 23;6(6):e32577 [FREE Full text] [doi: 10.2196/32577] [Medline: 35737455] 234",
    "FREE Full text",
    "[raw_reference] Bush J, Barlow DE, Echols J, Wilkerson J, Bellevin K. Impact of a mobile health application on user engagement and pregnancy outcomes among Wyoming Medicaid members. Telemed J E Health 2017 Nov;23(11):891-898 [FREE Full text] [doi: 10.1089/tmj.2016.0242] [Medline: 28481167] 235",
    "FREE Full text",
    "[raw_reference] Drake C, Lian T, Cameron B, Medynskaya K, Bosworth HB, Shah K. Understanding telemedicine's \"new normal\": variations in telemedicine use by specialty line and patient demographics. Telemed J E Health 2022 Jan;28(1):51-59 [FREE Full text] [doi: 10.1089/tmj.2021.0041] [Medline: 33769092] 236",
    "FREE Full text",
    "[raw_reference] Tzeng YH, Yin WH, Lin KC, Wei J, Liou HR, Sung HJ, et al. Factors associated with the utilization of outpatient virtual clinics: retrospective observational study using multilevel analysis. J Med Internet Res 2022 Aug 12;24(8):e40288 [FREE Full text] [doi: 10.2196/40288] [Medline: 35917486] 237",
    "[raw_reference] Dansky KH, Palmer L, Shea D, Bowles KH. Cost analysis of telehomecare. Telemed J E Health 2001;7(3):225-232 [doi: 10.1089/153056201316970920] [Medline: 11564358] 238",
    "[raw_reference] Armstrong AW, Dorer DJ, Lugn NE, Kvedar JC. Economic evaluation of interactive teledermatology compared with conventional care. Telemed J E Health 2007 Apr;13(2):91-99 [doi: 10.1089/tmj.2006.0035] [Medline: 17489695] 239",
    "FREE Full text",
    "[raw_reference] Das S, Wang J, Chen SY, Chen CE. Telemental health collaborative care medication management: implementation and outcomes. Telemed J E Health 2022 Jul;28(7):1035-1043 [FREE Full text] [doi: 10.1089/tmj.2021.0401] [Medline: 34939839] 240",
    "FREE Full text",
    "[raw_reference] Owusu JT, Wang P, Wickham RE, Varra AA, Chen C, Lungu A. Real-world evaluation of a large-scale blended care-cognitive behavioral therapy program for symptoms of anxiety and depression. Telemed J E Health 2022 Oct;28(10):1412-1420 [FREE Full text] [doi: 10.1089/tmj.2021.0590] [Medline: 35263185] 241",
    "FREE Full text",
    "[raw_reference] Ritterband LM, Thorndike FP, Morin CM, Gerwien R, Enman NM, Xiong R, et al. Real-world evidence from users of a behavioral digital therapeutic for chronic insomnia. Behav Res Ther 2022 Jun;153:104084 [FREE Full text] [doi: 10.1016/j.brat.2022.104084] [Medline: 35405424] 242",
    "FREE Full text",
    "[raw_reference] Scheer J, Areias AC, Molinos M, Janela D, Moulder R, Lains J, et al. Engagement and utilization of a complete remote digital care program for musculoskeletal pain management in urban and rural areas across the United States: longitudinal cohort study. JMIR Mhealth Uhealth 2023 Mar 16;11:e44316 [FREE Full text] [doi: 10.2196/44316] [Medline: 36735933] 243",
    "FREE Full text",
    "[raw_reference] Tan LF, Chan YH, Tay A, Jayasundram J, Low NA, Merchant RA. Practicality and reliability of self vs administered rapid geriatric assessment mobile app. J Nutr Health Aging 2021;25(9):1064-1069 [FREE Full text] [doi: 10.1007/s12603-021-1672-9] [Medline: 34725662] 244",
    "[raw_reference] Tumeh IB, Bergerot CD, Lee D, Philip EJ, Freitas-J\u00fanior R. mHealth program for patients with advanced cancer receiving treatment in a public health hospital in Brazil. Psychooncology 2023 Jan;32(1):125-132 [doi: 10.1002/pon.6059] [Medline: 36284459] 245",
    "FREE Full text",
    "[raw_reference] Melchiorre MG, Papa R, Quattrini S, Lamura G, Barbabella F, on behalf of ICARE4EU Consortium. Integrated care programs for people with multimorbidity in European countries: eHealth adoption in health systems. Biomed Res Int 2020 Apr 08;2020:9025326 [FREE Full text] [doi: 10.1155/2020/9025326] [Medline: 32337283] 246",
    "FREE Full text",
    "[raw_reference] Voncken-Brewster V, Tange H, Moser A, Nagykaldi Z, de Vries H, van der Weijden T. Integrating a tailored e-health self-management application for chronic obstructive pulmonary disease patients into primary care: a pilot study. BMC Fam Pract 2014 Jan 08;15:4 [FREE Full text] [doi: 10.1186/1471-2296-15-4] [Medline: 24400676] 247",
    "[raw_reference] Balchander D, Cabrera CI, Zack B, Porter S, Sunshine J, D'Anza B. Assessing telehealth through the lens of the provider: considerations for the post-COVID-19 era. Telemed J E Health 2022 Dec;28(12):1806-1816 [doi: 10.1089/tmj.2021.0508] [Medline: 35426745] 248",
    "FREE Full text",
    "[raw_reference] Romm KL, Nilsen L, Gjermundsen K, Holter M, Fjell A, Melle I, et al. Remote care for caregivers of people with psychosis: mixed methods pilot study. JMIR Ment Health 2020 Jul 28;7(7):e19497 [FREE Full text] [doi: 10.2196/19497] [Medline: 32720905] 249",
    "FREE Full text",
    "[raw_reference] Chukwu E, Garg L, Eze G. Mobile health insurance system and associated costs: a cross-sectional survey of primary health centers in Abuja, Nigeria. JMIR Mhealth Uhealth 2016 May 17;4(2):e37 [FREE Full text] [doi: 10.2196/mhealth.4342] [Medline: 27189312] 250",
    "FREE Full text",
    "[raw_reference] Ayyoubzadeh SM, Shirkhoda M, R Niakan Kalhori S, Mohammadzadeh N, Zakerabasali S. A smartphone remote monitoring app to follow up colorectal cancer survivors: requirement analysis. JMIR Cancer 2022 Jan 05;8(1):e18083 [FREE Full text] [doi: 10.2196/18083] [Medline: 34989685] 251",
    "FREE Full text",
    "[raw_reference] Becker ER, Shegog R, Savas LS, Frost EL, Coan SP, Healy CM, et al. Parents' experience with a mobile health intervention to influence human papillomavirus vaccination decision making: mixed methods study. JMIR Pediatr Parent 2022 Feb 21;5(1):e30340 [FREE Full text] [doi: 10.2196/30340] [Medline: 35188469] 252",
    "FREE Full text",
    "[raw_reference] LoBuono DL, Shea KS, Tovar A, Leedahl SN, Mahler L, Xu F, et al. Acceptance and perception of digital health for managing nutrition in people with Parkinson's disease and their caregivers and their digital competence in the United States: a mixed-methods study. Health Sci Rep 2021 Nov 11;4(4):e412 [FREE Full text] [doi: 10.1002/hsr2.412] [Medline: 34796282] 253",
    "FREE Full text",
    "[raw_reference] Saha S, Quazi ZS. Does digitally enabling frontline health workers improve coverage and quality of maternal and child health services? Findings from a mixed methods evaluation of TECHO+ in Gujarat. Front Public Health 2022 Jul 22;10:856561 [FREE Full text] [doi: 10.3389/fpubh.2022.856561] [Medline: 35958841] 254",
    "FREE Full text",
    "[raw_reference] Lewkowicz D, Wohlbrandt AM, Bottinger E. Digital therapeutic care apps with decision-support interventions for people with low back pain in Germany: cost-effectiveness analysis. JMIR Mhealth Uhealth 2022 Feb 07;10(2):e35042 [FREE Full text] [doi: 10.2196/35042] [Medline: 35129454] 255",
    "[raw_reference] Aardoom JJ, Dingemans AE, van Ginkel JR, Spinhoven P, Van Furth EF, Van den Akker-van Marle ME. Cost-utility of an internet-based intervention with or without therapist support in comparison with a waiting list for individuals with eating disorder symptoms: a randomized controlled trial. Int J Eat Disord 2016 Dec;49(12):1068-1076 [doi: 10.1002/eat.22587] [Medline: 27441418] 256",
    "[raw_reference] Ambrens M, van Schooten KS, Lung T, Clemson L, Close JC, Howard K, et al. Economic evaluation of the e-Health StandingTall balance exercise programme for fall prevention in people aged 70 years and over. Age Ageing 2022 Jun 01;51(6):afac130 [doi: 10.1093/ageing/afac130] [Medline: 35679193] 257",
    "FREE Full text",
    "[raw_reference] Li J, Sun L, Hou Y, Chen L. Cost-effectiveness analysis of a mobile-based intervention for patients with type 2 diabetes mellitus. Int J Endocrinol 2021 Jul 01;2021:8827629 [FREE Full text] [doi: 10.1155/2021/8827629] [Medline: 34306072] 258",
    "FREE Full text",
    "[raw_reference] Luo X, Xu W, Ming WK, Jiang X, Yuan Q, Lai H, et al. Cost-effectiveness of mobile health-based integrated care for atrial fibrillation: model development and data analysis. J Med Internet Res 2022 Apr 19;24(4):e29408 [FREE Full text] [doi: 10.2196/29408] [Medline: 35438646] 259",
    "FREE Full text",
    "[raw_reference] McManus RJ, Little P, Stuart B, Morton K, Raftery J, Kelly J, HOME BP investigators. Home and Online Management and Evaluation of Blood Pressure (HOME BP) using a digital intervention in poorly controlled hypertension: randomised controlled trial. BMJ 2021 Jan 19;372:m4858 [FREE Full text] [doi: 10.1136/bmj.m4858] [Medline: 33468518] 260",
    "[raw_reference] Allen AR, Smith J, Hobbs MJ, Loughnan SA, Sharrock M, Newby JM, et al. Internet-delivered cognitive behaviour therapy for post-traumatic stress disorder: a randomised controlled trial and outcomes in routine care. Behav Cogn Psychother 2022 Nov;50(6):649-655 [doi: 10.1017/S1352465822000285] [Medline: 35924312] 261",
    "FREE Full text",
    "[raw_reference] Loohuis AM, Van Der Worp H, Wessels NJ, Dekker JH, Slieker-Ten Hove MC, Berger MY, et al. Cost-effectiveness of an app-based treatment for urinary incontinence in comparison with care-as-usual in Dutch general practice: a pragmatic randomised controlled trial over 12 months. BJOG 2022 Aug;129(9):1538-1545 [FREE Full text] [doi: 10.1111/1471-0528.17191] [Medline: 35460163] 262",
    "FREE Full text",
    "[raw_reference] Powell J, Williams V, Atherton H, Bennett K, Yang Y, Davoudianfar M, et al. Effectiveness and cost-effectiveness of a self-guided internet intervention for social anxiety symptoms in a general population sample: randomized controlled trial. J Med Internet Res 2020 Jan 10;22(1):e16804 [FREE Full text] [doi: 10.2196/16804] [Medline: 31821151] 263",
    "FREE Full text Open API architecture policy",
    "[raw_reference] The Fast-Track process for digital health applications (DiGA) according to section 139e SGB V. Federal Institute for Drugs and Medical Devices. 2022. URL: https://www.bfarm.de/SharedDocs/Downloads/EN/MedicalDevices/DiGA_Guide. pdf?__blob=publicationFile&v=2 [accessed 2022-10-15] 267",
    "[raw_reference] Cowey A. Establishing the NHS digital academy: future vision and implementation areas for expansion. National Health Service Health Education, England. 2021. URL: https://digital-transformation.hee.nhs.uk/binaries/content/assets/ digital-transformation/nhs-digital-academy/digital-academy-future-vision-report---mar-2021.pdf [accessed 2023-01-15] 268",
    "[raw_reference] Bradford WD, Kleit A, Krousel-Wood MA, Re RM. Comparing willingness to pay for telemedicine across a chronic heart failure and hypertension population. Telemed J E Health 2005 Aug;11(4):430-438 [doi: 10.1089/tmj.2005.11.430] [Medline: 16149888] 269",
    "[raw_reference] Chang J, Savage SJ, Waldman DM. Estimating willingness to pay for online health services with discrete-choice experiments. Appl Health Econ Health Policy 2017 Aug;15(4):491-500 [doi: 10.1007/s40258-017-0316-z] [Medline: 28290107] 270",
    "FREE Full text NHS apps library",
    "[raw_reference] Aanestad M, Grisot M, Hanseth O, Vassilakopoulou P. Strategies for building eHealth infrastructures. In: Information Infrastructures within European Health Care: Working with the Installed Base. Cham, Switzerland: Springer; 2017. 274",
    "FREE Full text",
    "[raw_reference] Ramirez M, Duran MC, Pabiniak CJ, Hansen KE, Kelley A, Ralston JD, et al. Family caregiver needs and preferences for virtual training to manage behavioral and psychological symptoms of dementia: interview study. JMIR Aging 2021 Feb 10;4(1):e24965 [FREE Full text] [doi: 10.2196/24965] [Medline: 33565984] 275",
    "FREE Full text Telerehabilitation for chronic respiratory disease JAMA digital health deal count by country worldwide HY1 2020. Statista. 2022",
    "[raw_reference] Tikkanen R, Osborn R, Mossialos E, Djordjevic A, Wharton G. International profiles of health care systems. The Commonwealth Fund. 2020. URL: https://www.commonwealthfund.org/sites/default/files/2020-12/ International_Profiles_of_Health_Care_Systems_Dec2020.pdf [accessed 2022-11-26] 279",
    "8th edition",
    "[raw_reference] Folland S, Goodman A, Stano M. The economics of health and health care. 8th edition. London, United Kingdom: Routledge, Taylor & Francis Group; 2017. 280",
    "FREE Full text Wegwijzer bekostiging digitale zorg 2023",
    "[raw_reference] Anderson M, Pitchforth E, Asaria M, Brayne C, Casadei B, Charlesworth A, et al. LSE-Lancet Commission on the future of the NHS: re-laying the foundations for an equitable and efficient health and care service after COVID-19. Lancet 2021 May 22;397(10288):1915-1978 [FREE Full text] [doi: 10.1016/S0140-6736(21)00232-4] [Medline: 33965070] 281. Wegwijzer bekostiging digitale zorg 2023. Dutch Healthcare Authority. 2022. URL: https://puc.overheid.nl/nza/doc/ PUC_655318_22/1/ [accessed 2022-11-11]"
  ],
  "editors": [
    "E Aromataris",
    "Z Munn"
  ],
  "processing_software": {
    "GROBID": "0.8.2"
  }
}
