{
  "paper_id": "FWHQ3MES",
  "title": "Benefits and Harms of Digital Health Interventions Promoting Physical Activity in People With Chronic Conditions: Systematic Review and Meta-Analysis",
  "abstract": "Background: Digital health interventions for managing chronic conditions have great potential. However, the benefits and harms are still unclear. Objective: This systematic review and meta-analysis aimed to investigate the benefits and harms of digital health interventions in promoting physical activity in people with chronic conditions. \n Methods: We searched the MEDLINE, Embase, CINAHL, and Cochrane Central Register of Controlled Trials databases from inception to October 2022. Eligible randomized controlled trials were included if they used a digital component in physical activity promotion in adults with \u22651 of the following conditions: depression or anxiety, ischemic heart disease or heart failure, chronic obstructive pulmonary disease, knee or hip osteoarthritis, hypertension, or type 2 diabetes. The primary outcomes were objectively measured physical activity and physical function (eg, walk or step tests). We used a random effects model (restricted maximum likelihood) for meta-analyses and meta-regression analyses to assess the impact of study-level covariates. The risk of bias was assessed using the Cochrane Risk of Bias 2 tool, and the certainty of the evidence was assessed using the Grading of Recommendations Assessment, Development, and Evaluation. Results: Of 14,078 hits, 130 randomized controlled trials were included. Compared with usual care or minimal intervention, digital health interventions increased objectively measured physical activity (end of intervention: standardized mean difference [SMD] 0.29, 95% CI 0.21-0.37; follow-up: SMD 0.17, 95% CI 0.04-0.31) and physical function (end of intervention: SMD 0.36, 95% CI 0.12-0.59; follow-up: SMD 0.29, 95% CI 0.01-0.57). The secondary outcomes also favored the digital health interventions for subjectively measured physical activity and physical function, depression, anxiety, and health-related quality of life at the end of the intervention but only subjectively measured physical activity at follow-up. The risk of nonserious adverse events, but",
  "year": 2019,
  "date": "2019",
  "authors": [
    {
      "name": "Graziella Zangger",
      "email": "gzangger@health.sdu.dk",
      "affiliation": {
        "organization": "Department of Physiotherapy and Occupational Therapy",
        "department": "Department of Physiotherapy and Occupational Therapy",
        "institution": "Naestved-Slagelse-Ringsted Hospital",
        "address": "Slagelse, Denmark"
      }
    },
    {
      "name": "Alessio Bricca",
      "affiliation": {
        "organization": "Department of Physiotherapy and Occupational Therapy",
        "department": "Department of Physiotherapy and Occupational Therapy",
        "institution": "Naestved-Slagelse-Ringsted Hospital",
        "address": "Slagelse, Denmark"
      }
    },
    {
      "affiliation": {
        "organization": "Department of Sports Science and Clinical Biomechanics",
        "department": "Department of Sports Science and Clinical Biomechanics",
        "institution": "University of Southern Denmark",
        "address": "Odense, Denmark"
      }
    },
    {
      "name": "; Carsten"
    },
    {
      "name": "B Juhl",
      "affiliation": {
        "organization": "Department of Sports Science and Clinical Biomechanics",
        "department": "Department of Sports Science and Clinical Biomechanics",
        "institution": "University of Southern Denmark",
        "address": "Odense, Denmark"
      }
    },
    {
      "name": "Sofie Rath Mortensen"
    },
    {
      "name": "Rune Martens Andersen",
      "affiliation": {
        "organization": "Department of Physiotherapy and Occupational Therapy",
        "department": "Department of Physiotherapy and Occupational Therapy",
        "institution": "Naestved-Slagelse-Ringsted Hospital",
        "address": "Slagelse, Denmark"
      }
    },
    {
      "name": "Camma Damsted",
      "affiliation": {
        "organization": "Department of Physiotherapy and Occupational Therapy",
        "department": "Department of Physiotherapy and Occupational Therapy",
        "institution": "Naestved-Slagelse-Ringsted Hospital",
        "address": "Slagelse, Denmark"
      }
    },
    {
      "name": "Gr\u00f8nbek Hamborg",
      "affiliation": {
        "organization": "Department of Physiotherapy and Occupational Therapy",
        "department": "Department of Physiotherapy and Occupational Therapy",
        "institution": "Naestved-Slagelse-Ringsted Hospital",
        "address": "Slagelse, Denmark"
      }
    },
    {
      "name": "Mathias Ried-Larsen",
      "affiliation": {
        "organization": "Department of Physiotherapy and Occupational Therapy",
        "department": "Department of Physiotherapy and Occupational Therapy",
        "institution": "Naestved-Slagelse-Ringsted Hospital",
        "address": "Slagelse, Denmark"
      }
    },
    {
      "name": "Lars Tang",
      "affiliation": {
        "organization": "Department of Physiotherapy and Occupational Therapy",
        "department": "Department of Physiotherapy and Occupational Therapy",
        "institution": "Naestved-Slagelse-Ringsted Hospital",
        "address": "Slagelse, Denmark"
      }
    },
    {
      "name": "; Lau"
    },
    {
      "name": "Caspar Thygesen",
      "affiliation": {
        "organization": "Department of Physiotherapy and Occupational Therapy",
        "department": "Department of Physiotherapy and Occupational Therapy",
        "institution": "National Institute of Public Health",
        "address": "Copenhagen, Denmark"
      }
    },
    {
      "name": "S\u00f8ren Skou",
      "affiliation": {
        "organization": "Department of Physiotherapy and Occupational Therapy",
        "department": "Department of Physiotherapy and Occupational Therapy",
        "institution": "Naestved-Slagelse-Ringsted Hospital",
        "address": "Slagelse, Denmark"
      }
    },
    {
      "affiliation": {
        "organization": "Naestved",
        "institution": "Naestved",
        "address": "Faelledvej 2C 1 sal, 4200, Slagelse, Denmark"
      }
    }
  ],
  "doi": "10.2196/46439",
  "md5": "4883DBE01FF9D5CFCBE9BB04EFDB668B",
  "publication": {
    "journal": "J Med Internet Res",
    "journal_inferred": true
  },
  "keywords": [
    "digital health",
    "eHealth",
    "mobile health",
    "mHealth",
    "wearables",
    "physical activity",
    "physical function",
    "chronic conditions",
    "randomized controlled trials",
    "systematic review",
    "meta-analysis"
  ],
  "funding": [
    "",
    "",
    "",
    "Acknowledgments The authors would like to extend their gratitude and acknowledgment to  Dr Palmira Bernocchi , Associate  Professor Heidi Holmen ,  Dr Stephan Potter ,  Professor Sonja Lippke ,  Dr Nills Haller ,  Dr Ewa Piotrowicz , and  Dr Jomme Claes  for providing additional data;  Ida-Marie Marcussen  for practical support; and  Alexander Luijk ,  Frederik Buch Dalum , and  Nikolaj Aagaard N\u00f8hr  for help during the screening process. This study received funding from  Region Zealand (Exercise First) , the  Naestved-Slagelse-Ringsted Research Fund , and a  1-year faculty scholarship  from the  University of Southern Denmark . The funders had no role in the study design, data collection, analysis, interpretation, report writing, or submission."
  ],
  "sections": [
    {
      "title": "Introduction"
    },
    {
      "title": "Background",
      "text": "Chronic conditions are the most significant contributors to the global burden of disease, which is continuously increasing  [1] . Living with \u22651 chronic conditions significantly impacts a person's life, family, and society  [1] . Physical inactivity is a major risk factor for at least 35 chronic conditions, which has become a global health concern  [2] . Physical inactivity is expensive, constituting up to 4.6% of a country's national health care expenditure  [3] . In contrast, being physically active can benefit physical and psychosocial health  [4] . In fact, following a structured exercise program can reduce the symptoms of chronic conditions with no additional risk of serious adverse events  [5] . However, a high proportion of people living with chronic conditions do not meet the recommended levels of physical activity  [6, 7] , possibly because of various reasons such as lack of access; travel distance; time inconvenience; cost; or internal factors such as pain, lack of motivation, or reluctance to engage in group activities  [8] .\n\nRegarding physical activity interventions, it is essential to understand and adapt care according to the individual's needs, preferences, and abilities  [9] . One way to deliver and make physical activity available, individually or as an add-on, is through digital health interventions  [10] . Digital health involves multiple solutions, including telephone calls, SMS text messages, mobile apps, websites, videoconferencing, and wearables (eg, activity trackers). The potential advantages of digital health solutions are convenience in terms of reduced distance, time, and cost, thereby limiting some of the more traditional barriers to physical encounters  [10] . Digital health solutions enable personalized and person-centered tailored health interventions. Such personalized care empowers people to manage their health, increases health care efficiency, and reduces health care costs  [11] . Consequently, the focus on digital health interventions has steadily grown over the last 2 decades  [12] , accelerating further in response to the COVID-19 pandemic  [13] . This has led to digital health interventions being initiated without fully knowing their effect, potentially introducing people to ineffective interventions  [14] .\n\nSeveral systematic reviews have investigated the effect of digital health interventions on health outcomes in people with individual chronic conditions (eg, chronic obstructive pulmonary disease  [COPD] , heart disease, and diabetes)  [15] [16] [17] [18] [19] [20] [21] [22] [23] [24] [25] [26] . Some reviews have focused on physical activity  [19] [20] [21] 23, 25, 27] , but these included few studies, as they focused on a single condition, solution (eg, only telephone calls or apps), or outcome measure  (eg, pain) . This challenges the assessment of the benefits and harms of digital health intervention. Furthermore, the proportion of people with >1 chronic condition is increasing. More than half of the people with chronic conditions have at least 2 conditions  [28] ; therefore, to increase the power of the results and better resemble real-life clinical practice, including studies on several chronic conditions is relevant. Therefore, a more comprehensive approach is needed to provide clinicians and decision makers with the best current evidence."
    },
    {
      "title": "Objectives",
      "text": "With this systematic review and meta-analysis, we investigated the benefits and harms of digital health interventions promoting physical activity among people with \u22651 chronic conditions on objectively and subjectively measured physical activity and physical function, depression, anxiety, health-related quality of life (HRQOL), and nonserious and serious adverse events."
    },
    {
      "title": "Methods"
    },
    {
      "title": "Overview",
      "text": "The study was preregistered at PROSPERO (CRD42020189028) and the study protocol (including amendments) is available in Multimedia Appendix 1  [4, 26, [29] [30] [31] [32] [33] [34] [35] [36] [37] [38] [39] [40] [41] [42] [43] [44] . We followed the Cochrane Handbook for Systematic Reviews  [45]  and reported according to the PRISMA (Preferred Reporting Items for Systematic Reviews and Meta-Analyses) guidelines  [46] . The PRISMA checklist is available in Multimedia Appendix 2  [46] ."
    },
    {
      "title": "Ethical Considerations",
      "text": "As this research design only investigates aggregated data from published randomized controlled trials (RCTs) with no individual data, no ethics approval was required."
    },
    {
      "title": "Eligibility Criteria",
      "text": "We included all peer-reviewed RCTs that compared an intervention with a digital health component in promoting physical activity to usual care or minimal intervention (eg, education or blinded wearables). Digital health interventions were defined as interventions in which any solution or technology (eg, website, app, and wearable) was used to deliver health information between health care providers and participants over a distance  [47] . Studies were included if  (1)  physical activity (any activity that was up to the participants to choose), exercise (any prescribed activity), or exercise therapy (any planned and structured prescribed activity) was used or promoted; (2) the primary or secondary aim was physical activity promotion; and (3) digital health intervention was delivered with or without additional pharmacotherapy or other nondigital adjuvant interventions  (eg, rehabilitation, education, or counseling) .\n\nMoreover, studies had to include adults (aged \u226518 years) with \u22651 of the following chronic conditions: depression or anxiety (mental health condition), ischemic heart disease or heart failure (heart disease), COPD, osteoarthritis of the hip or knee, hypertension, or type 2 diabetes. The inclusion criteria focused on these specific conditions, as they are among the most common worldwide according to the global burden of disease  [1] . Furthermore, they share the risk factors of physical inactivity and systemic low-grade inflammation, which can cause a chain of events that can lead to worse outcomes and other chronic conditions  [4, 48] .\n\nStudies were excluded if they included angina, valvular heart disease, congenital heart disease, cardiomyopathy, hypertension if systolic blood pressure \u2264139 mm HG or diastolic blood pressure \u226489 mm Hg, mixed populations of type 1 and 2 diabetes, tested the same digital health intervention but in different settings, or used the digital health solution for monitoring without any interaction with or feedback to the participants (ie, electronic health records or passive use of telemonitoring or a blinded actigraphy device)."
    },
    {
      "title": "Information Sources and Search Strategy",
      "text": "The MEDLINE, Embase, CINAHL, and Cochrane Central Register of Controlled Trials databases were searched via Ovid from inception to October 28, 2022, with no language restrictions. The search string was developed based on previous searches used in systematic reviews for people with chronic conditions  [49, 50] , and validated RCT search filters were used if available and applicable in each database  [51] . All search strings are presented in Multimedia Appendix 3 . In addition, studies found during full-text screens were manually added."
    },
    {
      "title": "Selection and Data Collection Process",
      "text": "Initially, search duplicates were removed using the reference manager tool EndNote  (version 20; Clarivate) [192]  and the management tool Covidence (Veritas Health Innovation;)  [193] . In total, 5 authors (AB, NN, FD, AL, and GZ) independently screened titles and abstracts, and 2 authors (AB and GZ) independently screened the full texts. Discrepancies were solved during regular meetings and resolved by discussing with a third study team member (CBJ). Although no restrictions were applied to the search, we only included studies if available in 1 of the following languages: English, Danish, Norwegian, Swedish, or Italian. Covidence was used throughout the selection process.\n\nA standardized data extraction form (piloted in 5 studies) was used. A total of 4 authors (AB, BL, NN, and GZ; in pairs) independently extracted data at two time points: (1) immediately after the end of the intervention and (  2 ) at follow-up, the time point closest to 12-month follow-up. Discrepancies were resolved by consensus or by referring to a third author (CBJ). WebPlotDigitizer (version 4.5; Ankit Rohatgi) was used to extract data from the figures  [194] . The authors were contacted if the studies had missing or unclear information or data  [195] . If the authors did not respond, the study eligibility was reassessed and consequently excluded."
    },
    {
      "title": "Outcomes",
      "text": "Outcomes were hierarchically ordered (Table  1 ), with objectively measured outcomes prioritized over subjective and generic tests over disease-specific tests. The primary outcomes were objectively measured physical activity and physical function. The secondary outcomes were subjectively measured physical activity and physical function, depression, anxiety, HRQOL, and adverse events (nonserious and serious)."
    },
    {
      "title": "Data Extraction",
      "text": "Extracted data included characteristics of the (1) trial-study design, study authors, publication year, country, and setting;\n\n(2) participants-number randomized, age, sex, BMI, socioeconomic status, and index conditions (if a study included participants based on them having \u22652 chronic conditions, the study was categorized as multimorbidity); and (3) intervention-type, frequency, duration, delivery method (categorized as mobile health [mHealth; ie, telephone calls, SMS text messages, and apps], eHealth [eg, internet based, website, and emails], or digital device [eg, wearables and Bluetooth-connected devices]), type of comparator, physical activity (categorized as physical activity [any activity that was up to the participants to choose] or exercise therapy [any planned and structured prescribed activity]), phase (categorized as without, with, or after any other rehabilitation), use of theory or framework, intervention components (categorized as digital only or combined in-person and digital [ie, other in-person adjuvant intervention, as rehabilitation, education, or counseling]), and adherence."
    },
    {
      "title": "Risk of Bias Assessment and Certainty Assessment",
      "text": "The risk of bias was assessed for each outcome in pairs by 7 authors (CD, SRM, TGH, RMA, LHT, GZ, AB) independently using the Cochrane Risk of Bias 2 tool  [30] . Disagreements were resolved by reaching a consensus or by including a third author (GZ or AB). The quality of evidence of each outcome was assessed using the Grading of Recommendations Assessment, Development, and Evaluation approach by 2 authors (GZ and AB)  [31] . An agreement was reached through consensus."
    },
    {
      "title": "Synthesis of Results",
      "text": "Meta-analysis was conducted using a random effects model, adjusted to Hedges g and using a restricted maximum likelihood method, as heterogeneity was expected. The effect of the intervention on continuous outcomes was expressed as standardized mean difference (SMD) for outcomes reported with different measures and with 95% CIs. The mean differences with 95% CIs were calculated for data on the same metric scale. Risk ratios were calculated with 95% CIs for dichotomous outcomes (ie, adverse events). Meta-analyses were visually presented as forest plots and were performed using the meta command in Stata (version 17.0; StataCorp LLC)  [196] . The pooled SMD effect sizes were interpreted as 0.20, 0.50, and 0.80, representing small, moderate, and large effects, respectively  [32] . The inconsistency of the results was evaluated using the I 2 and adjusted R 2 statistics and by visual inspection of the bubble plots and meta-regressions  [52] ."
    },
    {
      "title": "Meta-Regression and Subgroup Analyses",
      "text": "Univariable and multivariable meta-regression analyses were performed if \u226510 studies were included in the analyses to identify factors that could influence the effect estimates. For each outcome at the end of the intervention, the impact of (  1 ) participant characteristics-age, sex, BMI, socioeconomic status, depression, and anxiety levels-and (  2 ) intervention characteristics-number of digital and in-person sessions, frequency, duration, type of physical activity, phase, use of theory or framework, adherence, digital only, other in-person adjuvant intervention, and financial incentive-were assessed. Meta-regression analyses were performed using the meta regress command in Stata version  17.0 [196] .\n\nSubgroup analyses investigated whether the effects of digital health interventions varied among the included index conditions on all outcomes. Moreover, the delivery method and methodological quality according to the Cochrane Risk of Bias 2 tool (high, some concern, or low risk of bias) were assessed by subgroups for the primary outcomes."
    },
    {
      "title": "Reporting Bias Assessment",
      "text": "Small study bias was assessed using funnel plots and Egger test (or Harbord test for risk ratios) by 2 authors (GZ and AB), and agreement was reached by consensus."
    },
    {
      "title": "Results"
    },
    {
      "title": "Study Selection and Characteristics",
      "text": "The search retrieved 14,078 hits; 427 papers were full-text screened, and 140 papers were included, representing 130 RCTs (see Figure  1  for flowchart and refer to Multimedia Appendix 3 for the list of excluded studies). The included RCTs allowed for 136 comparisons, representing 20,094 participants (mean age 60.68, SD 7.17 years; 8440/20,094, 41.63% female). The interventions were conducted in 31 countries, mainly in the United States (  24 RCTs)  and Australia (  21 RCTs) . Over half (91/140, 65%) of the RCTs were published between 2018 and 2022; however, the publication years ranged from 2003 to 2022. For study characteristics, refer to Multimedia Appendix 3."
    },
    {
      "title": "Intervention Components",
      "text": "In total, 80 RCTs used a digital-only approach  [53, 54, 56, [59] [60] [61] [62] 65, 66, [68] [69] [70] [71] [72] [73] [74] 76, 79, 80, 83, 85, 86, [88] [89] [90] [91] [92] [93] , whereas 56 RCTs combined digital solutions with nondigital interventions (eg, counseling or in-person guided exercise)  [55, 57, 58, 63, 64, 66, 67, 75, 77, 78, 81, 82, 84, 87, 94, 142, . Of the included studies, 7 offered a preintervention period as run-in exercise (a period before randomization and intervention start where all participants performed exercise) or rehabilitation  [63, 98, 108, 111, 120, 160, 183, 189] . Furthermore, 13 RCTs offered rehabilitation as part of the intervention  [64, 75, 80, 82, 147, 149, 151, 152, 157, 160, 163, 169, 178] . mHealth solutions (eg, telephone calls, text messages, and apps) were primarily used in 56 RCTs  [53,56,57,59,63,67,69,78-80, 83-86,90,92,93,96,99,101,102,105,108,110,112-115,119, 120,124,128-130,134,136,140-142,146-148,150,155,157,161,163, 164,167,168,172,176,177,179,181,185] , whereas 22 RCTs  [58, 60, 61, 65, 70, 81, 87, 111, 116, 117, 126, 133, 134, 145, 149, 151, 154, 156, 165, 171, 173, 174]  used mHealth combined with a device (eg, wearable, pedometer, activity tracker, or Bluetooth-connected pulse oximeter or glycosometer). Furthermore, 6 RCTs  [75, 89, 118, 158, 169, 183]  combined mHealth and eHealth (eg, websites, web apps, and emails) technology. eHealth solutions were used by 29 RCTs  [54, 55, 66, [72] [73] [74] 76, 77, 88, 91, 95, 97, 100, 103, 104, 106, 122, 125, 127, 131, 132, 138, 143, 144, 152, 159, 175, 184, 190] , whereas 6 RCTs  [64, 71, 82, 98, 137, 162, 189]  combined eHealth and a device. Digital devices alone were used in 14 RCTs  [62, 68, 94, 107, 109, 121, 123, 130, 139, 166, 170, 178, 182, 186, 188, 191] . Finally, 2 studies combined mHealth, eHealth, and a digital device  [132, 160] .\n\nThe RCTs had a mean intervention duration of  22.94 (SD 18.72 ; range 4-104) weeks, and 60.9% (81/136) RCTs were placed in the physical activity category. A theory or framework most often (71/136, 52.6%) guided the interventions. The mean number of digital sessions was 97.98 (SD 109.29; range 2-377), whereas in-person sessions had a mean of 3.26 (SD 2.93; range 0-18). Of the included RCTs, 31  [54, 58, 62, 65, 70, 76, 77, 82, 84, 86, 88, 92, 94, 95, 100, 101, 112, 121, 132, 135, 143, 144, 146, 150, 151, 155, 163, 164, 174, 182, 186, [189] [190] [191] 197 ] had follow-up data, and the mean follow-up time was  45.38 (SD 21.74 ; range 12-104) weeks."
    },
    {
      "title": "Chronic Conditions",
      "text": "Type 2 diabetes  [53, 56, 58, 59, 66, 67, 81, 84, 88, 92, 93, 97, 99, 104, 107, [114] [115] [116] 119, 122, 123, [126] [127] [128] 130, 131, 140, 145, 146, 155, 157, 159, 165, 168, 172, 182, 184]  and heart disease  [62, 64, 65, 70, 72, 73, 75, 80, 85, 87, 96, 98, 102, 106, 109, [111] [112] [113] 121, [132] [133] [134] [135] 139, 142, 147, 154, 160, 161, 169, 171, [173] [174] [175] [176] [177] [178] [179] [180] [181] 185, 189]  were the most frequent index conditions (41 RCTs each), followed by COPD (26 RCTs)  [60, 61, 63, 68, 71, 74, 79, 82, 91, 94, 105, 108, 117, 120, 124, 136, 141, 149, [151] [152] [153] 156, 163, 164, 167, 170, 183, 186, 190, 191] , osteoarthritis  (18 RCTs)    [54, 55, 57, [76] [77] [78] 86, 89, 90, 100, 110, 118, 129, 138, 148, 158, 166, 188] , mental health (5 RCTs)  [95, 125, 137, 143, 144, 162, 198] , hypertension (3 RCTs)  [83, 101, 103, 197] , and multimorbidity (2 RCTs)  [69, 150] . For the index conditions and comorbidities among the participants, refer to Multimedia Appendix 3."
    },
    {
      "title": "Effect on Primary Outcomes at the End of the Intervention",
      "text": "At the end of the intervention, the digital health interventions, compared with usual care or minimal intervention, showed a small improvement in objectively measured physical activity SMD 0.29 (95% CI 0.21-0.37), corresponding to an average increase of 970.79 daily steps (95% CI 657.11-1284.47; I 2 =54.04%). Objectively measured physical function also showed a small improvement in favor of the digital health interventions (SMD 0.36, 95% CI 0.13-0.59) consistent with an improvement of 19.82 m (95% CI 9.45-30.02; I 2 =75.94%) on the 6-minute walk test (6MWT). There was no between-group difference in objectively measured moderate to vigorous physical activity (MVPA; SMD 0.03, 95% CI -0.31 to 0.37). However, objectively measured physical function and MVPA showed substantial heterogeneity. See Figure  2  for the overall forest plot and refer to Multimedia Appendix 4  for a detailed forest plot of each outcome, including daily steps and 6MWT."
    },
    {
      "title": "Effect on Secondary Outcomes at the End of the Intervention",
      "text": "End-of-intervention effects were found in favor of the digital health interventions for subjectively measured physical activity and physical function, depression, anxiety, and HRQOL. Subjectively measured physical activity and HRQOL showed substantial heterogeneity (Figures  3  and  4 ; Multimedia Appendix 4). There was an increased risk of nonserious adverse events (eg, musculoskeletal problems, soreness, or pain) in the intervention groups (risk ratio 1.31, 95% CI 1.11-1.55), whereas the risk of serious adverse events did not differ (risk ratio 0.89, 95% CI 0.76 to 1.04; Multimedia Appendix 4)."
    },
    {
      "title": "Effect on Primary Outcomes at Follow-Up",
      "text": "At follow-up, objectively measured physical activity showed a small improvement (SMD 0.17, 95% CI 0.04-0.31; I 2 =50.85%) in favor of the digital health intervention groups but with no between-group difference in daily steps (mean daily steps 498.40, 95% CI -44.99 to 1041.80; I 2 =77.94%). For objectively measured physical function, a small improvement was found in favor of digital health interventions (SMD 0.29, 95% CI 0.01-0.57; I 2 =76.17%). The improvement in 6MWT was sustained (50.06 m, 95% CI 15.1-85.01; I 2 =71.28%). However, a small effect on objectively measured MVPA in favor of the intervention group was found at follow-up (SMD 0.23, 95% CI 0.06-.40, I 2 =29.45%). See Figure  5  for the overall forest plot and refer to Multimedia Appendix 4 for a detailed forest plot of each outcome, including daily steps and 6MWT."
    },
    {
      "title": "Effect on Secondary Outcomes at Follow-Up",
      "text": "Only the effect on subjectively measured physical activity was sustained at the follow-up of the secondary outcomes (SMD 0.36, 95% CI 0.05-0.66; Figures  6  and  7 ; Multimedia Appendix 4). However, in the follow-up period, neither nonserious (risk ratio 1.35, 95% CI 0.71-2.54) nor serious adverse events (risk ratio 0.76, 95% CI 0.56-1.03) showed any between-group differences (Multimedia Appendix 4)."
    },
    {
      "title": "Risk of Bias",
      "text": "For objectively measured physical activity, 6% (3/51) of the RCTs were classified as low risk of bias  [58, 84, 160] , 55% (28/51) of the RCTs had some concerns  [53, 61, 62, 68, 70, 71, 74, 81, 82, 95, 97, 98, 100, 102, 107, 111, 115, 117, 136, 143, 144, 147, 148, 155, 156, 166, 180, 182, 183, [188] [189] [190] [191] , and 39% (20/51) of the RCTs were classified as high risk of bias  [60, 65, 69, 81, 91, 94, 99, 104, 125, [130] [131] [132] 145, 146, 149, 151, 152, 163, 164, 186]  (Figure  8 ). For objectively measured physical function, 4% (2/47) of the RCTs were classified as low risk of bias  [110, 158] , 70% (33/47) of the RCTs had some concerns  [54, 55, 64, 71, 74, 79, 82, 87, 94, 96, 97, 102, 105, 108, 117, 118, 120, 121, 124, 133, 136, 147, 156, 159, 167, 171, 175, 178, 183, 185, 186, 190] , and 26% (12/47) of the RCTs were classified as high risk of bias  [57, 63, 91, 112, 126, 149, [151] [152] [153] [154] 163, 164, 170, 176]  (Figure  9 ). The risk of bias profiles were similar for the secondary outcomes (Multimedia Appendix 5 ). Small study bias was judged as present at the end of the intervention for objectively measured physical function, subjectively measured physical activity, and HRQOL and at follow-up for subjectively measured physical activity (Multimedia Appendix 6 )."
    },
    {
      "title": "Certainty of Evidence",
      "text": "The Grading of Recommendations Assessment, Development, and Evaluation assessment scores ranged from moderate to very low (Table  2 ). Downgrading was done owing to study limitations, imprecision of the findings (some conditions had a limited number of RCTs), and inconsistency (high statistical heterogeneity only partially explained by the meta-regression analyses). e Moderate certainty: we are moderately confident in the effect estimate; the true effect is likely to be close to the estimate of the effect, but there is a possibility that it is substantially different. f Very low certainty: we have very little confidence in the effect estimate; the true effect is likely to be substantially different from the estimate of effect. g Studies with low risk of bias reported lower effect on the outcome.\n\nh The 95% CI ranges from no effect to high effect.\n\ni A possible presence of a small study bias from visual inspection of the funnel plot and Egger test. j Results are inconsistent and measured using the I 2 statistics.\n\nk Low certainty: our confidence in the effect estimate is limited; the true effect may be substantially different from the estimate of the effect. l The risk in the intervention group (and its 95% CI) was based on the assumed risk in the comparison group and the relative effect of the intervention (and its 95% CI)."
    },
    {
      "title": "Meta-Regression, Subgroup Analyses, and Sensitivity Analysis",
      "text": "Univariate meta-regression analysis for objectively measured physical activity showed that increasing age was associated with a lower effect size (slope -0.01, 95% CI -0.03 to -0.00), suggesting an effect reduction of 0.01 SDs per increased year. For objectively measured physical function, a higher effect was found for interventions that combined exercise therapy and physical activity (coefficient [\u03b2]=1. 40, . A similar effect of age was found for subjectively measured physical activity (slope -0.02, 95% CI -0.03 to -0.00), suggesting an effect reduction of 0.02 SDs per increased year; however, BMI was also associated with a lower effect size (\u03b2=.04, 95% CI -0.07 to -0.01) for this outcome. Furthermore, for subjectively measured physical activity, shorter intervention duration showed a lower effect size (\u03b2=-.01, 95% CI -0.01 to -0.00), and the use of a theory or framework showed a decreased effect (\u03b2=-.31, 95% CI -0.50 to -0.11), which persisted in the multivariate model (adjusted for intervention session, duration, and frequency; \u03b2=-.28, 95% CI -0.46 to -0.09). For mental health conditions, the univariate analysis showed that participants with higher depression levels had a greater effect on depression symptoms (slope -0.01, 95% CI -0.02 to -0.00), which persisted in the multivariate model (adjusted for age and sex). There were no differences in the rest of the meta-regression analyses (Multimedia Appendix 7) or in the subgroup analyses stratified by conditions, delivery method, or methodology quality (Multimedia Appendix 8 ).\n\nIn an unplanned sensitivity analysis of the primary outcomes of RCTs with a digital-only approach, the results at the end of the intervention were in line with the main analyses (Multimedia Appendix 8)."
    },
    {
      "title": "XSL \u2022 FO"
    },
    {
      "title": "RenderX"
    },
    {
      "title": "Discussion"
    },
    {
      "title": "Principal Findings",
      "text": "Overall, digital health interventions had a small effect on physical activity and physical function in people with chronic conditions compared with usual care or minimal intervention at the end of the intervention and follow-up. Furthermore, subjectively measured physical function, depression, anxiety, and HRQOL showed a small improvement but only at the end of the intervention. The certainty of the findings was downgraded because of study limitations, imprecision, and inconsistency and was moderate to very low."
    },
    {
      "title": "Findings in Comparison With Prior Work"
    },
    {
      "title": "Overview",
      "text": "This systematic review was the first to focus primarily on physical activity in several major chronic conditions and across various digital health solutions. A previous systematic review found a large effect of eHealth interventions on physical activity in people with noncommunicable diseases but only included physical activity-integrated and diet-integrated interventions and combined objectively and subjectively physical activity outcomes, thereby limiting clinical interpretation and comparison  [81] . Another systematic review focused on multimorbidity and the effect of digital telemedicine on health outcomes but did not report any physical activity outcomes  [19] . A third review focused on exercise intervention in people with chronic conditions but solely assessed videoconferencing as the delivery method and found a moderate to small improvement in exercise capacity, which is not directly comparable with physical activity or physical function  [25, 199] . Finally, a fourth review assessed objectively and subjectively measured physical activity in people with chronic conditions and found a small effect in both outcomes but only significant for the subjective measured outcome  [200] . However, this study was limited to the assessment of self-guided digital interventions."
    },
    {
      "title": "Primary Outcomes",
      "text": "To ease the clinical interpretation of objectively measured physical activity, we pooled daily steps data and found an improvement (970.8 steps) comparable with findings in adults using physical activity monitors  [201] . Clinically, a 1000-steps increase is considered important and showed a risk reduction in cardiovascular morbidity and all-cause mortality for each additional 1000 daily steps taken, even below the 10,000 daily recommended steps  [202] . However, we did not find any improvement in MVPA at the end of the intervention. This intensity level may provide even greater health benefits compared with lower physical activity levels, but importantly, any increase in physical activity is associated with health benefits, regardless of the duration  [203] .\n\nAssessing objectively measured physical function by pooling 6MWT data, we found an improvement  (19.8 m)  comparable with previous systematic reviews  [15, 16]  and within the clinically relevant limits of 14.0-30.5 m that are considered clinically meaningful for people across different chronic conditions  [204] ."
    },
    {
      "title": "Secondary Outcomes",
      "text": "Subjectively measured physical activity and physical function showed almost the same effect as objectively measured outcomes at the end of the interventions, but it is known that people tend to overestimate their physical activity level when using subjective outcome measures  [205] . It is problematic that the study participants could not be blinded to the intervention, especially when using subjective outcome measures, which is reflected in the higher risk of bias profile of the studies in the subjectively measured outcomes compared with the objectively measured outcomes.\n\nThe digital health intervention also showed end-of-intervention effects on other essential health parameters such as depression, anxiety, and HRQOL. Depression and anxiety often coexist with other chronic conditions but are often undetected and untreated  [206] . However, digital health interventions may offer a dual effect, as we found both an effect on frequent physical conditions and mental health conditions. Furthermore, our meta-regression indicated that there might be a higher effect for people with higher levels of depression. A similar effect was found in a study that investigated in-person physical activity interventions  [5] .\n\nHRQOL is an important person-reported outcome measure and is associated with higher rates of hospitalization, morbidity, and mortality  [207] [208] [209] . Our findings are comparable with those of previous research  [210] , which also found a small effect on HRQOL in people with physical disabilities (eg, musculoskeletal conditions); however, we have overlapping studies. There has been a focus on measuring HRQOL in health research  [208] , and HRQOL was by far the most assessed outcome but also showed a high level of heterogeneity, highlighting the differences between trials and within-outcome assessment. This may hide the actual effect because of the differences in the intervention and outcome measures.\n\nAlthough exercise therapy has proven safe and beneficial for people with multiple chronic conditions  [5] , safety is paramount when initiating a digital physical activity intervention. We found an increased risk of nonserious events in the intervention groups, commonly musculoskeletal problems, soreness, or pain, which can be expected after engaging in physical activity, even in face-to-face interventions  [211] . The higher risk of nonserious events should also be seen in the light of including participants with COPD and heart failure, who often experience complications  [212, 213] . No increased risk of serious adverse events aligns with previous reviews of in-person physical activity interventions among people with chronic conditions and multimorbidities  [5, 211] ."
    },
    {
      "title": "Follow-Up",
      "text": "Only objectively measured physical activity and physical function, including MVPA, effects were sustained at follow-up. Owing to the few studies assessing follow-up, more research is needed to address the long-term effects  [214] . Nevertheless, for both subjectively measured physical activity and HRQOL, our meta-regression showed that a shorter intervention duration showed lower effect sizes for the digital health interventions."
    },
    {
      "title": "XSL \u2022 FO"
    },
    {
      "title": "RenderX",
      "text": "Although we prespecified our meta-regression analyses, they were exploratory and should be interpreted cautiously."
    },
    {
      "title": "Age and Digital Health",
      "text": "It has been suggested that age and multimorbidity may affect the use of digital technologies  [215] . Meta-regression analysis of objectively and subjectively measured physical activity showed that increasing age was associated with a lower effect size; however, the effect was negligible. Furthermore, the included studies mostly had an upper age limit, which is why the full effect of age is not known."
    },
    {
      "title": "Heterogeneity",
      "text": "We expected heterogeneity in our meta-analyses, as there is a clinical diversity in including the different chronic conditions, but further methodological diversity is also present as outcome measures differed among each outcome. There is no consensus on how to measure physical activity best  [216] . None of the meta-regression analyses could explain the substantial heterogeneity between studies."
    },
    {
      "title": "Digital Health Interventions",
      "text": "Digital health solutions encompass many different technologies  [217] . However, we did not find any difference in the effect of the interventions based on the delivery method. This could be owing to a wide variation across the included interventions. Although more than half of the interventions primarily involved solutions within 1 digital health category (ie, mHealth), commonly, the included studies incorporated >1 technology (eg, apps, telephone calls, and emails). Assessing the effect of different interventions is quite complex, and we encourage the use of reporting guidelines  [218] [219] [220] . Furthermore, for our study, the interventions also applied different approaches to physical activity (ie, self-management of the physical intervention or structured exercise therapy), which further challenges cross-comparisons."
    },
    {
      "title": "Chronic Conditions",
      "text": "The included studies were generally limited to 1 index condition or reported comorbidities very poorly, making investigations of the results across conditions challenging. Including only participants with 1 condition confines a silo-based approach. A more real-life approach allows participants with more chronic conditions to participate, reflecting that people often have >1 chronic condition  [221] . It should also be emphasized that the World Health Organization's guidelines on physical activity are not restricted to any single condition but apply to all people independent of health conditions  [203] ."
    },
    {
      "title": "Strengths and Limitations",
      "text": "This study had some limitations. The risk of selection bias within the RCTs, our inclusion criteria, which focused on 8 specific chronic conditions, thereby excluded, for example, cancer, and the fact that only a few RCTs targeted hypertension, depression, anxiety, and multimorbidity limits the generalizability of our results. Furthermore, few RCTs had follow-up data that induced uncertainty regarding whether the effect was maintained beyond the end of the interventions. In addition, the reporting of digital health solutions and the type and dose of physical activity were poor for many RCTs, preventing us from conducting further analyses on the intervention characteristics. Another limitation is the lack of measuring digital health literacy within the included studies, as it is known that low literacy (both health and digital) affects participation and health outcomes and deepens health inequities  [222] . Therefore, we lack information on whether the participants in the included studies were the ones with high or low levels of digital health literacy, as we may suspect that in groups with lower literacy, the effect would become even smaller  [223] .\n\nThe quality of the evidence had to be downgraded to low or very low for objectively measured physical function, subjectively measured physical activity, anxiety, and HRQOL, implying that the actual effect might be different from the estimated effect. In addition, a small study bias cannot be ruled out for some outcomes, although other factors, such as high heterogeneity and low quality of evidence, may contribute to funnel plot asymmetry.\n\nNevertheless, the strengths of this systematic review are the meticulous, state-of-the-art design and methodology, following the Cochrane handbook and reporting using the PRISMA guidelines. In addition, we assessed the effects across several chronic conditions, breaking down the more silo-based thinking of chronicity."
    },
    {
      "title": "Future Research",
      "text": "More high-quality research with better reporting, available protocols, blinding of assessors and study participants (when possible), better handling of missing data, and the use of common and clearly described measurement methods are needed for future research. In addition, such research should assess whether higher and more sustainable effects of digital health interventions that promote physical activity can be achieved. It should also focus on whether any digital health solution or features within these are more effective than others and whether a dose-response relationship exists. Studies focusing on the impact of comorbidities or multimorbidities are also warranted. Furthermore, if digital health solutions are to live up to their potential and be part of the solution to the health care shortage, the digital divide must be addressed by assessing if and how the participants' digital health literacy levels affect digital health interventions."
    },
    {
      "title": "Conclusions and Implications",
      "text": "Engaging people in physical activity is considered a polypill that provides high health gains with low risk and low costs  [224] . Digital health solutions as a delivery method can provide effective physical activity interventions across people with chronic conditions and may help make these types of interventions available for more people at a lower cost. Therefore, given the potential health benefits, digital health interventions promoting physical activity in people with \u22651 chronic condition should be considered in clinical practice, especially if the overall aim is to improve physical activity levels. However, educating participants about the potential risk of nonserious adverse events is essential. The findings of this study are also relevant for policy makers because easy and affordable access to high-quality health care services is at the top of the political agenda. However, it should be noted that the"
    },
    {
      "text": "Figure 1. PRISMA (Preferred Reporting Items for Systematic Reviews and Meta-Analyses) flowchart of the study selection process."
    },
    {
      "text": "Figure 2. Overall forest plot of objectively measured physical activity, objectively measured physical function, and moderate to vigorous physical activity (MVPA) at the end of the intervention. Obj PA: objectively measured physical activity; Obj PF: objectively measured physical function."
    },
    {
      "text": "Figure 3. Overall forest plot of subjectively measured physical activity, physical function, and health-related quality of life (HRQOL) at the end of the intervention. Subj PA: subjectively measured physical activity; Subj PF: subjectively measured physical function."
    },
    {
      "text": "Figure 4. Overall forest plot of depression and anxiety at the end of the intervention. ANX: anxiety; DEP: depression."
    },
    {
      "text": "Figure 5. Overall forest plot of objectively measured physical activity, physical function, and moderate to vigorous physical activity (MVPA) at follow-up. Obj PA: objectively measured physical activity; Obj PF: objectively measured physical function."
    },
    {
      "text": "Figure 6. Overall forest plot of subjectively measured physical activity, physical function, and health-related quality of life (HRQOL) at follow-up. Subj PA: subjectively measured physical activity; Subj PF: subjectively measured physical function."
    },
    {
      "text": "Figure 7. Overall forest plot of depression and anxiety at follow-up. ANX: anxiety; DEP: depression."
    },
    {
      "text": "Figure 8. Risk of bias for objectively measured physical activity given as percentages."
    },
    {
      "text": "Figure 9. Risk of bias with objectively measured physical function given as percentages."
    },
    {
      "text": "c SMD: standardized mean difference.d Some conditions are not represented, or the results only included a few studies within each condition."
    },
    {
      "text": "Grading of Recommendations Assessment, Development, and Evaluation summary of findings."
    },
    {
      "title": "Acknowledgments",
      "text": "The authors would like to extend their gratitude and acknowledgment to  Dr Palmira Bernocchi , Associate  Professor Heidi Holmen ,  Dr Stephan Potter ,  Professor Sonja Lippke ,  Dr Nills Haller ,  Dr Ewa Piotrowicz , and  Dr Jomme Claes  for providing additional data;  Ida-Marie Marcussen  for practical support; and  Alexander Luijk ,  Frederik Buch Dalum , and  Nikolaj Aagaard N\u00f8hr  for help during the screening process. This study received funding from  Region Zealand (Exercise First) , the  Naestved-Slagelse-Ringsted Research Fund , and a  1-year faculty scholarship  from the  University of Southern Denmark . The funders had no role in the study design, data collection, analysis, interpretation, report writing, or submission."
    },
    {
      "title": "Conflicts of Interest",
      "text": "All authors have completed the Unified Competing Interest form (available on request from the corresponding author) and declare that STS is an associate editor of the Journal of Orthopaedic & Sports Physical Therapy; has received personal fees from Munksgaard and TrustMe-Ed outside the submitted work; and is a cofounder of GLA:D, a not-for-profit initiative hosted at the University of Southern Denmark aimed at implementing clinical guidelines for osteoarthritis in clinical practice. Furthermore, STS is currently funded by a program grant from Region Zealand (Exercise First) and 2 grants from the European Union's Horizon 2020 Research and Innovation Program, one from the European Research Council (MOBILIZE, grant agreement 801790) and the other under grant agreement 945377 (ESCAPE). In addition, LHT was funded by a grant from the Danish Regions and the Danish Health Confederation through the Development and Research Fund for financial support (project 2703) and a grant from Region Zealand (Exercise First). None of the authors had financial relationships with any organizations that might have an interest in the submitted work or other relationships or activities that could appear to have influenced the submitted work."
    },
    {
      "title": "Multimedia Appendix 8",
      "text": "Subgroup and sensitivity analyses.\n\n[PDF File (Adobe PDF File), 7099 KB-Multimedia Appendix 8] Abbreviations 6MWT: 6-minute walk test COPD: chronic obstructive pulmonary disease HRQOL: health-related quality of life mHealth: mobile health MVPA: moderate to vigorous physical activity PRISMA: Preferred Reporting Items for Systematic Reviews and Meta-Analyses RCT: randomized controlled trial SMD: standardized mean difference Edited by A Mavragani; submitted  12.02.23; C Koehn, SQ Yoong; comments to author 30.03.23; revised version received 20.05.23; accepted 25.05.23; published 06.07.23  Please cite as: Zangger G,  Bricca A, Liaghat B, Juhl CB, Mortensen SR, Andersen RM, Damsted C, Hamborg TG, Ried-Larsen M, Tang LH, Thygesen LC, Skou ST Benefits and Harms of Digital Health Interventions Promoting Physical   \u00a9Graziella Zangger, Alessio Bricca, Behnam Liaghat, Carsten B Juhl, Sofie Rath Mortensen, Rune Martens Andersen, Camma Damsted, Trine Gr\u00f8nbek Hamborg, Mathias Ried-Larsen, Lars Hermann Tang, Lau Caspar Thygesen, S\u00f8ren T Skou. Originally published in the Journal of Medical Internet Research ( https://www.jmir.org ), 06.07.2023. This is an open-access article distributed under the terms of the Creative Commons Attribution License ( https://creativecommons.org/licenses/by/4.0/ ), which permits unrestricted use, distribution, and reproduction in any medium, provided the original work, first published in the Journal of Medical Internet Research, is properly cited. The complete bibliographic information, a link to the original publication on  https://www.jmir.org/ , as well as this copyright and license information must be included."
    }
  ],
  "references": [
    {
      "title": "Study protocol including amendments to protocol",
      "doi": "10.7717/peerj.17443/fig-1",
      "raw": "10.7717/peerj.17443/fig-1 \n\t\t Study protocol including amendments to protocol \n\t\t \n\t \n\t Study protocol including amendments to protocol."
    },
    {
      "title": "PDF File (Adobe PDF File), 283 KB-Multimedia Appendix 1Multimedia Appendix 2 PRISMA (Preferred Reporting Items for Systematic Reviews and Meta-Analyses) checklist",
      "doi": "10.7717/peerj.4598/supp-5",
      "raw": "10.7717/peerj.4598/supp-5 \n\t\t PDF File (Adobe PDF File), 283 KB-Multimedia Appendix 1Multimedia Appendix 2 PRISMA (Preferred Reporting Items for Systematic Reviews and Meta-Analyses) checklist \n\t\t \n\t \n\t PDF File (Adobe PDF File), 283 KB-Multimedia Appendix 1Multimedia Appendix 2 PRISMA (Preferred Reporting Items for Systematic Reviews and Meta-Analyses) checklist."
    },
    {
      "title": "Cochrane Risk of Bias 2 assessment of each outcome of interest",
      "doi": "10.7717/peerj.8772/supp-4",
      "raw": "10.7717/peerj.8772/supp-4 \n\t\t Cochrane Risk of Bias 2 assessment of each outcome of interest \n\t\t \n\t \n\t PDF File Adobe PDF File), 11151 KB-Multimedia Appendix Multimedia Appendix 5 Risk of bias \n\t PDF File (Adobe PDF File), 11151 KB-Multimedia Appendix Multimedia Appendix 5 Risk of bias: Cochrane Risk of Bias 2 assessment of each outcome of interest."
    },
    {
      "title": "979 KB-Multimedia Appendix 6Multimedia Appendix 7 Meta-regression analyses",
      "doi": "10.1007/1-84628-138-5_6",
      "pages": "593",
      "raw": "979 KB-Multimedia Appendix 6Multimedia Appendix 7 Meta-regression analyses \n\t\t 10.1007/1-84628-138-5_6 \n\t\t \n\t\t\t 593 \n\t\t \n\t \n\t PDF File Adobe PDF File PDF File (Adobe PDF File KB-Multimedia Appendix 7 \n\t PDF File (Adobe PDF File), 979 KB-Multimedia Appendix 6Multimedia Appendix 7 Meta-regression analyses. [PDF File (Adobe PDF File), 593 KB-Multimedia Appendix 7] References"
    },
    {
      "title": "Global burden of 369 diseases and injuries in 204 countries and territories, 1990-2019: a systematic analysis for the Global Burden of Disease Study 2019",
      "year": 2019,
      "doi": "10.1016/S0140-6736(20)30925-9",
      "journal": "Lancet",
      "volume": "396",
      "issue": "10258",
      "raw": "Global burden of 369 diseases and injuries in 204 countries and territories, 1990-2019: a systematic analysis for the Global Burden of Disease Study 2019 \n\t\t \n\t\t\t Gbd \n\t\t \n\t\t 10.1016/S0140-6736(20)30925-9 \n\t\t Medline: 33069326 \n\t \n\t \n\t\t Lancet \n\t\t \n\t\t\t 396 \n\t\t\t 10258 \n\t\t\t \n\t\t\t 2019. 2020 Oct 17 \n\t\t \n\t \n\t Diseases Injuries Collaborators FREE Full text \n\t GBD 2019 Diseases Injuries Collaborators. Global burden of 369 diseases and injuries in 204 countries and territories, 1990-2019: a systematic analysis for the Global Burden of Disease Study 2019. Lancet 2020 Oct 17;396(10258):1204-1222 [FREE Full text] [doi: 10.1016/S0140-6736(20)30925-9] [Medline: 33069326]"
    },
    {
      "title": "The current global state of movement and physical activity -the health and economic costs of the inactive phenotype",
      "authors": [
        "S Jayasinghe",
        "N Byrne",
        "K Patterson",
        "K Ahuja",
        "A Hills"
      ],
      "year": 2021,
      "doi": "10.1016/j.pcad.2020.10.006",
      "journal": "Prog Cardiovasc Dis",
      "volume": "64",
      "raw": "The current global state of movement and physical activity -the health and economic costs of the inactive phenotype \n\t\t \n\t\t\t S Jayasinghe \n\t\t \n\t\t \n\t\t\t N M Byrne \n\t\t \n\t\t \n\t\t\t K A Patterson \n\t\t \n\t\t \n\t\t\t K D Ahuja \n\t\t \n\t\t \n\t\t\t A P Hills \n\t\t \n\t\t 10.1016/j.pcad.2020.10.006 \n\t\t Medline: 33130190 \n\t \n\t \n\t\t Prog Cardiovasc Dis \n\t\t \n\t\t\t 64 \n\t\t\t \n\t\t\t 2021 Jan \n\t\t \n\t \n\t Jayasinghe S, Byrne NM, Patterson KA, Ahuja KD, Hills AP. The current global state of movement and physical activity -the health and economic costs of the inactive phenotype. Prog Cardiovasc Dis 2021 Jan;64:9-16 [doi: 10.1016/j.pcad.2020.10.006] [Medline: 33130190]"
    },
    {
      "title": "The economic burden of physical inactivity: a systematic review and critical appraisal",
      "authors": [
        "D Ding",
        "T Kolbe-Alexander",
        "B Nguyen",
        "P Pratt",
        "M Lawson"
      ],
      "year": 2017,
      "doi": "10.1136/bjsports-2016-097385",
      "journal": "Br J Sports Med",
      "volume": "51",
      "issue": "19",
      "raw": "The economic burden of physical inactivity: a systematic review and critical appraisal \n\t\t \n\t\t\t D Ding \n\t\t \n\t\t \n\t\t\t T Kolbe-Alexander \n\t\t \n\t\t \n\t\t\t B Nguyen \n\t\t \n\t\t \n\t\t\t P T Pratt \n\t\t \n\t\t \n\t\t\t M Lawson \n\t\t \n\t\t \n\t\t\t K D \n\t\t \n\t\t 10.1136/bjsports-2016-097385 \n\t\t Medline: 28446455 \n\t \n\t \n\t\t Br J Sports Med \n\t\t \n\t\t\t 51 \n\t\t\t 19 \n\t\t\t \n\t\t\t 2017 Oct \n\t\t \n\t \n\t Ding D, Kolbe-Alexander T, Nguyen B, PT, Pratt M, Lawson KD. The economic burden of physical inactivity: a systematic review and critical appraisal. Br J Sports Med 2017 Oct;51(19):1392-1409 [doi: 10.1136/bjsports-2016-097385] [Medline: 28446455]"
    },
    {
      "title": "Exercise as medicine -evidence for prescribing exercise as therapy in 26 different chronic diseases",
      "authors": [
        "B Pedersen",
        "B Saltin"
      ],
      "year": 2015,
      "doi": "10.1111/sms.12581",
      "journal": "Scand J Med Sci Sports",
      "volume": "25",
      "issue": "Suppl 3",
      "raw": "Exercise as medicine -evidence for prescribing exercise as therapy in 26 different chronic diseases \n\t\t \n\t\t\t B K Pedersen \n\t\t \n\t\t \n\t\t\t B Saltin \n\t\t \n\t\t 10.1111/sms.12581 \n\t\t Medline: 26606383 \n\t \n\t \n\t\t Scand J Med Sci Sports \n\t\t \n\t\t\t 25 \n\t\t\t Suppl 3 \n\t\t\t \n\t\t\t 2015 Dec \n\t\t \n\t \n\t Pedersen BK, Saltin B. Exercise as medicine -evidence for prescribing exercise as therapy in 26 different chronic diseases. Scand J Med Sci Sports 2015 Dec;25 Suppl 3:1-72 [doi: 10.1111/sms.12581] [Medline: 26606383]"
    },
    {
      "title": "Benefits and harms of exercise therapy in people with multimorbidity: a systematic review and meta-analysis of randomised controlled trials",
      "authors": [
        "A Bricca",
        "L Harris",
        "M J\u00e4ger",
        "S Smith",
        "C Juhl",
        "S Skou"
      ],
      "year": 2020,
      "doi": "10.1016/j.arr.2020.101166",
      "journal": "Ageing Res Rev",
      "volume": "63",
      "pages": "101166",
      "raw": "Benefits and harms of exercise therapy in people with multimorbidity: a systematic review and meta-analysis of randomised controlled trials \n\t\t \n\t\t\t A Bricca \n\t\t \n\t\t \n\t\t\t L K Harris \n\t\t \n\t\t \n\t\t\t M J\u00e4ger \n\t\t \n\t\t \n\t\t\t S M Smith \n\t\t \n\t\t \n\t\t\t C B Juhl \n\t\t \n\t\t \n\t\t\t S T Skou \n\t\t \n\t\t 10.1016/j.arr.2020.101166 \n\t\t Medline: 32896665 \n\t \n\t \n\t\t Ageing Res Rev \n\t\t \n\t\t\t 63 \n\t\t\t 101166 \n\t\t\t 2020 Nov \n\t\t \n\t \n\t FREE Full text \n\t Bricca A, Harris LK, J\u00e4ger M, Smith SM, Juhl CB, Skou ST. Benefits and harms of exercise therapy in people with multimorbidity: a systematic review and meta-analysis of randomised controlled trials. Ageing Res Rev 2020 Nov;63:101166 [FREE Full text] [doi: 10.1016/j.arr.2020.101166] [Medline: 32896665]"
    },
    {
      "title": "Physical ActivityChronic Conditions Research Team. Older adults, chronic disease and leisure-time physical activity",
      "authors": [
        "M Ashe",
        "W Miller",
        "J Eng",
        "L Noreau"
      ],
      "year": 2009,
      "doi": "10.1159/000141518",
      "journal": "Gerontology",
      "volume": "55",
      "issue": "1",
      "raw": "Physical ActivityChronic Conditions Research Team. Older adults, chronic disease and leisure-time physical activity \n\t\t \n\t\t\t M C Ashe \n\t\t \n\t\t \n\t\t\t W C Miller \n\t\t \n\t\t \n\t\t\t J J Eng \n\t\t \n\t\t \n\t\t\t L Noreau \n\t\t \n\t\t 10.1159/000141518 \n\t\t Medline: 18566534 \n\t \n\t \n\t\t Gerontology \n\t\t \n\t\t\t 55 \n\t\t\t 1 \n\t\t\t \n\t\t\t 2009 \n\t\t \n\t \n\t FREE Full text \n\t Ashe MC, Miller WC, Eng JJ, Noreau L, Physical ActivityChronic Conditions Research Team. Older adults, chronic disease and leisure-time physical activity. Gerontology 2009;55(1):64-72 [FREE Full text] [doi: 10.1159/000141518] [Medline: 18566534]"
    },
    {
      "title": "Do older adults with multimorbidity meet the recommended levels of physical activity? An analysis of scottish health survey",
      "authors": [
        "A Salman",
        "M Sellami"
      ],
      "year": 2019,
      "doi": "10.3390/ijerph16193748",
      "journal": "Int J Environ Res Public Health",
      "volume": "16",
      "issue": "19",
      "pages": "3748",
      "raw": "Do older adults with multimorbidity meet the recommended levels of physical activity? An analysis of scottish health survey \n\t\t \n\t\t\t A Salman \n\t\t \n\t\t \n\t\t\t M Sellami \n\t\t \n\t\t 10.3390/ijerph16193748 \n\t\t Medline: 31590293 \n\t \n\t \n\t\t Int J Environ Res Public Health \n\t\t \n\t\t\t 16 \n\t\t\t 19 \n\t\t\t 3748 \n\t\t\t 2019 Oct 04 \n\t\t \n\t \n\t FREE Full text \n\t Salman A, Sellami M. Do older adults with multimorbidity meet the recommended levels of physical activity? An analysis of scottish health survey. Int J Environ Res Public Health 2019 Oct 04;16(19):3748 [FREE Full text] [doi: 10.3390/ijerph16193748] [Medline: 31590293]"
    },
    {
      "title": "What prevents people with chronic obstructive pulmonary disease from attending pulmonary rehabilitation? A systematic review",
      "authors": [
        "A Keating",
        "A Lee",
        "A Holland"
      ],
      "year": 2011,
      "doi": "10.1177/1479972310393756",
      "journal": "Chron Respir Dis",
      "volume": "8",
      "issue": "2",
      "raw": "What prevents people with chronic obstructive pulmonary disease from attending pulmonary rehabilitation? A systematic review \n\t\t \n\t\t\t A Keating \n\t\t \n\t\t \n\t\t\t A Lee \n\t\t \n\t\t \n\t\t\t A E Holland \n\t\t \n\t\t 10.1177/1479972310393756 \n\t\t Medline: 21596892 \n\t \n\t \n\t\t Chron Respir Dis \n\t\t \n\t\t\t 8 \n\t\t\t 2 \n\t\t\t \n\t\t\t 2011 \n\t\t \n\t \n\t FREE Full text \n\t Keating A, Lee A, Holland AE. What prevents people with chronic obstructive pulmonary disease from attending pulmonary rehabilitation? A systematic review. Chron Respir Dis 2011;8(2):89-99 [FREE Full text] [doi: 10.1177/1479972310393756] [Medline: 21596892]"
    },
    {
      "title": "Strategies to increase physical activity",
      "authors": [
        "P Tuso"
      ],
      "year": 2015,
      "doi": "10.7812/tpp/14-242",
      "journal": "Perm J",
      "volume": "19",
      "issue": "4",
      "raw": "Strategies to increase physical activity \n\t\t \n\t\t\t P Tuso \n\t\t \n\t\t 10.7812/tpp/14-242 \n\t\t Medline: 26517440 \n\t \n\t \n\t\t Perm J \n\t\t \n\t\t\t 19 \n\t\t\t 4 \n\t\t\t \n\t\t\t 2015 \n\t\t \n\t \n\t FREE Full text \n\t Tuso P. Strategies to increase physical activity. Perm J 2015;19(4):84-88 [FREE Full text] [doi: 10.7812/TPP/14-242] [Medline: 26517440]"
    },
    {
      "title": "Evaluating digital health interventions: key questions and approaches",
      "authors": [
        "E Murray",
        "E Hekler",
        "G Andersson",
        "L Collins",
        "A Doherty",
        "C Hollis"
      ],
      "year": 2016,
      "doi": "10.1016/j.amepre.2016.06.008",
      "journal": "Am J Prev Med",
      "volume": "51",
      "issue": "5",
      "raw": "Evaluating digital health interventions: key questions and approaches \n\t\t \n\t\t\t E Murray \n\t\t \n\t\t \n\t\t\t E B Hekler \n\t\t \n\t\t \n\t\t\t G Andersson \n\t\t \n\t\t \n\t\t\t L M Collins \n\t\t \n\t\t \n\t\t\t A Doherty \n\t\t \n\t\t \n\t\t\t C Hollis \n\t\t \n\t\t 10.1016/j.amepre.2016.06.008 \n\t\t Medline: 27745684 \n\t \n\t \n\t\t Am J Prev Med \n\t\t \n\t\t\t 51 \n\t\t\t 5 \n\t\t\t \n\t\t\t 2016 Nov \n\t\t \n\t \n\t FREE Full text \n\t Murray E, Hekler EB, Andersson G, Collins LM, Doherty A, Hollis C, et al. Evaluating digital health interventions: key questions and approaches. Am J Prev Med 2016 Nov;51(5):843-851 [FREE Full text] [doi: 10.1016/j.amepre.2016.06.008] [Medline: 27745684]"
    },
    {
      "title": "Empowering patients through eHealth: a case report of a pan-European project",
      "authors": [
        "E Lettieri",
        "L Fumagalli",
        "G Radaelli",
        "' Bertele",
        "J Vogt",
        "R Hammerschmidt"
      ],
      "year": 2015,
      "doi": "10.1186/s12913-015-0983-0",
      "journal": "BMC Health Serv Res",
      "volume": "15",
      "pages": "309",
      "raw": "Empowering patients through eHealth: a case report of a pan-European project \n\t\t \n\t\t\t E Lettieri \n\t\t \n\t\t \n\t\t\t L P Fumagalli \n\t\t \n\t\t \n\t\t\t G Radaelli \n\t\t \n\t\t \n\t\t\t ' P Bertele \n\t\t \n\t\t \n\t\t\t J Vogt \n\t\t \n\t\t \n\t\t\t R Hammerschmidt \n\t\t \n\t\t 10.1186/s12913-015-0983-0 \n\t\t Medline: 26242863 \n\t \n\t \n\t\t BMC Health Serv Res \n\t\t \n\t\t\t 15 \n\t\t\t 309 \n\t\t\t 2015 Aug 05 \n\t\t \n\t \n\t FREE Full text \n\t Lettieri E, Fumagalli LP, Radaelli G, Bertele' P, Vogt J, Hammerschmidt R, et al. Empowering patients through eHealth: a case report of a pan-European project. BMC Health Serv Res 2015 Aug 05;15:309 [FREE Full text] [doi: 10.1186/s12913-015-0983-0] [Medline: 26242863]"
    },
    {
      "title": "WHO Digital Health Guidelines: a milestone for global health",
      "authors": [
        "A Labrique",
        "S Agarwal",
        "T Tamrat",
        "G Mehl"
      ],
      "year": 2020,
      "doi": "10.1038/s41746-020-00330-2",
      "journal": "NPJ Digit Med",
      "volume": "3",
      "pages": "120",
      "raw": "WHO Digital Health Guidelines: a milestone for global health \n\t\t \n\t\t\t A Labrique \n\t\t \n\t\t \n\t\t\t S Agarwal \n\t\t \n\t\t \n\t\t\t T Tamrat \n\t\t \n\t\t \n\t\t\t G Mehl \n\t\t \n\t\t 10.1038/s41746-020-00330-2 \n\t\t Medline: 33015373 \n\t \n\t \n\t\t NPJ Digit Med \n\t\t \n\t\t\t 3 \n\t\t\t 120 \n\t\t\t 2020 Sep \n\t\t \n\t \n\t FREE Full text \n\t Labrique A, Agarwal S, Tamrat T, Mehl G. WHO Digital Health Guidelines: a milestone for global health. NPJ Digit Med 2020 Sep;3:120 [FREE Full text] [doi: 10.1038/s41746-020-00330-2] [Medline: 33015373]"
    },
    {
      "title": "The effects of the health system response to the COVID-19 pandemic on chronic disease management: a narrative review",
      "authors": [
        "T Kendzerska",
        "D Zhu",
        "A Gershon",
        "J Edwards",
        "C Peixoto",
        "R Robillard"
      ],
      "year": 2021,
      "doi": "10.2147/rmhp.s293471",
      "journal": "Risk Manag Healthc Policy",
      "volume": "14",
      "raw": "The effects of the health system response to the COVID-19 pandemic on chronic disease management: a narrative review \n\t\t \n\t\t\t T Kendzerska \n\t\t \n\t\t \n\t\t\t D T Zhu \n\t\t \n\t\t \n\t\t\t A S Gershon \n\t\t \n\t\t \n\t\t\t J D Edwards \n\t\t \n\t\t \n\t\t\t C Peixoto \n\t\t \n\t\t \n\t\t\t R Robillard \n\t\t \n\t\t 10.2147/rmhp.s293471 \n\t\t Medline: 33623448 \n\t \n\t \n\t\t Risk Manag Healthc Policy \n\t\t \n\t\t\t 14 \n\t\t\t \n\t\t\t 2021 \n\t\t \n\t \n\t FREE Full text \n\t Kendzerska T, Zhu DT, Gershon AS, Edwards JD, Peixoto C, Robillard R, et al. The effects of the health system response to the COVID-19 pandemic on chronic disease management: a narrative review. Risk Manag Healthc Policy 2021;14:575-584 [FREE Full text] [doi: 10.2147/RMHP.S293471] [Medline: 33623448]"
    },
    {
      "title": "Challenges for the evaluation of digital health solutions-a call for innovative evidence generation approaches",
      "authors": [
        "C Guo",
        "H Ashrafian",
        "S Ghafur",
        "G Fontana",
        "C Gardner",
        "M Prime"
      ],
      "year": 2020,
      "doi": "10.1038/s41746-020-00314-2",
      "journal": "NPJ Digit Med",
      "volume": "3",
      "pages": "110",
      "raw": "Challenges for the evaluation of digital health solutions-a call for innovative evidence generation approaches \n\t\t \n\t\t\t C Guo \n\t\t \n\t\t \n\t\t\t H Ashrafian \n\t\t \n\t\t \n\t\t\t S Ghafur \n\t\t \n\t\t \n\t\t\t G Fontana \n\t\t \n\t\t \n\t\t\t C Gardner \n\t\t \n\t\t \n\t\t\t M Prime \n\t\t \n\t\t 10.1038/s41746-020-00314-2 \n\t\t Medline: 32904379 \n\t \n\t \n\t\t NPJ Digit Med \n\t\t \n\t\t\t 3 \n\t\t\t 110 \n\t\t\t 2020 \n\t\t \n\t \n\t FREE Full text \n\t Guo C, Ashrafian H, Ghafur S, Fontana G, Gardner C, Prime M. Challenges for the evaluation of digital health solutions-a call for innovative evidence generation approaches. NPJ Digit Med 2020;3:110 [FREE Full text] [doi: 10.1038/s41746-020-00314-2] [Medline: 32904379]"
    },
    {
      "title": "Telerehabilitation for chronic respiratory disease",
      "authors": [
        "N Cox",
        "Dal Corso",
        "S Hansen",
        "H Mcdonald",
        "C Hill",
        "C Zanaboni"
      ],
      "year": 2021,
      "doi": "10.1002/14651858.cd013040.pub2",
      "journal": "Cochrane Database Syst Rev",
      "volume": "1",
      "issue": "1",
      "pages": "13040",
      "raw": "Telerehabilitation for chronic respiratory disease \n\t\t \n\t\t\t N S Cox \n\t\t \n\t\t \n\t\t\t Dal Corso \n\t\t \n\t\t \n\t\t\t S D Hansen \n\t\t \n\t\t \n\t\t\t H Mcdonald \n\t\t \n\t\t \n\t\t\t C F Hill \n\t\t \n\t\t \n\t\t\t C J Zanaboni \n\t\t \n\t\t \n\t\t\t P \n\t\t \n\t\t 10.1002/14651858.cd013040.pub2 \n\t\t Medline: 33511633 \n\t \n\t \n\t\t Cochrane Database Syst Rev \n\t\t \n\t\t\t 1 \n\t\t\t 1 \n\t\t\t 13040 \n\t\t\t 2021 Jan 29 \n\t\t \n\t \n\t FREE Full text \n\t Cox NS, Dal Corso SD, Hansen H, McDonald CF, Hill CJ, Zanaboni P, et al. Telerehabilitation for chronic respiratory disease. Cochrane Database Syst Rev 2021 Jan 29;1(1):CD013040 [FREE Full text] [doi: 10.1002/14651858.CD013040.pub2] [Medline: 33511633]"
    },
    {
      "title": "Effectiveness of tele-rehabilitation programs in heart failure: a systematic review and meta-analysis",
      "authors": [
        "A Cavalheiro",
        "J Cardoso",
        "A Rocha",
        "E Moreira",
        "L Azevedo"
      ],
      "year": 2021,
      "doi": "10.1177/11786329211021668",
      "journal": "Health Serv Insights",
      "volume": "14",
      "pages": "11786329211021668",
      "raw": "Effectiveness of tele-rehabilitation programs in heart failure: a systematic review and meta-analysis \n\t\t \n\t\t\t A H Cavalheiro \n\t\t \n\t\t \n\t\t\t J S Cardoso \n\t\t \n\t\t \n\t\t\t A Rocha \n\t\t \n\t\t \n\t\t\t E Moreira \n\t\t \n\t\t \n\t\t\t L F Azevedo \n\t\t \n\t\t 10.1177/11786329211021668 \n\t\t Medline: 34188484 \n\t \n\t \n\t\t Health Serv Insights \n\t\t \n\t\t\t 14 \n\t\t\t 11786329211021668 \n\t\t\t 2021 Jun 15 \n\t\t \n\t \n\t FREE Full text \n\t Cavalheiro AH, Cardoso JS, Rocha A, Moreira E, Azevedo LF. Effectiveness of tele-rehabilitation programs in heart failure: a systematic review and meta-analysis. Health Serv Insights 2021 Jun 15;14:11786329211021668 [FREE Full text] [doi: 10.1177/11786329211021668] [Medline: 34188484]"
    },
    {
      "title": "Mobile phone technologies in the management of ischemic heart disease, heart failure, and hypertension: systematic review and meta-analysis",
      "authors": [
        "P Indraratna",
        "D Tardo",
        "J Yu",
        "K Delbaere",
        "M Brodie",
        "N Lovell"
      ],
      "year": 2020,
      "doi": "10.2196/16695",
      "journal": "JMIR Mhealth Uhealth",
      "volume": "8",
      "issue": "7",
      "pages": "16695",
      "raw": "Mobile phone technologies in the management of ischemic heart disease, heart failure, and hypertension: systematic review and meta-analysis \n\t\t \n\t\t\t P Indraratna \n\t\t \n\t\t \n\t\t\t D Tardo \n\t\t \n\t\t \n\t\t\t J Yu \n\t\t \n\t\t \n\t\t\t K Delbaere \n\t\t \n\t\t \n\t\t\t M Brodie \n\t\t \n\t\t \n\t\t\t N Lovell \n\t\t \n\t\t 10.2196/16695 \n\t\t Medline: 32628615 \n\t \n\t \n\t\t JMIR Mhealth Uhealth \n\t\t \n\t\t\t 8 \n\t\t\t 7 \n\t\t\t 16695 \n\t\t\t 2020 Jul 06 \n\t\t \n\t \n\t FREE Full text \n\t Indraratna P, Tardo D, Yu J, Delbaere K, Brodie M, Lovell N, et al. Mobile phone technologies in the management of ischemic heart disease, heart failure, and hypertension: systematic review and meta-analysis. JMIR Mhealth Uhealth 2020 Jul 06;8(7):e16695 [FREE Full text] [doi: 10.2196/16695] [Medline: 32628615]"
    },
    {
      "title": "A systematic review of the effects of e-health on chronically ill patients",
      "authors": [
        "Eland-De Kok",
        "P Van Os-Medendorp",
        "H Vergouwe-Meijer",
        "A Bruijnzeel-Koomen"
      ],
      "year": 2011,
      "doi": "10.1111/j.1365-2702.2011.03743.x",
      "journal": "J Clin Nurs",
      "volume": "20",
      "issue": "21-22",
      "raw": "A systematic review of the effects of e-health on chronically ill patients \n\t\t \n\t\t\t Eland-De Kok \n\t\t \n\t\t \n\t\t\t P Van Os-Medendorp \n\t\t \n\t\t \n\t\t\t H Vergouwe-Meijer \n\t\t \n\t\t \n\t\t\t A Bruijnzeel-Koomen \n\t\t \n\t\t \n\t\t\t C \n\t\t \n\t\t \n\t\t\t Ros W \n\t\t \n\t\t 10.1111/j.1365-2702.2011.03743.x \n\t\t Medline: 21707807 \n\t \n\t \n\t\t J Clin Nurs \n\t\t \n\t\t\t 20 \n\t\t\t 21-22 \n\t\t\t \n\t\t\t 2011 Nov \n\t\t \n\t \n\t Eland-de Kok P, van Os-Medendorp H, Vergouwe-Meijer A, Bruijnzeel-Koomen C, Ros W. A systematic review of the effects of e-health on chronically ill patients. J Clin Nurs 2011 Nov;20(21-22):2997-3010 [doi: 10.1111/j.1365-2702.2011.03743.x] [Medline: 21707807]"
    },
    {
      "title": "Digital telemedicine interventions for patients with multimorbidity: a systematic review and meta-analysis",
      "authors": [
        "C Kraef",
        "M Van Der Meirschen",
        "C Free"
      ],
      "year": 2020,
      "doi": "10.1136/bmjopen-2020-036904",
      "journal": "BMJ Open",
      "volume": "10",
      "issue": "10",
      "pages": "36904",
      "raw": "Digital telemedicine interventions for patients with multimorbidity: a systematic review and meta-analysis \n\t\t \n\t\t\t C Kraef \n\t\t \n\t\t \n\t\t\t M Van Der Meirschen \n\t\t \n\t\t \n\t\t\t C Free \n\t\t \n\t\t 10.1136/bmjopen-2020-036904 \n\t\t Medline: 33051232 \n\t \n\t \n\t\t BMJ Open \n\t\t \n\t\t\t 10 \n\t\t\t 10 \n\t\t\t 36904 \n\t\t\t 2020 Oct 13 \n\t\t \n\t \n\t FREE Full text \n\t Kraef C, van der Meirschen M, Free C. Digital telemedicine interventions for patients with multimorbidity: a systematic review and meta-analysis. BMJ Open 2020 Oct 13;10(10):e036904 [FREE Full text] [doi: 10.1136/bmjopen-2020-036904] [Medline: 33051232]"
    },
    {
      "title": "Web-based exercise interventions for patients with depressive and anxiety disorders: a systematic review of randomized controlled trials",
      "authors": [
        "L Carneiro",
        "S Rosenbaum",
        "P Ward",
        "F Clemente",
        "R Ramirez-Campillo",
        "Monteiro-J\u00fanior Rs"
      ],
      "year": 2022,
      "doi": "10.1590/1516-4446-2021-2026",
      "journal": "Braz J Psychiatry",
      "volume": "44",
      "issue": "3",
      "raw": "Web-based exercise interventions for patients with depressive and anxiety disorders: a systematic review of randomized controlled trials \n\t\t \n\t\t\t L Carneiro \n\t\t \n\t\t \n\t\t\t S Rosenbaum \n\t\t \n\t\t \n\t\t\t P B Ward \n\t\t \n\t\t \n\t\t\t F M Clemente \n\t\t \n\t\t \n\t\t\t R Ramirez-Campillo \n\t\t \n\t\t \n\t\t\t Monteiro-J\u00fanior Rs \n\t\t \n\t\t 10.1590/1516-4446-2021-2026 \n\t\t Medline: 34852034 \n\t \n\t \n\t\t Braz J Psychiatry \n\t\t \n\t\t\t 44 \n\t\t\t 3 \n\t\t\t \n\t\t\t 2022 \n\t\t \n\t \n\t FREE Full text \n\t Carneiro L, Rosenbaum S, Ward PB, Clemente FM, Ramirez-Campillo R, Monteiro-J\u00fanior RS, et al. Web-based exercise interventions for patients with depressive and anxiety disorders: a systematic review of randomized controlled trials. Braz J Psychiatry 2022;44(3):331-341 [FREE Full text] [doi: 10.1590/1516-4446-2021-2026] [Medline: 34852034]"
    },
    {
      "title": "Effects of technology-supported exercise programs on the knee pain, physical function, and quality of life of individuals with knee osteoarthritis and/or chronic knee pain: a systematic review and meta-analysis of randomized controlled trials",
      "authors": [
        "T Chen",
        "C Or",
        "J Chen"
      ],
      "year": 2021,
      "doi": "10.1093/jamia/ocaa282",
      "journal": "J Am Med Inform Assoc",
      "volume": "28",
      "issue": "2",
      "raw": "Effects of technology-supported exercise programs on the knee pain, physical function, and quality of life of individuals with knee osteoarthritis and/or chronic knee pain: a systematic review and meta-analysis of randomized controlled trials \n\t\t \n\t\t\t T Chen \n\t\t \n\t\t \n\t\t\t C K Or \n\t\t \n\t\t \n\t\t\t J Chen \n\t\t \n\t\t 10.1093/jamia/ocaa282 \n\t\t Medline: 33236109 \n\t \n\t \n\t\t J Am Med Inform Assoc \n\t\t \n\t\t\t 28 \n\t\t\t 2 \n\t\t\t \n\t\t\t 2021 Feb 15 \n\t\t \n\t \n\t FREE Full text \n\t Chen T, Or CK, Chen J. Effects of technology-supported exercise programs on the knee pain, physical function, and quality of life of individuals with knee osteoarthritis and/or chronic knee pain: a systematic review and meta-analysis of randomized controlled trials. J Am Med Inform Assoc 2021 Feb 15;28(2):414-423 [FREE Full text] [doi: 10.1093/jamia/ocaa282] [Medline: 33236109]"
    },
    {
      "title": "Interventions using wearable physical activity trackers among adults with cardiometabolic conditions: a systematic review and meta-analysis",
      "authors": [
        "A Hodkinson",
        "E Kontopantelis",
        "C Adeniji",
        "H Van Marwijk",
        "B Mcmillian",
        "P Bower"
      ],
      "year": 2021,
      "doi": "10.1001/jamanetworkopen.2021.16382",
      "journal": "JAMA Netw Open",
      "volume": "4",
      "issue": "7",
      "pages": "2116382",
      "raw": "Interventions using wearable physical activity trackers among adults with cardiometabolic conditions: a systematic review and meta-analysis \n\t\t \n\t\t\t A Hodkinson \n\t\t \n\t\t \n\t\t\t E Kontopantelis \n\t\t \n\t\t \n\t\t\t C Adeniji \n\t\t \n\t\t \n\t\t\t H Van Marwijk \n\t\t \n\t\t \n\t\t\t B Mcmillian \n\t\t \n\t\t \n\t\t\t P Bower \n\t\t \n\t\t 10.1001/jamanetworkopen.2021.16382 \n\t\t Medline: 34283229 \n\t \n\t \n\t\t JAMA Netw Open \n\t\t \n\t\t\t 4 \n\t\t\t 7 \n\t\t\t 2116382 \n\t\t\t 2021 Jul 01 \n\t\t \n\t \n\t FREE Full text \n\t Hodkinson A, Kontopantelis E, Adeniji C, van Marwijk H, McMillian B, Bower P, et al. Interventions using wearable physical activity trackers among adults with cardiometabolic conditions: a systematic review and meta-analysis. JAMA Netw Open 2021 Jul 01;4(7):e2116382 [FREE Full text] [doi: 10.1001/jamanetworkopen.2021.16382] [Medline: 34283229]"
    },
    {
      "title": "Smartphone applications for physical activity and sedentary behaviour change in people with cardiovascular disease: a systematic review and meta-analysis",
      "authors": [
        "K Patterson",
        "R Davey",
        "R Keegan",
        "N Freene"
      ],
      "year": 2021,
      "doi": "10.1371/journal.pone.0258460",
      "journal": "PLoS One",
      "volume": "16",
      "issue": "10",
      "pages": "258460",
      "raw": "Smartphone applications for physical activity and sedentary behaviour change in people with cardiovascular disease: a systematic review and meta-analysis \n\t\t \n\t\t\t K Patterson \n\t\t \n\t\t \n\t\t\t R Davey \n\t\t \n\t\t \n\t\t\t R Keegan \n\t\t \n\t\t \n\t\t\t N Freene \n\t\t \n\t\t 10.1371/journal.pone.0258460 \n\t\t Medline: 34634096 \n\t \n\t \n\t\t PLoS One \n\t\t \n\t\t\t 16 \n\t\t\t 10 \n\t\t\t 258460 \n\t\t\t 2021 Oct 11 \n\t\t \n\t \n\t FREE Full text \n\t Patterson K, Davey R, Keegan R, Freene N. Smartphone applications for physical activity and sedentary behaviour change in people with cardiovascular disease: a systematic review and meta-analysis. PLoS One 2021 Oct 11;16(10):e0258460 [FREE Full text] [doi: 10.1371/journal.pone.0258460] [Medline: 34634096]"
    },
    {
      "title": "Effects of telecardiac rehabilitation on coronary heart disease: a PRISMA-compliant systematic review and meta-analysis",
      "authors": [
        "Y Choo",
        "Chang Mc"
      ],
      "year": 2022,
      "doi": "10.1097/MD.0000000000029459",
      "journal": "Medicine",
      "volume": "101",
      "issue": "28",
      "pages": "e29459",
      "raw": "Effects of telecardiac rehabilitation on coronary heart disease: a PRISMA-compliant systematic review and meta-analysis \n\t\t \n\t\t\t Y J Choo \n\t\t \n\t\t \n\t\t\t Chang Mc \n\t\t \n\t\t 10.1097/MD.0000000000029459 \n\t\t Medline: 35839029 \n\t \n\t \n\t\t Medicine \n\t\t \n\t\t\t 101 \n\t\t\t 28 \n\t\t\t e29459 \n\t\t\t 2022 Jul 15 \n\t\t\t Baltimore \n\t\t \n\t \n\t FREE Full text \n\t Choo YJ, Chang MC. Effects of telecardiac rehabilitation on coronary heart disease: a PRISMA-compliant systematic review and meta-analysis. Medicine (Baltimore) 2022 Jul 15;101(28):e29459 [FREE Full text] [doi: 10.1097/MD.0000000000029459] [Medline: 35839029]"
    },
    {
      "title": "Effectiveness of exercise via telehealth for chronic disease: a systematic review and meta-analysis of exercise interventions delivered via videoconferencing",
      "authors": [
        "R Brown",
        "J Coombes",
        "K Rodriguez",
        "I Hickman",
        "S Keating"
      ],
      "year": 2022,
      "doi": "10.1136/bjsports-2021-105118",
      "journal": "Br J Sports Med",
      "volume": "56",
      "issue": "18",
      "raw": "Effectiveness of exercise via telehealth for chronic disease: a systematic review and meta-analysis of exercise interventions delivered via videoconferencing \n\t\t \n\t\t\t R C Brown \n\t\t \n\t\t \n\t\t\t J S Coombes \n\t\t \n\t\t \n\t\t\t K J Rodriguez \n\t\t \n\t\t \n\t\t\t I J Hickman \n\t\t \n\t\t \n\t\t\t S E Keating \n\t\t \n\t\t 10.1136/bjsports-2021-105118 \n\t\t Medline: 35715175 \n\t \n\t \n\t\t Br J Sports Med \n\t\t \n\t\t\t 56 \n\t\t\t 18 \n\t\t\t \n\t\t\t 2022 Jun 17 \n\t\t \n\t \n\t Brown RC, Coombes JS, Rodriguez KJ, Hickman IJ, Keating SE. Effectiveness of exercise via telehealth for chronic disease: a systematic review and meta-analysis of exercise interventions delivered via videoconferencing. Br J Sports Med 2022 Jun 17;56(18):1042-1052 [doi: 10.1136/bjsports-2021-105118] [Medline: 35715175]"
    },
    {
      "title": "How Can eHealth Improve Care for People With Multimorbidity in Europe?",
      "authors": [
        "F Barbabella",
        "M Melchiorre",
        "S Quattrini",
        "R Papa",
        "G Lamura",
        "E Richardson"
      ],
      "year": 2017,
      "doi": "10.1093/eurpub/ckv168.039",
      "raw": "F Barbabella \n\t\t \n\t\t \n\t\t\t M G Melchiorre \n\t\t \n\t\t \n\t\t\t S Quattrini \n\t\t \n\t\t \n\t\t\t R Papa \n\t\t \n\t\t \n\t\t\t G Lamura \n\t\t \n\t\t \n\t\t\t E Richardson \n\t\t \n\t\t 10.1093/eurpub/ckv168.039 \n\t\t How Can eHealth Improve Care for People With Multimorbidity in Europe? \n\t\t Copenhagen (Denmark) \n\t\t \n\t\t\t European Observatory on Health Systems and Policies \n\t\t\t 2017 \n\t\t \n\t \n\t Barbabella F, Melchiorre MG, Quattrini S, Papa R, Lamura G, Richardson E, et al, editors. How Can eHealth Improve Care for People With Multimorbidity in Europe?. Copenhagen (Denmark): European Observatory on Health Systems and Policies; 2017."
    },
    {
      "title": "The effectiveness of exercise based digital health interventions (requiring internet) in management of hip and knee osteoarthritis: a systematic review and meta-analysis",
      "authors": [
        "I Fan",
        "D Govil",
        "A Semciw"
      ],
      "year": 2022,
      "doi": "10.1016/j.joca.2022.02.540",
      "journal": "Osteoarthritis Cartilage",
      "volume": "30",
      "pages": "402",
      "raw": "The effectiveness of exercise based digital health interventions (requiring internet) in management of hip and knee osteoarthritis: a systematic review and meta-analysis \n\t\t \n\t\t\t I Fan \n\t\t \n\t\t \n\t\t\t D Govil \n\t\t \n\t\t \n\t\t\t A Semciw \n\t\t \n\t\t 10.1016/j.joca.2022.02.540 \n\t \n\t \n\t\t Osteoarthritis Cartilage \n\t\t \n\t\t\t 30 \n\t\t\t 402 \n\t\t\t 2022 Apr \n\t\t \n\t \n\t Fan I, Govil D, Semciw A. The effectiveness of exercise based digital health interventions (requiring internet) in management of hip and knee osteoarthritis: a systematic review and meta-analysis. Osteoarthritis Cartilage 2022 Apr;30:S402 [doi: 10.1016/j.joca.2022.02.540]"
    },
    {
      "title": "Multimorbidity",
      "authors": [
        "S Skou",
        "F Mair",
        "M Fortin",
        "B Guthrie",
        "B Nunes",
        "J Miranda"
      ],
      "year": 2022,
      "doi": "10.1038/s41572-022-00376-4",
      "journal": "Nat Rev Dis Primers",
      "volume": "8",
      "issue": "1",
      "pages": "48",
      "raw": "Multimorbidity \n\t\t \n\t\t\t S T Skou \n\t\t \n\t\t \n\t\t\t F S Mair \n\t\t \n\t\t \n\t\t\t M Fortin \n\t\t \n\t\t \n\t\t\t B Guthrie \n\t\t \n\t\t \n\t\t\t B P Nunes \n\t\t \n\t\t \n\t\t\t J J Miranda \n\t\t \n\t\t 10.1038/s41572-022-00376-4 \n\t\t Medline: 35835758 \n\t \n\t \n\t\t Nat Rev Dis Primers \n\t\t \n\t\t\t 8 \n\t\t\t 1 \n\t\t\t 48 \n\t\t\t 2022 Jul 14 \n\t\t \n\t \n\t FREE Full text \n\t Skou ST, Mair FS, Fortin M, Guthrie B, Nunes BP, Miranda JJ, et al. Multimorbidity. Nat Rev Dis Primers 2022 Jul 14;8(1):48 [FREE Full text] [doi: 10.1038/s41572-022-00376-4] [Medline: 35835758]"
    },
    {
      "title": "What is a serious adverse event",
      "year": 2020,
      "doi": "10.1016/j.jval.2015.03.502",
      "raw": "10.1016/j.jval.2015.03.502 \n\t\t \n\t\t What is a serious adverse event \n\t\t \n\t\t\t U.S. Food & Drug Administration \n\t\t\t 2020-05-01 \n\t\t \n\t \n\t What is a serious adverse event? U.S. Food & Drug Administration. URL: https://www.fda.gov/safety/ reporting-serious-problems-fda/what-serious-adverse-event [accessed 2020-05-01]"
    },
    {
      "title": "RoB 2: a revised tool for assessing risk of bias in randomised trials",
      "authors": [
        "J Sterne",
        "J Savovi\u0107",
        "M Page",
        "R Elbers",
        "N Blencowe",
        "I Boutron"
      ],
      "year": 2019,
      "doi": "10.1136/bmj.l4898",
      "journal": "BMJ",
      "volume": "366",
      "pages": "4898",
      "raw": "RoB 2: a revised tool for assessing risk of bias in randomised trials \n\t\t \n\t\t\t J A Sterne \n\t\t \n\t\t \n\t\t\t J Savovi\u0107 \n\t\t \n\t\t \n\t\t\t M J Page \n\t\t \n\t\t \n\t\t\t R G Elbers \n\t\t \n\t\t \n\t\t\t N S Blencowe \n\t\t \n\t\t \n\t\t\t I Boutron \n\t\t \n\t\t 10.1136/bmj.l4898 \n\t\t Medline: 31462531 \n\t \n\t \n\t\t BMJ \n\t\t \n\t\t\t 366 \n\t\t\t 4898 \n\t\t\t 2019 Aug 28 \n\t\t \n\t \n\t FREE Full text \n\t Sterne JA, Savovi\u0107 J, Page MJ, Elbers RG, Blencowe NS, Boutron I, et al. RoB 2: a revised tool for assessing risk of bias in randomised trials. BMJ 2019 Aug 28;366:l4898 [FREE Full text] [doi: 10.1136/bmj.l4898] [Medline: 31462531]"
    },
    {
      "title": "GRADE homepage",
      "year": 2020,
      "doi": "10.1017/s0009840x25000848",
      "raw": "10.1017/s0009840x25000848 \n\t\t \n\t\t GRADE homepage \n\t\t \n\t\t\t 2020-03-05 \n\t\t \n\t \n\t GRADE \n\t GRADE homepage. GRADE. URL: https://www.gradeworkinggroup.org/ [accessed 2020-03-05]"
    },
    {
      "title": "Statistical Power Analysis for the Behavioral Sciences",
      "authors": [
        "J Cohen"
      ],
      "year": 1988,
      "doi": "10.4324/9780203771587",
      "raw": "Statistical Power Analysis for the Behavioral Sciences \n\t\t \n\t\t\t J Cohen \n\t\t \n\t\t 10.4324/9780203771587 \n\t\t \n\t\t\t 1988 \n\t\t\t Routledge \n\t\t\t New York, NY \n\t\t \n\t \n\t Cohen J. Statistical Power Analysis for the Behavioral Sciences. New York, NY: Routledge; 1988."
    },
    {
      "title": "What is e-health?",
      "authors": [
        "G Eysenbach"
      ],
      "year": 2001,
      "doi": "10.2196/jmir.3.2.e20",
      "journal": "J Med Internet Res",
      "volume": "3",
      "issue": "2",
      "raw": "What is e-health? \n\t\t \n\t\t\t G Eysenbach \n\t\t \n\t\t 10.2196/jmir.3.2.e20 \n\t\t Medline: 11720962 \n\t \n\t \n\t\t J Med Internet Res \n\t\t \n\t\t\t 3 \n\t\t\t 2 \n\t\t\t 2001 Apr \n\t\t \n\t \n\t FREE Full text \n\t Eysenbach G. What is e-health? J Med Internet Res 2001 Apr;3(2):E20 [FREE Full text] [doi: 10.2196/jmir.3.2.e20] [Medline: 11720962]"
    },
    {
      "title": "How can health systems respond to population ageing? World Health Organization",
      "authors": [
        "B Rechel",
        "Y Doyle",
        "E Grundy",
        "M Mckee"
      ],
      "year": 2023,
      "raw": "How can health systems respond to population ageing? World Health Organization \n\t\t \n\t\t\t B Rechel \n\t\t \n\t\t \n\t\t\t Y Doyle \n\t\t \n\t\t \n\t\t\t E Grundy \n\t\t \n\t\t \n\t\t\t M Mckee \n\t\t \n\t\t \n\t\t \n\t\t\t 2023-06-11 \n\t\t \n\t \n\t Rechel B, Doyle Y, Grundy E, McKee M. How can health systems respond to population ageing? World Health Organization. URL: https://apps.who.int/iris/bitstream/handle/10665/107941/Policy-brief-10-1997-8073-eng.pdf?sequence=9&isAllowed=y [accessed 2023-06-11]"
    },
    {
      "title": "eHealth: Current Evidence, Promises, Perils and Future Directions",
      "authors": [
        "T Hale",
        "W Chou",
        "S Cotten",
        "A Khilnani"
      ],
      "year": 2018,
      "volume": "15",
      "raw": "eHealth: Current Evidence, Promises, Perils and Future Directions \n\t\t \n\t\t\t T M Hale \n\t\t \n\t\t \n\t\t\t W Y Chou \n\t\t \n\t\t \n\t\t\t S R Cotten \n\t\t \n\t\t \n\t\t\t A Khilnani \n\t\t \n\t\t \n\t\t\t 2018 \n\t\t\t Emerald Publishing \n\t\t\t 15 \n\t\t\t West Yorkshire, UK \n\t\t \n\t \n\t Hale TM, Chou WY, Cotten SR, Khilnani A. eHealth: Current Evidence, Promises, Perils and Future Directions. Volume 15. West Yorkshire, UK: Emerald Publishing; 2018."
    },
    {
      "title": "Long-term functioning and well-being outcomes associated with physical activity and exercise in patients with chronic conditions in the medical outcomes study",
      "authors": [
        "A Stewart",
        "R Hays",
        "K Wells",
        "W Rogers",
        "K Spritzer",
        "S Greenfield"
      ],
      "year": 1994,
      "doi": "10.1016/0895-4356(94)90169-4",
      "journal": "J Clin Epidemiol",
      "volume": "47",
      "issue": "7",
      "raw": "Long-term functioning and well-being outcomes associated with physical activity and exercise in patients with chronic conditions in the medical outcomes study \n\t\t \n\t\t\t A L Stewart \n\t\t \n\t\t \n\t\t\t R D Hays \n\t\t \n\t\t \n\t\t\t K B Wells \n\t\t \n\t\t \n\t\t\t W H Rogers \n\t\t \n\t\t \n\t\t\t K L Spritzer \n\t\t \n\t\t \n\t\t\t S Greenfield \n\t\t \n\t\t 10.1016/0895-4356(94)90169-4 \n\t\t Medline: 7722585 \n\t \n\t \n\t\t J Clin Epidemiol \n\t\t \n\t\t\t 47 \n\t\t\t 7 \n\t\t\t \n\t\t\t 1994 Jul \n\t\t \n\t \n\t Stewart AL, Hays RD, Wells KB, Rogers WH, Spritzer KL, Greenfield S. Long-term functioning and well-being outcomes associated with physical activity and exercise in patients with chronic conditions in the medical outcomes study. J Clin Epidemiol 1994 Jul;47(7):719-730 [doi: 10.1016/0895-4356(94)90169-4] [Medline: 7722585]"
    },
    {
      "title": "A review of eHealth interventions for physical activity and dietary behavior change",
      "authors": [
        "G Norman",
        "M Zabinski",
        "M Adams",
        "D Rosenberg",
        "A Yaroch",
        "A Atienza"
      ],
      "year": 2007,
      "doi": "10.1016/j.amepre.2007.05.007",
      "journal": "Am J Prev Med",
      "volume": "33",
      "issue": "4",
      "raw": "A review of eHealth interventions for physical activity and dietary behavior change \n\t\t \n\t\t\t G J Norman \n\t\t \n\t\t \n\t\t\t M F Zabinski \n\t\t \n\t\t \n\t\t\t M A Adams \n\t\t \n\t\t \n\t\t\t D E Rosenberg \n\t\t \n\t\t \n\t\t\t A L Yaroch \n\t\t \n\t\t \n\t\t\t A A Atienza \n\t\t \n\t\t 10.1016/j.amepre.2007.05.007 \n\t\t Medline: 17888860 \n\t \n\t \n\t\t Am J Prev Med \n\t\t \n\t\t\t 33 \n\t\t\t 4 \n\t\t\t \n\t\t\t 2007 Oct \n\t\t \n\t \n\t FREE Full text \n\t Norman GJ, Zabinski MF, Adams MA, Rosenberg DE, Yaroch AL, Atienza AA. A review of eHealth interventions for physical activity and dietary behavior change. Am J Prev Med 2007 Oct;33(4):336-345 [FREE Full text] [doi: 10.1016/j.amepre.2007.05.007] [Medline: 17888860]"
    },
    {
      "title": "Taking the pulse of eHealth in the EU",
      "authors": [
        "F Sforzolini"
      ],
      "year": 2017,
      "raw": "Taking the pulse of eHealth in the EU \n\t\t \n\t\t\t F S Sforzolini \n\t\t \n\t\t \n\t\t \n\t\t\t 2017. 2023-06-14 \n\t\t\t European Union \n\t\t \n\t \n\t Sforzolini FS. Taking the pulse of eHealth in the EU. European Union. 2017. URL: https://digital-strategy.ec.europa.eu/ en/library/taking-pulse-ehealth-eu-study-and-round-table-discussion [accessed 2023-06-14]"
    },
    {
      "title": "Physical activity and exercise therapy benefit more than just symptoms and impairments in people with hip and knee osteoarthritis",
      "authors": [
        "S Skou",
        "B Pedersen",
        "J Abbott",
        "B Patterson",
        "C Barton"
      ],
      "year": 2018,
      "doi": "10.2519/jospt.2018.7877",
      "journal": "J Orthop Sports Phys Ther",
      "volume": "48",
      "issue": "6",
      "raw": "Physical activity and exercise therapy benefit more than just symptoms and impairments in people with hip and knee osteoarthritis \n\t\t \n\t\t\t S T Skou \n\t\t \n\t\t \n\t\t\t B K Pedersen \n\t\t \n\t\t \n\t\t\t J H Abbott \n\t\t \n\t\t \n\t\t\t B Patterson \n\t\t \n\t\t \n\t\t\t C Barton \n\t\t \n\t\t 10.2519/jospt.2018.7877 \n\t\t Medline: 29669488 \n\t \n\t \n\t\t J Orthop Sports Phys Ther \n\t\t \n\t\t\t 48 \n\t\t\t 6 \n\t\t\t \n\t\t\t 2018 Jun \n\t\t \n\t \n\t Skou ST, Pedersen BK, Abbott JH, Patterson B, Barton C. Physical activity and exercise therapy benefit more than just symptoms and impairments in people with hip and knee osteoarthritis. J Orthop Sports Phys Ther 2018 Jun;48(6):439-447 [doi: 10.2519/jospt.2018.7877] [Medline: 29669488]"
    },
    {
      "title": "Global Burden of Disease Study 2013 Collaborators. Global, regional, and national incidence, prevalence, and years lived with disability for 301 acute and chronic diseases and injuries in 188 countries, 1990-2013: a systematic analysis for the global burden of disease study 2013",
      "year": 2015,
      "doi": "10.1016/s0140-6736(15)60692-4",
      "journal": "Lancet",
      "volume": "386",
      "raw": "Global Burden of Disease Study 2013 Collaborators. Global, regional, and national incidence, prevalence, and years lived with disability for 301 acute and chronic diseases and injuries in 188 countries, 1990-2013: a systematic analysis for the global burden of disease study 2013 \n\t\t 10.1016/s0140-6736(15)60692-4 \n\t\t Medline: 26063472 \n\t \n\t \n\t\t Lancet \n\t\t \n\t\t\t 386 \n\t\t\t \n\t\t\t 2015 Aug 22. 9995 \n\t\t \n\t \n\t FREE Full text \n\t Global Burden of Disease Study 2013 Collaborators. Global, regional, and national incidence, prevalence, and years lived with disability for 301 acute and chronic diseases and injuries in 188 countries, 1990-2013: a systematic analysis for the global burden of disease study 2013. Lancet 2015 Aug 22;386(9995):743-800 [FREE Full text] [doi: 10.1016/S0140-6736(15)60692-4] [Medline: 26063472]"
    },
    {
      "title": "Evidence on multimorbidity from definition to intervention: an overview of systematic reviews",
      "authors": [
        "X Xu",
        "G Mishra",
        "M Jones"
      ],
      "year": 2017,
      "doi": "10.1016/j.arr.2017.05.003",
      "journal": "Ageing Res Rev",
      "volume": "37",
      "raw": "Evidence on multimorbidity from definition to intervention: an overview of systematic reviews \n\t\t \n\t\t\t X Xu \n\t\t \n\t\t \n\t\t\t G D Mishra \n\t\t \n\t\t \n\t\t\t M Jones \n\t\t \n\t\t 10.1016/j.arr.2017.05.003 \n\t\t Medline: 28511964 \n\t \n\t \n\t\t Ageing Res Rev \n\t\t \n\t\t\t 37 \n\t\t\t \n\t\t\t 2017 Aug \n\t\t \n\t \n\t Xu X, Mishra GD, Jones M. Evidence on multimorbidity from definition to intervention: an overview of systematic reviews. Ageing Res Rev 2017 Aug;37:53-68 [doi: 10.1016/j.arr.2017.05.003] [Medline: 28511964]"
    },
    {
      "title": "A core outcome set for multimorbidity research (COSmm)",
      "authors": [
        "S Smith",
        "E Wallace",
        "C Salisbury",
        "M Sasseville",
        "E Bayliss",
        "M Fortin"
      ],
      "year": 2018,
      "doi": "10.1370/afm.2178",
      "journal": "Ann Fam Med",
      "volume": "16",
      "issue": "2",
      "raw": "A core outcome set for multimorbidity research (COSmm) \n\t\t \n\t\t\t S M Smith \n\t\t \n\t\t \n\t\t\t E Wallace \n\t\t \n\t\t \n\t\t\t C Salisbury \n\t\t \n\t\t \n\t\t\t M Sasseville \n\t\t \n\t\t \n\t\t\t E Bayliss \n\t\t \n\t\t \n\t\t\t M Fortin \n\t\t \n\t\t 10.1370/afm.2178 \n\t\t Medline: 29531104 \n\t \n\t \n\t\t Ann Fam Med \n\t\t \n\t\t\t 16 \n\t\t\t 2 \n\t\t\t \n\t\t\t 2018 Mar \n\t\t \n\t \n\t FREE Full text \n\t Smith SM, Wallace E, Salisbury C, Sasseville M, Bayliss E, Fortin M. A core outcome set for multimorbidity research (COSmm). Ann Fam Med 2018 Mar;16(2):132-138 [FREE Full text] [doi: 10.1370/afm.2178] [Medline: 29531104]"
    },
    {
      "title": "Multimorbidity: a priority for global health research",
      "year": 2018,
      "doi": "10.1109/glocom.2005.1578208",
      "raw": "Multimorbidity: a priority for global health research \n\t\t 10.1109/glocom.2005.1578208 \n\t\t \n\t\t \n\t\t\t 2018. 2019-01-05 \n\t\t\t The Academy of Medical Sciences \n\t\t \n\t \n\t Multimorbidity: a priority for global health research. The Academy of Medical Sciences. 2018. URL: https://acmedsci. ac.uk/file-download/82222577 [accessed 2019-01-05]"
    },
    {
      "title": "Cochrane handbook for systematic reviews of interventions version 6.0",
      "authors": [
        "J Higgins",
        "J Thomas",
        "J Chandler",
        "M Cumpston",
        "T Li",
        "M Page"
      ],
      "year": 2019,
      "doi": "10.1002/9781119536604",
      "raw": "Cochrane handbook for systematic reviews of interventions version 6.0 \n\t\t \n\t\t\t J Higgins \n\t\t \n\t\t \n\t\t\t J Thomas \n\t\t \n\t\t \n\t\t\t J Chandler \n\t\t \n\t\t \n\t\t\t M Cumpston \n\t\t \n\t\t \n\t\t\t T Li \n\t\t \n\t\t \n\t\t\t M Page \n\t\t \n\t\t 10.1002/9781119536604 \n\t\t \n\t\t \n\t\t\t 2019. 2023-06-14 \n\t\t\t Cochrane \n\t\t \n\t \n\t Higgins J, Thomas J, Chandler J, Cumpston M, Li T, Page M, et al. Cochrane handbook for systematic reviews of interventions version 6.0. Cochrane. 2019. URL: https://www.training.cochrane.org/handbook [accessed 2023-06-14]"
    },
    {
      "title": "Cochrane Handbook for Systematic Reviews of Interventions version 6.3",
      "authors": [
        "J Higgins",
        "J Thomas",
        "J Chandler",
        "M Cumpston",
        "T Li",
        "M Page"
      ],
      "year": 2022,
      "raw": "Cochrane Handbook for Systematic Reviews of Interventions version 6.3 \n\t\t \n\t\t\t J P Higgins \n\t\t \n\t\t \n\t\t\t J Thomas \n\t\t \n\t\t \n\t\t\t J Chandler \n\t\t \n\t\t \n\t\t\t M Cumpston \n\t\t \n\t\t \n\t\t\t T Li \n\t\t \n\t\t \n\t\t\t M J Page \n\t\t \n\t\t \n\t\t\t February 2022. 2022 \n\t\t\t Wiley \n\t\t\t Hoboken, New Jersey \n\t\t \n\t \n\t Higgins JP, Thomas J, Chandler J, Cumpston M, Li T, Page MJ, et al, editors. Cochrane Handbook for Systematic Reviews of Interventions version 6.3 (updated February 2022). Hoboken, New Jersey: Wiley; 2022."
    },
    {
      "title": "The PRISMA 2020 statement: an updated guideline for reporting systematic reviews",
      "authors": [
        "M Page",
        "J Mckenzie",
        "P Bossuyt",
        "I Boutron",
        "T Hoffmann",
        "C Mulrow"
      ],
      "year": 2021,
      "doi": "10.1136/bmj.n71",
      "journal": "BMJ",
      "volume": "372",
      "issue": "71",
      "raw": "The PRISMA 2020 statement: an updated guideline for reporting systematic reviews \n\t\t \n\t\t\t M J Page \n\t\t \n\t\t \n\t\t\t J E Mckenzie \n\t\t \n\t\t \n\t\t\t P M Bossuyt \n\t\t \n\t\t \n\t\t\t I Boutron \n\t\t \n\t\t \n\t\t\t T C Hoffmann \n\t\t \n\t\t \n\t\t\t C D Mulrow \n\t\t \n\t\t 10.1136/bmj.n71 \n\t\t Medline: 33782057 \n\t \n\t \n\t\t BMJ \n\t\t \n\t\t\t 372 \n\t\t\t 71 \n\t\t\t 2021 Mar 29 \n\t\t \n\t \n\t FREE Full text \n\t Page MJ, McKenzie JE, Bossuyt PM, Boutron I, Hoffmann TC, Mulrow CD, et al. The PRISMA 2020 statement: an updated guideline for reporting systematic reviews. BMJ 2021 Mar 29;372:n71 [FREE Full text] [doi: 10.1136/bmj.n71] [Medline: 33782057]"
    },
    {
      "title": "What is digital health? Review of definitions",
      "authors": [
        "F Fatehi",
        "M Samadbeik",
        "A Kazemi"
      ],
      "year": 2020,
      "doi": "10.3233/shti200696",
      "journal": "Stud Health Technol Inform",
      "volume": "275",
      "raw": "What is digital health? Review of definitions \n\t\t \n\t\t\t F Fatehi \n\t\t \n\t\t \n\t\t\t M Samadbeik \n\t\t \n\t\t \n\t\t\t A Kazemi \n\t\t \n\t\t 10.3233/shti200696 \n\t\t Medline: 33227742 \n\t \n\t \n\t\t Stud Health Technol Inform \n\t\t \n\t\t\t 275 \n\t\t\t \n\t\t\t 2020 Nov 23 \n\t\t \n\t \n\t Fatehi F, Samadbeik M, Kazemi A. What is digital health? Review of definitions. Stud Health Technol Inform 2020 Nov 23;275:67-71 [doi: 10.3233/SHTI200696] [Medline: 33227742]"
    },
    {
      "title": "The anti-inflammatory effects of exercise: mechanisms and implications for the prevention and treatment of disease",
      "authors": [
        "M Gleeson",
        "N Bishop",
        "D Stensel",
        "M Lindley",
        "S Mastana",
        "M Nimmo"
      ],
      "year": 2011,
      "doi": "10.1038/nri3041",
      "journal": "Nat Rev Immunol",
      "volume": "11",
      "issue": "9",
      "raw": "The anti-inflammatory effects of exercise: mechanisms and implications for the prevention and treatment of disease \n\t\t \n\t\t\t M Gleeson \n\t\t \n\t\t \n\t\t\t N C Bishop \n\t\t \n\t\t \n\t\t\t D J Stensel \n\t\t \n\t\t \n\t\t\t M R Lindley \n\t\t \n\t\t \n\t\t\t S S Mastana \n\t\t \n\t\t \n\t\t\t M A Nimmo \n\t\t \n\t\t 10.1038/nri3041 \n\t\t Medline: 21818123 \n\t \n\t \n\t\t Nat Rev Immunol \n\t\t \n\t\t\t 11 \n\t\t\t 9 \n\t\t\t \n\t\t\t 2011 Aug 05 \n\t\t \n\t \n\t Gleeson M, Bishop NC, Stensel DJ, Lindley MR, Mastana SS, Nimmo MA. The anti-inflammatory effects of exercise: mechanisms and implications for the prevention and treatment of disease. Nat Rev Immunol 2011 Aug 05;11(9):607-615 [doi: 10.1038/nri3041] [Medline: 21818123]"
    },
    {
      "title": "Effect of in-person delivered behavioural interventions in people with multimorbidity: systematic review and meta-analysis",
      "authors": [
        "A Bricca",
        "M J\u00e4ger",
        "M Johnston",
        "G Zangger",
        "L Harris",
        "J Midtgaard"
      ],
      "year": 2023,
      "doi": "10.1007/s12529-022-10092-8",
      "journal": "Int J Behav Med",
      "volume": "30",
      "issue": "2",
      "raw": "Effect of in-person delivered behavioural interventions in people with multimorbidity: systematic review and meta-analysis \n\t\t \n\t\t\t A Bricca \n\t\t \n\t\t \n\t\t\t M J\u00e4ger \n\t\t \n\t\t \n\t\t\t M Johnston \n\t\t \n\t\t \n\t\t\t G Zangger \n\t\t \n\t\t \n\t\t\t L K Harris \n\t\t \n\t\t \n\t\t\t J Midtgaard \n\t\t \n\t\t 10.1007/s12529-022-10092-8 \n\t\t Medline: 35484462 \n\t \n\t \n\t\t Int J Behav Med \n\t\t \n\t\t\t 30 \n\t\t\t 2 \n\t\t\t \n\t\t\t 2023 Apr \n\t\t \n\t \n\t FREE Full text \n\t Bricca A, J\u00e4ger M, Johnston M, Zangger G, Harris LK, Midtgaard J, et al. Effect of in-person delivered behavioural interventions in people with multimorbidity: systematic review and meta-analysis. Int J Behav Med 2023 Apr;30(2):167-189 [FREE Full text] [doi: 10.1007/s12529-022-10092-8] [Medline: 35484462]"
    },
    {
      "title": "Telerehabilitation for chronic respiratory disease",
      "authors": [
        "N Cox",
        "C Mcdonald",
        "C Hill",
        "O 'halloran",
        "P Alison",
        "J Zanaboni"
      ],
      "year": 2018,
      "doi": "10.1002/14651858.cd013040",
      "journal": "Cochrane Database Systematic Rev",
      "issue": "6",
      "raw": "Telerehabilitation for chronic respiratory disease \n\t\t \n\t\t\t N S Cox \n\t\t \n\t\t \n\t\t\t C F Mcdonald \n\t\t \n\t\t \n\t\t\t C J Hill \n\t\t \n\t\t \n\t\t\t O 'halloran \n\t\t \n\t\t \n\t\t\t P Alison \n\t\t \n\t\t \n\t\t\t J A Zanaboni \n\t\t \n\t\t \n\t\t\t P \n\t\t \n\t\t 10.1002/14651858.cd013040 \n\t \n\t \n\t\t Cochrane Database Systematic Rev \n\t\t \n\t\t\t 6 \n\t\t\t 2018 \n\t\t \n\t \n\t Cox NS, McDonald CF, Hill CJ, O'Halloran P, Alison JA, Zanaboni P, et al. Telerehabilitation for chronic respiratory disease. Cochrane Database Systematic Rev 2018(6) [doi: 10.1002/14651858.CD013040]"
    },
    {
      "title": "ISSG Search Filters Resource",
      "year": 2022,
      "doi": "10.1111/hir.12252",
      "raw": "ISSG Search Filters Resource \n\t\t 10.1111/hir.12252 \n\t\t \n\t \n\t \n\t\t EMBASE RCT filter \n\t\t \n\t\t\t 2022-06-22 \n\t\t \n\t \n\t EMBASE RCT filter. ISSG Search Filters Resource. URL: https://sites.google.com/a/york.ac.uk/issg-search-filters-resource/ home/rcts/embase-rct-filter [accessed 2022-06-22]"
    },
    {
      "title": "Measuring inconsistency in meta-analyses",
      "authors": [
        "J Higgins",
        "S Thompson",
        "J Deeks",
        "D Altman"
      ],
      "year": 2003,
      "doi": "10.1136/bmj.327.7414.557",
      "journal": "BMJ",
      "volume": "327",
      "issue": "7414",
      "raw": "Measuring inconsistency in meta-analyses \n\t\t \n\t\t\t J P Higgins \n\t\t \n\t\t \n\t\t\t S G Thompson \n\t\t \n\t\t \n\t\t\t J J Deeks \n\t\t \n\t\t \n\t\t\t D G Altman \n\t\t \n\t\t 10.1136/bmj.327.7414.557 \n\t\t Medline: 12958120 \n\t \n\t \n\t\t BMJ \n\t\t \n\t\t\t 327 \n\t\t\t 7414 \n\t\t\t \n\t\t\t 2003 Sep 06 \n\t\t \n\t \n\t FREE Full text \n\t Higgins JP, Thompson SG, Deeks JJ, Altman DG. Measuring inconsistency in meta-analyses. BMJ 2003 Sep 06;327(7414):557-560 [FREE Full text] [doi: 10.1136/bmj.327.7414.557] [Medline: 12958120]"
    },
    {
      "title": "Text to move: a randomized controlled trial of a text-messaging program to improve physical activity behaviors in patients with type 2 diabetes mellitus",
      "authors": [
        "S Agboola",
        "K Jethwani",
        "L Lopez",
        "M Searl",
        "O' Keefe",
        "S Kvedar"
      ],
      "year": 2016,
      "doi": "10.2196/jmir.6439",
      "journal": "J Med Internet Res",
      "volume": "18",
      "issue": "11",
      "pages": "307",
      "raw": "Text to move: a randomized controlled trial of a text-messaging program to improve physical activity behaviors in patients with type 2 diabetes mellitus \n\t\t \n\t\t\t S Agboola \n\t\t \n\t\t \n\t\t\t K Jethwani \n\t\t \n\t\t \n\t\t\t L Lopez \n\t\t \n\t\t \n\t\t\t M Searl \n\t\t \n\t\t \n\t\t\t O' Keefe \n\t\t \n\t\t \n\t\t\t S Kvedar \n\t\t \n\t\t \n\t\t\t J \n\t\t \n\t\t 10.2196/jmir.6439 \n\t\t Medline: 27864165 \n\t \n\t \n\t\t J Med Internet Res \n\t\t \n\t\t\t 18 \n\t\t\t 11 \n\t\t\t 307 \n\t\t\t 2016 Nov 18 \n\t\t \n\t \n\t FREE Full text \n\t Agboola S, Jethwani K, Lopez L, Searl M, O'Keefe S, Kvedar J. Text to move: a randomized controlled trial of a text-messaging program to improve physical activity behaviors in patients with type 2 diabetes mellitus. J Med Internet Res 2016 Nov 18;18(11):e307 [FREE Full text] [doi: 10.2196/jmir.6439] [Medline: 27864165]"
    },
    {
      "title": "Physical therapy vs internet-based exercise training for patients with knee osteoarthritis: results of a randomized controlled trial",
      "authors": [
        "K Allen",
        "L Arbeeva",
        "L Callahan",
        "Y Golightly",
        "A Goode",
        "B Heiderscheit"
      ],
      "year": 2018,
      "doi": "10.1016/j.joca.2017.12.008",
      "journal": "Osteoarthritis Cartilage",
      "volume": "26",
      "issue": "3",
      "raw": "Physical therapy vs internet-based exercise training for patients with knee osteoarthritis: results of a randomized controlled trial \n\t\t \n\t\t\t K D Allen \n\t\t \n\t\t \n\t\t\t L Arbeeva \n\t\t \n\t\t \n\t\t\t L F Callahan \n\t\t \n\t\t \n\t\t\t Y M Golightly \n\t\t \n\t\t \n\t\t\t A P Goode \n\t\t \n\t\t \n\t\t\t B C Heiderscheit \n\t\t \n\t\t 10.1016/j.joca.2017.12.008 \n\t\t Medline: 29307722 \n\t \n\t \n\t\t Osteoarthritis Cartilage \n\t\t \n\t\t\t 26 \n\t\t\t 3 \n\t\t\t \n\t\t\t 2018 Mar \n\t\t \n\t \n\t FREE Full text \n\t Allen KD, Arbeeva L, Callahan LF, Golightly YM, Goode AP, Heiderscheit BC, et al. Physical therapy vs internet-based exercise training for patients with knee osteoarthritis: results of a randomized controlled trial. Osteoarthritis Cartilage 2018 Mar;26(3):383-396 [FREE Full text] [doi: 10.1016/j.joca.2017.12.008] [Medline: 29307722]"
    },
    {
      "title": "Stepped exercise program for patients with knee osteoarthritis",
      "authors": [
        "K Allen",
        "S Woolson",
        "H Hoenig",
        "D Bongiorni",
        "J Byrd",
        "K Caves"
      ],
      "year": 2021,
      "doi": "10.7326/m20-4447",
      "journal": "Ann Intern Med",
      "volume": "174",
      "issue": "3",
      "raw": "Stepped exercise program for patients with knee osteoarthritis \n\t\t \n\t\t\t K D Allen \n\t\t \n\t\t \n\t\t\t S Woolson \n\t\t \n\t\t \n\t\t\t H M Hoenig \n\t\t \n\t\t \n\t\t\t D Bongiorni \n\t\t \n\t\t \n\t\t\t J Byrd \n\t\t \n\t\t \n\t\t\t K Caves \n\t\t \n\t\t 10.7326/m20-4447 \n\t \n\t \n\t\t Ann Intern Med \n\t\t \n\t\t\t 174 \n\t\t\t 3 \n\t\t\t \n\t\t\t 2021 Mar \n\t\t \n\t \n\t Allen KD, Woolson S, Hoenig HM, Bongiorni D, Byrd J, Caves K, et al. Stepped exercise program for patients with knee osteoarthritis. Ann Intern Med 2021 Mar;174(3):298-307 [doi: 10.7326/m20-4447]"
    },
    {
      "title": "Managing the space between visits: a randomized trial of disease management for diabetes in a community health center",
      "authors": [
        "D Anderson",
        "J Christison-Lagay",
        "V Villagra",
        "H Liu",
        "J Dziura"
      ],
      "year": 2010,
      "doi": "10.1007/s11606-010-1419-5",
      "journal": "J Gen Intern Med",
      "volume": "25",
      "issue": "10",
      "raw": "Managing the space between visits: a randomized trial of disease management for diabetes in a community health center \n\t\t \n\t\t\t D R Anderson \n\t\t \n\t\t \n\t\t\t J Christison-Lagay \n\t\t \n\t\t \n\t\t\t V Villagra \n\t\t \n\t\t \n\t\t\t H Liu \n\t\t \n\t\t \n\t\t\t J Dziura \n\t\t \n\t\t 10.1007/s11606-010-1419-5 \n\t\t Medline: 20556536 \n\t \n\t \n\t\t J Gen Intern Med \n\t\t \n\t\t\t 25 \n\t\t\t 10 \n\t\t\t \n\t\t\t 2010 Oct 16 \n\t\t \n\t \n\t FREE Full text \n\t Anderson DR, Christison-Lagay J, Villagra V, Liu H, Dziura J. Managing the space between visits: a randomized trial of disease management for diabetes in a community health center. J Gen Intern Med 2010 Oct 16;25(10):1116-1122 [FREE Full text] [doi: 10.1007/s11606-010-1419-5] [Medline: 20556536]"
    },
    {
      "title": "Efficacy of computer-based telephone counseling on long-term adherence to strength training in elderly patients with knee osteoarthritis: a randomized trial",
      "authors": [
        "K Baker",
        "M Lavalley",
        "C Brown",
        "D Felson",
        "A Ledingham",
        "J Keysor"
      ],
      "year": 2020,
      "doi": "10.1002/acr.23921",
      "journal": "Arthritis Care Res",
      "volume": "72",
      "issue": "7",
      "raw": "Efficacy of computer-based telephone counseling on long-term adherence to strength training in elderly patients with knee osteoarthritis: a randomized trial \n\t\t \n\t\t\t K Baker \n\t\t \n\t\t \n\t\t\t M P Lavalley \n\t\t \n\t\t \n\t\t\t C Brown \n\t\t \n\t\t \n\t\t\t D T Felson \n\t\t \n\t\t \n\t\t\t A Ledingham \n\t\t \n\t\t \n\t\t\t J J Keysor \n\t\t \n\t\t 10.1002/acr.23921 \n\t\t Medline: 31074576 \n\t \n\t \n\t\t Arthritis Care Res \n\t\t \n\t\t\t 72 \n\t\t\t 7 \n\t\t\t \n\t\t\t 2020 Jul \n\t\t\t Hoboken \n\t\t \n\t \n\t Baker K, LaValley MP, Brown C, Felson DT, Ledingham A, Keysor JJ. Efficacy of computer-based telephone counseling on long-term adherence to strength training in elderly patients with knee osteoarthritis: a randomized trial. Arthritis Care Res (Hoboken) 2020 Jul;72(7):982-990 [doi: 10.1002/acr.23921] [Medline: 31074576]"
    },
    {
      "title": "A feasible and efficacious mobile-phone based lifestyle intervention for Filipino Americans with type 2 diabetes: randomized controlled trial",
      "authors": [
        "M Bender",
        "B Cooper",
        "L Park",
        "S Padash",
        "S Arai"
      ],
      "year": 2017,
      "doi": "10.2196/diabetes.8156",
      "journal": "JMIR Diabetes",
      "volume": "2",
      "issue": "2",
      "raw": "A feasible and efficacious mobile-phone based lifestyle intervention for Filipino Americans with type 2 diabetes: randomized controlled trial \n\t\t \n\t\t\t M S Bender \n\t\t \n\t\t \n\t\t\t B A Cooper \n\t\t \n\t\t \n\t\t\t L G Park \n\t\t \n\t\t \n\t\t\t S Padash \n\t\t \n\t\t \n\t\t\t S Arai \n\t\t \n\t\t 10.2196/diabetes.8156 \n\t\t Medline: 30291068 \n\t \n\t \n\t\t JMIR Diabetes \n\t\t \n\t\t\t 2 \n\t\t\t 2 \n\t\t\t 2017 Dec 12 \n\t\t \n\t \n\t FREE Full text \n\t Bender MS, Cooper BA, Park LG, Padash S, Arai S. A feasible and efficacious mobile-phone based lifestyle intervention for Filipino Americans with type 2 diabetes: randomized controlled trial. JMIR Diabetes 2017 Dec 12;2(2):e30 [FREE Full text] [doi: 10.2196/diabetes.8156] [Medline: 30291068]"
    },
    {
      "title": "Impact of ENHANCED (diEtitiaNs Helping pAtieNts CarE for Diabetes) telemedicine randomized controlled trial on diabetes optimal care outcomes in patients with type 2 diabetes",
      "authors": [
        "G Benson",
        "A Sidebottom",
        "J Hayes",
        "M Miedema",
        "J Boucher",
        "M Vacquier"
      ],
      "year": 2019,
      "doi": "10.1016/j.jand.2018.11.013",
      "journal": "J Acad Nutr Diet",
      "volume": "119",
      "issue": "4",
      "raw": "Impact of ENHANCED (diEtitiaNs Helping pAtieNts CarE for Diabetes) telemedicine randomized controlled trial on diabetes optimal care outcomes in patients with type 2 diabetes \n\t\t \n\t\t\t G A Benson \n\t\t \n\t\t \n\t\t\t A Sidebottom \n\t\t \n\t\t \n\t\t\t J Hayes \n\t\t \n\t\t \n\t\t\t M D Miedema \n\t\t \n\t\t \n\t\t\t J Boucher \n\t\t \n\t\t \n\t\t\t M Vacquier \n\t\t \n\t\t 10.1016/j.jand.2018.11.013 \n\t\t Medline: 30711463 \n\t \n\t \n\t\t J Acad Nutr Diet \n\t\t \n\t\t\t 119 \n\t\t\t 4 \n\t\t\t \n\t\t\t 2019 Apr \n\t\t \n\t \n\t Benson GA, Sidebottom A, Hayes J, Miedema MD, Boucher J, Vacquier M, et al. Impact of ENHANCED (diEtitiaNs Helping pAtieNts CarE for Diabetes) telemedicine randomized controlled trial on diabetes optimal care outcomes in patients with type 2 diabetes. J Acad Nutr Diet 2019 Apr;119(4):585-598 [doi: 10.1016/j.jand.2018.11.013] [Medline: 30711463]"
    },
    {
      "title": "Feasibility of a health coaching and home-based rehabilitation intervention with remote monitoring for COPD",
      "authors": [
        "R Benzo",
        "J Ridgeway",
        "J Hoult",
        "P Novotny",
        "B Thomas",
        "N Lam"
      ],
      "year": 2021,
      "doi": "10.4187/respcare.08580",
      "journal": "Respir Care",
      "volume": "66",
      "issue": "6",
      "raw": "Feasibility of a health coaching and home-based rehabilitation intervention with remote monitoring for COPD \n\t\t \n\t\t\t R P Benzo \n\t\t \n\t\t \n\t\t\t J Ridgeway \n\t\t \n\t\t \n\t\t\t J P Hoult \n\t\t \n\t\t \n\t\t\t P Novotny \n\t\t \n\t\t \n\t\t\t B E Thomas \n\t\t \n\t\t \n\t\t\t N M Lam \n\t\t \n\t\t 10.4187/respcare.08580 \n\t\t Medline: 33906954 \n\t \n\t \n\t\t Respir Care \n\t\t \n\t\t\t 66 \n\t\t\t 6 \n\t\t\t \n\t\t\t 2021 Jun \n\t\t \n\t \n\t FREE Full text \n\t Benzo RP, Ridgeway J, Hoult JP, Novotny P, Thomas BE, Lam NM, et al. Feasibility of a health coaching and home-based rehabilitation intervention with remote monitoring for COPD. Respir Care 2021 Jun;66(6):960-971 [FREE Full text] [doi: 10.4187/respcare.08580] [Medline: 33906954]"
    },
    {
      "title": "Promoting chronic obstructive pulmonary disease wellness through remote monitoring and health coaching: a clinical trial",
      "authors": [
        "R Benzo",
        "J Hoult",
        "C Mcevoy",
        "M Clark",
        "M Benzo",
        "M Johnson"
      ],
      "year": 2022,
      "doi": "10.1513/annalsats.202203-214oc",
      "journal": "Annals ATS",
      "volume": "19",
      "issue": "11",
      "raw": "Promoting chronic obstructive pulmonary disease wellness through remote monitoring and health coaching: a clinical trial \n\t\t \n\t\t\t R Benzo \n\t\t \n\t\t \n\t\t\t J Hoult \n\t\t \n\t\t \n\t\t\t C Mcevoy \n\t\t \n\t\t \n\t\t\t M Clark \n\t\t \n\t\t \n\t\t\t M Benzo \n\t\t \n\t\t \n\t\t\t M Johnson \n\t\t \n\t\t 10.1513/annalsats.202203-214oc \n\t \n\t \n\t\t Annals ATS \n\t\t \n\t\t\t 19 \n\t\t\t 11 \n\t\t\t \n\t\t\t 2022 Nov \n\t\t \n\t \n\t Benzo R, Hoult J, McEvoy C, Clark M, Benzo M, Johnson M, et al. Promoting chronic obstructive pulmonary disease wellness through remote monitoring and health coaching: a clinical trial. Annals ATS 2022 Nov;19(11):1808-1817 [doi: 10.1513/annalsats.202203-214oc]"
    },
    {
      "title": "Loss-framed financial incentives and personalized goal-setting to increase physical activity among ischemic heart disease patients using wearable devices: the ACTIVE REWARD randomized trial",
      "authors": [
        "N Chokshi",
        "S Adusumalli",
        "D Small",
        "A Morris",
        "J Feingold",
        "Y Ha"
      ],
      "year": 2018,
      "doi": "10.1161/jaha.118.009173",
      "journal": "JAHA",
      "volume": "7",
      "issue": "12",
      "pages": "136",
      "raw": "Loss-framed financial incentives and personalized goal-setting to increase physical activity among ischemic heart disease patients using wearable devices: the ACTIVE REWARD randomized trial \n\t\t \n\t\t\t N P Chokshi \n\t\t \n\t\t \n\t\t\t S Adusumalli \n\t\t \n\t\t \n\t\t\t D S Small \n\t\t \n\t\t \n\t\t\t A Morris \n\t\t \n\t\t \n\t\t\t J Feingold \n\t\t \n\t\t \n\t\t\t Y P Ha \n\t\t \n\t\t 10.1161/jaha.118.009173 \n\t \n\t \n\t\t JAHA \n\t\t \n\t\t\t 7 \n\t\t\t 12 \n\t\t\t 136 \n\t\t\t 2018 Jun 19 \n\t\t \n\t \n\t FREE Full text \n\t Chokshi NP, Adusumalli S, Small DS, Morris A, Feingold J, Ha YP, et al. Loss-framed financial incentives and personalized goal-setting to increase physical activity among ischemic heart disease patients using wearable devices: the ACTIVE REWARD randomized trial. JAHA 2018 Jun 19;7(12):136 [FREE Full text] [doi: 10.1161/jaha.118.009173]"
    },
    {
      "title": "A lifestyle physical activity intervention for patients with chronic obstructive pulmonary disease. A randomized controlled trial",
      "authors": [
        "D Coultas",
        "B Jackson",
        "R Russo",
        "J Peoples",
        "J Sloan",
        "K Singh"
      ],
      "year": 2016,
      "doi": "10.1513/annalsats.201508-508oc",
      "journal": "Annals ATS",
      "volume": "13",
      "issue": "5",
      "raw": "A lifestyle physical activity intervention for patients with chronic obstructive pulmonary disease. A randomized controlled trial \n\t\t \n\t\t\t D B Coultas \n\t\t \n\t\t \n\t\t\t B E Jackson \n\t\t \n\t\t \n\t\t\t R Russo \n\t\t \n\t\t \n\t\t\t J Peoples \n\t\t \n\t\t \n\t\t\t J Sloan \n\t\t \n\t\t \n\t\t\t K P Singh \n\t\t \n\t\t 10.1513/annalsats.201508-508oc \n\t \n\t \n\t\t Annals ATS \n\t\t \n\t\t\t 13 \n\t\t\t 5 \n\t\t\t \n\t\t\t 2016 May \n\t\t \n\t \n\t Coultas DB, Jackson BE, Russo R, Peoples J, Sloan J, Singh KP, et al. A lifestyle physical activity intervention for patients with chronic obstructive pulmonary disease. A randomized controlled trial. Annals ATS 2016 May;13(5):617-626 [doi: 10.1513/annalsats.201508-508oc]"
    },
    {
      "title": "MOVE-HF: an internet-based pilot study to improve adherence to exercise in patients with heart failure",
      "authors": [
        "P Deka",
        "B Pozehl",
        "M Williams",
        "J Norman",
        "D Khazanchi",
        "D Pathak"
      ],
      "year": 2019,
      "doi": "10.1177/1474515118796613",
      "journal": "Eur J Cardiovasc Nurs",
      "volume": "18",
      "issue": "2",
      "raw": "MOVE-HF: an internet-based pilot study to improve adherence to exercise in patients with heart failure \n\t\t \n\t\t\t P Deka \n\t\t \n\t\t \n\t\t\t B Pozehl \n\t\t \n\t\t \n\t\t\t M A Williams \n\t\t \n\t\t \n\t\t\t J F Norman \n\t\t \n\t\t \n\t\t\t D Khazanchi \n\t\t \n\t\t \n\t\t\t D Pathak \n\t\t \n\t\t 10.1177/1474515118796613 \n\t\t Medline: 30129790 \n\t \n\t \n\t\t Eur J Cardiovasc Nurs \n\t\t \n\t\t\t 18 \n\t\t\t 2 \n\t\t\t \n\t\t\t 2019 Feb \n\t\t \n\t \n\t Deka P, Pozehl B, Williams MA, Norman JF, Khazanchi D, Pathak D. MOVE-HF: an internet-based pilot study to improve adherence to exercise in patients with heart failure. Eur J Cardiovasc Nurs 2019 Feb;18(2):122-131 [doi: 10.1177/1474515118796613] [Medline: 30129790]"
    },
    {
      "title": "A randomized controlled trial of mobile health intervention in patients with heart failure and diabetes",
      "authors": [
        "G Felker",
        "A Sharma",
        "R Mentz",
        "L She",
        "C Green",
        "B Granger"
      ],
      "year": 2022,
      "doi": "10.1016/j.cardfail.2022.07.048",
      "journal": "J Card Fail",
      "volume": "28",
      "issue": "11",
      "raw": "A randomized controlled trial of mobile health intervention in patients with heart failure and diabetes \n\t\t \n\t\t\t G M Felker \n\t\t \n\t\t \n\t\t\t A Sharma \n\t\t \n\t\t \n\t\t\t R J Mentz \n\t\t \n\t\t \n\t\t\t L She \n\t\t \n\t\t \n\t\t\t C L Green \n\t\t \n\t\t \n\t\t\t B B Granger \n\t\t \n\t\t 10.1016/j.cardfail.2022.07.048 \n\t\t Medline: 35882260 \n\t \n\t \n\t\t J Card Fail \n\t\t \n\t\t\t 28 \n\t\t\t 11 \n\t\t\t \n\t\t\t 2022 Nov \n\t\t \n\t \n\t Felker GM, Sharma A, Mentz RJ, She L, Green CL, Granger BB, et al. A randomized controlled trial of mobile health intervention in patients with heart failure and diabetes. J Card Fail 2022 Nov;28(11):1575-1583 [doi: 10.1016/j.cardfail.2022.07.048] [Medline: 35882260]"
    },
    {
      "title": "Twelve-month outcomes of an internet-based diabetes self-management support program",
      "authors": [
        "R Glasgow",
        "D Kurz",
        "D King",
        "J Dickman",
        "A Faber",
        "E Halterman"
      ],
      "year": 2012,
      "doi": "10.1016/j.pec.2011.07.024",
      "journal": "Patient Educ Couns",
      "volume": "87",
      "issue": "1",
      "raw": "Twelve-month outcomes of an internet-based diabetes self-management support program \n\t\t \n\t\t\t R E Glasgow \n\t\t \n\t\t \n\t\t\t D Kurz \n\t\t \n\t\t \n\t\t\t D King \n\t\t \n\t\t \n\t\t\t J M Dickman \n\t\t \n\t\t \n\t\t\t A J Faber \n\t\t \n\t\t \n\t\t\t E Halterman \n\t\t \n\t\t 10.1016/j.pec.2011.07.024 \n\t\t Medline: 21924576 \n\t \n\t \n\t\t Patient Educ Couns \n\t\t \n\t\t\t 87 \n\t\t\t 1 \n\t\t\t \n\t\t\t 2012 Apr \n\t\t \n\t \n\t FREE Full text \n\t Glasgow RE, Kurz D, King D, Dickman JM, Faber AJ, Halterman E, et al. Twelve-month outcomes of an internet-based diabetes self-management support program. Patient Educ Couns 2012 Apr;87(1):81-92 [FREE Full text] [doi: 10.1016/j.pec.2011.07.024] [Medline: 21924576]"
    },
    {
      "title": "Changes in patient-reported outcome measures with a technology-supported behavioral lifestyle intervention among patients with type 2 diabetes: pilot randomized controlled clinical trial",
      "authors": [
        "R Jiwani",
        "J Wang",
        "A Berndt",
        "P Ramaswamy",
        "N Joseph",
        "Y Du"
      ],
      "year": 2020,
      "doi": "10.2196/19268",
      "journal": "JMIR Diabetes",
      "volume": "5",
      "issue": "3",
      "pages": "e19268",
      "raw": "Changes in patient-reported outcome measures with a technology-supported behavioral lifestyle intervention among patients with type 2 diabetes: pilot randomized controlled clinical trial \n\t\t \n\t\t\t R Jiwani \n\t\t \n\t\t \n\t\t\t J Wang \n\t\t \n\t\t \n\t\t\t A Berndt \n\t\t \n\t\t \n\t\t\t P Ramaswamy \n\t\t \n\t\t \n\t\t\t N M Joseph \n\t\t \n\t\t \n\t\t\t Y Du \n\t\t \n\t\t 10.2196/19268 \n\t\t Medline: 32706652 \n\t \n\t \n\t\t JMIR Diabetes \n\t\t \n\t\t\t 5 \n\t\t\t 3 \n\t\t\t e19268 \n\t\t\t 2020 Jul 24 \n\t\t \n\t \n\t FREE Full text \n\t Jiwani R, Wang J, Berndt A, Ramaswamy P, Joseph NM, Du Y, et al. Changes in patient-reported outcome measures with a technology-supported behavioral lifestyle intervention among patients with type 2 diabetes: pilot randomized controlled clinical trial. JMIR Diabetes 2020 Jul 24;5(3):e19268 [FREE Full text] [doi: 10.2196/19268] [Medline: 32706652]"
    },
    {
      "title": "An internet-mediated pedometer-based program improves health-related quality-of-life domains and daily step counts in COPD: a randomized controlled trial",
      "authors": [
        "M Moy",
        "R Collins",
        "C Martinez",
        "R Kadri",
        "P Roman",
        "R Holleman"
      ],
      "year": 2015,
      "doi": "10.1378/chest.14-1466",
      "journal": "Chest",
      "volume": "148",
      "issue": "1",
      "raw": "An internet-mediated pedometer-based program improves health-related quality-of-life domains and daily step counts in COPD: a randomized controlled trial \n\t\t \n\t\t\t M L Moy \n\t\t \n\t\t \n\t\t\t R J Collins \n\t\t \n\t\t \n\t\t\t C H Martinez \n\t\t \n\t\t \n\t\t\t R Kadri \n\t\t \n\t\t \n\t\t\t P Roman \n\t\t \n\t\t \n\t\t\t R G Holleman \n\t\t \n\t\t 10.1378/chest.14-1466 \n\t\t Medline: 25811395 \n\t \n\t \n\t\t Chest \n\t\t \n\t\t\t 148 \n\t\t\t 1 \n\t\t\t \n\t\t\t 2015 Jul \n\t\t \n\t \n\t FREE Full text \n\t Moy ML, Collins RJ, Martinez CH, Kadri R, Roman P, Holleman RG, et al. An internet-mediated pedometer-based program improves health-related quality-of-life domains and daily step counts in COPD: a randomized controlled trial. Chest 2015 Jul;148(1):128-137 [FREE Full text] [doi: 10.1378/chest.14-1466] [Medline: 25811395]"
    },
    {
      "title": "A randomized trial of telephonic counseling plus walking for depressed diabetes patients",
      "authors": [
        "J Piette",
        "C Richardson",
        "J Himle",
        "S Duffy",
        "T Torres",
        "M Vogel"
      ],
      "year": 2011,
      "doi": "10.1097/mlr.0b013e318215d0c9",
      "journal": "Med Care",
      "volume": "49",
      "issue": "7",
      "raw": "A randomized trial of telephonic counseling plus walking for depressed diabetes patients \n\t\t \n\t\t\t J D Piette \n\t\t \n\t\t \n\t\t\t C Richardson \n\t\t \n\t\t \n\t\t\t J Himle \n\t\t \n\t\t \n\t\t\t S Duffy \n\t\t \n\t\t \n\t\t\t T Torres \n\t\t \n\t\t \n\t\t\t M Vogel \n\t\t \n\t\t 10.1097/mlr.0b013e318215d0c9 \n\t\t Medline: 21478777 \n\t \n\t \n\t\t Med Care \n\t\t \n\t\t\t 49 \n\t\t\t 7 \n\t\t\t \n\t\t\t 2011 Jul \n\t\t \n\t \n\t FREE Full text \n\t Piette JD, Richardson C, Himle J, Duffy S, Torres T, Vogel M, et al. A randomized trial of telephonic counseling plus walking for depressed diabetes patients. Med Care 2011 Jul;49(7):641-648 [FREE Full text] [doi: 10.1097/MLR.0b013e318215d0c9] [Medline: 21478777]"
    },
    {
      "title": "Feasibility of a sensor-controlled digital game for heart failure self-management: randomized controlled trial",
      "authors": [
        "K Radhakrishnan",
        "C Julien",
        "T Baranowski",
        "O' Hair",
        "M Lee",
        "De Main"
      ],
      "year": 2021,
      "doi": "10.2196/29044",
      "journal": "JMIR Serious Games",
      "volume": "9",
      "issue": "4",
      "pages": "e29044",
      "raw": "Feasibility of a sensor-controlled digital game for heart failure self-management: randomized controlled trial \n\t\t \n\t\t\t K Radhakrishnan \n\t\t \n\t\t \n\t\t\t C Julien \n\t\t \n\t\t \n\t\t\t T Baranowski \n\t\t \n\t\t \n\t\t\t O' Hair \n\t\t \n\t\t \n\t\t\t M Lee \n\t\t \n\t\t \n\t\t\t G \n\t\t \n\t\t \n\t\t\t De Main \n\t\t \n\t\t \n\t\t\t A S \n\t\t \n\t\t 10.2196/29044 \n\t\t Medline: 34747701 \n\t \n\t \n\t\t JMIR Serious Games \n\t\t \n\t\t\t 9 \n\t\t\t 4 \n\t\t\t e29044 \n\t\t\t 2021 Nov 08 \n\t\t \n\t \n\t FREE Full text \n\t Radhakrishnan K, Julien C, Baranowski T, O'Hair M, Lee G, De Main AS, et al. Feasibility of a sensor-controlled digital game for heart failure self-management: randomized controlled trial. JMIR Serious Games 2021 Nov 08;9(4):e29044 [FREE Full text] [doi: 10.2196/29044] [Medline: 34747701]"
    },
    {
      "title": "A randomised trial of a web-based physical activity self-management intervention in COPD",
      "authors": [
        "S Robinson",
        "J Cooper",
        "R Goldstein",
        "M Polak",
        "Cruz Rivera",
        "P Gagnon"
      ],
      "year": 2021,
      "doi": "10.1183/23120541.00158-2021",
      "journal": "ERJ Open Res",
      "volume": "7",
      "issue": "3",
      "raw": "A randomised trial of a web-based physical activity self-management intervention in COPD \n\t\t \n\t\t\t S A Robinson \n\t\t \n\t\t \n\t\t\t J A Cooper \n\t\t \n\t\t \n\t\t\t R L Goldstein \n\t\t \n\t\t \n\t\t\t M Polak \n\t\t \n\t\t \n\t\t\t Cruz Rivera \n\t\t \n\t\t \n\t\t\t P N Gagnon \n\t\t \n\t\t \n\t\t\t D R \n\t\t \n\t\t 10.1183/23120541.00158-2021 \n\t\t Medline: 34476247 \n\t \n\t \n\t\t ERJ Open Res \n\t\t \n\t\t\t 7 \n\t\t\t 3 \n\t\t\t \n\t\t\t 2021 Jul 15 \n\t\t \n\t \n\t FREE Full text \n\t Robinson SA, Cooper JA, Goldstein RL, Polak M, Cruz Rivera PN, Gagnon DR, et al. A randomised trial of a web-based physical activity self-management intervention in COPD. ERJ Open Res 2021 Jul 15;7(3):00158-2021 [FREE Full text] [doi: 10.1183/23120541.00158-2021] [Medline: 34476247]"
    },
    {
      "title": "Clinical trial of an internet-based case management system for secondary prevention of heart disease",
      "authors": [
        "B Southard",
        "D Southard",
        "J Nuckolls"
      ],
      "year": 2003,
      "doi": "10.1097/00008483-200309000-00003",
      "journal": "J Cardiopulm Rehabil",
      "volume": "23",
      "issue": "5",
      "raw": "Clinical trial of an internet-based case management system for secondary prevention of heart disease \n\t\t \n\t\t\t B H Southard \n\t\t \n\t\t \n\t\t\t D R Southard \n\t\t \n\t\t \n\t\t\t J Nuckolls \n\t\t \n\t\t 10.1097/00008483-200309000-00003 \n\t\t Medline: 14512778 \n\t \n\t \n\t\t J Cardiopulm Rehabil \n\t\t \n\t\t\t 23 \n\t\t\t 5 \n\t\t\t \n\t\t\t 2003 \n\t\t \n\t \n\t Southard BH, Southard DR, Nuckolls J. Clinical trial of an internet-based case management system for secondary prevention of heart disease. J Cardiopulm Rehabil 2003;23(5):341-348 [doi: 10.1097/00008483-200309000-00003] [Medline: 14512778]"
    },
    {
      "title": "Effects of multidisciplinary Internet-based program on management of heart failure",
      "authors": [
        "M Tomita",
        "B Tsai",
        "N Fisher",
        "N Kumar",
        "G Wilding",
        "K Stanton"
      ],
      "year": 2008,
      "doi": "10.2147/jmdh.s4355",
      "journal": "J Multidiscip Healthc",
      "issue": "2",
      "raw": "Effects of multidisciplinary Internet-based program on management of heart failure \n\t\t \n\t\t\t M R Tomita \n\t\t \n\t\t \n\t\t\t B M Tsai \n\t\t \n\t\t \n\t\t\t N M Fisher \n\t\t \n\t\t \n\t\t\t N A Kumar \n\t\t \n\t\t \n\t\t\t G Wilding \n\t\t \n\t\t \n\t\t\t K Stanton \n\t\t \n\t\t 10.2147/jmdh.s4355 \n\t\t Medline: 20505786 \n\t \n\t \n\t\t J Multidiscip Healthc \n\t\t \n\t\t\t 2 \n\t\t\t \n\t\t\t 2008 Dec 01. 2009 \n\t\t \n\t \n\t FREE Full text \n\t Tomita MR, Tsai BM, Fisher NM, Kumar NA, Wilding G, Stanton K, et al. Effects of multidisciplinary Internet-based program on management of heart failure. J Multidiscip Healthc 2008 Dec 01;2009(2):13-21 [FREE Full text] [doi: 10.2147/jmdh.s4355] [Medline: 20505786]"
    },
    {
      "title": "Promoting physical activity in COPD: insights from a randomized trial of a web-based intervention and pedometer use",
      "authors": [
        "E Wan",
        "A Kantorowski",
        "D Homsy",
        "M Teylan",
        "R Kadri",
        "C Richardson"
      ],
      "year": 2017,
      "doi": "10.1016/j.rmed.2017.07.057",
      "journal": "Respir Med",
      "volume": "130",
      "raw": "Promoting physical activity in COPD: insights from a randomized trial of a web-based intervention and pedometer use \n\t\t \n\t\t\t E S Wan \n\t\t \n\t\t \n\t\t\t A Kantorowski \n\t\t \n\t\t \n\t\t\t D Homsy \n\t\t \n\t\t \n\t\t\t M Teylan \n\t\t \n\t\t \n\t\t\t R Kadri \n\t\t \n\t\t \n\t\t\t C R Richardson \n\t\t \n\t\t 10.1016/j.rmed.2017.07.057 \n\t\t Medline: 29206627 \n\t \n\t \n\t\t Respir Med \n\t\t \n\t\t\t 130 \n\t\t\t \n\t\t\t 2017 Sep \n\t\t \n\t \n\t FREE Full text \n\t Wan ES, Kantorowski A, Homsy D, Teylan M, Kadri R, Richardson CR, et al. Promoting physical activity in COPD: insights from a randomized trial of a web-based intervention and pedometer use. Respir Med 2017 Sep;130:102-110 [FREE Full text] [doi: 10.1016/j.rmed.2017.07.057] [Medline: 29206627]"
    },
    {
      "title": "Digital health intervention during cardiac rehabilitation: a randomized controlled trial",
      "authors": [
        "R Widmer",
        "T Allison",
        "R Lennon",
        "F Lopez-Jimenez",
        "L Lerman",
        "A Lerman"
      ],
      "year": 2017,
      "doi": "10.1016/j.ahj.2017.02.016",
      "journal": "Am Heart J",
      "volume": "188",
      "raw": "Digital health intervention during cardiac rehabilitation: a randomized controlled trial \n\t\t \n\t\t\t R J Widmer \n\t\t \n\t\t \n\t\t\t T G Allison \n\t\t \n\t\t \n\t\t\t R Lennon \n\t\t \n\t\t \n\t\t\t F Lopez-Jimenez \n\t\t \n\t\t \n\t\t\t L O Lerman \n\t\t \n\t\t \n\t\t\t A Lerman \n\t\t \n\t\t 10.1016/j.ahj.2017.02.016 \n\t\t Medline: 28577682 \n\t \n\t \n\t\t Am Heart J \n\t\t \n\t\t\t 188 \n\t\t\t \n\t\t\t 2017 Jun \n\t\t \n\t \n\t Widmer RJ, Allison TG, Lennon R, Lopez-Jimenez F, Lerman LO, Lerman A. Digital health intervention during cardiac rehabilitation: a randomized controlled trial. Am Heart J 2017 Jun;188:65-72 [doi: 10.1016/j.ahj.2017.02.016] [Medline: 28577682]"
    },
    {
      "title": "Effectiveness of an internet-delivered exercise and pain-coping skills training intervention for persons with chronic knee pain: a randomized trial",
      "authors": [
        "K Bennell",
        "R Nelligan",
        "F Dobson",
        "C Rini",
        "F Keefe",
        "J Kasza"
      ],
      "year": 2017,
      "doi": "10.7326/M16-1714",
      "journal": "Ann Intern Med",
      "volume": "166",
      "issue": "7",
      "raw": "Effectiveness of an internet-delivered exercise and pain-coping skills training intervention for persons with chronic knee pain: a randomized trial \n\t\t \n\t\t\t K L Bennell \n\t\t \n\t\t \n\t\t\t R Nelligan \n\t\t \n\t\t \n\t\t\t F Dobson \n\t\t \n\t\t \n\t\t\t C Rini \n\t\t \n\t\t \n\t\t\t F Keefe \n\t\t \n\t\t \n\t\t\t J Kasza \n\t\t \n\t\t 10.7326/M16-1714 \n\t\t Medline: 28241215 \n\t \n\t \n\t\t Ann Intern Med \n\t\t \n\t\t\t 166 \n\t\t\t 7 \n\t\t\t \n\t\t\t 2017 Apr 04 \n\t\t \n\t \n\t Bennell KL, Nelligan R, Dobson F, Rini C, Keefe F, Kasza J, et al. Effectiveness of an internet-delivered exercise and pain-coping skills training intervention for persons with chronic knee pain: a randomized trial. Ann Intern Med 2017 Apr 04;166(7):453-462 [doi: 10.7326/M16-1714] [Medline: 28241215]"
    },
    {
      "title": "Effects of internet-based pain coping skills training before home exercise for individuals with hip osteoarthritis (HOPE trial): a randomised controlled trial",
      "authors": [
        "K Bennell",
        "R Nelligan",
        "C Rini",
        "F Keefe",
        "J Kasza",
        "S French"
      ],
      "year": 2018,
      "doi": "10.1097/j.pain.0000000000001281",
      "journal": "Pain",
      "volume": "159",
      "issue": "9",
      "raw": "Effects of internet-based pain coping skills training before home exercise for individuals with hip osteoarthritis (HOPE trial): a randomised controlled trial \n\t\t \n\t\t\t K L Bennell \n\t\t \n\t\t \n\t\t\t R K Nelligan \n\t\t \n\t\t \n\t\t\t C Rini \n\t\t \n\t\t \n\t\t\t F J Keefe \n\t\t \n\t\t \n\t\t\t J Kasza \n\t\t \n\t\t \n\t\t\t S French \n\t\t \n\t\t 10.1097/j.pain.0000000000001281 \n\t\t Medline: 29794609 \n\t \n\t \n\t\t Pain \n\t\t \n\t\t\t 159 \n\t\t\t 9 \n\t\t\t \n\t\t\t 2018 Sep \n\t\t \n\t \n\t Bennell KL, Nelligan RK, Rini C, Keefe FJ, Kasza J, French S, et al. Effects of internet-based pain coping skills training before home exercise for individuals with hip osteoarthritis (HOPE trial): a randomised controlled trial. Pain 2018 Sep;159(9):1833-1842 [doi: 10.1097/j.pain.0000000000001281] [Medline: 29794609]"
    },
    {
      "title": "Behavior change text messages for home exercise adherence in knee osteoarthritis: randomized trial",
      "authors": [
        "K Bennell",
        "R Nelligan",
        "S Schwartz",
        "J Kasza",
        "A Kimp",
        "S Crofts"
      ],
      "year": 2020,
      "doi": "10.2196/21749",
      "journal": "J Med Internet Res",
      "volume": "22",
      "issue": "9",
      "pages": "21749",
      "raw": "Behavior change text messages for home exercise adherence in knee osteoarthritis: randomized trial \n\t\t \n\t\t\t K Bennell \n\t\t \n\t\t \n\t\t\t R K Nelligan \n\t\t \n\t\t \n\t\t\t S Schwartz \n\t\t \n\t\t \n\t\t\t J Kasza \n\t\t \n\t\t \n\t\t\t A Kimp \n\t\t \n\t\t \n\t\t\t S J Crofts \n\t\t \n\t\t 10.2196/21749 \n\t\t Medline: 32985994 \n\t \n\t \n\t\t J Med Internet Res \n\t\t \n\t\t\t 22 \n\t\t\t 9 \n\t\t\t 21749 \n\t\t\t 2020 Sep 28 \n\t\t \n\t \n\t FREE Full text \n\t Bennell K, Nelligan RK, Schwartz S, Kasza J, Kimp A, Crofts SJ, et al. Behavior change text messages for home exercise adherence in knee osteoarthritis: randomized trial. J Med Internet Res 2020 Sep 28;22(9):e21749 [FREE Full text] [doi: 10.2196/21749] [Medline: 32985994]"
    },
    {
      "title": "A randomized controlled trial of telephone-mentoring with home-based walking preceding rehabilitation in COPD",
      "authors": [
        "Cameron-Tucker Hl",
        "Wood Baker",
        "R Joseph",
        "L Walters",
        "J Sch\u00fcz",
        "N Walters"
      ],
      "year": 2016,
      "doi": "10.2147/COPD.S109820",
      "journal": "Int J Chron Obstruct Pulmon Dis",
      "volume": "11",
      "raw": "A randomized controlled trial of telephone-mentoring with home-based walking preceding rehabilitation in COPD \n\t\t \n\t\t\t Cameron-Tucker Hl \n\t\t \n\t\t \n\t\t\t Wood - Baker \n\t\t \n\t\t \n\t\t\t R Joseph \n\t\t \n\t\t \n\t\t\t L Walters \n\t\t \n\t\t \n\t\t\t J A Sch\u00fcz \n\t\t \n\t\t \n\t\t\t N Walters \n\t\t \n\t\t \n\t\t\t E H \n\t\t \n\t\t 10.2147/COPD.S109820 \n\t\t Medline: 27601892 \n\t \n\t \n\t\t Int J Chron Obstruct Pulmon Dis \n\t\t \n\t\t\t 11 \n\t\t\t \n\t\t\t 2016 \n\t\t \n\t \n\t FREE Full text \n\t Cameron-Tucker HL, Wood-Baker R, Joseph L, Walters JA, Sch\u00fcz N, Walters EH. A randomized controlled trial of telephone-mentoring with home-based walking preceding rehabilitation in COPD. Int J Chron Obstruct Pulmon Dis 2016;11:1991-2000 [FREE Full text] [doi: 10.2147/COPD.S109820] [Medline: 27601892]"
    },
    {
      "title": "Effect of lifestyle-focused text messaging on risk factor modification in patients with coronary heart disease: a randomized clinical trial",
      "authors": [
        "C Chow",
        "J Redfern",
        "G Hillis",
        "J Thakkar",
        "K Santo",
        "M Hackett"
      ],
      "year": 2015,
      "doi": "10.1001/jama.2015.10945",
      "journal": "JAMA",
      "volume": "314",
      "issue": "12",
      "raw": "Effect of lifestyle-focused text messaging on risk factor modification in patients with coronary heart disease: a randomized clinical trial \n\t\t \n\t\t\t C K Chow \n\t\t \n\t\t \n\t\t\t J Redfern \n\t\t \n\t\t \n\t\t\t G S Hillis \n\t\t \n\t\t \n\t\t\t J Thakkar \n\t\t \n\t\t \n\t\t\t K Santo \n\t\t \n\t\t \n\t\t\t M L Hackett \n\t\t \n\t\t 10.1001/jama.2015.10945 \n\t\t Medline: 26393848 \n\t \n\t \n\t\t JAMA \n\t\t \n\t\t\t 314 \n\t\t\t 12 \n\t\t\t \n\t\t\t 2015 \n\t\t \n\t \n\t Chow CK, Redfern J, Hillis GS, Thakkar J, Santo K, Hackett ML, et al. Effect of lifestyle-focused text messaging on risk factor modification in patients with coronary heart disease: a randomized clinical trial. JAMA 2015;314(12):1255-1263 [doi: 10.1001/jama.2015.10945] [Medline: 26393848]"
    },
    {
      "title": "Personal activity intelligence e-health program in people with type 2 diabetes: a pilot randomized controlled trial",
      "authors": [
        "J Coombes",
        "S Keating",
        "G Mielke",
        "R Fassett",
        "B Coombes",
        "O' Leary"
      ],
      "year": 2022,
      "doi": "10.1249/mss.0000000000002768",
      "journal": "Med Sci Sports Exerc",
      "volume": "54",
      "issue": "1",
      "raw": "Personal activity intelligence e-health program in people with type 2 diabetes: a pilot randomized controlled trial \n\t\t \n\t\t\t J S Coombes \n\t\t \n\t\t \n\t\t\t S E Keating \n\t\t \n\t\t \n\t\t\t G I Mielke \n\t\t \n\t\t \n\t\t\t R G Fassett \n\t\t \n\t\t \n\t\t\t B K Coombes \n\t\t \n\t\t \n\t\t\t O' Leary \n\t\t \n\t\t \n\t\t\t K P \n\t\t \n\t\t 10.1249/mss.0000000000002768 \n\t\t Medline: 34334715 \n\t \n\t \n\t\t Med Sci Sports Exerc \n\t\t \n\t\t\t 54 \n\t\t\t 1 \n\t\t\t \n\t\t\t 2022 Jan 01 \n\t\t \n\t \n\t Coombes JS, Keating SE, Mielke GI, Fassett RG, Coombes BK, O'Leary KP, et al. Personal activity intelligence e-health program in people with type 2 diabetes: a pilot randomized controlled trial. Med Sci Sports Exerc 2022 Jan 01;54(1):18-27 [doi: 10.1249/MSS.0000000000002768] [Medline: 34334715]"
    },
    {
      "title": "Telerehabilitation for chronic respiratory disease: a randomised controlled equivalence trial",
      "authors": [
        "N Cox",
        "C Mcdonald",
        "A Mahal",
        "J Alison",
        "R Wootton",
        "C Hill"
      ],
      "year": 2022,
      "doi": "10.1136/thoraxjnl-2021-216934",
      "journal": "Thorax",
      "volume": "77",
      "issue": "7",
      "raw": "Telerehabilitation for chronic respiratory disease: a randomised controlled equivalence trial \n\t\t \n\t\t\t N S Cox \n\t\t \n\t\t \n\t\t\t C F Mcdonald \n\t\t \n\t\t \n\t\t\t A Mahal \n\t\t \n\t\t \n\t\t\t J A Alison \n\t\t \n\t\t \n\t\t\t R Wootton \n\t\t \n\t\t \n\t\t\t C J Hill \n\t\t \n\t\t 10.1136/thoraxjnl-2021-216934 \n\t\t Medline: 34650004 \n\t \n\t \n\t\t Thorax \n\t\t \n\t\t\t 77 \n\t\t\t 7 \n\t\t\t \n\t\t\t 2022 Jul \n\t\t \n\t \n\t Cox NS, McDonald CF, Mahal A, Alison JA, Wootton R, Hill CJ, et al. Telerehabilitation for chronic respiratory disease: a randomised controlled equivalence trial. Thorax 2022 Jul;77(7):643-651 [doi: 10.1136/thoraxjnl-2021-216934] [Medline: 34650004]"
    },
    {
      "title": "Telephone counseling for physical activity and diet in primary care patients",
      "authors": [
        "E Eakin",
        "M Reeves",
        "S Lawler",
        "N Graves",
        "B Oldenburg",
        "Del Mar"
      ],
      "year": 2009,
      "doi": "10.1016/j.amepre.2008.09.042",
      "journal": "Am J Prev Med",
      "volume": "36",
      "issue": "2",
      "raw": "Telephone counseling for physical activity and diet in primary care patients \n\t\t \n\t\t\t E Eakin \n\t\t \n\t\t \n\t\t\t M Reeves \n\t\t \n\t\t \n\t\t\t S Lawler \n\t\t \n\t\t \n\t\t\t N Graves \n\t\t \n\t\t \n\t\t\t B Oldenburg \n\t\t \n\t\t \n\t\t\t Del Mar \n\t\t \n\t\t \n\t\t\t C \n\t\t \n\t\t 10.1016/j.amepre.2008.09.042 \n\t\t Medline: 19062240 \n\t \n\t \n\t\t Am J Prev Med \n\t\t \n\t\t\t 36 \n\t\t\t 2 \n\t\t\t \n\t\t\t 2009 Feb \n\t\t \n\t \n\t Eakin E, Reeves M, Lawler S, Graves N, Oldenburg B, Del Mar C, et al. Telephone counseling for physical activity and diet in primary care patients. Am J Prev Med 2009 Feb;36(2):142-149 [doi: 10.1016/j.amepre.2008.09.042] [Medline: 19062240]"
    },
    {
      "title": "Living well with diabetes: 24-month outcomes from a randomized trial of telephone-delivered weight loss and physical activity intervention to improve glycemic control",
      "authors": [
        "E Eakin",
        "E Winkler",
        "D Dunstan",
        "G Healy",
        "N Owen",
        "A Marshall"
      ],
      "year": 2014,
      "doi": "10.2337/dc13-2427",
      "journal": "Diabetes Care",
      "volume": "37",
      "issue": "8",
      "raw": "Living well with diabetes: 24-month outcomes from a randomized trial of telephone-delivered weight loss and physical activity intervention to improve glycemic control \n\t\t \n\t\t\t E G Eakin \n\t\t \n\t\t \n\t\t\t E A Winkler \n\t\t \n\t\t \n\t\t\t D W Dunstan \n\t\t \n\t\t \n\t\t\t G N Healy \n\t\t \n\t\t \n\t\t\t N Owen \n\t\t \n\t\t \n\t\t\t A M Marshall \n\t\t \n\t\t 10.2337/dc13-2427 \n\t\t Medline: 24658390 \n\t \n\t \n\t\t Diabetes Care \n\t\t \n\t\t\t 37 \n\t\t\t 8 \n\t\t\t \n\t\t\t 2014 Aug \n\t\t \n\t \n\t FREE Full text \n\t Eakin EG, Winkler EA, Dunstan DW, Healy GN, Owen N, Marshall AM, et al. Living well with diabetes: 24-month outcomes from a randomized trial of telephone-delivered weight loss and physical activity intervention to improve glycemic control. Diabetes Care 2014 Aug;37(8):2177-2185 [FREE Full text] [doi: 10.2337/dc13-2427] [Medline: 24658390]"
    },
    {
      "title": "Effect of a telephone-delivered coronary heart disease secondary prevention program (proactive heart) on quality of life and health behaviours: primary outcomes of a randomised controlled trial",
      "authors": [
        "A Hawkes",
        "T Patrao",
        "J Atherton",
        "R Ware",
        "C Taylor",
        "O' Neil"
      ],
      "year": 2013,
      "doi": "10.1007/s12529-012-9250-5",
      "journal": "Int J Behav Med",
      "volume": "20",
      "issue": "3",
      "raw": "Effect of a telephone-delivered coronary heart disease secondary prevention program (proactive heart) on quality of life and health behaviours: primary outcomes of a randomised controlled trial \n\t\t \n\t\t\t A L Hawkes \n\t\t \n\t\t \n\t\t\t T A Patrao \n\t\t \n\t\t \n\t\t\t J Atherton \n\t\t \n\t\t \n\t\t\t R S Ware \n\t\t \n\t\t \n\t\t\t C B Taylor \n\t\t \n\t\t \n\t\t\t O' Neil \n\t\t \n\t\t \n\t\t\t A \n\t\t \n\t\t 10.1007/s12529-012-9250-5 \n\t\t Medline: 23012159 \n\t \n\t \n\t\t Int J Behav Med \n\t\t \n\t\t\t 20 \n\t\t\t 3 \n\t\t\t \n\t\t\t 2013 Sep \n\t\t \n\t \n\t Hawkes AL, Patrao TA, Atherton J, Ware RS, Taylor CB, O'Neil A, et al. Effect of a telephone-delivered coronary heart disease secondary prevention program (proactive heart) on quality of life and health behaviours: primary outcomes of a randomised controlled trial. Int J Behav Med 2013 Sep;20(3):413-424 [doi: 10.1007/s12529-012-9250-5] [Medline: 23012159]"
    },
    {
      "title": "Does telephone-delivered exercise advice and support by physiotherapists improve pain and/or function in people with knee osteoarthritis? Telecare randomised controlled trial",
      "authors": [
        "R Hinman",
        "P Campbell",
        "B Lawford",
        "A Briggs",
        "J Gale",
        "C Bills"
      ],
      "year": 2020,
      "doi": "10.1136/bjsports-2019-101183",
      "journal": "Br J Sports Med",
      "volume": "54",
      "issue": "13",
      "raw": "Does telephone-delivered exercise advice and support by physiotherapists improve pain and/or function in people with knee osteoarthritis? Telecare randomised controlled trial \n\t\t \n\t\t\t R S Hinman \n\t\t \n\t\t \n\t\t\t P K Campbell \n\t\t \n\t\t \n\t\t\t B J Lawford \n\t\t \n\t\t \n\t\t\t A M Briggs \n\t\t \n\t\t \n\t\t\t J Gale \n\t\t \n\t\t \n\t\t\t C Bills \n\t\t \n\t\t 10.1136/bjsports-2019-101183 \n\t\t Medline: 31748198 \n\t \n\t \n\t\t Br J Sports Med \n\t\t \n\t\t\t 54 \n\t\t\t 13 \n\t\t\t \n\t\t\t 2020 Jul \n\t\t \n\t \n\t Hinman RS, Campbell PK, Lawford BJ, Briggs AM, Gale J, Bills C, et al. Does telephone-delivered exercise advice and support by physiotherapists improve pain and/or function in people with knee osteoarthritis? Telecare randomised controlled trial. Br J Sports Med 2020 Jul;54(13):790-797 [doi: 10.1136/bjsports-2019-101183] [Medline: 31748198]"
    },
    {
      "title": "A smartphone-based model of care to support patients with cardiac disease transitioning from hospital to the community (TeleClinical Care): pilot randomized controlled trial",
      "authors": [
        "P Indraratna",
        "U Biswas",
        "J Mcveigh",
        "A Mamo",
        "J Magdy",
        "D Vickers"
      ],
      "year": 2022,
      "doi": "10.2196/32554",
      "journal": "JMIR Mhealth Uhealth",
      "volume": "10",
      "issue": "2",
      "pages": "32554",
      "raw": "A smartphone-based model of care to support patients with cardiac disease transitioning from hospital to the community (TeleClinical Care): pilot randomized controlled trial \n\t\t \n\t\t\t P Indraratna \n\t\t \n\t\t \n\t\t\t U Biswas \n\t\t \n\t\t \n\t\t\t J Mcveigh \n\t\t \n\t\t \n\t\t\t A Mamo \n\t\t \n\t\t \n\t\t\t J Magdy \n\t\t \n\t\t \n\t\t\t D Vickers \n\t\t \n\t\t 10.2196/32554 \n\t\t Medline: 35225819 \n\t \n\t \n\t\t JMIR Mhealth Uhealth \n\t\t \n\t\t\t 10 \n\t\t\t 2 \n\t\t\t 32554 \n\t\t\t 2022 Feb 28 \n\t\t \n\t \n\t FREE Full text \n\t Indraratna P, Biswas U, McVeigh J, Mamo A, Magdy J, Vickers D, et al. A smartphone-based model of care to support patients with cardiac disease transitioning from hospital to the community (TeleClinical Care): pilot randomized controlled trial. JMIR Mhealth Uhealth 2022 Feb 28;10(2):e32554 [FREE Full text] [doi: 10.2196/32554] [Medline: 35225819]"
    },
    {
      "title": "Effectiveness of a web-based physical activity intervention for adults with Type 2 diabetes-a randomised controlled trial",
      "authors": [
        "C Jennings",
        "C Vandelanotte",
        "C Caperchione",
        "W Mummery"
      ],
      "year": 2014,
      "doi": "10.1016/j.ypmed.2013.12.011",
      "journal": "Prev Med",
      "volume": "60",
      "raw": "Effectiveness of a web-based physical activity intervention for adults with Type 2 diabetes-a randomised controlled trial \n\t\t \n\t\t\t C A Jennings \n\t\t \n\t\t \n\t\t\t C Vandelanotte \n\t\t \n\t\t \n\t\t\t C M Caperchione \n\t\t \n\t\t \n\t\t\t W K Mummery \n\t\t \n\t\t 10.1016/j.ypmed.2013.12.011 \n\t\t Medline: 24345601 \n\t \n\t \n\t\t Prev Med \n\t\t \n\t\t\t 60 \n\t\t\t \n\t\t\t 2014 Mar \n\t\t \n\t \n\t Jennings CA, Vandelanotte C, Caperchione CM, Mummery WK. Effectiveness of a web-based physical activity intervention for adults with Type 2 diabetes-a randomised controlled trial. Prev Med 2014 Mar;60:33-40 [doi: 10.1016/j.ypmed.2013.12.011] [Medline: 24345601]"
    },
    {
      "title": "Effects of a self-directed web-based strengthening exercise and physical activity program supported by automated text messages for people with knee osteoarthritis: a randomized clinical trial",
      "authors": [
        "R Nelligan",
        "R Hinman",
        "J Kasza",
        "S Crofts",
        "K Bennell"
      ],
      "year": 2021,
      "doi": "10.1001/jamainternmed.2021.0991",
      "journal": "JAMA Intern Med",
      "volume": "181",
      "issue": "6",
      "raw": "Effects of a self-directed web-based strengthening exercise and physical activity program supported by automated text messages for people with knee osteoarthritis: a randomized clinical trial \n\t\t \n\t\t\t R K Nelligan \n\t\t \n\t\t \n\t\t\t R S Hinman \n\t\t \n\t\t \n\t\t\t J Kasza \n\t\t \n\t\t \n\t\t\t S J Crofts \n\t\t \n\t\t \n\t\t\t K L Bennell \n\t\t \n\t\t 10.1001/jamainternmed.2021.0991 \n\t\t Medline: 33843948 \n\t \n\t \n\t\t JAMA Intern Med \n\t\t \n\t\t\t 181 \n\t\t\t 6 \n\t\t\t \n\t\t\t 2021 Jun 01 \n\t\t \n\t \n\t FREE Full text \n\t Nelligan RK, Hinman RS, Kasza J, Crofts SJ, Bennell KL. Effects of a self-directed web-based strengthening exercise and physical activity program supported by automated text messages for people with knee osteoarthritis: a randomized clinical trial. JAMA Intern Med 2021 Jun 01;181(6):776-785 [FREE Full text] [doi: 10.1001/jamainternmed.2021.0991] [Medline: 33843948]"
    },
    {
      "title": "Telephone-based weight loss support for patients with knee osteoarthritis: a pragmatic randomised controlled trial",
      "authors": [
        "K O'brien",
        "J Wiggers",
        "A Williams",
        "E Campbell",
        "R Hodder",
        "L Wolfenden"
      ],
      "year": 2018,
      "doi": "10.1016/j.joca.2018.01.003",
      "journal": "Osteoarthritis Cartilage",
      "volume": "26",
      "issue": "4",
      "raw": "Telephone-based weight loss support for patients with knee osteoarthritis: a pragmatic randomised controlled trial \n\t\t \n\t\t\t K M O'brien \n\t\t \n\t\t \n\t\t\t J Wiggers \n\t\t \n\t\t \n\t\t\t A Williams \n\t\t \n\t\t \n\t\t\t E Campbell \n\t\t \n\t\t \n\t\t\t R K Hodder \n\t\t \n\t\t \n\t\t\t L Wolfenden \n\t\t \n\t\t 10.1016/j.joca.2018.01.003 \n\t \n\t \n\t\t Osteoarthritis Cartilage \n\t\t \n\t\t\t 26 \n\t\t\t 4 \n\t\t\t \n\t\t\t 2018 Apr \n\t\t \n\t \n\t FREE Full text \n\t O'Brien KM, Wiggers J, Williams A, Campbell E, Hodder RK, Wolfenden L, et al. Telephone-based weight loss support for patients with knee osteoarthritis: a pragmatic randomised controlled trial. Osteoarthritis Cartilage 2018 Apr;26(4):485-494 [FREE Full text] [doi: 10.1016/j.joca.2018.01.003]"
    },
    {
      "title": "Home-based telerehabilitation via real-time videoconferencing improves endurance exercise capacity in patients with COPD: the randomized controlled TeleR Study",
      "authors": [
        "L Tsai",
        "R Mcnamara",
        "C Moddel",
        "J Alison",
        "D Mckenzie",
        "Z Mckeough"
      ],
      "year": 2017,
      "doi": "10.1111/resp.12966",
      "journal": "Respirology",
      "volume": "22",
      "issue": "4",
      "raw": "Home-based telerehabilitation via real-time videoconferencing improves endurance exercise capacity in patients with COPD: the randomized controlled TeleR Study \n\t\t \n\t\t\t L L Tsai \n\t\t \n\t\t \n\t\t\t R J Mcnamara \n\t\t \n\t\t \n\t\t\t C Moddel \n\t\t \n\t\t \n\t\t\t J A Alison \n\t\t \n\t\t \n\t\t\t D K Mckenzie \n\t\t \n\t\t \n\t\t\t Z J Mckeough \n\t\t \n\t\t 10.1111/resp.12966 \n\t\t Medline: 27992099 \n\t \n\t \n\t\t Respirology \n\t\t \n\t\t\t 22 \n\t\t\t 4 \n\t\t\t \n\t\t\t 2017 May 19 \n\t\t \n\t \n\t FREE Full text \n\t Tsai LL, McNamara RJ, Moddel C, Alison JA, McKenzie DK, McKeough ZJ. Home-based telerehabilitation via real-time videoconferencing improves endurance exercise capacity in patients with COPD: the randomized controlled TeleR Study. Respirology 2017 May 19;22(4):699-707 [FREE Full text] [doi: 10.1111/resp.12966] [Medline: 27992099]"
    },
    {
      "title": "Effect of hospital-based telephone coaching on glycaemic control and adherence to management guidelines in type 2 diabetes, a randomised controlled trial",
      "authors": [
        "J Varney",
        "T Weiland",
        "W Inder",
        "G Jelinek"
      ],
      "year": 2014,
      "doi": "10.1111/imj.12515",
      "journal": "Intern Med J",
      "volume": "44",
      "issue": "9",
      "raw": "Effect of hospital-based telephone coaching on glycaemic control and adherence to management guidelines in type 2 diabetes, a randomised controlled trial \n\t\t \n\t\t\t J E Varney \n\t\t \n\t\t \n\t\t\t T J Weiland \n\t\t \n\t\t \n\t\t\t W J Inder \n\t\t \n\t\t \n\t\t\t G A Jelinek \n\t\t \n\t\t 10.1111/imj.12515 \n\t\t Medline: 24963611 \n\t \n\t \n\t\t Intern Med J \n\t\t \n\t\t\t 44 \n\t\t\t 9 \n\t\t\t \n\t\t\t 2014 Sep 08 \n\t\t \n\t \n\t Varney JE, Weiland TJ, Inder WJ, Jelinek GA. Effect of hospital-based telephone coaching on glycaemic control and adherence to management guidelines in type 2 diabetes, a randomised controlled trial. Intern Med J 2014 Sep 08;44(9):890-897 [doi: 10.1111/imj.12515] [Medline: 24963611]"
    },
    {
      "title": "Effectiveness and acceptability of a text message intervention (DTEXT) on HbA1c and self-management for people with type 2 diabetes. A randomized controlled trial",
      "authors": [
        "K Waller",
        "S Furber",
        "A Bauman",
        "M Allman-Farinelli",
        "P Van Den Dolder",
        "A Hayes"
      ],
      "year": 2021,
      "doi": "10.1016/j.pec.2020.11.038",
      "journal": "Patient Educ Couns",
      "volume": "104",
      "issue": "7",
      "raw": "Effectiveness and acceptability of a text message intervention (DTEXT) on HbA1c and self-management for people with type 2 diabetes. A randomized controlled trial \n\t\t \n\t\t\t K Waller \n\t\t \n\t\t \n\t\t\t S Furber \n\t\t \n\t\t \n\t\t\t A Bauman \n\t\t \n\t\t \n\t\t\t M Allman-Farinelli \n\t\t \n\t\t \n\t\t\t P Van Den Dolder \n\t\t \n\t\t \n\t\t\t A Hayes \n\t\t \n\t\t 10.1016/j.pec.2020.11.038 \n\t\t Medline: 33334634 \n\t \n\t \n\t\t Patient Educ Couns \n\t\t \n\t\t\t 104 \n\t\t\t 7 \n\t\t\t \n\t\t\t 2021 Jul \n\t\t \n\t \n\t Waller K, Furber S, Bauman A, Allman-Farinelli M, van den Dolder P, Hayes A, et al. Effectiveness and acceptability of a text message intervention (DTEXT) on HbA1c and self-management for people with type 2 diabetes. A randomized controlled trial. Patient Educ Couns 2021 Jul;104(7):1736-1744 [doi: 10.1016/j.pec.2020.11.038] [Medline: 33334634]"
    },
    {
      "title": "Effects of ongoing feedback during a 12-month maintenance walking program on daily physical activity in people with COPD",
      "authors": [
        "S Wootton",
        "K Hill",
        "J Alison",
        "L Ng",
        "S Jenkins",
        "P Eastwood"
      ],
      "year": 2019,
      "doi": "10.1007/s00408-019-00216-5",
      "journal": "Lung",
      "volume": "197",
      "issue": "3",
      "raw": "Effects of ongoing feedback during a 12-month maintenance walking program on daily physical activity in people with COPD \n\t\t \n\t\t\t S L Wootton \n\t\t \n\t\t \n\t\t\t K Hill \n\t\t \n\t\t \n\t\t\t J A Alison \n\t\t \n\t\t \n\t\t\t L W Ng \n\t\t \n\t\t \n\t\t\t S Jenkins \n\t\t \n\t\t \n\t\t\t P R Eastwood \n\t\t \n\t\t 10.1007/s00408-019-00216-5 \n\t\t Medline: 30982940 \n\t \n\t \n\t\t Lung \n\t\t \n\t\t\t 197 \n\t\t\t 3 \n\t\t\t \n\t\t\t 2019 Jun 15 \n\t\t \n\t \n\t Wootton SL, Hill K, Alison JA, Ng LW, Jenkins S, Eastwood PR, et al. Effects of ongoing feedback during a 12-month maintenance walking program on daily physical activity in people with COPD. Lung 2019 Jun 15;197(3):315-319 [doi: 10.1007/s00408-019-00216-5] [Medline: 30982940]"
    },
    {
      "title": "Impact of a self-guided, eHealth program targeting weight loss and depression in men: a randomized trial",
      "authors": [
        "M Young",
        "R Drew",
        "F Kay-Lambkin",
        "C Collins",
        "R Callister",
        "B Kelly"
      ],
      "year": 2021,
      "doi": "10.1037/ccp0000671",
      "journal": "J Consult Clin Psychol",
      "volume": "89",
      "issue": "8",
      "raw": "Impact of a self-guided, eHealth program targeting weight loss and depression in men: a randomized trial \n\t\t \n\t\t\t M D Young \n\t\t \n\t\t \n\t\t\t R J Drew \n\t\t \n\t\t \n\t\t\t F Kay-Lambkin \n\t\t \n\t\t \n\t\t\t C E Collins \n\t\t \n\t\t \n\t\t\t R Callister \n\t\t \n\t\t \n\t\t\t B J Kelly \n\t\t \n\t\t 10.1037/ccp0000671 \n\t\t Medline: 34472895 \n\t \n\t \n\t\t J Consult Clin Psychol \n\t\t \n\t\t\t 89 \n\t\t\t 8 \n\t\t\t \n\t\t\t 2021 Aug \n\t\t \n\t \n\t Young MD, Drew RJ, Kay-Lambkin F, Collins CE, Callister R, Kelly BJ, et al. Impact of a self-guided, eHealth program targeting weight loss and depression in men: a randomized trial. J Consult Clin Psychol 2021 Aug;89(8):682-694 [doi: 10.1037/ccp0000671] [Medline: 34472895]"
    },
    {
      "title": "SMARTphone-based, early cardiac REHABilitation in patients with acute coronary syndromes: a randomized controlled trial",
      "authors": [
        "M Yudi",
        "D Clark",
        "D Tsang",
        "M Jelinek",
        "K Kalten",
        "S Joshi"
      ],
      "year": 2021,
      "doi": "10.1097/mca.0000000000000938",
      "journal": "Coron Artery Dis",
      "volume": "32",
      "issue": "5",
      "raw": "SMARTphone-based, early cardiac REHABilitation in patients with acute coronary syndromes: a randomized controlled trial \n\t\t \n\t\t\t M B Yudi \n\t\t \n\t\t \n\t\t\t D J Clark \n\t\t \n\t\t \n\t\t\t D Tsang \n\t\t \n\t\t \n\t\t\t M Jelinek \n\t\t \n\t\t \n\t\t\t K Kalten \n\t\t \n\t\t \n\t\t\t S B Joshi \n\t\t \n\t\t 10.1097/mca.0000000000000938 \n\t\t Medline: 32868661 \n\t \n\t \n\t\t Coron Artery Dis \n\t\t \n\t\t\t 32 \n\t\t\t 5 \n\t\t\t \n\t\t\t 2021 Aug 01 \n\t\t \n\t \n\t Yudi MB, Clark DJ, Tsang D, Jelinek M, Kalten K, Joshi SB, et al. SMARTphone-based, early cardiac REHABilitation in patients with acute coronary syndromes: a randomized controlled trial. Coron Artery Dis 2021 Aug 01;32(5):432-440 [doi: 10.1097/MCA.0000000000000938] [Medline: 32868661]"
    },
    {
      "title": "The effects of Internet-based exercise compared with supervised group exercise in people with type 2 diabetes: a randomized controlled study",
      "authors": [
        "B Akinci",
        "I Yeldan",
        "I Satman",
        "A Dirican",
        "A Ozdincler"
      ],
      "year": 2018,
      "doi": "10.1177/0269215518757052",
      "journal": "Clin Rehabil",
      "volume": "32",
      "issue": "6",
      "raw": "The effects of Internet-based exercise compared with supervised group exercise in people with type 2 diabetes: a randomized controlled study \n\t\t \n\t\t\t B Akinci \n\t\t \n\t\t \n\t\t\t I Yeldan \n\t\t \n\t\t \n\t\t\t I Satman \n\t\t \n\t\t \n\t\t\t A Dirican \n\t\t \n\t\t \n\t\t\t A R Ozdincler \n\t\t \n\t\t 10.1177/0269215518757052 \n\t\t Medline: 29417832 \n\t \n\t \n\t\t Clin Rehabil \n\t\t \n\t\t\t 32 \n\t\t\t 6 \n\t\t\t \n\t\t\t 2018 Jun \n\t\t \n\t \n\t Akinci B, Yeldan I, Satman I, Dirican A, Ozdincler AR. The effects of Internet-based exercise compared with supervised group exercise in people with type 2 diabetes: a randomized controlled study. Clin Rehabil 2018 Jun;32(6):799-810 [doi: 10.1177/0269215518757052] [Medline: 29417832]"
    },
    {
      "title": "Home-based rehabilitation with telemonitoring guidance for patients with coronary artery disease (Short-Term Results of the TRiCH Study): randomized controlled trial",
      "authors": [
        "A Avila",
        "J Claes",
        "K Goetschalckx",
        "R Buys",
        "M Azzawi",
        "L Vanhees"
      ],
      "year": 2018,
      "doi": "10.2196/jmir.9943",
      "journal": "J Med Internet Res",
      "volume": "20",
      "issue": "6",
      "pages": "e225",
      "raw": "Home-based rehabilitation with telemonitoring guidance for patients with coronary artery disease (Short-Term Results of the TRiCH Study): randomized controlled trial \n\t\t \n\t\t\t A Avila \n\t\t \n\t\t \n\t\t\t J Claes \n\t\t \n\t\t \n\t\t\t K Goetschalckx \n\t\t \n\t\t \n\t\t\t R Buys \n\t\t \n\t\t \n\t\t\t M Azzawi \n\t\t \n\t\t \n\t\t\t L Vanhees \n\t\t \n\t\t 10.2196/jmir.9943 \n\t\t Medline: 29934286 \n\t \n\t \n\t\t J Med Internet Res \n\t\t \n\t\t\t 20 \n\t\t\t 6 \n\t\t\t e225 \n\t\t\t 2018 Jun 22 \n\t\t \n\t \n\t FREE Full text \n\t Avila A, Claes J, Goetschalckx K, Buys R, Azzawi M, Vanhees L, et al. Home-based rehabilitation with telemonitoring guidance for patients with coronary artery disease (Short-Term Results of the TRiCH Study): randomized controlled trial. J Med Internet Res 2018 Jun 22;20(6):e225 [FREE Full text] [doi: 10.2196/jmir.9943] [Medline: 29934286]"
    },
    {
      "title": "Randomised controlled feasibility study of the MyHealthAvatar-diabetes smartphone app for reducing prolonged sitting time in type 2 diabetes mellitus",
      "authors": [
        "D Bailey",
        "L Mugridge",
        "F Dong",
        "X Zhang",
        "A Chater"
      ],
      "year": 2020,
      "doi": "10.3390/ijerph17124414",
      "journal": "Int J Environ Res Public Health",
      "volume": "17",
      "issue": "12",
      "pages": "4414",
      "raw": "Randomised controlled feasibility study of the MyHealthAvatar-diabetes smartphone app for reducing prolonged sitting time in type 2 diabetes mellitus \n\t\t \n\t\t\t D P Bailey \n\t\t \n\t\t \n\t\t\t L H Mugridge \n\t\t \n\t\t \n\t\t\t F Dong \n\t\t \n\t\t \n\t\t\t X Zhang \n\t\t \n\t\t \n\t\t\t A M Chater \n\t\t \n\t\t 10.3390/ijerph17124414 \n\t\t Medline: 32575482] 100 \n\t \n\t \n\t\t Int J Environ Res Public Health \n\t\t \n\t\t\t 17 \n\t\t\t 12 \n\t\t\t 4414 \n\t\t\t 2020 Jun 19 \n\t\t \n\t \n\t FREE Full text \n\t Bailey DP, Mugridge LH, Dong F, Zhang X, Chater AM. Randomised controlled feasibility study of the MyHealthAvatar-diabetes smartphone app for reducing prolonged sitting time in type 2 diabetes mellitus. Int J Environ Res Public Health 2020 Jun 19;17(12):4414 [FREE Full text] [doi: 10.3390/ijerph17124414] [Medline: 32575482] 100"
    },
    {
      "title": "Effectiveness of a web-based physical activity intervention in patients with knee and/or hip osteoarthritis: randomized controlled trial",
      "authors": [
        "D Bossen",
        "C Veenhof",
        "K Van Beek",
        "P Spreeuwenberg",
        "J Dekker",
        "De Bakker"
      ],
      "year": 2013,
      "doi": "10.2196/jmir.2662",
      "journal": "J Med Internet Res",
      "volume": "15",
      "issue": "11",
      "pages": "257",
      "raw": "Effectiveness of a web-based physical activity intervention in patients with knee and/or hip osteoarthritis: randomized controlled trial \n\t\t \n\t\t\t D Bossen \n\t\t \n\t\t \n\t\t\t C Veenhof \n\t\t \n\t\t \n\t\t\t K E Van Beek \n\t\t \n\t\t \n\t\t\t P M Spreeuwenberg \n\t\t \n\t\t \n\t\t\t J Dekker \n\t\t \n\t\t \n\t\t\t De Bakker \n\t\t \n\t\t \n\t\t\t D H \n\t\t \n\t\t 10.2196/jmir.2662 \n\t\t Medline: 24269911] 101 \n\t \n\t \n\t\t J Med Internet Res \n\t\t \n\t\t\t 15 \n\t\t\t 11 \n\t\t\t 257 \n\t\t\t 2013 Nov 22 \n\t\t \n\t \n\t FREE Full text \n\t Bossen D, Veenhof C, Van Beek KE, Spreeuwenberg PM, Dekker J, De Bakker DH. Effectiveness of a web-based physical activity intervention in patients with knee and/or hip osteoarthritis: randomized controlled trial. J Med Internet Res 2013 Nov 22;15(11):e257 [FREE Full text] [doi: 10.2196/jmir.2662] [Medline: 24269911] 101"
    },
    {
      "title": "The effect of the mobile \"blood pressure management application\" on hypertension self-management enhancement: a randomized controlled trial",
      "authors": [
        "A Bozorgi",
        "H Hosseini",
        "H Eftekhar",
        "R Majdzadeh",
        "A Yoonessi",
        "A Ramezankhani"
      ],
      "year": 2021,
      "doi": "10.1186/s13063-021-05270-0",
      "journal": "Trials",
      "volume": "22",
      "issue": "1",
      "pages": "413",
      "raw": "The effect of the mobile \"blood pressure management application\" on hypertension self-management enhancement: a randomized controlled trial \n\t\t \n\t\t\t A Bozorgi \n\t\t \n\t\t \n\t\t\t H Hosseini \n\t\t \n\t\t \n\t\t\t H Eftekhar \n\t\t \n\t\t \n\t\t\t R Majdzadeh \n\t\t \n\t\t \n\t\t\t A Yoonessi \n\t\t \n\t\t \n\t\t\t A Ramezankhani \n\t\t \n\t\t 10.1186/s13063-021-05270-0 \n\t\t Medline: 34167566] 102 \n\t \n\t \n\t\t Trials \n\t\t \n\t\t\t 22 \n\t\t\t 1 \n\t\t\t 413 \n\t\t\t 2021 Jun 24 \n\t\t \n\t \n\t FREE Full text \n\t Bozorgi A, Hosseini H, Eftekhar H, Majdzadeh R, Yoonessi A, Ramezankhani A, et al. The effect of the mobile \"blood pressure management application\" on hypertension self-management enhancement: a randomized controlled trial. Trials 2021 Jun 24;22(1):413 [FREE Full text] [doi: 10.1186/s13063-021-05270-0] [Medline: 34167566] 102"
    },
    {
      "title": "Feasibility and potential effectiveness of a smartphone zero-time exercise intervention for promoting physical activity and fitness in patients with coronary heart disease: a pilot randomized controlled trial",
      "authors": [
        "N Chan",
        "A Lai",
        "H Choy",
        "D Cheung",
        "A Wan",
        "V Cheng"
      ],
      "year": 2022,
      "doi": "10.3389/fpubh.2022.865712",
      "journal": "Front Public Health",
      "volume": "10",
      "pages": "865712",
      "raw": "Feasibility and potential effectiveness of a smartphone zero-time exercise intervention for promoting physical activity and fitness in patients with coronary heart disease: a pilot randomized controlled trial \n\t\t \n\t\t\t N P Chan \n\t\t \n\t\t \n\t\t\t A Y Lai \n\t\t \n\t\t \n\t\t\t H K Choy \n\t\t \n\t\t \n\t\t\t D Y Cheung \n\t\t \n\t\t \n\t\t\t A N Wan \n\t\t \n\t\t \n\t\t\t V Y Cheng \n\t\t \n\t\t 10.3389/fpubh.2022.865712 \n\t\t Medline: 35910893] 103 \n\t \n\t \n\t\t Front Public Health \n\t\t \n\t\t\t 10 \n\t\t\t 865712 \n\t\t\t 2022 Jul 14 \n\t\t \n\t \n\t FREE Full text \n\t Chan NP, Lai AY, Choy HK, Cheung DY, Wan AN, Cheng VY, et al. Feasibility and potential effectiveness of a smartphone zero-time exercise intervention for promoting physical activity and fitness in patients with coronary heart disease: a pilot randomized controlled trial. Front Public Health 2022 Jul 14;10:865712 [FREE Full text] [doi: 10.3389/fpubh.2022.865712] [Medline: 35910893] 103"
    },
    {
      "title": "Efficacy of a nurse-led email reminder program for cardiovascular prevention risk reduction in hypertensive patients: a randomized controlled trial",
      "authors": [
        "G Cicolini",
        "V Simonetti",
        "D Comparcini",
        "I Celiberti",
        "Di Nicola",
        "M Capasso"
      ],
      "year": 2014,
      "doi": "10.1016/j.ijnurstu.2013.10.010",
      "journal": "Int J Nurs Stud",
      "volume": "51",
      "issue": "6",
      "raw": "Efficacy of a nurse-led email reminder program for cardiovascular prevention risk reduction in hypertensive patients: a randomized controlled trial \n\t\t \n\t\t\t G Cicolini \n\t\t \n\t\t \n\t\t\t V Simonetti \n\t\t \n\t\t \n\t\t\t D Comparcini \n\t\t \n\t\t \n\t\t\t I Celiberti \n\t\t \n\t\t \n\t\t\t Di Nicola \n\t\t \n\t\t \n\t\t\t M Capasso \n\t\t \n\t\t \n\t\t\t L M \n\t\t \n\t\t 10.1016/j.ijnurstu.2013.10.010 \n\t\t Medline: 24225325] 104 \n\t \n\t \n\t\t Int J Nurs Stud \n\t\t \n\t\t\t 51 \n\t\t\t 6 \n\t\t\t \n\t\t\t 2014 Jun \n\t\t \n\t \n\t Cicolini G, Simonetti V, Comparcini D, Celiberti I, Di Nicola M, Capasso LM, et al. Efficacy of a nurse-led email reminder program for cardiovascular prevention risk reduction in hypertensive patients: a randomized controlled trial. Int J Nurs Stud 2014 Jun;51(6):833-843 [doi: 10.1016/j.ijnurstu.2013.10.010] [Medline: 24225325] 104"
    },
    {
      "title": "A website to promote physical activity in people with type 2 diabetes living in remote or rural locations: feasibility pilot randomized controlled trial",
      "authors": [
        "J Connelly",
        "A Kirk",
        "J Masthoff",
        "S Macrury"
      ],
      "year": 2017,
      "doi": "10.2196/diabetes.6669",
      "journal": "JMIR Diabetes",
      "volume": "2",
      "issue": "2",
      "raw": "A website to promote physical activity in people with type 2 diabetes living in remote or rural locations: feasibility pilot randomized controlled trial \n\t\t \n\t\t\t J Connelly \n\t\t \n\t\t \n\t\t\t A Kirk \n\t\t \n\t\t \n\t\t\t J Masthoff \n\t\t \n\t\t \n\t\t\t S Macrury \n\t\t \n\t\t 10.2196/diabetes.6669 \n\t\t Medline: 30291091] 105 \n\t \n\t \n\t\t JMIR Diabetes \n\t\t \n\t\t\t 2 \n\t\t\t 2 \n\t\t\t 2017 Oct 19 \n\t\t \n\t \n\t FREE Full text \n\t Connelly J, Kirk A, Masthoff J, MacRury S. A website to promote physical activity in people with type 2 diabetes living in remote or rural locations: feasibility pilot randomized controlled trial. JMIR Diabetes 2017 Oct 19;2(2):e26 [FREE Full text] [doi: 10.2196/diabetes.6669] [Medline: 30291091] 105"
    },
    {
      "title": "Clinical benefits of home-based pulmonary rehabilitation in patients with chronic obstructive pulmonary disease",
      "authors": [
        "J De Sousa Pinto",
        "A Mart\u00edn-Nogueras",
        "J Calvo-Arenillas",
        "J Ramos-Gonz\u00e1lez"
      ],
      "year": 2014,
      "doi": "10.1097/hcr.0000000000000061",
      "journal": "J Cardiopulm Rehabil Prev",
      "volume": "34",
      "issue": "5",
      "raw": "Clinical benefits of home-based pulmonary rehabilitation in patients with chronic obstructive pulmonary disease \n\t\t \n\t\t\t J M De Sousa Pinto \n\t\t \n\t\t \n\t\t\t A M Mart\u00edn-Nogueras \n\t\t \n\t\t \n\t\t\t J I Calvo-Arenillas \n\t\t \n\t\t \n\t\t\t J Ramos-Gonz\u00e1lez \n\t\t \n\t\t 10.1097/hcr.0000000000000061 \n\t\t Medline: 24866357] 106 \n\t \n\t \n\t\t J Cardiopulm Rehabil Prev \n\t\t \n\t\t\t 34 \n\t\t\t 5 \n\t\t\t \n\t\t\t 2014 \n\t\t \n\t \n\t de Sousa Pinto JM, Mart\u00edn-Nogueras AM, Calvo-Arenillas JI, Ramos-Gonz\u00e1lez J. Clinical benefits of home-based pulmonary rehabilitation in patients with chronic obstructive pulmonary disease. J Cardiopulm Rehabil Prev 2014;34(5):355-359 [doi: 10.1097/HCR.0000000000000061] [Medline: 24866357] 106"
    },
    {
      "title": "Evaluation of a web-based intervention for multiple health behavior changes in patients with coronary heart disease in home-based rehabilitation: pilot randomized controlled trial",
      "authors": [
        "Y Duan",
        "W Liang",
        "L Guo",
        "J Wienert",
        "G Si",
        "S Lippke"
      ],
      "year": 2018,
      "doi": "10.2196/12052",
      "journal": "J Med Internet Res",
      "volume": "20",
      "issue": "11",
      "pages": "12052",
      "raw": "Evaluation of a web-based intervention for multiple health behavior changes in patients with coronary heart disease in home-based rehabilitation: pilot randomized controlled trial \n\t\t \n\t\t\t Y P Duan \n\t\t \n\t\t \n\t\t\t W Liang \n\t\t \n\t\t \n\t\t\t L Guo \n\t\t \n\t\t \n\t\t\t J Wienert \n\t\t \n\t\t \n\t\t\t G Y Si \n\t\t \n\t\t \n\t\t\t S Lippke \n\t\t \n\t\t 10.2196/12052 \n\t\t Medline: 30455167] 107 \n\t \n\t \n\t\t J Med Internet Res \n\t\t \n\t\t\t 20 \n\t\t\t 11 \n\t\t\t 12052 \n\t\t\t 2018 Nov 19 \n\t\t \n\t \n\t FREE Full text \n\t Duan YP, Liang W, Guo L, Wienert J, Si GY, Lippke S. Evaluation of a web-based intervention for multiple health behavior changes in patients with coronary heart disease in home-based rehabilitation: pilot randomized controlled trial. J Med Internet Res 2018 Nov 19;20(11):e12052 [FREE Full text] [doi: 10.2196/12052] [Medline: 30455167] 107"
    },
    {
      "title": "An assessment of lifestyle video education for people newly diagnosed with type 2 diabetes",
      "authors": [
        "P Dyson",
        "S Beatty",
        "D Matthews"
      ],
      "year": 2010,
      "doi": "10.1111/j.1365-277x.2010.01077.x",
      "journal": "J Hum Nutr Diet",
      "volume": "23",
      "issue": "4",
      "raw": "An assessment of lifestyle video education for people newly diagnosed with type 2 diabetes \n\t\t \n\t\t\t P A Dyson \n\t\t \n\t\t \n\t\t\t S Beatty \n\t\t \n\t\t \n\t\t\t D R Matthews \n\t\t \n\t\t 10.1111/j.1365-277x.2010.01077.x \n\t\t Medline: 20497292] 108 \n\t \n\t \n\t\t J Hum Nutr Diet \n\t\t \n\t\t\t 23 \n\t\t\t 4 \n\t\t\t \n\t\t\t 2010 Aug \n\t\t \n\t \n\t Dyson PA, Beatty S, Matthews DR. An assessment of lifestyle video education for people newly diagnosed with type 2 diabetes. J Hum Nutr Diet 2010 Aug;23(4):353-359 [doi: 10.1111/j.1365-277X.2010.01077.x] [Medline: 20497292] 108"
    },
    {
      "title": "Telerehabilitation programme as a maintenance strategy for copd patients: a 12-month randomized clinical trial",
      "authors": [
        "J Galdiz",
        "A G\u00f3mez",
        "D Rodriguez",
        "R Guell",
        "P Cebollero",
        "J Hueto"
      ],
      "year": 2021,
      "doi": "10.1016/j.arbres.2020.03.034",
      "journal": "Arch Bronconeumol (Engl Ed)",
      "volume": "57",
      "issue": "3",
      "raw": "Telerehabilitation programme as a maintenance strategy for copd patients: a 12-month randomized clinical trial \n\t\t \n\t\t\t J B Galdiz \n\t\t \n\t\t \n\t\t\t A G\u00f3mez \n\t\t \n\t\t \n\t\t\t D Rodriguez \n\t\t \n\t\t \n\t\t\t R Guell \n\t\t \n\t\t \n\t\t\t P Cebollero \n\t\t \n\t\t \n\t\t\t J Hueto \n\t\t \n\t\t 10.1016/j.arbres.2020.03.034 \n\t\t Medline: 32439253] 109 \n\t \n\t \n\t\t Arch Bronconeumol (Engl Ed) \n\t\t \n\t\t\t 57 \n\t\t\t 3 \n\t\t\t \n\t\t\t 2021 Mar \n\t\t \n\t \n\t Galdiz JB, G\u00f3mez A, Rodriguez D, Guell R, Cebollero P, Hueto J, et al. Telerehabilitation programme as a maintenance strategy for copd patients: a 12-month randomized clinical trial. Arch Bronconeumol (Engl Ed) 2021 Mar;57(3):195-204 [doi: 10.1016/j.arbres.2020.03.034] [Medline: 32439253] 109"
    },
    {
      "title": "Effects of tailored telemonitoring on functional status and health-related quality of life in patients with heart failure",
      "authors": [
        "A Gingele",
        "B Ramaekers",
        "H Brunner-La Rocca",
        "De Weerd",
        "G Kragten",
        "J Van Empel"
      ],
      "year": 2019,
      "doi": "10.1007/s12471-019-01323-x",
      "journal": "Neth Heart J",
      "volume": "27",
      "issue": "11",
      "raw": "Effects of tailored telemonitoring on functional status and health-related quality of life in patients with heart failure \n\t\t \n\t\t\t A J Gingele \n\t\t \n\t\t \n\t\t\t B Ramaekers \n\t\t \n\t\t \n\t\t\t H P Brunner-La Rocca \n\t\t \n\t\t \n\t\t\t De Weerd \n\t\t \n\t\t \n\t\t\t G Kragten \n\t\t \n\t\t \n\t\t\t J Van Empel \n\t\t \n\t\t \n\t\t\t V \n\t\t \n\t\t 10.1007/s12471-019-01323-x \n\t\t Medline: 31414308] 110 \n\t \n\t \n\t\t Neth Heart J \n\t\t \n\t\t\t 27 \n\t\t\t 11 \n\t\t\t \n\t\t\t 2019 Nov 14 \n\t\t \n\t \n\t FREE Full text \n\t Gingele AJ, Ramaekers B, Brunner-La Rocca HP, De Weerd G, Kragten J, van Empel V, et al. Effects of tailored telemonitoring on functional status and health-related quality of life in patients with heart failure. Neth Heart J 2019 Nov 14;27(11):565-574 [FREE Full text] [doi: 10.1007/s12471-019-01323-x] [Medline: 31414308] 110"
    },
    {
      "title": "Effectiveness of internet-based exercises aimed at treating knee osteoarthritis: the iBEAT-OA randomized clinical trial",
      "authors": [
        "S Gohir",
        "F Eek",
        "A Kelly",
        "A Abhishek",
        "A Valdes"
      ],
      "year": 2021,
      "doi": "10.1001/jamanetworkopen.2021.0012",
      "journal": "JAMA Netw Open",
      "volume": "4",
      "issue": "2",
      "pages": "210012",
      "raw": "Effectiveness of internet-based exercises aimed at treating knee osteoarthritis: the iBEAT-OA randomized clinical trial \n\t\t \n\t\t\t S A Gohir \n\t\t \n\t\t \n\t\t\t F Eek \n\t\t \n\t\t \n\t\t\t A Kelly \n\t\t \n\t\t \n\t\t\t A Abhishek \n\t\t \n\t\t \n\t\t\t A M Valdes \n\t\t \n\t\t 10.1001/jamanetworkopen.2021.0012 \n\t\t Medline: 33620447] 111 \n\t \n\t \n\t\t JAMA Netw Open \n\t\t \n\t\t\t 4 \n\t\t\t 2 \n\t\t\t 210012 \n\t\t\t 2021 Feb 01 \n\t\t \n\t \n\t FREE Full text \n\t Gohir SA, Eek F, Kelly A, Abhishek A, Valdes AM. Effectiveness of internet-based exercises aimed at treating knee osteoarthritis: the iBEAT-OA randomized clinical trial. JAMA Netw Open 2021 Feb 01;4(2):e210012 [FREE Full text] [doi: 10.1001/jamanetworkopen.2021.0012] [Medline: 33620447] 111"
    },
    {
      "title": "Telephone support oriented by accelerometric measurements enhances adherence to physical activity recommendations in noncompliant patients after a cardiac rehabilitation program",
      "authors": [
        "T Guiraud",
        "R Granger",
        "V Gremeaux",
        "M Bousquet",
        "L Richard",
        "L Soukari\u00e9"
      ],
      "year": 2012,
      "doi": "10.1016/j.apmr.2012.06.027",
      "journal": "Arch Phys Med Rehabil",
      "volume": "93",
      "issue": "12",
      "raw": "Telephone support oriented by accelerometric measurements enhances adherence to physical activity recommendations in noncompliant patients after a cardiac rehabilitation program \n\t\t \n\t\t\t T Guiraud \n\t\t \n\t\t \n\t\t\t R Granger \n\t\t \n\t\t \n\t\t\t V Gremeaux \n\t\t \n\t\t \n\t\t\t M Bousquet \n\t\t \n\t\t \n\t\t\t L Richard \n\t\t \n\t\t \n\t\t\t L Soukari\u00e9 \n\t\t \n\t\t 10.1016/j.apmr.2012.06.027 \n\t\t Medline: 22813832] 112 \n\t \n\t \n\t\t Arch Phys Med Rehabil \n\t\t \n\t\t\t 93 \n\t\t\t 12 \n\t\t\t \n\t\t\t 2012 Dec \n\t\t \n\t \n\t Guiraud T, Granger R, Gremeaux V, Bousquet M, Richard L, Soukari\u00e9 L, et al. Telephone support oriented by accelerometric measurements enhances adherence to physical activity recommendations in noncompliant patients after a cardiac rehabilitation program. Arch Phys Med Rehabil 2012 Dec;93(12):2141-2147 [doi: 10.1016/j.apmr.2012.06.027] [Medline: 22813832] 112"
    },
    {
      "title": "The effects of nurse-led motivational interviewing on exercise and quality of life among koreans with heart failure: a randomized controlled trial",
      "authors": [
        "H Lee",
        "G Park",
        "Jin Chun",
        "K Kim"
      ],
      "year": 2021,
      "doi": "10.7475/kjan.2021.33.6.588",
      "journal": "Korean J Adult Nurs",
      "volume": "33",
      "issue": "6",
      "pages": "588",
      "raw": "The effects of nurse-led motivational interviewing on exercise and quality of life among koreans with heart failure: a randomized controlled trial \n\t\t \n\t\t\t H Lee \n\t\t \n\t\t \n\t\t\t G Park \n\t\t \n\t\t \n\t\t\t Jin H Chun \n\t\t \n\t\t \n\t\t\t K J Kim \n\t\t \n\t\t \n\t\t\t J H \n\t\t \n\t\t 10.7475/kjan.2021.33.6.588 \n\t \n\t \n\t\t Korean J Adult Nurs \n\t\t \n\t\t\t 33 \n\t\t\t 6 \n\t\t\t 588 \n\t\t\t 2021 \n\t\t \n\t \n\t Lee H, Park G, Jin H, Chun KJ, Kim JH. The effects of nurse-led motivational interviewing on exercise and quality of life among koreans with heart failure: a randomized controlled trial. Korean J Adult Nurs 2021;33(6):588 [doi: 10.7475/kjan.2021.33.6.588] 113"
    },
    {
      "title": "Improving outcomes after myocardial infarction: a randomized controlled trial evaluating effects of a telephone follow-up intervention",
      "authors": [
        "T Hanssen",
        "J Nordrehaug",
        "G Eide",
        "B Hanestad"
      ],
      "year": 2007,
      "doi": "10.1097/hjr.0b013e32801da123",
      "journal": "Eur J Cardiovasc Prev Rehabil",
      "volume": "14",
      "issue": "3",
      "raw": "Improving outcomes after myocardial infarction: a randomized controlled trial evaluating effects of a telephone follow-up intervention \n\t\t \n\t\t\t T A Hanssen \n\t\t \n\t\t \n\t\t\t J E Nordrehaug \n\t\t \n\t\t \n\t\t\t G E Eide \n\t\t \n\t\t \n\t\t\t B R Hanestad \n\t\t \n\t\t 10.1097/hjr.0b013e32801da123 \n\t\t Medline: 17568244] 114 \n\t \n\t \n\t\t Eur J Cardiovasc Prev Rehabil \n\t\t \n\t\t\t 14 \n\t\t\t 3 \n\t\t\t \n\t\t\t 2007 Jun \n\t\t \n\t \n\t Hanssen TA, Nordrehaug JE, Eide GE, Hanestad BR. Improving outcomes after myocardial infarction: a randomized controlled trial evaluating effects of a telephone follow-up intervention. Eur J Cardiovasc Prev Rehabil 2007 Jun;14(3):429-437 [doi: 10.1097/HJR.0b013e32801da123] [Medline: 17568244] 114"
    },
    {
      "title": "Effects of brain breaks videos on the motives for the physical activity of Malaysians with type-2 diabetes mellitus",
      "authors": [
        "A Hidrus",
        "Y Kueh",
        "B Norsa\u00e1dah",
        "Y Chang",
        "T Hung",
        "N Naing"
      ],
      "year": 2020,
      "doi": "10.3390/ijerph17072507",
      "journal": "Int J Environ Res Public Health",
      "volume": "17",
      "issue": "7",
      "pages": "2507",
      "raw": "Effects of brain breaks videos on the motives for the physical activity of Malaysians with type-2 diabetes mellitus \n\t\t \n\t\t\t A Hidrus \n\t\t \n\t\t \n\t\t\t Y C Kueh \n\t\t \n\t\t \n\t\t\t B Norsa\u00e1dah \n\t\t \n\t\t \n\t\t\t Y K Chang \n\t\t \n\t\t \n\t\t\t T M Hung \n\t\t \n\t\t \n\t\t\t N N Naing \n\t\t \n\t\t 10.3390/ijerph17072507 \n\t\t Medline: 32268601] 115 \n\t \n\t \n\t\t Int J Environ Res Public Health \n\t\t \n\t\t\t 17 \n\t\t\t 7 \n\t\t\t 2507 \n\t\t\t 2020 Apr 06 \n\t\t \n\t \n\t FREE Full text \n\t Hidrus A, Kueh YC, Norsa\u00e1dah B, Chang YK, Hung TM, Naing NN, et al. Effects of brain breaks videos on the motives for the physical activity of Malaysians with type-2 diabetes mellitus. Int J Environ Res Public Health 2020 Apr 06;17(7):2507 [FREE Full text] [doi: 10.3390/ijerph17072507] [Medline: 32268601] 115"
    },
    {
      "title": "Novel smartphone game improves physical activity behavior in type 2 diabetes",
      "authors": [
        "C H\u00f6chsmann",
        "O M\u00fcller",
        "M Amb\u00fchl",
        "C Klenk",
        "K K\u00f6nigstein",
        "D Infanger"
      ],
      "year": 2019,
      "doi": "10.1016/j.amepre.2019.02.017",
      "journal": "Am J Prev Med",
      "volume": "57",
      "issue": "1",
      "raw": "Novel smartphone game improves physical activity behavior in type 2 diabetes \n\t\t \n\t\t\t C H\u00f6chsmann \n\t\t \n\t\t \n\t\t\t O M\u00fcller \n\t\t \n\t\t \n\t\t\t M Amb\u00fchl \n\t\t \n\t\t \n\t\t\t C Klenk \n\t\t \n\t\t \n\t\t\t K K\u00f6nigstein \n\t\t \n\t\t \n\t\t\t D Infanger \n\t\t \n\t\t 10.1016/j.amepre.2019.02.017 \n\t\t Medline: 31128953] 116 \n\t \n\t \n\t\t Am J Prev Med \n\t\t \n\t\t\t 57 \n\t\t\t 1 \n\t\t\t \n\t\t\t 2019 Jul \n\t\t \n\t \n\t FREE Full text \n\t H\u00f6chsmann C, M\u00fcller O, Amb\u00fchl M, Klenk C, K\u00f6nigstein K, Infanger D, et al. Novel smartphone game improves physical activity behavior in type 2 diabetes. Am J Prev Med 2019 Jul;57(1):41-50 [FREE Full text] [doi: 10.1016/j.amepre.2019.02.017] [Medline: 31128953] 116"
    },
    {
      "title": "A mobile health intervention for self-management and lifestyle change for persons with type 2 diabetes, part 2: one-year results from the Norwegian randomized controlled trial RENEWING HEALTH",
      "authors": [
        "H Holmen",
        "A Torbj\u00f8rnsen",
        "A Wahl",
        "A Jenum",
        "M Sm\u00e5stuen",
        "E Arsand"
      ],
      "year": 2014,
      "doi": "10.2196/mhealth.3882",
      "journal": "JMIR Mhealth Uhealth",
      "volume": "2",
      "issue": "4",
      "raw": "A mobile health intervention for self-management and lifestyle change for persons with type 2 diabetes, part 2: one-year results from the Norwegian randomized controlled trial RENEWING HEALTH \n\t\t \n\t\t\t H Holmen \n\t\t \n\t\t \n\t\t\t A Torbj\u00f8rnsen \n\t\t \n\t\t \n\t\t\t A K Wahl \n\t\t \n\t\t \n\t\t\t A K Jenum \n\t\t \n\t\t \n\t\t\t M C Sm\u00e5stuen \n\t\t \n\t\t \n\t\t\t E Arsand \n\t\t \n\t\t 10.2196/mhealth.3882 \n\t\t Medline: 25499872] 117 \n\t \n\t \n\t\t JMIR Mhealth Uhealth \n\t\t \n\t\t\t 2 \n\t\t\t 4 \n\t\t\t 2014 Dec 11 \n\t\t \n\t \n\t FREE Full text \n\t Holmen H, Torbj\u00f8rnsen A, Wahl AK, Jenum AK, Sm\u00e5stuen MC, Arsand E, et al. A mobile health intervention for self-management and lifestyle change for persons with type 2 diabetes, part 2: one-year results from the Norwegian randomized controlled trial RENEWING HEALTH. JMIR Mhealth Uhealth 2014 Dec 11;2(4):e57 [FREE Full text] [doi: 10.2196/mhealth.3882] [Medline: 25499872] 117"
    },
    {
      "title": "The effects of a physical activity counseling program after an exacerbation in patients with Chronic Obstructive Pulmonary Disease: a randomized controlled pilot study",
      "authors": [
        "M Hornikx",
        "H Demeyer",
        "C Camillo",
        "W Janssens",
        "T Troosters"
      ],
      "year": 2015,
      "doi": "10.1186/s12890-015-0126-8",
      "journal": "BMC Pulm Med",
      "volume": "15",
      "issue": "1",
      "pages": "136",
      "raw": "The effects of a physical activity counseling program after an exacerbation in patients with Chronic Obstructive Pulmonary Disease: a randomized controlled pilot study \n\t\t \n\t\t\t M Hornikx \n\t\t \n\t\t \n\t\t\t H Demeyer \n\t\t \n\t\t \n\t\t\t C A Camillo \n\t\t \n\t\t \n\t\t\t W Janssens \n\t\t \n\t\t \n\t\t\t T Troosters \n\t\t \n\t\t 10.1186/s12890-015-0126-8 \n\t\t Medline: 26530543] 118 \n\t \n\t \n\t\t BMC Pulm Med \n\t\t \n\t\t\t 15 \n\t\t\t 1 \n\t\t\t 136 \n\t\t\t 2015 Nov 04 \n\t\t \n\t \n\t FREE Full text \n\t Hornikx M, Demeyer H, Camillo CA, Janssens W, Troosters T. The effects of a physical activity counseling program after an exacerbation in patients with Chronic Obstructive Pulmonary Disease: a randomized controlled pilot study. BMC Pulm Med 2015 Nov 04;15(1):136 [FREE Full text] [doi: 10.1186/s12890-015-0126-8] [Medline: 26530543] 118"
    },
    {
      "title": "Effects of diet control and telemedicine-based resistance exercise intervention on patients with obesity and knee osteoarthritis: a randomized control trial",
      "authors": [
        "Y Hsu",
        "Y Chen",
        "C Lee",
        "N Chang"
      ],
      "year": 2021,
      "doi": "10.3390/ijerph18157744",
      "journal": "Int J Environ Res Public Health",
      "volume": "18",
      "issue": "15",
      "pages": "7744",
      "raw": "Effects of diet control and telemedicine-based resistance exercise intervention on patients with obesity and knee osteoarthritis: a randomized control trial \n\t\t \n\t\t\t Y I Hsu \n\t\t \n\t\t \n\t\t\t Y C Chen \n\t\t \n\t\t \n\t\t\t C L Lee \n\t\t \n\t\t \n\t\t\t N J Chang \n\t\t \n\t\t 10.3390/ijerph18157744 \n\t\t Medline: 34360036] 119 \n\t \n\t \n\t\t Int J Environ Res Public Health \n\t\t \n\t\t\t 18 \n\t\t\t 15 \n\t\t\t 7744 \n\t\t\t 2021 Jul 21 \n\t\t \n\t \n\t FREE Full text \n\t Hsu YI, Chen YC, Lee CL, Chang NJ. Effects of diet control and telemedicine-based resistance exercise intervention on patients with obesity and knee osteoarthritis: a randomized control trial. Int J Environ Res Public Health 2021 Jul 21;18(15):7744 [FREE Full text] [doi: 10.3390/ijerph18157744] [Medline: 34360036] 119"
    },
    {
      "title": "Efficacy of behavior change communication using mobile calls on glycemic control among Type 2 diabetic patients in an urban area of Pondicherry, South India: a randomized controlled trial",
      "authors": [
        "B Jayasree",
        "P Stalin"
      ],
      "year": 2019,
      "doi": "10.4103/jehp.jehp_247_18",
      "journal": "J Educ Health Promot",
      "volume": "8",
      "pages": "92",
      "raw": "Efficacy of behavior change communication using mobile calls on glycemic control among Type 2 diabetic patients in an urban area of Pondicherry, South India: a randomized controlled trial \n\t\t \n\t\t\t B Jayasree \n\t\t \n\t\t \n\t\t\t P Stalin \n\t\t \n\t\t 10.4103/jehp.jehp_247_18 \n\t\t Medline: 31143809] 120 \n\t \n\t \n\t\t J Educ Health Promot \n\t\t \n\t\t\t 8 \n\t\t\t 92 \n\t\t\t 2019 \n\t\t \n\t \n\t FREE Full text \n\t Jayasree B, Stalin P. Efficacy of behavior change communication using mobile calls on glycemic control among Type 2 diabetic patients in an urban area of Pondicherry, South India: a randomized controlled trial. J Educ Health Promot 2019;8:92 [FREE Full text] [doi: 10.4103/jehp.jehp_247_18] [Medline: 31143809] 120"
    },
    {
      "title": "Development and preliminary evaluation of the effects of an mHealth web-based platform (HappyAir) on adherence to a maintenance program after pulmonary rehabilitation in patients with chronic obstructive pulmonary disease: randomized controlled trial",
      "authors": [
        "B Jim\u00e9nez-Reguera",
        "E L\u00f3pez",
        "S Fitch",
        "L Juarros",
        "M Cort\u00e9s",
        "Rodr\u00edguez Hermosa"
      ],
      "year": 2020,
      "doi": "10.2196/18465",
      "journal": "JMIR Mhealth Uhealth",
      "volume": "8",
      "issue": "7",
      "pages": "18465",
      "raw": "Development and preliminary evaluation of the effects of an mHealth web-based platform (HappyAir) on adherence to a maintenance program after pulmonary rehabilitation in patients with chronic obstructive pulmonary disease: randomized controlled trial \n\t\t \n\t\t\t B Jim\u00e9nez-Reguera \n\t\t \n\t\t \n\t\t\t E M L\u00f3pez \n\t\t \n\t\t \n\t\t\t S Fitch \n\t\t \n\t\t \n\t\t\t L Juarros \n\t\t \n\t\t \n\t\t\t M S Cort\u00e9s \n\t\t \n\t\t \n\t\t\t Rodr\u00edguez Hermosa \n\t\t \n\t\t \n\t\t\t J L \n\t\t \n\t\t 10.2196/18465 \n\t\t Medline: 32513646] 121 \n\t \n\t \n\t\t JMIR Mhealth Uhealth \n\t\t \n\t\t\t 8 \n\t\t\t 7 \n\t\t\t 18465 \n\t\t\t 2020 Jul 31 \n\t\t \n\t \n\t FREE Full text \n\t Jim\u00e9nez-Reguera B, L\u00f3pez EM, Fitch S, Juarros L, Cort\u00e9s MS, Rodr\u00edguez Hermosa JL, et al. Development and preliminary evaluation of the effects of an mHealth web-based platform (HappyAir) on adherence to a maintenance program after pulmonary rehabilitation in patients with chronic obstructive pulmonary disease: randomized controlled trial. JMIR Mhealth Uhealth 2020 Jul 31;8(7):e18465 [FREE Full text] [doi: 10.2196/18465] [Medline: 32513646] 121"
    },
    {
      "title": "Effects of exergaming on exercise capacity in patients with heart failure: results of an international multicentre randomized controlled trial",
      "authors": [
        "T Jaarsma",
        "L Klompstra",
        "T Gal",
        "B Avraham",
        "J Boyne",
        "M B\u00e4ck"
      ],
      "year": 2021,
      "doi": "10.1002/ejhf.1754",
      "journal": "Eur J Heart Fail",
      "volume": "23",
      "issue": "1",
      "raw": "Effects of exergaming on exercise capacity in patients with heart failure: results of an international multicentre randomized controlled trial \n\t\t \n\t\t\t T Jaarsma \n\t\t \n\t\t \n\t\t\t L Klompstra \n\t\t \n\t\t \n\t\t\t T B Gal \n\t\t \n\t\t \n\t\t\t B B Avraham \n\t\t \n\t\t \n\t\t\t J Boyne \n\t\t \n\t\t \n\t\t\t M B\u00e4ck \n\t\t \n\t\t 10.1002/ejhf.1754 \n\t\t Medline: 32167657] 122 \n\t \n\t \n\t\t Eur J Heart Fail \n\t\t \n\t\t\t 23 \n\t\t\t 1 \n\t\t\t \n\t\t\t 2021 Jan 13 \n\t\t \n\t \n\t FREE Full text \n\t Jaarsma T, Klompstra L, Gal TB, Avraham BB, Boyne J, B\u00e4ck M, et al. Effects of exergaming on exercise capacity in patients with heart failure: results of an international multicentre randomized controlled trial. Eur J Heart Fail 2021 Jan 13;23(1):114-124 [FREE Full text] [doi: 10.1002/ejhf.1754] [Medline: 32167657] 122"
    },
    {
      "title": "Utility of a Web-based intervention for individuals with type 2 diabetes: the impact on physical activity levels and glycemic control",
      "authors": [
        "C Kim",
        "D Kang"
      ],
      "year": 2006,
      "doi": "10.1097/00024665-200611000-00008",
      "journal": "Comput Inform Nurs",
      "volume": "24",
      "issue": "6",
      "raw": "Utility of a Web-based intervention for individuals with type 2 diabetes: the impact on physical activity levels and glycemic control \n\t\t \n\t\t\t C J Kim \n\t\t \n\t\t \n\t\t\t D H Kang \n\t\t \n\t\t 10.1097/00024665-200611000-00008 \n\t\t Medline: 17108753] 123 \n\t \n\t \n\t\t Comput Inform Nurs \n\t\t \n\t\t\t 24 \n\t\t\t 6 \n\t\t\t \n\t\t\t 2006 \n\t\t \n\t \n\t Kim CJ, Kang DH. Utility of a Web-based intervention for individuals with type 2 diabetes: the impact on physical activity levels and glycemic control. Comput Inform Nurs 2006;24(6):337-345 [doi: 10.1097/00024665-200611000-00008] [Medline: 17108753] 123"
    },
    {
      "title": "Self-tracking of physical activity in people with type 2 diabetes: a randomized controlled trial",
      "authors": [
        "T Kooiman",
        "M De Groot",
        "K Hoogenberg",
        "W Krijnen",
        "C Van Der Schans",
        "A Kooy"
      ],
      "year": 2018,
      "doi": "10.1097/cin.0000000000000443",
      "journal": "Comput Inform Nurs",
      "volume": "36",
      "issue": "7",
      "raw": "Self-tracking of physical activity in people with type 2 diabetes: a randomized controlled trial \n\t\t \n\t\t\t T J Kooiman \n\t\t \n\t\t \n\t\t\t M De Groot \n\t\t \n\t\t \n\t\t\t K Hoogenberg \n\t\t \n\t\t \n\t\t\t W P Krijnen \n\t\t \n\t\t \n\t\t\t C P Van Der Schans \n\t\t \n\t\t \n\t\t\t A Kooy \n\t\t \n\t\t 10.1097/cin.0000000000000443 \n\t\t Medline: 29742550] 124 \n\t \n\t \n\t\t Comput Inform Nurs \n\t\t \n\t\t\t 36 \n\t\t\t 7 \n\t\t\t \n\t\t\t 2018 Jul \n\t\t \n\t \n\t Kooiman TJ, de Groot M, Hoogenberg K, Krijnen WP, van der Schans CP, Kooy A. Self-tracking of physical activity in people with type 2 diabetes: a randomized controlled trial. Comput Inform Nurs 2018 Jul;36(7):340-349 [doi: 10.1097/CIN.0000000000000443] [Medline: 29742550] 124"
    },
    {
      "title": "An mHealth management platform for patients with chronic obstructive pulmonary disease (efil breath): randomized controlled trial",
      "authors": [
        "H Kwon",
        "S Lee",
        "E Jung",
        "S Kim",
        "J Lee",
        "D Kim"
      ],
      "year": 2018,
      "doi": "10.2196/10502",
      "journal": "JMIR Mhealth Uhealth",
      "volume": "6",
      "issue": "8",
      "pages": "10502",
      "raw": "An mHealth management platform for patients with chronic obstructive pulmonary disease (efil breath): randomized controlled trial \n\t\t \n\t\t\t H Kwon \n\t\t \n\t\t \n\t\t\t S Lee \n\t\t \n\t\t \n\t\t\t E J Jung \n\t\t \n\t\t \n\t\t\t S H Kim \n\t\t \n\t\t \n\t\t\t J Lee \n\t\t \n\t\t \n\t\t\t D K Kim \n\t\t \n\t\t 10.2196/10502 \n\t\t Medline: 30143475] 125 \n\t \n\t \n\t\t JMIR Mhealth Uhealth \n\t\t \n\t\t\t 6 \n\t\t\t 8 \n\t\t\t 10502 \n\t\t\t 2018 Aug 24 \n\t\t \n\t \n\t FREE Full text \n\t Kwon H, Lee S, Jung EJ, Kim SH, Lee J, Kim DK, et al. An mHealth management platform for patients with chronic obstructive pulmonary disease (efil breath): randomized controlled trial. JMIR Mhealth Uhealth 2018 Aug 24;6(8):e10502 [FREE Full text] [doi: 10.2196/10502] [Medline: 30143475] 125"
    },
    {
      "title": "Web-based intervention using behavioral activation and physical activity for adults with depression (The eMotion Study): pilot randomized controlled trial",
      "authors": [
        "J Lambert",
        "C Greaves",
        "Farrand Price",
        "L Haase",
        "A Taylor"
      ],
      "year": 2018,
      "doi": "10.2196/10112",
      "journal": "J Med Internet Res",
      "volume": "20",
      "issue": "7",
      "pages": "10112",
      "raw": "Web-based intervention using behavioral activation and physical activity for adults with depression (The eMotion Study): pilot randomized controlled trial \n\t\t \n\t\t\t J D Lambert \n\t\t \n\t\t \n\t\t\t C J Greaves \n\t\t \n\t\t \n\t\t\t Farrand P Price \n\t\t \n\t\t \n\t\t\t L Haase \n\t\t \n\t\t \n\t\t\t A M Taylor \n\t\t \n\t\t \n\t\t\t A H \n\t\t \n\t\t 10.2196/10112 \n\t\t Medline: 30012547] 126 \n\t \n\t \n\t\t J Med Internet Res \n\t\t \n\t\t\t 20 \n\t\t\t 7 \n\t\t\t 10112 \n\t\t\t 2018 Jul 16 \n\t\t \n\t \n\t FREE Full text \n\t Lambert JD, Greaves CJ, Farrand P, Price L, Haase AM, Taylor AH. Web-based intervention using behavioral activation and physical activity for adults with depression (The eMotion Study): pilot randomized controlled trial. J Med Internet Res 2018 Jul 16;20(7):e10112 [FREE Full text] [doi: 10.2196/10112] [Medline: 30012547] 126"
    },
    {
      "title": "Efficiency of an mHealth app and chest-wearable remote exercise monitoring intervention in patients with type 2 diabetes: a prospective, multicenter randomized controlled trial",
      "authors": [
        "J Li",
        "D Wei",
        "S Liu",
        "M Li",
        "X Chen",
        "L Chen"
      ],
      "year": 2021,
      "doi": "10.2196/23338",
      "journal": "JMIR Mhealth Uhealth",
      "volume": "9",
      "issue": "2",
      "pages": "23338",
      "raw": "Efficiency of an mHealth app and chest-wearable remote exercise monitoring intervention in patients with type 2 diabetes: a prospective, multicenter randomized controlled trial \n\t\t \n\t\t\t J Li \n\t\t \n\t\t \n\t\t\t D Wei \n\t\t \n\t\t \n\t\t\t S Liu \n\t\t \n\t\t \n\t\t\t M Li \n\t\t \n\t\t \n\t\t\t X Chen \n\t\t \n\t\t \n\t\t\t L Chen \n\t\t \n\t\t 10.2196/23338 \n\t\t Medline: 33560244] 127 \n\t \n\t \n\t\t JMIR Mhealth Uhealth \n\t\t \n\t\t\t 9 \n\t\t\t 2 \n\t\t\t 23338 \n\t\t\t 2021 Feb 09 \n\t\t \n\t \n\t FREE Full text \n\t Li J, Wei D, Liu S, Li M, Chen X, Chen L, et al. Efficiency of an mHealth app and chest-wearable remote exercise monitoring intervention in patients with type 2 diabetes: a prospective, multicenter randomized controlled trial. JMIR Mhealth Uhealth 2021 Feb 09;9(2):e23338 [FREE Full text] [doi: 10.2196/23338] [Medline: 33560244] 127"
    },
    {
      "title": "Diabetes NetPLAY: a physical activity website and linked email counselling randomized intervention for individuals with type 2 diabetes",
      "authors": [
        "T Liebreich",
        "R Plotnikoff",
        "K Courneya",
        "N Boul\u00e9"
      ],
      "year": 2009,
      "doi": "10.1186/1479-5868-6-18",
      "journal": "Int J Behav Nutr Phys Act",
      "volume": "6",
      "pages": "18",
      "raw": "Diabetes NetPLAY: a physical activity website and linked email counselling randomized intervention for individuals with type 2 diabetes \n\t\t \n\t\t\t T Liebreich \n\t\t \n\t\t \n\t\t\t R C Plotnikoff \n\t\t \n\t\t \n\t\t\t K S Courneya \n\t\t \n\t\t \n\t\t\t N Boul\u00e9 \n\t\t \n\t\t 10.1186/1479-5868-6-18 \n\t\t Medline: 19327141] 128 \n\t \n\t \n\t\t Int J Behav Nutr Phys Act \n\t\t \n\t\t\t 6 \n\t\t\t 18 \n\t\t\t 2009 Mar 27 \n\t\t \n\t \n\t FREE Full text \n\t Liebreich T, Plotnikoff RC, Courneya KS, Boul\u00e9 N. Diabetes NetPLAY: a physical activity website and linked email counselling randomized intervention for individuals with type 2 diabetes. Int J Behav Nutr Phys Act 2009 Mar 27;6:18 [FREE Full text] [doi: 10.1186/1479-5868-6-18] [Medline: 19327141] 128"
    },
    {
      "title": "A smartphone application of diabetes coaching intervention to prevent the onset of complications and to improve diabetes self-management: a randomized control trial",
      "authors": [
        "R Pamungkas",
        "A Usman",
        "K Chamroonsawasdi"
      ],
      "year": 2022,
      "doi": "10.1016/j.dsx.2022.102537",
      "journal": "Diabetes Metab Syndr",
      "volume": "16",
      "issue": "7",
      "pages": "102537",
      "raw": "A smartphone application of diabetes coaching intervention to prevent the onset of complications and to improve diabetes self-management: a randomized control trial \n\t\t \n\t\t\t R A Pamungkas \n\t\t \n\t\t \n\t\t\t A M Usman \n\t\t \n\t\t \n\t\t\t K Chamroonsawasdi \n\t\t \n\t\t \n\t\t\t Abdurrasyid \n\t\t \n\t\t 10.1016/j.dsx.2022.102537 \n\t\t Medline: 35724489] 129 \n\t \n\t \n\t\t Diabetes Metab Syndr \n\t\t \n\t\t\t 16 \n\t\t\t 7 \n\t\t\t 102537 \n\t\t\t 2022 Jul \n\t\t \n\t \n\t Pamungkas RA, Usman AM, Chamroonsawasdi K, Abdurrasyid. A smartphone application of diabetes coaching intervention to prevent the onset of complications and to improve diabetes self-management: a randomized control trial. Diabetes Metab Syndr 2022 Jul;16(7):102537 [doi: 10.1016/j.dsx.2022.102537] [Medline: 35724489] 129"
    },
    {
      "title": "Effect of the dr. Bart application on healthcare use and clinical outcomes in people with osteoarthritis of the knee and/or hip in the Netherlands; a randomized controlled trial",
      "authors": [
        "T Pelle",
        "K Bevers",
        "J Van Der Palen",
        "F Van Den Hoogen",
        "C Van Den Ende"
      ],
      "year": 2020,
      "doi": "10.1016/j.joca.2020.02.831",
      "journal": "Osteoarthritis Cartilage",
      "volume": "28",
      "issue": "4",
      "raw": "Effect of the dr. Bart application on healthcare use and clinical outcomes in people with osteoarthritis of the knee and/or hip in the Netherlands; a randomized controlled trial \n\t\t \n\t\t\t T Pelle \n\t\t \n\t\t \n\t\t\t K Bevers \n\t\t \n\t\t \n\t\t\t J Van Der Palen \n\t\t \n\t\t \n\t\t\t F H Van Den Hoogen \n\t\t \n\t\t \n\t\t\t C H Van Den Ende \n\t\t \n\t\t 10.1016/j.joca.2020.02.831 \n\t\t Medline: 32119972] 130 \n\t \n\t \n\t\t Osteoarthritis Cartilage \n\t\t \n\t\t\t 28 \n\t\t\t 4 \n\t\t\t \n\t\t\t 2020 Apr \n\t\t \n\t \n\t FREE Full text \n\t Pelle T, Bevers K, van der Palen J, van den Hoogen FH, van den Ende CH. Effect of the dr. Bart application on healthcare use and clinical outcomes in people with osteoarthritis of the knee and/or hip in the Netherlands; a randomized controlled trial. Osteoarthritis Cartilage 2020 Apr;28(4):418-427 [FREE Full text] [doi: 10.1016/j.joca.2020.02.831] [Medline: 32119972] 130"
    },
    {
      "title": "The Alberta Diabetes and Physical Activity Trial (ADAPT): a randomized trial evaluating theory-based interventions to increase physical activity in adults with type 2 diabetes",
      "authors": [
        "R Plotnikoff",
        "N Karunamuni",
        "K Courneya",
        "R Sigal",
        "J Johnson",
        "Johnson St"
      ],
      "year": 2013,
      "doi": "10.1007/s12160-012-9405-2",
      "journal": "Ann Behav Med",
      "volume": "45",
      "issue": "1",
      "raw": "The Alberta Diabetes and Physical Activity Trial (ADAPT): a randomized trial evaluating theory-based interventions to increase physical activity in adults with type 2 diabetes \n\t\t \n\t\t\t R C Plotnikoff \n\t\t \n\t\t \n\t\t\t N Karunamuni \n\t\t \n\t\t \n\t\t\t K S Courneya \n\t\t \n\t\t \n\t\t\t R J Sigal \n\t\t \n\t\t \n\t\t\t J A Johnson \n\t\t \n\t\t \n\t\t\t Johnson St \n\t\t \n\t\t 10.1007/s12160-012-9405-2 \n\t\t Medline: 22922954] 131 \n\t \n\t \n\t\t Ann Behav Med \n\t\t \n\t\t\t 45 \n\t\t\t 1 \n\t\t\t \n\t\t\t 2013 Feb \n\t\t \n\t \n\t Plotnikoff RC, Karunamuni N, Courneya KS, Sigal RJ, Johnson JA, Johnson ST. The Alberta Diabetes and Physical Activity Trial (ADAPT): a randomized trial evaluating theory-based interventions to increase physical activity in adults with type 2 diabetes. Ann Behav Med 2013 Feb;45(1):45-56 [doi: 10.1007/s12160-012-9405-2] [Medline: 22922954] 131"
    },
    {
      "title": "Efficacy of a self-regulation-based electronic and mobile health intervention targeting an active lifestyle in adults having type 2 diabetes and in adults aged 50 years or older: two randomized controlled trials",
      "authors": [
        "L Poppe",
        "De Bourdeaudhuij",
        "I Verloigne",
        "M Shadid",
        "S Van Cauwenberg",
        "J Compernolle"
      ],
      "year": 2019,
      "doi": "10.2196/13363",
      "journal": "J Med Internet Res",
      "volume": "21",
      "issue": "8",
      "pages": "13363",
      "raw": "Efficacy of a self-regulation-based electronic and mobile health intervention targeting an active lifestyle in adults having type 2 diabetes and in adults aged 50 years or older: two randomized controlled trials \n\t\t \n\t\t\t L Poppe \n\t\t \n\t\t \n\t\t\t De Bourdeaudhuij \n\t\t \n\t\t \n\t\t\t I Verloigne \n\t\t \n\t\t \n\t\t\t M Shadid \n\t\t \n\t\t \n\t\t\t S Van Cauwenberg \n\t\t \n\t\t \n\t\t\t J Compernolle \n\t\t \n\t\t \n\t\t\t S \n\t\t \n\t\t 10.2196/13363 \n\t\t Medline: 31376274] 132 \n\t \n\t \n\t\t J Med Internet Res \n\t\t \n\t\t\t 21 \n\t\t\t 8 \n\t\t\t 13363 \n\t\t\t 2019 Aug 02 \n\t\t \n\t \n\t FREE Full text \n\t Poppe L, De Bourdeaudhuij I, Verloigne M, Shadid S, Van Cauwenberg J, Compernolle S, et al. Efficacy of a self-regulation-based electronic and mobile health intervention targeting an active lifestyle in adults having type 2 diabetes and in adults aged 50 years or older: two randomized controlled trials. J Med Internet Res 2019 Aug 02;21(8):e13363 [FREE Full text] [doi: 10.2196/13363] [Medline: 31376274] 132"
    },
    {
      "title": "Randomized trial of an internet-based computer-tailored expert system for physical activity in patients with heart disease",
      "authors": [
        "R Reid",
        "L Morrin",
        "L Beaton",
        "S Papadakis",
        "J Kocourek",
        "L Mcdonnell"
      ],
      "year": 2012,
      "doi": "10.1177/1741826711422988",
      "journal": "Eur J Prev Cardiol",
      "volume": "19",
      "issue": "6",
      "raw": "Randomized trial of an internet-based computer-tailored expert system for physical activity in patients with heart disease \n\t\t \n\t\t\t R D Reid \n\t\t \n\t\t \n\t\t\t L I Morrin \n\t\t \n\t\t \n\t\t\t L J Beaton \n\t\t \n\t\t \n\t\t\t S Papadakis \n\t\t \n\t\t \n\t\t\t J Kocourek \n\t\t \n\t\t \n\t\t\t L Mcdonnell \n\t\t \n\t\t 10.1177/1741826711422988 \n\t\t Medline: 21903744] 133 \n\t \n\t \n\t\t Eur J Prev Cardiol \n\t\t \n\t\t\t 19 \n\t\t\t 6 \n\t\t\t \n\t\t\t 2012 Dec \n\t\t \n\t \n\t Reid RD, Morrin LI, Beaton LJ, Papadakis S, Kocourek J, McDonnell L, et al. Randomized trial of an internet-based computer-tailored expert system for physical activity in patients with heart disease. Eur J Prev Cardiol 2012 Dec;19(6):1357-1364 [doi: 10.1177/1741826711422988] [Medline: 21903744] 133"
    },
    {
      "title": "Effects of multidisciplinary exercise management on patients after percutaneous coronary intervention: a randomized controlled study",
      "authors": [
        "Y Shi",
        "Y Liu",
        "T Jiang",
        "H Zhang",
        "T Shi"
      ],
      "year": 2022,
      "doi": "10.1016/j.ijnss.2022.06.012",
      "journal": "Int J Nurs Sci",
      "volume": "9",
      "issue": "3",
      "raw": "Effects of multidisciplinary exercise management on patients after percutaneous coronary intervention: a randomized controlled study \n\t\t \n\t\t\t Y J Shi \n\t\t \n\t\t \n\t\t\t Y Liu \n\t\t \n\t\t \n\t\t\t T T Jiang \n\t\t \n\t\t \n\t\t\t H R Zhang \n\t\t \n\t\t \n\t\t\t T Y Shi \n\t\t \n\t\t 10.1016/j.ijnss.2022.06.012 \n\t\t Medline: 35891912] 134 \n\t \n\t \n\t\t Int J Nurs Sci \n\t\t \n\t\t\t 9 \n\t\t\t 3 \n\t\t\t \n\t\t\t 2022 Jul \n\t\t \n\t \n\t FREE Full text \n\t Shi YJ, Liu Y, Jiang TT, Zhang HR, Shi TY. Effects of multidisciplinary exercise management on patients after percutaneous coronary intervention: a randomized controlled study. Int J Nurs Sci 2022 Jul;9(3):286-294 [FREE Full text] [doi: 10.1016/j.ijnss.2022.06.012] [Medline: 35891912] 134"
    },
    {
      "title": "The sustained effects of extending cardiac rehabilitation with a six-month telemonitoring and telecoaching programme on fitness, quality of life, cardiovascular risk factors and care utilisation in CAD patients: the TeleCaRe study",
      "authors": [
        "J Snoek",
        "E Meindersma",
        "L Prins",
        "A Van't Hof",
        "M De Boer",
        "M Hopman"
      ],
      "year": 2019,
      "doi": "10.1177/1357633x19885793",
      "journal": "J Telemed Telecare",
      "volume": "27",
      "issue": "8",
      "raw": "The sustained effects of extending cardiac rehabilitation with a six-month telemonitoring and telecoaching programme on fitness, quality of life, cardiovascular risk factors and care utilisation in CAD patients: the TeleCaRe study \n\t\t \n\t\t\t J A Snoek \n\t\t \n\t\t \n\t\t\t E P Meindersma \n\t\t \n\t\t \n\t\t\t L F Prins \n\t\t \n\t\t \n\t\t\t A W Van't Hof \n\t\t \n\t\t \n\t\t\t M J De Boer \n\t\t \n\t\t \n\t\t\t M T Hopman \n\t\t \n\t\t 10.1177/1357633x19885793 \n\t \n\t \n\t\t J Telemed Telecare \n\t\t \n\t\t\t 27 \n\t\t\t 8 \n\t\t\t \n\t\t\t 2019 Nov 23 \n\t\t \n\t \n\t Snoek JA, Meindersma EP, Prins LF, van't Hof AW, de Boer MJ, Hopman MT, et al. The sustained effects of extending cardiac rehabilitation with a six-month telemonitoring and telecoaching programme on fitness, quality of life, cardiovascular risk factors and care utilisation in CAD patients: the TeleCaRe study. J Telemed Telecare 2019 Nov 23;27(8):473-483 [doi: 10.1177/1357633x19885793] 135"
    },
    {
      "title": "Effectiveness of home-based mobile guided cardiac rehabilitation as alternative strategy for nonparticipation in clinic-based cardiac rehabilitation among elderly patients in Europe: a randomized clinical trial",
      "authors": [
        "J Snoek",
        "E Prescott",
        "A Van Der Velde",
        "T Eijsvogels",
        "N Mikkelsen",
        "L Prins"
      ],
      "year": 2021,
      "doi": "10.1001/jamacardio.2020.5218",
      "journal": "JAMA Cardiol",
      "volume": "6",
      "issue": "4",
      "raw": "Effectiveness of home-based mobile guided cardiac rehabilitation as alternative strategy for nonparticipation in clinic-based cardiac rehabilitation among elderly patients in Europe: a randomized clinical trial \n\t\t \n\t\t\t J A Snoek \n\t\t \n\t\t \n\t\t\t E I Prescott \n\t\t \n\t\t \n\t\t\t A E Van Der Velde \n\t\t \n\t\t \n\t\t\t T M Eijsvogels \n\t\t \n\t\t \n\t\t\t N Mikkelsen \n\t\t \n\t\t \n\t\t\t L F Prins \n\t\t \n\t\t 10.1001/jamacardio.2020.5218 \n\t\t Medline: 33112363] 136 \n\t \n\t \n\t\t JAMA Cardiol \n\t\t \n\t\t\t 6 \n\t\t\t 4 \n\t\t\t \n\t\t\t 2021 Apr 01 \n\t\t \n\t \n\t FREE Full text \n\t Snoek JA, Prescott EI, van der Velde AE, Eijsvogels TM, Mikkelsen N, Prins LF, et al. Effectiveness of home-based mobile guided cardiac rehabilitation as alternative strategy for nonparticipation in clinic-based cardiac rehabilitation among elderly patients in Europe: a randomized clinical trial. JAMA Cardiol 2021 Apr 01;6(4):463-468 [FREE Full text] [doi: 10.1001/jamacardio.2020.5218] [Medline: 33112363] 136"
    },
    {
      "title": "Using a smartphone application maintains physical activity following pulmonary rehabilitation in patients with COPD: a randomised controlled trial",
      "authors": [
        "M Spielmanns",
        "R Gloeckl",
        "I Jarosch",
        "D Leitl",
        "T Schneeberger",
        "T Boeselt"
      ],
      "year": 2023,
      "doi": "10.1136/thoraxjnl-2021-218338",
      "journal": "Thorax",
      "volume": "78",
      "issue": "5",
      "raw": "Using a smartphone application maintains physical activity following pulmonary rehabilitation in patients with COPD: a randomised controlled trial \n\t\t \n\t\t\t M Spielmanns \n\t\t \n\t\t \n\t\t\t R Gloeckl \n\t\t \n\t\t \n\t\t\t I Jarosch \n\t\t \n\t\t \n\t\t\t D Leitl \n\t\t \n\t\t \n\t\t\t T Schneeberger \n\t\t \n\t\t \n\t\t\t T Boeselt \n\t\t \n\t\t 10.1136/thoraxjnl-2021-218338 \n\t\t Medline: 35450945] 137 \n\t \n\t \n\t\t Thorax \n\t\t \n\t\t\t 78 \n\t\t\t 5 \n\t\t\t \n\t\t\t 2023 May \n\t\t \n\t \n\t FREE Full text \n\t Spielmanns M, Gloeckl R, Jarosch I, Leitl D, Schneeberger T, Boeselt T, et al. Using a smartphone application maintains physical activity following pulmonary rehabilitation in patients with COPD: a randomised controlled trial. Thorax 2023 May;78(5):442-450 [FREE Full text] [doi: 10.1136/thoraxjnl-2021-218338] [Medline: 35450945] 137"
    },
    {
      "title": "Internet-delivered therapist-guided physical activity for mild to moderate depression: a randomized controlled trial",
      "authors": [
        "M Str\u00f6m",
        "C Uckelstam",
        "G Andersson",
        "P Hassm\u00e9n",
        "G Umefjord",
        "P Carlbring"
      ],
      "year": 2013,
      "doi": "10.7717/peerj.178",
      "journal": "PeerJ",
      "volume": "1",
      "pages": "178",
      "raw": "Internet-delivered therapist-guided physical activity for mild to moderate depression: a randomized controlled trial \n\t\t \n\t\t\t M Str\u00f6m \n\t\t \n\t\t \n\t\t\t C J Uckelstam \n\t\t \n\t\t \n\t\t\t G Andersson \n\t\t \n\t\t \n\t\t\t P Hassm\u00e9n \n\t\t \n\t\t \n\t\t\t G Umefjord \n\t\t \n\t\t \n\t\t\t P Carlbring \n\t\t \n\t\t 10.7717/peerj.178 \n\t\t Medline: 24109561] 138 \n\t \n\t \n\t\t PeerJ \n\t\t \n\t\t\t 1 \n\t\t\t 178 \n\t\t\t 2013 \n\t\t \n\t \n\t FREE Full text \n\t Str\u00f6m M, Uckelstam CJ, Andersson G, Hassm\u00e9n P, Umefjord G, Carlbring P. Internet-delivered therapist-guided physical activity for mild to moderate depression: a randomized controlled trial. PeerJ 2013;1:e178 [FREE Full text] [doi: 10.7717/peerj.178] [Medline: 24109561] 138"
    },
    {
      "title": "The quality of physiotherapy and rehabilitation program and the effect of telerehabilitation on patients with knee osteoarthritis",
      "authors": [
        "N Tore",
        "D Oskay",
        "S Haznedaroglu"
      ],
      "year": 2023,
      "doi": "10.1007/s10067-022-06417-3",
      "journal": "Clin Rheumatol",
      "volume": "42",
      "issue": "3",
      "raw": "The quality of physiotherapy and rehabilitation program and the effect of telerehabilitation on patients with knee osteoarthritis \n\t\t \n\t\t\t N G Tore \n\t\t \n\t\t \n\t\t\t D Oskay \n\t\t \n\t\t \n\t\t\t S Haznedaroglu \n\t\t \n\t\t 10.1007/s10067-022-06417-3 \n\t\t Medline: 36279075] 139 \n\t \n\t \n\t\t Clin Rheumatol \n\t\t \n\t\t\t 42 \n\t\t\t 3 \n\t\t\t \n\t\t\t 2023 Mar 24 \n\t\t \n\t \n\t FREE Full text \n\t Tore NG, Oskay D, Haznedaroglu S. The quality of physiotherapy and rehabilitation program and the effect of telerehabilitation on patients with knee osteoarthritis. Clin Rheumatol 2023 Mar 24;42(3):903-915 [FREE Full text] [doi: 10.1007/s10067-022-06417-3] [Medline: 36279075] 139"
    },
    {
      "title": "Recovery after coronary artery bypass surgery: effect of an audiotape information programme",
      "authors": [
        "K Utriyaprasit",
        "S Moore",
        "P Chaiseri"
      ],
      "year": 2010,
      "doi": "10.1111/j.1365-2648.2010.05334.x",
      "journal": "J Adv Nurs",
      "volume": "66",
      "issue": "8",
      "raw": "Recovery after coronary artery bypass surgery: effect of an audiotape information programme \n\t\t \n\t\t\t K Utriyaprasit \n\t\t \n\t\t \n\t\t\t S M Moore \n\t\t \n\t\t \n\t\t\t P Chaiseri \n\t\t \n\t\t 10.1111/j.1365-2648.2010.05334.x \n\t\t Medline: 20557390] 140 \n\t \n\t \n\t\t J Adv Nurs \n\t\t \n\t\t\t 66 \n\t\t\t 8 \n\t\t\t \n\t\t\t 2010 Aug \n\t\t \n\t \n\t Utriyaprasit K, Moore SM, Chaiseri P. Recovery after coronary artery bypass surgery: effect of an audiotape information programme. J Adv Nurs 2010 Aug;66(8):1747-1759 [doi: 10.1111/j.1365-2648.2010.05334.x] [Medline: 20557390] 140"
    },
    {
      "title": "Effectiveness of mobile phone text messaging in improving glycaemic control among persons with newly detected type 2 diabetes",
      "authors": [
        "R Vinitha",
        "A Nanditha",
        "C Snehalatha",
        "K Satheesh",
        "P Susairaj",
        "A Raghavan"
      ],
      "year": 2019,
      "doi": "10.1016/j.diabres.2019.107919",
      "journal": "Diabetes Res Clin Pract",
      "volume": "158",
      "pages": "107919",
      "raw": "Effectiveness of mobile phone text messaging in improving glycaemic control among persons with newly detected type 2 diabetes \n\t\t \n\t\t\t R Vinitha \n\t\t \n\t\t \n\t\t\t A Nanditha \n\t\t \n\t\t \n\t\t\t C Snehalatha \n\t\t \n\t\t \n\t\t\t K Satheesh \n\t\t \n\t\t \n\t\t\t P Susairaj \n\t\t \n\t\t \n\t\t\t A Raghavan \n\t\t \n\t\t 10.1016/j.diabres.2019.107919 \n\t\t Medline: 31711858] 141 \n\t \n\t \n\t\t Diabetes Res Clin Pract \n\t\t \n\t\t\t 158 \n\t\t\t 107919 \n\t\t\t 2019 Dec \n\t\t \n\t \n\t Vinitha R, Nanditha A, Snehalatha C, Satheesh K, Susairaj P, Raghavan A, et al. Effectiveness of mobile phone text messaging in improving glycaemic control among persons with newly detected type 2 diabetes. Diabetes Res Clin Pract 2019 Dec;158:107919 [doi: 10.1016/j.diabres.2019.107919] [Medline: 31711858] 141"
    },
    {
      "title": "A mobile health application to support self-management in patients with chronic obstructive pulmonary disease: a randomised controlled trial",
      "authors": [
        "L Wang",
        "Y Guo",
        "M Wang",
        "Y Zhao"
      ],
      "year": 2021,
      "doi": "10.1177/0269215520946931",
      "journal": "Clin Rehabil",
      "volume": "35",
      "issue": "1",
      "raw": "A mobile health application to support self-management in patients with chronic obstructive pulmonary disease: a randomised controlled trial \n\t\t \n\t\t\t L Wang \n\t\t \n\t\t \n\t\t\t Y Guo \n\t\t \n\t\t \n\t\t\t M Wang \n\t\t \n\t\t \n\t\t\t Y Zhao \n\t\t \n\t\t 10.1177/0269215520946931 \n\t\t Medline: 32907384] 142 \n\t \n\t \n\t\t Clin Rehabil \n\t\t \n\t\t\t 35 \n\t\t\t 1 \n\t\t\t \n\t\t\t 2021 Jan \n\t\t \n\t \n\t Wang L, Guo Y, Wang M, Zhao Y. A mobile health application to support self-management in patients with chronic obstructive pulmonary disease: a randomised controlled trial. Clin Rehabil 2021 Jan;35(1):90-101 [doi: 10.1177/0269215520946931] [Medline: 32907384] 142"
    },
    {
      "title": "Effects of a web-based educational support intervention on total exercise and cardiovascular risk markers in adults with coronary heart disease",
      "authors": [
        "E Wong",
        "D Leung",
        "S Chair",
        "J Sit"
      ],
      "year": 2020,
      "doi": "10.1111/wvn.12456",
      "journal": "Worldviews Evid Based Nurs",
      "volume": "17",
      "issue": "4",
      "raw": "Effects of a web-based educational support intervention on total exercise and cardiovascular risk markers in adults with coronary heart disease \n\t\t \n\t\t\t E M Wong \n\t\t \n\t\t \n\t\t\t D Y Leung \n\t\t \n\t\t \n\t\t\t S Chair \n\t\t \n\t\t \n\t\t\t J W Sit \n\t\t \n\t\t 10.1111/wvn.12456 \n\t\t Medline: 32772509] 143 \n\t \n\t \n\t\t Worldviews Evid Based Nurs \n\t\t \n\t\t\t 17 \n\t\t\t 4 \n\t\t\t \n\t\t\t 2020 Aug 08 \n\t\t \n\t \n\t Wong EM, Leung DY, Chair S, Sit JW. Effects of a web-based educational support intervention on total exercise and cardiovascular risk markers in adults with coronary heart disease. Worldviews Evid Based Nurs 2020 Aug 08;17(4):283-292 [doi: 10.1111/wvn.12456] [Medline: 32772509] 143"
    },
    {
      "title": "Mechanisms of an eHealth program targeting depression in men with overweight or obesity: a randomised trial",
      "authors": [
        "R Drew",
        "P Morgan",
        "M Young"
      ],
      "year": 2022,
      "doi": "10.1016/j.jad.2021.12.001",
      "journal": "J Affect Disord",
      "volume": "299",
      "raw": "Mechanisms of an eHealth program targeting depression in men with overweight or obesity: a randomised trial \n\t\t \n\t\t\t R J Drew \n\t\t \n\t\t \n\t\t\t P J Morgan \n\t\t \n\t\t \n\t\t\t M D Young \n\t\t \n\t\t 10.1016/j.jad.2021.12.001 \n\t\t Medline: 34871640] 144 \n\t \n\t \n\t\t J Affect Disord \n\t\t \n\t\t\t 299 \n\t\t\t \n\t\t\t 2022 Feb 15 \n\t\t \n\t \n\t Drew RJ, Morgan PJ, Young MD. Mechanisms of an eHealth program targeting depression in men with overweight or obesity: a randomised trial. J Affect Disord 2022 Feb 15;299:309-317 [doi: 10.1016/j.jad.2021.12.001] [Medline: 34871640] 144"
    },
    {
      "title": "Behavioral and cognitive outcomes an online weight loss program for men with low mood: a randomized controlled trial",
      "authors": [
        "R Drew",
        "P Morgan",
        "C Collins",
        "R Callister",
        "F Kay-Lambkin",
        "B Kelly"
      ],
      "year": 2022,
      "doi": "10.1093/abm/kaab109",
      "journal": "Ann Behav Med",
      "volume": "56",
      "issue": "10",
      "raw": "Behavioral and cognitive outcomes an online weight loss program for men with low mood: a randomized controlled trial \n\t\t \n\t\t\t R J Drew \n\t\t \n\t\t \n\t\t\t P J Morgan \n\t\t \n\t\t \n\t\t\t C E Collins \n\t\t \n\t\t \n\t\t\t R Callister \n\t\t \n\t\t \n\t\t\t F Kay-Lambkin \n\t\t \n\t\t \n\t\t\t B J Kelly \n\t\t \n\t\t 10.1093/abm/kaab109 \n\t\t Medline: 34964449] 145 \n\t \n\t \n\t\t Ann Behav Med \n\t\t \n\t\t\t 56 \n\t\t\t 10 \n\t\t\t \n\t\t\t 2022 Oct 03 \n\t\t \n\t \n\t Drew RJ, Morgan PJ, Collins CE, Callister R, Kay-Lambkin F, Kelly BJ, et al. Behavioral and cognitive outcomes an online weight loss program for men with low mood: a randomized controlled trial. Ann Behav Med 2022 Oct 03;56(10):1026-1041 [doi: 10.1093/abm/kaab109] [Medline: 34964449] 145"
    },
    {
      "title": "MOVEdiabetes': a cluster randomized controlled trial to increase physical activity in adults with type 2 diabetes in primary health in Oman",
      "authors": [
        "T Alghafri",
        "S Alharthi",
        "Y Al-Farsi",
        "A Alrawahi",
        "E Bannerman",
        "A Craigie"
      ],
      "year": 2018,
      "doi": "10.1136/bmjdrc-2018-000605",
      "journal": "BMJ Open Diabetes Res Care",
      "volume": "6",
      "issue": "1",
      "pages": "605",
      "raw": "MOVEdiabetes': a cluster randomized controlled trial to increase physical activity in adults with type 2 diabetes in primary health in Oman \n\t\t \n\t\t\t T S Alghafri \n\t\t \n\t\t \n\t\t\t S M Alharthi \n\t\t \n\t\t \n\t\t\t Y Al-Farsi \n\t\t \n\t\t \n\t\t\t A H Alrawahi \n\t\t \n\t\t \n\t\t\t E Bannerman \n\t\t \n\t\t \n\t\t\t A M Craigie \n\t\t \n\t\t 10.1136/bmjdrc-2018-000605 \n\t\t Medline: 30487976] 146 \n\t \n\t \n\t\t BMJ Open Diabetes Res Care \n\t\t \n\t\t\t 6 \n\t\t\t 1 \n\t\t\t 605 \n\t\t\t 2018 \n\t\t \n\t \n\t FREE Full text \n\t Alghafri TS, Alharthi SM, Al-Farsi Y, Alrawahi AH, Bannerman E, Craigie AM, et al. 'MOVEdiabetes': a cluster randomized controlled trial to increase physical activity in adults with type 2 diabetes in primary health in Oman. BMJ Open Diabetes Res Care 2018;6(1):e000605 [FREE Full text] [doi: 10.1136/bmjdrc-2018-000605] [Medline: 30487976] 146"
    },
    {
      "title": "Effect of a multifactorial intervention on the increase in physical activity in subjects with type 2 diabetes mellitus: a randomized clinical trial (EMID Study)",
      "authors": [
        "R Alonso-Dom\u00ednguez",
        "M Patino-Alonso",
        "N S\u00e1nchez-Aguadero",
        "L Garc\u00eda-Ortiz",
        "J Recio-Rodr\u00edguez",
        "G\u00f3mez-Marcos Ma"
      ],
      "year": 2019,
      "doi": "10.1177/1474515119835048",
      "journal": "Eur J Cardiovasc Nurs",
      "volume": "18",
      "issue": "5",
      "raw": "Effect of a multifactorial intervention on the increase in physical activity in subjects with type 2 diabetes mellitus: a randomized clinical trial (EMID Study) \n\t\t \n\t\t\t R Alonso-Dom\u00ednguez \n\t\t \n\t\t \n\t\t\t M C Patino-Alonso \n\t\t \n\t\t \n\t\t\t N S\u00e1nchez-Aguadero \n\t\t \n\t\t \n\t\t\t L Garc\u00eda-Ortiz \n\t\t \n\t\t \n\t\t\t J I Recio-Rodr\u00edguez \n\t\t \n\t\t \n\t\t\t G\u00f3mez-Marcos Ma \n\t\t \n\t\t 10.1177/1474515119835048 \n\t\t Medline: 30808196] 147 \n\t \n\t \n\t\t Eur J Cardiovasc Nurs \n\t\t \n\t\t\t 18 \n\t\t\t 5 \n\t\t\t \n\t\t\t 2019 Jun \n\t\t \n\t \n\t Alonso-Dom\u00ednguez R, Patino-Alonso MC, S\u00e1nchez-Aguadero N, Garc\u00eda-Ortiz L, Recio-Rodr\u00edguez JI, G\u00f3mez-Marcos MA. Effect of a multifactorial intervention on the increase in physical activity in subjects with type 2 diabetes mellitus: a randomized clinical trial (EMID Study). Eur J Cardiovasc Nurs 2019 Jun;18(5):399-409 [doi: 10.1177/1474515119835048] [Medline: 30808196] 147"
    },
    {
      "title": "Home-based training program in patients with chronic heart failure and reduced ejection fraction: a randomized pilot study",
      "authors": [
        "G Andrade",
        "I Umeda",
        "A Fuchs",
        "L Mastrocola",
        "J Rossi-Neto",
        "D Moreira"
      ],
      "year": 2021,
      "doi": "10.6061/clinics/2021/e2550",
      "journal": "Clinics",
      "volume": "76",
      "pages": "2550",
      "raw": "Home-based training program in patients with chronic heart failure and reduced ejection fraction: a randomized pilot study \n\t\t \n\t\t\t G N Andrade \n\t\t \n\t\t \n\t\t\t I I Umeda \n\t\t \n\t\t \n\t\t\t A R Fuchs \n\t\t \n\t\t \n\t\t\t L E Mastrocola \n\t\t \n\t\t \n\t\t\t J M Rossi-Neto \n\t\t \n\t\t \n\t\t\t D A Moreira \n\t\t \n\t\t 10.6061/clinics/2021/e2550 \n\t\t Medline: 34133657] 148 \n\t \n\t \n\t\t Clinics \n\t\t \n\t\t\t 76 \n\t\t\t 2550 \n\t\t\t 2021 \n\t\t\t Sao Paulo \n\t\t \n\t \n\t FREE Full text \n\t Andrade GN, Umeda II, Fuchs AR, Mastrocola LE, Rossi-Neto JM, Moreira DA, et al. Home-based training program in patients with chronic heart failure and reduced ejection fraction: a randomized pilot study. Clinics (Sao Paulo) 2021;76:e2550 [FREE Full text] [doi: 10.6061/clinics/2021/e2550] [Medline: 34133657] 148"
    },
    {
      "title": "Effectiveness of text messages for decreasing inactive behaviour in patients with knee osteoarthritis: a pilot randomised controlled study",
      "authors": [
        "C Bartholdy",
        "H Bliddal",
        "M Henriksen"
      ],
      "year": 2019,
      "doi": "10.1186/s40814-019-0494-6",
      "journal": "Pilot Feasibility Stud",
      "volume": "5",
      "pages": "112",
      "raw": "Effectiveness of text messages for decreasing inactive behaviour in patients with knee osteoarthritis: a pilot randomised controlled study \n\t\t \n\t\t\t C Bartholdy \n\t\t \n\t\t \n\t\t\t H Bliddal \n\t\t \n\t\t \n\t\t\t M Henriksen \n\t\t \n\t\t 10.1186/s40814-019-0494-6 \n\t\t Medline: 31516729] 149 \n\t \n\t \n\t\t Pilot Feasibility Stud \n\t\t \n\t\t\t 5 \n\t\t\t 112 \n\t\t\t 2019 \n\t\t \n\t \n\t FREE Full text \n\t Bartholdy C, Bliddal H, Henriksen M. Effectiveness of text messages for decreasing inactive behaviour in patients with knee osteoarthritis: a pilot randomised controlled study. Pilot Feasibility Stud 2019;5:112 [FREE Full text] [doi: 10.1186/s40814-019-0494-6] [Medline: 31516729] 149"
    },
    {
      "title": "The use of a smartphone app and an activity tracker to promote physical activity in the management of chronic obstructive pulmonary disease: randomized controlled feasibility study",
      "authors": [
        "C Bentley",
        "L Powell",
        "S Potter",
        "J Parker",
        "G Mountain",
        "Y Bartlett"
      ],
      "year": 2020,
      "doi": "10.2196/16203",
      "journal": "JMIR Mhealth Uhealth",
      "volume": "8",
      "issue": "6",
      "pages": "16203",
      "raw": "The use of a smartphone app and an activity tracker to promote physical activity in the management of chronic obstructive pulmonary disease: randomized controlled feasibility study \n\t\t \n\t\t\t C L Bentley \n\t\t \n\t\t \n\t\t\t L Powell \n\t\t \n\t\t \n\t\t\t S Potter \n\t\t \n\t\t \n\t\t\t J Parker \n\t\t \n\t\t \n\t\t\t G A Mountain \n\t\t \n\t\t \n\t\t\t Y K Bartlett \n\t\t \n\t\t 10.2196/16203 \n\t\t Medline: 32490838] 150 \n\t \n\t \n\t\t JMIR Mhealth Uhealth \n\t\t \n\t\t\t 8 \n\t\t\t 6 \n\t\t\t 16203 \n\t\t\t 2020 Jun 03 \n\t\t \n\t \n\t FREE Full text \n\t Bentley CL, Powell L, Potter S, Parker J, Mountain GA, Bartlett YK, et al. The use of a smartphone app and an activity tracker to promote physical activity in the management of chronic obstructive pulmonary disease: randomized controlled feasibility study. JMIR Mhealth Uhealth 2020 Jun 03;8(6):e16203 [FREE Full text] [doi: 10.2196/16203] [Medline: 32490838] 150"
    },
    {
      "title": "Home-based telerehabilitation in older patients with chronic obstructive pulmonary disease and heart failure: a randomised controlled trial",
      "authors": [
        "P Bernocchi",
        "M Vitacca",
        "La Rovere",
        "M Volterrani",
        "M Galli",
        "T Baratti"
      ],
      "year": 2018,
      "doi": "10.3390/jcm11010011",
      "journal": "Age Ageing",
      "volume": "47",
      "issue": "1",
      "pages": "11",
      "raw": "Home-based telerehabilitation in older patients with chronic obstructive pulmonary disease and heart failure: a randomised controlled trial \n\t\t \n\t\t\t P Bernocchi \n\t\t \n\t\t \n\t\t\t M Vitacca \n\t\t \n\t\t \n\t\t\t La Rovere \n\t\t \n\t\t \n\t\t\t M T Volterrani \n\t\t \n\t\t \n\t\t\t M Galli \n\t\t \n\t\t \n\t\t\t T Baratti \n\t\t \n\t\t \n\t\t\t D \n\t\t \n\t\t 10.3390/jcm11010011 \n\t\t Medline: 35011755] 152 \n\t \n\t \n\t\t Age Ageing \n\t\t \n\t\t\t 47 \n\t\t\t 1 \n\t\t\t 11 \n\t\t\t 2018 Jan 01. 2021 Dec 21 \n\t\t \n\t \n\t Effect of a new tele-rehabilitation program versus standard rehabilitation in patients with chronic obstructive pulmonary disease J Clin Med FREE Full text \n\t Bernocchi P, Vitacca M, La Rovere MT, Volterrani M, Galli T, Baratti D, et al. Home-based telerehabilitation in older patients with chronic obstructive pulmonary disease and heart failure: a randomised controlled trial. Age Ageing 2018 Jan 01;47(1):82-88 [doi: 10.1093/ageing/afx146] [Medline: 28985325] 151. Cerd\u00e1n-de-Las-Heras J, Balbino F, L\u00f8kke A, Catal\u00e1n-Matamoros D, Hilberg O, Bendstrup E. Effect of a new tele-rehabilitation program versus standard rehabilitation in patients with chronic obstructive pulmonary disease. J Clin Med 2021 Dec 21;11(1):11 [FREE Full text] [doi: 10.3390/jcm11010011] [Medline: 35011755] 152"
    },
    {
      "title": "An interactive web-based pulmonary rehabilitation programme: a randomised controlled feasibility trial",
      "authors": [
        "E Chaplin",
        "S Hewitt",
        "L Apps",
        "K Edwards",
        "C Brough",
        "A Glab"
      ],
      "year": 2016,
      "doi": "10.1183/13993003.congress-2016.pa2064",
      "journal": "Eur Respir J",
      "volume": "48",
      "pages": "2064",
      "raw": "An interactive web-based pulmonary rehabilitation programme: a randomised controlled feasibility trial \n\t\t \n\t\t\t E Chaplin \n\t\t \n\t\t \n\t\t\t S Hewitt \n\t\t \n\t\t \n\t\t\t L Apps \n\t\t \n\t\t \n\t\t\t K Edwards \n\t\t \n\t\t \n\t\t\t C Brough \n\t\t \n\t\t \n\t\t\t A Glab \n\t\t \n\t\t 10.1183/13993003.congress-2016.pa2064 \n\t \n\t \n\t\t Eur Respir J \n\t\t \n\t\t\t 48 \n\t\t\t 2064 \n\t\t\t 2016 \n\t\t \n\t \n\t Chaplin E, Hewitt S, Apps L, Edwards K, Brough C, Glab A, et al. An interactive web-based pulmonary rehabilitation programme: a randomised controlled feasibility trial. Eur Respir J 2016;48:PA2064 [doi: 10.1183/13993003.congress-2016.PA2064] 153"
    },
    {
      "title": "Comparison of the impact of conventional and web-based pulmonary rehabilitation on physical activity in patients with chronic obstructive pulmonary disease: exploratory feasibility study",
      "authors": [
        "E Chaplin",
        "A Barnes",
        "C Newby",
        "L Houchen-Wolloff",
        "S Singh"
      ],
      "year": 2022,
      "doi": "10.2196/28875",
      "journal": "JMIR Rehabil Assist Technol",
      "volume": "9",
      "issue": "1",
      "pages": "28875",
      "raw": "Comparison of the impact of conventional and web-based pulmonary rehabilitation on physical activity in patients with chronic obstructive pulmonary disease: exploratory feasibility study \n\t\t \n\t\t\t E Chaplin \n\t\t \n\t\t \n\t\t\t A Barnes \n\t\t \n\t\t \n\t\t\t C Newby \n\t\t \n\t\t \n\t\t\t L Houchen-Wolloff \n\t\t \n\t\t \n\t\t\t S J Singh \n\t\t \n\t\t 10.2196/28875 \n\t\t Medline: 35266871] 154 \n\t \n\t \n\t\t JMIR Rehabil Assist Technol \n\t\t \n\t\t\t 9 \n\t\t\t 1 \n\t\t\t 28875 \n\t\t\t 2022 Mar 10 \n\t\t \n\t \n\t FREE Full text \n\t Chaplin E, Barnes A, Newby C, Houchen-Wolloff L, Singh SJ. Comparison of the impact of conventional and web-based pulmonary rehabilitation on physical activity in patients with chronic obstructive pulmonary disease: exploratory feasibility study. JMIR Rehabil Assist Technol 2022 Mar 10;9(1):e28875 [FREE Full text] [doi: 10.2196/28875] [Medline: 35266871] 154"
    },
    {
      "title": "Proof-of-concept trial results of the HeartMan mobile personal health system for self-management in congestive heart failure",
      "authors": [
        "E Clays",
        "P Puddu",
        "M Lu\u0161trek",
        "G Pioggia",
        "J Derboven",
        "M Vrana"
      ],
      "year": 2021,
      "doi": "10.1038/s41598-021-84920-4",
      "journal": "Sci Rep",
      "volume": "11",
      "issue": "1",
      "pages": "5663",
      "raw": "Proof-of-concept trial results of the HeartMan mobile personal health system for self-management in congestive heart failure \n\t\t \n\t\t\t E Clays \n\t\t \n\t\t \n\t\t\t P E Puddu \n\t\t \n\t\t \n\t\t\t M Lu\u0161trek \n\t\t \n\t\t \n\t\t\t G Pioggia \n\t\t \n\t\t \n\t\t\t J Derboven \n\t\t \n\t\t \n\t\t\t M Vrana \n\t\t \n\t\t 10.1038/s41598-021-84920-4 \n\t\t Medline: 33707523] 155 \n\t \n\t \n\t\t Sci Rep \n\t\t \n\t\t\t 11 \n\t\t\t 1 \n\t\t\t 5663 \n\t\t\t 2021 Mar 11 \n\t\t \n\t \n\t FREE Full text \n\t Clays E, Puddu PE, Lu\u0161trek M, Pioggia G, Derboven J, Vrana M, et al. Proof-of-concept trial results of the HeartMan mobile personal health system for self-management in congestive heart failure. Sci Rep 2021 Mar 11;11(1):5663 [FREE Full text] [doi: 10.1038/s41598-021-84920-4] [Medline: 33707523] 155"
    },
    {
      "title": "The effects of a pedometer-based behavioral modification program with telephone support on physical activity and sedentary behavior in type 2 diabetes patients",
      "authors": [
        "De Greef",
        "K Deforche",
        "B Ruige",
        "J Bouckaert",
        "Tudor Locke",
        "C Kaufman"
      ],
      "year": 2011,
      "doi": "10.1016/j.pec.2010.07.010",
      "journal": "Patient Educ Couns",
      "volume": "84",
      "issue": "2",
      "raw": "The effects of a pedometer-based behavioral modification program with telephone support on physical activity and sedentary behavior in type 2 diabetes patients \n\t\t \n\t\t\t De Greef \n\t\t \n\t\t \n\t\t\t K P Deforche \n\t\t \n\t\t \n\t\t\t B I Ruige \n\t\t \n\t\t \n\t\t\t J B Bouckaert \n\t\t \n\t\t \n\t\t\t J J \n\t\t \n\t\t \n\t\t\t Tudor - Locke \n\t\t \n\t\t \n\t\t\t C E Kaufman \n\t\t \n\t\t \n\t\t\t J M \n\t\t \n\t\t 10.1016/j.pec.2010.07.010 \n\t\t Medline: 20732776] 156 \n\t \n\t \n\t\t Patient Educ Couns \n\t\t \n\t\t\t 84 \n\t\t\t 2 \n\t\t\t \n\t\t\t 2011 Aug \n\t\t \n\t \n\t De Greef KP, Deforche BI, Ruige JB, Bouckaert JJ, Tudor-Locke CE, Kaufman JM, et al. The effects of a pedometer-based behavioral modification program with telephone support on physical activity and sedentary behavior in type 2 diabetes patients. Patient Educ Couns 2011 Aug;84(2):275-279 [doi: 10.1016/j.pec.2010.07.010] [Medline: 20732776] 156"
    },
    {
      "title": "PROactive study groupthe PROactive consortium. Physical activity is increased by a 12-week semiautomated telecoaching programme in patients with COPD: a multicentre randomised controlled trial",
      "authors": [
        "H Demeyer",
        "Z Louvaris",
        "A Frei",
        "R Rabinovich",
        "C De Jong",
        "E Gimeno-Santos",
        "Mr Papp"
      ],
      "year": 2017,
      "doi": "10.1136/thoraxjnl-2016-209026",
      "journal": "Thorax",
      "volume": "72",
      "issue": "5",
      "raw": "PROactive study groupthe PROactive consortium. Physical activity is increased by a 12-week semiautomated telecoaching programme in patients with COPD: a multicentre randomised controlled trial \n\t\t \n\t\t\t H Demeyer \n\t\t \n\t\t \n\t\t\t Z Louvaris \n\t\t \n\t\t \n\t\t\t A Frei \n\t\t \n\t\t \n\t\t\t R A Rabinovich \n\t\t \n\t\t \n\t\t\t C De Jong \n\t\t \n\t\t \n\t\t\t E Gimeno-Santos \n\t\t \n\t\t \n\t\t\t Mr Papp \n\t\t \n\t\t 10.1136/thoraxjnl-2016-209026 \n\t\t Medline: 28137918] 157 \n\t \n\t \n\t\t Thorax \n\t\t \n\t\t\t 72 \n\t\t\t 5 \n\t\t\t \n\t\t\t 2017 May \n\t\t \n\t \n\t FREE Full text \n\t Demeyer H, Louvaris Z, Frei A, Rabinovich RA, de Jong C, Gimeno-Santos E, Mr Papp PROactive study groupthe PROactive consortium. Physical activity is increased by a 12-week semiautomated telecoaching programme in patients with COPD: a multicentre randomised controlled trial. Thorax 2017 May;72(5):415-423 [FREE Full text] [doi: 10.1136/thoraxjnl-2016-209026] [Medline: 28137918] 157"
    },
    {
      "title": "Telephone-delivered lifestyle support with action planning and motivational interviewing techniques to improve rehabilitation outcomes",
      "authors": [
        "A D\u00f6bler",
        "Herbeck Belnap",
        "B Pollmann",
        "H Farin",
        "E Raspe",
        "H Mittag"
      ],
      "year": 2018,
      "doi": "10.1037/rep0000224",
      "journal": "Rehabil Psychol",
      "volume": "63",
      "issue": "2",
      "raw": "Telephone-delivered lifestyle support with action planning and motivational interviewing techniques to improve rehabilitation outcomes \n\t\t \n\t\t\t A D\u00f6bler \n\t\t \n\t\t \n\t\t\t Herbeck Belnap \n\t\t \n\t\t \n\t\t\t B Pollmann \n\t\t \n\t\t \n\t\t\t H Farin \n\t\t \n\t\t \n\t\t\t E Raspe \n\t\t \n\t\t \n\t\t\t H Mittag \n\t\t \n\t\t \n\t\t\t O \n\t\t \n\t\t 10.1037/rep0000224 \n\t\t Medline: 29878825] 158 \n\t \n\t \n\t\t Rehabil Psychol \n\t\t \n\t\t\t 63 \n\t\t\t 2 \n\t\t\t \n\t\t\t 2018 May \n\t\t \n\t \n\t D\u00f6bler A, Herbeck Belnap B, Pollmann H, Farin E, Raspe H, Mittag O. Telephone-delivered lifestyle support with action planning and motivational interviewing techniques to improve rehabilitation outcomes. Rehabil Psychol 2018 May;63(2):170-181 [doi: 10.1037/rep0000224] [Medline: 29878825] 158"
    },
    {
      "title": "Feasibility and preliminary effects of a tele-prehabilitation program and an in-person prehablitation program compared to usual care for total hip or knee arthroplasty candidates: a pilot randomized controlled trial",
      "authors": [
        "P Doiron-Cadrin",
        "D Kairy",
        "P Vendittoli",
        "V Lowry",
        "S Poitras",
        "F Desmeules"
      ],
      "year": 2020,
      "doi": "10.1080/09638288.2018.1515992",
      "journal": "Disabil Rehabil",
      "volume": "42",
      "issue": "7",
      "raw": "Feasibility and preliminary effects of a tele-prehabilitation program and an in-person prehablitation program compared to usual care for total hip or knee arthroplasty candidates: a pilot randomized controlled trial \n\t\t \n\t\t\t P Doiron-Cadrin \n\t\t \n\t\t \n\t\t\t D Kairy \n\t\t \n\t\t \n\t\t\t P A Vendittoli \n\t\t \n\t\t \n\t\t\t V Lowry \n\t\t \n\t\t \n\t\t\t S Poitras \n\t\t \n\t\t \n\t\t\t F Desmeules \n\t\t \n\t\t 10.1080/09638288.2018.1515992 \n\t\t Medline: 30638076] 159 \n\t \n\t \n\t\t Disabil Rehabil \n\t\t \n\t\t\t 42 \n\t\t\t 7 \n\t\t\t \n\t\t\t 2020 Apr 13 \n\t\t \n\t \n\t Doiron-Cadrin P, Kairy D, Vendittoli PA, Lowry V, Poitras S, Desmeules F. Feasibility and preliminary effects of a tele-prehabilitation program and an in-person prehablitation program compared to usual care for total hip or knee arthroplasty candidates: a pilot randomized controlled trial. Disabil Rehabil 2020 Apr 13;42(7):989-998 [doi: 10.1080/09638288.2018.1515992] [Medline: 30638076] 159"
    },
    {
      "title": "Effect of tele-rehabilitation on glucose control, exercise capacity, physical fitness, muscle strength and psychosocial status in patients with type 2 diabetes: a double blind randomized controlled trial",
      "authors": [
        "N Duruturk",
        "M \u00d6zk\u00f6sl\u00fc"
      ],
      "year": 2019,
      "doi": "10.1016/j.pcd.2019.03.007",
      "journal": "Primary Care Diabetes",
      "volume": "13",
      "issue": "6",
      "raw": "Effect of tele-rehabilitation on glucose control, exercise capacity, physical fitness, muscle strength and psychosocial status in patients with type 2 diabetes: a double blind randomized controlled trial \n\t\t \n\t\t\t N Duruturk \n\t\t \n\t\t \n\t\t\t M A \u00d6zk\u00f6sl\u00fc \n\t\t \n\t\t 10.1016/j.pcd.2019.03.007 \n\t\t Medline: 31014938] 160 \n\t \n\t \n\t\t Primary Care Diabetes \n\t\t \n\t\t\t 13 \n\t\t\t 6 \n\t\t\t \n\t\t\t 2019 Dec \n\t\t \n\t \n\t Duruturk N, \u00d6zk\u00f6sl\u00fc MA. Effect of tele-rehabilitation on glucose control, exercise capacity, physical fitness, muscle strength and psychosocial status in patients with type 2 diabetes: a double blind randomized controlled trial. Primary Care Diabetes 2019 Dec;13(6):542-548 [doi: 10.1016/j.pcd.2019.03.007] [Medline: 31014938] 160"
    },
    {
      "title": "Medium-term effectiveness of a comprehensive internet-based and patient-specific telerehabilitation program with text messaging support for cardiac patients: randomized controlled trial",
      "authors": [
        "I Frederix",
        "D Hansen",
        "K Coninx",
        "P Vandervoort",
        "D Vandijck",
        "N Hens"
      ],
      "year": 2015,
      "doi": "10.2196/jmir.4799",
      "journal": "J Med Internet Res",
      "volume": "17",
      "issue": "7",
      "pages": "185",
      "raw": "Medium-term effectiveness of a comprehensive internet-based and patient-specific telerehabilitation program with text messaging support for cardiac patients: randomized controlled trial \n\t\t \n\t\t\t I Frederix \n\t\t \n\t\t \n\t\t\t D Hansen \n\t\t \n\t\t \n\t\t\t K Coninx \n\t\t \n\t\t \n\t\t\t P Vandervoort \n\t\t \n\t\t \n\t\t\t D Vandijck \n\t\t \n\t\t \n\t\t\t N Hens \n\t\t \n\t\t 10.2196/jmir.4799 \n\t\t Medline: 26206311] 161 \n\t \n\t \n\t\t J Med Internet Res \n\t\t \n\t\t\t 17 \n\t\t\t 7 \n\t\t\t 185 \n\t\t\t 2015 Jul 23 \n\t\t \n\t \n\t FREE Full text \n\t Frederix I, Hansen D, Coninx K, Vandervoort P, Vandijck D, Hens N, et al. Medium-term effectiveness of a comprehensive internet-based and patient-specific telerehabilitation program with text messaging support for cardiac patients: randomized controlled trial. J Med Internet Res 2015 Jul 23;17(7):e185 [FREE Full text] [doi: 10.2196/jmir.4799] [Medline: 26206311] 161"
    },
    {
      "title": "A randomized controlled trial of an educational programme to improve self-care in Brazilian patients following percutaneous coronary intervention",
      "authors": [
        "R Furuya",
        "E Arantes",
        "C Dessotte",
        "M Ciol",
        "J Hoffman",
        "A Schmidt"
      ],
      "year": 2015,
      "doi": "10.1111/jan.12568",
      "journal": "J Adv Nurs",
      "volume": "71",
      "issue": "4",
      "raw": "A randomized controlled trial of an educational programme to improve self-care in Brazilian patients following percutaneous coronary intervention \n\t\t \n\t\t\t R K Furuya \n\t\t \n\t\t \n\t\t\t E C Arantes \n\t\t \n\t\t \n\t\t\t C A Dessotte \n\t\t \n\t\t \n\t\t\t M A Ciol \n\t\t \n\t\t \n\t\t\t J M Hoffman \n\t\t \n\t\t \n\t\t\t A Schmidt \n\t\t \n\t\t 10.1111/jan.12568 \n\t\t Medline: 25400127] 162 \n\t \n\t \n\t\t J Adv Nurs \n\t\t \n\t\t\t 71 \n\t\t\t 4 \n\t\t\t \n\t\t\t 2015 Apr 17 \n\t\t \n\t \n\t Furuya RK, Arantes EC, Dessotte CA, Ciol MA, Hoffman JM, Schmidt A, et al. A randomized controlled trial of an educational programme to improve self-care in Brazilian patients following percutaneous coronary intervention. J Adv Nurs 2015 Apr 17;71(4):895-908 [doi: 10.1111/jan.12568] [Medline: 25400127] 162"
    },
    {
      "title": "Individualized web-based exercise for the treatment of depression: randomized controlled trial",
      "authors": [
        "N Haller",
        "S Lorenz",
        "D Pfirrmann",
        "C Koch",
        "K Lieb",
        "U Dettweiler"
      ],
      "year": 2018,
      "doi": "10.2196/10698",
      "journal": "JMIR Ment Health",
      "volume": "5",
      "issue": "4",
      "pages": "10698",
      "raw": "Individualized web-based exercise for the treatment of depression: randomized controlled trial \n\t\t \n\t\t\t N Haller \n\t\t \n\t\t \n\t\t\t S Lorenz \n\t\t \n\t\t \n\t\t\t D Pfirrmann \n\t\t \n\t\t \n\t\t\t C Koch \n\t\t \n\t\t \n\t\t\t K Lieb \n\t\t \n\t\t \n\t\t\t U Dettweiler \n\t\t \n\t\t 10.2196/10698 \n\t\t Medline: 30314962] 163 \n\t \n\t \n\t\t JMIR Ment Health \n\t\t \n\t\t\t 5 \n\t\t\t 4 \n\t\t\t 10698 \n\t\t\t 2018 Oct 12 \n\t\t \n\t \n\t FREE Full text \n\t Haller N, Lorenz S, Pfirrmann D, Koch C, Lieb K, Dettweiler U, et al. Individualized web-based exercise for the treatment of depression: randomized controlled trial. JMIR Ment Health 2018 Oct 12;5(4):e10698 [FREE Full text] [doi: 10.2196/10698] [Medline: 30314962] 163"
    },
    {
      "title": "Comparison of a structured home-based rehabilitation programme with conventional supervised pulmonary rehabilitation: a randomised non-inferiority trial",
      "authors": [
        "E Horton",
        "K Mitchell",
        "V Johnson-Warrington",
        "L Apps",
        "L Sewell",
        "M Morgan"
      ],
      "year": 2018,
      "doi": "10.1136/thoraxjnl-2016-208506",
      "journal": "Thorax",
      "volume": "73",
      "issue": "1",
      "raw": "Comparison of a structured home-based rehabilitation programme with conventional supervised pulmonary rehabilitation: a randomised non-inferiority trial \n\t\t \n\t\t\t E J Horton \n\t\t \n\t\t \n\t\t\t K E Mitchell \n\t\t \n\t\t \n\t\t\t V Johnson-Warrington \n\t\t \n\t\t \n\t\t\t L D Apps \n\t\t \n\t\t \n\t\t\t L Sewell \n\t\t \n\t\t \n\t\t\t M Morgan \n\t\t \n\t\t 10.1136/thoraxjnl-2016-208506 \n\t\t Medline: 28756402] 164 \n\t \n\t \n\t\t Thorax \n\t\t \n\t\t\t 73 \n\t\t\t 1 \n\t\t\t \n\t\t\t 2018 Jan 29 \n\t\t \n\t \n\t Horton EJ, Mitchell KE, Johnson-Warrington V, Apps LD, Sewell L, Morgan M, et al. Comparison of a structured home-based rehabilitation programme with conventional supervised pulmonary rehabilitation: a randomised non-inferiority trial. Thorax 2018 Jan 29;73(1):29-36 [doi: 10.1136/thoraxjnl-2016-208506] [Medline: 28756402] 164"
    },
    {
      "title": "A comparison of physical activity between home-based and centre-based pulmonary rehabilitation: a randomised controlled secondary analysis",
      "authors": [
        "E Horton",
        "J Ruksenaite",
        "K Mitchell",
        "L Sewell",
        "C Newby",
        "S Singh"
      ],
      "year": 2021,
      "doi": "10.3389/fresc.2021.743441",
      "journal": "Front Rehabil Sci",
      "volume": "2",
      "pages": "743441",
      "raw": "A comparison of physical activity between home-based and centre-based pulmonary rehabilitation: a randomised controlled secondary analysis \n\t\t \n\t\t\t E J Horton \n\t\t \n\t\t \n\t\t\t J Ruksenaite \n\t\t \n\t\t \n\t\t\t K Mitchell \n\t\t \n\t\t \n\t\t\t L Sewell \n\t\t \n\t\t \n\t\t\t C Newby \n\t\t \n\t\t \n\t\t\t S J Singh \n\t\t \n\t\t 10.3389/fresc.2021.743441 \n\t\t Medline: 36188808] 165 \n\t \n\t \n\t\t Front Rehabil Sci \n\t\t \n\t\t\t 2 \n\t\t\t 743441 \n\t\t\t 2021 \n\t\t \n\t \n\t FREE Full text \n\t Horton EJ, Ruksenaite J, Mitchell K, Sewell L, Newby C, Singh SJ. A comparison of physical activity between home-based and centre-based pulmonary rehabilitation: a randomised controlled secondary analysis. Front Rehabil Sci 2021;2:743441 [FREE Full text] [doi: 10.3389/fresc.2021.743441] [Medline: 36188808] 165"
    },
    {
      "title": "The effectiveness, reproducibility, and durability of tailored mobile coaching on diabetes management in policyholders: a randomized, controlled, open-label study",
      "authors": [
        "D Lee",
        "J Park",
        "D Choi",
        "H Ahn",
        "S Park",
        "C Park"
      ],
      "year": 2018,
      "doi": "10.1038/s41598-018-22034-0",
      "journal": "Sci Rep",
      "volume": "8",
      "issue": "1",
      "pages": "3642",
      "raw": "The effectiveness, reproducibility, and durability of tailored mobile coaching on diabetes management in policyholders: a randomized, controlled, open-label study \n\t\t \n\t\t\t D Y Lee \n\t\t \n\t\t \n\t\t\t J Park \n\t\t \n\t\t \n\t\t\t D Choi \n\t\t \n\t\t \n\t\t\t H Y Ahn \n\t\t \n\t\t \n\t\t\t S W Park \n\t\t \n\t\t \n\t\t\t C Y Park \n\t\t \n\t\t 10.1038/s41598-018-22034-0 \n\t\t Medline: 29483559] 166 \n\t \n\t \n\t\t Sci Rep \n\t\t \n\t\t\t 8 \n\t\t\t 1 \n\t\t\t 3642 \n\t\t\t 2018 Feb 26 \n\t\t \n\t \n\t FREE Full text \n\t Lee DY, Park J, Choi D, Ahn HY, Park SW, Park CY. The effectiveness, reproducibility, and durability of tailored mobile coaching on diabetes management in policyholders: a randomized, controlled, open-label study. Sci Rep 2018 Feb 26;8(1):3642 [FREE Full text] [doi: 10.1038/s41598-018-22034-0] [Medline: 29483559] 166"
    },
    {
      "title": "Effects of a 12-week multifaceted wearable-based program for people with knee osteoarthritis: randomized controlled trial",
      "authors": [
        "L Li",
        "L Feehan",
        "H Xie",
        "N Lu",
        "C Shaw",
        "D Gromala"
      ],
      "year": 2020,
      "doi": "10.2196/19116",
      "journal": "JMIR Mhealth Uhealth",
      "volume": "8",
      "issue": "7",
      "pages": "e19116",
      "raw": "Effects of a 12-week multifaceted wearable-based program for people with knee osteoarthritis: randomized controlled trial \n\t\t \n\t\t\t L C Li \n\t\t \n\t\t \n\t\t\t L M Feehan \n\t\t \n\t\t \n\t\t\t H Xie \n\t\t \n\t\t \n\t\t\t N Lu \n\t\t \n\t\t \n\t\t\t C D Shaw \n\t\t \n\t\t \n\t\t\t D Gromala \n\t\t \n\t\t 10.2196/19116 \n\t\t Medline: 32618578] 167 \n\t \n\t \n\t\t JMIR Mhealth Uhealth \n\t\t \n\t\t\t 8 \n\t\t\t 7 \n\t\t\t e19116 \n\t\t\t 2020 Jul 03 \n\t\t \n\t \n\t FREE Full text \n\t Li LC, Feehan LM, Xie H, Lu N, Shaw CD, Gromala D, et al. Effects of a 12-week multifaceted wearable-based program for people with knee osteoarthritis: randomized controlled trial. JMIR Mhealth Uhealth 2020 Jul 03;8(7):e19116 [FREE Full text] [doi: 10.2196/19116] [Medline: 32618578] 167"
    },
    {
      "title": "The long-term maintenance effect of remote pulmonary rehabilitation via social media in COPD: a randomized controlled trial",
      "authors": [
        "Y Li",
        "H Qian",
        "K Yu",
        "Y Huang"
      ],
      "year": 2022,
      "doi": "10.2147/copd.s360125",
      "journal": "COPD",
      "volume": "17",
      "raw": "The long-term maintenance effect of remote pulmonary rehabilitation via social media in COPD: a randomized controlled trial \n\t\t \n\t\t\t Y Li \n\t\t \n\t\t \n\t\t\t H Qian \n\t\t \n\t\t \n\t\t\t K Yu \n\t\t \n\t\t \n\t\t\t Y Huang \n\t\t \n\t\t 10.2147/copd.s360125 \n\t \n\t \n\t\t COPD \n\t\t \n\t\t\t 17 \n\t\t\t \n\t\t\t 2022 May \n\t\t \n\t \n\t Li Y, Qian H, Yu K, Huang Y. The long-term maintenance effect of remote pulmonary rehabilitation via social media in COPD: a randomized controlled trial. COPD 2022 May;Volume 17:1131-1142 [doi: 10.2147/copd.s360125] 168"
    },
    {
      "title": "Effect of a smartphone app on weight change and metabolic outcomes in Asian adults with type 2 diabetes: a randomized clinical trial",
      "authors": [
        "S Lim",
        "K Ong",
        "J Johal",
        "C Han",
        "Q Yap",
        "Y Chan"
      ],
      "year": 2021,
      "doi": "10.1001/jamanetworkopen.2021.12417",
      "journal": "JAMA Netw Open",
      "volume": "4",
      "issue": "6",
      "pages": "2112417",
      "raw": "Effect of a smartphone app on weight change and metabolic outcomes in Asian adults with type 2 diabetes: a randomized clinical trial \n\t\t \n\t\t\t S L Lim \n\t\t \n\t\t \n\t\t\t K W Ong \n\t\t \n\t\t \n\t\t\t J Johal \n\t\t \n\t\t \n\t\t\t C Y Han \n\t\t \n\t\t \n\t\t\t Q V Yap \n\t\t \n\t\t \n\t\t\t Y H Chan \n\t\t \n\t\t 10.1001/jamanetworkopen.2021.12417 \n\t\t Medline: 34081137] 169 \n\t \n\t \n\t\t JAMA Netw Open \n\t\t \n\t\t\t 4 \n\t\t\t 6 \n\t\t\t 2112417 \n\t\t\t 2021 Jun 01 \n\t\t \n\t \n\t FREE Full text \n\t Lim SL, Ong KW, Johal J, Han CY, Yap QV, Chan YH, et al. Effect of a smartphone app on weight change and metabolic outcomes in Asian adults with type 2 diabetes: a randomized clinical trial. JAMA Netw Open 2021 Jun 01;4(6):e2112417 [FREE Full text] [doi: 10.1001/jamanetworkopen.2021.12417] [Medline: 34081137] 169"
    },
    {
      "title": "Effect of a lifestyle-focused web-based application on risk factor management in patients who have had a myocardial infarction: randomized controlled trial",
      "authors": [
        "H Michelsen",
        "I Sj\u00f6lin",
        "M B\u00e4ck",
        "M Garcia",
        "A Olsson",
        "C Sandberg"
      ],
      "year": 2022,
      "doi": "10.2196/25224",
      "journal": "J Med Internet Res",
      "volume": "24",
      "issue": "3",
      "pages": "25224",
      "raw": "Effect of a lifestyle-focused web-based application on risk factor management in patients who have had a myocardial infarction: randomized controlled trial \n\t\t \n\t\t\t H Michelsen \n\t\t \n\t\t \n\t\t\t I Sj\u00f6lin \n\t\t \n\t\t \n\t\t\t M B\u00e4ck \n\t\t \n\t\t \n\t\t\t M G Garcia \n\t\t \n\t\t \n\t\t\t A Olsson \n\t\t \n\t\t \n\t\t\t C Sandberg \n\t\t \n\t\t 10.2196/25224 \n\t\t Medline: 35357316] 170 \n\t \n\t \n\t\t J Med Internet Res \n\t\t \n\t\t\t 24 \n\t\t\t 3 \n\t\t\t 25224 \n\t\t\t 2022 Mar 31 \n\t\t \n\t \n\t FREE Full text \n\t \u00d6gmundsd\u00f3ttir Michelsen H, Sj\u00f6lin I, B\u00e4ck M, Garcia MG, Olsson A, Sandberg C, et al. Effect of a lifestyle-focused web-based application on risk factor management in patients who have had a myocardial infarction: randomized controlled trial. J Med Internet Res 2022 Mar 31;24(3):e25224 [FREE Full text] [doi: 10.2196/25224] [Medline: 35357316] 170"
    },
    {
      "title": "Effect of a home exercise video programme in patients with chronic obstructive pulmonary disease",
      "authors": [
        "J Moore",
        "H Fiddler",
        "J Seymour",
        "A Grant",
        "C Jolley",
        "L Johnson"
      ],
      "year": 2009,
      "doi": "10.2340/16501977-0308",
      "journal": "J Rehabil Med",
      "volume": "41",
      "issue": "3",
      "raw": "Effect of a home exercise video programme in patients with chronic obstructive pulmonary disease \n\t\t \n\t\t\t J Moore \n\t\t \n\t\t \n\t\t\t H Fiddler \n\t\t \n\t\t \n\t\t\t J Seymour \n\t\t \n\t\t \n\t\t\t A Grant \n\t\t \n\t\t \n\t\t\t C Jolley \n\t\t \n\t\t \n\t\t\t L Johnson \n\t\t \n\t\t 10.2340/16501977-0308 \n\t\t Medline: 19229454] 171 \n\t \n\t \n\t\t J Rehabil Med \n\t\t \n\t\t\t 41 \n\t\t\t 3 \n\t\t\t \n\t\t\t 2009 Feb \n\t\t \n\t \n\t FREE Full text \n\t Moore J, Fiddler H, Seymour J, Grant A, Jolley C, Johnson L, et al. Effect of a home exercise video programme in patients with chronic obstructive pulmonary disease. J Rehabil Med 2009 Feb;41(3):195-200 [FREE Full text] [doi: 10.2340/16501977-0308] [Medline: 19229454] 171"
    },
    {
      "title": "Home-based cardiac rehabilitation using information and communication technology for heart failure patients with frailty",
      "authors": [
        "Y Nagatomi",
        "T Ide",
        "T Higuchi",
        "T Nezu",
        "T Fujino",
        "T Tohyama"
      ],
      "year": 2022,
      "doi": "10.1002/ehf2.13934",
      "journal": "ESC Heart Fail",
      "volume": "9",
      "issue": "4",
      "raw": "Home-based cardiac rehabilitation using information and communication technology for heart failure patients with frailty \n\t\t \n\t\t\t Y Nagatomi \n\t\t \n\t\t \n\t\t\t T Ide \n\t\t \n\t\t \n\t\t\t T Higuchi \n\t\t \n\t\t \n\t\t\t T Nezu \n\t\t \n\t\t \n\t\t\t T Fujino \n\t\t \n\t\t \n\t\t\t T Tohyama \n\t\t \n\t\t 10.1002/ehf2.13934 \n\t\t Medline: 35534907] 172 \n\t \n\t \n\t\t ESC Heart Fail \n\t\t \n\t\t\t 9 \n\t\t\t 4 \n\t\t\t \n\t\t\t 2022 Aug \n\t\t \n\t \n\t FREE Full text \n\t Nagatomi Y, Ide T, Higuchi T, Nezu T, Fujino T, Tohyama T, et al. Home-based cardiac rehabilitation using information and communication technology for heart failure patients with frailty. ESC Heart Fail 2022 Aug;9(4):2407-2418 [FREE Full text] [doi: 10.1002/ehf2.13934] [Medline: 35534907] 172"
    },
    {
      "title": "Effects of self-management education through telephone follow-up in diabetic patients",
      "authors": [
        "Namjoo Nasab",
        "M Ghavam",
        "A Yazdanpanah",
        "A Jahangir",
        "F Shokrpour"
      ],
      "year": 2017,
      "doi": "10.1097/hcm.0000000000000172",
      "journal": "Health Care Manag",
      "volume": "36",
      "issue": "3",
      "raw": "Effects of self-management education through telephone follow-up in diabetic patients \n\t\t \n\t\t\t Namjoo Nasab \n\t\t \n\t\t \n\t\t\t M Ghavam \n\t\t \n\t\t \n\t\t\t A Yazdanpanah \n\t\t \n\t\t \n\t\t\t A Jahangir \n\t\t \n\t\t \n\t\t\t F Shokrpour \n\t\t \n\t\t \n\t\t\t N \n\t\t \n\t\t 10.1097/hcm.0000000000000172 \n\t \n\t \n\t\t Health Care Manag \n\t\t \n\t\t\t 36 \n\t\t\t 3 \n\t\t\t \n\t\t\t 2017 \n\t\t \n\t \n\t Namjoo Nasab M, Ghavam A, Yazdanpanah A, Jahangir F, Shokrpour N. Effects of self-management education through telephone follow-up in diabetic patients. Health Care Manag 2017;36(3):273-281 [doi: 10.1097/hcm.0000000000000172] 173"
    },
    {
      "title": "Effects of an intensive long-term prevention programme after myocardial infarction -a randomized trial",
      "authors": [
        "H Wienbergen",
        "A Fach",
        "S Meyer",
        "J Meyer",
        "J Stehmeier",
        "T Backhaus"
      ],
      "year": 2019,
      "doi": "10.1177/2047487318781109",
      "journal": "Eur J Prev Cardiol",
      "volume": "26",
      "issue": "5",
      "raw": "Effects of an intensive long-term prevention programme after myocardial infarction -a randomized trial \n\t\t \n\t\t\t H Wienbergen \n\t\t \n\t\t \n\t\t\t A Fach \n\t\t \n\t\t \n\t\t\t S Meyer \n\t\t \n\t\t \n\t\t\t J Meyer \n\t\t \n\t\t \n\t\t\t J Stehmeier \n\t\t \n\t\t \n\t\t\t T Backhaus \n\t\t \n\t\t 10.1177/2047487318781109 \n\t\t Medline: 29911893] 174 \n\t \n\t \n\t\t Eur J Prev Cardiol \n\t\t \n\t\t\t 26 \n\t\t\t 5 \n\t\t\t \n\t\t\t 2019 Mar 18 \n\t\t \n\t \n\t Wienbergen H, Fach A, Meyer S, Meyer J, Stehmeier J, Backhaus T, et al. Effects of an intensive long-term prevention programme after myocardial infarction -a randomized trial. Eur J Prev Cardiol 2019 Mar 18;26(5):522-530 [doi: 10.1177/2047487318781109] [Medline: 29911893] 174"
    },
    {
      "title": "Long-term effects of an intensive prevention program after acute myocardial infarction",
      "authors": [
        "R Osteresch",
        "A Fach",
        "F Frielitz",
        "S Meyer",
        "J Schmucker",
        "S R\u00fchle"
      ],
      "year": 2021,
      "doi": "10.1016/j.amjcard.2021.05.034",
      "journal": "Am J Cardiol",
      "volume": "154",
      "raw": "Long-term effects of an intensive prevention program after acute myocardial infarction \n\t\t \n\t\t\t R Osteresch \n\t\t \n\t\t \n\t\t\t A Fach \n\t\t \n\t\t \n\t\t\t F S Frielitz \n\t\t \n\t\t \n\t\t\t S Meyer \n\t\t \n\t\t \n\t\t\t J Schmucker \n\t\t \n\t\t \n\t\t\t S R\u00fchle \n\t\t \n\t\t 10.1016/j.amjcard.2021.05.034 \n\t\t Medline: 34238446] 175 \n\t \n\t \n\t\t Am J Cardiol \n\t\t \n\t\t\t 154 \n\t\t\t \n\t\t\t 2021 Sep 01 \n\t\t \n\t \n\t Osteresch R, Fach A, Frielitz FS, Meyer S, Schmucker J, R\u00fchle S, et al. Long-term effects of an intensive prevention program after acute myocardial infarction. Am J Cardiol 2021 Sep 01;154:7-13 [doi: 10.1016/j.amjcard.2021.05.034] [Medline: 34238446] 175"
    },
    {
      "title": "Home-based telehealth exercise training program in Chinese patients with heart failure: a randomized controlled trial",
      "authors": [
        "X Peng",
        "Y Su",
        "Z Hu",
        "X Sun",
        "X Li",
        "M Dolansky"
      ],
      "year": 2018,
      "doi": "10.1097/md.0000000000012069",
      "journal": "Medicine",
      "volume": "97",
      "issue": "35",
      "pages": "12069",
      "raw": "Home-based telehealth exercise training program in Chinese patients with heart failure: a randomized controlled trial \n\t\t \n\t\t\t X Peng \n\t\t \n\t\t \n\t\t\t Y Su \n\t\t \n\t\t \n\t\t\t Z Hu \n\t\t \n\t\t \n\t\t\t X Sun \n\t\t \n\t\t \n\t\t\t X Li \n\t\t \n\t\t \n\t\t\t M A Dolansky \n\t\t \n\t\t 10.1097/md.0000000000012069 \n\t\t Medline: 30170422] 176 \n\t \n\t \n\t\t Medicine \n\t\t \n\t\t\t 97 \n\t\t\t 35 \n\t\t\t 12069 \n\t\t\t 2018 Aug \n\t\t\t Baltimore \n\t\t \n\t \n\t FREE Full text \n\t Peng X, Su Y, Hu Z, Sun X, Li X, Dolansky MA, et al. Home-based telehealth exercise training program in Chinese patients with heart failure: a randomized controlled trial. Medicine (Baltimore) 2018 Aug;97(35):e12069 [FREE Full text] [doi: 10.1097/MD.0000000000012069] [Medline: 30170422] 176"
    },
    {
      "title": "Home-based telemonitored Nordic walking training is well accepted, safe, effective and has high adherence among heart failure patients, including those with cardiovascular implantable electronic devices: a randomised controlled study",
      "authors": [
        "E Piotrowicz",
        "T Zieli\u0144ski",
        "R Bodalski",
        "T Rywik",
        "B Dobraszkiewicz-Wasilewska",
        "M Sobieszcza\u0144ska-Ma\u0142ek"
      ],
      "year": 2015,
      "doi": "10.1177/2047487314551537",
      "journal": "Eur J Prev Cardiol",
      "volume": "22",
      "issue": "11",
      "raw": "Home-based telemonitored Nordic walking training is well accepted, safe, effective and has high adherence among heart failure patients, including those with cardiovascular implantable electronic devices: a randomised controlled study \n\t\t \n\t\t\t E Piotrowicz \n\t\t \n\t\t \n\t\t\t T Zieli\u0144ski \n\t\t \n\t\t \n\t\t\t R Bodalski \n\t\t \n\t\t \n\t\t\t T Rywik \n\t\t \n\t\t \n\t\t\t B Dobraszkiewicz-Wasilewska \n\t\t \n\t\t \n\t\t\t M Sobieszcza\u0144ska-Ma\u0142ek \n\t\t \n\t\t 10.1177/2047487314551537 \n\t\t Medline: 25261268] 177 \n\t \n\t \n\t\t Eur J Prev Cardiol \n\t\t \n\t\t\t 22 \n\t\t\t 11 \n\t\t\t \n\t\t\t 2015 Nov 26 \n\t\t \n\t \n\t Piotrowicz E, Zieli\u0144ski T, Bodalski R, Rywik T, Dobraszkiewicz-Wasilewska B, Sobieszcza\u0144ska-Ma\u0142ek M, et al. Home-based telemonitored Nordic walking training is well accepted, safe, effective and has high adherence among heart failure patients, including those with cardiovascular implantable electronic devices: a randomised controlled study. Eur J Prev Cardiol 2015 Nov 26;22(11):1368-1377 [doi: 10.1177/2047487314551537] [Medline: 25261268] 177"
    },
    {
      "title": "Positive effects of the reversion of depression on the sympathovagal balance after telerehabilitation in heart failure patients",
      "authors": [
        "E Piotrowicz",
        "W Piotrowski",
        "R Piotrowicz"
      ],
      "year": 2016,
      "doi": "10.1111/anec.12320",
      "journal": "Ann Noninvasive Electrocardiol",
      "volume": "21",
      "issue": "4",
      "raw": "Positive effects of the reversion of depression on the sympathovagal balance after telerehabilitation in heart failure patients \n\t\t \n\t\t\t E Piotrowicz \n\t\t \n\t\t \n\t\t\t W Piotrowski \n\t\t \n\t\t \n\t\t\t R Piotrowicz \n\t\t \n\t\t 10.1111/anec.12320 \n\t\t Medline: 26524699] 178 \n\t \n\t \n\t\t Ann Noninvasive Electrocardiol \n\t\t \n\t\t\t 21 \n\t\t\t 4 \n\t\t\t \n\t\t\t 2016 Jul 02 \n\t\t \n\t \n\t FREE Full text \n\t Piotrowicz E, Piotrowski W, Piotrowicz R. Positive effects of the reversion of depression on the sympathovagal balance after telerehabilitation in heart failure patients. Ann Noninvasive Electrocardiol 2016 Jul 02;21(4):358-368 [FREE Full text] [doi: 10.1111/anec.12320] [Medline: 26524699] 178"
    },
    {
      "title": "Effects of a 9-week hybrid comprehensive telerehabilitation program on long-term outcomes in patients with heart failure: the telerehabilitation in heart failure patients (TELEREH-HF) randomized clinical trial",
      "authors": [
        "E Piotrowicz",
        "M Pencina",
        "G Opolski",
        "W Zareba",
        "M Banach",
        "I Kowalik"
      ],
      "year": 2020,
      "doi": "10.1001/jamacardio.2019.5006",
      "journal": "JAMA Cardiol",
      "volume": "5",
      "issue": "3",
      "raw": "Effects of a 9-week hybrid comprehensive telerehabilitation program on long-term outcomes in patients with heart failure: the telerehabilitation in heart failure patients (TELEREH-HF) randomized clinical trial \n\t\t \n\t\t\t E Piotrowicz \n\t\t \n\t\t \n\t\t\t M J Pencina \n\t\t \n\t\t \n\t\t\t G Opolski \n\t\t \n\t\t \n\t\t\t W Zareba \n\t\t \n\t\t \n\t\t\t M Banach \n\t\t \n\t\t \n\t\t\t I Kowalik \n\t\t \n\t\t 10.1001/jamacardio.2019.5006 \n\t\t Medline: 31734701] 179 \n\t \n\t \n\t\t JAMA Cardiol \n\t\t \n\t\t\t 5 \n\t\t\t 3 \n\t\t\t \n\t\t\t 2020 Mar 01 \n\t\t \n\t \n\t FREE Full text \n\t Piotrowicz E, Pencina MJ, Opolski G, Zareba W, Banach M, Kowalik I, et al. Effects of a 9-week hybrid comprehensive telerehabilitation program on long-term outcomes in patients with heart failure: the telerehabilitation in heart failure patients (TELEREH-HF) randomized clinical trial. JAMA Cardiol 2020 Mar 01;5(3):300-308 [FREE Full text] [doi: 10.1001/jamacardio.2019.5006] [Medline: 31734701] 179"
    },
    {
      "title": "Effect of an educational program on physical activity in individuals undergoing their first percutaneous coronary intervention: a randomized clinical trial",
      "authors": [
        "N Pitta",
        "R Furuya",
        "N Freitas",
        "C Dessotte",
        "R Dantas",
        "M Ciol"
      ],
      "year": 2022,
      "doi": "10.1016/j.bjpt.2022.100443",
      "journal": "Braz J Phys Ther",
      "volume": "26",
      "issue": "5",
      "pages": "100443",
      "raw": "Effect of an educational program on physical activity in individuals undergoing their first percutaneous coronary intervention: a randomized clinical trial \n\t\t \n\t\t\t N C Pitta \n\t\t \n\t\t \n\t\t\t R K Furuya \n\t\t \n\t\t \n\t\t\t N D Freitas \n\t\t \n\t\t \n\t\t\t C A Dessotte \n\t\t \n\t\t \n\t\t\t R A Dantas \n\t\t \n\t\t \n\t\t\t M A Ciol \n\t\t \n\t\t 10.1016/j.bjpt.2022.100443 \n\t\t Medline: 36206592] 180 \n\t \n\t \n\t\t Braz J Phys Ther \n\t\t \n\t\t\t 26 \n\t\t\t 5 \n\t\t\t 100443 \n\t\t\t 2022 \n\t\t \n\t \n\t FREE Full text \n\t Pitta NC, Furuya RK, Freitas ND, Dessotte CA, Dantas RA, Ciol MA, et al. Effect of an educational program on physical activity in individuals undergoing their first percutaneous coronary intervention: a randomized clinical trial. Braz J Phys Ther 2022;26(5):100443 [FREE Full text] [doi: 10.1016/j.bjpt.2022.100443] [Medline: 36206592] 180"
    },
    {
      "title": "A randomized controlled trial of an exercise maintenance intervention in men and women after cardiac rehabilitation (ECO-PCR Trial)",
      "authors": [
        "R Reid",
        "E Wooding",
        "C Blanchard",
        "M Moghei",
        "J Harris",
        "G Proulx"
      ],
      "year": 2021,
      "doi": "10.1016/j.cjca.2020.10.015",
      "journal": "Can J Cardiol",
      "volume": "37",
      "issue": "5",
      "raw": "A randomized controlled trial of an exercise maintenance intervention in men and women after cardiac rehabilitation (ECO-PCR Trial) \n\t\t \n\t\t\t R D Reid \n\t\t \n\t\t \n\t\t\t E A Wooding \n\t\t \n\t\t \n\t\t\t C M Blanchard \n\t\t \n\t\t \n\t\t\t M Moghei \n\t\t \n\t\t \n\t\t\t J Harris \n\t\t \n\t\t \n\t\t\t G Proulx \n\t\t \n\t\t 10.1016/j.cjca.2020.10.015 \n\t\t Medline: 33161148] 181 \n\t \n\t \n\t\t Can J Cardiol \n\t\t \n\t\t\t 37 \n\t\t\t 5 \n\t\t\t \n\t\t\t 2021 May \n\t\t \n\t \n\t FREE Full text \n\t Reid RD, Wooding EA, Blanchard CM, Moghei M, Harris J, Proulx G, et al. A randomized controlled trial of an exercise maintenance intervention in men and women after cardiac rehabilitation (ECO-PCR Trial). Can J Cardiol 2021 May;37(5):794-802 [FREE Full text] [doi: [Medline: 33161148] 181"
    },
    {
      "title": "The effect of education and telephone follow-up intervention based on the Roy Adaptation Model after myocardial infarction: randomised controlled trial",
      "authors": [
        "S Kavradim",
        "Z \u00d6zer"
      ],
      "year": 2020,
      "doi": "10.1111/scs.12793",
      "journal": "Scand J Caring Sci",
      "volume": "34",
      "issue": "1",
      "raw": "The effect of education and telephone follow-up intervention based on the Roy Adaptation Model after myocardial infarction: randomised controlled trial \n\t\t \n\t\t\t S T Kavradim \n\t\t \n\t\t \n\t\t\t Z C \u00d6zer \n\t\t \n\t\t 10.1111/scs.12793 \n\t\t Medline: 31769891] 182 \n\t \n\t \n\t\t Scand J Caring Sci \n\t\t \n\t\t\t 34 \n\t\t\t 1 \n\t\t\t \n\t\t\t 2020 Mar \n\t\t \n\t \n\t Kavradim ST, \u00d6zer ZC. The effect of education and telephone follow-up intervention based on the Roy Adaptation Model after myocardial infarction: randomised controlled trial. Scand J Caring Sci 2020 Mar;34(1):247-260 [doi: 10.1111/scs.12793] [Medline: 31769891] 182"
    },
    {
      "title": "It's LiFe! Mobile and web-based monitoring and feedback tool embedded in primary care increases physical activity: a cluster randomized controlled trial",
      "authors": [
        "S Van Der Weegen",
        "R Verwey",
        "M Spreeuwenberg",
        "H Tange",
        "T Van Der Weijden",
        "L De Witte"
      ],
      "year": 2015,
      "doi": "10.2196/jmir.4579",
      "journal": "J Med Internet Res",
      "volume": "17",
      "issue": "7",
      "pages": "184",
      "raw": "It's LiFe! Mobile and web-based monitoring and feedback tool embedded in primary care increases physical activity: a cluster randomized controlled trial \n\t\t \n\t\t\t S Van Der Weegen \n\t\t \n\t\t \n\t\t\t R Verwey \n\t\t \n\t\t \n\t\t\t M Spreeuwenberg \n\t\t \n\t\t \n\t\t\t H Tange \n\t\t \n\t\t \n\t\t\t T Van Der Weijden \n\t\t \n\t\t \n\t\t\t L De Witte \n\t\t \n\t\t 10.2196/jmir.4579 \n\t\t Medline: 26209025] 183 \n\t \n\t \n\t\t J Med Internet Res \n\t\t \n\t\t\t 17 \n\t\t\t 7 \n\t\t\t 184 \n\t\t\t 2015 Jul 24 \n\t\t \n\t \n\t FREE Full text \n\t van der Weegen S, Verwey R, Spreeuwenberg M, Tange H, van der Weijden T, de Witte L. It's LiFe! Mobile and web-based monitoring and feedback tool embedded in primary care increases physical activity: a cluster randomized controlled trial. J Med Internet Res 2015 Jul 24;17(7):e184 [FREE Full text] [doi: 10.2196/jmir.4579] [Medline: 26209025] 183"
    },
    {
      "title": "Home-based maintenance tele-rehabilitation reduces the risk for acute exacerbations of COPD, hospitalisations and emergency department visits",
      "authors": [
        "M Vasilopoulou",
        "A Papaioannou",
        "G Kaltsakas",
        "Z Louvaris",
        "N Chynkiamis",
        "S Spetsioti"
      ],
      "year": 2017,
      "doi": "10.1183/13993003.02129-2016",
      "journal": "Eur Respir J",
      "volume": "49",
      "issue": "5",
      "pages": "1602129",
      "raw": "Home-based maintenance tele-rehabilitation reduces the risk for acute exacerbations of COPD, hospitalisations and emergency department visits \n\t\t \n\t\t\t M Vasilopoulou \n\t\t \n\t\t \n\t\t\t A I Papaioannou \n\t\t \n\t\t \n\t\t\t G Kaltsakas \n\t\t \n\t\t \n\t\t\t Z Louvaris \n\t\t \n\t\t \n\t\t\t N Chynkiamis \n\t\t \n\t\t \n\t\t\t S Spetsioti \n\t\t \n\t\t 10.1183/13993003.02129-2016 \n\t\t Medline: 28546268] 184 \n\t \n\t \n\t\t Eur Respir J \n\t\t \n\t\t\t 49 \n\t\t\t 5 \n\t\t\t 1602129 \n\t\t\t 2017 May 25 \n\t\t \n\t \n\t FREE Full text \n\t Vasilopoulou M, Papaioannou AI, Kaltsakas G, Louvaris Z, Chynkiamis N, Spetsioti S, et al. Home-based maintenance tele-rehabilitation reduces the risk for acute exacerbations of COPD, hospitalisations and emergency department visits. Eur Respir J 2017 May 25;49(5):1602129 [FREE Full text] [doi: 10.1183/13993003.02129-2016] [Medline: 28546268] 184"
    },
    {
      "title": "A web-based computer-tailored program to improve treatment adherence in patients with type 2 diabetes: randomized controlled trial",
      "authors": [
        "S Vluggen",
        "M Candel",
        "C Hoving",
        "N Schaper",
        "H De Vries"
      ],
      "year": 2021,
      "doi": "10.2196/18524",
      "journal": "J Med Internet Res",
      "volume": "23",
      "issue": "2",
      "pages": "18524",
      "raw": "A web-based computer-tailored program to improve treatment adherence in patients with type 2 diabetes: randomized controlled trial \n\t\t \n\t\t\t S Vluggen \n\t\t \n\t\t \n\t\t\t M Candel \n\t\t \n\t\t \n\t\t\t C Hoving \n\t\t \n\t\t \n\t\t\t N C Schaper \n\t\t \n\t\t \n\t\t\t H De Vries \n\t\t \n\t\t 10.2196/18524 \n\t\t Medline: 33620321] 185 \n\t \n\t \n\t\t J Med Internet Res \n\t\t \n\t\t\t 23 \n\t\t\t 2 \n\t\t\t 18524 \n\t\t\t 2021 Feb 23 \n\t\t \n\t \n\t FREE Full text \n\t Vluggen S, Candel M, Hoving C, Schaper NC, de Vries H. A web-based computer-tailored program to improve treatment adherence in patients with type 2 diabetes: randomized controlled trial. J Med Internet Res 2021 Feb 23;23(2):e18524 [FREE Full text] [doi: 10.2196/18524] [Medline: 33620321] 185"
    },
    {
      "title": "Efficacy and cost of an exercise program for functionally impaired older patients with heart failure",
      "authors": [
        "M Witham",
        "R Fulton",
        "C Greig",
        "D Johnston",
        "C Lang",
        "M Van Der Pol"
      ],
      "year": 2012,
      "doi": "10.1161/circheartfailure.111.963132",
      "journal": "Circ: Heart Failure",
      "volume": "5",
      "issue": "2",
      "raw": "Efficacy and cost of an exercise program for functionally impaired older patients with heart failure \n\t\t \n\t\t\t M D Witham \n\t\t \n\t\t \n\t\t\t R L Fulton \n\t\t \n\t\t \n\t\t\t C A Greig \n\t\t \n\t\t \n\t\t\t D W Johnston \n\t\t \n\t\t \n\t\t\t C C Lang \n\t\t \n\t\t \n\t\t\t M Van Der Pol \n\t\t \n\t\t 10.1161/circheartfailure.111.963132 \n\t \n\t \n\t\t Circ: Heart Failure \n\t\t \n\t\t\t 5 \n\t\t\t 2 \n\t\t\t \n\t\t\t 2012 Mar \n\t\t \n\t \n\t Witham MD, Fulton RL, Greig CA, Johnston DW, Lang CC, van der Pol M, et al. Efficacy and cost of an exercise program for functionally impaired older patients with heart failure. Circ: Heart Failure 2012 Mar;5(2):209-216 [doi: 10.1161/circheartfailure.111.963132] 186"
    },
    {
      "title": "Effect on health-related quality of life of ongoing feedback during a 12-month maintenance walking programme in patients with COPD: a randomized controlled trial",
      "authors": [
        "S Wootton",
        "Z Mckeough",
        "C Ng",
        "S Jenkins",
        "K Hill",
        "P Eastwood"
      ],
      "year": 2018,
      "doi": "10.1111/resp.13128",
      "journal": "Respirology",
      "volume": "23",
      "issue": "1",
      "raw": "Effect on health-related quality of life of ongoing feedback during a 12-month maintenance walking programme in patients with COPD: a randomized controlled trial \n\t\t \n\t\t\t S L Wootton \n\t\t \n\t\t \n\t\t\t Z Mckeough \n\t\t \n\t\t \n\t\t\t C L Ng \n\t\t \n\t\t \n\t\t\t S Jenkins \n\t\t \n\t\t \n\t\t\t K Hill \n\t\t \n\t\t \n\t\t\t P R Eastwood \n\t\t \n\t\t 10.1111/resp.13128 \n\t\t Medline: 28758320] 187 \n\t \n\t \n\t\t Respirology \n\t\t \n\t\t\t 23 \n\t\t\t 1 \n\t\t\t \n\t\t\t 2018 Jan 30 \n\t\t \n\t \n\t FREE Full text \n\t Wootton SL, McKeough Z, Ng CL, Jenkins S, Hill K, Eastwood PR, et al. Effect on health-related quality of life of ongoing feedback during a 12-month maintenance walking programme in patients with COPD: a randomized controlled trial. Respirology 2018 Jan 30;23(1):60-67 [FREE Full text] [doi: 10.1111/resp.13128] [Medline: 28758320] 187"
    },
    {
      "title": "Personal activity intelligence e-health program in people with type 2 diabetes: a pilot randomized controlled trial",
      "authors": [
        "J Coombes",
        "S Keating",
        "G Mielke",
        "R Fassett",
        "B Cooes",
        "O? Leary"
      ],
      "year": 2023,
      "doi": "10.1249/mss.0000000000002768",
      "journal": "Med Sci Sports Exerc",
      "volume": "54",
      "issue": "1",
      "pages": "27",
      "raw": "Personal activity intelligence e-health program in people with type 2 diabetes: a pilot randomized controlled trial \n\t\t \n\t\t\t J Coombes \n\t\t \n\t\t \n\t\t\t S Keating \n\t\t \n\t\t \n\t\t\t G Mielke \n\t\t \n\t\t \n\t\t\t R Fassett \n\t\t \n\t\t \n\t\t\t B Cooes \n\t\t \n\t\t \n\t\t\t O? Leary \n\t\t \n\t\t \n\t\t\t K \n\t\t \n\t\t 10.1249/mss.0000000000002768 \n\t \n\t \n\t\t Med Sci Sports Exerc \n\t\t \n\t\t\t 54 \n\t\t\t 1 \n\t\t\t 27 \n\t\t\t 2023 \n\t\t \n\t \n\t Coombes J, Keating S, Mielke G, Fassett R, Cooes B, O?Leary K, et al. Personal activity intelligence e-health program in people with type 2 diabetes: a pilot randomized controlled trial. Med Sci Sports Exerc 2023;54(1):27 [doi: 10.1249/mss.0000000000002768] 188"
    },
    {
      "title": "Efficacy of a community-based technology-enabled physical activity counseling program for people with knee osteoarthritis: proof-of-concept study",
      "authors": [
        "L Li",
        "E Sayre",
        "H Xie",
        "R Falck",
        "J Best",
        "T Liu-Ambrose"
      ],
      "year": 2018,
      "doi": "10.2196/jmir.8514",
      "journal": "J Med Internet Res",
      "volume": "20",
      "issue": "4",
      "pages": "e159",
      "raw": "Efficacy of a community-based technology-enabled physical activity counseling program for people with knee osteoarthritis: proof-of-concept study \n\t\t \n\t\t\t L C Li \n\t\t \n\t\t \n\t\t\t E C Sayre \n\t\t \n\t\t \n\t\t\t H Xie \n\t\t \n\t\t \n\t\t\t R S Falck \n\t\t \n\t\t \n\t\t\t J R Best \n\t\t \n\t\t \n\t\t\t T Liu-Ambrose \n\t\t \n\t\t 10.2196/jmir.8514 \n\t\t Medline: 29712630] 189 \n\t \n\t \n\t\t J Med Internet Res \n\t\t \n\t\t\t 20 \n\t\t\t 4 \n\t\t\t e159 \n\t\t\t 2018 Apr 30 \n\t\t \n\t \n\t FREE Full text \n\t Li LC, Sayre EC, Xie H, Falck RS, Best JR, Liu-Ambrose T, et al. Efficacy of a community-based technology-enabled physical activity counseling program for people with knee osteoarthritis: proof-of-concept study. J Med Internet Res 2018 Apr 30;20(4):e159 [FREE Full text] [doi: 10.2196/jmir.8514] [Medline: 29712630] 189"
    },
    {
      "title": "Home-based exercise with telemonitoring guidance in patients with coronary artery disease: does it improve long-term physical fitness?",
      "authors": [
        "A Avila",
        "J Claes",
        "R Buys",
        "M Azzawi",
        "L Vanhees",
        "V Cornelissen"
      ],
      "year": 2020,
      "doi": "10.1177/2047487319892201",
      "journal": "Eur J Prev Cardiol",
      "volume": "27",
      "issue": "4",
      "raw": "Home-based exercise with telemonitoring guidance in patients with coronary artery disease: does it improve long-term physical fitness? \n\t\t \n\t\t\t A Avila \n\t\t \n\t\t \n\t\t\t J Claes \n\t\t \n\t\t \n\t\t\t R Buys \n\t\t \n\t\t \n\t\t\t M Azzawi \n\t\t \n\t\t \n\t\t\t L Vanhees \n\t\t \n\t\t \n\t\t\t V Cornelissen \n\t\t \n\t\t 10.1177/2047487319892201 \n\t\t Medline: 31787026] 190 \n\t \n\t \n\t\t Eur J Prev Cardiol \n\t\t \n\t\t\t 27 \n\t\t\t 4 \n\t\t\t \n\t\t\t 2020 Mar \n\t\t \n\t \n\t Avila A, Claes J, Buys R, Azzawi M, Vanhees L, Cornelissen V. Home-based exercise with telemonitoring guidance in patients with coronary artery disease: does it improve long-term physical fitness? Eur J Prev Cardiol 2020 Mar;27(4):367-377 [doi: 10.1177/2047487319892201] [Medline: 31787026] 190"
    },
    {
      "title": "Long-term effects of web-based pedometer-mediated intervention on COPD exacerbations",
      "authors": [
        "E Wan",
        "A Kantorowski",
        "M Polak",
        "R Kadri",
        "C Richardson",
        "D Gagnon"
      ],
      "year": 2020,
      "doi": "10.1016/j.rmed.2020.105878",
      "journal": "Respir Med",
      "volume": "162",
      "pages": "105878",
      "raw": "Long-term effects of web-based pedometer-mediated intervention on COPD exacerbations \n\t\t \n\t\t\t E S Wan \n\t\t \n\t\t \n\t\t\t A Kantorowski \n\t\t \n\t\t \n\t\t\t M Polak \n\t\t \n\t\t \n\t\t\t R Kadri \n\t\t \n\t\t \n\t\t\t C R Richardson \n\t\t \n\t\t \n\t\t\t D R Gagnon \n\t\t \n\t\t 10.1016/j.rmed.2020.105878 \n\t\t Medline: 32056676] 191 \n\t \n\t \n\t\t Respir Med \n\t\t \n\t\t\t 162 \n\t\t\t 105878 \n\t\t\t 2020 Feb \n\t\t \n\t \n\t FREE Full text \n\t Wan ES, Kantorowski A, Polak M, Kadri R, Richardson CR, Gagnon DR, et al. Long-term effects of web-based pedometer-mediated intervention on COPD exacerbations. Respir Med 2020 Feb;162:105878 [FREE Full text] [doi: 10.1016/j.rmed.2020.105878] [Medline: 32056676] 191"
    },
    {
      "title": "Long-term effects of an internet-mediated pedometer-based walking program for chronic obstructive pulmonary disease: randomized controlled trial",
      "authors": [
        "M Moy",
        "C Martinez",
        "R Kadri",
        "P Roman",
        "R Holleman",
        "H Kim"
      ],
      "year": 2016,
      "doi": "10.2196/jmir.5622",
      "journal": "J Med Internet Res",
      "volume": "18",
      "issue": "8",
      "pages": "e215",
      "raw": "Long-term effects of an internet-mediated pedometer-based walking program for chronic obstructive pulmonary disease: randomized controlled trial \n\t\t \n\t\t\t M L Moy \n\t\t \n\t\t \n\t\t\t C H Martinez \n\t\t \n\t\t \n\t\t\t R Kadri \n\t\t \n\t\t \n\t\t\t P Roman \n\t\t \n\t\t \n\t\t\t R G Holleman \n\t\t \n\t\t \n\t\t\t H M Kim \n\t\t \n\t\t 10.2196/jmir.5622 \n\t\t Medline: 27502583] 192 \n\t \n\t \n\t\t J Med Internet Res \n\t\t \n\t\t\t 18 \n\t\t\t 8 \n\t\t\t e215 \n\t\t\t 2016 Aug 08 \n\t\t \n\t \n\t FREE Full text \n\t Moy ML, Martinez CH, Kadri R, Roman P, Holleman RG, Kim HM, et al. Long-term effects of an internet-mediated pedometer-based walking program for chronic obstructive pulmonary disease: randomized controlled trial. J Med Internet Res 2016 Aug 08;18(8):e215 [FREE Full text] [doi: 10.2196/jmir.5622] [Medline: 27502583] 192. EndNote"
    },
    {
      "year": 2013,
      "raw": "Clarivate \n\t\t \n\t\t \n\t\t \n\t\t\t 2013. 2020-06-01] 193. 2020-06-01 \n\t\t \n\t\t \n\t\t\t Veritas Health Innovation \n\t\t \n\t \n\t Covidence systematic review software \n\t Clarivate. 2013. URL: https://support.clarivate.com/Endnote/s/article/EndNote-20-Updates?language=en_US [accessed 2020-06-01] 193. Covidence systematic review software. Veritas Health Innovation. URL: https://www.covidence.org/ [accessed 2020-06-01] 194."
    },
    {
      "title": "Automeris",
      "authors": [
        "A Rohatgi"
      ],
      "year": 2020,
      "doi": "10.1079/cabicompendium.92893",
      "pages": "195",
      "raw": "A Rohatgi \n\t\t \n\t\t \n\t\t\t Webplotdigitizer \n\t\t \n\t\t 10.1079/cabicompendium.92893 \n\t\t \n\t\t Automeris \n\t\t \n\t\t\t 2020-08-01 \n\t\t\t 195 \n\t\t \n\t \n\t Rohatgi A. WebPlotDigitizer. Automeris. URL: https://apps.automeris.io/wpd/ [accessed 2020-08-01] 195"
    },
    {
      "title": "Strategies for effective study author contact to leverage existing research data when preparing systematic reviews -a randomised study within a review (SWAR)",
      "authors": [
        "K Goossen",
        "T Rombey",
        "C Kugler",
        "De Santis",
        "K Pieper"
      ],
      "year": 2020,
      "doi": "10.1016/j.jclinepi.2021.02.006",
      "raw": "Strategies for effective study author contact to leverage existing research data when preparing systematic reviews -a randomised study within a review (SWAR) \n\t\t \n\t\t\t K Goossen \n\t\t \n\t\t \n\t\t\t T Rombey \n\t\t \n\t\t \n\t\t\t C M Kugler \n\t\t \n\t\t \n\t\t\t De Santis \n\t\t \n\t\t \n\t\t\t K K Pieper \n\t\t \n\t\t \n\t\t\t D \n\t\t \n\t\t 10.1016/j.jclinepi.2021.02.006 \n\t\t \n\t \n\t \n\t\t Proceedings of the 1st Evidence-Based Research Conference (EBR) \n\t\t the 1st Evidence-Based Research Conference (EBR) \n\t\t \n\t\t\t StataCorp LLC \n\t\t\t 2020. Nov 16-17, 2020. 2021. 2023 \n\t\t \n\t \n\t Presented at: EBR '20 Stata statistical software: release 17 \n\t Goossen K, Rombey T, Kugler CM, De Santis KK, Pieper D. Strategies for effective study author contact to leverage existing research data when preparing systematic reviews -a randomised study within a review (SWAR). In: Proceedings of the 1st Evidence-Based Research Conference (EBR). 2020 Presented at: EBR '20; Nov 16-17, 2020; Virtual Event [doi: 10.1016/j.jclinepi.2021.02.006] 196. Stata statistical software: release 17. StataCorp LLC. 2021. URL: https://www.stata.com/support/faqs/resources/ citing-software-documentation-faqs/ [accessed 2023-06-13] 197"
    },
    {
      "title": "Maintenance of physical activity and dietary change following a telephone-delivered intervention",
      "authors": [
        "E Eakin",
        "M Reeves",
        "E Winkler",
        "S Lawler",
        "N Owen"
      ],
      "year": 2010,
      "doi": "10.1037/a0021359",
      "journal": "Health Psychol",
      "volume": "29",
      "issue": "6",
      "raw": "Maintenance of physical activity and dietary change following a telephone-delivered intervention \n\t\t \n\t\t\t E Eakin \n\t\t \n\t\t \n\t\t\t M Reeves \n\t\t \n\t\t \n\t\t\t E Winkler \n\t\t \n\t\t \n\t\t\t S Lawler \n\t\t \n\t\t \n\t\t\t N Owen \n\t\t \n\t\t 10.1037/a0021359 \n\t\t Medline: 20954778] 198 \n\t \n\t \n\t\t Health Psychol \n\t\t \n\t\t\t 29 \n\t\t\t 6 \n\t\t\t \n\t\t\t 2010 Nov \n\t\t \n\t \n\t Eakin E, Reeves M, Winkler E, Lawler S, Owen N. Maintenance of physical activity and dietary change following a telephone-delivered intervention. Health Psychol 2010 Nov;29(6):566-573 [doi: 10.1037/a0021359] [Medline: 20954778] 198"
    },
    {
      "title": "Smartphone-delivered multicomponent lifestyle medicine intervention for depressive symptoms: a randomized controlled trial",
      "authors": [
        "V Wong",
        "F Ho",
        "N Shi",
        "J Tong",
        "K Chung",
        "W Yeung"
      ],
      "year": 2021,
      "doi": "10.1037/ccp0000695",
      "journal": "J Consult Clin Psychol",
      "volume": "89",
      "issue": "12",
      "raw": "Smartphone-delivered multicomponent lifestyle medicine intervention for depressive symptoms: a randomized controlled trial \n\t\t \n\t\t\t V Wong \n\t\t \n\t\t \n\t\t\t F Ho \n\t\t \n\t\t \n\t\t\t N K Shi \n\t\t \n\t\t \n\t\t\t J Tong \n\t\t \n\t\t \n\t\t\t K F Chung \n\t\t \n\t\t \n\t\t\t W F Yeung \n\t\t \n\t\t 10.1037/ccp0000695 \n\t\t Medline: 35025538] 199 \n\t \n\t \n\t\t J Consult Clin Psychol \n\t\t \n\t\t\t 89 \n\t\t\t 12 \n\t\t\t \n\t\t\t 2021 Dec \n\t\t \n\t \n\t Wong V, Ho F, Shi NK, Tong J, Chung KF, Yeung WF, et al. Smartphone-delivered multicomponent lifestyle medicine intervention for depressive symptoms: a randomized controlled trial. J Consult Clin Psychol 2021 Dec;89(12):970-984 [doi: 10.1037/ccp0000695] [Medline: 35025538] 199"
    },
    {
      "title": "American Heart Association Physical Activity Committee of the Council on LifestyleCardiometabolic HealthCardiovascular\u201a Exercise\u201a Cardiac RehabilitationPrevention Committee of the Council on Clinical Cardiology\u201aCouncil. Guide to the assessment of physical activity: clinical and research applications: a scientific statement from the American Heart Association",
      "authors": [
        "S Strath",
        "L Kaminsky",
        "B Ainsworth",
        "U Ekelund",
        "P Freedson",
        "R Gary"
      ],
      "year": 2013,
      "doi": "10.1161/01.cir.0000435708.67487.da",
      "journal": "Circulation",
      "volume": "128",
      "issue": "20",
      "raw": "American Heart Association Physical Activity Committee of the Council on LifestyleCardiometabolic HealthCardiovascular\u201a Exercise\u201a Cardiac RehabilitationPrevention Committee of the Council on Clinical Cardiology\u201aCouncil. Guide to the assessment of physical activity: clinical and research applications: a scientific statement from the American Heart Association \n\t\t \n\t\t\t S J Strath \n\t\t \n\t\t \n\t\t\t L A Kaminsky \n\t\t \n\t\t \n\t\t\t B E Ainsworth \n\t\t \n\t\t \n\t\t\t U Ekelund \n\t\t \n\t\t \n\t\t\t P S Freedson \n\t\t \n\t\t \n\t\t\t R A Gary \n\t\t \n\t\t 10.1161/01.cir.0000435708.67487.da \n\t\t Medline: 24126387] 200 \n\t \n\t \n\t\t Circulation \n\t\t \n\t\t\t 128 \n\t\t\t 20 \n\t\t\t \n\t\t\t 2013 Nov 12 \n\t\t \n\t \n\t Strath SJ, Kaminsky LA, Ainsworth BE, Ekelund U, Freedson PS, Gary RA, American Heart Association Physical Activity Committee of the Council on LifestyleCardiometabolic HealthCardiovascular\u201a Exercise\u201a Cardiac RehabilitationPrevention Committee of the Council on Clinical Cardiology\u201aCouncil. Guide to the assessment of physical activity: clinical and research applications: a scientific statement from the American Heart Association. Circulation 2013 Nov 12;128(20):2259-2279 [doi: 10.1161/01.cir.0000435708.67487.da] [Medline: 24126387] 200"
    },
    {
      "title": "The effectiveness of self-guided digital interventions to improve physical activity and exercise outcomes for people with chronic conditions: a systematic review and meta-analysis",
      "authors": [
        "V Stavric",
        "N Kayes",
        "U Rashid",
        "N Saywell"
      ],
      "year": 2022,
      "doi": "10.3389/fresc.2022.925620",
      "journal": "Front Rehabil Sci",
      "volume": "3",
      "pages": "925620",
      "raw": "The effectiveness of self-guided digital interventions to improve physical activity and exercise outcomes for people with chronic conditions: a systematic review and meta-analysis \n\t\t \n\t\t\t V Stavric \n\t\t \n\t\t \n\t\t\t N M Kayes \n\t\t \n\t\t \n\t\t\t U Rashid \n\t\t \n\t\t \n\t\t\t N L Saywell \n\t\t \n\t\t 10.3389/fresc.2022.925620 \n\t\t Medline: 36188933] 201 \n\t \n\t \n\t\t Front Rehabil Sci \n\t\t \n\t\t\t 3 \n\t\t\t 925620 \n\t\t\t 2022 \n\t\t \n\t \n\t FREE Full text \n\t Stavric V, Kayes NM, Rashid U, Saywell NL. The effectiveness of self-guided digital interventions to improve physical activity and exercise outcomes for people with chronic conditions: a systematic review and meta-analysis. Front Rehabil Sci 2022;3:925620 [FREE Full text] [doi: 10.3389/fresc.2022.925620] [Medline: 36188933] 201"
    },
    {
      "title": "Effectiveness of physical activity monitors in adults: systematic review and meta-analysis",
      "authors": [
        "R Larsen",
        "V Wagner",
        "C Korfitsen",
        "C Keller",
        "C Juhl",
        "H Langberg"
      ],
      "year": 2022,
      "doi": "10.1136/bmj-2021-068047",
      "journal": "BMJ",
      "volume": "376",
      "pages": "68047",
      "raw": "Effectiveness of physical activity monitors in adults: systematic review and meta-analysis \n\t\t \n\t\t\t R T Larsen \n\t\t \n\t\t \n\t\t\t V Wagner \n\t\t \n\t\t \n\t\t\t C B Korfitsen \n\t\t \n\t\t \n\t\t\t C Keller \n\t\t \n\t\t \n\t\t\t C B Juhl \n\t\t \n\t\t \n\t\t\t H Langberg \n\t\t \n\t\t 10.1136/bmj-2021-068047 \n\t\t Medline: 35082116] 202 \n\t \n\t \n\t\t BMJ \n\t\t \n\t\t\t 376 \n\t\t\t 68047 \n\t\t\t 2022 Jan 26 \n\t\t \n\t \n\t FREE Full text \n\t Larsen RT, Wagner V, Korfitsen CB, Keller C, Juhl CB, Langberg H, et al. Effectiveness of physical activity monitors in adults: systematic review and meta-analysis. BMJ 2022 Jan 26;376:e068047 [FREE Full text] [doi: [Medline: 35082116] 202"
    },
    {
      "title": "Systematic review of the prospective association of daily step counts with risk of mortality, cardiovascular disease, and dysglycemia",
      "authors": [
        "K Hall",
        "E Hyde",
        "D Bassett",
        "S Carlson",
        "M Carnethon",
        "U Ekelund"
      ],
      "year": 2020,
      "doi": "10.1186/s12966-020-00978-9",
      "journal": "Int J Behav Nutr Phys Act",
      "volume": "17",
      "issue": "1",
      "pages": "78",
      "raw": "Systematic review of the prospective association of daily step counts with risk of mortality, cardiovascular disease, and dysglycemia \n\t\t \n\t\t\t K S Hall \n\t\t \n\t\t \n\t\t\t E T Hyde \n\t\t \n\t\t \n\t\t\t D R Bassett \n\t\t \n\t\t \n\t\t\t S A Carlson \n\t\t \n\t\t \n\t\t\t M R Carnethon \n\t\t \n\t\t \n\t\t\t U Ekelund \n\t\t \n\t\t 10.1186/s12966-020-00978-9 \n\t\t Medline: 32563261] 203 \n\t \n\t \n\t\t Int J Behav Nutr Phys Act \n\t\t \n\t\t\t 17 \n\t\t\t 1 \n\t\t\t 78 \n\t\t\t 2020 Jun 20 \n\t\t \n\t \n\t FREE Full text \n\t Hall KS, Hyde ET, Bassett DR, Carlson SA, Carnethon MR, Ekelund U, et al. Systematic review of the prospective association of daily step counts with risk of mortality, cardiovascular disease, and dysglycemia. Int J Behav Nutr Phys Act 2020 Jun 20;17(1):78 [FREE Full text] [doi: 10.1186/s12966-020-00978-9] [Medline: 32563261] 203"
    },
    {
      "title": "World Health Organization 2020 guidelines on physical activity and sedentary behaviour",
      "authors": [
        "F Bull",
        "Al-Ansari Ss",
        "S Biddle",
        "K Borodulin",
        "M Buman",
        "G Cardon"
      ],
      "year": 2020,
      "doi": "10.1136/bjsports-2020-102955",
      "journal": "Br J Sports Med",
      "volume": "54",
      "issue": "24",
      "raw": "World Health Organization 2020 guidelines on physical activity and sedentary behaviour \n\t\t \n\t\t\t F C Bull \n\t\t \n\t\t \n\t\t\t Al-Ansari Ss \n\t\t \n\t\t \n\t\t\t S Biddle \n\t\t \n\t\t \n\t\t\t K Borodulin \n\t\t \n\t\t \n\t\t\t M P Buman \n\t\t \n\t\t \n\t\t\t G Cardon \n\t\t \n\t\t 10.1136/bjsports-2020-102955 \n\t \n\t \n\t\t Br J Sports Med \n\t\t \n\t\t\t 54 \n\t\t\t 24 \n\t\t\t \n\t\t\t 2020 Nov 25 \n\t\t \n\t \n\t Bull FC, Al-Ansari SS, Biddle S, Borodulin K, Buman MP, Cardon G, et al. World Health Organization 2020 guidelines on physical activity and sedentary behaviour. Br J Sports Med 2020 Nov 25;54(24):1451-1462 [doi: 10.1136/bjsports-2020-102955] 204"
    },
    {
      "title": "Minimal clinically important difference for change in 6-minute walk test distance of adults with pathology: a systematic review",
      "authors": [
        "R Bohannon",
        "R Crouch"
      ],
      "year": 2017,
      "doi": "10.1111/jep.12629",
      "journal": "J Eval Clin Pract",
      "volume": "23",
      "issue": "2",
      "raw": "Minimal clinically important difference for change in 6-minute walk test distance of adults with pathology: a systematic review \n\t\t \n\t\t\t R W Bohannon \n\t\t \n\t\t \n\t\t\t R Crouch \n\t\t \n\t\t 10.1111/jep.12629 \n\t\t Medline: 27592691] 205 \n\t \n\t \n\t\t J Eval Clin Pract \n\t\t \n\t\t\t 23 \n\t\t\t 2 \n\t\t\t \n\t\t\t 2017 Apr \n\t\t \n\t \n\t Bohannon RW, Crouch R. Minimal clinically important difference for change in 6-minute walk test distance of adults with pathology: a systematic review. J Eval Clin Pract 2017 Apr;23(2):377-381 [doi: 10.1111/jep.12629] [Medline: 27592691] 205"
    },
    {
      "title": "Objective measurement of physical activity outcomes in lifestyle interventions among adults: a systematic review",
      "authors": [
        "V Silfee",
        "C Haughton",
        "Jake-Schoffman De",
        "A Lopez-Cepero",
        "C May",
        "M Sreedhara"
      ],
      "year": 2018,
      "doi": "10.1016/j.pmedr.2018.05.003",
      "journal": "Prev Med Rep",
      "volume": "11",
      "raw": "Objective measurement of physical activity outcomes in lifestyle interventions among adults: a systematic review \n\t\t \n\t\t\t V J Silfee \n\t\t \n\t\t \n\t\t\t C F Haughton \n\t\t \n\t\t \n\t\t\t Jake-Schoffman De \n\t\t \n\t\t \n\t\t\t A Lopez-Cepero \n\t\t \n\t\t \n\t\t\t C N May \n\t\t \n\t\t \n\t\t\t M Sreedhara \n\t\t \n\t\t 10.1016/j.pmedr.2018.05.003 \n\t\t Medline: 29984142] 206 \n\t \n\t \n\t\t Prev Med Rep \n\t\t \n\t\t\t 11 \n\t\t\t \n\t\t\t 2018 Sep \n\t\t \n\t \n\t FREE Full text \n\t Silfee VJ, Haughton CF, Jake-Schoffman DE, Lopez-Cepero A, May CN, Sreedhara M, et al. Objective measurement of physical activity outcomes in lifestyle interventions among adults: a systematic review. Prev Med Rep 2018 Sep;11:74-80 [FREE Full text] [doi: 10.1016/j.pmedr.2018.05.003] [Medline: 29984142] 206"
    },
    {
      "title": "Digital health interventions for depression and anxiety among people with chronic conditions: scoping review",
      "authors": [
        "A Shah",
        "N Hussain-Shamsy",
        "G Strudwick",
        "S Sockalingam",
        "R Nolan",
        "E Seto"
      ],
      "year": 2022,
      "doi": "10.2196/38030",
      "journal": "J Med Internet Res",
      "volume": "24",
      "issue": "9",
      "pages": "38030",
      "raw": "Digital health interventions for depression and anxiety among people with chronic conditions: scoping review \n\t\t \n\t\t\t A Shah \n\t\t \n\t\t \n\t\t\t N Hussain-Shamsy \n\t\t \n\t\t \n\t\t\t G Strudwick \n\t\t \n\t\t \n\t\t\t S Sockalingam \n\t\t \n\t\t \n\t\t\t R P Nolan \n\t\t \n\t\t \n\t\t\t E Seto \n\t\t \n\t\t 10.2196/38030 \n\t\t Medline: 36155409] 207 \n\t \n\t \n\t\t J Med Internet Res \n\t\t \n\t\t\t 24 \n\t\t\t 9 \n\t\t\t 38030 \n\t\t\t 2022 Sep 26 \n\t\t \n\t \n\t FREE Full text \n\t Shah A, Hussain-Shamsy N, Strudwick G, Sockalingam S, Nolan RP, Seto E. Digital health interventions for depression and anxiety among people with chronic conditions: scoping review. J Med Internet Res 2022 Sep 26;24(9):e38030 [FREE Full text] [doi: 10.2196/38030] [Medline: 36155409] 207"
    },
    {
      "title": "Associations between health-related quality of life and mortality in older adults",
      "authors": [
        "D Brown",
        "W Thompson",
        "M Zack",
        "S Arnold",
        "J Barile"
      ],
      "year": 2015,
      "doi": "10.1007/s11121-013-0437-z",
      "journal": "Prev Sci",
      "volume": "16",
      "issue": "1",
      "raw": "Associations between health-related quality of life and mortality in older adults \n\t\t \n\t\t\t D S Brown \n\t\t \n\t\t \n\t\t\t W W Thompson \n\t\t \n\t\t \n\t\t\t M M Zack \n\t\t \n\t\t \n\t\t\t S E Arnold \n\t\t \n\t\t \n\t\t\t J P Barile \n\t\t \n\t\t 10.1007/s11121-013-0437-z \n\t\t Medline: 24189743] 208 \n\t \n\t \n\t\t Prev Sci \n\t\t \n\t\t\t 16 \n\t\t\t 1 \n\t\t\t \n\t\t\t 2015 Jan \n\t\t \n\t \n\t FREE Full text \n\t Brown DS, Thompson WW, Zack MM, Arnold SE, Barile JP. Associations between health-related quality of life and mortality in older adults. Prev Sci 2015 Jan;16(1):21-30 [FREE Full text] [doi: 10.1007/s11121-013-0437-z] [Medline: 24189743] 208"
    },
    {
      "title": "Quality of life in chronic disease patients",
      "authors": [
        "K Megari"
      ],
      "year": 2013,
      "doi": "10.4081/hpr.2013.e27",
      "journal": "Health Psychol Res",
      "volume": "1",
      "issue": "3",
      "raw": "Quality of life in chronic disease patients \n\t\t \n\t\t\t K Megari \n\t\t \n\t\t 10.4081/hpr.2013.e27 \n\t\t Medline: 26973912] 209 \n\t \n\t \n\t\t Health Psychol Res \n\t\t \n\t\t\t 1 \n\t\t\t 3 \n\t\t\t 2013 Sep 24 \n\t\t \n\t \n\t FREE Full text \n\t Megari K. Quality of life in chronic disease patients. Health Psychol Res 2013 Sep 24;1(3):e27 [FREE Full text] [doi: 10.4081/hpr.2013.e27] [Medline: 26973912] 209"
    },
    {
      "title": "Quality of life and mortality in the general population: a systematic review and meta-analysis",
      "authors": [
        "A Phyo",
        "R Freak-Poli",
        "H Craig",
        "D Gasevic",
        "N Stocks"
      ],
      "year": 2020,
      "doi": "10.1186/s12889-020-09639-9",
      "journal": "BMC Public Health",
      "volume": "20",
      "issue": "1",
      "pages": "1596",
      "raw": "Quality of life and mortality in the general population: a systematic review and meta-analysis \n\t\t \n\t\t\t A Z Phyo \n\t\t \n\t\t \n\t\t\t R Freak-Poli \n\t\t \n\t\t \n\t\t\t H Craig \n\t\t \n\t\t \n\t\t\t D Gasevic \n\t\t \n\t\t \n\t\t\t N P Stocks \n\t\t \n\t\t \n\t\t\t Gonzalez-Chica \n\t\t \n\t\t \n\t\t\t Da \n\t\t \n\t\t 10.1186/s12889-020-09639-9 \n\t\t Medline: 33153441] 210 \n\t \n\t \n\t\t BMC Public Health \n\t\t \n\t\t\t 20 \n\t\t\t 1 \n\t\t\t 1596 \n\t\t\t 2020 Nov 06 \n\t\t \n\t \n\t FREE Full text \n\t Phyo AZ, Freak-Poli R, Craig H, Gasevic D, Stocks NP, Gonzalez-Chica DA, et al. Quality of life and mortality in the general population: a systematic review and meta-analysis. BMC Public Health 2020 Nov 06;20(1):1596 [FREE Full text] [doi: 10.1186/s12889-020-09639-9] [Medline: 33153441] 210"
    },
    {
      "title": "Effectiveness of exercises by telerehabilitation on pain, physical function and quality of life in people with physical disabilities: a systematic review of randomised controlled trials with GRADE recommendations",
      "authors": [
        "J Dias",
        "V Oliveira",
        "P Borges",
        "F Dutra",
        "M Mancini",
        "R Kirkwood"
      ],
      "year": 2021,
      "doi": "10.1136/bjsports-2019-101375",
      "journal": "Br J Sports Med",
      "volume": "55",
      "issue": "3",
      "raw": "Effectiveness of exercises by telerehabilitation on pain, physical function and quality of life in people with physical disabilities: a systematic review of randomised controlled trials with GRADE recommendations \n\t\t \n\t\t\t J F Dias \n\t\t \n\t\t \n\t\t\t V C Oliveira \n\t\t \n\t\t \n\t\t\t P R Borges \n\t\t \n\t\t \n\t\t\t F C Dutra \n\t\t \n\t\t \n\t\t\t M C Mancini \n\t\t \n\t\t \n\t\t\t R N Kirkwood \n\t\t \n\t\t 10.1136/bjsports-2019-101375 \n\t\t Medline: 33060156] 211 \n\t \n\t \n\t\t Br J Sports Med \n\t\t \n\t\t\t 55 \n\t\t\t 3 \n\t\t\t \n\t\t\t 2021 Feb \n\t\t \n\t \n\t Dias JF, Oliveira VC, Borges PR, Dutra FC, Mancini MC, Kirkwood RN, et al. Effectiveness of exercises by telerehabilitation on pain, physical function and quality of life in people with physical disabilities: a systematic review of randomised controlled trials with GRADE recommendations. Br J Sports Med 2021 Feb;55(3):155-162 [doi: 10.1136/bjsports-2019-101375] [Medline: 33060156] 211"
    },
    {
      "title": "Adverse events of exercise therapy in randomised controlled trials: a systematic review and meta-analysis",
      "authors": [
        "A Niemeijer",
        "H Lund",
        "S Stafne",
        "T Ipsen",
        "C Goldschmidt",
        "C J\u00f8rgensen"
      ],
      "year": 2020,
      "doi": "10.1136/bjsports-2018-100461",
      "journal": "Br J Sports Med",
      "volume": "54",
      "issue": "18",
      "raw": "Adverse events of exercise therapy in randomised controlled trials: a systematic review and meta-analysis \n\t\t \n\t\t\t A Niemeijer \n\t\t \n\t\t \n\t\t\t H Lund \n\t\t \n\t\t \n\t\t\t S N Stafne \n\t\t \n\t\t \n\t\t\t T Ipsen \n\t\t \n\t\t \n\t\t\t C L Goldschmidt \n\t\t \n\t\t \n\t\t\t C T J\u00f8rgensen \n\t\t \n\t\t 10.1136/bjsports-2018-100461 \n\t\t Medline: 31563884] 212 \n\t \n\t \n\t\t Br J Sports Med \n\t\t \n\t\t\t 54 \n\t\t\t 18 \n\t\t\t \n\t\t\t 2020 Sep 28 \n\t\t \n\t \n\t Niemeijer A, Lund H, Stafne SN, Ipsen T, Goldschmidt CL, J\u00f8rgensen CT, et al. Adverse events of exercise therapy in randomised controlled trials: a systematic review and meta-analysis. Br J Sports Med 2020 Sep 28;54(18):1073-1080 [doi: 10.1136/bjsports-2018-100461] [Medline: 31563884] 212"
    },
    {
      "title": "Chronic obstructive pulmonary disease exacerbations: a need for action",
      "authors": [
        "A Anzueto",
        "M Miravitlles"
      ],
      "year": 2018,
      "doi": "10.1016/j.amjmed.2018.05.003",
      "journal": "Am J Med",
      "volume": "131",
      "issue": "9S",
      "raw": "Chronic obstructive pulmonary disease exacerbations: a need for action \n\t\t \n\t\t\t A Anzueto \n\t\t \n\t\t \n\t\t\t M Miravitlles \n\t\t \n\t\t 10.1016/j.amjmed.2018.05.003 \n\t\t Medline: 29777660] 213 \n\t \n\t \n\t\t Am J Med \n\t\t \n\t\t\t 131 \n\t\t\t 9S \n\t\t\t \n\t\t\t 2018 Sep \n\t\t \n\t \n\t Anzueto A, Miravitlles M. Chronic obstructive pulmonary disease exacerbations: a need for action. Am J Med 2018 Sep;131(9S):15-22 [doi: 10.1016/j.amjmed.2018.05.003] [Medline: 29777660] 213"
    },
    {
      "title": "The prevention of hospital readmissions in heart failure",
      "authors": [
        "B Ziaeian",
        "G Fonarow"
      ],
      "year": 2016,
      "doi": "10.1016/j.pcad.2015.09.004",
      "journal": "Prog Cardiovasc Dis",
      "volume": "58",
      "issue": "4",
      "raw": "The prevention of hospital readmissions in heart failure \n\t\t \n\t\t\t B Ziaeian \n\t\t \n\t\t \n\t\t\t G C Fonarow \n\t\t \n\t\t 10.1016/j.pcad.2015.09.004 \n\t\t Medline: 26432556] 214 \n\t \n\t \n\t\t Prog Cardiovasc Dis \n\t\t \n\t\t\t 58 \n\t\t\t 4 \n\t\t\t \n\t\t\t 2016 Jan \n\t\t \n\t \n\t FREE Full text \n\t Ziaeian B, Fonarow GC. The prevention of hospital readmissions in heart failure. Prog Cardiovasc Dis 2016 Jan;58(4):379-385 [FREE Full text] [doi: 10.1016/j.pcad.2015.09.004] [Medline: 26432556] 214"
    },
    {
      "title": "Digital tools to support the maintenance of physical activity in people with long-term conditions: a scoping review",
      "authors": [
        "P Clarkson",
        "A Stephenson",
        "C Grimmett",
        "K Cook",
        "C Clark",
        "P Muckelt"
      ],
      "year": 2022,
      "doi": "10.1177/20552076221089778",
      "journal": "Digit Health",
      "volume": "8",
      "pages": "20552076221089778",
      "raw": "Digital tools to support the maintenance of physical activity in people with long-term conditions: a scoping review \n\t\t \n\t\t\t P Clarkson \n\t\t \n\t\t \n\t\t\t A Stephenson \n\t\t \n\t\t \n\t\t\t C Grimmett \n\t\t \n\t\t \n\t\t\t K Cook \n\t\t \n\t\t \n\t\t\t C Clark \n\t\t \n\t\t \n\t\t\t P E Muckelt \n\t\t \n\t\t 10.1177/20552076221089778 \n\t\t Medline: 35433017] 215 \n\t \n\t \n\t\t Digit Health \n\t\t \n\t\t\t 8 \n\t\t\t 20552076221089778 \n\t\t\t 2022 \n\t\t \n\t \n\t FREE Full text \n\t Clarkson P, Stephenson A, Grimmett C, Cook K, Clark C, Muckelt PE, et al. Digital tools to support the maintenance of physical activity in people with long-term conditions: a scoping review. Digit Health 2022;8:20552076221089778 [FREE Full text] [doi: 10.1177/20552076221089778] [Medline: 35433017] 215"
    },
    {
      "title": "Association of multimorbidity with the use of health information technology",
      "authors": [
        "S Manning",
        "H Wang",
        "N Dwibedi",
        "C Shen",
        "R Wiener",
        "P Findley"
      ],
      "year": 2023,
      "doi": "10.1177/20552076231163797",
      "journal": "Digit Health",
      "volume": "9",
      "pages": "20552076231163797",
      "raw": "Association of multimorbidity with the use of health information technology \n\t\t \n\t\t\t S E Manning \n\t\t \n\t\t \n\t\t\t H Wang \n\t\t \n\t\t \n\t\t\t N Dwibedi \n\t\t \n\t\t \n\t\t\t C Shen \n\t\t \n\t\t \n\t\t\t R C Wiener \n\t\t \n\t\t \n\t\t\t P A Findley \n\t\t \n\t\t 10.1177/20552076231163797 \n\t\t Medline: 37124332] 216 \n\t \n\t \n\t\t Digit Health \n\t\t \n\t\t\t 9 \n\t\t\t 20552076231163797 \n\t\t\t 2023 \n\t\t \n\t \n\t FREE Full text \n\t Manning SE, Wang H, Dwibedi N, Shen C, Wiener RC, Findley PA, et al. Association of multimorbidity with the use of health information technology. Digit Health 2023;9:20552076231163797 [FREE Full text] [doi: 10.1177/20552076231163797] [Medline: 37124332] 216"
    },
    {
      "title": "Should we reframe how we think about physical activity and sedentary behaviour measurement? Validity and reliability reconsidered",
      "authors": [
        "P Kelly",
        "C Fitzsimons",
        "G Baker"
      ],
      "year": 2016,
      "doi": "10.1186/s12966-016-0351-4",
      "journal": "Int J Behav Nutr Phys Act",
      "volume": "13",
      "pages": "32",
      "raw": "Should we reframe how we think about physical activity and sedentary behaviour measurement? Validity and reliability reconsidered \n\t\t \n\t\t\t P Kelly \n\t\t \n\t\t \n\t\t\t C Fitzsimons \n\t\t \n\t\t \n\t\t\t G Baker \n\t\t \n\t\t 10.1186/s12966-016-0351-4 \n\t\t Medline: 26931142] 217 \n\t \n\t \n\t\t Int J Behav Nutr Phys Act \n\t\t \n\t\t\t 13 \n\t\t\t 32 \n\t\t\t 2016 Mar 01 \n\t\t \n\t \n\t FREE Full text \n\t Kelly P, Fitzsimons C, Baker G. Should we reframe how we think about physical activity and sedentary behaviour measurement? Validity and reliability reconsidered. Int J Behav Nutr Phys Act 2016 Mar 01;13:32 [FREE Full text] [doi: 10.1186/s12966-016-0351-4] [Medline: 26931142] 217"
    },
    {
      "title": "A critical review of the role of technology and context in digital health research",
      "authors": [
        "P Nielsen",
        "S Sahay"
      ],
      "year": 2022,
      "doi": "10.1177/20552076221109554",
      "journal": "Digit Health",
      "volume": "8",
      "pages": "20552076221109554",
      "raw": "A critical review of the role of technology and context in digital health research \n\t\t \n\t\t\t P Nielsen \n\t\t \n\t\t \n\t\t\t S Sahay \n\t\t \n\t\t 10.1177/20552076221109554 \n\t\t Medline: 35769359] 218 \n\t \n\t \n\t\t Digit Health \n\t\t \n\t\t\t 8 \n\t\t\t 20552076221109554 \n\t\t\t 2022 Jun 22 \n\t\t \n\t \n\t FREE Full text \n\t Nielsen P, Sahay S. A critical review of the role of technology and context in digital health research. Digit Health 2022 Jun 22;8:20552076221109554 [FREE Full text] [doi: 10.1177/20552076221109554] [Medline: 35769359] 218"
    },
    {
      "title": "CONSORT-EHEALTH: improving and standardizing evaluation reports of Web-based and mobile health interventions",
      "authors": [
        "G Eysenbach",
        "Consort-Ehealth Group"
      ],
      "year": 2011,
      "doi": "10.2196/jmir.1923",
      "journal": "J Med Internet Res",
      "volume": "13",
      "issue": "4",
      "pages": "e126",
      "raw": "CONSORT-EHEALTH: improving and standardizing evaluation reports of Web-based and mobile health interventions \n\t\t \n\t\t\t G Eysenbach \n\t\t \n\t\t \n\t\t\t Consort-Ehealth Group \n\t\t \n\t\t 10.2196/jmir.1923 \n\t\t Medline: 22209829] 219 \n\t \n\t \n\t\t J Med Internet Res \n\t\t \n\t\t\t 13 \n\t\t\t 4 \n\t\t\t e126 \n\t\t\t 2011 Dec 31 \n\t\t \n\t \n\t FREE Full text \n\t Eysenbach G, CONSORT-EHEALTH Group. CONSORT-EHEALTH: improving and standardizing evaluation reports of Web-based and mobile health interventions. J Med Internet Res 2011 Dec 31;13(4):e126 [FREE Full text] [doi: 10.2196/jmir.1923] [Medline: 22209829] 219"
    },
    {
      "title": "Guidelines for reporting of health interventions using mobile phones: mobile health (mHealth) evidence reporting and assessment (mERA) checklist",
      "authors": [
        "S Agarwal",
        "A Lefevre",
        "J Lee",
        "L 'engle",
        "K Mehl",
        "G Sinha",
        "C Who",
        "Technical Evidence",
        "Review Group"
      ],
      "year": 2016,
      "doi": "10.1136/bmj.i1174",
      "journal": "BMJ",
      "volume": "352",
      "pages": "1174",
      "raw": "Guidelines for reporting of health interventions using mobile phones: mobile health (mHealth) evidence reporting and assessment (mERA) checklist \n\t\t \n\t\t\t S Agarwal \n\t\t \n\t\t \n\t\t\t A E Lefevre \n\t\t \n\t\t \n\t\t\t J Lee \n\t\t \n\t\t \n\t\t\t L 'engle \n\t\t \n\t\t \n\t\t\t K Mehl \n\t\t \n\t\t \n\t\t\t G Sinha \n\t\t \n\t\t \n\t\t\t C Who \n\t\t \n\t\t \n\t\t\t Technical Evidence \n\t\t \n\t\t \n\t\t\t Review Group \n\t\t \n\t\t 10.1136/bmj.i1174 \n\t\t Medline: 26988021] 220 \n\t \n\t \n\t\t BMJ \n\t\t \n\t\t\t 352 \n\t\t\t 1174 \n\t\t\t 2016 Mar 17 \n\t\t \n\t \n\t Agarwal S, LeFevre AE, Lee J, L'Engle K, Mehl G, Sinha C, WHO mHealth Technical Evidence Review Group. Guidelines for reporting of health interventions using mobile phones: mobile health (mHealth) evidence reporting and assessment (mERA) checklist. BMJ 2016 Mar 17;352:i1174 [doi: 10.1136/bmj.i1174] [Medline: 26988021] 220"
    },
    {
      "title": "iCHECK-DH: guidelines and checklist for the reporting on digital health implementations",
      "authors": [
        "C Franck",
        "A Babington-Ashaye",
        "D Dietrich",
        "G Bediang",
        "P Veltsos",
        "P Gupta"
      ],
      "year": 2023,
      "doi": "10.2196/46694",
      "journal": "J Med Internet Res",
      "volume": "25",
      "pages": "46694",
      "raw": "iCHECK-DH: guidelines and checklist for the reporting on digital health implementations \n\t\t \n\t\t\t C P Franck \n\t\t \n\t\t \n\t\t\t A Babington-Ashaye \n\t\t \n\t\t \n\t\t\t D Dietrich \n\t\t \n\t\t \n\t\t\t G Bediang \n\t\t \n\t\t \n\t\t\t P Veltsos \n\t\t \n\t\t \n\t\t\t P P Gupta \n\t\t \n\t\t 10.2196/46694 \n\t\t Medline: 37163336] 221 \n\t \n\t \n\t\t J Med Internet Res \n\t\t \n\t\t\t 25 \n\t\t\t 46694 \n\t\t\t 2023 May 10 \n\t\t \n\t \n\t FREE Full text \n\t Franck CP, Babington-Ashaye A, Dietrich D, Bediang G, Veltsos P, Gupta PP, et al. iCHECK-DH: guidelines and checklist for the reporting on digital health implementations. J Med Internet Res 2023 May 10;25:e46694 [FREE Full text] [doi: 10.2196/46694] [Medline: 37163336] 221"
    },
    {
      "title": "Multimorbidity: making the case for an end to disease-specific rehabilitation",
      "authors": [
        "L Carlesso",
        "S Skou",
        "L Tang",
        "C Simon\u00ff",
        "D Brooks"
      ],
      "year": 2020,
      "doi": "10.3138/ptc-72-1-gee",
      "journal": "Physiother Can",
      "volume": "72",
      "issue": "1",
      "raw": "Multimorbidity: making the case for an end to disease-specific rehabilitation \n\t\t \n\t\t\t L C Carlesso \n\t\t \n\t\t \n\t\t\t S T Skou \n\t\t \n\t\t \n\t\t\t L H Tang \n\t\t \n\t\t \n\t\t\t C Simon\u00ff \n\t\t \n\t\t \n\t\t\t D Brooks \n\t\t \n\t\t 10.3138/ptc-72-1-gee \n\t\t Medline: 34385742] 222 \n\t \n\t \n\t\t Physiother Can \n\t\t \n\t\t\t 72 \n\t\t\t 1 \n\t\t\t \n\t\t\t 2020 \n\t\t \n\t \n\t FREE Full text \n\t Carlesso LC, Skou ST, Tang LH, Simon\u00ff C, Brooks D. Multimorbidity: making the case for an end to disease-specific rehabilitation. Physiother Can 2020;72(1):1-3 [FREE Full text] [doi: 10.3138/ptc-72-1-gee] [Medline: 34385742] 222"
    },
    {
      "title": "eHealth literacy: extending the digital divide to the realm of health information",
      "authors": [
        "E Neter",
        "E Brainin"
      ],
      "year": 2012,
      "doi": "10.2196/jmir.1619",
      "journal": "J Med Internet Res",
      "volume": "14",
      "issue": "1",
      "raw": "eHealth literacy: extending the digital divide to the realm of health information \n\t\t \n\t\t\t E Neter \n\t\t \n\t\t \n\t\t\t E Brainin \n\t\t \n\t\t 10.2196/jmir.1619 \n\t\t Medline: 22357448] 223 \n\t \n\t \n\t\t J Med Internet Res \n\t\t \n\t\t\t 14 \n\t\t\t 1 \n\t\t\t 2012 Jan 27 \n\t\t \n\t \n\t FREE Full text \n\t Neter E, Brainin E. eHealth literacy: extending the digital divide to the realm of health information. J Med Internet Res 2012 Jan 27;14(1):e19 [FREE Full text] [doi: 10.2196/jmir.1619] [Medline: 22357448] 223"
    },
    {
      "title": "Digital health literacy as a super determinant of health: more than simply the sum of its parts",
      "authors": [
        "R Van Kessel",
        "B Wong",
        "T Clemens",
        "H Brand"
      ],
      "year": 2022,
      "doi": "10.1016/j.invent.2022.100500",
      "journal": "Internet Interv",
      "volume": "27",
      "pages": "100500",
      "raw": "Digital health literacy as a super determinant of health: more than simply the sum of its parts \n\t\t \n\t\t\t R Van Kessel \n\t\t \n\t\t \n\t\t\t B L Wong \n\t\t \n\t\t \n\t\t\t T Clemens \n\t\t \n\t\t \n\t\t\t H Brand \n\t\t \n\t\t 10.1016/j.invent.2022.100500 \n\t\t Medline: 35242586] 224 \n\t \n\t \n\t\t Internet Interv \n\t\t \n\t\t\t 27 \n\t\t\t 100500 \n\t\t\t 2022 Mar \n\t\t \n\t \n\t FREE Full text \n\t van Kessel R, Wong BL, Clemens T, Brand H. Digital health literacy as a super determinant of health: more than simply the sum of its parts. Internet Interv 2022 Mar;27:100500 [FREE Full text] [doi: 10.1016/j.invent.2022.100500] [Medline: 35242586] 224"
    },
    {
      "title": "Exercise is the real polypill",
      "authors": [
        "C Fiuza-Luces",
        "N Garatachea",
        "N Berger"
      ],
      "year": 2013,
      "doi": "10.1152/physiol.00019.2013",
      "journal": "Physiology (Bethesda)",
      "volume": "28",
      "issue": "5",
      "raw": "Exercise is the real polypill \n\t\t \n\t\t\t C Fiuza-Luces \n\t\t \n\t\t \n\t\t\t N Garatachea \n\t\t \n\t\t \n\t\t\t N A Berger \n\t\t \n\t\t \n\t\t\t Lucia A \n\t\t \n\t\t 10.1152/physiol.00019.2013 \n\t\t Medline: 23997192 \n\t \n\t \n\t\t Physiology (Bethesda) \n\t\t \n\t\t\t 28 \n\t\t\t 5 \n\t\t\t \n\t\t\t 2013 Sep \n\t\t \n\t \n\t FREE Full text \n\t Fiuza-Luces C, Garatachea N, Berger NA, Lucia A. Exercise is the real polypill. Physiology (Bethesda) 2013 Sep;28(5):330-358 [FREE Full text] [doi: 10.1152/physiol.00019.2013] [Medline: 23997192]"
    }
  ],
  "num_references": 225,
  "figures": [
    {
      "caption": "Figure 1 .",
      "description": "Figure 1. PRISMA (Preferred Reporting Items for Systematic Reviews and Meta-Analyses) flowchart of the study selection process."
    },
    {
      "caption": "Figure 2 .",
      "description": "Figure 2. Overall forest plot of objectively measured physical activity, objectively measured physical function, and moderate to vigorous physical activity (MVPA) at the end of the intervention. Obj PA: objectively measured physical activity; Obj PF: objectively measured physical function."
    },
    {
      "caption": "Figure 3 .",
      "description": "Figure 3. Overall forest plot of subjectively measured physical activity, physical function, and health-related quality of life (HRQOL) at the end of the intervention. Subj PA: subjectively measured physical activity; Subj PF: subjectively measured physical function."
    },
    {
      "caption": "Figure 4 .",
      "description": "Figure 4. Overall forest plot of depression and anxiety at the end of the intervention. ANX: anxiety; DEP: depression."
    },
    {
      "caption": "Figure 5 .",
      "description": "Figure 5. Overall forest plot of objectively measured physical activity, physical function, and moderate to vigorous physical activity (MVPA) at follow-up. Obj PA: objectively measured physical activity; Obj PF: objectively measured physical function."
    },
    {
      "caption": "Figure 6 .",
      "description": "Figure 6. Overall forest plot of subjectively measured physical activity, physical function, and health-related quality of life (HRQOL) at follow-up. Subj PA: subjectively measured physical activity; Subj PF: subjectively measured physical function."
    },
    {
      "caption": "Figure 7 .",
      "description": "Figure 7. Overall forest plot of depression and anxiety at follow-up. ANX: anxiety; DEP: depression."
    },
    {
      "caption": "Figure 8 .",
      "description": "Figure 8. Risk of bias for objectively measured physical activity given as percentages."
    },
    {
      "caption": "Figure 9 .",
      "description": "Figure 9. Risk of bias with objectively measured physical function given as percentages."
    },
    {
      "description": "c SMD: standardized mean difference.d Some conditions are not represented, or the results only included a few studies within each condition."
    },
    {
      "type": "table",
      "caption": "Table 2 .",
      "description": "Grading of Recommendations Assessment, Development, and Evaluation summary of findings."
    }
  ],
  "num_figures": 11,
  "tables": [
    {
      "content": "Outcome; Number of par- Relative ef- Anticipated absolute effects Certainty What happens time point ticipants (stud- fect (95% ies) CI) Without digital With digital Difference health interven- health interven- tions, % tions (95% CI) Objectively measured physical activ-ity; end of in-tervention: 6207 (51 RCTs a ) N/A b N/A N/A SMD c 0.29 SD higher (0.21 higher to 0.37 higher) \u2295\u2295\u2295\u25cb Moderate d,e Digital health interventions that promote physical activity likely slightly increase objectively measured physical activity. This may correspond to an average mean 20.7 increase of 970.8 daily steps (SD 16.6) (95% CI 657.1 1284.5 steps; weeks I 2 =54.0%; 30 RCTs; 3904 partic- ipants). However, there was no effect on objectively measured moderate to vigorous physical activity (SMD 0.03, 95% CI -0.31 to 0.37; I 2 =89.8%; 18 RCTs; 1921 participants). Objectively 6056 (47 RCTs) N/A N/A N/A SMD 0.36 SD \u2295\u25cb\u25cb\u25cb Digital health interventions pro- measured physical func-tion; end of in- higher (0.12 higher to 0.59 higher) Very low f,g,h,i moting physical activity may slightly increase objectively measured physical function, but tervention: the evidence is very uncertain. mean 17.5 However, at the end of the inter- (SD 18.0) vention (mean 16.8 weeks), the weeks effect may correspond to an aver- age increase of 19.8 m (95% CI 9.5-30.0 m; I 2 =75.9%; 34 RCTs; 4725 participants) on the 6- minute walk test. Subjectively 10,906 (58 N/A N/A N/A SMD 0.29 SD \u2295\u25cb\u25cb\u25cb Digital health interventions pro- measured physical activ-ity; end of in- RCTs) higher (0.19 higher to 0.39 higher) Very low d,f,g,i,j moting physical activity may slightly increase subjectively measured physical activity, but tervention: the evidence is very uncertain. mean 27.3 (SD 21.4) Subjectively 4065 (26 RCTs) N/A N/A N/A SMD 0.21 SD \u2295\u2295\u2295\u25cb Digital health interventions that measured physical func-tion; end of in- higher (0.13 higher to 0.29 higher) Moder-ate d,e,g promote physical activity likely slightly increase subjectively measured physical function. tervention: mean 18.5 (SD 10.5) weeks Depression as- 4604 (40 RCTs) N/A N/A N/A SMD 0.25 SD \u2295\u2295\u2295\u25cb Digital health interventions that sessed with subjective measures; end lower (0.35 lower to 0.16 lower) Moder-ate d,e,g promote physical activity likely slightly reduce depression. of interven- tion: mean 20 (SD 15.4) weeks Anxiety as- 2934 (25 RCTs) N/A N/A N/A SMD 0.17 SD \u2295\u2295\u25cb\u25cb Digital health interventions that sessed with subjective lower (0.26 lower to 0.09 Low d,g,i,j,k promote physical activity may slightly reduce anxiety. measures; end lower) of interven- tion: mean 16 (SD 11.1) weeks"
    }
  ],
  "num_tables": 1,
  "num_citations": 555,
  "cited_references": [
    "b72",
    "b13",
    "b65",
    "b79",
    "b41",
    "b44",
    "b14",
    "b25",
    "b35",
    "b20",
    "b92",
    "b90",
    "b71",
    "b99",
    "b74",
    "b51",
    "b42",
    "b30",
    "b96",
    "b29",
    "b102",
    "b28",
    "b4",
    "b56",
    "b85",
    "b50",
    "b62",
    "b11",
    "b22",
    "b34",
    "b6",
    "b58",
    "b73",
    "b17",
    "b77",
    "b60",
    "b43",
    "b66",
    "b68",
    "b12",
    "b78",
    "b98",
    "b52",
    "b97",
    "b75",
    "b82",
    "b84",
    "b89",
    "b81",
    "b33",
    "b8",
    "b27",
    "b57",
    "b39",
    "b49",
    "b94",
    "b36",
    "b59",
    "b21",
    "b64",
    "b40",
    "b100",
    "b54",
    "b91",
    "b16",
    "b46",
    "b32",
    "b101",
    "b45",
    "b10",
    "b67",
    "b55",
    "b76",
    "b86",
    "b18",
    "b87",
    "b9",
    "b69",
    "b95",
    "b47",
    "b93",
    "b31",
    "b70",
    "b61",
    "b37",
    "b15",
    "b5",
    "b19",
    "b38",
    "b88",
    "b24",
    "b48",
    "b53",
    "b63",
    "b80",
    "b83",
    "b26"
  ],
  "notes": [
    "[raw_affiliation] 1  The Research Unit PROgrez , Department of Physiotherapy and Occupational Therapy , Naestved-Slagelse-Ringsted Hospital , Slagelse , Denmark",
    "[raw_affiliation] 2  Research Unit for Musculoskeletal Function and Physiotherapy , Department of Sports Science and Clinical Biomechanics , University of Southern Denmark , Odense , Denmark",
    "[raw_affiliation] 1  The Research Unit PROgrez , Department of Physiotherapy and Occupational Therapy , Naestved-Slagelse-Ringsted Hospital , Slagelse , Denmark",
    "[raw_affiliation] 2  Research Unit for Musculoskeletal Function and Physiotherapy , Department of Sports Science and Clinical Biomechanics , University of Southern Denmark , Odense , Denmark",
    "[raw_affiliation] 2  Research Unit for Musculoskeletal Function and Physiotherapy , Department of Sports Science and Clinical Biomechanics , University of Southern Denmark , Odense , Denmark",
    "[raw_affiliation] 3  Centre for Evidence-Based Orthopedics (CEBO) , Department of Orthopaedic Surgery , Zealand University Hospital , K\u00f8ge , Denmark",
    "[raw_affiliation] 2  Research Unit for Musculoskeletal Function and Physiotherapy , Department of Sports Science and Clinical Biomechanics , University of Southern Denmark , Odense , Denmark",
    "[raw_affiliation] 4  Department of Physiotherapy and Occupational Therapy , University Hospital of Copenhagen , Herlev and Gentofte , Denmark",
    "[raw_affiliation] 1  The Research Unit PROgrez , Department of Physiotherapy and Occupational Therapy , Naestved-Slagelse-Ringsted Hospital , Slagelse , Denmark",
    "[raw_affiliation] 5  Research Unit for Exercise Epidemiology , Centre of Research in Childhood Health , Department of Sports Science and Clinical Biomechanics , University of Southern Denmark , Odense , Denmark",
    "[raw_affiliation] 6  Department of Regional Health Research , University of Southern Denmark , Odense , Denmark",
    "[raw_affiliation] 1  The Research Unit PROgrez , Department of Physiotherapy and Occupational Therapy , Naestved-Slagelse-Ringsted Hospital , Slagelse , Denmark",
    "[raw_affiliation] 2  Research Unit for Musculoskeletal Function and Physiotherapy , Department of Sports Science and Clinical Biomechanics , University of Southern Denmark , Odense , Denmark",
    "[raw_affiliation] 1  The Research Unit PROgrez , Department of Physiotherapy and Occupational Therapy , Naestved-Slagelse-Ringsted Hospital , Slagelse , Denmark",
    "[raw_affiliation] 1  The Research Unit PROgrez , Department of Physiotherapy and Occupational Therapy , Naestved-Slagelse-Ringsted Hospital , Slagelse , Denmark",
    "[raw_affiliation] 5  Research Unit for Exercise Epidemiology , Centre of Research in Childhood Health , Department of Sports Science and Clinical Biomechanics , University of Southern Denmark , Odense , Denmark",
    "[raw_affiliation] 7  Centre for Physical Activity Research , Copenhagen University Hospital , Rigshospitalet , Copenhagen , Denmark",
    "[raw_affiliation] 1  The Research Unit PROgrez , Department of Physiotherapy and Occupational Therapy , Naestved-Slagelse-Ringsted Hospital , Slagelse , Denmark",
    "[raw_affiliation] 6  Department of Regional Health Research , University of Southern Denmark , Odense , Denmark",
    "[raw_affiliation] 8  National Institute of Public Health , University of Southern Denmark , Copenhagen , Denmark The Research Unit PROgrez Department of Physiotherapy and Occupational Therapy",
    "[raw_affiliation] 1  The Research Unit PROgrez , Department of Physiotherapy and Occupational Therapy , Naestved-Slagelse-Ringsted Hospital , Slagelse , Denmark",
    "[raw_affiliation] 2  Research Unit for Musculoskeletal Function and Physiotherapy , Department of Sports Science and Clinical Biomechanics , University of Southern Denmark , Odense , Denmark",
    "[raw_affiliation] Naestved- Slagelse-Ringsted Hospital Faelledvej 2C , 1 sal Slagelse , 4200 Denmark",
    "a RCT: randomized controlled trial. b N/A: not applicable.",
    "J Med Internet Res 2023 | vol. 25 | e46439 | p. 2 https://www.jmir.org/2023/1/e46439 (page number not for citation purposes)",
    "J Med Internet Res 2023 | vol. 25 | e46439 | p. 3 https://www.jmir.org/2023/1/e46439 (page number not for citation purposes)",
    "J Med Internet Res 2023 | vol. 25 | e46439 | p. 4 https://www.jmir.org/2023/1/e46439 (page number not for citation purposes)",
    "J Med Internet Res 2023 | vol. 25 | e46439 | p. 5 https://www.jmir.org/2023/1/e46439(page number not for citation purposes)",
    "J Med Internet Res 2023 | vol. 25 | e46439 | p. 6 https://www.jmir.org/2023/1/e46439 (page number not for citation purposes)",
    "J Med Internet Res 2023 | vol. 25 | e46439 | p. 7 https://www.jmir.org/2023/1/e46439 (page number not for citation purposes)",
    "J Med Internet Res 2023 | vol. 25 | e46439 | p. 8 https://www.jmir.org/2023/1/e46439 (page number not for citation purposes)",
    "J Med Internet Res 2023 | vol. 25 | e46439 | p. 9 https://www.jmir.org/2023/1/e46439 (page number not for citation purposes)",
    "J Med Internet Res 2023 | vol. 25 | e46439 | p. 10 https://www.jmir.org/2023/1/e46439 (page number not for citation purposes)",
    "J Med Internet Res 2023 | vol. 25 | e46439 | p. 11 https://www.jmir.org/2023/1/e46439 (page number not for citation purposes)",
    "J Med Internet Res 2023 | vol. 25 | e46439 | p. 12 https://www.jmir.org/2023/1/e46439 (page number not for citation purposes)",
    "J Med Internet Res 2023 | vol. 25 | e46439 | p. 13 https://www.jmir.org/2023/1/e46439 (page number not for citation purposes)",
    "J Med Internet Res 2023 | vol. 25 | e46439 | p. 14 https://www.jmir.org/2023/1/e46439 (page number not for citation purposes)",
    "J Med Internet Res 2023 | vol. 25 | e46439 | p. 15 https://www.jmir.org/2023/1/e46439 (page number not for citation purposes)",
    "J Med Internet Res 2023 | vol. 25 | e46439 | p. 16 https://www.jmir.org/2023/1/e46439 (page number not for citation purposes)",
    "J Med Internet Res 2023 | vol. 25 | e46439 | p. 17 https://www.jmir.org/2023/1/e46439 (page number not for citation purposes)",
    "J Med Internet Res 2023 | vol. 25 | e46439 | p. 18 https://www.jmir.org/2023/1/e46439 (page number not for citation purposes)",
    "J Med Internet Res 2023 | vol. 25 | e46439 | p. 19 https://www.jmir.org/2023/1/e46439 (page number not for citation purposes)",
    "J Med Internet Res 2023 | vol. 25 | e46439 | p. 20 https://www.jmir.org/2023/1/e46439 (page number not for citation purposes)",
    "J Med Internet Res 2023 | vol. 25 | e46439 | p. 21 https://www.jmir.org/2023/1/e46439 (page number not for citation purposes)",
    "J Med Internet Res 2023 | vol. 25 | e46439 | p. 22 https://www.jmir.org/2023/1/e46439 (page number not for citation purposes)",
    "J Med Internet Res 2023 | vol. 25 | e46439 | p. 23 https://www.jmir.org/2023/1/e46439 (page number not for citation purposes)",
    "J Med Internet Res 2023 | vol. 25 | e46439 | p. 24 https://www.jmir.org/2023/1/e46439 (page number not for citation purposes)",
    "J Med Internet Res 2023 | vol. 25 | e46439 | p. 25 https://www.jmir.org/2023/1/e46439 (page number not for citation purposes)",
    "J Med Internet Res 2023 | vol. 25 | e46439 | p. 26 https://www.jmir.org/2023/1/e46439 (page number not for citation purposes)",
    "[raw_reference] Study protocol including amendments to protocol.",
    "[raw_reference] PDF File (Adobe PDF File), 283 KB-Multimedia Appendix 1Multimedia Appendix 2 PRISMA (Preferred Reporting Items for Systematic Reviews and Meta-Analyses) checklist.",
    "PDF File Adobe PDF File), 11151 KB-Multimedia Appendix Multimedia Appendix 5 Risk of bias",
    "[raw_reference] PDF File (Adobe PDF File), 11151 KB-Multimedia Appendix Multimedia Appendix 5 Risk of bias: Cochrane Risk of Bias 2 assessment of each outcome of interest.",
    "PDF File Adobe PDF File PDF File (Adobe PDF File KB-Multimedia Appendix 7",
    "[raw_reference] PDF File (Adobe PDF File), 979 KB-Multimedia Appendix 6Multimedia Appendix 7 Meta-regression analyses. [PDF File (Adobe PDF File), 593 KB-Multimedia Appendix 7] References",
    "Diseases Injuries Collaborators FREE Full text",
    "[raw_reference] GBD 2019 Diseases Injuries Collaborators. Global burden of 369 diseases and injuries in 204 countries and territories, 1990-2019: a systematic analysis for the Global Burden of Disease Study 2019. Lancet 2020 Oct 17;396(10258):1204-1222 [FREE Full text] [doi: 10.1016/S0140-6736(20)30925-9] [Medline: 33069326]",
    "[raw_reference] Jayasinghe S, Byrne NM, Patterson KA, Ahuja KD, Hills AP. The current global state of movement and physical activity -the health and economic costs of the inactive phenotype. Prog Cardiovasc Dis 2021 Jan;64:9-16 [doi: 10.1016/j.pcad.2020.10.006] [Medline: 33130190]",
    "[raw_reference] Ding D, Kolbe-Alexander T, Nguyen B, PT, Pratt M, Lawson KD. The economic burden of physical inactivity: a systematic review and critical appraisal. Br J Sports Med 2017 Oct;51(19):1392-1409 [doi: 10.1136/bjsports-2016-097385] [Medline: 28446455]",
    "[raw_reference] Pedersen BK, Saltin B. Exercise as medicine -evidence for prescribing exercise as therapy in 26 different chronic diseases. Scand J Med Sci Sports 2015 Dec;25 Suppl 3:1-72 [doi: 10.1111/sms.12581] [Medline: 26606383]",
    "FREE Full text",
    "[raw_reference] Bricca A, Harris LK, J\u00e4ger M, Smith SM, Juhl CB, Skou ST. Benefits and harms of exercise therapy in people with multimorbidity: a systematic review and meta-analysis of randomised controlled trials. Ageing Res Rev 2020 Nov;63:101166 [FREE Full text] [doi: 10.1016/j.arr.2020.101166] [Medline: 32896665]",
    "FREE Full text",
    "[raw_reference] Ashe MC, Miller WC, Eng JJ, Noreau L, Physical ActivityChronic Conditions Research Team. Older adults, chronic disease and leisure-time physical activity. Gerontology 2009;55(1):64-72 [FREE Full text] [doi: 10.1159/000141518] [Medline: 18566534]",
    "FREE Full text",
    "[raw_reference] Salman A, Sellami M. Do older adults with multimorbidity meet the recommended levels of physical activity? An analysis of scottish health survey. Int J Environ Res Public Health 2019 Oct 04;16(19):3748 [FREE Full text] [doi: 10.3390/ijerph16193748] [Medline: 31590293]",
    "FREE Full text",
    "[raw_reference] Keating A, Lee A, Holland AE. What prevents people with chronic obstructive pulmonary disease from attending pulmonary rehabilitation? A systematic review. Chron Respir Dis 2011;8(2):89-99 [FREE Full text] [doi: 10.1177/1479972310393756] [Medline: 21596892]",
    "FREE Full text",
    "[raw_reference] Tuso P. Strategies to increase physical activity. Perm J 2015;19(4):84-88 [FREE Full text] [doi: 10.7812/TPP/14-242] [Medline: 26517440]",
    "FREE Full text",
    "[raw_reference] Murray E, Hekler EB, Andersson G, Collins LM, Doherty A, Hollis C, et al. Evaluating digital health interventions: key questions and approaches. Am J Prev Med 2016 Nov;51(5):843-851 [FREE Full text] [doi: 10.1016/j.amepre.2016.06.008] [Medline: 27745684]",
    "FREE Full text",
    "[raw_reference] Lettieri E, Fumagalli LP, Radaelli G, Bertele' P, Vogt J, Hammerschmidt R, et al. Empowering patients through eHealth: a case report of a pan-European project. BMC Health Serv Res 2015 Aug 05;15:309 [FREE Full text] [doi: 10.1186/s12913-015-0983-0] [Medline: 26242863]",
    "FREE Full text",
    "[raw_reference] Labrique A, Agarwal S, Tamrat T, Mehl G. WHO Digital Health Guidelines: a milestone for global health. NPJ Digit Med 2020 Sep;3:120 [FREE Full text] [doi: 10.1038/s41746-020-00330-2] [Medline: 33015373]",
    "FREE Full text",
    "[raw_reference] Kendzerska T, Zhu DT, Gershon AS, Edwards JD, Peixoto C, Robillard R, et al. The effects of the health system response to the COVID-19 pandemic on chronic disease management: a narrative review. Risk Manag Healthc Policy 2021;14:575-584 [FREE Full text] [doi: 10.2147/RMHP.S293471] [Medline: 33623448]",
    "FREE Full text",
    "[raw_reference] Guo C, Ashrafian H, Ghafur S, Fontana G, Gardner C, Prime M. Challenges for the evaluation of digital health solutions-a call for innovative evidence generation approaches. NPJ Digit Med 2020;3:110 [FREE Full text] [doi: 10.1038/s41746-020-00314-2] [Medline: 32904379]",
    "FREE Full text",
    "[raw_reference] Cox NS, Dal Corso SD, Hansen H, McDonald CF, Hill CJ, Zanaboni P, et al. Telerehabilitation for chronic respiratory disease. Cochrane Database Syst Rev 2021 Jan 29;1(1):CD013040 [FREE Full text] [doi: 10.1002/14651858.CD013040.pub2] [Medline: 33511633]",
    "FREE Full text",
    "[raw_reference] Cavalheiro AH, Cardoso JS, Rocha A, Moreira E, Azevedo LF. Effectiveness of tele-rehabilitation programs in heart failure: a systematic review and meta-analysis. Health Serv Insights 2021 Jun 15;14:11786329211021668 [FREE Full text] [doi: 10.1177/11786329211021668] [Medline: 34188484]",
    "FREE Full text",
    "[raw_reference] Indraratna P, Tardo D, Yu J, Delbaere K, Brodie M, Lovell N, et al. Mobile phone technologies in the management of ischemic heart disease, heart failure, and hypertension: systematic review and meta-analysis. JMIR Mhealth Uhealth 2020 Jul 06;8(7):e16695 [FREE Full text] [doi: 10.2196/16695] [Medline: 32628615]",
    "[raw_reference] Eland-de Kok P, van Os-Medendorp H, Vergouwe-Meijer A, Bruijnzeel-Koomen C, Ros W. A systematic review of the effects of e-health on chronically ill patients. J Clin Nurs 2011 Nov;20(21-22):2997-3010 [doi: 10.1111/j.1365-2702.2011.03743.x] [Medline: 21707807]",
    "FREE Full text",
    "[raw_reference] Kraef C, van der Meirschen M, Free C. Digital telemedicine interventions for patients with multimorbidity: a systematic review and meta-analysis. BMJ Open 2020 Oct 13;10(10):e036904 [FREE Full text] [doi: 10.1136/bmjopen-2020-036904] [Medline: 33051232]",
    "FREE Full text",
    "[raw_reference] Carneiro L, Rosenbaum S, Ward PB, Clemente FM, Ramirez-Campillo R, Monteiro-J\u00fanior RS, et al. Web-based exercise interventions for patients with depressive and anxiety disorders: a systematic review of randomized controlled trials. Braz J Psychiatry 2022;44(3):331-341 [FREE Full text] [doi: 10.1590/1516-4446-2021-2026] [Medline: 34852034]",
    "FREE Full text",
    "[raw_reference] Chen T, Or CK, Chen J. Effects of technology-supported exercise programs on the knee pain, physical function, and quality of life of individuals with knee osteoarthritis and/or chronic knee pain: a systematic review and meta-analysis of randomized controlled trials. J Am Med Inform Assoc 2021 Feb 15;28(2):414-423 [FREE Full text] [doi: 10.1093/jamia/ocaa282] [Medline: 33236109]",
    "FREE Full text",
    "[raw_reference] Hodkinson A, Kontopantelis E, Adeniji C, van Marwijk H, McMillian B, Bower P, et al. Interventions using wearable physical activity trackers among adults with cardiometabolic conditions: a systematic review and meta-analysis. JAMA Netw Open 2021 Jul 01;4(7):e2116382 [FREE Full text] [doi: 10.1001/jamanetworkopen.2021.16382] [Medline: 34283229]",
    "FREE Full text",
    "[raw_reference] Patterson K, Davey R, Keegan R, Freene N. Smartphone applications for physical activity and sedentary behaviour change in people with cardiovascular disease: a systematic review and meta-analysis. PLoS One 2021 Oct 11;16(10):e0258460 [FREE Full text] [doi: 10.1371/journal.pone.0258460] [Medline: 34634096]",
    "FREE Full text",
    "[raw_reference] Choo YJ, Chang MC. Effects of telecardiac rehabilitation on coronary heart disease: a PRISMA-compliant systematic review and meta-analysis. Medicine (Baltimore) 2022 Jul 15;101(28):e29459 [FREE Full text] [doi: 10.1097/MD.0000000000029459] [Medline: 35839029]",
    "[raw_reference] Brown RC, Coombes JS, Rodriguez KJ, Hickman IJ, Keating SE. Effectiveness of exercise via telehealth for chronic disease: a systematic review and meta-analysis of exercise interventions delivered via videoconferencing. Br J Sports Med 2022 Jun 17;56(18):1042-1052 [doi: 10.1136/bjsports-2021-105118] [Medline: 35715175]",
    "[raw_reference] Barbabella F, Melchiorre MG, Quattrini S, Papa R, Lamura G, Richardson E, et al, editors. How Can eHealth Improve Care for People With Multimorbidity in Europe?. Copenhagen (Denmark): European Observatory on Health Systems and Policies; 2017.",
    "[raw_reference] Fan I, Govil D, Semciw A. The effectiveness of exercise based digital health interventions (requiring internet) in management of hip and knee osteoarthritis: a systematic review and meta-analysis. Osteoarthritis Cartilage 2022 Apr;30:S402 [doi: 10.1016/j.joca.2022.02.540]",
    "FREE Full text",
    "[raw_reference] Skou ST, Mair FS, Fortin M, Guthrie B, Nunes BP, Miranda JJ, et al. Multimorbidity. Nat Rev Dis Primers 2022 Jul 14;8(1):48 [FREE Full text] [doi: 10.1038/s41572-022-00376-4] [Medline: 35835758]",
    "[raw_reference] What is a serious adverse event? U.S. Food & Drug Administration. URL: https://www.fda.gov/safety/ reporting-serious-problems-fda/what-serious-adverse-event [accessed 2020-05-01]",
    "FREE Full text",
    "[raw_reference] Sterne JA, Savovi\u0107 J, Page MJ, Elbers RG, Blencowe NS, Boutron I, et al. RoB 2: a revised tool for assessing risk of bias in randomised trials. BMJ 2019 Aug 28;366:l4898 [FREE Full text] [doi: 10.1136/bmj.l4898] [Medline: 31462531]",
    "GRADE",
    "[raw_reference] GRADE homepage. GRADE. URL: https://www.gradeworkinggroup.org/ [accessed 2020-03-05]",
    "[raw_reference] Cohen J. Statistical Power Analysis for the Behavioral Sciences. New York, NY: Routledge; 1988.",
    "FREE Full text",
    "[raw_reference] Eysenbach G. What is e-health? J Med Internet Res 2001 Apr;3(2):E20 [FREE Full text] [doi: 10.2196/jmir.3.2.e20] [Medline: 11720962]",
    "[raw_reference] Rechel B, Doyle Y, Grundy E, McKee M. How can health systems respond to population ageing? World Health Organization. URL: https://apps.who.int/iris/bitstream/handle/10665/107941/Policy-brief-10-1997-8073-eng.pdf?sequence=9&isAllowed=y [accessed 2023-06-11]",
    "[raw_reference] Hale TM, Chou WY, Cotten SR, Khilnani A. eHealth: Current Evidence, Promises, Perils and Future Directions. Volume 15. West Yorkshire, UK: Emerald Publishing; 2018.",
    "[raw_reference] Stewart AL, Hays RD, Wells KB, Rogers WH, Spritzer KL, Greenfield S. Long-term functioning and well-being outcomes associated with physical activity and exercise in patients with chronic conditions in the medical outcomes study. J Clin Epidemiol 1994 Jul;47(7):719-730 [doi: 10.1016/0895-4356(94)90169-4] [Medline: 7722585]",
    "FREE Full text",
    "[raw_reference] Norman GJ, Zabinski MF, Adams MA, Rosenberg DE, Yaroch AL, Atienza AA. A review of eHealth interventions for physical activity and dietary behavior change. Am J Prev Med 2007 Oct;33(4):336-345 [FREE Full text] [doi: 10.1016/j.amepre.2007.05.007] [Medline: 17888860]",
    "[raw_reference] Sforzolini FS. Taking the pulse of eHealth in the EU. European Union. 2017. URL: https://digital-strategy.ec.europa.eu/ en/library/taking-pulse-ehealth-eu-study-and-round-table-discussion [accessed 2023-06-14]",
    "[raw_reference] Skou ST, Pedersen BK, Abbott JH, Patterson B, Barton C. Physical activity and exercise therapy benefit more than just symptoms and impairments in people with hip and knee osteoarthritis. J Orthop Sports Phys Ther 2018 Jun;48(6):439-447 [doi: 10.2519/jospt.2018.7877] [Medline: 29669488]",
    "FREE Full text",
    "[raw_reference] Global Burden of Disease Study 2013 Collaborators. Global, regional, and national incidence, prevalence, and years lived with disability for 301 acute and chronic diseases and injuries in 188 countries, 1990-2013: a systematic analysis for the global burden of disease study 2013. Lancet 2015 Aug 22;386(9995):743-800 [FREE Full text] [doi: 10.1016/S0140-6736(15)60692-4] [Medline: 26063472]",
    "[raw_reference] Xu X, Mishra GD, Jones M. Evidence on multimorbidity from definition to intervention: an overview of systematic reviews. Ageing Res Rev 2017 Aug;37:53-68 [doi: 10.1016/j.arr.2017.05.003] [Medline: 28511964]",
    "FREE Full text",
    "[raw_reference] Smith SM, Wallace E, Salisbury C, Sasseville M, Bayliss E, Fortin M. A core outcome set for multimorbidity research (COSmm). Ann Fam Med 2018 Mar;16(2):132-138 [FREE Full text] [doi: 10.1370/afm.2178] [Medline: 29531104]",
    "[raw_reference] Multimorbidity: a priority for global health research. The Academy of Medical Sciences. 2018. URL: https://acmedsci. ac.uk/file-download/82222577 [accessed 2019-01-05]",
    "[raw_reference] Higgins J, Thomas J, Chandler J, Cumpston M, Li T, Page M, et al. Cochrane handbook for systematic reviews of interventions version 6.0. Cochrane. 2019. URL: https://www.training.cochrane.org/handbook [accessed 2023-06-14]",
    "[raw_reference] Higgins JP, Thomas J, Chandler J, Cumpston M, Li T, Page MJ, et al, editors. Cochrane Handbook for Systematic Reviews of Interventions version 6.3 (updated February 2022). Hoboken, New Jersey: Wiley; 2022.",
    "FREE Full text",
    "[raw_reference] Page MJ, McKenzie JE, Bossuyt PM, Boutron I, Hoffmann TC, Mulrow CD, et al. The PRISMA 2020 statement: an updated guideline for reporting systematic reviews. BMJ 2021 Mar 29;372:n71 [FREE Full text] [doi: 10.1136/bmj.n71] [Medline: 33782057]",
    "[raw_reference] Fatehi F, Samadbeik M, Kazemi A. What is digital health? Review of definitions. Stud Health Technol Inform 2020 Nov 23;275:67-71 [doi: 10.3233/SHTI200696] [Medline: 33227742]",
    "[raw_reference] Gleeson M, Bishop NC, Stensel DJ, Lindley MR, Mastana SS, Nimmo MA. The anti-inflammatory effects of exercise: mechanisms and implications for the prevention and treatment of disease. Nat Rev Immunol 2011 Aug 05;11(9):607-615 [doi: 10.1038/nri3041] [Medline: 21818123]",
    "FREE Full text",
    "[raw_reference] Bricca A, J\u00e4ger M, Johnston M, Zangger G, Harris LK, Midtgaard J, et al. Effect of in-person delivered behavioural interventions in people with multimorbidity: systematic review and meta-analysis. Int J Behav Med 2023 Apr;30(2):167-189 [FREE Full text] [doi: 10.1007/s12529-022-10092-8] [Medline: 35484462]",
    "[raw_reference] Cox NS, McDonald CF, Hill CJ, O'Halloran P, Alison JA, Zanaboni P, et al. Telerehabilitation for chronic respiratory disease. Cochrane Database Systematic Rev 2018(6) [doi: 10.1002/14651858.CD013040]",
    "[raw_reference] EMBASE RCT filter. ISSG Search Filters Resource. URL: https://sites.google.com/a/york.ac.uk/issg-search-filters-resource/ home/rcts/embase-rct-filter [accessed 2022-06-22]",
    "FREE Full text",
    "[raw_reference] Higgins JP, Thompson SG, Deeks JJ, Altman DG. Measuring inconsistency in meta-analyses. BMJ 2003 Sep 06;327(7414):557-560 [FREE Full text] [doi: 10.1136/bmj.327.7414.557] [Medline: 12958120]",
    "FREE Full text",
    "[raw_reference] Agboola S, Jethwani K, Lopez L, Searl M, O'Keefe S, Kvedar J. Text to move: a randomized controlled trial of a text-messaging program to improve physical activity behaviors in patients with type 2 diabetes mellitus. J Med Internet Res 2016 Nov 18;18(11):e307 [FREE Full text] [doi: 10.2196/jmir.6439] [Medline: 27864165]",
    "FREE Full text",
    "[raw_reference] Allen KD, Arbeeva L, Callahan LF, Golightly YM, Goode AP, Heiderscheit BC, et al. Physical therapy vs internet-based exercise training for patients with knee osteoarthritis: results of a randomized controlled trial. Osteoarthritis Cartilage 2018 Mar;26(3):383-396 [FREE Full text] [doi: 10.1016/j.joca.2017.12.008] [Medline: 29307722]",
    "[raw_reference] Allen KD, Woolson S, Hoenig HM, Bongiorni D, Byrd J, Caves K, et al. Stepped exercise program for patients with knee osteoarthritis. Ann Intern Med 2021 Mar;174(3):298-307 [doi: 10.7326/m20-4447]",
    "FREE Full text",
    "[raw_reference] Anderson DR, Christison-Lagay J, Villagra V, Liu H, Dziura J. Managing the space between visits: a randomized trial of disease management for diabetes in a community health center. J Gen Intern Med 2010 Oct 16;25(10):1116-1122 [FREE Full text] [doi: 10.1007/s11606-010-1419-5] [Medline: 20556536]",
    "[raw_reference] Baker K, LaValley MP, Brown C, Felson DT, Ledingham A, Keysor JJ. Efficacy of computer-based telephone counseling on long-term adherence to strength training in elderly patients with knee osteoarthritis: a randomized trial. Arthritis Care Res (Hoboken) 2020 Jul;72(7):982-990 [doi: 10.1002/acr.23921] [Medline: 31074576]",
    "FREE Full text",
    "[raw_reference] Bender MS, Cooper BA, Park LG, Padash S, Arai S. A feasible and efficacious mobile-phone based lifestyle intervention for Filipino Americans with type 2 diabetes: randomized controlled trial. JMIR Diabetes 2017 Dec 12;2(2):e30 [FREE Full text] [doi: 10.2196/diabetes.8156] [Medline: 30291068]",
    "[raw_reference] Benson GA, Sidebottom A, Hayes J, Miedema MD, Boucher J, Vacquier M, et al. Impact of ENHANCED (diEtitiaNs Helping pAtieNts CarE for Diabetes) telemedicine randomized controlled trial on diabetes optimal care outcomes in patients with type 2 diabetes. J Acad Nutr Diet 2019 Apr;119(4):585-598 [doi: 10.1016/j.jand.2018.11.013] [Medline: 30711463]",
    "FREE Full text",
    "[raw_reference] Benzo RP, Ridgeway J, Hoult JP, Novotny P, Thomas BE, Lam NM, et al. Feasibility of a health coaching and home-based rehabilitation intervention with remote monitoring for COPD. Respir Care 2021 Jun;66(6):960-971 [FREE Full text] [doi: 10.4187/respcare.08580] [Medline: 33906954]",
    "[raw_reference] Benzo R, Hoult J, McEvoy C, Clark M, Benzo M, Johnson M, et al. Promoting chronic obstructive pulmonary disease wellness through remote monitoring and health coaching: a clinical trial. Annals ATS 2022 Nov;19(11):1808-1817 [doi: 10.1513/annalsats.202203-214oc]",
    "FREE Full text",
    "[raw_reference] Chokshi NP, Adusumalli S, Small DS, Morris A, Feingold J, Ha YP, et al. Loss-framed financial incentives and personalized goal-setting to increase physical activity among ischemic heart disease patients using wearable devices: the ACTIVE REWARD randomized trial. JAHA 2018 Jun 19;7(12):136 [FREE Full text] [doi: 10.1161/jaha.118.009173]",
    "[raw_reference] Coultas DB, Jackson BE, Russo R, Peoples J, Sloan J, Singh KP, et al. A lifestyle physical activity intervention for patients with chronic obstructive pulmonary disease. A randomized controlled trial. Annals ATS 2016 May;13(5):617-626 [doi: 10.1513/annalsats.201508-508oc]",
    "[raw_reference] Deka P, Pozehl B, Williams MA, Norman JF, Khazanchi D, Pathak D. MOVE-HF: an internet-based pilot study to improve adherence to exercise in patients with heart failure. Eur J Cardiovasc Nurs 2019 Feb;18(2):122-131 [doi: 10.1177/1474515118796613] [Medline: 30129790]",
    "[raw_reference] Felker GM, Sharma A, Mentz RJ, She L, Green CL, Granger BB, et al. A randomized controlled trial of mobile health intervention in patients with heart failure and diabetes. J Card Fail 2022 Nov;28(11):1575-1583 [doi: 10.1016/j.cardfail.2022.07.048] [Medline: 35882260]",
    "FREE Full text",
    "[raw_reference] Glasgow RE, Kurz D, King D, Dickman JM, Faber AJ, Halterman E, et al. Twelve-month outcomes of an internet-based diabetes self-management support program. Patient Educ Couns 2012 Apr;87(1):81-92 [FREE Full text] [doi: 10.1016/j.pec.2011.07.024] [Medline: 21924576]",
    "FREE Full text",
    "[raw_reference] Jiwani R, Wang J, Berndt A, Ramaswamy P, Joseph NM, Du Y, et al. Changes in patient-reported outcome measures with a technology-supported behavioral lifestyle intervention among patients with type 2 diabetes: pilot randomized controlled clinical trial. JMIR Diabetes 2020 Jul 24;5(3):e19268 [FREE Full text] [doi: 10.2196/19268] [Medline: 32706652]",
    "FREE Full text",
    "[raw_reference] Moy ML, Collins RJ, Martinez CH, Kadri R, Roman P, Holleman RG, et al. An internet-mediated pedometer-based program improves health-related quality-of-life domains and daily step counts in COPD: a randomized controlled trial. Chest 2015 Jul;148(1):128-137 [FREE Full text] [doi: 10.1378/chest.14-1466] [Medline: 25811395]",
    "FREE Full text",
    "[raw_reference] Piette JD, Richardson C, Himle J, Duffy S, Torres T, Vogel M, et al. A randomized trial of telephonic counseling plus walking for depressed diabetes patients. Med Care 2011 Jul;49(7):641-648 [FREE Full text] [doi: 10.1097/MLR.0b013e318215d0c9] [Medline: 21478777]",
    "FREE Full text",
    "[raw_reference] Radhakrishnan K, Julien C, Baranowski T, O'Hair M, Lee G, De Main AS, et al. Feasibility of a sensor-controlled digital game for heart failure self-management: randomized controlled trial. JMIR Serious Games 2021 Nov 08;9(4):e29044 [FREE Full text] [doi: 10.2196/29044] [Medline: 34747701]",
    "FREE Full text",
    "[raw_reference] Robinson SA, Cooper JA, Goldstein RL, Polak M, Cruz Rivera PN, Gagnon DR, et al. A randomised trial of a web-based physical activity self-management intervention in COPD. ERJ Open Res 2021 Jul 15;7(3):00158-2021 [FREE Full text] [doi: 10.1183/23120541.00158-2021] [Medline: 34476247]",
    "[raw_reference] Southard BH, Southard DR, Nuckolls J. Clinical trial of an internet-based case management system for secondary prevention of heart disease. J Cardiopulm Rehabil 2003;23(5):341-348 [doi: 10.1097/00008483-200309000-00003] [Medline: 14512778]",
    "FREE Full text",
    "[raw_reference] Tomita MR, Tsai BM, Fisher NM, Kumar NA, Wilding G, Stanton K, et al. Effects of multidisciplinary Internet-based program on management of heart failure. J Multidiscip Healthc 2008 Dec 01;2009(2):13-21 [FREE Full text] [doi: 10.2147/jmdh.s4355] [Medline: 20505786]",
    "FREE Full text",
    "[raw_reference] Wan ES, Kantorowski A, Homsy D, Teylan M, Kadri R, Richardson CR, et al. Promoting physical activity in COPD: insights from a randomized trial of a web-based intervention and pedometer use. Respir Med 2017 Sep;130:102-110 [FREE Full text] [doi: 10.1016/j.rmed.2017.07.057] [Medline: 29206627]",
    "[raw_reference] Widmer RJ, Allison TG, Lennon R, Lopez-Jimenez F, Lerman LO, Lerman A. Digital health intervention during cardiac rehabilitation: a randomized controlled trial. Am Heart J 2017 Jun;188:65-72 [doi: 10.1016/j.ahj.2017.02.016] [Medline: 28577682]",
    "[raw_reference] Bennell KL, Nelligan R, Dobson F, Rini C, Keefe F, Kasza J, et al. Effectiveness of an internet-delivered exercise and pain-coping skills training intervention for persons with chronic knee pain: a randomized trial. Ann Intern Med 2017 Apr 04;166(7):453-462 [doi: 10.7326/M16-1714] [Medline: 28241215]",
    "[raw_reference] Bennell KL, Nelligan RK, Rini C, Keefe FJ, Kasza J, French S, et al. Effects of internet-based pain coping skills training before home exercise for individuals with hip osteoarthritis (HOPE trial): a randomised controlled trial. Pain 2018 Sep;159(9):1833-1842 [doi: 10.1097/j.pain.0000000000001281] [Medline: 29794609]",
    "FREE Full text",
    "[raw_reference] Bennell K, Nelligan RK, Schwartz S, Kasza J, Kimp A, Crofts SJ, et al. Behavior change text messages for home exercise adherence in knee osteoarthritis: randomized trial. J Med Internet Res 2020 Sep 28;22(9):e21749 [FREE Full text] [doi: 10.2196/21749] [Medline: 32985994]",
    "FREE Full text",
    "[raw_reference] Cameron-Tucker HL, Wood-Baker R, Joseph L, Walters JA, Sch\u00fcz N, Walters EH. A randomized controlled trial of telephone-mentoring with home-based walking preceding rehabilitation in COPD. Int J Chron Obstruct Pulmon Dis 2016;11:1991-2000 [FREE Full text] [doi: 10.2147/COPD.S109820] [Medline: 27601892]",
    "[raw_reference] Chow CK, Redfern J, Hillis GS, Thakkar J, Santo K, Hackett ML, et al. Effect of lifestyle-focused text messaging on risk factor modification in patients with coronary heart disease: a randomized clinical trial. JAMA 2015;314(12):1255-1263 [doi: 10.1001/jama.2015.10945] [Medline: 26393848]",
    "[raw_reference] Coombes JS, Keating SE, Mielke GI, Fassett RG, Coombes BK, O'Leary KP, et al. Personal activity intelligence e-health program in people with type 2 diabetes: a pilot randomized controlled trial. Med Sci Sports Exerc 2022 Jan 01;54(1):18-27 [doi: 10.1249/MSS.0000000000002768] [Medline: 34334715]",
    "[raw_reference] Cox NS, McDonald CF, Mahal A, Alison JA, Wootton R, Hill CJ, et al. Telerehabilitation for chronic respiratory disease: a randomised controlled equivalence trial. Thorax 2022 Jul;77(7):643-651 [doi: 10.1136/thoraxjnl-2021-216934] [Medline: 34650004]",
    "[raw_reference] Eakin E, Reeves M, Lawler S, Graves N, Oldenburg B, Del Mar C, et al. Telephone counseling for physical activity and diet in primary care patients. Am J Prev Med 2009 Feb;36(2):142-149 [doi: 10.1016/j.amepre.2008.09.042] [Medline: 19062240]",
    "FREE Full text",
    "[raw_reference] Eakin EG, Winkler EA, Dunstan DW, Healy GN, Owen N, Marshall AM, et al. Living well with diabetes: 24-month outcomes from a randomized trial of telephone-delivered weight loss and physical activity intervention to improve glycemic control. Diabetes Care 2014 Aug;37(8):2177-2185 [FREE Full text] [doi: 10.2337/dc13-2427] [Medline: 24658390]",
    "[raw_reference] Hawkes AL, Patrao TA, Atherton J, Ware RS, Taylor CB, O'Neil A, et al. Effect of a telephone-delivered coronary heart disease secondary prevention program (proactive heart) on quality of life and health behaviours: primary outcomes of a randomised controlled trial. Int J Behav Med 2013 Sep;20(3):413-424 [doi: 10.1007/s12529-012-9250-5] [Medline: 23012159]",
    "[raw_reference] Hinman RS, Campbell PK, Lawford BJ, Briggs AM, Gale J, Bills C, et al. Does telephone-delivered exercise advice and support by physiotherapists improve pain and/or function in people with knee osteoarthritis? Telecare randomised controlled trial. Br J Sports Med 2020 Jul;54(13):790-797 [doi: 10.1136/bjsports-2019-101183] [Medline: 31748198]",
    "FREE Full text",
    "[raw_reference] Indraratna P, Biswas U, McVeigh J, Mamo A, Magdy J, Vickers D, et al. A smartphone-based model of care to support patients with cardiac disease transitioning from hospital to the community (TeleClinical Care): pilot randomized controlled trial. JMIR Mhealth Uhealth 2022 Feb 28;10(2):e32554 [FREE Full text] [doi: 10.2196/32554] [Medline: 35225819]",
    "[raw_reference] Jennings CA, Vandelanotte C, Caperchione CM, Mummery WK. Effectiveness of a web-based physical activity intervention for adults with Type 2 diabetes-a randomised controlled trial. Prev Med 2014 Mar;60:33-40 [doi: 10.1016/j.ypmed.2013.12.011] [Medline: 24345601]",
    "FREE Full text",
    "[raw_reference] Nelligan RK, Hinman RS, Kasza J, Crofts SJ, Bennell KL. Effects of a self-directed web-based strengthening exercise and physical activity program supported by automated text messages for people with knee osteoarthritis: a randomized clinical trial. JAMA Intern Med 2021 Jun 01;181(6):776-785 [FREE Full text] [doi: 10.1001/jamainternmed.2021.0991] [Medline: 33843948]",
    "FREE Full text",
    "[raw_reference] O'Brien KM, Wiggers J, Williams A, Campbell E, Hodder RK, Wolfenden L, et al. Telephone-based weight loss support for patients with knee osteoarthritis: a pragmatic randomised controlled trial. Osteoarthritis Cartilage 2018 Apr;26(4):485-494 [FREE Full text] [doi: 10.1016/j.joca.2018.01.003]",
    "FREE Full text",
    "[raw_reference] Tsai LL, McNamara RJ, Moddel C, Alison JA, McKenzie DK, McKeough ZJ. Home-based telerehabilitation via real-time videoconferencing improves endurance exercise capacity in patients with COPD: the randomized controlled TeleR Study. Respirology 2017 May 19;22(4):699-707 [FREE Full text] [doi: 10.1111/resp.12966] [Medline: 27992099]",
    "[raw_reference] Varney JE, Weiland TJ, Inder WJ, Jelinek GA. Effect of hospital-based telephone coaching on glycaemic control and adherence to management guidelines in type 2 diabetes, a randomised controlled trial. Intern Med J 2014 Sep 08;44(9):890-897 [doi: 10.1111/imj.12515] [Medline: 24963611]",
    "[raw_reference] Waller K, Furber S, Bauman A, Allman-Farinelli M, van den Dolder P, Hayes A, et al. Effectiveness and acceptability of a text message intervention (DTEXT) on HbA1c and self-management for people with type 2 diabetes. A randomized controlled trial. Patient Educ Couns 2021 Jul;104(7):1736-1744 [doi: 10.1016/j.pec.2020.11.038] [Medline: 33334634]",
    "[raw_reference] Wootton SL, Hill K, Alison JA, Ng LW, Jenkins S, Eastwood PR, et al. Effects of ongoing feedback during a 12-month maintenance walking program on daily physical activity in people with COPD. Lung 2019 Jun 15;197(3):315-319 [doi: 10.1007/s00408-019-00216-5] [Medline: 30982940]",
    "[raw_reference] Young MD, Drew RJ, Kay-Lambkin F, Collins CE, Callister R, Kelly BJ, et al. Impact of a self-guided, eHealth program targeting weight loss and depression in men: a randomized trial. J Consult Clin Psychol 2021 Aug;89(8):682-694 [doi: 10.1037/ccp0000671] [Medline: 34472895]",
    "[raw_reference] Yudi MB, Clark DJ, Tsang D, Jelinek M, Kalten K, Joshi SB, et al. SMARTphone-based, early cardiac REHABilitation in patients with acute coronary syndromes: a randomized controlled trial. Coron Artery Dis 2021 Aug 01;32(5):432-440 [doi: 10.1097/MCA.0000000000000938] [Medline: 32868661]",
    "[raw_reference] Akinci B, Yeldan I, Satman I, Dirican A, Ozdincler AR. The effects of Internet-based exercise compared with supervised group exercise in people with type 2 diabetes: a randomized controlled study. Clin Rehabil 2018 Jun;32(6):799-810 [doi: 10.1177/0269215518757052] [Medline: 29417832]",
    "FREE Full text",
    "[raw_reference] Avila A, Claes J, Goetschalckx K, Buys R, Azzawi M, Vanhees L, et al. Home-based rehabilitation with telemonitoring guidance for patients with coronary artery disease (Short-Term Results of the TRiCH Study): randomized controlled trial. J Med Internet Res 2018 Jun 22;20(6):e225 [FREE Full text] [doi: 10.2196/jmir.9943] [Medline: 29934286]",
    "FREE Full text",
    "[raw_reference] Bailey DP, Mugridge LH, Dong F, Zhang X, Chater AM. Randomised controlled feasibility study of the MyHealthAvatar-diabetes smartphone app for reducing prolonged sitting time in type 2 diabetes mellitus. Int J Environ Res Public Health 2020 Jun 19;17(12):4414 [FREE Full text] [doi: 10.3390/ijerph17124414] [Medline: 32575482] 100",
    "FREE Full text",
    "[raw_reference] Bossen D, Veenhof C, Van Beek KE, Spreeuwenberg PM, Dekker J, De Bakker DH. Effectiveness of a web-based physical activity intervention in patients with knee and/or hip osteoarthritis: randomized controlled trial. J Med Internet Res 2013 Nov 22;15(11):e257 [FREE Full text] [doi: 10.2196/jmir.2662] [Medline: 24269911] 101",
    "FREE Full text",
    "[raw_reference] Bozorgi A, Hosseini H, Eftekhar H, Majdzadeh R, Yoonessi A, Ramezankhani A, et al. The effect of the mobile \"blood pressure management application\" on hypertension self-management enhancement: a randomized controlled trial. Trials 2021 Jun 24;22(1):413 [FREE Full text] [doi: 10.1186/s13063-021-05270-0] [Medline: 34167566] 102",
    "FREE Full text",
    "[raw_reference] Chan NP, Lai AY, Choy HK, Cheung DY, Wan AN, Cheng VY, et al. Feasibility and potential effectiveness of a smartphone zero-time exercise intervention for promoting physical activity and fitness in patients with coronary heart disease: a pilot randomized controlled trial. Front Public Health 2022 Jul 14;10:865712 [FREE Full text] [doi: 10.3389/fpubh.2022.865712] [Medline: 35910893] 103",
    "[raw_reference] Cicolini G, Simonetti V, Comparcini D, Celiberti I, Di Nicola M, Capasso LM, et al. Efficacy of a nurse-led email reminder program for cardiovascular prevention risk reduction in hypertensive patients: a randomized controlled trial. Int J Nurs Stud 2014 Jun;51(6):833-843 [doi: 10.1016/j.ijnurstu.2013.10.010] [Medline: 24225325] 104",
    "FREE Full text",
    "[raw_reference] Connelly J, Kirk A, Masthoff J, MacRury S. A website to promote physical activity in people with type 2 diabetes living in remote or rural locations: feasibility pilot randomized controlled trial. JMIR Diabetes 2017 Oct 19;2(2):e26 [FREE Full text] [doi: 10.2196/diabetes.6669] [Medline: 30291091] 105",
    "[raw_reference] de Sousa Pinto JM, Mart\u00edn-Nogueras AM, Calvo-Arenillas JI, Ramos-Gonz\u00e1lez J. Clinical benefits of home-based pulmonary rehabilitation in patients with chronic obstructive pulmonary disease. J Cardiopulm Rehabil Prev 2014;34(5):355-359 [doi: 10.1097/HCR.0000000000000061] [Medline: 24866357] 106",
    "FREE Full text",
    "[raw_reference] Duan YP, Liang W, Guo L, Wienert J, Si GY, Lippke S. Evaluation of a web-based intervention for multiple health behavior changes in patients with coronary heart disease in home-based rehabilitation: pilot randomized controlled trial. J Med Internet Res 2018 Nov 19;20(11):e12052 [FREE Full text] [doi: 10.2196/12052] [Medline: 30455167] 107",
    "[raw_reference] Dyson PA, Beatty S, Matthews DR. An assessment of lifestyle video education for people newly diagnosed with type 2 diabetes. J Hum Nutr Diet 2010 Aug;23(4):353-359 [doi: 10.1111/j.1365-277X.2010.01077.x] [Medline: 20497292] 108",
    "[raw_reference] Galdiz JB, G\u00f3mez A, Rodriguez D, Guell R, Cebollero P, Hueto J, et al. Telerehabilitation programme as a maintenance strategy for copd patients: a 12-month randomized clinical trial. Arch Bronconeumol (Engl Ed) 2021 Mar;57(3):195-204 [doi: 10.1016/j.arbres.2020.03.034] [Medline: 32439253] 109",
    "FREE Full text",
    "[raw_reference] Gingele AJ, Ramaekers B, Brunner-La Rocca HP, De Weerd G, Kragten J, van Empel V, et al. Effects of tailored telemonitoring on functional status and health-related quality of life in patients with heart failure. Neth Heart J 2019 Nov 14;27(11):565-574 [FREE Full text] [doi: 10.1007/s12471-019-01323-x] [Medline: 31414308] 110",
    "FREE Full text",
    "[raw_reference] Gohir SA, Eek F, Kelly A, Abhishek A, Valdes AM. Effectiveness of internet-based exercises aimed at treating knee osteoarthritis: the iBEAT-OA randomized clinical trial. JAMA Netw Open 2021 Feb 01;4(2):e210012 [FREE Full text] [doi: 10.1001/jamanetworkopen.2021.0012] [Medline: 33620447] 111",
    "[raw_reference] Guiraud T, Granger R, Gremeaux V, Bousquet M, Richard L, Soukari\u00e9 L, et al. Telephone support oriented by accelerometric measurements enhances adherence to physical activity recommendations in noncompliant patients after a cardiac rehabilitation program. Arch Phys Med Rehabil 2012 Dec;93(12):2141-2147 [doi: 10.1016/j.apmr.2012.06.027] [Medline: 22813832] 112",
    "[raw_reference] Lee H, Park G, Jin H, Chun KJ, Kim JH. The effects of nurse-led motivational interviewing on exercise and quality of life among koreans with heart failure: a randomized controlled trial. Korean J Adult Nurs 2021;33(6):588 [doi: 10.7475/kjan.2021.33.6.588] 113",
    "[raw_reference] Hanssen TA, Nordrehaug JE, Eide GE, Hanestad BR. Improving outcomes after myocardial infarction: a randomized controlled trial evaluating effects of a telephone follow-up intervention. Eur J Cardiovasc Prev Rehabil 2007 Jun;14(3):429-437 [doi: 10.1097/HJR.0b013e32801da123] [Medline: 17568244] 114",
    "FREE Full text",
    "[raw_reference] Hidrus A, Kueh YC, Norsa\u00e1dah B, Chang YK, Hung TM, Naing NN, et al. Effects of brain breaks videos on the motives for the physical activity of Malaysians with type-2 diabetes mellitus. Int J Environ Res Public Health 2020 Apr 06;17(7):2507 [FREE Full text] [doi: 10.3390/ijerph17072507] [Medline: 32268601] 115",
    "FREE Full text",
    "[raw_reference] H\u00f6chsmann C, M\u00fcller O, Amb\u00fchl M, Klenk C, K\u00f6nigstein K, Infanger D, et al. Novel smartphone game improves physical activity behavior in type 2 diabetes. Am J Prev Med 2019 Jul;57(1):41-50 [FREE Full text] [doi: 10.1016/j.amepre.2019.02.017] [Medline: 31128953] 116",
    "FREE Full text",
    "[raw_reference] Holmen H, Torbj\u00f8rnsen A, Wahl AK, Jenum AK, Sm\u00e5stuen MC, Arsand E, et al. A mobile health intervention for self-management and lifestyle change for persons with type 2 diabetes, part 2: one-year results from the Norwegian randomized controlled trial RENEWING HEALTH. JMIR Mhealth Uhealth 2014 Dec 11;2(4):e57 [FREE Full text] [doi: 10.2196/mhealth.3882] [Medline: 25499872] 117",
    "FREE Full text",
    "[raw_reference] Hornikx M, Demeyer H, Camillo CA, Janssens W, Troosters T. The effects of a physical activity counseling program after an exacerbation in patients with Chronic Obstructive Pulmonary Disease: a randomized controlled pilot study. BMC Pulm Med 2015 Nov 04;15(1):136 [FREE Full text] [doi: 10.1186/s12890-015-0126-8] [Medline: 26530543] 118",
    "FREE Full text",
    "[raw_reference] Hsu YI, Chen YC, Lee CL, Chang NJ. Effects of diet control and telemedicine-based resistance exercise intervention on patients with obesity and knee osteoarthritis: a randomized control trial. Int J Environ Res Public Health 2021 Jul 21;18(15):7744 [FREE Full text] [doi: 10.3390/ijerph18157744] [Medline: 34360036] 119",
    "FREE Full text",
    "[raw_reference] Jayasree B, Stalin P. Efficacy of behavior change communication using mobile calls on glycemic control among Type 2 diabetic patients in an urban area of Pondicherry, South India: a randomized controlled trial. J Educ Health Promot 2019;8:92 [FREE Full text] [doi: 10.4103/jehp.jehp_247_18] [Medline: 31143809] 120",
    "FREE Full text",
    "[raw_reference] Jim\u00e9nez-Reguera B, L\u00f3pez EM, Fitch S, Juarros L, Cort\u00e9s MS, Rodr\u00edguez Hermosa JL, et al. Development and preliminary evaluation of the effects of an mHealth web-based platform (HappyAir) on adherence to a maintenance program after pulmonary rehabilitation in patients with chronic obstructive pulmonary disease: randomized controlled trial. JMIR Mhealth Uhealth 2020 Jul 31;8(7):e18465 [FREE Full text] [doi: 10.2196/18465] [Medline: 32513646] 121",
    "FREE Full text",
    "[raw_reference] Jaarsma T, Klompstra L, Gal TB, Avraham BB, Boyne J, B\u00e4ck M, et al. Effects of exergaming on exercise capacity in patients with heart failure: results of an international multicentre randomized controlled trial. Eur J Heart Fail 2021 Jan 13;23(1):114-124 [FREE Full text] [doi: 10.1002/ejhf.1754] [Medline: 32167657] 122",
    "[raw_reference] Kim CJ, Kang DH. Utility of a Web-based intervention for individuals with type 2 diabetes: the impact on physical activity levels and glycemic control. Comput Inform Nurs 2006;24(6):337-345 [doi: 10.1097/00024665-200611000-00008] [Medline: 17108753] 123",
    "[raw_reference] Kooiman TJ, de Groot M, Hoogenberg K, Krijnen WP, van der Schans CP, Kooy A. Self-tracking of physical activity in people with type 2 diabetes: a randomized controlled trial. Comput Inform Nurs 2018 Jul;36(7):340-349 [doi: 10.1097/CIN.0000000000000443] [Medline: 29742550] 124",
    "FREE Full text",
    "[raw_reference] Kwon H, Lee S, Jung EJ, Kim SH, Lee J, Kim DK, et al. An mHealth management platform for patients with chronic obstructive pulmonary disease (efil breath): randomized controlled trial. JMIR Mhealth Uhealth 2018 Aug 24;6(8):e10502 [FREE Full text] [doi: 10.2196/10502] [Medline: 30143475] 125",
    "FREE Full text",
    "[raw_reference] Lambert JD, Greaves CJ, Farrand P, Price L, Haase AM, Taylor AH. Web-based intervention using behavioral activation and physical activity for adults with depression (The eMotion Study): pilot randomized controlled trial. J Med Internet Res 2018 Jul 16;20(7):e10112 [FREE Full text] [doi: 10.2196/10112] [Medline: 30012547] 126",
    "FREE Full text",
    "[raw_reference] Li J, Wei D, Liu S, Li M, Chen X, Chen L, et al. Efficiency of an mHealth app and chest-wearable remote exercise monitoring intervention in patients with type 2 diabetes: a prospective, multicenter randomized controlled trial. JMIR Mhealth Uhealth 2021 Feb 09;9(2):e23338 [FREE Full text] [doi: 10.2196/23338] [Medline: 33560244] 127",
    "FREE Full text",
    "[raw_reference] Liebreich T, Plotnikoff RC, Courneya KS, Boul\u00e9 N. Diabetes NetPLAY: a physical activity website and linked email counselling randomized intervention for individuals with type 2 diabetes. Int J Behav Nutr Phys Act 2009 Mar 27;6:18 [FREE Full text] [doi: 10.1186/1479-5868-6-18] [Medline: 19327141] 128",
    "[raw_reference] Pamungkas RA, Usman AM, Chamroonsawasdi K, Abdurrasyid. A smartphone application of diabetes coaching intervention to prevent the onset of complications and to improve diabetes self-management: a randomized control trial. Diabetes Metab Syndr 2022 Jul;16(7):102537 [doi: 10.1016/j.dsx.2022.102537] [Medline: 35724489] 129",
    "FREE Full text",
    "[raw_reference] Pelle T, Bevers K, van der Palen J, van den Hoogen FH, van den Ende CH. Effect of the dr. Bart application on healthcare use and clinical outcomes in people with osteoarthritis of the knee and/or hip in the Netherlands; a randomized controlled trial. Osteoarthritis Cartilage 2020 Apr;28(4):418-427 [FREE Full text] [doi: 10.1016/j.joca.2020.02.831] [Medline: 32119972] 130",
    "[raw_reference] Plotnikoff RC, Karunamuni N, Courneya KS, Sigal RJ, Johnson JA, Johnson ST. The Alberta Diabetes and Physical Activity Trial (ADAPT): a randomized trial evaluating theory-based interventions to increase physical activity in adults with type 2 diabetes. Ann Behav Med 2013 Feb;45(1):45-56 [doi: 10.1007/s12160-012-9405-2] [Medline: 22922954] 131",
    "FREE Full text",
    "[raw_reference] Poppe L, De Bourdeaudhuij I, Verloigne M, Shadid S, Van Cauwenberg J, Compernolle S, et al. Efficacy of a self-regulation-based electronic and mobile health intervention targeting an active lifestyle in adults having type 2 diabetes and in adults aged 50 years or older: two randomized controlled trials. J Med Internet Res 2019 Aug 02;21(8):e13363 [FREE Full text] [doi: 10.2196/13363] [Medline: 31376274] 132",
    "[raw_reference] Reid RD, Morrin LI, Beaton LJ, Papadakis S, Kocourek J, McDonnell L, et al. Randomized trial of an internet-based computer-tailored expert system for physical activity in patients with heart disease. Eur J Prev Cardiol 2012 Dec;19(6):1357-1364 [doi: 10.1177/1741826711422988] [Medline: 21903744] 133",
    "FREE Full text",
    "[raw_reference] Shi YJ, Liu Y, Jiang TT, Zhang HR, Shi TY. Effects of multidisciplinary exercise management on patients after percutaneous coronary intervention: a randomized controlled study. Int J Nurs Sci 2022 Jul;9(3):286-294 [FREE Full text] [doi: 10.1016/j.ijnss.2022.06.012] [Medline: 35891912] 134",
    "[raw_reference] Snoek JA, Meindersma EP, Prins LF, van't Hof AW, de Boer MJ, Hopman MT, et al. The sustained effects of extending cardiac rehabilitation with a six-month telemonitoring and telecoaching programme on fitness, quality of life, cardiovascular risk factors and care utilisation in CAD patients: the TeleCaRe study. J Telemed Telecare 2019 Nov 23;27(8):473-483 [doi: 10.1177/1357633x19885793] 135",
    "FREE Full text",
    "[raw_reference] Snoek JA, Prescott EI, van der Velde AE, Eijsvogels TM, Mikkelsen N, Prins LF, et al. Effectiveness of home-based mobile guided cardiac rehabilitation as alternative strategy for nonparticipation in clinic-based cardiac rehabilitation among elderly patients in Europe: a randomized clinical trial. JAMA Cardiol 2021 Apr 01;6(4):463-468 [FREE Full text] [doi: 10.1001/jamacardio.2020.5218] [Medline: 33112363] 136",
    "FREE Full text",
    "[raw_reference] Spielmanns M, Gloeckl R, Jarosch I, Leitl D, Schneeberger T, Boeselt T, et al. Using a smartphone application maintains physical activity following pulmonary rehabilitation in patients with COPD: a randomised controlled trial. Thorax 2023 May;78(5):442-450 [FREE Full text] [doi: 10.1136/thoraxjnl-2021-218338] [Medline: 35450945] 137",
    "FREE Full text",
    "[raw_reference] Str\u00f6m M, Uckelstam CJ, Andersson G, Hassm\u00e9n P, Umefjord G, Carlbring P. Internet-delivered therapist-guided physical activity for mild to moderate depression: a randomized controlled trial. PeerJ 2013;1:e178 [FREE Full text] [doi: 10.7717/peerj.178] [Medline: 24109561] 138",
    "FREE Full text",
    "[raw_reference] Tore NG, Oskay D, Haznedaroglu S. The quality of physiotherapy and rehabilitation program and the effect of telerehabilitation on patients with knee osteoarthritis. Clin Rheumatol 2023 Mar 24;42(3):903-915 [FREE Full text] [doi: 10.1007/s10067-022-06417-3] [Medline: 36279075] 139",
    "[raw_reference] Utriyaprasit K, Moore SM, Chaiseri P. Recovery after coronary artery bypass surgery: effect of an audiotape information programme. J Adv Nurs 2010 Aug;66(8):1747-1759 [doi: 10.1111/j.1365-2648.2010.05334.x] [Medline: 20557390] 140",
    "[raw_reference] Vinitha R, Nanditha A, Snehalatha C, Satheesh K, Susairaj P, Raghavan A, et al. Effectiveness of mobile phone text messaging in improving glycaemic control among persons with newly detected type 2 diabetes. Diabetes Res Clin Pract 2019 Dec;158:107919 [doi: 10.1016/j.diabres.2019.107919] [Medline: 31711858] 141",
    "[raw_reference] Wang L, Guo Y, Wang M, Zhao Y. A mobile health application to support self-management in patients with chronic obstructive pulmonary disease: a randomised controlled trial. Clin Rehabil 2021 Jan;35(1):90-101 [doi: 10.1177/0269215520946931] [Medline: 32907384] 142",
    "[raw_reference] Wong EM, Leung DY, Chair S, Sit JW. Effects of a web-based educational support intervention on total exercise and cardiovascular risk markers in adults with coronary heart disease. Worldviews Evid Based Nurs 2020 Aug 08;17(4):283-292 [doi: 10.1111/wvn.12456] [Medline: 32772509] 143",
    "[raw_reference] Drew RJ, Morgan PJ, Young MD. Mechanisms of an eHealth program targeting depression in men with overweight or obesity: a randomised trial. J Affect Disord 2022 Feb 15;299:309-317 [doi: 10.1016/j.jad.2021.12.001] [Medline: 34871640] 144",
    "[raw_reference] Drew RJ, Morgan PJ, Collins CE, Callister R, Kay-Lambkin F, Kelly BJ, et al. Behavioral and cognitive outcomes an online weight loss program for men with low mood: a randomized controlled trial. Ann Behav Med 2022 Oct 03;56(10):1026-1041 [doi: 10.1093/abm/kaab109] [Medline: 34964449] 145",
    "FREE Full text",
    "[raw_reference] Alghafri TS, Alharthi SM, Al-Farsi Y, Alrawahi AH, Bannerman E, Craigie AM, et al. 'MOVEdiabetes': a cluster randomized controlled trial to increase physical activity in adults with type 2 diabetes in primary health in Oman. BMJ Open Diabetes Res Care 2018;6(1):e000605 [FREE Full text] [doi: 10.1136/bmjdrc-2018-000605] [Medline: 30487976] 146",
    "[raw_reference] Alonso-Dom\u00ednguez R, Patino-Alonso MC, S\u00e1nchez-Aguadero N, Garc\u00eda-Ortiz L, Recio-Rodr\u00edguez JI, G\u00f3mez-Marcos MA. Effect of a multifactorial intervention on the increase in physical activity in subjects with type 2 diabetes mellitus: a randomized clinical trial (EMID Study). Eur J Cardiovasc Nurs 2019 Jun;18(5):399-409 [doi: 10.1177/1474515119835048] [Medline: 30808196] 147",
    "FREE Full text",
    "[raw_reference] Andrade GN, Umeda II, Fuchs AR, Mastrocola LE, Rossi-Neto JM, Moreira DA, et al. Home-based training program in patients with chronic heart failure and reduced ejection fraction: a randomized pilot study. Clinics (Sao Paulo) 2021;76:e2550 [FREE Full text] [doi: 10.6061/clinics/2021/e2550] [Medline: 34133657] 148",
    "FREE Full text",
    "[raw_reference] Bartholdy C, Bliddal H, Henriksen M. Effectiveness of text messages for decreasing inactive behaviour in patients with knee osteoarthritis: a pilot randomised controlled study. Pilot Feasibility Stud 2019;5:112 [FREE Full text] [doi: 10.1186/s40814-019-0494-6] [Medline: 31516729] 149",
    "FREE Full text",
    "[raw_reference] Bentley CL, Powell L, Potter S, Parker J, Mountain GA, Bartlett YK, et al. The use of a smartphone app and an activity tracker to promote physical activity in the management of chronic obstructive pulmonary disease: randomized controlled feasibility study. JMIR Mhealth Uhealth 2020 Jun 03;8(6):e16203 [FREE Full text] [doi: 10.2196/16203] [Medline: 32490838] 150",
    "Effect of a new tele-rehabilitation program versus standard rehabilitation in patients with chronic obstructive pulmonary disease J Clin Med FREE Full text",
    "[raw_reference] Chaplin E, Hewitt S, Apps L, Edwards K, Brough C, Glab A, et al. An interactive web-based pulmonary rehabilitation programme: a randomised controlled feasibility trial. Eur Respir J 2016;48:PA2064 [doi: 10.1183/13993003.congress-2016.PA2064] 153",
    "FREE Full text",
    "[raw_reference] Chaplin E, Barnes A, Newby C, Houchen-Wolloff L, Singh SJ. Comparison of the impact of conventional and web-based pulmonary rehabilitation on physical activity in patients with chronic obstructive pulmonary disease: exploratory feasibility study. JMIR Rehabil Assist Technol 2022 Mar 10;9(1):e28875 [FREE Full text] [doi: 10.2196/28875] [Medline: 35266871] 154",
    "FREE Full text",
    "[raw_reference] Clays E, Puddu PE, Lu\u0161trek M, Pioggia G, Derboven J, Vrana M, et al. Proof-of-concept trial results of the HeartMan mobile personal health system for self-management in congestive heart failure. Sci Rep 2021 Mar 11;11(1):5663 [FREE Full text] [doi: 10.1038/s41598-021-84920-4] [Medline: 33707523] 155",
    "[raw_reference] De Greef KP, Deforche BI, Ruige JB, Bouckaert JJ, Tudor-Locke CE, Kaufman JM, et al. The effects of a pedometer-based behavioral modification program with telephone support on physical activity and sedentary behavior in type 2 diabetes patients. Patient Educ Couns 2011 Aug;84(2):275-279 [doi: 10.1016/j.pec.2010.07.010] [Medline: 20732776] 156",
    "FREE Full text",
    "[raw_reference] Demeyer H, Louvaris Z, Frei A, Rabinovich RA, de Jong C, Gimeno-Santos E, Mr Papp PROactive study groupthe PROactive consortium. Physical activity is increased by a 12-week semiautomated telecoaching programme in patients with COPD: a multicentre randomised controlled trial. Thorax 2017 May;72(5):415-423 [FREE Full text] [doi: 10.1136/thoraxjnl-2016-209026] [Medline: 28137918] 157",
    "[raw_reference] D\u00f6bler A, Herbeck Belnap B, Pollmann H, Farin E, Raspe H, Mittag O. Telephone-delivered lifestyle support with action planning and motivational interviewing techniques to improve rehabilitation outcomes. Rehabil Psychol 2018 May;63(2):170-181 [doi: 10.1037/rep0000224] [Medline: 29878825] 158",
    "[raw_reference] Doiron-Cadrin P, Kairy D, Vendittoli PA, Lowry V, Poitras S, Desmeules F. Feasibility and preliminary effects of a tele-prehabilitation program and an in-person prehablitation program compared to usual care for total hip or knee arthroplasty candidates: a pilot randomized controlled trial. Disabil Rehabil 2020 Apr 13;42(7):989-998 [doi: 10.1080/09638288.2018.1515992] [Medline: 30638076] 159",
    "[raw_reference] Duruturk N, \u00d6zk\u00f6sl\u00fc MA. Effect of tele-rehabilitation on glucose control, exercise capacity, physical fitness, muscle strength and psychosocial status in patients with type 2 diabetes: a double blind randomized controlled trial. Primary Care Diabetes 2019 Dec;13(6):542-548 [doi: 10.1016/j.pcd.2019.03.007] [Medline: 31014938] 160",
    "FREE Full text",
    "[raw_reference] Frederix I, Hansen D, Coninx K, Vandervoort P, Vandijck D, Hens N, et al. Medium-term effectiveness of a comprehensive internet-based and patient-specific telerehabilitation program with text messaging support for cardiac patients: randomized controlled trial. J Med Internet Res 2015 Jul 23;17(7):e185 [FREE Full text] [doi: 10.2196/jmir.4799] [Medline: 26206311] 161",
    "[raw_reference] Furuya RK, Arantes EC, Dessotte CA, Ciol MA, Hoffman JM, Schmidt A, et al. A randomized controlled trial of an educational programme to improve self-care in Brazilian patients following percutaneous coronary intervention. J Adv Nurs 2015 Apr 17;71(4):895-908 [doi: 10.1111/jan.12568] [Medline: 25400127] 162",
    "FREE Full text",
    "[raw_reference] Haller N, Lorenz S, Pfirrmann D, Koch C, Lieb K, Dettweiler U, et al. Individualized web-based exercise for the treatment of depression: randomized controlled trial. JMIR Ment Health 2018 Oct 12;5(4):e10698 [FREE Full text] [doi: 10.2196/10698] [Medline: 30314962] 163",
    "[raw_reference] Horton EJ, Mitchell KE, Johnson-Warrington V, Apps LD, Sewell L, Morgan M, et al. Comparison of a structured home-based rehabilitation programme with conventional supervised pulmonary rehabilitation: a randomised non-inferiority trial. Thorax 2018 Jan 29;73(1):29-36 [doi: 10.1136/thoraxjnl-2016-208506] [Medline: 28756402] 164",
    "FREE Full text",
    "[raw_reference] Horton EJ, Ruksenaite J, Mitchell K, Sewell L, Newby C, Singh SJ. A comparison of physical activity between home-based and centre-based pulmonary rehabilitation: a randomised controlled secondary analysis. Front Rehabil Sci 2021;2:743441 [FREE Full text] [doi: 10.3389/fresc.2021.743441] [Medline: 36188808] 165",
    "FREE Full text",
    "[raw_reference] Lee DY, Park J, Choi D, Ahn HY, Park SW, Park CY. The effectiveness, reproducibility, and durability of tailored mobile coaching on diabetes management in policyholders: a randomized, controlled, open-label study. Sci Rep 2018 Feb 26;8(1):3642 [FREE Full text] [doi: 10.1038/s41598-018-22034-0] [Medline: 29483559] 166",
    "FREE Full text",
    "[raw_reference] Li LC, Feehan LM, Xie H, Lu N, Shaw CD, Gromala D, et al. Effects of a 12-week multifaceted wearable-based program for people with knee osteoarthritis: randomized controlled trial. JMIR Mhealth Uhealth 2020 Jul 03;8(7):e19116 [FREE Full text] [doi: 10.2196/19116] [Medline: 32618578] 167",
    "[raw_reference] Li Y, Qian H, Yu K, Huang Y. The long-term maintenance effect of remote pulmonary rehabilitation via social media in COPD: a randomized controlled trial. COPD 2022 May;Volume 17:1131-1142 [doi: 10.2147/copd.s360125] 168",
    "FREE Full text",
    "[raw_reference] Lim SL, Ong KW, Johal J, Han CY, Yap QV, Chan YH, et al. Effect of a smartphone app on weight change and metabolic outcomes in Asian adults with type 2 diabetes: a randomized clinical trial. JAMA Netw Open 2021 Jun 01;4(6):e2112417 [FREE Full text] [doi: 10.1001/jamanetworkopen.2021.12417] [Medline: 34081137] 169",
    "FREE Full text",
    "[raw_reference] \u00d6gmundsd\u00f3ttir Michelsen H, Sj\u00f6lin I, B\u00e4ck M, Garcia MG, Olsson A, Sandberg C, et al. Effect of a lifestyle-focused web-based application on risk factor management in patients who have had a myocardial infarction: randomized controlled trial. J Med Internet Res 2022 Mar 31;24(3):e25224 [FREE Full text] [doi: 10.2196/25224] [Medline: 35357316] 170",
    "FREE Full text",
    "[raw_reference] Moore J, Fiddler H, Seymour J, Grant A, Jolley C, Johnson L, et al. Effect of a home exercise video programme in patients with chronic obstructive pulmonary disease. J Rehabil Med 2009 Feb;41(3):195-200 [FREE Full text] [doi: 10.2340/16501977-0308] [Medline: 19229454] 171",
    "FREE Full text",
    "[raw_reference] Nagatomi Y, Ide T, Higuchi T, Nezu T, Fujino T, Tohyama T, et al. Home-based cardiac rehabilitation using information and communication technology for heart failure patients with frailty. ESC Heart Fail 2022 Aug;9(4):2407-2418 [FREE Full text] [doi: 10.1002/ehf2.13934] [Medline: 35534907] 172",
    "[raw_reference] Namjoo Nasab M, Ghavam A, Yazdanpanah A, Jahangir F, Shokrpour N. Effects of self-management education through telephone follow-up in diabetic patients. Health Care Manag 2017;36(3):273-281 [doi: 10.1097/hcm.0000000000000172] 173",
    "[raw_reference] Wienbergen H, Fach A, Meyer S, Meyer J, Stehmeier J, Backhaus T, et al. Effects of an intensive long-term prevention programme after myocardial infarction -a randomized trial. Eur J Prev Cardiol 2019 Mar 18;26(5):522-530 [doi: 10.1177/2047487318781109] [Medline: 29911893] 174",
    "[raw_reference] Osteresch R, Fach A, Frielitz FS, Meyer S, Schmucker J, R\u00fchle S, et al. Long-term effects of an intensive prevention program after acute myocardial infarction. Am J Cardiol 2021 Sep 01;154:7-13 [doi: 10.1016/j.amjcard.2021.05.034] [Medline: 34238446] 175",
    "FREE Full text",
    "[raw_reference] Peng X, Su Y, Hu Z, Sun X, Li X, Dolansky MA, et al. Home-based telehealth exercise training program in Chinese patients with heart failure: a randomized controlled trial. Medicine (Baltimore) 2018 Aug;97(35):e12069 [FREE Full text] [doi: 10.1097/MD.0000000000012069] [Medline: 30170422] 176",
    "[raw_reference] Piotrowicz E, Zieli\u0144ski T, Bodalski R, Rywik T, Dobraszkiewicz-Wasilewska B, Sobieszcza\u0144ska-Ma\u0142ek M, et al. Home-based telemonitored Nordic walking training is well accepted, safe, effective and has high adherence among heart failure patients, including those with cardiovascular implantable electronic devices: a randomised controlled study. Eur J Prev Cardiol 2015 Nov 26;22(11):1368-1377 [doi: 10.1177/2047487314551537] [Medline: 25261268] 177",
    "FREE Full text",
    "[raw_reference] Piotrowicz E, Piotrowski W, Piotrowicz R. Positive effects of the reversion of depression on the sympathovagal balance after telerehabilitation in heart failure patients. Ann Noninvasive Electrocardiol 2016 Jul 02;21(4):358-368 [FREE Full text] [doi: 10.1111/anec.12320] [Medline: 26524699] 178",
    "FREE Full text",
    "[raw_reference] Piotrowicz E, Pencina MJ, Opolski G, Zareba W, Banach M, Kowalik I, et al. Effects of a 9-week hybrid comprehensive telerehabilitation program on long-term outcomes in patients with heart failure: the telerehabilitation in heart failure patients (TELEREH-HF) randomized clinical trial. JAMA Cardiol 2020 Mar 01;5(3):300-308 [FREE Full text] [doi: 10.1001/jamacardio.2019.5006] [Medline: 31734701] 179",
    "FREE Full text",
    "[raw_reference] Pitta NC, Furuya RK, Freitas ND, Dessotte CA, Dantas RA, Ciol MA, et al. Effect of an educational program on physical activity in individuals undergoing their first percutaneous coronary intervention: a randomized clinical trial. Braz J Phys Ther 2022;26(5):100443 [FREE Full text] [doi: 10.1016/j.bjpt.2022.100443] [Medline: 36206592] 180",
    "FREE Full text",
    "[raw_reference] Reid RD, Wooding EA, Blanchard CM, Moghei M, Harris J, Proulx G, et al. A randomized controlled trial of an exercise maintenance intervention in men and women after cardiac rehabilitation (ECO-PCR Trial). Can J Cardiol 2021 May;37(5):794-802 [FREE Full text] [doi: [Medline: 33161148] 181",
    "[raw_reference] Kavradim ST, \u00d6zer ZC. The effect of education and telephone follow-up intervention based on the Roy Adaptation Model after myocardial infarction: randomised controlled trial. Scand J Caring Sci 2020 Mar;34(1):247-260 [doi: 10.1111/scs.12793] [Medline: 31769891] 182",
    "FREE Full text",
    "[raw_reference] van der Weegen S, Verwey R, Spreeuwenberg M, Tange H, van der Weijden T, de Witte L. It's LiFe! Mobile and web-based monitoring and feedback tool embedded in primary care increases physical activity: a cluster randomized controlled trial. J Med Internet Res 2015 Jul 24;17(7):e184 [FREE Full text] [doi: 10.2196/jmir.4579] [Medline: 26209025] 183",
    "FREE Full text",
    "[raw_reference] Vasilopoulou M, Papaioannou AI, Kaltsakas G, Louvaris Z, Chynkiamis N, Spetsioti S, et al. Home-based maintenance tele-rehabilitation reduces the risk for acute exacerbations of COPD, hospitalisations and emergency department visits. Eur Respir J 2017 May 25;49(5):1602129 [FREE Full text] [doi: 10.1183/13993003.02129-2016] [Medline: 28546268] 184",
    "FREE Full text",
    "[raw_reference] Vluggen S, Candel M, Hoving C, Schaper NC, de Vries H. A web-based computer-tailored program to improve treatment adherence in patients with type 2 diabetes: randomized controlled trial. J Med Internet Res 2021 Feb 23;23(2):e18524 [FREE Full text] [doi: 10.2196/18524] [Medline: 33620321] 185",
    "[raw_reference] Witham MD, Fulton RL, Greig CA, Johnston DW, Lang CC, van der Pol M, et al. Efficacy and cost of an exercise program for functionally impaired older patients with heart failure. Circ: Heart Failure 2012 Mar;5(2):209-216 [doi: 10.1161/circheartfailure.111.963132] 186",
    "FREE Full text",
    "[raw_reference] Wootton SL, McKeough Z, Ng CL, Jenkins S, Hill K, Eastwood PR, et al. Effect on health-related quality of life of ongoing feedback during a 12-month maintenance walking programme in patients with COPD: a randomized controlled trial. Respirology 2018 Jan 30;23(1):60-67 [FREE Full text] [doi: 10.1111/resp.13128] [Medline: 28758320] 187",
    "[raw_reference] Coombes J, Keating S, Mielke G, Fassett R, Cooes B, O?Leary K, et al. Personal activity intelligence e-health program in people with type 2 diabetes: a pilot randomized controlled trial. Med Sci Sports Exerc 2023;54(1):27 [doi: 10.1249/mss.0000000000002768] 188",
    "FREE Full text",
    "[raw_reference] Li LC, Sayre EC, Xie H, Falck RS, Best JR, Liu-Ambrose T, et al. Efficacy of a community-based technology-enabled physical activity counseling program for people with knee osteoarthritis: proof-of-concept study. J Med Internet Res 2018 Apr 30;20(4):e159 [FREE Full text] [doi: 10.2196/jmir.8514] [Medline: 29712630] 189",
    "[raw_reference] Avila A, Claes J, Buys R, Azzawi M, Vanhees L, Cornelissen V. Home-based exercise with telemonitoring guidance in patients with coronary artery disease: does it improve long-term physical fitness? Eur J Prev Cardiol 2020 Mar;27(4):367-377 [doi: 10.1177/2047487319892201] [Medline: 31787026] 190",
    "FREE Full text",
    "[raw_reference] Wan ES, Kantorowski A, Polak M, Kadri R, Richardson CR, Gagnon DR, et al. Long-term effects of web-based pedometer-mediated intervention on COPD exacerbations. Respir Med 2020 Feb;162:105878 [FREE Full text] [doi: 10.1016/j.rmed.2020.105878] [Medline: 32056676] 191",
    "FREE Full text",
    "[raw_reference] Moy ML, Martinez CH, Kadri R, Roman P, Holleman RG, Kim HM, et al. Long-term effects of an internet-mediated pedometer-based walking program for chronic obstructive pulmonary disease: randomized controlled trial. J Med Internet Res 2016 Aug 08;18(8):e215 [FREE Full text] [doi: 10.2196/jmir.5622] [Medline: 27502583] 192. EndNote",
    "Covidence systematic review software",
    "[raw_reference] Clarivate. 2013. URL: https://support.clarivate.com/Endnote/s/article/EndNote-20-Updates?language=en_US [accessed 2020-06-01] 193. Covidence systematic review software. Veritas Health Innovation. URL: https://www.covidence.org/ [accessed 2020-06-01] 194.",
    "[raw_reference] Rohatgi A. WebPlotDigitizer. Automeris. URL: https://apps.automeris.io/wpd/ [accessed 2020-08-01] 195",
    "Presented at: EBR '20 Stata statistical software: release 17",
    "[raw_reference] Eakin E, Reeves M, Winkler E, Lawler S, Owen N. Maintenance of physical activity and dietary change following a telephone-delivered intervention. Health Psychol 2010 Nov;29(6):566-573 [doi: 10.1037/a0021359] [Medline: 20954778] 198",
    "[raw_reference] Wong V, Ho F, Shi NK, Tong J, Chung KF, Yeung WF, et al. Smartphone-delivered multicomponent lifestyle medicine intervention for depressive symptoms: a randomized controlled trial. J Consult Clin Psychol 2021 Dec;89(12):970-984 [doi: 10.1037/ccp0000695] [Medline: 35025538] 199",
    "FREE Full text",
    "[raw_reference] Stavric V, Kayes NM, Rashid U, Saywell NL. The effectiveness of self-guided digital interventions to improve physical activity and exercise outcomes for people with chronic conditions: a systematic review and meta-analysis. Front Rehabil Sci 2022;3:925620 [FREE Full text] [doi: 10.3389/fresc.2022.925620] [Medline: 36188933] 201",
    "FREE Full text",
    "[raw_reference] Larsen RT, Wagner V, Korfitsen CB, Keller C, Juhl CB, Langberg H, et al. Effectiveness of physical activity monitors in adults: systematic review and meta-analysis. BMJ 2022 Jan 26;376:e068047 [FREE Full text] [doi: [Medline: 35082116] 202",
    "FREE Full text",
    "[raw_reference] Hall KS, Hyde ET, Bassett DR, Carlson SA, Carnethon MR, Ekelund U, et al. Systematic review of the prospective association of daily step counts with risk of mortality, cardiovascular disease, and dysglycemia. Int J Behav Nutr Phys Act 2020 Jun 20;17(1):78 [FREE Full text] [doi: 10.1186/s12966-020-00978-9] [Medline: 32563261] 203",
    "[raw_reference] Bull FC, Al-Ansari SS, Biddle S, Borodulin K, Buman MP, Cardon G, et al. World Health Organization 2020 guidelines on physical activity and sedentary behaviour. Br J Sports Med 2020 Nov 25;54(24):1451-1462 [doi: 10.1136/bjsports-2020-102955] 204",
    "[raw_reference] Bohannon RW, Crouch R. Minimal clinically important difference for change in 6-minute walk test distance of adults with pathology: a systematic review. J Eval Clin Pract 2017 Apr;23(2):377-381 [doi: 10.1111/jep.12629] [Medline: 27592691] 205",
    "FREE Full text",
    "[raw_reference] Silfee VJ, Haughton CF, Jake-Schoffman DE, Lopez-Cepero A, May CN, Sreedhara M, et al. Objective measurement of physical activity outcomes in lifestyle interventions among adults: a systematic review. Prev Med Rep 2018 Sep;11:74-80 [FREE Full text] [doi: 10.1016/j.pmedr.2018.05.003] [Medline: 29984142] 206",
    "FREE Full text",
    "[raw_reference] Shah A, Hussain-Shamsy N, Strudwick G, Sockalingam S, Nolan RP, Seto E. Digital health interventions for depression and anxiety among people with chronic conditions: scoping review. J Med Internet Res 2022 Sep 26;24(9):e38030 [FREE Full text] [doi: 10.2196/38030] [Medline: 36155409] 207",
    "FREE Full text",
    "[raw_reference] Brown DS, Thompson WW, Zack MM, Arnold SE, Barile JP. Associations between health-related quality of life and mortality in older adults. Prev Sci 2015 Jan;16(1):21-30 [FREE Full text] [doi: 10.1007/s11121-013-0437-z] [Medline: 24189743] 208",
    "FREE Full text",
    "[raw_reference] Megari K. Quality of life in chronic disease patients. Health Psychol Res 2013 Sep 24;1(3):e27 [FREE Full text] [doi: 10.4081/hpr.2013.e27] [Medline: 26973912] 209",
    "FREE Full text",
    "[raw_reference] Phyo AZ, Freak-Poli R, Craig H, Gasevic D, Stocks NP, Gonzalez-Chica DA, et al. Quality of life and mortality in the general population: a systematic review and meta-analysis. BMC Public Health 2020 Nov 06;20(1):1596 [FREE Full text] [doi: 10.1186/s12889-020-09639-9] [Medline: 33153441] 210",
    "[raw_reference] Dias JF, Oliveira VC, Borges PR, Dutra FC, Mancini MC, Kirkwood RN, et al. Effectiveness of exercises by telerehabilitation on pain, physical function and quality of life in people with physical disabilities: a systematic review of randomised controlled trials with GRADE recommendations. Br J Sports Med 2021 Feb;55(3):155-162 [doi: 10.1136/bjsports-2019-101375] [Medline: 33060156] 211",
    "[raw_reference] Niemeijer A, Lund H, Stafne SN, Ipsen T, Goldschmidt CL, J\u00f8rgensen CT, et al. Adverse events of exercise therapy in randomised controlled trials: a systematic review and meta-analysis. Br J Sports Med 2020 Sep 28;54(18):1073-1080 [doi: 10.1136/bjsports-2018-100461] [Medline: 31563884] 212",
    "[raw_reference] Anzueto A, Miravitlles M. Chronic obstructive pulmonary disease exacerbations: a need for action. Am J Med 2018 Sep;131(9S):15-22 [doi: 10.1016/j.amjmed.2018.05.003] [Medline: 29777660] 213",
    "FREE Full text",
    "[raw_reference] Ziaeian B, Fonarow GC. The prevention of hospital readmissions in heart failure. Prog Cardiovasc Dis 2016 Jan;58(4):379-385 [FREE Full text] [doi: 10.1016/j.pcad.2015.09.004] [Medline: 26432556] 214",
    "FREE Full text",
    "[raw_reference] Clarkson P, Stephenson A, Grimmett C, Cook K, Clark C, Muckelt PE, et al. Digital tools to support the maintenance of physical activity in people with long-term conditions: a scoping review. Digit Health 2022;8:20552076221089778 [FREE Full text] [doi: 10.1177/20552076221089778] [Medline: 35433017] 215",
    "FREE Full text",
    "[raw_reference] Manning SE, Wang H, Dwibedi N, Shen C, Wiener RC, Findley PA, et al. Association of multimorbidity with the use of health information technology. Digit Health 2023;9:20552076231163797 [FREE Full text] [doi: 10.1177/20552076231163797] [Medline: 37124332] 216",
    "FREE Full text",
    "[raw_reference] Kelly P, Fitzsimons C, Baker G. Should we reframe how we think about physical activity and sedentary behaviour measurement? Validity and reliability reconsidered. Int J Behav Nutr Phys Act 2016 Mar 01;13:32 [FREE Full text] [doi: 10.1186/s12966-016-0351-4] [Medline: 26931142] 217",
    "FREE Full text",
    "[raw_reference] Nielsen P, Sahay S. A critical review of the role of technology and context in digital health research. Digit Health 2022 Jun 22;8:20552076221109554 [FREE Full text] [doi: 10.1177/20552076221109554] [Medline: 35769359] 218",
    "FREE Full text",
    "[raw_reference] Eysenbach G, CONSORT-EHEALTH Group. CONSORT-EHEALTH: improving and standardizing evaluation reports of Web-based and mobile health interventions. J Med Internet Res 2011 Dec 31;13(4):e126 [FREE Full text] [doi: 10.2196/jmir.1923] [Medline: 22209829] 219",
    "[raw_reference] Agarwal S, LeFevre AE, Lee J, L'Engle K, Mehl G, Sinha C, WHO mHealth Technical Evidence Review Group. Guidelines for reporting of health interventions using mobile phones: mobile health (mHealth) evidence reporting and assessment (mERA) checklist. BMJ 2016 Mar 17;352:i1174 [doi: 10.1136/bmj.i1174] [Medline: 26988021] 220",
    "FREE Full text",
    "[raw_reference] Franck CP, Babington-Ashaye A, Dietrich D, Bediang G, Veltsos P, Gupta PP, et al. iCHECK-DH: guidelines and checklist for the reporting on digital health implementations. J Med Internet Res 2023 May 10;25:e46694 [FREE Full text] [doi: 10.2196/46694] [Medline: 37163336] 221",
    "FREE Full text",
    "[raw_reference] Carlesso LC, Skou ST, Tang LH, Simon\u00ff C, Brooks D. Multimorbidity: making the case for an end to disease-specific rehabilitation. Physiother Can 2020;72(1):1-3 [FREE Full text] [doi: 10.3138/ptc-72-1-gee] [Medline: 34385742] 222",
    "FREE Full text",
    "[raw_reference] Neter E, Brainin E. eHealth literacy: extending the digital divide to the realm of health information. J Med Internet Res 2012 Jan 27;14(1):e19 [FREE Full text] [doi: 10.2196/jmir.1619] [Medline: 22357448] 223",
    "FREE Full text",
    "[raw_reference] van Kessel R, Wong BL, Clemens T, Brand H. Digital health literacy as a super determinant of health: more than simply the sum of its parts. Internet Interv 2022 Mar;27:100500 [FREE Full text] [doi: 10.1016/j.invent.2022.100500] [Medline: 35242586] 224",
    "FREE Full text",
    "[raw_reference] Fiuza-Luces C, Garatachea N, Berger NA, Lucia A. Exercise is the real polypill. Physiology (Bethesda) 2013 Sep;28(5):330-358 [FREE Full text] [doi: 10.1152/physiol.00019.2013] [Medline: 23997192]"
  ],
  "processing_software": {
    "GROBID": "0.8.2"
  }
}
