{
  "paper_id": "LCTLA3KN",
  "title": "Long-term Effectiveness of mHealth Physical Activity Interventions: Systematic Review and Meta-analysis of Randomized Controlled Trials",
  "abstract": "Background: Mobile health (mHealth) interventions can increase physical activity (PA); however, their long-term impact is not well understood. \n Objective: The primary aim of this study is to understand the immediate and long-term effects of mHealth interventions on PA. The secondary aim is to explore potential effect moderators. \n Methods: We performed this study according to the Cochrane and PRISMA (Preferred Reporting Items for Systematic Reviews and Meta-Analyses) guidelines. We searched PubMed, the Cochrane Library, SCOPUS, and PsycINFO in July 2020. Eligible studies included randomized controlled trials of mHealth interventions targeting PA as a primary outcome in adults. Eligible outcome measures were walking, moderate-to-vigorous physical activity (MVPA), total physical activity (TPA), and energy expenditure. Where reported, we extracted data for 3 time points (ie, end of intervention, follow-up \u22646 months, and follow-up >6 months). To explore effect moderators, we performed subgroup analyses by population, intervention design, and control group type. Results were summarized using random effects meta-analysis. Risk of bias was assessed using the Cochrane Collaboration tool. Results: Of the 2828 identified studies, 117 were included. These studies reported on 21,118 participants with a mean age of 52.03 (SD 14.14) years, of whom 58.99% (n=12,459) were female. mHealth interventions significantly increased PA across all the 4 outcome measures at the end of intervention (walking standardized mean difference [SMD] 0.46, 95% CI 0.36-0.55; P<.001; MVPA SMD 0.28, 95% CI 0.21-0.35; P<.001; TPA SMD 0.34, 95% CI 0.20-0.47; P<.001; energy expenditure SMD 0.44, 95% CI 0.13-0.75; P=.01). Only 33 studies reported short-term follow-up measurements, and 8 studies reported long-term follow-up measurements in addition to end-of-intervention results. In the short term, effects were sustained for walking (SMD 0.26, 95%",
  "year": 2014,
  "date": "2014",
  "authors": [
    {
      "name": "Annette M\u00f6nninghoff",
      "email": "annette.moenninghoff@unisg.ch",
      "affiliation": {
        "organization": "Institute for Customer Insight",
        "department": "Institute for Customer Insight",
        "institution": "University of St. Gallen",
        "address": "St. Gallen, Switzerland"
      }
    },
    {
      "name": "Jan Kramer",
      "affiliation": {
        "organization": "Centre for Digital Health Interventions",
        "department": "Centre for Digital Health Interventions",
        "institution": "University of St. Gallen",
        "address": "St. Gallen, Switzerland"
      }
    },
    {
      "name": "Alexander Hess",
      "affiliation": {
        "organization": "Centre for Digital Health Interventions",
        "department": "Centre for Digital Health Interventions",
        "institution": "University of St. Gallen",
        "address": "St. Gallen, Switzerland"
      }
    },
    {
      "name": "Kamila Ismailova",
      "affiliation": {
        "organization": "Centre for Digital Health Interventions",
        "department": "Centre for Digital Health Interventions",
        "institution": "University of St. Gallen",
        "address": "St. Gallen, Switzerland"
      }
    },
    {
      "name": "Gisbert Teepe",
      "affiliation": {
        "organization": "Centre for Digital Health Interventions",
        "department": "Centre for Digital Health Interventions",
        "institution": "ETH Zurich",
        "address": "Zurich, Switzerland"
      }
    },
    {
      "name": "Lorainne Car",
      "affiliation": {
        "organization": "Lee Kong Chian School of Medicine",
        "department": "Lee Kong Chian School of Medicine",
        "institution": "Nanyang Technological University",
        "address": "Singapore, Singapore"
      }
    },
    {
      "name": "Falk M\u00fcller-Riemenschneider",
      "affiliation": {
        "organization": "Saw",
        "department": "Saw",
        "institution": "Swee Hock School of Public Health",
        "address": "Singapore, Singapore"
      }
    },
    {
      "name": "Tobias Kowatsch",
      "affiliation": {
        "organization": "Centre for Digital Health Interventions",
        "department": "Centre for Digital Health Interventions",
        "institution": "University of St. Gallen",
        "address": "St. Gallen, Switzerland"
      }
    },
    {
      "affiliation": {
        "organization": "Institute for Customer",
        "department": "Institute for Customer",
        "institution": "Insight University of St",
        "address": "Gallen Bahnhofstrasse 8 St., 9000, Gallen, Switzerland"
      }
    }
  ],
  "doi": "10.2196/26699",
  "md5": "AE1AA05BC5A810B54866AE128B9DB51A",
  "publication": {
    "journal": "J Med Internet Res",
    "journal_inferred": true
  },
  "keywords": [
    "mHealth",
    "physical activity",
    "systematic review",
    "meta-analysis",
    "mobile phone"
  ],
  "funding": [
    "",
    "",
    "",
    "Acknowledgments This study was supported by the  National Research Foundation, Prime Minister's Office, Singapore , under its  Campus for Research Excellence and Technological Enterprise Programme  and by the  CSS Insurance (Switzerland) . We thank  Iva Milhaylova  for her support during screening and extraction."
  ],
  "sections": [
    {
      "title": "Introduction"
    },
    {
      "title": "Background",
      "text": "In recent decades, populations have become increasingly sedentary. The World Health Organization (WHO) recommends 150 minutes of moderate-intensity physical activity (PA) or 75 minutes of vigorous-intensity PA per week for adults and 60 minutes of moderate-to-vigorous physical activity (MVPA) for adolescents per day  [1] . An estimated 28% of adults worldwide do not meet these guidelines  [2] . The prevalence of inactivity is high in Latin America and many high-income countries, with approximately every second adult inactive in Brazil or Saudi Arabia, and 40% of adults insufficiently active in the United States  [2] .\n\nAccording to the WHO, physical inactivity is 1 of the 4 core modifiable risk factors for noncommunicable diseases (NCDs). As such, it is as important to be addressed as tobacco use or obesity and proven to increase the risk of cancer, cardiovascular diseases, diabetes, dementia, and depression  [3] [4] [5] [6] .\n\nIn response to the high prevalence and substantial risk posed by physical inactivity, the WHO has formulated a target to reduce physical inactivity by 10% by 2025 as part of its strategy against NCDs  [7] . Scaling up PA interventions is key to achieving the WHO target. However, there are various barriers, including cost, resource restrictions, and poorly scalable intervention designs  [8, 9] . Owing to the increasing dissemination and ubiquity of mobile technology, mobile technology-based interventions, that is, mobile health (mHealth), have been discussed as a solution for overcoming scalability challenges  [10, 11] . There are only a few examples of nationwide mHealth programs such as the NHS Diabetes Prevention Program  [12]  in the United Kingdom, the 10,000 steps program in Australia  [13] , and the National Steps Challenge and Live Healthy SG in Singapore  [14, 15] . Most governments and health organizations are still hesitant about rolling out mHealth PA programs, as clear evidence for the effectiveness of mHealth interventions for sustainable behavior change is lacking  [16, 17] .\n\nPrevious evidence for the effectiveness of mHealth interventions on PA is mixed (Multimedia Appendix 1  [18] [19] [20] [21] [22] [23] [24] [25] [26] [27] [28] [29] [30] [31] ). Most existing meta-analyses found significant positive effects on PA in sick and at-risk populations, with effect sizes ranging from small to large  [18] [19] [20] [21] [22] [23] [24] [25] [26] [27] [28] . However, some studies did not find significant effects or reported conflicting results  [29] [30] [31] . There is limited evidence for the sustainability of increased PA levels beyond the end of intervention. Only 2 studies quantitatively analyzed long-term effects: one review found that PA increases are maintained up to 3-4 years after the intervention  [20]  and the other did not find significant long-term results  [31] . Kirk et al  [25]  and Romeo et al  [30]  found that shorter mHealth PA interventions (<16 weeks and <12 weeks, respectively) are more effective than longer ones, indicating that effects might not be maintained in the long term.\n\nWe also lack clarity on how population types, intervention design, and control group type moderate the impact of mHealth interventions on PA. Only 3 studies performed subgroup analyses according to population type with mixed results. A total of 2 studies found interventions to be equally effective in sick and healthy populations  [23, 30] , and 1 review found mHealth interventions to be more effective in sick populations; however, the results were not statistically significant  [27] . Most studies focused exclusively on sick or at-risk populations  [21, 22, [24] [25] [26] 28, 31] , making it difficult to draw clear conclusions.\n\nThe design of mHealth interventions influences the degree to which they are scalable. The promise of mHealth is that the technology itself (ie, without costly and limited human resources) promotes active lifestyles. However, these highly scalable interventions miss the element of human-to-human interaction, which is a potentially important active ingredient in behavior change interventions. Current evidence draws an inconclusive picture: existing studies have found no effects on PA when interventions are scalable  [24, 30]  (ie, mHealth interventions without human-to-human interactions), stronger effects when interventions are nonscalable (ie, mHealth interventions with human-to-human interactions)  [27, 32] , stronger effects in scalable interventions  [20] , or no moderating effects  [22] . Thus, we need a comprehensive evaluation of scalable versus nonscalable designs to judge the potential of mHealth technologies in reaching large populations at low costs. Furthermore, our current understanding of the effects of mHealth PA interventions is limited by the inclusion of different control groups in previous studies. Most previous studies included both minimal or no intervention control groups and control groups receiving an alternative intervention  [18] [19] [20] [22] [23] [24] [25] [26] [27] [28] [29] 31] . This makes it impossible to distinguish between the absolute effect of mHealth PA interventions on behavior and the degree to which mHealth interventions are superior to alternative nonmobile designs or the standard of care."
    },
    {
      "title": "Objectives",
      "text": "Accordingly, we sought to comprehensively collate and analyze trials evaluating mHealth interventions that promote PA in adult populations. Our primary aim is to understand the long-term impact of these interventions on PA.\n\nOur secondary aim is to explore potential effect moderators (population type, intervention design, and control group type), to understand which populations can benefit from mHealth interventions, to understand if scalable mHealth intervention designs are effective, and to understand if mHealth interventions produce superior results to nonmobile interventions."
    },
    {
      "title": "Methods"
    },
    {
      "title": "Overview",
      "text": "This study was performed according to the Cochrane methodology, and the results were reported following the PRISMA (Preferred Reporting Items for Systematic Reviews and Meta-Analyses) guidelines. We searched PubMed, the Cochrane Library, SCOPUS, and PsycINFO for randomized controlled trials (RCTs) on mHealth interventions targeting PA increases (all search strategies are given in Multimedia Appendices 2 and 3) published from database inception to July 3, 2020. We also searched the reference lists of the relevant existing systematic reviews for eligible studies. This study was registered with PROSPERO (CRD 42019124716)."
    },
    {
      "title": "Eligibility Criteria",
      "text": "Studies were eligible if they assessed the impact of mHealth interventions on PA as a primary study outcome in individuals aged 18 years or more and were published in English. Eligible study designs were RCTs or cluster RCTs. Eligible comparators comprised no or minimal interventions and alternative interventions that did not include mobile technologies."
    },
    {
      "title": "Types of Interventions",
      "text": "mHealth interventions were defined as programs that fully or partly deliver interventions using mobile technology such as pedometers or accelerometers with displays, activity trackers, smartphones, or tablets. We excluded interventions where the use of a mobile device was unclear (eg, telephone or website interventions) or where increasing PA was not the primary outcome. This was to ensure that interventions genuinely aimed to increase PA and to avoid including studies measuring PA only as a supplemental outcome."
    },
    {
      "title": "Types of Outcomes",
      "text": "Eligible outcome measures were walking, MVPA, total physical activity (TPA), and energy expenditure (EE), as these outcomes are most commonly reported. Multiple outcome units were eligible per outcome measure (eg, walking in minutes and walking in steps). Studies reporting objectively measured or self-reported outcome data were eligible."
    },
    {
      "title": "Data Collection Process",
      "text": "Abstracts of all identified papers were exported and uploaded into Covidence Systematic Review software (Veritas Health Innovation Ltd, version accessed July 2020) for screening. Two reviewers independently screened the abstracts for eligibility (AM, JNK, or KI). If reviewers doubted whether an article was potentially relevant, it was included for full inspection. Next, full texts of potentially eligible papers were uploaded into Covidence and screened by 2 independent reviewers (AM, JNK, or KI). Conflicts were resolved by discussion or where required by a third reviewer. We contacted authors of potentially relevant articles for further information when needed. All reviewers were trained during a full-day workshop on eligibility criteria and software before screening."
    },
    {
      "title": "Data Extraction and Management",
      "text": "Data for each study were extracted independently by 2 reviewers (AM, JNK, KI, AJH, or GWT) using standardized extraction forms. Conflicts were resolved by discussion between 2 primary reviewers or with a third, independent reviewer. All reviewers were trained to use the extraction form and Cochrane risk of bias criteria during a full-day workshop. Where reported, data were extracted for all 4 eligible outcome measures (walking, MVPA, TPA, and EE) and time points (end of intervention, short-term follow-up [\u22646 months after the end of intervention], and long-term follow-up [>6 months after the end of intervention]). If studies reported both objectively measured and self-reported outcome data, the former were used for meta-analysis. If studies only reported self-reported outcome data, these were extracted, and the quality of evidence was rated as high risk of detection bias. Data were extracted as means and SDs per outcome measure and time point. If SDs were not reported, they were calculated using the RevMan calculator and following the Cochrane Handbook  [33] . Respective authors were contacted for any missing data."
    },
    {
      "title": "Assessment of Risk of Bias in Included Studies",
      "text": "Two reviewers (AM, JNK, KI, AJH, or GWT) independently assessed the risk of bias for each study using the Cochrane Collaboration tool  [34] . Additional criteria for cluster RCTs were assessed  [35]  and documented within the other bias domains of the Cochrane Collaboration tool. Discrepancies were resolved by consensus between reviewers or where needed by a third reviewer. We classified studies as overall high risk of bias if they scored high in any bias domain other than performance bias, as blinding of participants and personnel is almost impossible in mHealth intervention studies  [23] . Blinding of outcome assessors was rated as high risk if outcomes were self-reported."
    },
    {
      "title": "Statistical Methods",
      "text": "We summarized the intervention and sample characteristics of all the included studies. We quantitatively analyzed the data using RevMan software (Cochrane, version 5.4) and a DerSimonian and Laird random effects model for our meta-analysis  [36] . We reported all 4 outcome measures using standardized mean differences (SMDs) and 95% CI. Where appropriate (eg, if one mHealth intervention was compared with a minimal and alternative nonmobile intervention), we combined means and SDs of control or intervention groups following the Cochrane Handbook  [33] . We classified populations into 3 groups based on the reported recruitment criteria: sick, at-risk, and healthy. The sick group included populations experiencing illnesses such as diabetes, cancer, chronic obstructive pulmonary disease, and coronary heart disease. The at-risk group included inactive or sedentary, older, overweight, and obese populations. We classified mHealth interventions into 2 designs: scalable and nonscalable. Scalability is defined as the ability to scale up an intervention without requiring human resources. Consequently, scalable mHealth interventions were defined as interventions that only leveraged automated components without any human-to-human interactions. Nonscalable mHealth interventions included human-to-human interactions, such as coaching, in-person feedback, or group activity sessions. We classified control groups into no or minimal interventions (no intervention or information material only) and alternative (nonmobile) interventions.\n\nFollowing the recommendations of Richardson et al  [37]  and the Cochrane Handbook  [33] , a subgroup analysis was performed based on end-of-intervention values for all outcomes where at least 10 studies were available. We a priori defined 3 subgroup analyses following the population, intervention, comparison, and outcome framework  [33]  to identify possible effect moderators. Our aim is to understand the impact of population type (sick, at-risk, and healthy), intervention design (scalable and nonscalable), and control group type (no or minimal and alternative).\n\nWe present the primary results using forest plots for each outcome and time point. Subgroup analyses were displayed in forest plots using end-of-intervention data. We quantified inconsistencies between studies using the I 2 statistics (ie, the varying effect estimates towing to heterogeneity rather than chance)  [33] . We classified I 2 >50% as having substantial heterogeneity  [38] . We examined the significance of heterogeneity using chi-square tests (P\u2264.05). We assessed subgroup differences following the guidelines given by Richardson et al  [37] , which recommend testing for significant subgroup differences (P\u2264.10) and covariate distribution and comparing heterogeneity and effect sizes between subgroups. Funnel plot analysis was used to detect sampling bias. We used end-of-intervention effect values in our funnel plot analyses, as all studies reported this time point.\n\nWe conducted 3 sensitivity analyses to evaluate the robustness of our primary results: first, we excluded outlier studies; second, we excluded studies with high risk of bias; and third, we excluded studies not reporting long-term follow-up measurements to keep the study sample consistent across all time points. We used the grading of recommendations, assessment, development, and evaluation (GRADE) framework to assess the quality of evidence at the outcome measure level for the end-of-intervention time point and to report the standardized quality of evidence profiles, following the study by Guyatt et al  [39] ."
    },
    {
      "title": "Results"
    },
    {
      "title": "Overview",
      "text": "Of the 2828 identified studies, 512 full-text articles were screened, and 117 studies were included in the meta-analysis (Figure  1 )."
    },
    {
      "title": "Study Characteristics",
      "text": "Multimedia Appendix 4  contains the included studies and their characteristics. The 117 trials represented 21,188 participants with a mean age of 52.03 years (SD 14.14), of whom 58.99% (12,459/21,118) were female. Most studies were conducted in high-income, developed regions such as North America (43/117, 36.8%), Europe (39/117, 33.3%), and Australia and New Zealand (24/117, 20.5%). Very few studies were conducted in Asia (7/117, 6.0%), Latin America (3/117, 2.6%), or Africa (1/117, 0.9%), limiting the representativeness of the evidence for low-income countries. Sample sizes ranged widely (from 15 to 1442), and the intervention duration ranged from 1 week to 2 years. All but one study  [40]  reported end-of-intervention results, 33 studies reported short-term follow-up results , and only 8 studies reported long-term follow-up results  [61, [72] [73] [74] [75] [76] [77] [78] . The mean time point for the short-term follow-up was 4.14 months (SD 2.08) after the end of intervention. The long-term follow-up measurement was taken on average after 13.96 months (SD 11.91).\n\nWalking was the most reported outcome measure  ( 77/117, 65.8%) [41,43,44,48,50-54,58-60,63-65,67-69,72-130], followed by MVPA (62/117, 53.0%) [42,44,46,47,49,51-55,57,59, 61-64,68,70-76,78-80,82,84-87,89-91,94,98,104,107,109,112,114, 117,125,126,131-147], TPA (33/117, 28.2%) [44,45,50,52,54, 56,64,66,72,74,76-78,84,85,89,96,110-112,114, 118,131,135,146,148-154,157], and EE (5/117, 4.3%) [61,103,137,155,156]. Most RCTs were conducted in at-risk (48/117, 41.0%) or sick populations (46/117, 39.3%). Only 19.7% (23/117) of the studies tested mHealth interventions in healthy populations within a preventative setting. In most interventions, mHealth technologies were leveraged in nonscalable intervention designs (71/117, 60.7%). Human-to-human interactions included individual coaching, group coaching, PA classes, and physical education classes. Of the 117 interventions, 45 (38.5%) used mHealth technologies without any human-to-human interactions and were thus classified as scalable. In 1 study [75], 2 mHealth interventions (scalable and nonscalable) were combined. Most mHealth interventions only leveraged basic technologies such as pedometers or accelerometers (86/117, 73.5%), text messages (20/117, 17.1%), or websites (20/117, 17.1%). Although some recent studies pioneered innovative mHealth technologies [49,96], overall, only a few studies used advanced mHealth technologies such as automated individualized feedback (19/117, 16.2%), mobile phone apps (15/117, 12.8%), social comparison (10/117, 8.5%), and automated coaching or virtual advisors (5/117, 4.3%). Most studies had no or minimal intervention control groups (83/117, 70.9%). Only a few trials had alternative intervention control groups (22/117, 18.8%). Different control group types were combined into one control group in 12 cases. Meta-analysis of mHealth Interventions on PA Overall, mHealth interventions significantly increased PA across all 4 outcome measures at the end of intervention: walking SMD 0.46 (95% CI 0.36-0.55; P<.001; I 2 =83%, P<.001); MVPA SMD 0.28 (95% CI 0.21-0.35; P<.001; I 2 =62%, P<.001); TPA SMD 0.34 (95% CI 0.20-0.47; P<.001; I 2 =77%, P<.001); and EE SMD 0.44 (95% CI 0.13-0.75; P=.005; I 2 =60%, P=.04; Figures 2-9). Short-term effects were sustained (\u22646 months after the end of intervention) for 3 of 4 outcome measures: walking SMD 0.26 (95% CI 0.09-0.42; P=.002; I 2 =73%, P<.001); MVPA SMD 0.20 (95% CI 0.05-0.35; P=.008; I 2 =72%, P<.001); and TPA SMD 0.53 (95% CI 0.13-0.93; P=.009; I 2 =87%, P<.001).\n\nOnly one study  [61]  reported short-term follow-up measurements for EE, and the results were not statistically significant. In addition, long-term (>6 months after the end of intervention) effects were sustained for 2 of 4 outcome measures: walking SMD 0.25 (95% CI 0.10-0.39; P=.001; I 2 =68%, P=.004) and MVPA SMD 0.19 (95% CI 0.11-0.27; P<.001; I 2 =0%, P=.44). TPA results were sustained, but the effects were just below the significance threshold (SMD 0.19, 95% CI 0.00-0.38; P=.05; I 2 =72%, P=.003). Again, only one study  [61]  reported long-term follow-up effects for EE, which were not statistically significant. Effect sizes decreased over time, from almost moderate at the end of intervention to small during the long-term follow-up measurement. We found substantial and significant heterogeneity across all outcomes and most time points, with I 2 ranging from 60% to 83% for end-of-intervention measurements (Figures  2 3 4 5 6 7 8 9 )."
    },
    {
      "title": "XSL \u2022 FO"
    },
    {
      "title": "Publication Bias Assessment",
      "text": "Publication bias was assessed using funnel plot analysis for end-of-intervention measurements, as all but one study  [40]  reported this time point (Multimedia Appendix 5  [54, 82, 102] ). No systematic publication bias was observed. However, the funnel plot analysis revealed 3 outlier studies  [54, 82, 102] . We identified unusually high adherence rates  [54] , possibly because the research team and the study participants were based on the same campus, and a short intervention duration (only 4 weeks)  [82, 102]  as potential reasons for the high effect scores in the outlier studies. We conducted a sensitivity analysis and excluded these studies across all outcome measures. All effects were found to be stable, and heterogeneity was substantially reduced (Multimedia Appendix 6)."
    },
    {
      "title": "Sensitivity Analyses",
      "text": "Sensitivity analysis by risk of bias was conducted for all outcome measures but for EE, as only one study  [155]  measuring EE classified as low risk of bias. Results at the end of intervention were found to be robust across outcome measures (Multimedia Appendix 6), with effect sizes substantially increasing for walking, MVPA, and TPA to moderate effect sizes. Short-and long-term follow-up effects were not statistically significant when only studies with low risk of bias were included. Heterogeneity increased and remained substantial. Sensitivity analysis of studies reporting long-term follow-up measurements was conducted for all outcome measures but for EE, as only one study  [61]  measuring EE reported a long-term follow-up measurement. The results across all time points were robust for all outcome measures."
    },
    {
      "title": "Subgroup Analysis by Population Type",
      "text": "We used subgroup analysis to evaluate the effect moderators. Table  1  summarizes all results, and Multimedia Appendices 7 , 8 , and 9  provide detailed forest plots for each analysis. We found that population type moderates the effect of mHealth interventions on PA. The intervention design and control group type were not found to be significant effect moderators. Subgroup analysis by population type revealed statistically significant (P\u2264.10) quantitative subgroup effects for all outcome measures. The treatment effect at the end of intervention was greater in sick populations (walking SMD 0.44, 95% CI 0.29-0.60, P<.001, I 2 =71%, P<.001; MVPA SMD 0.33, 95% CI 0.21-0.45, P<.001, I 2 =55%, P<.001; TPA SMD 0.59, 95% CI 0.36-0.81, P<.001, I 2 =49%, P=.03; Multimedia Appendix 7) than in healthy populations (walking SMD 0.20, 95% CI 0.04-0.35, P=.01, I 2 =78%, P<.001; MVPA SMD 0.14, 95% CI 0.06-0.23, P=.001, I 2 =15%, P=.29; TPA SMD 0.29, 95% CI -0.10 to 0.67, P=.14, I 2 =85%, P<.001; Multimedia Appendix 7). Within the healthy subgroup, summary effects were only statistically significant for the outcome measures walking and MVPA. The results for at-risk populations were mixed. The outcome measures walking and MVPA exhibited high effect scores, similar to the high effect scores of sick populations (walking SMD 0.59, 95% CI 0.42-0.76, P<.001, I 2 =87%, P<.001; MVPA SMD 0.30, 95% CI 0.18-0.43, P .001, I 2 =72%, P<.001; Multimedia Appendix 7), whereas effect scores for at-risk populations were lower for TPA (SMD 0.21, 95% CI 0.04-0.38; P=.02; I 2 =78%, P<.001). Although heterogeneity was somewhat reduced within most subgroups compared with the overall outcome heterogeneity, it remained high and significant. The covariate distribution between sick, at-risk, and healthy population subgroups was uneven, as fewer studies investigated preventative mHealth PA interventions in healthy populations."
    },
    {
      "title": "Subgroup Analysis by Intervention Design",
      "text": "Subgroup analysis by intervention design revealed no significant subgroup differences across 3 outcome measures (walking, P=.35; MVPA, P=.12; TPA, P=.60; Table  1 ; Multimedia Appendix 8) and did not identify mHealth intervention design as a significant effect moderator. Heterogeneity within subgroups was substantial and significant across all outcome measures (Table  1 ). Both scalable and nonscalable mHealth intervention designs significantly increased PA at similar levels (scalable walking SMD 0.54, 95% CI 0.34-0.74, P<.001, I 2 =89%, P<.001; scalable MVPA SMD 0.20, 95% CI 0.08-0.32, P=.001, I 2 =67%, P<.001; scalable TPA SMD 0.39, 95% CI 0.06-0.73, P=.02, I 2 =89%, P<.001; nonscalable walking SMD 0.42, 95% CI 0.31-0.54, P<.001, I 2 =77%, P<.001; nonscalable MVPA SMD 0.33, 95% CI 0.24-0.43, P<.001, I 2 =57%, P<.001; nonscalable TPA SMD 0.30, 95% CI 0.18-0.42, P<.001, I 2 =53%, P=.002; Multimedia Appendix 8)."
    },
    {
      "title": "Subgroup Analysis by Control Group Type",
      "text": "Subgroup analysis by control group type found no statistically significant subgroup effect for the outcome measures walking (P=.15) and MVPA (P=.26). Subgroup differences were only significant for TPA (P=.006), where mHealth interventions led to larger effects in studies compared with alternative control groups (SMD 0.48, 95% CI 0.06-0.91; P=.03; I 2 =83%, P<.001; Multimedia Appendix 9) than in studies with no or minimal control groups (SMD 0.34, 95% CI 0.19-0.50; P<.001; I 2 =76%, P<.001; Multimedia Appendix 9). Subgroup analysis did not significantly reduce heterogeneity, and the covariate distribution between the no or minimal intervention subgroup and the alternative intervention subgroup was extremely uneven)."
    },
    {
      "title": "Risk of Bias in Included Studies",
      "text": "Figure  10  shows the overall risk of bias assessment across all included studies. Overall, 94 studies were classified as high risk because of selection bias (14/117, 11.9%), detection bias (37/117, 31.6%), attrition bias (42/117, 35.9%), reporting bias (13/117, 11.1%), and other biases (56/117, 47.9%). These mostly included baseline group indifferences or biases resulting from the respective study design (including potential cluster RCT biases)  [35] . Multimedia Appendix 10 [40-156] displays the individual risk of bias assessment by study. GRADE analysis of all 4 outcomes (Multimedia Appendix 11) revealed no evidence of publication bias but evidence of inconsistency for the outcome measure EE. Thus, the overall quality of evidence rating ranged from low (walking, MPVA, and TPA) to very low (EE)."
    },
    {
      "title": "Discussion"
    },
    {
      "title": "Principal Findings",
      "text": "This systematic review is the most comprehensive study to date of mHealth PA interventions in adult populations. The aims of this study are to understand the long-term impacts of mHealth interventions on PA and to identify important effect moderators.\n\nOverall, our analysis confirms the potential of mHealth interventions to increase PA at the end of intervention. We found small to moderate positive effects (SMD 0.28-0.46), which concur with previous research that reported small to large effect sizes  [19, [21] [22] [23] [24] 27, 28] . Transforming our results into mean differences based on a representative low risk of bias study [109], we found mHealth interventions to result in 1566 incremental steps per day and an additional 36 minutes of MVPA per week. Previous research found that 1000 incremental steps per day can result in a 10% lower risk of having metabolic syndrome (MetS) and a 6% risk reduction of all-cause mortality, substantiating that mHealth interventions can result in significant health benefits  [158, 159] . This study is among the first to find that activity increases are sustained beyond the end of intervention. Increased PA levels remained significant in short-term follow-ups taken on average 4.14 months after the end of intervention for the outcome measures walking, MVPA, and TPA. Long-term follow-up measurements, taken on average after 13.96 months, confirmed these results. However, effect sizes decreased over time and ranged from 0.19 to 0.25 at the long-term follow-up time point, which is equivalent to an incremental 851 steps per day and 24 minutes per week of MVPA. Our results concur with the recent review by Chaudhry et al  [20] , who also found maintained but decreasing effects of step-count monitoring interventions on PA; however, as Chaudhry et al  [20]  defined time frames from the start of intervention and this study looks at follow-up measurements after the end of intervention, absolute effect scores cannot be compared. Given the inverse relationship of PA with the prevalence of MetS [158], it can be assumed that mHealth interventions still yield health benefits in the long term. These observations are encouraging and provide initial evidence that mHealth interventions can support sustainable behavioral changes. However, our follow-up effects were not robust when only low risk of bias studies were analyzed because of the limited number of high-quality studies with longitudinal designs. Thus, as the current evidence base for studies with long-term follow-up measurements is very limited, further primary research is needed to confirm the sustained effects of mHealth on PA beyond the end of intervention.\n\nOur analysis of effect moderators found that population type moderates the effect of mHealth on PA, whereas intervention design and control group type were not found to be effect moderators. Our evidence suggests that mHealth interventions might be most effective when targeting sick or at-risk populations, thereby supporting the indicative results by Smith et al  [27] -effect sizes in sick and at-risk populations were about twice as high as in healthy populations. However, we still found mHealth interventions to be effective in all population types. These results challenge previous findings by Gal et al  [23]  and Romeo et al  [30] , who found no differences in effectiveness by population type, likely owing to the small number of studies reviewed. Previous studies found that baseline activity levels are negatively correlated with activity increases in mHealth interventions  [144, 160, 161 ]. An underlying driver for the higher effectiveness of mHealth interventions in sick and at-risk populations could thus be lower baseline activity levels usually seen within these populations. However, there could also be further underlying factors, such as higher expectations that increases in PA lead to improved health outcomes (outcome expectancy). Further research is thus needed to understand the variety of underlying factors driving higher effectiveness in sick and at-risk populations. Our results provide helpful guidance to policy makers developing scaled-up mHealth intervention programs. Our results suggest that technology-enabled preventative, population-wide programs (eg, The National Steps Challenge  [14] ) might maximize their public health impact if they specifically target at-risk populations (eg, older or overweight groups). Focusing on at-risk groups should also increase the cost-effectiveness of large-scale mHealth programs. mHealth technologies are cost-effective and scalable. However, this holds true only if technologies are effective without additional nonscalable intervention components (eg, face-to-face coaching). Previous research has found no effects in scalable mHealth intervention designs  [24, 30] , stronger effects in nonscalable designs that combined technology with human-to-human interactions  [27, 32] , and stronger effects when technology was used stand-alone  [20] . We found preliminary evidence that mHealth interventions could be effective in scalable intervention designs. Our analysis found no significant subgroup differences between scalable and nonscalable intervention designs, suggesting that both designs can be equally effective in increasing PA. These results are promising and encourage the development of scalable mHealth intervention designs to efficiently increase PA in large population groups.\n\nWithin our sample, most scalable mHealth interventions leveraged basic technologies (eg, texting, pedometers, or accelerometers), without taking advantage of more advanced mobile technologies (eg, automated individualized coaching, social comparison, and mobile apps), which could have further increased intervention effectiveness [162,163]. Our analysis is among the first to explore whether mHealth PA interventions produce results superior to alternative nonmobile interventions. We found that across the outcome measures walking, MPVA, and TPA, mHealth interventions led to increased levels of PA compared with alternative nonmobile interventions and no or minimal control groups, which accords with previous findings [21]. These results encourage the addition of mHealth technology to nonmobile PA interventions to increase their effectiveness."
    },
    {
      "title": "Strengths and Limitations",
      "text": "The strengths of this study are the large number of mHealth interventions analyzed and its rigorous methodology. However, this study has several limitations. First, in line with other studies [164], we encountered large and significant heterogeneity in our results, despite performing several subgroup analyses. Our wide inclusion criteria led us to expect high heterogeneity because of the diverse multicomponent interventions, settings, and intervention durations. In addition, the uneven covariate distribution between subgroups limits the validity of our findings on effect moderators. Second, most of the included studies were classified as having a high risk of bias, and the overall quality of evidence was graded low to very low. The quality of evidence could be improved if future research agreed on standardized reporting of PA outcomes (eg, MVPA in minutes per day) and objective outcome measurement  [21] . When replicating our primary results with low risk of bias studies, we could not confirm the effectiveness of mHealth interventions to increase PA beyond the end of interventions, as the available high-quality evidence was limited. Third, we did not attempt to identify unpublished reports or gray literature. Previous research has shown that excluding gray literature might exaggerate the results of a meta-analysis  [165] . We tried to mitigate this limitation by conducting a funnel plot analysis to detect potential publication bias. Furthermore, we performed sensitivity analyses to assess the robustness of our results. We detected no systematic publication bias and sensitivity analyses that excluded outlier studies, confirming that our results were robust. Fourth, some studies included in this study allowed intervention participants to keep mHealth devices after the end of intervention. This might have positively skewed the follow-up effects of our review. Finally, although this study provides initial evidence on the long-term effects of mHealth interventions, it only presents results for follow-up measurements taken on average 13.96 months after intervention, and our analysis included only 8 studies. We found that summary effects decrease over time, thus raising the question about the sustainability of positive effects. Further research is required to evaluate whether behavior change-toward a more active lifestyle-is truly sustainable in long term."
    },
    {
      "title": "Conclusions",
      "text": "We conclude that mHealth interventions can moderately increase PA in adults at the end of intervention, both compared with alternative nonmobile control groups and no or minimal control groups. PA increases are maintained in follow-up measurements taken after intervention but decrease over time. Population type seems to moderate the effect of mHealth intervention on PA, with higher effectiveness in sick and at-risk populations compared with healthy population samples. mHealth interventions with scalable and nonscalable intervention designs seem to be equivalent in terms of effectiveness. Further high-quality studies investigating scalable mHealth interventions with long-term follow-up measurements are needed to confirm our results. This study concludes that mHealth technologies might not only support sustainable behavior change toward more active lifestyles but also contribute to preventing and controlling chronic disease risk."
    },
    {
      "text": "Figure 1. PRISMA (Preferred Reporting Items for Systematic Reviews and Meta-Analyses) chart. mHealth: mobile health; RCT: randomized controlled trial."
    },
    {
      "text": "Figure 2. Primary outcome analysis for the outcome walking at timepoint end of intervention."
    },
    {
      "text": "Figure 3. Primary outcome analysis for the outcome walking at timepoint short-term follow-up."
    },
    {
      "text": "Figure 4. Primary outcome analysis for the outcome walking at timepoint long-term follow-up."
    },
    {
      "text": "Figure 5. Primary outcome analysis for the outcome moderate-to-vigorous physical activity at timepoint end of intervention."
    },
    {
      "text": "Figure 6. Primary outcome analysis for the outcome moderate-to-vigorous physical activity at timepoint short-term follow-up."
    },
    {
      "text": "Figure 7. Primary outcome analysis for the outcome moderate-to-vigorous physical activity at timepoint long-term follow-up."
    },
    {
      "text": "Figure 8. Primary outcome analysis by measurement time point for the outcome total physical activity."
    },
    {
      "text": "Figure 9. Primary outcome analysis by measurement time point for the outcome energy expenditure."
    },
    {
      "text": "Figure 10. Summary of the overall risk of bias assessment for included studies. RCT: randomized controlled trial."
    },
    {
      "text": "Summary of subgroup analyses results.MVPA: moderate-to-vigorous physical activity.In subgroups where n=1, heterogeneity cannot be calculated.No studies with combined subgroups. Thus, no numbers reported."
    },
    {
      "title": "Acknowledgments",
      "text": "This study was supported by the  National Research Foundation, Prime Minister's Office, Singapore , under its  Campus for Research Excellence and Technological Enterprise Programme  and by the  CSS Insurance (Switzerland) . We thank  Iva Milhaylova  for her support during screening and extraction."
    },
    {
      "title": "Authors' Contributions",
      "text": "JNK wrote the initial study protocol with inputs from AM and KI. AM wrote the adjusted study protocol. JNK designed and implemented the search strategy. AM, KI, GWT, and AJH screened and coded the primary studies and extracted data. AM analyzed the data and drafted the initial manuscript, supervised by TK. FM and LTC provided methodological guidance and feedback on the manuscript. All authors reviewed and approved the final manuscript."
    },
    {
      "title": "Conflicts of Interest",
      "text": "JNK, AJH, KI, GWT and TK are affiliated with the Centre for Digital Health Interventions, a joint initiative of the Department of Management, Technology and Economics at ETH Zurich and the Institute of Technology Management at the University of St. Gallen, which was funded in part by CSS Insurance, Switzerland. TK is also a cofounder of Pathmate Technologies, a university spin-off company that creates and delivers digital clinical pathways. However, Pathmate Technologies was not involved in this research. Since January 2021, JNK is associated with CSS Insurance, Switzerland."
    },
    {
      "title": "Multimedia Appendix 1",
      "text": "Overview of existing meta-analyses on the effect of mobile health interventions on physical activity. [PDF File (Adobe PDF File), 319 KB-Multimedia Appendix 1]"
    },
    {
      "title": "Multimedia Appendix 2",
      "text": "Overview of the search strategy and keywords.\n\n[PDF File (Adobe PDF File), 238 KB-Multimedia Appendix 2]"
    },
    {
      "title": "Multimedia Appendix 3",
      "text": "Search algorithms.\n\n[PDF File (Adobe PDF File), 247 KB-Multimedia Appendix 3]"
    },
    {
      "title": "Multimedia Appendix 4",
      "text": "Overview of the study characteristics.\n\n[PDF File (Adobe PDF File), 431 KB-Multimedia Appendix 4]"
    },
    {
      "title": "Multimedia Appendix 5",
      "text": "Funnel plot analysis to detect publication bias.\n\n[PDF File (Adobe PDF File), 333 KB-Multimedia  Appendix"
    }
  ],
  "references": [
    {
      "title": "Global Status Report on Noncommunicable Diseases",
      "authors": [
        "S Mendis",
        "T Armstrong",
        "D Bettcher",
        "F Branca",
        "J Lauer",
        "C Mace"
      ],
      "year": 2014,
      "raw": "S Mendis \n\t\t \n\t\t \n\t\t\t T Armstrong \n\t\t \n\t\t \n\t\t\t D Bettcher \n\t\t \n\t\t \n\t\t\t F Branca \n\t\t \n\t\t \n\t\t\t J Lauer \n\t\t \n\t\t \n\t\t\t C Mace \n\t\t \n\t\t Global Status Report on Noncommunicable Diseases \n\t\t Geneva \n\t\t \n\t\t\t World Health Organization \n\t\t\t 2014. 2014 \n\t\t \n\t \n\t Mendis S, Armstrong T, Bettcher D, Branca F, Lauer J, Mace C, et al. Global Status Report on Noncommunicable Diseases 2014. Geneva: World Health Organization; 2014."
    },
    {
      "title": "Worldwide trends in insufficient physical activity from 2001 to 2016: a pooled analysis of 358 population-based surveys with 1\u20229 million participants",
      "authors": [
        "R Guthold",
        "G Stevens",
        "L Riley",
        "F Bull"
      ],
      "year": 2018,
      "doi": "10.1016/s2214-109x(18)30357-7",
      "journal": "Lancet Glob Health",
      "volume": "6",
      "issue": "10",
      "raw": "Worldwide trends in insufficient physical activity from 2001 to 2016: a pooled analysis of 358 population-based surveys with 1\u20229 million participants \n\t\t \n\t\t\t R Guthold \n\t\t \n\t\t \n\t\t\t G A Stevens \n\t\t \n\t\t \n\t\t\t L M Riley \n\t\t \n\t\t \n\t\t\t F C Bull \n\t\t \n\t\t 10.1016/s2214-109x(18)30357-7 \n\t\t Medline: 30193830 \n\t \n\t \n\t\t Lancet Glob Health \n\t\t \n\t\t\t 6 \n\t\t\t 10 \n\t\t\t \n\t\t\t 2018 Oct \n\t\t \n\t \n\t FREE Full text \n\t Guthold R, Stevens GA, Riley LM, Bull FC. Worldwide trends in insufficient physical activity from 2001 to 2016: a pooled analysis of 358 population-based surveys with 1\u20229 million participants. Lancet Glob Health 2018 Oct;6(10):1077-1086 [FREE Full text] [doi: 10.1016/S2214-109X(18)30357-7] [Medline: 30193830]"
    },
    {
      "title": "Effect of physical inactivity on major non-communicable diseases worldwide: an analysis of burden of disease and life expectancy",
      "authors": [
        "I Lee",
        "E Shiroma",
        "F Lobelo",
        "P Puska",
        "S Blair",
        "P Katzmarzyk",
        "Lancet Physical",
        "Activity Series",
        "Working Group"
      ],
      "year": 2012,
      "doi": "10.1016/s0140-6736(12)61031-9",
      "journal": "Lancet",
      "volume": "380",
      "raw": "Effect of physical inactivity on major non-communicable diseases worldwide: an analysis of burden of disease and life expectancy \n\t\t \n\t\t\t I Lee \n\t\t \n\t\t \n\t\t\t E J Shiroma \n\t\t \n\t\t \n\t\t\t F Lobelo \n\t\t \n\t\t \n\t\t\t P Puska \n\t\t \n\t\t \n\t\t\t S N Blair \n\t\t \n\t\t \n\t\t\t P T Katzmarzyk \n\t\t \n\t\t \n\t\t\t Lancet Physical \n\t\t \n\t\t \n\t\t\t Activity Series \n\t\t \n\t\t \n\t\t\t Working Group \n\t\t \n\t\t 10.1016/s0140-6736(12)61031-9 \n\t\t Medline: 22818936 \n\t \n\t \n\t\t Lancet \n\t\t \n\t\t\t 380 \n\t\t\t \n\t\t\t 2012 Jul 21. 9838 \n\t\t \n\t \n\t FREE Full text \n\t Lee I, Shiroma EJ, Lobelo F, Puska P, Blair SN, Katzmarzyk PT, Lancet Physical Activity Series Working Group. Effect of physical inactivity on major non-communicable diseases worldwide: an analysis of burden of disease and life expectancy. Lancet 2012 Jul 21;380(9838):219-229 [FREE Full text] [doi: 10.1016/S0140-6736(12)61031-9] [Medline: 22818936]"
    },
    {
      "title": "Lancet Physical Activity Series 2 Executive Committee. Progress in physical activity over the Olympic quadrennium",
      "authors": [
        "J Sallis",
        "F Bull",
        "R Guthold",
        "G Heath",
        "S Inoue",
        "P Kelly"
      ],
      "year": 2016,
      "doi": "10.1016/s0140-6736(16)30581-5",
      "journal": "Lancet",
      "volume": "388",
      "issue": "10051",
      "raw": "Lancet Physical Activity Series 2 Executive Committee. Progress in physical activity over the Olympic quadrennium \n\t\t \n\t\t\t J F Sallis \n\t\t \n\t\t \n\t\t\t F Bull \n\t\t \n\t\t \n\t\t\t R Guthold \n\t\t \n\t\t \n\t\t\t G W Heath \n\t\t \n\t\t \n\t\t\t S Inoue \n\t\t \n\t\t \n\t\t\t P Kelly \n\t\t \n\t\t 10.1016/s0140-6736(16)30581-5 \n\t\t Medline: 27475270 \n\t \n\t \n\t\t Lancet \n\t\t \n\t\t\t 388 \n\t\t\t 10051 \n\t\t\t \n\t\t\t 2016 Sep 24 \n\t\t \n\t \n\t Sallis JF, Bull F, Guthold R, Heath GW, Inoue S, Kelly P, Lancet Physical Activity Series 2 Executive Committee. Progress in physical activity over the Olympic quadrennium. Lancet 2016 Sep 24;388(10051):1325-1336. [doi: 10.1016/S0140-6736(16)30581-5] [Medline: 27475270]"
    },
    {
      "title": "Weight control and physical activity in cancer prevention",
      "authors": [
        "F Bianchini",
        "R Kaaks",
        "H Vainio"
      ],
      "year": 2002,
      "doi": "10.1046/j.1467-789x.2002.00046.x",
      "journal": "Obes Rev",
      "volume": "3",
      "issue": "1",
      "raw": "Weight control and physical activity in cancer prevention \n\t\t \n\t\t\t F Bianchini \n\t\t \n\t\t \n\t\t\t R Kaaks \n\t\t \n\t\t \n\t\t\t H Vainio \n\t\t \n\t\t 10.1046/j.1467-789x.2002.00046.x \n\t\t Medline: 12119660 \n\t \n\t \n\t\t Obes Rev \n\t\t \n\t\t\t 3 \n\t\t\t 1 \n\t\t\t \n\t\t\t 2002 Feb \n\t\t \n\t \n\t Bianchini F, Kaaks R, Vainio H. Weight control and physical activity in cancer prevention. Obes Rev 2002 Feb;3(1):5-8. [doi: 10.1046/j.1467-789x.2002.00046.x] [Medline: 12119660]"
    },
    {
      "title": "Assessment of bidirectional relationships between physical activity and depression among adults: a 2-sample Mendelian randomization study",
      "authors": [
        "K Choi",
        "C Chen",
        "M Stein",
        "Y Klimentidis",
        "M Wang",
        "K Koenen",
        "Major Depressive"
      ],
      "year": 2019,
      "doi": "10.1001/jamapsychiatry.2018.4175",
      "journal": "JAMA Psychiatry",
      "volume": "76",
      "issue": "4",
      "raw": "Assessment of bidirectional relationships between physical activity and depression among adults: a 2-sample Mendelian randomization study \n\t\t \n\t\t\t K W Choi \n\t\t\t \n\t\t\t\t Disorder Working Group of the Psychiatric Genomics Consortium \n\t\t\t \n\t\t \n\t\t \n\t\t\t C Chen \n\t\t\t \n\t\t\t\t Disorder Working Group of the Psychiatric Genomics Consortium \n\t\t\t \n\t\t \n\t\t \n\t\t\t M B Stein \n\t\t\t \n\t\t\t\t Disorder Working Group of the Psychiatric Genomics Consortium \n\t\t\t \n\t\t \n\t\t \n\t\t\t Y C Klimentidis \n\t\t\t \n\t\t\t\t Disorder Working Group of the Psychiatric Genomics Consortium \n\t\t\t \n\t\t \n\t\t \n\t\t\t M Wang \n\t\t\t \n\t\t\t\t Disorder Working Group of the Psychiatric Genomics Consortium \n\t\t\t \n\t\t \n\t\t \n\t\t\t K C Koenen \n\t\t\t \n\t\t\t\t Disorder Working Group of the Psychiatric Genomics Consortium \n\t\t\t \n\t\t \n\t\t \n\t\t\t Major Depressive \n\t\t\t \n\t\t\t\t Disorder Working Group of the Psychiatric Genomics Consortium \n\t\t\t \n\t\t \n\t\t 10.1001/jamapsychiatry.2018.4175 \n\t\t Medline: 30673066 \n\t \n\t \n\t\t JAMA Psychiatry \n\t\t \n\t\t\t 76 \n\t\t\t 4 \n\t\t\t \n\t\t\t 2019 Apr 01 \n\t\t \n\t \n\t FREE Full text \n\t Choi KW, Chen C, Stein MB, Klimentidis YC, Wang M, Koenen KC, Major Depressive Disorder Working Group of the Psychiatric Genomics Consortium. Assessment of bidirectional relationships between physical activity and depression among adults: a 2-sample Mendelian randomization study. JAMA Psychiatry 2019 Apr 01;76(4):399-408 [FREE Full text] [doi: 10.1001/jamapsychiatry.2018.4175] [Medline: 30673066]"
    },
    {
      "title": "Global Action Plan for the Prevention and Control of NCDs 2013-2020",
      "year": 2013,
      "doi": "10.2471/blt.08.053348",
      "journal": "Geneva: World Health Organization",
      "raw": "Global Action Plan for the Prevention and Control of NCDs 2013-2020 \n\t\t 10.2471/blt.08.053348 \n\t \n\t \n\t\t Geneva: World Health Organization \n\t\t \n\t\t\t \n\t\t\t 2013 \n\t\t\t World Health Organization \n\t\t \n\t \n\t World Health Organization. Global Action Plan for the Prevention and Control of NCDs 2013-2020. Geneva: World Health Organization; 2013:1-103."
    },
    {
      "title": "A design and evaluation framework for digital health interventions",
      "authors": [
        "T Kowatsch",
        "L Otto",
        "S Harperink",
        "A Cotti",
        "H Schlieter"
      ],
      "year": 2019,
      "doi": "10.1515/itit-2019-0019",
      "journal": "Inf Technol",
      "volume": "61",
      "issue": "5-6",
      "raw": "A design and evaluation framework for digital health interventions \n\t\t \n\t\t\t T Kowatsch \n\t\t \n\t\t \n\t\t\t L Otto \n\t\t \n\t\t \n\t\t\t S Harperink \n\t\t \n\t\t \n\t\t\t A Cotti \n\t\t \n\t\t \n\t\t\t H Schlieter \n\t\t \n\t\t 10.1515/itit-2019-0019 \n\t \n\t \n\t\t Inf Technol \n\t\t \n\t\t\t 61 \n\t\t\t 5-6 \n\t\t\t \n\t\t\t 2019 \n\t\t \n\t \n\t FREE Full text \n\t Kowatsch T, Otto L, Harperink S, Cotti A, Schlieter H. A design and evaluation framework for digital health interventions. Inf Technol 2019;61(5-6):253-263 [FREE Full text] [doi: 10.1515/itit-2019-0019]"
    },
    {
      "title": "Lancet Physical Activity Series 2 Executive Committee. Scaling up physical activity interventions worldwide: stepping up to larger and smarter approaches to get people moving",
      "authors": [
        "R Reis",
        "D Salvo",
        "D Ogilvie",
        "E Lambert",
        "S Goenka",
        "R Brownson"
      ],
      "year": 2016,
      "doi": "10.1016/s0140-6736(16)30728-0",
      "journal": "Lancet",
      "volume": "388",
      "issue": "10051",
      "raw": "Lancet Physical Activity Series 2 Executive Committee. Scaling up physical activity interventions worldwide: stepping up to larger and smarter approaches to get people moving \n\t\t \n\t\t\t R S Reis \n\t\t \n\t\t \n\t\t\t D Salvo \n\t\t \n\t\t \n\t\t\t D Ogilvie \n\t\t \n\t\t \n\t\t\t E V Lambert \n\t\t \n\t\t \n\t\t\t S Goenka \n\t\t \n\t\t \n\t\t\t R C Brownson \n\t\t \n\t\t 10.1016/s0140-6736(16)30728-0 \n\t\t Medline: 27475273 \n\t \n\t \n\t\t Lancet \n\t\t \n\t\t\t 388 \n\t\t\t 10051 \n\t\t\t \n\t\t\t 2016 Sep 24 \n\t\t \n\t \n\t FREE Full text \n\t Reis RS, Salvo D, Ogilvie D, Lambert EV, Goenka S, Brownson RC, Lancet Physical Activity Series 2 Executive Committee. Scaling up physical activity interventions worldwide: stepping up to larger and smarter approaches to get people moving. Lancet 2016 Sep 24;388(10051):1337-1348 [FREE Full text] [doi: 10.1016/S0140-6736(16)30728-0] [Medline: 27475273]"
    },
    {
      "title": "Healthy ageing through internet counselling in the elderly (HATICE): a multinational, randomised controlled trial",
      "authors": [
        "E Richard",
        "E Van Charante",
        "M Hoevenaar-Blom",
        "N Coley",
        "M Barbera",
        "A Van Der Groep"
      ],
      "year": 2019,
      "doi": "10.1016/s2589-7500(19)30153-0",
      "journal": "Lancet Digit Health",
      "volume": "1",
      "issue": "8",
      "raw": "Healthy ageing through internet counselling in the elderly (HATICE): a multinational, randomised controlled trial \n\t\t \n\t\t\t E Richard \n\t\t \n\t\t \n\t\t\t E P Van Charante \n\t\t \n\t\t \n\t\t\t M P Hoevenaar-Blom \n\t\t \n\t\t \n\t\t\t N Coley \n\t\t \n\t\t \n\t\t\t M Barbera \n\t\t \n\t\t \n\t\t\t A Van Der Groep \n\t\t \n\t\t 10.1016/s2589-7500(19)30153-0 \n\t \n\t \n\t\t Lancet Digit Health \n\t\t \n\t\t\t 1 \n\t\t\t 8 \n\t\t\t \n\t\t\t 2019 Dec \n\t\t \n\t \n\t Richard E, van Charante EP, Hoevenaar-Blom MP, Coley N, Barbera M, van der Groep A, et al. Healthy ageing through internet counselling in the elderly (HATICE): a multinational, randomised controlled trial. Lancet Digit Health 2019 Dec;1(8):424-434. [doi: 10.1016/s2589-7500(19)30153-0]"
    },
    {
      "title": "The impact of digital technology on psychological treatments and their dissemination",
      "authors": [
        "C Fairburn",
        "V Patel"
      ],
      "year": 2017,
      "doi": "10.1016/j.brat.2016.08.012",
      "journal": "Behav Res Ther",
      "volume": "88",
      "raw": "The impact of digital technology on psychological treatments and their dissemination \n\t\t \n\t\t\t C G Fairburn \n\t\t \n\t\t \n\t\t\t V Patel \n\t\t \n\t\t 10.1016/j.brat.2016.08.012 \n\t\t Medline: 28110672 \n\t \n\t \n\t\t Behav Res Ther \n\t\t \n\t\t\t 88 \n\t\t\t \n\t\t\t 2017 Jan \n\t\t \n\t \n\t FREE Full text \n\t Fairburn CG, Patel V. The impact of digital technology on psychological treatments and their dissemination. Behav Res Ther 2017 Jan;88:19-25 [FREE Full text] [doi: 10.1016/j.brat.2016.08.012] [Medline: 28110672]"
    },
    {
      "title": "NHS Diabetes Prevention Programme -digital stream",
      "year": 2016,
      "doi": "10.1136/bmj.i1669",
      "raw": "NHS Diabetes Prevention Programme -digital stream \n\t\t 10.1136/bmj.i1669 \n\t\t \n\t\t \n\t\t\t 2016. 2020-06-03 \n\t\t\t NHS England \n\t\t \n\t \n\t NHS Diabetes Prevention Programme -digital stream. NHS England. 2016. URL: https://tinyurl.com/u58h67ry [accessed 2020-06-03]"
    },
    {
      "title": "Engagement and nonusage attrition with a free physical activity promotion program: the case of 10,000 steps Australia",
      "authors": [
        "D Guertler",
        "C Vandelanotte",
        "M Kirwan",
        "M Duncan"
      ],
      "year": 2015,
      "doi": "10.2196/jmir.4339",
      "journal": "J Med Internet Res",
      "volume": "17",
      "issue": "7",
      "pages": "e176",
      "raw": "Engagement and nonusage attrition with a free physical activity promotion program: the case of 10,000 steps Australia \n\t\t \n\t\t\t D Guertler \n\t\t \n\t\t \n\t\t\t C Vandelanotte \n\t\t \n\t\t \n\t\t\t M Kirwan \n\t\t \n\t\t \n\t\t\t M J Duncan \n\t\t \n\t\t 10.2196/jmir.4339 \n\t\t Medline: 26180040 \n\t \n\t \n\t\t J Med Internet Res \n\t\t \n\t\t\t 17 \n\t\t\t 7 \n\t\t\t e176 \n\t\t\t 2015 Jul 15 \n\t\t \n\t \n\t FREE Full text \n\t Guertler D, Vandelanotte C, Kirwan M, Duncan MJ. Engagement and nonusage attrition with a free physical activity promotion program: the case of 10,000 steps Australia. J Med Internet Res 2015 Jul 15;17(7):e176 [FREE Full text] [doi: 10.2196/jmir.4339] [Medline: 26180040]"
    },
    {
      "title": "Bright spots, physical activity investments that work: National Steps Challenge, Singapore: a nationwide mHealth physical activity programme",
      "authors": [
        "J Yao",
        "C Tan",
        "C Chen",
        "J Tan",
        "N Lim",
        "F M\u00fcller-Riemenschneider"
      ],
      "year": 2020,
      "doi": "10.1136/bjsports-2019-101662",
      "journal": "Br J Sports Med",
      "volume": "54",
      "issue": "17",
      "raw": "Bright spots, physical activity investments that work: National Steps Challenge, Singapore: a nationwide mHealth physical activity programme \n\t\t \n\t\t\t J Yao \n\t\t \n\t\t \n\t\t\t C S Tan \n\t\t \n\t\t \n\t\t\t C Chen \n\t\t \n\t\t \n\t\t\t J Tan \n\t\t \n\t\t \n\t\t\t N Lim \n\t\t \n\t\t \n\t\t\t F M\u00fcller-Riemenschneider \n\t\t \n\t\t 10.1136/bjsports-2019-101662 \n\t\t Medline: 31857340 \n\t \n\t \n\t\t Br J Sports Med \n\t\t \n\t\t\t 54 \n\t\t\t 17 \n\t\t\t \n\t\t\t 2020 Sep \n\t\t \n\t \n\t Yao J, Tan CS, Chen C, Tan J, Lim N, M\u00fcller-Riemenschneider F. Bright spots, physical activity investments that work: National Steps Challenge, Singapore: a nationwide mHealth physical activity programme. Br J Sports Med 2020 Sep;54(17):1047-1048. [doi: 10.1136/bjsports-2019-101662] [Medline: 31857340]"
    },
    {
      "title": "Fitbit collaborates with Singapore's Health Promotion Board on population-based public health initiative in Singapore",
      "year": 2019,
      "raw": "Fitbit collaborates with Singapore's Health Promotion Board on population-based public health initiative in Singapore \n\t\t \n\t\t\t Fitbit Press Release \n\t\t\t 2019. 2020-07-01 \n\t\t \n\t\t \n\t\t\t Health-Promotion-Board-on-Population-Based-Public-Health-Initiative \n\t\t \n\t \n\t Fitbit collaborates with Singapore's Health Promotion Board on population-based public health initiative in Singapore. Fitbit Press Release. 2019. URL: https://investor.fitbit.com/press/press-releases/press-release-details/2019/ Fitbit-Collaborates-with-Singapores-Health-Promotion-Board-on-Population-Based-Public-Health-Initiative-in-Singapore/ default.aspx [accessed 2020-07-01]"
    },
    {
      "title": "Wearable technology and lifestyle management: the fight against obesity and diabetes",
      "authors": [
        "The Lancet",
        "Digital Health"
      ],
      "year": 2019,
      "doi": "10.1016/S2589-7500(19)30135-9",
      "journal": "Lancet Digit Health",
      "volume": "1",
      "issue": "6",
      "pages": "243",
      "raw": "Wearable technology and lifestyle management: the fight against obesity and diabetes \n\t\t \n\t\t\t The Lancet \n\t\t \n\t\t \n\t\t\t Digital Health \n\t\t \n\t\t 10.1016/S2589-7500(19)30135-9 \n\t\t Medline: 33323244 \n\t \n\t \n\t\t Lancet Digit Health \n\t\t \n\t\t\t 1 \n\t\t\t 6 \n\t\t\t 243 \n\t\t\t 2019 Oct \n\t\t \n\t \n\t FREE Full text \n\t The Lancet Digital Health. Wearable technology and lifestyle management: the fight against obesity and diabetes. Lancet Digit Health 2019 Oct;1(6):e243 [FREE Full text] [doi: 10.1016/S2589-7500(19)30135-9] [Medline: 33323244]"
    },
    {
      "title": "What is the clinical value of mHealth for patients?",
      "authors": [
        "S Rowland",
        "J Fitzgerald",
        "T Holme",
        "J Powell",
        "A Mcgregor"
      ],
      "year": 2020,
      "doi": "10.1038/s41746-019-0206-x",
      "journal": "NPJ Digit Med",
      "volume": "3",
      "issue": "4",
      "raw": "What is the clinical value of mHealth for patients? \n\t\t \n\t\t\t S P Rowland \n\t\t \n\t\t \n\t\t\t J E Fitzgerald \n\t\t \n\t\t \n\t\t\t T Holme \n\t\t \n\t\t \n\t\t\t J Powell \n\t\t \n\t\t \n\t\t\t A Mcgregor \n\t\t \n\t\t 10.1038/s41746-019-0206-x \n\t\t Medline: 31970289 \n\t \n\t \n\t\t NPJ Digit Med \n\t\t \n\t\t\t 3 \n\t\t\t 4 \n\t\t\t 2020 \n\t\t \n\t \n\t FREE Full text \n\t Rowland SP, Fitzgerald JE, Holme T, Powell J, McGregor A. What is the clinical value of mHealth for patients? NPJ Digit Med 2020;3:4 [FREE Full text] [doi: 10.1038/s41746-019-0206-x] [Medline: 31970289]"
    },
    {
      "title": "Using pedometers to increase physical activity and improve health: a systematic review",
      "authors": [
        "D Bravata",
        "C Smith-Spangler",
        "V Sundaram",
        "A Gienger",
        "Lin Lewis"
      ],
      "year": 2007,
      "doi": "10.1001/jama.298.19.2296",
      "journal": "J Am Med Assoc",
      "volume": "298",
      "issue": "19",
      "raw": "Using pedometers to increase physical activity and improve health: a systematic review \n\t\t \n\t\t\t D M Bravata \n\t\t \n\t\t \n\t\t\t C Smith-Spangler \n\t\t \n\t\t \n\t\t\t V Sundaram \n\t\t \n\t\t \n\t\t\t A L Gienger \n\t\t \n\t\t \n\t\t\t Lin N Lewis \n\t\t \n\t\t \n\t\t\t R \n\t\t \n\t\t 10.1001/jama.298.19.2296 \n\t\t Medline: 18029834 \n\t \n\t \n\t\t J Am Med Assoc \n\t\t \n\t\t\t 298 \n\t\t\t 19 \n\t\t\t \n\t\t\t 2007 Nov 21 \n\t\t \n\t \n\t Bravata DM, Smith-Spangler C, Sundaram V, Gienger AL, Lin N, Lewis R, et al. Using pedometers to increase physical activity and improve health: a systematic review. J Am Med Assoc 2007 Nov 21;298(19):2296-2304. [doi: 10.1001/jama.298.19.2296] [Medline: 18029834]"
    },
    {
      "title": "Consumer-based wearable activity trackers increase physical activity participation: systematic review and meta-analysis",
      "authors": [
        "K Brickwood",
        "G Watson",
        "O 'brien",
        "J Williams"
      ],
      "year": 2019,
      "doi": "10.2196/11819",
      "journal": "JMIR Mhealth Uhealth",
      "volume": "7",
      "issue": "4",
      "pages": "11819",
      "raw": "Consumer-based wearable activity trackers increase physical activity participation: systematic review and meta-analysis \n\t\t \n\t\t\t K J Brickwood \n\t\t \n\t\t \n\t\t\t G Watson \n\t\t \n\t\t \n\t\t\t O 'brien \n\t\t \n\t\t \n\t\t\t J Williams \n\t\t \n\t\t \n\t\t\t A D \n\t\t \n\t\t 10.2196/11819 \n\t\t Medline: 30977740 \n\t \n\t \n\t\t JMIR Mhealth Uhealth \n\t\t \n\t\t\t 7 \n\t\t\t 4 \n\t\t\t 11819 \n\t\t\t 2019 Apr 12 \n\t\t \n\t \n\t FREE Full text \n\t Brickwood KJ, Watson G, O'Brien J, Williams AD. Consumer-based wearable activity trackers increase physical activity participation: systematic review and meta-analysis. JMIR Mhealth Uhealth 2019 Apr 12;7(4):11819 [FREE Full text] [doi: 10.2196/11819] [Medline: 30977740]"
    },
    {
      "title": "The effects of step-count monitoring interventions on physical activity: systematic review and meta-analysis of community-based randomised controlled trials in adults",
      "authors": [
        "U Chaudhry",
        "C Wahlich",
        "R Fortescue",
        "D Cook",
        "R Knightly",
        "T Harris"
      ],
      "year": 2020,
      "doi": "10.1186/s12966-020-01020-8",
      "journal": "Int J Behav Nutr Phys Act",
      "volume": "17",
      "issue": "1",
      "pages": "129",
      "raw": "The effects of step-count monitoring interventions on physical activity: systematic review and meta-analysis of community-based randomised controlled trials in adults \n\t\t \n\t\t\t U A Chaudhry \n\t\t \n\t\t \n\t\t\t C Wahlich \n\t\t \n\t\t \n\t\t\t R Fortescue \n\t\t \n\t\t \n\t\t\t D G Cook \n\t\t \n\t\t \n\t\t\t R Knightly \n\t\t \n\t\t \n\t\t\t T Harris \n\t\t \n\t\t 10.1186/s12966-020-01020-8 \n\t\t Medline: 33036635 \n\t \n\t \n\t\t Int J Behav Nutr Phys Act \n\t\t \n\t\t\t 17 \n\t\t\t 1 \n\t\t\t 129 \n\t\t\t 2020 Oct 09 \n\t\t \n\t \n\t FREE Full text \n\t Chaudhry UA, Wahlich C, Fortescue R, Cook DG, Knightly R, Harris T. The effects of step-count monitoring interventions on physical activity: systematic review and meta-analysis of community-based randomised controlled trials in adults. Int J Behav Nutr Phys Act 2020 Oct 09;17(1):129 [FREE Full text] [doi: 10.1186/s12966-020-01020-8] [Medline: 33036635]"
    },
    {
      "title": "Do activity monitors increase physical activity in adults with overweight or obesity? A systematic review and meta-analysis",
      "authors": [
        "De Vries",
        "H Kooiman",
        "T Van Ittersum",
        "Van Brussel",
        "De Groot"
      ],
      "year": 2016,
      "doi": "10.1002/oby.21619",
      "journal": "Obesity",
      "volume": "24",
      "issue": "10",
      "raw": "Do activity monitors increase physical activity in adults with overweight or obesity? A systematic review and meta-analysis \n\t\t \n\t\t\t De Vries \n\t\t \n\t\t \n\t\t\t H J Kooiman \n\t\t \n\t\t \n\t\t\t T J Van Ittersum \n\t\t \n\t\t \n\t\t\t M W \n\t\t \n\t\t \n\t\t\t Van Brussel \n\t\t \n\t\t \n\t\t\t M \n\t\t \n\t\t \n\t\t\t De Groot \n\t\t \n\t\t \n\t\t\t M \n\t\t \n\t\t 10.1002/oby.21619 \n\t\t Medline: 27670401 \n\t \n\t \n\t\t Obesity \n\t\t \n\t\t\t 24 \n\t\t\t 10 \n\t\t\t \n\t\t\t 2016 Oct \n\t\t\t Silver Spring \n\t\t \n\t \n\t FREE Full text \n\t De Vries HJ, Kooiman TJ, Van Ittersum MW, Van Brussel M, De Groot M. Do activity monitors increase physical activity in adults with overweight or obesity? A systematic review and meta-analysis. Obesity (Silver Spring) 2016 Oct;24(10):2078-2091 [FREE Full text] [doi: 10.1002/oby.21619] [Medline: 27670401]"
    },
    {
      "title": "Can consumer wearable activity tracker-based interventions improve physical activity and cardiometabolic health in patients with chronic diseases? A systematic review and meta-analysis of randomised controlled trials",
      "authors": [
        "W Franssen",
        "G Franssen",
        "J Spaas",
        "F Solmi",
        "B Eijnde"
      ],
      "year": 2020,
      "doi": "10.1186/s12966-020-00955-2",
      "journal": "Int J Behav Nutr Phys Act",
      "volume": "17",
      "issue": "1",
      "pages": "57",
      "raw": "Can consumer wearable activity tracker-based interventions improve physical activity and cardiometabolic health in patients with chronic diseases? A systematic review and meta-analysis of randomised controlled trials \n\t\t \n\t\t\t W M Franssen \n\t\t \n\t\t \n\t\t\t G H Franssen \n\t\t \n\t\t \n\t\t\t J Spaas \n\t\t \n\t\t \n\t\t\t F Solmi \n\t\t \n\t\t \n\t\t\t B O Eijnde \n\t\t \n\t\t 10.1186/s12966-020-00955-2 \n\t\t Medline: 32393357 \n\t \n\t \n\t\t Int J Behav Nutr Phys Act \n\t\t \n\t\t\t 17 \n\t\t\t 1 \n\t\t\t 57 \n\t\t\t 2020 May 11 \n\t\t \n\t \n\t FREE Full text \n\t Franssen WM, Franssen GH, Spaas J, Solmi F, Eijnde BO. Can consumer wearable activity tracker-based interventions improve physical activity and cardiometabolic health in patients with chronic diseases? A systematic review and meta-analysis of randomised controlled trials. Int J Behav Nutr Phys Act 2020 May 11;17(1):57 [FREE Full text] [doi: 10.1186/s12966-020-00955-2] [Medline: 32393357]"
    },
    {
      "title": "The effect of physical activity interventions comprising wearables and smartphone applications on physical activity: a systematic review and meta-analysis",
      "authors": [
        "R Gal",
        "A May",
        "E Van Overmeeren",
        "M Simons",
        "E Monninkhof"
      ],
      "year": 2018,
      "doi": "10.1186/s40798-018-0157-9",
      "journal": "Sports Med Open",
      "volume": "4",
      "issue": "1",
      "pages": "42",
      "raw": "The effect of physical activity interventions comprising wearables and smartphone applications on physical activity: a systematic review and meta-analysis \n\t\t \n\t\t\t R Gal \n\t\t \n\t\t \n\t\t\t A M May \n\t\t \n\t\t \n\t\t\t E J Van Overmeeren \n\t\t \n\t\t \n\t\t\t M Simons \n\t\t \n\t\t \n\t\t\t E M Monninkhof \n\t\t \n\t\t 10.1186/s40798-018-0157-9 \n\t\t Medline: 30178072 \n\t \n\t \n\t\t Sports Med Open \n\t\t \n\t\t\t 4 \n\t\t\t 1 \n\t\t\t 42 \n\t\t\t 2018 Sep 03 \n\t\t \n\t \n\t FREE Full text \n\t Gal R, May AM, van Overmeeren EJ, Simons M, Monninkhof EM. The effect of physical activity interventions comprising wearables and smartphone applications on physical activity: a systematic review and meta-analysis. Sports Med Open 2018 Sep 03;4(1):42 [FREE Full text] [doi: 10.1186/s40798-018-0157-9] [Medline: 30178072]"
    },
    {
      "title": "Accelerometer-and pedometer-based physical activity interventions among adults with cardiometabolic conditions: a systematic review and meta-analysis",
      "authors": [
        "A Hodkinson",
        "E Kontopantelis",
        "C Adeniji",
        "H Van Marwijk",
        "B Mcmillan",
        "P Bower"
      ],
      "year": 2019,
      "doi": "10.1001/jamanetworkopen.2019.12895",
      "journal": "JAMA Netw Open",
      "volume": "2",
      "issue": "10",
      "pages": "e1912895",
      "raw": "Accelerometer-and pedometer-based physical activity interventions among adults with cardiometabolic conditions: a systematic review and meta-analysis \n\t\t \n\t\t\t A Hodkinson \n\t\t \n\t\t \n\t\t\t E Kontopantelis \n\t\t \n\t\t \n\t\t\t C Adeniji \n\t\t \n\t\t \n\t\t\t H Van Marwijk \n\t\t \n\t\t \n\t\t\t B Mcmillan \n\t\t \n\t\t \n\t\t\t P Bower \n\t\t \n\t\t 10.1001/jamanetworkopen.2019.12895 \n\t\t Medline: 31596494 \n\t \n\t \n\t\t JAMA Netw Open \n\t\t \n\t\t\t 2 \n\t\t\t 10 \n\t\t\t e1912895 \n\t\t\t 2019 Oct 02 \n\t\t \n\t \n\t FREE Full text \n\t Hodkinson A, Kontopantelis E, Adeniji C, van Marwijk H, McMillan B, Bower P, et al. Accelerometer-and pedometer-based physical activity interventions among adults with cardiometabolic conditions: a systematic review and meta-analysis. JAMA Netw Open 2019 Oct 02;2(10):e1912895 [FREE Full text] [doi: 10.1001/jamanetworkopen.2019.12895] [Medline: 31596494]"
    },
    {
      "title": "Wearable technology and physical activity behavior change in adults with chronic cardiometabolic disease: a systematic review and meta-analysis",
      "authors": [
        "M Kirk",
        "M Amiri",
        "M Pirbaglou",
        "P Ritvo"
      ],
      "year": 2019,
      "doi": "10.1177/0890117118816278",
      "journal": "Am J Health Promot",
      "volume": "33",
      "issue": "5",
      "raw": "Wearable technology and physical activity behavior change in adults with chronic cardiometabolic disease: a systematic review and meta-analysis \n\t\t \n\t\t\t M A Kirk \n\t\t \n\t\t \n\t\t\t M Amiri \n\t\t \n\t\t \n\t\t\t M Pirbaglou \n\t\t \n\t\t \n\t\t\t P Ritvo \n\t\t \n\t\t 10.1177/0890117118816278 \n\t\t Medline: 30586996 \n\t \n\t \n\t\t Am J Health Promot \n\t\t \n\t\t\t 33 \n\t\t\t 5 \n\t\t\t \n\t\t\t 2019 Jun \n\t\t \n\t \n\t Kirk MA, Amiri M, Pirbaglou M, Ritvo P. Wearable technology and physical activity behavior change in adults with chronic cardiometabolic disease: a systematic review and meta-analysis. Am J Health Promot 2019 Jun;33(5):778-791. [doi: 10.1177/0890117118816278] [Medline: 30586996]"
    },
    {
      "title": "Step counter use in type 2 diabetes: a meta-analysis of randomized controlled trials",
      "authors": [
        "S Qiu",
        "X Cai",
        "X Chen",
        "B Yang",
        "Z Sun"
      ],
      "year": 2014,
      "doi": "10.1186/1741-7015-12-36",
      "journal": "BMC Med",
      "volume": "12",
      "pages": "36",
      "raw": "Step counter use in type 2 diabetes: a meta-analysis of randomized controlled trials \n\t\t \n\t\t\t S Qiu \n\t\t \n\t\t \n\t\t\t X Cai \n\t\t \n\t\t \n\t\t\t X Chen \n\t\t \n\t\t \n\t\t\t B Yang \n\t\t \n\t\t \n\t\t\t Z Sun \n\t\t \n\t\t 10.1186/1741-7015-12-36 \n\t\t Medline: 24571580 \n\t \n\t \n\t\t BMC Med \n\t\t \n\t\t\t 12 \n\t\t\t 36 \n\t\t\t 2014 Feb 27 \n\t\t \n\t \n\t FREE Full text \n\t Qiu S, Cai X, Chen X, Yang B, Sun Z. Step counter use in type 2 diabetes: a meta-analysis of randomized controlled trials. BMC Med 2014 Feb 27;12:36 [FREE Full text] [doi: 10.1186/1741-7015-12-36] [Medline: 24571580]"
    },
    {
      "title": "Text message interventions for physical activity: a systematic review and meta-analysis",
      "authors": [
        "D Smith",
        "L Duque",
        "J Huffman",
        "B Healy",
        "C Celano"
      ],
      "year": 2020,
      "doi": "10.1016/j.amepre.2019.08.014",
      "journal": "Am J Prev Med",
      "volume": "58",
      "issue": "1",
      "raw": "Text message interventions for physical activity: a systematic review and meta-analysis \n\t\t \n\t\t\t D M Smith \n\t\t \n\t\t \n\t\t\t L Duque \n\t\t \n\t\t \n\t\t\t J C Huffman \n\t\t \n\t\t \n\t\t\t B C Healy \n\t\t \n\t\t \n\t\t\t C M Celano \n\t\t \n\t\t 10.1016/j.amepre.2019.08.014 \n\t\t Medline: 31759805 \n\t \n\t \n\t\t Am J Prev Med \n\t\t \n\t\t\t 58 \n\t\t\t 1 \n\t\t\t \n\t\t\t 2020 Jan \n\t\t \n\t \n\t FREE Full text \n\t Smith DM, Duque L, Huffman JC, Healy BC, Celano CM. Text message interventions for physical activity: a systematic review and meta-analysis. Am J Prev Med 2020 Jan;58(1):142-151 [FREE Full text] [doi: 10.1016/j.amepre.2019.08.014] [Medline: 31759805]"
    },
    {
      "title": "Effect of 'activity monitor-based' counseling on physical activity and health-related outcomes in patients with chronic diseases: a systematic review and meta-analysis",
      "authors": [
        "A Vaes",
        "A Cheung",
        "M Atakhorrami",
        "M Groenen",
        "O Amft",
        "F Franssen"
      ],
      "year": 2013,
      "doi": "10.3109/07853890.2013.810891",
      "journal": "Ann Med",
      "volume": "45",
      "issue": "5-6",
      "raw": "Effect of 'activity monitor-based' counseling on physical activity and health-related outcomes in patients with chronic diseases: a systematic review and meta-analysis \n\t\t \n\t\t\t A W Vaes \n\t\t \n\t\t \n\t\t\t A Cheung \n\t\t \n\t\t \n\t\t\t M Atakhorrami \n\t\t \n\t\t \n\t\t\t M T Groenen \n\t\t \n\t\t \n\t\t\t O Amft \n\t\t \n\t\t \n\t\t\t F M Franssen \n\t\t \n\t\t 10.3109/07853890.2013.810891 \n\t\t Medline: 23952917 \n\t \n\t \n\t\t Ann Med \n\t\t \n\t\t\t 45 \n\t\t\t 5-6 \n\t\t\t \n\t\t\t 2013 Sep \n\t\t \n\t \n\t Vaes AW, Cheung A, Atakhorrami M, Groenen MT, Amft O, Franssen FM, et al. Effect of 'activity monitor-based' counseling on physical activity and health-related outcomes in patients with chronic diseases: a systematic review and meta-analysis. Ann Med 2013 Sep;45(5-6):397-412. [doi: 10.3109/07853890.2013.810891] [Medline: 23952917]"
    },
    {
      "title": "mHealth technologies to influence physical activity and sedentary behaviors: behavior change techniques, systematic review and meta-analysis of randomized controlled trials",
      "authors": [
        "A Direito",
        "E Carra\u00e7a",
        "J Rawstorn",
        "R Whittaker",
        "R Maddison"
      ],
      "year": 2017,
      "doi": "10.1007/s12160-016-9846-0",
      "journal": "Ann Behav Med",
      "volume": "51",
      "issue": "2",
      "raw": "mHealth technologies to influence physical activity and sedentary behaviors: behavior change techniques, systematic review and meta-analysis of randomized controlled trials \n\t\t \n\t\t\t A Direito \n\t\t \n\t\t \n\t\t\t E Carra\u00e7a \n\t\t \n\t\t \n\t\t\t J Rawstorn \n\t\t \n\t\t \n\t\t\t R Whittaker \n\t\t \n\t\t \n\t\t\t R Maddison \n\t\t \n\t\t 10.1007/s12160-016-9846-0 \n\t\t Medline: 27757789 \n\t \n\t \n\t\t Ann Behav Med \n\t\t \n\t\t\t 51 \n\t\t\t 2 \n\t\t\t \n\t\t\t 2017 Apr \n\t\t \n\t \n\t Direito A, Carra\u00e7a E, Rawstorn J, Whittaker R, Maddison R. mHealth technologies to influence physical activity and sedentary behaviors: behavior change techniques, systematic review and meta-analysis of randomized controlled trials. Ann Behav Med 2017 Apr;51(2):226-239. [doi: 10.1007/s12160-016-9846-0] [Medline: 27757789]"
    },
    {
      "title": "Can smartphone apps increase physical activity? Systematic review and meta-analysis",
      "authors": [
        "A Romeo",
        "S Edney",
        "R Plotnikoff",
        "R Curtis",
        "J Ryan",
        "I Sanders"
      ],
      "year": 2019,
      "doi": "10.2196/12053",
      "journal": "J Med Internet Res",
      "volume": "21",
      "issue": "3",
      "pages": "12053",
      "raw": "Can smartphone apps increase physical activity? Systematic review and meta-analysis \n\t\t \n\t\t\t A Romeo \n\t\t \n\t\t \n\t\t\t S Edney \n\t\t \n\t\t \n\t\t\t R Plotnikoff \n\t\t \n\t\t \n\t\t\t R Curtis \n\t\t \n\t\t \n\t\t\t J Ryan \n\t\t \n\t\t \n\t\t\t I Sanders \n\t\t \n\t\t 10.2196/12053 \n\t\t Medline: 30888321 \n\t \n\t \n\t\t J Med Internet Res \n\t\t \n\t\t\t 21 \n\t\t\t 3 \n\t\t\t 12053 \n\t\t\t 2019 Mar 19 \n\t\t \n\t \n\t FREE Full text \n\t Romeo A, Edney S, Plotnikoff R, Curtis R, Ryan J, Sanders I, et al. Can smartphone apps increase physical activity? Systematic review and meta-analysis. J Med Internet Res 2019 Mar 19;21(3):12053 [FREE Full text] [doi: 10.2196/12053] [Medline: 30888321]"
    },
    {
      "title": "Effects of mobile health app interventions on sedentary time, physical activity, and fitness in older adults: systematic review and meta-analysis",
      "authors": [
        "D Yerrakalva",
        "D Yerrakalva",
        "S Hajna",
        "S Griffin"
      ],
      "year": 2019,
      "doi": "10.2196/14343",
      "journal": "J Med Internet Res",
      "volume": "21",
      "issue": "11",
      "pages": "14343",
      "raw": "Effects of mobile health app interventions on sedentary time, physical activity, and fitness in older adults: systematic review and meta-analysis \n\t\t \n\t\t\t D Yerrakalva \n\t\t \n\t\t \n\t\t\t D Yerrakalva \n\t\t \n\t\t \n\t\t\t S Hajna \n\t\t \n\t\t \n\t\t\t S Griffin \n\t\t \n\t\t 10.2196/14343 \n\t\t Medline: 31778121 \n\t \n\t \n\t\t J Med Internet Res \n\t\t \n\t\t\t 21 \n\t\t\t 11 \n\t\t\t 14343 \n\t\t\t 2019 Nov 28 \n\t\t \n\t \n\t FREE Full text \n\t Yerrakalva D, Yerrakalva D, Hajna S, Griffin S. Effects of mobile health app interventions on sedentary time, physical activity, and fitness in older adults: systematic review and meta-analysis. J Med Internet Res 2019 Nov 28;21(11):14343 [FREE Full text] [doi: 10.2196/14343] [Medline: 31778121]"
    },
    {
      "title": "Efficacy of interventions that use apps to improve diet, physical activity and sedentary behaviour: a systematic review",
      "authors": [
        "S Schoeppe",
        "S Alley",
        "W Van Lippevelde",
        "N Bray",
        "S Williams",
        "M Duncan"
      ],
      "year": 2016,
      "doi": "10.1186/s12966-016-0454-y",
      "journal": "Int J Behav Nutr Phys Act",
      "volume": "13",
      "issue": "1",
      "pages": "127",
      "raw": "Efficacy of interventions that use apps to improve diet, physical activity and sedentary behaviour: a systematic review \n\t\t \n\t\t\t S Schoeppe \n\t\t \n\t\t \n\t\t\t S Alley \n\t\t \n\t\t \n\t\t\t W Van Lippevelde \n\t\t \n\t\t \n\t\t\t N A Bray \n\t\t \n\t\t \n\t\t\t S L Williams \n\t\t \n\t\t \n\t\t\t M J Duncan \n\t\t \n\t\t 10.1186/s12966-016-0454-y \n\t\t Medline: 27927218 \n\t \n\t \n\t\t Int J Behav Nutr Phys Act \n\t\t \n\t\t\t 13 \n\t\t\t 1 \n\t\t\t 127 \n\t\t\t 2016 Dec 07 \n\t\t \n\t \n\t FREE Full text \n\t Schoeppe S, Alley S, Van Lippevelde W, Bray NA, Williams SL, Duncan MJ, et al. Efficacy of interventions that use apps to improve diet, physical activity and sedentary behaviour: a systematic review. Int J Behav Nutr Phys Act 2016 Dec 07;13(1):127 [FREE Full text] [doi: 10.1186/s12966-016-0454-y] [Medline: 27927218]"
    },
    {
      "title": "Cochrane Handbook for Systematic Reviews of Interventions: Cochrane Book Series",
      "authors": [
        "J Higgins",
        "S Green"
      ],
      "year": 2008,
      "doi": "10.1002/9780470712184",
      "raw": "Cochrane Handbook for Systematic Reviews of Interventions: Cochrane Book Series \n\t\t \n\t\t\t J P Higgins \n\t\t \n\t\t \n\t\t\t S Green \n\t\t \n\t\t 10.1002/9780470712184 \n\t\t \n\t\t\t 2008 \n\t\t\t John Wiley & Sons Inc \n\t\t\t \n\t\t\t Hoboken, New Jersey, United States \n\t\t \n\t \n\t Higgins JP, Green S. Cochrane Handbook for Systematic Reviews of Interventions: Cochrane Book Series. Hoboken, New Jersey, United States: John Wiley & Sons Inc; 2008:1-649."
    },
    {
      "title": "The Cochrane Collaboration's tool for assessing risk of bias in randomised trials",
      "authors": [
        "J Higgins",
        "D Altman",
        "P G\u00f8tzsche",
        "P J\u00fcni",
        "D Moher",
        "A Oxman",
        "Cochrane Bias",
        "Methods Group"
      ],
      "year": 2011,
      "doi": "10.1136/bmj.d5928",
      "journal": "Br Med J",
      "volume": "343",
      "pages": "5928",
      "raw": "The Cochrane Collaboration's tool for assessing risk of bias in randomised trials \n\t\t \n\t\t\t J P Higgins \n\t\t\t \n\t\t\t\t Cochrane Statistical Methods Group \n\t\t\t \n\t\t \n\t\t \n\t\t\t D G Altman \n\t\t\t \n\t\t\t\t Cochrane Statistical Methods Group \n\t\t\t \n\t\t \n\t\t \n\t\t\t P C G\u00f8tzsche \n\t\t\t \n\t\t\t\t Cochrane Statistical Methods Group \n\t\t\t \n\t\t \n\t\t \n\t\t\t P J\u00fcni \n\t\t\t \n\t\t\t\t Cochrane Statistical Methods Group \n\t\t\t \n\t\t \n\t\t \n\t\t\t D Moher \n\t\t\t \n\t\t\t\t Cochrane Statistical Methods Group \n\t\t\t \n\t\t \n\t\t \n\t\t\t A D Oxman \n\t\t\t \n\t\t\t\t Cochrane Statistical Methods Group \n\t\t\t \n\t\t \n\t\t \n\t\t\t Cochrane Bias \n\t\t\t \n\t\t\t\t Cochrane Statistical Methods Group \n\t\t\t \n\t\t \n\t\t \n\t\t\t Methods Group \n\t\t\t \n\t\t\t\t Cochrane Statistical Methods Group \n\t\t\t \n\t\t \n\t\t 10.1136/bmj.d5928 \n\t\t Medline: 22008217 \n\t \n\t \n\t\t Br Med J \n\t\t \n\t\t\t 343 \n\t\t\t 5928 \n\t\t\t 2011 Oct 18 \n\t\t \n\t \n\t FREE Full text \n\t Higgins JP, Altman DG, G\u00f8tzsche PC, J\u00fcni P, Moher D, Oxman AD, Cochrane Bias Methods Group, Cochrane Statistical Methods Group. The Cochrane Collaboration's tool for assessing risk of bias in randomised trials. Br Med J 2011 Oct 18;343:d5928 [FREE Full text] [doi: 10.1136/bmj.d5928] [Medline: 22008217]"
    },
    {
      "title": "Revised Cochrane risk of bias tool for randomized trials (RoB 2.0), additional considerations for cluster-randomized trials",
      "authors": [
        "S Eldridge",
        "M Campbell",
        "M Campbell",
        "A Dahota",
        "B Giraudeau",
        "J Higgins"
      ],
      "year": 2016,
      "raw": "S Eldridge \n\t\t \n\t\t \n\t\t\t M Campbell \n\t\t \n\t\t \n\t\t\t M Campbell \n\t\t \n\t\t \n\t\t\t A Dahota \n\t\t \n\t\t \n\t\t\t B Giraudeau \n\t\t \n\t\t \n\t\t\t J Higgins \n\t\t \n\t\t \n\t\t Revised Cochrane risk of bias tool for randomized trials (RoB 2.0), additional considerations for cluster-randomized trials \n\t\t \n\t\t\t 2016. 2020-07-01 \n\t\t \n\t \n\t Eldridge S, Campbell M, Campbell M, Dahota A, Giraudeau B, Higgins J, et al. Revised Cochrane risk of bias tool for randomized trials (RoB 2.0), additional considerations for cluster-randomized trials. 2016. URL: https://sites.google.com/ site/riskofbiastool/welcome/rob-2-0-tool/archive-rob-2-0-cluster-randomized-trials-2016 [accessed 2020-07-01]"
    },
    {
      "title": "Meta-analysis in clinical trials",
      "authors": [
        "R Dersimonian",
        "N Laird"
      ],
      "year": 1986,
      "doi": "10.1016/0197-2456(86)90046-2",
      "journal": "Control Clin Trials",
      "volume": "7",
      "issue": "3",
      "raw": "Meta-analysis in clinical trials \n\t\t \n\t\t\t R Dersimonian \n\t\t \n\t\t \n\t\t\t N Laird \n\t\t \n\t\t 10.1016/0197-2456(86)90046-2 \n\t\t Medline: 3802833 \n\t \n\t \n\t\t Control Clin Trials \n\t\t \n\t\t\t 7 \n\t\t\t 3 \n\t\t\t \n\t\t\t 1986 Sep \n\t\t \n\t \n\t DerSimonian R, Laird N. Meta-analysis in clinical trials. Control Clin Trials 1986 Sep;7(3):177-188. [doi: 10.1016/0197-2456(86)90046-2] [Medline: 3802833]"
    },
    {
      "title": "Interpretation of subgroup analyses in systematic reviews: a tutorial",
      "authors": [
        "M Richardson",
        "P Garner",
        "S Donegan"
      ],
      "year": 2019,
      "doi": "10.1016/j.cegh.2018.05.005",
      "journal": "Clin Epidemiol Glob Health",
      "volume": "7",
      "issue": "2",
      "raw": "Interpretation of subgroup analyses in systematic reviews: a tutorial \n\t\t \n\t\t\t M Richardson \n\t\t \n\t\t \n\t\t\t P Garner \n\t\t \n\t\t \n\t\t\t S Donegan \n\t\t \n\t\t 10.1016/j.cegh.2018.05.005 \n\t \n\t \n\t\t Clin Epidemiol Glob Health \n\t\t \n\t\t\t 7 \n\t\t\t 2 \n\t\t\t \n\t\t\t 2019 Jun \n\t\t \n\t \n\t Richardson M, Garner P, Donegan S. Interpretation of subgroup analyses in systematic reviews: a tutorial. Clin Epidemiol Glob Health 2019 Jun;7(2):192-198. [doi: 10.1016/j.cegh.2018.05.005]"
    },
    {
      "title": "Measuring inconsistency in meta-analyses",
      "authors": [
        "J Higgins",
        "S Thompson",
        "J Deeks",
        "D Altman"
      ],
      "year": 2003,
      "doi": "10.1136/bmj.327.7414.557",
      "journal": "Br Med J",
      "volume": "327",
      "issue": "7414",
      "raw": "Measuring inconsistency in meta-analyses \n\t\t \n\t\t\t J P Higgins \n\t\t \n\t\t \n\t\t\t S G Thompson \n\t\t \n\t\t \n\t\t\t J J Deeks \n\t\t \n\t\t \n\t\t\t D G Altman \n\t\t \n\t\t 10.1136/bmj.327.7414.557 \n\t\t Medline: 12958120 \n\t \n\t \n\t\t Br Med J \n\t\t \n\t\t\t 327 \n\t\t\t 7414 \n\t\t\t \n\t\t\t 2003 Sep 06 \n\t\t \n\t \n\t FREE Full text \n\t Higgins JP, Thompson SG, Deeks JJ, Altman DG. Measuring inconsistency in meta-analyses. Br Med J 2003 Sep 06;327(7414):557-560 [FREE Full text] [doi: 10.1136/bmj.327.7414.557] [Medline: 12958120]"
    },
    {
      "title": "GRADE guidelines: 1. Introduction-GRADE evidence profiles and summary of findings tables",
      "authors": [
        "G Guyatt",
        "A Oxman",
        "E Akl",
        "R Kunz",
        "G Vist",
        "J Brozek"
      ],
      "year": 2011,
      "doi": "10.1016/j.jclinepi.2010.04.026",
      "journal": "J Clin Epidemiol",
      "volume": "64",
      "issue": "4",
      "raw": "GRADE guidelines: 1. Introduction-GRADE evidence profiles and summary of findings tables \n\t\t \n\t\t\t G Guyatt \n\t\t \n\t\t \n\t\t\t A D Oxman \n\t\t \n\t\t \n\t\t\t E A Akl \n\t\t \n\t\t \n\t\t\t R Kunz \n\t\t \n\t\t \n\t\t\t G Vist \n\t\t \n\t\t \n\t\t\t J Brozek \n\t\t \n\t\t 10.1016/j.jclinepi.2010.04.026 \n\t\t Medline: 21195583 \n\t \n\t \n\t\t J Clin Epidemiol \n\t\t \n\t\t\t 64 \n\t\t\t 4 \n\t\t\t \n\t\t\t 2011 Apr \n\t\t \n\t \n\t Guyatt G, Oxman AD, Akl EA, Kunz R, Vist G, Brozek J, et al. GRADE guidelines: 1. Introduction-GRADE evidence profiles and summary of findings tables. J Clin Epidemiol 2011 Apr;64(4):383-394. [doi: 10.1016/j.jclinepi.2010.04.026] [Medline: 21195583]"
    },
    {
      "title": "Towards a physically more active lifestyle based on one's own values: the results of a randomized controlled trial among physically inactive adults",
      "authors": [
        "A Kangasniemi",
        "R Lappalainen",
        "A Kankaanp\u00e4\u00e4",
        "A Tolvanen",
        "T Tammelin"
      ],
      "year": 2015,
      "doi": "10.1186/s12889-015-1604-x",
      "journal": "BMC Public Health",
      "volume": "15",
      "pages": "260",
      "raw": "Towards a physically more active lifestyle based on one's own values: the results of a randomized controlled trial among physically inactive adults \n\t\t \n\t\t\t A M Kangasniemi \n\t\t \n\t\t \n\t\t\t R Lappalainen \n\t\t \n\t\t \n\t\t\t A Kankaanp\u00e4\u00e4 \n\t\t \n\t\t \n\t\t\t A Tolvanen \n\t\t \n\t\t \n\t\t\t T Tammelin \n\t\t \n\t\t 10.1186/s12889-015-1604-x \n\t\t Medline: 25848812 \n\t \n\t \n\t\t BMC Public Health \n\t\t \n\t\t\t 15 \n\t\t\t 260 \n\t\t\t 2015 Mar 18 \n\t\t \n\t \n\t FREE Full text \n\t Kangasniemi AM, Lappalainen R, Kankaanp\u00e4\u00e4 A, Tolvanen A, Tammelin T. Towards a physically more active lifestyle based on one's own values: the results of a randomized controlled trial among physically inactive adults. BMC Public Health 2015 Mar 18;15:260 [FREE Full text] [doi: 10.1186/s12889-015-1604-x] [Medline: 25848812]"
    },
    {
      "title": "Promoting walking among office employeesevaluation of a randomized controlled intervention with pedometers and e-mail messages",
      "authors": [
        "M Aittasalo",
        "M Rinne",
        "M Pasanen",
        "K Kukkonen-Harjula",
        "T Vasankari"
      ],
      "year": 2012,
      "doi": "10.1186/1471-2458-12-403",
      "journal": "BMC Public Health",
      "volume": "12",
      "pages": "403",
      "raw": "Promoting walking among office employeesevaluation of a randomized controlled intervention with pedometers and e-mail messages \n\t\t \n\t\t\t M Aittasalo \n\t\t \n\t\t \n\t\t\t M Rinne \n\t\t \n\t\t \n\t\t\t M Pasanen \n\t\t \n\t\t \n\t\t\t K Kukkonen-Harjula \n\t\t \n\t\t \n\t\t\t T Vasankari \n\t\t \n\t\t 10.1186/1471-2458-12-403 \n\t\t Medline: 22672576 \n\t \n\t \n\t\t BMC Public Health \n\t\t \n\t\t\t 12 \n\t\t\t 403 \n\t\t\t 2012 Jun 06 \n\t\t \n\t \n\t FREE Full text \n\t Aittasalo M, Rinne M, Pasanen M, Kukkonen-Harjula K, Vasankari T. Promoting walking among office employees - evaluation of a randomized controlled intervention with pedometers and e-mail messages. BMC Public Health 2012 Jun 06;12:403 [FREE Full text] [doi: 10.1186/1471-2458-12-403] [Medline: 22672576]"
    },
    {
      "title": "Feasibility and preliminary efficacy of the MADE4Life Program: a pilot randomized controlled trial",
      "authors": [
        "A Barnes",
        "R Plotnikoff",
        "C Collins",
        "P Morgan"
      ],
      "year": 2015,
      "doi": "10.1123/jpah.2014-0331",
      "journal": "J Phys Act Health",
      "volume": "12",
      "issue": "10",
      "raw": "Feasibility and preliminary efficacy of the MADE4Life Program: a pilot randomized controlled trial \n\t\t \n\t\t\t A T Barnes \n\t\t \n\t\t \n\t\t\t R C Plotnikoff \n\t\t \n\t\t \n\t\t\t C E Collins \n\t\t \n\t\t \n\t\t\t P J Morgan \n\t\t \n\t\t 10.1123/jpah.2014-0331 \n\t\t Medline: 25599119 \n\t \n\t \n\t\t J Phys Act Health \n\t\t \n\t\t\t 12 \n\t\t\t 10 \n\t\t\t \n\t\t\t 2015 Oct \n\t\t \n\t \n\t Barnes AT, Plotnikoff RC, Collins CE, Morgan PJ. Feasibility and preliminary efficacy of the MADE4Life Program: a pilot randomized controlled trial. J Phys Act Health 2015 Oct;12(10):1378-1393. [doi: 10.1123/jpah.2014-0331] [Medline: 25599119]"
    },
    {
      "title": "Effects of an unsupervised pedometer-based physical activity program on daily steps of adults with moderate to severe asthma: a randomized controlled trial",
      "authors": [
        "C Coelho",
        "M Reboredo",
        "F Valle",
        "C Malaguti",
        "L Campos",
        "L Nascimento"
      ],
      "year": 2018,
      "doi": "10.1080/02640414.2017.1364402",
      "journal": "J Sports Sci",
      "volume": "36",
      "issue": "10",
      "raw": "Effects of an unsupervised pedometer-based physical activity program on daily steps of adults with moderate to severe asthma: a randomized controlled trial \n\t\t \n\t\t\t C M Coelho \n\t\t \n\t\t \n\t\t\t M M Reboredo \n\t\t \n\t\t \n\t\t\t F M Valle \n\t\t \n\t\t \n\t\t\t C Malaguti \n\t\t \n\t\t \n\t\t\t L A Campos \n\t\t \n\t\t \n\t\t\t L M Nascimento \n\t\t \n\t\t 10.1080/02640414.2017.1364402 \n\t\t Medline: 28799458 \n\t \n\t \n\t\t J Sports Sci \n\t\t \n\t\t\t 36 \n\t\t\t 10 \n\t\t\t \n\t\t\t 2018 May \n\t\t \n\t \n\t Coelho CM, Reboredo MM, Valle FM, Malaguti C, Campos LA, Nascimento LM, et al. Effects of an unsupervised pedometer-based physical activity program on daily steps of adults with moderate to severe asthma: a randomized controlled trial. J Sports Sci 2018 May;36(10):1186-1193. [doi: 10.1080/02640414.2017.1364402] [Medline: 28799458]"
    },
    {
      "title": "Walk2Bactive: a randomised controlled trial of a physical activity-focused behavioural intervention beyond pulmonary rehabilitation in chronic obstructive pulmonary disease",
      "authors": [
        "J Cruz",
        "D Brooks",
        "A Marques"
      ],
      "year": 2016,
      "doi": "10.1177/1479972315619574",
      "journal": "Chron Respir Dis",
      "volume": "13",
      "issue": "1",
      "raw": "Walk2Bactive: a randomised controlled trial of a physical activity-focused behavioural intervention beyond pulmonary rehabilitation in chronic obstructive pulmonary disease \n\t\t \n\t\t\t J Cruz \n\t\t \n\t\t \n\t\t\t D Brooks \n\t\t \n\t\t \n\t\t\t A Marques \n\t\t \n\t\t 10.1177/1479972315619574 \n\t\t Medline: 26703921 \n\t \n\t \n\t\t Chron Respir Dis \n\t\t \n\t\t\t 13 \n\t\t\t 1 \n\t\t\t \n\t\t\t 2016 Feb \n\t\t \n\t \n\t FREE Full text \n\t Cruz J, Brooks D, Marques A. Walk2Bactive: a randomised controlled trial of a physical activity-focused behavioural intervention beyond pulmonary rehabilitation in chronic obstructive pulmonary disease. Chron Respir Dis 2016 Feb;13(1):57-66 [FREE Full text] [doi: 10.1177/1479972315619574] [Medline: 26703921]"
    },
    {
      "title": "Internet-delivered behavioral intervention to increase physical activity in persons with multiple sclerosis: sustainability and secondary outcomes",
      "authors": [
        "D Dlugonski",
        "R Motl",
        "D Mohr",
        "B Sandroff"
      ],
      "year": 2012,
      "doi": "10.1080/13548506.2011.652640",
      "journal": "Psychol Health Med",
      "volume": "17",
      "issue": "6",
      "raw": "Internet-delivered behavioral intervention to increase physical activity in persons with multiple sclerosis: sustainability and secondary outcomes \n\t\t \n\t\t\t D Dlugonski \n\t\t \n\t\t \n\t\t\t R W Motl \n\t\t \n\t\t \n\t\t\t D C Mohr \n\t\t \n\t\t \n\t\t\t B M Sandroff \n\t\t \n\t\t 10.1080/13548506.2011.652640 \n\t\t Medline: 22313192 \n\t \n\t \n\t\t Psychol Health Med \n\t\t \n\t\t\t 17 \n\t\t\t 6 \n\t\t\t \n\t\t\t 2012 \n\t\t \n\t \n\t Dlugonski D, Motl RW, Mohr DC, Sandroff BM. Internet-delivered behavioral intervention to increase physical activity in persons with multiple sclerosis: sustainability and secondary outcomes. Psychol Health Med 2012;17(6):636-651. [doi: 10.1080/13548506.2011.652640] [Medline: 22313192]"
    },
    {
      "title": "Living well with diabetes: 24-month outcomes from a randomized trial of telephone-delivered weight loss and physical activity intervention to improve glycemic control",
      "authors": [
        "E Eakin",
        "E Winkler",
        "D Dunstan",
        "G Healy",
        "N Owen",
        "A Marshall"
      ],
      "year": 2014,
      "doi": "10.2337/dc13-2427",
      "journal": "Diabetes Care",
      "volume": "37",
      "issue": "8",
      "raw": "Living well with diabetes: 24-month outcomes from a randomized trial of telephone-delivered weight loss and physical activity intervention to improve glycemic control \n\t\t \n\t\t\t E G Eakin \n\t\t \n\t\t \n\t\t\t E A Winkler \n\t\t \n\t\t \n\t\t\t D W Dunstan \n\t\t \n\t\t \n\t\t\t G N Healy \n\t\t \n\t\t \n\t\t\t N Owen \n\t\t \n\t\t \n\t\t\t A M Marshall \n\t\t \n\t\t 10.2337/dc13-2427 \n\t\t Medline: 24658390 \n\t \n\t \n\t\t Diabetes Care \n\t\t \n\t\t\t 37 \n\t\t\t 8 \n\t\t\t \n\t\t\t 2014 Aug \n\t\t \n\t \n\t Eakin EG, Winkler EA, Dunstan DW, Healy GN, Owen N, Marshall AM, et al. Living well with diabetes: 24-month outcomes from a randomized trial of telephone-delivered weight loss and physical activity intervention to improve glycemic control. Diabetes Care 2014 Aug;37(8):2177-2185. [doi: 10.2337/dc13-2427] [Medline: 24658390]"
    },
    {
      "title": "A social networking and gamified app to increase physical activity: cluster RCT",
      "authors": [
        "S Edney",
        "T Olds",
        "J Ryan",
        "C Vandelanotte",
        "R Plotnikoff",
        "R Curtis"
      ],
      "year": 2020,
      "doi": "10.1016/j.amepre.2019.09.009",
      "journal": "Am J Prev Med",
      "volume": "58",
      "issue": "2",
      "raw": "A social networking and gamified app to increase physical activity: cluster RCT \n\t\t \n\t\t\t S M Edney \n\t\t \n\t\t \n\t\t\t T S Olds \n\t\t \n\t\t \n\t\t\t J C Ryan \n\t\t \n\t\t \n\t\t\t C Vandelanotte \n\t\t \n\t\t \n\t\t\t R C Plotnikoff \n\t\t \n\t\t \n\t\t\t R G Curtis \n\t\t \n\t\t 10.1016/j.amepre.2019.09.009 \n\t\t Medline: 31959326 \n\t \n\t \n\t\t Am J Prev Med \n\t\t \n\t\t\t 58 \n\t\t\t 2 \n\t\t\t \n\t\t\t 2020 Feb \n\t\t \n\t \n\t Edney SM, Olds TS, Ryan JC, Vandelanotte C, Plotnikoff RC, Curtis RG, et al. A social networking and gamified app to increase physical activity: cluster RCT. Am J Prev Med 2020 Feb;58(2):51-62. [doi: 10.1016/j.amepre.2019.09.009] [Medline: 31959326]"
    },
    {
      "title": "Effectiveness of activity trackers with and without incentives to increase physical activity (TRIPPA): a randomised controlled trial",
      "authors": [
        "E Finkelstein",
        "B Haaland",
        "M Bilger",
        "A Sahasranaman",
        "R Sloan",
        "E Nang"
      ],
      "year": 2016,
      "doi": "10.1016/s2213-8587(16)30284-4",
      "journal": "Lancet Diabetes Endocrinol",
      "volume": "4",
      "issue": "12",
      "raw": "Effectiveness of activity trackers with and without incentives to increase physical activity (TRIPPA): a randomised controlled trial \n\t\t \n\t\t\t E A Finkelstein \n\t\t \n\t\t \n\t\t\t B A Haaland \n\t\t \n\t\t \n\t\t\t M Bilger \n\t\t \n\t\t \n\t\t\t A Sahasranaman \n\t\t \n\t\t \n\t\t\t R A Sloan \n\t\t \n\t\t \n\t\t\t E E Nang \n\t\t \n\t\t 10.1016/s2213-8587(16)30284-4 \n\t\t Medline: 27717766 \n\t \n\t \n\t\t Lancet Diabetes Endocrinol \n\t\t \n\t\t\t 4 \n\t\t\t 12 \n\t\t\t \n\t\t\t 2016 Dec \n\t\t \n\t \n\t Finkelstein EA, Haaland BA, Bilger M, Sahasranaman A, Sloan RA, Nang EE, et al. Effectiveness of activity trackers with and without incentives to increase physical activity (TRIPPA): a randomised controlled trial. Lancet Diabetes Endocrinol 2016 Dec;4(12):983-995. [doi: 10.1016/S2213-8587(16)30284-4] [Medline: 27717766]"
    },
    {
      "title": "Randomized controlled trial of an improved version of mobilemums, an intervention for increasing physical activity in women with young children",
      "authors": [
        "B Fjeldsoe",
        "Y Miller",
        "N Graves",
        "A Barnett",
        "A Marshall"
      ],
      "year": 2015,
      "doi": "10.1007/s12160-014-9675-y",
      "journal": "Ann Behav Med",
      "volume": "49",
      "issue": "4",
      "raw": "Randomized controlled trial of an improved version of mobilemums, an intervention for increasing physical activity in women with young children \n\t\t \n\t\t\t B S Fjeldsoe \n\t\t \n\t\t \n\t\t\t Y D Miller \n\t\t \n\t\t \n\t\t\t N Graves \n\t\t \n\t\t \n\t\t\t A G Barnett \n\t\t \n\t\t \n\t\t\t A L Marshall \n\t\t \n\t\t 10.1007/s12160-014-9675-y \n\t\t Medline: 25582987 \n\t \n\t \n\t\t Ann Behav Med \n\t\t \n\t\t\t 49 \n\t\t\t 4 \n\t\t\t \n\t\t\t 2015 Aug \n\t\t \n\t \n\t Fjeldsoe BS, Miller YD, Graves N, Barnett AG, Marshall AL. Randomized controlled trial of an improved version of mobilemums, an intervention for increasing physical activity in women with young children. Ann Behav Med 2015 Aug;49(4):487-499. [doi: 10.1007/s12160-014-9675-y] [Medline: 25582987]"
    },
    {
      "title": "Randomised controlled trial of a pedometer-based telephone intervention to increase physical activity among cardiac patients not attending cardiac rehabilitation",
      "authors": [
        "S Furber",
        "L Butler",
        "P Phongsavan",
        "A Mark",
        "A Bauman"
      ],
      "year": 2010,
      "doi": "10.1016/j.pec.2009.11.012",
      "journal": "Patient Educ Couns",
      "volume": "80",
      "issue": "2",
      "raw": "Randomised controlled trial of a pedometer-based telephone intervention to increase physical activity among cardiac patients not attending cardiac rehabilitation \n\t\t \n\t\t\t S Furber \n\t\t \n\t\t \n\t\t\t L Butler \n\t\t \n\t\t \n\t\t\t P Phongsavan \n\t\t \n\t\t \n\t\t\t A Mark \n\t\t \n\t\t \n\t\t\t A Bauman \n\t\t \n\t\t 10.1016/j.pec.2009.11.012 \n\t\t Medline: 20022201 \n\t \n\t \n\t\t Patient Educ Couns \n\t\t \n\t\t\t 80 \n\t\t\t 2 \n\t\t\t \n\t\t\t 2010 Aug \n\t\t \n\t \n\t Furber S, Butler L, Phongsavan P, Mark A, Bauman A. Randomised controlled trial of a pedometer-based telephone intervention to increase physical activity among cardiac patients not attending cardiac rehabilitation. Patient Educ Couns 2010 Aug;80(2):212-218. [doi: 10.1016/j.pec.2009.11.012] [Medline: 20022201]"
    },
    {
      "title": "Impact of a nutrition and physical activity intervention (ENRICH: Exercise and Nutrition Routine Improving Cancer Health) on health behaviors of cancer survivors and carers: a pragmatic randomized controlled trial",
      "authors": [
        "E James",
        "F Stacey",
        "K Chapman",
        "A Boyes",
        "T Burrows",
        "A Girgis"
      ],
      "year": 2015,
      "doi": "10.1186/s12885-015-1775-y",
      "journal": "BMC Cancer",
      "volume": "15",
      "pages": "710",
      "raw": "Impact of a nutrition and physical activity intervention (ENRICH: Exercise and Nutrition Routine Improving Cancer Health) on health behaviors of cancer survivors and carers: a pragmatic randomized controlled trial \n\t\t \n\t\t\t E L James \n\t\t \n\t\t \n\t\t\t F G Stacey \n\t\t \n\t\t \n\t\t\t K Chapman \n\t\t \n\t\t \n\t\t\t A W Boyes \n\t\t \n\t\t \n\t\t\t T Burrows \n\t\t \n\t\t \n\t\t\t A Girgis \n\t\t \n\t\t 10.1186/s12885-015-1775-y \n\t\t Medline: 26471791 \n\t \n\t \n\t\t BMC Cancer \n\t\t \n\t\t\t 15 \n\t\t\t 710 \n\t\t\t 2015 Oct 15 \n\t\t \n\t \n\t FREE Full text \n\t James EL, Stacey FG, Chapman K, Boyes AW, Burrows T, Girgis A, et al. Impact of a nutrition and physical activity intervention (ENRICH: Exercise and Nutrition Routine Improving Cancer Health) on health behaviors of cancer survivors and carers: a pragmatic randomized controlled trial. BMC Cancer 2015 Oct 15;15:710 [FREE Full text] [doi: 10.1186/s12885-015-1775-y] [Medline: 26471791]"
    },
    {
      "title": "Effectiveness of a Facebook-delivered physical activity intervention for postpartum women: a randomized controlled trial",
      "authors": [
        "J Kernot",
        "L Lewis",
        "T Olds",
        "C Maher"
      ],
      "year": 2019,
      "doi": "10.1123/jpah.2017-0573",
      "journal": "J Phys Act Health",
      "volume": "16",
      "issue": "2",
      "raw": "Effectiveness of a Facebook-delivered physical activity intervention for postpartum women: a randomized controlled trial \n\t\t \n\t\t\t J Kernot \n\t\t \n\t\t \n\t\t\t L Lewis \n\t\t \n\t\t \n\t\t\t T Olds \n\t\t \n\t\t \n\t\t\t C Maher \n\t\t \n\t\t 10.1123/jpah.2017-0573 \n\t\t Medline: 30541378 \n\t \n\t \n\t\t J Phys Act Health \n\t\t \n\t\t\t 16 \n\t\t\t 2 \n\t\t\t \n\t\t\t 2019 Feb 01 \n\t\t \n\t \n\t Kernot J, Lewis L, Olds T, Maher C. Effectiveness of a Facebook-delivered physical activity intervention for postpartum women: a randomized controlled trial. J Phys Act Health 2019 Feb 01;16(2):125-133. [doi: 10.1123/jpah.2017-0573] [Medline: 30541378]"
    },
    {
      "title": "A web-based, social networking physical activity intervention for insufficiently active adults delivered via Facebook app: randomized controlled trial",
      "authors": [
        "C Maher",
        "M Ferguson",
        "C Vandelanotte",
        "R Plotnikoff",
        "De Bourdeaudhuij",
        "I Thomas"
      ],
      "year": 2015,
      "doi": "10.2196/jmir.4086",
      "journal": "J Med Internet Res",
      "volume": "17",
      "issue": "7",
      "pages": "e174",
      "raw": "A web-based, social networking physical activity intervention for insufficiently active adults delivered via Facebook app: randomized controlled trial \n\t\t \n\t\t\t C Maher \n\t\t \n\t\t \n\t\t\t M Ferguson \n\t\t \n\t\t \n\t\t\t C Vandelanotte \n\t\t \n\t\t \n\t\t\t R Plotnikoff \n\t\t \n\t\t \n\t\t\t De Bourdeaudhuij \n\t\t \n\t\t \n\t\t\t I Thomas \n\t\t \n\t\t \n\t\t\t S \n\t\t \n\t\t 10.2196/jmir.4086 \n\t\t Medline: 26169067 \n\t \n\t \n\t\t J Med Internet Res \n\t\t \n\t\t\t 17 \n\t\t\t 7 \n\t\t\t e174 \n\t\t\t 2015 Jul 13 \n\t\t \n\t \n\t FREE Full text \n\t Maher C, Ferguson M, Vandelanotte C, Plotnikoff R, De Bourdeaudhuij I, Thomas S, et al. A web-based, social networking physical activity intervention for insufficiently active adults delivered via Facebook app: randomized controlled trial. J Med Internet Res 2015 Jul 13;17(7):e174 [FREE Full text] [doi: 10.2196/jmir.4086] [Medline: 26169067]"
    },
    {
      "title": "Investigating the effect of a 3-month workplace-based pedometer-driven walking programme on health-related quality of life in meat processing workers: a feasibility study within a randomized controlled trial",
      "authors": [
        "S Mansi",
        "S Milosavljevic",
        "S Tumilty",
        "P Hendrick",
        "C Higgs",
        "D Baxter"
      ],
      "year": 2015,
      "doi": "10.1186/s12889-015-1736-z",
      "journal": "BMC Public Health",
      "volume": "15",
      "pages": "410",
      "raw": "Investigating the effect of a 3-month workplace-based pedometer-driven walking programme on health-related quality of life in meat processing workers: a feasibility study within a randomized controlled trial \n\t\t \n\t\t\t S Mansi \n\t\t \n\t\t \n\t\t\t S Milosavljevic \n\t\t \n\t\t \n\t\t\t S Tumilty \n\t\t \n\t\t \n\t\t\t P Hendrick \n\t\t \n\t\t \n\t\t\t C Higgs \n\t\t \n\t\t \n\t\t\t D G Baxter \n\t\t \n\t\t 10.1186/s12889-015-1736-z \n\t\t Medline: 25895747 \n\t \n\t \n\t\t BMC Public Health \n\t\t \n\t\t\t 15 \n\t\t\t 410 \n\t\t\t 2015 Apr 22 \n\t\t \n\t \n\t FREE Full text \n\t Mansi S, Milosavljevic S, Tumilty S, Hendrick P, Higgs C, Baxter DG. Investigating the effect of a 3-month workplace-based pedometer-driven walking programme on health-related quality of life in meat processing workers: a feasibility study within a randomized controlled trial. BMC Public Health 2015 Apr 22;15:410 [FREE Full text] [doi: 10.1186/s12889-015-1736-z] [Medline: 25895747]"
    },
    {
      "title": "Effectiveness of individual counseling and activity monitors to promote physical activity among university students",
      "authors": [
        "M Maselli",
        "E Gobbi",
        "A Carraro"
      ],
      "year": 2019,
      "doi": "10.23736/s0022-4707.17.07981-6",
      "journal": "J Sports Med Phys Fitness",
      "volume": "59",
      "issue": "1",
      "raw": "Effectiveness of individual counseling and activity monitors to promote physical activity among university students \n\t\t \n\t\t\t M Maselli \n\t\t \n\t\t \n\t\t\t E Gobbi \n\t\t \n\t\t \n\t\t\t A Carraro \n\t\t \n\t\t 10.23736/s0022-4707.17.07981-6 \n\t\t Medline: 29199784 \n\t \n\t \n\t\t J Sports Med Phys Fitness \n\t\t \n\t\t\t 59 \n\t\t\t 1 \n\t\t\t \n\t\t\t 2019 Jan \n\t\t \n\t \n\t Maselli M, Gobbi E, Carraro A. Effectiveness of individual counseling and activity monitors to promote physical activity among university students. J Sports Med Phys Fitness 2019 Jan;59(1):132-140. [doi: 10.23736/S0022-4707.17.07981-6] [Medline: 29199784]"
    },
    {
      "title": "Text messaging for exercise promotion in older adults from an upper-middle-income country: randomized controlled trial",
      "authors": [
        "A M\u00fcller",
        "S Khoo",
        "T Morris"
      ],
      "year": 2016,
      "doi": "10.2196/jmir.5235",
      "journal": "J Med Internet Res",
      "volume": "18",
      "issue": "1",
      "raw": "Text messaging for exercise promotion in older adults from an upper-middle-income country: randomized controlled trial \n\t\t \n\t\t\t A M M\u00fcller \n\t\t \n\t\t \n\t\t\t S Khoo \n\t\t \n\t\t \n\t\t\t T Morris \n\t\t \n\t\t 10.2196/jmir.5235 \n\t\t Medline: 26742999 \n\t \n\t \n\t\t J Med Internet Res \n\t\t \n\t\t\t 18 \n\t\t\t 1 \n\t\t\t 2016 Jan 07 \n\t\t \n\t \n\t FREE Full text \n\t M\u00fcller AM, Khoo S, Morris T. Text messaging for exercise promotion in older adults from an upper-middle-income country: randomized controlled trial. J Med Internet Res 2016 Jan 07;18(1):e5 [FREE Full text] [doi: 10.2196/jmir.5235] [Medline: 26742999]"
    },
    {
      "title": "Efficacy of an m-Health physical activity and sleep health intervention for adults: a randomized waitlist-controlled trial",
      "authors": [
        "B Murawski",
        "R Plotnikoff",
        "A Rayward",
        "C Oldmeadow",
        "C Vandelanotte",
        "W Brown"
      ],
      "year": 2019,
      "doi": "10.1016/j.amepre.2019.05.009",
      "journal": "Am J Prev Med",
      "volume": "57",
      "issue": "4",
      "raw": "Efficacy of an m-Health physical activity and sleep health intervention for adults: a randomized waitlist-controlled trial \n\t\t \n\t\t\t B Murawski \n\t\t \n\t\t \n\t\t\t R C Plotnikoff \n\t\t \n\t\t \n\t\t\t A T Rayward \n\t\t \n\t\t \n\t\t\t C Oldmeadow \n\t\t \n\t\t \n\t\t\t C Vandelanotte \n\t\t \n\t\t \n\t\t\t W J Brown \n\t\t \n\t\t 10.1016/j.amepre.2019.05.009 \n\t\t Medline: 31542128 \n\t \n\t \n\t\t Am J Prev Med \n\t\t \n\t\t\t 57 \n\t\t\t 4 \n\t\t\t \n\t\t\t 2019 Oct \n\t\t \n\t \n\t Murawski B, Plotnikoff RC, Rayward AT, Oldmeadow C, Vandelanotte C, Brown WJ, et al. Efficacy of an m-Health physical activity and sleep health intervention for adults: a randomized waitlist-controlled trial. Am J Prev Med 2019 Oct;57(4):503-514. [doi: 10.1016/j.amepre.2019.05.009] [Medline: 31542128]"
    },
    {
      "title": "Increasing older adults' walking through primary care: results of a pilot randomized controlled trial",
      "authors": [
        "N Mutrie",
        "O Doolin",
        "C Fitzsimons",
        "P Grant",
        "M Granat",
        "M Grealy"
      ],
      "year": 2012,
      "doi": "10.1093/fampra/cms038",
      "journal": "Fam Pract",
      "volume": "29",
      "issue": "6",
      "raw": "Increasing older adults' walking through primary care: results of a pilot randomized controlled trial \n\t\t \n\t\t\t N Mutrie \n\t\t \n\t\t \n\t\t\t O Doolin \n\t\t \n\t\t \n\t\t\t C F Fitzsimons \n\t\t \n\t\t \n\t\t\t P M Grant \n\t\t \n\t\t \n\t\t\t M Granat \n\t\t \n\t\t \n\t\t\t M Grealy \n\t\t \n\t\t 10.1093/fampra/cms038 \n\t\t Medline: 22843637 \n\t \n\t \n\t\t Fam Pract \n\t\t \n\t\t\t 29 \n\t\t\t 6 \n\t\t\t \n\t\t\t 2012 Dec \n\t\t \n\t \n\t FREE Full text \n\t Mutrie N, Doolin O, Fitzsimons CF, Grant PM, Granat M, Grealy M, et al. Increasing older adults' walking through primary care: results of a pilot randomized controlled trial. Fam Pract 2012 Dec;29(6):633-642 [FREE Full text] [doi: 10.1093/fampra/cms038] [Medline: 22843637]"
    },
    {
      "title": "Pedometer step count targets during pulmonary rehabilitation in chronic obstructive pulmonary disease. A randomized controlled trial",
      "authors": [
        "C Nolan",
        "M Maddocks",
        "J Canavan",
        "S Jones",
        "V Delogu",
        "D Kaliaraju"
      ],
      "year": 2017,
      "doi": "10.1164/rccm.201607-1372oc",
      "journal": "Am J Respir Crit Care Med",
      "volume": "195",
      "issue": "10",
      "raw": "Pedometer step count targets during pulmonary rehabilitation in chronic obstructive pulmonary disease. A randomized controlled trial \n\t\t \n\t\t\t C M Nolan \n\t\t \n\t\t \n\t\t\t M Maddocks \n\t\t \n\t\t \n\t\t\t J L Canavan \n\t\t \n\t\t \n\t\t\t S E Jones \n\t\t \n\t\t \n\t\t\t V Delogu \n\t\t \n\t\t \n\t\t\t D Kaliaraju \n\t\t \n\t\t 10.1164/rccm.201607-1372oc \n\t \n\t \n\t\t Am J Respir Crit Care Med \n\t\t \n\t\t\t 195 \n\t\t\t 10 \n\t\t\t \n\t\t\t 2017 May 15 \n\t\t \n\t \n\t Nolan CM, Maddocks M, Canavan JL, Jones SE, Delogu V, Kaliaraju D, et al. Pedometer step count targets during pulmonary rehabilitation in chronic obstructive pulmonary disease. A randomized controlled trial. Am J Respir Crit Care Med 2017 May 15;195(10):1344-1352. [doi: 10.1164/rccm.201607-1372oc]"
    },
    {
      "title": "A combined physical activity and fall prevention intervention improved mobility-related goal attainment but not physical activity in older adults: a randomised trial",
      "authors": [
        "J Oliveira",
        "C Sherrington",
        "S Paul",
        "E Ramsay",
        "K Chamberlain",
        "C Kirkham"
      ],
      "year": 2019,
      "doi": "10.1016/j.jphys.2018.11.005",
      "journal": "J Physiother",
      "volume": "65",
      "issue": "1",
      "raw": "A combined physical activity and fall prevention intervention improved mobility-related goal attainment but not physical activity in older adults: a randomised trial \n\t\t \n\t\t\t J S Oliveira \n\t\t \n\t\t \n\t\t\t C Sherrington \n\t\t \n\t\t \n\t\t\t S S Paul \n\t\t \n\t\t \n\t\t\t E Ramsay \n\t\t \n\t\t \n\t\t\t K Chamberlain \n\t\t \n\t\t \n\t\t\t C Kirkham \n\t\t \n\t\t 10.1016/j.jphys.2018.11.005 \n\t\t Medline: 30581138 \n\t \n\t \n\t\t J Physiother \n\t\t \n\t\t\t 65 \n\t\t\t 1 \n\t\t\t \n\t\t\t 2019 Jan \n\t\t \n\t \n\t FREE Full text \n\t Oliveira JS, Sherrington C, Paul SS, Ramsay E, Chamberlain K, Kirkham C, et al. A combined physical activity and fall prevention intervention improved mobility-related goal attainment but not physical activity in older adults: a randomised trial. J Physiother 2019 Jan;65(1):16-22 [FREE Full text] [doi: 10.1016/j.jphys.2018.11.005] [Medline: 30581138]"
    },
    {
      "title": "Home-based physical activity intervention for colorectal cancer survivors",
      "authors": [
        "B Pinto",
        "G Papandonatos",
        "M Goldstein",
        "B Marcus",
        "N Farrell"
      ],
      "year": 2013,
      "doi": "10.1002/pon.2047",
      "journal": "Psychooncology",
      "volume": "22",
      "issue": "1",
      "raw": "Home-based physical activity intervention for colorectal cancer survivors \n\t\t \n\t\t\t B M Pinto \n\t\t \n\t\t \n\t\t\t G D Papandonatos \n\t\t \n\t\t \n\t\t\t M G Goldstein \n\t\t \n\t\t \n\t\t\t B H Marcus \n\t\t \n\t\t \n\t\t\t N Farrell \n\t\t \n\t\t 10.1002/pon.2047 \n\t\t Medline: 21905158 \n\t \n\t \n\t\t Psychooncology \n\t\t \n\t\t\t 22 \n\t\t\t 1 \n\t\t\t \n\t\t\t 2013 Jan \n\t\t \n\t \n\t Pinto BM, Papandonatos GD, Goldstein MG, Marcus BH, Farrell N. Home-based physical activity intervention for colorectal cancer survivors. Psychooncology 2013 Jan;22(1):54-64. [doi: 10.1002/pon.2047] [Medline: 21905158]"
    },
    {
      "title": "Peers promoting physical activity among breast cancer survivors: a randomized controlled trial",
      "authors": [
        "B Pinto",
        "K Stein",
        "S Dunsiger"
      ],
      "year": 2015,
      "doi": "10.1037/hea0000120",
      "journal": "Health Psychol",
      "volume": "34",
      "issue": "5",
      "raw": "Peers promoting physical activity among breast cancer survivors: a randomized controlled trial \n\t\t \n\t\t\t B M Pinto \n\t\t \n\t\t \n\t\t\t K Stein \n\t\t \n\t\t \n\t\t\t S Dunsiger \n\t\t \n\t\t 10.1037/hea0000120 \n\t\t Medline: 25110844 \n\t \n\t \n\t\t Health Psychol \n\t\t \n\t\t\t 34 \n\t\t\t 5 \n\t\t\t \n\t\t\t 2015 May \n\t\t \n\t \n\t FREE Full text \n\t Pinto BM, Stein K, Dunsiger S. Peers promoting physical activity among breast cancer survivors: a randomized controlled trial. Health Psychol 2015 May;34(5):463-472 [FREE Full text] [doi: 10.1037/hea0000120] [Medline: 25110844]"
    },
    {
      "title": "Interventions to increase physical activity in middle-age women at the workplace: a randomized controlled trial",
      "authors": [
        "M Ribeiro",
        "M Martins",
        "Crf Carvalho"
      ],
      "year": 2014,
      "doi": "10.1249/mss.0000000000000190",
      "journal": "Med Sci Sports Exerc",
      "volume": "46",
      "issue": "5",
      "raw": "Interventions to increase physical activity in middle-age women at the workplace: a randomized controlled trial \n\t\t \n\t\t\t M A Ribeiro \n\t\t \n\t\t \n\t\t\t M A Martins \n\t\t \n\t\t \n\t\t\t Crf Carvalho \n\t\t \n\t\t 10.1249/mss.0000000000000190 \n\t\t Medline: 24126967 \n\t \n\t \n\t\t Med Sci Sports Exerc \n\t\t \n\t\t\t 46 \n\t\t\t 5 \n\t\t\t \n\t\t\t 2014 \n\t\t \n\t \n\t Ribeiro MA, Martins MA, Carvalho CRF. Interventions to increase physical activity in middle-age women at the workplace: a randomized controlled trial. Med Sci Sports Exerc 2014;46(5):1008-1015. [doi: 10.1249/MSS.0000000000000190] [Medline: 24126967]"
    },
    {
      "title": "Effect and process evaluation of a smartphone app to promote an active lifestyle in lower educated working young adults: cluster randomized controlled trial",
      "authors": [
        "D Simons",
        "De Bourdeaudhuij",
        "I Clarys",
        "De Cocker",
        "K Vandelanotte",
        "C Deforche"
      ],
      "year": 2018,
      "doi": "10.2196/10003",
      "journal": "JMIR Mhealth Uhealth",
      "volume": "6",
      "issue": "8",
      "pages": "10003",
      "raw": "Effect and process evaluation of a smartphone app to promote an active lifestyle in lower educated working young adults: cluster randomized controlled trial \n\t\t \n\t\t\t D Simons \n\t\t \n\t\t \n\t\t\t De Bourdeaudhuij \n\t\t \n\t\t \n\t\t\t I Clarys \n\t\t \n\t\t \n\t\t\t P \n\t\t \n\t\t \n\t\t\t De Cocker \n\t\t \n\t\t \n\t\t\t K Vandelanotte \n\t\t \n\t\t \n\t\t\t C Deforche \n\t\t \n\t\t \n\t\t\t B \n\t\t \n\t\t 10.2196/10003 \n\t\t Medline: 30143477 \n\t \n\t \n\t\t JMIR Mhealth Uhealth \n\t\t \n\t\t\t 6 \n\t\t\t 8 \n\t\t\t 10003 \n\t\t\t 2018 Aug 24 \n\t\t \n\t \n\t FREE Full text \n\t Simons D, De Bourdeaudhuij I, Clarys P, De Cocker K, Vandelanotte C, Deforche B. Effect and process evaluation of a smartphone app to promote an active lifestyle in lower educated working young adults: cluster randomized controlled trial. JMIR Mhealth Uhealth 2018 Aug 24;6(8):e10003 [FREE Full text] [doi: 10.2196/10003] [Medline: 30143477]"
    },
    {
      "title": "Social cognitive theory mediators of physical activity in a lifestyle program for cancer survivors and carers: findings from the ENRICH randomized controlled trial",
      "authors": [
        "F Stacey",
        "E James",
        "K Chapman",
        "D Lubans"
      ],
      "year": 2016,
      "doi": "10.1186/s12966-016-0372-z",
      "journal": "Int J Behav Nutr Phys Act",
      "volume": "13",
      "pages": "49",
      "raw": "Social cognitive theory mediators of physical activity in a lifestyle program for cancer survivors and carers: findings from the ENRICH randomized controlled trial \n\t\t \n\t\t\t F G Stacey \n\t\t \n\t\t \n\t\t\t E L James \n\t\t \n\t\t \n\t\t\t K Chapman \n\t\t \n\t\t \n\t\t\t D R Lubans \n\t\t \n\t\t 10.1186/s12966-016-0372-z \n\t\t Medline: 27075417 \n\t \n\t \n\t\t Int J Behav Nutr Phys Act \n\t\t \n\t\t\t 13 \n\t\t\t 49 \n\t\t\t 2016 Apr 14 \n\t\t \n\t \n\t FREE Full text \n\t Stacey FG, James EL, Chapman K, Lubans DR. Social cognitive theory mediators of physical activity in a lifestyle program for cancer survivors and carers: findings from the ENRICH randomized controlled trial. Int J Behav Nutr Phys Act 2016 Apr 14;13:49 [FREE Full text] [doi: 10.1186/s12966-016-0372-z] [Medline: 27075417]"
    },
    {
      "title": "Effects of text messaging in addition to emails on physical activity among university and college employees in the UK",
      "authors": [
        "S Suggs",
        "H Blake",
        "M Bardus",
        "S Lloyd"
      ],
      "year": 2013,
      "doi": "10.1177/1355819613478001",
      "journal": "J Health Serv Res Policy",
      "volume": "18",
      "issue": "1",
      "raw": "Effects of text messaging in addition to emails on physical activity among university and college employees in the UK \n\t\t \n\t\t\t S Suggs \n\t\t \n\t\t \n\t\t\t H Blake \n\t\t \n\t\t \n\t\t\t M Bardus \n\t\t \n\t\t \n\t\t\t S Lloyd \n\t\t \n\t\t 10.1177/1355819613478001 \n\t\t Medline: 27552780 \n\t \n\t \n\t\t J Health Serv Res Policy \n\t\t \n\t\t\t 18 \n\t\t\t 1 \n\t\t\t \n\t\t\t 2013 Apr \n\t\t \n\t \n\t Suppl \n\t Suggs S, Blake H, Bardus M, Lloyd S. Effects of text messaging in addition to emails on physical activity among university and college employees in the UK. J Health Serv Res Policy 2013 Apr;18(1 Suppl):56-64. [doi: 10.1177/1355819613478001] [Medline: 27552780]"
    },
    {
      "title": "A home-based pedometer-driven walking program to increase physical activity in older adults with osteoarthritis of the knee: a preliminary study",
      "authors": [
        "L Talbot",
        "J Gaines",
        "T Huynh",
        "E Metter"
      ],
      "year": 2003,
      "doi": "10.1046/j.1532-5415.2003.51113.x",
      "journal": "J Am Geriatr Soc",
      "volume": "51",
      "issue": "3",
      "raw": "A home-based pedometer-driven walking program to increase physical activity in older adults with osteoarthritis of the knee: a preliminary study \n\t\t \n\t\t\t L A Talbot \n\t\t \n\t\t \n\t\t\t J M Gaines \n\t\t \n\t\t \n\t\t\t T N Huynh \n\t\t \n\t\t \n\t\t\t E J Metter \n\t\t \n\t\t 10.1046/j.1532-5415.2003.51113.x \n\t\t Medline: 12588583 \n\t \n\t \n\t\t J Am Geriatr Soc \n\t\t \n\t\t\t 51 \n\t\t\t 3 \n\t\t\t \n\t\t\t 2003 Mar \n\t\t \n\t \n\t Talbot LA, Gaines JM, Huynh TN, Metter EJ. A home-based pedometer-driven walking program to increase physical activity in older adults with osteoarthritis of the knee: a preliminary study. J Am Geriatr Soc 2003 Mar;51(3):387-392. [doi: 10.1046/j.1532-5415.2003.51113.x] [Medline: 12588583]"
    },
    {
      "title": "Effects of two behavioral cardiac rehabilitation interventions on physical activity: a randomized controlled trial",
      "authors": [
        "N Hoeve",
        "M Sunamura",
        "H Stam",
        "E Boersma",
        "M Geleijnse",
        "R Van Domburg"
      ],
      "year": 2018,
      "doi": "10.1016/j.ijcard.2017.12.015",
      "journal": "Int J Cardiol",
      "volume": "255",
      "raw": "Effects of two behavioral cardiac rehabilitation interventions on physical activity: a randomized controlled trial \n\t\t \n\t\t\t N T Hoeve \n\t\t \n\t\t \n\t\t\t M Sunamura \n\t\t \n\t\t \n\t\t\t H J Stam \n\t\t \n\t\t \n\t\t\t E Boersma \n\t\t \n\t\t \n\t\t\t M L Geleijnse \n\t\t \n\t\t \n\t\t\t R T Van Domburg \n\t\t \n\t\t 10.1016/j.ijcard.2017.12.015 \n\t\t Medline: 29425564 \n\t \n\t \n\t\t Int J Cardiol \n\t\t \n\t\t\t 255 \n\t\t\t \n\t\t\t 2018 Mar 15 \n\t\t \n\t \n\t Hoeve NT, Sunamura M, Stam HJ, Boersma E, Geleijnse ML, van Domburg RT, et al. Effects of two behavioral cardiac rehabilitation interventions on physical activity: a randomized controlled trial. Int J Cardiol 2018 Mar 15;255:221-228. [doi: 10.1016/j.ijcard.2017.12.015] [Medline: 29425564]"
    },
    {
      "title": "Controlled outcome evaluation of the First Step Program: a daily physical activity intervention for individuals with type II diabetes",
      "authors": [
        "C Tudor-Locke",
        "R Bell",
        "A Myers",
        "S Harris",
        "N Ecclestone",
        "N Lauzon"
      ],
      "year": 2004,
      "doi": "10.1038/sj.ijo.0802485",
      "journal": "Int J Obes Relat Metab Disord",
      "volume": "28",
      "issue": "1",
      "raw": "Controlled outcome evaluation of the First Step Program: a daily physical activity intervention for individuals with type II diabetes \n\t\t \n\t\t\t C Tudor-Locke \n\t\t \n\t\t \n\t\t\t R C Bell \n\t\t \n\t\t \n\t\t\t A M Myers \n\t\t \n\t\t \n\t\t\t S B Harris \n\t\t \n\t\t \n\t\t\t N A Ecclestone \n\t\t \n\t\t \n\t\t\t N Lauzon \n\t\t \n\t\t 10.1038/sj.ijo.0802485 \n\t\t Medline: 14569279 \n\t \n\t \n\t\t Int J Obes Relat Metab Disord \n\t\t \n\t\t\t 28 \n\t\t\t 1 \n\t\t\t \n\t\t\t 2004 Jan \n\t\t \n\t \n\t Tudor-Locke C, Bell RC, Myers AM, Harris SB, Ecclestone NA, Lauzon N, et al. Controlled outcome evaluation of the First Step Program: a daily physical activity intervention for individuals with type II diabetes. Int J Obes Relat Metab Disord 2004 Jan;28(1):113-119. [doi: 10.1038/sj.ijo.0802485] [Medline: 14569279]"
    },
    {
      "title": "Maintenance of physical activity in breast cancer survivors after a randomized trial",
      "authors": [
        "J Vallance",
        "K Courneya",
        "R Plotnikoff",
        "I Dinu",
        "J Mackey"
      ],
      "year": 2008,
      "doi": "10.1249/mss.0b013e3181586b41",
      "journal": "Med Sci Sports Exerc",
      "volume": "40",
      "issue": "1",
      "raw": "Maintenance of physical activity in breast cancer survivors after a randomized trial \n\t\t \n\t\t\t J K Vallance \n\t\t \n\t\t \n\t\t\t K S Courneya \n\t\t \n\t\t \n\t\t\t R C Plotnikoff \n\t\t \n\t\t \n\t\t\t I Dinu \n\t\t \n\t\t \n\t\t\t J R Mackey \n\t\t \n\t\t 10.1249/mss.0b013e3181586b41 \n\t\t Medline: 18091007 \n\t \n\t \n\t\t Med Sci Sports Exerc \n\t\t \n\t\t\t 40 \n\t\t\t 1 \n\t\t\t \n\t\t\t 2008 Jan \n\t\t \n\t \n\t Vallance JK, Courneya KS, Plotnikoff RC, Dinu I, Mackey JR. Maintenance of physical activity in breast cancer survivors after a randomized trial. Med Sci Sports Exerc 2008 Jan;40(1):173-180. [doi: 10.1249/mss.0b013e3181586b41] [Medline: 18091007]"
    },
    {
      "title": "It's LiFe! Mobile and web-based monitoring and feedback tool embedded in primary care increases physical activity: a cluster randomized controlled trial",
      "authors": [
        "S Van Der Weegen",
        "R Verwey",
        "M Spreeuwenberg",
        "H Tange",
        "T Van Der Weijden",
        "L De Witte"
      ],
      "year": 2015,
      "doi": "10.2196/jmir.4579",
      "journal": "J Med Internet Res",
      "volume": "17",
      "issue": "7",
      "pages": "184",
      "raw": "It's LiFe! Mobile and web-based monitoring and feedback tool embedded in primary care increases physical activity: a cluster randomized controlled trial \n\t\t \n\t\t\t S Van Der Weegen \n\t\t \n\t\t \n\t\t\t R Verwey \n\t\t \n\t\t \n\t\t\t M Spreeuwenberg \n\t\t \n\t\t \n\t\t\t H Tange \n\t\t \n\t\t \n\t\t\t T Van Der Weijden \n\t\t \n\t\t \n\t\t\t L De Witte \n\t\t \n\t\t 10.2196/jmir.4579 \n\t\t Medline: 26209025 \n\t \n\t \n\t\t J Med Internet Res \n\t\t \n\t\t\t 17 \n\t\t\t 7 \n\t\t\t 184 \n\t\t\t 2015 Jul 24 \n\t\t \n\t \n\t FREE Full text \n\t van der Weegen S, Verwey R, Spreeuwenberg M, Tange H, van der Weijden T, de Witte L. It's LiFe! Mobile and web-based monitoring and feedback tool embedded in primary care increases physical activity: a cluster randomized controlled trial. J Med Internet Res 2015 Jul 24;17(7):e184 [FREE Full text] [doi: 10.2196/jmir.4579] [Medline: 26209025]"
    },
    {
      "title": "Year-round effects of a four-week randomized controlled trial using different types of feedback on employees' physical activity",
      "authors": [
        "K Van Hoye",
        "A Wijtzes",
        "J Lefevre",
        "De Baere",
        "S Boen"
      ],
      "year": 2018,
      "doi": "10.1186/s12889-018-5402-0",
      "journal": "BMC Public Health",
      "volume": "18",
      "issue": "1",
      "pages": "492",
      "raw": "Year-round effects of a four-week randomized controlled trial using different types of feedback on employees' physical activity \n\t\t \n\t\t\t K Van Hoye \n\t\t \n\t\t \n\t\t\t A I Wijtzes \n\t\t \n\t\t \n\t\t\t J Lefevre \n\t\t \n\t\t \n\t\t\t De Baere \n\t\t \n\t\t \n\t\t\t S Boen \n\t\t \n\t\t \n\t\t\t F \n\t\t \n\t\t 10.1186/s12889-018-5402-0 \n\t\t Medline: 29649997 \n\t \n\t \n\t\t BMC Public Health \n\t\t \n\t\t\t 18 \n\t\t\t 1 \n\t\t\t 492 \n\t\t\t 2018 Apr 12 \n\t\t \n\t \n\t FREE Full text \n\t Van Hoye K, Wijtzes AI, Lefevre J, De Baere S, Boen F. Year-round effects of a four-week randomized controlled trial using different types of feedback on employees' physical activity. BMC Public Health 2018 Apr 12;18(1):492 [FREE Full text] [doi: 10.1186/s12889-018-5402-0] [Medline: 29649997]"
    },
    {
      "title": "A cognitive-behavioural pedometer-based group intervention on physical activity and sedentary behaviour in individuals with type 2 diabetes",
      "authors": [
        "K De Greef",
        "B Deforche",
        "C Tudor-Locke",
        "De Bourdeaudhuij"
      ],
      "year": 2010,
      "doi": "10.1093/her/cyq017",
      "journal": "Health Educ Res",
      "volume": "25",
      "issue": "5",
      "raw": "A cognitive-behavioural pedometer-based group intervention on physical activity and sedentary behaviour in individuals with type 2 diabetes \n\t\t \n\t\t\t K De Greef \n\t\t \n\t\t \n\t\t\t B Deforche \n\t\t \n\t\t \n\t\t\t C Tudor-Locke \n\t\t \n\t\t \n\t\t\t De Bourdeaudhuij \n\t\t \n\t\t \n\t\t\t I \n\t\t \n\t\t 10.1093/her/cyq017 \n\t\t Medline: 20338978 \n\t \n\t \n\t\t Health Educ Res \n\t\t \n\t\t\t 25 \n\t\t\t 5 \n\t\t\t \n\t\t\t 2010 Oct \n\t\t \n\t \n\t FREE Full text \n\t De Greef K, Deforche B, Tudor-Locke C, De Bourdeaudhuij I. A cognitive-behavioural pedometer-based group intervention on physical activity and sedentary behaviour in individuals with type 2 diabetes. Health Educ Res 2010 Oct;25(5):724-736 [FREE Full text] [doi: 10.1093/her/cyq017] [Medline: 20338978]"
    },
    {
      "title": "The effects of a pedometer-based behavioral modification program with telephone support on physical activity and sedentary behavior in type 2 diabetes patients",
      "authors": [
        "De Greef",
        "K Deforche",
        "B Ruige",
        "J Bouckaert",
        "Tudor-Locke Ce",
        "J Kaufman"
      ],
      "year": 2011,
      "doi": "10.1016/j.pec.2010.07.010",
      "journal": "Patient Educ Couns",
      "volume": "84",
      "issue": "2",
      "raw": "The effects of a pedometer-based behavioral modification program with telephone support on physical activity and sedentary behavior in type 2 diabetes patients \n\t\t \n\t\t\t De Greef \n\t\t \n\t\t \n\t\t\t K P Deforche \n\t\t \n\t\t \n\t\t\t B I Ruige \n\t\t \n\t\t \n\t\t\t J B Bouckaert \n\t\t \n\t\t \n\t\t\t J J \n\t\t \n\t\t \n\t\t\t Tudor-Locke Ce \n\t\t \n\t\t \n\t\t\t J Kaufman \n\t\t \n\t\t 10.1016/j.pec.2010.07.010 \n\t\t Medline: 20732776 \n\t \n\t \n\t\t Patient Educ Couns \n\t\t \n\t\t\t 84 \n\t\t\t 2 \n\t\t\t \n\t\t\t 2011 Aug \n\t\t \n\t \n\t De Greef KP, Deforche BI, Ruige JB, Bouckaert JJ, Tudor-Locke CE, Kaufman J, et al. The effects of a pedometer-based behavioral modification program with telephone support on physical activity and sedentary behavior in type 2 diabetes patients. Patient Educ Couns 2011 Aug;84(2):275-279. [doi: 10.1016/j.pec.2010.07.010] [Medline: 20732776]"
    },
    {
      "title": "Physical activity levels in adults and older adults 3-4 years after pedometer-based walking interventions: Long-term follow-up of participants from two randomised controlled trials in UK primary care",
      "authors": [
        "T Harris",
        "S Kerry",
        "E Limb",
        "C Furness",
        "C Wahlich",
        "C Victor"
      ],
      "year": 2018,
      "doi": "10.1371/journal.pmed.1002526",
      "journal": "PLoS Med",
      "volume": "15",
      "issue": "3",
      "pages": "1002526",
      "raw": "Physical activity levels in adults and older adults 3-4 years after pedometer-based walking interventions: Long-term follow-up of participants from two randomised controlled trials in UK primary care \n\t\t \n\t\t\t T Harris \n\t\t \n\t\t \n\t\t\t S M Kerry \n\t\t \n\t\t \n\t\t\t E S Limb \n\t\t \n\t\t \n\t\t\t C Furness \n\t\t \n\t\t \n\t\t\t C Wahlich \n\t\t \n\t\t \n\t\t\t C R Victor \n\t\t \n\t\t 10.1371/journal.pmed.1002526 \n\t \n\t \n\t\t PLoS Med \n\t\t \n\t\t\t 15 \n\t\t\t 3 \n\t\t\t 1002526 \n\t\t\t 2018 Mar \n\t\t \n\t \n\t FREE Full text \n\t Harris T, Kerry SM, Limb ES, Furness C, Wahlich C, Victor CR, et al. Physical activity levels in adults and older adults 3-4 years after pedometer-based walking interventions: Long-term follow-up of participants from two randomised controlled trials in UK primary care. PLoS Med 2018 Mar;15(3):e1002526 [FREE Full text] [doi: 10.1371/journal.pmed.1002526] 29522529]"
    },
    {
      "title": "Healthy Steps trial: pedometer-based advice and physical activity for low-active older adults",
      "authors": [
        "G Kolt",
        "G Schofield",
        "N Kerse",
        "N Garrett",
        "T Ashton",
        "A Patel"
      ],
      "year": 2012,
      "doi": "10.1370/afm.1345",
      "journal": "Ann Fam Med",
      "volume": "10",
      "issue": "3",
      "raw": "Healthy Steps trial: pedometer-based advice and physical activity for low-active older adults \n\t\t \n\t\t\t G S Kolt \n\t\t \n\t\t \n\t\t\t G M Schofield \n\t\t \n\t\t \n\t\t\t N Kerse \n\t\t \n\t\t \n\t\t\t N Garrett \n\t\t \n\t\t \n\t\t\t T Ashton \n\t\t \n\t\t \n\t\t\t A Patel \n\t\t \n\t\t 10.1370/afm.1345 \n\t\t Medline: 22585884 \n\t \n\t \n\t\t Ann Fam Med \n\t\t \n\t\t\t 10 \n\t\t\t 3 \n\t\t\t \n\t\t\t 2012 \n\t\t \n\t \n\t FREE Full text \n\t Kolt GS, Schofield GM, Kerse N, Garrett N, Ashton T, Patel A. Healthy Steps trial: pedometer-based advice and physical activity for low-active older adults. Ann Fam Med 2012;10(3):206-212 [FREE Full text] [doi: 10.1370/afm.1345] [Medline: 22585884]"
    },
    {
      "title": "Correction: the effect of a programme to improve men's sedentary time and physical activity: the European Fans in Training (EuroFIT) randomised controlled trial",
      "authors": [
        "S Wyke",
        "C Bunn",
        "E Andersen",
        "M Silva",
        "F Van Nassau",
        "P Mcskimming"
      ],
      "year": 2019,
      "doi": "10.1371/journal.pmed.1002772",
      "journal": "PLoS Med",
      "volume": "16",
      "issue": "3",
      "pages": "1002772",
      "raw": "Correction: the effect of a programme to improve men's sedentary time and physical activity: the European Fans in Training (EuroFIT) randomised controlled trial \n\t\t \n\t\t\t S Wyke \n\t\t \n\t\t \n\t\t\t C Bunn \n\t\t \n\t\t \n\t\t\t E Andersen \n\t\t \n\t\t \n\t\t\t M N Silva \n\t\t \n\t\t \n\t\t\t F Van Nassau \n\t\t \n\t\t \n\t\t\t P Mcskimming \n\t\t \n\t\t 10.1371/journal.pmed.1002772 \n\t\t Medline: 30870433 \n\t \n\t \n\t\t PLoS Med \n\t\t \n\t\t\t 16 \n\t\t\t 3 \n\t\t\t 1002772 \n\t\t\t 2019 Mar \n\t\t \n\t \n\t FREE Full text \n\t Wyke S, Bunn C, Andersen E, Silva MN, Van Nassau F, McSkimming P, et al. Correction: the effect of a programme to improve men's sedentary time and physical activity: the European Fans in Training (EuroFIT) randomised controlled trial. PLoS Med 2019 Mar;16(3):e1002772 [FREE Full text] [doi: 10.1371/journal.pmed.1002772] [Medline: 30870433]"
    },
    {
      "title": "Walking away from type 2 diabetes: a cluster randomized controlled trial",
      "authors": [
        "T Yates",
        "C Edwardson",
        "J Henson",
        "L Gray",
        "N Ashra",
        "J Troughton"
      ],
      "year": 2017,
      "doi": "10.1111/dme.13254",
      "journal": "Diabet Med",
      "volume": "34",
      "issue": "5",
      "raw": "Walking away from type 2 diabetes: a cluster randomized controlled trial \n\t\t \n\t\t\t T Yates \n\t\t \n\t\t \n\t\t\t C L Edwardson \n\t\t \n\t\t \n\t\t\t J Henson \n\t\t \n\t\t \n\t\t\t L J Gray \n\t\t \n\t\t \n\t\t\t N B Ashra \n\t\t \n\t\t \n\t\t\t J Troughton \n\t\t \n\t\t 10.1111/dme.13254 \n\t\t Medline: 27589017 \n\t \n\t \n\t\t Diabet Med \n\t\t \n\t\t\t 34 \n\t\t\t 5 \n\t\t\t \n\t\t\t 2017 May \n\t\t \n\t \n\t Yates T, Edwardson CL, Henson J, Gray LJ, Ashra NB, Troughton J, et al. Walking away from type 2 diabetes: a cluster randomized controlled trial. Diabet Med 2017 May;34(5):698-707. [doi: 10.1111/dme.13254] [Medline: 27589017]"
    },
    {
      "title": "Behavioural intervention to increase physical activity in adults with coronary heart disease in Jordan",
      "authors": [
        "E Alsaleh",
        "R Windle",
        "H Blake"
      ],
      "year": 2016,
      "doi": "10.1186/s12889-016-3313-5",
      "journal": "BMC Public Health",
      "volume": "16",
      "pages": "643",
      "raw": "Behavioural intervention to increase physical activity in adults with coronary heart disease in Jordan \n\t\t \n\t\t\t E Alsaleh \n\t\t \n\t\t \n\t\t\t R Windle \n\t\t \n\t\t \n\t\t\t H Blake \n\t\t \n\t\t 10.1186/s12889-016-3313-5 \n\t\t Medline: 27460675 \n\t \n\t \n\t\t BMC Public Health \n\t\t \n\t\t\t 16 \n\t\t\t 643 \n\t\t\t 2016 Jul 26 \n\t\t \n\t \n\t FREE Full text \n\t Alsaleh E, Windle R, Blake H. Behavioural intervention to increase physical activity in adults with coronary heart disease in Jordan. BMC Public Health 2016 Jul 26;16:643 [FREE Full text] [doi: 10.1186/s12889-016-3313-5] [Medline: 27460675]"
    },
    {
      "title": "Feasibility and preliminary efficacy of the 'HEYMAN' healthy lifestyle program for young men: a pilot randomised controlled trial",
      "authors": [
        "L Ashton",
        "P Morgan",
        "M Hutchesson",
        "M Rollo",
        "C Collins"
      ],
      "year": 2017,
      "doi": "10.1186/s12937-017-0227-8",
      "journal": "Nutr J",
      "volume": "16",
      "issue": "1",
      "raw": "Feasibility and preliminary efficacy of the 'HEYMAN' healthy lifestyle program for young men: a pilot randomised controlled trial \n\t\t \n\t\t\t L M Ashton \n\t\t \n\t\t \n\t\t\t P J Morgan \n\t\t \n\t\t \n\t\t\t M J Hutchesson \n\t\t \n\t\t \n\t\t\t M E Rollo \n\t\t \n\t\t \n\t\t\t C E Collins \n\t\t \n\t\t 10.1186/s12937-017-0227-8 \n\t\t Medline: 28086890 \n\t \n\t \n\t\t Nutr J \n\t\t \n\t\t\t 16 \n\t\t\t 1 \n\t\t\t 2017 Jan 13 \n\t\t \n\t \n\t FREE Full text \n\t Ashton LM, Morgan PJ, Hutchesson MJ, Rollo ME, Collins CE. Feasibility and preliminary efficacy of the 'HEYMAN' healthy lifestyle program for young men: a pilot randomised controlled trial. Nutr J 2017 Jan 13;16(1):2 [FREE Full text] [doi: 10.1186/s12937-017-0227-8] [Medline: 28086890]"
    },
    {
      "title": "The effect of a pedometer-based community walking intervention \"Walking for Wellbeing in the West\" on physical activity levels and health outcomes: a 12-week randomized controlled trial",
      "authors": [
        "G Baker",
        "S Gray",
        "A Wright",
        "C Fitzsimons",
        "M Nimmo",
        "R ; Lowry",
        ") Sparcoll"
      ],
      "year": 2008,
      "doi": "10.1186/1479-5868-5-44",
      "journal": "Int J Behav Nutr Phys Act",
      "volume": "5",
      "pages": "44",
      "raw": "The effect of a pedometer-based community walking intervention \"Walking for Wellbeing in the West\" on physical activity levels and health outcomes: a 12-week randomized controlled trial \n\t\t \n\t\t\t G Baker \n\t\t\t \n\t\t\t\t Scottish Physical Activity Research Collaboration \n\t\t\t \n\t\t \n\t\t \n\t\t\t S R Gray \n\t\t\t \n\t\t\t\t Scottish Physical Activity Research Collaboration \n\t\t\t \n\t\t \n\t\t \n\t\t\t A Wright \n\t\t\t \n\t\t\t\t Scottish Physical Activity Research Collaboration \n\t\t\t \n\t\t \n\t\t \n\t\t\t C Fitzsimons \n\t\t\t \n\t\t\t\t Scottish Physical Activity Research Collaboration \n\t\t\t \n\t\t \n\t\t \n\t\t\t M Nimmo \n\t\t\t \n\t\t\t\t Scottish Physical Activity Research Collaboration \n\t\t\t \n\t\t \n\t\t \n\t\t\t R ; Lowry \n\t\t\t \n\t\t\t\t Scottish Physical Activity Research Collaboration \n\t\t\t \n\t\t \n\t\t \n\t\t\t ) Sparcoll \n\t\t\t \n\t\t\t\t Scottish Physical Activity Research Collaboration \n\t\t\t \n\t\t \n\t\t 10.1186/1479-5868-5-44 \n\t\t Medline: 18775062 \n\t \n\t \n\t\t Int J Behav Nutr Phys Act \n\t\t \n\t\t\t 5 \n\t\t\t 44 \n\t\t\t 2008 Sep 05 \n\t\t \n\t \n\t FREE Full text \n\t Baker G, Gray SR, Wright A, Fitzsimons C, Nimmo M, Lowry R, Scottish Physical Activity Research Collaboration (SPARColl). The effect of a pedometer-based community walking intervention \"Walking for Wellbeing in the West\" on physical activity levels and health outcomes: a 12-week randomized controlled trial. Int J Behav Nutr Phys Act 2008 Sep 05;5:44 [FREE Full text] [doi: 10.1186/1479-5868-5-44] [Medline: 18775062]"
    },
    {
      "title": "Physical activity, sedentary behavior and total wellness changes among sedentary adults: a 4-week randomized controlled trial",
      "authors": [
        "F Barwais",
        "T Cuddihy",
        "L Tomson"
      ],
      "year": 2013,
      "doi": "10.1186/1477-7525-11-183",
      "journal": "Health Qual Life Outcomes",
      "volume": "11",
      "pages": "183",
      "raw": "Physical activity, sedentary behavior and total wellness changes among sedentary adults: a 4-week randomized controlled trial \n\t\t \n\t\t\t F A Barwais \n\t\t \n\t\t \n\t\t\t T F Cuddihy \n\t\t \n\t\t \n\t\t\t L M Tomson \n\t\t \n\t\t 10.1186/1477-7525-11-183 \n\t\t Medline: 24168638 \n\t \n\t \n\t\t Health Qual Life Outcomes \n\t\t \n\t\t\t 11 \n\t\t\t 183 \n\t\t\t 2013 Oct 29 \n\t\t \n\t \n\t FREE Full text \n\t Barwais FA, Cuddihy TF, Tomson LM. Physical activity, sedentary behavior and total wellness changes among sedentary adults: a 4-week randomized controlled trial. Health Qual Life Outcomes 2013 Oct 29;11:183 [FREE Full text] [doi: 10.1186/1477-7525-11-183] [Medline: 24168638]"
    },
    {
      "title": "Pedometers may not provide a positive effect on walking activity",
      "authors": [
        "L Butler",
        "D Dwyer"
      ],
      "year": 2004,
      "doi": "10.1071/he04134",
      "journal": "Health Promot J Aust",
      "volume": "15",
      "issue": "2",
      "raw": "Pedometers may not provide a positive effect on walking activity \n\t\t \n\t\t\t L Butler \n\t\t \n\t\t \n\t\t\t D Dwyer \n\t\t \n\t\t 10.1071/he04134 \n\t \n\t \n\t\t Health Promot J Aust \n\t\t \n\t\t\t 15 \n\t\t\t 2 \n\t\t\t \n\t\t\t 2004 Aug 01 \n\t\t \n\t \n\t Butler L, Dwyer D. Pedometers may not provide a positive effect on walking activity. Health Promot J Aust 2004 Aug 01;15(2):134-136. [doi: 10.1071/he04134]"
    },
    {
      "title": "Building a physical activity intervention into clinical care for breast and colorectal cancer survivors in Wisconsin: a randomized controlled pilot trial",
      "authors": [
        "L Cadmus-Bertram",
        "A Tevaarwerk",
        "M Sesto",
        "R Gangnon",
        "B Van Remortel",
        "P Date"
      ],
      "year": 2019,
      "doi": "10.1007/s11764-019-00778-6",
      "journal": "J Cancer Surviv",
      "volume": "13",
      "issue": "4",
      "raw": "Building a physical activity intervention into clinical care for breast and colorectal cancer survivors in Wisconsin: a randomized controlled pilot trial \n\t\t \n\t\t\t L Cadmus-Bertram \n\t\t \n\t\t \n\t\t\t A J Tevaarwerk \n\t\t \n\t\t \n\t\t\t M E Sesto \n\t\t \n\t\t \n\t\t\t R Gangnon \n\t\t \n\t\t \n\t\t\t B Van Remortel \n\t\t \n\t\t \n\t\t\t P Date \n\t\t \n\t\t 10.1007/s11764-019-00778-6 \n\t\t Medline: 31264183 \n\t \n\t \n\t\t J Cancer Surviv \n\t\t \n\t\t\t 13 \n\t\t\t 4 \n\t\t\t \n\t\t\t 2019 Aug \n\t\t \n\t \n\t FREE Full text \n\t Cadmus-Bertram L, Tevaarwerk AJ, Sesto ME, Gangnon R, Van Remortel B, Date P. Building a physical activity intervention into clinical care for breast and colorectal cancer survivors in Wisconsin: a randomized controlled pilot trial. J Cancer Surviv 2019 Aug;13(4):593-602 [FREE Full text] [doi: 10.1007/s11764-019-00778-6] [Medline: 31264183]"
    },
    {
      "title": "Effectiveness of a web-based, computer-tailored, pedometer-based physical activity intervention for adults: a cluster randomized controlled trial",
      "authors": [
        "S Compernolle",
        "C Vandelanotte",
        "G Cardon",
        "De Bourdeaudhuij",
        "De Cocker"
      ],
      "year": 2015,
      "doi": "10.2196/jmir.3402",
      "journal": "J Med Internet Res",
      "volume": "17",
      "issue": "2",
      "pages": "38",
      "raw": "Effectiveness of a web-based, computer-tailored, pedometer-based physical activity intervention for adults: a cluster randomized controlled trial \n\t\t \n\t\t\t S Compernolle \n\t\t \n\t\t \n\t\t\t C Vandelanotte \n\t\t \n\t\t \n\t\t\t G Cardon \n\t\t \n\t\t \n\t\t\t De Bourdeaudhuij \n\t\t \n\t\t \n\t\t\t I \n\t\t \n\t\t \n\t\t\t De Cocker \n\t\t \n\t\t \n\t\t\t K \n\t\t \n\t\t 10.2196/jmir.3402 \n\t\t Medline: 25665498 \n\t \n\t \n\t\t J Med Internet Res \n\t\t \n\t\t\t 17 \n\t\t\t 2 \n\t\t\t 38 \n\t\t\t 2015 Feb 09 \n\t\t \n\t \n\t FREE Full text \n\t Compernolle S, Vandelanotte C, Cardon G, De Bourdeaudhuij I, De Cocker K. Effectiveness of a web-based, computer-tailored, pedometer-based physical activity intervention for adults: a cluster randomized controlled trial. J Med Internet Res 2015 Feb 09;17(2):e38 [FREE Full text] [doi: 10.2196/jmir.3402] [Medline: 25665498]"
    },
    {
      "title": "A randomized trial comparing two interventions to increase physical activity among patients undergoing bariatric surgery",
      "authors": [
        "D Creel",
        "L Schuh",
        "C Reed",
        "A Gomez",
        "L Hurst",
        "J Stote"
      ],
      "year": 2016,
      "doi": "10.1002/oby.21548",
      "journal": "Obesity",
      "volume": "24",
      "issue": "8",
      "raw": "A randomized trial comparing two interventions to increase physical activity among patients undergoing bariatric surgery \n\t\t \n\t\t\t D B Creel \n\t\t \n\t\t \n\t\t\t L M Schuh \n\t\t \n\t\t \n\t\t\t C A Reed \n\t\t \n\t\t \n\t\t\t A R Gomez \n\t\t \n\t\t \n\t\t\t L A Hurst \n\t\t \n\t\t \n\t\t\t J Stote \n\t\t \n\t\t 10.1002/oby.21548 \n\t\t Medline: 27367821 \n\t \n\t \n\t\t Obesity \n\t\t \n\t\t\t 24 \n\t\t\t 8 \n\t\t\t \n\t\t\t 2016 Aug \n\t\t\t Silver Spring \n\t\t \n\t \n\t FREE Full text \n\t Creel DB, Schuh LM, Reed CA, Gomez AR, Hurst LA, Stote J, et al. A randomized trial comparing two interventions to increase physical activity among patients undergoing bariatric surgery. Obesity (Silver Spring) 2016 Aug;24(8):1660-1668 [FREE Full text] [doi: 10.1002/oby.21548] [Medline: 27367821]"
    },
    {
      "title": "Promoting physical activity in worksite settings: results of a German pilot study of the online intervention Healingo fit",
      "authors": [
        "K Dadaczynski",
        "S Schiemann",
        "O Backhaus"
      ],
      "year": 2017,
      "doi": "10.1186/s12889-017-4697-6",
      "journal": "BMC Public Health",
      "volume": "17",
      "issue": "1",
      "pages": "696",
      "raw": "Promoting physical activity in worksite settings: results of a German pilot study of the online intervention Healingo fit \n\t\t \n\t\t\t K Dadaczynski \n\t\t \n\t\t \n\t\t\t S Schiemann \n\t\t \n\t\t \n\t\t\t O Backhaus \n\t\t \n\t\t 10.1186/s12889-017-4697-6 \n\t\t Medline: 28886734 \n\t \n\t \n\t\t BMC Public Health \n\t\t \n\t\t\t 17 \n\t\t\t 1 \n\t\t\t 696 \n\t\t\t 2017 Sep 08 \n\t\t \n\t \n\t FREE Full text \n\t Dadaczynski K, Schiemann S, Backhaus O. Promoting physical activity in worksite settings: results of a German pilot study of the online intervention Healingo fit. BMC Public Health 2017 Sep 08;17(1):696 [FREE Full text] [doi: 10.1186/s12889-017-4697-6] [Medline: 28886734]"
    },
    {
      "title": "The effects of a lifestyle physical activity counseling program with feedback of a pedometer during pulmonary rehabilitation in patients with COPD: a pilot study",
      "authors": [
        "B De Blok",
        "M De Greef",
        "N Hacken",
        "S Sprenger",
        "K Postema",
        "J Wempe"
      ],
      "year": 2006,
      "doi": "10.1016/j.pec.2005.02.005",
      "journal": "Patient Educ Couns",
      "volume": "61",
      "issue": "1",
      "raw": "The effects of a lifestyle physical activity counseling program with feedback of a pedometer during pulmonary rehabilitation in patients with COPD: a pilot study \n\t\t \n\t\t\t B M De Blok \n\t\t \n\t\t \n\t\t\t M H De Greef \n\t\t \n\t\t \n\t\t\t N H Hacken \n\t\t \n\t\t \n\t\t\t S R Sprenger \n\t\t \n\t\t \n\t\t\t K Postema \n\t\t \n\t\t \n\t\t\t J B Wempe \n\t\t \n\t\t 10.1016/j.pec.2005.02.005 \n\t\t Medline: 16455222 \n\t \n\t \n\t\t Patient Educ Couns \n\t\t \n\t\t\t 61 \n\t\t\t 1 \n\t\t\t \n\t\t\t 2006 Apr \n\t\t \n\t \n\t de Blok BM, de Greef MH, Hacken NH, Sprenger SR, Postema K, Wempe JB. The effects of a lifestyle physical activity counseling program with feedback of a pedometer during pulmonary rehabilitation in patients with COPD: a pilot study. Patient Educ Couns 2006 Apr;61(1):48-55. [doi: 10.1016/j.pec.2005.02.005] [Medline: 16455222]"
    },
    {
      "title": "Increasing physical activity in Belgian type 2 diabetes patients: a three-arm randomized controlled trial",
      "authors": [
        "K De Greef",
        "B Deforche",
        "C Tudor-Locke",
        "De Bourdeaudhuij"
      ],
      "year": 2011,
      "doi": "10.1007/s12529-010-9124-7",
      "journal": "Int J Behav Med",
      "volume": "18",
      "issue": "3",
      "raw": "Increasing physical activity in Belgian type 2 diabetes patients: a three-arm randomized controlled trial \n\t\t \n\t\t\t K De Greef \n\t\t \n\t\t \n\t\t\t B Deforche \n\t\t \n\t\t \n\t\t\t C Tudor-Locke \n\t\t \n\t\t \n\t\t\t De Bourdeaudhuij \n\t\t \n\t\t \n\t\t\t I \n\t\t \n\t\t 10.1007/s12529-010-9124-7 \n\t\t Medline: 21052886 \n\t \n\t \n\t\t Int J Behav Med \n\t\t \n\t\t\t 18 \n\t\t\t 3 \n\t\t\t \n\t\t\t 2011 Sep \n\t\t \n\t \n\t De Greef K, Deforche B, Tudor-Locke C, De Bourdeaudhuij I. Increasing physical activity in Belgian type 2 diabetes patients: a three-arm randomized controlled trial. Int J Behav Med 2011 Sep;18(3):188-198. [doi: 10.1007/s12529-010-9124-7] [Medline: 21052886]"
    },
    {
      "title": "PROactive study groupthe PROactive consortium. Physical activity is increased by a 12-week semiautomated telecoaching programme in patients with COPD: a multicentre randomised controlled trial",
      "authors": [
        "H Demeyer",
        "Z Louvaris",
        "A Frei",
        "R Rabinovich",
        "C De Jong",
        "E Gimeno-Santos",
        "Mr Papp"
      ],
      "year": 2017,
      "doi": "10.1136/thoraxjnl-2016-209026",
      "journal": "Thorax",
      "volume": "72",
      "issue": "5",
      "raw": "PROactive study groupthe PROactive consortium. Physical activity is increased by a 12-week semiautomated telecoaching programme in patients with COPD: a multicentre randomised controlled trial \n\t\t \n\t\t\t H Demeyer \n\t\t \n\t\t \n\t\t\t Z Louvaris \n\t\t \n\t\t \n\t\t\t A Frei \n\t\t \n\t\t \n\t\t\t R A Rabinovich \n\t\t \n\t\t \n\t\t\t C De Jong \n\t\t \n\t\t \n\t\t\t E Gimeno-Santos \n\t\t \n\t\t \n\t\t\t Mr Papp \n\t\t \n\t\t 10.1136/thoraxjnl-2016-209026 \n\t\t Medline: 28137918 \n\t \n\t \n\t\t Thorax \n\t\t \n\t\t\t 72 \n\t\t\t 5 \n\t\t\t \n\t\t\t 2017 May \n\t\t \n\t \n\t FREE Full text \n\t Demeyer H, Louvaris Z, Frei A, Rabinovich RA, de Jong C, Gimeno-Santos E, Mr Papp PROactive study groupthe PROactive consortium. Physical activity is increased by a 12-week semiautomated telecoaching programme in patients with COPD: a multicentre randomised controlled trial. Thorax 2017 May;72(5):415-423 [FREE Full text] [doi: 10.1136/thoraxjnl-2016-209026] [Medline: 28137918]"
    },
    {
      "title": "Move to improve: a randomized workplace trial to increase physical activity",
      "authors": [
        "R Dishman",
        "D Dejoy",
        "M Wilson",
        "R Vandenberg"
      ],
      "year": 2009,
      "doi": "10.1016/j.amepre.2008.09.038",
      "journal": "Am J Prev Med",
      "volume": "36",
      "issue": "2",
      "raw": "Move to improve: a randomized workplace trial to increase physical activity \n\t\t \n\t\t\t R K Dishman \n\t\t \n\t\t \n\t\t\t D M Dejoy \n\t\t \n\t\t \n\t\t\t M G Wilson \n\t\t \n\t\t \n\t\t\t R J Vandenberg \n\t\t \n\t\t 10.1016/j.amepre.2008.09.038 \n\t\t Medline: 19135905 \n\t \n\t \n\t\t Am J Prev Med \n\t\t \n\t\t\t 36 \n\t\t\t 2 \n\t\t\t \n\t\t\t 2009 Feb \n\t\t \n\t \n\t Dishman RK, DeJoy DM, Wilson MG, Vandenberg RJ. Move to improve: a randomized workplace trial to increase physical activity. Am J Prev Med 2009 Feb;36(2):133-141. [doi: 10.1016/j.amepre.2008.09.038] [Medline: 19135905]"
    },
    {
      "title": "Sisters in motion: a randomized controlled trial of a faith-based physical activity intervention",
      "authors": [
        "O Duru",
        "C Sarkisian",
        "M Leng",
        "C Mangione"
      ],
      "year": 2010,
      "doi": "10.1111/j.1532-5415.2010.03082.x",
      "journal": "J Am Geriatr Soc",
      "volume": "58",
      "issue": "10",
      "raw": "Sisters in motion: a randomized controlled trial of a faith-based physical activity intervention \n\t\t \n\t\t\t O K Duru \n\t\t \n\t\t \n\t\t\t C A Sarkisian \n\t\t \n\t\t \n\t\t\t M Leng \n\t\t \n\t\t \n\t\t\t C M Mangione \n\t\t \n\t\t 10.1111/j.1532-5415.2010.03082.x \n\t\t Medline: 20929464 \n\t \n\t \n\t\t J Am Geriatr Soc \n\t\t \n\t\t\t 58 \n\t\t\t 10 \n\t\t\t \n\t\t\t 2010 Oct \n\t\t \n\t \n\t FREE Full text \n\t Duru OK, Sarkisian CA, Leng M, Mangione CM. Sisters in motion: a randomized controlled trial of a faith-based physical activity intervention. J Am Geriatr Soc 2010 Oct;58(10):1863-1869 [FREE Full text] [doi: 10.1111/j.1532-5415.2010.03082.x] [Medline: 20929464]"
    },
    {
      "title": "Impact of using a pedometer on time spent walking in older adults with type 2 diabetes",
      "authors": [
        "L Engel",
        "H Lindner"
      ],
      "year": 2006,
      "doi": "10.1177/0145721705284373",
      "journal": "Diabetes Educ",
      "volume": "32",
      "issue": "1",
      "raw": "Impact of using a pedometer on time spent walking in older adults with type 2 diabetes \n\t\t \n\t\t\t L Engel \n\t\t \n\t\t \n\t\t\t H Lindner \n\t\t \n\t\t 10.1177/0145721705284373 \n\t\t Medline: 16439498 \n\t \n\t \n\t\t Diabetes Educ \n\t\t \n\t\t\t 32 \n\t\t\t 1 \n\t\t\t \n\t\t\t 2006 \n\t\t \n\t \n\t Engel L, Lindner H. Impact of using a pedometer on time spent walking in older adults with type 2 diabetes. Diabetes Educ 2006;32(1):98-107. [doi: 10.1177/0145721705284373] [Medline: 16439498]"
    },
    {
      "title": "MobileMums: a randomized controlled trial of an SMS-based physical activity intervention",
      "authors": [
        "B Fjeldsoe",
        "Y Miller",
        "A Marshall"
      ],
      "year": 2010,
      "doi": "10.1007/s12160-010-9170-z",
      "journal": "Ann Behav Med",
      "volume": "39",
      "issue": "2",
      "raw": "MobileMums: a randomized controlled trial of an SMS-based physical activity intervention \n\t\t \n\t\t\t B S Fjeldsoe \n\t\t \n\t\t \n\t\t\t Y D Miller \n\t\t \n\t\t \n\t\t\t A L Marshall \n\t\t \n\t\t 10.1007/s12160-010-9170-z \n\t\t Medline: 20174902 \n\t \n\t \n\t\t Ann Behav Med \n\t\t \n\t\t\t 39 \n\t\t\t 2 \n\t\t\t \n\t\t\t 2010 May \n\t\t \n\t \n\t Fjeldsoe BS, Miller YD, Marshall AL. MobileMums: a randomized controlled trial of an SMS-based physical activity intervention. Ann Behav Med 2010 May;39(2):101-111. [doi: 10.1007/s12160-010-9170-z] [Medline: 20174902]"
    },
    {
      "title": "The use of text messaging to promote physical activity in working women: a randomized controlled trial",
      "authors": [
        "N Gell",
        "D Wadsworth"
      ],
      "year": 2015,
      "doi": "10.1123/jpah.2013-0144",
      "journal": "J Phys Act Health",
      "volume": "12",
      "issue": "6",
      "raw": "The use of text messaging to promote physical activity in working women: a randomized controlled trial \n\t\t \n\t\t\t N M Gell \n\t\t \n\t\t \n\t\t\t D D Wadsworth \n\t\t \n\t\t 10.1123/jpah.2013-0144 \n\t\t Medline: 25110303 \n\t \n\t \n\t\t J Phys Act Health \n\t\t \n\t\t\t 12 \n\t\t\t 6 \n\t\t\t \n\t\t\t 2015 Jun \n\t\t \n\t \n\t FREE Full text \n\t Gell NM, Wadsworth DD. The use of text messaging to promote physical activity in working women: a randomized controlled trial. J Phys Act Health 2015 Jun;12(6):756-763 [FREE Full text] [doi: 10.1123/jpah.2013-0144] [Medline: 25110303]"
    },
    {
      "title": "The HealtheSteps\u2122 lifestyle prescription program to improve physical activity and modifiable risk factors for chronic disease: a pragmatic randomized controlled trial",
      "authors": [
        "D Gill",
        "W Blunt",
        "N Silva",
        "C Stiller-Moldovan",
        "G Zou",
        "R Petrella"
      ],
      "year": 2019,
      "doi": "10.1186/s12889-019-7141-2",
      "journal": "BMC Public Health",
      "volume": "19",
      "issue": "1",
      "pages": "841",
      "raw": "The HealtheSteps\u2122 lifestyle prescription program to improve physical activity and modifiable risk factors for chronic disease: a pragmatic randomized controlled trial \n\t\t \n\t\t\t D P Gill \n\t\t \n\t\t \n\t\t\t W Blunt \n\t\t \n\t\t \n\t\t\t N C Silva \n\t\t \n\t\t \n\t\t\t C Stiller-Moldovan \n\t\t \n\t\t \n\t\t\t G Y Zou \n\t\t \n\t\t \n\t\t\t R J Petrella \n\t\t \n\t\t 10.1186/s12889-019-7141-2 \n\t\t Medline: 31253112 \n\t \n\t \n\t\t BMC Public Health \n\t\t \n\t\t\t 19 \n\t\t\t 1 \n\t\t\t 841 \n\t\t\t 2019 Jun 28 \n\t\t \n\t \n\t FREE Full text \n\t Gill DP, Blunt W, Silva NC, Stiller-Moldovan C, Zou GY, Petrella RJ. The HealtheSteps\u2122 lifestyle prescription program to improve physical activity and modifiable risk factors for chronic disease: a pragmatic randomized controlled trial. BMC Public Health 2019 Jun 28;19(1):841 [FREE Full text] [doi: 10.1186/s12889-019-7141-2] [Medline: 31253112]"
    },
    {
      "title": "Effectiveness of a smartphone application to promote physical activity in primary care: the SMART MOVE randomised controlled trial",
      "authors": [
        "L Glynn",
        "P Hayes",
        "M Casey",
        "F Glynn",
        "A Alvarez-Iglesias",
        "J Newell"
      ],
      "year": 2014,
      "doi": "10.3399/bjgp14x680461",
      "journal": "Br J Gen Pract",
      "volume": "64",
      "issue": "624",
      "raw": "Effectiveness of a smartphone application to promote physical activity in primary care: the SMART MOVE randomised controlled trial \n\t\t \n\t\t\t L G Glynn \n\t\t \n\t\t \n\t\t\t P S Hayes \n\t\t \n\t\t \n\t\t\t M Casey \n\t\t \n\t\t \n\t\t\t F Glynn \n\t\t \n\t\t \n\t\t\t A Alvarez-Iglesias \n\t\t \n\t\t \n\t\t\t J Newell \n\t\t \n\t\t 10.3399/bjgp14x680461 \n\t\t Medline: 24982490 \n\t \n\t \n\t\t Br J Gen Pract \n\t\t \n\t\t\t 64 \n\t\t\t 624 \n\t\t\t \n\t\t\t 2014 Jul \n\t\t \n\t \n\t FREE Full text \n\t Glynn LG, Hayes PS, Casey M, Glynn F, Alvarez-Iglesias A, Newell J, et al. Effectiveness of a smartphone application to promote physical activity in primary care: the SMART MOVE randomised controlled trial. Br J Gen Pract 2014 Jul;64(624):384-391 [FREE Full text] [doi: 10.3399/bjgp14X680461] [Medline: 24982490]"
    },
    {
      "title": "Evaluation of a very brief pedometer-based physical activity intervention delivered in NHS Health Checks in England: the VBI randomised controlled trial",
      "authors": [
        "W Hardeman",
        "J Mitchell",
        "S Pears",
        "M Van Emmenis",
        "F Theil",
        "V Gc",
        "Research Vbi"
      ],
      "year": 2020,
      "doi": "10.1371/journal.pmed.1003046",
      "journal": "PLoS Med",
      "volume": "17",
      "issue": "3",
      "pages": "1003046",
      "raw": "Evaluation of a very brief pedometer-based physical activity intervention delivered in NHS Health Checks in England: the VBI randomised controlled trial \n\t\t \n\t\t\t W Hardeman \n\t\t \n\t\t \n\t\t\t J Mitchell \n\t\t \n\t\t \n\t\t\t S Pears \n\t\t \n\t\t \n\t\t\t M Van Emmenis \n\t\t \n\t\t \n\t\t\t F Theil \n\t\t \n\t\t \n\t\t\t V S Gc \n\t\t \n\t\t \n\t\t\t Research Vbi \n\t\t \n\t\t \n\t\t\t Team \n\t\t \n\t\t 10.1371/journal.pmed.1003046 \n\t\t Medline: 32142507 \n\t \n\t \n\t\t PLoS Med \n\t\t \n\t\t\t 17 \n\t\t\t 3 \n\t\t\t 1003046 \n\t\t\t 2020 Mar \n\t\t \n\t \n\t FREE Full text \n\t Hardeman W, Mitchell J, Pears S, Van Emmenis M, Theil F, Gc VS, VBI Research Team. Evaluation of a very brief pedometer-based physical activity intervention delivered in NHS Health Checks in England: the VBI randomised controlled trial. PLoS Med 2020 Mar;17(3):e1003046 [FREE Full text] [doi: 10.1371/journal.pmed.1003046] [Medline: 32142507]"
    },
    {
      "title": "The effects of a physical activity counseling program after an exacerbation in patients with Chronic Obstructive Pulmonary Disease: a randomized controlled pilot study",
      "authors": [
        "M Hornikx",
        "H Demeyer",
        "C Camillo",
        "W Janssens",
        "T Troosters"
      ],
      "year": 2015,
      "doi": "10.1186/s12890-015-0126-8",
      "journal": "BMC Pulm Med",
      "volume": "15",
      "pages": "136",
      "raw": "The effects of a physical activity counseling program after an exacerbation in patients with Chronic Obstructive Pulmonary Disease: a randomized controlled pilot study \n\t\t \n\t\t\t M Hornikx \n\t\t \n\t\t \n\t\t\t H Demeyer \n\t\t \n\t\t \n\t\t\t C A Camillo \n\t\t \n\t\t \n\t\t\t W Janssens \n\t\t \n\t\t \n\t\t\t T Troosters \n\t\t \n\t\t 10.1186/s12890-015-0126-8 \n\t\t Medline: 26530543] 100 \n\t \n\t \n\t\t BMC Pulm Med \n\t\t \n\t\t\t 15 \n\t\t\t 136 \n\t\t\t 2015 Nov 04 \n\t\t \n\t \n\t FREE Full text \n\t Hornikx M, Demeyer H, Camillo CA, Janssens W, Troosters T. The effects of a physical activity counseling program after an exacerbation in patients with Chronic Obstructive Pulmonary Disease: a randomized controlled pilot study. BMC Pulm Med 2015 Nov 04;15:136 [FREE Full text] [doi: 10.1186/s12890-015-0126-8] [Medline: 26530543] 100."
    },
    {
      "title": "Enhancement of daily physical activity increases physical fitness of outclinic COPD patients: results of an exercise counseling program",
      "authors": [
        "G Hospes",
        "L Bossenbroek",
        "N Hacken",
        "Van Hengel",
        "De Greef"
      ],
      "year": 2009,
      "doi": "10.1016/j.pec.2008.10.005",
      "journal": "Patient Educ Couns",
      "volume": "75",
      "issue": "2",
      "raw": "Enhancement of daily physical activity increases physical fitness of outclinic COPD patients: results of an exercise counseling program \n\t\t \n\t\t\t G Hospes \n\t\t \n\t\t \n\t\t\t L Bossenbroek \n\t\t \n\t\t \n\t\t\t N H Hacken \n\t\t \n\t\t \n\t\t\t Van Hengel \n\t\t \n\t\t \n\t\t\t P \n\t\t \n\t\t \n\t\t\t De Greef \n\t\t \n\t\t \n\t\t\t M H \n\t\t \n\t\t 10.1016/j.pec.2008.10.005 \n\t\t Medline: 19036552] 101 \n\t \n\t \n\t\t Patient Educ Couns \n\t\t \n\t\t\t 75 \n\t\t\t 2 \n\t\t\t \n\t\t\t 2009 May \n\t\t \n\t \n\t Hospes G, Bossenbroek L, Hacken NH, Van Hengel P, De Greef MH. Enhancement of daily physical activity increases physical fitness of outclinic COPD patients: results of an exercise counseling program. Patient Educ Couns 2009 May;75(2):274-278. [doi: 10.1016/j.pec.2008.10.005] [Medline: 19036552] 101"
    },
    {
      "title": "Innovative program to increase physical activity following an acute coronary syndrome: randomized controlled trial",
      "authors": [
        "J Houle",
        "O Doyon",
        "N Vadeboncoeur",
        "G Turbide",
        "A Diaz",
        "P Poirier"
      ],
      "year": 2011,
      "doi": "10.1016/j.pec.2011.03.018",
      "journal": "Patient Educ Couns",
      "volume": "85",
      "issue": "3",
      "raw": "Innovative program to increase physical activity following an acute coronary syndrome: randomized controlled trial \n\t\t \n\t\t\t J Houle \n\t\t \n\t\t \n\t\t\t O Doyon \n\t\t \n\t\t \n\t\t\t N Vadeboncoeur \n\t\t \n\t\t \n\t\t\t G Turbide \n\t\t \n\t\t \n\t\t\t A Diaz \n\t\t \n\t\t \n\t\t\t P Poirier \n\t\t \n\t\t 10.1016/j.pec.2011.03.018 \n\t\t Medline: 21546203] 102 \n\t \n\t \n\t\t Patient Educ Couns \n\t\t \n\t\t\t 85 \n\t\t\t 3 \n\t\t\t \n\t\t\t 2011 Dec \n\t\t \n\t \n\t Houle J, Doyon O, Vadeboncoeur N, Turbide G, Diaz A, Poirier P. Innovative program to increase physical activity following an acute coronary syndrome: randomized controlled trial. Patient Educ Couns 2011 Dec;85(3):237-244. [doi: 10.1016/j.pec.2011.03.018] [Medline: 21546203] 102"
    },
    {
      "title": "Comparison of walking recommendations in previously inactive women",
      "authors": [
        "C Hultquist",
        "C Albright",
        "D Thompson"
      ],
      "year": 2005,
      "doi": "10.1249/01.mss.0000158993.39760.1b",
      "journal": "Med Sci Sports Exerc",
      "volume": "37",
      "issue": "4",
      "raw": "Comparison of walking recommendations in previously inactive women \n\t\t \n\t\t\t C N Hultquist \n\t\t \n\t\t \n\t\t\t C Albright \n\t\t \n\t\t \n\t\t\t D L Thompson \n\t\t \n\t\t 10.1249/01.mss.0000158993.39760.1b \n\t\t Medline: 15809569] 103 \n\t \n\t \n\t\t Med Sci Sports Exerc \n\t\t \n\t\t\t 37 \n\t\t\t 4 \n\t\t\t \n\t\t\t 2005 Apr \n\t\t \n\t \n\t Hultquist CN, Albright C, Thompson DL. Comparison of walking recommendations in previously inactive women. Med Sci Sports Exerc 2005 Apr;37(4):676-683. [doi: 10.1249/01.mss.0000158993.39760.1b] [Medline: 15809569] 103"
    },
    {
      "title": "Determination of the effectiveness of accelerometer use in the promotion of physical activity in cardiac patients: a randomized controlled trial",
      "authors": [
        "K Izawa",
        "S Watanabe",
        "K Hiraki",
        "Y Morio",
        "Y Kasahara",
        "N Takeichi"
      ],
      "year": 2012,
      "doi": "10.1016/j.apmr.2012.06.015",
      "journal": "Arch Phys Med Rehabil",
      "volume": "93",
      "issue": "11",
      "raw": "Determination of the effectiveness of accelerometer use in the promotion of physical activity in cardiac patients: a randomized controlled trial \n\t\t \n\t\t\t K P Izawa \n\t\t \n\t\t \n\t\t\t S Watanabe \n\t\t \n\t\t \n\t\t\t K Hiraki \n\t\t \n\t\t \n\t\t\t Y Morio \n\t\t \n\t\t \n\t\t\t Y Kasahara \n\t\t \n\t\t \n\t\t\t N Takeichi \n\t\t \n\t\t 10.1016/j.apmr.2012.06.015 \n\t\t Medline: 22750166] 104 \n\t \n\t \n\t\t Arch Phys Med Rehabil \n\t\t \n\t\t\t 93 \n\t\t\t 11 \n\t\t\t \n\t\t\t 2012 Nov \n\t\t \n\t \n\t Izawa KP, Watanabe S, Hiraki K, Morio Y, Kasahara Y, Takeichi N, et al. Determination of the effectiveness of accelerometer use in the promotion of physical activity in cardiac patients: a randomized controlled trial. Arch Phys Med Rehabil 2012 Nov;93(11):1896-1902. [doi: 10.1016/j.apmr.2012.06.015] [Medline: 22750166] 104"
    },
    {
      "title": "A short-term physical activity randomized trial in the Lower Mississippi Delta",
      "authors": [
        "P Katzmarzyk",
        "C Champagne",
        "C Tudor-Locke",
        "S Broyles",
        "D Harsha",
        "B Kennedy"
      ],
      "year": 2011,
      "doi": "10.1371/journal.pone.0026667",
      "journal": "PLoS One",
      "volume": "6",
      "issue": "10",
      "pages": "26667",
      "raw": "A short-term physical activity randomized trial in the Lower Mississippi Delta \n\t\t \n\t\t\t P T Katzmarzyk \n\t\t \n\t\t \n\t\t\t C M Champagne \n\t\t \n\t\t \n\t\t\t C Tudor-Locke \n\t\t \n\t\t \n\t\t\t S T Broyles \n\t\t \n\t\t \n\t\t\t D Harsha \n\t\t \n\t\t \n\t\t\t B M Kennedy \n\t\t \n\t\t 10.1371/journal.pone.0026667 \n\t\t Medline: 22046325] 105 \n\t \n\t \n\t\t PLoS One \n\t\t \n\t\t\t 6 \n\t\t\t 10 \n\t\t\t 26667 \n\t\t\t 2011 \n\t\t \n\t \n\t FREE Full text \n\t Katzmarzyk PT, Champagne CM, Tudor-Locke C, Broyles ST, Harsha D, Kennedy BM, et al. A short-term physical activity randomized trial in the Lower Mississippi Delta. PLoS One 2011;6(10):e26667 [FREE Full text] [doi: 10.1371/journal.pone.0026667] [Medline: 22046325] 105"
    },
    {
      "title": "Effects of low-intensity exercise and home-based pulmonary rehabilitation with pedometer feedback on physical activity in elderly patients with chronic obstructive pulmonary disease",
      "authors": [
        "A Kawagoshi",
        "N Kiyokawa",
        "K Sugawara",
        "H Takahashi",
        "S Sakata",
        "M Satake"
      ],
      "year": 2015,
      "doi": "10.1016/j.rmed.2015.01.008",
      "journal": "Respir Med",
      "volume": "109",
      "issue": "3",
      "raw": "Effects of low-intensity exercise and home-based pulmonary rehabilitation with pedometer feedback on physical activity in elderly patients with chronic obstructive pulmonary disease \n\t\t \n\t\t\t A Kawagoshi \n\t\t \n\t\t \n\t\t\t N Kiyokawa \n\t\t \n\t\t \n\t\t\t K Sugawara \n\t\t \n\t\t \n\t\t\t H Takahashi \n\t\t \n\t\t \n\t\t\t S Sakata \n\t\t \n\t\t \n\t\t\t M Satake \n\t\t \n\t\t 10.1016/j.rmed.2015.01.008 \n\t\t Medline: 25682543] 106 \n\t \n\t \n\t\t Respir Med \n\t\t \n\t\t\t 109 \n\t\t\t 3 \n\t\t\t \n\t\t\t 2015 Mar \n\t\t \n\t \n\t FREE Full text \n\t Kawagoshi A, Kiyokawa N, Sugawara K, Takahashi H, Sakata S, Satake M, et al. Effects of low-intensity exercise and home-based pulmonary rehabilitation with pedometer feedback on physical activity in elderly patients with chronic obstructive pulmonary disease. Respir Med 2015 Mar;109(3):364-371 [FREE Full text] [doi: 10.1016/j.rmed.2015.01.008] [Medline: 25682543] 106"
    },
    {
      "title": "Employing virtual advisors in preventive care for underserved communities: results from the COMPASS study",
      "authors": [
        "A King",
        "T Bickmore",
        "M Campero",
        "L Pruitt",
        "J Yin"
      ],
      "year": 2013,
      "doi": "10.1080/10810730.2013.798374",
      "journal": "J Health Commun",
      "volume": "18",
      "issue": "12",
      "raw": "Employing virtual advisors in preventive care for underserved communities: results from the COMPASS study \n\t\t \n\t\t\t A C King \n\t\t \n\t\t \n\t\t\t T W Bickmore \n\t\t \n\t\t \n\t\t\t M I Campero \n\t\t \n\t\t \n\t\t\t L A Pruitt \n\t\t \n\t\t \n\t\t\t J L Yin \n\t\t \n\t\t 10.1080/10810730.2013.798374 \n\t\t Medline: 23941610] 107 \n\t \n\t \n\t\t J Health Commun \n\t\t \n\t\t\t 18 \n\t\t\t 12 \n\t\t\t \n\t\t\t 2013 \n\t\t \n\t \n\t FREE Full text \n\t King AC, Bickmore TW, Campero MI, Pruitt LA, Yin JL. Employing virtual advisors in preventive care for underserved communities: results from the COMPASS study. J Health Commun 2013;18(12):1449-1464 [FREE Full text] [doi: 10.1080/10810730.2013.798374] [Medline: 23941610] 107"
    },
    {
      "title": "Efficacy of a physical activity counseling program with use of a wearable tracker in people with inflammatory arthritis: a randomized controlled trial",
      "authors": [
        "L Li",
        "L Feehan",
        "H Xie",
        "N Lu",
        "C Shaw",
        "D Gromala"
      ],
      "year": 2020,
      "doi": "10.1002/acr.24199",
      "journal": "Arthritis Care Res",
      "volume": "72",
      "issue": "12",
      "raw": "Efficacy of a physical activity counseling program with use of a wearable tracker in people with inflammatory arthritis: a randomized controlled trial \n\t\t \n\t\t\t L C Li \n\t\t \n\t\t \n\t\t\t L M Feehan \n\t\t \n\t\t \n\t\t\t H Xie \n\t\t \n\t\t \n\t\t\t N Lu \n\t\t \n\t\t \n\t\t\t C Shaw \n\t\t \n\t\t \n\t\t\t D Gromala \n\t\t \n\t\t 10.1002/acr.24199 \n\t\t Medline: 32248626] 108 \n\t \n\t \n\t\t Arthritis Care Res \n\t\t \n\t\t\t 72 \n\t\t\t 12 \n\t\t\t \n\t\t\t 2020 Dec \n\t\t\t Hoboken \n\t\t \n\t \n\t Li LC, Feehan LM, Xie H, Lu N, Shaw C, Gromala D, et al. Efficacy of a physical activity counseling program with use of a wearable tracker in people with inflammatory arthritis: a randomized controlled trial. Arthritis Care Res (Hoboken) 2020 Dec;72(12):1755-1765. [doi: 10.1002/acr.24199] [Medline: 32248626] 108"
    },
    {
      "title": "A life-style physical activity intervention and the antibody response to pneumococcal vaccination in women",
      "authors": [
        "J Long",
        "C Ring",
        "J Bosch",
        "F Eves",
        "M Drayson",
        "R Calver"
      ],
      "year": 2013,
      "doi": "10.1097/psy.0b013e3182a0b664",
      "journal": "Psychosom Med",
      "volume": "75",
      "issue": "8",
      "raw": "A life-style physical activity intervention and the antibody response to pneumococcal vaccination in women \n\t\t \n\t\t\t J E Long \n\t\t \n\t\t \n\t\t\t C Ring \n\t\t \n\t\t \n\t\t\t J A Bosch \n\t\t \n\t\t \n\t\t\t F Eves \n\t\t \n\t\t \n\t\t\t M T Drayson \n\t\t \n\t\t \n\t\t\t R Calver \n\t\t \n\t\t 10.1097/psy.0b013e3182a0b664 \n\t\t Medline: 23922400] 109 \n\t \n\t \n\t\t Psychosom Med \n\t\t \n\t\t\t 75 \n\t\t\t 8 \n\t\t\t \n\t\t\t 2013 Oct \n\t\t \n\t \n\t Long JE, Ring C, Bosch JA, Eves F, Drayson MT, Calver R, et al. A life-style physical activity intervention and the antibody response to pneumococcal vaccination in women. Psychosom Med 2013 Oct;75(8):774-782. [doi: 10.1097/PSY.0b013e3182a0b664] [Medline: 23922400] 109"
    },
    {
      "title": "A randomized controlled trial of a wearable technology-based intervention for increasing moderate to vigorous physical activity and reducing sedentary behavior in breast cancer survivors: the ACTIVATE trial",
      "authors": [
        "B Lynch",
        "N Nguyen",
        "M Moore",
        "M Reeves",
        "D Rosenberg",
        "T Boyle"
      ],
      "year": 2019,
      "doi": "10.1002/cncr.32143",
      "journal": "Cancer",
      "volume": "125",
      "issue": "16",
      "raw": "A randomized controlled trial of a wearable technology-based intervention for increasing moderate to vigorous physical activity and reducing sedentary behavior in breast cancer survivors: the ACTIVATE trial \n\t\t \n\t\t\t B M Lynch \n\t\t \n\t\t \n\t\t\t N H Nguyen \n\t\t \n\t\t \n\t\t\t M M Moore \n\t\t \n\t\t \n\t\t\t M M Reeves \n\t\t \n\t\t \n\t\t\t D E Rosenberg \n\t\t \n\t\t \n\t\t\t T Boyle \n\t\t \n\t\t 10.1002/cncr.32143 \n\t\t Medline: 31012970] 110 \n\t \n\t \n\t\t Cancer \n\t\t \n\t\t\t 125 \n\t\t\t 16 \n\t\t\t \n\t\t\t 2019 Aug 15 \n\t\t \n\t \n\t FREE Full text \n\t Lynch BM, Nguyen NH, Moore MM, Reeves MM, Rosenberg DE, Boyle T, et al. A randomized controlled trial of a wearable technology-based intervention for increasing moderate to vigorous physical activity and reducing sedentary behavior in breast cancer survivors: the ACTIVATE trial. Cancer 2019 Aug 15;125(16):2846-2855 [FREE Full text] [doi: 10.1002/cncr.32143] [Medline: 31012970] 110"
    },
    {
      "title": "Feasibility and acceptability of a wearable technology physical activity intervention with telephone counseling for mid-aged and older adults: a randomized controlled pilot trial",
      "authors": [
        "E Lyons",
        "M Swartz",
        "Z Lewis",
        "E Martinez",
        "K Jennings"
      ],
      "year": 2017,
      "doi": "10.2196/mhealth.6967",
      "journal": "JMIR Mhealth Uhealth",
      "volume": "5",
      "issue": "3",
      "raw": "Feasibility and acceptability of a wearable technology physical activity intervention with telephone counseling for mid-aged and older adults: a randomized controlled pilot trial \n\t\t \n\t\t\t E J Lyons \n\t\t \n\t\t \n\t\t\t M C Swartz \n\t\t \n\t\t \n\t\t\t Z H Lewis \n\t\t \n\t\t \n\t\t\t E Martinez \n\t\t \n\t\t \n\t\t\t K Jennings \n\t\t \n\t\t 10.2196/mhealth.6967 \n\t\t Medline: 28264796] 111 \n\t \n\t \n\t\t JMIR Mhealth Uhealth \n\t\t \n\t\t\t 5 \n\t\t\t 3 \n\t\t\t 2017 Mar 06 \n\t\t \n\t \n\t FREE Full text \n\t Lyons EJ, Swartz MC, Lewis ZH, Martinez E, Jennings K. Feasibility and acceptability of a wearable technology physical activity intervention with telephone counseling for mid-aged and older adults: a randomized controlled pilot trial. JMIR Mhealth Uhealth 2017 Mar 06;5(3):e28 [FREE Full text] [doi: 10.2196/mhealth.6967] [Medline: 28264796] 111"
    },
    {
      "title": "mActive: a randomized clinical trial of an automated mhealth intervention for physical activity promotion",
      "authors": [
        "S Martin",
        "D Feldman",
        "R Blumenthal",
        "S Jones",
        "W Post",
        "R Mckibben"
      ],
      "year": 2015,
      "doi": "10.1161/jaha.115.002239",
      "journal": "J Am Heart Assoc",
      "volume": "4",
      "issue": "11",
      "raw": "mActive: a randomized clinical trial of an automated mhealth intervention for physical activity promotion \n\t\t \n\t\t\t S S Martin \n\t\t \n\t\t \n\t\t\t D I Feldman \n\t\t \n\t\t \n\t\t\t R S Blumenthal \n\t\t \n\t\t \n\t\t\t S R Jones \n\t\t \n\t\t \n\t\t\t W S Post \n\t\t \n\t\t \n\t\t\t R A Mckibben \n\t\t \n\t\t 10.1161/jaha.115.002239 \n\t\t Medline: 26553211] 112 \n\t \n\t \n\t\t J Am Heart Assoc \n\t\t \n\t\t\t 4 \n\t\t\t 11 \n\t\t\t \n\t\t\t 2015 Nov 09 \n\t\t \n\t \n\t FREE Full text \n\t Martin SS, Feldman DI, Blumenthal RS, Jones SR, Post WS, McKibben RA, et al. mActive: a randomized clinical trial of an automated mhealth intervention for physical activity promotion. J Am Heart Assoc 2015 Nov 09;4(11):1-9 [FREE Full text] [doi: 10.1161/JAHA.115.002239] [Medline: 26553211] 112"
    },
    {
      "title": "Effectiveness of a walking programme to support adults with intellectual disabilities to increase physical activity: walk well cluster-randomised controlled trial",
      "authors": [
        "C Melville",
        "F Mitchell",
        "K Stalker",
        "L Matthews",
        "A Mcconnachie",
        "H Murray"
      ],
      "year": 2015,
      "doi": "10.1186/s12966-015-0290-5",
      "journal": "Int J Behav Nutr Phys Act",
      "volume": "12",
      "pages": "125",
      "raw": "Effectiveness of a walking programme to support adults with intellectual disabilities to increase physical activity: walk well cluster-randomised controlled trial \n\t\t \n\t\t\t C A Melville \n\t\t \n\t\t \n\t\t\t F Mitchell \n\t\t \n\t\t \n\t\t\t K Stalker \n\t\t \n\t\t \n\t\t\t L Matthews \n\t\t \n\t\t \n\t\t\t A Mcconnachie \n\t\t \n\t\t \n\t\t\t H M Murray \n\t\t \n\t\t 10.1186/s12966-015-0290-5 \n\t\t Medline: 26416606] 113 \n\t \n\t \n\t\t Int J Behav Nutr Phys Act \n\t\t \n\t\t\t 12 \n\t\t\t 125 \n\t\t\t 2015 Sep 29 \n\t\t \n\t \n\t FREE Full text \n\t Melville CA, Mitchell F, Stalker K, Matthews L, McConnachie A, Murray HM, et al. Effectiveness of a walking programme to support adults with intellectual disabilities to increase physical activity: walk well cluster-randomised controlled trial. Int J Behav Nutr Phys Act 2015 Sep 29;12:125 [FREE Full text] [doi: 10.1186/s12966-015-0290-5] [Medline: 26416606] 113"
    },
    {
      "title": "Pedometers to enhance physical activity in COPD: a randomised controlled trial",
      "authors": [
        "L Mendoza",
        "P Horta",
        "J Espinoza",
        "M Aguilera",
        "N Balmaceda",
        "A Castro"
      ],
      "year": 2015,
      "doi": "10.1183/09031936.00084514",
      "journal": "Eur Respir J",
      "volume": "45",
      "issue": "2",
      "raw": "Pedometers to enhance physical activity in COPD: a randomised controlled trial \n\t\t \n\t\t\t L Mendoza \n\t\t \n\t\t \n\t\t\t P Horta \n\t\t \n\t\t \n\t\t\t J Espinoza \n\t\t \n\t\t \n\t\t\t M Aguilera \n\t\t \n\t\t \n\t\t\t N Balmaceda \n\t\t \n\t\t \n\t\t\t A Castro \n\t\t \n\t\t 10.1183/09031936.00084514 \n\t\t Medline: 25261324] 114 \n\t \n\t \n\t\t Eur Respir J \n\t\t \n\t\t\t 45 \n\t\t\t 2 \n\t\t\t \n\t\t\t 2015 Feb \n\t\t \n\t \n\t FREE Full text \n\t Mendoza L, Horta P, Espinoza J, Aguilera M, Balmaceda N, Castro A, et al. Pedometers to enhance physical activity in COPD: a randomised controlled trial. Eur Respir J 2015 Feb;45(2):347-354 [FREE Full text] [doi: 10.1183/09031936.00084514] [Medline: 25261324] 114"
    },
    {
      "title": "Promoting walking with pedometers in the community: the step-by-step trial",
      "authors": [
        "D Merom",
        "C Rissel",
        "P Phongsavan",
        "B Smith",
        "C Van Kemenade",
        "W Brown"
      ],
      "year": 2007,
      "doi": "10.1016/j.amepre.2006.12.007",
      "journal": "Am J Prev Med",
      "volume": "32",
      "issue": "4",
      "raw": "Promoting walking with pedometers in the community: the step-by-step trial \n\t\t \n\t\t\t D Merom \n\t\t \n\t\t \n\t\t\t C Rissel \n\t\t \n\t\t \n\t\t\t P Phongsavan \n\t\t \n\t\t \n\t\t\t B J Smith \n\t\t \n\t\t \n\t\t\t C Van Kemenade \n\t\t \n\t\t \n\t\t\t W J Brown \n\t\t \n\t\t 10.1016/j.amepre.2006.12.007 \n\t\t Medline: 17303369] 115 \n\t \n\t \n\t\t Am J Prev Med \n\t\t \n\t\t\t 32 \n\t\t\t 4 \n\t\t\t \n\t\t\t 2007 Apr \n\t\t \n\t \n\t Merom D, Rissel C, Phongsavan P, Smith BJ, Van Kemenade C, Brown WJ, et al. Promoting walking with pedometers in the community: the step-by-step trial. Am J Prev Med 2007 Apr;32(4):290-297. [doi: 10.1016/j.amepre.2006.12.007] [Medline: 17303369] 115"
    },
    {
      "title": "Increasing physical activity in stroke survivors using STARFISH, an interactive mobile phone application: a pilot study",
      "authors": [
        "L Paul",
        "S Wyke",
        "S Brewster",
        "N Sattar",
        "Jmr Gill",
        "G Alexander"
      ],
      "year": 2016,
      "doi": "10.1080/10749357.2015.1122266",
      "journal": "Top Stroke Rehabil",
      "volume": "23",
      "issue": "3",
      "raw": "Increasing physical activity in stroke survivors using STARFISH, an interactive mobile phone application: a pilot study \n\t\t \n\t\t\t L Paul \n\t\t \n\t\t \n\t\t\t S Wyke \n\t\t \n\t\t \n\t\t\t S Brewster \n\t\t \n\t\t \n\t\t\t N Sattar \n\t\t \n\t\t \n\t\t\t Jmr Gill \n\t\t \n\t\t \n\t\t\t G Alexander \n\t\t \n\t\t 10.1080/10749357.2015.1122266 \n\t\t Medline: 27077973] 116 \n\t \n\t \n\t\t Top Stroke Rehabil \n\t\t \n\t\t\t 23 \n\t\t\t 3 \n\t\t\t \n\t\t\t 2016 Jun \n\t\t \n\t \n\t Paul L, Wyke S, Brewster S, Sattar N, Gill JMR, Alexander G, et al. Increasing physical activity in stroke survivors using STARFISH, an interactive mobile phone application: a pilot study. Top Stroke Rehabil 2016 Jun;23(3):170-177. [doi: 10.1080/10749357.2015.1122266] [Medline: 27077973] 116"
    },
    {
      "title": "Effectiveness of an activity tracker-and internet-based adaptive walking program for adults: a randomized controlled trial",
      "authors": [
        "J Poirier",
        "W Bennett",
        "G Jerome",
        "N Shah",
        "M Lazo",
        "H Yeh"
      ],
      "year": 2016,
      "doi": "10.2196/jmir.5295",
      "journal": "J Med Internet Res",
      "volume": "18",
      "issue": "2",
      "raw": "Effectiveness of an activity tracker-and internet-based adaptive walking program for adults: a randomized controlled trial \n\t\t \n\t\t\t J Poirier \n\t\t \n\t\t \n\t\t\t W L Bennett \n\t\t \n\t\t \n\t\t\t G J Jerome \n\t\t \n\t\t \n\t\t\t N G Shah \n\t\t \n\t\t \n\t\t\t M Lazo \n\t\t \n\t\t \n\t\t\t H Yeh \n\t\t \n\t\t 10.2196/jmir.5295 \n\t\t Medline: 26860434] 117 \n\t \n\t \n\t\t J Med Internet Res \n\t\t \n\t\t\t 18 \n\t\t\t 2 \n\t\t\t 2016 Feb 09 \n\t\t \n\t \n\t FREE Full text \n\t Poirier J, Bennett WL, Jerome GJ, Shah NG, Lazo M, Yeh H, et al. Effectiveness of an activity tracker-and internet-based adaptive walking program for adults: a randomized controlled trial. J Med Internet Res 2016 Feb 09;18(2):e34 [FREE Full text] [doi: 10.2196/jmir.5295] [Medline: 26860434] 117"
    },
    {
      "title": "Effectiveness of combined smartwatch and social media intervention on breast cancer survivor health outcomes: a 10-week pilot randomized trial",
      "authors": [
        "Z Pope",
        "N Zeng",
        "R Zhang",
        "H Lee",
        "Z Gao"
      ],
      "year": 2018,
      "doi": "10.3390/jcm7060140",
      "journal": "J Clin Med",
      "volume": "7",
      "issue": "6",
      "raw": "Effectiveness of combined smartwatch and social media intervention on breast cancer survivor health outcomes: a 10-week pilot randomized trial \n\t\t \n\t\t\t Z C Pope \n\t\t \n\t\t \n\t\t\t N Zeng \n\t\t \n\t\t \n\t\t\t R Zhang \n\t\t \n\t\t \n\t\t\t H Y Lee \n\t\t \n\t\t \n\t\t\t Z Gao \n\t\t \n\t\t 10.3390/jcm7060140 \n\t\t Medline: 29880779] 118 \n\t \n\t \n\t\t J Clin Med \n\t\t \n\t\t\t 7 \n\t\t\t 6 \n\t\t\t \n\t\t\t 2018 Jun 07 \n\t\t \n\t \n\t FREE Full text \n\t Pope ZC, Zeng N, Zhang R, Lee HY, Gao Z. Effectiveness of combined smartwatch and social media intervention on breast cancer survivor health outcomes: a 10-week pilot randomized trial. J Clin Med 2018 Jun 07;7(6):1-17 [FREE Full text] [doi: 10.3390/jcm7060140] [Medline: 29880779] 118"
    },
    {
      "title": "Can implementation intentions and text messages promote brisk walking? A randomized trial",
      "authors": [
        "A Prestwich",
        "M Perugini",
        "R Hurling"
      ],
      "year": 2010,
      "doi": "10.1037/a0016993",
      "journal": "Health Psychol",
      "volume": "29",
      "issue": "1",
      "raw": "Can implementation intentions and text messages promote brisk walking? A randomized trial \n\t\t \n\t\t\t A Prestwich \n\t\t \n\t\t \n\t\t\t M Perugini \n\t\t \n\t\t \n\t\t\t R Hurling \n\t\t \n\t\t 10.1037/a0016993 \n\t\t Medline: 20063934] 119 \n\t \n\t \n\t\t Health Psychol \n\t\t \n\t\t\t 29 \n\t\t\t 1 \n\t\t\t \n\t\t\t 2010 Jan \n\t\t \n\t \n\t Prestwich A, Perugini M, Hurling R. Can implementation intentions and text messages promote brisk walking? A randomized trial. Health Psychol 2010 Jan;29(1):40-49. [doi: 10.1037/a0016993] [Medline: 20063934] 119"
    },
    {
      "title": "The effectiveness of physical activity monitoring and distance counseling in an occupational setting -results from a randomized controlled trial (CoAct)",
      "authors": [
        "K Reijonsaari",
        "A Vehtari",
        "O Kahilakoski",
        "W Van Mechelen",
        "T Aro",
        "S Taimela"
      ],
      "year": 2012,
      "doi": "10.1186/1471-2458-12-344",
      "journal": "BMC Public Health",
      "volume": "12",
      "pages": "344",
      "raw": "The effectiveness of physical activity monitoring and distance counseling in an occupational setting -results from a randomized controlled trial (CoAct) \n\t\t \n\t\t\t K Reijonsaari \n\t\t \n\t\t \n\t\t\t A Vehtari \n\t\t \n\t\t \n\t\t\t O Kahilakoski \n\t\t \n\t\t \n\t\t\t W Van Mechelen \n\t\t \n\t\t \n\t\t\t T Aro \n\t\t \n\t\t \n\t\t\t S Taimela \n\t\t \n\t\t 10.1186/1471-2458-12-344 \n\t\t Medline: 22578104] 120 \n\t \n\t \n\t\t BMC Public Health \n\t\t \n\t\t\t 12 \n\t\t\t 344 \n\t\t\t 2012 May 11 \n\t\t \n\t \n\t FREE Full text \n\t Reijonsaari K, Vehtari A, Kahilakoski O, Van Mechelen W, Aro T, Taimela S. The effectiveness of physical activity monitoring and distance counseling in an occupational setting -results from a randomized controlled trial (CoAct). BMC Public Health 2012 May 11;12:344 [FREE Full text] [doi: 10.1186/1471-2458-12-344] [Medline: 22578104] 120"
    },
    {
      "title": "Effects of an education and home-based pedometer walking program on ischemic heart disease risk factors in people infected with HIV: a randomized trial",
      "authors": [
        "R Roos",
        "H Myezwa",
        "H Van Aswegen",
        "E Musenge"
      ],
      "year": 2014,
      "doi": "10.1097/QAI.0000000000000299",
      "journal": "J Acquir Immune Defic Syndr",
      "volume": "67",
      "issue": "3",
      "raw": "Effects of an education and home-based pedometer walking program on ischemic heart disease risk factors in people infected with HIV: a randomized trial \n\t\t \n\t\t\t R Roos \n\t\t \n\t\t \n\t\t\t H Myezwa \n\t\t \n\t\t \n\t\t\t H Van Aswegen \n\t\t \n\t\t \n\t\t\t E Musenge \n\t\t \n\t\t 10.1097/QAI.0000000000000299 \n\t\t Medline: 25140908] 121 \n\t \n\t \n\t\t J Acquir Immune Defic Syndr \n\t\t \n\t\t\t 67 \n\t\t\t 3 \n\t\t\t \n\t\t\t 2014 Nov 01 \n\t\t \n\t \n\t Roos R, Myezwa H, Van Aswegen H, Musenge E. Effects of an education and home-based pedometer walking program on ischemic heart disease risk factors in people infected with HIV: a randomized trial. J Acquir Immune Defic Syndr 2014 Nov 01;67(3):268-276. [doi: 10.1097/QAI.0000000000000299] [Medline: 25140908] 121"
    },
    {
      "title": "Efficacy of an individually tailored, internet-mediated physical activity intervention in older adults: a randomized controlled trial",
      "authors": [
        "T Rowley",
        "E Lenz",
        "A Swartz",
        "N Miller",
        "H Maeda",
        "S Strath"
      ],
      "year": 2019,
      "doi": "10.1177/0733464817735396",
      "journal": "J Appl Gerontol",
      "volume": "38",
      "issue": "7",
      "raw": "Efficacy of an individually tailored, internet-mediated physical activity intervention in older adults: a randomized controlled trial \n\t\t \n\t\t\t T W Rowley \n\t\t \n\t\t \n\t\t\t E K Lenz \n\t\t \n\t\t \n\t\t\t A M Swartz \n\t\t \n\t\t \n\t\t\t N E Miller \n\t\t \n\t\t \n\t\t\t H Maeda \n\t\t \n\t\t \n\t\t\t S J Strath \n\t\t \n\t\t 10.1177/0733464817735396 \n\t\t Medline: 29165018] 122 \n\t \n\t \n\t\t J Appl Gerontol \n\t\t \n\t\t\t 38 \n\t\t\t 7 \n\t\t\t \n\t\t\t 2019 Jul \n\t\t \n\t \n\t Rowley TW, Lenz EK, Swartz AM, Miller NE, Maeda H, Strath SJ. Efficacy of an individually tailored, internet-mediated physical activity intervention in older adults: a randomized controlled trial. J Appl Gerontol 2019 Jul;38(7):1011-1022. [doi: 10.1177/0733464817735396] [Medline: 29165018] 122"
    },
    {
      "title": "Effect of pretesting on intentions and behaviour: a pedometer and walking intervention",
      "authors": [
        "J Spence",
        "J Burgess",
        "W Rodgers",
        "T Murray"
      ],
      "year": 2009,
      "doi": "10.1080/08870440801989938",
      "journal": "Psychol Health",
      "volume": "24",
      "issue": "7",
      "raw": "Effect of pretesting on intentions and behaviour: a pedometer and walking intervention \n\t\t \n\t\t\t J C Spence \n\t\t \n\t\t \n\t\t\t J Burgess \n\t\t \n\t\t \n\t\t\t W Rodgers \n\t\t \n\t\t \n\t\t\t T Murray \n\t\t \n\t\t 10.1080/08870440801989938 \n\t\t Medline: 20205026] 123 \n\t \n\t \n\t\t Psychol Health \n\t\t \n\t\t\t 24 \n\t\t\t 7 \n\t\t\t \n\t\t\t 2009 Sep \n\t\t \n\t \n\t Spence JC, Burgess J, Rodgers W, Murray T. Effect of pretesting on intentions and behaviour: a pedometer and walking intervention. Psychol Health 2009 Sep;24(7):777-789. [doi: 10.1080/08870440801989938] [Medline: 20205026] 123"
    },
    {
      "title": "A telerehabilitation intervention for patients with Chronic Obstructive Pulmonary Disease: a randomized controlled pilot trial",
      "authors": [
        "M Tabak",
        "M Vollenbroek-Hutten",
        "P Van Der Valk",
        "J Van Der Palen",
        "H Hermens"
      ],
      "year": 2014,
      "doi": "10.1177/0269215513512495",
      "journal": "Clin Rehabil",
      "volume": "28",
      "issue": "6",
      "raw": "A telerehabilitation intervention for patients with Chronic Obstructive Pulmonary Disease: a randomized controlled pilot trial \n\t\t \n\t\t\t M Tabak \n\t\t \n\t\t \n\t\t\t M M Vollenbroek-Hutten \n\t\t \n\t\t \n\t\t\t P D Van Der Valk \n\t\t \n\t\t \n\t\t\t J Van Der Palen \n\t\t \n\t\t \n\t\t\t H J Hermens \n\t\t \n\t\t 10.1177/0269215513512495 \n\t\t Medline: 24293120] 124 \n\t \n\t \n\t\t Clin Rehabil \n\t\t \n\t\t\t 28 \n\t\t\t 6 \n\t\t\t \n\t\t\t 2014 Jun \n\t\t \n\t \n\t Tabak M, Vollenbroek-Hutten MM, Van der Valk PD, Van der Palen J, Hermens HJ. A telerehabilitation intervention for patients with Chronic Obstructive Pulmonary Disease: a randomized controlled pilot trial. Clin Rehabil 2014 Jun;28(6):582-591. [doi: 10.1177/0269215513512495] [Medline: 24293120] 124"
    },
    {
      "title": "Activity monitor intervention to promote physical activity of physicians-in-training: randomized controlled trial",
      "authors": [
        "A Thorndike",
        "S Mills",
        "L Sonnenberg",
        "D Palakshappa",
        "T Gao",
        "C Pau"
      ],
      "year": 2014,
      "doi": "10.1371/journal.pone.0100251",
      "journal": "PLoS One",
      "volume": "9",
      "issue": "6",
      "pages": "100251",
      "raw": "Activity monitor intervention to promote physical activity of physicians-in-training: randomized controlled trial \n\t\t \n\t\t\t A N Thorndike \n\t\t \n\t\t \n\t\t\t S Mills \n\t\t \n\t\t \n\t\t\t L Sonnenberg \n\t\t \n\t\t \n\t\t\t D Palakshappa \n\t\t \n\t\t \n\t\t\t T Gao \n\t\t \n\t\t \n\t\t\t C T Pau \n\t\t \n\t\t 10.1371/journal.pone.0100251 \n\t\t Medline: 24950218] 125 \n\t \n\t \n\t\t PLoS One \n\t\t \n\t\t\t 9 \n\t\t\t 6 \n\t\t\t 100251 \n\t\t\t 2014 \n\t\t \n\t \n\t FREE Full text \n\t Thorndike AN, Mills S, Sonnenberg L, Palakshappa D, Gao T, Pau CT, et al. Activity monitor intervention to promote physical activity of physicians-in-training: randomized controlled trial. PLoS One 2014;9(6):e100251 [FREE Full text] [doi: 10.1371/journal.pone.0100251] [Medline: 24950218] 125"
    },
    {
      "title": "Exploring the feasibility of a broad-reach physical activity behavior change intervention for women receiving chemotherapy for breast cancer: a randomized trial",
      "authors": [
        "J Vallance",
        "C Friedenreich",
        "C Lavallee",
        "N Culos-Reed",
        "J Mackey",
        "B Walley"
      ],
      "year": 2015,
      "doi": "10.1158/1055-9965.epi-15-0812",
      "journal": "Cancer Epidemiol Biomarkers Prev",
      "volume": "25",
      "issue": "2",
      "raw": "Exploring the feasibility of a broad-reach physical activity behavior change intervention for women receiving chemotherapy for breast cancer: a randomized trial \n\t\t \n\t\t\t J K Vallance \n\t\t \n\t\t \n\t\t\t C M Friedenreich \n\t\t \n\t\t \n\t\t\t C M Lavallee \n\t\t \n\t\t \n\t\t\t N Culos-Reed \n\t\t \n\t\t \n\t\t\t J R Mackey \n\t\t \n\t\t \n\t\t\t B Walley \n\t\t \n\t\t 10.1158/1055-9965.epi-15-0812 \n\t \n\t \n\t\t Cancer Epidemiol Biomarkers Prev \n\t\t \n\t\t\t 25 \n\t\t\t 2 \n\t\t\t \n\t\t\t 2015 Dec 16 \n\t\t \n\t \n\t Vallance JK, Friedenreich CM, Lavallee CM, Culos-Reed N, Mackey JR, Walley B, et al. Exploring the feasibility of a broad-reach physical activity behavior change intervention for women receiving chemotherapy for breast cancer: a randomized trial. Cancer Epidemiol Biomarkers Prev 2015 Dec 16;25(2):391-398. [doi: 10.1158/1055-9965.epi-15-0812] 126"
    },
    {
      "title": "Self-monitoring and reminder text messages to increase physical activity in colorectal cancer survivors (Smart Pace): a pilot randomized controlled trial",
      "authors": [
        "E Van Blarigan",
        "Chan Van Loon",
        "K Kenfield",
        "S Chan",
        "J Mitchell"
      ],
      "year": 2019,
      "doi": "10.1186/s12885-019-5427-5",
      "journal": "BMC Cancer",
      "volume": "19",
      "issue": "1",
      "pages": "218",
      "raw": "Self-monitoring and reminder text messages to increase physical activity in colorectal cancer survivors (Smart Pace): a pilot randomized controlled trial \n\t\t \n\t\t\t E L Van Blarigan \n\t\t \n\t\t \n\t\t\t Chan H Van Loon \n\t\t \n\t\t \n\t\t\t K Kenfield \n\t\t \n\t\t \n\t\t\t S A Chan \n\t\t \n\t\t \n\t\t\t J M Mitchell \n\t\t \n\t\t \n\t\t\t E \n\t\t \n\t\t 10.1186/s12885-019-5427-5 \n\t\t Medline: 30866859] 127 \n\t \n\t \n\t\t BMC Cancer \n\t\t \n\t\t\t 19 \n\t\t\t 1 \n\t\t\t 218 \n\t\t\t 2019 Mar 11 \n\t\t \n\t \n\t FREE Full text \n\t Van Blarigan EL, Chan H, Van Loon K, Kenfield SA, Chan JM, Mitchell E, et al. Self-monitoring and reminder text messages to increase physical activity in colorectal cancer survivors (Smart Pace): a pilot randomized controlled trial. BMC Cancer 2019 Mar 11;19(1):218 [FREE Full text] [doi: 10.1186/s12885-019-5427-5] [Medline: 30866859] 127"
    },
    {
      "title": "Evaluation of different recruitment and randomisation methods in a trial of general practitioner-led interventions to increase physical activity: a randomised controlled feasibility study with factorial design",
      "authors": [
        "F Warren",
        "K Stych",
        "M Thorogood",
        "D Sharp",
        "M Murphy",
        "K Turner"
      ],
      "year": 2014,
      "doi": "10.1186/1745-6215-15-134",
      "journal": "Trials",
      "volume": "15",
      "pages": "134",
      "raw": "Evaluation of different recruitment and randomisation methods in a trial of general practitioner-led interventions to increase physical activity: a randomised controlled feasibility study with factorial design \n\t\t \n\t\t\t F C Warren \n\t\t \n\t\t \n\t\t\t K Stych \n\t\t \n\t\t \n\t\t\t M Thorogood \n\t\t \n\t\t \n\t\t\t D J Sharp \n\t\t \n\t\t \n\t\t\t M Murphy \n\t\t \n\t\t \n\t\t\t K M Turner \n\t\t \n\t\t 10.1186/1745-6215-15-134 \n\t\t Medline: 24746263] 128 \n\t \n\t \n\t\t Trials \n\t\t \n\t\t\t 15 \n\t\t\t 134 \n\t\t\t 2014 Apr 21 \n\t\t \n\t \n\t FREE Full text \n\t Warren FC, Stych K, Thorogood M, Sharp DJ, Murphy M, Turner KM, et al. Evaluation of different recruitment and randomisation methods in a trial of general practitioner-led interventions to increase physical activity: a randomised controlled feasibility study with factorial design. Trials 2014 Apr 21;15:134 [FREE Full text] [doi: 10.1186/1745-6215-15-134] [Medline: 24746263] 128"
    },
    {
      "title": "Pedometer-based behavioral change program can improve dependency in sedentary older adults: a randomized controlled trial",
      "authors": [
        "M Yamada",
        "S Mori",
        "S Nishiguchi",
        "Y Kajiwara",
        "K Yoshimura",
        "T Sonoda"
      ],
      "year": 2012,
      "doi": "10.14283/jfa.2012.7",
      "journal": "J Frailty Aging",
      "volume": "1",
      "issue": "1",
      "raw": "Pedometer-based behavioral change program can improve dependency in sedentary older adults: a randomized controlled trial \n\t\t \n\t\t\t M Yamada \n\t\t \n\t\t \n\t\t\t S Mori \n\t\t \n\t\t \n\t\t\t S Nishiguchi \n\t\t \n\t\t \n\t\t\t Y Kajiwara \n\t\t \n\t\t \n\t\t\t K Yoshimura \n\t\t \n\t\t \n\t\t\t T Sonoda \n\t\t \n\t\t 10.14283/jfa.2012.7 \n\t\t Medline: 27092936] 129 \n\t \n\t \n\t\t J Frailty Aging \n\t\t \n\t\t\t 1 \n\t\t\t 1 \n\t\t\t \n\t\t\t 2012 \n\t\t \n\t \n\t Yamada M, Mori S, Nishiguchi S, Kajiwara Y, Yoshimura K, Sonoda T, et al. Pedometer-based behavioral change program can improve dependency in sedentary older adults: a randomized controlled trial. J Frailty Aging 2012;1(1):39-44. [doi: 10.14283/jfa.2012.7] [Medline: 27092936] 129"
    },
    {
      "title": "Effects of a pedometer-based physical activity program on older adults' mobility-related self-efficacy and physical performance",
      "authors": [
        "K Croteau",
        "N Richeson",
        "S Vines",
        "D Jones"
      ],
      "year": 2004,
      "doi": "10.1300/j016v28n02_02",
      "journal": "Act Adapt Aging",
      "volume": "28",
      "issue": "2",
      "raw": "Effects of a pedometer-based physical activity program on older adults' mobility-related self-efficacy and physical performance \n\t\t \n\t\t\t K A Croteau \n\t\t \n\t\t \n\t\t\t N E Richeson \n\t\t \n\t\t \n\t\t\t S W Vines \n\t\t \n\t\t \n\t\t\t D B Jones \n\t\t \n\t\t 10.1300/j016v28n02_02 \n\t \n\t \n\t\t Act Adapt Aging \n\t\t \n\t\t\t 28 \n\t\t\t 2 \n\t\t\t \n\t\t\t 2004 Apr 21 \n\t\t \n\t \n\t Croteau KA, Richeson NE, Vines SW, Jones DB. Effects of a pedometer-based physical activity program on older adults' mobility-related self-efficacy and physical performance. Act Adapt Aging 2004 Apr 21;28(2):19-33. [doi: 10.1300/j016v28n02_02] 130"
    },
    {
      "title": "Effect of a pedometer-based intervention on daily step counts of community-dwelling older adults",
      "authors": [
        "K Croteau",
        "N Richeson",
        "B Farmer",
        "D Jones"
      ],
      "year": 2007,
      "doi": "10.1080/02701367.2007.10599439",
      "journal": "Res Q Exerc Sport",
      "volume": "78",
      "issue": "5",
      "raw": "Effect of a pedometer-based intervention on daily step counts of community-dwelling older adults \n\t\t \n\t\t\t K A Croteau \n\t\t \n\t\t \n\t\t\t N E Richeson \n\t\t \n\t\t \n\t\t\t B C Farmer \n\t\t \n\t\t \n\t\t\t D B Jones \n\t\t \n\t\t 10.1080/02701367.2007.10599439 \n\t\t Medline: 18274211] 131 \n\t \n\t \n\t\t Res Q Exerc Sport \n\t\t \n\t\t\t 78 \n\t\t\t 5 \n\t\t\t \n\t\t\t 2007 Dec \n\t\t \n\t \n\t Croteau KA, Richeson NE, Farmer BC, Jones DB. Effect of a pedometer-based intervention on daily step counts of community-dwelling older adults. Res Q Exerc Sport 2007 Dec;78(5):401-406. [doi: 10.1080/02701367.2007.10599439] [Medline: 18274211] 131"
    },
    {
      "title": "A randomized intervention of physical activity promotion and patient self-monitoring in primary health care",
      "authors": [
        "M Aittasalo",
        "S Miilunpalo",
        "K Kukkonen-Harjula",
        "M Pasanen"
      ],
      "year": 2006,
      "doi": "10.1016/j.ypmed.2005.10.003",
      "journal": "Prev Med",
      "volume": "42",
      "issue": "1",
      "raw": "A randomized intervention of physical activity promotion and patient self-monitoring in primary health care \n\t\t \n\t\t\t M Aittasalo \n\t\t \n\t\t \n\t\t\t S Miilunpalo \n\t\t \n\t\t \n\t\t\t K Kukkonen-Harjula \n\t\t \n\t\t \n\t\t\t M Pasanen \n\t\t \n\t\t 10.1016/j.ypmed.2005.10.003 \n\t\t Medline: 16297442] 132 \n\t \n\t \n\t\t Prev Med \n\t\t \n\t\t\t 42 \n\t\t\t 1 \n\t\t\t \n\t\t\t 2006 Jan \n\t\t \n\t \n\t Aittasalo M, Miilunpalo S, Kukkonen-Harjula K, Pasanen M. A randomized intervention of physical activity promotion and patient self-monitoring in primary health care. Prev Med 2006 Jan;42(1):40-46. [doi: 10.1016/j.ypmed.2005.10.003] [Medline: 16297442] 132"
    },
    {
      "title": "Telephone-based coaching and prompting for physical activity: short-and long-term findings of a randomized controlled trial (Movingcall)",
      "authors": [
        "X Fischer",
        "J Kreppke",
        "L Zahner",
        "M Gerber",
        "O Faude",
        "L Donath"
      ],
      "year": 2019,
      "doi": "10.3390/ijerph16142626",
      "journal": "Int J Environ Res Public Health",
      "volume": "16",
      "issue": "14",
      "raw": "Telephone-based coaching and prompting for physical activity: short-and long-term findings of a randomized controlled trial (Movingcall) \n\t\t \n\t\t\t X Fischer \n\t\t \n\t\t \n\t\t\t J Kreppke \n\t\t \n\t\t \n\t\t\t L Zahner \n\t\t \n\t\t \n\t\t\t M Gerber \n\t\t \n\t\t \n\t\t\t O Faude \n\t\t \n\t\t \n\t\t\t L Donath \n\t\t \n\t\t 10.3390/ijerph16142626 \n\t\t Medline: 31340528] 133 \n\t \n\t \n\t\t Int J Environ Res Public Health \n\t\t \n\t\t\t 16 \n\t\t\t 14 \n\t\t\t \n\t\t\t 2019 Jul 23 \n\t\t \n\t \n\t FREE Full text \n\t Fischer X, Kreppke J, Zahner L, Gerber M, Faude O, Donath L. Telephone-based coaching and prompting for physical activity: short-and long-term findings of a randomized controlled trial (Movingcall). Int J Environ Res Public Health 2019 Jul 23;16(14):1-16 [FREE Full text] [doi: 10.3390/ijerph16142626] [Medline: 31340528] 133"
    },
    {
      "title": "Short-term efficacy of a computer-tailored physical activity intervention for prostate and colorectal cancer patients and survivors: a randomized controlled trial",
      "authors": [
        "R Golsteijn",
        "C Bolman",
        "E Volders",
        "D Peels",
        "H De Vries",
        "L Lechner"
      ],
      "year": 2018,
      "doi": "10.1186/s12966-018-0734-9",
      "journal": "Int J Behav Nutr Phys Act",
      "volume": "15",
      "issue": "1",
      "pages": "106",
      "raw": "Short-term efficacy of a computer-tailored physical activity intervention for prostate and colorectal cancer patients and survivors: a randomized controlled trial \n\t\t \n\t\t\t R H Golsteijn \n\t\t \n\t\t \n\t\t\t C Bolman \n\t\t \n\t\t \n\t\t\t E Volders \n\t\t \n\t\t \n\t\t\t D A Peels \n\t\t \n\t\t \n\t\t\t H De Vries \n\t\t \n\t\t \n\t\t\t L Lechner \n\t\t \n\t\t 10.1186/s12966-018-0734-9 \n\t\t Medline: 30376857] 134 \n\t \n\t \n\t\t Int J Behav Nutr Phys Act \n\t\t \n\t\t\t 15 \n\t\t\t 1 \n\t\t\t 106 \n\t\t\t 2018 Oct 30 \n\t\t \n\t \n\t FREE Full text \n\t Golsteijn RH, Bolman C, Volders E, Peels DA, de Vries H, Lechner L. Short-term efficacy of a computer-tailored physical activity intervention for prostate and colorectal cancer patients and survivors: a randomized controlled trial. Int J Behav Nutr Phys Act 2018 Oct 30;15(1):106 [FREE Full text] [doi: 10.1186/s12966-018-0734-9] [Medline: 30376857] 134"
    },
    {
      "title": "Evaluation of a shelter-based diet and physical activity intervention for homeless adults",
      "authors": [
        "D Kendzor",
        "M Allicock",
        "M Businelle",
        "L Sandon",
        "K Gabriel",
        "S Frank"
      ],
      "year": 2017,
      "doi": "10.1123/jpah.2016-0343",
      "journal": "J Phys Act Health",
      "volume": "14",
      "issue": "2",
      "raw": "Evaluation of a shelter-based diet and physical activity intervention for homeless adults \n\t\t \n\t\t\t D E Kendzor \n\t\t \n\t\t \n\t\t\t M Allicock \n\t\t \n\t\t \n\t\t\t M S Businelle \n\t\t \n\t\t \n\t\t\t L F Sandon \n\t\t \n\t\t \n\t\t\t K P Gabriel \n\t\t \n\t\t \n\t\t\t S G Frank \n\t\t \n\t\t 10.1123/jpah.2016-0343 \n\t\t Medline: 27775471] 135 \n\t \n\t \n\t\t J Phys Act Health \n\t\t \n\t\t\t 14 \n\t\t\t 2 \n\t\t\t \n\t\t\t 2017 Feb \n\t\t \n\t \n\t Kendzor DE, Allicock M, Businelle MS, Sandon LF, Gabriel KP, Frank SG. Evaluation of a shelter-based diet and physical activity intervention for homeless adults. J Phys Act Health 2017 Feb;14(2):88-97. [doi: 10.1123/jpah.2016-0343] [Medline: 27775471] 135"
    },
    {
      "title": "Randomized trial of a clinic-based, community-supported, lifestyle intervention to improve physical activity and diet: the North Carolina enhanced WISEWOMAN project",
      "authors": [
        "T Keyserling",
        "Samuel Hodge",
        "C Jilcott",
        "S Johnston",
        "L Garcia",
        "B Gizlice"
      ],
      "year": 2008,
      "doi": "10.1016/j.ypmed.2008.02.011",
      "journal": "Prev Med",
      "volume": "46",
      "issue": "6",
      "raw": "Randomized trial of a clinic-based, community-supported, lifestyle intervention to improve physical activity and diet: the North Carolina enhanced WISEWOMAN project \n\t\t \n\t\t\t T C Keyserling \n\t\t \n\t\t \n\t\t\t Samuel Hodge \n\t\t \n\t\t \n\t\t\t C D Jilcott \n\t\t \n\t\t \n\t\t\t S B Johnston \n\t\t \n\t\t \n\t\t\t L F Garcia \n\t\t \n\t\t \n\t\t\t B A Gizlice \n\t\t \n\t\t \n\t\t\t Z \n\t\t \n\t\t 10.1016/j.ypmed.2008.02.011 \n\t\t Medline: 18394692] 136 \n\t \n\t \n\t\t Prev Med \n\t\t \n\t\t\t 46 \n\t\t\t 6 \n\t\t\t \n\t\t\t 2008 Jun \n\t\t \n\t \n\t Keyserling TC, Samuel Hodge CD, Jilcott SB, Johnston LF, Garcia BA, Gizlice Z, et al. Randomized trial of a clinic-based, community-supported, lifestyle intervention to improve physical activity and diet: the North Carolina enhanced WISEWOMAN project. Prev Med 2008 Jun;46(6):499-510. [doi: 10.1016/j.ypmed.2008.02.011] [Medline: 18394692] 136"
    },
    {
      "title": "Promoting physical activity using a wearable activity tracker in college students: a cluster randomized controlled trial",
      "authors": [
        "Y Kim",
        "A Lumpkin",
        "M Lochbaum",
        "S Stegemeier",
        "K Kitten"
      ],
      "year": 2018,
      "doi": "10.1080/02640414.2018.1423886",
      "journal": "J Sports Sci",
      "volume": "36",
      "issue": "16",
      "raw": "Promoting physical activity using a wearable activity tracker in college students: a cluster randomized controlled trial \n\t\t \n\t\t\t Y Kim \n\t\t \n\t\t \n\t\t\t A Lumpkin \n\t\t \n\t\t \n\t\t\t M Lochbaum \n\t\t \n\t\t \n\t\t\t S Stegemeier \n\t\t \n\t\t \n\t\t\t K Kitten \n\t\t \n\t\t 10.1080/02640414.2018.1423886 \n\t\t Medline: 29318916] 137 \n\t \n\t \n\t\t J Sports Sci \n\t\t \n\t\t\t 36 \n\t\t\t 16 \n\t\t\t \n\t\t\t 2018 Aug \n\t\t \n\t \n\t Kim Y, Lumpkin A, Lochbaum M, Stegemeier S, Kitten K. Promoting physical activity using a wearable activity tracker in college students: a cluster randomized controlled trial. J Sports Sci 2018 Aug;36(16):1889-1896. [doi: 10.1080/02640414.2018.1423886] [Medline: 29318916] 137"
    },
    {
      "title": "Promoting physical activity through hand-held computer technology",
      "authors": [
        "A King",
        "D Ahn",
        "B Oliveira",
        "A Atienza",
        "C Castro",
        "C Gardner"
      ],
      "year": 2008,
      "doi": "10.1016/j.amepre.2007.09.025",
      "journal": "Am J Prev Med",
      "volume": "34",
      "issue": "2",
      "raw": "Promoting physical activity through hand-held computer technology \n\t\t \n\t\t\t A C King \n\t\t \n\t\t \n\t\t\t D K Ahn \n\t\t \n\t\t \n\t\t\t B M Oliveira \n\t\t \n\t\t \n\t\t\t A A Atienza \n\t\t \n\t\t \n\t\t\t C M Castro \n\t\t \n\t\t \n\t\t\t C D Gardner \n\t\t \n\t\t 10.1016/j.amepre.2007.09.025 \n\t\t Medline: 18201644] 138 \n\t \n\t \n\t\t Am J Prev Med \n\t\t \n\t\t\t 34 \n\t\t\t 2 \n\t\t\t \n\t\t\t 2008 Feb \n\t\t \n\t \n\t FREE Full text \n\t King AC, Ahn DK, Oliveira BM, Atienza AA, Castro CM, Gardner CD. Promoting physical activity through hand-held computer technology. Am J Prev Med 2008 Feb;34(2):138-142 [FREE Full text] [doi: 10.1016/j.amepre.2007.09.025] [Medline: 18201644] 138"
    },
    {
      "title": "Efficacy of an accelerometer-guided physical activity intervention in community-dwelling older women",
      "authors": [
        "D Koizumi",
        "N Rogers",
        "M Rogers",
        "M Islam",
        "M Kusunoki",
        "N Takeshima"
      ],
      "year": 2009,
      "doi": "10.1123/jpah.6.4.467",
      "journal": "J Phys Act Health",
      "volume": "6",
      "issue": "4",
      "raw": "Efficacy of an accelerometer-guided physical activity intervention in community-dwelling older women \n\t\t \n\t\t\t D Koizumi \n\t\t \n\t\t \n\t\t\t N L Rogers \n\t\t \n\t\t \n\t\t\t M E Rogers \n\t\t \n\t\t \n\t\t\t M M Islam \n\t\t \n\t\t \n\t\t\t M Kusunoki \n\t\t \n\t\t \n\t\t\t N Takeshima \n\t\t \n\t\t 10.1123/jpah.6.4.467 \n\t\t Medline: 19842461] 139 \n\t \n\t \n\t\t J Phys Act Health \n\t\t \n\t\t\t 6 \n\t\t\t 4 \n\t\t\t \n\t\t\t 2009 Jul \n\t\t \n\t \n\t Koizumi D, Rogers NL, Rogers ME, Islam MM, Kusunoki M, Takeshima N. Efficacy of an accelerometer-guided physical activity intervention in community-dwelling older women. J Phys Act Health 2009 Jul;6(4):467-474. [doi: 10.1123/jpah.6.4.467] [Medline: 19842461] 139"
    },
    {
      "title": "A community-based physical activity counselling program for people with knee osteoarthritis: feasibility and preliminary efficacy of the Track-OA study",
      "authors": [
        "L Li",
        "E Sayre",
        "H Xie",
        "C Clayton",
        "L Feehan"
      ],
      "year": 2017,
      "doi": "10.2196/mhealth.7863",
      "journal": "JMIR Mhealth Uhealth",
      "volume": "5",
      "issue": "6",
      "raw": "A community-based physical activity counselling program for people with knee osteoarthritis: feasibility and preliminary efficacy of the Track-OA study \n\t\t \n\t\t\t L C Li \n\t\t \n\t\t \n\t\t\t E C Sayre \n\t\t \n\t\t \n\t\t\t H Xie \n\t\t \n\t\t \n\t\t\t C Clayton \n\t\t \n\t\t \n\t\t\t L M Feehan \n\t\t \n\t\t 10.2196/mhealth.7863 \n\t\t Medline: 28652228] 140 \n\t \n\t \n\t\t JMIR Mhealth Uhealth \n\t\t \n\t\t\t 5 \n\t\t\t 6 \n\t\t\t 2017 Jun 26 \n\t\t \n\t \n\t FREE Full text \n\t Li LC, Sayre EC, Xie H, Clayton C, Feehan LM. A community-based physical activity counselling program for people with knee osteoarthritis: feasibility and preliminary efficacy of the Track-OA study. JMIR Mhealth Uhealth 2017 Jun 26;5(6):e86 [FREE Full text] [doi: 10.2196/mhealth.7863] [Medline: 28652228] 140"
    },
    {
      "title": "A randomized controlled trial of WATAAP to promote physical activity in colorectal and endometrial cancer survivors",
      "authors": [
        "C Maxwell-Smith",
        "D Hince",
        "P Cohen",
        "M Bulsara",
        "T Boyle",
        "C Platell"
      ],
      "year": 2019,
      "doi": "10.1002/pon.5090",
      "journal": "Psychooncology",
      "volume": "28",
      "issue": "7",
      "raw": "A randomized controlled trial of WATAAP to promote physical activity in colorectal and endometrial cancer survivors \n\t\t \n\t\t\t C Maxwell-Smith \n\t\t \n\t\t \n\t\t\t D Hince \n\t\t \n\t\t \n\t\t\t P A Cohen \n\t\t \n\t\t \n\t\t\t M K Bulsara \n\t\t \n\t\t \n\t\t\t T Boyle \n\t\t \n\t\t \n\t\t\t C Platell \n\t\t \n\t\t 10.1002/pon.5090 \n\t\t Medline: 30980691] 141 \n\t \n\t \n\t\t Psychooncology \n\t\t \n\t\t\t 28 \n\t\t\t 7 \n\t\t\t \n\t\t\t 2019 Jul \n\t\t \n\t \n\t Maxwell-Smith C, Hince D, Cohen PA, Bulsara MK, Boyle T, Platell C, et al. A randomized controlled trial of WATAAP to promote physical activity in colorectal and endometrial cancer survivors. Psychooncology 2019 Jul;28(7):1420-1429. [doi: 10.1002/pon.5090] [Medline: 30980691] 141"
    },
    {
      "title": "Pilot trial of a home-based physical activity program for African American women",
      "authors": [
        "D Pekmezi",
        "C Ainsworth",
        "R Joseph",
        "V Williams",
        "R Desmond",
        "K Meneses"
      ],
      "year": 2017,
      "doi": "10.1249/mss.0000000000001370",
      "journal": "Med Sci Sports Exerc",
      "volume": "49",
      "issue": "12",
      "raw": "Pilot trial of a home-based physical activity program for African American women \n\t\t \n\t\t\t D Pekmezi \n\t\t \n\t\t \n\t\t\t C Ainsworth \n\t\t \n\t\t \n\t\t\t R P Joseph \n\t\t \n\t\t \n\t\t\t V Williams \n\t\t \n\t\t \n\t\t\t R Desmond \n\t\t \n\t\t \n\t\t\t K Meneses \n\t\t \n\t\t 10.1249/mss.0000000000001370 \n\t\t Medline: 28704343] 142 \n\t \n\t \n\t\t Med Sci Sports Exerc \n\t\t \n\t\t\t 49 \n\t\t\t 12 \n\t\t\t \n\t\t\t 2017 Dec \n\t\t \n\t \n\t FREE Full text \n\t Pekmezi D, Ainsworth C, Joseph RP, Williams V, Desmond R, Meneses K, et al. Pilot trial of a home-based physical activity program for African American women. Med Sci Sports Exerc 2017 Dec;49(12):2528-2536 [FREE Full text] [doi: 10.1249/MSS.0000000000001370] [Medline: 28704343] 142"
    },
    {
      "title": "Can the effects of implementation intentions on exercise be enhanced using text messages?",
      "authors": [
        "A Prestwich",
        "M Perugini",
        "R Hurling"
      ],
      "year": 2009,
      "doi": "10.1080/08870440802040715",
      "journal": "Psychol Health",
      "volume": "24",
      "issue": "6",
      "raw": "Can the effects of implementation intentions on exercise be enhanced using text messages? \n\t\t \n\t\t\t A Prestwich \n\t\t \n\t\t \n\t\t\t M Perugini \n\t\t \n\t\t \n\t\t\t R Hurling \n\t\t \n\t\t 10.1080/08870440802040715 \n\t\t Medline: 20205020] 143 \n\t \n\t \n\t\t Psychol Health \n\t\t \n\t\t\t 24 \n\t\t\t 6 \n\t\t\t \n\t\t\t 2009 Jul \n\t\t \n\t \n\t Prestwich A, Perugini M, Hurling R. Can the effects of implementation intentions on exercise be enhanced using text messages? Psychol Health 2009 Jul;24(6):677-687. [doi: 10.1080/08870440802040715] [Medline: 20205020] 143"
    },
    {
      "title": "A randomized controlled trial of continuous activity, short bouts, and a 10,000 step guideline in inactive adults",
      "authors": [
        "T Samuels",
        "T Raedeke",
        "M Mahar",
        "K Karvinen",
        "K Dubose"
      ],
      "year": 2011,
      "doi": "10.1016/j.ypmed.2010.12.001",
      "journal": "Prev Med",
      "volume": "52",
      "issue": "2",
      "raw": "A randomized controlled trial of continuous activity, short bouts, and a 10,000 step guideline in inactive adults \n\t\t \n\t\t\t T Y Samuels \n\t\t \n\t\t \n\t\t\t T D Raedeke \n\t\t \n\t\t \n\t\t\t M T Mahar \n\t\t \n\t\t \n\t\t\t K H Karvinen \n\t\t \n\t\t \n\t\t\t K D Dubose \n\t\t \n\t\t 10.1016/j.ypmed.2010.12.001 \n\t\t Medline: 21147156] 144 \n\t \n\t \n\t\t Prev Med \n\t\t \n\t\t\t 52 \n\t\t\t 2 \n\t\t\t \n\t\t\t 2011 Feb \n\t\t \n\t \n\t Samuels TY, Raedeke TD, Mahar MT, Karvinen KH, DuBose KD. A randomized controlled trial of continuous activity, short bouts, and a 10,000 step guideline in inactive adults. Prev Med 2011 Feb;52(2):120-125. [doi: 10.1016/j.ypmed.2010.12.001] [Medline: 21147156] 144"
    },
    {
      "title": "The effects of a pedometer-based intervention on first-year university students: a randomized control trial",
      "authors": [
        "P Sharp",
        "C Caperchione"
      ],
      "year": 2016,
      "doi": "10.1080/07448481.2016.1217538",
      "journal": "J Am Coll Health",
      "volume": "64",
      "issue": "8",
      "raw": "The effects of a pedometer-based intervention on first-year university students: a randomized control trial \n\t\t \n\t\t\t P Sharp \n\t\t \n\t\t \n\t\t\t C Caperchione \n\t\t \n\t\t 10.1080/07448481.2016.1217538 \n\t\t Medline: 27471879] 145 \n\t \n\t \n\t\t J Am Coll Health \n\t\t \n\t\t\t 64 \n\t\t\t 8 \n\t\t\t \n\t\t\t 2016 \n\t\t \n\t \n\t Sharp P, Caperchione C. The effects of a pedometer-based intervention on first-year university students: a randomized control trial. J Am Coll Health 2016;64(8):630-638. [doi: 10.1080/07448481.2016.1217538] [Medline: 27471879] 145"
    },
    {
      "title": "Physical activity enhancement to a behavioral weight loss program for severely obese individuals: a preliminary investigation",
      "authors": [
        "J Unick",
        "O' Leary",
        "K Bond",
        "D Wing"
      ],
      "year": 2012,
      "doi": "10.5402/2012/465158",
      "journal": "ISRN Obes",
      "raw": "Physical activity enhancement to a behavioral weight loss program for severely obese individuals: a preliminary investigation \n\t\t \n\t\t\t J L Unick \n\t\t \n\t\t \n\t\t\t O' Leary \n\t\t \n\t\t \n\t\t\t K C Bond \n\t\t \n\t\t \n\t\t\t D S Wing \n\t\t \n\t\t \n\t\t\t R R \n\t\t \n\t\t 10.5402/2012/465158 \n\t\t Medline: 24379985] 146 \n\t \n\t \n\t\t ISRN Obes \n\t\t \n\t\t\t \n\t\t\t 2012 Sep 05. 2012 \n\t\t \n\t \n\t FREE Full text \n\t Unick JL, O'Leary KC, Bond DS, Wing RR. Physical activity enhancement to a behavioral weight loss program for severely obese individuals: a preliminary investigation. ISRN Obes 2012 Sep 05;2012:1-4 [FREE Full text] [doi: 10.5402/2012/465158] [Medline: 24379985] 146"
    },
    {
      "title": "The effectiveness of a web-based computer-tailored physical activity intervention using Fitbit activity trackers: randomized trial",
      "authors": [
        "C Vandelanotte",
        "M Duncan",
        "C Maher",
        "S Schoeppe",
        "A Rebar",
        "D Power"
      ],
      "year": 2018,
      "doi": "10.2196/11321",
      "journal": "J Med Internet Res",
      "volume": "20",
      "issue": "12",
      "pages": "11321",
      "raw": "The effectiveness of a web-based computer-tailored physical activity intervention using Fitbit activity trackers: randomized trial \n\t\t \n\t\t\t C Vandelanotte \n\t\t \n\t\t \n\t\t\t M J Duncan \n\t\t \n\t\t \n\t\t\t C A Maher \n\t\t \n\t\t \n\t\t\t S Schoeppe \n\t\t \n\t\t \n\t\t\t A L Rebar \n\t\t \n\t\t \n\t\t\t D A Power \n\t\t \n\t\t 10.2196/11321 \n\t\t Medline: 30563808] 147 \n\t \n\t \n\t\t J Med Internet Res \n\t\t \n\t\t\t 20 \n\t\t\t 12 \n\t\t\t 11321 \n\t\t\t 2018 Dec 18 \n\t\t \n\t \n\t FREE Full text \n\t Vandelanotte C, Duncan MJ, Maher CA, Schoeppe S, Rebar AL, Power DA, et al. The effectiveness of a web-based computer-tailored physical activity intervention using Fitbit activity trackers: randomized trial. J Med Internet Res 2018 Dec 18;20(12):e11321 [FREE Full text] [doi: 10.2196/11321] [Medline: 30563808] 147"
    },
    {
      "title": "Effects of a web-based intervention on physical activity and metabolism in older adults: randomized controlled trial",
      "authors": [
        "C Wijsman",
        "R Westendorp",
        "E Verhagen",
        "M Catt",
        "P Slagboom",
        "De Craen"
      ],
      "year": 2013,
      "doi": "10.2196/jmir.2843",
      "journal": "J Med Internet Res",
      "volume": "15",
      "issue": "11",
      "pages": "233",
      "raw": "Effects of a web-based intervention on physical activity and metabolism in older adults: randomized controlled trial \n\t\t \n\t\t\t C A Wijsman \n\t\t \n\t\t \n\t\t\t R G Westendorp \n\t\t \n\t\t \n\t\t\t E A Verhagen \n\t\t \n\t\t \n\t\t\t M Catt \n\t\t \n\t\t \n\t\t\t P E Slagboom \n\t\t \n\t\t \n\t\t\t De Craen \n\t\t \n\t\t \n\t\t\t A J \n\t\t \n\t\t 10.2196/jmir.2843 \n\t\t Medline: 24195965] 148 \n\t \n\t \n\t\t J Med Internet Res \n\t\t \n\t\t\t 15 \n\t\t\t 11 \n\t\t\t 233 \n\t\t\t 2013 Nov 06 \n\t\t \n\t \n\t FREE Full text \n\t Wijsman CA, Westendorp RG, Verhagen EA, Catt M, Slagboom PE, De Craen AJ, et al. Effects of a web-based intervention on physical activity and metabolism in older adults: randomized controlled trial. J Med Internet Res 2013 Nov 06;15(11):e233 [FREE Full text] [doi: 10.2196/jmir.2843] [Medline: 24195965] 148"
    },
    {
      "title": "Randomized controlled trial testing an internet physical activity intervention for sedentary adults",
      "authors": [
        "L Carr",
        "S Dunsiger",
        "B Lewis",
        "J Ciccolo",
        "S Hartman",
        "B Bock"
      ],
      "year": 2013,
      "doi": "10.1037/a0028962",
      "journal": "Health Psychol",
      "volume": "32",
      "issue": "3",
      "raw": "Randomized controlled trial testing an internet physical activity intervention for sedentary adults \n\t\t \n\t\t\t L J Carr \n\t\t \n\t\t \n\t\t\t S I Dunsiger \n\t\t \n\t\t \n\t\t\t B Lewis \n\t\t \n\t\t \n\t\t\t J T Ciccolo \n\t\t \n\t\t \n\t\t\t S Hartman \n\t\t \n\t\t \n\t\t\t B Bock \n\t\t \n\t\t 10.1037/a0028962 \n\t\t Medline: 22823069] 149 \n\t \n\t \n\t\t Health Psychol \n\t\t \n\t\t\t 32 \n\t\t\t 3 \n\t\t\t \n\t\t\t 2013 Mar \n\t\t \n\t \n\t FREE Full text \n\t Carr LJ, Dunsiger SI, Lewis B, Ciccolo JT, Hartman S, Bock B, et al. Randomized controlled trial testing an internet physical activity intervention for sedentary adults. Health Psychol 2013 Mar;32(3):328-336 [FREE Full text] [doi: 10.1037/a0028962] [Medline: 22823069] 149"
    },
    {
      "title": "An effort to 'leverage' the effect of participation in a mass event on physical activity",
      "authors": [
        "A Lane",
        "N Murphy",
        "A Bauman"
      ],
      "year": 2015,
      "doi": "10.1093/heapro/dat077",
      "journal": "Health Promot Int",
      "volume": "30",
      "issue": "3",
      "raw": "An effort to 'leverage' the effect of participation in a mass event on physical activity \n\t\t \n\t\t\t A Lane \n\t\t \n\t\t \n\t\t\t N Murphy \n\t\t \n\t\t \n\t\t\t A Bauman \n\t\t \n\t\t 10.1093/heapro/dat077 \n\t\t Medline: 24226297] 150 \n\t \n\t \n\t\t Health Promot Int \n\t\t \n\t\t\t 30 \n\t\t\t 3 \n\t\t\t \n\t\t\t 2015 Sep 13 \n\t\t \n\t \n\t Lane A, Murphy N, Bauman A. An effort to 'leverage' the effect of participation in a mass event on physical activity. Health Promot Int 2015 Sep 13;30(3):542-551. [doi: 10.1093/heapro/dat077] [Medline: 24226297] 150"
    },
    {
      "title": "Internet-delivered physical activity intervention for college students with mental health disorders: a randomized pilot trial",
      "authors": [
        "E Mailey",
        "T W\u00f3jcicki",
        "R Motl",
        "L Hu",
        "D Strauser",
        "K Collins"
      ],
      "year": 2010,
      "doi": "10.1080/13548506.2010.498894",
      "journal": "Psychol Health Med",
      "volume": "15",
      "issue": "6",
      "raw": "Internet-delivered physical activity intervention for college students with mental health disorders: a randomized pilot trial \n\t\t \n\t\t\t E L Mailey \n\t\t \n\t\t \n\t\t\t T R W\u00f3jcicki \n\t\t \n\t\t \n\t\t\t R W Motl \n\t\t \n\t\t \n\t\t\t L Hu \n\t\t \n\t\t \n\t\t\t D R Strauser \n\t\t \n\t\t \n\t\t\t K D Collins \n\t\t \n\t\t 10.1080/13548506.2010.498894 \n\t\t Medline: 21154018] 151 \n\t \n\t \n\t\t Psychol Health Med \n\t\t \n\t\t\t 15 \n\t\t\t 6 \n\t\t\t \n\t\t\t 2010 Dec \n\t\t \n\t \n\t Mailey EL, W\u00f3jcicki TR, Motl RW, Hu L, Strauser DR, Collins KD, et al. Internet-delivered physical activity intervention for college students with mental health disorders: a randomized pilot trial. Psychol Health Med 2010 Dec;15(6):646-659. [doi: 10.1080/13548506.2010.498894] [Medline: 21154018] 151"
    },
    {
      "title": "Internet intervention for increasing physical activity in persons with multiple sclerosis",
      "authors": [
        "R Motl",
        "D Dlugonski",
        "T W\u00f3jcicki",
        "E Mcauley",
        "D Mohr"
      ],
      "year": 2011,
      "doi": "10.1177/1352458510383148",
      "journal": "Mult Scler",
      "volume": "17",
      "issue": "1",
      "raw": "Internet intervention for increasing physical activity in persons with multiple sclerosis \n\t\t \n\t\t\t R W Motl \n\t\t \n\t\t \n\t\t\t D Dlugonski \n\t\t \n\t\t \n\t\t\t T R W\u00f3jcicki \n\t\t \n\t\t \n\t\t\t E Mcauley \n\t\t \n\t\t \n\t\t\t D C Mohr \n\t\t \n\t\t 10.1177/1352458510383148 \n\t\t Medline: 20921239] 152 \n\t \n\t \n\t\t Mult Scler \n\t\t \n\t\t\t 17 \n\t\t\t 1 \n\t\t\t \n\t\t\t 2011 Jan \n\t\t \n\t \n\t Motl RW, Dlugonski D, W\u00f3jcicki TR, McAuley E, Mohr DC. Internet intervention for increasing physical activity in persons with multiple sclerosis. Mult Scler 2011 Jan;17(1):116-128. [doi: 10.1177/1352458510383148] [Medline: 20921239] 152"
    },
    {
      "title": "The feasibility of using pedometers and brief advice to increase activity in sedentary older women-a pilot study",
      "authors": [
        "J Sugden",
        "F Sniehotta",
        "P Donnan",
        "P Boyle",
        "D Johnston",
        "M Mcmurdo"
      ],
      "year": 2008,
      "doi": "10.1186/1472-6963-8-169",
      "journal": "BMC Health Serv Res",
      "volume": "8",
      "pages": "169",
      "raw": "The feasibility of using pedometers and brief advice to increase activity in sedentary older women-a pilot study \n\t\t \n\t\t\t J A Sugden \n\t\t \n\t\t \n\t\t\t F F Sniehotta \n\t\t \n\t\t \n\t\t\t P T Donnan \n\t\t \n\t\t \n\t\t\t P Boyle \n\t\t \n\t\t \n\t\t\t D W Johnston \n\t\t \n\t\t \n\t\t\t M E Mcmurdo \n\t\t \n\t\t 10.1186/1472-6963-8-169 \n\t\t Medline: 18691392] 153 \n\t \n\t \n\t\t BMC Health Serv Res \n\t\t \n\t\t\t 8 \n\t\t\t 169 \n\t\t\t 2008 Aug 08 \n\t\t \n\t \n\t FREE Full text \n\t Sugden JA, Sniehotta FF, Donnan PT, Boyle P, Johnston DW, McMurdo ME. The feasibility of using pedometers and brief advice to increase activity in sedentary older women-a pilot study. BMC Health Serv Res 2008 Aug 08;8:169 [FREE Full text] [doi: 10.1186/1472-6963-8-169] [Medline: 18691392] 153"
    },
    {
      "title": "Increasing physical activity efficiently: an experimental pilot study of a website and mobile phone intervention",
      "authors": [
        "K Thorsteinsen",
        "J Vitters\u00f8",
        "G Svendsen"
      ],
      "year": 2014,
      "doi": "10.1155/2014/746232",
      "journal": "Int J Telemed Appl",
      "raw": "Increasing physical activity efficiently: an experimental pilot study of a website and mobile phone intervention \n\t\t \n\t\t\t K Thorsteinsen \n\t\t \n\t\t \n\t\t\t J Vitters\u00f8 \n\t\t \n\t\t \n\t\t\t G B Svendsen \n\t\t \n\t\t 10.1155/2014/746232 \n\t\t Medline: 24963290] 154 \n\t \n\t \n\t\t Int J Telemed Appl \n\t\t \n\t\t\t 2014. 2014 \n\t\t \n\t \n\t FREE Full text \n\t Thorsteinsen K, Vitters\u00f8 J, Svendsen GB. Increasing physical activity efficiently: an experimental pilot study of a website and mobile phone intervention. Int J Telemed Appl 2014;2014 [FREE Full text] [doi: 10.1155/2014/746232] [Medline: 24963290] 154"
    },
    {
      "title": "Using text messages to bridge the intention-behavior gap? A pilot study on the use of text message reminders to increase objectively assessed physical activity in daily life",
      "authors": [
        "A Schwerdtfeger",
        "C Schmitz",
        "M Warken"
      ],
      "year": 2012,
      "doi": "10.3389/fpsyg.2012.00270",
      "journal": "Front Psychol",
      "volume": "3",
      "pages": "270",
      "raw": "Using text messages to bridge the intention-behavior gap? A pilot study on the use of text message reminders to increase objectively assessed physical activity in daily life \n\t\t \n\t\t\t A R Schwerdtfeger \n\t\t \n\t\t \n\t\t\t C Schmitz \n\t\t \n\t\t \n\t\t\t M Warken \n\t\t \n\t\t 10.3389/fpsyg.2012.00270 \n\t\t Medline: 22876237] 155 \n\t \n\t \n\t\t Front Psychol \n\t\t \n\t\t\t 3 \n\t\t\t 270 \n\t\t\t 2012 \n\t\t \n\t \n\t FREE Full text \n\t Schwerdtfeger AR, Schmitz C, Warken M. Using text messages to bridge the intention-behavior gap? A pilot study on the use of text message reminders to increase objectively assessed physical activity in daily life. Front Psychol 2012;3:270 [FREE Full text] [doi: 10.3389/fpsyg.2012.00270] [Medline: 22876237] 155"
    },
    {
      "title": "A telephone-only motivational intervention to increase physical activity in rural adults: a randomized controlled trial",
      "authors": [
        "J Bennett",
        "H Young",
        "L Nail",
        "K Winters-Stone",
        "G Hanson"
      ],
      "year": 2008,
      "doi": "10.1097/01.nnr.0000280661.34502.c1",
      "journal": "Nurs Res",
      "volume": "57",
      "issue": "1",
      "raw": "A telephone-only motivational intervention to increase physical activity in rural adults: a randomized controlled trial \n\t\t \n\t\t\t J A Bennett \n\t\t \n\t\t \n\t\t\t H M Young \n\t\t \n\t\t \n\t\t\t L M Nail \n\t\t \n\t\t \n\t\t\t K Winters-Stone \n\t\t \n\t\t \n\t\t\t G Hanson \n\t\t \n\t\t 10.1097/01.nnr.0000280661.34502.c1 \n\t\t Medline: 18091289] 156 \n\t \n\t \n\t\t Nurs Res \n\t\t \n\t\t\t 57 \n\t\t\t 1 \n\t\t\t \n\t\t\t 2008 \n\t\t \n\t \n\t Bennett JA, Young HM, Nail LM, Winters-Stone K, Hanson G. A telephone-only motivational intervention to increase physical activity in rural adults: a randomized controlled trial. Nurs Res 2008;57(1):24-32. [doi: 10.1097/01.NNR.0000280661.34502.c1] [Medline: 18091289] 156"
    },
    {
      "title": "Twelve-month outcomes of an internet-based diabetes self-management support program",
      "authors": [
        "R Glasgow",
        "D Kurz",
        "D King",
        "J Dickman",
        "A Faber",
        "E Halterman"
      ],
      "year": 2012,
      "doi": "10.1016/j.pec.2011.07.024",
      "journal": "Patient Educ Couns",
      "volume": "87",
      "issue": "1",
      "raw": "Twelve-month outcomes of an internet-based diabetes self-management support program \n\t\t \n\t\t\t R E Glasgow \n\t\t \n\t\t \n\t\t\t D Kurz \n\t\t \n\t\t \n\t\t\t D King \n\t\t \n\t\t \n\t\t\t J M Dickman \n\t\t \n\t\t \n\t\t\t A J Faber \n\t\t \n\t\t \n\t\t\t E Halterman \n\t\t \n\t\t 10.1016/j.pec.2011.07.024 \n\t\t Medline: 21924576] 157 \n\t \n\t \n\t\t Patient Educ Couns \n\t\t \n\t\t\t 87 \n\t\t\t 1 \n\t\t\t \n\t\t\t 2012 Apr \n\t\t \n\t \n\t FREE Full text \n\t Glasgow RE, Kurz D, King D, Dickman JM, Faber AJ, Halterman E, et al. Twelve-month outcomes of an internet-based diabetes self-management support program. Patient Educ Couns 2012 Apr;87(1):81-92 [FREE Full text] [doi: 10.1016/j.pec.2011.07.024] [Medline: 21924576] 157"
    },
    {
      "title": "Combining temporal and spectral information with spatial mapping to identify differences between phonological and semantic networks: a magnetoencephalographic approach",
      "authors": [
        "F Mcnab",
        "A Hillebrand",
        "S Swithenby",
        "G Rippon"
      ],
      "year": 2012,
      "doi": "10.3389/fpsyg.2012.00273",
      "journal": "Front Psychol",
      "volume": "3",
      "pages": "273",
      "raw": "Combining temporal and spectral information with spatial mapping to identify differences between phonological and semantic networks: a magnetoencephalographic approach \n\t\t \n\t\t\t F Mcnab \n\t\t \n\t\t \n\t\t\t A Hillebrand \n\t\t \n\t\t \n\t\t\t S J Swithenby \n\t\t \n\t\t \n\t\t\t G Rippon \n\t\t \n\t\t 10.3389/fpsyg.2012.00273 \n\t\t Medline: 22908001] 158 \n\t \n\t \n\t\t Front Psychol \n\t\t \n\t\t\t 3 \n\t\t\t 273 \n\t\t\t 2012 \n\t\t \n\t \n\t FREE Full text \n\t McNab F, Hillebrand A, Swithenby SJ, Rippon G. Combining temporal and spectral information with spatial mapping to identify differences between phonological and semantic networks: a magnetoencephalographic approach. Front Psychol 2012;3:273 [FREE Full text] [doi: 10.3389/fpsyg.2012.00273] [Medline: 22908001] 158"
    },
    {
      "title": "Accelerometer-determined steps/day and metabolic syndrome",
      "authors": [
        "S Sisson",
        "S Camhi",
        "T Church",
        "C Tudor-Locke",
        "W Johnson",
        "P Katzmarzyk"
      ],
      "year": 2010,
      "doi": "10.1016/j.amepre.2010.02.015",
      "journal": "Am J Prev Med",
      "volume": "38",
      "issue": "6",
      "raw": "Accelerometer-determined steps/day and metabolic syndrome \n\t\t \n\t\t\t S B Sisson \n\t\t \n\t\t \n\t\t\t S M Camhi \n\t\t \n\t\t \n\t\t\t T S Church \n\t\t \n\t\t \n\t\t\t C Tudor-Locke \n\t\t \n\t\t \n\t\t\t W D Johnson \n\t\t \n\t\t \n\t\t\t P T Katzmarzyk \n\t\t \n\t\t 10.1016/j.amepre.2010.02.015 \n\t\t Medline: 20494233] 159 \n\t \n\t \n\t\t Am J Prev Med \n\t\t \n\t\t\t 38 \n\t\t\t 6 \n\t\t\t \n\t\t\t 2010 Jun \n\t\t \n\t \n\t Sisson SB, Camhi SM, Church TS, Tudor-Locke C, Johnson WD, Katzmarzyk PT. Accelerometer-determined steps/day and metabolic syndrome. Am J Prev Med 2010 Jun;38(6):575-582. [doi: 10.1016/j.amepre.2010.02.015] [Medline: 20494233] 159"
    },
    {
      "title": "Daily steps and diet, but not sleep, are related to mortality in older Australians",
      "authors": [
        "S Oftedal",
        "E Holliday",
        "J Attia",
        "W Brown",
        "C Collins",
        "B Ewald"
      ],
      "year": 2020,
      "doi": "10.1016/j.jsams.2019.09.018",
      "journal": "J Sci Med Sport",
      "volume": "23",
      "issue": "3",
      "raw": "Daily steps and diet, but not sleep, are related to mortality in older Australians \n\t\t \n\t\t\t S Oftedal \n\t\t \n\t\t \n\t\t\t E G Holliday \n\t\t \n\t\t \n\t\t\t J Attia \n\t\t \n\t\t \n\t\t\t W J Brown \n\t\t \n\t\t \n\t\t\t C E Collins \n\t\t \n\t\t \n\t\t\t B Ewald \n\t\t \n\t\t 10.1016/j.jsams.2019.09.018 \n\t\t Medline: 31615727] 160 \n\t \n\t \n\t\t J Sci Med Sport \n\t\t \n\t\t\t 23 \n\t\t\t 3 \n\t\t\t \n\t\t\t 2020 Mar \n\t\t \n\t \n\t Oftedal S, Holliday EG, Attia J, Brown WJ, Collins CE, Ewald B, et al. Daily steps and diet, but not sleep, are related to mortality in older Australians. J Sci Med Sport 2020 Mar;23(3):276-282. [doi: 10.1016/j.jsams.2019.09.018] [Medline: 31615727] 160"
    },
    {
      "title": "Health benefits of a pedometer-based physical activity intervention in sedentary workers",
      "authors": [
        "C Chan",
        "D Ryan",
        "Tudor Locke"
      ],
      "year": 2004,
      "doi": "10.1016/j.ypmed.2004.04.053",
      "journal": "Prev Med",
      "volume": "39",
      "issue": "6",
      "raw": "Health benefits of a pedometer-based physical activity intervention in sedentary workers \n\t\t \n\t\t\t C B Chan \n\t\t \n\t\t \n\t\t\t D A Ryan \n\t\t \n\t\t \n\t\t\t Tudor - Locke \n\t\t \n\t\t \n\t\t\t C \n\t\t \n\t\t 10.1016/j.ypmed.2004.04.053 \n\t\t Medline: 15539058] 161 \n\t \n\t \n\t\t Prev Med \n\t\t \n\t\t\t 39 \n\t\t\t 6 \n\t\t\t \n\t\t\t 2004 Dec \n\t\t \n\t \n\t Chan CB, Ryan DA, Tudor-Locke C. Health benefits of a pedometer-based physical activity intervention in sedentary workers. Prev Med 2004 Dec;39(6):1215-1222. [doi: 10.1016/j.ypmed.2004.04.053] [Medline: 15539058] 161"
    },
    {
      "title": "Large-scale physical activity data reveal worldwide activity inequality",
      "authors": [
        "T Althoff",
        "R Sosi\u010d",
        "J Hicks",
        "A King",
        "S Delp",
        "J Leskovec"
      ],
      "year": 2017,
      "doi": "10.1038/nature23018",
      "journal": "Nature",
      "volume": "547",
      "issue": "7663",
      "raw": "Large-scale physical activity data reveal worldwide activity inequality \n\t\t \n\t\t\t T Althoff \n\t\t \n\t\t \n\t\t\t R Sosi\u010d \n\t\t \n\t\t \n\t\t\t J L Hicks \n\t\t \n\t\t \n\t\t\t A C King \n\t\t \n\t\t \n\t\t\t S L Delp \n\t\t \n\t\t \n\t\t\t J Leskovec \n\t\t \n\t\t 10.1038/nature23018 \n\t\t Medline: 28693034] 162 \n\t \n\t \n\t\t Nature \n\t\t \n\t\t\t 547 \n\t\t\t 7663 \n\t\t\t \n\t\t\t 2017 Jul 20 \n\t\t \n\t \n\t FREE Full text \n\t Althoff T, Sosi\u010d R, Hicks JL, King AC, Delp SL, Leskovec J. Large-scale physical activity data reveal worldwide activity inequality. Nature 2017 Jul 20;547(7663):336-339 [FREE Full text] [doi: 10.1038/nature23018] [Medline: 28693034] 162"
    },
    {
      "title": "The effect of digital physical activity interventions on daily step count: a randomised controlled crossover substudy of the MyHeart Counts Cardiovascular Health Study",
      "authors": [
        "A Shcherbina",
        "S Hershman",
        "L Lazzeroni",
        "A King",
        "O' Sullivan",
        "J Hekler"
      ],
      "year": 2019,
      "doi": "10.1016/s2589-7500(19)30129-3",
      "journal": "Lancet Digit Health",
      "volume": "1",
      "issue": "7",
      "raw": "The effect of digital physical activity interventions on daily step count: a randomised controlled crossover substudy of the MyHeart Counts Cardiovascular Health Study \n\t\t \n\t\t\t A Shcherbina \n\t\t \n\t\t \n\t\t\t S G Hershman \n\t\t \n\t\t \n\t\t\t L Lazzeroni \n\t\t \n\t\t \n\t\t\t A C King \n\t\t \n\t\t \n\t\t\t O' Sullivan \n\t\t \n\t\t \n\t\t\t J W Hekler \n\t\t \n\t\t \n\t\t\t E \n\t\t \n\t\t 10.1016/s2589-7500(19)30129-3 \n\t\t Medline: 33323209] 163 \n\t \n\t \n\t\t Lancet Digit Health \n\t\t \n\t\t\t 1 \n\t\t\t 7 \n\t\t\t \n\t\t\t 2019 Nov \n\t\t \n\t \n\t Shcherbina A, Hershman SG, Lazzeroni L, King AC, O'Sullivan JW, Hekler E, et al. The effect of digital physical activity interventions on daily step count: a randomised controlled crossover substudy of the MyHeart Counts Cardiovascular Health Study. Lancet Digit Health 2019 Nov;1(7):344-352. [doi: 10.1016/s2589-7500(19)30129-3] [Medline: 33323209] 163"
    },
    {
      "title": "Which components of a smartphone walking app help users to reach personalized step goals? Results from an optimization trial",
      "authors": [
        "J Kramer",
        "F K\u00fcnzler",
        "V Mishra",
        "S Smith",
        "D Kotz",
        "U Scholz"
      ],
      "year": 2020,
      "doi": "10.1093/abm/kaaa002",
      "journal": "Ann Behav Med",
      "volume": "54",
      "issue": "7",
      "raw": "Which components of a smartphone walking app help users to reach personalized step goals? Results from an optimization trial \n\t\t \n\t\t\t J Kramer \n\t\t \n\t\t \n\t\t\t F K\u00fcnzler \n\t\t \n\t\t \n\t\t\t V Mishra \n\t\t \n\t\t \n\t\t\t S N Smith \n\t\t \n\t\t \n\t\t\t D Kotz \n\t\t \n\t\t \n\t\t\t U Scholz \n\t\t \n\t\t 10.1093/abm/kaaa002 \n\t\t Medline: 32182353] 164 \n\t \n\t \n\t\t Ann Behav Med \n\t\t \n\t\t\t 54 \n\t\t\t 7 \n\t\t\t \n\t\t\t 2020 Jun 12 \n\t\t \n\t \n\t FREE Full text \n\t Kramer J, K\u00fcnzler F, Mishra V, Smith SN, Kotz D, Scholz U, et al. Which components of a smartphone walking app help users to reach personalized step goals? Results from an optimization trial. Ann Behav Med 2020 Jun 12;54(7):518-528 [FREE Full text] [doi: 10.1093/abm/kaaa002] [Medline: 32182353] 164"
    },
    {
      "title": "Pedometers can help people get more active as part of an exercise programme",
      "authors": [
        "R Cook",
        "P Davidson",
        "R Martin",
        "Dissemination Nihr"
      ],
      "year": 2020,
      "doi": "10.1136/bmj.m877",
      "journal": "Br Med J",
      "pages": "369",
      "raw": "Pedometers can help people get more active as part of an exercise programme \n\t\t \n\t\t\t R Cook \n\t\t \n\t\t \n\t\t\t P Davidson \n\t\t \n\t\t \n\t\t\t R Martin \n\t\t \n\t\t \n\t\t\t Dissemination Nihr \n\t\t \n\t\t \n\t\t\t Centre \n\t\t \n\t\t 10.1136/bmj.m877 \n\t\t Medline: 32253188] 165 \n\t \n\t \n\t\t Br Med J \n\t\t \n\t\t\t 369 \n\t\t\t 2020 Apr 06 \n\t\t \n\t \n\t Cook R, Davidson P, Martin R, NIHR Dissemination Centre. Pedometers can help people get more active as part of an exercise programme. Br Med J 2020 Apr 06;369. [doi: 10.1136/bmj.m877] [Medline: 32253188] 165"
    },
    {
      "title": "Does the inclusion of grey literature influence estimates of intervention effectiveness reported in meta-analyses?",
      "authors": [
        "L Mcauley",
        "B Pham",
        "P Tugwell",
        "D Moher"
      ],
      "year": 2000,
      "doi": "10.1016/s0140-6736(00)02786-0",
      "journal": "Lancet",
      "volume": "356",
      "raw": "Does the inclusion of grey literature influence estimates of intervention effectiveness reported in meta-analyses? \n\t\t \n\t\t\t L Mcauley \n\t\t \n\t\t \n\t\t\t B Pham \n\t\t \n\t\t \n\t\t\t P Tugwell \n\t\t \n\t\t \n\t\t\t D Moher \n\t\t \n\t\t 10.1016/s0140-6736(00)02786-0 \n\t\t Medline: 11072941 \n\t \n\t \n\t\t Lancet \n\t\t \n\t\t\t 356 \n\t\t\t \n\t\t\t 2000 Oct 07. 9237 \n\t\t \n\t \n\t McAuley L, Pham B, Tugwell P, Moher D. Does the inclusion of grey literature influence estimates of intervention effectiveness reported in meta-analyses? Lancet 2000 Oct 07;356(9237):1228-1231. [doi: 10.1016/S0140-6736(00)02786-0] [Medline: 11072941]"
    }
  ],
  "num_references": 165,
  "figures": [
    {
      "caption": "Figure 1 .",
      "description": "Figure 1. PRISMA (Preferred Reporting Items for Systematic Reviews and Meta-Analyses) chart. mHealth: mobile health; RCT: randomized controlled trial."
    },
    {
      "caption": "Figure 2 .",
      "description": "Figure 2. Primary outcome analysis for the outcome walking at timepoint end of intervention."
    },
    {
      "caption": "Figure 3 .",
      "description": "Figure 3. Primary outcome analysis for the outcome walking at timepoint short-term follow-up."
    },
    {
      "caption": "Figure 4 .",
      "description": "Figure 4. Primary outcome analysis for the outcome walking at timepoint long-term follow-up."
    },
    {
      "caption": "Figure 5 .",
      "description": "Figure 5. Primary outcome analysis for the outcome moderate-to-vigorous physical activity at timepoint end of intervention."
    },
    {
      "caption": "Figure 6 .",
      "description": "Figure 6. Primary outcome analysis for the outcome moderate-to-vigorous physical activity at timepoint short-term follow-up."
    },
    {
      "caption": "Figure 7 .",
      "description": "Figure 7. Primary outcome analysis for the outcome moderate-to-vigorous physical activity at timepoint long-term follow-up."
    },
    {
      "caption": "Figure 8 .",
      "description": "Figure 8. Primary outcome analysis by measurement time point for the outcome total physical activity."
    },
    {
      "caption": "Figure 9 .",
      "description": "Figure 9. Primary outcome analysis by measurement time point for the outcome energy expenditure."
    },
    {
      "caption": "Figure 10 .",
      "description": "Figure 10. Summary of the overall risk of bias assessment for included studies. RCT: randomized controlled trial."
    },
    {
      "type": "table",
      "caption": "Table 1 .",
      "description": "Summary of subgroup analyses results.MVPA: moderate-to-vigorous physical activity.In subgroups where n=1, heterogeneity cannot be calculated.No studies with combined subgroups. Thus, no numbers reported."
    }
  ],
  "num_figures": 11,
  "tables": [
    {
      "content": "Outcome measure and time point Studies, n (%) SMD a (95% CI) P value Heterogeneity Test for subgroup differences (P value) I 2 (%) P value Population type Walking (n=77) .003 Healthy 14 (18) 0.20 (0.04 to 0.35) .01 78 <.001 At-risk 30 (39) 0.59 (0.42 to 0.76) <.001 87 <.001 Sick 33 (42) 0.44 (0.29 to 0.60) <.001 71 <.001 MVPA b (n=62) .02 Healthy 12 (19) 0.14 (0.06 to 0.23) .001 15 .29 At-risk 25 (40) 0.30 (0.18 to 0.43) <.001 72 <.001 Sick 25 (40) 0.33 (0.21 to 0.45) <.001 55 <.001 TPA c (n=33) .03 Healthy 6 (18) 0.29 (-0.10 to 0.67) .14 85 <.001 At-risk 16 (48) 0.21 (0.04 to 0.38) .02 78 <.001 Sick 11 (33) 0.59 (0.36 to 0.81) <.001 49 .03 Intervention design Walking (n=77) .35 Scalable 31 (40) 0.54 (0.34 to 0.74) <.001 89 <.001 Nonscalable 45 (58) 0.42 (0.31 to 0.54) <.001 77 <.001 Combined 1 (1) 0.37 (0.25 to 0.48) <.001 N/A d,e N/A MVPA (n=62) .12 Scalable 23 (37) 0.20 (0.08 to 0.32) .001 67 <.001 Nonscalable 38 (61) 0.33 (0.24 to 0.43) <.001 57 <.001 Combined 1 (2) 0.37 (0.25 to 0.48) <.001 N/A N/A TPA (n=33) .60 Scalable 12 (36) 0.39 (0.06 to 0.73) .02 89 <.001 Nonscalable 21 (64) 0.30 (0.18 to 0.42) <.001 53 .002 Combined -f - - - - Control group type Walking (n=77) .15 No or minimal intervention 62 (81) 0.47 (0.36 to 0.59) <.001 85 <.001 Alternative intervention 10 (13) 0.48 (0.12 to 0.83) .009 80 <.001 Combined 5 (6) 0.23 (0.01 to 0.45) .04 62 .03 MVPA (n=62) .26 No or minimal intervention 43 (69) 0.29 (0.21 to 0.38) <.001 67 <.001 Alternative intervention 9 (15) 0.39 (0.14 to 0.65) .002 62 .007 Combined 10 (16) 0.20 (0.08 to 0.32) <.001 34 .13 TPA (n=33) .006 No or minimal intervention 24 (73) 0.34 (0.19 to 0.50) <.001 76 <.001 Alternative intervention 6 (18) 0.48 (0.06 to 0.91) .03 83 <.001 Combined 3 (9) 0.00 (-0.17 to 0.17) .97 0 .59"
    }
  ],
  "num_tables": 1,
  "num_citations": 142,
  "cited_references": [
    "b73",
    "b3",
    "b72",
    "b13",
    "b39",
    "b18",
    "b2",
    "b14",
    "b17",
    "b36",
    "b25",
    "b9",
    "b1",
    "b77",
    "b35",
    "b20",
    "b71",
    "b60",
    "b74",
    "b21",
    "b12",
    "b30",
    "b31",
    "b29",
    "b16",
    "b37",
    "b15",
    "b23",
    "b32",
    "b5",
    "b19",
    "b28",
    "b75",
    "b10",
    "b38",
    "b27",
    "b24",
    "b4",
    "b81",
    "b33",
    "b7",
    "b11",
    "b8",
    "b53",
    "b22",
    "b34",
    "b6",
    "b0",
    "b76",
    "b26"
  ],
  "notes": [
    "[raw_affiliation] 1  Institute for Customer Insight , University of St. Gallen , St. Gallen , Switzerland",
    "[raw_affiliation] 2  Institute for Mobility , University of St. Gallen , St. Gallen , Switzerland",
    "[raw_affiliation] 3  Centre for Digital Health Interventions , Institute of Technology Management , University of St. Gallen , St. Gallen , Switzerland",
    "[raw_affiliation] 4  CSS Insurance , Lucerne , Switzerland",
    "[raw_affiliation] 3  Centre for Digital Health Interventions , Institute of Technology Management , University of St. Gallen , St. Gallen , Switzerland",
    "[raw_affiliation] 5  Translational Neuromodeling Unit , Institute for Biomedical Engineering , University of Zurich and ETH Zurich , Zurich , Switzerland",
    "[raw_affiliation] 3  Centre for Digital Health Interventions , Institute of Technology Management , University of St. Gallen , St. Gallen , Switzerland",
    "[raw_affiliation] 6  Centre for Digital Health Interventions , Department of Management, Technology, and Economics , ETH Zurich , Zurich , Switzerland",
    "[raw_affiliation] 7  Lee Kong Chian School of Medicine , Nanyang Technological University , Singapore , Singapore",
    "[raw_affiliation] 8  School of Public Health , Department of Primary Care and Public Health , Imperial College London , London , United Kingdom",
    "[raw_affiliation] 9  Saw Swee Hock School of Public Health , National University of Singapore , Singapore , Singapore",
    "[raw_affiliation] 3  Centre for Digital Health Interventions , Institute of Technology Management , University of St. Gallen , St. Gallen , Switzerland",
    "[raw_affiliation] 6  Centre for Digital Health Interventions , Department of Management, Technology, and Economics , ETH Zurich , Zurich , Switzerland",
    "[raw_affiliation] 9  Saw Swee Hock School of Public Health , National University of Singapore , Singapore , Singapore",
    "[raw_affiliation] 10  Future Health Technologies Programme , Campus for Research Excellence and Technological Enterprise (CREATE) , Singapore-ETH Centre , Singapore , Singapore",
    "[raw_affiliation] Institute for Customer Insight University of St. Gallen Bahnhofstrasse 8 St. Gallen , 9000 Switzerland",
    "[other] RenderX",
    "b c TPA: total physical activity. d N/A: not applicable. e f",
    "J Med Internet Res 2021 | vol. 23 | iss. 4 | e26699 | p. 2 https://www.jmir.org/2021/4/e26699 (page number not for citation purposes)",
    "J Med Internet Res 2021 | vol. 23 | iss. 4 | e26699 | p. 3 https://www.jmir.org/2021/4/e26699 (page number not for citation purposes)",
    "J Med Internet Res 2021 | vol. 23 | iss. 4 | e26699 | p. 4 https://www.jmir.org/2021/4/e26699 (page number not for citation purposes)",
    "J Med Internet Res 2021 | vol. 23 | iss. 4 | e26699 | p. 5 https://www.jmir.org/2021/4/e26699 (page number not for citation purposes)",
    "J Med Internet Res 2021 | vol. 23 | iss. 4 | e26699 | p. 6 https://www.jmir.org/2021/4/e26699 (page number not for citation purposes)",
    "J Med Internet Res 2021 | vol. 23 | iss. 4 | e26699 | p. 7 https://www.jmir.org/2021/4/e26699 (page number not for citation purposes)",
    "J Med Internet Res 2021 | vol. 23 | iss. 4 | e26699 | p. 8 https://www.jmir.org/2021/4/e26699 (page number not for citation purposes)",
    "J Med Internet Res 2021 | vol. 23 | iss. 4 | e26699 | p. 9 https://www.jmir.org/2021/4/e26699 (page number not for citation purposes)",
    "J Med Internet Res 2021 | vol. 23 | iss. 4 | e26699 | p. 10 https://www.jmir.org/2021/4/e26699 (page number not for citation purposes)",
    "J Med Internet Res 2021 | vol. 23 | iss. 4 | e26699 | p. 11 https://www.jmir.org/2021/4/e26699 (page number not for citation purposes)",
    "J Med Internet Res 2021 | vol. 23 | iss. 4 | e26699 | p. 12 https://www.jmir.org/2021/4/e26699 (page number not for citation purposes)",
    "J Med Internet Res 2021 | vol. 23 | iss. 4 | e26699 | p. 13 https://www.jmir.org/2021/4/e26699 (page number not for citation purposes)",
    "J Med Internet Res 2021 | vol. 23 | iss. 4 | e26699 | p. 14 https://www.jmir.org/2021/4/e26699 (page number not for citation purposes)",
    "J Med Internet Res 2021 | vol. 23 | iss. 4 | e26699 | p. 15 https://www.jmir.org/2021/4/e26699 (page number not for citation purposes)",
    "J Med Internet Res 2021 | vol. 23 | iss. 4 | e26699 | p. 16 https://www.jmir.org/2021/4/e26699 (page number not for citation purposes)",
    "(page number not for citation purposes)",
    "J Med Internet Res 2021 | vol. 23 | iss. 4 | e26699 | p. 18 https://www.jmir.org/2021/4/e26699 (page number not for citation purposes)",
    "J Med Internet Res 2021 | vol. 23 | iss. 4 | e26699 | p. 19 https://www.jmir.org/2021/4/e26699 (page number not for citation purposes)",
    "J Med Internet Res 2021 | vol. 23 | iss. 4 | e26699 | p. 21 https://www.jmir.org/2021/4/e26699 (page number not for citation purposes)",
    "J Med Internet Res 2021 | vol. 23 | iss. 4 | e26699 | p. 22 https://www.jmir.org/2021/4/e26699 (page number not for citation purposes)",
    "J Med Internet Res 2021 | vol. 23 | iss. 4 | e26699 | p. 23 https://www.jmir.org/2021/4/e26699 (page number not for citation purposes)",
    "J Med Internet Res 2021 | vol. 23 | iss. 4 | e26699 | p. 24 https://www.jmir.org/2021/4/e26699 (page number not for citation purposes)",
    "J Med Internet Res 2021 | vol. 23 | iss. 4 | e26699 | p. 26 https://www.jmir.org/2021/4/e26699 (page number not for citation purposes)",
    "[raw_reference] Mendis S, Armstrong T, Bettcher D, Branca F, Lauer J, Mace C, et al. Global Status Report on Noncommunicable Diseases 2014. Geneva: World Health Organization; 2014.",
    "FREE Full text",
    "[raw_reference] Guthold R, Stevens GA, Riley LM, Bull FC. Worldwide trends in insufficient physical activity from 2001 to 2016: a pooled analysis of 358 population-based surveys with 1\u20229 million participants. Lancet Glob Health 2018 Oct;6(10):1077-1086 [FREE Full text] [doi: 10.1016/S2214-109X(18)30357-7] [Medline: 30193830]",
    "FREE Full text",
    "[raw_reference] Lee I, Shiroma EJ, Lobelo F, Puska P, Blair SN, Katzmarzyk PT, Lancet Physical Activity Series Working Group. Effect of physical inactivity on major non-communicable diseases worldwide: an analysis of burden of disease and life expectancy. Lancet 2012 Jul 21;380(9838):219-229 [FREE Full text] [doi: 10.1016/S0140-6736(12)61031-9] [Medline: 22818936]",
    "[raw_reference] Sallis JF, Bull F, Guthold R, Heath GW, Inoue S, Kelly P, Lancet Physical Activity Series 2 Executive Committee. Progress in physical activity over the Olympic quadrennium. Lancet 2016 Sep 24;388(10051):1325-1336. [doi: 10.1016/S0140-6736(16)30581-5] [Medline: 27475270]",
    "[raw_reference] Bianchini F, Kaaks R, Vainio H. Weight control and physical activity in cancer prevention. Obes Rev 2002 Feb;3(1):5-8. [doi: 10.1046/j.1467-789x.2002.00046.x] [Medline: 12119660]",
    "FREE Full text",
    "[raw_reference] Choi KW, Chen C, Stein MB, Klimentidis YC, Wang M, Koenen KC, Major Depressive Disorder Working Group of the Psychiatric Genomics Consortium. Assessment of bidirectional relationships between physical activity and depression among adults: a 2-sample Mendelian randomization study. JAMA Psychiatry 2019 Apr 01;76(4):399-408 [FREE Full text] [doi: 10.1001/jamapsychiatry.2018.4175] [Medline: 30673066]",
    "[raw_reference] World Health Organization. Global Action Plan for the Prevention and Control of NCDs 2013-2020. Geneva: World Health Organization; 2013:1-103.",
    "FREE Full text",
    "[raw_reference] Kowatsch T, Otto L, Harperink S, Cotti A, Schlieter H. A design and evaluation framework for digital health interventions. Inf Technol 2019;61(5-6):253-263 [FREE Full text] [doi: 10.1515/itit-2019-0019]",
    "FREE Full text",
    "[raw_reference] Reis RS, Salvo D, Ogilvie D, Lambert EV, Goenka S, Brownson RC, Lancet Physical Activity Series 2 Executive Committee. Scaling up physical activity interventions worldwide: stepping up to larger and smarter approaches to get people moving. Lancet 2016 Sep 24;388(10051):1337-1348 [FREE Full text] [doi: 10.1016/S0140-6736(16)30728-0] [Medline: 27475273]",
    "[raw_reference] Richard E, van Charante EP, Hoevenaar-Blom MP, Coley N, Barbera M, van der Groep A, et al. Healthy ageing through internet counselling in the elderly (HATICE): a multinational, randomised controlled trial. Lancet Digit Health 2019 Dec;1(8):424-434. [doi: 10.1016/s2589-7500(19)30153-0]",
    "FREE Full text",
    "[raw_reference] Fairburn CG, Patel V. The impact of digital technology on psychological treatments and their dissemination. Behav Res Ther 2017 Jan;88:19-25 [FREE Full text] [doi: 10.1016/j.brat.2016.08.012] [Medline: 28110672]",
    "[raw_reference] NHS Diabetes Prevention Programme -digital stream. NHS England. 2016. URL: https://tinyurl.com/u58h67ry [accessed 2020-06-03]",
    "FREE Full text",
    "[raw_reference] Guertler D, Vandelanotte C, Kirwan M, Duncan MJ. Engagement and nonusage attrition with a free physical activity promotion program: the case of 10,000 steps Australia. J Med Internet Res 2015 Jul 15;17(7):e176 [FREE Full text] [doi: 10.2196/jmir.4339] [Medline: 26180040]",
    "[raw_reference] Yao J, Tan CS, Chen C, Tan J, Lim N, M\u00fcller-Riemenschneider F. Bright spots, physical activity investments that work: National Steps Challenge, Singapore: a nationwide mHealth physical activity programme. Br J Sports Med 2020 Sep;54(17):1047-1048. [doi: 10.1136/bjsports-2019-101662] [Medline: 31857340]",
    "[raw_reference] Fitbit collaborates with Singapore's Health Promotion Board on population-based public health initiative in Singapore. Fitbit Press Release. 2019. URL: https://investor.fitbit.com/press/press-releases/press-release-details/2019/ Fitbit-Collaborates-with-Singapores-Health-Promotion-Board-on-Population-Based-Public-Health-Initiative-in-Singapore/ default.aspx [accessed 2020-07-01]",
    "FREE Full text",
    "[raw_reference] The Lancet Digital Health. Wearable technology and lifestyle management: the fight against obesity and diabetes. Lancet Digit Health 2019 Oct;1(6):e243 [FREE Full text] [doi: 10.1016/S2589-7500(19)30135-9] [Medline: 33323244]",
    "FREE Full text",
    "[raw_reference] Rowland SP, Fitzgerald JE, Holme T, Powell J, McGregor A. What is the clinical value of mHealth for patients? NPJ Digit Med 2020;3:4 [FREE Full text] [doi: 10.1038/s41746-019-0206-x] [Medline: 31970289]",
    "[raw_reference] Bravata DM, Smith-Spangler C, Sundaram V, Gienger AL, Lin N, Lewis R, et al. Using pedometers to increase physical activity and improve health: a systematic review. J Am Med Assoc 2007 Nov 21;298(19):2296-2304. [doi: 10.1001/jama.298.19.2296] [Medline: 18029834]",
    "FREE Full text",
    "[raw_reference] Brickwood KJ, Watson G, O'Brien J, Williams AD. Consumer-based wearable activity trackers increase physical activity participation: systematic review and meta-analysis. JMIR Mhealth Uhealth 2019 Apr 12;7(4):11819 [FREE Full text] [doi: 10.2196/11819] [Medline: 30977740]",
    "FREE Full text",
    "[raw_reference] Chaudhry UA, Wahlich C, Fortescue R, Cook DG, Knightly R, Harris T. The effects of step-count monitoring interventions on physical activity: systematic review and meta-analysis of community-based randomised controlled trials in adults. Int J Behav Nutr Phys Act 2020 Oct 09;17(1):129 [FREE Full text] [doi: 10.1186/s12966-020-01020-8] [Medline: 33036635]",
    "FREE Full text",
    "[raw_reference] De Vries HJ, Kooiman TJ, Van Ittersum MW, Van Brussel M, De Groot M. Do activity monitors increase physical activity in adults with overweight or obesity? A systematic review and meta-analysis. Obesity (Silver Spring) 2016 Oct;24(10):2078-2091 [FREE Full text] [doi: 10.1002/oby.21619] [Medline: 27670401]",
    "FREE Full text",
    "[raw_reference] Franssen WM, Franssen GH, Spaas J, Solmi F, Eijnde BO. Can consumer wearable activity tracker-based interventions improve physical activity and cardiometabolic health in patients with chronic diseases? A systematic review and meta-analysis of randomised controlled trials. Int J Behav Nutr Phys Act 2020 May 11;17(1):57 [FREE Full text] [doi: 10.1186/s12966-020-00955-2] [Medline: 32393357]",
    "FREE Full text",
    "[raw_reference] Gal R, May AM, van Overmeeren EJ, Simons M, Monninkhof EM. The effect of physical activity interventions comprising wearables and smartphone applications on physical activity: a systematic review and meta-analysis. Sports Med Open 2018 Sep 03;4(1):42 [FREE Full text] [doi: 10.1186/s40798-018-0157-9] [Medline: 30178072]",
    "FREE Full text",
    "[raw_reference] Hodkinson A, Kontopantelis E, Adeniji C, van Marwijk H, McMillan B, Bower P, et al. Accelerometer-and pedometer-based physical activity interventions among adults with cardiometabolic conditions: a systematic review and meta-analysis. JAMA Netw Open 2019 Oct 02;2(10):e1912895 [FREE Full text] [doi: 10.1001/jamanetworkopen.2019.12895] [Medline: 31596494]",
    "[raw_reference] Kirk MA, Amiri M, Pirbaglou M, Ritvo P. Wearable technology and physical activity behavior change in adults with chronic cardiometabolic disease: a systematic review and meta-analysis. Am J Health Promot 2019 Jun;33(5):778-791. [doi: 10.1177/0890117118816278] [Medline: 30586996]",
    "FREE Full text",
    "[raw_reference] Qiu S, Cai X, Chen X, Yang B, Sun Z. Step counter use in type 2 diabetes: a meta-analysis of randomized controlled trials. BMC Med 2014 Feb 27;12:36 [FREE Full text] [doi: 10.1186/1741-7015-12-36] [Medline: 24571580]",
    "FREE Full text",
    "[raw_reference] Smith DM, Duque L, Huffman JC, Healy BC, Celano CM. Text message interventions for physical activity: a systematic review and meta-analysis. Am J Prev Med 2020 Jan;58(1):142-151 [FREE Full text] [doi: 10.1016/j.amepre.2019.08.014] [Medline: 31759805]",
    "[raw_reference] Vaes AW, Cheung A, Atakhorrami M, Groenen MT, Amft O, Franssen FM, et al. Effect of 'activity monitor-based' counseling on physical activity and health-related outcomes in patients with chronic diseases: a systematic review and meta-analysis. Ann Med 2013 Sep;45(5-6):397-412. [doi: 10.3109/07853890.2013.810891] [Medline: 23952917]",
    "[raw_reference] Direito A, Carra\u00e7a E, Rawstorn J, Whittaker R, Maddison R. mHealth technologies to influence physical activity and sedentary behaviors: behavior change techniques, systematic review and meta-analysis of randomized controlled trials. Ann Behav Med 2017 Apr;51(2):226-239. [doi: 10.1007/s12160-016-9846-0] [Medline: 27757789]",
    "FREE Full text",
    "[raw_reference] Romeo A, Edney S, Plotnikoff R, Curtis R, Ryan J, Sanders I, et al. Can smartphone apps increase physical activity? Systematic review and meta-analysis. J Med Internet Res 2019 Mar 19;21(3):12053 [FREE Full text] [doi: 10.2196/12053] [Medline: 30888321]",
    "FREE Full text",
    "[raw_reference] Yerrakalva D, Yerrakalva D, Hajna S, Griffin S. Effects of mobile health app interventions on sedentary time, physical activity, and fitness in older adults: systematic review and meta-analysis. J Med Internet Res 2019 Nov 28;21(11):14343 [FREE Full text] [doi: 10.2196/14343] [Medline: 31778121]",
    "FREE Full text",
    "[raw_reference] Schoeppe S, Alley S, Van Lippevelde W, Bray NA, Williams SL, Duncan MJ, et al. Efficacy of interventions that use apps to improve diet, physical activity and sedentary behaviour: a systematic review. Int J Behav Nutr Phys Act 2016 Dec 07;13(1):127 [FREE Full text] [doi: 10.1186/s12966-016-0454-y] [Medline: 27927218]",
    "[raw_reference] Higgins JP, Green S. Cochrane Handbook for Systematic Reviews of Interventions: Cochrane Book Series. Hoboken, New Jersey, United States: John Wiley & Sons Inc; 2008:1-649.",
    "FREE Full text",
    "[raw_reference] Higgins JP, Altman DG, G\u00f8tzsche PC, J\u00fcni P, Moher D, Oxman AD, Cochrane Bias Methods Group, Cochrane Statistical Methods Group. The Cochrane Collaboration's tool for assessing risk of bias in randomised trials. Br Med J 2011 Oct 18;343:d5928 [FREE Full text] [doi: 10.1136/bmj.d5928] [Medline: 22008217]",
    "[raw_reference] Eldridge S, Campbell M, Campbell M, Dahota A, Giraudeau B, Higgins J, et al. Revised Cochrane risk of bias tool for randomized trials (RoB 2.0), additional considerations for cluster-randomized trials. 2016. URL: https://sites.google.com/ site/riskofbiastool/welcome/rob-2-0-tool/archive-rob-2-0-cluster-randomized-trials-2016 [accessed 2020-07-01]",
    "[raw_reference] DerSimonian R, Laird N. Meta-analysis in clinical trials. Control Clin Trials 1986 Sep;7(3):177-188. [doi: 10.1016/0197-2456(86)90046-2] [Medline: 3802833]",
    "[raw_reference] Richardson M, Garner P, Donegan S. Interpretation of subgroup analyses in systematic reviews: a tutorial. Clin Epidemiol Glob Health 2019 Jun;7(2):192-198. [doi: 10.1016/j.cegh.2018.05.005]",
    "FREE Full text",
    "[raw_reference] Higgins JP, Thompson SG, Deeks JJ, Altman DG. Measuring inconsistency in meta-analyses. Br Med J 2003 Sep 06;327(7414):557-560 [FREE Full text] [doi: 10.1136/bmj.327.7414.557] [Medline: 12958120]",
    "[raw_reference] Guyatt G, Oxman AD, Akl EA, Kunz R, Vist G, Brozek J, et al. GRADE guidelines: 1. Introduction-GRADE evidence profiles and summary of findings tables. J Clin Epidemiol 2011 Apr;64(4):383-394. [doi: 10.1016/j.jclinepi.2010.04.026] [Medline: 21195583]",
    "FREE Full text",
    "[raw_reference] Kangasniemi AM, Lappalainen R, Kankaanp\u00e4\u00e4 A, Tolvanen A, Tammelin T. Towards a physically more active lifestyle based on one's own values: the results of a randomized controlled trial among physically inactive adults. BMC Public Health 2015 Mar 18;15:260 [FREE Full text] [doi: 10.1186/s12889-015-1604-x] [Medline: 25848812]",
    "FREE Full text",
    "[raw_reference] Aittasalo M, Rinne M, Pasanen M, Kukkonen-Harjula K, Vasankari T. Promoting walking among office employees - evaluation of a randomized controlled intervention with pedometers and e-mail messages. BMC Public Health 2012 Jun 06;12:403 [FREE Full text] [doi: 10.1186/1471-2458-12-403] [Medline: 22672576]",
    "[raw_reference] Barnes AT, Plotnikoff RC, Collins CE, Morgan PJ. Feasibility and preliminary efficacy of the MADE4Life Program: a pilot randomized controlled trial. J Phys Act Health 2015 Oct;12(10):1378-1393. [doi: 10.1123/jpah.2014-0331] [Medline: 25599119]",
    "[raw_reference] Coelho CM, Reboredo MM, Valle FM, Malaguti C, Campos LA, Nascimento LM, et al. Effects of an unsupervised pedometer-based physical activity program on daily steps of adults with moderate to severe asthma: a randomized controlled trial. J Sports Sci 2018 May;36(10):1186-1193. [doi: 10.1080/02640414.2017.1364402] [Medline: 28799458]",
    "FREE Full text",
    "[raw_reference] Cruz J, Brooks D, Marques A. Walk2Bactive: a randomised controlled trial of a physical activity-focused behavioural intervention beyond pulmonary rehabilitation in chronic obstructive pulmonary disease. Chron Respir Dis 2016 Feb;13(1):57-66 [FREE Full text] [doi: 10.1177/1479972315619574] [Medline: 26703921]",
    "[raw_reference] Dlugonski D, Motl RW, Mohr DC, Sandroff BM. Internet-delivered behavioral intervention to increase physical activity in persons with multiple sclerosis: sustainability and secondary outcomes. Psychol Health Med 2012;17(6):636-651. [doi: 10.1080/13548506.2011.652640] [Medline: 22313192]",
    "[raw_reference] Eakin EG, Winkler EA, Dunstan DW, Healy GN, Owen N, Marshall AM, et al. Living well with diabetes: 24-month outcomes from a randomized trial of telephone-delivered weight loss and physical activity intervention to improve glycemic control. Diabetes Care 2014 Aug;37(8):2177-2185. [doi: 10.2337/dc13-2427] [Medline: 24658390]",
    "[raw_reference] Edney SM, Olds TS, Ryan JC, Vandelanotte C, Plotnikoff RC, Curtis RG, et al. A social networking and gamified app to increase physical activity: cluster RCT. Am J Prev Med 2020 Feb;58(2):51-62. [doi: 10.1016/j.amepre.2019.09.009] [Medline: 31959326]",
    "[raw_reference] Finkelstein EA, Haaland BA, Bilger M, Sahasranaman A, Sloan RA, Nang EE, et al. Effectiveness of activity trackers with and without incentives to increase physical activity (TRIPPA): a randomised controlled trial. Lancet Diabetes Endocrinol 2016 Dec;4(12):983-995. [doi: 10.1016/S2213-8587(16)30284-4] [Medline: 27717766]",
    "[raw_reference] Fjeldsoe BS, Miller YD, Graves N, Barnett AG, Marshall AL. Randomized controlled trial of an improved version of mobilemums, an intervention for increasing physical activity in women with young children. Ann Behav Med 2015 Aug;49(4):487-499. [doi: 10.1007/s12160-014-9675-y] [Medline: 25582987]",
    "[raw_reference] Furber S, Butler L, Phongsavan P, Mark A, Bauman A. Randomised controlled trial of a pedometer-based telephone intervention to increase physical activity among cardiac patients not attending cardiac rehabilitation. Patient Educ Couns 2010 Aug;80(2):212-218. [doi: 10.1016/j.pec.2009.11.012] [Medline: 20022201]",
    "FREE Full text",
    "[raw_reference] James EL, Stacey FG, Chapman K, Boyes AW, Burrows T, Girgis A, et al. Impact of a nutrition and physical activity intervention (ENRICH: Exercise and Nutrition Routine Improving Cancer Health) on health behaviors of cancer survivors and carers: a pragmatic randomized controlled trial. BMC Cancer 2015 Oct 15;15:710 [FREE Full text] [doi: 10.1186/s12885-015-1775-y] [Medline: 26471791]",
    "[raw_reference] Kernot J, Lewis L, Olds T, Maher C. Effectiveness of a Facebook-delivered physical activity intervention for postpartum women: a randomized controlled trial. J Phys Act Health 2019 Feb 01;16(2):125-133. [doi: 10.1123/jpah.2017-0573] [Medline: 30541378]",
    "FREE Full text",
    "[raw_reference] Maher C, Ferguson M, Vandelanotte C, Plotnikoff R, De Bourdeaudhuij I, Thomas S, et al. A web-based, social networking physical activity intervention for insufficiently active adults delivered via Facebook app: randomized controlled trial. J Med Internet Res 2015 Jul 13;17(7):e174 [FREE Full text] [doi: 10.2196/jmir.4086] [Medline: 26169067]",
    "FREE Full text",
    "[raw_reference] Mansi S, Milosavljevic S, Tumilty S, Hendrick P, Higgs C, Baxter DG. Investigating the effect of a 3-month workplace-based pedometer-driven walking programme on health-related quality of life in meat processing workers: a feasibility study within a randomized controlled trial. BMC Public Health 2015 Apr 22;15:410 [FREE Full text] [doi: 10.1186/s12889-015-1736-z] [Medline: 25895747]",
    "[raw_reference] Maselli M, Gobbi E, Carraro A. Effectiveness of individual counseling and activity monitors to promote physical activity among university students. J Sports Med Phys Fitness 2019 Jan;59(1):132-140. [doi: 10.23736/S0022-4707.17.07981-6] [Medline: 29199784]",
    "FREE Full text",
    "[raw_reference] M\u00fcller AM, Khoo S, Morris T. Text messaging for exercise promotion in older adults from an upper-middle-income country: randomized controlled trial. J Med Internet Res 2016 Jan 07;18(1):e5 [FREE Full text] [doi: 10.2196/jmir.5235] [Medline: 26742999]",
    "[raw_reference] Murawski B, Plotnikoff RC, Rayward AT, Oldmeadow C, Vandelanotte C, Brown WJ, et al. Efficacy of an m-Health physical activity and sleep health intervention for adults: a randomized waitlist-controlled trial. Am J Prev Med 2019 Oct;57(4):503-514. [doi: 10.1016/j.amepre.2019.05.009] [Medline: 31542128]",
    "FREE Full text",
    "[raw_reference] Mutrie N, Doolin O, Fitzsimons CF, Grant PM, Granat M, Grealy M, et al. Increasing older adults' walking through primary care: results of a pilot randomized controlled trial. Fam Pract 2012 Dec;29(6):633-642 [FREE Full text] [doi: 10.1093/fampra/cms038] [Medline: 22843637]",
    "[raw_reference] Nolan CM, Maddocks M, Canavan JL, Jones SE, Delogu V, Kaliaraju D, et al. Pedometer step count targets during pulmonary rehabilitation in chronic obstructive pulmonary disease. A randomized controlled trial. Am J Respir Crit Care Med 2017 May 15;195(10):1344-1352. [doi: 10.1164/rccm.201607-1372oc]",
    "FREE Full text",
    "[raw_reference] Oliveira JS, Sherrington C, Paul SS, Ramsay E, Chamberlain K, Kirkham C, et al. A combined physical activity and fall prevention intervention improved mobility-related goal attainment but not physical activity in older adults: a randomised trial. J Physiother 2019 Jan;65(1):16-22 [FREE Full text] [doi: 10.1016/j.jphys.2018.11.005] [Medline: 30581138]",
    "[raw_reference] Pinto BM, Papandonatos GD, Goldstein MG, Marcus BH, Farrell N. Home-based physical activity intervention for colorectal cancer survivors. Psychooncology 2013 Jan;22(1):54-64. [doi: 10.1002/pon.2047] [Medline: 21905158]",
    "FREE Full text",
    "[raw_reference] Pinto BM, Stein K, Dunsiger S. Peers promoting physical activity among breast cancer survivors: a randomized controlled trial. Health Psychol 2015 May;34(5):463-472 [FREE Full text] [doi: 10.1037/hea0000120] [Medline: 25110844]",
    "[raw_reference] Ribeiro MA, Martins MA, Carvalho CRF. Interventions to increase physical activity in middle-age women at the workplace: a randomized controlled trial. Med Sci Sports Exerc 2014;46(5):1008-1015. [doi: 10.1249/MSS.0000000000000190] [Medline: 24126967]",
    "FREE Full text",
    "[raw_reference] Simons D, De Bourdeaudhuij I, Clarys P, De Cocker K, Vandelanotte C, Deforche B. Effect and process evaluation of a smartphone app to promote an active lifestyle in lower educated working young adults: cluster randomized controlled trial. JMIR Mhealth Uhealth 2018 Aug 24;6(8):e10003 [FREE Full text] [doi: 10.2196/10003] [Medline: 30143477]",
    "FREE Full text",
    "[raw_reference] Stacey FG, James EL, Chapman K, Lubans DR. Social cognitive theory mediators of physical activity in a lifestyle program for cancer survivors and carers: findings from the ENRICH randomized controlled trial. Int J Behav Nutr Phys Act 2016 Apr 14;13:49 [FREE Full text] [doi: 10.1186/s12966-016-0372-z] [Medline: 27075417]",
    "Suppl",
    "[raw_reference] Suggs S, Blake H, Bardus M, Lloyd S. Effects of text messaging in addition to emails on physical activity among university and college employees in the UK. J Health Serv Res Policy 2013 Apr;18(1 Suppl):56-64. [doi: 10.1177/1355819613478001] [Medline: 27552780]",
    "[raw_reference] Talbot LA, Gaines JM, Huynh TN, Metter EJ. A home-based pedometer-driven walking program to increase physical activity in older adults with osteoarthritis of the knee: a preliminary study. J Am Geriatr Soc 2003 Mar;51(3):387-392. [doi: 10.1046/j.1532-5415.2003.51113.x] [Medline: 12588583]",
    "[raw_reference] Hoeve NT, Sunamura M, Stam HJ, Boersma E, Geleijnse ML, van Domburg RT, et al. Effects of two behavioral cardiac rehabilitation interventions on physical activity: a randomized controlled trial. Int J Cardiol 2018 Mar 15;255:221-228. [doi: 10.1016/j.ijcard.2017.12.015] [Medline: 29425564]",
    "[raw_reference] Tudor-Locke C, Bell RC, Myers AM, Harris SB, Ecclestone NA, Lauzon N, et al. Controlled outcome evaluation of the First Step Program: a daily physical activity intervention for individuals with type II diabetes. Int J Obes Relat Metab Disord 2004 Jan;28(1):113-119. [doi: 10.1038/sj.ijo.0802485] [Medline: 14569279]",
    "[raw_reference] Vallance JK, Courneya KS, Plotnikoff RC, Dinu I, Mackey JR. Maintenance of physical activity in breast cancer survivors after a randomized trial. Med Sci Sports Exerc 2008 Jan;40(1):173-180. [doi: 10.1249/mss.0b013e3181586b41] [Medline: 18091007]",
    "FREE Full text",
    "[raw_reference] van der Weegen S, Verwey R, Spreeuwenberg M, Tange H, van der Weijden T, de Witte L. It's LiFe! Mobile and web-based monitoring and feedback tool embedded in primary care increases physical activity: a cluster randomized controlled trial. J Med Internet Res 2015 Jul 24;17(7):e184 [FREE Full text] [doi: 10.2196/jmir.4579] [Medline: 26209025]",
    "FREE Full text",
    "[raw_reference] Van Hoye K, Wijtzes AI, Lefevre J, De Baere S, Boen F. Year-round effects of a four-week randomized controlled trial using different types of feedback on employees' physical activity. BMC Public Health 2018 Apr 12;18(1):492 [FREE Full text] [doi: 10.1186/s12889-018-5402-0] [Medline: 29649997]",
    "FREE Full text",
    "[raw_reference] De Greef K, Deforche B, Tudor-Locke C, De Bourdeaudhuij I. A cognitive-behavioural pedometer-based group intervention on physical activity and sedentary behaviour in individuals with type 2 diabetes. Health Educ Res 2010 Oct;25(5):724-736 [FREE Full text] [doi: 10.1093/her/cyq017] [Medline: 20338978]",
    "[raw_reference] De Greef KP, Deforche BI, Ruige JB, Bouckaert JJ, Tudor-Locke CE, Kaufman J, et al. The effects of a pedometer-based behavioral modification program with telephone support on physical activity and sedentary behavior in type 2 diabetes patients. Patient Educ Couns 2011 Aug;84(2):275-279. [doi: 10.1016/j.pec.2010.07.010] [Medline: 20732776]",
    "FREE Full text",
    "[raw_reference] Harris T, Kerry SM, Limb ES, Furness C, Wahlich C, Victor CR, et al. Physical activity levels in adults and older adults 3-4 years after pedometer-based walking interventions: Long-term follow-up of participants from two randomised controlled trials in UK primary care. PLoS Med 2018 Mar;15(3):e1002526 [FREE Full text] [doi: 10.1371/journal.pmed.1002526] 29522529]",
    "FREE Full text",
    "[raw_reference] Kolt GS, Schofield GM, Kerse N, Garrett N, Ashton T, Patel A. Healthy Steps trial: pedometer-based advice and physical activity for low-active older adults. Ann Fam Med 2012;10(3):206-212 [FREE Full text] [doi: 10.1370/afm.1345] [Medline: 22585884]",
    "FREE Full text",
    "[raw_reference] Wyke S, Bunn C, Andersen E, Silva MN, Van Nassau F, McSkimming P, et al. Correction: the effect of a programme to improve men's sedentary time and physical activity: the European Fans in Training (EuroFIT) randomised controlled trial. PLoS Med 2019 Mar;16(3):e1002772 [FREE Full text] [doi: 10.1371/journal.pmed.1002772] [Medline: 30870433]",
    "[raw_reference] Yates T, Edwardson CL, Henson J, Gray LJ, Ashra NB, Troughton J, et al. Walking away from type 2 diabetes: a cluster randomized controlled trial. Diabet Med 2017 May;34(5):698-707. [doi: 10.1111/dme.13254] [Medline: 27589017]",
    "FREE Full text",
    "[raw_reference] Alsaleh E, Windle R, Blake H. Behavioural intervention to increase physical activity in adults with coronary heart disease in Jordan. BMC Public Health 2016 Jul 26;16:643 [FREE Full text] [doi: 10.1186/s12889-016-3313-5] [Medline: 27460675]",
    "FREE Full text",
    "[raw_reference] Ashton LM, Morgan PJ, Hutchesson MJ, Rollo ME, Collins CE. Feasibility and preliminary efficacy of the 'HEYMAN' healthy lifestyle program for young men: a pilot randomised controlled trial. Nutr J 2017 Jan 13;16(1):2 [FREE Full text] [doi: 10.1186/s12937-017-0227-8] [Medline: 28086890]",
    "FREE Full text",
    "[raw_reference] Baker G, Gray SR, Wright A, Fitzsimons C, Nimmo M, Lowry R, Scottish Physical Activity Research Collaboration (SPARColl). The effect of a pedometer-based community walking intervention \"Walking for Wellbeing in the West\" on physical activity levels and health outcomes: a 12-week randomized controlled trial. Int J Behav Nutr Phys Act 2008 Sep 05;5:44 [FREE Full text] [doi: 10.1186/1479-5868-5-44] [Medline: 18775062]",
    "FREE Full text",
    "[raw_reference] Barwais FA, Cuddihy TF, Tomson LM. Physical activity, sedentary behavior and total wellness changes among sedentary adults: a 4-week randomized controlled trial. Health Qual Life Outcomes 2013 Oct 29;11:183 [FREE Full text] [doi: 10.1186/1477-7525-11-183] [Medline: 24168638]",
    "[raw_reference] Butler L, Dwyer D. Pedometers may not provide a positive effect on walking activity. Health Promot J Aust 2004 Aug 01;15(2):134-136. [doi: 10.1071/he04134]",
    "FREE Full text",
    "[raw_reference] Cadmus-Bertram L, Tevaarwerk AJ, Sesto ME, Gangnon R, Van Remortel B, Date P. Building a physical activity intervention into clinical care for breast and colorectal cancer survivors in Wisconsin: a randomized controlled pilot trial. J Cancer Surviv 2019 Aug;13(4):593-602 [FREE Full text] [doi: 10.1007/s11764-019-00778-6] [Medline: 31264183]",
    "FREE Full text",
    "[raw_reference] Compernolle S, Vandelanotte C, Cardon G, De Bourdeaudhuij I, De Cocker K. Effectiveness of a web-based, computer-tailored, pedometer-based physical activity intervention for adults: a cluster randomized controlled trial. J Med Internet Res 2015 Feb 09;17(2):e38 [FREE Full text] [doi: 10.2196/jmir.3402] [Medline: 25665498]",
    "FREE Full text",
    "[raw_reference] Creel DB, Schuh LM, Reed CA, Gomez AR, Hurst LA, Stote J, et al. A randomized trial comparing two interventions to increase physical activity among patients undergoing bariatric surgery. Obesity (Silver Spring) 2016 Aug;24(8):1660-1668 [FREE Full text] [doi: 10.1002/oby.21548] [Medline: 27367821]",
    "FREE Full text",
    "[raw_reference] Dadaczynski K, Schiemann S, Backhaus O. Promoting physical activity in worksite settings: results of a German pilot study of the online intervention Healingo fit. BMC Public Health 2017 Sep 08;17(1):696 [FREE Full text] [doi: 10.1186/s12889-017-4697-6] [Medline: 28886734]",
    "[raw_reference] de Blok BM, de Greef MH, Hacken NH, Sprenger SR, Postema K, Wempe JB. The effects of a lifestyle physical activity counseling program with feedback of a pedometer during pulmonary rehabilitation in patients with COPD: a pilot study. Patient Educ Couns 2006 Apr;61(1):48-55. [doi: 10.1016/j.pec.2005.02.005] [Medline: 16455222]",
    "[raw_reference] De Greef K, Deforche B, Tudor-Locke C, De Bourdeaudhuij I. Increasing physical activity in Belgian type 2 diabetes patients: a three-arm randomized controlled trial. Int J Behav Med 2011 Sep;18(3):188-198. [doi: 10.1007/s12529-010-9124-7] [Medline: 21052886]",
    "FREE Full text",
    "[raw_reference] Demeyer H, Louvaris Z, Frei A, Rabinovich RA, de Jong C, Gimeno-Santos E, Mr Papp PROactive study groupthe PROactive consortium. Physical activity is increased by a 12-week semiautomated telecoaching programme in patients with COPD: a multicentre randomised controlled trial. Thorax 2017 May;72(5):415-423 [FREE Full text] [doi: 10.1136/thoraxjnl-2016-209026] [Medline: 28137918]",
    "[raw_reference] Dishman RK, DeJoy DM, Wilson MG, Vandenberg RJ. Move to improve: a randomized workplace trial to increase physical activity. Am J Prev Med 2009 Feb;36(2):133-141. [doi: 10.1016/j.amepre.2008.09.038] [Medline: 19135905]",
    "FREE Full text",
    "[raw_reference] Duru OK, Sarkisian CA, Leng M, Mangione CM. Sisters in motion: a randomized controlled trial of a faith-based physical activity intervention. J Am Geriatr Soc 2010 Oct;58(10):1863-1869 [FREE Full text] [doi: 10.1111/j.1532-5415.2010.03082.x] [Medline: 20929464]",
    "[raw_reference] Engel L, Lindner H. Impact of using a pedometer on time spent walking in older adults with type 2 diabetes. Diabetes Educ 2006;32(1):98-107. [doi: 10.1177/0145721705284373] [Medline: 16439498]",
    "[raw_reference] Fjeldsoe BS, Miller YD, Marshall AL. MobileMums: a randomized controlled trial of an SMS-based physical activity intervention. Ann Behav Med 2010 May;39(2):101-111. [doi: 10.1007/s12160-010-9170-z] [Medline: 20174902]",
    "FREE Full text",
    "[raw_reference] Gell NM, Wadsworth DD. The use of text messaging to promote physical activity in working women: a randomized controlled trial. J Phys Act Health 2015 Jun;12(6):756-763 [FREE Full text] [doi: 10.1123/jpah.2013-0144] [Medline: 25110303]",
    "FREE Full text",
    "[raw_reference] Gill DP, Blunt W, Silva NC, Stiller-Moldovan C, Zou GY, Petrella RJ. The HealtheSteps\u2122 lifestyle prescription program to improve physical activity and modifiable risk factors for chronic disease: a pragmatic randomized controlled trial. BMC Public Health 2019 Jun 28;19(1):841 [FREE Full text] [doi: 10.1186/s12889-019-7141-2] [Medline: 31253112]",
    "FREE Full text",
    "[raw_reference] Glynn LG, Hayes PS, Casey M, Glynn F, Alvarez-Iglesias A, Newell J, et al. Effectiveness of a smartphone application to promote physical activity in primary care: the SMART MOVE randomised controlled trial. Br J Gen Pract 2014 Jul;64(624):384-391 [FREE Full text] [doi: 10.3399/bjgp14X680461] [Medline: 24982490]",
    "FREE Full text",
    "[raw_reference] Hardeman W, Mitchell J, Pears S, Van Emmenis M, Theil F, Gc VS, VBI Research Team. Evaluation of a very brief pedometer-based physical activity intervention delivered in NHS Health Checks in England: the VBI randomised controlled trial. PLoS Med 2020 Mar;17(3):e1003046 [FREE Full text] [doi: 10.1371/journal.pmed.1003046] [Medline: 32142507]",
    "FREE Full text",
    "[raw_reference] Hornikx M, Demeyer H, Camillo CA, Janssens W, Troosters T. The effects of a physical activity counseling program after an exacerbation in patients with Chronic Obstructive Pulmonary Disease: a randomized controlled pilot study. BMC Pulm Med 2015 Nov 04;15:136 [FREE Full text] [doi: 10.1186/s12890-015-0126-8] [Medline: 26530543] 100.",
    "[raw_reference] Hospes G, Bossenbroek L, Hacken NH, Van Hengel P, De Greef MH. Enhancement of daily physical activity increases physical fitness of outclinic COPD patients: results of an exercise counseling program. Patient Educ Couns 2009 May;75(2):274-278. [doi: 10.1016/j.pec.2008.10.005] [Medline: 19036552] 101",
    "[raw_reference] Houle J, Doyon O, Vadeboncoeur N, Turbide G, Diaz A, Poirier P. Innovative program to increase physical activity following an acute coronary syndrome: randomized controlled trial. Patient Educ Couns 2011 Dec;85(3):237-244. [doi: 10.1016/j.pec.2011.03.018] [Medline: 21546203] 102",
    "[raw_reference] Hultquist CN, Albright C, Thompson DL. Comparison of walking recommendations in previously inactive women. Med Sci Sports Exerc 2005 Apr;37(4):676-683. [doi: 10.1249/01.mss.0000158993.39760.1b] [Medline: 15809569] 103",
    "[raw_reference] Izawa KP, Watanabe S, Hiraki K, Morio Y, Kasahara Y, Takeichi N, et al. Determination of the effectiveness of accelerometer use in the promotion of physical activity in cardiac patients: a randomized controlled trial. Arch Phys Med Rehabil 2012 Nov;93(11):1896-1902. [doi: 10.1016/j.apmr.2012.06.015] [Medline: 22750166] 104",
    "FREE Full text",
    "[raw_reference] Katzmarzyk PT, Champagne CM, Tudor-Locke C, Broyles ST, Harsha D, Kennedy BM, et al. A short-term physical activity randomized trial in the Lower Mississippi Delta. PLoS One 2011;6(10):e26667 [FREE Full text] [doi: 10.1371/journal.pone.0026667] [Medline: 22046325] 105",
    "FREE Full text",
    "[raw_reference] Kawagoshi A, Kiyokawa N, Sugawara K, Takahashi H, Sakata S, Satake M, et al. Effects of low-intensity exercise and home-based pulmonary rehabilitation with pedometer feedback on physical activity in elderly patients with chronic obstructive pulmonary disease. Respir Med 2015 Mar;109(3):364-371 [FREE Full text] [doi: 10.1016/j.rmed.2015.01.008] [Medline: 25682543] 106",
    "FREE Full text",
    "[raw_reference] King AC, Bickmore TW, Campero MI, Pruitt LA, Yin JL. Employing virtual advisors in preventive care for underserved communities: results from the COMPASS study. J Health Commun 2013;18(12):1449-1464 [FREE Full text] [doi: 10.1080/10810730.2013.798374] [Medline: 23941610] 107",
    "[raw_reference] Li LC, Feehan LM, Xie H, Lu N, Shaw C, Gromala D, et al. Efficacy of a physical activity counseling program with use of a wearable tracker in people with inflammatory arthritis: a randomized controlled trial. Arthritis Care Res (Hoboken) 2020 Dec;72(12):1755-1765. [doi: 10.1002/acr.24199] [Medline: 32248626] 108",
    "[raw_reference] Long JE, Ring C, Bosch JA, Eves F, Drayson MT, Calver R, et al. A life-style physical activity intervention and the antibody response to pneumococcal vaccination in women. Psychosom Med 2013 Oct;75(8):774-782. [doi: 10.1097/PSY.0b013e3182a0b664] [Medline: 23922400] 109",
    "FREE Full text",
    "[raw_reference] Lynch BM, Nguyen NH, Moore MM, Reeves MM, Rosenberg DE, Boyle T, et al. A randomized controlled trial of a wearable technology-based intervention for increasing moderate to vigorous physical activity and reducing sedentary behavior in breast cancer survivors: the ACTIVATE trial. Cancer 2019 Aug 15;125(16):2846-2855 [FREE Full text] [doi: 10.1002/cncr.32143] [Medline: 31012970] 110",
    "FREE Full text",
    "[raw_reference] Lyons EJ, Swartz MC, Lewis ZH, Martinez E, Jennings K. Feasibility and acceptability of a wearable technology physical activity intervention with telephone counseling for mid-aged and older adults: a randomized controlled pilot trial. JMIR Mhealth Uhealth 2017 Mar 06;5(3):e28 [FREE Full text] [doi: 10.2196/mhealth.6967] [Medline: 28264796] 111",
    "FREE Full text",
    "[raw_reference] Martin SS, Feldman DI, Blumenthal RS, Jones SR, Post WS, McKibben RA, et al. mActive: a randomized clinical trial of an automated mhealth intervention for physical activity promotion. J Am Heart Assoc 2015 Nov 09;4(11):1-9 [FREE Full text] [doi: 10.1161/JAHA.115.002239] [Medline: 26553211] 112",
    "FREE Full text",
    "[raw_reference] Melville CA, Mitchell F, Stalker K, Matthews L, McConnachie A, Murray HM, et al. Effectiveness of a walking programme to support adults with intellectual disabilities to increase physical activity: walk well cluster-randomised controlled trial. Int J Behav Nutr Phys Act 2015 Sep 29;12:125 [FREE Full text] [doi: 10.1186/s12966-015-0290-5] [Medline: 26416606] 113",
    "FREE Full text",
    "[raw_reference] Mendoza L, Horta P, Espinoza J, Aguilera M, Balmaceda N, Castro A, et al. Pedometers to enhance physical activity in COPD: a randomised controlled trial. Eur Respir J 2015 Feb;45(2):347-354 [FREE Full text] [doi: 10.1183/09031936.00084514] [Medline: 25261324] 114",
    "[raw_reference] Merom D, Rissel C, Phongsavan P, Smith BJ, Van Kemenade C, Brown WJ, et al. Promoting walking with pedometers in the community: the step-by-step trial. Am J Prev Med 2007 Apr;32(4):290-297. [doi: 10.1016/j.amepre.2006.12.007] [Medline: 17303369] 115",
    "[raw_reference] Paul L, Wyke S, Brewster S, Sattar N, Gill JMR, Alexander G, et al. Increasing physical activity in stroke survivors using STARFISH, an interactive mobile phone application: a pilot study. Top Stroke Rehabil 2016 Jun;23(3):170-177. [doi: 10.1080/10749357.2015.1122266] [Medline: 27077973] 116",
    "FREE Full text",
    "[raw_reference] Poirier J, Bennett WL, Jerome GJ, Shah NG, Lazo M, Yeh H, et al. Effectiveness of an activity tracker-and internet-based adaptive walking program for adults: a randomized controlled trial. J Med Internet Res 2016 Feb 09;18(2):e34 [FREE Full text] [doi: 10.2196/jmir.5295] [Medline: 26860434] 117",
    "FREE Full text",
    "[raw_reference] Pope ZC, Zeng N, Zhang R, Lee HY, Gao Z. Effectiveness of combined smartwatch and social media intervention on breast cancer survivor health outcomes: a 10-week pilot randomized trial. J Clin Med 2018 Jun 07;7(6):1-17 [FREE Full text] [doi: 10.3390/jcm7060140] [Medline: 29880779] 118",
    "[raw_reference] Prestwich A, Perugini M, Hurling R. Can implementation intentions and text messages promote brisk walking? A randomized trial. Health Psychol 2010 Jan;29(1):40-49. [doi: 10.1037/a0016993] [Medline: 20063934] 119",
    "FREE Full text",
    "[raw_reference] Reijonsaari K, Vehtari A, Kahilakoski O, Van Mechelen W, Aro T, Taimela S. The effectiveness of physical activity monitoring and distance counseling in an occupational setting -results from a randomized controlled trial (CoAct). BMC Public Health 2012 May 11;12:344 [FREE Full text] [doi: 10.1186/1471-2458-12-344] [Medline: 22578104] 120",
    "[raw_reference] Roos R, Myezwa H, Van Aswegen H, Musenge E. Effects of an education and home-based pedometer walking program on ischemic heart disease risk factors in people infected with HIV: a randomized trial. J Acquir Immune Defic Syndr 2014 Nov 01;67(3):268-276. [doi: 10.1097/QAI.0000000000000299] [Medline: 25140908] 121",
    "[raw_reference] Rowley TW, Lenz EK, Swartz AM, Miller NE, Maeda H, Strath SJ. Efficacy of an individually tailored, internet-mediated physical activity intervention in older adults: a randomized controlled trial. J Appl Gerontol 2019 Jul;38(7):1011-1022. [doi: 10.1177/0733464817735396] [Medline: 29165018] 122",
    "[raw_reference] Spence JC, Burgess J, Rodgers W, Murray T. Effect of pretesting on intentions and behaviour: a pedometer and walking intervention. Psychol Health 2009 Sep;24(7):777-789. [doi: 10.1080/08870440801989938] [Medline: 20205026] 123",
    "[raw_reference] Tabak M, Vollenbroek-Hutten MM, Van der Valk PD, Van der Palen J, Hermens HJ. A telerehabilitation intervention for patients with Chronic Obstructive Pulmonary Disease: a randomized controlled pilot trial. Clin Rehabil 2014 Jun;28(6):582-591. [doi: 10.1177/0269215513512495] [Medline: 24293120] 124",
    "FREE Full text",
    "[raw_reference] Thorndike AN, Mills S, Sonnenberg L, Palakshappa D, Gao T, Pau CT, et al. Activity monitor intervention to promote physical activity of physicians-in-training: randomized controlled trial. PLoS One 2014;9(6):e100251 [FREE Full text] [doi: 10.1371/journal.pone.0100251] [Medline: 24950218] 125",
    "[raw_reference] Vallance JK, Friedenreich CM, Lavallee CM, Culos-Reed N, Mackey JR, Walley B, et al. Exploring the feasibility of a broad-reach physical activity behavior change intervention for women receiving chemotherapy for breast cancer: a randomized trial. Cancer Epidemiol Biomarkers Prev 2015 Dec 16;25(2):391-398. [doi: 10.1158/1055-9965.epi-15-0812] 126",
    "FREE Full text",
    "[raw_reference] Van Blarigan EL, Chan H, Van Loon K, Kenfield SA, Chan JM, Mitchell E, et al. Self-monitoring and reminder text messages to increase physical activity in colorectal cancer survivors (Smart Pace): a pilot randomized controlled trial. BMC Cancer 2019 Mar 11;19(1):218 [FREE Full text] [doi: 10.1186/s12885-019-5427-5] [Medline: 30866859] 127",
    "FREE Full text",
    "[raw_reference] Warren FC, Stych K, Thorogood M, Sharp DJ, Murphy M, Turner KM, et al. Evaluation of different recruitment and randomisation methods in a trial of general practitioner-led interventions to increase physical activity: a randomised controlled feasibility study with factorial design. Trials 2014 Apr 21;15:134 [FREE Full text] [doi: 10.1186/1745-6215-15-134] [Medline: 24746263] 128",
    "[raw_reference] Yamada M, Mori S, Nishiguchi S, Kajiwara Y, Yoshimura K, Sonoda T, et al. Pedometer-based behavioral change program can improve dependency in sedentary older adults: a randomized controlled trial. J Frailty Aging 2012;1(1):39-44. [doi: 10.14283/jfa.2012.7] [Medline: 27092936] 129",
    "[raw_reference] Croteau KA, Richeson NE, Vines SW, Jones DB. Effects of a pedometer-based physical activity program on older adults' mobility-related self-efficacy and physical performance. Act Adapt Aging 2004 Apr 21;28(2):19-33. [doi: 10.1300/j016v28n02_02] 130",
    "[raw_reference] Croteau KA, Richeson NE, Farmer BC, Jones DB. Effect of a pedometer-based intervention on daily step counts of community-dwelling older adults. Res Q Exerc Sport 2007 Dec;78(5):401-406. [doi: 10.1080/02701367.2007.10599439] [Medline: 18274211] 131",
    "[raw_reference] Aittasalo M, Miilunpalo S, Kukkonen-Harjula K, Pasanen M. A randomized intervention of physical activity promotion and patient self-monitoring in primary health care. Prev Med 2006 Jan;42(1):40-46. [doi: 10.1016/j.ypmed.2005.10.003] [Medline: 16297442] 132",
    "FREE Full text",
    "[raw_reference] Fischer X, Kreppke J, Zahner L, Gerber M, Faude O, Donath L. Telephone-based coaching and prompting for physical activity: short-and long-term findings of a randomized controlled trial (Movingcall). Int J Environ Res Public Health 2019 Jul 23;16(14):1-16 [FREE Full text] [doi: 10.3390/ijerph16142626] [Medline: 31340528] 133",
    "FREE Full text",
    "[raw_reference] Golsteijn RH, Bolman C, Volders E, Peels DA, de Vries H, Lechner L. Short-term efficacy of a computer-tailored physical activity intervention for prostate and colorectal cancer patients and survivors: a randomized controlled trial. Int J Behav Nutr Phys Act 2018 Oct 30;15(1):106 [FREE Full text] [doi: 10.1186/s12966-018-0734-9] [Medline: 30376857] 134",
    "[raw_reference] Kendzor DE, Allicock M, Businelle MS, Sandon LF, Gabriel KP, Frank SG. Evaluation of a shelter-based diet and physical activity intervention for homeless adults. J Phys Act Health 2017 Feb;14(2):88-97. [doi: 10.1123/jpah.2016-0343] [Medline: 27775471] 135",
    "[raw_reference] Keyserling TC, Samuel Hodge CD, Jilcott SB, Johnston LF, Garcia BA, Gizlice Z, et al. Randomized trial of a clinic-based, community-supported, lifestyle intervention to improve physical activity and diet: the North Carolina enhanced WISEWOMAN project. Prev Med 2008 Jun;46(6):499-510. [doi: 10.1016/j.ypmed.2008.02.011] [Medline: 18394692] 136",
    "[raw_reference] Kim Y, Lumpkin A, Lochbaum M, Stegemeier S, Kitten K. Promoting physical activity using a wearable activity tracker in college students: a cluster randomized controlled trial. J Sports Sci 2018 Aug;36(16):1889-1896. [doi: 10.1080/02640414.2018.1423886] [Medline: 29318916] 137",
    "FREE Full text",
    "[raw_reference] King AC, Ahn DK, Oliveira BM, Atienza AA, Castro CM, Gardner CD. Promoting physical activity through hand-held computer technology. Am J Prev Med 2008 Feb;34(2):138-142 [FREE Full text] [doi: 10.1016/j.amepre.2007.09.025] [Medline: 18201644] 138",
    "[raw_reference] Koizumi D, Rogers NL, Rogers ME, Islam MM, Kusunoki M, Takeshima N. Efficacy of an accelerometer-guided physical activity intervention in community-dwelling older women. J Phys Act Health 2009 Jul;6(4):467-474. [doi: 10.1123/jpah.6.4.467] [Medline: 19842461] 139",
    "FREE Full text",
    "[raw_reference] Li LC, Sayre EC, Xie H, Clayton C, Feehan LM. A community-based physical activity counselling program for people with knee osteoarthritis: feasibility and preliminary efficacy of the Track-OA study. JMIR Mhealth Uhealth 2017 Jun 26;5(6):e86 [FREE Full text] [doi: 10.2196/mhealth.7863] [Medline: 28652228] 140",
    "[raw_reference] Maxwell-Smith C, Hince D, Cohen PA, Bulsara MK, Boyle T, Platell C, et al. A randomized controlled trial of WATAAP to promote physical activity in colorectal and endometrial cancer survivors. Psychooncology 2019 Jul;28(7):1420-1429. [doi: 10.1002/pon.5090] [Medline: 30980691] 141",
    "FREE Full text",
    "[raw_reference] Pekmezi D, Ainsworth C, Joseph RP, Williams V, Desmond R, Meneses K, et al. Pilot trial of a home-based physical activity program for African American women. Med Sci Sports Exerc 2017 Dec;49(12):2528-2536 [FREE Full text] [doi: 10.1249/MSS.0000000000001370] [Medline: 28704343] 142",
    "[raw_reference] Prestwich A, Perugini M, Hurling R. Can the effects of implementation intentions on exercise be enhanced using text messages? Psychol Health 2009 Jul;24(6):677-687. [doi: 10.1080/08870440802040715] [Medline: 20205020] 143",
    "[raw_reference] Samuels TY, Raedeke TD, Mahar MT, Karvinen KH, DuBose KD. A randomized controlled trial of continuous activity, short bouts, and a 10,000 step guideline in inactive adults. Prev Med 2011 Feb;52(2):120-125. [doi: 10.1016/j.ypmed.2010.12.001] [Medline: 21147156] 144",
    "[raw_reference] Sharp P, Caperchione C. The effects of a pedometer-based intervention on first-year university students: a randomized control trial. J Am Coll Health 2016;64(8):630-638. [doi: 10.1080/07448481.2016.1217538] [Medline: 27471879] 145",
    "FREE Full text",
    "[raw_reference] Unick JL, O'Leary KC, Bond DS, Wing RR. Physical activity enhancement to a behavioral weight loss program for severely obese individuals: a preliminary investigation. ISRN Obes 2012 Sep 05;2012:1-4 [FREE Full text] [doi: 10.5402/2012/465158] [Medline: 24379985] 146",
    "FREE Full text",
    "[raw_reference] Vandelanotte C, Duncan MJ, Maher CA, Schoeppe S, Rebar AL, Power DA, et al. The effectiveness of a web-based computer-tailored physical activity intervention using Fitbit activity trackers: randomized trial. J Med Internet Res 2018 Dec 18;20(12):e11321 [FREE Full text] [doi: 10.2196/11321] [Medline: 30563808] 147",
    "FREE Full text",
    "[raw_reference] Wijsman CA, Westendorp RG, Verhagen EA, Catt M, Slagboom PE, De Craen AJ, et al. Effects of a web-based intervention on physical activity and metabolism in older adults: randomized controlled trial. J Med Internet Res 2013 Nov 06;15(11):e233 [FREE Full text] [doi: 10.2196/jmir.2843] [Medline: 24195965] 148",
    "FREE Full text",
    "[raw_reference] Carr LJ, Dunsiger SI, Lewis B, Ciccolo JT, Hartman S, Bock B, et al. Randomized controlled trial testing an internet physical activity intervention for sedentary adults. Health Psychol 2013 Mar;32(3):328-336 [FREE Full text] [doi: 10.1037/a0028962] [Medline: 22823069] 149",
    "[raw_reference] Lane A, Murphy N, Bauman A. An effort to 'leverage' the effect of participation in a mass event on physical activity. Health Promot Int 2015 Sep 13;30(3):542-551. [doi: 10.1093/heapro/dat077] [Medline: 24226297] 150",
    "[raw_reference] Mailey EL, W\u00f3jcicki TR, Motl RW, Hu L, Strauser DR, Collins KD, et al. Internet-delivered physical activity intervention for college students with mental health disorders: a randomized pilot trial. Psychol Health Med 2010 Dec;15(6):646-659. [doi: 10.1080/13548506.2010.498894] [Medline: 21154018] 151",
    "[raw_reference] Motl RW, Dlugonski D, W\u00f3jcicki TR, McAuley E, Mohr DC. Internet intervention for increasing physical activity in persons with multiple sclerosis. Mult Scler 2011 Jan;17(1):116-128. [doi: 10.1177/1352458510383148] [Medline: 20921239] 152",
    "FREE Full text",
    "[raw_reference] Sugden JA, Sniehotta FF, Donnan PT, Boyle P, Johnston DW, McMurdo ME. The feasibility of using pedometers and brief advice to increase activity in sedentary older women-a pilot study. BMC Health Serv Res 2008 Aug 08;8:169 [FREE Full text] [doi: 10.1186/1472-6963-8-169] [Medline: 18691392] 153",
    "FREE Full text",
    "[raw_reference] Thorsteinsen K, Vitters\u00f8 J, Svendsen GB. Increasing physical activity efficiently: an experimental pilot study of a website and mobile phone intervention. Int J Telemed Appl 2014;2014 [FREE Full text] [doi: 10.1155/2014/746232] [Medline: 24963290] 154",
    "FREE Full text",
    "[raw_reference] Schwerdtfeger AR, Schmitz C, Warken M. Using text messages to bridge the intention-behavior gap? A pilot study on the use of text message reminders to increase objectively assessed physical activity in daily life. Front Psychol 2012;3:270 [FREE Full text] [doi: 10.3389/fpsyg.2012.00270] [Medline: 22876237] 155",
    "[raw_reference] Bennett JA, Young HM, Nail LM, Winters-Stone K, Hanson G. A telephone-only motivational intervention to increase physical activity in rural adults: a randomized controlled trial. Nurs Res 2008;57(1):24-32. [doi: 10.1097/01.NNR.0000280661.34502.c1] [Medline: 18091289] 156",
    "FREE Full text",
    "[raw_reference] Glasgow RE, Kurz D, King D, Dickman JM, Faber AJ, Halterman E, et al. Twelve-month outcomes of an internet-based diabetes self-management support program. Patient Educ Couns 2012 Apr;87(1):81-92 [FREE Full text] [doi: 10.1016/j.pec.2011.07.024] [Medline: 21924576] 157",
    "FREE Full text",
    "[raw_reference] McNab F, Hillebrand A, Swithenby SJ, Rippon G. Combining temporal and spectral information with spatial mapping to identify differences between phonological and semantic networks: a magnetoencephalographic approach. Front Psychol 2012;3:273 [FREE Full text] [doi: 10.3389/fpsyg.2012.00273] [Medline: 22908001] 158",
    "[raw_reference] Sisson SB, Camhi SM, Church TS, Tudor-Locke C, Johnson WD, Katzmarzyk PT. Accelerometer-determined steps/day and metabolic syndrome. Am J Prev Med 2010 Jun;38(6):575-582. [doi: 10.1016/j.amepre.2010.02.015] [Medline: 20494233] 159",
    "[raw_reference] Oftedal S, Holliday EG, Attia J, Brown WJ, Collins CE, Ewald B, et al. Daily steps and diet, but not sleep, are related to mortality in older Australians. J Sci Med Sport 2020 Mar;23(3):276-282. [doi: 10.1016/j.jsams.2019.09.018] [Medline: 31615727] 160",
    "[raw_reference] Chan CB, Ryan DA, Tudor-Locke C. Health benefits of a pedometer-based physical activity intervention in sedentary workers. Prev Med 2004 Dec;39(6):1215-1222. [doi: 10.1016/j.ypmed.2004.04.053] [Medline: 15539058] 161",
    "FREE Full text",
    "[raw_reference] Althoff T, Sosi\u010d R, Hicks JL, King AC, Delp SL, Leskovec J. Large-scale physical activity data reveal worldwide activity inequality. Nature 2017 Jul 20;547(7663):336-339 [FREE Full text] [doi: 10.1038/nature23018] [Medline: 28693034] 162",
    "[raw_reference] Shcherbina A, Hershman SG, Lazzeroni L, King AC, O'Sullivan JW, Hekler E, et al. The effect of digital physical activity interventions on daily step count: a randomised controlled crossover substudy of the MyHeart Counts Cardiovascular Health Study. Lancet Digit Health 2019 Nov;1(7):344-352. [doi: 10.1016/s2589-7500(19)30129-3] [Medline: 33323209] 163",
    "FREE Full text",
    "[raw_reference] Kramer J, K\u00fcnzler F, Mishra V, Smith SN, Kotz D, Scholz U, et al. Which components of a smartphone walking app help users to reach personalized step goals? Results from an optimization trial. Ann Behav Med 2020 Jun 12;54(7):518-528 [FREE Full text] [doi: 10.1093/abm/kaaa002] [Medline: 32182353] 164",
    "[raw_reference] Cook R, Davidson P, Martin R, NIHR Dissemination Centre. Pedometers can help people get more active as part of an exercise programme. Br Med J 2020 Apr 06;369. [doi: 10.1136/bmj.m877] [Medline: 32253188] 165",
    "[raw_reference] McAuley L, Pham B, Tugwell P, Moher D. Does the inclusion of grey literature influence estimates of intervention effectiveness reported in meta-analyses? Lancet 2000 Oct 07;356(9237):1228-1231. [doi: 10.1016/S0140-6736(00)02786-0] [Medline: 11072941]"
  ],
  "processing_software": {
    "GROBID": "0.8.2"
  }
}
