{
  "paper_id": "TAHXZJK9",
  "title": "The Impact of Wearable Technologies in Health Research: Scoping Review",
  "abstract": "Background: Wearable devices hold great promise, particularly for data generation for cutting-edge health research, and their demand has risen substantially in recent years. However, there is a shortage of aggregated insights into how wearables have been used in health research. \n Objective: In this review, we aim to broadly overview and categorize the current research conducted with affordable wearable devices for health research. \n Methods: We performed a scoping review to understand the use of affordable, consumer-grade wearables for health research from a population health perspective using the PRISMA-ScR (Preferred Reporting Items for Systematic Reviews and Meta-Analyses extension for Scoping Reviews) framework. A total of 7499 articles were found in 4 medical databases (PubMed, Ovid, Web of Science, and CINAHL). Studies were eligible if they used noninvasive wearables: worn on the wrist, arm, hip, and chest; measured vital signs; and analyzed the collected data quantitatively. We excluded studies that did not use wearables for outcome assessment and prototype studies, devices that cost >\u20ac500 (US $570), or obtrusive smart clothing. \n Results: We included 179 studies using 189 wearable devices covering 10,835,733 participants. Most studies were observational (128/179, 71.5%), conducted in 2020 (56/179, 31.3%) and in North America (94/179, 52.5%), and 93% (10,104,217/10,835,733) of the participants were part of global health studies. The most popular wearables were fitness trackers (86/189, 45.5%) and accelerometer wearables, which primarily measure movement (49/189, 25.9%). Typical measurements included steps (95/179, 53.1%), heart rate (HR; 55/179, 30.7%), and sleep duration (51/179, 28.5%). Other devices measured blood pressure (3/179, 1.7%), skin temperature (3/179, 1.7%), oximetry (3/179, 1.7%), or respiratory rate (2/179, 1.1%). The wearables were mostly worn on the wrist (138/189, 73%) and cost <\u20ac200 (US $228; 120/189, 63.5%). The aims and approaches of all 179 studies revealed six prominent uses for wearables, comprising correlations-wearable and other physiological data (40/179, 22.3%), method evaluations (with subgroups; 40/179, 22.3%), population-based research (31/179, 17.3%), experimental outcome assessment (30/179, 16.8%), prognostic forecasting (28/179, 15.6%), and explorative analysis of big data sets (10/179, 5.6%). The most frequent strengths of affordable wearables were validation, accuracy, and clinical certification (104/179, 58.1%).",
  "year": 2014,
  "date": "2014",
  "authors": [
    {
      "name": "Sophie Huhn",
      "email": "sophie.huhn@uni-heidelberg.de",
      "affiliation": {
        "organization": "Heidelberg Institute of Global Health",
        "department": "Heidelberg Institute of Global Health",
        "institution": "Heidelberg University Hospital",
        "address": "Heidelberg, Germany"
      }
    },
    {
      "name": "Miriam Axt",
      "affiliation": {
        "organization": "Heidelberg Institute of Global Health",
        "department": "Heidelberg Institute of Global Health",
        "institution": "Heidelberg University Hospital",
        "address": "Heidelberg, Germany"
      }
    },
    {
      "name": "Hanns-Christian Gunga",
      "affiliation": {
        "organization": "Institute of Physiology",
        "department": "Institute of Physiology",
        "institution": "Charit\u00e9 -Universit\u00e4tsmedizin Berlin",
        "address": "Berlin, Germany"
      }
    },
    {
      "name": "Martina Maggioni",
      "affiliation": {
        "organization": "Institute of Physiology",
        "department": "Institute of Physiology",
        "institution": "Charit\u00e9 -Universit\u00e4tsmedizin Berlin",
        "address": "Berlin, Germany"
      }
    },
    {
      "name": "Stephen Munga",
      "affiliation": {
        "organization": "Kenya Medical Research Institute",
        "institution": "Kenya Medical Research Institute",
        "address": "Kisumu, Kenya"
      }
    },
    {
      "name": "David Obor",
      "affiliation": {
        "organization": "Kenya Medical Research Institute",
        "institution": "Kenya Medical Research Institute",
        "address": "Kisumu, Kenya"
      }
    },
    {
      "name": "Ali Si\u00e9",
      "affiliation": {
        "organization": "Heidelberg Institute of Global Health",
        "department": "Heidelberg Institute of Global Health",
        "institution": "Heidelberg University Hospital",
        "address": "Heidelberg, Germany"
      }
    },
    {
      "name": "Valentin Boudo",
      "affiliation": {
        "organization": "Centre de Recherche en Sant\u00e9 Nouna",
        "department": "Centre de Recherche en Sant\u00e9 Nouna",
        "address": "Nouna, Burkina Faso"
      }
    },
    {
      "name": "Aditi Bunker",
      "affiliation": {
        "organization": "Heidelberg Institute of Global Health",
        "department": "Heidelberg Institute of Global Health",
        "institution": "Heidelberg University Hospital",
        "address": "Heidelberg, Germany"
      }
    },
    {
      "name": "Rainer Sauerborn",
      "affiliation": {
        "organization": "Heidelberg Institute of Global Health",
        "department": "Heidelberg Institute of Global Health",
        "institution": "Heidelberg University Hospital",
        "address": "Heidelberg, Germany"
      }
    },
    {
      "name": "Sandra Barteit",
      "affiliation": {
        "organization": "Heidelberg Institute of Global Health",
        "department": "Heidelberg Institute of Global Health",
        "institution": "Heidelberg University Hospital",
        "address": "Heidelberg, Germany"
      }
    },
    {
      "affiliation": {
        "organization": "Heidelberg University Hospital Heidelberg University Im",
        "institution": "Heidelberg University Hospital Heidelberg University Im",
        "address": "Neuenheimer Feld 130 3, 69120, Heidelberg, Germany"
      }
    }
  ],
  "doi": "10.2196/34384",
  "md5": "48322D18F370E902582221BF89AA1A3C",
  "publication": {
    "journal": "PLoS One",
    "journal_inferred": true
  },
  "keywords": [
    "wearable",
    "consumer-grade wearables",
    "commercially available wearables",
    "public health",
    "global health",
    "population health",
    "fitness trackers",
    "big data",
    "low-resource setting",
    "tracker",
    "review",
    "mHealth",
    "research",
    "mobile phone XSL \u2022"
  ],
  "funding": [
    "",
    "",
    "",
    "",
    "Acknowledgments We wish to thank the  German Research Foundation (Deutsche Forschungsgemeinschaft)  for supporting this study as part of a  Deutsche Forschungsgemeinschaft -funded research unit (Forschungsgruppe). We acknowledge the support of  Else Kr\u00f6ner-Fresenius-Stiftung  from the  Heidelberg Graduate School of Global Health . Funders did not have a role in the design, data collection and analysis, decision to publish, or preparation of the manuscript."
  ],
  "sections": [
    {
      "title": "Introduction"
    },
    {
      "title": "Background",
      "text": "Wearable devices hold great promise, particularly for data generation for cutting-edge health research, and their demand has risen considerably in the last few years  [1] [2] [3] .\n\nNoninvasive, consumer-grade wearables (hereafter wearables) may provide manifold advantages for health research; they are generally unobtrusive, less expensive than gold standard research devices  [4] , comfortable to wear  [5] , and affordable for consumers  [6] . In recent years, the quality and accuracy of wearables have improved  [7, 8] , resulting in more clinically approved certifications  [9] . Wearables can measure long-term data in the naturalistic environment of study participants, allowing for ecologic momentary assessments  [10, 11] . Therefore, wearables are valuable developments, particularly for generating data for health research in large study populations, that is, global health or epidemiological studies, or in low-income contexts  [6, 9, 12] .\n\nOne example of a large study is the so-called Datenspende study by the Robert Koch Institute, the German research institute for disease control and prevention, which aims to tackle the COVID-19 (corona virus disease) pandemic with anonymous data donations acquired through wearables  [13] . On the basis of the study by Radin et al  [14] , researchers used wearable data to calculate the regional probability of COVID-19 outbreaks incorporating data on pulse, physical activity (PA), and sleep, as well as weather data. Using a large sample size exceeding half a million participants, they forecasted the number of COVID-19 infections for the preceding 4 days. The Apple Heart Study  [15]  is another example that was a breakthrough for showing that wearable devices may detect atrial fibrillation (AF) and foster a discussion of potentials and limitations with regard to health care providers, researchers, and members of the media and economy  [16, 17] .\n\nApart from these 2 examples, wearables are applied in diverse fields of health, including acoustic, gastrointestinal sensors for ileus prediction  [18] ; UV sun exposure  [19] ; heat-related illness measurements  [20] ; electrolyte monitoring, for example, for cystic fibrosis or training management  [21, 22] ; early warning of AF with a wearable ring  [23] ; generation of electrocardiograms (ECGs)  [15] ; measurement of cardiopulmonary resuscitation quality  [24] ; measurement of continuous noninvasive blood glucose  [25] , as well as smart inhalers and activity trackers for asthma monitoring  [26] .\n\nNumerous reviews and studies have investigated validation and accuracy, particularly for specific affordable wearables, comparing these to the gold standard measurements  [21]  or comparing evidence in a meta-analysis  [8] . Many studies have focused on novel technologies, presenting prototypes, or investigating the feasibility and acceptance of a wearable device in a specific setting  [3, 27] . Similarly, reviews on the application and potential of wearables have focused on (1) specific wearable devices or specific wearable measurements, for example, only smartwatches  [4]  or only sleep measurements  [28]  or  (2)  applications of specific medical fields and interventions, for example, only for diagnosis and treatment in cardiological conditions  [29]  or wearables as an intervention to promote PA in patients with oncologic conditions  [30] . Among these publications, we identified a lack of aggregated insight for wearable use in health research and its respective strengths and shortcomings."
    },
    {
      "title": "Objectives",
      "text": "With this scoping review, we aim to overview and categorize the current research conducted on wearable devices."
    },
    {
      "title": "Methods"
    },
    {
      "title": "Overview",
      "text": "We conducted a scoping review to explore the applications of affordable wearables worn on wrists, arms, chests, or waists, which constitute the characteristic locations  [31] . We focused on the following aspects: (1) demographics; (2) wearable devices and measured vital signs; (3) wearable data and its analysis; (4) reported shortcomings and strengths of wearables; and (  5 ) study aims, results, and types of wearable use. We present our findings in accordance with the PRISMA (Preferred Reporting Items for Systematic Reviews and Meta-Analyses) reporting standard and PRISMA-ScR (Preferred Reporting Items for Systematic Reviews and Meta-Analyses extension for Scoping Reviews; Multimedia Appendix 1)  [32]  and the methodological framework of Arksey and O'Malley  [33]  and Peters et al  [34] . A scoping review seemed most appropriate given the broad nature of this subject and the range of potential implementations in the setting of health research."
    },
    {
      "title": "Eligibility Criteria",
      "text": "We sought to define and characterize the state of affordable wearables for health research. Eligible publications were peer reviewed, published in English, and published after 2013 (after wearables became widely commercially available  [1] [2] [3] ) and had a full-text version available (in instances no full text was available, authors were contacted 3 times with a waiting period of 7 days between each contact before exclusion).\n\nOur review scopes the current information available on affordable, noninvasive wearables, which are (1) worn on the wrist, arm, and chest; (2) measure vital signs; and (  3 ) analyze the generated wearable data for outcome assessment. Validation and qualitative studies were excluded. We focused only on devices that cost <\u20ac500 (US $570) per device  (1)  to allow the affordability of larger studies, for example, where wearable devices need to be provided to study participants via the study and  (2)  to ensure that wearables are available commercially and (3) intended for consumers. As the definition of vital signs is not distinct  [35] , we included the following vital signs  [9, 36, 37] : HR, HR variability, ECG measurements or heart rhythm analysis (detection of arrhythmias), blood pressure, blood oxygen, respiratory rate, body temperature, sleep, electrodermal activity, electromyogram measurements, and PA (Textbox 1)."
    },
    {
      "title": "Textbox 1. Inclusion and exclusion criteria."
    },
    {
      "title": "Inclusion criteria",
      "text": "\u2022 Publications\n\n\u2022 Full text available"
    },
    {
      "title": "\u2022"
    },
    {
      "title": "English language",
      "text": "\u2022 Peer-reviewed articles"
    },
    {
      "title": "\u2022",
      "text": "Published between 2013 and 2020"
    },
    {
      "title": "\u2022",
      "text": "Wearable device"
    },
    {
      "title": "\u2022",
      "text": "Commercially available wearable, price <\u20ac500 (US $570) per device (Only hardware prices were considered. Software, subscriptions, or similar, which might be necessary for device use, were not included. All prices were captured in the timeframe of this study and therefore are only considered as approximations)\n\n\u2022 Wearables worn on the arm, wrist, chest, and waist"
    },
    {
      "title": "\u2022 Outcomes",
      "text": "\u2022 Measuring and analyzing one or more vital sign\n\n\u2022 Range of vital signs as defined in this review, including heart rate, heart rate variability, electrocardiogram measurements or heart rhythm analysis (detection and classification of atrial fibrillation, extrasystoles, and other arrhythmic events), blood pressure, blood oxygen, respiratory rate, body temperature, sleep (time, deepness, etc), electrodermal activity, electromyogram measurements, physical activity (steps, distance covered, intensity, energy expenditure, etc; physical activity included as basic measurements of wearables or very similar or related parameters)  [9, 36, 37] ."
    },
    {
      "title": "Exclusion criteria",
      "text": "\u2022 Publications\n\n\u2022 Studies not analyzing wearable-generated data for (health) outcome assessment, including studies focusing on (1) accuracy, validation, improvement (algorithms and software); (2) patents; (3) smart clothing; (4) obtrusive wearables (the device comprises obstructive parts or wires, etc); (5) behavior change intervention studies (ie, where the wearable is provided as promotion for more physical activity only and not for health outcome assessment); (6) qualitative studies; or (7) studies with research objectives and outcomes not related to health or a medical condition \u2022 Wearable device \u2022 Wearable not commercially available (eg, prototype and discontinued) \u2022 Invasive, obtrusive device (comprising obstructive parts or wires, etc) \u2022 Prosthesis, smart clothing (sensors in clothing)\n\n\u2022 Outcomes\n\n\u2022 Not measuring vital sign, that is, gait, posture, and motion recognition analysis (eg, gesture recognition for sign language)\n\n\u2022 Studies with research objectives and outcomes not related to health or a medical condition"
    },
    {
      "title": "Information Sources and Search",
      "text": "We used PubMed, Ovid, Web of Science, and CINAHL to search peer-reviewed literature using a search string based on the following three concepts: synonyms and medical subject headings terms, including (1) wearables (synonyms, top 15 vendors with most market shares  [38] [39] [40] , or frequently used in research  [2, 7] ), (  2 ) physical wear location of wearables (torso, arm, and wrist), and (3) measurement of vital signs (for full search string see Multimedia Appendix 2  [41] ). We manually searched the reference lists for relevant articles.\n\nWe imported the identified articles into the literature reference management system Zotero  [42]  and then into the systematic review management platform Covidence  [41] . Literature was screened by 2 independent reviewers. Any disagreements were resolved by discussion between the 2 reviewers (SH and MA) and a third researcher (SB)."
    },
    {
      "title": "Quality Assessment",
      "text": "To assess the quality of the included studies and their various study designs (credibility), we considered the Medical Education Research Study Quality Instrument  [43]  score as adequate (Multimedia Appendix 3  [14, 15, 20, )."
    },
    {
      "title": "Data Synthesis",
      "text": "We conducted data synthesis in accordance with Arksey and O'Malley  [33] , comprising the analytic framework, analysis of the extent and nature of studies, and thematic analysis. We categorized the findings by title, author, year, country of study, objectives of study, study population, sample size, methods, intervention type, outcomes, and key findings related to the scoping review question  [34] . We extracted mutually exclusive groups, including wearable manufacturers, built-in sensors, scope of measurements (vital signs), shortcomings and strengths of wearables mentioned by the authors, the used methods for data analysis, and medical fields."
    },
    {
      "title": "Results"
    },
    {
      "title": "Overview",
      "text": "Our initial search yielded 7499 hits (PubMed: 2514; Ovid: 1905; Web of Science: 1440; CINAHL: 1640) and we identified 121 publications by manual search. Of 7620 total publications, we screened 4525 (59.38%) nonduplicates for title and abstract, leading to the assessment of 660 full-texts. After full-text screening of the 660 articles, we included 179 (27.1%) studies in our review  [14, 15, 20,  (Figure  1 )."
    },
    {
      "title": "Study Characteristics"
    },
    {
      "title": "Demographics",
      "text": "Between 2013 and 2020, we observed an increase in the number of studies and study participants (Figure  2  and Table  1 ). The year 2019 featured the largest sample size, and studies were predominantly conducted in North America (Figure  3  [221]).\n\nThe largest study we identified was conducted in 2019 in North America and included over 8 million participants (75.71%)\n\n[153]; the second largest was a European study comprising 742,000 participants (6.85%)  [162] . Without the aforementioned, largest study, Europe and Asia would lead in participant numbers and we would see a continuous increase in participant numbers from 2013 to 2020. 01)  3 (1.68)  2014   3284 (0.03)  2 (1.12)  2015   124 , 060 (1.14)  14 (7.82)  2016   27 , 377 (0.25)  21 (11.73)  2017   16 , 700 (0.15)  34 (18.99)  2018   9 , 016 , 909 (83 .21) 48 (26.82) 2019 1,647,092 (15.2) 56 (31.28) 2020 Continents 8,916,888 (82.29) 94 (52.51) North America 991,357 (9.15) 50 (27.93) Europe 925,768 (8.54) 24 (13.41) Asia 1198 (0.01) 8 (4.47) Australia 522 (<0.01) 3 (1.68) South America Study objectives 394,296 (3.64) 70 (39.11) Correlations and influencing factors of study population and outcome data a 8,315,559 (76.74) 54 (30.17) Population and patient characterization b 2,124,328 (19.6) 47 (26.26) Evaluation of method or intervention 1550 (0.01) 8 (4.5) Prognostic evaluation c Study design 9,780,808 (90.26) 66 (36.87) Cross-sectional study 628,641 (5.8) 62 (34.64) Cohort study 724 (0.01) 14 (7.82) Nonrandomized experimental study 2332 (0.02) 11 (6.15) Randomized controlled trial 314,247 (2.9) 8 (4.47) Method evaluation 108,462 (1) 7 (3.91) Other 348 (<0.01) 7 (3.91) Case control study 171 (<0.01) 4 (2.23) Mixed methods, feasibility study Medical field of study 107,148 (0.99) 43 (24.02) Multidisciplinary and general medicine 2630 (0.02) 29 (16.2) Neurology and psychiatry 557,120 (5.14) 28 (15.64) Cardiology, fitness, and sports medicine 10,104,217 (93.25) 19 (10.61) Global health, epidemiology, and prevention 5575 (0.05) 18 (10.06) Gynecology and pediatrics 2749 (0.03) 16 (8.94) Orthopedics and surgery 1326 (0.01) 13 (7.26) Pulmonology 54,968 (0.51) 13 (7.26) Other a Studies aimed to find associations, correlations, or influencing factors within their study population, study outcomes, and generated data. b Studies aimed to observe and characterize the study population and patients. c Studies aimed to evaluate patient-reported outcomes, health care practices, diagnostics, screenings, and others. JMIR Mhealth Uhealth 2022 | vol. 10 | iss. 1 | e34384 | p. 7  https://mhealth.jmir.org/2022/1/e34384 (page number not for citation purposes)"
    },
    {
      "title": "Study Types and Fields",
      "text": "Most studies (128/179, 71.5%) used observational study designs such as cross-sectional (66/179, 36.9%) and cohort studies (62/179, 34.6%), comprising 9,780,808 (90.26%) participants and 628,641 (5.8%) participants, out of 10,835,733 participants, respectively. Most frequently, studies (70/179, 39.1%) aimed to find associations, correlations, or influencing factors within their study population, study outcomes, and generated data.\n\nSlightly less than one-third of the studies (54/179, 30.2%) aimed to characterize and observe their study population.\n\nMost studies were conducted in the fields of multidisciplinary and general medicine (43/179, 24%); cardiology, fitness, and sports medicine (29/179, 16.2%); and neurology, psychology, and psychiatry (28/179, 15.6%; Figure  4 ). The fields of global health, prevention, and epidemiology featured the largest sample size with, with 10,104,217 (93.25%) out of 10,835,733 participants."
    },
    {
      "title": "Wearable Characteristics",
      "text": "A total of 189 wearable devices were extracted.\n\nThe company with the most wearable devices in the included studies was Fitbit (97/189, 51.3%), covering 8,361,035 (74.35%) out of 11,224,872 participants. Fitbit is followed by ActiGraph (research-grade wearable devices unavailable for consumers or not consumer grade per se; 19/189, 10.1%), Polar Electro (9/189, 4.8%), and Withings (8/189, 4.2%). In number of study participants, Huawei and Withings comprised 832,036 (7.4%) participants and 794,174 (7.06%) participants out of 11,224,872 participants, respectively (Table 2). Number of wearable device models per study (n=179) 486,684 (4.49) 156 (87.15) 1 420,007 (3.88) 11 (6.15) 2 838,266 (7.74) 3 (1.68) 3 9,090,776 (83.9) 9 (5.03) >3 or not applicable b Wearable device types 22,823 (0.2) 86 (45.5) Fitness tracker 299,251 (2.66) 49 (25.93) Accelerometer (worn on wrist, torso, and hip) 530,332 (4.72) 21 (11.11) Electrocardiogram chest patch or strap 1,259,605 (11.2) 12 (6.35) Smartwatch 9,122,758 (81.13) 11 (5.82) Diverse wearable devices-secondary data via wearable data platform 10,103 (0.09) 10 (5.29) Distinct vital sign trackers (eg, oximetry ring, temperature wristband tracker, and blood pressure armband) c Physical location of wearable 10,702,843 (95.18) 138 (73.02) Wrist 2257 (0.02) 25 (13.23) Hip 550,332 (4.89) 21 (11.11) Chest 9392 (0.08) 3 (1.59) Arm 48 (<0.01) 2 (1.06) Finger In studies used in-built sensor in wearables d (n=179) 1,157,069 (10.68) 146 (81.56) Accelerometer 9,622,147 (88.8) 59 (32.96) Photoplethysmography 550,500 (5.08) 21 (11.73) Electrodes (ie, electrocardiogram) 1585 (0.01) 6 (3.35) Gyroscope Participants (N=11,244,872), n (%) Studies (N=189), n (%) Wearable characteristics 842 (0.01) 4 (2.23) Thermometer 9397 (0.09) 3 (1.68) Blood pressure sensor Wearable costs (\u20ac; US $) 340,460 (3.03) 120 (63.49) <200 (228) 18,256 (0.16) 41 (21.69) 200-350 (228-399) 551,128 (4.9) 13 (6.88) >350 (399) 10,355,028 (92.09) 15 (7.94) Not applicable e Analysis-statistical tests f in studies (n=179) 1,021,032 (9.42) 62 (34.64) Regression 8,309,202 (76.68) 41 (22.91) t test 11,044 (0.1) 40 (22.35) Correlation (Pearson, Spearman, etc) 7180 (0.07) 23 (12.85) Wilcoxon U, Mann-Whitney U, and other nonparametric tests 433,785 (4) 15 (8.38) Chi-square and Fisher-Yates tests 57,938 (0.53) 14 (7.82) Mixed methods model and other statistical models 835,967 (7.71) 11 (6.15) Artificial Intelligence (data mining, cluster, machine learning, etc) 810 (0.01) 11 (6.15) Analysis of variance 423,093 (3.9) 8 (4.47) Descriptive 420,928 (3.88) 3 (1.67) Prognostic analysis (Kaplan-Meier, permutation test, etc) a Research-grade wearable devices unavailable for consumers or not consumer grade per se. b\n\nStudies collected data with multiple wearable devices (that belonged to the study participants) or studies that used secondary data provided by web-based wearable platforms, mobile applications, or wearable companies. c Distinct vital sign trackers are specialized on a specific vital sign, for example, oximetry ring, temperature wristband tracker, and blood pressure armband. They differ in measured vital signs and worn locations compared with other wearable device types. d Utilized in-built sensors in wearables sums up to more than the total of wearables, as sometimes more than one built-in sensor was used.\n\ne Providing wearable hardware pricing was not transparent, as some studies used data provided by diverse participant-owned wearables or wearable hardware costs were part of a subscription or a membership fee, that is, Whoop strap of Whoop. f Analysis-statistical tests sums up to more than the total number of included studies, as some studies applied more than one type of analysis or statistical test.\n\nMost studies (156/179, 87.2%) used 1 wearable model. However, most of the study participants  (9,090,776/10,835,733, 83.9%)  were part of large-scale population-based studies in which data were mostly collected with multiple wearable devices that belonged to the study participants. Some large-scale population-based studies (11/179, 6.1%) relied on secondary data collected with mobile apps  [87]  or web-based wearable platforms  [153]  or provided through a wearable company  [189] . Thus, the device type could not be specified (assigned to category diverse wearable devices-secondary data via wearable data platform). A total of 15 (63%) out of 24 studies that used secondary data were conducted in 2020, and 5 (21%) studies in 2019.\n\nFitness trackers  (86/189, 45.5%)  and accelerometers (measuring body movement acceleration  [37] ) worn on the wrist, torso, and hip  (49/189, 25.9%)  were the most frequent. Other wearable device types included ECG chest straps and patches  (21/189, 11.1%) , smartwatches (12/189, 6.3%), and distinct vital sign trackers (10/189, 5.3%) such as oximetry rings or blood pressure armbands (Table  2 ).\n\nMost wearables were worn on the wrist (138/189, 73%), followed by the hip (25/189, 13.2%) and chest  (21/189, 11.1%) . Only a few wearables were worn on the arm (3/189, 1.6%) and finger (2/189, 1.1%; Figure  5 ). Most of the studies used wearable built-in sensors of (  1 ) accelerometers (146/179, 81.6%) that measure acceleration on a 3-or 1-axis  [37]  and (  2 ) photoplethysmography (59/179, 33%) defined as an \"optical technique that [...] detects blood volume changes in the microvascular bed of tissue\"  [222] . Other built-in sensors were electrodes for ECG measurements (21/179, 11.7%); gyroscopes (6/179, 3.4%), which determine how different portions of the body rotate  [37] ; thermometers (4/179, 2.2%) measuring skin temperature; and blood pressure sensors (3/179, 1.7%).\n\nMost studies investigated steps  (95/179, 53.1%) , HR (55/179, 30.7%), and sleep time (51/179, 28.5%). We classified measured vital signs into three categories, whereby PA measures were most frequent (228/179, 127.4%; Multimedia Appendix 4  [14, 15, 20, ):\n\n1. PA measures included steps, intensity (eg, time spent in moderate to vigorous PA), energy expenditure (eg, kilocalories and metabolic equivalent), axial or raw movement data, distance (covered), and others (such as stairs taken, elevation, and sedentary time). 2 . Cardiac measures included HR, HR variability, and ECG (or other direct heart rhythm analyses, such as AF detection). 3 . Other measures that included blood or pulse pressure, body temperature, blood oxygen, and respiratory rate.\n\nMost studies (120/189, 63.5%) used wearables that cost <\u20ac200 (US $228). In some studies (15/189, 7.9%), wearable prices were not transparent, as data were provided through a variety of participant-owned wearables  [87]  or the wearable hardware was part of a subscription or a membership fee, that is, Whoop strap of Whoop  [178] .\n\nRegression analysis (62/179, 34.6%) and t tests (42/179, 22.9%) were the most commonly used statistical methods to analyze wearable data. Other methods comprised nonparametric tests, such as correlations, Wilcoxon U test, Kaplan-Meier survival analysis, and chi-square tests. Variance analysis (analysis of variance) and significance tests such as permutations were also used. Further data analyses were conducted in a data-driven manner [223] with artificial intelligence, such as k-means [176] or unsupervised cluster analysis [172], recursive feature elimination technique [170], rotation random forest classifier [130], and supervised machine learning algorithms using logistic regression, decision tree, and random forest [215]."
    },
    {
      "title": "Categorization of Wearable Application in the Studies",
      "text": "We categorized the included studies based on their study objective, the role of the wearable and the collected wearable data within the study in the following 6 categories (overlaps are possible as separation is artificial). In the following, categories are presented in order of their frequency (see Figure  6  and Multimedia Appendix 5  [14, 15, 20,  for article references and examples)."
    },
    {
      "title": "Correlations-Wearable and Other Physiological Data",
      "text": "Studies (40/179, 22.3%) have examined the correlation of a wearable derived measure with clinical-and patient-reported and other health-related outcomes to find new associations and correlations. The data generated by the wearable device were correlated with data from mostly physiological or patient-reported outcomes."
    },
    {
      "title": "Population-Based Research",
      "text": "In 17.3% (31/179) of studies, wearables produced insights into a specific population through monitoring (observational and cross-sectional) of vital signs, such as steps and HR. Often, these were cross-sectional studies  (17/31, 55%)  where the wearable measurement was the sole outcome. The resulting data provide novel insights and characteristics of populations."
    },
    {
      "title": "Outcome Assessment",
      "text": "In these studies  (30/179, 17.3%) , wearables generated the outcome measurement and monitored the dependent variable in an (quasi-) experimental setting or intervention, in mostly randomized controlled trials and quasi-experimental designs."
    },
    {
      "title": "Prognosis, Forecasting, and Risk Stratification",
      "text": "In further studies (28/179, 15.6%), data generated with wearables were integrated into risk calculations (risk for a certain event or outcome), prognostic models, or cut-points.\n\nWearable data constituted inputs for models to estimate risks."
    },
    {
      "title": "Explorative Analysis of Big Data Sets",
      "text": "These studies (10/179, 5.6%) exploratively analyzed big data  [223] , generated by wearables and accessible via applications, commercial platforms, eCohorts, or companies themselves, to find trends and generate new hypotheses."
    },
    {
      "title": "Method Evaluation",
      "text": "Studies (40/179, 22.3%) have evaluated and compared methods and tools (such as screenings for diseases, general practices, questionnaires, or other patient-reported outcomes) with the help of wearables. The wearable device might be the gold standard device or probed itself."
    },
    {
      "title": "Feasibility",
      "text": "In these studies (12/179, 6.7%), the feasibility of using wearables for screening diseases and to improve on existing methods and practices is focused, mostly accompanied by a qualitative component."
    },
    {
      "title": "Diagnostics and Screening",
      "text": "Studies  (6/179, 3.4%)  in this category evaluated details of diagnostics and disease screening outcomes, (cost-) effectiveness, utility, and screening length or were compared with standard measurement methods."
    },
    {
      "title": "Disease Monitoring",
      "text": "Here  (8/179, 4.5%) , wearables supported the monitoring of an already diagnosed condition or a patient at risk (of deterioration)."
    },
    {
      "title": "Others",
      "text": "Studies (14/179, 7.8%) evaluated methods, with no other particular subgroup being appropriate."
    },
    {
      "title": "Strengths and Shortcomings of Wearables",
      "text": "Overall, the studies mentioned more strengths than shortcomings. A few studies  (16/179, 8.9%)  mentioned no strengths of wearables, whereas 55.3% (99/179) of the studies mentioned no shortcomings. Most often, authors (104/179, 58.1%) emphasized the accuracy and reliability, positive results of peer-reviewed validation studies (own and of others), or clinically approved certifications (eg, the Food and Drug Administration [FDA] clearance in the United States or Communaut\u00e9 Europ\u00e9enne [CE] mark of the European Union; Figure  7 ). Often, studies (59/179, 33%) identified the wearable as innovative, that is, as a cutting-edge tool and method [103] with a wearable device potentially closing a gap in or improving health care and research. For example, 1 study described how wireless wearables and data synching could improve the quality of care  [69] , \"The data can be sent from the wearable to the physician's office, avoiding the need for office visits, ultimately making possible preventive medicine and improving quality of care. \" Low et al [129]  concluded that \"Fitbit devices may provide opportunities to improve postoperative clinical care with minimal burden to patients or clinical providers. \" Tomitani et al [199]  reflected how wrist-worn blood pressure wearables could \"significantly improve blood pressure control.\" As per  Shilaih et al [184] , wrist-worn wearables might ameliorate fertility awareness research and care.\n\nSeveral studies (55/179, 30.7%) acknowledged the ability of wearables to measure in the naturalistic environment of the participants, called ecological momentary assessment  [10, 11, 224] .\n\nMultiple studies (51/179, 28.5%) described wearables as objective and superior to self-reported outcomes as they were more accurate, reliable, and easier to generate. Often, the authors valued the relatively low costs of wearables  (50/179, 27.9%) .\n\nOthers appreciated wearables as being unobtrusive or noninvasive  (48/179, 26.8%)  and enabling continuous, long-term measurements (38/179, 21.2%). Furthermore, the handling (37/179, 20.7%) of hardware and software was often found to be user-friendly, as well as the prevalence of wearables in the population  (27/179, 15.1%) , decreasing stigma and easing participant recruitment. Some studies (26/179, 14.5%) reported that participants accepted and liked the wearables, resulting in high participant compliance (wearing and using the wearable). Some authors (18/179, 10.1%) perceived technical wearable characteristics as positive, for example, good sampling rate of measurements, long battery life, large memory space, raw data availability, data security, compatibility with other devices such as smartphones, and availability of application programing interfaces (APIs).\n\nFew studies (11/179, 6.1%) described wearables as robust and not easy to break. Authors (10/179, 5.6%) valued the wearable-induced behavior change as a cobenefit, that is, motivating study participants to more PA and increasing health awareness.\n\nA few studies (8/179, 4.5%) mentioned data accessibility via APIs, apps, and web-based platforms and a few other studies (7/179, 3.9%) potential of large-scale wearable studies, or the ease of data handling. A few (6/179, 3.4%) studies underlined the variety of functionalities and vital sign measurements as positive aspects, and 2.2% (4/179) of studies perceived wearables as fast or time-efficient in data generation.\n\nMost shortcomings  (39/179, 21.8%)  were related to the inaccuracy of the wearables or the absence of validation or clinically approved certification. Studies (16/179, 8.9%) also mentioned technical issues, such as a low sampling rate of measurements, no wear time recognition, or missing data. Other technical issues comprised, for example, synchronization, charging and device setup [91] or data cleaning [137]. Rare experienced shortcomings were participants' noncompliance or dislike toward the wearable (11/179, 6.1%), no access to raw data or company's algorithms (4/179, 2.2%), difficulties in handling the wearable (3/179, 1.7%), and wearables perceived as obtrusive in daily life (2/179, 1.1%)."
    },
    {
      "title": "Discussion"
    },
    {
      "title": "Study Characteristics",
      "text": "Overall, we have identified a positive trend in wearable studies, underlining the growing interest in wearables in health research, in line with other reviews  [3, [224] [225] [226] . Our results show a strong interest of researchers and study participants in this technology, but we also identified cautionary behavior toward using wearables. The vast majority of studies were undertaken in North America, about twice as many as in Europe, which is consistent with the previous literature  [225] . One study in North America, conducted in 2019 with over 8 million participants  [153] , dominated the image of the distribution of participants.\n\nThe reasons for the American-European gap may be multifaceted. One factor may be the differences in political and administrative frameworks, for example, comparing CE and FDA processes, which may result in slower certification processes for wearables and new technologies in general  [31] . Another factor may be cultural mentality resulting in faster adoption of new technology in the United States, as the North Americans own proportionally more fitness trackers in comparison to the Europeans  [227, 228] . Some factors discussed in other research were not or only briefly mentioned in the included studies  [6, 29, 31] , but should also be reflected, especially technical and legal aspects, such as data security  [224] , data synching, and export. For example, the Germany-based study of  Koehler et al [114]  was one of the few that detailed data security and transfer of home-based telemonitoring data to the clinic. Data security and privacy are severely governed by the European Union General Data Protection Regulation, which is according to their website the \"toughest privacy and security law in the world\"  [229] .\n\nAdministrative limitations and challenges presumably obscure the benefits of wearable research in Europe. A possible solution for data security and usability might be data trusts  [230]  as an alternative to large platforms.\n\nMost medical fields represented in the included studies showed similarities with other reviews  [224] , for example, studies often focusing on cardiology, sports medicine, and neurology. However, we found a multitude of studies from multidisciplinary fields as well as the field of global health, indicating a likely adoption and expansion of wearables in other medical fields. This underlines the potential for wearables in health research beyond a mere trend or hype, as wearables may provide new possibilities for a broad spectrum of health research, such as for infectious disease prediction like COVID-19 or fertility awareness, among many others."
    },
    {
      "title": "Wearable Characteristics",
      "text": "Similar to other reviews, most devices were wrist-worn fitness trackers and accelerometers, and most of them are from the company Fitbit, measuring PA, HR, and sleep  [3, 27, 31, 224, 225] . These vital signs and device types seem to become the standard in wearable research  [3, 27, 31, 224, 225] . The included studies also emphasized the growing wearable use  [147, 195, 197] , which is also reflected in commercially available devices  [38] [39] [40] .\n\nCurrently, further wearable devices emerge, measuring, for example, oximetry, blood pressure, skin temperature, or respiratory rate."
    },
    {
      "title": "Categorization of Wearable Application in the Studies",
      "text": "In general, the included studies covered a great scope of health applications such as fertility tracking; monitoring of body characteristics such as weight or diseases such as Alzheimer disease, diabetes mellitus, and AF; as well as associations of coffee intake, sleep, and PA, or blood pressure and steps. We have noted an increase in smaller studies that also included rare populations and conditions, such as fibromyalgia or the rare genetic Pompe disease, indicating that wearables may be valuable for insights into patients with rare conditions. Using affordable, consumer-grade wearables for rare disease assessment and monitoring might eventually be less expensive than specifically developed devices and easier to use for patients. Therefore, currently underrepresented populations may be better researched through wearables  [231] , that is, different ethnic groups, nationalities, individuals with disabilities, or (rare) conditions. Future studies could examine the participation of underrepresented groups in wearable research in greater depth, particularly in studies analyzing wearable user data."
    },
    {
      "title": "Global Health and Low-Resource Contexts",
      "text": "Included studies are predominantly from high-income countries, constituting a gap in wearable studies in low-resource contexts.\n\nThe AliveCor device was shown to be feasible in Kenya to help detect AF  [232] , as well as for early diagnosis. The literature underlines the potential for wearable-based research in low-resource settings to generate data and improve health care  [9] , based on their low cost and ease of use (data\n\nacquisition, hardware, and software handling) [233]. Xu et al [234] emphasized that physiological monitoring with wearables hold \"promise for substantial improvements in neonatal outcomes\" in low-and middle-resource countries. Wearables can generate a solid database for global health research, particularly for morbidity measurements [235], large-scale studies, and modeling and descriptive studies. Topics such as climate change-induced impacts focusing on extreme weather events as an outcome and impact on health [236] may be approached. For example, 1 study [20] measured the physiological response of farm workers to climate conditions with wearables to investigate heat-related illness in a high-income setting. Lam et al [237] investigated the thermal adaptation and comfort of participants originating from various climatic regions. The fitness tracker measured HR data was integrated with other weather and human-based measurements and predicted the thermal sensation of nonlocal participants, among others. Similar studies can be conducted in low-resource regions."
    },
    {
      "title": "Strengths and Shortcomings of Wearables",
      "text": "A few studies have experienced issues or shortcomings, such as inaccuracies in measurements and technical issues.\n\nNevertheless, most authors were satisfied with wearables, as strengths were mentioned more frequently than shortcomings. Novelty and innovation outweighed the shortcomings for most authors. The most mentioned positive wearable characteristics were validity and accuracy, technical reliability, innovation, and unobtrusiveness. Only a few authors have mentioned data access through APIs or cloud platforms as a strength. However, the practical value of wearables is heavily reliant on the mode and reliability of data access. Depending on the company, there may be different data access policies in place, whereby it may not be possible to access the raw data of the wearable. Most authors have not considered wearable data access. However, data access and availability of wearable devices is an important aspect that researchers need to be aware of before using a potential study device. Another aspect is open access to the wearables' raw data or source codes, as companies might change the source code and implement algorithms without the obligation to announce or detail changes that might lead to bias and inconsistency of data  [224] . For example,  Thijs et al [195]  mentioned the consequences of nondisclosed algorithms (Fitbit) for data analysis and standardization. Moreover, the lack of standardization and replicability of wearable raw data and analysis  [28]  hinders comparability among studies.\n\nMost studies mentioned and discussed validation, accuracy, and certification of the used wearables as part of good research practice approaches. However, the mention of validation or accuracy did not necessarily imply that the wearables had been certified (FDA or CE) or validated in peer-reviewed research. Nevertheless, the authors reported that the wearable device is sufficiently accurate even with existing inaccuracies  [14, 143, 197] . The authors seemed to tolerate smaller inaccuracies and validation drawbacks-especially of established consumer-grade wearables-if usability was of high importance, such as in large-scale studies."
    },
    {
      "title": "Large-scale and Big Data Sets for Wearable Research",
      "text": "We noted an increase in large-scale wearable studies in recent years, which is consistent with previous literature  [225] . During the COVID-19 pandemic, there has been an increase in studies using secondary data. Studies aimed at generating insights with regard to the developing pandemic, focusing on forecasting models and their effects on different populations. Overall, wearable-generated big data sets might decrease biased data because measurements are objectively taken in the natural environment of numerous and diverse individuals. Although data analytic skills are needed for handling big data sets, their analysis might be extremely valuable for health research in generating new evidence  [31, 225] ."
    },
    {
      "title": "Limitations",
      "text": "First, not all studies using wearables might have been identified by our search. We included only the wearables of companies in the search that had the highest market share. Therefore, the wearables of smaller or new companies may be missing in this review. In addition, we only included studies published in English, which may have excluded evidence from other regions that may not publish in English. Although this review provides a wide scope of wearable research, the list of included studies is by no means exhaustive.\n\nIn addition, wearable costs are only approximations and could be imprecise: (1) companies follow different sales and distribution models, for example membership, rental, and subscription;\n\n(2) we only incorporated wearable (hardware) prices, excluding costs for software, maintenance, and other charges such as subscription fees, which may even exceed wearable hardware costs; and (3) sales prices are subject to fluctuation. We also excluded many studies as wearables were discontinued. The fluctuant and unstable market, therefore, might also be a factor in decisions regarding the use of wearables  [28] . Although interesting and promising, some wearables and similar devices were beyond the scope of this study but might also be valuable for health research. We have provided a wide overview of wearable devices; however, the included studies did not show the full range of possible wearables and measured vital signs  [9, 37] .\n\nIn addition, we report the opinions of the included studies with regard to the shortcomings and strengths of wearables. Although these insights might be helpful, they are not objective measures. Moreover, our introduced categories for studies and aims to use wearables might overlap, as separation and categorization are artificial."
    },
    {
      "title": "Conclusions",
      "text": "We see a growing uptake of wearables in health research and a trend to use wearables for large-scale, population-based studies. Wearables, which were often piloted in the included studies, were used in diverse health fields including COVID-19 prediction, fertility awareness, geriatrics, AF detection, evaluation of methods, drug effects, psychological interventions, and patient-reported outcomes. Measurement of steps, PA, HR, and sleep may be considered standard wearable measurements. Nevertheless, wearables are becoming more diverse in their measurements and appearance. Therefore, wearable-induced research may include currently underrepresented populations such as the older adults, participants who are disabled, participants with rare chronic or genetic diseases, participants from low socioeconomic backgrounds, and others.\n\nFor many researchers, novelty and innovation seem to outweigh shortcomings such as measurement inaccuracies. Overall, the included studies shared key characteristics that the wearables should meet: validity, technical reliability (including data access solutions), innovation, and unobtrusiveness.\n\nWe identified a lack of wearable research in low-resource settings. We assume that the reasons for the gap may be a lack of funding and doubts about the usefulness of the wearables. However, wearable devices may be used to generate data in such settings, which may otherwise be difficult and expensive to obtain. Therefore, wearable devices may be valuable for health research in a global context. During the COVID-19-pandemic in particular, large-sized wearable studies were used to generate insights into the developing pandemic and may potentially lead to novel insights into population health trends and forecasts. Future research is needed to determine the usability of wearable devices for underrepresented populations, as well as the feasibility and usefulness of health research in low-resource contexts."
    },
    {
      "text": "Figure 1. PRISMA (Preferred Reporting Items for Systematic Reviews and Meta-Analyses) flow diagram [220]."
    },
    {
      "text": "Figure 2. Number of studies and study participants (logarithmic scale) per year of study publication. The sizes of the circles visualize the overlapping and number of studies within the year."
    },
    {
      "text": "Figure 3. Included studies per continent. The colors of the continents visualize the number of included studies published on the respective continent (created with Mapchart [221])."
    },
    {
      "text": "Figure 4. Studies per medical field."
    },
    {
      "text": "Figure 5. Wear locations of wearables and their frequencies. The color and size of the circles assigned to the body location visualize the frequency of wearables worn on the respective location."
    },
    {
      "text": "Figure 6. Categorization of wearable applications, showing proportions of the 6 categories (with 4 subcategories). The size of depicted categories (in different colors) corresponds to the number of studies."
    },
    {
      "text": "Figure 7. Chart of reported strengths and weaknesses of wearables as mentioned by authors. PA: physical activity."
    },
    {
      "text": "Characteristics of studies."
    },
    {
      "text": "Characteristics of wearable devices."
    },
    {
      "title": "Acknowledgments",
      "text": "We wish to thank the  German Research Foundation (Deutsche Forschungsgemeinschaft)  for supporting this study as part of a  Deutsche Forschungsgemeinschaft -funded research unit (Forschungsgruppe). We acknowledge the support of  Else Kr\u00f6ner-Fresenius-Stiftung  from the  Heidelberg Graduate School of Global Health . Funders did not have a role in the design, data collection and analysis, decision to publish, or preparation of the manuscript."
    },
    {
      "title": "Authors' Contributions",
      "text": "SH, SB, and MA conceived and designed the study. SH drafted the manuscript with the help of SB and MA. All authors contributed to the critical revision of the draft and approved the final version of the manuscript."
    },
    {
      "title": "Conflicts of Interest",
      "text": "None declared."
    },
    {
      "title": "Multimedia Appendix 1"
    }
  ],
  "references": [
    {
      "title": "Wearable band shipments rocket by 684%",
      "year": 2014,
      "doi": "10.1149/ma2014-02/11/684",
      "raw": "10.1149/ma2014-02/11/684 \n\t\t \n\t\t Wearable band shipments rocket by 684% \n\t\t Singapore \n\t\t \n\t\t\t Canalys \n\t\t\t 2014. 2020-11-12 \n\t\t \n\t \n\t Wearable band shipments rocket by 684%. Canalys. Singapore; 2014. URL: https://www.canalys.com/newsroom/ wearable-band-shipments-rocket-684?time=1605182466 [accessed 2020-11-12]"
    },
    {
      "title": "Using fitness trackers and smartwatches to measure physical activity in research: analysis of consumer wrist-worn wearables",
      "authors": [
        "A Henriksen",
        "M Haugen Mikalsen",
        "A Woldaregay",
        "M Muzny",
        "G Hartvigsen",
        "L Hopstock"
      ],
      "year": 2018,
      "doi": "10.2196/jmir.9157",
      "journal": "J Med Internet Res",
      "volume": "20",
      "issue": "3",
      "pages": "110",
      "raw": "Using fitness trackers and smartwatches to measure physical activity in research: analysis of consumer wrist-worn wearables \n\t\t \n\t\t\t A Henriksen \n\t\t \n\t\t \n\t\t\t M Haugen Mikalsen \n\t\t \n\t\t \n\t\t\t A Z Woldaregay \n\t\t \n\t\t \n\t\t\t M Muzny \n\t\t \n\t\t \n\t\t\t G Hartvigsen \n\t\t \n\t\t \n\t\t\t L A Hopstock \n\t\t \n\t\t 10.2196/jmir.9157 \n\t\t Medline: 29567635 \n\t \n\t \n\t\t J Med Internet Res \n\t\t \n\t\t\t 20 \n\t\t\t 3 \n\t\t\t 110 \n\t\t\t 2018 \n\t\t \n\t \n\t FREE Full text \n\t Henriksen A, Haugen Mikalsen M, Woldaregay AZ, Muzny M, Hartvigsen G, Hopstock LA, et al. Using fitness trackers and smartwatches to measure physical activity in research: analysis of consumer wrist-worn wearables. J Med Internet Res 2018;20(3):e110 [FREE Full text] [doi: 10.2196/jmir.9157] [Medline: 29567635]"
    },
    {
      "title": "Wearable activity trackers, accuracy, adoption, acceptance and health impact: a systematic literature review",
      "authors": [
        "G Shin",
        "M Jarrahi",
        "Y Fei",
        "A Karami",
        "N Gafinowitz",
        "A Byun"
      ],
      "year": 2019,
      "doi": "10.1016/j.jbi.2019.103153",
      "journal": "J Biomed Inform",
      "volume": "93",
      "pages": "103153",
      "raw": "Wearable activity trackers, accuracy, adoption, acceptance and health impact: a systematic literature review \n\t\t \n\t\t\t G Shin \n\t\t \n\t\t \n\t\t\t M H Jarrahi \n\t\t \n\t\t \n\t\t\t Y Fei \n\t\t \n\t\t \n\t\t\t A Karami \n\t\t \n\t\t \n\t\t\t N Gafinowitz \n\t\t \n\t\t \n\t\t\t A Byun \n\t\t \n\t\t 10.1016/j.jbi.2019.103153 \n\t\t Medline: 30910623 \n\t \n\t \n\t\t J Biomed Inform \n\t\t \n\t\t\t 93 \n\t\t\t 103153 \n\t\t\t 2019 \n\t\t \n\t \n\t Shin G, Jarrahi MH, Fei Y, Karami A, Gafinowitz N, Byun A, et al. Wearable activity trackers, accuracy, adoption, acceptance and health impact: a systematic literature review. J Biomed Inform 2019;93:103153. [doi: 10.1016/j.jbi.2019.103153] [Medline: 30910623]"
    },
    {
      "title": "Smart-watches: a potential challenger to the implantable loop recorder",
      "authors": [
        "A Carpenter",
        "A Frontera"
      ],
      "year": 2016,
      "doi": "10.1093/europace/euv427",
      "journal": "Europace",
      "volume": "18",
      "issue": "6",
      "raw": "Smart-watches: a potential challenger to the implantable loop recorder \n\t\t \n\t\t\t A Carpenter \n\t\t \n\t\t \n\t\t\t A Frontera \n\t\t \n\t\t 10.1093/europace/euv427 \n\t\t Medline: 26847074 \n\t \n\t \n\t\t Europace \n\t\t \n\t\t\t 18 \n\t\t\t 6 \n\t\t\t \n\t\t\t 2016 \n\t\t \n\t \n\t Carpenter A, Frontera A. Smart-watches: a potential challenger to the implantable loop recorder. Europace 2016;18(6):791-793. [doi: 10.1093/europace/euv427] [Medline: 26847074]"
    },
    {
      "title": "Perceived user preferences and usability evaluation of mainstream wearable devices for health monitoring",
      "authors": [
        "Y Jia",
        "Wang Wen",
        "D Liang",
        "L Gao",
        "L Lei"
      ],
      "year": 2018,
      "doi": "10.7717/peerj.5350",
      "journal": "PeerJ",
      "volume": "6",
      "pages": "5350",
      "raw": "Perceived user preferences and usability evaluation of mainstream wearable devices for health monitoring \n\t\t \n\t\t\t Y Jia \n\t\t \n\t\t \n\t\t\t Wang W Wen \n\t\t \n\t\t \n\t\t\t D Liang \n\t\t \n\t\t \n\t\t\t L Gao \n\t\t \n\t\t \n\t\t\t L Lei \n\t\t \n\t\t \n\t\t\t J \n\t\t \n\t\t 10.7717/peerj.5350 \n\t\t Medline: 30065893 \n\t \n\t \n\t\t PeerJ \n\t\t \n\t\t\t 6 \n\t\t\t 5350 \n\t\t\t 2018 \n\t\t \n\t \n\t FREE Full text \n\t Jia Y, Wang W, Wen D, Liang L, Gao L, Lei J. Perceived user preferences and usability evaluation of mainstream wearable devices for health monitoring. PeerJ 2018;6:e5350 [FREE Full text] [doi: 10.7717/peerj.5350] [Medline: 30065893]"
    },
    {
      "title": "Utility of consumer physical activity trackers as an intervention tool in cardiovascular disease prevention and treatment",
      "authors": [
        "A Hickey",
        "P Freedson"
      ],
      "year": 2016,
      "doi": "10.1016/j.pcad.2016.02.006",
      "journal": "Prog Cardiovasc Dis",
      "volume": "58",
      "issue": "6",
      "raw": "Utility of consumer physical activity trackers as an intervention tool in cardiovascular disease prevention and treatment \n\t\t \n\t\t\t A M Hickey \n\t\t \n\t\t \n\t\t\t P S Freedson \n\t\t \n\t\t 10.1016/j.pcad.2016.02.006 \n\t\t Medline: 26943981 \n\t \n\t \n\t\t Prog Cardiovasc Dis \n\t\t \n\t\t\t 58 \n\t\t\t 6 \n\t\t\t \n\t\t\t 2016 \n\t\t \n\t \n\t Hickey AM, Freedson PS. Utility of consumer physical activity trackers as an intervention tool in cardiovascular disease prevention and treatment. Prog Cardiovasc Dis 2016;58(6):613-619. [doi: 10.1016/j.pcad.2016.02.006] [Medline: 26943981]"
    },
    {
      "title": "Reliability and validity of commercially available wearable devices for measuring steps, energy expenditure, and heart rate: systematic review",
      "authors": [
        "D Fuller",
        "E Colwell",
        "J Low",
        "K Orychock",
        "M Tobin",
        "B Simango"
      ],
      "year": 2020,
      "doi": "10.2196/18694",
      "journal": "JMIR Mhealth Uhealth",
      "volume": "8",
      "issue": "9",
      "pages": "18694",
      "raw": "Reliability and validity of commercially available wearable devices for measuring steps, energy expenditure, and heart rate: systematic review \n\t\t \n\t\t\t D Fuller \n\t\t \n\t\t \n\t\t\t E Colwell \n\t\t \n\t\t \n\t\t\t J Low \n\t\t \n\t\t \n\t\t\t K Orychock \n\t\t \n\t\t \n\t\t\t M A Tobin \n\t\t \n\t\t \n\t\t\t B Simango \n\t\t \n\t\t 10.2196/18694 \n\t\t Medline: 32897239 \n\t \n\t \n\t\t JMIR Mhealth Uhealth \n\t\t \n\t\t\t 8 \n\t\t\t 9 \n\t\t\t 18694 \n\t\t\t 2020 \n\t\t \n\t \n\t FREE Full text \n\t Fuller D, Colwell E, Low J, Orychock K, Tobin MA, Simango B, et al. Reliability and validity of commercially available wearable devices for measuring steps, energy expenditure, and heart rate: systematic review. JMIR Mhealth Uhealth 2020;8(9):e18694 [FREE Full text] [doi: 10.2196/18694] [Medline: 32897239]"
    },
    {
      "title": "Validity of wrist-worn photoplethysmography devices to measure heart rate: a systematic review and meta-analysis",
      "authors": [
        "Y Zhang",
        "R Weaver",
        "B Armstrong",
        "S Burkart",
        "S Zhang",
        "M Beets"
      ],
      "year": 2020,
      "doi": "10.1080/02640414.2020.1767348",
      "journal": "J Sports Sci",
      "volume": "38",
      "issue": "17",
      "raw": "Validity of wrist-worn photoplethysmography devices to measure heart rate: a systematic review and meta-analysis \n\t\t \n\t\t\t Y Zhang \n\t\t \n\t\t \n\t\t\t R G Weaver \n\t\t \n\t\t \n\t\t\t B Armstrong \n\t\t \n\t\t \n\t\t\t S Burkart \n\t\t \n\t\t \n\t\t\t S Zhang \n\t\t \n\t\t \n\t\t\t M W Beets \n\t\t \n\t\t 10.1080/02640414.2020.1767348 \n\t\t Medline: 32552580 \n\t \n\t \n\t\t J Sports Sci \n\t\t \n\t\t\t 38 \n\t\t\t 17 \n\t\t\t \n\t\t\t 2020 \n\t\t \n\t \n\t Zhang Y, Weaver RG, Armstrong B, Burkart S, Zhang S, Beets MW. Validity of wrist-worn photoplethysmography devices to measure heart rate: a systematic review and meta-analysis. J Sports Sci 2020;38(17):2021-2034. [doi: 10.1080/02640414.2020.1767348] [Medline: 32552580]"
    },
    {
      "title": "Wearables and the medical revolution",
      "authors": [
        "J Dunn",
        "R Runge",
        "M Snyder"
      ],
      "year": 2018,
      "doi": "10.2217/pme-2018-0044",
      "journal": "Per Med",
      "volume": "15",
      "issue": "5",
      "raw": "Wearables and the medical revolution \n\t\t \n\t\t\t J Dunn \n\t\t \n\t\t \n\t\t\t R Runge \n\t\t \n\t\t \n\t\t\t M Snyder \n\t\t \n\t\t 10.2217/pme-2018-0044 \n\t\t Medline: 30259801 \n\t \n\t \n\t\t Per Med \n\t\t \n\t\t\t 15 \n\t\t\t 5 \n\t\t\t \n\t\t\t 2018 \n\t\t \n\t \n\t FREE Full text \n\t Dunn J, Runge R, Snyder M. Wearables and the medical revolution. Per Med 2018;15(5):429-448 [FREE Full text] [doi: 10.2217/pme-2018-0044] [Medline: 30259801]"
    },
    {
      "title": "Ecological momentary assessment",
      "authors": [
        "S Shiffman",
        "A Stone",
        "M Hufford"
      ],
      "year": 2008,
      "doi": "10.1146/annurev.clinpsy.3.022806.091415",
      "journal": "Annu Rev Clin Psychol",
      "volume": "4",
      "raw": "Ecological momentary assessment \n\t\t \n\t\t\t S Shiffman \n\t\t \n\t\t \n\t\t\t A A Stone \n\t\t \n\t\t \n\t\t\t M R Hufford \n\t\t \n\t\t 10.1146/annurev.clinpsy.3.022806.091415 \n\t\t Medline: 18509902 \n\t \n\t \n\t\t Annu Rev Clin Psychol \n\t\t \n\t\t\t 4 \n\t\t\t \n\t\t\t 2008 \n\t\t \n\t \n\t Shiffman S, Stone AA, Hufford MR. Ecological momentary assessment. Annu Rev Clin Psychol 2008;4:1-32. [doi: 10.1146/annurev.clinpsy.3.022806.091415] [Medline: 18509902]"
    },
    {
      "title": "mHealth technology for ecological momentary assessment in physical activity research: a systematic review",
      "authors": [
        "R Zapata-Lamana",
        "J Lalanza",
        "J Losilla",
        "E Parrado",
        "L Capdevila"
      ],
      "year": 2020,
      "doi": "10.7717/peerj.8848",
      "journal": "PeerJ",
      "volume": "8",
      "pages": "8848",
      "raw": "mHealth technology for ecological momentary assessment in physical activity research: a systematic review \n\t\t \n\t\t\t R Zapata-Lamana \n\t\t \n\t\t \n\t\t\t J F Lalanza \n\t\t \n\t\t \n\t\t\t J M Losilla \n\t\t \n\t\t \n\t\t\t E Parrado \n\t\t \n\t\t \n\t\t\t L Capdevila \n\t\t \n\t\t 10.7717/peerj.8848 \n\t\t Medline: 32257648 \n\t \n\t \n\t\t PeerJ \n\t\t \n\t\t\t 8 \n\t\t\t 8848 \n\t\t\t 2020 \n\t\t \n\t \n\t FREE Full text \n\t Zapata-Lamana R, Lalanza JF, Losilla JM, Parrado E, Capdevila L. mHealth technology for ecological momentary assessment in physical activity research: a systematic review. PeerJ 2020;8:e8848 [FREE Full text] [doi: 10.7717/peerj.8848] [Medline: 32257648]"
    },
    {
      "title": "La montre connect\u00e9e : un instrument de sant\u00e9 publique?",
      "authors": [
        "G Berrut"
      ],
      "year": 2020,
      "doi": "10.1684/pnv.2020.0847",
      "journal": "Geriatr Psychol Neuropsychiatr Vieil",
      "volume": "18",
      "issue": "1",
      "pages": "5",
      "raw": "La montre connect\u00e9e : un instrument de sant\u00e9 publique? \n\t\t \n\t\t\t G Berrut \n\t\t \n\t\t 10.1684/pnv.2020.0847 \n\t\t Medline: 32160985 \n\t \n\t \n\t\t Geriatr Psychol Neuropsychiatr Vieil \n\t\t \n\t\t\t 18 \n\t\t\t 1 \n\t\t\t 5 \n\t\t\t 2020 \n\t\t \n\t \n\t Berrut G. La montre connect\u00e9e : un instrument de sant\u00e9 publique? Geriatr Psychol Neuropsychiatr Vieil 2020;18(1):5. [doi: 10.1684/pnv.2020.0847] [Medline: 32160985]"
    },
    {
      "title": "Corona-Datenspende",
      "authors": [
        "Robert Koch"
      ],
      "year": 2020,
      "raw": "Corona-Datenspende \n\t\t \n\t\t\t Robert Koch \n\t\t \n\t\t \n\t\t\t Institute \n\t\t \n\t\t \n\t\t \n\t\t\t 2020. 2020-10-26 \n\t\t\t Corona Data Donation \n\t\t \n\t \n\t Robert Koch Institute. Corona-Datenspende | Robert Koch-Institut. Corona Data Donation. 2020. URL: https:/ /corona-datenspende.de/ [accessed 2020-10-26]"
    },
    {
      "title": "Harnessing wearable device data to improve state-level real-time surveillance of influenza-like illness in the USA: a population-based study",
      "authors": [
        "J Radin",
        "N Wineinger",
        "E Topol",
        "S Steinhubl"
      ],
      "year": 2020,
      "doi": "10.1016/S2589-7500(19)30222-5",
      "journal": "Lancet Digit Health",
      "volume": "2",
      "issue": "2",
      "raw": "Harnessing wearable device data to improve state-level real-time surveillance of influenza-like illness in the USA: a population-based study \n\t\t \n\t\t\t J M Radin \n\t\t \n\t\t \n\t\t\t N E Wineinger \n\t\t \n\t\t \n\t\t\t E J Topol \n\t\t \n\t\t \n\t\t\t S R Steinhubl \n\t\t \n\t\t 10.1016/S2589-7500(19)30222-5 \n\t\t Medline: 33334565 \n\t \n\t \n\t\t Lancet Digit Health \n\t\t \n\t\t\t 2 \n\t\t\t 2 \n\t\t\t \n\t\t\t 2020 \n\t\t \n\t \n\t FREE Full text \n\t Radin JM, Wineinger NE, Topol EJ, Steinhubl SR. Harnessing wearable device data to improve state-level real-time surveillance of influenza-like illness in the USA: a population-based study. Lancet Digit Health 2020;2(2):e85-e93 [FREE Full text] [doi: 10.1016/S2589-7500(19)30222-5] [Medline: 33334565]"
    },
    {
      "title": "Large-scale assessment of a smartwatch to identify atrial fibrillation",
      "authors": [
        "M Perez",
        "K Mahaffey",
        "H Hedlin",
        "J Rumsfeld",
        "A Garcia",
        "T Ferris",
        "Apple Heart",
        "Study Investigators"
      ],
      "year": 2019,
      "doi": "10.1056/nejmoa1901183",
      "journal": "N Engl J Med",
      "volume": "381",
      "issue": "20",
      "raw": "Large-scale assessment of a smartwatch to identify atrial fibrillation \n\t\t \n\t\t\t M V Perez \n\t\t \n\t\t \n\t\t\t K W Mahaffey \n\t\t \n\t\t \n\t\t\t H Hedlin \n\t\t \n\t\t \n\t\t\t J S Rumsfeld \n\t\t \n\t\t \n\t\t\t A Garcia \n\t\t \n\t\t \n\t\t\t T Ferris \n\t\t \n\t\t \n\t\t\t Apple Heart \n\t\t \n\t\t \n\t\t\t Study Investigators \n\t\t \n\t\t 10.1056/nejmoa1901183 \n\t\t Medline: 31722151 \n\t \n\t \n\t\t N Engl J Med \n\t\t \n\t\t\t 381 \n\t\t\t 20 \n\t\t\t \n\t\t\t 2019 \n\t\t \n\t \n\t Perez MV, Mahaffey KW, Hedlin H, Rumsfeld JS, Garcia A, Ferris T, Apple Heart Study Investigators. Large-scale assessment of a smartwatch to identify atrial fibrillation. N Engl J Med 2019;381(20):1909-1917. [doi: 10.1056/NEJMoa1901183] [Medline: 31722151]"
    },
    {
      "title": "Why doctors shouldn't dismiss the Apple watch's new ECG app",
      "authors": [
        "C Worsham",
        "A Jena"
      ],
      "year": 2018,
      "raw": "Why doctors shouldn't dismiss the Apple watch's new ECG app \n\t\t \n\t\t\t C Worsham \n\t\t \n\t\t \n\t\t\t A B Jena \n\t\t \n\t\t \n\t\t \n\t\t\t 2018. 2020-10-02 \n\t\t \n\t\t \n\t\t\t Harvard Business Review \n\t\t \n\t \n\t Worsham C, Jena AB. Why doctors shouldn't dismiss the Apple watch's new ECG app. Harvard Business Review. 2018. URL: https://hbr.org/2018/10/why-doctors-shouldnt-dismiss-the-apple-watchs-new-ecg-app [accessed 2020-10-02]"
    },
    {
      "title": "Reply: watch out: the many limitations in smartwatch-driven AF detection",
      "authors": [
        "M D\u00f6rr",
        "V Nohturfft",
        "N Brasier",
        "E Bosshard",
        "A Djurdjevic",
        "S Gross"
      ],
      "year": 2019,
      "doi": "10.1016/j.jacep.2019.03.001",
      "journal": "JACC Clin Electrophysiol",
      "volume": "5",
      "issue": "4",
      "raw": "Reply: watch out: the many limitations in smartwatch-driven AF detection \n\t\t \n\t\t\t M D\u00f6rr \n\t\t \n\t\t \n\t\t\t V Nohturfft \n\t\t \n\t\t \n\t\t\t N Brasier \n\t\t \n\t\t \n\t\t\t E Bosshard \n\t\t \n\t\t \n\t\t\t A Djurdjevic \n\t\t \n\t\t \n\t\t\t S Gross \n\t\t \n\t\t 10.1016/j.jacep.2019.03.001 \n\t\t Medline: 31000111 \n\t \n\t \n\t\t JACC Clin Electrophysiol \n\t\t \n\t\t\t 5 \n\t\t\t 4 \n\t\t\t \n\t\t\t 2019 \n\t\t \n\t \n\t FREE Full text \n\t D\u00f6rr M, Nohturfft V, Brasier N, Bosshard E, Djurdjevic A, Gross S, et al. Reply: watch out: the many limitations in smartwatch-driven AF detection. JACC Clin Electrophysiol 2019;5(4):526-527 [FREE Full text] [doi: 10.1016/j.jacep.2019.03.001] [Medline: 31000111]"
    },
    {
      "title": "Postoperative gastrointestinal telemetry with an acoustic biosensor predicts ileus vs. uneventful GI recovery",
      "authors": [
        "M Kaneshiro",
        "W Kaiser",
        "J Pourmorady",
        "P Fleshner",
        "M Russell",
        "K Zaghiyan"
      ],
      "year": 2016,
      "doi": "10.1007/s11605-015-2956-3",
      "journal": "J Gastrointest Surg",
      "volume": "20",
      "issue": "1",
      "raw": "Postoperative gastrointestinal telemetry with an acoustic biosensor predicts ileus vs. uneventful GI recovery \n\t\t \n\t\t\t M Kaneshiro \n\t\t \n\t\t \n\t\t\t W Kaiser \n\t\t \n\t\t \n\t\t\t J Pourmorady \n\t\t \n\t\t \n\t\t\t P Fleshner \n\t\t \n\t\t \n\t\t\t M Russell \n\t\t \n\t\t \n\t\t\t K Zaghiyan \n\t\t \n\t\t 10.1007/s11605-015-2956-3 \n\t\t Medline: 26408329 \n\t \n\t \n\t\t J Gastrointest Surg \n\t\t \n\t\t\t 20 \n\t\t\t 1 \n\t\t\t \n\t\t\t 2016 \n\t\t \n\t \n\t Kaneshiro M, Kaiser W, Pourmorady J, Fleshner P, Russell M, Zaghiyan K, et al. Postoperative gastrointestinal telemetry with an acoustic biosensor predicts ileus vs. uneventful GI recovery. J Gastrointest Surg 2016;20(1):132-139. [doi: 10.1007/s11605-015-2956-3] [Medline: 26408329]"
    },
    {
      "title": "Wearable nanoplasmonic patch detecting Sun/UV exposure",
      "authors": [
        "J Barajas-Carmona",
        "L Francisco-Aldana",
        "E Morales-Narv\u00e1ez"
      ],
      "year": 2017,
      "doi": "10.1021/acs.analchem.7b04066",
      "journal": "Anal Chem",
      "volume": "89",
      "issue": "24",
      "raw": "Wearable nanoplasmonic patch detecting Sun/UV exposure \n\t\t \n\t\t\t J G Barajas-Carmona \n\t\t \n\t\t \n\t\t\t L Francisco-Aldana \n\t\t \n\t\t \n\t\t\t E Morales-Narv\u00e1ez \n\t\t \n\t\t 10.1021/acs.analchem.7b04066 \n\t\t Medline: 29155557 \n\t \n\t \n\t\t Anal Chem \n\t\t \n\t\t\t 89 \n\t\t\t 24 \n\t\t\t \n\t\t\t 2017 \n\t\t \n\t \n\t Barajas-Carmona JG, Francisco-Aldana L, Morales-Narv\u00e1ez E. Wearable nanoplasmonic patch detecting Sun/UV exposure. Anal Chem 2017;89(24):13589-13595. [doi: 10.1021/acs.analchem.7b04066] [Medline: 29155557]"
    },
    {
      "title": "Heat-related illness in midwestern hispanic farmworkers: a descriptive analysis of hydration status and reported symptoms",
      "authors": [
        "K Culp",
        "S Tonelli"
      ],
      "year": 2019,
      "doi": "10.1177/2165079918813380",
      "journal": "Workplace Health Saf",
      "volume": "67",
      "issue": "4",
      "raw": "Heat-related illness in midwestern hispanic farmworkers: a descriptive analysis of hydration status and reported symptoms \n\t\t \n\t\t\t K Culp \n\t\t \n\t\t \n\t\t\t S Tonelli \n\t\t \n\t\t 10.1177/2165079918813380 \n\t\t Medline: 30724664 \n\t \n\t \n\t\t Workplace Health Saf \n\t\t \n\t\t\t 67 \n\t\t\t 4 \n\t\t\t \n\t\t\t 2019 \n\t\t \n\t \n\t FREE Full text \n\t Culp K, Tonelli S. Heat-related illness in midwestern hispanic farmworkers: a descriptive analysis of hydration status and reported symptoms. Workplace Health Saf 2019;67(4):168-178 [FREE Full text] [doi: 10.1177/2165079918813380] [Medline: 30724664]"
    },
    {
      "title": "Sweat test for cystic fibrosis: wearable sweat sensor vs. standard laboratory test",
      "authors": [
        "D Choi",
        "A Thaxton",
        "I Jeong",
        "K Kim",
        "P Sosnay",
        "G Cutting"
      ],
      "year": 2018,
      "doi": "10.1016/j.jcf.2018.03.005",
      "journal": "J Cyst Fibros",
      "volume": "17",
      "issue": "4",
      "raw": "Sweat test for cystic fibrosis: wearable sweat sensor vs. standard laboratory test \n\t\t \n\t\t\t D H Choi \n\t\t \n\t\t \n\t\t\t A Thaxton \n\t\t \n\t\t \n\t\t\t I C Jeong \n\t\t \n\t\t \n\t\t\t K Kim \n\t\t \n\t\t \n\t\t\t P R Sosnay \n\t\t \n\t\t \n\t\t\t G R Cutting \n\t\t \n\t\t 10.1016/j.jcf.2018.03.005 \n\t\t Medline: 29580829 \n\t \n\t \n\t\t J Cyst Fibros \n\t\t \n\t\t\t 17 \n\t\t\t 4 \n\t\t\t \n\t\t\t 2018 \n\t\t \n\t \n\t FREE Full text \n\t Choi DH, Thaxton A, Jeong IC, Kim K, Sosnay PR, Cutting GR, et al. Sweat test for cystic fibrosis: wearable sweat sensor vs. standard laboratory test. J Cyst Fibros 2018;17(4):e35-e38 [FREE Full text] [doi: 10.1016/j.jcf.2018.03.005] [Medline: 29580829]"
    },
    {
      "title": "Reliability of a wearable sweat rate monitor and routine sweat analysis techniques under heat stress in females",
      "authors": [
        "R Relf",
        "A Willmott",
        "M Flint",
        "L Beale",
        "N Maxwell"
      ],
      "year": 2019,
      "doi": "10.1016/j.jtherbio.2018.12.019",
      "journal": "J Therm Biol",
      "volume": "79",
      "raw": "Reliability of a wearable sweat rate monitor and routine sweat analysis techniques under heat stress in females \n\t\t \n\t\t\t R Relf \n\t\t \n\t\t \n\t\t\t A Willmott \n\t\t \n\t\t \n\t\t\t M S Flint \n\t\t \n\t\t \n\t\t\t L Beale \n\t\t \n\t\t \n\t\t\t N Maxwell \n\t\t \n\t\t 10.1016/j.jtherbio.2018.12.019 \n\t\t Medline: 30612681 \n\t \n\t \n\t\t J Therm Biol \n\t\t \n\t\t\t 79 \n\t\t\t \n\t\t\t 2019 \n\t\t \n\t \n\t Relf R, Willmott A, Flint MS, Beale L, Maxwell N. Reliability of a wearable sweat rate monitor and routine sweat analysis techniques under heat stress in females. J Therm Biol 2019;79:209-217. [doi: 10.1016/j.jtherbio.2018.12.019] [Medline: 30612681]"
    },
    {
      "title": "Detection of atrial fibrillation using a ring-type wearable device (CardioTracker) and deep learning analysis of photoplethysmography signals: prospective observational proof-of-concept study",
      "authors": [
        "S Kwon",
        "J Hong",
        "E Choi",
        "B Lee",
        "C Baik",
        "E Lee"
      ],
      "year": 2020,
      "doi": "10.2196/16443",
      "journal": "J Med Internet Res",
      "volume": "22",
      "issue": "5",
      "pages": "16443",
      "raw": "Detection of atrial fibrillation using a ring-type wearable device (CardioTracker) and deep learning analysis of photoplethysmography signals: prospective observational proof-of-concept study \n\t\t \n\t\t\t S Kwon \n\t\t \n\t\t \n\t\t\t J Hong \n\t\t \n\t\t \n\t\t\t E K Choi \n\t\t \n\t\t \n\t\t\t B Lee \n\t\t \n\t\t \n\t\t\t C Baik \n\t\t \n\t\t \n\t\t\t E Lee \n\t\t \n\t\t 10.2196/16443 \n\t\t Medline: 32348254 \n\t \n\t \n\t\t J Med Internet Res \n\t\t \n\t\t\t 22 \n\t\t\t 5 \n\t\t\t 16443 \n\t\t\t 2020 \n\t\t \n\t \n\t FREE Full text \n\t Kwon S, Hong J, Choi EK, Lee B, Baik C, Lee E, et al. Detection of atrial fibrillation using a ring-type wearable device (CardioTracker) and deep learning analysis of photoplethysmography signals: prospective observational proof-of-concept study. J Med Internet Res 2020;22(5):e16443 [FREE Full text] [doi: 10.2196/16443] [Medline: 32348254]"
    },
    {
      "title": "Monitor the quality of cardiopulmonary resuscitation in 2020",
      "authors": [
        "C Genbrugge",
        "W Eertmans",
        "D Salcido"
      ],
      "year": 2020,
      "doi": "10.1097/mcc.0000000000000726",
      "journal": "Curr Opin Crit Care",
      "volume": "26",
      "issue": "3",
      "raw": "Monitor the quality of cardiopulmonary resuscitation in 2020 \n\t\t \n\t\t\t C Genbrugge \n\t\t \n\t\t \n\t\t\t W Eertmans \n\t\t \n\t\t \n\t\t\t D D Salcido \n\t\t \n\t\t 10.1097/mcc.0000000000000726 \n\t\t Medline: 32332284 \n\t \n\t \n\t\t Curr Opin Crit Care \n\t\t \n\t\t\t 26 \n\t\t\t 3 \n\t\t\t \n\t\t\t 2020 \n\t\t \n\t \n\t Genbrugge C, Eertmans W, Salcido DD. Monitor the quality of cardiopulmonary resuscitation in 2020. Curr Opin Crit Care 2020;26(3):219-227. [doi: 10.1097/MCC.0000000000000726] [Medline: 32332284]"
    },
    {
      "title": "First experiences with a wearable multisensor in an outpatient glucose monitoring study, part I: the users' view",
      "authors": [
        "A Caduff",
        "M Zanon",
        "P Zakharov",
        "M Mueller",
        "M Talary",
        "A Krebs"
      ],
      "year": 2018,
      "doi": "10.1177/1932296817750932",
      "journal": "J Diabetes Sci Technol",
      "volume": "12",
      "issue": "3",
      "raw": "First experiences with a wearable multisensor in an outpatient glucose monitoring study, part I: the users' view \n\t\t \n\t\t\t A Caduff \n\t\t \n\t\t \n\t\t\t M Zanon \n\t\t \n\t\t \n\t\t\t P Zakharov \n\t\t \n\t\t \n\t\t\t M Mueller \n\t\t \n\t\t \n\t\t\t M Talary \n\t\t \n\t\t \n\t\t\t A Krebs \n\t\t \n\t\t 10.1177/1932296817750932 \n\t\t Medline: 29332423 \n\t \n\t \n\t\t J Diabetes Sci Technol \n\t\t \n\t\t\t 12 \n\t\t\t 3 \n\t\t\t \n\t\t\t 2018 \n\t\t \n\t \n\t FREE Full text \n\t Caduff A, Zanon M, Zakharov P, Mueller M, Talary M, Krebs A, et al. First experiences with a wearable multisensor in an outpatient glucose monitoring study, part I: the users' view. J Diabetes Sci Technol 2018;12(3):562-568 [FREE Full text] [doi: 10.1177/1932296817750932] [Medline: 29332423]"
    },
    {
      "title": "WEARCON: wearable home monitoring in children with asthma reveals a strong association with hospital based assessment of asthma control",
      "authors": [
        "M Van Der Kamp",
        "E Klaver",
        "B Thio",
        "J Driessen",
        "F De Jongh",
        "M Tabak"
      ],
      "year": 2020,
      "doi": "10.1186/s12911-020-01210-1",
      "journal": "BMC Med Inform Decis Mak",
      "volume": "20",
      "issue": "1",
      "pages": "192",
      "raw": "WEARCON: wearable home monitoring in children with asthma reveals a strong association with hospital based assessment of asthma control \n\t\t \n\t\t\t M R Van Der Kamp \n\t\t \n\t\t \n\t\t\t E C Klaver \n\t\t \n\t\t \n\t\t\t B J Thio \n\t\t \n\t\t \n\t\t\t J M Driessen \n\t\t \n\t\t \n\t\t\t F H De Jongh \n\t\t \n\t\t \n\t\t\t M Tabak \n\t\t \n\t\t 10.1186/s12911-020-01210-1 \n\t\t Medline: 32795352 \n\t \n\t \n\t\t BMC Med Inform Decis Mak \n\t\t \n\t\t\t 20 \n\t\t\t 1 \n\t\t\t 192 \n\t\t\t 2020 \n\t\t \n\t \n\t FREE Full text \n\t van der Kamp MR, Klaver EC, Thio BJ, Driessen JM, de Jongh FH, Tabak M, et al. WEARCON: wearable home monitoring in children with asthma reveals a strong association with hospital based assessment of asthma control. BMC Med Inform Decis Mak 2020;20(1):192 [FREE Full text] [doi: 10.1186/s12911-020-01210-1] [Medline: 32795352]"
    },
    {
      "title": "The opportunity and obstacles for smartwatches and wearable sensors",
      "authors": [
        "K Foster",
        "J Torous"
      ],
      "year": 2019,
      "doi": "10.1109/MPULS.2018.2885832",
      "journal": "IEEE Pulse",
      "volume": "10",
      "issue": "1",
      "raw": "The opportunity and obstacles for smartwatches and wearable sensors \n\t\t \n\t\t\t K R Foster \n\t\t \n\t\t \n\t\t\t J Torous \n\t\t \n\t\t 10.1109/MPULS.2018.2885832 \n\t\t Medline: 30872210 \n\t \n\t \n\t\t IEEE Pulse \n\t\t \n\t\t\t 10 \n\t\t\t 1 \n\t\t\t \n\t\t\t 2019 \n\t\t \n\t \n\t Foster KR, Torous J. The opportunity and obstacles for smartwatches and wearable sensors. IEEE Pulse 2019;10(1):22-25. [doi: 10.1109/MPULS.2018.2885832] [Medline: 30872210]"
    },
    {
      "title": "Sleep tracking, wearable technology, and opportunities for research and clinical care",
      "authors": [
        "A Shelgikar",
        "P Anderson",
        "M Stephens"
      ],
      "year": 2016,
      "doi": "10.1016/j.chest.2016.04.016",
      "journal": "Chest",
      "volume": "150",
      "issue": "3",
      "raw": "Sleep tracking, wearable technology, and opportunities for research and clinical care \n\t\t \n\t\t\t A V Shelgikar \n\t\t \n\t\t \n\t\t\t P F Anderson \n\t\t \n\t\t \n\t\t\t M R Stephens \n\t\t \n\t\t 10.1016/j.chest.2016.04.016 \n\t\t Medline: 27132701 \n\t \n\t \n\t\t Chest \n\t\t \n\t\t\t 150 \n\t\t\t 3 \n\t\t\t \n\t\t\t 2016 \n\t\t \n\t \n\t Shelgikar AV, Anderson PF, Stephens MR. Sleep tracking, wearable technology, and opportunities for research and clinical care. Chest 2016;150(3):732-743. [doi: 10.1016/j.chest.2016.04.016] [Medline: 27132701]"
    },
    {
      "title": "Smartphones and wearable technology: benefits and concerns in cardiology",
      "authors": [
        "D Jin",
        "H Adams",
        "A Cocco",
        "W Martin",
        "S Palmer"
      ],
      "year": 2020,
      "doi": "10.5694/mja2.50446",
      "journal": "Med J Aust",
      "volume": "212",
      "issue": "2",
      "raw": "Smartphones and wearable technology: benefits and concerns in cardiology \n\t\t \n\t\t\t D Jin \n\t\t \n\t\t \n\t\t\t H Adams \n\t\t \n\t\t \n\t\t\t A M Cocco \n\t\t \n\t\t \n\t\t\t W G Martin \n\t\t \n\t\t \n\t\t\t S Palmer \n\t\t \n\t\t 10.5694/mja2.50446 \n\t\t Medline: 31851375 \n\t \n\t \n\t\t Med J Aust \n\t\t \n\t\t\t 212 \n\t\t\t 2 \n\t\t\t \n\t\t\t 2020 \n\t\t \n\t \n\t Jin D, Adams H, Cocco AM, Martin WG, Palmer S. Smartphones and wearable technology: benefits and concerns in cardiology. Med J Aust 2020;212(2):54-6.e1. [doi: 10.5694/mja2.50446] [Medline: 31851375]"
    },
    {
      "title": "The use of eHealth to promote physical activity in cancer survivors: a systematic review",
      "authors": [
        "C Haberlin",
        "O' Dwyer",
        "T Mockler",
        "D Moran",
        "O' Donnell",
        "D Broderick"
      ],
      "year": 2018,
      "doi": "10.1007/s00520-018-4305-z",
      "journal": "Support Care Cancer",
      "volume": "26",
      "issue": "10",
      "raw": "The use of eHealth to promote physical activity in cancer survivors: a systematic review \n\t\t \n\t\t\t C Haberlin \n\t\t \n\t\t \n\t\t\t O' Dwyer \n\t\t \n\t\t \n\t\t\t T Mockler \n\t\t \n\t\t \n\t\t\t D Moran \n\t\t \n\t\t \n\t\t\t J \n\t\t \n\t\t \n\t\t\t O' Donnell \n\t\t \n\t\t \n\t\t\t D M Broderick \n\t\t \n\t\t \n\t\t\t J \n\t\t \n\t\t 10.1007/s00520-018-4305-z \n\t\t Medline: 29909476 \n\t \n\t \n\t\t Support Care Cancer \n\t\t \n\t\t\t 26 \n\t\t\t 10 \n\t\t\t \n\t\t\t 2018 \n\t\t \n\t \n\t Haberlin C, O'Dwyer T, Mockler D, Moran J, O'Donnell DM, Broderick J. The use of eHealth to promote physical activity in cancer survivors: a systematic review. Support Care Cancer 2018;26(10):3323-3336. [doi: 10.1007/s00520-018-4305-z] [Medline: 29909476]"
    },
    {
      "title": "Noninvasive continuous monitoring of vital signs with wearables: fit for medical use?",
      "authors": [
        "M Jacobsen",
        "T Dembek",
        "G Kobbe",
        "P Gaidzik",
        "L Heinemann"
      ],
      "year": 2021,
      "doi": "10.1177/1932296820904947",
      "journal": "J Diabetes Sci Technol",
      "volume": "15",
      "issue": "1",
      "raw": "Noninvasive continuous monitoring of vital signs with wearables: fit for medical use? \n\t\t \n\t\t\t M Jacobsen \n\t\t \n\t\t \n\t\t\t T A Dembek \n\t\t \n\t\t \n\t\t\t G Kobbe \n\t\t \n\t\t \n\t\t\t P W Gaidzik \n\t\t \n\t\t \n\t\t\t L Heinemann \n\t\t \n\t\t 10.1177/1932296820904947 \n\t\t Medline: 32063034 \n\t \n\t \n\t\t J Diabetes Sci Technol \n\t\t \n\t\t\t 15 \n\t\t\t 1 \n\t\t\t \n\t\t\t 2021 \n\t\t \n\t \n\t FREE Full text \n\t Jacobsen M, Dembek TA, Kobbe G, Gaidzik PW, Heinemann L. Noninvasive continuous monitoring of vital signs with wearables: fit for medical use? J Diabetes Sci Technol 2021;15(1):34-43 [FREE Full text] [doi: 10.1177/1932296820904947] [Medline: 32063034]"
    },
    {
      "title": "PRISMA extension for scoping reviews (PRISMA-ScR): checklist and explanation",
      "authors": [
        "A Tricco",
        "Lillie Zarin",
        "O' Brien",
        "K Colquhoun",
        "H Levac"
      ],
      "year": 2018,
      "doi": "10.7326/m18-0850",
      "journal": "Ann Intern Med",
      "volume": "169",
      "issue": "7",
      "raw": "PRISMA extension for scoping reviews (PRISMA-ScR): checklist and explanation \n\t\t \n\t\t\t A C Tricco \n\t\t \n\t\t \n\t\t\t Lillie E Zarin \n\t\t \n\t\t \n\t\t\t W \n\t\t \n\t\t \n\t\t\t O' Brien \n\t\t \n\t\t \n\t\t\t K K Colquhoun \n\t\t \n\t\t \n\t\t\t H Levac \n\t\t \n\t\t \n\t\t\t D \n\t\t \n\t\t 10.7326/m18-0850 \n\t\t Medline: 30178033 \n\t \n\t \n\t\t Ann Intern Med \n\t\t \n\t\t\t 169 \n\t\t\t 7 \n\t\t\t \n\t\t\t 2018 \n\t\t \n\t \n\t Tricco AC, Lillie E, Zarin W, O'Brien KK, Colquhoun H, Levac D, et al. PRISMA extension for scoping reviews (PRISMA-ScR): checklist and explanation. Ann Intern Med 2018;169(7):467-473. [doi: 10.7326/M18-0850] [Medline: 30178033]"
    },
    {
      "title": "Scoping studies: towards a methodological framework",
      "authors": [
        "H Arksey",
        "O' Malley"
      ],
      "year": 2005,
      "doi": "10.1080/1364557032000119616",
      "journal": "Int J Soc Res Methodol",
      "volume": "8",
      "issue": "1",
      "raw": "Scoping studies: towards a methodological framework \n\t\t \n\t\t\t H Arksey \n\t\t \n\t\t \n\t\t\t O' Malley \n\t\t \n\t\t \n\t\t\t L \n\t\t \n\t\t 10.1080/1364557032000119616 \n\t \n\t \n\t\t Int J Soc Res Methodol \n\t\t \n\t\t\t 8 \n\t\t\t 1 \n\t\t\t \n\t\t\t 2005 \n\t\t \n\t \n\t Arksey H, O'Malley L. Scoping studies: towards a methodological framework. Int J Soc Res Methodol 2005;8(1):19-32. [doi: 10.1080/1364557032000119616]"
    },
    {
      "title": "Guidance for conducting systematic scoping reviews",
      "authors": [
        "M Peters",
        "C Godfrey",
        "H Khalil",
        "P Mcinerney",
        "D Parker",
        "C Soares"
      ],
      "year": 2015,
      "doi": "10.1097/xeb.0000000000000050",
      "journal": "Int J Evid Based Healthc",
      "volume": "13",
      "issue": "3",
      "raw": "Guidance for conducting systematic scoping reviews \n\t\t \n\t\t\t M D Peters \n\t\t \n\t\t \n\t\t\t C M Godfrey \n\t\t \n\t\t \n\t\t\t H Khalil \n\t\t \n\t\t \n\t\t\t P Mcinerney \n\t\t \n\t\t \n\t\t\t D Parker \n\t\t \n\t\t \n\t\t\t C B Soares \n\t\t \n\t\t 10.1097/xeb.0000000000000050 \n\t\t Medline: 26134548 \n\t \n\t \n\t\t Int J Evid Based Healthc \n\t\t \n\t\t\t 13 \n\t\t\t 3 \n\t\t\t \n\t\t\t 2015 \n\t\t \n\t \n\t Peters MD, Godfrey CM, Khalil H, McInerney P, Parker D, Soares CB. Guidance for conducting systematic scoping reviews. Int J Evid Based Healthc 2015;13(3):141-146. [doi: 10.1097/XEB.0000000000000050] [Medline: 26134548]"
    },
    {
      "title": "Critical care: the eight vital signs of patient monitoring",
      "authors": [
        "M Elliott",
        "A Coventry"
      ],
      "year": 2012,
      "doi": "10.12968/bjon.2012.21.10.621",
      "journal": "Br J Nurs",
      "volume": "21",
      "issue": "10",
      "raw": "Critical care: the eight vital signs of patient monitoring \n\t\t \n\t\t\t M Elliott \n\t\t \n\t\t \n\t\t\t A Coventry \n\t\t \n\t\t 10.12968/bjon.2012.21.10.621 \n\t\t Medline: 22875303 \n\t \n\t \n\t\t Br J Nurs \n\t\t \n\t\t\t 21 \n\t\t\t 10 \n\t\t\t \n\t\t\t 2012 \n\t\t \n\t \n\t Elliott M, Coventry A. Critical care: the eight vital signs of patient monitoring. Br J Nurs 2012;21(10):621-625. [doi: 10.12968/bjon.2012.21.10.621] [Medline: 22875303]"
    },
    {
      "title": "Wearable health devices-vital sign monitoring, systems and technologies",
      "authors": [
        "D Dias",
        "Paulo Silva Cunha"
      ],
      "year": 2018,
      "doi": "10.3390/s18082414",
      "journal": "Sensors",
      "volume": "18",
      "issue": "8",
      "pages": "2414",
      "raw": "Wearable health devices-vital sign monitoring, systems and technologies \n\t\t \n\t\t\t D Dias \n\t\t \n\t\t \n\t\t\t Paulo Silva Cunha \n\t\t \n\t\t \n\t\t\t J \n\t\t \n\t\t 10.3390/s18082414 \n\t\t Medline: 30044415 \n\t \n\t \n\t\t Sensors \n\t\t \n\t\t\t 18 \n\t\t\t 8 \n\t\t\t 2414 \n\t\t\t 2018 \n\t\t\t Basel \n\t\t \n\t \n\t FREE Full text \n\t Dias D, Paulo Silva Cunha J. Wearable health devices-vital sign monitoring, systems and technologies. Sensors (Basel) 2018;18(8):2414 [FREE Full text] [doi: 10.3390/s18082414] [Medline: 30044415]"
    },
    {
      "title": "Sensors and functionalities of non-invasive wrist-wearable devices: a review",
      "authors": [
        "A Kami\u0161ali\u0107",
        "I Fister",
        "M Turkanovi\u0107",
        "S Karakati\u010d"
      ],
      "year": 2018,
      "doi": "10.3390/s18061714",
      "journal": "Sensors",
      "volume": "18",
      "issue": "6",
      "pages": "1714",
      "raw": "Sensors and functionalities of non-invasive wrist-wearable devices: a review \n\t\t \n\t\t\t A Kami\u0161ali\u0107 \n\t\t \n\t\t \n\t\t\t I Fister Jr \n\t\t \n\t\t \n\t\t\t M Turkanovi\u0107 \n\t\t \n\t\t \n\t\t\t S Karakati\u010d \n\t\t \n\t\t 10.3390/s18061714 \n\t\t Medline: 29799504 \n\t \n\t \n\t\t Sensors \n\t\t \n\t\t\t 18 \n\t\t\t 6 \n\t\t\t 1714 \n\t\t\t 2018 \n\t\t\t Basel \n\t\t \n\t \n\t FREE Full text \n\t Kami\u0161ali\u0107 A, Fister Jr I, Turkanovi\u0107 M, Karakati\u010d S. Sensors and functionalities of non-invasive wrist-wearable devices: a review. Sensors (Basel) 2018;18(6):1714 [FREE Full text] [doi: 10.3390/s18061714] [Medline: 29799504]"
    },
    {
      "title": "Wearable devices market share",
      "year": 2021,
      "doi": "10.1201/b18322-29",
      "raw": "10.1201/b18322-29 \n\t\t \n\t\t Wearable devices market share \n\t\t \n\t\t\t IDC Corporate USA \n\t\t\t 2021. 2021-07-13 \n\t\t \n\t \n\t International Data Corporation. Wearable devices market share. IDC Corporate USA. 2021. URL: https://www.idc.com/ promo/wearablevendor/vendor [accessed 2021-07-13] 40"
    },
    {
      "title": "Wearables shipments worldwide market share 2014-2021",
      "authors": [
        "L Vailshery"
      ],
      "year": 2021,
      "doi": "10.2514/6.2023-4110.vid",
      "raw": "L S Vailshery \n\t\t \n\t\t 10.2514/6.2023-4110.vid \n\t\t \n\t\t Wearables shipments worldwide market share 2014-2021 \n\t\t \n\t\t\t Statista \n\t\t\t 2021. 2021-07-13 \n\t\t \n\t \n\t by vendor \n\t Vailshery LS. Wearables shipments worldwide market share 2014-2021, by vendor. Statista. 2021. URL: https://www. statista.com/statistics/435944/quarterly-wearables-shipments-worldwide-market-share-by-vendor/ [accessed 2021-07-13]"
    },
    {
      "title": "Covidence systematic review software",
      "year": 2021,
      "doi": "10.5596/c14-016",
      "raw": "10.5596/c14-016 \n\t\t \n\t\t Covidence systematic review software \n\t\t Covidence; Melbourne \n\t\t \n\t\t\t Veritas Health Innovation \n\t\t\t 2021-03-15 \n\t\t \n\t \n\t Covidence systematic review software. Covidence. Melbourne: Veritas Health Innovation URL: https://www.covidence.org/ [accessed 2021-03-15]"
    },
    {
      "title": "Fairfax: Roy Rosenzweig Center for History and New Media",
      "year": 2021,
      "raw": "Fairfax: Roy Rosenzweig Center for History and New Media \n\t\t \n\t\t\t 2021-03-15 \n\t\t \n\t \n\t Roy Rosenzweig Center for History and New Media \n\t Zotero. Roy Rosenzweig Center for History and New Media. Fairfax: Roy Rosenzweig Center for History and New Media URL: https://www.zotero.org/download/ [accessed 2021-03-15]"
    },
    {
      "title": "Appraising the quality of medical education research methods: the medical education research study quality instrument and the newcastle-ottawa scale-education",
      "authors": [
        "D Cook",
        "Reed Da"
      ],
      "year": 2015,
      "doi": "10.1097/acm.0000000000000786",
      "journal": "Acad Med",
      "volume": "90",
      "issue": "8",
      "raw": "Appraising the quality of medical education research methods: the medical education research study quality instrument and the newcastle-ottawa scale-education \n\t\t \n\t\t\t D A Cook \n\t\t \n\t\t \n\t\t\t Reed Da \n\t\t \n\t\t 10.1097/acm.0000000000000786 \n\t\t Medline: 26107881 \n\t \n\t \n\t\t Acad Med \n\t\t \n\t\t\t 90 \n\t\t\t 8 \n\t\t\t \n\t\t\t 2015 \n\t\t \n\t \n\t Cook DA, Reed DA. Appraising the quality of medical education research methods: the medical education research study quality instrument and the newcastle-ottawa scale-education. Acad Med 2015;90(8):1067-1076. [doi: 10.1097/ACM.0000000000000786] [Medline: 26107881]"
    },
    {
      "title": "Physical activity monitors can be successfully implemented to assess perioperative activity in urologic surgery",
      "authors": [
        "D Agarwal",
        "B Viers",
        "M Rivera",
        "D Nienow",
        "I Frank",
        "M Tollefson"
      ],
      "year": 2018,
      "doi": "10.21037/mhealth.2018.09.05",
      "journal": "Mhealth",
      "volume": "4",
      "pages": "43",
      "raw": "Physical activity monitors can be successfully implemented to assess perioperative activity in urologic surgery \n\t\t \n\t\t\t D K Agarwal \n\t\t \n\t\t \n\t\t\t B R Viers \n\t\t \n\t\t \n\t\t\t M E Rivera \n\t\t \n\t\t \n\t\t\t D A Nienow \n\t\t \n\t\t \n\t\t\t I Frank \n\t\t \n\t\t \n\t\t\t M K Tollefson \n\t\t \n\t\t 10.21037/mhealth.2018.09.05 \n\t\t Medline: 30363722 \n\t \n\t \n\t\t Mhealth \n\t\t \n\t\t\t 4 \n\t\t\t 43 \n\t\t\t 2018 \n\t\t \n\t \n\t FREE Full text \n\t Agarwal DK, Viers BR, Rivera ME, Nienow DA, Frank I, Tollefson MK, et al. Physical activity monitors can be successfully implemented to assess perioperative activity in urologic surgery. Mhealth 2018;4:43 [FREE Full text] [doi: 10.21037/mhealth.2018.09.05] [Medline: 30363722]"
    },
    {
      "title": "Impact of Ramadan on physical activity and sleeping patterns in individuals with type 2 diabetes: the first study using fitbit device",
      "authors": [
        "A Alghamdi",
        "K Alghamdi",
        "R Jenkins",
        "M Alghamdi",
        "P Haris"
      ],
      "year": 2020,
      "doi": "10.1007/s13300-020-00825-x",
      "journal": "Diabetes Ther",
      "volume": "11",
      "issue": "6",
      "raw": "Impact of Ramadan on physical activity and sleeping patterns in individuals with type 2 diabetes: the first study using fitbit device \n\t\t \n\t\t\t A S Alghamdi \n\t\t \n\t\t \n\t\t\t K A Alghamdi \n\t\t \n\t\t \n\t\t\t R O Jenkins \n\t\t \n\t\t \n\t\t\t M N Alghamdi \n\t\t \n\t\t \n\t\t\t P I Haris \n\t\t \n\t\t 10.1007/s13300-020-00825-x \n\t\t Medline: 32367477 \n\t \n\t \n\t\t Diabetes Ther \n\t\t \n\t\t\t 11 \n\t\t\t 6 \n\t\t\t \n\t\t\t 2020 \n\t\t \n\t \n\t FREE Full text \n\t Alghamdi AS, Alghamdi KA, Jenkins RO, Alghamdi MN, Haris PI. Impact of Ramadan on physical activity and sleeping patterns in individuals with type 2 diabetes: the first study using fitbit device. Diabetes Ther 2020;11(6):1331-1346 [FREE Full text] [doi: 10.1007/s13300-020-00825-x] [Medline: 32367477]"
    },
    {
      "title": "Body fat is related to sedentary behavior and light physical activity but not to moderate-vigorous physical activity in type 2 diabetes mellitus",
      "authors": [
        "K An",
        "K Han",
        "T Sohn",
        "I Park",
        "H Kim",
        "S Moon"
      ],
      "year": 2020,
      "doi": "10.4093/dmj.2019.0029",
      "journal": "Diabetes Metab J",
      "volume": "44",
      "issue": "2",
      "raw": "Body fat is related to sedentary behavior and light physical activity but not to moderate-vigorous physical activity in type 2 diabetes mellitus \n\t\t \n\t\t\t K H An \n\t\t \n\t\t \n\t\t\t K A Han \n\t\t \n\t\t \n\t\t\t T S Sohn \n\t\t \n\t\t \n\t\t\t I B Park \n\t\t \n\t\t \n\t\t\t H J Kim \n\t\t \n\t\t \n\t\t\t S D Moon \n\t\t \n\t\t 10.4093/dmj.2019.0029 \n\t\t Medline: 31769237 \n\t \n\t \n\t\t Diabetes Metab J \n\t\t \n\t\t\t 44 \n\t\t\t 2 \n\t\t\t \n\t\t\t 2020 \n\t\t \n\t \n\t FREE Full text \n\t An KH, Han KA, Sohn TS, Park IB, Kim HJ, Moon SD, et al. Body fat is related to sedentary behavior and light physical activity but not to moderate-vigorous physical activity in type 2 diabetes mellitus. Diabetes Metab J 2020;44(2):316-325 [FREE Full text] [doi: 10.4093/dmj.2019.0029] [Medline: 31769237]"
    },
    {
      "title": "Daily relations between social perceptions and physical activity among college women",
      "authors": [
        "D Arigo",
        "K Pasko",
        "J Mogle"
      ],
      "year": 2020,
      "doi": "10.1016/j.psychsport.2019.04.018",
      "journal": "Psychol Sport Exerc",
      "volume": "47",
      "pages": "101528",
      "raw": "Daily relations between social perceptions and physical activity among college women \n\t\t \n\t\t\t D Arigo \n\t\t \n\t\t \n\t\t\t K Pasko \n\t\t \n\t\t \n\t\t\t J A Mogle \n\t\t \n\t\t 10.1016/j.psychsport.2019.04.018 \n\t\t Medline: 32831642 \n\t \n\t \n\t\t Psychol Sport Exerc \n\t\t \n\t\t\t 47 \n\t\t\t 101528 \n\t\t\t 2020 \n\t\t \n\t \n\t FREE Full text \n\t Arigo D, Pasko K, Mogle JA. Daily relations between social perceptions and physical activity among college women. Psychol Sport Exerc 2020;47:101528 [FREE Full text] [doi: 10.1016/j.psychsport.2019.04.018] [Medline: 32831642]"
    },
    {
      "title": "Assessing the correlation between physical activity and quality of life in advanced lung cancer",
      "authors": [
        "B Bade",
        "M Brooks",
        "S Nietert",
        "A Ulmer",
        "D Thomas",
        "P Nietert"
      ],
      "year": 2018,
      "doi": "10.1177/1534735416684016",
      "journal": "Integr Cancer Ther",
      "volume": "17",
      "issue": "1",
      "raw": "Assessing the correlation between physical activity and quality of life in advanced lung cancer \n\t\t \n\t\t\t B C Bade \n\t\t \n\t\t \n\t\t\t M C Brooks \n\t\t \n\t\t \n\t\t\t S B Nietert \n\t\t \n\t\t \n\t\t\t A Ulmer \n\t\t \n\t\t \n\t\t\t D D Thomas \n\t\t \n\t\t \n\t\t\t P J Nietert \n\t\t \n\t\t 10.1177/1534735416684016 \n\t\t Medline: 28024420 \n\t \n\t \n\t\t Integr Cancer Ther \n\t\t \n\t\t\t 17 \n\t\t\t 1 \n\t\t\t \n\t\t\t 2018 \n\t\t \n\t \n\t FREE Full text \n\t Bade BC, Brooks MC, Nietert SB, Ulmer A, Thomas DD, Nietert PJ, et al. Assessing the correlation between physical activity and quality of life in advanced lung cancer. Integr Cancer Ther 2018;17(1):73-79 [FREE Full text] [doi: 10.1177/1534735416684016] [Medline: 28024420]"
    },
    {
      "title": "Use of free-living step count monitoring for heart failure functional classification: validation study",
      "authors": [
        "J Baril",
        "S Bromberg",
        "Y Moayedi",
        "B Taati",
        "C Manlhiot",
        "H Ross"
      ],
      "year": 2019,
      "doi": "10.2196/12122",
      "journal": "JMIR Cardio",
      "volume": "3",
      "issue": "1",
      "pages": "12122",
      "raw": "Use of free-living step count monitoring for heart failure functional classification: validation study \n\t\t \n\t\t\t J F Baril \n\t\t \n\t\t \n\t\t\t S Bromberg \n\t\t \n\t\t \n\t\t\t Y Moayedi \n\t\t \n\t\t \n\t\t\t B Taati \n\t\t \n\t\t \n\t\t\t C Manlhiot \n\t\t \n\t\t \n\t\t\t H J Ross \n\t\t \n\t\t 10.2196/12122 \n\t\t Medline: 31758777 \n\t \n\t \n\t\t JMIR Cardio \n\t\t \n\t\t\t 3 \n\t\t\t 1 \n\t\t\t 12122 \n\t\t\t 2019 \n\t\t \n\t \n\t FREE Full text \n\t Baril JF, Bromberg S, Moayedi Y, Taati B, Manlhiot C, Ross HJ, et al. Use of free-living step count monitoring for heart failure functional classification: validation study. JMIR Cardio 2019;3(1):e12122 [FREE Full text] [doi: 10.2196/12122] [Medline: 31758777]"
    },
    {
      "title": "Feasibility of low-cost accelerometers in measuring functional recovery after major oncologic surgery",
      "authors": [
        "R Barkley",
        "M Khalil",
        "P Shen",
        "E Levine",
        "K Votanopoulos",
        "C Clark"
      ],
      "year": 2019,
      "doi": "10.1002/jso.25789",
      "journal": "J Surg Oncol",
      "volume": "121",
      "issue": "2",
      "raw": "Feasibility of low-cost accelerometers in measuring functional recovery after major oncologic surgery \n\t\t \n\t\t\t R Barkley \n\t\t \n\t\t \n\t\t\t M Khalil \n\t\t \n\t\t \n\t\t\t P Shen \n\t\t \n\t\t \n\t\t\t E A Levine \n\t\t \n\t\t \n\t\t\t K Votanopoulos \n\t\t \n\t\t \n\t\t\t C J Clark \n\t\t \n\t\t 10.1002/jso.25789 \n\t\t Medline: 31782174 \n\t \n\t \n\t\t J Surg Oncol \n\t\t \n\t\t\t 121 \n\t\t\t 2 \n\t\t\t \n\t\t\t 2019 \n\t\t \n\t \n\t Barkley R, Khalil M, Shen P, Levine EA, Votanopoulos K, Clark CJ. Feasibility of low-cost accelerometers in measuring functional recovery after major oncologic surgery. J Surg Oncol 2019;121(2):279-285. [doi: 10.1002/jso.25789] [Medline: 31782174]"
    },
    {
      "title": "Comparison of 24-hour Holter monitoring with 14-day novel adhesive patch electrocardiographic monitoring",
      "authors": [
        "P Barrett",
        "R Komatireddy",
        "S Haaser",
        "S Topol",
        "J Sheard",
        "J Encinas"
      ],
      "year": 2014,
      "doi": "10.1016/j.amjmed.2013.10.003",
      "journal": "Am J Med",
      "volume": "127",
      "issue": "1",
      "raw": "Comparison of 24-hour Holter monitoring with 14-day novel adhesive patch electrocardiographic monitoring \n\t\t \n\t\t\t P M Barrett \n\t\t \n\t\t \n\t\t\t R Komatireddy \n\t\t \n\t\t \n\t\t\t S Haaser \n\t\t \n\t\t \n\t\t\t S Topol \n\t\t \n\t\t \n\t\t\t J Sheard \n\t\t \n\t\t \n\t\t\t J Encinas \n\t\t \n\t\t 10.1016/j.amjmed.2013.10.003 \n\t\t Medline: 24384108 \n\t \n\t \n\t\t Am J Med \n\t\t \n\t\t\t 127 \n\t\t\t 1 \n\t\t\t \n\t\t\t 2014 \n\t\t \n\t \n\t FREE Full text \n\t Barrett PM, Komatireddy R, Haaser S, Topol S, Sheard J, Encinas J, et al. Comparison of 24-hour Holter monitoring with 14-day novel adhesive patch electrocardiographic monitoring. Am J Med 2014;127(1):95.e11-95.e17 [FREE Full text] [doi: 10.1016/j.amjmed.2013.10.003] [Medline: 24384108]"
    },
    {
      "title": "Self-reported and objectively measured physical activity levels among Hispanic/Latino adults with type 2 diabetes",
      "authors": [
        "W Bevier",
        "N Glantz",
        "C Hoppe",
        "Morales Glass",
        "J Larez",
        "A Chen"
      ],
      "year": 2020,
      "doi": "10.1136/bmjdrc-2019-000893",
      "journal": "BMJ Open Diabetes Res Care",
      "volume": "8",
      "issue": "1",
      "pages": "893",
      "raw": "Self-reported and objectively measured physical activity levels among Hispanic/Latino adults with type 2 diabetes \n\t\t \n\t\t\t W Bevier \n\t\t \n\t\t \n\t\t\t N Glantz \n\t\t \n\t\t \n\t\t\t C Hoppe \n\t\t \n\t\t \n\t\t\t Morales Glass \n\t\t \n\t\t \n\t\t\t J Larez \n\t\t \n\t\t \n\t\t\t A Chen \n\t\t \n\t\t \n\t\t\t K \n\t\t \n\t\t 10.1136/bmjdrc-2019-000893 \n\t\t Medline: 32169933 \n\t \n\t \n\t\t BMJ Open Diabetes Res Care \n\t\t \n\t\t\t 8 \n\t\t\t 1 \n\t\t\t 893 \n\t\t\t 2020 \n\t\t \n\t \n\t FREE Full text \n\t Bevier W, Glantz N, Hoppe C, Morales Glass J, Larez A, Chen K, et al. Self-reported and objectively measured physical activity levels among Hispanic/Latino adults with type 2 diabetes. BMJ Open Diabetes Res Care 2020;8(1):e000893 [FREE Full text] [doi: 10.1136/bmjdrc-2019-000893] [Medline: 32169933]"
    },
    {
      "title": "Exploring the association between self-reported asthma impact and fitbit-derived sleep quality and physical activity measures in adolescents",
      "authors": [
        "J Bian",
        "Y Guo",
        "M Xie",
        "A Parish",
        "I Wardlaw",
        "R Brown"
      ],
      "year": 2017,
      "doi": "10.2196/mhealth.7346",
      "journal": "JMIR Mhealth Uhealth",
      "volume": "5",
      "issue": "7",
      "pages": "105",
      "raw": "Exploring the association between self-reported asthma impact and fitbit-derived sleep quality and physical activity measures in adolescents \n\t\t \n\t\t\t J Bian \n\t\t \n\t\t \n\t\t\t Y Guo \n\t\t \n\t\t \n\t\t\t M Xie \n\t\t \n\t\t \n\t\t\t A E Parish \n\t\t \n\t\t \n\t\t\t I Wardlaw \n\t\t \n\t\t \n\t\t\t R Brown \n\t\t \n\t\t 10.2196/mhealth.7346 \n\t\t Medline: 28743679 \n\t \n\t \n\t\t JMIR Mhealth Uhealth \n\t\t \n\t\t\t 5 \n\t\t\t 7 \n\t\t\t 105 \n\t\t\t 2017 \n\t\t \n\t \n\t FREE Full text \n\t Bian J, Guo Y, Xie M, Parish AE, Wardlaw I, Brown R, et al. Exploring the association between self-reported asthma impact and fitbit-derived sleep quality and physical activity measures in adolescents. JMIR Mhealth Uhealth 2017;5(7):e105 [FREE Full text] [doi: 10.2196/mhealth.7346] [Medline: 28743679]"
    },
    {
      "title": "Heart rate variability during a joint attention task in toddlers with autism spectrum disorders",
      "authors": [
        "L Billeci",
        "A Tonacci",
        "A Narzisi",
        "Z Manigrasso",
        "M Varanini",
        "F Fulceri"
      ],
      "year": 2018,
      "doi": "10.3389/fphys.2018.00467",
      "journal": "Front Physiol",
      "volume": "9",
      "pages": "467",
      "raw": "Heart rate variability during a joint attention task in toddlers with autism spectrum disorders \n\t\t \n\t\t\t L Billeci \n\t\t \n\t\t \n\t\t\t A Tonacci \n\t\t \n\t\t \n\t\t\t A Narzisi \n\t\t \n\t\t \n\t\t\t Z Manigrasso \n\t\t \n\t\t \n\t\t\t M Varanini \n\t\t \n\t\t \n\t\t\t F Fulceri \n\t\t \n\t\t 10.3389/fphys.2018.00467 \n\t\t Medline: 29765335 \n\t \n\t \n\t\t Front Physiol \n\t\t \n\t\t\t 9 \n\t\t\t 467 \n\t\t\t 2018 \n\t\t \n\t \n\t FREE Full text \n\t Billeci L, Tonacci A, Narzisi A, Manigrasso Z, Varanini M, Fulceri F, et al. Heart rate variability during a joint attention task in toddlers with autism spectrum disorders. Front Physiol 2018;9:467 [FREE Full text] [doi: 10.3389/fphys.2018.00467] [Medline: 29765335]"
    },
    {
      "title": "Daily activity measured with wearable technology as a novel measurement of treatment effect in patients with coronary microvascular dysfunction: substudy of a randomized controlled crossover trial",
      "authors": [
        "K Birkeland",
        "R Khandwalla",
        "I Kedan",
        "C Shufelt",
        "P Mehta",
        "M Minissian"
      ],
      "year": 2017,
      "doi": "10.2196/resprot.8057",
      "journal": "JMIR Res Protoc",
      "volume": "6",
      "issue": "12",
      "pages": "255",
      "raw": "Daily activity measured with wearable technology as a novel measurement of treatment effect in patients with coronary microvascular dysfunction: substudy of a randomized controlled crossover trial \n\t\t \n\t\t\t K Birkeland \n\t\t \n\t\t \n\t\t\t R M Khandwalla \n\t\t \n\t\t \n\t\t\t I Kedan \n\t\t \n\t\t \n\t\t\t C L Shufelt \n\t\t \n\t\t \n\t\t\t P K Mehta \n\t\t \n\t\t \n\t\t\t M B Minissian \n\t\t \n\t\t 10.2196/resprot.8057 \n\t\t Medline: 29263019 \n\t \n\t \n\t\t JMIR Res Protoc \n\t\t \n\t\t\t 6 \n\t\t\t 12 \n\t\t\t 255 \n\t\t\t 2017 \n\t\t \n\t \n\t FREE Full text \n\t Birkeland K, Khandwalla RM, Kedan I, Shufelt CL, Mehta PK, Minissian MB, et al. Daily activity measured with wearable technology as a novel measurement of treatment effect in patients with coronary microvascular dysfunction: substudy of a randomized controlled crossover trial. JMIR Res Protoc 2017;6(12):e255 [FREE Full text] [doi: 10.2196/resprot.8057] [Medline: 29263019]"
    },
    {
      "title": "Does education close the black-white physical activity and obesity gaps?",
      "authors": [
        "T Blackshear",
        "L Seyfried"
      ],
      "year": 2021,
      "doi": "10.1080/07448481.2019.1657122",
      "journal": "J Am Coll Health",
      "volume": "69",
      "issue": "2",
      "raw": "Does education close the black-white physical activity and obesity gaps? \n\t\t \n\t\t\t T B Blackshear \n\t\t \n\t\t \n\t\t\t L Seyfried \n\t\t \n\t\t 10.1080/07448481.2019.1657122 \n\t\t Medline: 31765289 \n\t \n\t \n\t\t J Am Coll Health \n\t\t \n\t\t\t 69 \n\t\t\t 2 \n\t\t\t \n\t\t\t 2021 \n\t\t \n\t \n\t Blackshear TB, Seyfried L. Does education close the black-white physical activity and obesity gaps? J Am Coll Health 2021;69(2):222-226. [doi: 10.1080/07448481.2019.1657122] [Medline: 31765289]"
    },
    {
      "title": "Association of continuous assessment of step count by remote monitoring with disability progression among adults with multiple sclerosis",
      "authors": [
        "V Block",
        "R Bove",
        "C Zhao",
        "P Garcha",
        "J Graves",
        "A Romeo"
      ],
      "year": 2019,
      "doi": "10.1001/jamanetworkopen.2019.0570",
      "journal": "JAMA Netw Open",
      "volume": "2",
      "issue": "3",
      "pages": "190570",
      "raw": "Association of continuous assessment of step count by remote monitoring with disability progression among adults with multiple sclerosis \n\t\t \n\t\t\t V J Block \n\t\t \n\t\t \n\t\t\t R Bove \n\t\t \n\t\t \n\t\t\t C Zhao \n\t\t \n\t\t \n\t\t\t P Garcha \n\t\t \n\t\t \n\t\t\t J Graves \n\t\t \n\t\t \n\t\t\t A R Romeo \n\t\t \n\t\t 10.1001/jamanetworkopen.2019.0570 \n\t\t Medline: 30874777 \n\t \n\t \n\t\t JAMA Netw Open \n\t\t \n\t\t\t 2 \n\t\t\t 3 \n\t\t\t 190570 \n\t\t\t 2019 \n\t\t \n\t \n\t FREE Full text \n\t Block VJ, Bove R, Zhao C, Garcha P, Graves J, Romeo AR, et al. Association of continuous assessment of step count by remote monitoring with disability progression among adults with multiple sclerosis. JAMA Netw Open 2019;2(3):e190570 [FREE Full text] [doi: 10.1001/jamanetworkopen.2019.0570] [Medline: 30874777]"
    },
    {
      "title": "Continuous daily assessment of multiple sclerosis disability using remote step count monitoring",
      "authors": [
        "V Block",
        "A Liz\u00e9e",
        "E Crabtree-Hartman",
        "C Bevan",
        "J Graves",
        "R Bove"
      ],
      "year": 2017,
      "doi": "10.1007/s00415-016-8334-6",
      "journal": "J Neurol",
      "volume": "264",
      "issue": "2",
      "raw": "Continuous daily assessment of multiple sclerosis disability using remote step count monitoring \n\t\t \n\t\t\t V J Block \n\t\t \n\t\t \n\t\t\t A Liz\u00e9e \n\t\t \n\t\t \n\t\t\t E Crabtree-Hartman \n\t\t \n\t\t \n\t\t\t C J Bevan \n\t\t \n\t\t \n\t\t\t J S Graves \n\t\t \n\t\t \n\t\t\t R Bove \n\t\t \n\t\t 10.1007/s00415-016-8334-6 \n\t\t Medline: 27896433 \n\t \n\t \n\t\t J Neurol \n\t\t \n\t\t\t 264 \n\t\t\t 2 \n\t\t\t \n\t\t\t 2017 \n\t\t \n\t \n\t Block VJ, Liz\u00e9e A, Crabtree-Hartman E, Bevan CJ, Graves JS, Bove R, et al. Continuous daily assessment of multiple sclerosis disability using remote step count monitoring. J Neurol 2017;264(2):316-326. [doi: 10.1007/s00415-016-8334-6] [Medline: 27896433]"
    },
    {
      "title": "Diagnostic yield of patch ambulatory electrocardiogram monitoring in children (from a national registry)",
      "authors": [
        "M Bolourchi",
        "A Batra"
      ],
      "year": 2015,
      "doi": "10.1016/j.amjcard.2014.12.014",
      "journal": "Am J Cardiol",
      "volume": "115",
      "issue": "5",
      "raw": "Diagnostic yield of patch ambulatory electrocardiogram monitoring in children (from a national registry) \n\t\t \n\t\t\t M Bolourchi \n\t\t \n\t\t \n\t\t\t A S Batra \n\t\t \n\t\t 10.1016/j.amjcard.2014.12.014 \n\t\t Medline: 25591894 \n\t \n\t \n\t\t Am J Cardiol \n\t\t \n\t\t\t 115 \n\t\t\t 5 \n\t\t\t \n\t\t\t 2015 \n\t\t \n\t \n\t Bolourchi M, Batra AS. Diagnostic yield of patch ambulatory electrocardiogram monitoring in children (from a national registry). Am J Cardiol 2015;115(5):630-634. [doi: 10.1016/j.amjcard.2014.12.014] [Medline: 25591894]"
    },
    {
      "title": "Autonomic modulation in Duchenne muscular dystrophy during a computer task: a prospective control trial",
      "authors": [
        "M Alvarez",
        "T Silva",
        "F Favero",
        "V Valenti",
        "R Raimundo",
        "L Vanderlei"
      ],
      "year": 2017,
      "doi": "10.1371/journal.pone.0169633",
      "journal": "PLoS One",
      "volume": "12",
      "issue": "1",
      "pages": "169633",
      "raw": "Autonomic modulation in Duchenne muscular dystrophy during a computer task: a prospective control trial \n\t\t \n\t\t\t M P Alvarez \n\t\t \n\t\t \n\t\t\t T D Silva \n\t\t \n\t\t \n\t\t\t F M Favero \n\t\t \n\t\t \n\t\t\t V E Valenti \n\t\t \n\t\t \n\t\t\t R D Raimundo \n\t\t \n\t\t \n\t\t\t L C Vanderlei \n\t\t \n\t\t 10.1371/journal.pone.0169633 \n\t\t Medline: 28118369 \n\t \n\t \n\t\t PLoS One \n\t\t \n\t\t\t 12 \n\t\t\t 1 \n\t\t\t 169633 \n\t\t\t 2017 \n\t\t \n\t \n\t FREE Full text \n\t Alvarez MP, Silva TD, Favero FM, Valenti VE, Raimundo RD, Vanderlei LC, et al. Autonomic modulation in Duchenne muscular dystrophy during a computer task: a prospective control trial. PLoS One 2017;12(1):e0169633 [FREE Full text] [doi: 10.1371/journal.pone.0169633] [Medline: 28118369]"
    },
    {
      "title": "Brief report: obesogenic behaviors of children with developmental disabilities during summer",
      "authors": [
        "K Brazendale",
        "A Brazendale",
        "J Garcia",
        "C Monroe",
        "R Weaver",
        "M Beets"
      ],
      "year": 2021,
      "doi": "10.1007/s10803-020-04566-5",
      "journal": "J Autism Dev Disord",
      "volume": "51",
      "issue": "2",
      "raw": "Brief report: obesogenic behaviors of children with developmental disabilities during summer \n\t\t \n\t\t\t K Brazendale \n\t\t \n\t\t \n\t\t\t A B Brazendale \n\t\t \n\t\t \n\t\t\t J M Garcia \n\t\t \n\t\t \n\t\t\t C M Monroe \n\t\t \n\t\t \n\t\t\t R G Weaver \n\t\t \n\t\t \n\t\t\t M W Beets \n\t\t \n\t\t 10.1007/s10803-020-04566-5 \n\t\t Medline: 32533383 \n\t \n\t \n\t\t J Autism Dev Disord \n\t\t \n\t\t\t 51 \n\t\t\t 2 \n\t\t\t \n\t\t\t 2021 \n\t\t \n\t \n\t Brazendale K, Brazendale AB, Garcia JM, Monroe CM, Weaver RG, Beets MW. Brief report: obesogenic behaviors of children with developmental disabilities during summer. J Autism Dev Disord 2021;51(2):734-740. [doi: 10.1007/s10803-020-04566-5] [Medline: 32533383]"
    },
    {
      "title": "Children with congenital heart disease are active but need to keep moving: a cross-sectional study using wrist-worn physical activity trackers",
      "authors": [
        "L Brudy",
        "J Hock",
        "A H\u00e4cker",
        "M Meyer",
        "R Oberhoffer",
        "A Hager"
      ],
      "year": 2020,
      "doi": "10.1016/j.jpeds.2019.09.077",
      "journal": "J Pediatr",
      "volume": "217",
      "raw": "Children with congenital heart disease are active but need to keep moving: a cross-sectional study using wrist-worn physical activity trackers \n\t\t \n\t\t\t L Brudy \n\t\t \n\t\t \n\t\t\t J Hock \n\t\t \n\t\t \n\t\t\t A L H\u00e4cker \n\t\t \n\t\t \n\t\t\t M Meyer \n\t\t \n\t\t \n\t\t\t R Oberhoffer \n\t\t \n\t\t \n\t\t\t A Hager \n\t\t \n\t\t 10.1016/j.jpeds.2019.09.077 \n\t\t Medline: 31740142 \n\t \n\t \n\t\t J Pediatr \n\t\t \n\t\t\t 217 \n\t\t\t \n\t\t\t 2020 \n\t\t \n\t \n\t Brudy L, Hock J, H\u00e4cker AL, Meyer M, Oberhoffer R, Hager A, et al. Children with congenital heart disease are active but need to keep moving: a cross-sectional study using wrist-worn physical activity trackers. J Pediatr 2020;217:13-19. [doi: 10.1016/j.jpeds.2019.09.077] [Medline: 31740142]"
    },
    {
      "title": "The use of the intensity gradient and average acceleration metrics to explore associations with BMI z-score in children",
      "authors": [
        "D Buchan",
        "G Mclellan",
        "S Donnelly",
        "R Arthur"
      ],
      "year": 2019,
      "doi": "10.1080/02640414.2019.1664536",
      "journal": "J Sports Sci",
      "volume": "37",
      "issue": "23",
      "raw": "The use of the intensity gradient and average acceleration metrics to explore associations with BMI z-score in children \n\t\t \n\t\t\t D S Buchan \n\t\t \n\t\t \n\t\t\t G Mclellan \n\t\t \n\t\t \n\t\t\t S Donnelly \n\t\t \n\t\t \n\t\t\t R Arthur \n\t\t \n\t\t 10.1080/02640414.2019.1664536 \n\t\t Medline: 31506039 \n\t \n\t \n\t\t J Sports Sci \n\t\t \n\t\t\t 37 \n\t\t\t 23 \n\t\t\t \n\t\t\t 2019 \n\t\t \n\t \n\t Buchan DS, McLellan G, Donnelly S, Arthur R. The use of the intensity gradient and average acceleration metrics to explore associations with BMI z-score in children. J Sports Sci 2019;37(23):2751-2758. [doi: 10.1080/02640414.2019.1664536] [Medline: 31506039]"
    },
    {
      "title": "Accessibility and feasibility of using technology to support mindfulness practice, reduce stress and promote long term mental health",
      "authors": [
        "I Burnett-Zeigler",
        "E Waldron",
        "S Hong",
        "A Yang",
        "K Wisner",
        "J Ciolino"
      ],
      "year": 2018,
      "doi": "10.1016/j.ctcp.2018.09.001",
      "journal": "Complement Ther Clin Pract",
      "volume": "33",
      "raw": "Accessibility and feasibility of using technology to support mindfulness practice, reduce stress and promote long term mental health \n\t\t \n\t\t\t I E Burnett-Zeigler \n\t\t \n\t\t \n\t\t\t E M Waldron \n\t\t \n\t\t \n\t\t\t S Hong \n\t\t \n\t\t \n\t\t\t A Yang \n\t\t \n\t\t \n\t\t\t K L Wisner \n\t\t \n\t\t \n\t\t\t J D Ciolino \n\t\t \n\t\t 10.1016/j.ctcp.2018.09.001 \n\t\t Medline: 30396633 \n\t \n\t \n\t\t Complement Ther Clin Pract \n\t\t \n\t\t\t 33 \n\t\t\t \n\t\t\t 2018 \n\t\t \n\t \n\t Burnett-Zeigler IE, Waldron EM, Hong S, Yang A, Wisner KL, Ciolino JD. Accessibility and feasibility of using technology to support mindfulness practice, reduce stress and promote long term mental health. Complement Ther Clin Pract 2018;33:93-99. [doi: 10.1016/j.ctcp.2018.09.001] [Medline: 30396633]"
    },
    {
      "title": "I-ACT: integrated study on effect of activity on complications in pregnancy: study protocol of a multiethnic prospective cohort study",
      "authors": [
        "M Cai",
        "K Tan",
        "S Ang"
      ],
      "year": 2019,
      "doi": "10.1136/bmjopen-2018-025970",
      "journal": "BMJ Open",
      "volume": "9",
      "issue": "4",
      "pages": "25970",
      "raw": "I-ACT: integrated study on effect of activity on complications in pregnancy: study protocol of a multiethnic prospective cohort study \n\t\t \n\t\t\t M Cai \n\t\t \n\t\t \n\t\t\t K H Tan \n\t\t \n\t\t \n\t\t\t S B Ang \n\t\t \n\t\t 10.1136/bmjopen-2018-025970 \n\t\t Medline: 30948592 \n\t \n\t \n\t\t BMJ Open \n\t\t \n\t\t\t 9 \n\t\t\t 4 \n\t\t\t 25970 \n\t\t\t 2019 \n\t\t \n\t \n\t FREE Full text \n\t Cai M, Tan KH, Ang SB. I-ACT: integrated study on effect of activity on complications in pregnancy: study protocol of a multiethnic prospective cohort study. BMJ Open 2019;9(4):e025970 [FREE Full text] [doi: 10.1136/bmjopen-2018-025970] [Medline: 30948592]"
    },
    {
      "title": "Physical activity monitoring and acceptance of a commercial activity tracker in adult patients with haemophilia",
      "authors": [
        "J Carrasco",
        "S P\u00e9rez-Alenda",
        "J Casa\u00f1a",
        "E Soria-Olivas",
        "S Bonanad",
        "F Querol"
      ],
      "year": 2019,
      "doi": "10.3390/ijerph16203851",
      "journal": "Int J Environ Res Public Health",
      "volume": "16",
      "issue": "20",
      "pages": "3851",
      "raw": "Physical activity monitoring and acceptance of a commercial activity tracker in adult patients with haemophilia \n\t\t \n\t\t\t J J Carrasco \n\t\t \n\t\t \n\t\t\t S P\u00e9rez-Alenda \n\t\t \n\t\t \n\t\t\t J Casa\u00f1a \n\t\t \n\t\t \n\t\t\t E Soria-Olivas \n\t\t \n\t\t \n\t\t\t S Bonanad \n\t\t \n\t\t \n\t\t\t F Querol \n\t\t \n\t\t 10.3390/ijerph16203851 \n\t\t Medline: 31614706 \n\t \n\t \n\t\t Int J Environ Res Public Health \n\t\t \n\t\t\t 16 \n\t\t\t 20 \n\t\t\t 3851 \n\t\t\t 2019 \n\t\t \n\t \n\t FREE Full text \n\t Carrasco JJ, P\u00e9rez-Alenda S, Casa\u00f1a J, Soria-Olivas E, Bonanad S, Querol F. Physical activity monitoring and acceptance of a commercial activity tracker in adult patients with haemophilia. Int J Environ Res Public Health 2019;16(20):3851 [FREE Full text] [doi: 10.3390/ijerph16203851] [Medline: 31614706]"
    },
    {
      "title": "Barriers to physical activity in patients with pulmonary hypertension",
      "authors": [
        "T Cascino",
        "V Mclaughlin",
        "C Richardson",
        "N Behbahani-Nejad",
        "V Moles",
        "S Visovatti"
      ],
      "year": 2019,
      "doi": "10.1177/2045894019847895",
      "journal": "Pulm Circ",
      "volume": "9",
      "issue": "2",
      "pages": "2045894019847895",
      "raw": "Barriers to physical activity in patients with pulmonary hypertension \n\t\t \n\t\t\t T M Cascino \n\t\t \n\t\t \n\t\t\t V V Mclaughlin \n\t\t \n\t\t \n\t\t\t C R Richardson \n\t\t \n\t\t \n\t\t\t N Behbahani-Nejad \n\t\t \n\t\t \n\t\t\t V M Moles \n\t\t \n\t\t \n\t\t\t S H Visovatti \n\t\t \n\t\t 10.1177/2045894019847895 \n\t\t Medline: 30983524 \n\t \n\t \n\t\t Pulm Circ \n\t\t \n\t\t\t 9 \n\t\t\t 2 \n\t\t\t 2045894019847895 \n\t\t\t 2019 \n\t\t \n\t \n\t FREE Full text \n\t Cascino TM, McLaughlin VV, Richardson CR, Behbahani-Nejad N, Moles VM, Visovatti SH, et al. Barriers to physical activity in patients with pulmonary hypertension. Pulm Circ 2019;9(2):2045894019847895 [FREE Full text] [doi: 10.1177/2045894019847895] [Medline: 30983524]"
    },
    {
      "title": "Physical activity and cognitive function in mild cognitive impairment",
      "authors": [
        "Y Chang"
      ],
      "year": 2020,
      "doi": "10.1177/1759091419901182",
      "journal": "ASN Neuro",
      "volume": "12",
      "pages": "1759091419901182",
      "raw": "Physical activity and cognitive function in mild cognitive impairment \n\t\t \n\t\t\t Y T Chang \n\t\t \n\t\t 10.1177/1759091419901182 \n\t\t Medline: 31948261 \n\t \n\t \n\t\t ASN Neuro \n\t\t \n\t\t\t 12 \n\t\t\t 1759091419901182 \n\t\t\t 2020 \n\t\t \n\t \n\t FREE Full text \n\t Chang YT. Physical activity and cognitive function in mild cognitive impairment. ASN Neuro 2020;12:1759091419901182 [FREE Full text] [doi: 10.1177/1759091419901182] [Medline: 31948261]"
    },
    {
      "title": "Night-time voids, level of bother and sleep characteristics in a non-patient population of wearable devices users",
      "authors": [
        "C Chapple",
        "D Bliwise",
        "L Maislisch",
        "E Roitmann",
        "T Burtea"
      ],
      "year": 2020,
      "doi": "10.1111/ijcp.13495",
      "journal": "Int J Clin Pract",
      "volume": "74",
      "issue": "7",
      "pages": "13495",
      "raw": "Night-time voids, level of bother and sleep characteristics in a non-patient population of wearable devices users \n\t\t \n\t\t\t C Chapple \n\t\t \n\t\t \n\t\t\t D Bliwise \n\t\t \n\t\t \n\t\t\t L Maislisch \n\t\t \n\t\t \n\t\t\t E Roitmann \n\t\t \n\t\t \n\t\t\t T Burtea \n\t\t \n\t\t 10.1111/ijcp.13495 \n\t\t Medline: 32100396 \n\t \n\t \n\t\t Int J Clin Pract \n\t\t \n\t\t\t 74 \n\t\t\t 7 \n\t\t\t 13495 \n\t\t\t 2020 \n\t\t \n\t \n\t FREE Full text \n\t Chapple C, Bliwise D, Maislisch L, Roitmann E, Burtea T. Night-time voids, level of bother and sleep characteristics in a non-patient population of wearable devices users. Int J Clin Pract 2020;74(7):e13495 [FREE Full text] [doi: 10.1111/ijcp.13495] [Medline: 32100396]"
    },
    {
      "title": "The role of sleep in adolescents' daily stress recovery: negative affect spillover and positive affect bounce-back effects",
      "authors": [
        "A Chue",
        "K Gunthert",
        "R Kim",
        "C Alfano",
        "A Ruggiero"
      ],
      "year": 2018,
      "doi": "10.1016/j.adolescence.2018.05.006",
      "journal": "J Adolesc",
      "volume": "66",
      "raw": "The role of sleep in adolescents' daily stress recovery: negative affect spillover and positive affect bounce-back effects \n\t\t \n\t\t\t A E Chue \n\t\t \n\t\t \n\t\t\t K C Gunthert \n\t\t \n\t\t \n\t\t\t R W Kim \n\t\t \n\t\t \n\t\t\t C A Alfano \n\t\t \n\t\t \n\t\t\t A R Ruggiero \n\t\t \n\t\t 10.1016/j.adolescence.2018.05.006 \n\t\t Medline: 29842996 \n\t \n\t \n\t\t J Adolesc \n\t\t \n\t\t\t 66 \n\t\t\t \n\t\t\t 2018 \n\t\t \n\t \n\t Chue AE, Gunthert KC, Kim RW, Alfano CA, Ruggiero AR. The role of sleep in adolescents' daily stress recovery: negative affect spillover and positive affect bounce-back effects. J Adolesc 2018;66:101-111. [doi: 10.1016/j.adolescence.2018.05.006] [Medline: 29842996]"
    },
    {
      "title": "The influence of a constraint and bimanual training program using a variety of modalities on endurance and on the cardiac autonomic regulation system of children with unilateral cerebral palsy: a self-control clinical trial",
      "authors": [
        "M Cohen-Holzer",
        "G Sorek",
        "M Schweizer",
        "M Katz-Leurer"
      ],
      "year": 2017,
      "doi": "10.3233/NRE-171463",
      "journal": "NeuroRehabilitation",
      "volume": "41",
      "issue": "1",
      "raw": "The influence of a constraint and bimanual training program using a variety of modalities on endurance and on the cardiac autonomic regulation system of children with unilateral cerebral palsy: a self-control clinical trial \n\t\t \n\t\t\t M Cohen-Holzer \n\t\t \n\t\t \n\t\t\t G Sorek \n\t\t \n\t\t \n\t\t\t M Schweizer \n\t\t \n\t\t \n\t\t\t M Katz-Leurer \n\t\t \n\t\t 10.3233/NRE-171463 \n\t\t Medline: 28505992 \n\t \n\t \n\t\t NeuroRehabilitation \n\t\t \n\t\t\t 41 \n\t\t\t 1 \n\t\t\t \n\t\t\t 2017 \n\t\t \n\t \n\t Cohen-Holzer M, Sorek G, Schweizer M, Katz-Leurer M. The influence of a constraint and bimanual training program using a variety of modalities on endurance and on the cardiac autonomic regulation system of children with unilateral cerebral palsy: a self-control clinical trial. NeuroRehabilitation 2017;41(1):119-126. [doi: 10.3233/NRE-171463] [Medline: 28505992]"
    },
    {
      "title": "Use of a wrist-mounted device for continuous outpatient physiologic monitoring after transsphenoidal surgery: a pilot study",
      "authors": [
        "T Cole",
        "H Jahnke",
        "J Godzik",
        "C Morgan",
        "P Nakaji",
        "A Little"
      ],
      "year": 2019,
      "doi": "10.1007/s11102-019-00946-y",
      "journal": "Pituitary",
      "volume": "22",
      "issue": "2",
      "raw": "Use of a wrist-mounted device for continuous outpatient physiologic monitoring after transsphenoidal surgery: a pilot study \n\t\t \n\t\t\t T S Cole \n\t\t \n\t\t \n\t\t\t H Jahnke \n\t\t \n\t\t \n\t\t\t J Godzik \n\t\t \n\t\t \n\t\t\t C D Morgan \n\t\t \n\t\t \n\t\t\t P Nakaji \n\t\t \n\t\t \n\t\t\t A S Little \n\t\t \n\t\t 10.1007/s11102-019-00946-y \n\t\t Medline: 30806859 \n\t \n\t \n\t\t Pituitary \n\t\t \n\t\t\t 22 \n\t\t\t 2 \n\t\t\t \n\t\t\t 2019 \n\t\t \n\t \n\t Cole TS, Jahnke H, Godzik J, Morgan CD, Nakaji P, Little AS. Use of a wrist-mounted device for continuous outpatient physiologic monitoring after transsphenoidal surgery: a pilot study. Pituitary 2019;22(2):156-162. [doi: 10.1007/s11102-019-00946-y] [Medline: 30806859]"
    },
    {
      "title": "Enuretic children have a higher variability in REM sleep when comparing their sleep parameters with nonenuretic control children using a wearable sleep tracker at home",
      "authors": [
        "E Collier",
        "C Varon",
        "Van Huffel",
        "S Bogaert"
      ],
      "year": 2020,
      "doi": "10.1002/nau.24215",
      "journal": "Neurourol Urodyn",
      "volume": "39",
      "issue": "1",
      "raw": "Enuretic children have a higher variability in REM sleep when comparing their sleep parameters with nonenuretic control children using a wearable sleep tracker at home \n\t\t \n\t\t\t E Collier \n\t\t \n\t\t \n\t\t\t C Varon \n\t\t \n\t\t \n\t\t\t Van Huffel \n\t\t \n\t\t \n\t\t\t S Bogaert \n\t\t \n\t\t \n\t\t\t G \n\t\t \n\t\t 10.1002/nau.24215 \n\t\t Medline: 31729062 \n\t \n\t \n\t\t Neurourol Urodyn \n\t\t \n\t\t\t 39 \n\t\t\t 1 \n\t\t\t \n\t\t\t 2020 \n\t\t \n\t \n\t Collier E, Varon C, Van Huffel S, Bogaert G. Enuretic children have a higher variability in REM sleep when comparing their sleep parameters with nonenuretic control children using a wearable sleep tracker at home. Neurourol Urodyn 2020;39(1):367-375. [doi: 10.1002/nau.24215] [Medline: 31729062]"
    },
    {
      "title": "Intra-individual variability of sleep and nocturnal cardiac autonomic activity in elite female soccer players during an international tournament",
      "authors": [
        "J Costa",
        "P Figueiredo",
        "F Nakamura",
        "V Rago",
        "A Rebelo",
        "J Brito"
      ],
      "year": 2019,
      "doi": "10.1371/journal.pone.0218635",
      "journal": "PLoS One",
      "volume": "14",
      "issue": "9",
      "pages": "218635",
      "raw": "Intra-individual variability of sleep and nocturnal cardiac autonomic activity in elite female soccer players during an international tournament \n\t\t \n\t\t\t J Costa \n\t\t \n\t\t \n\t\t\t P Figueiredo \n\t\t \n\t\t \n\t\t\t F Nakamura \n\t\t \n\t\t \n\t\t\t V Rago \n\t\t \n\t\t \n\t\t\t A Rebelo \n\t\t \n\t\t \n\t\t\t J Brito \n\t\t \n\t\t 10.1371/journal.pone.0218635 \n\t\t Medline: 31527865 \n\t \n\t \n\t\t PLoS One \n\t\t \n\t\t\t 14 \n\t\t\t 9 \n\t\t\t 218635 \n\t\t\t 2019 \n\t\t \n\t \n\t FREE Full text \n\t Costa J, Figueiredo P, Nakamura F, Rago V, Rebelo A, Brito J. Intra-individual variability of sleep and nocturnal cardiac autonomic activity in elite female soccer players during an international tournament. PLoS One 2019;14(9):e0218635 [FREE Full text] [doi: 10.1371/journal.pone.0218635] [Medline: 31527865]"
    },
    {
      "title": "(PaCCSC). A pragmatic, phase III, multisite, double-blind, placebo-controlled, parallel-arm, dose increment randomised trial of regular, low-dose extended-release morphine for chronic breathlessness: Breathlessness, Exertion And Morphine Sulfate (BEAMS) study protocol",
      "authors": [
        "D Currow",
        "G Watts",
        "M Johnson",
        "C Mcdonald",
        "J Miners",
        "A Somogyi"
      ],
      "year": 2017,
      "doi": "10.1136/bmjopen-2017-018100",
      "journal": "BMJ Open",
      "volume": "7",
      "issue": "7",
      "pages": "18100",
      "raw": "(PaCCSC). A pragmatic, phase III, multisite, double-blind, placebo-controlled, parallel-arm, dose increment randomised trial of regular, low-dose extended-release morphine for chronic breathlessness: Breathlessness, Exertion And Morphine Sulfate (BEAMS) study protocol \n\t\t \n\t\t\t D Currow \n\t\t\t \n\t\t\t\t Australian national Palliative Care Clinical Studies Collaborative \n\t\t\t \n\t\t \n\t\t \n\t\t\t G J Watts \n\t\t\t \n\t\t\t\t Australian national Palliative Care Clinical Studies Collaborative \n\t\t\t \n\t\t \n\t\t \n\t\t\t M Johnson \n\t\t\t \n\t\t\t\t Australian national Palliative Care Clinical Studies Collaborative \n\t\t\t \n\t\t \n\t\t \n\t\t\t C F Mcdonald \n\t\t\t \n\t\t\t\t Australian national Palliative Care Clinical Studies Collaborative \n\t\t\t \n\t\t \n\t\t \n\t\t\t J O Miners \n\t\t\t \n\t\t\t\t Australian national Palliative Care Clinical Studies Collaborative \n\t\t\t \n\t\t \n\t\t \n\t\t\t A A Somogyi \n\t\t\t \n\t\t\t\t Australian national Palliative Care Clinical Studies Collaborative \n\t\t\t \n\t\t \n\t\t 10.1136/bmjopen-2017-018100 \n\t\t Medline: 28716797 \n\t \n\t \n\t\t BMJ Open \n\t\t \n\t\t\t 7 \n\t\t\t 7 \n\t\t\t 18100 \n\t\t\t 2017 \n\t\t \n\t \n\t FREE Full text \n\t Currow D, Watts GJ, Johnson M, McDonald CF, Miners JO, Somogyi AA, Australian national Palliative Care Clinical Studies Collaborative (PaCCSC). A pragmatic, phase III, multisite, double-blind, placebo-controlled, parallel-arm, dose increment randomised trial of regular, low-dose extended-release morphine for chronic breathlessness: Breathlessness, Exertion And Morphine Sulfate (BEAMS) study protocol. BMJ Open 2017;7(7):e018100 [FREE Full text] [doi: 10.1136/bmjopen-2017-018100] [Medline: 28716797]"
    },
    {
      "title": "Free-living physical activity monitoring in adult US patients with multiple sclerosis using a consumer wearable device",
      "authors": [
        "P Dasmahapatra",
        "E Chiauzzi",
        "R Bhalerao",
        "J Rhodes"
      ],
      "year": 2018,
      "doi": "10.1159/000488040",
      "journal": "Digit Biomark",
      "volume": "2",
      "issue": "1",
      "raw": "Free-living physical activity monitoring in adult US patients with multiple sclerosis using a consumer wearable device \n\t\t \n\t\t\t P Dasmahapatra \n\t\t \n\t\t \n\t\t\t E Chiauzzi \n\t\t \n\t\t \n\t\t\t R Bhalerao \n\t\t \n\t\t \n\t\t\t J Rhodes \n\t\t \n\t\t 10.1159/000488040 \n\t\t Medline: 32095756 \n\t \n\t \n\t\t Digit Biomark \n\t\t \n\t\t\t 2 \n\t\t\t 1 \n\t\t\t \n\t\t\t 2018 \n\t\t \n\t \n\t FREE Full text \n\t DasMahapatra P, Chiauzzi E, Bhalerao R, Rhodes J. Free-living physical activity monitoring in adult US patients with multiple sclerosis using a consumer wearable device. Digit Biomark 2018;2(1):47-63 [FREE Full text] [doi: 10.1159/000488040] [Medline: 32095756]"
    },
    {
      "title": "Physically active children with epilepsy have good objective sleep duration and efficiency despite subjective reports of fatigue and sleep problems",
      "authors": [
        "J Do",
        "R Webster",
        "P Longmuir",
        "S Ieradi",
        "D Reddy",
        "S Whiting"
      ],
      "year": 2020,
      "doi": "10.1016/j.yebeh.2019.106853",
      "journal": "Epilepsy Behav",
      "volume": "104",
      "pages": "106853",
      "raw": "Physically active children with epilepsy have good objective sleep duration and efficiency despite subjective reports of fatigue and sleep problems \n\t\t \n\t\t\t J Do \n\t\t \n\t\t \n\t\t\t R J Webster \n\t\t \n\t\t \n\t\t\t P E Longmuir \n\t\t \n\t\t \n\t\t\t S Ieradi \n\t\t \n\t\t \n\t\t\t D Reddy \n\t\t \n\t\t \n\t\t\t S Whiting \n\t\t \n\t\t 10.1016/j.yebeh.2019.106853 \n\t\t Medline: 31958642 \n\t \n\t \n\t\t Epilepsy Behav \n\t\t \n\t\t\t 104 \n\t\t\t 106853 \n\t\t\t 2020 \n\t\t \n\t \n\t Pt A \n\t Do J, Webster RJ, Longmuir PE, Ieradi S, Reddy D, Whiting S, et al. Physically active children with epilepsy have good objective sleep duration and efficiency despite subjective reports of fatigue and sleep problems. Epilepsy Behav 2020;104(Pt A):106853. [doi: 10.1016/j.yebeh.2019.106853] [Medline: 31958642]"
    },
    {
      "title": "Continuous versus intermittent vital signs monitoring using a wearable, wireless patch in patients admitted to surgical wards: pilot cluster randomized controlled trial",
      "authors": [
        "C Downey",
        "R Randell",
        "J Brown",
        "D Jayne"
      ],
      "year": 2018,
      "doi": "10.2196/10802",
      "journal": "J Med Internet Res",
      "volume": "20",
      "issue": "12",
      "pages": "10802",
      "raw": "Continuous versus intermittent vital signs monitoring using a wearable, wireless patch in patients admitted to surgical wards: pilot cluster randomized controlled trial \n\t\t \n\t\t\t C Downey \n\t\t \n\t\t \n\t\t\t R Randell \n\t\t \n\t\t \n\t\t\t J Brown \n\t\t \n\t\t \n\t\t\t D G Jayne \n\t\t \n\t\t 10.2196/10802 \n\t\t Medline: 30538086 \n\t \n\t \n\t\t J Med Internet Res \n\t\t \n\t\t\t 20 \n\t\t\t 12 \n\t\t\t 10802 \n\t\t\t 2018 \n\t\t \n\t \n\t FREE Full text \n\t Downey C, Randell R, Brown J, Jayne DG. Continuous versus intermittent vital signs monitoring using a wearable, wireless patch in patients admitted to surgical wards: pilot cluster randomized controlled trial. J Med Internet Res 2018;20(12):e10802 [FREE Full text] [doi: 10.2196/10802] [Medline: 30538086]"
    },
    {
      "title": "Factors associated with orthopaedic resident burnout: a pilot study",
      "authors": [
        "A Driesman",
        "E Strauss",
        "S Konda",
        "K Egol"
      ],
      "year": 2020,
      "doi": "10.5435/jaaos-d-19-00648",
      "journal": "J Am Acad Orthop Surg",
      "volume": "28",
      "issue": "21",
      "raw": "Factors associated with orthopaedic resident burnout: a pilot study \n\t\t \n\t\t\t A S Driesman \n\t\t \n\t\t \n\t\t\t E J Strauss \n\t\t \n\t\t \n\t\t\t S R Konda \n\t\t \n\t\t \n\t\t\t K A Egol \n\t\t \n\t\t 10.5435/jaaos-d-19-00648 \n\t\t Medline: 32039922 \n\t \n\t \n\t\t J Am Acad Orthop Surg \n\t\t \n\t\t\t 28 \n\t\t\t 21 \n\t\t\t \n\t\t\t 2020 \n\t\t \n\t \n\t Driesman AS, Strauss EJ, Konda SR, Egol KA. Factors associated with orthopaedic resident burnout: a pilot study. J Am Acad Orthop Surg 2020;28(21):900-906. [doi: 10.5435/JAAOS-D-19-00648] [Medline: 32039922]"
    },
    {
      "title": "Physical activity measured using wearable activity tracking devices associated with gout flares",
      "authors": [
        "N Elmagboul",
        "B Coburn",
        "J Foster",
        "A Mudano",
        "J Melnick",
        "D Bergman"
      ],
      "year": 2020,
      "doi": "10.1186/s13075-020-02272-2",
      "journal": "Arthritis Res Ther",
      "volume": "22",
      "issue": "1",
      "pages": "181",
      "raw": "Physical activity measured using wearable activity tracking devices associated with gout flares \n\t\t \n\t\t\t N Elmagboul \n\t\t \n\t\t \n\t\t\t B W Coburn \n\t\t \n\t\t \n\t\t\t J Foster \n\t\t \n\t\t \n\t\t\t A Mudano \n\t\t \n\t\t \n\t\t\t J Melnick \n\t\t \n\t\t \n\t\t\t D Bergman \n\t\t \n\t\t 10.1186/s13075-020-02272-2 \n\t\t Medline: 32746893 \n\t \n\t \n\t\t Arthritis Res Ther \n\t\t \n\t\t\t 22 \n\t\t\t 1 \n\t\t\t 181 \n\t\t\t 2020 \n\t\t \n\t \n\t FREE Full text \n\t Elmagboul N, Coburn BW, Foster J, Mudano A, Melnick J, Bergman D, et al. Physical activity measured using wearable activity tracking devices associated with gout flares. Arthritis Res Ther 2020;22(1):181 [FREE Full text] [doi: 10.1186/s13075-020-02272-2] [Medline: 32746893]"
    },
    {
      "title": "Sitting and activity time in people with stroke",
      "authors": [
        "C English",
        "G Healy",
        "A Coates",
        "L Lewis",
        "T Olds",
        "J Bernhardt"
      ],
      "year": 2016,
      "doi": "10.2522/ptj.20140522",
      "journal": "Phys Ther",
      "volume": "96",
      "issue": "2",
      "raw": "Sitting and activity time in people with stroke \n\t\t \n\t\t\t C English \n\t\t \n\t\t \n\t\t\t G N Healy \n\t\t \n\t\t \n\t\t\t A Coates \n\t\t \n\t\t \n\t\t\t L Lewis \n\t\t \n\t\t \n\t\t\t T Olds \n\t\t \n\t\t \n\t\t\t J Bernhardt \n\t\t \n\t\t 10.2522/ptj.20140522 \n\t\t Medline: 26112254 \n\t \n\t \n\t\t Phys Ther \n\t\t \n\t\t\t 96 \n\t\t\t 2 \n\t\t\t \n\t\t\t 2016 \n\t\t \n\t \n\t English C, Healy GN, Coates A, Lewis L, Olds T, Bernhardt J. Sitting and activity time in people with stroke. Phys Ther 2016;96(2):193-201. [doi: 10.2522/ptj.20140522] [Medline: 26112254]"
    },
    {
      "title": "Physical activity patterns of ethnic children from low socio-economic environments within the UK",
      "authors": [
        "E Eyre",
        "M Duncan",
        "S Birch",
        "V Cox",
        "M Blackett"
      ],
      "year": 2015,
      "doi": "10.1080/02640414.2014.934706",
      "journal": "J Sports Sci",
      "volume": "33",
      "issue": "3",
      "raw": "Physical activity patterns of ethnic children from low socio-economic environments within the UK \n\t\t \n\t\t\t E L Eyre \n\t\t \n\t\t \n\t\t\t M J Duncan \n\t\t \n\t\t \n\t\t\t S L Birch \n\t\t \n\t\t \n\t\t\t V Cox \n\t\t \n\t\t \n\t\t\t M Blackett \n\t\t \n\t\t 10.1080/02640414.2014.934706 \n\t\t Medline: 24998418 \n\t \n\t \n\t\t J Sports Sci \n\t\t \n\t\t\t 33 \n\t\t\t 3 \n\t\t\t \n\t\t\t 2015 \n\t\t \n\t \n\t Eyre EL, Duncan MJ, Birch SL, Cox V, Blackett M. Physical activity patterns of ethnic children from low socio-economic environments within the UK. J Sports Sci 2015;33(3):232-242. [doi: 10.1080/02640414.2014.934706] [Medline: 24998418]"
    },
    {
      "title": "An international study on the determinants of poor sleep amongst 15,000 users of connected devices",
      "authors": [
        "G Fagherazzi",
        "El Fatouhi",
        "D Bellicha",
        "El Gareh",
        "A Affret",
        "A Dow"
      ],
      "year": 2017,
      "doi": "10.2196/jmir.7930",
      "journal": "J Med Internet Res",
      "volume": "19",
      "issue": "10",
      "pages": "363",
      "raw": "An international study on the determinants of poor sleep amongst 15,000 users of connected devices \n\t\t \n\t\t\t G Fagherazzi \n\t\t \n\t\t \n\t\t\t El Fatouhi \n\t\t \n\t\t \n\t\t\t D Bellicha \n\t\t \n\t\t \n\t\t\t A \n\t\t \n\t\t \n\t\t\t El Gareh \n\t\t \n\t\t \n\t\t\t A Affret \n\t\t \n\t\t \n\t\t\t A Dow \n\t\t \n\t\t \n\t\t\t C \n\t\t \n\t\t 10.2196/jmir.7930 \n\t\t Medline: 29061551 \n\t \n\t \n\t\t J Med Internet Res \n\t\t \n\t\t\t 19 \n\t\t\t 10 \n\t\t\t 363 \n\t\t\t 2017 \n\t\t \n\t \n\t FREE Full text \n\t Fagherazzi G, El Fatouhi D, Bellicha A, El Gareh A, Affret A, Dow C, et al. An international study on the determinants of poor sleep amongst 15,000 users of connected devices. J Med Internet Res 2017;19(10):e363 [FREE Full text] [doi: 10.2196/jmir.7930] [Medline: 29061551]"
    },
    {
      "title": "Average acceleration and intensity gradient of primary school children and associations with indicators of health and well-being",
      "authors": [
        "S Fairclough",
        "S Taylor",
        "A Rowlands",
        "L Boddy",
        "R Noonan"
      ],
      "year": 2019,
      "doi": "10.1080/02640414.2019.1624313",
      "journal": "J Sports Sci",
      "volume": "37",
      "issue": "18",
      "raw": "Average acceleration and intensity gradient of primary school children and associations with indicators of health and well-being \n\t\t \n\t\t\t S J Fairclough \n\t\t \n\t\t \n\t\t\t S Taylor \n\t\t \n\t\t \n\t\t\t A V Rowlands \n\t\t \n\t\t \n\t\t\t L M Boddy \n\t\t \n\t\t \n\t\t\t R J Noonan \n\t\t \n\t\t 10.1080/02640414.2019.1624313 \n\t\t Medline: 31156048 \n\t \n\t \n\t\t J Sports Sci \n\t\t \n\t\t\t 37 \n\t\t\t 18 \n\t\t\t \n\t\t\t 2019 \n\t\t \n\t \n\t Fairclough SJ, Taylor S, Rowlands AV, Boddy LM, Noonan RJ. Average acceleration and intensity gradient of primary school children and associations with indicators of health and well-being. J Sports Sci 2019;37(18):2159-2167. [doi: 10.1080/02640414.2019.1624313] [Medline: 31156048]"
    },
    {
      "title": "Deviations from normal bedtimes are associated with short-term increases in resting heart rate",
      "authors": [
        "L Faust",
        "K Feldman",
        "S Mattingly",
        "D Hachen",
        "V Chawla"
      ],
      "year": 2020,
      "doi": "10.1038/s41746-020-0250-6",
      "journal": "NPJ Digit Med",
      "volume": "3",
      "pages": "39",
      "raw": "Deviations from normal bedtimes are associated with short-term increases in resting heart rate \n\t\t \n\t\t\t L Faust \n\t\t \n\t\t \n\t\t\t K Feldman \n\t\t \n\t\t \n\t\t\t S M Mattingly \n\t\t \n\t\t \n\t\t\t D Hachen \n\t\t \n\t\t \n\t\t\t V Chawla \n\t\t \n\t\t \n\t\t\t N \n\t\t \n\t\t 10.1038/s41746-020-0250-6 \n\t\t Medline: 32219180 \n\t \n\t \n\t\t NPJ Digit Med \n\t\t \n\t\t\t 3 \n\t\t\t 39 \n\t\t\t 2020 \n\t\t \n\t \n\t FREE Full text \n\t Faust L, Feldman K, Mattingly SM, Hachen D, V Chawla N. Deviations from normal bedtimes are associated with short-term increases in resting heart rate. NPJ Digit Med 2020;3:39 [FREE Full text] [doi: 10.1038/s41746-020-0250-6] [Medline: 32219180]"
    },
    {
      "title": "Evaluating individual training adaptation with smartphone-derived heart rate variability in a collegiate female soccer team",
      "authors": [
        "A Flatt",
        "M Esco"
      ],
      "year": 2016,
      "doi": "10.1519/JSC.0000000000001095",
      "journal": "J Strength Cond Res",
      "volume": "30",
      "issue": "2",
      "raw": "Evaluating individual training adaptation with smartphone-derived heart rate variability in a collegiate female soccer team \n\t\t \n\t\t\t A A Flatt \n\t\t \n\t\t \n\t\t\t M R Esco \n\t\t \n\t\t 10.1519/JSC.0000000000001095 \n\t\t Medline: 26200192 \n\t \n\t \n\t\t J Strength Cond Res \n\t\t \n\t\t\t 30 \n\t\t\t 2 \n\t\t\t \n\t\t\t 2016 \n\t\t \n\t \n\t Flatt AA, Esco MR. Evaluating individual training adaptation with smartphone-derived heart rate variability in a collegiate female soccer team. J Strength Cond Res 2016;30(2):378-385. [doi: 10.1519/JSC.0000000000001095] [Medline: 26200192]"
    },
    {
      "title": "Patterns in weight and physical activity tracking data preceding a stop in weight monitoring: observational analysis",
      "authors": [
        "K Frie",
        "J Hartmann-Boyce",
        "S Jebb",
        "J Oke",
        "P Aveyard"
      ],
      "year": 2020,
      "doi": "10.2196/15790",
      "journal": "J Med Internet Res",
      "volume": "22",
      "issue": "3",
      "pages": "15790",
      "raw": "Patterns in weight and physical activity tracking data preceding a stop in weight monitoring: observational analysis \n\t\t \n\t\t\t K Frie \n\t\t \n\t\t \n\t\t\t J Hartmann-Boyce \n\t\t \n\t\t \n\t\t\t S Jebb \n\t\t \n\t\t \n\t\t\t J Oke \n\t\t \n\t\t \n\t\t\t P Aveyard \n\t\t \n\t\t 10.2196/15790 \n\t\t Medline: 32181749 \n\t \n\t \n\t\t J Med Internet Res \n\t\t \n\t\t\t 22 \n\t\t\t 3 \n\t\t\t 15790 \n\t\t\t 2020 \n\t\t \n\t \n\t FREE Full text \n\t Frie K, Hartmann-Boyce J, Jebb S, Oke J, Aveyard P. Patterns in weight and physical activity tracking data preceding a stop in weight monitoring: observational analysis. J Med Internet Res 2020;22(3):e15790 [FREE Full text] [doi: 10.2196/15790] [Medline: 32181749]"
    },
    {
      "title": "Using accelerometers to characterize recovery after surgery in children",
      "authors": [
        "H Ghomrawi",
        "L Baumann",
        "S Kwon",
        "F Hebal",
        "G Hsiung",
        "K Williams"
      ],
      "year": 2018,
      "doi": "10.1016/j.jpedsurg.2017.09.016",
      "journal": "J Pediatr Surg",
      "volume": "53",
      "issue": "8",
      "raw": "Using accelerometers to characterize recovery after surgery in children \n\t\t \n\t\t\t H M Ghomrawi \n\t\t \n\t\t \n\t\t\t L M Baumann \n\t\t \n\t\t \n\t\t\t S Kwon \n\t\t \n\t\t \n\t\t\t F Hebal \n\t\t \n\t\t \n\t\t\t G Hsiung \n\t\t \n\t\t \n\t\t\t K Williams \n\t\t \n\t\t 10.1016/j.jpedsurg.2017.09.016 \n\t\t Medline: 29092769 \n\t \n\t \n\t\t J Pediatr Surg \n\t\t \n\t\t\t 53 \n\t\t\t 8 \n\t\t\t \n\t\t\t 2018 \n\t\t \n\t \n\t Ghomrawi HM, Baumann LM, Kwon S, Hebal F, Hsiung G, Williams K, et al. Using accelerometers to characterize recovery after surgery in children. J Pediatr Surg 2018;53(8):1600-1605. [doi: 10.1016/j.jpedsurg.2017.09.016] [Medline: 29092769]"
    },
    {
      "title": "Association between physical activity, weight loss, anxiety, and lumbopelvic pain in postpartum women",
      "authors": [
        "M Girard",
        "O' Shaughnessy",
        "J Doucet",
        "C Ruchat",
        "S Descarreaux"
      ],
      "year": 2020,
      "doi": "10.1016/j.jmpt.2019.11.008",
      "journal": "J Manipulative Physiol Ther",
      "volume": "43",
      "issue": "6",
      "raw": "Association between physical activity, weight loss, anxiety, and lumbopelvic pain in postpartum women \n\t\t \n\t\t\t M P Girard \n\t\t \n\t\t \n\t\t\t O' Shaughnessy \n\t\t \n\t\t \n\t\t\t J Doucet \n\t\t \n\t\t \n\t\t\t C Ruchat \n\t\t \n\t\t \n\t\t\t S M Descarreaux \n\t\t \n\t\t \n\t\t\t M \n\t\t \n\t\t 10.1016/j.jmpt.2019.11.008 \n\t\t Medline: 32709518 \n\t \n\t \n\t\t J Manipulative Physiol Ther \n\t\t \n\t\t\t 43 \n\t\t\t 6 \n\t\t\t \n\t\t\t 2020 \n\t\t \n\t \n\t Girard MP, O'Shaughnessy J, Doucet C, Ruchat SM, Descarreaux M. Association between physical activity, weight loss, anxiety, and lumbopelvic pain in postpartum women. J Manipulative Physiol Ther 2020;43(6):655-666. [doi: 10.1016/j.jmpt.2019.11.008] [Medline: 32709518]"
    },
    {
      "title": "An observational study investigating the use of patient-owned technology to quantify physical activity in survivors of critical illness",
      "authors": [
        "S Gluck",
        "M Summers",
        "M Finnis",
        "A Andrawos",
        "T Goddard",
        "C Hodgson"
      ],
      "year": 2020,
      "doi": "10.1016/j.aucc.2019.01.009",
      "journal": "Aust Crit Care",
      "volume": "33",
      "issue": "2",
      "raw": "An observational study investigating the use of patient-owned technology to quantify physical activity in survivors of critical illness \n\t\t \n\t\t\t S Gluck \n\t\t \n\t\t \n\t\t\t M J Summers \n\t\t \n\t\t \n\t\t\t M E Finnis \n\t\t \n\t\t \n\t\t\t A Andrawos \n\t\t \n\t\t \n\t\t\t T P Goddard \n\t\t \n\t\t \n\t\t\t C L Hodgson \n\t\t \n\t\t 10.1016/j.aucc.2019.01.009 \n\t\t Medline: 30879879 \n\t \n\t \n\t\t Aust Crit Care \n\t\t \n\t\t\t 33 \n\t\t\t 2 \n\t\t\t \n\t\t\t 2020 \n\t\t \n\t \n\t Gluck S, Summers MJ, Finnis ME, Andrawos A, Goddard TP, Hodgson CL, et al. An observational study investigating the use of patient-owned technology to quantify physical activity in survivors of critical illness. Aust Crit Care 2020;33(2):137-143. [doi: 10.1016/j.aucc.2019.01.009] [Medline: 30879879]"
    },
    {
      "title": "Janitor workload and occupational injuries",
      "authors": [
        "D Green",
        "S Gerberich",
        "H Kim",
        "A Ryan",
        "P Mcgovern",
        "T Church"
      ],
      "year": 2019,
      "doi": "10.1002/ajim.22940",
      "journal": "Am J Ind Med",
      "volume": "62",
      "issue": "3",
      "raw": "Janitor workload and occupational injuries \n\t\t \n\t\t\t D R Green \n\t\t \n\t\t \n\t\t\t S G Gerberich \n\t\t \n\t\t \n\t\t\t H Kim \n\t\t \n\t\t \n\t\t\t A D Ryan \n\t\t \n\t\t \n\t\t\t P M Mcgovern \n\t\t \n\t\t \n\t\t\t T R Church \n\t\t \n\t\t 10.1002/ajim.22940 \n\t\t Medline: 30675912 \n\t \n\t \n\t\t Am J Ind Med \n\t\t \n\t\t\t 62 \n\t\t\t 3 \n\t\t\t \n\t\t\t 2019 \n\t\t \n\t \n\t Green DR, Gerberich SG, Kim H, Ryan AD, McGovern PM, Church TR, et al. Janitor workload and occupational injuries. Am J Ind Med 2019;62(3):222-232. [doi: 10.1002/ajim.22940] [Medline: 30675912]"
    },
    {
      "title": "Wearable activity monitors to assess performance status and predict clinical outcomes in advanced cancer patients",
      "authors": [
        "G Gresham",
        "A Hendifar",
        "B Spiegel",
        "E Neeman",
        "R Tuli",
        "B Rimel"
      ],
      "year": 2018,
      "doi": "10.1038/s41746-018-0032-6",
      "journal": "NPJ Digit Med",
      "volume": "1",
      "pages": "27",
      "raw": "Wearable activity monitors to assess performance status and predict clinical outcomes in advanced cancer patients \n\t\t \n\t\t\t G Gresham \n\t\t \n\t\t \n\t\t\t A E Hendifar \n\t\t \n\t\t \n\t\t\t B Spiegel \n\t\t \n\t\t \n\t\t\t E Neeman \n\t\t \n\t\t \n\t\t\t R Tuli \n\t\t \n\t\t \n\t\t\t B J Rimel \n\t\t \n\t\t 10.1038/s41746-018-0032-6 \n\t\t Medline: 31304309 \n\t \n\t \n\t\t NPJ Digit Med \n\t\t \n\t\t\t 1 \n\t\t\t 27 \n\t\t\t 2018 \n\t\t \n\t \n\t FREE Full text \n\t Gresham G, Hendifar AE, Spiegel B, Neeman E, Tuli R, Rimel BJ, et al. Wearable activity monitors to assess performance status and predict clinical outcomes in advanced cancer patients. NPJ Digit Med 2018;1:27 [FREE Full text] [doi: 10.1038/s41746-018-0032-6] [Medline: 31304309]"
    },
    {
      "title": "Accelerometery as a measure of modifiable physical activity in high-risk elderly preoperative patients: a prospective observational pilot study",
      "authors": [
        "L Grimes",
        "J Outtrim",
        "S Griffin",
        "A Ercole"
      ],
      "year": 2019,
      "doi": "10.1136/bmjopen-2019-032346",
      "journal": "BMJ Open",
      "volume": "9",
      "issue": "11",
      "pages": "32346",
      "raw": "Accelerometery as a measure of modifiable physical activity in high-risk elderly preoperative patients: a prospective observational pilot study \n\t\t \n\t\t\t L Grimes \n\t\t \n\t\t \n\t\t\t J G Outtrim \n\t\t \n\t\t \n\t\t\t S J Griffin \n\t\t \n\t\t \n\t\t\t A Ercole \n\t\t \n\t\t 10.1136/bmjopen-2019-032346 \n\t\t Medline: 31685513 \n\t \n\t \n\t\t BMJ Open \n\t\t \n\t\t\t 9 \n\t\t\t 11 \n\t\t\t 32346 \n\t\t\t 2019 \n\t\t \n\t \n\t FREE Full text \n\t Grimes L, Outtrim JG, Griffin SJ, Ercole A. Accelerometery as a measure of modifiable physical activity in high-risk elderly preoperative patients: a prospective observational pilot study. BMJ Open 2019;9(11):e032346 [FREE Full text] [doi: 10.1136/bmjopen-2019-032346] [Medline: 31685513]"
    },
    {
      "title": "Comparing real-time self-tracking and device-recorded exercise data in subjects with type 1 diabetes",
      "authors": [
        "D Groat",
        "H Kwon",
        "M Grando",
        "C Cook",
        "B Thompson"
      ],
      "year": 2018,
      "doi": "10.1055/s-0038-1676458",
      "journal": "Appl Clin Inform",
      "volume": "9",
      "issue": "4",
      "raw": "Comparing real-time self-tracking and device-recorded exercise data in subjects with type 1 diabetes \n\t\t \n\t\t\t D Groat \n\t\t \n\t\t \n\t\t\t H J Kwon \n\t\t \n\t\t \n\t\t\t M A Grando \n\t\t \n\t\t \n\t\t\t C B Cook \n\t\t \n\t\t \n\t\t\t B Thompson \n\t\t \n\t\t 10.1055/s-0038-1676458 \n\t\t Medline: 30586673 \n\t \n\t \n\t\t Appl Clin Inform \n\t\t \n\t\t\t 9 \n\t\t\t 4 \n\t\t\t \n\t\t\t 2018 \n\t\t \n\t \n\t FREE Full text \n\t Groat D, Kwon HJ, Grando MA, Cook CB, Thompson B. Comparing real-time self-tracking and device-recorded exercise data in subjects with type 1 diabetes. Appl Clin Inform 2018;9(4):919-926 [FREE Full text] [doi: 10.1055/s-0038-1676458] [Medline: 30586673]"
    },
    {
      "title": "Population-based screening or targeted screening based on initial clinical risk assessment for atrial fibrillation: a report from the Huawei heart study",
      "authors": [
        "Y Guo",
        "H Wang",
        "H Zhang",
        "Y Chen",
        "G Lip"
      ],
      "year": 2020,
      "doi": "10.3390/jcm9051493",
      "journal": "J Clin Med",
      "volume": "9",
      "issue": "5",
      "pages": "1493",
      "raw": "Population-based screening or targeted screening based on initial clinical risk assessment for atrial fibrillation: a report from the Huawei heart study \n\t\t \n\t\t\t Y Guo \n\t\t \n\t\t \n\t\t\t H Wang \n\t\t \n\t\t \n\t\t\t H Zhang \n\t\t \n\t\t \n\t\t\t Y Chen \n\t\t \n\t\t \n\t\t\t G Y Lip \n\t\t \n\t\t 10.3390/jcm9051493 \n\t\t Medline: 32429241 \n\t \n\t \n\t\t J Clin Med \n\t\t \n\t\t\t 9 \n\t\t\t 5 \n\t\t\t 1493 \n\t\t\t 2020 \n\t\t \n\t \n\t FREE Full text \n\t Guo Y, Wang H, Zhang H, Chen Y, Lip GY. Population-based screening or targeted screening based on initial clinical risk assessment for atrial fibrillation: a report from the Huawei heart study. J Clin Med 2020;9(5):1493 [FREE Full text] [doi: 10.3390/jcm9051493] [Medline: 32429241]"
    },
    {
      "title": "Mobile photoplethysmographic technology to detect atrial fibrillation",
      "authors": [
        "Y Guo",
        "H Wang",
        "H Zhang",
        "T Liu",
        "Z Liang",
        "Y Xia",
        "Mafa Ii Investigators"
      ],
      "year": 2019,
      "doi": "10.1016/j.jacc.2019.08.019",
      "journal": "J Am Coll Cardiol",
      "volume": "74",
      "issue": "19",
      "raw": "Mobile photoplethysmographic technology to detect atrial fibrillation \n\t\t \n\t\t\t Y Guo \n\t\t \n\t\t \n\t\t\t H Wang \n\t\t \n\t\t \n\t\t\t H Zhang \n\t\t \n\t\t \n\t\t\t T Liu \n\t\t \n\t\t \n\t\t\t Z Liang \n\t\t \n\t\t \n\t\t\t Y Xia \n\t\t \n\t\t \n\t\t\t Mafa Ii Investigators \n\t\t \n\t\t 10.1016/j.jacc.2019.08.019 \n\t\t Medline: 31487545 \n\t \n\t \n\t\t J Am Coll Cardiol \n\t\t \n\t\t\t 74 \n\t\t\t 19 \n\t\t\t \n\t\t\t 2019 \n\t\t \n\t \n\t Guo Y, Wang H, Zhang H, Liu T, Liang Z, Xia Y, MAFA II Investigators. Mobile photoplethysmographic technology to detect atrial fibrillation. J Am Coll Cardiol 2019;74(19):2365-2375. [doi: 10.1016/j.jacc.2019.08.019] [Medline: 31487545]"
    },
    {
      "title": "Mobility assessment using wearable technology in patients with late-onset Pompe disease",
      "authors": [
        "A Hamed",
        "C Curran",
        "C Gwaltney",
        "P Dasmahapatra"
      ],
      "year": 2019,
      "doi": "10.1038/s41746-019-0143-8",
      "journal": "NPJ Digit Med",
      "volume": "2",
      "pages": "70",
      "raw": "Mobility assessment using wearable technology in patients with late-onset Pompe disease \n\t\t \n\t\t\t A Hamed \n\t\t \n\t\t \n\t\t\t C Curran \n\t\t \n\t\t \n\t\t\t C Gwaltney \n\t\t \n\t\t \n\t\t\t P Dasmahapatra \n\t\t \n\t\t 10.1038/s41746-019-0143-8 \n\t\t Medline: 31341956 \n\t \n\t \n\t\t NPJ Digit Med \n\t\t \n\t\t\t 2 \n\t\t\t 70 \n\t\t\t 2019 \n\t\t \n\t \n\t FREE Full text \n\t Hamed A, Curran C, Gwaltney C, DasMahapatra P. Mobility assessment using wearable technology in patients with late-onset Pompe disease. NPJ Digit Med 2019;2:70 [FREE Full text] [doi: 10.1038/s41746-019-0143-8] [Medline: 31341956]"
    },
    {
      "title": "Relationships between neighborhood walkability and objectively measured physical activity levels in hemodialysis patients",
      "authors": [
        "M Han",
        "X Ye",
        "P Preciado",
        "S Williams",
        "I Campos",
        "M Bonner"
      ],
      "year": 2018,
      "doi": "10.1159/000485161",
      "journal": "Blood Purif",
      "volume": "45",
      "issue": "1-3",
      "raw": "Relationships between neighborhood walkability and objectively measured physical activity levels in hemodialysis patients \n\t\t \n\t\t\t M Han \n\t\t \n\t\t \n\t\t\t X Ye \n\t\t \n\t\t \n\t\t\t P Preciado \n\t\t \n\t\t \n\t\t\t S Williams \n\t\t \n\t\t \n\t\t\t I Campos \n\t\t \n\t\t \n\t\t\t M Bonner \n\t\t \n\t\t 10.1159/000485161 \n\t\t Medline: 29478044 \n\t \n\t \n\t\t Blood Purif \n\t\t \n\t\t\t 45 \n\t\t\t 1-3 \n\t\t\t \n\t\t\t 2018 \n\t\t \n\t \n\t FREE Full text \n\t Han M, Ye X, Preciado P, Williams S, Campos I, Bonner M, et al. Relationships between neighborhood walkability and objectively measured physical activity levels in hemodialysis patients. Blood Purif 2018;45(1-3):236-244 [FREE Full text] [doi: 10.1159/000485161] [Medline: 29478044]"
    },
    {
      "title": "Reduced physical activity during COVID-19 pandemic in children with congenital heart disease",
      "authors": [
        "N Hemphill",
        "M Kuan",
        "K Harris"
      ],
      "year": 2020,
      "doi": "10.1016/j.cjca.2020.04.038",
      "journal": "Can J Cardiol",
      "volume": "36",
      "issue": "7",
      "raw": "Reduced physical activity during COVID-19 pandemic in children with congenital heart disease \n\t\t \n\t\t\t N M Hemphill \n\t\t \n\t\t \n\t\t\t M T Kuan \n\t\t \n\t\t \n\t\t\t K C Harris \n\t\t \n\t\t 10.1016/j.cjca.2020.04.038 \n\t\t Medline: 32387502] 100 \n\t \n\t \n\t\t Can J Cardiol \n\t\t \n\t\t\t 36 \n\t\t\t 7 \n\t\t\t \n\t\t\t 2020 \n\t\t \n\t \n\t FREE Full text \n\t Hemphill NM, Kuan MT, Harris KC. Reduced physical activity during COVID-19 pandemic in children with congenital heart disease. Can J Cardiol 2020;36(7):1130-1134 [FREE Full text] [doi: 10.1016/j.cjca.2020.04.038] [Medline: 32387502] 100"
    },
    {
      "title": "Collaborative songwriting intervention for veterans with post-traumatic stress disorder",
      "authors": [
        "R Hirschberg",
        "L Sylvia",
        "E Wright",
        "C Gupta",
        "M Mccarthy",
        "L Harward"
      ],
      "year": 2020,
      "doi": "10.1089/acm.2019.0368",
      "journal": "J Altern Complement Med",
      "volume": "26",
      "issue": "3",
      "raw": "Collaborative songwriting intervention for veterans with post-traumatic stress disorder \n\t\t \n\t\t\t R Hirschberg \n\t\t \n\t\t \n\t\t\t L G Sylvia \n\t\t \n\t\t \n\t\t\t E C Wright \n\t\t \n\t\t \n\t\t\t C T Gupta \n\t\t \n\t\t \n\t\t\t M D Mccarthy \n\t\t \n\t\t \n\t\t\t L K Harward \n\t\t \n\t\t 10.1089/acm.2019.0368 \n\t\t Medline: 31985263] 101 \n\t \n\t \n\t\t J Altern Complement Med \n\t\t \n\t\t\t 26 \n\t\t\t 3 \n\t\t\t \n\t\t\t 2020 \n\t\t \n\t \n\t Hirschberg R, Sylvia LG, Wright EC, Gupta CT, McCarthy MD, Harward LK, et al. Collaborative songwriting intervention for veterans with post-traumatic stress disorder. J Altern Complement Med 2020;26(3):198-203. [doi: 10.1089/acm.2019.0368] [Medline: 31985263] 101"
    },
    {
      "title": "Trajectories of objectively-measured physical activity and sedentary time over the course of pregnancy in women self-identified as inactive",
      "authors": [
        "J Huberty",
        "M Buman",
        "J Leiferman",
        "J Bushar",
        "M Adams"
      ],
      "year": 2016,
      "doi": "10.1016/j.pmedr.2016.04.004",
      "journal": "Prev Med Rep",
      "volume": "3",
      "raw": "Trajectories of objectively-measured physical activity and sedentary time over the course of pregnancy in women self-identified as inactive \n\t\t \n\t\t\t J L Huberty \n\t\t \n\t\t \n\t\t\t M P Buman \n\t\t \n\t\t \n\t\t\t J A Leiferman \n\t\t \n\t\t \n\t\t\t J Bushar \n\t\t \n\t\t \n\t\t\t M A Adams \n\t\t \n\t\t 10.1016/j.pmedr.2016.04.004 \n\t\t Medline: 27419036] 102 \n\t \n\t \n\t\t Prev Med Rep \n\t\t \n\t\t\t 3 \n\t\t\t \n\t\t\t 2016 \n\t\t \n\t \n\t FREE Full text \n\t Huberty JL, Buman MP, Leiferman JA, Bushar J, Adams MA. Trajectories of objectively-measured physical activity and sedentary time over the course of pregnancy in women self-identified as inactive. Prev Med Rep 2016;3:353-360 [FREE Full text] [doi: 10.1016/j.pmedr.2016.04.004] [Medline: 27419036] 102"
    },
    {
      "title": "Relationship between objectively measured lifestyle factors and health factors in patients with knee osteoarthritis: the STROBE study",
      "authors": [
        "J Jeong",
        "S Kim",
        "K Park"
      ],
      "year": 2019,
      "doi": "10.1097/MD.0000000000016060",
      "journal": "Medicine",
      "volume": "98",
      "issue": "26",
      "pages": "16060",
      "raw": "Relationship between objectively measured lifestyle factors and health factors in patients with knee osteoarthritis: the STROBE study \n\t\t \n\t\t\t J N Jeong \n\t\t \n\t\t \n\t\t\t S H Kim \n\t\t \n\t\t \n\t\t\t K N Park \n\t\t \n\t\t 10.1097/MD.0000000000016060 \n\t\t Medline: 31261513] 103 \n\t \n\t \n\t\t Medicine \n\t\t \n\t\t\t 98 \n\t\t\t 26 \n\t\t\t 16060 \n\t\t\t 2019 \n\t\t\t Baltimore \n\t\t \n\t \n\t FREE Full text \n\t Jeong JN, Kim SH, Park KN. Relationship between objectively measured lifestyle factors and health factors in patients with knee osteoarthritis: the STROBE study. Medicine (Baltimore) 2019;98(26):e16060 [FREE Full text] [doi: 10.1097/MD.0000000000016060] [Medline: 31261513] 103"
    },
    {
      "title": "The effect of citrus ginger aroma on heart rate and salivary cortisol level during sleep at home",
      "authors": [
        "F Jiang",
        "T Kobayashi",
        "T Ichihashi",
        "K Ito",
        "S Nomura"
      ],
      "year": 2019,
      "doi": "10.1002/tee.22845",
      "journal": "IEEJ Trans Elec Electron Eng",
      "volume": "14",
      "issue": "4",
      "raw": "The effect of citrus ginger aroma on heart rate and salivary cortisol level during sleep at home \n\t\t \n\t\t\t F Jiang \n\t\t \n\t\t \n\t\t\t T Kobayashi \n\t\t \n\t\t \n\t\t\t T Ichihashi \n\t\t \n\t\t \n\t\t\t K Ito \n\t\t \n\t\t \n\t\t\t S Nomura \n\t\t \n\t\t 10.1002/tee.22845 \n\t \n\t \n\t\t IEEJ Trans Elec Electron Eng \n\t\t \n\t\t\t 14 \n\t\t\t 4 \n\t\t\t \n\t\t\t 2019 \n\t\t \n\t \n\t Jiang F, Kobayashi T, Ichihashi T, Ito K, Nomura S. The effect of citrus ginger aroma on heart rate and salivary cortisol level during sleep at home. IEEJ Trans Elec Electron Eng 2019;14(4):623-629. [doi: 10.1002/tee.22845] 104"
    },
    {
      "title": "Life stress, sense of belonging and sleep in American Indian college students",
      "authors": [
        "N John-Henderson",
        "C Palmer",
        "A Thomas"
      ],
      "year": 2019,
      "doi": "10.1016/j.sleh.2019.04.001",
      "journal": "Sleep Health",
      "volume": "5",
      "issue": "4",
      "raw": "Life stress, sense of belonging and sleep in American Indian college students \n\t\t \n\t\t\t N A John-Henderson \n\t\t \n\t\t \n\t\t\t C A Palmer \n\t\t \n\t\t \n\t\t\t A Thomas \n\t\t \n\t\t 10.1016/j.sleh.2019.04.001 \n\t\t Medline: 31153800] 105 \n\t \n\t \n\t\t Sleep Health \n\t\t \n\t\t\t 5 \n\t\t\t 4 \n\t\t\t \n\t\t\t 2019 \n\t\t \n\t \n\t FREE Full text \n\t John-Henderson NA, Palmer CA, Thomas A. Life stress, sense of belonging and sleep in American Indian college students. Sleep Health 2019;5(4):352-358 [FREE Full text] [doi: 10.1016/j.sleh.2019.04.001] [Medline: 31153800] 105"
    },
    {
      "title": "Associations of accelerometer-measured sedentary time, sedentary bouts, and physical activity with adiposity and fitness in children",
      "authors": [
        "M Jones",
        "P Skidmore",
        "L Stoner",
        "H Harrex",
        "P Saeedi",
        "K Black"
      ],
      "year": 2020,
      "doi": "10.1080/02640414.2019.1685842",
      "journal": "J Sports Sci",
      "volume": "38",
      "issue": "1",
      "raw": "Associations of accelerometer-measured sedentary time, sedentary bouts, and physical activity with adiposity and fitness in children \n\t\t \n\t\t\t M A Jones \n\t\t \n\t\t \n\t\t\t P M Skidmore \n\t\t \n\t\t \n\t\t\t L Stoner \n\t\t \n\t\t \n\t\t\t H Harrex \n\t\t \n\t\t \n\t\t\t P Saeedi \n\t\t \n\t\t \n\t\t\t K Black \n\t\t \n\t\t 10.1080/02640414.2019.1685842 \n\t\t Medline: 31665975] 106 \n\t \n\t \n\t\t J Sports Sci \n\t\t \n\t\t\t 38 \n\t\t\t 1 \n\t\t\t \n\t\t\t 2020 \n\t\t \n\t \n\t Jones MA, Skidmore PM, Stoner L, Harrex H, Saeedi P, Black K, et al. Associations of accelerometer-measured sedentary time, sedentary bouts, and physical activity with adiposity and fitness in children. J Sports Sci 2020;38(1):114-120. [doi: 10.1080/02640414.2019.1685842] [Medline: 31665975] 106"
    },
    {
      "title": "Postoperative recovery of accelerometer-based physical activity in older cancer patients",
      "authors": [
        "L Jonker",
        "S Hendriks",
        "M Lahr",
        "B Van Munster",
        "G De Bock",
        "B Van Leeuwen"
      ],
      "year": 2020,
      "doi": "10.1016/j.ejso.2020.06.012",
      "journal": "Eur J Surg Oncol",
      "volume": "46",
      "issue": "11",
      "raw": "Postoperative recovery of accelerometer-based physical activity in older cancer patients \n\t\t \n\t\t\t L T Jonker \n\t\t \n\t\t \n\t\t\t S Hendriks \n\t\t \n\t\t \n\t\t\t M M Lahr \n\t\t \n\t\t \n\t\t\t B C Van Munster \n\t\t \n\t\t \n\t\t\t G H De Bock \n\t\t \n\t\t \n\t\t\t B L Van Leeuwen \n\t\t \n\t\t 10.1016/j.ejso.2020.06.012 \n\t\t Medline: 32682650] 107 \n\t \n\t \n\t\t Eur J Surg Oncol \n\t\t \n\t\t\t 46 \n\t\t\t 11 \n\t\t\t \n\t\t\t 2020 \n\t\t \n\t \n\t FREE Full text \n\t Jonker LT, Hendriks S, Lahr MM, van Munster BC, de Bock GH, van Leeuwen BL. Postoperative recovery of accelerometer-based physical activity in older cancer patients. Eur J Surg Oncol 2020;46(11):2083-2090 [FREE Full text] [doi: 10.1016/j.ejso.2020.06.012] [Medline: 32682650] 107"
    },
    {
      "title": "Increased parasympathetic cardiac modulation in patients with acute exacerbation of COPD: how should we interpret it?",
      "authors": [
        "E Kabbach",
        "A Mazzuco",
        "A Borghi-Silva",
        "R Cabiddu",
        "A Agnoleto",
        "J Barbosa"
      ],
      "year": 2017,
      "doi": "10.2147/COPD.S134498",
      "journal": "Int J Chron Obstruct Pulmon Dis",
      "volume": "12",
      "raw": "Increased parasympathetic cardiac modulation in patients with acute exacerbation of COPD: how should we interpret it? \n\t\t \n\t\t\t E Z Kabbach \n\t\t \n\t\t \n\t\t\t A Mazzuco \n\t\t \n\t\t \n\t\t\t A Borghi-Silva \n\t\t \n\t\t \n\t\t\t R Cabiddu \n\t\t \n\t\t \n\t\t\t A G Agnoleto \n\t\t \n\t\t \n\t\t\t J F Barbosa \n\t\t \n\t\t 10.2147/COPD.S134498 \n\t\t Medline: 28814850] 108 \n\t \n\t \n\t\t Int J Chron Obstruct Pulmon Dis \n\t\t \n\t\t\t 12 \n\t\t\t \n\t\t\t 2017 \n\t\t \n\t \n\t FREE Full text \n\t Kabbach EZ, Mazzuco A, Borghi-Silva A, Cabiddu R, Agnoleto AG, Barbosa JF, et al. Increased parasympathetic cardiac modulation in patients with acute exacerbation of COPD: how should we interpret it? Int J Chron Obstruct Pulmon Dis 2017;12:2221-2230 [FREE Full text] [doi: 10.2147/COPD.S134498] [Medline: 28814850] 108"
    },
    {
      "title": "Relationship between subjective fatigue, physical activity, and sleep indices in nurses working 16-hour night shifts in a rotating two-shift system",
      "authors": [
        "H Kagamiyama",
        "R Yano"
      ],
      "year": 2018,
      "doi": "10.2185/jrm.2951",
      "journal": "J Rural Med",
      "volume": "13",
      "issue": "1",
      "raw": "Relationship between subjective fatigue, physical activity, and sleep indices in nurses working 16-hour night shifts in a rotating two-shift system \n\t\t \n\t\t\t H Kagamiyama \n\t\t \n\t\t \n\t\t\t R Yano \n\t\t \n\t\t 10.2185/jrm.2951 \n\t\t Medline: 29875894] 109 \n\t \n\t \n\t\t J Rural Med \n\t\t \n\t\t\t 13 \n\t\t\t 1 \n\t\t\t \n\t\t\t 2018 \n\t\t \n\t \n\t FREE Full text \n\t Kagamiyama H, Yano R. Relationship between subjective fatigue, physical activity, and sleep indices in nurses working 16-hour night shifts in a rotating two-shift system. J Rural Med 2018;13(1):26-32 [FREE Full text] [doi: 10.2185/jrm.2951] [Medline: 29875894] 109"
    },
    {
      "title": "Early prolonged ambulatory cardiac monitoring in stroke (EPACS): an open-label randomised controlled trial",
      "authors": [
        "A Kaura",
        "L Sztriha",
        "F Chan",
        "J Aeron-Thomas",
        "N Gall",
        "B Piechowski-Jozwiak"
      ],
      "year": 2019,
      "doi": "10.1186/s40001-019-0383-8",
      "journal": "Eur J Med Res",
      "volume": "24",
      "issue": "1",
      "pages": "25",
      "raw": "Early prolonged ambulatory cardiac monitoring in stroke (EPACS): an open-label randomised controlled trial \n\t\t \n\t\t\t A Kaura \n\t\t \n\t\t \n\t\t\t L Sztriha \n\t\t \n\t\t \n\t\t\t F K Chan \n\t\t \n\t\t \n\t\t\t J Aeron-Thomas \n\t\t \n\t\t \n\t\t\t N Gall \n\t\t \n\t\t \n\t\t\t B Piechowski-Jozwiak \n\t\t \n\t\t 10.1186/s40001-019-0383-8 \n\t\t Medline: 31349792] 110 \n\t \n\t \n\t\t Eur J Med Res \n\t\t \n\t\t\t 24 \n\t\t\t 1 \n\t\t\t 25 \n\t\t\t 2019 \n\t\t \n\t \n\t FREE Full text \n\t Kaura A, Sztriha L, Chan FK, Aeron-Thomas J, Gall N, Piechowski-Jozwiak B, et al. Early prolonged ambulatory cardiac monitoring in stroke (EPACS): an open-label randomised controlled trial. Eur J Med Res 2019;24(1):25 [FREE Full text] [doi: 10.1186/s40001-019-0383-8] [Medline: 31349792] 110"
    },
    {
      "title": "The usefulness of a wearable device in daily physical activity monitoring for the hospitalized patients undergoing lumbar surgery",
      "authors": [
        "D Kim",
        "K Nam",
        "B Choi",
        "I Han",
        "T Jeon",
        "S Park"
      ],
      "year": 2019,
      "doi": "10.3340/jkns.2018.0131",
      "journal": "J Korean Neurosurg Soc",
      "volume": "62",
      "issue": "5",
      "raw": "The usefulness of a wearable device in daily physical activity monitoring for the hospitalized patients undergoing lumbar surgery \n\t\t \n\t\t\t D H Kim \n\t\t \n\t\t \n\t\t\t K H Nam \n\t\t \n\t\t \n\t\t\t B K Choi \n\t\t \n\t\t \n\t\t\t I H Han \n\t\t \n\t\t \n\t\t\t T J Jeon \n\t\t \n\t\t \n\t\t\t S Y Park \n\t\t \n\t\t 10.3340/jkns.2018.0131 \n\t\t Medline: 31337197] 111 \n\t \n\t \n\t\t J Korean Neurosurg Soc \n\t\t \n\t\t\t 62 \n\t\t\t 5 \n\t\t\t \n\t\t\t 2019 \n\t\t \n\t \n\t FREE Full text \n\t Kim DH, Nam KH, Choi BK, Han IH, Jeon TJ, Park SY. The usefulness of a wearable device in daily physical activity monitoring for the hospitalized patients undergoing lumbar surgery. J Korean Neurosurg Soc 2019;62(5):561-566 [FREE Full text] [doi: 10.3340/jkns.2018.0131] [Medline: 31337197] 111"
    },
    {
      "title": "Specific physical activities, sedentary behaviours and sleep as long-term predictors of accelerometer-measured physical activity in 91,648 adults: a prospective cohort study",
      "authors": [
        "Y Kim",
        "K Wijndaele",
        "S Sharp",
        "T Strain",
        "M Pearce",
        "T White"
      ],
      "year": 2019,
      "doi": "10.1186/s12966-019-0802-9",
      "journal": "Int J Behav Nutr Phys Act",
      "volume": "16",
      "issue": "1",
      "pages": "41",
      "raw": "Specific physical activities, sedentary behaviours and sleep as long-term predictors of accelerometer-measured physical activity in 91,648 adults: a prospective cohort study \n\t\t \n\t\t\t Y Kim \n\t\t \n\t\t \n\t\t\t K Wijndaele \n\t\t \n\t\t \n\t\t\t S J Sharp \n\t\t \n\t\t \n\t\t\t T Strain \n\t\t \n\t\t \n\t\t\t M Pearce \n\t\t \n\t\t \n\t\t\t T White \n\t\t \n\t\t 10.1186/s12966-019-0802-9 \n\t\t Medline: 31064403] 112 \n\t \n\t \n\t\t Int J Behav Nutr Phys Act \n\t\t \n\t\t\t 16 \n\t\t\t 1 \n\t\t\t 41 \n\t\t\t 2019 \n\t\t \n\t \n\t FREE Full text \n\t Kim Y, Wijndaele K, Sharp SJ, Strain T, Pearce M, White T, et al. Specific physical activities, sedentary behaviours and sleep as long-term predictors of accelerometer-measured physical activity in 91,648 adults: a prospective cohort study. Int J Behav Nutr Phys Act 2019;16(1):41 [FREE Full text] [doi: 10.1186/s12966-019-0802-9] [Medline: 31064403] 112"
    },
    {
      "title": "Association of modifiable lifestyle factors with cortical amyloid burden and cerebral glucose metabolism in older adults with mild cognitive impairment",
      "authors": [
        "N Kimura",
        "Y Aso",
        "K Yabuuchi",
        "M Ishibashi",
        "D Hori",
        "Y Sasaki"
      ],
      "year": 2020,
      "doi": "10.1001/jamanetworkopen.2020.5719",
      "journal": "JAMA Netw Open",
      "volume": "3",
      "issue": "6",
      "pages": "205719",
      "raw": "Association of modifiable lifestyle factors with cortical amyloid burden and cerebral glucose metabolism in older adults with mild cognitive impairment \n\t\t \n\t\t\t N Kimura \n\t\t \n\t\t \n\t\t\t Y Aso \n\t\t \n\t\t \n\t\t\t K Yabuuchi \n\t\t \n\t\t \n\t\t\t M Ishibashi \n\t\t \n\t\t \n\t\t\t D Hori \n\t\t \n\t\t \n\t\t\t Y Sasaki \n\t\t \n\t\t 10.1001/jamanetworkopen.2020.5719 \n\t\t Medline: 32515796] 113 \n\t \n\t \n\t\t JAMA Netw Open \n\t\t \n\t\t\t 3 \n\t\t\t 6 \n\t\t\t 205719 \n\t\t\t 2020 \n\t\t \n\t \n\t FREE Full text \n\t Kimura N, Aso Y, Yabuuchi K, Ishibashi M, Hori D, Sasaki Y, et al. Association of modifiable lifestyle factors with cortical amyloid burden and cerebral glucose metabolism in older adults with mild cognitive impairment. JAMA Netw Open 2020;3(6):e205719 [FREE Full text] [doi: 10.1001/jamanetworkopen.2020.5719] [Medline: 32515796] 113"
    },
    {
      "title": "Nocturnal heart rate variability in 1-year-old infants analyzed by using the least square cosine spectrum method",
      "authors": [
        "Y Kochiya",
        "A Hirabayashi",
        "Y Ichimaru"
      ],
      "year": 2017,
      "doi": "10.1186/s40101-017-0152-8",
      "journal": "J Physiol Anthropol",
      "volume": "36",
      "issue": "1",
      "pages": "36",
      "raw": "Nocturnal heart rate variability in 1-year-old infants analyzed by using the least square cosine spectrum method \n\t\t \n\t\t\t Y Kochiya \n\t\t \n\t\t \n\t\t\t A Hirabayashi \n\t\t \n\t\t \n\t\t\t Y Ichimaru \n\t\t \n\t\t 10.1186/s40101-017-0152-8 \n\t\t Medline: 28915915] 114 \n\t \n\t \n\t\t J Physiol Anthropol \n\t\t \n\t\t\t 36 \n\t\t\t 1 \n\t\t\t 36 \n\t\t\t 2017 \n\t\t \n\t \n\t FREE Full text \n\t Kochiya Y, Hirabayashi A, Ichimaru Y. Nocturnal heart rate variability in 1-year-old infants analyzed by using the least square cosine spectrum method. J Physiol Anthropol 2017;36(1):36 [FREE Full text] [doi: 10.1186/s40101-017-0152-8] [Medline: 28915915] 114"
    },
    {
      "title": "Efficacy of telemedical interventional management in patients with heart failure (TIM-HF2): a randomised, controlled, parallel-group, unmasked trial",
      "authors": [
        "F Koehler",
        "K Koehler",
        "O Deckwart",
        "S Prescher",
        "K Wegscheider",
        "B Kirwan"
      ],
      "year": 2018,
      "doi": "10.1016/s0140-6736(18)31880-4",
      "journal": "Lancet",
      "volume": "392",
      "issue": "10152",
      "raw": "Efficacy of telemedical interventional management in patients with heart failure (TIM-HF2): a randomised, controlled, parallel-group, unmasked trial \n\t\t \n\t\t\t F Koehler \n\t\t \n\t\t \n\t\t\t K Koehler \n\t\t \n\t\t \n\t\t\t O Deckwart \n\t\t \n\t\t \n\t\t\t S Prescher \n\t\t \n\t\t \n\t\t\t K Wegscheider \n\t\t \n\t\t \n\t\t\t B A Kirwan \n\t\t \n\t\t 10.1016/s0140-6736(18)31880-4 \n\t\t Medline: 30153985] 115 \n\t \n\t \n\t\t Lancet \n\t\t \n\t\t\t 392 \n\t\t\t 10152 \n\t\t\t \n\t\t\t 2018 \n\t\t \n\t \n\t FREE Full text \n\t Koehler F, Koehler K, Deckwart O, Prescher S, Wegscheider K, Kirwan BA, et al. Efficacy of telemedical interventional management in patients with heart failure (TIM-HF2): a randomised, controlled, parallel-group, unmasked trial. Lancet 2018;392(10152):1047-1057 [FREE Full text] [doi: 10.1016/S0140-6736(18)31880-4] [Medline: 30153985] 115"
    },
    {
      "title": "Factors associated with step numbers in acutely hospitalized older adults: the hospital-activities of daily living study",
      "authors": [
        "D Kolk",
        "J Aarden",
        "J Macneil-Vroomen",
        "L Reichardt",
        "R Van Seben",
        "M Van Der Schaaf",
        "Hospital-Adl Study Group"
      ],
      "year": 2021,
      "doi": "10.1016/j.jamda.2020.06.027",
      "journal": "J Am Med Dir Assoc",
      "volume": "22",
      "issue": "2",
      "raw": "Factors associated with step numbers in acutely hospitalized older adults: the hospital-activities of daily living study \n\t\t \n\t\t\t D Kolk \n\t\t \n\t\t \n\t\t\t J J Aarden \n\t\t \n\t\t \n\t\t\t J L Macneil-Vroomen \n\t\t \n\t\t \n\t\t\t L A Reichardt \n\t\t \n\t\t \n\t\t\t R Van Seben \n\t\t \n\t\t \n\t\t\t M Van Der Schaaf \n\t\t \n\t\t \n\t\t\t Hospital-Adl Study Group \n\t\t \n\t\t 10.1016/j.jamda.2020.06.027 \n\t\t Medline: 32713773] 116 \n\t \n\t \n\t\t J Am Med Dir Assoc \n\t\t \n\t\t\t 22 \n\t\t\t 2 \n\t\t\t \n\t\t\t 2021 \n\t\t \n\t \n\t FREE Full text \n\t Kolk D, Aarden JJ, MacNeil-Vroomen JL, Reichardt LA, van Seben R, van der Schaaf M, Hospital-ADL Study Group. Factors associated with step numbers in acutely hospitalized older adults: the hospital-activities of daily living study. J Am Med Dir Assoc 2021;22(2):425-432 [FREE Full text] [doi: 10.1016/j.jamda.2020.06.027] [Medline: 32713773] 116"
    },
    {
      "title": "Finding suitable clinical endpoints for a potential treatment of a rare genetic disease: the case of ARID1B",
      "authors": [
        "M Kruizinga",
        "R Zuiker",
        "E Sali",
        "M De Kam",
        "R Doll",
        "G Groeneveld"
      ],
      "year": 2020,
      "doi": "10.1007/s13311-020-00868-9",
      "journal": "Neurotherapeutics",
      "volume": "17",
      "issue": "3",
      "raw": "Finding suitable clinical endpoints for a potential treatment of a rare genetic disease: the case of ARID1B \n\t\t \n\t\t\t M D Kruizinga \n\t\t \n\t\t \n\t\t\t R G Zuiker \n\t\t \n\t\t \n\t\t\t E Sali \n\t\t \n\t\t \n\t\t\t M L De Kam \n\t\t \n\t\t \n\t\t\t R J Doll \n\t\t \n\t\t \n\t\t\t G J Groeneveld \n\t\t \n\t\t 10.1007/s13311-020-00868-9 \n\t\t Medline: 32462407] 117 \n\t \n\t \n\t\t Neurotherapeutics \n\t\t \n\t\t\t 17 \n\t\t\t 3 \n\t\t\t \n\t\t\t 2020 \n\t\t \n\t \n\t FREE Full text \n\t Kruizinga MD, Zuiker RG, Sali E, de Kam ML, Doll RJ, Groeneveld GJ, et al. Finding suitable clinical endpoints for a potential treatment of a rare genetic disease: the case of ARID1B. Neurotherapeutics 2020;17(3):1300-1310 [FREE Full text] [doi: 10.1007/s13311-020-00868-9] [Medline: 32462407] 117"
    },
    {
      "title": "Sedentary behavior in the workplace: a potential occupational hazard for radiologists",
      "authors": [
        "D Lamar",
        "S Chou",
        "J Medverd",
        "J Swanson"
      ],
      "year": 2016,
      "doi": "10.1067/j.cpradiol.2015.10.007",
      "journal": "Curr Probl Diagn Radiol",
      "volume": "45",
      "issue": "4",
      "raw": "Sedentary behavior in the workplace: a potential occupational hazard for radiologists \n\t\t \n\t\t\t D L Lamar \n\t\t \n\t\t \n\t\t\t S H Chou \n\t\t \n\t\t \n\t\t\t J R Medverd \n\t\t \n\t\t \n\t\t\t J O Swanson \n\t\t \n\t\t 10.1067/j.cpradiol.2015.10.007 \n\t\t Medline: 26675263] 118 \n\t \n\t \n\t\t Curr Probl Diagn Radiol \n\t\t \n\t\t\t 45 \n\t\t\t 4 \n\t\t\t \n\t\t\t 2016 \n\t\t \n\t \n\t Lamar DL, Chou SH, Medverd JR, Swanson JO. Sedentary behavior in the workplace: a potential occupational hazard for radiologists. Curr Probl Diagn Radiol 2016;45(4):253-257. [doi: 10.1067/j.cpradiol.2015.10.007] [Medline: 26675263] 118"
    },
    {
      "title": "Consistent sleep onset and maintenance of body weight after weight loss: an analysis of data from the NoHoW trial",
      "authors": [
        "S Larsen",
        "G Horgan",
        "M Mikkelsen",
        "A Palmeira",
        "S Scott",
        "C Duarte"
      ],
      "year": 2020,
      "doi": "10.1371/journal.pmed.1003168",
      "journal": "PLoS Med",
      "volume": "17",
      "issue": "7",
      "pages": "1003168",
      "raw": "Consistent sleep onset and maintenance of body weight after weight loss: an analysis of data from the NoHoW trial \n\t\t \n\t\t\t S C Larsen \n\t\t \n\t\t \n\t\t\t G Horgan \n\t\t \n\t\t \n\t\t\t M K Mikkelsen \n\t\t \n\t\t \n\t\t\t A L Palmeira \n\t\t \n\t\t \n\t\t\t S Scott \n\t\t \n\t\t \n\t\t\t C Duarte \n\t\t \n\t\t 10.1371/journal.pmed.1003168 \n\t\t Medline: 32673309] 119 \n\t \n\t \n\t\t PLoS Med \n\t\t \n\t\t\t 17 \n\t\t\t 7 \n\t\t\t 1003168 \n\t\t\t 2020 \n\t\t \n\t \n\t FREE Full text \n\t Larsen SC, Horgan G, Mikkelsen MK, Palmeira AL, Scott S, Duarte C, et al. Consistent sleep onset and maintenance of body weight after weight loss: an analysis of data from the NoHoW trial. PLoS Med 2020;17(7):e1003168 [FREE Full text] [doi: 10.1371/journal.pmed.1003168] [Medline: 32673309] 119"
    },
    {
      "title": "The association between daily physical exercise and pain among women with fibromyalgia: the moderating role of pain catastrophizing",
      "authors": [
        "A Lazaridou",
        "M Paschali",
        "K Schreiber",
        "L Galenkamp",
        "M Berry",
        "T Paschalis"
      ],
      "year": 2020,
      "doi": "10.1097/PR9.0000000000000832",
      "journal": "Pain Rep",
      "volume": "5",
      "issue": "4",
      "pages": "832",
      "raw": "The association between daily physical exercise and pain among women with fibromyalgia: the moderating role of pain catastrophizing \n\t\t \n\t\t\t A Lazaridou \n\t\t \n\t\t \n\t\t\t M Paschali \n\t\t \n\t\t \n\t\t\t K Schreiber \n\t\t \n\t\t \n\t\t\t L Galenkamp \n\t\t \n\t\t \n\t\t\t M Berry \n\t\t \n\t\t \n\t\t\t T Paschalis \n\t\t \n\t\t 10.1097/PR9.0000000000000832 \n\t\t Medline: 32766468] 120 \n\t \n\t \n\t\t Pain Rep \n\t\t \n\t\t\t 5 \n\t\t\t 4 \n\t\t\t 832 \n\t\t\t 2020 \n\t\t \n\t \n\t FREE Full text \n\t Lazaridou A, Paschali M, Schreiber K, Galenkamp L, Berry M, Paschalis T, et al. The association between daily physical exercise and pain among women with fibromyalgia: the moderating role of pain catastrophizing. Pain Rep 2020;5(4):e832 [FREE Full text] [doi: 10.1097/PR9.0000000000000832] [Medline: 32766468] 120"
    },
    {
      "title": "Performance analysis of walking of 10,000 regular users of a connected activity tracker",
      "authors": [
        "Le Hello",
        "C Trombert",
        "B Morel",
        "A Chieh",
        "A Brouard",
        "B Boissier"
      ],
      "year": 2018,
      "doi": "10.1016/j.jdmv.2018.04.001",
      "journal": "J Med Vasc",
      "volume": "43",
      "issue": "4",
      "raw": "Performance analysis of walking of 10,000 regular users of a connected activity tracker \n\t\t \n\t\t\t Le Hello \n\t\t \n\t\t \n\t\t\t C Trombert \n\t\t \n\t\t \n\t\t\t B Morel \n\t\t \n\t\t \n\t\t\t A Chieh \n\t\t \n\t\t \n\t\t\t A Brouard \n\t\t \n\t\t \n\t\t\t B Boissier \n\t\t \n\t\t \n\t\t\t C \n\t\t \n\t\t 10.1016/j.jdmv.2018.04.001 \n\t\t Medline: 29981731] 121 \n\t \n\t \n\t\t J Med Vasc \n\t\t \n\t\t\t 43 \n\t\t\t 4 \n\t\t\t \n\t\t\t 2018 \n\t\t \n\t \n\t Le Hello C, Trombert B, Morel A, Chieh A, Brouard B, Boissier C. Performance analysis of walking of 10,000 regular users of a connected activity tracker. J Med Vasc 2018;43(4):231-237. [doi: 10.1016/j.jdmv.2018.04.001] [Medline: 29981731] 121"
    },
    {
      "title": "Clinical feasibility of continuously monitored data for heart rate, physical activity, and sleeping by wearable activity trackers in patients with thyrotoxicosis: protocol for a prospective longitudinal observational study",
      "authors": [
        "J Lee",
        "D Lee",
        "T Oh",
        "K Kim",
        "S Choi",
        "S Lim"
      ],
      "year": 2018,
      "doi": "10.2196/resprot.8119",
      "journal": "JMIR Res Protoc",
      "volume": "7",
      "issue": "2",
      "raw": "Clinical feasibility of continuously monitored data for heart rate, physical activity, and sleeping by wearable activity trackers in patients with thyrotoxicosis: protocol for a prospective longitudinal observational study \n\t\t \n\t\t\t J E Lee \n\t\t \n\t\t \n\t\t\t D H Lee \n\t\t \n\t\t \n\t\t\t T J Oh \n\t\t \n\t\t \n\t\t\t K M Kim \n\t\t \n\t\t \n\t\t\t S H Choi \n\t\t \n\t\t \n\t\t\t S Lim \n\t\t \n\t\t 10.2196/resprot.8119 \n\t\t Medline: 29467121] 122 \n\t \n\t \n\t\t JMIR Res Protoc \n\t\t \n\t\t\t 7 \n\t\t\t 2 \n\t\t\t 2018 \n\t\t \n\t \n\t FREE Full text \n\t Lee JE, Lee DH, Oh TJ, Kim KM, Choi SH, Lim S, et al. Clinical feasibility of continuously monitored data for heart rate, physical activity, and sleeping by wearable activity trackers in patients with thyrotoxicosis: protocol for a prospective longitudinal observational study. JMIR Res Protoc 2018;7(2):e49 [FREE Full text] [doi: 10.2196/resprot.8119] [Medline: 29467121] 122"
    },
    {
      "title": "Characteristics associated with the differential activity of nondominant and dominant affected hands in patients with poststroke right hemiparesis",
      "authors": [
        "J Lee",
        "S Chen",
        "C Tsai",
        "H Chung",
        "W Chang"
      ],
      "year": 2020,
      "doi": "10.1155/2020/2387378",
      "journal": "Occup Ther Int",
      "volume": "2020",
      "pages": "2387378",
      "raw": "Characteristics associated with the differential activity of nondominant and dominant affected hands in patients with poststroke right hemiparesis \n\t\t \n\t\t\t J P Lee \n\t\t \n\t\t \n\t\t\t S Chen \n\t\t \n\t\t \n\t\t\t C T Tsai \n\t\t \n\t\t \n\t\t\t H C Chung \n\t\t \n\t\t \n\t\t\t W D Chang \n\t\t \n\t\t 10.1155/2020/2387378 \n\t\t Medline: 32565757] 123 \n\t \n\t \n\t\t Occup Ther Int \n\t\t \n\t\t\t 2020 \n\t\t\t 2387378 \n\t\t\t 2020 \n\t\t \n\t \n\t FREE Full text \n\t Lee JP, Chen S, Tsai CT, Chung HC, Chang WD. Characteristics associated with the differential activity of nondominant and dominant affected hands in patients with poststroke right hemiparesis. Occup Ther Int 2020;2020:2387378 [FREE Full text] [doi: 10.1155/2020/2387378] [Medline: 32565757] 123"
    },
    {
      "title": "Physical activity in women of reproductive age in a transitioning rural polish population",
      "authors": [
        "K Lee",
        "M Rogers",
        "A Galbarczyk",
        "G Jasienska",
        "K Clancy"
      ],
      "year": 2019,
      "doi": "10.1002/ajhb.23231",
      "journal": "Am J Hum Biol",
      "volume": "31",
      "issue": "3",
      "pages": "23231",
      "raw": "Physical activity in women of reproductive age in a transitioning rural polish population \n\t\t \n\t\t\t K M Lee \n\t\t \n\t\t \n\t\t\t M P Rogers \n\t\t \n\t\t \n\t\t\t A Galbarczyk \n\t\t \n\t\t \n\t\t\t G Jasienska \n\t\t \n\t\t \n\t\t\t K B Clancy \n\t\t \n\t\t 10.1002/ajhb.23231 \n\t\t Medline: 30835924] 124 \n\t \n\t \n\t\t Am J Hum Biol \n\t\t \n\t\t\t 31 \n\t\t\t 3 \n\t\t\t 23231 \n\t\t\t 2019 \n\t\t \n\t \n\t Lee KM, Rogers MP, Galbarczyk A, Jasienska G, Clancy KB. Physical activity in women of reproductive age in a transitioning rural polish population. Am J Hum Biol 2019;31(3):e23231. [doi: 10.1002/ajhb.23231] [Medline: 30835924] 124"
    },
    {
      "title": "Investigating the within-person relationships between activity levels and sleep duration using Fitbit data",
      "authors": [
        "Y Liao",
        "M Robertson",
        "Winne Wu",
        "I Le",
        "T Balachandran"
      ],
      "year": 2021,
      "doi": "10.1093/tbm/ibaa071",
      "journal": "Transl Behav Med",
      "volume": "11",
      "issue": "2",
      "raw": "Investigating the within-person relationships between activity levels and sleep duration using Fitbit data \n\t\t \n\t\t\t Y Liao \n\t\t \n\t\t \n\t\t\t M C Robertson \n\t\t \n\t\t \n\t\t\t Winne A Wu \n\t\t \n\t\t \n\t\t\t I H Le \n\t\t \n\t\t \n\t\t\t T A Balachandran \n\t\t \n\t\t \n\t\t\t D D \n\t\t \n\t\t 10.1093/tbm/ibaa071 \n\t\t Medline: 32667039] 125 \n\t \n\t \n\t\t Transl Behav Med \n\t\t \n\t\t\t 11 \n\t\t\t 2 \n\t\t\t \n\t\t\t 2021 \n\t\t \n\t \n\t Liao Y, Robertson MC, Winne A, Wu IH, Le TA, Balachandran DD, et al. Investigating the within-person relationships between activity levels and sleep duration using Fitbit data. Transl Behav Med 2021;11(2):619-624. [doi: 10.1093/tbm/ibaa071] [Medline: 32667039] 125"
    },
    {
      "title": "Physical activity among hospitalised older people: insights from upper and lower limb accelerometry",
      "authors": [
        "S Lim",
        "R Dodds",
        "D Bacon",
        "A Sayer",
        "H Roberts"
      ],
      "year": 2018,
      "doi": "10.1007/s40520-018-0930-0",
      "journal": "Aging Clin Exp Res",
      "volume": "30",
      "issue": "11",
      "raw": "Physical activity among hospitalised older people: insights from upper and lower limb accelerometry \n\t\t \n\t\t\t S E Lim \n\t\t \n\t\t \n\t\t\t R Dodds \n\t\t \n\t\t \n\t\t\t D Bacon \n\t\t \n\t\t \n\t\t\t A A Sayer \n\t\t \n\t\t \n\t\t\t H C Roberts \n\t\t \n\t\t 10.1007/s40520-018-0930-0 \n\t\t Medline: 29542070] 126 \n\t \n\t \n\t\t Aging Clin Exp Res \n\t\t \n\t\t\t 30 \n\t\t\t 11 \n\t\t\t \n\t\t\t 2018 \n\t\t \n\t \n\t FREE Full text \n\t Lim SE, Dodds R, Bacon D, Sayer AA, Roberts HC. Physical activity among hospitalised older people: insights from upper and lower limb accelerometry. Aging Clin Exp Res 2018;30(11):1363-1369 [FREE Full text] [doi: 10.1007/s40520-018-0930-0] [Medline: 29542070] 126"
    },
    {
      "title": "Beyond fitness tracking: the use of consumer-grade wearable data from normal volunteers in cardiovascular and lipidomics research",
      "authors": [
        "W Lim",
        "S Davila",
        "J Teo",
        "C Yang",
        "C Pua",
        "C Bl\u00f6cker"
      ],
      "year": 2018,
      "doi": "10.1371/journal.pbio.2004285",
      "journal": "PLoS Biol",
      "volume": "16",
      "issue": "2",
      "pages": "2004285",
      "raw": "Beyond fitness tracking: the use of consumer-grade wearable data from normal volunteers in cardiovascular and lipidomics research \n\t\t \n\t\t\t W K Lim \n\t\t \n\t\t \n\t\t\t S Davila \n\t\t \n\t\t \n\t\t\t J X Teo \n\t\t \n\t\t \n\t\t\t C Yang \n\t\t \n\t\t \n\t\t\t C J Pua \n\t\t \n\t\t \n\t\t\t C Bl\u00f6cker \n\t\t \n\t\t 10.1371/journal.pbio.2004285 \n\t\t Medline: 29485983] 127 \n\t \n\t \n\t\t PLoS Biol \n\t\t \n\t\t\t 16 \n\t\t\t 2 \n\t\t\t 2004285 \n\t\t\t 2018 \n\t\t \n\t \n\t FREE Full text \n\t Lim WK, Davila S, Teo JX, Yang C, Pua CJ, Bl\u00f6cker C, et al. Beyond fitness tracking: the use of consumer-grade wearable data from normal volunteers in cardiovascular and lipidomics research. PLoS Biol 2018;16(2):e2004285 [FREE Full text] [doi: 10.1371/journal.pbio.2004285] [Medline: 29485983] 127"
    },
    {
      "title": "Association of habitual physical activity with cardiovascular disease risk",
      "authors": [
        "H Lin",
        "M Sardana",
        "Y Zhang",
        "C Liu",
        "L Trinquart",
        "E Benjamin"
      ],
      "year": 2020,
      "doi": "10.1161/CIRCRESAHA.120.317578",
      "journal": "Circ Res",
      "volume": "127",
      "issue": "10",
      "raw": "Association of habitual physical activity with cardiovascular disease risk \n\t\t \n\t\t\t H Lin \n\t\t \n\t\t \n\t\t\t M Sardana \n\t\t \n\t\t \n\t\t\t Y Zhang \n\t\t \n\t\t \n\t\t\t C Liu \n\t\t \n\t\t \n\t\t\t L Trinquart \n\t\t \n\t\t \n\t\t\t E J Benjamin \n\t\t \n\t\t 10.1161/CIRCRESAHA.120.317578 \n\t\t Medline: 32842915] 128 \n\t \n\t \n\t\t Circ Res \n\t\t \n\t\t\t 127 \n\t\t\t 10 \n\t\t\t \n\t\t\t 2020 \n\t\t \n\t \n\t Lin H, Sardana M, Zhang Y, Liu C, Trinquart L, Benjamin EJ, et al. Association of habitual physical activity with cardiovascular disease risk. Circ Res 2020;127(10):1253-1260. [doi: 10.1161/CIRCRESAHA.120.317578] [Medline: 32842915] 128"
    },
    {
      "title": "Comparison of self-report and objective measures of physical activity in US adults with osteoarthritis",
      "authors": [
        "S Liu",
        "C Eaton",
        "J Driban",
        "T Mcalindon",
        "K Lapane"
      ],
      "year": 2016,
      "doi": "10.1007/s00296-016-3537-9",
      "journal": "Rheumatol Int",
      "volume": "36",
      "issue": "10",
      "raw": "Comparison of self-report and objective measures of physical activity in US adults with osteoarthritis \n\t\t \n\t\t\t S Liu \n\t\t \n\t\t \n\t\t\t C B Eaton \n\t\t \n\t\t \n\t\t\t J B Driban \n\t\t \n\t\t \n\t\t\t T E Mcalindon \n\t\t \n\t\t \n\t\t\t K L Lapane \n\t\t \n\t\t 10.1007/s00296-016-3537-9 \n\t\t Medline: 27435920] 129 \n\t \n\t \n\t\t Rheumatol Int \n\t\t \n\t\t\t 36 \n\t\t\t 10 \n\t\t\t \n\t\t\t 2016 \n\t\t \n\t \n\t Liu S, Eaton CB, Driban JB, McAlindon TE, Lapane KL. Comparison of self-report and objective measures of physical activity in US adults with osteoarthritis. Rheumatol Int 2016;36(10):1355-1364. [doi: 10.1007/s00296-016-3537-9] [Medline: 27435920] 129"
    },
    {
      "title": "Fitbit step counts during inpatient recovery from cancer surgery as a predictor of readmission",
      "authors": [
        "C Low",
        "D Bovbjerg",
        "S Ahrendt",
        "M Choudry",
        "M Holtzman",
        "H Jones"
      ],
      "year": 2018,
      "doi": "10.1093/abm/kax022",
      "journal": "Ann Behav Med",
      "volume": "52",
      "issue": "1",
      "raw": "Fitbit step counts during inpatient recovery from cancer surgery as a predictor of readmission \n\t\t \n\t\t\t C A Low \n\t\t \n\t\t \n\t\t\t D H Bovbjerg \n\t\t \n\t\t \n\t\t\t S Ahrendt \n\t\t \n\t\t \n\t\t\t M H Choudry \n\t\t \n\t\t \n\t\t\t M Holtzman \n\t\t \n\t\t \n\t\t\t H L Jones \n\t\t \n\t\t 10.1093/abm/kax022 \n\t\t Medline: 29538623] 130 \n\t \n\t \n\t\t Ann Behav Med \n\t\t \n\t\t\t 52 \n\t\t\t 1 \n\t\t\t \n\t\t\t 2018 \n\t\t \n\t \n\t FREE Full text \n\t Low CA, Bovbjerg DH, Ahrendt S, Choudry MH, Holtzman M, Jones HL, et al. Fitbit step counts during inpatient recovery from cancer surgery as a predictor of readmission. Ann Behav Med 2018;52(1):88-92 [FREE Full text] [doi: 10.1093/abm/kax022] [Medline: 29538623] 130"
    },
    {
      "title": "Estimation of symptom severity during chemotherapy from passively sensed data: exploratory study",
      "authors": [
        "C Low",
        "A Dey",
        "D Ferreira",
        "T Kamarck",
        "W Sun",
        "S Bae"
      ],
      "year": 2017,
      "doi": "10.2196/jmir.9046",
      "journal": "J Med Internet Res",
      "volume": "19",
      "issue": "12",
      "pages": "420",
      "raw": "Estimation of symptom severity during chemotherapy from passively sensed data: exploratory study \n\t\t \n\t\t\t C A Low \n\t\t \n\t\t \n\t\t\t A K Dey \n\t\t \n\t\t \n\t\t\t D Ferreira \n\t\t \n\t\t \n\t\t\t T Kamarck \n\t\t \n\t\t \n\t\t\t W Sun \n\t\t \n\t\t \n\t\t\t S Bae \n\t\t \n\t\t 10.2196/jmir.9046 \n\t\t Medline: 29258977] 131 \n\t \n\t \n\t\t J Med Internet Res \n\t\t \n\t\t\t 19 \n\t\t\t 12 \n\t\t\t 420 \n\t\t\t 2017 \n\t\t \n\t \n\t FREE Full text \n\t Low CA, Dey AK, Ferreira D, Kamarck T, Sun W, Bae S, et al. Estimation of symptom severity during chemotherapy from passively sensed data: exploratory study. J Med Internet Res 2017;19(12):e420 [FREE Full text] [doi: 10.2196/jmir.9046] [Medline: 29258977] 131"
    },
    {
      "title": "Using activity trackers to quantify postpartum ambulation: a prospective observational study of ambulation after regional anesthesia and analgesia interventions",
      "authors": [
        "J Ma",
        "R Martin",
        "B Chan",
        "M Gofeld",
        "M Geary",
        "J Laffey"
      ],
      "year": 2018,
      "doi": "10.1097/ALN.0000000000001979",
      "journal": "Anesthesiology",
      "volume": "128",
      "issue": "3",
      "raw": "Using activity trackers to quantify postpartum ambulation: a prospective observational study of ambulation after regional anesthesia and analgesia interventions \n\t\t \n\t\t\t J Ma \n\t\t \n\t\t \n\t\t\t R Martin \n\t\t \n\t\t \n\t\t\t B Chan \n\t\t \n\t\t \n\t\t\t M Gofeld \n\t\t \n\t\t \n\t\t\t M P Geary \n\t\t \n\t\t \n\t\t\t J G Laffey \n\t\t \n\t\t 10.1097/ALN.0000000000001979 \n\t\t Medline: 29135475] 132 \n\t \n\t \n\t\t Anesthesiology \n\t\t \n\t\t\t 128 \n\t\t\t 3 \n\t\t\t \n\t\t\t 2018 \n\t\t \n\t \n\t FREE Full text \n\t Ma J, Martin R, Chan B, Gofeld M, Geary MP, Laffey JG, et al. Using activity trackers to quantify postpartum ambulation: a prospective observational study of ambulation after regional anesthesia and analgesia interventions. Anesthesiology 2018;128(3):598-608 [FREE Full text] [doi: 10.1097/ALN.0000000000001979] [Medline: 29135475] 132"
    },
    {
      "title": "Nocturnal finger skin temperature in menstrual cycle tracking: ambulatory pilot study using a wearable Oura ring",
      "authors": [
        "A Maijala",
        "H Kinnunen",
        "H Koskim\u00e4ki",
        "T J\u00e4ms\u00e4",
        "M Kangas"
      ],
      "year": 2019,
      "doi": "10.1186/s12905-019-0844-9",
      "journal": "BMC Womens Health",
      "volume": "19",
      "issue": "1",
      "pages": "150",
      "raw": "Nocturnal finger skin temperature in menstrual cycle tracking: ambulatory pilot study using a wearable Oura ring \n\t\t \n\t\t\t A Maijala \n\t\t \n\t\t \n\t\t\t H Kinnunen \n\t\t \n\t\t \n\t\t\t H Koskim\u00e4ki \n\t\t \n\t\t \n\t\t\t T J\u00e4ms\u00e4 \n\t\t \n\t\t \n\t\t\t M Kangas \n\t\t \n\t\t 10.1186/s12905-019-0844-9 \n\t\t Medline: 31783840] 133 \n\t \n\t \n\t\t BMC Womens Health \n\t\t \n\t\t\t 19 \n\t\t\t 1 \n\t\t\t 150 \n\t\t\t 2019 \n\t\t \n\t \n\t FREE Full text \n\t Maijala A, Kinnunen H, Koskim\u00e4ki H, J\u00e4ms\u00e4 T, Kangas M. Nocturnal finger skin temperature in menstrual cycle tracking: ambulatory pilot study using a wearable Oura ring. BMC Womens Health 2019;19(1):150 [FREE Full text] [doi: 10.1186/s12905-019-0844-9] [Medline: 31783840] 133"
    },
    {
      "title": "Sensor and survey measures associated with daily fatigue in HIV: findings from a mixed-method study",
      "authors": [
        "M Makic",
        "D Gilbert",
        "C Jankowski",
        "B Reeder",
        "N Al-Salmi",
        "W Starr"
      ],
      "year": 2020,
      "doi": "10.1097/JNC.0000000000000152",
      "journal": "J Assoc Nurses AIDS Care",
      "volume": "31",
      "issue": "1",
      "raw": "Sensor and survey measures associated with daily fatigue in HIV: findings from a mixed-method study \n\t\t \n\t\t\t M B Makic \n\t\t \n\t\t \n\t\t\t D Gilbert \n\t\t \n\t\t \n\t\t\t C Jankowski \n\t\t \n\t\t \n\t\t\t B Reeder \n\t\t \n\t\t \n\t\t\t N Al-Salmi \n\t\t \n\t\t \n\t\t\t W Starr \n\t\t \n\t\t 10.1097/JNC.0000000000000152 \n\t\t Medline: 31860594] 134 \n\t \n\t \n\t\t J Assoc Nurses AIDS Care \n\t\t \n\t\t\t 31 \n\t\t\t 1 \n\t\t\t \n\t\t\t 2020 \n\t\t \n\t \n\t Makic MB, Gilbert D, Jankowski C, Reeder B, Al-Salmi N, Starr W, et al. Sensor and survey measures associated with daily fatigue in HIV: findings from a mixed-method study. J Assoc Nurses AIDS Care 2020;31(1):12-24. [doi: 10.1097/JNC.0000000000000152] [Medline: 31860594] 134"
    },
    {
      "title": "An observational study of recess quality and physical activity in urban primary schools",
      "authors": [
        "W Massey",
        "M Stellino",
        "J Geldhof"
      ],
      "year": 2020,
      "doi": "10.1186/s12889-020-08849-5",
      "journal": "BMC Public Health",
      "volume": "20",
      "issue": "1",
      "pages": "792",
      "raw": "An observational study of recess quality and physical activity in urban primary schools \n\t\t \n\t\t\t W V Massey \n\t\t \n\t\t \n\t\t\t M B Stellino \n\t\t \n\t\t \n\t\t\t J Geldhof \n\t\t \n\t\t 10.1186/s12889-020-08849-5 \n\t\t Medline: 32460860] 135 \n\t \n\t \n\t\t BMC Public Health \n\t\t \n\t\t\t 20 \n\t\t\t 1 \n\t\t\t 792 \n\t\t\t 2020 \n\t\t \n\t \n\t FREE Full text \n\t Massey WV, Stellino MB, Geldhof J. An observational study of recess quality and physical activity in urban primary schools. BMC Public Health 2020;20(1):792 [FREE Full text] [doi: 10.1186/s12889-020-08849-5] [Medline: 32460860] 135"
    },
    {
      "title": "Individual and environmental correlates of school-based recess engagement",
      "authors": [
        "W Massey",
        "M Stellino",
        "M Fraser"
      ],
      "year": 2018,
      "doi": "10.1016/j.pmedr.2018.07.005",
      "journal": "Prev Med Rep",
      "volume": "11",
      "raw": "Individual and environmental correlates of school-based recess engagement \n\t\t \n\t\t\t W V Massey \n\t\t \n\t\t \n\t\t\t M B Stellino \n\t\t \n\t\t \n\t\t\t M Fraser \n\t\t \n\t\t 10.1016/j.pmedr.2018.07.005 \n\t\t Medline: 30094127] 136 \n\t \n\t \n\t\t Prev Med Rep \n\t\t \n\t\t\t 11 \n\t\t\t \n\t\t\t 2018 \n\t\t \n\t \n\t FREE Full text \n\t Massey WV, Stellino MB, Fraser M. Individual and environmental correlates of school-based recess engagement. Prev Med Rep 2018;11:247-253 [FREE Full text] [doi: 10.1016/j.pmedr.2018.07.005] [Medline: 30094127] 136"
    },
    {
      "title": "Remote assessment of disease and relapse in major depressive disorder (RADAR-MDD): a multi-centre prospective cohort study protocol",
      "authors": [
        "F Matcham",
        "Barattieri Di San Pietro",
        "C Bulgari",
        "V De Girolamo",
        "G Dobson",
        "R Eriksson",
        "Radar-Cns Consortium"
      ],
      "year": 2019,
      "doi": "10.1186/s12888-019-2049-z",
      "journal": "BMC Psychiatry",
      "volume": "19",
      "issue": "1",
      "pages": "72",
      "raw": "Remote assessment of disease and relapse in major depressive disorder (RADAR-MDD): a multi-centre prospective cohort study protocol \n\t\t \n\t\t\t F Matcham \n\t\t \n\t\t \n\t\t\t Barattieri Di San Pietro \n\t\t \n\t\t \n\t\t\t C Bulgari \n\t\t \n\t\t \n\t\t\t V De Girolamo \n\t\t \n\t\t \n\t\t\t G Dobson \n\t\t \n\t\t \n\t\t\t R Eriksson \n\t\t \n\t\t \n\t\t\t H \n\t\t \n\t\t \n\t\t\t Radar-Cns Consortium \n\t\t \n\t\t 10.1186/s12888-019-2049-z \n\t\t Medline: 30777041] 137 \n\t \n\t \n\t\t BMC Psychiatry \n\t\t \n\t\t\t 19 \n\t\t\t 1 \n\t\t\t 72 \n\t\t\t 2019 \n\t\t \n\t \n\t FREE Full text \n\t Matcham F, Barattieri di San Pietro C, Bulgari V, de Girolamo G, Dobson R, Eriksson H, RADAR-CNS consortium. Remote assessment of disease and relapse in major depressive disorder (RADAR-MDD): a multi-centre prospective cohort study protocol. BMC Psychiatry 2019;19(1):72 [FREE Full text] [doi: 10.1186/s12888-019-2049-z] [Medline: 30777041] 137"
    },
    {
      "title": "Reconsidering the experience machine: self-reported versus objective measures of physical activity to increase positive affect",
      "authors": [
        "D Mclean",
        "J Nakamura",
        "M Csikszentmihalyi"
      ],
      "year": 2020,
      "doi": "10.1177/1359105318801939",
      "journal": "J Health Psychol",
      "volume": "25",
      "issue": "13-14",
      "raw": "Reconsidering the experience machine: self-reported versus objective measures of physical activity to increase positive affect \n\t\t \n\t\t\t D C Mclean \n\t\t \n\t\t \n\t\t\t J Nakamura \n\t\t \n\t\t \n\t\t\t M Csikszentmihalyi \n\t\t \n\t\t 10.1177/1359105318801939 \n\t\t Medline: 30246550] 138 \n\t \n\t \n\t\t J Health Psychol \n\t\t \n\t\t\t 25 \n\t\t\t 13-14 \n\t\t\t \n\t\t\t 2020 \n\t\t \n\t \n\t McLean DC, Nakamura J, Csikszentmihalyi M. Reconsidering the experience machine: self-reported versus objective measures of physical activity to increase positive affect. J Health Psychol 2020;25(13-14):2428-2439. [doi: 10.1177/1359105318801939] [Medline: 30246550] 138"
    },
    {
      "title": "Daily associations between sleep and physical activity",
      "authors": [
        "M Mead",
        "K Baron",
        "M Sorby",
        "L Irish"
      ],
      "year": 2019,
      "doi": "10.1007/s12529-019-09810-6",
      "journal": "Int J Behav Med",
      "volume": "26",
      "issue": "5",
      "raw": "Daily associations between sleep and physical activity \n\t\t \n\t\t\t M P Mead \n\t\t \n\t\t \n\t\t\t K Baron \n\t\t \n\t\t \n\t\t\t M Sorby \n\t\t \n\t\t \n\t\t\t L A Irish \n\t\t \n\t\t 10.1007/s12529-019-09810-6 \n\t\t Medline: 31372835] 139 \n\t \n\t \n\t\t Int J Behav Med \n\t\t \n\t\t\t 26 \n\t\t\t 5 \n\t\t\t \n\t\t\t 2019 \n\t\t \n\t \n\t Mead MP, Baron K, Sorby M, Irish LA. Daily associations between sleep and physical activity. Int J Behav Med 2019;26(5):562-568. [doi: 10.1007/s12529-019-09810-6] [Medline: 31372835] 139"
    },
    {
      "title": "Characteristics of daily arm activities in patients with COPD",
      "authors": [
        "K Meijer",
        "J Annegarn",
        "V Lima Passos",
        "H Savelberg",
        "A Schols",
        "E Wouters"
      ],
      "year": 2014,
      "doi": "10.1183/09031936.00082513",
      "journal": "Eur Respir J",
      "volume": "43",
      "issue": "6",
      "raw": "Characteristics of daily arm activities in patients with COPD \n\t\t \n\t\t\t K Meijer \n\t\t \n\t\t \n\t\t\t J Annegarn \n\t\t \n\t\t \n\t\t\t V Lima Passos \n\t\t \n\t\t \n\t\t\t H H Savelberg \n\t\t \n\t\t \n\t\t\t A M Schols \n\t\t \n\t\t \n\t\t\t E F Wouters \n\t\t \n\t\t 10.1183/09031936.00082513 \n\t\t Medline: 24558175] 140 \n\t \n\t \n\t\t Eur Respir J \n\t\t \n\t\t\t 43 \n\t\t\t 6 \n\t\t\t \n\t\t\t 2014 \n\t\t \n\t \n\t FREE Full text \n\t Meijer K, Annegarn J, Lima Passos V, Savelberg HH, Schols AM, Wouters EF, et al. Characteristics of daily arm activities in patients with COPD. Eur Respir J 2014;43(6):1631-1641 [FREE Full text] [doi: 10.1183/09031936.00082513] [Medline: 24558175] 140"
    },
    {
      "title": "Variability in physical activity assessed with accelerometer is an independent predictor of mortality in CHF patients",
      "authors": [
        "M Melin",
        "I Hagerman",
        "A Gonon",
        "T Gustafsson",
        "E Rullman"
      ],
      "year": 2016,
      "doi": "10.1371/journal.pone.0153036",
      "journal": "PLoS One",
      "volume": "11",
      "issue": "4",
      "pages": "153036",
      "raw": "Variability in physical activity assessed with accelerometer is an independent predictor of mortality in CHF patients \n\t\t \n\t\t\t M Melin \n\t\t \n\t\t \n\t\t\t I Hagerman \n\t\t \n\t\t \n\t\t\t A Gonon \n\t\t \n\t\t \n\t\t\t T Gustafsson \n\t\t \n\t\t \n\t\t\t E Rullman \n\t\t \n\t\t 10.1371/journal.pone.0153036 \n\t\t Medline: 27054323] 141 \n\t \n\t \n\t\t PLoS One \n\t\t \n\t\t\t 11 \n\t\t\t 4 \n\t\t\t 153036 \n\t\t\t 2016 \n\t\t \n\t \n\t FREE Full text \n\t Melin M, Hagerman I, Gonon A, Gustafsson T, Rullman E. Variability in physical activity assessed with accelerometer is an independent predictor of mortality in CHF patients. PLoS One 2016;11(4):e0153036 [FREE Full text] [doi: 10.1371/journal.pone.0153036] [Medline: 27054323] 141"
    },
    {
      "title": "Cross-sectional and longitudinal associations of objectively-measured physical activity on blood pressure: evaluation in 37 countries",
      "authors": [
        "M Menai",
        "B Brouard",
        "M Vegreville",
        "A Chieh",
        "N Schmidt",
        "J Oppert"
      ],
      "year": 2017,
      "doi": "10.15171/hpp.2017.34",
      "journal": "Health Promot Perspect",
      "volume": "7",
      "issue": "4",
      "raw": "Cross-sectional and longitudinal associations of objectively-measured physical activity on blood pressure: evaluation in 37 countries \n\t\t \n\t\t\t M Menai \n\t\t \n\t\t \n\t\t\t B Brouard \n\t\t \n\t\t \n\t\t\t M Vegreville \n\t\t \n\t\t \n\t\t\t A Chieh \n\t\t \n\t\t \n\t\t\t N Schmidt \n\t\t \n\t\t \n\t\t\t J M Oppert \n\t\t \n\t\t 10.15171/hpp.2017.34 \n\t\t Medline: 29085795] 142 \n\t \n\t \n\t\t Health Promot Perspect \n\t\t \n\t\t\t 7 \n\t\t\t 4 \n\t\t\t \n\t\t\t 2017 \n\t\t \n\t \n\t FREE Full text \n\t Menai M, Brouard B, Vegreville M, Chieh A, Schmidt N, Oppert JM, et al. Cross-sectional and longitudinal associations of objectively-measured physical activity on blood pressure: evaluation in 37 countries. Health Promot Perspect 2017;7(4):190-196 [FREE Full text] [doi: 10.15171/hpp.2017.34] [Medline: 29085795] 142"
    },
    {
      "title": "Impact of work hours and sleep on well-being and burnout for physicians-in-training: the Resident Activity Tracker Evaluation Study",
      "authors": [
        "D Mendelsohn",
        "I Despot",
        "P Gooderham",
        "A Singhal",
        "G Redekop",
        "B Toyota"
      ],
      "year": 2019,
      "doi": "10.1111/medu.13757",
      "journal": "Med Educ",
      "volume": "53",
      "issue": "3",
      "raw": "Impact of work hours and sleep on well-being and burnout for physicians-in-training: the Resident Activity Tracker Evaluation Study \n\t\t \n\t\t\t D Mendelsohn \n\t\t \n\t\t \n\t\t\t I Despot \n\t\t \n\t\t \n\t\t\t P A Gooderham \n\t\t \n\t\t \n\t\t\t A Singhal \n\t\t \n\t\t \n\t\t\t G J Redekop \n\t\t \n\t\t \n\t\t\t B D Toyota \n\t\t \n\t\t 10.1111/medu.13757 \n\t\t Medline: 30485496] 143 \n\t \n\t \n\t\t Med Educ \n\t\t \n\t\t\t 53 \n\t\t\t 3 \n\t\t\t \n\t\t\t 2019 \n\t\t \n\t \n\t Mendelsohn D, Despot I, Gooderham PA, Singhal A, Redekop GJ, Toyota BD. Impact of work hours and sleep on well-being and burnout for physicians-in-training: the Resident Activity Tracker Evaluation Study. Med Educ 2019;53(3):306-315. [doi: 10.1111/medu.13757] [Medline: 30485496] 143"
    },
    {
      "title": "Does dog ownership affect physical activity, sleep, and self-reported health in older adults?",
      "authors": [
        "E Mi\u010dkov\u00e1",
        "K Machov\u00e1",
        "K Da\u010fov\u00e1",
        "I Svobodov\u00e1"
      ],
      "year": 2019,
      "doi": "10.3390/ijerph16183355",
      "journal": "Int J Environ Res Public Health",
      "volume": "16",
      "issue": "18",
      "pages": "3355",
      "raw": "Does dog ownership affect physical activity, sleep, and self-reported health in older adults? \n\t\t \n\t\t\t E Mi\u010dkov\u00e1 \n\t\t \n\t\t \n\t\t\t K Machov\u00e1 \n\t\t \n\t\t \n\t\t\t K Da\u010fov\u00e1 \n\t\t \n\t\t \n\t\t\t I Svobodov\u00e1 \n\t\t \n\t\t 10.3390/ijerph16183355 \n\t\t Medline: 31514379] 144 \n\t \n\t \n\t\t Int J Environ Res Public Health \n\t\t \n\t\t\t 16 \n\t\t\t 18 \n\t\t\t 3355 \n\t\t\t 2019 \n\t\t \n\t \n\t FREE Full text \n\t Mi\u010dkov\u00e1 E, Machov\u00e1 K, Da\u010fov\u00e1 K, Svobodov\u00e1 I. Does dog ownership affect physical activity, sleep, and self-reported health in older adults? Int J Environ Res Public Health 2019;16(18):3355 [FREE Full text] [doi: 10.3390/ijerph16183355] [Medline: 31514379] 144"
    },
    {
      "title": "Analyzing changes in respiratory rate to predict the risk of COVID-19 infection",
      "authors": [
        "D Miller",
        "J Capodilupo",
        "M Lastella",
        "C Sargent",
        "G Roach",
        "V Lee"
      ],
      "year": 2020,
      "doi": "10.1371/journal.pone.0243693",
      "journal": "PLoS One",
      "volume": "15",
      "issue": "12",
      "pages": "243693",
      "raw": "Analyzing changes in respiratory rate to predict the risk of COVID-19 infection \n\t\t \n\t\t\t D J Miller \n\t\t \n\t\t \n\t\t\t J V Capodilupo \n\t\t \n\t\t \n\t\t\t M Lastella \n\t\t \n\t\t \n\t\t\t C Sargent \n\t\t \n\t\t \n\t\t\t G D Roach \n\t\t \n\t\t \n\t\t\t V H Lee \n\t\t \n\t\t 10.1371/journal.pone.0243693 \n\t\t Medline: 33301493] 145 \n\t \n\t \n\t\t PLoS One \n\t\t \n\t\t\t 15 \n\t\t\t 12 \n\t\t\t 243693 \n\t\t\t 2020 \n\t\t \n\t \n\t FREE Full text \n\t Miller DJ, Capodilupo JV, Lastella M, Sargent C, Roach GD, Lee VH, et al. Analyzing changes in respiratory rate to predict the risk of COVID-19 infection. PLoS One 2020;15(12):e0243693 [FREE Full text] [doi: 10.1371/journal.pone.0243693] [Medline: 33301493] 145"
    },
    {
      "title": "Physical activity measured with accelerometer and self-rated disability in lumbar spine surgery: a prospective study",
      "authors": [
        "R Mobbs",
        "K Phan",
        "M Maharaj",
        "P Rao"
      ],
      "year": 2016,
      "doi": "10.1055/s-0035-1565259",
      "journal": "Global Spine J",
      "volume": "6",
      "issue": "5",
      "raw": "Physical activity measured with accelerometer and self-rated disability in lumbar spine surgery: a prospective study \n\t\t \n\t\t\t R J Mobbs \n\t\t \n\t\t \n\t\t\t K Phan \n\t\t \n\t\t \n\t\t\t M Maharaj \n\t\t \n\t\t \n\t\t\t P J Rao \n\t\t \n\t\t 10.1055/s-0035-1565259 \n\t\t Medline: 27433430] 146 \n\t \n\t \n\t\t Global Spine J \n\t\t \n\t\t\t 6 \n\t\t\t 5 \n\t\t\t \n\t\t\t 2016 \n\t\t \n\t \n\t FREE Full text \n\t Mobbs RJ, Phan K, Maharaj M, Rao PJ. Physical activity measured with accelerometer and self-rated disability in lumbar spine surgery: a prospective study. Global Spine J 2016;6(5):459-464 [FREE Full text] [doi: 10.1055/s-0035-1565259] [Medline: 27433430] 146"
    },
    {
      "title": "Evaluating the stress-response of dental students to the dental school environment",
      "authors": [
        "K Mocny-Pacho\u0144ska",
        "R Doniec",
        "A Trzcionka",
        "M Pacho\u0144ski",
        "N Piaseczna",
        "S Sieci\u0144ski"
      ],
      "year": 2020,
      "doi": "10.7717/peerj.8981",
      "journal": "PeerJ",
      "volume": "8",
      "pages": "e8981",
      "raw": "Evaluating the stress-response of dental students to the dental school environment \n\t\t \n\t\t\t K Mocny-Pacho\u0144ska \n\t\t \n\t\t \n\t\t\t R Doniec \n\t\t \n\t\t \n\t\t\t A Trzcionka \n\t\t \n\t\t \n\t\t\t M Pacho\u0144ski \n\t\t \n\t\t \n\t\t\t N Piaseczna \n\t\t \n\t\t \n\t\t\t S Sieci\u0144ski \n\t\t \n\t\t 10.7717/peerj.8981 \n\t\t Medline: 32411517] 147 \n\t \n\t \n\t\t PeerJ \n\t\t \n\t\t\t 8 \n\t\t\t e8981 \n\t\t\t 2020 \n\t\t \n\t \n\t FREE Full text \n\t Mocny-Pacho\u0144ska K, Doniec R, Trzcionka A, Pacho\u0144ski M, Piaseczna N, Sieci\u0144ski S, et al. Evaluating the stress-response of dental students to the dental school environment. PeerJ 2020;8:e8981 [FREE Full text] [doi: 10.7717/peerj.8981] [Medline: 32411517] 147"
    },
    {
      "title": "Objectively measured physical activity is associated with vertebral size in midlife",
      "authors": [
        "M Modarress-Sadeghi",
        "P Oura",
        "J Junno",
        "M Niemel\u00e4",
        "J Niinim\u00e4ki",
        "T J\u00e4ms\u00e4"
      ],
      "year": 2019,
      "doi": "10.1249/MSS.0000000000001962",
      "journal": "Med Sci Sports Exerc",
      "volume": "51",
      "issue": "8",
      "raw": "Objectively measured physical activity is associated with vertebral size in midlife \n\t\t \n\t\t\t M Modarress-Sadeghi \n\t\t \n\t\t \n\t\t\t P Oura \n\t\t \n\t\t \n\t\t\t J A Junno \n\t\t \n\t\t \n\t\t\t M Niemel\u00e4 \n\t\t \n\t\t \n\t\t\t J Niinim\u00e4ki \n\t\t \n\t\t \n\t\t\t T J\u00e4ms\u00e4 \n\t\t \n\t\t 10.1249/MSS.0000000000001962 \n\t\t Medline: 30817715] 148 \n\t \n\t \n\t\t Med Sci Sports Exerc \n\t\t \n\t\t\t 51 \n\t\t\t 8 \n\t\t\t \n\t\t\t 2019 \n\t\t \n\t \n\t Modarress-Sadeghi M, Oura P, Junno JA, Niemel\u00e4 M, Niinim\u00e4ki J, J\u00e4ms\u00e4 T, et al. Objectively measured physical activity is associated with vertebral size in midlife. Med Sci Sports Exerc 2019;51(8):1606-1612. [doi: 10.1249/MSS.0000000000001962] [Medline: 30817715] 148"
    },
    {
      "title": "Sedentarism, physical activity, steps, and neurotrophic factors in obese children",
      "authors": [
        "J Mora-Gonzalez",
        "J Migueles",
        "Esteban Cornejo",
        "I Cadenas-Sanchez",
        "C Pastor-Villaescusa",
        "B Molina-Garc\u00eda"
      ],
      "year": 2019,
      "doi": "10.1249/MSS.0000000000002064",
      "journal": "Med Sci Sports Exerc",
      "volume": "51",
      "issue": "11",
      "raw": "Sedentarism, physical activity, steps, and neurotrophic factors in obese children \n\t\t \n\t\t\t J Mora-Gonzalez \n\t\t \n\t\t \n\t\t\t J H Migueles \n\t\t \n\t\t \n\t\t\t Esteban - Cornejo \n\t\t \n\t\t \n\t\t\t I Cadenas-Sanchez \n\t\t \n\t\t \n\t\t\t C Pastor-Villaescusa \n\t\t \n\t\t \n\t\t\t B Molina-Garc\u00eda \n\t\t \n\t\t \n\t\t\t P \n\t\t \n\t\t 10.1249/MSS.0000000000002064 \n\t\t Medline: 31634295] 149 \n\t \n\t \n\t\t Med Sci Sports Exerc \n\t\t \n\t\t\t 51 \n\t\t\t 11 \n\t\t\t \n\t\t\t 2019 \n\t\t \n\t \n\t Mora-Gonzalez J, Migueles JH, Esteban-Cornejo I, Cadenas-Sanchez C, Pastor-Villaescusa B, Molina-Garc\u00eda P, et al. Sedentarism, physical activity, steps, and neurotrophic factors in obese children. Med Sci Sports Exerc 2019;51(11):2325-2333. [doi: 10.1249/MSS.0000000000002064] [Medline: 31634295] 149"
    },
    {
      "title": "Correlation between hip osteoarthritis and the level of physical activity as measured by wearable technology and patient-reported questionnaires",
      "authors": [
        "M Morcos",
        "M Teeter",
        "L Somerville",
        "B Lanting"
      ],
      "year": 2019,
      "doi": "10.1016/j.jor.2019.11.049",
      "journal": "J Orthop",
      "volume": "20",
      "raw": "Correlation between hip osteoarthritis and the level of physical activity as measured by wearable technology and patient-reported questionnaires \n\t\t \n\t\t\t M W Morcos \n\t\t \n\t\t \n\t\t\t M G Teeter \n\t\t \n\t\t \n\t\t\t L E Somerville \n\t\t \n\t\t \n\t\t\t B Lanting \n\t\t \n\t\t 10.1016/j.jor.2019.11.049 \n\t\t Medline: 32071522] 150 \n\t \n\t \n\t\t J Orthop \n\t\t \n\t\t\t 20 \n\t\t\t \n\t\t\t 2019 \n\t\t \n\t \n\t FREE Full text \n\t Morcos MW, Teeter MG, Somerville LE, Lanting B. Correlation between hip osteoarthritis and the level of physical activity as measured by wearable technology and patient-reported questionnaires. J Orthop 2019;20:236-239 [FREE Full text] [doi: 10.1016/j.jor.2019.11.049] [Medline: 32071522] 150"
    },
    {
      "title": "Determining resident sleep during and after call with commercial sleep monitoring devices",
      "authors": [
        "D Morhardt",
        "A Luckenbaugh",
        "C Goldstein",
        "G Faerber"
      ],
      "year": 2017,
      "doi": "10.1016/j.urology.2017.03.059",
      "journal": "Urology",
      "volume": "106",
      "raw": "Determining resident sleep during and after call with commercial sleep monitoring devices \n\t\t \n\t\t\t D R Morhardt \n\t\t \n\t\t \n\t\t\t A Luckenbaugh \n\t\t \n\t\t \n\t\t\t C Goldstein \n\t\t \n\t\t \n\t\t\t G J Faerber \n\t\t \n\t\t 10.1016/j.urology.2017.03.059 \n\t\t Medline: 28502597] 151 \n\t \n\t \n\t\t Urology \n\t\t \n\t\t\t 106 \n\t\t\t \n\t\t\t 2017 \n\t\t \n\t \n\t Morhardt DR, Luckenbaugh A, Goldstein C, Faerber GJ. Determining resident sleep during and after call with commercial sleep monitoring devices. Urology 2017;106:39-44. [doi: 10.1016/j.urology.2017.03.059] [Medline: 28502597] 151"
    },
    {
      "title": "Evaluation of clinical outcomes and simultaneous digital tracking of daily physical activity, heart rate, and inhalation behavior in patients with pulmonary arterial hypertension treated with inhaled iloprost: protocol for the observational VENTASTEP study",
      "authors": [
        "C Mueller",
        "B Stollfuss",
        "A Roitenberg",
        "J Harder",
        "M Richter"
      ],
      "year": 2019,
      "doi": "10.2196/12144",
      "journal": "JMIR Res Protoc",
      "volume": "8",
      "issue": "4",
      "pages": "12144",
      "raw": "Evaluation of clinical outcomes and simultaneous digital tracking of daily physical activity, heart rate, and inhalation behavior in patients with pulmonary arterial hypertension treated with inhaled iloprost: protocol for the observational VENTASTEP study \n\t\t \n\t\t\t C Mueller \n\t\t \n\t\t \n\t\t\t B Stollfuss \n\t\t \n\t\t \n\t\t\t A Roitenberg \n\t\t \n\t\t \n\t\t\t J Harder \n\t\t \n\t\t \n\t\t\t M J Richter \n\t\t \n\t\t 10.2196/12144 \n\t\t Medline: 30985279] 152 \n\t \n\t \n\t\t JMIR Res Protoc \n\t\t \n\t\t\t 8 \n\t\t\t 4 \n\t\t\t 12144 \n\t\t\t 2019 \n\t\t \n\t \n\t FREE Full text \n\t Mueller C, Stollfuss B, Roitenberg A, Harder J, Richter MJ. Evaluation of clinical outcomes and simultaneous digital tracking of daily physical activity, heart rate, and inhalation behavior in patients with pulmonary arterial hypertension treated with inhaled iloprost: protocol for the observational VENTASTEP study. JMIR Res Protoc 2019;8(4):e12144 [FREE Full text] [doi: 10.2196/12144] [Medline: 30985279] 152"
    },
    {
      "title": "Measuring the impact of ambulatory red blood cell transfusion on home functional status: study protocol for a pilot randomized controlled trial",
      "authors": [
        "D Murphree",
        "T Kinard",
        "N Khera",
        "C Storlie",
        "C Ngufor",
        "S Upadhyaya"
      ],
      "year": 2017,
      "doi": "10.1186/s13063-017-1873-z",
      "journal": "Trials",
      "volume": "18",
      "issue": "1",
      "pages": "153",
      "raw": "Measuring the impact of ambulatory red blood cell transfusion on home functional status: study protocol for a pilot randomized controlled trial \n\t\t \n\t\t\t D H Murphree \n\t\t \n\t\t \n\t\t\t T N Kinard \n\t\t \n\t\t \n\t\t\t N Khera \n\t\t \n\t\t \n\t\t\t C B Storlie \n\t\t \n\t\t \n\t\t\t C Ngufor \n\t\t \n\t\t \n\t\t\t S Upadhyaya \n\t\t \n\t\t 10.1186/s13063-017-1873-z \n\t\t Medline: 28359342] 153 \n\t \n\t \n\t\t Trials \n\t\t \n\t\t\t 18 \n\t\t\t 1 \n\t\t\t 153 \n\t\t\t 2017 \n\t\t \n\t \n\t FREE Full text \n\t Murphree DH, Kinard TN, Khera N, Storlie CB, Ngufor C, Upadhyaya S, et al. Measuring the impact of ambulatory red blood cell transfusion on home functional status: study protocol for a pilot randomized controlled trial. Trials 2017;18(1):153 [FREE Full text] [doi: 10.1186/s13063-017-1873-z] [Medline: 28359342] 153"
    },
    {
      "title": "Heart rate variability with photoplethysmography in 8 million individuals: a cross-sectional study",
      "authors": [
        "A Natarajan",
        "A Pantelopoulos",
        "H Emir-Farinas",
        "P Natarajan"
      ],
      "year": 2020,
      "doi": "10.1016/s2589-7500(20)30246-6",
      "journal": "Lancet Digit Health",
      "volume": "2",
      "issue": "12",
      "raw": "Heart rate variability with photoplethysmography in 8 million individuals: a cross-sectional study \n\t\t \n\t\t\t A Natarajan \n\t\t \n\t\t \n\t\t\t A Pantelopoulos \n\t\t \n\t\t \n\t\t\t H Emir-Farinas \n\t\t \n\t\t \n\t\t\t P Natarajan \n\t\t \n\t\t 10.1016/s2589-7500(20)30246-6 \n\t\t Medline: 33328029] 154 \n\t \n\t \n\t\t Lancet Digit Health \n\t\t \n\t\t\t 2 \n\t\t\t 12 \n\t\t\t \n\t\t\t 2020 \n\t\t \n\t \n\t Natarajan A, Pantelopoulos A, Emir-Farinas H, Natarajan P. Heart rate variability with photoplethysmography in 8 million individuals: a cross-sectional study. Lancet Digit Health 2020;2(12):e650-e657. [doi: 10.1016/S2589-7500(20)30246-6] [Medline: 33328029] 154"
    },
    {
      "title": "Dose-response relation of self-reported and accelerometer-measured physical activity to perceived health in middle age-the Northern Finland Birth Cohort 1966 Study",
      "authors": [
        "M Niemel\u00e4",
        "M Kangas",
        "R Ahola",
        "J Auvinen",
        "A Leinonen",
        "T Tammelin"
      ],
      "year": 2019,
      "doi": "10.1186/s12889-018-6359-8",
      "journal": "BMC Public Health",
      "volume": "19",
      "issue": "1",
      "pages": "21",
      "raw": "Dose-response relation of self-reported and accelerometer-measured physical activity to perceived health in middle age-the Northern Finland Birth Cohort 1966 Study \n\t\t \n\t\t\t M S Niemel\u00e4 \n\t\t \n\t\t \n\t\t\t M Kangas \n\t\t \n\t\t \n\t\t\t R J Ahola \n\t\t \n\t\t \n\t\t\t J P Auvinen \n\t\t \n\t\t \n\t\t\t A M Leinonen \n\t\t \n\t\t \n\t\t\t T H Tammelin \n\t\t \n\t\t 10.1186/s12889-018-6359-8 \n\t\t Medline: 30612541] 155 \n\t \n\t \n\t\t BMC Public Health \n\t\t \n\t\t\t 19 \n\t\t\t 1 \n\t\t\t 21 \n\t\t\t 2019 \n\t\t \n\t \n\t FREE Full text \n\t Niemel\u00e4 MS, Kangas M, Ahola RJ, Auvinen JP, Leinonen AM, Tammelin TH, et al. Dose-response relation of self-reported and accelerometer-measured physical activity to perceived health in middle age-the Northern Finland Birth Cohort 1966 Study. BMC Public Health 2019;19(1):21 [FREE Full text] [doi: 10.1186/s12889-018-6359-8] [Medline: 30612541] 155"
    },
    {
      "title": "Night duty and decreased brain activity of medical residents: a wearable optical topography study",
      "authors": [
        "M Nishida",
        "S Kikuchi",
        "F Miwakeichi",
        "S Suda"
      ],
      "year": 2017,
      "doi": "10.1080/10872981.2017.1379345",
      "journal": "Med Educ Online",
      "volume": "22",
      "issue": "1",
      "pages": "1379345",
      "raw": "Night duty and decreased brain activity of medical residents: a wearable optical topography study \n\t\t \n\t\t\t M Nishida \n\t\t \n\t\t \n\t\t\t S Kikuchi \n\t\t \n\t\t \n\t\t\t F Miwakeichi \n\t\t \n\t\t \n\t\t\t S Suda \n\t\t \n\t\t 10.1080/10872981.2017.1379345 \n\t\t Medline: 28954586] 156 \n\t \n\t \n\t\t Med Educ Online \n\t\t \n\t\t\t 22 \n\t\t\t 1 \n\t\t\t 1379345 \n\t\t\t 2017 \n\t\t \n\t \n\t FREE Full text \n\t Nishida M, Kikuchi S, Miwakeichi F, Suda S. Night duty and decreased brain activity of medical residents: a wearable optical topography study. Med Educ Online 2017;22(1):1379345 [FREE Full text] [doi: 10.1080/10872981.2017.1379345] [Medline: 28954586] 156"
    },
    {
      "title": "Digital tracking of rheumatoid arthritis longitudinally (DIGITAL) using biosensor and patient-reported outcome data: protocol for a real-world study",
      "authors": [
        "W Nowell",
        "J Curtis",
        "S Nolot",
        "D Curtis",
        "S Venkatachalam",
        "J Owensby"
      ],
      "year": 2019,
      "doi": "10.2196/14665",
      "journal": "JMIR Res Protoc",
      "volume": "8",
      "issue": "9",
      "pages": "14665",
      "raw": "Digital tracking of rheumatoid arthritis longitudinally (DIGITAL) using biosensor and patient-reported outcome data: protocol for a real-world study \n\t\t \n\t\t\t W B Nowell \n\t\t \n\t\t \n\t\t\t J R Curtis \n\t\t \n\t\t \n\t\t\t S K Nolot \n\t\t \n\t\t \n\t\t\t D Curtis \n\t\t \n\t\t \n\t\t\t S Venkatachalam \n\t\t \n\t\t \n\t\t\t J K Owensby \n\t\t \n\t\t 10.2196/14665 \n\t\t Medline: 31573949] 157 \n\t \n\t \n\t\t JMIR Res Protoc \n\t\t \n\t\t\t 8 \n\t\t\t 9 \n\t\t\t 14665 \n\t\t\t 2019 \n\t\t \n\t \n\t FREE Full text \n\t Nowell WB, Curtis JR, Nolot SK, Curtis D, Venkatachalam S, Owensby JK, et al. Digital tracking of rheumatoid arthritis longitudinally (DIGITAL) using biosensor and patient-reported outcome data: protocol for a real-world study. JMIR Res Protoc 2019;8(9):e14665 [FREE Full text] [doi: 10.2196/14665] [Medline: 31573949] 157"
    },
    {
      "title": "24-hour accelerometry in COPD: exploring physical activity, sedentary behavior, sleep and clinical characteristics",
      "authors": [
        "M Orme",
        "M Steiner",
        "M Morgan",
        "A Kingsnorth",
        "D Esliger",
        "S Singh"
      ],
      "year": 2019,
      "doi": "10.2147/COPD.S183029",
      "journal": "Int J Chron Obstruct Pulmon Dis",
      "volume": "14",
      "raw": "24-hour accelerometry in COPD: exploring physical activity, sedentary behavior, sleep and clinical characteristics \n\t\t \n\t\t\t M W Orme \n\t\t \n\t\t \n\t\t\t M C Steiner \n\t\t \n\t\t \n\t\t\t M D Morgan \n\t\t \n\t\t \n\t\t\t A P Kingsnorth \n\t\t \n\t\t \n\t\t\t D W Esliger \n\t\t \n\t\t \n\t\t\t S J Singh \n\t\t \n\t\t 10.2147/COPD.S183029 \n\t\t Medline: 30863042] 158 \n\t \n\t \n\t\t Int J Chron Obstruct Pulmon Dis \n\t\t \n\t\t\t 14 \n\t\t\t \n\t\t\t 2019 \n\t\t \n\t \n\t FREE Full text \n\t Orme MW, Steiner MC, Morgan MD, Kingsnorth AP, Esliger DW, Singh SJ, et al. 24-hour accelerometry in COPD: exploring physical activity, sedentary behavior, sleep and clinical characteristics. Int J Chron Obstruct Pulmon Dis 2019;14:419-430 [FREE Full text] [doi: 10.2147/COPD.S183029] [Medline: 30863042] 158"
    },
    {
      "title": "Association between blood pressure changes during self-paced outdoor walking and air temperature",
      "authors": [
        "T Otsuki",
        "N Ishii"
      ],
      "year": 2017,
      "doi": "10.1111/cpf.12280",
      "journal": "Clin Physiol Funct Imaging",
      "volume": "37",
      "issue": "2",
      "raw": "Association between blood pressure changes during self-paced outdoor walking and air temperature \n\t\t \n\t\t\t T Otsuki \n\t\t \n\t\t \n\t\t\t N Ishii \n\t\t \n\t\t 10.1111/cpf.12280 \n\t\t Medline: 26211639] 159 \n\t \n\t \n\t\t Clin Physiol Funct Imaging \n\t\t \n\t\t\t 37 \n\t\t\t 2 \n\t\t\t \n\t\t\t 2017 \n\t\t \n\t \n\t Otsuki T, Ishii N. Association between blood pressure changes during self-paced outdoor walking and air temperature. Clin Physiol Funct Imaging 2017;37(2):155-161. [doi: 10.1111/cpf.12280] [Medline: 26211639] 159"
    },
    {
      "title": "Using consumer-wearable technology for remote assessment of physiological response to stress in the naturalistic environment",
      "authors": [
        "S Pakhomov",
        "P Thuras",
        "R Finzel",
        "J Eppel",
        "M Kotlyar"
      ],
      "year": 2020,
      "doi": "10.1371/journal.pone.0229942",
      "journal": "PLoS One",
      "volume": "15",
      "issue": "3",
      "pages": "229942",
      "raw": "Using consumer-wearable technology for remote assessment of physiological response to stress in the naturalistic environment \n\t\t \n\t\t\t S V Pakhomov \n\t\t \n\t\t \n\t\t\t P D Thuras \n\t\t \n\t\t \n\t\t\t R Finzel \n\t\t \n\t\t \n\t\t\t J Eppel \n\t\t \n\t\t \n\t\t\t M Kotlyar \n\t\t \n\t\t 10.1371/journal.pone.0229942 \n\t\t Medline: 32210441] 160 \n\t \n\t \n\t\t PLoS One \n\t\t \n\t\t\t 15 \n\t\t\t 3 \n\t\t\t 229942 \n\t\t\t 2020 \n\t\t \n\t \n\t FREE Full text \n\t Pakhomov SV, Thuras PD, Finzel R, Eppel J, Kotlyar M. Using consumer-wearable technology for remote assessment of physiological response to stress in the naturalistic environment. PLoS One 2020;15(3):e0229942 [FREE Full text] [doi: 10.1371/journal.pone.0229942] [Medline: 32210441] 160"
    },
    {
      "title": "Remote monitoring telemedicine (REMOTE) platform for patients with anxiety symptoms and alcohol use disorder: protocol for a case-control study",
      "authors": [
        "N Pastor",
        "E Khalilian",
        "E Caballeria",
        "D Morrison",
        "U Sanchez Luque",
        "S Matrai"
      ],
      "year": 2020,
      "doi": "10.2196/16964",
      "journal": "JMIR Res Protoc",
      "volume": "9",
      "issue": "6",
      "pages": "16964",
      "raw": "Remote monitoring telemedicine (REMOTE) platform for patients with anxiety symptoms and alcohol use disorder: protocol for a case-control study \n\t\t \n\t\t\t N Pastor \n\t\t \n\t\t \n\t\t\t E Khalilian \n\t\t \n\t\t \n\t\t\t E Caballeria \n\t\t \n\t\t \n\t\t\t D Morrison \n\t\t \n\t\t \n\t\t\t U Sanchez Luque \n\t\t \n\t\t \n\t\t\t S Matrai \n\t\t \n\t\t 10.2196/16964 \n\t\t Medline: 32579124] 161 \n\t \n\t \n\t\t JMIR Res Protoc \n\t\t \n\t\t\t 9 \n\t\t\t 6 \n\t\t\t 16964 \n\t\t\t 2020 \n\t\t \n\t \n\t FREE Full text \n\t Pastor N, Khalilian E, Caballeria E, Morrison D, Sanchez Luque U, Matrai S, et al. Remote monitoring telemedicine (REMOTE) platform for patients with anxiety symptoms and alcohol use disorder: protocol for a case-control study. JMIR Res Protoc 2020;9(6):e16964 [FREE Full text] [doi: 10.2196/16964] [Medline: 32579124] 161"
    },
    {
      "title": "Direct and indirect associations of sleep knowledge and attitudes with objective and subjective sleep duration and quality via sleep hygiene",
      "authors": [
        "H Peach",
        "J Gaultney",
        "A Ruggiero"
      ],
      "year": 2018,
      "doi": "10.1007/s10935-018-0526-7",
      "journal": "J Prim Prev",
      "volume": "39",
      "issue": "6",
      "raw": "Direct and indirect associations of sleep knowledge and attitudes with objective and subjective sleep duration and quality via sleep hygiene \n\t\t \n\t\t\t H D Peach \n\t\t \n\t\t \n\t\t\t J F Gaultney \n\t\t \n\t\t \n\t\t\t A R Ruggiero \n\t\t \n\t\t 10.1007/s10935-018-0526-7 \n\t\t Medline: 30443688] 162 \n\t \n\t \n\t\t J Prim Prev \n\t\t \n\t\t\t 39 \n\t\t\t 6 \n\t\t\t \n\t\t\t 2018 \n\t\t \n\t \n\t Peach HD, Gaultney JF, Ruggiero AR. Direct and indirect associations of sleep knowledge and attitudes with objective and subjective sleep duration and quality via sleep hygiene. J Prim Prev 2018;39(6):555-570. [doi: 10.1007/s10935-018-0526-7] [Medline: 30443688] 162"
    },
    {
      "title": "Wearable activity trackers for monitoring adherence to home confinement during the COVID-19 pandemic worldwide: data aggregation and analysis",
      "authors": [
        "J P\u00e9pin",
        "R Bruno",
        "R Yang",
        "V Vercamer",
        "P Jouhaud",
        "P Escourrou"
      ],
      "year": 2020,
      "doi": "10.2196/19787",
      "journal": "J Med Internet Res",
      "volume": "22",
      "issue": "6",
      "pages": "19787",
      "raw": "Wearable activity trackers for monitoring adherence to home confinement during the COVID-19 pandemic worldwide: data aggregation and analysis \n\t\t \n\t\t\t J L P\u00e9pin \n\t\t \n\t\t \n\t\t\t R M Bruno \n\t\t \n\t\t \n\t\t\t R Y Yang \n\t\t \n\t\t \n\t\t\t V Vercamer \n\t\t \n\t\t \n\t\t\t P Jouhaud \n\t\t \n\t\t \n\t\t\t P Escourrou \n\t\t \n\t\t 10.2196/19787 \n\t\t Medline: 32501803] 163 \n\t \n\t \n\t\t J Med Internet Res \n\t\t \n\t\t\t 22 \n\t\t\t 6 \n\t\t\t 19787 \n\t\t\t 2020 \n\t\t \n\t \n\t FREE Full text \n\t P\u00e9pin JL, Bruno RM, Yang RY, Vercamer V, Jouhaud P, Escourrou P, et al. Wearable activity trackers for monitoring adherence to home confinement during the COVID-19 pandemic worldwide: data aggregation and analysis. J Med Internet Res 2020;22(6):e19787 [FREE Full text] [doi: 10.2196/19787] [Medline: 32501803] 163"
    },
    {
      "title": "Exploring path models of disablement in residential care and assisted living residents",
      "authors": [
        "L Phillips",
        "G Petroski",
        "V Conn",
        "M Brown",
        "E Leary",
        "L Teri"
      ],
      "year": 2018,
      "doi": "10.1177/0733464816672048",
      "journal": "J Appl Gerontol",
      "volume": "37",
      "issue": "12",
      "raw": "Exploring path models of disablement in residential care and assisted living residents \n\t\t \n\t\t\t L J Phillips \n\t\t \n\t\t \n\t\t\t G F Petroski \n\t\t \n\t\t \n\t\t\t V S Conn \n\t\t \n\t\t \n\t\t\t M Brown \n\t\t \n\t\t \n\t\t\t E Leary \n\t\t \n\t\t \n\t\t\t L Teri \n\t\t \n\t\t 10.1177/0733464816672048 \n\t\t Medline: 27708073] 164 \n\t \n\t \n\t\t J Appl Gerontol \n\t\t \n\t\t\t 37 \n\t\t\t 12 \n\t\t\t \n\t\t\t 2018 \n\t\t \n\t \n\t FREE Full text \n\t Phillips LJ, Petroski GF, Conn VS, Brown M, Leary E, Teri L, et al. Exploring path models of disablement in residential care and assisted living residents. J Appl Gerontol 2018;37(12):1490-1516 [FREE Full text] [doi: 10.1177/0733464816672048] [Medline: 27708073] 164"
    },
    {
      "title": "Accelerometer-measured daily activity levels and related factors in patients with heart failure",
      "authors": [
        "B Pozehl",
        "R Mcguire",
        "K Duncan",
        "M Hertzog",
        "P Deka",
        "J Norman"
      ],
      "year": 2018,
      "doi": "10.1097/JCN.0000000000000464",
      "journal": "J Cardiovasc Nurs",
      "volume": "33",
      "issue": "4",
      "raw": "Accelerometer-measured daily activity levels and related factors in patients with heart failure \n\t\t \n\t\t\t B J Pozehl \n\t\t \n\t\t \n\t\t\t R Mcguire \n\t\t \n\t\t \n\t\t\t K Duncan \n\t\t \n\t\t \n\t\t\t M Hertzog \n\t\t \n\t\t \n\t\t\t P Deka \n\t\t \n\t\t \n\t\t\t J Norman \n\t\t \n\t\t 10.1097/JCN.0000000000000464 \n\t\t Medline: 29538050] 165 \n\t \n\t \n\t\t J Cardiovasc Nurs \n\t\t \n\t\t\t 33 \n\t\t\t 4 \n\t\t\t \n\t\t\t 2018 \n\t\t \n\t \n\t FREE Full text \n\t Pozehl BJ, Mcguire R, Duncan K, Hertzog M, Deka P, Norman J, et al. Accelerometer-measured daily activity levels and related factors in patients with heart failure. J Cardiovasc Nurs 2018;33(4):329-335 [FREE Full text] [doi: 10.1097/JCN.0000000000000464] [Medline: 29538050] 165"
    },
    {
      "title": "Quantifying physical activity in early Parkinson disease using a commercial activity monitor",
      "authors": [
        "S Pradhan",
        "V Kelly"
      ],
      "year": 2019,
      "doi": "10.1016/j.parkreldis.2019.08.001",
      "journal": "Parkinsonism Relat Disord",
      "volume": "66",
      "raw": "Quantifying physical activity in early Parkinson disease using a commercial activity monitor \n\t\t \n\t\t\t S Pradhan \n\t\t \n\t\t \n\t\t\t V E Kelly \n\t\t \n\t\t 10.1016/j.parkreldis.2019.08.001 \n\t\t Medline: 31420310] 166 \n\t \n\t \n\t\t Parkinsonism Relat Disord \n\t\t \n\t\t\t 66 \n\t\t\t \n\t\t\t 2019 \n\t\t \n\t \n\t FREE Full text \n\t Pradhan S, Kelly VE. Quantifying physical activity in early Parkinson disease using a commercial activity monitor. Parkinsonism Relat Disord 2019;66:171-175 [FREE Full text] [doi: 10.1016/j.parkreldis.2019.08.001] [Medline: 31420310] 166"
    },
    {
      "title": "Inter-and intraindividual variability in daily resting heart rate and its associations with age, sex, sleep, BMI, and time of year: retrospective, longitudinal cohort study of 92,457 adults",
      "authors": [
        "G Quer",
        "P Gouda",
        "M Galarnyk",
        "E Topol",
        "S Steinhubl"
      ],
      "year": 2020,
      "doi": "10.1371/journal.pone.0227709",
      "journal": "PLoS One",
      "volume": "15",
      "issue": "2",
      "pages": "227709",
      "raw": "Inter-and intraindividual variability in daily resting heart rate and its associations with age, sex, sleep, BMI, and time of year: retrospective, longitudinal cohort study of 92,457 adults \n\t\t \n\t\t\t G Quer \n\t\t \n\t\t \n\t\t\t P Gouda \n\t\t \n\t\t \n\t\t\t M Galarnyk \n\t\t \n\t\t \n\t\t\t E J Topol \n\t\t \n\t\t \n\t\t\t S R Steinhubl \n\t\t \n\t\t 10.1371/journal.pone.0227709 \n\t\t Medline: 32023264] 167 \n\t \n\t \n\t\t PLoS One \n\t\t \n\t\t\t 15 \n\t\t\t 2 \n\t\t\t 227709 \n\t\t\t 2020 \n\t\t \n\t \n\t FREE Full text \n\t Quer G, Gouda P, Galarnyk M, Topol EJ, Steinhubl SR. Inter-and intraindividual variability in daily resting heart rate and its associations with age, sex, sleep, BMI, and time of year: retrospective, longitudinal cohort study of 92,457 adults. PLoS One 2020;15(2):e0227709 [FREE Full text] [doi: 10.1371/journal.pone.0227709] [Medline: 32023264] 167"
    },
    {
      "title": "Wearable sensor data and self-reported symptoms for COVID-19 detection",
      "authors": [
        "G Quer",
        "J Radin",
        "M Gadaleta",
        "K Baca-Motes",
        "L Ariniello",
        "E Ramos"
      ],
      "year": 2021,
      "doi": "10.1038/s41591-020-1123-x",
      "journal": "Nat Med",
      "volume": "27",
      "issue": "1",
      "raw": "Wearable sensor data and self-reported symptoms for COVID-19 detection \n\t\t \n\t\t\t G Quer \n\t\t \n\t\t \n\t\t\t J M Radin \n\t\t \n\t\t \n\t\t\t M Gadaleta \n\t\t \n\t\t \n\t\t\t K Baca-Motes \n\t\t \n\t\t \n\t\t\t L Ariniello \n\t\t \n\t\t \n\t\t\t E Ramos \n\t\t \n\t\t 10.1038/s41591-020-1123-x \n\t\t Medline: 33122860] 168 \n\t \n\t \n\t\t Nat Med \n\t\t \n\t\t\t 27 \n\t\t\t 1 \n\t\t\t \n\t\t\t 2021 \n\t\t \n\t \n\t Quer G, Radin JM, Gadaleta M, Baca-Motes K, Ariniello L, Ramos E, et al. Wearable sensor data and self-reported symptoms for COVID-19 detection. Nat Med 2021;27(1):73-77. [doi: 10.1038/s41591-020-1123-x] [Medline: 33122860] 168"
    },
    {
      "title": "Emotion recognition using smart watch sensor data: mixed-design study",
      "authors": [
        "J Quiroz",
        "E Geangu",
        "M Yong"
      ],
      "year": 2018,
      "doi": "10.2196/10153",
      "journal": "JMIR Ment Health",
      "volume": "5",
      "issue": "3",
      "pages": "10153",
      "raw": "Emotion recognition using smart watch sensor data: mixed-design study \n\t\t \n\t\t\t J C Quiroz \n\t\t \n\t\t \n\t\t\t E Geangu \n\t\t \n\t\t \n\t\t\t M H Yong \n\t\t \n\t\t 10.2196/10153 \n\t\t Medline: 30089610] 169 \n\t \n\t \n\t\t JMIR Ment Health \n\t\t \n\t\t\t 5 \n\t\t\t 3 \n\t\t\t 10153 \n\t\t\t 2018 \n\t\t \n\t \n\t FREE Full text \n\t Quiroz JC, Geangu E, Yong MH. Emotion recognition using smart watch sensor data: mixed-design study. JMIR Ment Health 2018;5(3):e10153 [FREE Full text] [doi: 10.2196/10153] [Medline: 30089610] 169"
    },
    {
      "title": "A field study to capture events of interest (EoI) from living labs using wearables for spatiotemporal monitoring towards a framework of smart health (sHealth)",
      "authors": [
        "M Rahman",
        "B Morshed",
        "B Harmon"
      ],
      "year": 2020,
      "doi": "10.1109/embc44109.2020.9175771",
      "journal": "Annu Int Conf IEEE Eng Med Biol Soc",
      "volume": "2020",
      "raw": "A field study to capture events of interest (EoI) from living labs using wearables for spatiotemporal monitoring towards a framework of smart health (sHealth) \n\t\t \n\t\t\t M J Rahman \n\t\t \n\t\t \n\t\t\t B I Morshed \n\t\t \n\t\t \n\t\t\t B Harmon \n\t\t \n\t\t 10.1109/embc44109.2020.9175771 \n\t\t Medline: 33019327] 170 \n\t \n\t \n\t\t Annu Int Conf IEEE Eng Med Biol Soc \n\t\t \n\t\t\t 2020 \n\t\t\t \n\t\t\t 2020 \n\t\t \n\t \n\t Rahman MJ, Morshed BI, Harmon B. A field study to capture events of interest (EoI) from living labs using wearables for spatiotemporal monitoring towards a framework of smart health (sHealth). Annu Int Conf IEEE Eng Med Biol Soc 2020;2020:5943-5947. [doi: 10.1109/EMBC44109.2020.9175771] [Medline: 33019327] 170"
    },
    {
      "title": "Toward early severity assessment of obstructive lung disease using multi-modal wearable sensor data fusion during walking",
      "authors": [
        "M Rahman",
        "E Nemati",
        "M Rahman",
        "K Vatanparvar",
        "V Nathan",
        "J Kuang"
      ],
      "year": 2020,
      "doi": "10.1109/embc44109.2020.9176559",
      "journal": "Annu Int Conf IEEE Eng Med Biol Soc",
      "volume": "2020",
      "raw": "Toward early severity assessment of obstructive lung disease using multi-modal wearable sensor data fusion during walking \n\t\t \n\t\t\t M J Rahman \n\t\t \n\t\t \n\t\t\t E Nemati \n\t\t \n\t\t \n\t\t\t M Rahman \n\t\t \n\t\t \n\t\t\t K Vatanparvar \n\t\t \n\t\t \n\t\t\t V Nathan \n\t\t \n\t\t \n\t\t\t J Kuang \n\t\t \n\t\t 10.1109/embc44109.2020.9176559 \n\t\t Medline: 33019325] 171 \n\t \n\t \n\t\t Annu Int Conf IEEE Eng Med Biol Soc \n\t\t \n\t\t\t 2020 \n\t\t\t \n\t\t\t 2020 \n\t\t \n\t \n\t Rahman MJ, Nemati E, Rahman M, Vatanparvar K, Nathan V, Kuang J. Toward early severity assessment of obstructive lung disease using multi-modal wearable sensor data fusion during walking. Annu Int Conf IEEE Eng Med Biol Soc 2020;2020:5935-5938. [doi: 10.1109/EMBC44109.2020.9176559] [Medline: 33019325] 171"
    },
    {
      "title": "Continuous digital assessment for weight loss surgery patients",
      "authors": [
        "E Ramirez",
        "N Marinsek",
        "B Bradshaw",
        "R Kanard",
        "L Foschini"
      ],
      "year": 2020,
      "doi": "10.1159/000506417",
      "journal": "Digit Biomark",
      "volume": "4",
      "issue": "1",
      "raw": "Continuous digital assessment for weight loss surgery patients \n\t\t \n\t\t\t E Ramirez \n\t\t \n\t\t \n\t\t\t N Marinsek \n\t\t \n\t\t \n\t\t\t B Bradshaw \n\t\t \n\t\t \n\t\t\t R Kanard \n\t\t \n\t\t \n\t\t\t L Foschini \n\t\t \n\t\t 10.1159/000506417 \n\t\t Medline: 32399512] 172 \n\t \n\t \n\t\t Digit Biomark \n\t\t \n\t\t\t 4 \n\t\t\t 1 \n\t\t\t \n\t\t\t 2020 \n\t\t \n\t \n\t FREE Full text \n\t Ramirez E, Marinsek N, Bradshaw B, Kanard R, Foschini L. Continuous digital assessment for weight loss surgery patients. Digit Biomark 2020;4(1):13-20 [FREE Full text] [doi: 10.1159/000506417] [Medline: 32399512] 172"
    },
    {
      "title": "Protocol for Project Fizzyo, an analytic longitudinal observational cohort study of physiotherapy for children and young people with cystic fibrosis, with interrupted time-series design",
      "authors": [
        "E Raywood",
        "H Douglas",
        "K Kapoor",
        "N Filipow",
        "N Murray",
        "O' Connor"
      ],
      "year": 2020,
      "doi": "10.1136/bmjopen-2020-039587",
      "journal": "BMJ Open",
      "volume": "10",
      "issue": "10",
      "pages": "39587",
      "raw": "Protocol for Project Fizzyo, an analytic longitudinal observational cohort study of physiotherapy for children and young people with cystic fibrosis, with interrupted time-series design \n\t\t \n\t\t\t E Raywood \n\t\t \n\t\t \n\t\t\t H Douglas \n\t\t \n\t\t \n\t\t\t K Kapoor \n\t\t \n\t\t \n\t\t\t N Filipow \n\t\t \n\t\t \n\t\t\t N Murray \n\t\t \n\t\t \n\t\t\t O' Connor \n\t\t \n\t\t \n\t\t\t R \n\t\t \n\t\t 10.1136/bmjopen-2020-039587 \n\t\t Medline: 33033031] 173 \n\t \n\t \n\t\t BMJ Open \n\t\t \n\t\t\t 10 \n\t\t\t 10 \n\t\t\t 39587 \n\t\t\t 2020 \n\t\t \n\t \n\t FREE Full text \n\t Raywood E, Douglas H, Kapoor K, Filipow N, Murray N, O'Connor R, et al. Protocol for Project Fizzyo, an analytic longitudinal observational cohort study of physiotherapy for children and young people with cystic fibrosis, with interrupted time-series design. BMJ Open 2020;10(10):e039587 [FREE Full text] [doi: 10.1136/bmjopen-2020-039587] [Medline: 33033031] 173"
    },
    {
      "title": "The effect of exercise on sleep in adults with type 1 diabetes",
      "authors": [
        "R Reddy",
        "El Youssef",
        "J Winters-Stone",
        "K Branigan",
        "D Leitschuh",
        "J Castle"
      ],
      "year": 2018,
      "doi": "10.1111/dom.13065",
      "journal": "Diabetes Obes Metab",
      "volume": "20",
      "issue": "2",
      "raw": "The effect of exercise on sleep in adults with type 1 diabetes \n\t\t \n\t\t\t R Reddy \n\t\t \n\t\t \n\t\t\t El Youssef \n\t\t \n\t\t \n\t\t\t J Winters-Stone \n\t\t \n\t\t \n\t\t\t K Branigan \n\t\t \n\t\t \n\t\t\t D Leitschuh \n\t\t \n\t\t \n\t\t\t J Castle \n\t\t \n\t\t \n\t\t\t J \n\t\t \n\t\t 10.1111/dom.13065 \n\t\t Medline: 28718987] 174 \n\t \n\t \n\t\t Diabetes Obes Metab \n\t\t \n\t\t\t 20 \n\t\t\t 2 \n\t\t\t \n\t\t\t 2018 \n\t\t \n\t \n\t FREE Full text \n\t Reddy R, El Youssef J, Winters-Stone K, Branigan D, Leitschuh J, Castle J, et al. The effect of exercise on sleep in adults with type 1 diabetes. Diabetes Obes Metab 2018;20(2):443-447 [FREE Full text] [doi: 10.1111/dom.13065] [Medline: 28718987] 174"
    },
    {
      "title": "Objective measure of activity level after total knee arthoplasty with the use of the 'Fitbit' device",
      "authors": [
        "J Roe",
        "L Salmon",
        "J Twiggs"
      ],
      "year": 2016,
      "doi": "10.1177/2325967116s00012",
      "journal": "Orthop J Sports Med",
      "volume": "4",
      "issue": "Supplement 2",
      "raw": "Objective measure of activity level after total knee arthoplasty with the use of the 'Fitbit' device \n\t\t \n\t\t\t J Roe \n\t\t \n\t\t \n\t\t\t L Salmon \n\t\t \n\t\t \n\t\t\t J Twiggs \n\t\t \n\t\t 10.1177/2325967116s00012 \n\t \n\t \n\t\t Orthop J Sports Med \n\t\t \n\t\t\t 4 \n\t\t\t Supplement 2 \n\t\t\t \n\t\t\t 2016 \n\t\t \n\t \n\t FREE Full text \n\t Roe J, Salmon L, Twiggs J. Objective measure of activity level after total knee arthoplasty with the use of the 'Fitbit' device. Orthop J Sports Med 2016;4(Supplement 2):2325967116S00012 [FREE Full text] [doi: 10.1177/2325967116S00012] 175"
    },
    {
      "title": "Physical activity and activity space in patients with pulmonary fibrosis not prescribed supplemental oxygen",
      "authors": [
        "E Root",
        "B Graney",
        "S Baird",
        "T Churney",
        "K Fier",
        "M Korn"
      ],
      "year": 2017,
      "doi": "10.1186/s12890-017-0495-2",
      "journal": "BMC Pulm Med",
      "volume": "17",
      "issue": "1",
      "pages": "154",
      "raw": "Physical activity and activity space in patients with pulmonary fibrosis not prescribed supplemental oxygen \n\t\t \n\t\t\t E D Root \n\t\t \n\t\t \n\t\t\t B Graney \n\t\t \n\t\t \n\t\t\t S Baird \n\t\t \n\t\t \n\t\t\t T Churney \n\t\t \n\t\t \n\t\t\t K Fier \n\t\t \n\t\t \n\t\t\t M Korn \n\t\t \n\t\t 10.1186/s12890-017-0495-2 \n\t\t Medline: 29169394] 176 \n\t \n\t \n\t\t BMC Pulm Med \n\t\t \n\t\t\t 17 \n\t\t\t 1 \n\t\t\t 154 \n\t\t\t 2017 \n\t\t \n\t \n\t FREE Full text \n\t Root ED, Graney B, Baird S, Churney T, Fier K, Korn M, et al. Physical activity and activity space in patients with pulmonary fibrosis not prescribed supplemental oxygen. BMC Pulm Med 2017;17(1):154 [FREE Full text] [doi: 10.1186/s12890-017-0495-2] [Medline: 29169394] 176"
    },
    {
      "title": "Activity tracker-based metrics as digital markers of cardiometabolic health in working adults: cross-sectional study",
      "authors": [
        "Y Rykov",
        "T Thach",
        "G Dunleavy",
        "A Roberts",
        "G Christopoulos",
        "C Soh"
      ],
      "year": 2020,
      "doi": "10.2196/16409",
      "journal": "JMIR Mhealth Uhealth",
      "volume": "8",
      "issue": "1",
      "pages": "16409",
      "raw": "Activity tracker-based metrics as digital markers of cardiometabolic health in working adults: cross-sectional study \n\t\t \n\t\t\t Y Rykov \n\t\t \n\t\t \n\t\t\t T Q Thach \n\t\t \n\t\t \n\t\t\t G Dunleavy \n\t\t \n\t\t \n\t\t\t A C Roberts \n\t\t \n\t\t \n\t\t\t G Christopoulos \n\t\t \n\t\t \n\t\t\t C K Soh \n\t\t \n\t\t 10.2196/16409 \n\t\t Medline: 32012098] 177 \n\t \n\t \n\t\t JMIR Mhealth Uhealth \n\t\t \n\t\t\t 8 \n\t\t\t 1 \n\t\t\t 16409 \n\t\t\t 2020 \n\t\t \n\t \n\t FREE Full text \n\t Rykov Y, Thach TQ, Dunleavy G, Roberts AC, Christopoulos G, Soh CK, et al. Activity tracker-based metrics as digital markers of cardiometabolic health in working adults: cross-sectional study. JMIR Mhealth Uhealth 2020;8(1):e16409 [FREE Full text] [doi: 10.2196/16409] [Medline: 32012098] 177"
    },
    {
      "title": "Continuous 7-month internet of things-based monitoring of health parameters of pregnant and postpartum women: prospective observational feasibility study",
      "authors": [
        "J Saarikko",
        "H Niela-Vilen",
        "E Ekholm",
        "L Hamari",
        "I Azimi",
        "P Liljeberg"
      ],
      "year": 2020,
      "doi": "10.2196/12417",
      "journal": "JMIR Form Res",
      "volume": "4",
      "issue": "7",
      "pages": "12417",
      "raw": "Continuous 7-month internet of things-based monitoring of health parameters of pregnant and postpartum women: prospective observational feasibility study \n\t\t \n\t\t\t J Saarikko \n\t\t \n\t\t \n\t\t\t H Niela-Vilen \n\t\t \n\t\t \n\t\t\t E Ekholm \n\t\t \n\t\t \n\t\t\t L Hamari \n\t\t \n\t\t \n\t\t\t I Azimi \n\t\t \n\t\t \n\t\t\t P Liljeberg \n\t\t \n\t\t 10.2196/12417 \n\t\t Medline: 32706696] 178 \n\t \n\t \n\t\t JMIR Form Res \n\t\t \n\t\t\t 4 \n\t\t\t 7 \n\t\t\t 12417 \n\t\t\t 2020 \n\t\t \n\t \n\t FREE Full text \n\t Saarikko J, Niela-Vilen H, Ekholm E, Hamari L, Azimi I, Liljeberg P, et al. Continuous 7-month internet of things-based monitoring of health parameters of pregnant and postpartum women: prospective observational feasibility study. JMIR Form Res 2020;4(7):e12417 [FREE Full text] [doi: 10.2196/12417] [Medline: 32706696] 178"
    },
    {
      "title": "Feasibility of using a wearable biosensor device in patients at risk for Alzheimer's disease dementia",
      "authors": [
        "N Saif",
        "P Yan",
        "K Niotis",
        "O Scheyer",
        "A Rahman",
        "M Berkowitz"
      ],
      "year": 2020,
      "doi": "10.14283/jpad.2019.39",
      "journal": "J Prev Alzheimers Dis",
      "volume": "7",
      "issue": "2",
      "raw": "Feasibility of using a wearable biosensor device in patients at risk for Alzheimer's disease dementia \n\t\t \n\t\t\t N Saif \n\t\t \n\t\t \n\t\t\t P Yan \n\t\t \n\t\t \n\t\t\t K Niotis \n\t\t \n\t\t \n\t\t\t O Scheyer \n\t\t \n\t\t \n\t\t\t A Rahman \n\t\t \n\t\t \n\t\t\t M Berkowitz \n\t\t \n\t\t 10.14283/jpad.2019.39 \n\t\t Medline: 32236399] 179 \n\t \n\t \n\t\t J Prev Alzheimers Dis \n\t\t \n\t\t\t 7 \n\t\t\t 2 \n\t\t\t \n\t\t\t 2020 \n\t\t \n\t \n\t FREE Full text \n\t Saif N, Yan P, Niotis K, Scheyer O, Rahman A, Berkowitz M, et al. Feasibility of using a wearable biosensor device in patients at risk for Alzheimer's disease dementia. J Prev Alzheimers Dis 2020;7(2):104-111 [FREE Full text] [doi: 10.14283/jpad.2019.39] [Medline: 32236399] 179"
    },
    {
      "title": "Objective sleep duration in older adults: results from the Irish longitudinal study on ageing",
      "authors": [
        "S Scarlett",
        "H Nolan",
        "R Kenny",
        "O' Connell"
      ],
      "year": 2020,
      "doi": "10.1111/jgs.16177",
      "journal": "J Am Geriatr Soc",
      "volume": "68",
      "issue": "1",
      "raw": "Objective sleep duration in older adults: results from the Irish longitudinal study on ageing \n\t\t \n\t\t\t S Scarlett \n\t\t \n\t\t \n\t\t\t H Nolan \n\t\t \n\t\t \n\t\t\t R A Kenny \n\t\t \n\t\t \n\t\t\t O' Connell \n\t\t \n\t\t \n\t\t\t M D \n\t\t \n\t\t 10.1111/jgs.16177 \n\t\t Medline: 31579942] 180 \n\t \n\t \n\t\t J Am Geriatr Soc \n\t\t \n\t\t\t 68 \n\t\t\t 1 \n\t\t\t \n\t\t\t 2020 \n\t\t \n\t \n\t Scarlett S, Nolan H, Kenny RA, O'Connell MD. Objective sleep duration in older adults: results from the Irish longitudinal study on ageing. J Am Geriatr Soc 2020;68(1):120-128. [doi: 10.1111/jgs.16177] [Medline: 31579942] 180"
    },
    {
      "title": "STep-count using an Accelerometer for Monitoring PAH-STAMP Study group. Counting steps: a new way to monitor patients with pulmonary arterial hypertension",
      "authors": [
        "S Sehgal",
        "A Chowdhury",
        "F Rabih",
        "A Gadre",
        "M Park",
        "M Li"
      ],
      "year": 2019,
      "doi": "10.1007/s00408-019-00239-y",
      "journal": "Lung",
      "volume": "197",
      "issue": "4",
      "raw": "STep-count using an Accelerometer for Monitoring PAH-STAMP Study group. Counting steps: a new way to monitor patients with pulmonary arterial hypertension \n\t\t \n\t\t\t S Sehgal \n\t\t \n\t\t \n\t\t\t A Chowdhury \n\t\t \n\t\t \n\t\t\t F Rabih \n\t\t \n\t\t \n\t\t\t A Gadre \n\t\t \n\t\t \n\t\t\t M M Park \n\t\t \n\t\t \n\t\t\t M Li \n\t\t \n\t\t 10.1007/s00408-019-00239-y \n\t\t Medline: 31144016] 181 \n\t \n\t \n\t\t Lung \n\t\t \n\t\t\t 197 \n\t\t\t 4 \n\t\t\t \n\t\t\t 2019 \n\t\t \n\t \n\t Sehgal S, Chowdhury A, Rabih F, Gadre A, Park MM, Li M, STep-count using an Accelerometer for Monitoring PAH-STAMP Study group. Counting steps: a new way to monitor patients with pulmonary arterial hypertension. Lung 2019;197(4):501-508. [doi: 10.1007/s00408-019-00239-y] [Medline: 31144016] 181"
    },
    {
      "title": "Physical activity and atrial fibrillation: data from wearable fitness trackers",
      "authors": [
        "S Semaan",
        "T Dewland",
        "G Tison",
        "G Nah",
        "E Vittinghoff",
        "M Pletcher"
      ],
      "year": 2020,
      "doi": "10.1016/j.hrthm.2020.02.013",
      "journal": "Heart Rhythm",
      "volume": "17",
      "issue": "5",
      "raw": "Physical activity and atrial fibrillation: data from wearable fitness trackers \n\t\t \n\t\t\t S Semaan \n\t\t \n\t\t \n\t\t\t T A Dewland \n\t\t \n\t\t \n\t\t\t G H Tison \n\t\t \n\t\t \n\t\t\t G Nah \n\t\t \n\t\t \n\t\t\t E Vittinghoff \n\t\t \n\t\t \n\t\t\t M J Pletcher \n\t\t \n\t\t 10.1016/j.hrthm.2020.02.013 \n\t\t Medline: 32354448] 182 \n\t \n\t \n\t\t Heart Rhythm \n\t\t \n\t\t\t 17 \n\t\t\t 5 \n\t\t\t \n\t\t\t 2020 \n\t\t \n\t \n\t Pt B \n\t Semaan S, Dewland TA, Tison GH, Nah G, Vittinghoff E, Pletcher MJ, et al. Physical activity and atrial fibrillation: data from wearable fitness trackers. Heart Rhythm 2020;17(5 Pt B):842-846. [doi: 10.1016/j.hrthm.2020.02.013] [Medline: 32354448] 182"
    },
    {
      "title": "Enhancing diabetes self-management through collection and visualization of data from multiple mobile health technologies: protocol for a development and feasibility trial",
      "authors": [
        "R Shaw",
        "A Barnes",
        "D Steinberg",
        "J Vaughn",
        "Diane Levine"
      ],
      "year": 2019,
      "doi": "10.2196/13517",
      "journal": "JMIR Res Protoc",
      "volume": "8",
      "issue": "6",
      "pages": "13517",
      "raw": "Enhancing diabetes self-management through collection and visualization of data from multiple mobile health technologies: protocol for a development and feasibility trial \n\t\t \n\t\t\t R J Shaw \n\t\t \n\t\t \n\t\t\t A Barnes \n\t\t \n\t\t \n\t\t\t D Steinberg \n\t\t \n\t\t \n\t\t\t J Vaughn \n\t\t \n\t\t \n\t\t\t Diane A Levine \n\t\t \n\t\t \n\t\t\t E \n\t\t \n\t\t 10.2196/13517 \n\t\t Medline: 31162127] 183 \n\t \n\t \n\t\t JMIR Res Protoc \n\t\t \n\t\t\t 8 \n\t\t\t 6 \n\t\t\t 13517 \n\t\t\t 2019 \n\t\t \n\t \n\t FREE Full text \n\t Shaw RJ, Barnes A, Steinberg D, Vaughn J, Diane A, Levine E, et al. Enhancing diabetes self-management through collection and visualization of data from multiple mobile health technologies: protocol for a development and feasibility trial. JMIR Res Protoc 2019;8(6):e13517 [FREE Full text] [doi: 10.2196/13517] [Medline: 31162127] 183"
    },
    {
      "title": "Impaired chronotropic response to physical activities in heart failure patients",
      "authors": [
        "H Shen",
        "J Zhao",
        "X Zhou",
        "J Li",
        "Q Wan",
        "J Huang"
      ],
      "year": 2017,
      "doi": "10.1186/s12872-017-0571-9",
      "journal": "BMC Cardiovasc Disord",
      "volume": "17",
      "issue": "1",
      "pages": "136",
      "raw": "Impaired chronotropic response to physical activities in heart failure patients \n\t\t \n\t\t\t H Shen \n\t\t \n\t\t \n\t\t\t J Zhao \n\t\t \n\t\t \n\t\t\t X Zhou \n\t\t \n\t\t \n\t\t\t J Li \n\t\t \n\t\t \n\t\t\t Q Wan \n\t\t \n\t\t \n\t\t\t J Huang \n\t\t \n\t\t 10.1186/s12872-017-0571-9 \n\t\t Medline: 28545575] 184 \n\t \n\t \n\t\t BMC Cardiovasc Disord \n\t\t \n\t\t\t 17 \n\t\t\t 1 \n\t\t\t 136 \n\t\t\t 2017 \n\t\t \n\t \n\t FREE Full text \n\t Shen H, Zhao J, Zhou X, Li J, Wan Q, Huang J, et al. Impaired chronotropic response to physical activities in heart failure patients. BMC Cardiovasc Disord 2017;17(1):136 [FREE Full text] [doi: 10.1186/s12872-017-0571-9] [Medline: 28545575] 184"
    },
    {
      "title": "Modern fertility awareness methods: wrist wearables capture the changes in temperature associated with the menstrual cycle",
      "authors": [
        "M Shilaih",
        "B Goodale",
        "L Falco",
        "F K\u00fcbler",
        "De Clerck",
        "V Leeners"
      ],
      "year": 2018,
      "doi": "10.1042/BSR20171279",
      "journal": "Biosci Rep",
      "volume": "38",
      "issue": "6",
      "raw": "Modern fertility awareness methods: wrist wearables capture the changes in temperature associated with the menstrual cycle \n\t\t \n\t\t\t M Shilaih \n\t\t \n\t\t \n\t\t\t B M Goodale \n\t\t \n\t\t \n\t\t\t L Falco \n\t\t \n\t\t \n\t\t\t F K\u00fcbler \n\t\t \n\t\t \n\t\t\t De Clerck \n\t\t \n\t\t \n\t\t\t V Leeners \n\t\t \n\t\t \n\t\t\t B \n\t\t \n\t\t 10.1042/BSR20171279 \n\t\t Medline: 29175999] 185 \n\t \n\t \n\t\t Biosci Rep \n\t\t \n\t\t\t 38 \n\t\t\t 6 \n\t\t\t 2018 \n\t\t \n\t \n\t FREE Full text \n\t Shilaih M, Goodale BM, Falco L, K\u00fcbler F, De Clerck V, Leeners B. Modern fertility awareness methods: wrist wearables capture the changes in temperature associated with the menstrual cycle. Biosci Rep 2018;38(6):BSR20171279 [FREE Full text] [doi: 10.1042/BSR20171279] [Medline: 29175999] 185"
    },
    {
      "title": "Pulse rate measurement during sleep using wearable sensors, and its correlation with the menstrual cycle phases, a prospective observational study",
      "authors": [
        "M Shilaih",
        "V Clerck",
        "L Falco",
        "F K\u00fcbler",
        "B Leeners"
      ],
      "year": 2017,
      "doi": "10.1038/s41598-017-01433-9",
      "journal": "Sci Rep",
      "volume": "7",
      "issue": "1",
      "pages": "1294",
      "raw": "Pulse rate measurement during sleep using wearable sensors, and its correlation with the menstrual cycle phases, a prospective observational study \n\t\t \n\t\t\t M Shilaih \n\t\t \n\t\t \n\t\t\t V Clerck \n\t\t \n\t\t \n\t\t\t L Falco \n\t\t \n\t\t \n\t\t\t F K\u00fcbler \n\t\t \n\t\t \n\t\t\t B Leeners \n\t\t \n\t\t 10.1038/s41598-017-01433-9 \n\t\t Medline: 28465583] 186 \n\t \n\t \n\t\t Sci Rep \n\t\t \n\t\t\t 7 \n\t\t\t 1 \n\t\t\t 1294 \n\t\t\t 2017 \n\t\t \n\t \n\t FREE Full text \n\t Shilaih M, Clerck V, Falco L, K\u00fcbler F, Leeners B. Pulse rate measurement during sleep using wearable sensors, and its correlation with the menstrual cycle phases, a prospective observational study. Sci Rep 2017;7(1):1294 [FREE Full text] [doi: 10.1038/s41598-017-01433-9] [Medline: 28465583] 186"
    },
    {
      "title": "Biometric and psychometric remote monitoring and cardiovascular risk biomarkers in ischemic heart disease",
      "authors": [
        "C Shufelt",
        "A Kim",
        "S Joung",
        "L Barsky",
        "C Arnold",
        "S Cheng"
      ],
      "year": 2020,
      "doi": "10.1161/jaha.120.016023",
      "journal": "J Am Heart Assoc",
      "volume": "9",
      "issue": "18",
      "pages": "16023",
      "raw": "Biometric and psychometric remote monitoring and cardiovascular risk biomarkers in ischemic heart disease \n\t\t \n\t\t\t C L Shufelt \n\t\t \n\t\t \n\t\t\t A Kim \n\t\t \n\t\t \n\t\t\t S Joung \n\t\t \n\t\t \n\t\t\t L Barsky \n\t\t \n\t\t \n\t\t\t C Arnold \n\t\t \n\t\t \n\t\t\t S Cheng \n\t\t \n\t\t 10.1161/jaha.120.016023 \n\t\t Medline: 32896202] 187 \n\t \n\t \n\t\t J Am Heart Assoc \n\t\t \n\t\t\t 9 \n\t\t\t 18 \n\t\t\t 16023 \n\t\t\t 2020 \n\t\t \n\t \n\t FREE Full text \n\t Shufelt CL, Kim A, Joung S, Barsky L, Arnold C, Cheng S, et al. Biometric and psychometric remote monitoring and cardiovascular risk biomarkers in ischemic heart disease. J Am Heart Assoc 2020;9(18):e016023 [FREE Full text] [doi: 10.1161/JAHA.120.016023] [Medline: 32896202] 187"
    },
    {
      "title": "mActive-Smoke: a prospective observational study using mobile health tools to assess the association of physical activity with smoking urges",
      "authors": [
        "L Silverman-Lloyd",
        "S Kianoush",
        "M Blaha",
        "A Sabina",
        "G Graham",
        "S Martin"
      ],
      "year": 2018,
      "doi": "10.2196/mhealth.9292",
      "journal": "JMIR Mhealth Uhealth",
      "volume": "6",
      "issue": "5",
      "pages": "121",
      "raw": "mActive-Smoke: a prospective observational study using mobile health tools to assess the association of physical activity with smoking urges \n\t\t \n\t\t\t L G Silverman-Lloyd \n\t\t \n\t\t \n\t\t\t S Kianoush \n\t\t \n\t\t \n\t\t\t M J Blaha \n\t\t \n\t\t \n\t\t\t A B Sabina \n\t\t \n\t\t \n\t\t\t G N Graham \n\t\t \n\t\t \n\t\t\t S S Martin \n\t\t \n\t\t 10.2196/mhealth.9292 \n\t\t Medline: 29752250] 188 \n\t \n\t \n\t\t JMIR Mhealth Uhealth \n\t\t \n\t\t\t 6 \n\t\t\t 5 \n\t\t\t 121 \n\t\t\t 2018 \n\t\t \n\t \n\t FREE Full text \n\t Silverman-Lloyd LG, Kianoush S, Blaha MJ, Sabina AB, Graham GN, Martin SS. mActive-Smoke: a prospective observational study using mobile health tools to assess the association of physical activity with smoking urges. JMIR Mhealth Uhealth 2018;6(5):e121 [FREE Full text] [doi: 10.2196/mhealth.9292] [Medline: 29752250] 188"
    },
    {
      "title": "Changes in taste preference and steps taken after sleep curtailment",
      "authors": [
        "S Smith",
        "M Ludy",
        "R Tucker"
      ],
      "year": 2016,
      "doi": "10.1016/j.physbeh.2016.05.002",
      "journal": "Physiol Behav",
      "volume": "163",
      "raw": "Changes in taste preference and steps taken after sleep curtailment \n\t\t \n\t\t\t S L Smith \n\t\t \n\t\t \n\t\t\t M J Ludy \n\t\t \n\t\t \n\t\t\t R M Tucker \n\t\t \n\t\t 10.1016/j.physbeh.2016.05.002 \n\t\t Medline: 27184237] 189 \n\t \n\t \n\t\t Physiol Behav \n\t\t \n\t\t\t 163 \n\t\t\t \n\t\t\t 2016 \n\t\t \n\t \n\t Smith SL, Ludy MJ, Tucker RM. Changes in taste preference and steps taken after sleep curtailment. Physiol Behav 2016;163:228-233. [doi: 10.1016/j.physbeh.2016.05.002] [Medline: 27184237] 189"
    },
    {
      "title": "Incidence and timing of potentially high-risk arrhythmias detected through long term continuous ambulatory electrocardiographic monitoring",
      "authors": [
        "M Solomon",
        "J Yang",
        "S Sung",
        "M Livingston",
        "G Sarlas",
        "J Lenane"
      ],
      "year": 2016,
      "doi": "10.1186/s12872-016-0210-x",
      "journal": "BMC Cardiovasc Disord",
      "volume": "16",
      "pages": "35",
      "raw": "Incidence and timing of potentially high-risk arrhythmias detected through long term continuous ambulatory electrocardiographic monitoring \n\t\t \n\t\t\t M D Solomon \n\t\t \n\t\t \n\t\t\t J Yang \n\t\t \n\t\t \n\t\t\t S H Sung \n\t\t \n\t\t \n\t\t\t M L Livingston \n\t\t \n\t\t \n\t\t\t G Sarlas \n\t\t \n\t\t \n\t\t\t J C Lenane \n\t\t \n\t\t 10.1186/s12872-016-0210-x \n\t\t Medline: 26883019] 190 \n\t \n\t \n\t\t BMC Cardiovasc Disord \n\t\t \n\t\t\t 16 \n\t\t\t 35 \n\t\t\t 2016 \n\t\t \n\t \n\t FREE Full text \n\t Solomon MD, Yang J, Sung SH, Livingston ML, Sarlas G, Lenane JC, et al. Incidence and timing of potentially high-risk arrhythmias detected through long term continuous ambulatory electrocardiographic monitoring. BMC Cardiovasc Disord 2016;16:35 [FREE Full text] [doi: 10.1186/s12872-016-0210-x] [Medline: 26883019] 190"
    },
    {
      "title": "Identification of earlier predictors of pregnancy complications through wearable technologies in a Brazilian multicentre cohort: Maternal Actigraphy Exploratory Study I (MAES-I) study protocol",
      "authors": [
        "R Souza",
        "J Cecatti",
        "J Mayrink",
        "R Galv\u00e3o",
        "M Costa",
        "F Feitosa",
        "Maes-I Study Group"
      ],
      "year": 2019,
      "doi": "10.1136/bmjopen-2018-023101",
      "journal": "BMJ Open",
      "volume": "9",
      "issue": "4",
      "pages": "23101",
      "raw": "Identification of earlier predictors of pregnancy complications through wearable technologies in a Brazilian multicentre cohort: Maternal Actigraphy Exploratory Study I (MAES-I) study protocol \n\t\t \n\t\t\t R T Souza \n\t\t \n\t\t \n\t\t\t J G Cecatti \n\t\t \n\t\t \n\t\t\t J Mayrink \n\t\t \n\t\t \n\t\t\t R B Galv\u00e3o \n\t\t \n\t\t \n\t\t\t M L Costa \n\t\t \n\t\t \n\t\t\t F Feitosa \n\t\t \n\t\t \n\t\t\t Maes-I Study Group \n\t\t \n\t\t 10.1136/bmjopen-2018-023101 \n\t\t Medline: 31005906] 191 \n\t \n\t \n\t\t BMJ Open \n\t\t \n\t\t\t 9 \n\t\t\t 4 \n\t\t\t 23101 \n\t\t\t 2019 \n\t\t \n\t \n\t FREE Full text \n\t Souza RT, Cecatti JG, Mayrink J, Galv\u00e3o RB, Costa ML, Feitosa F, MAES-I Study Group. Identification of earlier predictors of pregnancy complications through wearable technologies in a Brazilian multicentre cohort: Maternal Actigraphy Exploratory Study I (MAES-I) study protocol. BMJ Open 2019;9(4):e023101 [FREE Full text] [doi: 10.1136/bmjopen-2018-023101] [Medline: 31005906] 191"
    },
    {
      "title": "Effect of a home-based wearable continuous ECG monitoring patch on detection of undiagnosed atrial fibrillation: the mSToPS randomized clinical trial",
      "authors": [
        "S Steinhubl",
        "J Waalen",
        "A Edwards",
        "L Ariniello",
        "R Mehta",
        "G Ebner"
      ],
      "year": 2018,
      "doi": "10.1001/jama.2018.8102",
      "journal": "JAMA",
      "volume": "320",
      "issue": "2",
      "raw": "Effect of a home-based wearable continuous ECG monitoring patch on detection of undiagnosed atrial fibrillation: the mSToPS randomized clinical trial \n\t\t \n\t\t\t S R Steinhubl \n\t\t \n\t\t \n\t\t\t J Waalen \n\t\t \n\t\t \n\t\t\t A M Edwards \n\t\t \n\t\t \n\t\t\t L M Ariniello \n\t\t \n\t\t \n\t\t\t R R Mehta \n\t\t \n\t\t \n\t\t\t G S Ebner \n\t\t \n\t\t 10.1001/jama.2018.8102 \n\t\t Medline: 29998336] 192 \n\t \n\t \n\t\t JAMA \n\t\t \n\t\t\t 320 \n\t\t\t 2 \n\t\t\t \n\t\t\t 2018 \n\t\t \n\t \n\t FREE Full text \n\t Steinhubl SR, Waalen J, Edwards AM, Ariniello LM, Mehta RR, Ebner GS, et al. Effect of a home-based wearable continuous ECG monitoring patch on detection of undiagnosed atrial fibrillation: the mSToPS randomized clinical trial. JAMA 2018;320(2):146-155 [FREE Full text] [doi: 10.1001/jama.2018.8102] [Medline: 29998336] 192"
    },
    {
      "title": "Bouldering psychotherapy reduces depressive symptoms even when general physical activity is controlled for: a randomized controlled trial",
      "authors": [
        "E Stelzer",
        "S Book",
        "E Graessel",
        "B Hofner",
        "J Kornhuber",
        "K Luttenberger"
      ],
      "year": 2018,
      "doi": "10.1016/j.heliyon.2018.e00580",
      "journal": "Heliyon",
      "volume": "4",
      "issue": "3",
      "pages": "580",
      "raw": "Bouldering psychotherapy reduces depressive symptoms even when general physical activity is controlled for: a randomized controlled trial \n\t\t \n\t\t\t E M Stelzer \n\t\t \n\t\t \n\t\t\t S Book \n\t\t \n\t\t \n\t\t\t E Graessel \n\t\t \n\t\t \n\t\t\t B Hofner \n\t\t \n\t\t \n\t\t\t J Kornhuber \n\t\t \n\t\t \n\t\t\t K Luttenberger \n\t\t \n\t\t 10.1016/j.heliyon.2018.e00580 \n\t\t Medline: 29862344] 193 \n\t \n\t \n\t\t Heliyon \n\t\t \n\t\t\t 4 \n\t\t\t 3 \n\t\t\t 580 \n\t\t\t 2018 \n\t\t \n\t \n\t FREE Full text \n\t Stelzer EM, Book S, Graessel E, Hofner B, Kornhuber J, Luttenberger K. Bouldering psychotherapy reduces depressive symptoms even when general physical activity is controlled for: a randomized controlled trial. Heliyon 2018;4(3):e00580 [FREE Full text] [doi: 10.1016/j.heliyon.2018.e00580] [Medline: 29862344] 193"
    },
    {
      "title": "Wearable-device-measured physical activity and future health risk",
      "authors": [
        "T Strain",
        "K Wijndaele",
        "P Dempsey",
        "S Sharp",
        "M Pearce",
        "J Jeon"
      ],
      "year": 2020,
      "doi": "10.1038/s41591-020-1012-3",
      "journal": "Nat Med",
      "volume": "26",
      "issue": "9",
      "raw": "Wearable-device-measured physical activity and future health risk \n\t\t \n\t\t\t T Strain \n\t\t \n\t\t \n\t\t\t K Wijndaele \n\t\t \n\t\t \n\t\t\t P C Dempsey \n\t\t \n\t\t \n\t\t\t S J Sharp \n\t\t \n\t\t \n\t\t\t M Pearce \n\t\t \n\t\t \n\t\t\t J Jeon \n\t\t \n\t\t 10.1038/s41591-020-1012-3 \n\t\t Medline: 32807930] 194 \n\t \n\t \n\t\t Nat Med \n\t\t \n\t\t\t 26 \n\t\t\t 9 \n\t\t\t \n\t\t\t 2020 \n\t\t \n\t \n\t Strain T, Wijndaele K, Dempsey PC, Sharp SJ, Pearce M, Jeon J, et al. Wearable-device-measured physical activity and future health risk. Nat Med 2020;26(9):1385-1391. [doi: 10.1038/s41591-020-1012-3] [Medline: 32807930] 194"
    },
    {
      "title": "Physiological effects of interactions between female dog owners with neuroticism and their dogs",
      "authors": [
        "K Tateishi",
        "N Ohtani",
        "M Ohta"
      ],
      "year": 2014,
      "doi": "10.1016/j.jveb.2014.08.005",
      "journal": "J Vet Behav",
      "volume": "9",
      "issue": "6",
      "raw": "Physiological effects of interactions between female dog owners with neuroticism and their dogs \n\t\t \n\t\t\t K Tateishi \n\t\t \n\t\t \n\t\t\t N Ohtani \n\t\t \n\t\t \n\t\t\t M Ohta \n\t\t \n\t\t 10.1016/j.jveb.2014.08.005 \n\t \n\t \n\t\t J Vet Behav \n\t\t \n\t\t\t 9 \n\t\t\t 6 \n\t\t\t \n\t\t\t 2014 \n\t\t \n\t \n\t Tateishi K, Ohtani N, Ohta M. Physiological effects of interactions between female dog owners with neuroticism and their dogs. J Vet Behav 2014;9(6):304-310. [doi: 10.1016/j.jveb.2014.08.005] 195"
    },
    {
      "title": "Assessment of physical activity by wearable technology during rehabilitation after cardiac surgery: explorative prospective monocentric observational cohort study",
      "authors": [
        "I Thijs",
        "L Fresiello",
        "W Oosterlinck",
        "P Sinnaeve",
        "F Rega"
      ],
      "year": 2019,
      "doi": "10.2196/mhealth.9865",
      "journal": "JMIR Mhealth Uhealth",
      "volume": "7",
      "issue": "1",
      "pages": "e9865",
      "raw": "Assessment of physical activity by wearable technology during rehabilitation after cardiac surgery: explorative prospective monocentric observational cohort study \n\t\t \n\t\t\t I Thijs \n\t\t \n\t\t \n\t\t\t L Fresiello \n\t\t \n\t\t \n\t\t\t W Oosterlinck \n\t\t \n\t\t \n\t\t\t P Sinnaeve \n\t\t \n\t\t \n\t\t\t F Rega \n\t\t \n\t\t 10.2196/mhealth.9865 \n\t\t Medline: 30702433] 196 \n\t \n\t \n\t\t JMIR Mhealth Uhealth \n\t\t \n\t\t\t 7 \n\t\t\t 1 \n\t\t\t e9865 \n\t\t\t 2019 \n\t\t \n\t \n\t FREE Full text \n\t Thijs I, Fresiello L, Oosterlinck W, Sinnaeve P, Rega F. Assessment of physical activity by wearable technology during rehabilitation after cardiac surgery: explorative prospective monocentric observational cohort study. JMIR Mhealth Uhealth 2019;7(1):e9865 [FREE Full text] [doi: 10.2196/mhealth.9865] [Medline: 30702433] 196"
    },
    {
      "title": "Mobile health technology can objectively capture physical activity (PA) targets among African-American women within resource-limited communities-the Washington, D.C. cardiovascular health and needs assessment",
      "authors": [
        "S Thomas",
        "L Yingling",
        "J Adu-Brimpong",
        "V Mitchell",
        "C Ayers",
        "G Wallen"
      ],
      "year": 2016,
      "doi": "10.1007/s40615-016-0290-4",
      "journal": "J Racial Ethn Health Disparities",
      "raw": "Mobile health technology can objectively capture physical activity (PA) targets among African-American women within resource-limited communities-the Washington, D.C. cardiovascular health and needs assessment \n\t\t \n\t\t\t S Thomas \n\t\t \n\t\t \n\t\t\t L Yingling \n\t\t \n\t\t \n\t\t\t J Adu-Brimpong \n\t\t \n\t\t \n\t\t\t V Mitchell \n\t\t \n\t\t \n\t\t\t C R Ayers \n\t\t \n\t\t \n\t\t\t G R Wallen \n\t\t \n\t\t 10.1007/s40615-016-0290-4 \n\t\t Medline: 27913983] 197 \n\t \n\t \n\t\t J Racial Ethn Health Disparities \n\t\t \n\t\t\t 2016 \n\t\t \n\t \n\t forthcoming forthcoming FREE Full text \n\t Thomas S, Yingling L, Adu-Brimpong J, Mitchell V, Ayers CR, Wallen GR, et al. Mobile health technology can objectively capture physical activity (PA) targets among African-American women within resource-limited communities-the Washington, D.C. cardiovascular health and needs assessment. J Racial Ethn Health Disparities (forthcoming) 2016:-(forthcoming) [FREE Full text] [doi: 10.1007/s40615-016-0290-4] [Medline: 27913983] 197"
    },
    {
      "title": "Occupational physical activity in brewery and office workers",
      "authors": [
        "J Thompson",
        "R Severson",
        "J Rosecrance"
      ],
      "year": 2018,
      "doi": "10.1080/15459624.2018.1492136",
      "journal": "J Occup Environ Hyg",
      "volume": "15",
      "issue": "9",
      "raw": "Occupational physical activity in brewery and office workers \n\t\t \n\t\t\t J F Thompson \n\t\t \n\t\t \n\t\t\t R L Severson \n\t\t \n\t\t \n\t\t\t J C Rosecrance \n\t\t \n\t\t 10.1080/15459624.2018.1492136 \n\t\t Medline: 30188781] 198 \n\t \n\t \n\t\t J Occup Environ Hyg \n\t\t \n\t\t\t 15 \n\t\t\t 9 \n\t\t\t \n\t\t\t 2018 \n\t\t \n\t \n\t Thompson JF, Severson RL, Rosecrance JC. Occupational physical activity in brewery and office workers. J Occup Environ Hyg 2018;15(9):686-699. [doi: 10.1080/15459624.2018.1492136] [Medline: 30188781] 198"
    },
    {
      "title": "Cardiac patients' walking activity determined by a step counter in cardiac telerehabilitation: data from the intervention arm of a randomized controlled trial",
      "authors": [
        "C Thorup",
        "J Hansen",
        "M Gr\u00f8nkjaer",
        "J Andreasen",
        "G Nielsen",
        "E S\u00f8rensen"
      ],
      "year": 2016,
      "doi": "10.2196/jmir.5191",
      "journal": "J Med Internet Res",
      "volume": "18",
      "issue": "4",
      "pages": "69",
      "raw": "Cardiac patients' walking activity determined by a step counter in cardiac telerehabilitation: data from the intervention arm of a randomized controlled trial \n\t\t \n\t\t\t C Thorup \n\t\t \n\t\t \n\t\t\t J Hansen \n\t\t \n\t\t \n\t\t\t M Gr\u00f8nkjaer \n\t\t \n\t\t \n\t\t\t J J Andreasen \n\t\t \n\t\t \n\t\t\t G Nielsen \n\t\t \n\t\t \n\t\t\t E E S\u00f8rensen \n\t\t \n\t\t 10.2196/jmir.5191 \n\t\t Medline: 27044310] 199 \n\t \n\t \n\t\t J Med Internet Res \n\t\t \n\t\t\t 18 \n\t\t\t 4 \n\t\t\t 69 \n\t\t\t 2016 \n\t\t \n\t \n\t FREE Full text \n\t Thorup C, Hansen J, Gr\u00f8nkjaer M, Andreasen JJ, Nielsen G, S\u00f8rensen EE, et al. Cardiac patients' walking activity determined by a step counter in cardiac telerehabilitation: data from the intervention arm of a randomized controlled trial. J Med Internet Res 2016;18(4):e69 [FREE Full text] [doi: 10.2196/jmir.5191] [Medline: 27044310] 199"
    },
    {
      "title": "Stress-induced blood pressure elevation self-measured by a wearable watch-type device",
      "authors": [
        "N Tomitani",
        "H Kanegae",
        "Y Suzuki",
        "M Kuwabara",
        "K Kario"
      ],
      "year": 2021,
      "doi": "10.1093/ajh/hpaa139",
      "journal": "Am J Hypertens",
      "volume": "34",
      "issue": "4",
      "raw": "Stress-induced blood pressure elevation self-measured by a wearable watch-type device \n\t\t \n\t\t\t N Tomitani \n\t\t \n\t\t \n\t\t\t H Kanegae \n\t\t \n\t\t \n\t\t\t Y Suzuki \n\t\t \n\t\t \n\t\t\t M Kuwabara \n\t\t \n\t\t \n\t\t\t K Kario \n\t\t \n\t\t 10.1093/ajh/hpaa139 \n\t\t Medline: 32852527] 200 \n\t \n\t \n\t\t Am J Hypertens \n\t\t \n\t\t\t 34 \n\t\t\t 4 \n\t\t\t \n\t\t\t 2021 \n\t\t \n\t \n\t FREE Full text \n\t Tomitani N, Kanegae H, Suzuki Y, Kuwabara M, Kario K. Stress-induced blood pressure elevation self-measured by a wearable watch-type device. Am J Hypertens 2021;34(4):377-382 [FREE Full text] [doi: 10.1093/ajh/hpaa139] [Medline: 32852527] 200"
    },
    {
      "title": "Feasibility of extended ambulatory electrocardiogram monitoring to identify silent atrial fibrillation in high-risk patients: the Screening Study for Undiagnosed Atrial Fibrillation (STUDY-AF)",
      "authors": [
        "M Turakhia",
        "A Ullal",
        "D Hoang",
        "C Than",
        "J Miller",
        "K Friday"
      ],
      "year": 2015,
      "doi": "10.1002/clc.22387",
      "journal": "Clin Cardiol",
      "volume": "38",
      "issue": "5",
      "raw": "Feasibility of extended ambulatory electrocardiogram monitoring to identify silent atrial fibrillation in high-risk patients: the Screening Study for Undiagnosed Atrial Fibrillation (STUDY-AF) \n\t\t \n\t\t\t M P Turakhia \n\t\t \n\t\t \n\t\t\t A J Ullal \n\t\t \n\t\t \n\t\t\t D D Hoang \n\t\t \n\t\t \n\t\t\t C T Than \n\t\t \n\t\t \n\t\t\t J D Miller \n\t\t \n\t\t \n\t\t\t K J Friday \n\t\t \n\t\t 10.1002/clc.22387 \n\t\t Medline: 25873476] 201 \n\t \n\t \n\t\t Clin Cardiol \n\t\t \n\t\t\t 38 \n\t\t\t 5 \n\t\t\t \n\t\t\t 2015 \n\t\t \n\t \n\t FREE Full text \n\t Turakhia MP, Ullal AJ, Hoang DD, Than CT, Miller JD, Friday KJ, et al. Feasibility of extended ambulatory electrocardiogram monitoring to identify silent atrial fibrillation in high-risk patients: the Screening Study for Undiagnosed Atrial Fibrillation (STUDY-AF). Clin Cardiol 2015;38(5):285-292 [FREE Full text] [doi: 10.1002/clc.22387] [Medline: 25873476] 201"
    },
    {
      "title": "Health outcomes of information system use lifestyles among adolescents: videogame addiction, sleep curtailment and cardio-metabolic deficiencies",
      "authors": [
        "O Turel",
        "A Romashkin",
        "K Morrison"
      ],
      "year": 2016,
      "doi": "10.1371/journal.pone.0154764",
      "journal": "PLoS One",
      "volume": "11",
      "issue": "5",
      "pages": "154764",
      "raw": "Health outcomes of information system use lifestyles among adolescents: videogame addiction, sleep curtailment and cardio-metabolic deficiencies \n\t\t \n\t\t\t O Turel \n\t\t \n\t\t \n\t\t\t A Romashkin \n\t\t \n\t\t \n\t\t\t K M Morrison \n\t\t \n\t\t 10.1371/journal.pone.0154764 \n\t\t Medline: 27149512] 202 \n\t \n\t \n\t\t PLoS One \n\t\t \n\t\t\t 11 \n\t\t\t 5 \n\t\t\t 154764 \n\t\t\t 2016 \n\t\t \n\t \n\t FREE Full text \n\t Turel O, Romashkin A, Morrison KM. Health outcomes of information system use lifestyles among adolescents: videogame addiction, sleep curtailment and cardio-metabolic deficiencies. PLoS One 2016;11(5):e0154764 [FREE Full text] [doi: 10.1371/journal.pone.0154764] [Medline: 27149512] 202"
    },
    {
      "title": "Measurement of physical activity in the pre-and early post-operative after total knee arthroplasty for osteoarthritis using a Fitbit Flex device",
      "authors": [
        "J Twiggs",
        "L Salmon",
        "E Kolos",
        "E Bogue",
        "B Miles",
        "J Roe"
      ],
      "year": 2018,
      "doi": "10.1016/j.medengphy.2017.10.007",
      "journal": "Med Eng Phys",
      "volume": "51",
      "raw": "Measurement of physical activity in the pre-and early post-operative after total knee arthroplasty for osteoarthritis using a Fitbit Flex device \n\t\t \n\t\t\t J Twiggs \n\t\t \n\t\t \n\t\t\t L Salmon \n\t\t \n\t\t \n\t\t\t E Kolos \n\t\t \n\t\t \n\t\t\t E Bogue \n\t\t \n\t\t \n\t\t\t B Miles \n\t\t \n\t\t \n\t\t\t J Roe \n\t\t \n\t\t 10.1016/j.medengphy.2017.10.007 \n\t\t Medline: 29117912] 203 \n\t \n\t \n\t\t Med Eng Phys \n\t\t \n\t\t\t 51 \n\t\t\t \n\t\t\t 2018 \n\t\t \n\t \n\t Twiggs J, Salmon L, Kolos E, Bogue E, Miles B, Roe J. Measurement of physical activity in the pre-and early post-operative after total knee arthroplasty for osteoarthritis using a Fitbit Flex device. Med Eng Phys 2018;51:31-40. [doi: 10.1016/j.medengphy.2017.10.007] [Medline: 29117912] 203"
    },
    {
      "title": "Does exercise-induced bronchoconstriction affect physical activity patterns in asthmatic children?",
      "authors": [
        "M Van Der Kamp",
        "B Thio",
        "M Tabak",
        "H Hermens",
        "J Driessen",
        "J Van Der Palen"
      ],
      "year": 2020,
      "doi": "10.1177/1367493519881257",
      "journal": "J Child Health Care",
      "volume": "24",
      "issue": "4",
      "raw": "Does exercise-induced bronchoconstriction affect physical activity patterns in asthmatic children? \n\t\t \n\t\t\t M R Van Der Kamp \n\t\t \n\t\t \n\t\t\t B J Thio \n\t\t \n\t\t \n\t\t\t M Tabak \n\t\t \n\t\t \n\t\t\t H J Hermens \n\t\t \n\t\t \n\t\t\t J Driessen \n\t\t \n\t\t \n\t\t\t J Van Der Palen \n\t\t \n\t\t 10.1177/1367493519881257 \n\t\t Medline: 31607144] 204 \n\t \n\t \n\t\t J Child Health Care \n\t\t \n\t\t\t 24 \n\t\t\t 4 \n\t\t\t \n\t\t\t 2020 \n\t\t \n\t \n\t van der Kamp MR, Thio BJ, Tabak M, Hermens HJ, Driessen J, van der Palen J. Does exercise-induced bronchoconstriction affect physical activity patterns in asthmatic children? J Child Health Care 2020;24(4):577-588. [doi: 10.1177/1367493519881257] [Medline: 31607144] 204"
    },
    {
      "title": "Non-motor correlates of wrist-worn wearable sensor use in Parkinson's disease: an exploratory analysis",
      "authors": [
        "D Van Wamelen",
        "S Hota",
        "A Podlewska",
        "V Leta",
        "D Trivedi",
        "A Rizos"
      ],
      "year": 2019,
      "doi": "10.1038/s41531-019-0094-4",
      "journal": "NPJ Parkinsons Dis",
      "volume": "5",
      "pages": "22",
      "raw": "Non-motor correlates of wrist-worn wearable sensor use in Parkinson's disease: an exploratory analysis \n\t\t \n\t\t\t D J Van Wamelen \n\t\t \n\t\t \n\t\t\t S Hota \n\t\t \n\t\t \n\t\t\t A Podlewska \n\t\t \n\t\t \n\t\t\t V Leta \n\t\t \n\t\t \n\t\t\t D Trivedi \n\t\t \n\t\t \n\t\t\t A Rizos \n\t\t \n\t\t 10.1038/s41531-019-0094-4 \n\t\t Medline: 31602393] 205 \n\t \n\t \n\t\t NPJ Parkinsons Dis \n\t\t \n\t\t\t 5 \n\t\t\t 22 \n\t\t\t 2019 \n\t\t \n\t \n\t FREE Full text \n\t van Wamelen DJ, Hota S, Podlewska A, Leta V, Trivedi D, Rizos A, et al. Non-motor correlates of wrist-worn wearable sensor use in Parkinson's disease: an exploratory analysis. NPJ Parkinsons Dis 2019;5:22 [FREE Full text] [doi: 10.1038/s41531-019-0094-4] [Medline: 31602393] 205"
    },
    {
      "title": "Individual patient-reported activity levels before and after joint arthroplasty are neither accurate nor reproducible",
      "authors": [
        "N Vaughn",
        "M Dunklebarger",
        "M Mason"
      ],
      "year": 2019,
      "doi": "10.1097/corr.0000000000000591",
      "journal": "Clin Orthop Relat Res",
      "volume": "477",
      "issue": "3",
      "raw": "Individual patient-reported activity levels before and after joint arthroplasty are neither accurate nor reproducible \n\t\t \n\t\t\t N H Vaughn \n\t\t \n\t\t \n\t\t\t M F Dunklebarger \n\t\t \n\t\t \n\t\t\t M W Mason \n\t\t \n\t\t 10.1097/corr.0000000000000591 \n\t\t Medline: 30543533] 206 \n\t \n\t \n\t\t Clin Orthop Relat Res \n\t\t \n\t\t\t 477 \n\t\t\t 3 \n\t\t\t \n\t\t\t 2019 \n\t\t \n\t \n\t FREE Full text \n\t Vaughn NH, Dunklebarger MF, Mason MW. Individual patient-reported activity levels before and after joint arthroplasty are neither accurate nor reproducible. Clin Orthop Relat Res 2019;477(3):536-544 [FREE Full text] [doi: 10.1097/CORR.0000000000000591] [Medline: 30543533] 206"
    },
    {
      "title": "Determination of personalized asthma triggers from multimodal sensing and a mobile app: observational study",
      "authors": [
        "R Venkataramanan",
        "K Thirunarayan",
        "U Jaimini",
        "D Kadariya",
        "H Yip",
        "M Kalra"
      ],
      "year": 2019,
      "doi": "10.2196/14300",
      "journal": "JMIR Pediatr Parent",
      "volume": "2",
      "issue": "1",
      "pages": "14300",
      "raw": "Determination of personalized asthma triggers from multimodal sensing and a mobile app: observational study \n\t\t \n\t\t\t R Venkataramanan \n\t\t \n\t\t \n\t\t\t K Thirunarayan \n\t\t \n\t\t \n\t\t\t U Jaimini \n\t\t \n\t\t \n\t\t\t D Kadariya \n\t\t \n\t\t \n\t\t\t H Y Yip \n\t\t \n\t\t \n\t\t\t M Kalra \n\t\t \n\t\t 10.2196/14300 \n\t\t Medline: 31518318] 207 \n\t \n\t \n\t\t JMIR Pediatr Parent \n\t\t \n\t\t\t 2 \n\t\t\t 1 \n\t\t\t 14300 \n\t\t\t 2019 \n\t\t \n\t \n\t FREE Full text \n\t Venkataramanan R, Thirunarayan K, Jaimini U, Kadariya D, Yip HY, Kalra M, et al. Determination of personalized asthma triggers from multimodal sensing and a mobile app: observational study. JMIR Pediatr Parent 2019;2(1):e14300 [FREE Full text] [doi: 10.2196/14300] [Medline: 31518318] 207"
    },
    {
      "title": "Predict-Hd Investigators And Coordinators Of The Huntington Study Group. Is there an association of physical activity with brain volume, behavior, and day-to-day functioning? A cross sectional design in prodromal and early Huntington disease",
      "authors": [
        "M Wallace",
        "N Downing",
        "S Lourens",
        "J Mills",
        "J Kim",
        "J Long"
      ],
      "year": 2016,
      "doi": "10.1371/currents.hd.cba6ea74972cf8412a73ce52eb018c1e",
      "journal": "PLoS Curr",
      "volume": "8",
      "issue": "6",
      "raw": "Predict-Hd Investigators And Coordinators Of The Huntington Study Group. Is there an association of physical activity with brain volume, behavior, and day-to-day functioning? A cross sectional design in prodromal and early Huntington disease \n\t\t \n\t\t\t M Wallace \n\t\t \n\t\t \n\t\t\t N Downing \n\t\t \n\t\t \n\t\t\t S Lourens \n\t\t \n\t\t \n\t\t\t J Mills \n\t\t \n\t\t \n\t\t\t J I Kim \n\t\t \n\t\t \n\t\t\t J Long \n\t\t \n\t\t 10.1371/currents.hd.cba6ea74972cf8412a73ce52eb018c1e \n\t\t Medline: 27818843] 208 \n\t \n\t \n\t\t PLoS Curr \n\t\t \n\t\t\t 8 \n\t\t\t 6 \n\t\t\t 2016 \n\t\t \n\t \n\t ea74972cf8412a73ce52eb018c1e [FREE Full text \n\t Wallace M, Downing N, Lourens S, Mills J, Kim JI, Long J, Predict-Hd Investigators And Coordinators Of The Huntington Study Group. Is there an association of physical activity with brain volume, behavior, and day-to-day functioning? A cross sectional design in prodromal and early Huntington disease. PLoS Curr 2016;8:ecurrents.hd.cba6ea74972cf8412a73ce52eb018c1e [FREE Full text] [doi: 10.1371/currents.hd.cba6ea74972cf8412a73ce52eb018c1e] [Medline: 27818843] 208"
    },
    {
      "title": "Using Fitbit data to monitor the heart rate evolution patterns of college students",
      "authors": [
        "C Wang",
        "O Lizardo",
        "D Hachen"
      ],
      "year": 2020,
      "doi": "10.1080/07448481.2020.1775610",
      "journal": "J Am Coll Health",
      "raw": "Using Fitbit data to monitor the heart rate evolution patterns of college students \n\t\t \n\t\t\t C Wang \n\t\t \n\t\t \n\t\t\t O Lizardo \n\t\t \n\t\t \n\t\t\t D S Hachen \n\t\t \n\t\t 10.1080/07448481.2020.1775610 \n\t\t Medline: 32569509] 209 \n\t \n\t \n\t\t J Am Coll Health \n\t\t \n\t\t\t \n\t\t\t 2020 \n\t\t \n\t \n\t Wang C, Lizardo O, Hachen DS. Using Fitbit data to monitor the heart rate evolution patterns of college students. J Am Coll Health 2020:1-8. [doi: 10.1080/07448481.2020.1775610] [Medline: 32569509] 209"
    },
    {
      "title": "Sleep tracking and exercise in patients with type 2 diabetes mellitus (Step-D): pilot study to determine correlations between Fitbit data and patient-reported outcomes",
      "authors": [
        "J Weatherall",
        "Y Paprocki",
        "T Meyer",
        "I Kudel",
        "E Witt"
      ],
      "year": 2018,
      "doi": "10.2196/mhealth.8122",
      "journal": "JMIR Mhealth Uhealth",
      "volume": "6",
      "issue": "6",
      "pages": "131",
      "raw": "Sleep tracking and exercise in patients with type 2 diabetes mellitus (Step-D): pilot study to determine correlations between Fitbit data and patient-reported outcomes \n\t\t \n\t\t\t J Weatherall \n\t\t \n\t\t \n\t\t\t Y Paprocki \n\t\t \n\t\t \n\t\t\t T M Meyer \n\t\t \n\t\t \n\t\t\t I Kudel \n\t\t \n\t\t \n\t\t\t E A Witt \n\t\t \n\t\t 10.2196/mhealth.8122 \n\t\t Medline: 29871856] 210 \n\t \n\t \n\t\t JMIR Mhealth Uhealth \n\t\t \n\t\t\t 6 \n\t\t\t 6 \n\t\t\t 131 \n\t\t\t 2018 \n\t\t \n\t \n\t FREE Full text \n\t Weatherall J, Paprocki Y, Meyer TM, Kudel I, Witt EA. Sleep tracking and exercise in patients with type 2 diabetes mellitus (Step-D): pilot study to determine correlations between Fitbit data and patient-reported outcomes. JMIR Mhealth Uhealth 2018;6(6):e131 [FREE Full text] [doi: 10.2196/mhealth.8122] [Medline: 29871856] 210"
    },
    {
      "title": "Implementing wearable sensors for continuous assessment of daytime heart rate response in inpatient rehabilitation",
      "authors": [
        "D Weeks",
        "G Sprint",
        "V Stilwill",
        "A Meisen-Vehrs",
        "D Cook"
      ],
      "year": 2018,
      "doi": "10.1089/tmj.2017.0306",
      "journal": "Telemed J E Health",
      "volume": "24",
      "issue": "12",
      "raw": "Implementing wearable sensors for continuous assessment of daytime heart rate response in inpatient rehabilitation \n\t\t \n\t\t\t D L Weeks \n\t\t \n\t\t \n\t\t\t G L Sprint \n\t\t \n\t\t \n\t\t\t V Stilwill \n\t\t \n\t\t \n\t\t\t A L Meisen-Vehrs \n\t\t \n\t\t \n\t\t\t D J Cook \n\t\t \n\t\t 10.1089/tmj.2017.0306 \n\t\t Medline: 29608421] 211 \n\t \n\t \n\t\t Telemed J E Health \n\t\t \n\t\t\t 24 \n\t\t\t 12 \n\t\t\t \n\t\t\t 2018 \n\t\t \n\t \n\t FREE Full text \n\t Weeks DL, Sprint GL, Stilwill V, Meisen-Vehrs AL, Cook DJ. Implementing wearable sensors for continuous assessment of daytime heart rate response in inpatient rehabilitation. Telemed J E Health 2018;24(12):1014-1020 [FREE Full text] [doi: 10.1089/tmj.2017.0306] [Medline: 29608421] 211"
    },
    {
      "title": "Characterization of adult heart rate responses during recreational skateboarding at community skateparks",
      "authors": [
        "T Wiles",
        "D Kellogg",
        "H Furr",
        "J Nessler",
        "S Newcomer"
      ],
      "year": 2020,
      "doi": "10.70252/zkop2345",
      "journal": "Int J Exerc Sci",
      "volume": "13",
      "issue": "2",
      "raw": "Characterization of adult heart rate responses during recreational skateboarding at community skateparks \n\t\t \n\t\t\t T Wiles \n\t\t \n\t\t \n\t\t\t D Kellogg \n\t\t \n\t\t \n\t\t\t H Furr \n\t\t \n\t\t \n\t\t\t J A Nessler \n\t\t \n\t\t \n\t\t\t S C Newcomer \n\t\t \n\t\t 10.70252/zkop2345 \n\t\t Medline: 32509111] 212 \n\t \n\t \n\t\t Int J Exerc Sci \n\t\t \n\t\t\t 13 \n\t\t\t 2 \n\t\t\t \n\t\t\t 2020 \n\t\t \n\t \n\t FREE Full text \n\t Wiles T, Kellogg D, Furr H, Nessler JA, Newcomer SC. Characterization of adult heart rate responses during recreational skateboarding at community skateparks. Int J Exerc Sci 2020;13(2):501-510 [FREE Full text] [Medline: 32509111] 212"
    },
    {
      "title": "Dynamics and ultradian structure of human sleep in real life",
      "authors": [
        "E Winnebeck",
        "D Fischer",
        "T Leise",
        "T Roenneberg"
      ],
      "year": 2018,
      "doi": "10.1016/j.cub.2017.11.063",
      "journal": "Curr Biol",
      "volume": "28",
      "issue": "1",
      "raw": "Dynamics and ultradian structure of human sleep in real life \n\t\t \n\t\t\t E C Winnebeck \n\t\t \n\t\t \n\t\t\t D Fischer \n\t\t \n\t\t \n\t\t\t T Leise \n\t\t \n\t\t \n\t\t\t T Roenneberg \n\t\t \n\t\t 10.1016/j.cub.2017.11.063 \n\t\t Medline: 29290561] 213 \n\t \n\t \n\t\t Curr Biol \n\t\t \n\t\t\t 28 \n\t\t\t 1 \n\t\t\t \n\t\t\t 2018 \n\t\t \n\t \n\t FREE Full text \n\t Winnebeck EC, Fischer D, Leise T, Roenneberg T. Dynamics and ultradian structure of human sleep in real life. Curr Biol 2018;28(1):49-59.e5 [FREE Full text] [doi: 10.1016/j.cub.2017.11.063] [Medline: 29290561] 213"
    },
    {
      "title": "Clinical evaluation and diagnostic yield following evaluation of abnormal pulse detected using Apple watch",
      "authors": [
        "K Wyatt",
        "L Poole",
        "A Mullan",
        "S Kopecky",
        "H Heaton"
      ],
      "year": 2020,
      "doi": "10.1093/jamia/ocaa137",
      "journal": "J Am Med Inform Assoc",
      "volume": "27",
      "issue": "9",
      "raw": "Clinical evaluation and diagnostic yield following evaluation of abnormal pulse detected using Apple watch \n\t\t \n\t\t\t K D Wyatt \n\t\t \n\t\t \n\t\t\t L R Poole \n\t\t \n\t\t \n\t\t\t A F Mullan \n\t\t \n\t\t \n\t\t\t S L Kopecky \n\t\t \n\t\t \n\t\t\t H A Heaton \n\t\t \n\t\t 10.1093/jamia/ocaa137 \n\t\t Medline: 32979046] 214 \n\t \n\t \n\t\t J Am Med Inform Assoc \n\t\t \n\t\t\t 27 \n\t\t\t 9 \n\t\t\t \n\t\t\t 2020 \n\t\t \n\t \n\t FREE Full text \n\t Wyatt KD, Poole LR, Mullan AF, Kopecky SL, Heaton HA. Clinical evaluation and diagnostic yield following evaluation of abnormal pulse detected using Apple watch. J Am Med Inform Assoc 2020;27(9):1359-1363 [FREE Full text] [doi: 10.1093/jamia/ocaa137] [Medline: 32979046] 214"
    },
    {
      "title": "Habitual sleep duration and sleep duration variation are independently associated with body mass index",
      "authors": [
        "X Xu",
        "M Conomos",
        "O Manor",
        "J Rohwer",
        "A Magis",
        "J Lovejoy"
      ],
      "year": 2018,
      "doi": "10.1038/ijo.2017.223",
      "journal": "Int J Obes (Lond)",
      "volume": "42",
      "issue": "4",
      "raw": "Habitual sleep duration and sleep duration variation are independently associated with body mass index \n\t\t \n\t\t\t X Xu \n\t\t \n\t\t \n\t\t\t M P Conomos \n\t\t \n\t\t \n\t\t\t O Manor \n\t\t \n\t\t \n\t\t\t J E Rohwer \n\t\t \n\t\t \n\t\t\t A T Magis \n\t\t \n\t\t \n\t\t\t J C Lovejoy \n\t\t \n\t\t 10.1038/ijo.2017.223 \n\t\t Medline: 28895585] 215 \n\t \n\t \n\t\t Int J Obes (Lond) \n\t\t \n\t\t\t 42 \n\t\t\t 4 \n\t\t\t \n\t\t\t 2018 \n\t\t \n\t \n\t Xu X, Conomos MP, Manor O, Rohwer JE, Magis AT, Lovejoy JC. Habitual sleep duration and sleep duration variation are independently associated with body mass index. Int J Obes (Lond) 2018;42(4):794-800. [doi: 10.1038/ijo.2017.223] [Medline: 28895585] 215"
    },
    {
      "title": "Fall risk classification in community-dwelling older adults using a smart wrist-worn device and the resident assessment instrument-home care: prospective observational study",
      "authors": [
        "Y Yang",
        "J Hirdes",
        "J Dubin",
        "J Lee"
      ],
      "year": 2019,
      "doi": "10.2196/12153",
      "journal": "JMIR Aging",
      "volume": "2",
      "issue": "1",
      "pages": "12153",
      "raw": "Fall risk classification in community-dwelling older adults using a smart wrist-worn device and the resident assessment instrument-home care: prospective observational study \n\t\t \n\t\t\t Y Yang \n\t\t \n\t\t \n\t\t\t J P Hirdes \n\t\t \n\t\t \n\t\t\t J A Dubin \n\t\t \n\t\t \n\t\t\t J Lee \n\t\t \n\t\t 10.2196/12153 \n\t\t Medline: 31518278] 216 \n\t \n\t \n\t\t JMIR Aging \n\t\t \n\t\t\t 2 \n\t\t\t 1 \n\t\t\t 12153 \n\t\t\t 2019 \n\t\t \n\t \n\t FREE Full text \n\t Yang Y, Hirdes JP, Dubin JA, Lee J. Fall risk classification in community-dwelling older adults using a smart wrist-worn device and the resident assessment instrument-home care: prospective observational study. JMIR Aging 2019;2(1):e12153 [FREE Full text] [doi: 10.2196/12153] [Medline: 31518278] 216"
    },
    {
      "title": "Seafarers' physical activity and sleep patterns: results from Asia-Pacific sea routes",
      "authors": [
        "I Youn",
        "J Lee"
      ],
      "year": 2020,
      "doi": "10.3390/ijerph17197266",
      "journal": "Int J Environ Res Public Health",
      "volume": "17",
      "issue": "19",
      "pages": "7266",
      "raw": "Seafarers' physical activity and sleep patterns: results from Asia-Pacific sea routes \n\t\t \n\t\t\t I H Youn \n\t\t \n\t\t \n\t\t\t J M Lee \n\t\t \n\t\t 10.3390/ijerph17197266 \n\t\t Medline: 33027892] 217 \n\t \n\t \n\t\t Int J Environ Res Public Health \n\t\t \n\t\t\t 17 \n\t\t\t 19 \n\t\t\t 7266 \n\t\t\t 2020 \n\t\t \n\t \n\t FREE Full text \n\t Youn IH, Lee JM. Seafarers' physical activity and sleep patterns: results from Asia-Pacific sea routes. Int J Environ Res Public Health 2020;17(19):7266 [FREE Full text] [doi: 10.3390/ijerph17197266] [Medline: 33027892] 217"
    },
    {
      "title": "Do stairs inhibit seniors who live on upper floors from going out?",
      "authors": [
        "Y Yu",
        "Z Chen",
        "J Bu",
        "Q Zhang"
      ],
      "year": 2020,
      "doi": "10.1177/1937586720936588",
      "journal": "HERD",
      "volume": "13",
      "issue": "4",
      "raw": "Do stairs inhibit seniors who live on upper floors from going out? \n\t\t \n\t\t\t Y Yu \n\t\t \n\t\t \n\t\t\t Z Chen \n\t\t \n\t\t \n\t\t\t J Bu \n\t\t \n\t\t \n\t\t\t Q Zhang \n\t\t \n\t\t 10.1177/1937586720936588 \n\t\t Medline: 32666833] 218 \n\t \n\t \n\t\t HERD \n\t\t \n\t\t\t 13 \n\t\t\t 4 \n\t\t\t \n\t\t\t 2020 \n\t\t \n\t \n\t Yu Y, Chen Z, Bu J, Zhang Q. Do stairs inhibit seniors who live on upper floors from going out? HERD 2020;13(4):128-143. [doi: 10.1177/1937586720936588] [Medline: 32666833] 218"
    },
    {
      "title": "Objective sleep assessment in >80,000 UK mid-life adults: associations with sociodemographic characteristics, physical activity and caffeine",
      "authors": [
        "G Zhu",
        "M Catt",
        "S Cassidy",
        "M Birch-Machin",
        "M Trenell",
        "H Hiden"
      ],
      "year": 2019,
      "doi": "10.1371/journal.pone.0226220",
      "journal": "PLoS One",
      "volume": "14",
      "issue": "12",
      "pages": "226220",
      "raw": "Objective sleep assessment in >80,000 UK mid-life adults: associations with sociodemographic characteristics, physical activity and caffeine \n\t\t \n\t\t\t G Zhu \n\t\t \n\t\t \n\t\t\t M Catt \n\t\t \n\t\t \n\t\t\t S Cassidy \n\t\t \n\t\t \n\t\t\t M Birch-Machin \n\t\t \n\t\t \n\t\t\t M Trenell \n\t\t \n\t\t \n\t\t\t H Hiden \n\t\t \n\t\t 10.1371/journal.pone.0226220 \n\t\t Medline: 31881028] 219 \n\t \n\t \n\t\t PLoS One \n\t\t \n\t\t\t 14 \n\t\t\t 12 \n\t\t\t 226220 \n\t\t\t 2019 \n\t\t \n\t \n\t FREE Full text \n\t Zhu G, Catt M, Cassidy S, Birch-Machin M, Trenell M, Hiden H, et al. Objective sleep assessment in >80,000 UK mid-life adults: associations with sociodemographic characteristics, physical activity and caffeine. PLoS One 2019;14(12):e0226220 [FREE Full text] [doi: 10.1371/journal.pone.0226220] [Medline: 31881028] 219"
    },
    {
      "title": "Stress and sleep: a survey based on wearable sleep trackers among medical and nursing staff in Wuhan during the COVID-19 pandemic",
      "authors": [
        "K Zhuo",
        "C Gao",
        "X Wang",
        "C Zhang",
        "Z Wang"
      ],
      "year": 2020,
      "doi": "10.1136/gpsych-2020-100260",
      "journal": "Gen Psychiatr",
      "volume": "33",
      "issue": "3",
      "pages": "100260",
      "raw": "Stress and sleep: a survey based on wearable sleep trackers among medical and nursing staff in Wuhan during the COVID-19 pandemic \n\t\t \n\t\t\t K Zhuo \n\t\t \n\t\t \n\t\t\t C Gao \n\t\t \n\t\t \n\t\t\t X Wang \n\t\t \n\t\t \n\t\t\t C Zhang \n\t\t \n\t\t \n\t\t\t Z Wang \n\t\t \n\t\t 10.1136/gpsych-2020-100260 \n\t\t Medline: 32596641] 220 \n\t \n\t \n\t\t Gen Psychiatr \n\t\t \n\t\t\t 33 \n\t\t\t 3 \n\t\t\t 100260 \n\t\t\t 2020 \n\t\t \n\t \n\t FREE Full text \n\t Zhuo K, Gao C, Wang X, Zhang C, Wang Z. Stress and sleep: a survey based on wearable sleep trackers among medical and nursing staff in Wuhan during the COVID-19 pandemic. Gen Psychiatr 2020;33(3):e100260 [FREE Full text] [doi: 10.1136/gpsych-2020-100260] [Medline: 32596641] 220"
    },
    {
      "title": "The PRISMA 2020 statement: an updated guideline for reporting systematic reviews",
      "authors": [
        "M Page",
        "J Mckenzie",
        "P Bossuyt",
        "I Boutron",
        "T Hoffmann",
        "C Mulrow"
      ],
      "year": 2021,
      "doi": "10.1186/s13643-021-01626-4",
      "journal": "Syst Rev",
      "volume": "10",
      "issue": "1",
      "pages": "89",
      "raw": "The PRISMA 2020 statement: an updated guideline for reporting systematic reviews \n\t\t \n\t\t\t M J Page \n\t\t \n\t\t \n\t\t\t J E Mckenzie \n\t\t \n\t\t \n\t\t\t P M Bossuyt \n\t\t \n\t\t \n\t\t\t I Boutron \n\t\t \n\t\t \n\t\t\t T C Hoffmann \n\t\t \n\t\t \n\t\t\t C D Mulrow \n\t\t \n\t\t 10.1186/s13643-021-01626-4 \n\t\t Medline: 33781348] 221 \n\t\t \n\t \n\t \n\t\t Syst Rev \n\t\t \n\t\t\t 10 \n\t\t\t 1 \n\t\t\t 89 \n\t\t\t 2021 \n\t\t \n\t \n\t FREE Full text Create your own custom map. MapChart \n\t Page MJ, McKenzie JE, Bossuyt PM, Boutron I, Hoffmann TC, Mulrow CD, et al. The PRISMA 2020 statement: an updated guideline for reporting systematic reviews. Syst Rev 2021;10(1):89 [FREE Full text] [doi: 10.1186/s13643-021-01626-4] [Medline: 33781348] 221. Create your own custom map. MapChart. URL: https://mapchart.net/ [accessed 2022-01-19] 222"
    },
    {
      "title": "Photoplethysmography and its application in clinical physiological measurement",
      "authors": [
        "J Allen"
      ],
      "year": 2007,
      "doi": "10.1088/0967-3334/28/3/r01",
      "journal": "Physiol Meas",
      "volume": "28",
      "issue": "3",
      "raw": "Photoplethysmography and its application in clinical physiological measurement \n\t\t \n\t\t\t J Allen \n\t\t \n\t\t 10.1088/0967-3334/28/3/r01 \n\t\t Medline: 17322588] 223 \n\t \n\t \n\t\t Physiol Meas \n\t\t \n\t\t\t 28 \n\t\t\t 3 \n\t\t\t \n\t\t\t 2007 \n\t\t \n\t \n\t Allen J. Photoplethysmography and its application in clinical physiological measurement. Physiol Meas 2007;28(3):R1-39. [doi: 10.1088/0967-3334/28/3/R01] [Medline: 17322588] 223"
    },
    {
      "title": "Beyond the hype: big data concepts, methods, and analytics",
      "authors": [
        "A Gandomi",
        "M Haider"
      ],
      "year": 2015,
      "doi": "10.1016/j.ijinfomgt.2014.10.007",
      "journal": "Int J Inf Manage",
      "volume": "35",
      "issue": "2",
      "raw": "Beyond the hype: big data concepts, methods, and analytics \n\t\t \n\t\t\t A Gandomi \n\t\t \n\t\t \n\t\t\t M Haider \n\t\t \n\t\t 10.1016/j.ijinfomgt.2014.10.007 \n\t \n\t \n\t\t Int J Inf Manage \n\t\t \n\t\t\t 35 \n\t\t\t 2 \n\t\t\t \n\t\t\t 2015 \n\t\t \n\t \n\t Gandomi A, Haider M. Beyond the hype: big data concepts, methods, and analytics. Int J Inf Manage 2015;35(2):137-144. [doi: 10.1016/j.ijinfomgt.2014.10.007] 224"
    },
    {
      "title": "How consumer physical activity monitors could transform human physiology research",
      "authors": [
        "S Wright",
        "Hall Brown",
        "T Collier",
        "S Sandberg"
      ],
      "year": 2017,
      "doi": "10.1152/ajpregu.00349.2016",
      "journal": "Am J Physiol Regul Integr Comp Physiol",
      "volume": "312",
      "issue": "3",
      "raw": "How consumer physical activity monitors could transform human physiology research \n\t\t \n\t\t\t S P Wright \n\t\t \n\t\t \n\t\t\t Hall Brown \n\t\t \n\t\t \n\t\t\t T S Collier \n\t\t \n\t\t \n\t\t\t S R Sandberg \n\t\t \n\t\t \n\t\t\t K \n\t\t \n\t\t 10.1152/ajpregu.00349.2016 \n\t\t Medline: 28052867] 225 \n\t \n\t \n\t\t Am J Physiol Regul Integr Comp Physiol \n\t\t \n\t\t\t 312 \n\t\t\t 3 \n\t\t\t \n\t\t\t 2017 \n\t\t \n\t \n\t Wright SP, Hall Brown TS, Collier SR, Sandberg K. How consumer physical activity monitors could transform human physiology research. Am J Physiol Regul Integr Comp Physiol 2017;312(3):R358-R367. [doi: 10.1152/ajpregu.00349.2016] [Medline: 28052867] 225"
    },
    {
      "title": "A systematic review on the use of wearable body sensors for health monitoring: a qualitative synthesis",
      "authors": [
        "A Kristoffersson",
        "M Lind\u00e9n"
      ],
      "year": 2020,
      "doi": "10.3390/s20051502",
      "journal": "Sensors",
      "volume": "20",
      "issue": "5",
      "pages": "15902",
      "raw": "A systematic review on the use of wearable body sensors for health monitoring: a qualitative synthesis \n\t\t \n\t\t\t A Kristoffersson \n\t\t \n\t\t \n\t\t\t M Lind\u00e9n \n\t\t \n\t\t 10.3390/s20051502 \n\t\t Medline: 32182907] 226 \n\t \n\t \n\t\t Sensors \n\t\t \n\t\t\t 20 \n\t\t\t 5 \n\t\t\t 15902 \n\t\t\t 2020 \n\t\t\t Basel \n\t\t \n\t \n\t FREE Full text \n\t Kristoffersson A, Lind\u00e9n M. A systematic review on the use of wearable body sensors for health monitoring: a qualitative synthesis. Sensors (Basel) 2020;20(5):15902 [FREE Full text] [doi: 10.3390/s20051502] [Medline: 32182907] 226"
    },
    {
      "title": "Guidelines for wrist-worn consumer wearable assessment of heart rate in biobehavioral research",
      "authors": [
        "B Nelson",
        "C Low",
        "N Jacobson",
        "P Are\u00e1n",
        "J Torous",
        "N Allen"
      ],
      "year": 2020,
      "doi": "10.1038/s41746-020-0297-4",
      "journal": "NPJ Digit Med",
      "volume": "3",
      "pages": "90",
      "raw": "Guidelines for wrist-worn consumer wearable assessment of heart rate in biobehavioral research \n\t\t \n\t\t\t B W Nelson \n\t\t \n\t\t \n\t\t\t C A Low \n\t\t \n\t\t \n\t\t\t N Jacobson \n\t\t \n\t\t \n\t\t\t P Are\u00e1n \n\t\t \n\t\t \n\t\t\t J Torous \n\t\t \n\t\t \n\t\t\t N B Allen \n\t\t \n\t\t 10.1038/s41746-020-0297-4 \n\t\t Medline: 32613085] 227 \n\t\t \n\t \n\t \n\t\t NPJ Digit Med \n\t\t \n\t\t\t 3 \n\t\t\t 90 \n\t\t\t 2020. 2021-05-20 \n\t\t \n\t \n\t FREE Full text Who are the world's biggest wearable tech buyers? Ipsos. 2018 \n\t Nelson BW, Low CA, Jacobson N, Are\u00e1n P, Torous J, Allen NB. Guidelines for wrist-worn consumer wearable assessment of heart rate in biobehavioral research. NPJ Digit Med 2020;3:90 [FREE Full text] [doi: 10.1038/s41746-020-0297-4] [Medline: 32613085] 227. Who are the world's biggest wearable tech buyers? Ipsos. 2018. URL: https://www.ipsos.com/en-ro/ who-are-worlds-biggest-wearable-tech-buyers [accessed 2021-05-20] 228"
    },
    {
      "title": "Number of connected wearable devices worldwide by region from 2015 to 2022",
      "authors": [
        "L Vailshery"
      ],
      "year": 2018,
      "doi": "10.2307/j.ctt1trkk7x.19",
      "raw": "Number of connected wearable devices worldwide by region from 2015 to 2022 \n\t\t \n\t\t\t L S Vailshery \n\t\t \n\t\t 10.2307/j.ctt1trkk7x.19 \n\t\t \n\t \n\t \n\t\t GDPR, the EU's new data protection law? General Data Protection Regulation \n\t\t \n\t\t\t European Union \n\t\t\t 2021. 2021-05-20] 229. 2018 \n\t\t \n\t \n\t Vailshery LS. Number of connected wearable devices worldwide by region from 2015 to 2022. Statista. 2021. URL: https:/ /www.statista.com/statistics/490231/wearable-devices-worldwide-by-region/ [accessed 2021-05-20] 229. What is GDPR, the EU's new data protection law? General Data Protection Regulation.: European Union; 2018. URL: https://gdpr.eu/what-is-gdpr/ [accessed 2021-06-08] 230"
    },
    {
      "title": "On regulation for data trusts: policy brief",
      "authors": [
        "A Blankertz",
        "L Specht"
      ],
      "year": 2020,
      "raw": "A Blankertz \n\t\t \n\t\t \n\t\t\t L Specht \n\t\t \n\t\t \n\t\t On regulation for data trusts: policy brief \n\t\t \n\t\t\t National Institutes of Health \n\t\t\t 2021. 2021-07-06. 2020. 2021 \n\t\t \n\t \n\t extramural scientific workforce \n\t Blankertz A, Specht L. On regulation for data trusts: policy brief. Stiftung Neue Verantwortung. 2021. URL: https://www. stiftung-nv.de/en/publication/regulation-data-trusts [accessed 2021-07-06] 231. Populations underrepresented in the extramural scientific workforce. Scientific Workforce Diversity.: National Institutes of Health; 2020. URL: https://diversity.nih.gov/about-us/population-underrepresented [accessed 2021-10-13] 232"
    },
    {
      "title": "Feasibility of using mobile ECG recording technology to detect atrial fibrillation in low-resource settings",
      "authors": [
        "G Evans",
        "A Shirk",
        "P Muturi",
        "E Soliman"
      ],
      "year": 2017,
      "doi": "10.1016/j.gheart.2016.12.003",
      "journal": "Glob Heart",
      "volume": "12",
      "issue": "4",
      "raw": "Feasibility of using mobile ECG recording technology to detect atrial fibrillation in low-resource settings \n\t\t \n\t\t\t G F Evans \n\t\t \n\t\t \n\t\t\t A Shirk \n\t\t \n\t\t \n\t\t\t P Muturi \n\t\t \n\t\t \n\t\t\t E Z Soliman \n\t\t \n\t\t 10.1016/j.gheart.2016.12.003 \n\t\t Medline: 28302547] 233 \n\t \n\t \n\t\t Glob Heart \n\t\t \n\t\t\t 12 \n\t\t\t 4 \n\t\t\t \n\t\t\t 2017 \n\t\t \n\t \n\t Evans GF, Shirk A, Muturi P, Soliman EZ. Feasibility of using mobile ECG recording technology to detect atrial fibrillation in low-resource settings. Glob Heart 2017;12(4):285-289. [doi: 10.1016/j.gheart.2016.12.003] [Medline: 28302547] 233"
    },
    {
      "title": "Best practices for analyzing large-scale health data from wearables and smartphone apps",
      "authors": [
        "J Hicks",
        "T Althoff",
        "R Sosic",
        "P Kuhar",
        "B Bostjancic",
        "A King"
      ],
      "year": 2019,
      "doi": "10.1038/s41746-019-0121-1",
      "journal": "NPJ Digit Med",
      "volume": "2",
      "pages": "45",
      "raw": "Best practices for analyzing large-scale health data from wearables and smartphone apps \n\t\t \n\t\t\t J L Hicks \n\t\t \n\t\t \n\t\t\t T Althoff \n\t\t \n\t\t \n\t\t\t R Sosic \n\t\t \n\t\t \n\t\t\t P Kuhar \n\t\t \n\t\t \n\t\t\t B Bostjancic \n\t\t \n\t\t \n\t\t\t A C King \n\t\t \n\t\t 10.1038/s41746-019-0121-1 \n\t\t Medline: 31304391] 234 \n\t \n\t \n\t\t NPJ Digit Med \n\t\t \n\t\t\t 2 \n\t\t\t 45 \n\t\t\t 2019 \n\t\t \n\t \n\t FREE Full text \n\t Hicks JL, Althoff T, Sosic R, Kuhar P, Bostjancic B, King AC, et al. Best practices for analyzing large-scale health data from wearables and smartphone apps. NPJ Digit Med 2019;2:45 [FREE Full text] [doi: 10.1038/s41746-019-0121-1] [Medline: 31304391] 234"
    },
    {
      "title": "Wireless skin sensors for physiological monitoring of infants in low-income and middle-income countries",
      "authors": [
        "S Xu",
        "A Rwei",
        "B Vwalika",
        "M Chisembele",
        "J Stringer",
        "A Ginsburg"
      ],
      "year": 2021,
      "doi": "10.1016/s2589-7500(21)00001-7",
      "journal": "Lancet Digit Health",
      "volume": "3",
      "issue": "4",
      "raw": "Wireless skin sensors for physiological monitoring of infants in low-income and middle-income countries \n\t\t \n\t\t\t S Xu \n\t\t \n\t\t \n\t\t\t A Y Rwei \n\t\t \n\t\t \n\t\t\t B Vwalika \n\t\t \n\t\t \n\t\t\t M P Chisembele \n\t\t \n\t\t \n\t\t\t J S Stringer \n\t\t \n\t\t \n\t\t\t A S Ginsburg \n\t\t \n\t\t 10.1016/s2589-7500(21)00001-7 \n\t\t Medline: 33640306] 235 \n\t \n\t \n\t\t Lancet Digit Health \n\t\t \n\t\t\t 3 \n\t\t\t 4 \n\t\t\t \n\t\t\t 2021 \n\t\t \n\t \n\t FREE Full text \n\t Xu S, Rwei AY, Vwalika B, Chisembele MP, Stringer JS, Ginsburg AS, et al. Wireless skin sensors for physiological monitoring of infants in low-income and middle-income countries. Lancet Digit Health 2021;3(4):e266-e273 [FREE Full text] [doi: 10.1016/S2589-7500(21)00001-7] [Medline: 33640306] 235"
    },
    {
      "title": "A gaping research gap regarding the climate change impact on health in poor countries",
      "authors": [
        "R Sauerborn"
      ],
      "year": 2017,
      "doi": "10.1007/s10654-017-0258-7",
      "journal": "Eur J Epidemiol",
      "volume": "32",
      "issue": "9",
      "raw": "A gaping research gap regarding the climate change impact on health in poor countries \n\t\t \n\t\t\t R Sauerborn \n\t\t \n\t\t 10.1007/s10654-017-0258-7 \n\t\t Medline: 28573342] 236 \n\t \n\t \n\t\t Eur J Epidemiol \n\t\t \n\t\t\t 32 \n\t\t\t 9 \n\t\t\t \n\t\t\t 2017 \n\t\t \n\t \n\t FREE Full text \n\t Sauerborn R. A gaping research gap regarding the climate change impact on health in poor countries. Eur J Epidemiol 2017;32(9):855-856 [FREE Full text] [doi: 10.1007/s10654-017-0258-7] [Medline: 28573342] 236"
    },
    {
      "title": "Feasibility, acceptability and validation of wearable devices for climate change and health research in the low-resource contexts of Burkina Faso and Kenya: study protocol",
      "authors": [
        "S Barteit",
        "V Boudo",
        "A Ouedraogo",
        "P Zabr\u00e9",
        "L Ouremi",
        "A Si\u00e9"
      ],
      "year": 2021,
      "doi": "10.1371/journal.pone.0257170",
      "journal": "PLoS One",
      "volume": "16",
      "issue": "9",
      "pages": "257170",
      "raw": "Feasibility, acceptability and validation of wearable devices for climate change and health research in the low-resource contexts of Burkina Faso and Kenya: study protocol \n\t\t \n\t\t\t S Barteit \n\t\t \n\t\t \n\t\t\t V Boudo \n\t\t \n\t\t \n\t\t\t A Ouedraogo \n\t\t \n\t\t \n\t\t\t P Zabr\u00e9 \n\t\t \n\t\t \n\t\t\t L Ouremi \n\t\t \n\t\t \n\t\t\t A Si\u00e9 \n\t\t \n\t\t 10.1371/journal.pone.0257170 \n\t\t Medline: 34591893] 237 \n\t \n\t \n\t\t PLoS One \n\t\t \n\t\t\t 16 \n\t\t\t 9 \n\t\t\t 257170 \n\t\t\t 2021 \n\t\t \n\t \n\t FREE Full text \n\t Barteit S, Boudo V, Ouedraogo A, Zabr\u00e9 P, Ouremi L, Si\u00e9 A, et al. Feasibility, acceptability and validation of wearable devices for climate change and health research in the low-resource contexts of Burkina Faso and Kenya: study protocol. PLoS One 2021;16(9):e0257170 [FREE Full text] [doi: 10.1371/journal.pone.0257170] [Medline: 34591893] 237"
    },
    {
      "title": "PRISMA-ScR: Preferred Reporting Items for Systematic Reviews and Meta-Analyses extension for Scoping Reviews Edited by A Mavragani",
      "authors": [
        "C Lam",
        "J Hang",
        "D Zhang",
        "Q Wang",
        "M Ren",
        "C Huang"
      ],
      "year": 2021,
      "doi": "10.1016/j.buildenv.2021.107877",
      "journal": "Build Environ",
      "volume": "198",
      "pages": "107877",
      "raw": "PRISMA-ScR: Preferred Reporting Items for Systematic Reviews and Meta-Analyses extension for Scoping Reviews Edited by A Mavragani \n\t\t \n\t\t\t C K Lam \n\t\t \n\t\t \n\t\t\t J Hang \n\t\t \n\t\t \n\t\t\t D Zhang \n\t\t \n\t\t \n\t\t\t Q Wang \n\t\t \n\t\t \n\t\t\t M Ren \n\t\t \n\t\t \n\t\t\t C Huang \n\t\t \n\t\t 10.1016/j.buildenv.2021.107877 \n\t \n\t \n\t\t Build Environ \n\t\t \n\t\t\t 198 \n\t\t\t 107877 \n\t\t\t 2021 \n\t\t \n\t \n\t Effects of short-term physiological and psychological adaptation on summer thermal comfort of outdoor exercising people in China comments to author 12.11.21 revised version received 23.11.21; accepted 17.12.21; published 25.01.22 Please cite as \n\t Lam CK, Hang J, Zhang D, Wang Q, Ren M, Huang C. Effects of short-term physiological and psychological adaptation on summer thermal comfort of outdoor exercising people in China. Build Environ 2021;198:107877. [doi: 10.1016/j.buildenv.2021.107877] PRISMA-ScR: Preferred Reporting Items for Systematic Reviews and Meta-Analyses extension for Scoping Reviews Edited by A Mavragani; submitted 20.10.21; peer-reviewed by H Zhang, P Escourrou, A Henriksen; comments to author 12.11.21; revised version received 23.11.21; accepted 17.12.21; published 25.01.22 Please cite as:"
    },
    {
      "title": "The Impact of Wearable Technologies in Health Research: Scoping Review JMIR",
      "authors": [
        "S Huhn",
        "M Axt",
        "H Gunga",
        "M Maggioni",
        "S Munga",
        "D Obor",
        "A Si\u00e9",
        "V Boudo",
        "A Bunker",
        "R Sauerborn",
        "T B\u00e4rnighausen",
        "S Barteit"
      ],
      "year": 2022,
      "doi": "10.2196/34384",
      "journal": "Mhealth Uhealth",
      "volume": "10",
      "issue": "1",
      "pages": "34384",
      "raw": "The Impact of Wearable Technologies in Health Research: Scoping Review JMIR \n\t\t \n\t\t\t S Huhn \n\t\t \n\t\t \n\t\t\t M Axt \n\t\t \n\t\t \n\t\t\t H C Gunga \n\t\t \n\t\t \n\t\t\t M A Maggioni \n\t\t \n\t\t \n\t\t\t S Munga \n\t\t \n\t\t \n\t\t\t D Obor \n\t\t \n\t\t \n\t\t\t A Si\u00e9 \n\t\t \n\t\t \n\t\t\t V Boudo \n\t\t \n\t\t \n\t\t\t A Bunker \n\t\t \n\t\t \n\t\t\t R Sauerborn \n\t\t \n\t\t \n\t\t\t T B\u00e4rnighausen \n\t\t \n\t\t \n\t\t\t S Barteit \n\t\t \n\t\t 10.2196/34384 \n\t\t \n\t \n\t \n\t\t Mhealth Uhealth \n\t\t \n\t\t\t 10 \n\t\t\t 1 \n\t\t\t 34384 \n\t\t\t 2022 \n\t\t \n\t \n\t Huhn S, Axt M, Gunga HC, Maggioni MA, Munga S, Obor D, Si\u00e9 A, Boudo V, Bunker A, Sauerborn R, B\u00e4rnighausen T, Barteit S The Impact of Wearable Technologies in Health Research: Scoping Review JMIR Mhealth Uhealth 2022;10(1):e34384 URL: https://mhealth.jmir.org/2022/1/e34384 doi: 10.2196/34384 PMID:"
    },
    {
      "title": "Originally published in JMIR mHealth and uHealth",
      "authors": [
        "Miriam Huhn",
        "Martina Gunga",
        "Stephen Maggioni",
        "David Munga",
        "Ali Obor",
        "Valentin Si\u00e9",
        "Aditi Boudo",
        "Rainer Bunker",
        "Till Sauerborn",
        "Sandra B\u00e4rnighausen"
      ],
      "doi": "10.2196/34384",
      "raw": "Originally published in JMIR mHealth and uHealth \n\t\t \n\t\t\t Miriam Huhn \n\t\t \n\t\t \n\t\t\t Axt \n\t\t \n\t\t \n\t\t\t Hanns-Christian \n\t\t \n\t\t \n\t\t\t Martina Anna Gunga \n\t\t \n\t\t \n\t\t\t Stephen Maggioni \n\t\t \n\t\t \n\t\t\t David Munga \n\t\t \n\t\t \n\t\t\t Ali Obor \n\t\t \n\t\t \n\t\t\t Valentin Si\u00e9 \n\t\t \n\t\t \n\t\t\t Aditi Boudo \n\t\t \n\t\t \n\t\t\t Rainer Bunker \n\t\t \n\t\t \n\t\t\t Till Sauerborn \n\t\t \n\t\t \n\t\t\t Sandra B\u00e4rnighausen \n\t\t \n\t\t \n\t\t\t Barteit \n\t\t \n\t\t 10.2196/34384 \n\t\t \n\t\t \n\t \n\t \u00a9Sophie Huhn, Miriam Axt, Hanns-Christian Gunga, Martina Anna Maggioni, Stephen Munga, David Obor, Ali Si\u00e9, Valentin Boudo, Aditi Bunker, Rainer Sauerborn, Till B\u00e4rnighausen, Sandra Barteit. Originally published in JMIR mHealth and uHealth (https://mhealth.jmir.org), 25.01"
    }
  ],
  "num_references": 234,
  "figures": [
    {
      "caption": "Figure 1 .",
      "description": "Figure 1. PRISMA (Preferred Reporting Items for Systematic Reviews and Meta-Analyses) flow diagram [220]."
    },
    {
      "caption": "Figure 2 .",
      "description": "Figure 2. Number of studies and study participants (logarithmic scale) per year of study publication. The sizes of the circles visualize the overlapping and number of studies within the year."
    },
    {
      "caption": "Figure 3 .",
      "description": "Figure 3. Included studies per continent. The colors of the continents visualize the number of included studies published on the respective continent (created with Mapchart [221])."
    },
    {
      "caption": "Figure 4 .",
      "description": "Figure 4. Studies per medical field."
    },
    {
      "caption": "Figure 5 .",
      "description": "Figure 5. Wear locations of wearables and their frequencies. The color and size of the circles assigned to the body location visualize the frequency of wearables worn on the respective location."
    },
    {
      "caption": "Figure 6 .",
      "description": "Figure 6. Categorization of wearable applications, showing proportions of the 6 categories (with 4 subcategories). The size of depicted categories (in different colors) corresponds to the number of studies."
    },
    {
      "caption": "Figure 7 .",
      "description": "Figure 7. Chart of reported strengths and weaknesses of wearables as mentioned by authors. PA: physical activity."
    },
    {
      "type": "table",
      "caption": "Table 1 .",
      "description": "Characteristics of studies."
    },
    {
      "type": "table",
      "caption": "Table 2 .",
      "description": "Characteristics of wearable devices."
    }
  ],
  "num_figures": 9,
  "tables": [
    {
      "content": "Studies (N=179), n (%) Participants (N=10,835,733), n, (%)"
    },
    {
      "content": "Studies (N=189), n (%) Participants (N=11,244,872), n (%)"
    }
  ],
  "num_tables": 2,
  "num_citations": 158,
  "cited_references": [
    "b3",
    "b13",
    "b39",
    "b41",
    "b18",
    "b2",
    "b14",
    "b17",
    "b36",
    "b25",
    "b9",
    "b1",
    "b35",
    "b20",
    "b21",
    "b40",
    "b12",
    "b30",
    "b31",
    "b29",
    "b16",
    "b37",
    "b15",
    "b23",
    "b32",
    "b5",
    "b19",
    "b28",
    "b10",
    "b27",
    "b67",
    "b24",
    "b4",
    "b85",
    "b33",
    "b7",
    "b11",
    "b8",
    "b22",
    "b34",
    "b6",
    "b0",
    "b26"
  ],
  "notes": [
    "[raw_affiliation] 1  Heidelberg Institute of Global Health , Heidelberg University Hospital , Heidelberg University , Heidelberg , Germany",
    "[raw_affiliation] 1  Heidelberg Institute of Global Health , Heidelberg University Hospital , Heidelberg University , Heidelberg , Germany",
    "[raw_affiliation] 1  Heidelberg Institute of Global Health , Heidelberg University Hospital , Heidelberg University , Heidelberg , Germany",
    "[raw_affiliation] 2  Charit\u00e9 -Universit\u00e4tsmedizin Berlin , Institute of Physiology , Center for Space Medicine and Extreme Environment , Berlin , Germany",
    "[raw_affiliation] 2  Charit\u00e9 -Universit\u00e4tsmedizin Berlin , Institute of Physiology , Center for Space Medicine and Extreme Environment , Berlin , Germany",
    "[raw_affiliation] 3  Department of Biomedical Sciences for Health , Universit\u00e0 degli Studi di Milano , Milano , Italy",
    "[raw_affiliation] 4  Kenya Medical Research Institute , Kisumu , Kenya",
    "[raw_affiliation] 4  Kenya Medical Research Institute , Kisumu , Kenya",
    "[raw_affiliation] 1  Heidelberg Institute of Global Health , Heidelberg University Hospital , Heidelberg University , Heidelberg , Germany",
    "[raw_affiliation] 5  Centre de Recherche en Sant\u00e9 Nouna , Nouna , Burkina Faso",
    "[raw_affiliation] 5  Centre de Recherche en Sant\u00e9 Nouna , Nouna , Burkina Faso",
    "[raw_affiliation] 1  Heidelberg Institute of Global Health , Heidelberg University Hospital , Heidelberg University , Heidelberg , Germany",
    "[raw_affiliation] 1  Heidelberg Institute of Global Health , Heidelberg University Hospital , Heidelberg University , Heidelberg , Germany",
    "[raw_affiliation] 1  Heidelberg Institute of Global Health , Heidelberg University Hospital , Heidelberg University , Heidelberg , Germany",
    "[raw_affiliation] 6  Harvard Center for Population and Development Studies , Cambridge , MA , United States",
    "[raw_affiliation] 7  Africa Health Research Institute , KwaZulu-Natal , South Africa Heidelberg Institute of Global Health",
    "[raw_affiliation] Heidelberg University Hospital Heidelberg University Im Neuenheimer Feld 130 3 Heidelberg , 69120 Germany",
    "JMIR Mhealth Uhealth 2022 | vol. 10 | iss. 1 | e34384 | p. 2 https://mhealth.jmir.org/2022/1/e34384 (page number not for citation purposes)",
    "JMIR Mhealth Uhealth 2022 | vol. 10 | iss. 1 | e34384 | p. 3 https://mhealth.jmir.org/2022/1/e34384 (page number not for citation purposes)",
    "JMIR Mhealth Uhealth 2022 | vol. 10 | iss. 1 | e34384 | p. 4 https://mhealth.jmir.org/2022/1/e34384 (page number not for citation purposes)",
    "JMIR Mhealth Uhealth 2022 | vol. 10 | iss. 1 | e34384 | p. 5 https://mhealth.jmir.org/2022/1/e34384 (page number not for citation purposes)",
    "JMIR Mhealth Uhealth 2022 | vol. 10 | iss. 1 | e34384 | p. 6 https://mhealth.jmir.org/2022/1/e34384 (page number not for citation purposes)",
    "JMIR Mhealth Uhealth 2022 | vol. 10 | iss. 1 | e34384 | p. 8 https://mhealth.jmir.org/2022/1/e34384 (page number not for citation purposes)",
    "JMIR Mhealth Uhealth 2022 | vol. 10 | iss. 1 | e34384 | p. 9 https://mhealth.jmir.org/2022/1/e34384 (page number not for citation purposes)",
    "JMIR Mhealth Uhealth 2022 | vol. 10 | iss. 1 | e34384 | p. 10 https://mhealth.jmir.org/2022/1/e34384 (page number not for citation purposes)",
    "JMIR Mhealth Uhealth 2022 | vol. 10 | iss. 1 | e34384 | p. 11 https://mhealth.jmir.org/2022/1/e34384 (page number not for citation purposes)",
    "JMIR Mhealth Uhealth 2022 | vol. 10 | iss. 1 | e34384 | p. 12 https://mhealth.jmir.org/2022/1/e34384 (page number not for citation purposes)",
    "JMIR Mhealth Uhealth 2022 | vol. 10 | iss. 1 | e34384 | p. 13 https://mhealth.jmir.org/2022/1/e34384 (page number not for citation purposes)",
    "JMIR Mhealth Uhealth 2022 | vol. 10 | iss. 1 | e34384 | p. 14 https://mhealth.jmir.org/2022/1/e34384 (page number not for citation purposes)",
    "JMIR Mhealth Uhealth 2022 | vol. 10 | iss. 1 | e34384 | p. 15 https://mhealth.jmir.org/2022/1/e34384 (page number not for citation purposes)",
    "JMIR Mhealth Uhealth 2022 | vol. 10 | iss. 1 | e34384 | p. 16 https://mhealth.jmir.org/2022/1/e34384 (page number not for citation purposes)",
    "(page number not for citation purposes)",
    "JMIR Mhealth Uhealth 2022 | vol. 10 | iss. 1 | e34384 | p. 19 https://mhealth.jmir.org/2022/1/e34384 (page number not for citation purposes)",
    "JMIR Mhealth Uhealth 2022 | vol. 10 | iss. 1 | e34384 | p. 20 https://mhealth.jmir.org/2022/1/e34384 (page number not for citation purposes)",
    "JMIR Mhealth Uhealth 2022 | vol. 10 | iss. 1 | e34384 | p. 21 https://mhealth.jmir.org/2022/1/e34384 (page number not for citation purposes)",
    "JMIR Mhealth Uhealth 2022 | vol. 10 | iss. 1 | e34384 | p. 25 https://mhealth.jmir.org/2022/1/e34384 (page number not for citation purposes)",
    "JMIR Mhealth Uhealth 2022 | vol. 10 | iss. 1 | e34384 | p. 26 https://mhealth.jmir.org/2022/1/e34384 (page number not for citation purposes)",
    "JMIR Mhealth Uhealth 2022 | vol. 10 | iss. 1 | e34384 | p. 28 https://mhealth.jmir.org/2022/1/e34384 (page number not for citation purposes)",
    "JMIR Mhealth Uhealth 2022 | vol. 10 | iss. 1 | e34384 | p. 29 https://mhealth.jmir.org/2022/1/e34384 (page number not for citation purposes)",
    "[raw_reference] Wearable band shipments rocket by 684%. Canalys. Singapore; 2014. URL: https://www.canalys.com/newsroom/ wearable-band-shipments-rocket-684?time=1605182466 [accessed 2020-11-12]",
    "FREE Full text",
    "[raw_reference] Henriksen A, Haugen Mikalsen M, Woldaregay AZ, Muzny M, Hartvigsen G, Hopstock LA, et al. Using fitness trackers and smartwatches to measure physical activity in research: analysis of consumer wrist-worn wearables. J Med Internet Res 2018;20(3):e110 [FREE Full text] [doi: 10.2196/jmir.9157] [Medline: 29567635]",
    "[raw_reference] Shin G, Jarrahi MH, Fei Y, Karami A, Gafinowitz N, Byun A, et al. Wearable activity trackers, accuracy, adoption, acceptance and health impact: a systematic literature review. J Biomed Inform 2019;93:103153. [doi: 10.1016/j.jbi.2019.103153] [Medline: 30910623]",
    "[raw_reference] Carpenter A, Frontera A. Smart-watches: a potential challenger to the implantable loop recorder. Europace 2016;18(6):791-793. [doi: 10.1093/europace/euv427] [Medline: 26847074]",
    "FREE Full text",
    "[raw_reference] Jia Y, Wang W, Wen D, Liang L, Gao L, Lei J. Perceived user preferences and usability evaluation of mainstream wearable devices for health monitoring. PeerJ 2018;6:e5350 [FREE Full text] [doi: 10.7717/peerj.5350] [Medline: 30065893]",
    "[raw_reference] Hickey AM, Freedson PS. Utility of consumer physical activity trackers as an intervention tool in cardiovascular disease prevention and treatment. Prog Cardiovasc Dis 2016;58(6):613-619. [doi: 10.1016/j.pcad.2016.02.006] [Medline: 26943981]",
    "FREE Full text",
    "[raw_reference] Fuller D, Colwell E, Low J, Orychock K, Tobin MA, Simango B, et al. Reliability and validity of commercially available wearable devices for measuring steps, energy expenditure, and heart rate: systematic review. JMIR Mhealth Uhealth 2020;8(9):e18694 [FREE Full text] [doi: 10.2196/18694] [Medline: 32897239]",
    "[raw_reference] Zhang Y, Weaver RG, Armstrong B, Burkart S, Zhang S, Beets MW. Validity of wrist-worn photoplethysmography devices to measure heart rate: a systematic review and meta-analysis. J Sports Sci 2020;38(17):2021-2034. [doi: 10.1080/02640414.2020.1767348] [Medline: 32552580]",
    "FREE Full text",
    "[raw_reference] Dunn J, Runge R, Snyder M. Wearables and the medical revolution. Per Med 2018;15(5):429-448 [FREE Full text] [doi: 10.2217/pme-2018-0044] [Medline: 30259801]",
    "[raw_reference] Shiffman S, Stone AA, Hufford MR. Ecological momentary assessment. Annu Rev Clin Psychol 2008;4:1-32. [doi: 10.1146/annurev.clinpsy.3.022806.091415] [Medline: 18509902]",
    "FREE Full text",
    "[raw_reference] Zapata-Lamana R, Lalanza JF, Losilla JM, Parrado E, Capdevila L. mHealth technology for ecological momentary assessment in physical activity research: a systematic review. PeerJ 2020;8:e8848 [FREE Full text] [doi: 10.7717/peerj.8848] [Medline: 32257648]",
    "[raw_reference] Berrut G. La montre connect\u00e9e : un instrument de sant\u00e9 publique? Geriatr Psychol Neuropsychiatr Vieil 2020;18(1):5. [doi: 10.1684/pnv.2020.0847] [Medline: 32160985]",
    "[raw_reference] Robert Koch Institute. Corona-Datenspende | Robert Koch-Institut. Corona Data Donation. 2020. URL: https:/ /corona-datenspende.de/ [accessed 2020-10-26]",
    "FREE Full text",
    "[raw_reference] Radin JM, Wineinger NE, Topol EJ, Steinhubl SR. Harnessing wearable device data to improve state-level real-time surveillance of influenza-like illness in the USA: a population-based study. Lancet Digit Health 2020;2(2):e85-e93 [FREE Full text] [doi: 10.1016/S2589-7500(19)30222-5] [Medline: 33334565]",
    "[raw_reference] Perez MV, Mahaffey KW, Hedlin H, Rumsfeld JS, Garcia A, Ferris T, Apple Heart Study Investigators. Large-scale assessment of a smartwatch to identify atrial fibrillation. N Engl J Med 2019;381(20):1909-1917. [doi: 10.1056/NEJMoa1901183] [Medline: 31722151]",
    "[raw_reference] Worsham C, Jena AB. Why doctors shouldn't dismiss the Apple watch's new ECG app. Harvard Business Review. 2018. URL: https://hbr.org/2018/10/why-doctors-shouldnt-dismiss-the-apple-watchs-new-ecg-app [accessed 2020-10-02]",
    "FREE Full text",
    "[raw_reference] D\u00f6rr M, Nohturfft V, Brasier N, Bosshard E, Djurdjevic A, Gross S, et al. Reply: watch out: the many limitations in smartwatch-driven AF detection. JACC Clin Electrophysiol 2019;5(4):526-527 [FREE Full text] [doi: 10.1016/j.jacep.2019.03.001] [Medline: 31000111]",
    "[raw_reference] Kaneshiro M, Kaiser W, Pourmorady J, Fleshner P, Russell M, Zaghiyan K, et al. Postoperative gastrointestinal telemetry with an acoustic biosensor predicts ileus vs. uneventful GI recovery. J Gastrointest Surg 2016;20(1):132-139. [doi: 10.1007/s11605-015-2956-3] [Medline: 26408329]",
    "[raw_reference] Barajas-Carmona JG, Francisco-Aldana L, Morales-Narv\u00e1ez E. Wearable nanoplasmonic patch detecting Sun/UV exposure. Anal Chem 2017;89(24):13589-13595. [doi: 10.1021/acs.analchem.7b04066] [Medline: 29155557]",
    "FREE Full text",
    "[raw_reference] Culp K, Tonelli S. Heat-related illness in midwestern hispanic farmworkers: a descriptive analysis of hydration status and reported symptoms. Workplace Health Saf 2019;67(4):168-178 [FREE Full text] [doi: 10.1177/2165079918813380] [Medline: 30724664]",
    "FREE Full text",
    "[raw_reference] Choi DH, Thaxton A, Jeong IC, Kim K, Sosnay PR, Cutting GR, et al. Sweat test for cystic fibrosis: wearable sweat sensor vs. standard laboratory test. J Cyst Fibros 2018;17(4):e35-e38 [FREE Full text] [doi: 10.1016/j.jcf.2018.03.005] [Medline: 29580829]",
    "[raw_reference] Relf R, Willmott A, Flint MS, Beale L, Maxwell N. Reliability of a wearable sweat rate monitor and routine sweat analysis techniques under heat stress in females. J Therm Biol 2019;79:209-217. [doi: 10.1016/j.jtherbio.2018.12.019] [Medline: 30612681]",
    "FREE Full text",
    "[raw_reference] Kwon S, Hong J, Choi EK, Lee B, Baik C, Lee E, et al. Detection of atrial fibrillation using a ring-type wearable device (CardioTracker) and deep learning analysis of photoplethysmography signals: prospective observational proof-of-concept study. J Med Internet Res 2020;22(5):e16443 [FREE Full text] [doi: 10.2196/16443] [Medline: 32348254]",
    "[raw_reference] Genbrugge C, Eertmans W, Salcido DD. Monitor the quality of cardiopulmonary resuscitation in 2020. Curr Opin Crit Care 2020;26(3):219-227. [doi: 10.1097/MCC.0000000000000726] [Medline: 32332284]",
    "FREE Full text",
    "[raw_reference] Caduff A, Zanon M, Zakharov P, Mueller M, Talary M, Krebs A, et al. First experiences with a wearable multisensor in an outpatient glucose monitoring study, part I: the users' view. J Diabetes Sci Technol 2018;12(3):562-568 [FREE Full text] [doi: 10.1177/1932296817750932] [Medline: 29332423]",
    "FREE Full text",
    "[raw_reference] van der Kamp MR, Klaver EC, Thio BJ, Driessen JM, de Jongh FH, Tabak M, et al. WEARCON: wearable home monitoring in children with asthma reveals a strong association with hospital based assessment of asthma control. BMC Med Inform Decis Mak 2020;20(1):192 [FREE Full text] [doi: 10.1186/s12911-020-01210-1] [Medline: 32795352]",
    "[raw_reference] Foster KR, Torous J. The opportunity and obstacles for smartwatches and wearable sensors. IEEE Pulse 2019;10(1):22-25. [doi: 10.1109/MPULS.2018.2885832] [Medline: 30872210]",
    "[raw_reference] Shelgikar AV, Anderson PF, Stephens MR. Sleep tracking, wearable technology, and opportunities for research and clinical care. Chest 2016;150(3):732-743. [doi: 10.1016/j.chest.2016.04.016] [Medline: 27132701]",
    "[raw_reference] Jin D, Adams H, Cocco AM, Martin WG, Palmer S. Smartphones and wearable technology: benefits and concerns in cardiology. Med J Aust 2020;212(2):54-6.e1. [doi: 10.5694/mja2.50446] [Medline: 31851375]",
    "[raw_reference] Haberlin C, O'Dwyer T, Mockler D, Moran J, O'Donnell DM, Broderick J. The use of eHealth to promote physical activity in cancer survivors: a systematic review. Support Care Cancer 2018;26(10):3323-3336. [doi: 10.1007/s00520-018-4305-z] [Medline: 29909476]",
    "FREE Full text",
    "[raw_reference] Jacobsen M, Dembek TA, Kobbe G, Gaidzik PW, Heinemann L. Noninvasive continuous monitoring of vital signs with wearables: fit for medical use? J Diabetes Sci Technol 2021;15(1):34-43 [FREE Full text] [doi: 10.1177/1932296820904947] [Medline: 32063034]",
    "[raw_reference] Tricco AC, Lillie E, Zarin W, O'Brien KK, Colquhoun H, Levac D, et al. PRISMA extension for scoping reviews (PRISMA-ScR): checklist and explanation. Ann Intern Med 2018;169(7):467-473. [doi: 10.7326/M18-0850] [Medline: 30178033]",
    "[raw_reference] Arksey H, O'Malley L. Scoping studies: towards a methodological framework. Int J Soc Res Methodol 2005;8(1):19-32. [doi: 10.1080/1364557032000119616]",
    "[raw_reference] Peters MD, Godfrey CM, Khalil H, McInerney P, Parker D, Soares CB. Guidance for conducting systematic scoping reviews. Int J Evid Based Healthc 2015;13(3):141-146. [doi: 10.1097/XEB.0000000000000050] [Medline: 26134548]",
    "[raw_reference] Elliott M, Coventry A. Critical care: the eight vital signs of patient monitoring. Br J Nurs 2012;21(10):621-625. [doi: 10.12968/bjon.2012.21.10.621] [Medline: 22875303]",
    "FREE Full text",
    "[raw_reference] Dias D, Paulo Silva Cunha J. Wearable health devices-vital sign monitoring, systems and technologies. Sensors (Basel) 2018;18(8):2414 [FREE Full text] [doi: 10.3390/s18082414] [Medline: 30044415]",
    "FREE Full text",
    "[raw_reference] Kami\u0161ali\u0107 A, Fister Jr I, Turkanovi\u0107 M, Karakati\u010d S. Sensors and functionalities of non-invasive wrist-wearable devices: a review. Sensors (Basel) 2018;18(6):1714 [FREE Full text] [doi: 10.3390/s18061714] [Medline: 29799504]",
    "[raw_reference] International Data Corporation. Wearable devices market share. IDC Corporate USA. 2021. URL: https://www.idc.com/ promo/wearablevendor/vendor [accessed 2021-07-13] 40",
    "by vendor",
    "[raw_reference] Vailshery LS. Wearables shipments worldwide market share 2014-2021, by vendor. Statista. 2021. URL: https://www. statista.com/statistics/435944/quarterly-wearables-shipments-worldwide-market-share-by-vendor/ [accessed 2021-07-13]",
    "[raw_reference] Covidence systematic review software. Covidence. Melbourne: Veritas Health Innovation URL: https://www.covidence.org/ [accessed 2021-03-15]",
    "Roy Rosenzweig Center for History and New Media",
    "[raw_reference] Zotero. Roy Rosenzweig Center for History and New Media. Fairfax: Roy Rosenzweig Center for History and New Media URL: https://www.zotero.org/download/ [accessed 2021-03-15]",
    "[raw_reference] Cook DA, Reed DA. Appraising the quality of medical education research methods: the medical education research study quality instrument and the newcastle-ottawa scale-education. Acad Med 2015;90(8):1067-1076. [doi: 10.1097/ACM.0000000000000786] [Medline: 26107881]",
    "FREE Full text",
    "[raw_reference] Agarwal DK, Viers BR, Rivera ME, Nienow DA, Frank I, Tollefson MK, et al. Physical activity monitors can be successfully implemented to assess perioperative activity in urologic surgery. Mhealth 2018;4:43 [FREE Full text] [doi: 10.21037/mhealth.2018.09.05] [Medline: 30363722]",
    "FREE Full text",
    "[raw_reference] Alghamdi AS, Alghamdi KA, Jenkins RO, Alghamdi MN, Haris PI. Impact of Ramadan on physical activity and sleeping patterns in individuals with type 2 diabetes: the first study using fitbit device. Diabetes Ther 2020;11(6):1331-1346 [FREE Full text] [doi: 10.1007/s13300-020-00825-x] [Medline: 32367477]",
    "FREE Full text",
    "[raw_reference] An KH, Han KA, Sohn TS, Park IB, Kim HJ, Moon SD, et al. Body fat is related to sedentary behavior and light physical activity but not to moderate-vigorous physical activity in type 2 diabetes mellitus. Diabetes Metab J 2020;44(2):316-325 [FREE Full text] [doi: 10.4093/dmj.2019.0029] [Medline: 31769237]",
    "FREE Full text",
    "[raw_reference] Arigo D, Pasko K, Mogle JA. Daily relations between social perceptions and physical activity among college women. Psychol Sport Exerc 2020;47:101528 [FREE Full text] [doi: 10.1016/j.psychsport.2019.04.018] [Medline: 32831642]",
    "FREE Full text",
    "[raw_reference] Bade BC, Brooks MC, Nietert SB, Ulmer A, Thomas DD, Nietert PJ, et al. Assessing the correlation between physical activity and quality of life in advanced lung cancer. Integr Cancer Ther 2018;17(1):73-79 [FREE Full text] [doi: 10.1177/1534735416684016] [Medline: 28024420]",
    "FREE Full text",
    "[raw_reference] Baril JF, Bromberg S, Moayedi Y, Taati B, Manlhiot C, Ross HJ, et al. Use of free-living step count monitoring for heart failure functional classification: validation study. JMIR Cardio 2019;3(1):e12122 [FREE Full text] [doi: 10.2196/12122] [Medline: 31758777]",
    "[raw_reference] Barkley R, Khalil M, Shen P, Levine EA, Votanopoulos K, Clark CJ. Feasibility of low-cost accelerometers in measuring functional recovery after major oncologic surgery. J Surg Oncol 2019;121(2):279-285. [doi: 10.1002/jso.25789] [Medline: 31782174]",
    "FREE Full text",
    "[raw_reference] Barrett PM, Komatireddy R, Haaser S, Topol S, Sheard J, Encinas J, et al. Comparison of 24-hour Holter monitoring with 14-day novel adhesive patch electrocardiographic monitoring. Am J Med 2014;127(1):95.e11-95.e17 [FREE Full text] [doi: 10.1016/j.amjmed.2013.10.003] [Medline: 24384108]",
    "FREE Full text",
    "[raw_reference] Bevier W, Glantz N, Hoppe C, Morales Glass J, Larez A, Chen K, et al. Self-reported and objectively measured physical activity levels among Hispanic/Latino adults with type 2 diabetes. BMJ Open Diabetes Res Care 2020;8(1):e000893 [FREE Full text] [doi: 10.1136/bmjdrc-2019-000893] [Medline: 32169933]",
    "FREE Full text",
    "[raw_reference] Bian J, Guo Y, Xie M, Parish AE, Wardlaw I, Brown R, et al. Exploring the association between self-reported asthma impact and fitbit-derived sleep quality and physical activity measures in adolescents. JMIR Mhealth Uhealth 2017;5(7):e105 [FREE Full text] [doi: 10.2196/mhealth.7346] [Medline: 28743679]",
    "FREE Full text",
    "[raw_reference] Billeci L, Tonacci A, Narzisi A, Manigrasso Z, Varanini M, Fulceri F, et al. Heart rate variability during a joint attention task in toddlers with autism spectrum disorders. Front Physiol 2018;9:467 [FREE Full text] [doi: 10.3389/fphys.2018.00467] [Medline: 29765335]",
    "FREE Full text",
    "[raw_reference] Birkeland K, Khandwalla RM, Kedan I, Shufelt CL, Mehta PK, Minissian MB, et al. Daily activity measured with wearable technology as a novel measurement of treatment effect in patients with coronary microvascular dysfunction: substudy of a randomized controlled crossover trial. JMIR Res Protoc 2017;6(12):e255 [FREE Full text] [doi: 10.2196/resprot.8057] [Medline: 29263019]",
    "[raw_reference] Blackshear TB, Seyfried L. Does education close the black-white physical activity and obesity gaps? J Am Coll Health 2021;69(2):222-226. [doi: 10.1080/07448481.2019.1657122] [Medline: 31765289]",
    "FREE Full text",
    "[raw_reference] Block VJ, Bove R, Zhao C, Garcha P, Graves J, Romeo AR, et al. Association of continuous assessment of step count by remote monitoring with disability progression among adults with multiple sclerosis. JAMA Netw Open 2019;2(3):e190570 [FREE Full text] [doi: 10.1001/jamanetworkopen.2019.0570] [Medline: 30874777]",
    "[raw_reference] Block VJ, Liz\u00e9e A, Crabtree-Hartman E, Bevan CJ, Graves JS, Bove R, et al. Continuous daily assessment of multiple sclerosis disability using remote step count monitoring. J Neurol 2017;264(2):316-326. [doi: 10.1007/s00415-016-8334-6] [Medline: 27896433]",
    "[raw_reference] Bolourchi M, Batra AS. Diagnostic yield of patch ambulatory electrocardiogram monitoring in children (from a national registry). Am J Cardiol 2015;115(5):630-634. [doi: 10.1016/j.amjcard.2014.12.014] [Medline: 25591894]",
    "FREE Full text",
    "[raw_reference] Alvarez MP, Silva TD, Favero FM, Valenti VE, Raimundo RD, Vanderlei LC, et al. Autonomic modulation in Duchenne muscular dystrophy during a computer task: a prospective control trial. PLoS One 2017;12(1):e0169633 [FREE Full text] [doi: 10.1371/journal.pone.0169633] [Medline: 28118369]",
    "[raw_reference] Brazendale K, Brazendale AB, Garcia JM, Monroe CM, Weaver RG, Beets MW. Brief report: obesogenic behaviors of children with developmental disabilities during summer. J Autism Dev Disord 2021;51(2):734-740. [doi: 10.1007/s10803-020-04566-5] [Medline: 32533383]",
    "[raw_reference] Brudy L, Hock J, H\u00e4cker AL, Meyer M, Oberhoffer R, Hager A, et al. Children with congenital heart disease are active but need to keep moving: a cross-sectional study using wrist-worn physical activity trackers. J Pediatr 2020;217:13-19. [doi: 10.1016/j.jpeds.2019.09.077] [Medline: 31740142]",
    "[raw_reference] Buchan DS, McLellan G, Donnelly S, Arthur R. The use of the intensity gradient and average acceleration metrics to explore associations with BMI z-score in children. J Sports Sci 2019;37(23):2751-2758. [doi: 10.1080/02640414.2019.1664536] [Medline: 31506039]",
    "[raw_reference] Burnett-Zeigler IE, Waldron EM, Hong S, Yang A, Wisner KL, Ciolino JD. Accessibility and feasibility of using technology to support mindfulness practice, reduce stress and promote long term mental health. Complement Ther Clin Pract 2018;33:93-99. [doi: 10.1016/j.ctcp.2018.09.001] [Medline: 30396633]",
    "FREE Full text",
    "[raw_reference] Cai M, Tan KH, Ang SB. I-ACT: integrated study on effect of activity on complications in pregnancy: study protocol of a multiethnic prospective cohort study. BMJ Open 2019;9(4):e025970 [FREE Full text] [doi: 10.1136/bmjopen-2018-025970] [Medline: 30948592]",
    "FREE Full text",
    "[raw_reference] Carrasco JJ, P\u00e9rez-Alenda S, Casa\u00f1a J, Soria-Olivas E, Bonanad S, Querol F. Physical activity monitoring and acceptance of a commercial activity tracker in adult patients with haemophilia. Int J Environ Res Public Health 2019;16(20):3851 [FREE Full text] [doi: 10.3390/ijerph16203851] [Medline: 31614706]",
    "FREE Full text",
    "[raw_reference] Cascino TM, McLaughlin VV, Richardson CR, Behbahani-Nejad N, Moles VM, Visovatti SH, et al. Barriers to physical activity in patients with pulmonary hypertension. Pulm Circ 2019;9(2):2045894019847895 [FREE Full text] [doi: 10.1177/2045894019847895] [Medline: 30983524]",
    "FREE Full text",
    "[raw_reference] Chang YT. Physical activity and cognitive function in mild cognitive impairment. ASN Neuro 2020;12:1759091419901182 [FREE Full text] [doi: 10.1177/1759091419901182] [Medline: 31948261]",
    "FREE Full text",
    "[raw_reference] Chapple C, Bliwise D, Maislisch L, Roitmann E, Burtea T. Night-time voids, level of bother and sleep characteristics in a non-patient population of wearable devices users. Int J Clin Pract 2020;74(7):e13495 [FREE Full text] [doi: 10.1111/ijcp.13495] [Medline: 32100396]",
    "[raw_reference] Chue AE, Gunthert KC, Kim RW, Alfano CA, Ruggiero AR. The role of sleep in adolescents' daily stress recovery: negative affect spillover and positive affect bounce-back effects. J Adolesc 2018;66:101-111. [doi: 10.1016/j.adolescence.2018.05.006] [Medline: 29842996]",
    "[raw_reference] Cohen-Holzer M, Sorek G, Schweizer M, Katz-Leurer M. The influence of a constraint and bimanual training program using a variety of modalities on endurance and on the cardiac autonomic regulation system of children with unilateral cerebral palsy: a self-control clinical trial. NeuroRehabilitation 2017;41(1):119-126. [doi: 10.3233/NRE-171463] [Medline: 28505992]",
    "[raw_reference] Cole TS, Jahnke H, Godzik J, Morgan CD, Nakaji P, Little AS. Use of a wrist-mounted device for continuous outpatient physiologic monitoring after transsphenoidal surgery: a pilot study. Pituitary 2019;22(2):156-162. [doi: 10.1007/s11102-019-00946-y] [Medline: 30806859]",
    "[raw_reference] Collier E, Varon C, Van Huffel S, Bogaert G. Enuretic children have a higher variability in REM sleep when comparing their sleep parameters with nonenuretic control children using a wearable sleep tracker at home. Neurourol Urodyn 2020;39(1):367-375. [doi: 10.1002/nau.24215] [Medline: 31729062]",
    "FREE Full text",
    "[raw_reference] Costa J, Figueiredo P, Nakamura F, Rago V, Rebelo A, Brito J. Intra-individual variability of sleep and nocturnal cardiac autonomic activity in elite female soccer players during an international tournament. PLoS One 2019;14(9):e0218635 [FREE Full text] [doi: 10.1371/journal.pone.0218635] [Medline: 31527865]",
    "FREE Full text",
    "FREE Full text",
    "[raw_reference] DasMahapatra P, Chiauzzi E, Bhalerao R, Rhodes J. Free-living physical activity monitoring in adult US patients with multiple sclerosis using a consumer wearable device. Digit Biomark 2018;2(1):47-63 [FREE Full text] [doi: 10.1159/000488040] [Medline: 32095756]",
    "Pt A",
    "[raw_reference] Do J, Webster RJ, Longmuir PE, Ieradi S, Reddy D, Whiting S, et al. Physically active children with epilepsy have good objective sleep duration and efficiency despite subjective reports of fatigue and sleep problems. Epilepsy Behav 2020;104(Pt A):106853. [doi: 10.1016/j.yebeh.2019.106853] [Medline: 31958642]",
    "FREE Full text",
    "[raw_reference] Downey C, Randell R, Brown J, Jayne DG. Continuous versus intermittent vital signs monitoring using a wearable, wireless patch in patients admitted to surgical wards: pilot cluster randomized controlled trial. J Med Internet Res 2018;20(12):e10802 [FREE Full text] [doi: 10.2196/10802] [Medline: 30538086]",
    "[raw_reference] Driesman AS, Strauss EJ, Konda SR, Egol KA. Factors associated with orthopaedic resident burnout: a pilot study. J Am Acad Orthop Surg 2020;28(21):900-906. [doi: 10.5435/JAAOS-D-19-00648] [Medline: 32039922]",
    "FREE Full text",
    "[raw_reference] Elmagboul N, Coburn BW, Foster J, Mudano A, Melnick J, Bergman D, et al. Physical activity measured using wearable activity tracking devices associated with gout flares. Arthritis Res Ther 2020;22(1):181 [FREE Full text] [doi: 10.1186/s13075-020-02272-2] [Medline: 32746893]",
    "[raw_reference] English C, Healy GN, Coates A, Lewis L, Olds T, Bernhardt J. Sitting and activity time in people with stroke. Phys Ther 2016;96(2):193-201. [doi: 10.2522/ptj.20140522] [Medline: 26112254]",
    "[raw_reference] Eyre EL, Duncan MJ, Birch SL, Cox V, Blackett M. Physical activity patterns of ethnic children from low socio-economic environments within the UK. J Sports Sci 2015;33(3):232-242. [doi: 10.1080/02640414.2014.934706] [Medline: 24998418]",
    "FREE Full text",
    "[raw_reference] Fagherazzi G, El Fatouhi D, Bellicha A, El Gareh A, Affret A, Dow C, et al. An international study on the determinants of poor sleep amongst 15,000 users of connected devices. J Med Internet Res 2017;19(10):e363 [FREE Full text] [doi: 10.2196/jmir.7930] [Medline: 29061551]",
    "[raw_reference] Fairclough SJ, Taylor S, Rowlands AV, Boddy LM, Noonan RJ. Average acceleration and intensity gradient of primary school children and associations with indicators of health and well-being. J Sports Sci 2019;37(18):2159-2167. [doi: 10.1080/02640414.2019.1624313] [Medline: 31156048]",
    "FREE Full text",
    "[raw_reference] Faust L, Feldman K, Mattingly SM, Hachen D, V Chawla N. Deviations from normal bedtimes are associated with short-term increases in resting heart rate. NPJ Digit Med 2020;3:39 [FREE Full text] [doi: 10.1038/s41746-020-0250-6] [Medline: 32219180]",
    "[raw_reference] Flatt AA, Esco MR. Evaluating individual training adaptation with smartphone-derived heart rate variability in a collegiate female soccer team. J Strength Cond Res 2016;30(2):378-385. [doi: 10.1519/JSC.0000000000001095] [Medline: 26200192]",
    "FREE Full text",
    "[raw_reference] Frie K, Hartmann-Boyce J, Jebb S, Oke J, Aveyard P. Patterns in weight and physical activity tracking data preceding a stop in weight monitoring: observational analysis. J Med Internet Res 2020;22(3):e15790 [FREE Full text] [doi: 10.2196/15790] [Medline: 32181749]",
    "[raw_reference] Ghomrawi HM, Baumann LM, Kwon S, Hebal F, Hsiung G, Williams K, et al. Using accelerometers to characterize recovery after surgery in children. J Pediatr Surg 2018;53(8):1600-1605. [doi: 10.1016/j.jpedsurg.2017.09.016] [Medline: 29092769]",
    "[raw_reference] Girard MP, O'Shaughnessy J, Doucet C, Ruchat SM, Descarreaux M. Association between physical activity, weight loss, anxiety, and lumbopelvic pain in postpartum women. J Manipulative Physiol Ther 2020;43(6):655-666. [doi: 10.1016/j.jmpt.2019.11.008] [Medline: 32709518]",
    "[raw_reference] Gluck S, Summers MJ, Finnis ME, Andrawos A, Goddard TP, Hodgson CL, et al. An observational study investigating the use of patient-owned technology to quantify physical activity in survivors of critical illness. Aust Crit Care 2020;33(2):137-143. [doi: 10.1016/j.aucc.2019.01.009] [Medline: 30879879]",
    "[raw_reference] Green DR, Gerberich SG, Kim H, Ryan AD, McGovern PM, Church TR, et al. Janitor workload and occupational injuries. Am J Ind Med 2019;62(3):222-232. [doi: 10.1002/ajim.22940] [Medline: 30675912]",
    "FREE Full text",
    "[raw_reference] Gresham G, Hendifar AE, Spiegel B, Neeman E, Tuli R, Rimel BJ, et al. Wearable activity monitors to assess performance status and predict clinical outcomes in advanced cancer patients. NPJ Digit Med 2018;1:27 [FREE Full text] [doi: 10.1038/s41746-018-0032-6] [Medline: 31304309]",
    "FREE Full text",
    "[raw_reference] Grimes L, Outtrim JG, Griffin SJ, Ercole A. Accelerometery as a measure of modifiable physical activity in high-risk elderly preoperative patients: a prospective observational pilot study. BMJ Open 2019;9(11):e032346 [FREE Full text] [doi: 10.1136/bmjopen-2019-032346] [Medline: 31685513]",
    "FREE Full text",
    "[raw_reference] Groat D, Kwon HJ, Grando MA, Cook CB, Thompson B. Comparing real-time self-tracking and device-recorded exercise data in subjects with type 1 diabetes. Appl Clin Inform 2018;9(4):919-926 [FREE Full text] [doi: 10.1055/s-0038-1676458] [Medline: 30586673]",
    "FREE Full text",
    "[raw_reference] Guo Y, Wang H, Zhang H, Chen Y, Lip GY. Population-based screening or targeted screening based on initial clinical risk assessment for atrial fibrillation: a report from the Huawei heart study. J Clin Med 2020;9(5):1493 [FREE Full text] [doi: 10.3390/jcm9051493] [Medline: 32429241]",
    "[raw_reference] Guo Y, Wang H, Zhang H, Liu T, Liang Z, Xia Y, MAFA II Investigators. Mobile photoplethysmographic technology to detect atrial fibrillation. J Am Coll Cardiol 2019;74(19):2365-2375. [doi: 10.1016/j.jacc.2019.08.019] [Medline: 31487545]",
    "FREE Full text",
    "[raw_reference] Hamed A, Curran C, Gwaltney C, DasMahapatra P. Mobility assessment using wearable technology in patients with late-onset Pompe disease. NPJ Digit Med 2019;2:70 [FREE Full text] [doi: 10.1038/s41746-019-0143-8] [Medline: 31341956]",
    "FREE Full text",
    "[raw_reference] Han M, Ye X, Preciado P, Williams S, Campos I, Bonner M, et al. Relationships between neighborhood walkability and objectively measured physical activity levels in hemodialysis patients. Blood Purif 2018;45(1-3):236-244 [FREE Full text] [doi: 10.1159/000485161] [Medline: 29478044]",
    "FREE Full text",
    "[raw_reference] Hemphill NM, Kuan MT, Harris KC. Reduced physical activity during COVID-19 pandemic in children with congenital heart disease. Can J Cardiol 2020;36(7):1130-1134 [FREE Full text] [doi: 10.1016/j.cjca.2020.04.038] [Medline: 32387502] 100",
    "[raw_reference] Hirschberg R, Sylvia LG, Wright EC, Gupta CT, McCarthy MD, Harward LK, et al. Collaborative songwriting intervention for veterans with post-traumatic stress disorder. J Altern Complement Med 2020;26(3):198-203. [doi: 10.1089/acm.2019.0368] [Medline: 31985263] 101",
    "FREE Full text",
    "[raw_reference] Huberty JL, Buman MP, Leiferman JA, Bushar J, Adams MA. Trajectories of objectively-measured physical activity and sedentary time over the course of pregnancy in women self-identified as inactive. Prev Med Rep 2016;3:353-360 [FREE Full text] [doi: 10.1016/j.pmedr.2016.04.004] [Medline: 27419036] 102",
    "FREE Full text",
    "[raw_reference] Jeong JN, Kim SH, Park KN. Relationship between objectively measured lifestyle factors and health factors in patients with knee osteoarthritis: the STROBE study. Medicine (Baltimore) 2019;98(26):e16060 [FREE Full text] [doi: 10.1097/MD.0000000000016060] [Medline: 31261513] 103",
    "[raw_reference] Jiang F, Kobayashi T, Ichihashi T, Ito K, Nomura S. The effect of citrus ginger aroma on heart rate and salivary cortisol level during sleep at home. IEEJ Trans Elec Electron Eng 2019;14(4):623-629. [doi: 10.1002/tee.22845] 104",
    "FREE Full text",
    "[raw_reference] John-Henderson NA, Palmer CA, Thomas A. Life stress, sense of belonging and sleep in American Indian college students. Sleep Health 2019;5(4):352-358 [FREE Full text] [doi: 10.1016/j.sleh.2019.04.001] [Medline: 31153800] 105",
    "[raw_reference] Jones MA, Skidmore PM, Stoner L, Harrex H, Saeedi P, Black K, et al. Associations of accelerometer-measured sedentary time, sedentary bouts, and physical activity with adiposity and fitness in children. J Sports Sci 2020;38(1):114-120. [doi: 10.1080/02640414.2019.1685842] [Medline: 31665975] 106",
    "FREE Full text",
    "[raw_reference] Jonker LT, Hendriks S, Lahr MM, van Munster BC, de Bock GH, van Leeuwen BL. Postoperative recovery of accelerometer-based physical activity in older cancer patients. Eur J Surg Oncol 2020;46(11):2083-2090 [FREE Full text] [doi: 10.1016/j.ejso.2020.06.012] [Medline: 32682650] 107",
    "FREE Full text",
    "[raw_reference] Kabbach EZ, Mazzuco A, Borghi-Silva A, Cabiddu R, Agnoleto AG, Barbosa JF, et al. Increased parasympathetic cardiac modulation in patients with acute exacerbation of COPD: how should we interpret it? Int J Chron Obstruct Pulmon Dis 2017;12:2221-2230 [FREE Full text] [doi: 10.2147/COPD.S134498] [Medline: 28814850] 108",
    "FREE Full text",
    "[raw_reference] Kagamiyama H, Yano R. Relationship between subjective fatigue, physical activity, and sleep indices in nurses working 16-hour night shifts in a rotating two-shift system. J Rural Med 2018;13(1):26-32 [FREE Full text] [doi: 10.2185/jrm.2951] [Medline: 29875894] 109",
    "FREE Full text",
    "[raw_reference] Kaura A, Sztriha L, Chan FK, Aeron-Thomas J, Gall N, Piechowski-Jozwiak B, et al. Early prolonged ambulatory cardiac monitoring in stroke (EPACS): an open-label randomised controlled trial. Eur J Med Res 2019;24(1):25 [FREE Full text] [doi: 10.1186/s40001-019-0383-8] [Medline: 31349792] 110",
    "FREE Full text",
    "[raw_reference] Kim DH, Nam KH, Choi BK, Han IH, Jeon TJ, Park SY. The usefulness of a wearable device in daily physical activity monitoring for the hospitalized patients undergoing lumbar surgery. J Korean Neurosurg Soc 2019;62(5):561-566 [FREE Full text] [doi: 10.3340/jkns.2018.0131] [Medline: 31337197] 111",
    "FREE Full text",
    "[raw_reference] Kim Y, Wijndaele K, Sharp SJ, Strain T, Pearce M, White T, et al. Specific physical activities, sedentary behaviours and sleep as long-term predictors of accelerometer-measured physical activity in 91,648 adults: a prospective cohort study. Int J Behav Nutr Phys Act 2019;16(1):41 [FREE Full text] [doi: 10.1186/s12966-019-0802-9] [Medline: 31064403] 112",
    "FREE Full text",
    "[raw_reference] Kimura N, Aso Y, Yabuuchi K, Ishibashi M, Hori D, Sasaki Y, et al. Association of modifiable lifestyle factors with cortical amyloid burden and cerebral glucose metabolism in older adults with mild cognitive impairment. JAMA Netw Open 2020;3(6):e205719 [FREE Full text] [doi: 10.1001/jamanetworkopen.2020.5719] [Medline: 32515796] 113",
    "FREE Full text",
    "[raw_reference] Kochiya Y, Hirabayashi A, Ichimaru Y. Nocturnal heart rate variability in 1-year-old infants analyzed by using the least square cosine spectrum method. J Physiol Anthropol 2017;36(1):36 [FREE Full text] [doi: 10.1186/s40101-017-0152-8] [Medline: 28915915] 114",
    "FREE Full text",
    "[raw_reference] Koehler F, Koehler K, Deckwart O, Prescher S, Wegscheider K, Kirwan BA, et al. Efficacy of telemedical interventional management in patients with heart failure (TIM-HF2): a randomised, controlled, parallel-group, unmasked trial. Lancet 2018;392(10152):1047-1057 [FREE Full text] [doi: 10.1016/S0140-6736(18)31880-4] [Medline: 30153985] 115",
    "FREE Full text",
    "[raw_reference] Kolk D, Aarden JJ, MacNeil-Vroomen JL, Reichardt LA, van Seben R, van der Schaaf M, Hospital-ADL Study Group. Factors associated with step numbers in acutely hospitalized older adults: the hospital-activities of daily living study. J Am Med Dir Assoc 2021;22(2):425-432 [FREE Full text] [doi: 10.1016/j.jamda.2020.06.027] [Medline: 32713773] 116",
    "FREE Full text",
    "[raw_reference] Kruizinga MD, Zuiker RG, Sali E, de Kam ML, Doll RJ, Groeneveld GJ, et al. Finding suitable clinical endpoints for a potential treatment of a rare genetic disease: the case of ARID1B. Neurotherapeutics 2020;17(3):1300-1310 [FREE Full text] [doi: 10.1007/s13311-020-00868-9] [Medline: 32462407] 117",
    "[raw_reference] Lamar DL, Chou SH, Medverd JR, Swanson JO. Sedentary behavior in the workplace: a potential occupational hazard for radiologists. Curr Probl Diagn Radiol 2016;45(4):253-257. [doi: 10.1067/j.cpradiol.2015.10.007] [Medline: 26675263] 118",
    "FREE Full text",
    "[raw_reference] Larsen SC, Horgan G, Mikkelsen MK, Palmeira AL, Scott S, Duarte C, et al. Consistent sleep onset and maintenance of body weight after weight loss: an analysis of data from the NoHoW trial. PLoS Med 2020;17(7):e1003168 [FREE Full text] [doi: 10.1371/journal.pmed.1003168] [Medline: 32673309] 119",
    "FREE Full text",
    "[raw_reference] Lazaridou A, Paschali M, Schreiber K, Galenkamp L, Berry M, Paschalis T, et al. The association between daily physical exercise and pain among women with fibromyalgia: the moderating role of pain catastrophizing. Pain Rep 2020;5(4):e832 [FREE Full text] [doi: 10.1097/PR9.0000000000000832] [Medline: 32766468] 120",
    "[raw_reference] Le Hello C, Trombert B, Morel A, Chieh A, Brouard B, Boissier C. Performance analysis of walking of 10,000 regular users of a connected activity tracker. J Med Vasc 2018;43(4):231-237. [doi: 10.1016/j.jdmv.2018.04.001] [Medline: 29981731] 121",
    "FREE Full text",
    "[raw_reference] Lee JE, Lee DH, Oh TJ, Kim KM, Choi SH, Lim S, et al. Clinical feasibility of continuously monitored data for heart rate, physical activity, and sleeping by wearable activity trackers in patients with thyrotoxicosis: protocol for a prospective longitudinal observational study. JMIR Res Protoc 2018;7(2):e49 [FREE Full text] [doi: 10.2196/resprot.8119] [Medline: 29467121] 122",
    "FREE Full text",
    "[raw_reference] Lee JP, Chen S, Tsai CT, Chung HC, Chang WD. Characteristics associated with the differential activity of nondominant and dominant affected hands in patients with poststroke right hemiparesis. Occup Ther Int 2020;2020:2387378 [FREE Full text] [doi: 10.1155/2020/2387378] [Medline: 32565757] 123",
    "[raw_reference] Lee KM, Rogers MP, Galbarczyk A, Jasienska G, Clancy KB. Physical activity in women of reproductive age in a transitioning rural polish population. Am J Hum Biol 2019;31(3):e23231. [doi: 10.1002/ajhb.23231] [Medline: 30835924] 124",
    "[raw_reference] Liao Y, Robertson MC, Winne A, Wu IH, Le TA, Balachandran DD, et al. Investigating the within-person relationships between activity levels and sleep duration using Fitbit data. Transl Behav Med 2021;11(2):619-624. [doi: 10.1093/tbm/ibaa071] [Medline: 32667039] 125",
    "FREE Full text",
    "[raw_reference] Lim SE, Dodds R, Bacon D, Sayer AA, Roberts HC. Physical activity among hospitalised older people: insights from upper and lower limb accelerometry. Aging Clin Exp Res 2018;30(11):1363-1369 [FREE Full text] [doi: 10.1007/s40520-018-0930-0] [Medline: 29542070] 126",
    "FREE Full text",
    "[raw_reference] Lim WK, Davila S, Teo JX, Yang C, Pua CJ, Bl\u00f6cker C, et al. Beyond fitness tracking: the use of consumer-grade wearable data from normal volunteers in cardiovascular and lipidomics research. PLoS Biol 2018;16(2):e2004285 [FREE Full text] [doi: 10.1371/journal.pbio.2004285] [Medline: 29485983] 127",
    "[raw_reference] Lin H, Sardana M, Zhang Y, Liu C, Trinquart L, Benjamin EJ, et al. Association of habitual physical activity with cardiovascular disease risk. Circ Res 2020;127(10):1253-1260. [doi: 10.1161/CIRCRESAHA.120.317578] [Medline: 32842915] 128",
    "[raw_reference] Liu S, Eaton CB, Driban JB, McAlindon TE, Lapane KL. Comparison of self-report and objective measures of physical activity in US adults with osteoarthritis. Rheumatol Int 2016;36(10):1355-1364. [doi: 10.1007/s00296-016-3537-9] [Medline: 27435920] 129",
    "FREE Full text",
    "[raw_reference] Low CA, Bovbjerg DH, Ahrendt S, Choudry MH, Holtzman M, Jones HL, et al. Fitbit step counts during inpatient recovery from cancer surgery as a predictor of readmission. Ann Behav Med 2018;52(1):88-92 [FREE Full text] [doi: 10.1093/abm/kax022] [Medline: 29538623] 130",
    "FREE Full text",
    "[raw_reference] Low CA, Dey AK, Ferreira D, Kamarck T, Sun W, Bae S, et al. Estimation of symptom severity during chemotherapy from passively sensed data: exploratory study. J Med Internet Res 2017;19(12):e420 [FREE Full text] [doi: 10.2196/jmir.9046] [Medline: 29258977] 131",
    "FREE Full text",
    "[raw_reference] Ma J, Martin R, Chan B, Gofeld M, Geary MP, Laffey JG, et al. Using activity trackers to quantify postpartum ambulation: a prospective observational study of ambulation after regional anesthesia and analgesia interventions. Anesthesiology 2018;128(3):598-608 [FREE Full text] [doi: 10.1097/ALN.0000000000001979] [Medline: 29135475] 132",
    "FREE Full text",
    "[raw_reference] Maijala A, Kinnunen H, Koskim\u00e4ki H, J\u00e4ms\u00e4 T, Kangas M. Nocturnal finger skin temperature in menstrual cycle tracking: ambulatory pilot study using a wearable Oura ring. BMC Womens Health 2019;19(1):150 [FREE Full text] [doi: 10.1186/s12905-019-0844-9] [Medline: 31783840] 133",
    "[raw_reference] Makic MB, Gilbert D, Jankowski C, Reeder B, Al-Salmi N, Starr W, et al. Sensor and survey measures associated with daily fatigue in HIV: findings from a mixed-method study. J Assoc Nurses AIDS Care 2020;31(1):12-24. [doi: 10.1097/JNC.0000000000000152] [Medline: 31860594] 134",
    "FREE Full text",
    "[raw_reference] Massey WV, Stellino MB, Geldhof J. An observational study of recess quality and physical activity in urban primary schools. BMC Public Health 2020;20(1):792 [FREE Full text] [doi: 10.1186/s12889-020-08849-5] [Medline: 32460860] 135",
    "FREE Full text",
    "[raw_reference] Massey WV, Stellino MB, Fraser M. Individual and environmental correlates of school-based recess engagement. Prev Med Rep 2018;11:247-253 [FREE Full text] [doi: 10.1016/j.pmedr.2018.07.005] [Medline: 30094127] 136",
    "FREE Full text",
    "[raw_reference] Matcham F, Barattieri di San Pietro C, Bulgari V, de Girolamo G, Dobson R, Eriksson H, RADAR-CNS consortium. Remote assessment of disease and relapse in major depressive disorder (RADAR-MDD): a multi-centre prospective cohort study protocol. BMC Psychiatry 2019;19(1):72 [FREE Full text] [doi: 10.1186/s12888-019-2049-z] [Medline: 30777041] 137",
    "[raw_reference] McLean DC, Nakamura J, Csikszentmihalyi M. Reconsidering the experience machine: self-reported versus objective measures of physical activity to increase positive affect. J Health Psychol 2020;25(13-14):2428-2439. [doi: 10.1177/1359105318801939] [Medline: 30246550] 138",
    "[raw_reference] Mead MP, Baron K, Sorby M, Irish LA. Daily associations between sleep and physical activity. Int J Behav Med 2019;26(5):562-568. [doi: 10.1007/s12529-019-09810-6] [Medline: 31372835] 139",
    "FREE Full text",
    "[raw_reference] Meijer K, Annegarn J, Lima Passos V, Savelberg HH, Schols AM, Wouters EF, et al. Characteristics of daily arm activities in patients with COPD. Eur Respir J 2014;43(6):1631-1641 [FREE Full text] [doi: 10.1183/09031936.00082513] [Medline: 24558175] 140",
    "FREE Full text",
    "[raw_reference] Melin M, Hagerman I, Gonon A, Gustafsson T, Rullman E. Variability in physical activity assessed with accelerometer is an independent predictor of mortality in CHF patients. PLoS One 2016;11(4):e0153036 [FREE Full text] [doi: 10.1371/journal.pone.0153036] [Medline: 27054323] 141",
    "FREE Full text",
    "[raw_reference] Menai M, Brouard B, Vegreville M, Chieh A, Schmidt N, Oppert JM, et al. Cross-sectional and longitudinal associations of objectively-measured physical activity on blood pressure: evaluation in 37 countries. Health Promot Perspect 2017;7(4):190-196 [FREE Full text] [doi: 10.15171/hpp.2017.34] [Medline: 29085795] 142",
    "[raw_reference] Mendelsohn D, Despot I, Gooderham PA, Singhal A, Redekop GJ, Toyota BD. Impact of work hours and sleep on well-being and burnout for physicians-in-training: the Resident Activity Tracker Evaluation Study. Med Educ 2019;53(3):306-315. [doi: 10.1111/medu.13757] [Medline: 30485496] 143",
    "FREE Full text",
    "[raw_reference] Mi\u010dkov\u00e1 E, Machov\u00e1 K, Da\u010fov\u00e1 K, Svobodov\u00e1 I. Does dog ownership affect physical activity, sleep, and self-reported health in older adults? Int J Environ Res Public Health 2019;16(18):3355 [FREE Full text] [doi: 10.3390/ijerph16183355] [Medline: 31514379] 144",
    "FREE Full text",
    "[raw_reference] Miller DJ, Capodilupo JV, Lastella M, Sargent C, Roach GD, Lee VH, et al. Analyzing changes in respiratory rate to predict the risk of COVID-19 infection. PLoS One 2020;15(12):e0243693 [FREE Full text] [doi: 10.1371/journal.pone.0243693] [Medline: 33301493] 145",
    "FREE Full text",
    "[raw_reference] Mobbs RJ, Phan K, Maharaj M, Rao PJ. Physical activity measured with accelerometer and self-rated disability in lumbar spine surgery: a prospective study. Global Spine J 2016;6(5):459-464 [FREE Full text] [doi: 10.1055/s-0035-1565259] [Medline: 27433430] 146",
    "FREE Full text",
    "[raw_reference] Mocny-Pacho\u0144ska K, Doniec R, Trzcionka A, Pacho\u0144ski M, Piaseczna N, Sieci\u0144ski S, et al. Evaluating the stress-response of dental students to the dental school environment. PeerJ 2020;8:e8981 [FREE Full text] [doi: 10.7717/peerj.8981] [Medline: 32411517] 147",
    "[raw_reference] Modarress-Sadeghi M, Oura P, Junno JA, Niemel\u00e4 M, Niinim\u00e4ki J, J\u00e4ms\u00e4 T, et al. Objectively measured physical activity is associated with vertebral size in midlife. Med Sci Sports Exerc 2019;51(8):1606-1612. [doi: 10.1249/MSS.0000000000001962] [Medline: 30817715] 148",
    "[raw_reference] Mora-Gonzalez J, Migueles JH, Esteban-Cornejo I, Cadenas-Sanchez C, Pastor-Villaescusa B, Molina-Garc\u00eda P, et al. Sedentarism, physical activity, steps, and neurotrophic factors in obese children. Med Sci Sports Exerc 2019;51(11):2325-2333. [doi: 10.1249/MSS.0000000000002064] [Medline: 31634295] 149",
    "FREE Full text",
    "[raw_reference] Morcos MW, Teeter MG, Somerville LE, Lanting B. Correlation between hip osteoarthritis and the level of physical activity as measured by wearable technology and patient-reported questionnaires. J Orthop 2019;20:236-239 [FREE Full text] [doi: 10.1016/j.jor.2019.11.049] [Medline: 32071522] 150",
    "[raw_reference] Morhardt DR, Luckenbaugh A, Goldstein C, Faerber GJ. Determining resident sleep during and after call with commercial sleep monitoring devices. Urology 2017;106:39-44. [doi: 10.1016/j.urology.2017.03.059] [Medline: 28502597] 151",
    "FREE Full text",
    "[raw_reference] Mueller C, Stollfuss B, Roitenberg A, Harder J, Richter MJ. Evaluation of clinical outcomes and simultaneous digital tracking of daily physical activity, heart rate, and inhalation behavior in patients with pulmonary arterial hypertension treated with inhaled iloprost: protocol for the observational VENTASTEP study. JMIR Res Protoc 2019;8(4):e12144 [FREE Full text] [doi: 10.2196/12144] [Medline: 30985279] 152",
    "FREE Full text",
    "[raw_reference] Murphree DH, Kinard TN, Khera N, Storlie CB, Ngufor C, Upadhyaya S, et al. Measuring the impact of ambulatory red blood cell transfusion on home functional status: study protocol for a pilot randomized controlled trial. Trials 2017;18(1):153 [FREE Full text] [doi: 10.1186/s13063-017-1873-z] [Medline: 28359342] 153",
    "[raw_reference] Natarajan A, Pantelopoulos A, Emir-Farinas H, Natarajan P. Heart rate variability with photoplethysmography in 8 million individuals: a cross-sectional study. Lancet Digit Health 2020;2(12):e650-e657. [doi: 10.1016/S2589-7500(20)30246-6] [Medline: 33328029] 154",
    "FREE Full text",
    "[raw_reference] Niemel\u00e4 MS, Kangas M, Ahola RJ, Auvinen JP, Leinonen AM, Tammelin TH, et al. Dose-response relation of self-reported and accelerometer-measured physical activity to perceived health in middle age-the Northern Finland Birth Cohort 1966 Study. BMC Public Health 2019;19(1):21 [FREE Full text] [doi: 10.1186/s12889-018-6359-8] [Medline: 30612541] 155",
    "FREE Full text",
    "[raw_reference] Nishida M, Kikuchi S, Miwakeichi F, Suda S. Night duty and decreased brain activity of medical residents: a wearable optical topography study. Med Educ Online 2017;22(1):1379345 [FREE Full text] [doi: 10.1080/10872981.2017.1379345] [Medline: 28954586] 156",
    "FREE Full text",
    "[raw_reference] Nowell WB, Curtis JR, Nolot SK, Curtis D, Venkatachalam S, Owensby JK, et al. Digital tracking of rheumatoid arthritis longitudinally (DIGITAL) using biosensor and patient-reported outcome data: protocol for a real-world study. JMIR Res Protoc 2019;8(9):e14665 [FREE Full text] [doi: 10.2196/14665] [Medline: 31573949] 157",
    "FREE Full text",
    "[raw_reference] Orme MW, Steiner MC, Morgan MD, Kingsnorth AP, Esliger DW, Singh SJ, et al. 24-hour accelerometry in COPD: exploring physical activity, sedentary behavior, sleep and clinical characteristics. Int J Chron Obstruct Pulmon Dis 2019;14:419-430 [FREE Full text] [doi: 10.2147/COPD.S183029] [Medline: 30863042] 158",
    "[raw_reference] Otsuki T, Ishii N. Association between blood pressure changes during self-paced outdoor walking and air temperature. Clin Physiol Funct Imaging 2017;37(2):155-161. [doi: 10.1111/cpf.12280] [Medline: 26211639] 159",
    "FREE Full text",
    "[raw_reference] Pakhomov SV, Thuras PD, Finzel R, Eppel J, Kotlyar M. Using consumer-wearable technology for remote assessment of physiological response to stress in the naturalistic environment. PLoS One 2020;15(3):e0229942 [FREE Full text] [doi: 10.1371/journal.pone.0229942] [Medline: 32210441] 160",
    "FREE Full text",
    "[raw_reference] Pastor N, Khalilian E, Caballeria E, Morrison D, Sanchez Luque U, Matrai S, et al. Remote monitoring telemedicine (REMOTE) platform for patients with anxiety symptoms and alcohol use disorder: protocol for a case-control study. JMIR Res Protoc 2020;9(6):e16964 [FREE Full text] [doi: 10.2196/16964] [Medline: 32579124] 161",
    "[raw_reference] Peach HD, Gaultney JF, Ruggiero AR. Direct and indirect associations of sleep knowledge and attitudes with objective and subjective sleep duration and quality via sleep hygiene. J Prim Prev 2018;39(6):555-570. [doi: 10.1007/s10935-018-0526-7] [Medline: 30443688] 162",
    "FREE Full text",
    "[raw_reference] P\u00e9pin JL, Bruno RM, Yang RY, Vercamer V, Jouhaud P, Escourrou P, et al. Wearable activity trackers for monitoring adherence to home confinement during the COVID-19 pandemic worldwide: data aggregation and analysis. J Med Internet Res 2020;22(6):e19787 [FREE Full text] [doi: 10.2196/19787] [Medline: 32501803] 163",
    "FREE Full text",
    "[raw_reference] Phillips LJ, Petroski GF, Conn VS, Brown M, Leary E, Teri L, et al. Exploring path models of disablement in residential care and assisted living residents. J Appl Gerontol 2018;37(12):1490-1516 [FREE Full text] [doi: 10.1177/0733464816672048] [Medline: 27708073] 164",
    "FREE Full text",
    "[raw_reference] Pozehl BJ, Mcguire R, Duncan K, Hertzog M, Deka P, Norman J, et al. Accelerometer-measured daily activity levels and related factors in patients with heart failure. J Cardiovasc Nurs 2018;33(4):329-335 [FREE Full text] [doi: 10.1097/JCN.0000000000000464] [Medline: 29538050] 165",
    "FREE Full text",
    "[raw_reference] Pradhan S, Kelly VE. Quantifying physical activity in early Parkinson disease using a commercial activity monitor. Parkinsonism Relat Disord 2019;66:171-175 [FREE Full text] [doi: 10.1016/j.parkreldis.2019.08.001] [Medline: 31420310] 166",
    "FREE Full text",
    "[raw_reference] Quer G, Gouda P, Galarnyk M, Topol EJ, Steinhubl SR. Inter-and intraindividual variability in daily resting heart rate and its associations with age, sex, sleep, BMI, and time of year: retrospective, longitudinal cohort study of 92,457 adults. PLoS One 2020;15(2):e0227709 [FREE Full text] [doi: 10.1371/journal.pone.0227709] [Medline: 32023264] 167",
    "[raw_reference] Quer G, Radin JM, Gadaleta M, Baca-Motes K, Ariniello L, Ramos E, et al. Wearable sensor data and self-reported symptoms for COVID-19 detection. Nat Med 2021;27(1):73-77. [doi: 10.1038/s41591-020-1123-x] [Medline: 33122860] 168",
    "FREE Full text",
    "[raw_reference] Quiroz JC, Geangu E, Yong MH. Emotion recognition using smart watch sensor data: mixed-design study. JMIR Ment Health 2018;5(3):e10153 [FREE Full text] [doi: 10.2196/10153] [Medline: 30089610] 169",
    "[raw_reference] Rahman MJ, Morshed BI, Harmon B. A field study to capture events of interest (EoI) from living labs using wearables for spatiotemporal monitoring towards a framework of smart health (sHealth). Annu Int Conf IEEE Eng Med Biol Soc 2020;2020:5943-5947. [doi: 10.1109/EMBC44109.2020.9175771] [Medline: 33019327] 170",
    "[raw_reference] Rahman MJ, Nemati E, Rahman M, Vatanparvar K, Nathan V, Kuang J. Toward early severity assessment of obstructive lung disease using multi-modal wearable sensor data fusion during walking. Annu Int Conf IEEE Eng Med Biol Soc 2020;2020:5935-5938. [doi: 10.1109/EMBC44109.2020.9176559] [Medline: 33019325] 171",
    "FREE Full text",
    "[raw_reference] Ramirez E, Marinsek N, Bradshaw B, Kanard R, Foschini L. Continuous digital assessment for weight loss surgery patients. Digit Biomark 2020;4(1):13-20 [FREE Full text] [doi: 10.1159/000506417] [Medline: 32399512] 172",
    "FREE Full text",
    "[raw_reference] Raywood E, Douglas H, Kapoor K, Filipow N, Murray N, O'Connor R, et al. Protocol for Project Fizzyo, an analytic longitudinal observational cohort study of physiotherapy for children and young people with cystic fibrosis, with interrupted time-series design. BMJ Open 2020;10(10):e039587 [FREE Full text] [doi: 10.1136/bmjopen-2020-039587] [Medline: 33033031] 173",
    "FREE Full text",
    "[raw_reference] Reddy R, El Youssef J, Winters-Stone K, Branigan D, Leitschuh J, Castle J, et al. The effect of exercise on sleep in adults with type 1 diabetes. Diabetes Obes Metab 2018;20(2):443-447 [FREE Full text] [doi: 10.1111/dom.13065] [Medline: 28718987] 174",
    "FREE Full text",
    "[raw_reference] Roe J, Salmon L, Twiggs J. Objective measure of activity level after total knee arthoplasty with the use of the 'Fitbit' device. Orthop J Sports Med 2016;4(Supplement 2):2325967116S00012 [FREE Full text] [doi: 10.1177/2325967116S00012] 175",
    "FREE Full text",
    "[raw_reference] Root ED, Graney B, Baird S, Churney T, Fier K, Korn M, et al. Physical activity and activity space in patients with pulmonary fibrosis not prescribed supplemental oxygen. BMC Pulm Med 2017;17(1):154 [FREE Full text] [doi: 10.1186/s12890-017-0495-2] [Medline: 29169394] 176",
    "FREE Full text",
    "[raw_reference] Rykov Y, Thach TQ, Dunleavy G, Roberts AC, Christopoulos G, Soh CK, et al. Activity tracker-based metrics as digital markers of cardiometabolic health in working adults: cross-sectional study. JMIR Mhealth Uhealth 2020;8(1):e16409 [FREE Full text] [doi: 10.2196/16409] [Medline: 32012098] 177",
    "FREE Full text",
    "[raw_reference] Saarikko J, Niela-Vilen H, Ekholm E, Hamari L, Azimi I, Liljeberg P, et al. Continuous 7-month internet of things-based monitoring of health parameters of pregnant and postpartum women: prospective observational feasibility study. JMIR Form Res 2020;4(7):e12417 [FREE Full text] [doi: 10.2196/12417] [Medline: 32706696] 178",
    "FREE Full text",
    "[raw_reference] Saif N, Yan P, Niotis K, Scheyer O, Rahman A, Berkowitz M, et al. Feasibility of using a wearable biosensor device in patients at risk for Alzheimer's disease dementia. J Prev Alzheimers Dis 2020;7(2):104-111 [FREE Full text] [doi: 10.14283/jpad.2019.39] [Medline: 32236399] 179",
    "[raw_reference] Scarlett S, Nolan H, Kenny RA, O'Connell MD. Objective sleep duration in older adults: results from the Irish longitudinal study on ageing. J Am Geriatr Soc 2020;68(1):120-128. [doi: 10.1111/jgs.16177] [Medline: 31579942] 180",
    "[raw_reference] Sehgal S, Chowdhury A, Rabih F, Gadre A, Park MM, Li M, STep-count using an Accelerometer for Monitoring PAH-STAMP Study group. Counting steps: a new way to monitor patients with pulmonary arterial hypertension. Lung 2019;197(4):501-508. [doi: 10.1007/s00408-019-00239-y] [Medline: 31144016] 181",
    "Pt B",
    "[raw_reference] Semaan S, Dewland TA, Tison GH, Nah G, Vittinghoff E, Pletcher MJ, et al. Physical activity and atrial fibrillation: data from wearable fitness trackers. Heart Rhythm 2020;17(5 Pt B):842-846. [doi: 10.1016/j.hrthm.2020.02.013] [Medline: 32354448] 182",
    "FREE Full text",
    "[raw_reference] Shaw RJ, Barnes A, Steinberg D, Vaughn J, Diane A, Levine E, et al. Enhancing diabetes self-management through collection and visualization of data from multiple mobile health technologies: protocol for a development and feasibility trial. JMIR Res Protoc 2019;8(6):e13517 [FREE Full text] [doi: 10.2196/13517] [Medline: 31162127] 183",
    "FREE Full text",
    "[raw_reference] Shen H, Zhao J, Zhou X, Li J, Wan Q, Huang J, et al. Impaired chronotropic response to physical activities in heart failure patients. BMC Cardiovasc Disord 2017;17(1):136 [FREE Full text] [doi: 10.1186/s12872-017-0571-9] [Medline: 28545575] 184",
    "FREE Full text",
    "[raw_reference] Shilaih M, Goodale BM, Falco L, K\u00fcbler F, De Clerck V, Leeners B. Modern fertility awareness methods: wrist wearables capture the changes in temperature associated with the menstrual cycle. Biosci Rep 2018;38(6):BSR20171279 [FREE Full text] [doi: 10.1042/BSR20171279] [Medline: 29175999] 185",
    "FREE Full text",
    "[raw_reference] Shilaih M, Clerck V, Falco L, K\u00fcbler F, Leeners B. Pulse rate measurement during sleep using wearable sensors, and its correlation with the menstrual cycle phases, a prospective observational study. Sci Rep 2017;7(1):1294 [FREE Full text] [doi: 10.1038/s41598-017-01433-9] [Medline: 28465583] 186",
    "FREE Full text",
    "[raw_reference] Shufelt CL, Kim A, Joung S, Barsky L, Arnold C, Cheng S, et al. Biometric and psychometric remote monitoring and cardiovascular risk biomarkers in ischemic heart disease. J Am Heart Assoc 2020;9(18):e016023 [FREE Full text] [doi: 10.1161/JAHA.120.016023] [Medline: 32896202] 187",
    "FREE Full text",
    "[raw_reference] Silverman-Lloyd LG, Kianoush S, Blaha MJ, Sabina AB, Graham GN, Martin SS. mActive-Smoke: a prospective observational study using mobile health tools to assess the association of physical activity with smoking urges. JMIR Mhealth Uhealth 2018;6(5):e121 [FREE Full text] [doi: 10.2196/mhealth.9292] [Medline: 29752250] 188",
    "[raw_reference] Smith SL, Ludy MJ, Tucker RM. Changes in taste preference and steps taken after sleep curtailment. Physiol Behav 2016;163:228-233. [doi: 10.1016/j.physbeh.2016.05.002] [Medline: 27184237] 189",
    "FREE Full text",
    "[raw_reference] Solomon MD, Yang J, Sung SH, Livingston ML, Sarlas G, Lenane JC, et al. Incidence and timing of potentially high-risk arrhythmias detected through long term continuous ambulatory electrocardiographic monitoring. BMC Cardiovasc Disord 2016;16:35 [FREE Full text] [doi: 10.1186/s12872-016-0210-x] [Medline: 26883019] 190",
    "FREE Full text",
    "[raw_reference] Souza RT, Cecatti JG, Mayrink J, Galv\u00e3o RB, Costa ML, Feitosa F, MAES-I Study Group. Identification of earlier predictors of pregnancy complications through wearable technologies in a Brazilian multicentre cohort: Maternal Actigraphy Exploratory Study I (MAES-I) study protocol. BMJ Open 2019;9(4):e023101 [FREE Full text] [doi: 10.1136/bmjopen-2018-023101] [Medline: 31005906] 191",
    "FREE Full text",
    "[raw_reference] Steinhubl SR, Waalen J, Edwards AM, Ariniello LM, Mehta RR, Ebner GS, et al. Effect of a home-based wearable continuous ECG monitoring patch on detection of undiagnosed atrial fibrillation: the mSToPS randomized clinical trial. JAMA 2018;320(2):146-155 [FREE Full text] [doi: 10.1001/jama.2018.8102] [Medline: 29998336] 192",
    "FREE Full text",
    "[raw_reference] Stelzer EM, Book S, Graessel E, Hofner B, Kornhuber J, Luttenberger K. Bouldering psychotherapy reduces depressive symptoms even when general physical activity is controlled for: a randomized controlled trial. Heliyon 2018;4(3):e00580 [FREE Full text] [doi: 10.1016/j.heliyon.2018.e00580] [Medline: 29862344] 193",
    "[raw_reference] Strain T, Wijndaele K, Dempsey PC, Sharp SJ, Pearce M, Jeon J, et al. Wearable-device-measured physical activity and future health risk. Nat Med 2020;26(9):1385-1391. [doi: 10.1038/s41591-020-1012-3] [Medline: 32807930] 194",
    "[raw_reference] Tateishi K, Ohtani N, Ohta M. Physiological effects of interactions between female dog owners with neuroticism and their dogs. J Vet Behav 2014;9(6):304-310. [doi: 10.1016/j.jveb.2014.08.005] 195",
    "FREE Full text",
    "[raw_reference] Thijs I, Fresiello L, Oosterlinck W, Sinnaeve P, Rega F. Assessment of physical activity by wearable technology during rehabilitation after cardiac surgery: explorative prospective monocentric observational cohort study. JMIR Mhealth Uhealth 2019;7(1):e9865 [FREE Full text] [doi: 10.2196/mhealth.9865] [Medline: 30702433] 196",
    "forthcoming forthcoming FREE Full text",
    "[raw_reference] Thomas S, Yingling L, Adu-Brimpong J, Mitchell V, Ayers CR, Wallen GR, et al. Mobile health technology can objectively capture physical activity (PA) targets among African-American women within resource-limited communities-the Washington, D.C. cardiovascular health and needs assessment. J Racial Ethn Health Disparities (forthcoming) 2016:-(forthcoming) [FREE Full text] [doi: 10.1007/s40615-016-0290-4] [Medline: 27913983] 197",
    "[raw_reference] Thompson JF, Severson RL, Rosecrance JC. Occupational physical activity in brewery and office workers. J Occup Environ Hyg 2018;15(9):686-699. [doi: 10.1080/15459624.2018.1492136] [Medline: 30188781] 198",
    "FREE Full text",
    "[raw_reference] Thorup C, Hansen J, Gr\u00f8nkjaer M, Andreasen JJ, Nielsen G, S\u00f8rensen EE, et al. Cardiac patients' walking activity determined by a step counter in cardiac telerehabilitation: data from the intervention arm of a randomized controlled trial. J Med Internet Res 2016;18(4):e69 [FREE Full text] [doi: 10.2196/jmir.5191] [Medline: 27044310] 199",
    "FREE Full text",
    "[raw_reference] Tomitani N, Kanegae H, Suzuki Y, Kuwabara M, Kario K. Stress-induced blood pressure elevation self-measured by a wearable watch-type device. Am J Hypertens 2021;34(4):377-382 [FREE Full text] [doi: 10.1093/ajh/hpaa139] [Medline: 32852527] 200",
    "FREE Full text",
    "[raw_reference] Turakhia MP, Ullal AJ, Hoang DD, Than CT, Miller JD, Friday KJ, et al. Feasibility of extended ambulatory electrocardiogram monitoring to identify silent atrial fibrillation in high-risk patients: the Screening Study for Undiagnosed Atrial Fibrillation (STUDY-AF). Clin Cardiol 2015;38(5):285-292 [FREE Full text] [doi: 10.1002/clc.22387] [Medline: 25873476] 201",
    "FREE Full text",
    "[raw_reference] Turel O, Romashkin A, Morrison KM. Health outcomes of information system use lifestyles among adolescents: videogame addiction, sleep curtailment and cardio-metabolic deficiencies. PLoS One 2016;11(5):e0154764 [FREE Full text] [doi: 10.1371/journal.pone.0154764] [Medline: 27149512] 202",
    "[raw_reference] Twiggs J, Salmon L, Kolos E, Bogue E, Miles B, Roe J. Measurement of physical activity in the pre-and early post-operative after total knee arthroplasty for osteoarthritis using a Fitbit Flex device. Med Eng Phys 2018;51:31-40. [doi: 10.1016/j.medengphy.2017.10.007] [Medline: 29117912] 203",
    "[raw_reference] van der Kamp MR, Thio BJ, Tabak M, Hermens HJ, Driessen J, van der Palen J. Does exercise-induced bronchoconstriction affect physical activity patterns in asthmatic children? J Child Health Care 2020;24(4):577-588. [doi: 10.1177/1367493519881257] [Medline: 31607144] 204",
    "FREE Full text",
    "[raw_reference] van Wamelen DJ, Hota S, Podlewska A, Leta V, Trivedi D, Rizos A, et al. Non-motor correlates of wrist-worn wearable sensor use in Parkinson's disease: an exploratory analysis. NPJ Parkinsons Dis 2019;5:22 [FREE Full text] [doi: 10.1038/s41531-019-0094-4] [Medline: 31602393] 205",
    "FREE Full text",
    "[raw_reference] Vaughn NH, Dunklebarger MF, Mason MW. Individual patient-reported activity levels before and after joint arthroplasty are neither accurate nor reproducible. Clin Orthop Relat Res 2019;477(3):536-544 [FREE Full text] [doi: 10.1097/CORR.0000000000000591] [Medline: 30543533] 206",
    "FREE Full text",
    "[raw_reference] Venkataramanan R, Thirunarayan K, Jaimini U, Kadariya D, Yip HY, Kalra M, et al. Determination of personalized asthma triggers from multimodal sensing and a mobile app: observational study. JMIR Pediatr Parent 2019;2(1):e14300 [FREE Full text] [doi: 10.2196/14300] [Medline: 31518318] 207",
    "ea74972cf8412a73ce52eb018c1e [FREE Full text",
    "[raw_reference] Wallace M, Downing N, Lourens S, Mills J, Kim JI, Long J, Predict-Hd Investigators And Coordinators Of The Huntington Study Group. Is there an association of physical activity with brain volume, behavior, and day-to-day functioning? A cross sectional design in prodromal and early Huntington disease. PLoS Curr 2016;8:ecurrents.hd.cba6ea74972cf8412a73ce52eb018c1e [FREE Full text] [doi: 10.1371/currents.hd.cba6ea74972cf8412a73ce52eb018c1e] [Medline: 27818843] 208",
    "[raw_reference] Wang C, Lizardo O, Hachen DS. Using Fitbit data to monitor the heart rate evolution patterns of college students. J Am Coll Health 2020:1-8. [doi: 10.1080/07448481.2020.1775610] [Medline: 32569509] 209",
    "FREE Full text",
    "[raw_reference] Weatherall J, Paprocki Y, Meyer TM, Kudel I, Witt EA. Sleep tracking and exercise in patients with type 2 diabetes mellitus (Step-D): pilot study to determine correlations between Fitbit data and patient-reported outcomes. JMIR Mhealth Uhealth 2018;6(6):e131 [FREE Full text] [doi: 10.2196/mhealth.8122] [Medline: 29871856] 210",
    "FREE Full text",
    "[raw_reference] Weeks DL, Sprint GL, Stilwill V, Meisen-Vehrs AL, Cook DJ. Implementing wearable sensors for continuous assessment of daytime heart rate response in inpatient rehabilitation. Telemed J E Health 2018;24(12):1014-1020 [FREE Full text] [doi: 10.1089/tmj.2017.0306] [Medline: 29608421] 211",
    "FREE Full text",
    "[raw_reference] Wiles T, Kellogg D, Furr H, Nessler JA, Newcomer SC. Characterization of adult heart rate responses during recreational skateboarding at community skateparks. Int J Exerc Sci 2020;13(2):501-510 [FREE Full text] [Medline: 32509111] 212",
    "FREE Full text",
    "[raw_reference] Winnebeck EC, Fischer D, Leise T, Roenneberg T. Dynamics and ultradian structure of human sleep in real life. Curr Biol 2018;28(1):49-59.e5 [FREE Full text] [doi: 10.1016/j.cub.2017.11.063] [Medline: 29290561] 213",
    "FREE Full text",
    "[raw_reference] Wyatt KD, Poole LR, Mullan AF, Kopecky SL, Heaton HA. Clinical evaluation and diagnostic yield following evaluation of abnormal pulse detected using Apple watch. J Am Med Inform Assoc 2020;27(9):1359-1363 [FREE Full text] [doi: 10.1093/jamia/ocaa137] [Medline: 32979046] 214",
    "[raw_reference] Xu X, Conomos MP, Manor O, Rohwer JE, Magis AT, Lovejoy JC. Habitual sleep duration and sleep duration variation are independently associated with body mass index. Int J Obes (Lond) 2018;42(4):794-800. [doi: 10.1038/ijo.2017.223] [Medline: 28895585] 215",
    "FREE Full text",
    "[raw_reference] Yang Y, Hirdes JP, Dubin JA, Lee J. Fall risk classification in community-dwelling older adults using a smart wrist-worn device and the resident assessment instrument-home care: prospective observational study. JMIR Aging 2019;2(1):e12153 [FREE Full text] [doi: 10.2196/12153] [Medline: 31518278] 216",
    "FREE Full text",
    "[raw_reference] Youn IH, Lee JM. Seafarers' physical activity and sleep patterns: results from Asia-Pacific sea routes. Int J Environ Res Public Health 2020;17(19):7266 [FREE Full text] [doi: 10.3390/ijerph17197266] [Medline: 33027892] 217",
    "[raw_reference] Yu Y, Chen Z, Bu J, Zhang Q. Do stairs inhibit seniors who live on upper floors from going out? HERD 2020;13(4):128-143. [doi: 10.1177/1937586720936588] [Medline: 32666833] 218",
    "FREE Full text",
    "[raw_reference] Zhu G, Catt M, Cassidy S, Birch-Machin M, Trenell M, Hiden H, et al. Objective sleep assessment in >80,000 UK mid-life adults: associations with sociodemographic characteristics, physical activity and caffeine. PLoS One 2019;14(12):e0226220 [FREE Full text] [doi: 10.1371/journal.pone.0226220] [Medline: 31881028] 219",
    "FREE Full text",
    "[raw_reference] Zhuo K, Gao C, Wang X, Zhang C, Wang Z. Stress and sleep: a survey based on wearable sleep trackers among medical and nursing staff in Wuhan during the COVID-19 pandemic. Gen Psychiatr 2020;33(3):e100260 [FREE Full text] [doi: 10.1136/gpsych-2020-100260] [Medline: 32596641] 220",
    "FREE Full text Create your own custom map. MapChart",
    "[raw_reference] Page MJ, McKenzie JE, Bossuyt PM, Boutron I, Hoffmann TC, Mulrow CD, et al. The PRISMA 2020 statement: an updated guideline for reporting systematic reviews. Syst Rev 2021;10(1):89 [FREE Full text] [doi: 10.1186/s13643-021-01626-4] [Medline: 33781348] 221. Create your own custom map. MapChart. URL: https://mapchart.net/ [accessed 2022-01-19] 222",
    "[raw_reference] Allen J. Photoplethysmography and its application in clinical physiological measurement. Physiol Meas 2007;28(3):R1-39. [doi: 10.1088/0967-3334/28/3/R01] [Medline: 17322588] 223",
    "[raw_reference] Gandomi A, Haider M. Beyond the hype: big data concepts, methods, and analytics. Int J Inf Manage 2015;35(2):137-144. [doi: 10.1016/j.ijinfomgt.2014.10.007] 224",
    "[raw_reference] Wright SP, Hall Brown TS, Collier SR, Sandberg K. How consumer physical activity monitors could transform human physiology research. Am J Physiol Regul Integr Comp Physiol 2017;312(3):R358-R367. [doi: 10.1152/ajpregu.00349.2016] [Medline: 28052867] 225",
    "FREE Full text",
    "[raw_reference] Kristoffersson A, Lind\u00e9n M. A systematic review on the use of wearable body sensors for health monitoring: a qualitative synthesis. Sensors (Basel) 2020;20(5):15902 [FREE Full text] [doi: 10.3390/s20051502] [Medline: 32182907] 226",
    "FREE Full text Who are the world's biggest wearable tech buyers? Ipsos. 2018",
    "[raw_reference] Nelson BW, Low CA, Jacobson N, Are\u00e1n P, Torous J, Allen NB. Guidelines for wrist-worn consumer wearable assessment of heart rate in biobehavioral research. NPJ Digit Med 2020;3:90 [FREE Full text] [doi: 10.1038/s41746-020-0297-4] [Medline: 32613085] 227. Who are the world's biggest wearable tech buyers? Ipsos. 2018. URL: https://www.ipsos.com/en-ro/ who-are-worlds-biggest-wearable-tech-buyers [accessed 2021-05-20] 228",
    "[raw_reference] Vailshery LS. Number of connected wearable devices worldwide by region from 2015 to 2022. Statista. 2021. URL: https:/ /www.statista.com/statistics/490231/wearable-devices-worldwide-by-region/ [accessed 2021-05-20] 229. What is GDPR, the EU's new data protection law? General Data Protection Regulation.: European Union; 2018. URL: https://gdpr.eu/what-is-gdpr/ [accessed 2021-06-08] 230",
    "extramural scientific workforce",
    "[raw_reference] Blankertz A, Specht L. On regulation for data trusts: policy brief. Stiftung Neue Verantwortung. 2021. URL: https://www. stiftung-nv.de/en/publication/regulation-data-trusts [accessed 2021-07-06] 231. Populations underrepresented in the extramural scientific workforce. Scientific Workforce Diversity.: National Institutes of Health; 2020. URL: https://diversity.nih.gov/about-us/population-underrepresented [accessed 2021-10-13] 232",
    "[raw_reference] Evans GF, Shirk A, Muturi P, Soliman EZ. Feasibility of using mobile ECG recording technology to detect atrial fibrillation in low-resource settings. Glob Heart 2017;12(4):285-289. [doi: 10.1016/j.gheart.2016.12.003] [Medline: 28302547] 233",
    "FREE Full text",
    "[raw_reference] Hicks JL, Althoff T, Sosic R, Kuhar P, Bostjancic B, King AC, et al. Best practices for analyzing large-scale health data from wearables and smartphone apps. NPJ Digit Med 2019;2:45 [FREE Full text] [doi: 10.1038/s41746-019-0121-1] [Medline: 31304391] 234",
    "FREE Full text",
    "[raw_reference] Xu S, Rwei AY, Vwalika B, Chisembele MP, Stringer JS, Ginsburg AS, et al. Wireless skin sensors for physiological monitoring of infants in low-income and middle-income countries. Lancet Digit Health 2021;3(4):e266-e273 [FREE Full text] [doi: 10.1016/S2589-7500(21)00001-7] [Medline: 33640306] 235",
    "FREE Full text",
    "[raw_reference] Sauerborn R. A gaping research gap regarding the climate change impact on health in poor countries. Eur J Epidemiol 2017;32(9):855-856 [FREE Full text] [doi: 10.1007/s10654-017-0258-7] [Medline: 28573342] 236",
    "FREE Full text",
    "[raw_reference] Barteit S, Boudo V, Ouedraogo A, Zabr\u00e9 P, Ouremi L, Si\u00e9 A, et al. Feasibility, acceptability and validation of wearable devices for climate change and health research in the low-resource contexts of Burkina Faso and Kenya: study protocol. PLoS One 2021;16(9):e0257170 [FREE Full text] [doi: 10.1371/journal.pone.0257170] [Medline: 34591893] 237",
    "Effects of short-term physiological and psychological adaptation on summer thermal comfort of outdoor exercising people in China comments to author 12.11.21 revised version received 23.11.21; accepted 17.12.21; published 25.01.22 Please cite as",
    "[raw_reference] Huhn S, Axt M, Gunga HC, Maggioni MA, Munga S, Obor D, Si\u00e9 A, Boudo V, Bunker A, Sauerborn R, B\u00e4rnighausen T, Barteit S The Impact of Wearable Technologies in Health Research: Scoping Review JMIR Mhealth Uhealth 2022;10(1):e34384 URL: https://mhealth.jmir.org/2022/1/e34384 doi: 10.2196/34384 PMID:",
    "[raw_reference] \u00a9Sophie Huhn, Miriam Axt, Hanns-Christian Gunga, Martina Anna Maggioni, Stephen Munga, David Obor, Ali Si\u00e9, Valentin Boudo, Aditi Bunker, Rainer Sauerborn, Till B\u00e4rnighausen, Sandra Barteit. Originally published in JMIR mHealth and uHealth (https://mhealth.jmir.org), 25.01"
  ],
  "processing_software": {
    "GROBID": "0.8.2"
  }
}
