{
  "paper_id": "WTXMZ4SY",
  "title": "Digital health interventions Chronic medical diseases Diabetes Cancer Pain Heart disease",
  "abstract": "Chronic medical conditions are increasingly common and associated with a high burden for persons affected by them. Digital health interventions might be a viable way to support persons with a chronic illness in their coping and self-management. The present special issue's editorial on digital health interventions in chronic medical conditions summarizes core findings and discusses next steps needed to further the field while avoiding to reinvent the wheel, thereby elaborating on four topics extracted from the special issue's articles: 1) Needs assessment and digital intervention development, 2) Efficacy and (cost-)effectiveness, 3) Dissemination and implementation research: reach and engagement as well as 4) next generation of digital interventions.",
  "year": 2014,
  "date": "2014",
  "authors": [
    {
      "name": "Harald Baumeister",
      "email": "harald.baumeister@uni-ulm.de",
      "affiliation": {
        "organization": "Department of Clinical Psychology and Psychotherapy",
        "department": "Department of Clinical Psychology and Psychotherapy",
        "institution": "Ulm University",
        "address": "Germany"
      }
    },
    {
      "name": "David Ebert",
      "affiliation": {
        "organization": "Psychology and Digital Mental Health Care",
        "department": "Psychology and Digital Mental Health Care",
        "institution": "Technical University of Munich",
        "address": "Germany"
      }
    },
    {
      "name": "Frank Snoek",
      "affiliation": {
        "organization": "Department of Clinical Psychology and Psychotherapy",
        "department": "Department of Clinical Psychology and Psychotherapy",
        "institution": "Amsterdam University Medical Centers",
        "address": "Amsterdam, the Netherlands"
      }
    },
    {
      "affiliation": {
        "organization": "Institute of Psychology and Education",
        "department": "Institute of Psychology and Education",
        "institution": "Ulm University",
        "address": "Lise-Meitner-Stra\u00dfe 16, D-89081, Ulm, Germany"
      }
    }
  ],
  "doi": "10.1016/j.diabres.2014.04.031",
  "md5": "9A617E497DACDAEC83803251B7971620",
  "publication": {
    "journal": "Internet Interv",
    "journal_inferred": true
  },
  "sections": [
    {
      "text": "Chronic medical conditions such as coronary heart disease, cancer, diabetes, asthma and arthritis are increasingly common and associated with a high burden for persons affected by them. As noted by  Corbin and Strauss (1985) , managing a chronic illness involves 'three lines of work': illness work, everyday life work, and biographical work. Persons with chronic medical conditions are confronted with a multitude of disease (self-)management challenges such as adhering to complex and often ambivalent treatment plans over a long period of time, coping with symptoms, functional limitations and treatment side-effects, as well as dealing with social issues (e.g. stigma, role functioning) and an increased risk for mental health problems such as depression and anxiety  (H\u00e4rter et al., 2007; Petrie and Jones, 2019) .\n\nDigital health interventions might be a viable way to support persons with a chronic illness in their coping and self-management and achieve optimal health outcomes, both medical and psychological  (Bendig et al., 2018) . Moreover, such approaches allow not only to be tailored to the specific characteristics of individuals with medical conditions, but also to be attuned to the needs of persons at different stages of the disease trajectory, e.g. (co)-treatment, after-care and palliative care. While there is already substantial evidence in the area of digital interventions in the field of mental health, there is still much to learn about the needs and best way of providing digital interventions for people with medical conditions  (Ebert et al., 2018) .\n\nThe present special issue provides a series of fourteen studies in medical conditions, the majority of which can be classified as in the early translational research stage of needs assessment and intervention development  (Blaney et al., 2021; Bonnert et al., 2021; Carolan-Olah et al., 2021; Geirhos et al., 2021; Mellerg\u00e5rd et al., 2021; Muijs et al., 2021; Nap-van der Vlist et al., 2021; Verkleij et al., 2021) . A few studies report on the efficacy and effectiveness of digital interventions  (Bendig et al., 2021; Domhardt et al., 2021b; Terhorst et al., 2021; Terpstra et al., 2021; van der Hout et al., 2021) , while two studies focus on the next development stage of digital interventions, aiming for personalisation and adaptiveness  (Harnas et al., 2021; Nap-van der Vlist et al., 2021) . The studies target a broad range of chronic medical conditions, including diabetes  (Geirhos et al., 2021; Mellerg\u00e5rd et al., 2021; Muijs et al., 2021) , cancer  (Harnas et al., 2021; Nap-van der Vlist et al., 2021; van der Hout et al., 2021) , arthritis and pain  (Blaney et al., 2021; Geirhos et al., 2021; Terhorst et al., 2021; Terpstra et al., 2021) , cystic fibrosis  (Geirhos et al., 2021; Nap-van der Vlist et al., 2021; Verkleij et al., 2021) , asthma  (Bonnert et al., 2021)  and coronary artery disease  (Bendig et al., 2021)  as well as chronic medical conditions in general  (Domhardt et al., 2021b)  in adults as well as youth  (Domhardt et al., 2021b; Geirhos et al., 2021; Nap-van der Vlist et al., 2021) .\n\nThis special issue provides us the opportunity to reflect on the current status of digital health in medical conditions in the broader context of digital interventions and identify the next steps needed to further the field while avoiding to reinvent the wheel, with four extracted interdependent categories (Fig.  1"
    },
    {
      "title": "1.. Needs assessment and digital intervention development",
      "text": "The substantial number of papers on need assessment and intervention development in this special issue appears indicative for the field of digital health interventions in people with chronic medical conditions being still in its early stage. While there are clearly overarching psychosocial themes across diseases, it is important to identify the specific needs, challenges and preferences of specific patient groups as they may vary across conditions and severity stage of disease. For example people Contents lists available at ScienceDirect Internet Interventions journal homepage:  www.elsevier.com/locate/invent https://doi.org/10.1016/j.invent.2021.100457 with diabetes mellitus  (Geirhos et al., 2021; Mellerg\u00e5rd et al., 2021)  might be particularly interested in interventions supporting their longterm daily struggle, while those with a progressive condition or in palliative care phase  (Capurro et al., 2014; Verkleij et al., 2021)  may have a demand for meaning-centered interventions, related to coping with limited life-expectancy, dying or struggling with the help-and hopelessness in a not yet always very supportive, personalised health care system. As exemplified by  Carolan-Olah et al. (2021) , interventions should also be attuned to the demands and preferences of the target population, in socio-demographic and cultural terms, next to the disease-specific needs. Interventions are to be optimized for people with a medical condition with a migration background, low socioeconomic status and different educational levels. In this context, it seems recommendable to build interventions on existing knowledge gathered in the past two decades of digital intervention development, that have led to intervention development guidelines and recommendations from both a clinical and a technological perspective  (Edwards-Stewart et al., 2019; Holfelder et al., 2021; Karekla et al., 2019; Michie et al., 2017) ."
    },
    {
      "title": "2.. Efficacy and (cost-)effectiveness",
      "text": "Once needs are assessed and the interventions developed, they usually pass the translational process of clinical testing with feasibility and pilot trials followed by efficacy and (cost-)effectiveness trials. A few aspects warrant special attention in order to make a difference in the field of digital interventions for people with chronic medical conditions. First, interventions might not work the same across disease conditions and at different stages of the disease and treatment. As one example,  Bendig et al. (2021)  reported on a failed trial examining an intervention for depression in people with coronary artery disease, while we do know that this kind of intervention can work e.g. for people with diabetes  (Nobis et al., 2018; Nobis et al., 2015; van Bastelaar et al., 2008) . However, two other trials, one on the prevention of depression in patients with back pain  (Sander et al., 2020)  and one on the treatment of depression in patients with back pain  (Baumeister et al., 2021) , using almost the same intervention highlighted that we still need to take a closer look at what works for whom at which stage of disease. While the prevention trial, targeting individuals with chronic pain and subclinical symptoms of depression, resulted in a more than impressive hazard ratio of 0.48, i.e. onset of depression was halved within a period of twelve months  (Sander et al., 2020) , the treatment trial, including only people with a diagnosed Major Depression Disorder, provided a null-finding, at least for the primary outcome  (Baumeister et al., 2021) , despite the fact that the efficacy of digital depression interventions in the general population is well established  (K\u00f6nigbauer et al., 2017) . This finding also supports the assumption that evidence generated in the general population can not necessarily be simply generalized to chronic medical populations.\n\nThus, digital interventions for depression in chronic medical conditions can work and make a difference, but we cannot assume they work for all people at any stage of disease with any intervention, regardless of the specific active components and technological approaches. More research is warranted to deepen our understanding of the differential effectiveness of interventions by means of moderator analyses as estimator for personalised intervention provision as well as studies on the active components and the mechanisms of change  (Breitborde et al., 2010) . As one example, it has been shown that people with chronic pain are more likely to benefit from an Acceptance and Commitment Therapy (ACT) based pain intervention in case of initially lower psychological flexibility  (Probst et al., 2018) , and psychological flexibility has been verified as mechanism of change  (Lin et al., 2018) . Improving our knowledge on the moderators, causal factors and mechanisms of change can iteratively inform future intervention development to optimize (digital) health care  (Domhardt et al., 2021a) ."
    },
    {
      "title": "3.. Dissemination and implementation research: reach and engagement",
      "text": "Dissemination and implementation research should accompany our efforts to inform health care policy about the effectiveness and potential of digital interventions in real world settings  (Etzelmueller et al., 2020; Gaebel et al., 2021; Titov et al., 2018) . A main challenge in this context is reach, i.e. reaching the target population at large and facilitating acceptance towards digital health interventions  (Baumeister et al., 2014; Baumeister et al., 2015; Baumeister et al., 2020) , as well as reaching those not yet well covered by our health care systems, thereby aiming to reduce health care disparities  (Wasserman et al., 2019) . A second topic of interest is engagement, i.e. scientific evidence on how digital health interventions are used in real word settings outside the research context. Fleming et al. (2018) highlighted that completion or sustained use of Needs Assessment and Interven\u019fon Development Dissemina\u019fon and Implementa\u019fon Efficacy and (Cost) Effec\u019fveness Next Genera\u019fon Digital Health Interven\u019fons Pa\u019fent and Health Care Provider Perspec\u019fve Interven\u019fon Development Guidelines Pace and Efficiency Theory Basis Regulatories Efficacy RCTs (Cost-) Effec\u019fveness RCTs Tes\u019fng different Implementa\u019fon Models Differen\u019fal Indica\u019fon and Mechanisms of Change Dismantling and Addi\u019fve RCT design Reach Engagement Real-World Effec\u019fveness Con\u019fnous Quality Assurance Just-in-Time Interven\u019fons Persuasive Design op\u019fmized Interven\u019fons AI-based Chatbots Complex (blended) Internet Interven\u019fons Chronic Medical Condi\u019fons Across the Lifespan Health Care Promo\u019fon | Preven\u019fon | Treatment A\u014cercare | Recurrence Preven\u019fon | Life Companions | Pallia\u019fve Care Fig. 1. Digital health interventions in people with chronic medical conditions. self-help interventions for depression, low mood or anxiety provided in real-world was only registered for 0.5% to 28.6% of health intervention users. Similarly, Baumel et al. (2019) calculated that there is a research bias regarding engagement estimates with intervention usage being four times higher in trials compared with the same interventions in realworld. Therefore, the report by van der Hout et al. (2021) in this special issue on reasons for not reaching or engaging cancer patients regarding the provided digital intervention is of utmost relevance, underscoring the need to better understand ways of implementing evidence based health care delivery models. 4. Next generation of digital health interventions Information from the translational process of developing and evaluating digital health interventions for people with chronic medical conditions can help to further improve interventions, thereby taking the rapid technological innovation cycle into account. Next generation digital health interventions for people with chronic medical conditions will not only be informed by formative feedback from studies alongside the translational process, but also by intervention designs aiming to provide personalised and adaptive interventions such as Just-in-timeadaptive interventions (i.e. personalised interventions provided at a moment of opportunity; (Nahum-Shani et al., 2017)) or AI-based medical and psychotherapeutic chatbots  (Bendig et al., 2019; Pryss et al., 2019) . Similarly, next generation digital health interventions can and should build more thoroughly on persuasive design principles in order to improve intervention engagement -one of the well-established barriers to successful intervention designs  (Baumeister et al., 2019) . The complexity of this kind of technologically enhanced interventions is nicely illustrated by  Harnas et al. (2021)  in this special issue, who provide a case report series on personalizing cognitive behavioural therapy for cancer-related fatigue by means of ecological momentary assessments. Another challenge is the development of digital interventions fit for people with medical conditions as integral part of often complex health care services models and disease management programs."
    },
    {
      "title": "5.. Conclusion",
      "text": "The present special issue clearly illustrates the potential as well the challenges that we face on the road to exploit the full potential of digital intervention for people with a chronic medical condition. We commend the many colleagues who have contributed to this special issue and provided much needed evidence to add to this developing field of research. We hope it will stimulate future research within and across medical conditions to provide answers on how digital interventions can make a difference to help improve the lives of people with chronic medical conditionswithin and beyond established health care services."
    },
    {
      "text": "): 1. Needs Assessment and Digital Intervention Development 2. Efficacy and (Cost-)Effectiveness 3. Dissemination and Implementation Research: Reach and Engagement 4. Next Generation of Digital Interventions"
    }
  ],
  "references": [
    {
      "title": "Impact of an acceptance facilitating intervention on diabetes patients' acceptance of Internet-based interventions for depression: a randomized controlled trial",
      "authors": [
        "H Baumeister",
        "L Nowoczin",
        "J Lin",
        "H Seifferth",
        "J Seufert",
        "K Laubner",
        "D Ebert"
      ],
      "year": 2014,
      "doi": "10.1016/j.diabres.2014.04.031",
      "journal": "Diabetes Res. Clin. Pract",
      "volume": "105",
      "raw": "Impact of an acceptance facilitating intervention on diabetes patients' acceptance of Internet-based interventions for depression: a randomized controlled trial \n\t\t \n\t\t\t H Baumeister \n\t\t \n\t\t \n\t\t\t L Nowoczin \n\t\t \n\t\t \n\t\t\t J Lin \n\t\t \n\t\t \n\t\t\t H Seifferth \n\t\t \n\t\t \n\t\t\t J Seufert \n\t\t \n\t\t \n\t\t\t K Laubner \n\t\t \n\t\t \n\t\t\t D D Ebert \n\t\t \n\t\t 10.1016/j.diabres.2014.04.031 \n\t\t \n\t \n\t \n\t\t Diabetes Res. Clin. Pract \n\t\t \n\t\t\t 105 \n\t\t\t 2014 \n\t\t \n\t \n\t Baumeister, H., Nowoczin, L., Lin, J., Seifferth, H., Seufert, J., Laubner, K., Ebert, D.D., 2014. Impact of an acceptance facilitating intervention on diabetes patients' acceptance of Internet-based interventions for depression: a randomized controlled trial. Diabetes Res. Clin. Pract. 105. https://doi.org/10.1016/j.diabres.2014.04.031."
    },
    {
      "title": "Impact of an acceptance facilitating intervention on patients' acceptance of Internet-based pain interventions: a randomized controlled trial",
      "authors": [
        "H Baumeister",
        "H Seifferth",
        "J Lin",
        "L Nowoczin",
        "M Luking",
        "D Ebert"
      ],
      "year": 2015,
      "doi": "10.1097/AJP.0000000000000118PM",
      "journal": "Clin. J. Pain",
      "volume": "31",
      "raw": "Impact of an acceptance facilitating intervention on patients' acceptance of Internet-based pain interventions: a randomized controlled trial \n\t\t \n\t\t\t H Baumeister \n\t\t \n\t\t \n\t\t\t H Seifferth \n\t\t \n\t\t \n\t\t\t J Lin \n\t\t \n\t\t \n\t\t\t L Nowoczin \n\t\t \n\t\t \n\t\t\t M Luking \n\t\t \n\t\t \n\t\t\t D Ebert \n\t\t \n\t\t 10.1097/AJP.0000000000000118PM \n\t\t \n\t \n\t \n\t\t Clin. J. Pain \n\t\t \n\t\t\t 31 \n\t\t\t \n\t\t\t 2015 \n\t\t \n\t \n\t Baumeister, H., Seifferth, H., Lin, J., Nowoczin, L., Luking, M., Ebert, D., 2015. Impact of an acceptance facilitating intervention on patients' acceptance of Internet-based pain interventions: a randomized controlled trial. Clin. J. Pain 31, 528-535. https:// doi.org/10.1097/AJP.0000000000000118PM."
    },
    {
      "title": "Persuasive e-Health Design for Behavior Change",
      "authors": [
        "H Baumeister",
        "R Kraft",
        "A Baumel",
        "R Pryss",
        "E.-M Messner"
      ],
      "year": 2019,
      "doi": "10.1007/978-3-030-31620-4_17",
      "raw": "Persuasive e-Health Design for Behavior Change \n\t\t \n\t\t\t H Baumeister \n\t\t \n\t\t \n\t\t\t R Kraft \n\t\t \n\t\t \n\t\t\t A Baumel \n\t\t \n\t\t \n\t\t\t R Pryss \n\t\t \n\t\t \n\t\t\t E.-M Messner \n\t\t \n\t\t 10.1007/978-3-030-31620-4_17 \n\t\t \n\t\t \n\t\t\t 2019 \n\t\t\t \n\t\t \n\t \n\t Baumeister, H., Kraft, R., Baumel, A., Pryss, R., Messner, E.-M., 2019. Persuasive e- Health Design for Behavior Change, pp. 261-276. https://doi.org/10.1007/978-3- 030-31620-4_17."
    },
    {
      "title": "Impact of an acceptance facilitating intervention on psychotherapists' acceptance of blended therapy",
      "authors": [
        "H Baumeister",
        "Y Terhorst",
        "C Gr\u00e4ssle",
        "M Freudenstein",
        "R N\u00fcbling",
        "D Ebert"
      ],
      "year": 2020,
      "doi": "10.1371/journal.pone.0236995",
      "journal": "PLoS One",
      "volume": "15",
      "pages": "236995",
      "raw": "Impact of an acceptance facilitating intervention on psychotherapists' acceptance of blended therapy \n\t\t \n\t\t\t H Baumeister \n\t\t \n\t\t \n\t\t\t Y Terhorst \n\t\t \n\t\t \n\t\t\t C Gr\u00e4ssle \n\t\t \n\t\t \n\t\t\t M Freudenstein \n\t\t \n\t\t \n\t\t\t R N\u00fcbling \n\t\t \n\t\t \n\t\t\t D D Ebert \n\t\t \n\t\t 10.1371/journal.pone.0236995 \n\t\t \n\t \n\t \n\t\t PLoS One \n\t\t \n\t\t\t 15 \n\t\t\t 236995 \n\t\t\t 2020 \n\t\t \n\t \n\t Baumeister, H., Terhorst, Y., Gr\u00e4ssle, C., Freudenstein, M., N\u00fcbling, R., Ebert, D.D., 2020. Impact of an acceptance facilitating intervention on psychotherapists' acceptance of blended therapy. PLoS One 15, e0236995. https://doi.org/10.1371/journal. pone.0236995."
    },
    {
      "title": "Effectiveness of a guided Internet-and Mobile-based intervention for patients with chronic back pain and depression (WARD-BP): a multicenter, pragmatic randomized controlled trial",
      "authors": [
        "H Baumeister",
        "S Paganini",
        "L Sander",
        "J Lin",
        "S Schlicker",
        "Y Terhorst",
        "M Moshagen",
        "J Bengel",
        "D Lehr",
        "D Ebert"
      ],
      "year": 2021,
      "doi": "10.1159/000511881",
      "journal": "Psychother. Psychosom",
      "volume": "90",
      "raw": "Effectiveness of a guided Internet-and Mobile-based intervention for patients with chronic back pain and depression (WARD-BP): a multicenter, pragmatic randomized controlled trial \n\t\t \n\t\t\t H Baumeister \n\t\t \n\t\t \n\t\t\t S Paganini \n\t\t \n\t\t \n\t\t\t L B Sander \n\t\t \n\t\t \n\t\t\t J Lin \n\t\t \n\t\t \n\t\t\t S Schlicker \n\t\t \n\t\t \n\t\t\t Y Terhorst \n\t\t \n\t\t \n\t\t\t M Moshagen \n\t\t \n\t\t \n\t\t\t J Bengel \n\t\t \n\t\t \n\t\t\t D Lehr \n\t\t \n\t\t \n\t\t\t D D Ebert \n\t\t \n\t\t 10.1159/000511881 \n\t\t \n\t \n\t \n\t\t Psychother. Psychosom \n\t\t \n\t\t\t 90 \n\t\t\t \n\t\t\t 2021 \n\t\t \n\t \n\t Baumeister, H., Paganini, S., Sander, L.B., Lin, J., Schlicker, S., Terhorst, Y., Moshagen, M., Bengel, J., Lehr, D., Ebert, D.D., 2021. Effectiveness of a guided Internet-and Mobile-based intervention for patients with chronic back pain and depression (WARD-BP): a multicenter, pragmatic randomized controlled trial. Psy- chother. Psychosom. 90, 255-268. https://doi.org/10.1159/000511881."
    },
    {
      "title": "Is there a trial bias impacting user engagement with unguided e-mental health interventions? A systematic comparison of published reports and real-world usage of the same programs",
      "authors": [
        "A Baumel",
        "S Edan",
        "J Kane"
      ],
      "year": 2019,
      "doi": "10.1093/tbm/ibz147",
      "journal": "Transl. Behav. Med",
      "volume": "9",
      "raw": "Is there a trial bias impacting user engagement with unguided e-mental health interventions? A systematic comparison of published reports and real-world usage of the same programs \n\t\t \n\t\t\t A Baumel \n\t\t \n\t\t \n\t\t\t S Edan \n\t\t \n\t\t \n\t\t\t J M Kane \n\t\t \n\t\t 10.1093/tbm/ibz147 \n\t\t \n\t \n\t \n\t\t Transl. Behav. Med \n\t\t \n\t\t\t 9 \n\t\t\t \n\t\t\t 2019 \n\t\t \n\t \n\t Baumel, A., Edan, S., Kane, J.M., 2019. Is there a trial bias impacting user engagement with unguided e-mental health interventions? A systematic comparison of published reports and real-world usage of the same programs. Transl. Behav. Med. 9, 1020-1033. https://doi.org/10.1093/tbm/ibz147."
    },
    {
      "title": "Internet-and mobile based psychological interventions in people with chronic medical conditions",
      "authors": [
        "E Bendig",
        "N Bauerei\u00df",
        "D Ebert",
        "F Snoek",
        "G Andersson",
        "H Baumeister"
      ],
      "year": 2018,
      "doi": "10.3238/arztebl.2018.0659",
      "journal": "Dtsch. Aerzteblatt Int",
      "volume": "115",
      "raw": "Internet-and mobile based psychological interventions in people with chronic medical conditions \n\t\t \n\t\t\t E Bendig \n\t\t \n\t\t \n\t\t\t N Bauerei\u00df \n\t\t \n\t\t \n\t\t\t D D Ebert \n\t\t \n\t\t \n\t\t\t F Snoek \n\t\t \n\t\t \n\t\t\t G Andersson \n\t\t \n\t\t \n\t\t\t H Baumeister \n\t\t \n\t\t 10.3238/arztebl.2018.0659 \n\t\t \n\t \n\t \n\t\t Dtsch. Aerzteblatt Int \n\t\t \n\t\t\t 115 \n\t\t\t \n\t\t\t 2018 \n\t\t \n\t \n\t Bendig, E., Bauerei\u00df, N., Ebert, D.D., Snoek, F., Andersson, G., Baumeister, H., 2018. Internet-and mobile based psychological interventions in people with chronic medical conditions. Dtsch. Aerzteblatt Int. 115, 659-665. https://doi.org/10.3238/ arztebl.2018.0659."
    },
    {
      "title": "Next generation: chatbots in clinical psychology and psychotherapy to foster mental healtha scoping review",
      "authors": [
        "E Bendig",
        "B Erb",
        "L Schulze-Thuesing",
        "H Baumeister"
      ],
      "year": 2019,
      "doi": "10.1159/000499492",
      "journal": "Verhaltenstherapie",
      "raw": "Next generation: chatbots in clinical psychology and psychotherapy to foster mental healtha scoping review \n\t\t \n\t\t\t E Bendig \n\t\t \n\t\t \n\t\t\t B Erb \n\t\t \n\t\t \n\t\t\t L Schulze-Thuesing \n\t\t \n\t\t \n\t\t\t H Baumeister \n\t\t \n\t\t 10.1159/000499492 \n\t\t \n\t \n\t \n\t\t Verhaltenstherapie \n\t\t \n\t\t\t \n\t\t\t 2019 \n\t\t \n\t \n\t Bendig, E., Erb, B., Schulze-Thuesing, L., Baumeister, H., 2019. Next generation: chatbots in clinical psychology and psychotherapy to foster mental health -a scoping review. Verhaltenstherapie 1-15. https://doi.org/10.1159/000499492."
    },
    {
      "title": "Lessons learned from an attempted randomized-controlled feasibility trial on \"WIDeCAD\" -an internet-based depression treatment for people living with coronary artery disease (CAD)",
      "authors": [
        "E Bendig",
        "N Bauerei\u00df",
        "C Buntrock",
        "M Habibovi\u0107",
        "D Ebert",
        "H Baumeister"
      ],
      "year": 2021,
      "doi": "10.1016/j.invent.2021.100375",
      "journal": "Internet Interv",
      "volume": "24",
      "pages": "100375",
      "raw": "Lessons learned from an attempted randomized-controlled feasibility trial on \"WIDeCAD\" -an internet-based depression treatment for people living with coronary artery disease (CAD) \n\t\t \n\t\t\t E Bendig \n\t\t \n\t\t \n\t\t\t N Bauerei\u00df \n\t\t \n\t\t \n\t\t\t C Buntrock \n\t\t \n\t\t \n\t\t\t M Habibovi\u0107 \n\t\t \n\t\t \n\t\t\t D D Ebert \n\t\t \n\t\t \n\t\t\t H Baumeister \n\t\t \n\t\t 10.1016/j.invent.2021.100375 \n\t\t \n\t \n\t \n\t\t Internet Interv \n\t\t \n\t\t\t 24 \n\t\t\t 100375 \n\t\t\t 2021 \n\t\t \n\t \n\t Bendig, E., Bauerei\u00df, N., Buntrock, C., Habibovi\u0107, M., Ebert, D.D., Baumeister, H., 2021. Lessons learned from an attempted randomized-controlled feasibility trial on \"WIDeCAD\" -an internet-based depression treatment for people living with coronary artery disease (CAD). Internet Interv. 24, 100375. https://doi.org/10.1016/j. invent.2021.100375."
    },
    {
      "title": "Support for a non-therapist assisted, Internet-based cognitive-behavioral therapy (iCBT) intervention for mental health in rheumatoid arthritis patients",
      "authors": [
        "C Blaney",
        "C Hitchon",
        "R Marrie",
        "C Mackenzie",
        "P Holens",
        "R El-Gabalawy"
      ],
      "year": 2021,
      "doi": "10.1016/j.invent.2021.100385",
      "journal": "Internet Interv",
      "volume": "24",
      "pages": "100385",
      "raw": "Support for a non-therapist assisted, Internet-based cognitive-behavioral therapy (iCBT) intervention for mental health in rheumatoid arthritis patients \n\t\t \n\t\t\t C Blaney \n\t\t \n\t\t \n\t\t\t C A Hitchon \n\t\t \n\t\t \n\t\t\t R A Marrie \n\t\t \n\t\t \n\t\t\t C Mackenzie \n\t\t \n\t\t \n\t\t\t P Holens \n\t\t \n\t\t \n\t\t\t R El-Gabalawy \n\t\t \n\t\t 10.1016/j.invent.2021.100385 \n\t\t \n\t \n\t \n\t\t Internet Interv \n\t\t \n\t\t\t 24 \n\t\t\t 100385 \n\t\t\t 2021 \n\t\t \n\t \n\t Blaney, C., Hitchon, C.A., Marrie, R.A., Mackenzie, C., Holens, P., El-Gabalawy, R., 2021. Support for a non-therapist assisted, Internet-based cognitive-behavioral therapy (iCBT) intervention for mental health in rheumatoid arthritis patients. Internet Interv. 24, 100385. https://doi.org/10.1016/j.invent.2021.100385."
    },
    {
      "title": "Targeting excessive avoidance behavior to reduce anxiety related to asthma: a feasibility study of an exposure-based treatment delivered online",
      "authors": [
        "M Bonnert",
        "J S\u00e4rnholm",
        "E Andersson",
        "S Bergstr\u00f6m",
        "M Lalouni",
        "C Lundholm",
        "E Serlachius",
        "C Almqvist"
      ],
      "year": 2021,
      "doi": "10.1016/j.invent.2021.100415",
      "journal": "Internet Interv",
      "volume": "25",
      "pages": "100415",
      "raw": "Targeting excessive avoidance behavior to reduce anxiety related to asthma: a feasibility study of an exposure-based treatment delivered online \n\t\t \n\t\t\t M Bonnert \n\t\t \n\t\t \n\t\t\t J S\u00e4rnholm \n\t\t \n\t\t \n\t\t\t E Andersson \n\t\t \n\t\t \n\t\t\t S E Bergstr\u00f6m \n\t\t \n\t\t \n\t\t\t M Lalouni \n\t\t \n\t\t \n\t\t\t C Lundholm \n\t\t \n\t\t \n\t\t\t E Serlachius \n\t\t \n\t\t \n\t\t\t C Almqvist \n\t\t \n\t\t 10.1016/j.invent.2021.100415 \n\t\t \n\t \n\t \n\t\t Internet Interv \n\t\t \n\t\t\t 25 \n\t\t\t 100415 \n\t\t\t 2021 \n\t\t \n\t \n\t Bonnert, M., S\u00e4rnholm, J., Andersson, E., Bergstr\u00f6m, S.E., Lalouni, M., Lundholm, C., Serlachius, E., Almqvist, C., 2021. Targeting excessive avoidance behavior to reduce anxiety related to asthma: a feasibility study of an exposure-based treatment deliv- ered online. Internet Interv. 25, 100415. https://doi.org/10.1016/j. invent.2021.100415."
    },
    {
      "title": "Mediators and moderators in early intervention research",
      "authors": [
        "N Breitborde",
        "V Srihari",
        "J Pollard",
        "D Addington",
        "S Woods"
      ],
      "year": 2010,
      "doi": "10.1111/j.1751-7893.2010.00177.x",
      "journal": "Early Interv. Psychiatry",
      "volume": "4",
      "raw": "Mediators and moderators in early intervention research \n\t\t \n\t\t\t N J K Breitborde \n\t\t \n\t\t \n\t\t\t V H Srihari \n\t\t \n\t\t \n\t\t\t J M Pollard \n\t\t \n\t\t \n\t\t\t D N Addington \n\t\t \n\t\t \n\t\t\t S W Woods \n\t\t \n\t\t 10.1111/j.1751-7893.2010.00177.x \n\t\t \n\t \n\t \n\t\t Early Interv. Psychiatry \n\t\t \n\t\t\t 4 \n\t\t\t \n\t\t\t 2010 \n\t\t \n\t \n\t Breitborde, N.J.K., Srihari, V.H., Pollard, J.M., Addington, D.N., Woods, S.W., 2010. Mediators and moderators in early intervention research. Early Interv. Psychiatry 4, 143-152. https://doi.org/10.1111/j.1751-7893.2010.00177.x."
    },
    {
      "title": "Effectiveness of ehealth interventions and information needs in palliative care: a systematic literature review",
      "authors": [
        "D Capurro",
        "M Ganzinger",
        "J Perez-Lu",
        "P Knaup"
      ],
      "year": 2014,
      "doi": "10.2196/jmir.2812",
      "journal": "J. Med. Internet Res",
      "volume": "16",
      "pages": "2812",
      "raw": "Effectiveness of ehealth interventions and information needs in palliative care: a systematic literature review \n\t\t \n\t\t\t D Capurro \n\t\t \n\t\t \n\t\t\t M Ganzinger \n\t\t \n\t\t \n\t\t\t J Perez-Lu \n\t\t \n\t\t \n\t\t\t P Knaup \n\t\t \n\t\t 10.2196/jmir.2812 \n\t\t \n\t \n\t \n\t\t J. Med. Internet Res \n\t\t \n\t\t\t 16 \n\t\t\t 2812 \n\t\t\t 2014 \n\t\t \n\t \n\t Capurro, D., Ganzinger, M., Perez-Lu, J., Knaup, P., 2014. Effectiveness of ehealth in- terventions and information needs in palliative care: a systematic literature review. J. Med. Internet Res. 16, e2812 https://doi.org/10.2196/jmir.2812."
    },
    {
      "title": "Overview of a new eHealth intervention to promote healthy eating and exercise in pregnancy: initial user responses and acceptability",
      "authors": [
        "M Carolan-Olah",
        "V Vasilevski",
        "C Nagle",
        "N Stepto"
      ],
      "year": 2021,
      "doi": "10.1016/j.invent.2021.100393",
      "journal": "Internet Interv",
      "volume": "25",
      "pages": "100393",
      "raw": "Overview of a new eHealth intervention to promote healthy eating and exercise in pregnancy: initial user responses and acceptability \n\t\t \n\t\t\t M Carolan-Olah \n\t\t \n\t\t \n\t\t\t V Vasilevski \n\t\t \n\t\t \n\t\t\t C Nagle \n\t\t \n\t\t \n\t\t\t N Stepto \n\t\t \n\t\t 10.1016/j.invent.2021.100393 \n\t\t \n\t \n\t \n\t\t Internet Interv \n\t\t \n\t\t\t 25 \n\t\t\t 100393 \n\t\t\t 2021 \n\t\t \n\t \n\t Carolan-Olah, M., Vasilevski, V., Nagle, C., Stepto, N., 2021. Overview of a new eHealth intervention to promote healthy eating and exercise in pregnancy: initial user re- sponses and acceptability. Internet Interv. 25, 100393. https://doi.org/10.1016/j. invent.2021.100393."
    },
    {
      "title": "Managing chronic illness at home: three lines of work",
      "authors": [
        "J Corbin",
        "A Strauss"
      ],
      "year": 1985,
      "doi": "10.1007/BF00989485",
      "journal": "Qual. Sociol",
      "volume": "8",
      "raw": "Managing chronic illness at home: three lines of work \n\t\t \n\t\t\t J Corbin \n\t\t \n\t\t \n\t\t\t A Strauss \n\t\t \n\t\t 10.1007/BF00989485 \n\t\t \n\t \n\t \n\t\t Qual. Sociol \n\t\t \n\t\t\t 8 \n\t\t\t \n\t\t\t 1985 \n\t\t \n\t \n\t Corbin, J., Strauss, A., 1985. Managing chronic illness at home: three lines of work. Qual. Sociol. 8, 224-247. https://doi.org/10.1007/BF00989485."
    },
    {
      "title": "More light? Opportunities and pitfalls in digitalized psychotherapy process research",
      "authors": [
        "M Domhardt",
        "P Cuijpers",
        "D Ebert",
        "H Baumeister"
      ],
      "year": 2021,
      "doi": "10.3389/fpsyg.2021.544129",
      "journal": "Front. Psychol",
      "volume": "12",
      "pages": "863",
      "raw": "More light? Opportunities and pitfalls in digitalized psychotherapy process research \n\t\t \n\t\t\t M Domhardt \n\t\t \n\t\t \n\t\t\t P Cuijpers \n\t\t \n\t\t \n\t\t\t D D Ebert \n\t\t \n\t\t \n\t\t\t H Baumeister \n\t\t \n\t\t 10.3389/fpsyg.2021.544129 \n\t\t \n\t \n\t \n\t\t Front. Psychol \n\t\t \n\t\t\t 12 \n\t\t\t 863 \n\t\t\t 2021 \n\t\t \n\t \n\t Domhardt, M., Cuijpers, P., Ebert, D.D., Baumeister, H., 2021a. More light? Opportu- nities and pitfalls in digitalized psychotherapy process research. Front. Psychol. 12, 863. https://doi.org/10.3389/fpsyg.2021.544129."
    },
    {
      "title": "Efficacy of digital health interventions in youth with chronic medical conditions: a meta-analysis",
      "authors": [
        "M Domhardt",
        "A Schr\u00f6der",
        "A Geirhos",
        "L Steubl",
        "H Baumeister"
      ],
      "year": 2021,
      "doi": "10.1016/j.invent.2021.100373",
      "journal": "Internet Interv",
      "raw": "Efficacy of digital health interventions in youth with chronic medical conditions: a meta-analysis \n\t\t \n\t\t\t M Domhardt \n\t\t \n\t\t \n\t\t\t A Schr\u00f6der \n\t\t \n\t\t \n\t\t\t A Geirhos \n\t\t \n\t\t \n\t\t\t L Steubl \n\t\t \n\t\t \n\t\t\t H Baumeister \n\t\t \n\t\t 10.1016/j.invent.2021.100373 \n\t\t \n\t \n\t \n\t\t Internet Interv \n\t\t \n\t\t\t 2021 \n\t\t \n\t \n\t Domhardt, M., Schr\u00f6der, A., Geirhos, A., Steubl, L., Baumeister, H., 2021b. Efficacy of digital health interventions in youth with chronic medical conditions: a meta-anal- ysis. Internet Interv. https://doi.org/10.1016/j.invent.2021.100373."
    },
    {
      "title": "Internet-and mobile-based psychological interventions: applications, efficacy, and potential for improving mental health. A report of the EFPA E-Health Taskforce",
      "authors": [
        "D Ebert",
        "T Van Daele",
        "T Nordgreen",
        "M Karekla",
        "A Compare",
        "C Zarbo",
        "A Brugnera",
        "S \u00d8verland",
        "G Trebbi",
        "K Jensen",
        "F Kaehlke",
        "H Baumeister"
      ],
      "year": 2018,
      "doi": "10.1027/1016-9040/a000318",
      "journal": "Eur. Psychol",
      "volume": "23",
      "raw": "Internet-and mobile-based psychological interventions: applications, efficacy, and potential for improving mental health. A report of the EFPA E-Health Taskforce \n\t\t \n\t\t\t D D Ebert \n\t\t \n\t\t \n\t\t\t T Van Daele \n\t\t \n\t\t \n\t\t\t T Nordgreen \n\t\t \n\t\t \n\t\t\t M Karekla \n\t\t \n\t\t \n\t\t\t A Compare \n\t\t \n\t\t \n\t\t\t C Zarbo \n\t\t \n\t\t \n\t\t\t A Brugnera \n\t\t \n\t\t \n\t\t\t S \u00d8verland \n\t\t \n\t\t \n\t\t\t G Trebbi \n\t\t \n\t\t \n\t\t\t K L Jensen \n\t\t \n\t\t \n\t\t\t F Kaehlke \n\t\t \n\t\t \n\t\t\t H Baumeister \n\t\t \n\t\t 10.1027/1016-9040/a000318 \n\t\t \n\t \n\t \n\t\t Eur. Psychol \n\t\t \n\t\t\t 23 \n\t\t\t \n\t\t\t 2018 \n\t\t \n\t \n\t Ebert, D.D., Van Daele, T., Nordgreen, T., Karekla, M., Compare, A., Zarbo, C., Brugnera, A., \u00d8verland, S., Trebbi, G., Jensen, K.L., Kaehlke, F., Baumeister, H., 2018. Internet-and mobile-based psychological interventions: applications, efficacy, and potential for improving mental health. A report of the EFPA E-Health Taskforce. Eur. Psychol. 23, 167-187. https://doi.org/10.1027/1016-9040/a000318."
    },
    {
      "title": "Mobile applications for client use: ethical and legal considerations",
      "authors": [
        "A Edwards-Stewart",
        "C Alexander",
        "C Armstrong",
        "T Hoyt",
        "W O'donohue"
      ],
      "year": 2019,
      "doi": "10.1037/ser0000321",
      "journal": "Psychol. Serv",
      "volume": "16",
      "raw": "Mobile applications for client use: ethical and legal considerations \n\t\t \n\t\t\t A Edwards-Stewart \n\t\t \n\t\t \n\t\t\t C Alexander \n\t\t \n\t\t \n\t\t\t C M Armstrong \n\t\t \n\t\t \n\t\t\t T Hoyt \n\t\t \n\t\t \n\t\t\t W O'donohue \n\t\t \n\t\t 10.1037/ser0000321 \n\t\t \n\t \n\t \n\t\t Psychol. Serv \n\t\t \n\t\t\t 16 \n\t\t\t \n\t\t\t 2019 \n\t\t \n\t \n\t Edwards-Stewart, A., Alexander, C., Armstrong, C.M., Hoyt, T., O'Donohue, W., 2019. Mobile applications for client use: ethical and legal considerations. Psychol. Serv. 16, 281-285. https://doi.org/10.1037/ser0000321."
    },
    {
      "title": "Effects of internet-based cognitive behavioral therapy in routine care for adults in treatment for depression and anxiety: systematic review and meta-analysis",
      "authors": [
        "A Etzelmueller",
        "C Vis",
        "E Karyotaki",
        "H Baumeister",
        "N Titov",
        "M Berking",
        "P Cuijpers",
        "H Riper",
        "D Ebert"
      ],
      "year": 2020,
      "doi": "10.2196/18100",
      "journal": "J. Med. Internet Res",
      "raw": "Effects of internet-based cognitive behavioral therapy in routine care for adults in treatment for depression and anxiety: systematic review and meta-analysis \n\t\t \n\t\t\t A Etzelmueller \n\t\t \n\t\t \n\t\t\t C Vis \n\t\t \n\t\t \n\t\t\t E Karyotaki \n\t\t \n\t\t \n\t\t\t H Baumeister \n\t\t \n\t\t \n\t\t\t N Titov \n\t\t \n\t\t \n\t\t\t M Berking \n\t\t \n\t\t \n\t\t\t P Cuijpers \n\t\t \n\t\t \n\t\t\t H Riper \n\t\t \n\t\t \n\t\t\t D D Ebert \n\t\t \n\t\t 10.2196/18100 \n\t\t \n\t \n\t \n\t\t J. Med. Internet Res \n\t\t \n\t\t\t 2020 \n\t\t \n\t \n\t Etzelmueller, A., Vis, C., Karyotaki, E., Baumeister, H., Titov, N., Berking, M., Cuijpers, P., Riper, H., Ebert, D.D., 2020. Effects of internet-based cognitive behavioral therapy in routine care for adults in treatment for depression and anxiety: systematic review and meta-analysis. J. Med. Internet Res. https://doi.org/10.2196/ 18100."
    },
    {
      "title": "Beyond the trial: systematic review of real-world uptake and engagement with digital self-help interventions for depression, low mood, or anxiety",
      "authors": [
        "T Fleming",
        "L Bavin",
        "M Lucassen",
        "K Stasiak",
        "S Hopkins",
        "S Merry"
      ],
      "year": 2018,
      "doi": "10.2196/jmir.9275",
      "journal": "J. Med. Internet Res",
      "volume": "20",
      "raw": "Beyond the trial: systematic review of real-world uptake and engagement with digital self-help interventions for depression, low mood, or anxiety \n\t\t \n\t\t\t T Fleming \n\t\t \n\t\t \n\t\t\t L Bavin \n\t\t \n\t\t \n\t\t\t M Lucassen \n\t\t \n\t\t \n\t\t\t K Stasiak \n\t\t \n\t\t \n\t\t\t S Hopkins \n\t\t \n\t\t \n\t\t\t S Merry \n\t\t \n\t\t 10.2196/jmir.9275 \n\t\t \n\t \n\t \n\t\t J. Med. Internet Res \n\t\t \n\t\t\t 20 \n\t\t\t 2018. 9275 \n\t\t \n\t \n\t Fleming, T., Bavin, L., Lucassen, M., Stasiak, K., Hopkins, S., Merry, S., 2018. Beyond the trial: systematic review of real-world uptake and engagement with digital self-help interventions for depression, low mood, or anxiety. J. Med. Internet Res. 20, e9275 https://doi.org/10.2196/jmir.9275."
    },
    {
      "title": "Upscaling e-mental health in Europe: a six-country qualitative analysis and policy recommendations from the eMEN project",
      "authors": [
        "W Gaebel",
        "R Lukies",
        "A Kerst",
        "J Stricker",
        "J Zielasek",
        "S Diekmann",
        "N Trost",
        "E Gouzoulis-Mayfrank",
        "B Bonroy",
        "K Cullen",
        "K Desie",
        "A Ewalds Mulliez",
        "G Gerlinger",
        "K G\u00fcnther",
        "H Hiemstra",
        "S Mcdaid",
        "C Murphy",
        "J Sander",
        "D Sebbane",
        "J Roelandt",
        "L Thorpe",
        "D Topolska",
        "E Van Assche",
        "T Van Daele",
        "L Van Den Broeck",
        "C Versluis",
        "O Vlijter"
      ],
      "year": 2021,
      "doi": "10.1007/s00406-020-01133-y",
      "journal": "Eur. Arch. Psychiatry Clin. Neurosci",
      "volume": "271",
      "raw": "Upscaling e-mental health in Europe: a six-country qualitative analysis and policy recommendations from the eMEN project \n\t\t \n\t\t\t W Gaebel \n\t\t \n\t\t \n\t\t\t R Lukies \n\t\t \n\t\t \n\t\t\t A Kerst \n\t\t \n\t\t \n\t\t\t J Stricker \n\t\t \n\t\t \n\t\t\t J Zielasek \n\t\t \n\t\t \n\t\t\t S Diekmann \n\t\t \n\t\t \n\t\t\t N Trost \n\t\t \n\t\t \n\t\t\t E Gouzoulis-Mayfrank \n\t\t \n\t\t \n\t\t\t B Bonroy \n\t\t \n\t\t \n\t\t\t K Cullen \n\t\t \n\t\t \n\t\t\t K Desie \n\t\t \n\t\t \n\t\t\t A P Ewalds Mulliez \n\t\t \n\t\t \n\t\t\t G Gerlinger \n\t\t \n\t\t \n\t\t\t K G\u00fcnther \n\t\t \n\t\t \n\t\t\t H J Hiemstra \n\t\t \n\t\t \n\t\t\t S Mcdaid \n\t\t \n\t\t \n\t\t\t C Murphy \n\t\t \n\t\t \n\t\t\t J Sander \n\t\t \n\t\t \n\t\t\t D Sebbane \n\t\t \n\t\t \n\t\t\t J L Roelandt \n\t\t \n\t\t \n\t\t\t L Thorpe \n\t\t \n\t\t \n\t\t\t D Topolska \n\t\t \n\t\t \n\t\t\t E Van Assche \n\t\t \n\t\t \n\t\t\t T Van Daele \n\t\t \n\t\t \n\t\t\t L Van Den Broeck \n\t\t \n\t\t \n\t\t\t C Versluis \n\t\t \n\t\t \n\t\t\t O Vlijter \n\t\t \n\t\t 10.1007/s00406-020-01133-y \n\t\t \n\t \n\t \n\t\t Eur. Arch. Psychiatry Clin. Neurosci \n\t\t \n\t\t\t 271 \n\t\t\t \n\t\t\t 2021 \n\t\t \n\t \n\t Gaebel, W., Lukies, R., Kerst, A., Stricker, J., Zielasek, J., Diekmann, S., Trost, N., Gouzoulis-Mayfrank, E., Bonroy, B., Cullen, K., Desie, K., Ewalds Mulliez, A.P., Gerlinger, G., G\u00fcnther, K., Hiemstra, H.J., McDaid, S., Murphy, C., Sander, J., Sebbane, D., Roelandt, J.L., Thorpe, L., Topolska, D., Van Assche, E., Van Daele, T., Van den Broeck, L., Versluis, C., Vlijter, O., 2021. Upscaling e-mental health in Europe: a six-country qualitative analysis and policy recommendations from the eMEN project. Eur. Arch. Psychiatry Clin. Neurosci. 271, 1005-1016. https://doi. org/10.1007/s00406-020-01133-y."
    },
    {
      "title": "Involving patients' perspective in the development of an internet-and mobile-based CBT intervention for adolescents with chronic medical conditions: findings from a qualitative study",
      "authors": [
        "A Geirhos",
        "F Lunkenheimer",
        "R Holl",
        "K Minden",
        "A Schmitt",
        "S Temming",
        "H Baumeister",
        "M Domhardt"
      ],
      "year": 2021,
      "doi": "10.1016/j.invent.2021.100383",
      "journal": "Internet Interv",
      "volume": "24",
      "pages": "100383",
      "raw": "Involving patients' perspective in the development of an internet-and mobile-based CBT intervention for adolescents with chronic medical conditions: findings from a qualitative study \n\t\t \n\t\t\t A Geirhos \n\t\t \n\t\t \n\t\t\t F Lunkenheimer \n\t\t \n\t\t \n\t\t\t R W Holl \n\t\t \n\t\t \n\t\t\t K Minden \n\t\t \n\t\t \n\t\t\t A Schmitt \n\t\t \n\t\t \n\t\t\t S Temming \n\t\t \n\t\t \n\t\t\t H Baumeister \n\t\t \n\t\t \n\t\t\t M Domhardt \n\t\t \n\t\t 10.1016/j.invent.2021.100383 \n\t\t \n\t \n\t \n\t\t Internet Interv \n\t\t \n\t\t\t 24 \n\t\t\t 100383 \n\t\t\t 2021 \n\t\t \n\t \n\t Geirhos, A., Lunkenheimer, F., Holl, R.W., Minden, K., Schmitt, A., Temming, S., Baumeister, H., Domhardt, M., 2021. Involving patients' perspective in the devel- opment of an internet-and mobile-based CBT intervention for adolescents with chronic medical conditions: findings from a qualitative study. Internet Interv. 24, 100383. https://doi.org/10.1016/j.invent.2021.100383."
    },
    {
      "title": "Personalizing cognitive behavioral therapy for cancer-related fatigue using ecological momentary assessments followed by automated individual time series analyses: a case report series",
      "authors": [
        "S Harnas",
        "H Knoop",
        "S Booij",
        "A Braamse"
      ],
      "year": 2021,
      "doi": "10.1016/j.invent.2021.100430",
      "journal": "Internet Interv",
      "volume": "25",
      "pages": "100430",
      "raw": "Personalizing cognitive behavioral therapy for cancer-related fatigue using ecological momentary assessments followed by automated individual time series analyses: a case report series \n\t\t \n\t\t\t S J Harnas \n\t\t \n\t\t \n\t\t\t H Knoop \n\t\t \n\t\t \n\t\t\t S H Booij \n\t\t \n\t\t \n\t\t\t A M J Braamse \n\t\t \n\t\t 10.1016/j.invent.2021.100430 \n\t\t \n\t \n\t \n\t\t Internet Interv \n\t\t \n\t\t\t 25 \n\t\t\t 100430 \n\t\t\t 2021 \n\t\t \n\t \n\t Harnas, S.J., Knoop, H., Booij, S.H., Braamse, A.M.J., 2021. Personalizing cognitive behavioral therapy for cancer-related fatigue using ecological momentary assess- ments followed by automated individual time series analyses: a case report series. Internet Interv. 25, 100430. https://doi.org/10.1016/j.invent.2021.100430."
    },
    {
      "title": "Increased 12-month prevalence rates of mental disorders in patients with chronic somatic diseases",
      "authors": [
        "M H\u00e4rter",
        "H Baumeister",
        "K Reuter",
        "F Jacobi",
        "M H\u00f6fler",
        "J Bengel",
        "H.-U Wittchen"
      ],
      "year": 2007,
      "doi": "10.1159/000107563",
      "journal": "Psychother. Psychosom",
      "volume": "76",
      "raw": "Increased 12-month prevalence rates of mental disorders in patients with chronic somatic diseases \n\t\t \n\t\t\t M H\u00e4rter \n\t\t \n\t\t \n\t\t\t H Baumeister \n\t\t \n\t\t \n\t\t\t K Reuter \n\t\t \n\t\t \n\t\t\t F Jacobi \n\t\t \n\t\t \n\t\t\t M H\u00f6fler \n\t\t \n\t\t \n\t\t\t J Bengel \n\t\t \n\t\t \n\t\t\t H.-U Wittchen \n\t\t \n\t\t 10.1159/000107563 \n\t\t \n\t \n\t \n\t\t Psychother. Psychosom \n\t\t \n\t\t\t 76 \n\t\t\t 2007 \n\t\t \n\t \n\t H\u00e4rter, M., Baumeister, H., Reuter, K., Jacobi, F., H\u00f6fler, M., Bengel, J., Wittchen, H.-U., 2007. Increased 12-month prevalence rates of mental disorders in patients with chronic somatic diseases. Psychother. Psychosom. 76 https://doi.org/10.1159/ 000107563."
    },
    {
      "title": "Medical device regulation efforts for mHealth apps during the COVID-19 pandemic -an experience report of Corona Check and Corona Health",
      "authors": [
        "M Holfelder",
        "L Mulansky",
        "W Schlee",
        "H Baumeister",
        "J Schobel",
        "H Greger",
        "A Hoff",
        "R Pryss"
      ],
      "year": 2021,
      "doi": "10.3390/j4020017",
      "journal": "J",
      "volume": "4",
      "raw": "Medical device regulation efforts for mHealth apps during the COVID-19 pandemic -an experience report of Corona Check and Corona Health \n\t\t \n\t\t\t M Holfelder \n\t\t \n\t\t \n\t\t\t L Mulansky \n\t\t \n\t\t \n\t\t\t W Schlee \n\t\t \n\t\t \n\t\t\t H Baumeister \n\t\t \n\t\t \n\t\t\t J Schobel \n\t\t \n\t\t \n\t\t\t H Greger \n\t\t \n\t\t \n\t\t\t A Hoff \n\t\t \n\t\t \n\t\t\t R Pryss \n\t\t \n\t\t 10.3390/j4020017 \n\t\t \n\t \n\t \n\t\t J \n\t\t \n\t\t\t 4 \n\t\t\t \n\t\t\t 2021 \n\t\t \n\t \n\t Holfelder, M., Mulansky, L., Schlee, W., Baumeister, H., Schobel, J., Greger, H., Hoff, A., Pryss, R., 2021. Medical device regulation efforts for mHealth apps during the COVID-19 pandemic -an experience report of Corona Check and Corona Health. J 4, 206-222. https://doi.org/10.3390/j4020017."
    },
    {
      "title": "Special issue: adjustment to chronic illness original articles and reviews. Best practices and recommendations for digital interventions to improve engagement and adherence in chronic illness sufferers",
      "authors": [
        "M Karekla",
        "O Kasinopoulos",
        "D Dias Neto",
        "D Ebert",
        "T Van Daele",
        "T Nordgreen",
        "S H\u00f6fer",
        "S Oeverland",
        "K Jensen"
      ],
      "year": 2019,
      "doi": "10.1027/1016-9040/a000349",
      "journal": "Eur. Psychol",
      "volume": "24",
      "raw": "Special issue: adjustment to chronic illness original articles and reviews. Best practices and recommendations for digital interventions to improve engagement and adherence in chronic illness sufferers \n\t\t \n\t\t\t M Karekla \n\t\t \n\t\t \n\t\t\t O Kasinopoulos \n\t\t \n\t\t \n\t\t\t D Dias Neto \n\t\t \n\t\t \n\t\t\t D D Ebert \n\t\t \n\t\t \n\t\t\t T Van Daele \n\t\t \n\t\t \n\t\t\t T Nordgreen \n\t\t \n\t\t \n\t\t\t S H\u00f6fer \n\t\t \n\t\t \n\t\t\t S Oeverland \n\t\t \n\t\t \n\t\t\t K L Jensen \n\t\t \n\t\t 10.1027/1016-9040/a000349 \n\t\t \n\t \n\t \n\t\t Eur. Psychol \n\t\t \n\t\t\t 24 \n\t\t\t \n\t\t\t 2019 \n\t\t \n\t \n\t Karekla, M., Kasinopoulos, O., Dias Neto, D., Ebert, D.D., Van Daele, T., Nordgreen, T., H\u00f6fer, S., Oeverland, S., Jensen, K.L., 2019. Special issue: adjustment to chronic illness original articles and reviews. Best practices and recommendations for digital interventions to improve engagement and adherence in chronic illness sufferers. Eur. Psychol. 24, 49-67. https://doi.org/10.1027/1016-9040/a000349."
    },
    {
      "title": "Internet-and mobile-based depression interventions for people with diagnosed depression: a systematic review and meta-analysis",
      "authors": [
        "J K\u00f6nigbauer",
        "J Letsch",
        "P Doebler",
        "D Ebert",
        "H Baumeister"
      ],
      "year": 2017,
      "doi": "10.1016/j.jad.2017.07.021",
      "journal": "J. Affect. Disord",
      "raw": "Internet-and mobile-based depression interventions for people with diagnosed depression: a systematic review and meta-analysis \n\t\t \n\t\t\t J K\u00f6nigbauer \n\t\t \n\t\t \n\t\t\t J Letsch \n\t\t \n\t\t \n\t\t\t P Doebler \n\t\t \n\t\t \n\t\t\t D Ebert \n\t\t \n\t\t \n\t\t\t H Baumeister \n\t\t \n\t\t 10.1016/j.jad.2017.07.021 \n\t\t \n\t \n\t \n\t\t J. Affect. Disord \n\t\t \n\t\t\t 2017 \n\t\t \n\t \n\t K\u00f6nigbauer, J., Letsch, J., Doebler, P., Ebert, D., Baumeister, H., 2017. Internet-and mobile-based depression interventions for people with diagnosed depression: a systematic review and meta-analysis. J. Affect. Disord. https://doi.org/10.1016/j. jad.2017.07.021."
    },
    {
      "title": "Psychological flexibility mediates the effect of an online-based acceptance and commitment therapy for chronic pain: an investigation of change processes",
      "authors": [
        "J Lin",
        "L.-I Klatt",
        "L Mccracken",
        "H Baumeister"
      ],
      "year": 2018,
      "doi": "10.1097/j.pain.0000000000001134",
      "journal": "Pain",
      "volume": "159",
      "raw": "Psychological flexibility mediates the effect of an online-based acceptance and commitment therapy for chronic pain: an investigation of change processes \n\t\t \n\t\t\t J Lin \n\t\t \n\t\t \n\t\t\t L.-I Klatt \n\t\t \n\t\t \n\t\t\t L M Mccracken \n\t\t \n\t\t \n\t\t\t H Baumeister \n\t\t \n\t\t 10.1097/j.pain.0000000000001134 \n\t\t \n\t \n\t \n\t\t Pain \n\t\t \n\t\t\t 159 \n\t\t\t \n\t\t\t 2018 \n\t\t \n\t \n\t Lin, J., Klatt, L.-I., McCracken, L.M., Baumeister, H., 2018. Psychological flexibility mediates the effect of an online-based acceptance and commitment therapy for chronic pain: an investigation of change processes. Pain 159, 663-672. https://doi. org/10.1097/j.pain.0000000000001134."
    },
    {
      "title": "Developing a web-based support using selfaffirmation to motivate lifestyle changes in type 2 diabetes: a qualitative study assessing patient perspectives on self-management and views on a digital lifestyle intervention",
      "authors": [
        "E Mellerg\u00e5rd",
        "P Johnsson",
        "F Eek"
      ],
      "year": 2021,
      "doi": "10.1016/j.invent.2021.100384",
      "journal": "Internet Interv",
      "volume": "24",
      "raw": "Developing a web-based support using selfaffirmation to motivate lifestyle changes in type 2 diabetes: a qualitative study assessing patient perspectives on self-management and views on a digital lifestyle intervention \n\t\t \n\t\t\t E Mellerg\u00e5rd \n\t\t \n\t\t \n\t\t\t P Johnsson \n\t\t \n\t\t \n\t\t\t F Eek \n\t\t \n\t\t 10.1016/j.invent.2021.100384 \n\t\t \n\t \n\t \n\t\t Internet Interv \n\t\t \n\t\t\t 24 \n\t\t\t 2021 \n\t\t \n\t \n\t Mellerg\u00e5rd, E., Johnsson, P., Eek, F., 2021. Developing a web-based support using self- affirmation to motivate lifestyle changes in type 2 diabetes: a qualitative study assessing patient perspectives on self-management and views on a digital lifestyle intervention. Internet Interv. 24 https://doi.org/10.1016/j.invent.2021.100384."
    },
    {
      "title": "Developing and evaluating digital interventions to promote behavior change in health and health care: recommendations resulting from an international workshop",
      "authors": [
        "S Michie",
        "L Yardley",
        "R West",
        "K Patrick",
        "F Greaves"
      ],
      "year": 2017,
      "doi": "10.2196/jmir.7126",
      "journal": "J. Med. Internet Res",
      "raw": "Developing and evaluating digital interventions to promote behavior change in health and health care: recommendations resulting from an international workshop \n\t\t \n\t\t\t S Michie \n\t\t \n\t\t \n\t\t\t L Yardley \n\t\t \n\t\t \n\t\t\t R West \n\t\t \n\t\t \n\t\t\t K Patrick \n\t\t \n\t\t \n\t\t\t F Greaves \n\t\t \n\t\t 10.2196/jmir.7126 \n\t\t \n\t \n\t \n\t\t J. Med. Internet Res \n\t\t \n\t\t\t 2017 \n\t\t \n\t \n\t Michie, S., Yardley, L., West, R., Patrick, K., Greaves, F., 2017. Developing and evalu- ating digital interventions to promote behavior change in health and health care: recommendations resulting from an international workshop. J. Med. Internet Res. https://doi.org/10.2196/jmir.7126."
    },
    {
      "title": "Feasibility and user experience of the unguided web-based self-help app 'MyDiaMate' aimed to prevent and reduce psychological distress and fatigue in adults with diabetes",
      "authors": [
        "L Muijs",
        "M De Wit",
        "H Knoop",
        "F Snoek"
      ],
      "year": 2021,
      "doi": "10.1016/j.invent.2021.100414",
      "journal": "Internet Interv",
      "volume": "25",
      "pages": "100414",
      "raw": "Feasibility and user experience of the unguided web-based self-help app 'MyDiaMate' aimed to prevent and reduce psychological distress and fatigue in adults with diabetes \n\t\t \n\t\t\t L T Muijs \n\t\t \n\t\t \n\t\t\t M De Wit \n\t\t \n\t\t \n\t\t\t H Knoop \n\t\t \n\t\t \n\t\t\t F J Snoek \n\t\t \n\t\t 10.1016/j.invent.2021.100414 \n\t\t \n\t \n\t \n\t\t Internet Interv \n\t\t \n\t\t\t 25 \n\t\t\t 100414 \n\t\t\t 2021 \n\t\t \n\t \n\t Muijs, L.T., de Wit, M., Knoop, H., Snoek, F.J., 2021. Feasibility and user experience of the unguided web-based self-help app 'MyDiaMate' aimed to prevent and reduce psychological distress and fatigue in adults with diabetes. Internet Interv. 25, 100414. https://doi.org/10.1016/j.invent.2021.100414."
    },
    {
      "title": "Just-in-time adaptive interventions (JITAIs) in mobile health: key components and design principles for ongoing health behavior support",
      "authors": [
        "I Nahum-Shani",
        "S Smith",
        "B Spring",
        "L Collins",
        "K Witkiewitz",
        "A Tewari",
        "S Murphy"
      ],
      "year": 2017,
      "doi": "10.1007/s12160-016-9830-8",
      "journal": "Ann. Behav. Med",
      "volume": "52",
      "raw": "Just-in-time adaptive interventions (JITAIs) in mobile health: key components and design principles for ongoing health behavior support \n\t\t \n\t\t\t I Nahum-Shani \n\t\t \n\t\t \n\t\t\t S N Smith \n\t\t \n\t\t \n\t\t\t B J Spring \n\t\t \n\t\t \n\t\t\t L M Collins \n\t\t \n\t\t \n\t\t\t K Witkiewitz \n\t\t \n\t\t \n\t\t\t A Tewari \n\t\t \n\t\t \n\t\t\t S A Murphy \n\t\t \n\t\t 10.1007/s12160-016-9830-8 \n\t\t \n\t \n\t \n\t\t Ann. Behav. Med \n\t\t \n\t\t\t 52 \n\t\t\t \n\t\t\t 2017 \n\t\t \n\t \n\t Nahum-Shani, I., Smith, S.N., Spring, B.J., Collins, L.M., Witkiewitz, K., Tewari, A., Murphy, S.A., 2017. Just-in-time adaptive interventions (JITAIs) in mobile health: key components and design principles for ongoing health behavior support. Ann. Behav. Med. 52, 446-462. https://doi.org/10.1007/s12160-016-9830-8."
    },
    {
      "title": "Internet and smartphone-based ecological momentary assessment and personalized advice (PROfeel) in adolescents with chronic conditions: a feasibility study",
      "authors": [
        "M Nap-Van Der Vlist",
        "J Houtveen",
        "G Dalmeijer",
        "M Grootenhuis",
        "C Van Der Ent",
        "M Van Grotel",
        "J Swart",
        "J Van Montfrans",
        "E Van De Putte",
        "S Nijhof"
      ],
      "year": 2021,
      "doi": "10.1016/j.invent.2021.100395",
      "journal": "Internet Interv",
      "volume": "25",
      "pages": "100395",
      "raw": "Internet and smartphone-based ecological momentary assessment and personalized advice (PROfeel) in adolescents with chronic conditions: a feasibility study \n\t\t \n\t\t\t M M Nap-Van Der Vlist \n\t\t \n\t\t \n\t\t\t J Houtveen \n\t\t \n\t\t \n\t\t\t G W Dalmeijer \n\t\t \n\t\t \n\t\t\t M A Grootenhuis \n\t\t \n\t\t \n\t\t\t C K Van Der Ent \n\t\t \n\t\t \n\t\t\t M Van Grotel \n\t\t \n\t\t \n\t\t\t J F Swart \n\t\t \n\t\t \n\t\t\t J M Van Montfrans \n\t\t \n\t\t \n\t\t\t E M Van De Putte \n\t\t \n\t\t \n\t\t\t S L Nijhof \n\t\t \n\t\t 10.1016/j.invent.2021.100395 \n\t\t \n\t \n\t \n\t\t Internet Interv \n\t\t \n\t\t\t 25 \n\t\t\t 100395 \n\t\t\t 2021 \n\t\t \n\t \n\t Nap-van der Vlist, M.M., Houtveen, J., Dalmeijer, G.W., Grootenhuis, M.A., van der Ent, C.K., van Grotel, M., Swart, J.F., van Montfrans, J.M., van de Putte, E.M., Nijhof, S.L., 2021. Internet and smartphone-based ecological momentary assessment and personalized advice (PROfeel) in adolescents with chronic conditions: a feasi- bility study. Internet Interv. 25, 100395. https://doi.org/10.1016/j. invent.2021.100395."
    },
    {
      "title": "Efficacy of a web-based intervention with mobile phone support in treating depressive symptoms in adults with type 1 and type 2 diabetes: a randomized controlled trial",
      "authors": [
        "S Nobis",
        "D Lehr",
        "D Ebert",
        "H Baumeister",
        "F Snoek",
        "H Riper",
        "M Berking"
      ],
      "year": 2015,
      "doi": "10.2337/dc14-1728PM",
      "journal": "Diabetes Care",
      "volume": "38",
      "raw": "Efficacy of a web-based intervention with mobile phone support in treating depressive symptoms in adults with type 1 and type 2 diabetes: a randomized controlled trial \n\t\t \n\t\t\t S Nobis \n\t\t \n\t\t \n\t\t\t D Lehr \n\t\t \n\t\t \n\t\t\t D D Ebert \n\t\t \n\t\t \n\t\t\t H Baumeister \n\t\t \n\t\t \n\t\t\t F Snoek \n\t\t \n\t\t \n\t\t\t H Riper \n\t\t \n\t\t \n\t\t\t M Berking \n\t\t \n\t\t 10.2337/dc14-1728PM \n\t\t \n\t \n\t \n\t\t Diabetes Care \n\t\t \n\t\t\t 38 \n\t\t\t \n\t\t\t 2015 \n\t\t \n\t \n\t Nobis, S., Lehr, D., Ebert, D.D., Baumeister, H., Snoek, F., Riper, H., Berking, M., 2015. Efficacy of a web-based intervention with mobile phone support in treating depressive symptoms in adults with type 1 and type 2 diabetes: a randomized controlled trial. Diabetes Care 38, 776-783. https://doi.org/10.2337/dc14-1728PM."
    },
    {
      "title": "Web-based intervention for depressive symptoms in adults with types 1 and 2 diabetes mellitus: a health economic evaluation",
      "authors": [
        "S Nobis",
        "D Ebert",
        "D Lehr",
        "F Smit",
        "C Buntrock",
        "M Berking",
        "H Baumeister",
        "F Snoek",
        "B Funk",
        "H Riper"
      ],
      "year": 2018,
      "doi": "10.1192/bjp.2018.10",
      "journal": "Br. J. Psychiatry",
      "volume": "212",
      "raw": "Web-based intervention for depressive symptoms in adults with types 1 and 2 diabetes mellitus: a health economic evaluation \n\t\t \n\t\t\t S Nobis \n\t\t \n\t\t \n\t\t\t D D Ebert \n\t\t \n\t\t \n\t\t\t D Lehr \n\t\t \n\t\t \n\t\t\t F Smit \n\t\t \n\t\t \n\t\t\t C Buntrock \n\t\t \n\t\t \n\t\t\t M Berking \n\t\t \n\t\t \n\t\t\t H Baumeister \n\t\t \n\t\t \n\t\t\t F Snoek \n\t\t \n\t\t \n\t\t\t B Funk \n\t\t \n\t\t \n\t\t\t H Riper \n\t\t \n\t\t 10.1192/bjp.2018.10 \n\t\t \n\t \n\t \n\t\t Br. J. Psychiatry \n\t\t \n\t\t\t 212 \n\t\t\t 2018 \n\t\t \n\t \n\t Nobis, S., Ebert, D.D., Lehr, D., Smit, F., Buntrock, C., Berking, M., Baumeister, H., Snoek, F., Funk, B., Riper, H., 2018. Web-based intervention for depressive symp- toms in adults with types 1 and 2 diabetes mellitus: a health economic evaluation. Br. J. Psychiatry 212. https://doi.org/10.1192/bjp.2018."
    },
    {
      "title": "Coping with chronic illness",
      "authors": [
        "K Petrie",
        "A Jones"
      ],
      "year": 2019,
      "doi": "10.2307/3423436",
      "journal": "Cambridge Handbook of Psychology, Health and Medicine",
      "raw": "Coping with chronic illness \n\t\t \n\t\t\t K J Petrie \n\t\t \n\t\t \n\t\t\t A S K Jones \n\t\t \n\t\t 10.2307/3423436 \n\t\t \n\t \n\t \n\t\t Cambridge Handbook of Psychology, Health and Medicine \n\t\t \n\t\t\t \n\t\t\t 2019 \n\t\t \n\t \n\t Third edition \n\t Petrie, K.J., Jones, A.S.K., 2019. Coping with chronic illness. In: Cambridge Handbook of Psychology, Health and Medicine, Third edition, pp. 110-113. https://doi.org/ 10.2307/3423436."
    },
    {
      "title": "Baseline psychological inflexibility moderates the outcome pain interference in a randomized controlled trial on Internet-based Acceptance and Commitment Therapy for chronic pain",
      "authors": [
        "T Probst",
        "H Baumeister",
        "L Mccracken",
        "J Lin"
      ],
      "year": 2018,
      "doi": "10.3390/jcm8010024",
      "journal": "J. Clin. Med",
      "volume": "8",
      "pages": "24",
      "raw": "Baseline psychological inflexibility moderates the outcome pain interference in a randomized controlled trial on Internet-based Acceptance and Commitment Therapy for chronic pain \n\t\t \n\t\t\t T Probst \n\t\t \n\t\t \n\t\t\t H Baumeister \n\t\t \n\t\t \n\t\t\t L Mccracken \n\t\t \n\t\t \n\t\t\t J Lin \n\t\t \n\t\t 10.3390/jcm8010024 \n\t\t \n\t \n\t \n\t\t J. Clin. Med \n\t\t \n\t\t\t 8 \n\t\t\t 24 \n\t\t\t 2018 \n\t\t \n\t \n\t Probst, T., Baumeister, H., McCracken, L., Lin, J., 2018. Baseline psychological inflexi- bility moderates the outcome pain interference in a randomized controlled trial on Internet-based Acceptance and Commitment Therapy for chronic pain. J. Clin. Med. 8, 24. https://doi.org/10.3390/jcm8010024."
    },
    {
      "title": "Using Chatbots to Support Medical and Psychological Treatment Procedures: Challenges, Opportunities, Technologies",
      "authors": [
        "R Pryss",
        "R Kraft",
        "H Baumeister",
        "J Winkler",
        "T Probst",
        "M Reichert",
        "B Langguth",
        "M Spiliopoulou",
        "W Schlee"
      ],
      "year": 2019,
      "doi": "10.1007/978-3-030-31620-4_16",
      "journal": "Reference Architecture",
      "raw": "Using Chatbots to Support Medical and Psychological Treatment Procedures: Challenges, Opportunities, Technologies \n\t\t \n\t\t\t R Pryss \n\t\t \n\t\t \n\t\t\t R Kraft \n\t\t \n\t\t \n\t\t\t H Baumeister \n\t\t \n\t\t \n\t\t\t J Winkler \n\t\t \n\t\t \n\t\t\t T Probst \n\t\t \n\t\t \n\t\t\t M Reichert \n\t\t \n\t\t \n\t\t\t B Langguth \n\t\t \n\t\t \n\t\t\t M Spiliopoulou \n\t\t \n\t\t \n\t\t\t W Schlee \n\t\t \n\t\t 10.1007/978-3-030-31620-4_16 \n\t\t \n\t \n\t \n\t\t Reference Architecture \n\t\t \n\t\t\t \n\t\t\t 2019 \n\t\t \n\t \n\t Pryss, R., Kraft, R., Baumeister, H., Winkler, J., Probst, T., Reichert, M., Langguth, B., Spiliopoulou, M., Schlee, W., 2019. Using Chatbots to Support Medical and Psy- chological Treatment Procedures: Challenges, Opportunities, Technologies, Refer- ence Architecture, pp. 249-260. https://doi.org/10.1007/978-3-030-31620-4_16."
    },
    {
      "title": "Effectiveness of a guided web-based self-help intervention to prevent depression in patients with persistent back pain: the PROD-BP randomized clinical trial",
      "authors": [
        "L Sander",
        "S Paganini",
        "Y Terhorst",
        "S Schlicker",
        "J Lin",
        "K Spanhel",
        "C Buntrock",
        "D Ebert",
        "H Baumeister"
      ],
      "year": 2020,
      "doi": "10.1001/jamapsychiatry.2020.1021",
      "journal": "JAMA Psychiatry",
      "raw": "Effectiveness of a guided web-based self-help intervention to prevent depression in patients with persistent back pain: the PROD-BP randomized clinical trial \n\t\t \n\t\t\t L B Sander \n\t\t \n\t\t \n\t\t\t S Paganini \n\t\t \n\t\t \n\t\t\t Y Terhorst \n\t\t \n\t\t \n\t\t\t S Schlicker \n\t\t \n\t\t \n\t\t\t J Lin \n\t\t \n\t\t \n\t\t\t K Spanhel \n\t\t \n\t\t \n\t\t\t C Buntrock \n\t\t \n\t\t \n\t\t\t D D Ebert \n\t\t \n\t\t \n\t\t\t H Baumeister \n\t\t \n\t\t 10.1001/jamapsychiatry.2020.1021 \n\t\t \n\t \n\t \n\t\t JAMA Psychiatry \n\t\t \n\t\t\t 2020 \n\t\t \n\t \n\t Sander, L.B., Paganini, S., Terhorst, Y., Schlicker, S., Lin, J., Spanhel, K., Buntrock, C., Ebert, D.D., Baumeister, H., 2020. Effectiveness of a guided web-based self-help intervention to prevent depression in patients with persistent back pain: the PROD- BP randomized clinical trial. JAMA Psychiatry. https://doi.org/10.1001/ jamapsychiatry.2020.1021."
    },
    {
      "title": "Systematic evaluation of content and quality of English and German pain apps in European app stores",
      "authors": [
        "Y Terhorst",
        "E Messner",
        "D Schultchen",
        "S Paganini",
        "A Portenhauser",
        "A Eder",
        "M Bauer",
        "M Papenhoff",
        "H Baumeister",
        "L Sander"
      ],
      "year": 2021,
      "doi": "10.1016/j.invent.2021.100376",
      "journal": "Internet Interv",
      "volume": "24",
      "pages": "100376",
      "raw": "Systematic evaluation of content and quality of English and German pain apps in European app stores \n\t\t \n\t\t\t Y Terhorst \n\t\t \n\t\t \n\t\t\t E M Messner \n\t\t \n\t\t \n\t\t\t D Schultchen \n\t\t \n\t\t \n\t\t\t S Paganini \n\t\t \n\t\t \n\t\t\t A Portenhauser \n\t\t \n\t\t \n\t\t\t A S Eder \n\t\t \n\t\t \n\t\t\t M Bauer \n\t\t \n\t\t \n\t\t\t M Papenhoff \n\t\t \n\t\t \n\t\t\t H Baumeister \n\t\t \n\t\t \n\t\t\t L B Sander \n\t\t \n\t\t 10.1016/j.invent.2021.100376 \n\t\t \n\t \n\t \n\t\t Internet Interv \n\t\t \n\t\t\t 24 \n\t\t\t 100376 \n\t\t\t 2021 \n\t\t \n\t \n\t Terhorst, Y., Messner, E.M., Schultchen, D., Paganini, S., Portenhauser, A., Eder, A.S., Bauer, M., Papenhoff, M., Baumeister, H., Sander, L.B., 2021. Systematic evaluation of content and quality of English and German pain apps in European app stores. Internet Interv. 24, 100376. https://doi.org/10.1016/j.invent.2021.100376."
    },
    {
      "title": "Guided Internet-based cognitive-behavioral therapy for patients with rheumatic conditions: a systematic review",
      "authors": [
        "J Terpstra",
        "R Van Der Vaart",
        "H Ding",
        "M Klppenburg",
        "A Evers"
      ],
      "year": 2021,
      "doi": "10.1016/j.invent.2021.100444",
      "journal": "Internet Interv",
      "volume": "26",
      "pages": "100444",
      "raw": "Guided Internet-based cognitive-behavioral therapy for patients with rheumatic conditions: a systematic review \n\t\t \n\t\t\t J A Terpstra \n\t\t \n\t\t \n\t\t\t R Van Der Vaart \n\t\t \n\t\t \n\t\t\t H J Ding \n\t\t \n\t\t \n\t\t\t M Klppenburg \n\t\t \n\t\t \n\t\t\t A W Evers \n\t\t \n\t\t 10.1016/j.invent.2021.100444 \n\t\t \n\t \n\t \n\t\t Internet Interv \n\t\t \n\t\t\t 26 \n\t\t\t 100444 \n\t\t\t 2021 \n\t\t \n\t \n\t Terpstra, J.A., van der Vaart, R., Ding, H.J., Klppenburg, M., Evers, A.W., 2021. Guided Internet-based cognitive-behavioral therapy for patients with rheumatic conditions: a systematic review. Internet Interv. 26, 100444 https://doi.org/10.1016/j. invent.2021.100444."
    },
    {
      "title": "ICBT in routine care: a descriptive analysis of successful clinics in five countries",
      "authors": [
        "N Titov",
        "B Dear",
        "O Nielssen",
        "L Staples",
        "H Hadjistavropoulos",
        "M Nugent",
        "K Adlam",
        "T Nordgreen",
        "K Bruvik",
        "A Hovland",
        "A Rep\u00e5l",
        "K Mathiasen",
        "M Kraepelien",
        "K Blom",
        "C Svanborg",
        "N Lindefors",
        "V Kaldo"
      ],
      "year": 2018,
      "doi": "10.1016/j.invent.2018.07.006",
      "journal": "Internet Interv",
      "raw": "ICBT in routine care: a descriptive analysis of successful clinics in five countries \n\t\t \n\t\t\t N Titov \n\t\t \n\t\t \n\t\t\t B Dear \n\t\t \n\t\t \n\t\t\t O Nielssen \n\t\t \n\t\t \n\t\t\t L Staples \n\t\t \n\t\t \n\t\t\t H Hadjistavropoulos \n\t\t \n\t\t \n\t\t\t M Nugent \n\t\t \n\t\t \n\t\t\t K Adlam \n\t\t \n\t\t \n\t\t\t T Nordgreen \n\t\t \n\t\t \n\t\t\t K H Bruvik \n\t\t \n\t\t \n\t\t\t A Hovland \n\t\t \n\t\t \n\t\t\t A Rep\u00e5l \n\t\t \n\t\t \n\t\t\t K Mathiasen \n\t\t \n\t\t \n\t\t\t M Kraepelien \n\t\t \n\t\t \n\t\t\t K Blom \n\t\t \n\t\t \n\t\t\t C Svanborg \n\t\t \n\t\t \n\t\t\t N Lindefors \n\t\t \n\t\t \n\t\t\t V Kaldo \n\t\t \n\t\t 10.1016/j.invent.2018.07.006 \n\t\t \n\t \n\t \n\t\t Internet Interv \n\t\t \n\t\t\t 2018 \n\t\t \n\t \n\t Titov, N., Dear, B., Nielssen, O., Staples, L., Hadjistavropoulos, H., Nugent, M., Adlam, K., Nordgreen, T., Bruvik, K.H., Hovland, A., Rep\u00e5l, A., Mathiasen, K., Kraepelien, M., Blom, K., Svanborg, C., Lindefors, N., Kaldo, V., 2018. ICBT in routine care: a descriptive analysis of successful clinics in five countries. Internet Interv. https://doi.org/10.1016/j.invent.2018.07.006."
    },
    {
      "title": "Web-based cognitive behavioural therapy (W-CBT) for diabetes patients with co-morbid depression: design of a randomised controlled trial",
      "authors": [
        "K Van Bastelaar",
        "F Pouwer",
        "P Cuijpers",
        "J Twisk",
        "F Snoek"
      ],
      "year": 2008,
      "doi": "10.1186/1471-244X-8-9U6",
      "journal": "BMC Psychiatry",
      "volume": "8",
      "issue": "9",
      "raw": "Web-based cognitive behavioural therapy (W-CBT) for diabetes patients with co-morbid depression: design of a randomised controlled trial \n\t\t \n\t\t\t K M Van Bastelaar \n\t\t \n\t\t \n\t\t\t F Pouwer \n\t\t \n\t\t \n\t\t\t P Cuijpers \n\t\t \n\t\t \n\t\t\t J W Twisk \n\t\t \n\t\t \n\t\t\t F J Snoek \n\t\t \n\t\t 10.1186/1471-244X-8-9U6 \n\t\t \n\t \n\t \n\t\t BMC Psychiatry \n\t\t \n\t\t\t 8 \n\t\t\t 9 \n\t\t\t 2008 \n\t\t \n\t \n\t van Bastelaar, K.M., Pouwer, F., Cuijpers, P., Twisk, J.W., Snoek, F.J., 2008. Web-based cognitive behavioural therapy (W-CBT) for diabetes patients with co-morbid depression: design of a randomised controlled trial. BMC Psychiatry 8, 9. https://doi. org/10.1186/1471-244X-8-9 U6."
    },
    {
      "title": "Reasons for not reaching or using web-based self-management applications, and the use and evaluation of Oncokompas among cancer survivors, in the context of a randomised controlled trial",
      "authors": [
        "A Van Der Hout",
        "C Van Uden-Kraan",
        "K Holtmaat",
        "F Jansen",
        "B Lissenberg-Witte",
        "G Nieuwenhuijzen",
        "J Hardillo",
        "R Baatenburg De Jong",
        "N Tiren-Verbeet",
        "D Sommeijer",
        "K De Heer",
        "C Schaar",
        "R Sedee",
        "K Bosscha",
        "M Van Den Brekel",
        "J Petersen",
        "M Westerman",
        "J Honings",
        "R Takes",
        "I Houtenbos",
        "W Van Den Broek",
        "R De Bree",
        "P Jansen",
        "S Eerenstein",
        "C Leemans",
        "J Zijlstra",
        "P Cuijpers",
        "L Van De Poll-Franse",
        "I Verdonck-De Leeuw"
      ],
      "year": 2021,
      "doi": "10.1016/j.invent.2021.100429",
      "journal": "Internet Interv",
      "volume": "25",
      "pages": "100429",
      "raw": "Reasons for not reaching or using web-based self-management applications, and the use and evaluation of Oncokompas among cancer survivors, in the context of a randomised controlled trial \n\t\t \n\t\t\t A Van Der Hout \n\t\t \n\t\t \n\t\t\t C F Van Uden-Kraan \n\t\t \n\t\t \n\t\t\t K Holtmaat \n\t\t \n\t\t \n\t\t\t F Jansen \n\t\t \n\t\t \n\t\t\t B I Lissenberg-Witte \n\t\t \n\t\t \n\t\t\t G A P Nieuwenhuijzen \n\t\t \n\t\t \n\t\t\t J A Hardillo \n\t\t \n\t\t \n\t\t\t R J Baatenburg De Jong \n\t\t \n\t\t \n\t\t\t N L Tiren-Verbeet \n\t\t \n\t\t \n\t\t\t D W Sommeijer \n\t\t \n\t\t \n\t\t\t K De Heer \n\t\t \n\t\t \n\t\t\t C G Schaar \n\t\t \n\t\t \n\t\t\t R J E Sedee \n\t\t \n\t\t \n\t\t\t K Bosscha \n\t\t \n\t\t \n\t\t\t M W M Van Den Brekel \n\t\t \n\t\t \n\t\t\t J F Petersen \n\t\t \n\t\t \n\t\t\t M Westerman \n\t\t \n\t\t \n\t\t\t J Honings \n\t\t \n\t\t \n\t\t\t R P Takes \n\t\t \n\t\t \n\t\t\t I Houtenbos \n\t\t \n\t\t \n\t\t\t W T Van Den Broek \n\t\t \n\t\t \n\t\t\t R De Bree \n\t\t \n\t\t \n\t\t\t P Jansen \n\t\t \n\t\t \n\t\t\t S E J Eerenstein \n\t\t \n\t\t \n\t\t\t C R Leemans \n\t\t \n\t\t \n\t\t\t J M Zijlstra \n\t\t \n\t\t \n\t\t\t P Cuijpers \n\t\t \n\t\t \n\t\t\t L V Van De Poll-Franse \n\t\t \n\t\t \n\t\t\t I M Verdonck-De Leeuw \n\t\t \n\t\t 10.1016/j.invent.2021.100429 \n\t\t \n\t \n\t \n\t\t Internet Interv \n\t\t \n\t\t\t 25 \n\t\t\t 100429 \n\t\t\t 2021 \n\t\t \n\t \n\t van der Hout, A., van Uden-Kraan, C.F., Holtmaat, K., Jansen, F., Lissenberg-Witte, B.I., Nieuwenhuijzen, G.A.P., Hardillo, J.A., Baatenburg de Jong, R.J., Tiren-Verbeet, N. L., Sommeijer, D.W., de Heer, K., Schaar, C.G., Sedee, R.J.E., Bosscha, K., van den Brekel, M.W.M., Petersen, J.F., Westerman, M., Honings, J., Takes, R.P., Houtenbos, I., van den Broek, W.T., de Bree, R., Jansen, P., Eerenstein, S.E.J., Leemans, C.R., Zijlstra, J.M., Cuijpers, P., van de Poll-Franse, L.V., Verdonck-de Leeuw, I.M., 2021. Reasons for not reaching or using web-based self-management applications, and the use and evaluation of Oncokompas among cancer survivors, in the context of a randomised controlled trial. Internet Interv. 25, 100429. https://doi. org/10.1016/j.invent.2021.100429."
    },
    {
      "title": "Development and evaluation of an internet-based cognitive behavioral therapy intervention for anxiety and depression in adults with cystic fibrosis (eHealth CF-CBT): an international collaboration",
      "authors": [
        "M Verkleij",
        "A Georgiopoulos",
        "D Friedman"
      ],
      "year": 2021,
      "doi": "10.1016/j.invent.2021.100372",
      "journal": "Internet Interv",
      "volume": "24",
      "pages": "100372",
      "raw": "Development and evaluation of an internet-based cognitive behavioral therapy intervention for anxiety and depression in adults with cystic fibrosis (eHealth CF-CBT): an international collaboration \n\t\t \n\t\t\t M Verkleij \n\t\t \n\t\t \n\t\t\t A M Georgiopoulos \n\t\t \n\t\t \n\t\t\t D Friedman \n\t\t \n\t\t 10.1016/j.invent.2021.100372 \n\t\t \n\t \n\t \n\t\t Internet Interv \n\t\t \n\t\t\t 24 \n\t\t\t 100372 \n\t\t\t 2021 \n\t\t \n\t \n\t Verkleij, M., Georgiopoulos, A.M., Friedman, D., 2021. Development and evaluation of an internet-based cognitive behavioral therapy intervention for anxiety and depression in adults with cystic fibrosis (eHealth CF-CBT): an international collab- oration. Internet Interv. 24, 100372. https://doi.org/10.1016/j. invent.2021.100372."
    },
    {
      "title": "Advancing health services research to eliminate health care disparities",
      "authors": [
        "J Wasserman",
        "R Palmer",
        "M Gomez",
        "R Berzon",
        "S Ibrahim",
        "J Ayanian"
      ],
      "year": 2019,
      "doi": "10.2105/AJPH.2018.304922",
      "journal": "Am. J. Public Health",
      "volume": "109",
      "raw": "Advancing health services research to eliminate health care disparities \n\t\t \n\t\t\t J Wasserman \n\t\t \n\t\t \n\t\t\t R C Palmer \n\t\t \n\t\t \n\t\t\t M M Gomez \n\t\t \n\t\t \n\t\t\t R Berzon \n\t\t \n\t\t \n\t\t\t S A Ibrahim \n\t\t \n\t\t \n\t\t\t J Z Ayanian \n\t\t \n\t\t 10.2105/AJPH.2018.304922 \n\t\t \n\t \n\t \n\t\t Am. J. Public Health \n\t\t \n\t\t\t 109 \n\t\t\t \n\t\t\t 2019 \n\t\t \n\t \n\t Wasserman, J., Palmer, R.C., Gomez, M.M., Berzon, R., Ibrahim, S.A., Ayanian, J.Z., 2019. Advancing health services research to eliminate health care disparities. Am. J. Public Health 109, S64-S69. https://doi.org/10.2105/AJPH.2018.304922."
    }
  ],
  "num_references": 47,
  "figures": [
    {
      "description": "): 1. Needs Assessment and Digital Intervention Development 2. Efficacy and (Cost-)Effectiveness 3. Dissemination and Implementation Research: Reach and Engagement 4. Next Generation of Digital Interventions"
    }
  ],
  "num_figures": 1,
  "license": "\u00a9 2021 The Authors. Published by Elsevier B.V. This is an open access article under the CC BY-NC-ND license (http://creativecommons.org/licenses/bync-nd/4.0/).",
  "license_type": "unknown",
  "num_citations": 72,
  "cited_references": [
    "b3",
    "b13",
    "b39",
    "b41",
    "b18",
    "b44",
    "b2",
    "b14",
    "b17",
    "b36",
    "b25",
    "b9",
    "b1",
    "b35",
    "b43",
    "b21",
    "b40",
    "b12",
    "b42",
    "b31",
    "b30",
    "b29",
    "b37",
    "b46",
    "b19",
    "b28",
    "b45",
    "b10",
    "b38",
    "b27",
    "b24",
    "b4",
    "b6",
    "b33",
    "b7",
    "b11",
    "b8",
    "b22",
    "b34",
    "b23",
    "b0",
    "b26"
  ],
  "notes": [
    "[raw_affiliation] a  Department of Clinical Psychology and Psychotherapy , Institute of Psychology and Education , Ulm University , Germany",
    "[raw_affiliation] b  Psychology and Digital Mental Health Care , Department of Sport and Health Sciences , Technical University of Munich , Germany",
    "[raw_affiliation] c  Amsterdam University Medical Centers , Vrije Universiteit , Amsterdam , the Netherlands Department of Clinical Psychology and Psychotherapy ,",
    "[raw_affiliation] Institute of Psychology and Education , Ulm University , Lise-Meitner-Stra\u00dfe 16 , D-89081 Ulm , Germany.",
    "[raw_reference] Baumeister, H., Nowoczin, L., Lin, J., Seifferth, H., Seufert, J., Laubner, K., Ebert, D.D., 2014. Impact of an acceptance facilitating intervention on diabetes patients' acceptance of Internet-based interventions for depression: a randomized controlled trial. Diabetes Res. Clin. Pract. 105. https://doi.org/10.1016/j.diabres.2014.04.031.",
    "[raw_reference] Baumeister, H., Seifferth, H., Lin, J., Nowoczin, L., Luking, M., Ebert, D., 2015. Impact of an acceptance facilitating intervention on patients' acceptance of Internet-based pain interventions: a randomized controlled trial. Clin. J. Pain 31, 528-535. https:// doi.org/10.1097/AJP.0000000000000118PM.",
    "[raw_reference] Baumeister, H., Kraft, R., Baumel, A., Pryss, R., Messner, E.-M., 2019. Persuasive e- Health Design for Behavior Change, pp. 261-276. https://doi.org/10.1007/978-3- 030-31620-4_17.",
    "[raw_reference] Baumeister, H., Terhorst, Y., Gr\u00e4ssle, C., Freudenstein, M., N\u00fcbling, R., Ebert, D.D., 2020. Impact of an acceptance facilitating intervention on psychotherapists' acceptance of blended therapy. PLoS One 15, e0236995. https://doi.org/10.1371/journal. pone.0236995.",
    "[raw_reference] Baumeister, H., Paganini, S., Sander, L.B., Lin, J., Schlicker, S., Terhorst, Y., Moshagen, M., Bengel, J., Lehr, D., Ebert, D.D., 2021. Effectiveness of a guided Internet-and Mobile-based intervention for patients with chronic back pain and depression (WARD-BP): a multicenter, pragmatic randomized controlled trial. Psy- chother. Psychosom. 90, 255-268. https://doi.org/10.1159/000511881.",
    "[raw_reference] Baumel, A., Edan, S., Kane, J.M., 2019. Is there a trial bias impacting user engagement with unguided e-mental health interventions? A systematic comparison of published reports and real-world usage of the same programs. Transl. Behav. Med. 9, 1020-1033. https://doi.org/10.1093/tbm/ibz147.",
    "[raw_reference] Bendig, E., Bauerei\u00df, N., Ebert, D.D., Snoek, F., Andersson, G., Baumeister, H., 2018. Internet-and mobile based psychological interventions in people with chronic medical conditions. Dtsch. Aerzteblatt Int. 115, 659-665. https://doi.org/10.3238/ arztebl.2018.0659.",
    "[raw_reference] Bendig, E., Erb, B., Schulze-Thuesing, L., Baumeister, H., 2019. Next generation: chatbots in clinical psychology and psychotherapy to foster mental health -a scoping review. Verhaltenstherapie 1-15. https://doi.org/10.1159/000499492.",
    "[raw_reference] Bendig, E., Bauerei\u00df, N., Buntrock, C., Habibovi\u0107, M., Ebert, D.D., Baumeister, H., 2021. Lessons learned from an attempted randomized-controlled feasibility trial on \"WIDeCAD\" -an internet-based depression treatment for people living with coronary artery disease (CAD). Internet Interv. 24, 100375. https://doi.org/10.1016/j. invent.2021.100375.",
    "[raw_reference] Blaney, C., Hitchon, C.A., Marrie, R.A., Mackenzie, C., Holens, P., El-Gabalawy, R., 2021. Support for a non-therapist assisted, Internet-based cognitive-behavioral therapy (iCBT) intervention for mental health in rheumatoid arthritis patients. Internet Interv. 24, 100385. https://doi.org/10.1016/j.invent.2021.100385.",
    "[raw_reference] Bonnert, M., S\u00e4rnholm, J., Andersson, E., Bergstr\u00f6m, S.E., Lalouni, M., Lundholm, C., Serlachius, E., Almqvist, C., 2021. Targeting excessive avoidance behavior to reduce anxiety related to asthma: a feasibility study of an exposure-based treatment deliv- ered online. Internet Interv. 25, 100415. https://doi.org/10.1016/j. invent.2021.100415.",
    "[raw_reference] Breitborde, N.J.K., Srihari, V.H., Pollard, J.M., Addington, D.N., Woods, S.W., 2010. Mediators and moderators in early intervention research. Early Interv. Psychiatry 4, 143-152. https://doi.org/10.1111/j.1751-7893.2010.00177.x.",
    "[raw_reference] Capurro, D., Ganzinger, M., Perez-Lu, J., Knaup, P., 2014. Effectiveness of ehealth in- terventions and information needs in palliative care: a systematic literature review. J. Med. Internet Res. 16, e2812 https://doi.org/10.2196/jmir.2812.",
    "[raw_reference] Carolan-Olah, M., Vasilevski, V., Nagle, C., Stepto, N., 2021. Overview of a new eHealth intervention to promote healthy eating and exercise in pregnancy: initial user re- sponses and acceptability. Internet Interv. 25, 100393. https://doi.org/10.1016/j. invent.2021.100393.",
    "[raw_reference] Corbin, J., Strauss, A., 1985. Managing chronic illness at home: three lines of work. Qual. Sociol. 8, 224-247. https://doi.org/10.1007/BF00989485.",
    "[raw_reference] Domhardt, M., Cuijpers, P., Ebert, D.D., Baumeister, H., 2021a. More light? Opportu- nities and pitfalls in digitalized psychotherapy process research. Front. Psychol. 12, 863. https://doi.org/10.3389/fpsyg.2021.544129.",
    "[raw_reference] Domhardt, M., Schr\u00f6der, A., Geirhos, A., Steubl, L., Baumeister, H., 2021b. Efficacy of digital health interventions in youth with chronic medical conditions: a meta-anal- ysis. Internet Interv. https://doi.org/10.1016/j.invent.2021.100373.",
    "[raw_reference] Ebert, D.D., Van Daele, T., Nordgreen, T., Karekla, M., Compare, A., Zarbo, C., Brugnera, A., \u00d8verland, S., Trebbi, G., Jensen, K.L., Kaehlke, F., Baumeister, H., 2018. Internet-and mobile-based psychological interventions: applications, efficacy, and potential for improving mental health. A report of the EFPA E-Health Taskforce. Eur. Psychol. 23, 167-187. https://doi.org/10.1027/1016-9040/a000318.",
    "[raw_reference] Edwards-Stewart, A., Alexander, C., Armstrong, C.M., Hoyt, T., O'Donohue, W., 2019. Mobile applications for client use: ethical and legal considerations. Psychol. Serv. 16, 281-285. https://doi.org/10.1037/ser0000321.",
    "[raw_reference] Etzelmueller, A., Vis, C., Karyotaki, E., Baumeister, H., Titov, N., Berking, M., Cuijpers, P., Riper, H., Ebert, D.D., 2020. Effects of internet-based cognitive behavioral therapy in routine care for adults in treatment for depression and anxiety: systematic review and meta-analysis. J. Med. Internet Res. https://doi.org/10.2196/ 18100.",
    "[raw_reference] Fleming, T., Bavin, L., Lucassen, M., Stasiak, K., Hopkins, S., Merry, S., 2018. Beyond the trial: systematic review of real-world uptake and engagement with digital self-help interventions for depression, low mood, or anxiety. J. Med. Internet Res. 20, e9275 https://doi.org/10.2196/jmir.9275.",
    "[raw_reference] Geirhos, A., Lunkenheimer, F., Holl, R.W., Minden, K., Schmitt, A., Temming, S., Baumeister, H., Domhardt, M., 2021. Involving patients' perspective in the devel- opment of an internet-and mobile-based CBT intervention for adolescents with chronic medical conditions: findings from a qualitative study. Internet Interv. 24, 100383. https://doi.org/10.1016/j.invent.2021.100383.",
    "[raw_reference] Harnas, S.J., Knoop, H., Booij, S.H., Braamse, A.M.J., 2021. Personalizing cognitive behavioral therapy for cancer-related fatigue using ecological momentary assess- ments followed by automated individual time series analyses: a case report series. Internet Interv. 25, 100430. https://doi.org/10.1016/j.invent.2021.100430.",
    "[raw_reference] H\u00e4rter, M., Baumeister, H., Reuter, K., Jacobi, F., H\u00f6fler, M., Bengel, J., Wittchen, H.-U., 2007. Increased 12-month prevalence rates of mental disorders in patients with chronic somatic diseases. Psychother. Psychosom. 76 https://doi.org/10.1159/ 000107563.",
    "[raw_reference] Holfelder, M., Mulansky, L., Schlee, W., Baumeister, H., Schobel, J., Greger, H., Hoff, A., Pryss, R., 2021. Medical device regulation efforts for mHealth apps during the COVID-19 pandemic -an experience report of Corona Check and Corona Health. J 4, 206-222. https://doi.org/10.3390/j4020017.",
    "[raw_reference] Karekla, M., Kasinopoulos, O., Dias Neto, D., Ebert, D.D., Van Daele, T., Nordgreen, T., H\u00f6fer, S., Oeverland, S., Jensen, K.L., 2019. Special issue: adjustment to chronic illness original articles and reviews. Best practices and recommendations for digital interventions to improve engagement and adherence in chronic illness sufferers. Eur. Psychol. 24, 49-67. https://doi.org/10.1027/1016-9040/a000349.",
    "[raw_reference] K\u00f6nigbauer, J., Letsch, J., Doebler, P., Ebert, D., Baumeister, H., 2017. Internet-and mobile-based depression interventions for people with diagnosed depression: a systematic review and meta-analysis. J. Affect. Disord. https://doi.org/10.1016/j. jad.2017.07.021.",
    "[raw_reference] Lin, J., Klatt, L.-I., McCracken, L.M., Baumeister, H., 2018. Psychological flexibility mediates the effect of an online-based acceptance and commitment therapy for chronic pain: an investigation of change processes. Pain 159, 663-672. https://doi. org/10.1097/j.pain.0000000000001134.",
    "[raw_reference] Mellerg\u00e5rd, E., Johnsson, P., Eek, F., 2021. Developing a web-based support using self- affirmation to motivate lifestyle changes in type 2 diabetes: a qualitative study assessing patient perspectives on self-management and views on a digital lifestyle intervention. Internet Interv. 24 https://doi.org/10.1016/j.invent.2021.100384.",
    "[raw_reference] Michie, S., Yardley, L., West, R., Patrick, K., Greaves, F., 2017. Developing and evalu- ating digital interventions to promote behavior change in health and health care: recommendations resulting from an international workshop. J. Med. Internet Res. https://doi.org/10.2196/jmir.7126.",
    "[raw_reference] Muijs, L.T., de Wit, M., Knoop, H., Snoek, F.J., 2021. Feasibility and user experience of the unguided web-based self-help app 'MyDiaMate' aimed to prevent and reduce psychological distress and fatigue in adults with diabetes. Internet Interv. 25, 100414. https://doi.org/10.1016/j.invent.2021.100414.",
    "[raw_reference] Nahum-Shani, I., Smith, S.N., Spring, B.J., Collins, L.M., Witkiewitz, K., Tewari, A., Murphy, S.A., 2017. Just-in-time adaptive interventions (JITAIs) in mobile health: key components and design principles for ongoing health behavior support. Ann. Behav. Med. 52, 446-462. https://doi.org/10.1007/s12160-016-9830-8.",
    "[raw_reference] Nap-van der Vlist, M.M., Houtveen, J., Dalmeijer, G.W., Grootenhuis, M.A., van der Ent, C.K., van Grotel, M., Swart, J.F., van Montfrans, J.M., van de Putte, E.M., Nijhof, S.L., 2021. Internet and smartphone-based ecological momentary assessment and personalized advice (PROfeel) in adolescents with chronic conditions: a feasi- bility study. Internet Interv. 25, 100395. https://doi.org/10.1016/j. invent.2021.100395.",
    "[raw_reference] Nobis, S., Lehr, D., Ebert, D.D., Baumeister, H., Snoek, F., Riper, H., Berking, M., 2015. Efficacy of a web-based intervention with mobile phone support in treating depressive symptoms in adults with type 1 and type 2 diabetes: a randomized controlled trial. Diabetes Care 38, 776-783. https://doi.org/10.2337/dc14-1728PM.",
    "[raw_reference] Nobis, S., Ebert, D.D., Lehr, D., Smit, F., Buntrock, C., Berking, M., Baumeister, H., Snoek, F., Funk, B., Riper, H., 2018. Web-based intervention for depressive symp- toms in adults with types 1 and 2 diabetes mellitus: a health economic evaluation. Br. J. Psychiatry 212. https://doi.org/10.1192/bjp.2018.",
    "Third edition",
    "[raw_reference] Petrie, K.J., Jones, A.S.K., 2019. Coping with chronic illness. In: Cambridge Handbook of Psychology, Health and Medicine, Third edition, pp. 110-113. https://doi.org/ 10.2307/3423436.",
    "[raw_reference] Probst, T., Baumeister, H., McCracken, L., Lin, J., 2018. Baseline psychological inflexi- bility moderates the outcome pain interference in a randomized controlled trial on Internet-based Acceptance and Commitment Therapy for chronic pain. J. Clin. Med. 8, 24. https://doi.org/10.3390/jcm8010024.",
    "[raw_reference] Pryss, R., Kraft, R., Baumeister, H., Winkler, J., Probst, T., Reichert, M., Langguth, B., Spiliopoulou, M., Schlee, W., 2019. Using Chatbots to Support Medical and Psy- chological Treatment Procedures: Challenges, Opportunities, Technologies, Refer- ence Architecture, pp. 249-260. https://doi.org/10.1007/978-3-030-31620-4_16.",
    "[raw_reference] Sander, L.B., Paganini, S., Terhorst, Y., Schlicker, S., Lin, J., Spanhel, K., Buntrock, C., Ebert, D.D., Baumeister, H., 2020. Effectiveness of a guided web-based self-help intervention to prevent depression in patients with persistent back pain: the PROD- BP randomized clinical trial. JAMA Psychiatry. https://doi.org/10.1001/ jamapsychiatry.2020.1021.",
    "[raw_reference] Terhorst, Y., Messner, E.M., Schultchen, D., Paganini, S., Portenhauser, A., Eder, A.S., Bauer, M., Papenhoff, M., Baumeister, H., Sander, L.B., 2021. Systematic evaluation of content and quality of English and German pain apps in European app stores. Internet Interv. 24, 100376. https://doi.org/10.1016/j.invent.2021.100376.",
    "[raw_reference] Terpstra, J.A., van der Vaart, R., Ding, H.J., Klppenburg, M., Evers, A.W., 2021. Guided Internet-based cognitive-behavioral therapy for patients with rheumatic conditions: a systematic review. Internet Interv. 26, 100444 https://doi.org/10.1016/j. invent.2021.100444.",
    "[raw_reference] Titov, N., Dear, B., Nielssen, O., Staples, L., Hadjistavropoulos, H., Nugent, M., Adlam, K., Nordgreen, T., Bruvik, K.H., Hovland, A., Rep\u00e5l, A., Mathiasen, K., Kraepelien, M., Blom, K., Svanborg, C., Lindefors, N., Kaldo, V., 2018. ICBT in routine care: a descriptive analysis of successful clinics in five countries. Internet Interv. https://doi.org/10.1016/j.invent.2018.07.006.",
    "[raw_reference] van Bastelaar, K.M., Pouwer, F., Cuijpers, P., Twisk, J.W., Snoek, F.J., 2008. Web-based cognitive behavioural therapy (W-CBT) for diabetes patients with co-morbid depression: design of a randomised controlled trial. BMC Psychiatry 8, 9. https://doi. org/10.1186/1471-244X-8-9 U6.",
    "[raw_reference] Verkleij, M., Georgiopoulos, A.M., Friedman, D., 2021. Development and evaluation of an internet-based cognitive behavioral therapy intervention for anxiety and depression in adults with cystic fibrosis (eHealth CF-CBT): an international collab- oration. Internet Interv. 24, 100372. https://doi.org/10.1016/j. invent.2021.100372.",
    "[raw_reference] Wasserman, J., Palmer, R.C., Gomez, M.M., Berzon, R., Ibrahim, S.A., Ayanian, J.Z., 2019. Advancing health services research to eliminate health care disparities. Am. J. Public Health 109, S64-S69. https://doi.org/10.2105/AJPH.2018.304922."
  ],
  "processing_software": {
    "GROBID": "0.8.2"
  }
}
